{
  "url": "https://www.gov.uk/guidance/immigration-rules/immigration-rules-appendix-international-sportsperson",
  "part_name": "Immigration Rules Appendix International Sportsperson",
  "scraped_at": "2025-12-06T17:28:01.170768",
  "chunk_count": 51,
  "chunks": [
    {
      "metadata": {
        "source": "Immigration Rules Appendix International Sportsperson",
        "part": "Immigration Rules Appendix International Sportsperson",
        "section_id": "ISP 1.1",
        "section_title": "Validity requirements for an International Sportsperson",
        "parent_section": "ISP 1",
        "hierarchy_level": 2,
        "topic": "leave-to-enter",
        "url": "https://www.gov.uk/guidance/immigration-rules/immigration-rules-appendix-international-sportsperson",
        "scraped_at": "2025-12-06T17:28:01.169477"
      },
      "text": "### Validity requirements for an International Sportsperson\n\nISP 1.1. A person applying for entry clearance or permission to stay as an International Sportsperson must apply online on the gov.uk website on the specified form as follows:\n\n| Applicant | Specified form |\n| --- | --- |\n| EEA national with a chipped passport | Either: • International Sportsperson using the UK Immigration: ID Check app; or • the forms listed below for applicants outside or inside the UK (as relevant) |\n| Applicants outside the UK | International Sportsperson visa |\n| Applicants inside the UK | International Sportsperson |\n\n1.   ISP 1.2. An application for entry clearance or permission to stay on the International Sportsperson route must meet all the following requirements: \n    1.   (a) any fee and Immigration Health Charge must have been paid; and\n    2.   (b) the applicant must have provided biometrics when required; and\n    3.   (c) the applicant must have provided a passport or other travel document which satisfactorily establishes their identity and nationality; and\n    4.   (d) the applicant must have a Certificate of Sponsorship that was issued to them by their sponsor no more than three months before the date of application.\n\nISP 1.3. The applicant must be aged 16 or over on the date of application.\n\nISP 1.4. If an applicant has, in the last 12 months before the date of application, received an award from a Government or international scholarship agency covering both fees and living costs for study in the UK, they must provide written consent from that Government or agency.\n\nISP 1.5. If applying for permission to stay, the applicant must be in the UK on the date of application.\n\n1.   ISP 1.5ZA. If applying for permission to stay, the applicant must not have, or have last been granted, permission: \n    1.   (a) as a Visitor, except where the applicant has been in the UK undertaking the activities in paragraphs PA 15.1. to PA 15.3. of Appendix Visitor: Permitted Activities, or paragraph V 13.3 (f) of Appendix V: Visitor; or\n    2.   (b) as a Short-term student; or\n    3.   (c) as a Parent of a Child Student; or\n    4.   (d) as a Seasonal Worker; or\n    5.   (e) as a Domestic Worker in a Private Household; or\n    6.   (f) outside the Immigration Rules.\n\n1.   ISP 1.5A. An applicant who is applying for permission to stay and has, or last had, permission as a Student, must fulfil one of the Conditions A, B or C below on the date of application: \n    1.   (a) Condition A: the applicant must have completed the course of study for which the Confirmation of Acceptance for Studies was assigned (or a course to which ST 27.3 of Appendix Student applies); or\n    2.   (b) Condition B: \n        1.   (i) the applicant must be studying a full-time course of study at degree level or above with a higher education provider which has a track record of compliance; and\n        2.   (ii) the Certificate of Sponsorship in ISP 1.2(d) must have a start date no earlier than the course completion date; or\n\n    3.   (c) Condition C: \n        1.   (i) the applicant must be studying a full-time course of study leading to the award of a PhD with a higher education provider which has a track record of compliance; and\n        2.   (ii) the Certificate of Sponsorship in ISP 1.2(d) must have a start date no earlier than 24 months after the start date of that course.\n\nISP 1.6. An application which does not meet all the validity requirements for an International Sportsperson may be rejected as invalid and not considered.",
      "summary": "Applicants seeking entry or permission to stay as an International Sportsperson must apply online, meet fee, biometrics, identity, and sponsorship validity requirements, and be aged 16 or over; exceptions are not specified in this segment.",
      "augmented_text": "Document: Immigration Rules Appendix International Sportsperson\nPart: Immigration Rules Appendix International Sportsperson\nSection ID: ISP 1.1\nSection: Validity requirements for an International Sportsperson\nTopic: leave-to-enter\n\nSummary: Applicants seeking entry or permission to stay as an International Sportsperson must apply online, meet fee, biometrics, identity, and sponsorship validity requirements, and be aged 16 or over; exceptions are not specified in this segment.\n\n### Validity requirements for an International Sportsperson\n\nISP 1.1. A person applying for entry clearance or permission to stay as an International Sportsperson must apply online on the gov.uk website on the specified form as follows:\n\n| Applicant | Specified form |\n| --- | --- |\n| EEA national with a chipped passport | Either: • International Sportsperson using the UK Immigration: ID Check app; or • the forms listed below for applicants outside or inside the UK (as relevant) |\n| Applicants outside the UK | International Sportsperson visa |\n| Applicants inside the UK | International Sportsperson |\n\n1.   ISP 1.2. An application for entry clearance or permission to stay on the International Sportsperson route must meet all the following requirements: \n    1.   (a) any fee and Immigration Health Charge must have been paid; and\n    2.   (b) the applicant must have provided biometrics when required; and\n    3.   (c) the applicant must have provided a passport or other travel document which satisfactorily establishes their identity and nationality; and\n    4.   (d) the applicant must have a Certificate of Sponsorship that was issued to them by their sponsor no more than three months before the date of application.\n\nISP 1.3. The applicant must be aged 16 or over on the date of application.\n\nISP 1.4. If an applicant has, in the last 12 months before the date of application, received an award from a Government or international scholarship agency covering both fees and living costs for study in the UK, they must provide written consent from that Government or agency.\n\nISP 1.5. If applying for permission to stay, the applicant must be in the UK on the date of application.\n\n1.   ISP 1.5ZA. If applying for permission to stay, the applicant must not have, or have last been granted, permission: \n    1.   (a) as a Visitor, except where the applicant has been in the UK undertaking the activities in paragraphs PA 15.1. to PA 15.3. of Appendix Visitor: Permitted Activities, or paragraph V 13.3 (f) of Appendix V: Visitor; or\n    2.   (b) as a Short-term student; or\n    3.   (c) as a Parent of a Child Student; or\n    4.   (d) as a Seasonal Worker; or\n    5.   (e) as a Domestic Worker in a Private Household; or\n    6.   (f) outside the Immigration Rules.\n\n1.   ISP 1.5A. An applicant who is applying for permission to stay and has, or last had, permission as a Student, must fulfil one of the Conditions A, B or C below on the date of application: \n    1.   (a) Condition A: the applicant must have completed the course of study for which the Confirmation of Acceptance for Studies was assigned (or a course to which ST 27.3 of Appendix Student applies); or\n    2.   (b) Condition B: \n        1.   (i) the applicant must be studying a full-time course of study at degree level or above with a higher education provider which has a track record of compliance; and\n        2.   (ii) the Certificate of Sponsorship in ISP 1.2(d) must have a start date no earlier than the course completion date; or\n\n    3.   (c) Condition C: \n        1.   (i) the applicant must be studying a full-time course of study leading to the award of a PhD with a higher education provider which has a track record of compliance; and\n        2.   (ii) the Certificate of Sponsorship in ISP 1.2(d) must have a start date no earlier than 24 months after the start date of that course.\n\nISP 1.6. An application which does not meet all the validity requirements for an International Sportsperson may be rejected as invalid and not considered.",
      "needs_review": false
    },
    {
      "metadata": {
        "source": "Immigration Rules Appendix International Sportsperson",
        "part": "Immigration Rules Appendix International Sportsperson",
        "section_id": "ISP 2.1",
        "section_title": "Suitability requirements for an International Sportsperson",
        "parent_section": "ISP 2",
        "hierarchy_level": 2,
        "topic": "suitability",
        "url": "https://www.gov.uk/guidance/immigration-rules/immigration-rules-appendix-international-sportsperson",
        "scraped_at": "2025-12-06T17:28:01.169513"
      },
      "text": "### Suitability requirements for an International Sportsperson\n\nISP 2.1. The applicant must not fall for refusal under Part Suitability.\n\n1.   ISP 2.2. If applying for permission to stay, the applicant must not be: \n    1.   (a) in breach of immigration laws, except that where the Exceptions for overstayers section of Part Suitability applies, that period of overstaying will be disregarded; or\n    2.   (b) on immigration bail.",
      "summary": "This provision applies to international sportsperson applicants seeking permission to stay. They must not breach immigration laws or be on immigration bail, except where overstaying is disregarded under exceptions; failure to meet these conditions renders them unsuitable.",
      "augmented_text": "Document: Immigration Rules Appendix International Sportsperson\nPart: Immigration Rules Appendix International Sportsperson\nSection ID: ISP 2.1\nSection: Suitability requirements for an International Sportsperson\nTopic: suitability\n\nSummary: This provision applies to international sportsperson applicants seeking permission to stay. They must not breach immigration laws or be on immigration bail, except where overstaying is disregarded under exceptions; failure to meet these conditions renders them unsuitable.\n\n### Suitability requirements for an International Sportsperson\n\nISP 2.1. The applicant must not fall for refusal under Part Suitability.\n\n1.   ISP 2.2. If applying for permission to stay, the applicant must not be: \n    1.   (a) in breach of immigration laws, except that where the Exceptions for overstayers section of Part Suitability applies, that period of overstaying will be disregarded; or\n    2.   (b) on immigration bail.",
      "needs_review": false
    },
    {
      "metadata": {
        "source": "Immigration Rules Appendix International Sportsperson",
        "part": "Immigration Rules Appendix International Sportsperson",
        "section_id": "Eligibility requirements for an International Sportsperson",
        "section_title": "Eligibility requirements for an International Sportsperson",
        "parent_section": null,
        "hierarchy_level": 2,
        "topic": "eligibility",
        "url": "https://www.gov.uk/guidance/immigration-rules/immigration-rules-appendix-international-sportsperson",
        "scraped_at": "2025-12-06T17:28:01.169526"
      },
      "text": "### Eligibility requirements for an International Sportsperson",
      "summary": "This provision applies to international sportspersons seeking entry clearance or permission to stay. They must meet specific eligibility criteria, including being a distinguished sportsperson with recent international experience and meeting fitness standards. Critical conditions include demonstrating appropriate achievements and complying with any exceptions set out in the rules.",
      "augmented_text": "Document: Immigration Rules Appendix International Sportsperson\nPart: Immigration Rules Appendix International Sportsperson\nSection ID: Eligibility requirements for an International Sportsperson\nSection: Eligibility requirements for an International Sportsperson\nTopic: eligibility\n\nSummary: This provision applies to international sportspersons seeking entry clearance or permission to stay. They must meet specific eligibility criteria, including being a distinguished sportsperson with recent international experience and meeting fitness standards. Critical conditions include demonstrating appropriate achievements and complying with any exceptions set out in the rules.\n\n### Eligibility requirements for an International Sportsperson",
      "needs_review": false
    },
    {
      "metadata": {
        "source": "Immigration Rules Appendix International Sportsperson",
        "part": "Immigration Rules Appendix International Sportsperson",
        "section_id": "ISP 3.1",
        "section_title": "Entry requirements for an International Sportsperson",
        "parent_section": "ISP 3",
        "hierarchy_level": 2,
        "topic": "leave-to-enter",
        "url": "https://www.gov.uk/guidance/immigration-rules/immigration-rules-appendix-international-sportsperson",
        "scraped_at": "2025-12-06T17:28:01.169554"
      },
      "text": "### Entry requirements for an International Sportsperson\n\nISP 3.1. A person seeking to come to the UK as an International Sportsperson must apply for and obtain entry clearance as an International Sportsperson before their arrival in the UK.\n\nISP 3.2. A person applying for entry clearance as an International Sportsperson must, if Appendix Tuberculosis applies, provide a valid medical certificate confirming that they have undergone screening for active pulmonary tuberculosis and that this tuberculosis is not present in them.",
      "summary": "International Sportspersons must obtain entry clearance before arriving in the UK. If applicable, they must provide a tuberculosis screening certificate demonstrating they do not have active pulmonary TB.",
      "augmented_text": "Document: Immigration Rules Appendix International Sportsperson\nPart: Immigration Rules Appendix International Sportsperson\nSection ID: ISP 3.1\nSection: Entry requirements for an International Sportsperson\nTopic: leave-to-enter\n\nSummary: International Sportspersons must obtain entry clearance before arriving in the UK. If applicable, they must provide a tuberculosis screening certificate demonstrating they do not have active pulmonary TB.\n\n### Entry requirements for an International Sportsperson\n\nISP 3.1. A person seeking to come to the UK as an International Sportsperson must apply for and obtain entry clearance as an International Sportsperson before their arrival in the UK.\n\nISP 3.2. A person applying for entry clearance as an International Sportsperson must, if Appendix Tuberculosis applies, provide a valid medical certificate confirming that they have undergone screening for active pulmonary tuberculosis and that this tuberculosis is not present in them.",
      "needs_review": false
    },
    {
      "metadata": {
        "source": "Immigration Rules Appendix International Sportsperson",
        "part": "Immigration Rules Appendix International Sportsperson",
        "section_id": "ISP 4.1",
        "section_title": "Points requirements for an International Sportsperson",
        "parent_section": "ISP 4",
        "hierarchy_level": 2,
        "topic": "leave-to-enter",
        "url": "https://www.gov.uk/guidance/immigration-rules/immigration-rules-appendix-international-sportsperson",
        "scraped_at": "2025-12-06T17:28:01.169581"
      },
      "text": "### Points requirements for an International Sportsperson\n\nISP 4.1. An applicant applying for entry clearance or permission to stay as an International Sportsperson for a period of 12 months or less must be awarded all 70 points in table A below.\n\nISP 4.2. An applicant applying for entry clearance or permission to stay as an International Sportsperson for a period exceeding 12 months must be awarded all 80 points in tables A and B below.\n\n| Table A |  |  |\n| --- |\n| Points required (mandatory) | Relevant rules | Points available |\n| Governing Body Endorsement | ISP 5.1 | 50 |\n| Certificate of Sponsorship | ISP 5.2 and ISP 5.3 | 10 |\n| Financial requirements | ISP 7.1 to ISP 7.3 | 10 |\n\n| Table B |  |  |\n| --- |\n| Points required (mandatory) where the period of permission applied for exceeds 12 months | Relevant rules | Points available |\n| English Language at level A1 | ISP 8.1 and ISP 8.2 | 10 |",
      "summary": "International Sportsperson applicants must score 70 points for stays up to 12 months and 80 points for longer periods, by meeting mandatory criteria including a Governing Body Endorsement, Certificate of Sponsorship, financial requirements, and English language skills if exceeding 12 months. Exemptions or alternative points are not specified.",
      "augmented_text": "Document: Immigration Rules Appendix International Sportsperson\nPart: Immigration Rules Appendix International Sportsperson\nSection ID: ISP 4.1\nSection: Points requirements for an International Sportsperson\nTopic: leave-to-enter\n\nSummary: International Sportsperson applicants must score 70 points for stays up to 12 months and 80 points for longer periods, by meeting mandatory criteria including a Governing Body Endorsement, Certificate of Sponsorship, financial requirements, and English language skills if exceeding 12 months. Exemptions or alternative points are not specified.\n\n### Points requirements for an International Sportsperson\n\nISP 4.1. An applicant applying for entry clearance or permission to stay as an International Sportsperson for a period of 12 months or less must be awarded all 70 points in table A below.\n\nISP 4.2. An applicant applying for entry clearance or permission to stay as an International Sportsperson for a period exceeding 12 months must be awarded all 80 points in tables A and B below.\n\n| Table A |  |  |\n| --- |\n| Points required (mandatory) | Relevant rules | Points available |\n| Governing Body Endorsement | ISP 5.1 | 50 |\n| Certificate of Sponsorship | ISP 5.2 and ISP 5.3 | 10 |\n| Financial requirements | ISP 7.1 to ISP 7.3 | 10 |\n\n| Table B |  |  |\n| --- |\n| Points required (mandatory) where the period of permission applied for exceeds 12 months | Relevant rules | Points available |\n| English Language at level A1 | ISP 8.1 and ISP 8.2 | 10 |",
      "needs_review": false
    },
    {
      "metadata": {
        "source": "Immigration Rules Appendix International Sportsperson",
        "part": "Immigration Rules Appendix International Sportsperson",
        "section_id": "ISP 5.1",
        "section_title": "Endorsement requirement for an International Sportsperson",
        "parent_section": null,
        "hierarchy_level": 1,
        "topic": "endorsement",
        "url": "https://www.gov.uk/guidance/immigration-rules/immigration-rules-appendix-international-sportsperson",
        "scraped_at": "2025-12-06T17:28:01.169617"
      },
      "text": "### Endorsement requirement for an International Sportsperson\n\n1.   ISP 5.1. The applicant must provide a letter, containing the unique endorsement number issued to them, from the relevant Sports Governing Body listed in Appendix Sports Governing Bodies, confirming the applicant: \n    1.   (a) is elite; and\n    2.   (b) is internationally established; and\n    3.   (c) will make a significant contribution to the development of their sport at the highest level in the UK.",
      "summary": "International sportsperson applicants must provide a letter from a designated Sports Governing Body, confirming their elite status, international establishment, and potential to significantly contribute to their sport’s development in the UK. The letter must include a unique endorsement number; no exceptions are specified.",
      "augmented_text": "Document: Immigration Rules Appendix International Sportsperson\nPart: Immigration Rules Appendix International Sportsperson\nSection ID: ISP 5.1\nSection: Endorsement requirement for an International Sportsperson\nTopic: endorsement\n\nSummary: International sportsperson applicants must provide a letter from a designated Sports Governing Body, confirming their elite status, international establishment, and potential to significantly contribute to their sport’s development in the UK. The letter must include a unique endorsement number; no exceptions are specified.\n\n### Endorsement requirement for an International Sportsperson\n\n1.   ISP 5.1. The applicant must provide a letter, containing the unique endorsement number issued to them, from the relevant Sports Governing Body listed in Appendix Sports Governing Bodies, confirming the applicant: \n    1.   (a) is elite; and\n    2.   (b) is internationally established; and\n    3.   (c) will make a significant contribution to the development of their sport at the highest level in the UK.",
      "needs_review": false
    },
    {
      "metadata": {
        "source": "Immigration Rules Appendix International Sportsperson",
        "part": "Immigration Rules Appendix International Sportsperson",
        "section_id": "ISP 5.2",
        "section_title": "Certificate of sponsorship requirement for an International Sportsperson",
        "parent_section": null,
        "hierarchy_level": 1,
        "topic": "sponsorship",
        "url": "https://www.gov.uk/guidance/immigration-rules/immigration-rules-appendix-international-sportsperson",
        "scraped_at": "2025-12-06T17:28:01.169663"
      },
      "text": "### Certificate of sponsorship requirement for an International Sportsperson\n\n1.   ISP 5.2. The applicant must have a valid Certificate of Sponsorship for the job they are planning to do; which to be valid must: \n    1.   (a) confirm the applicant’s name, that they are being sponsored as an International Sportsperson, details of the job and salary the sponsor is offering them; and\n    2.   (b) must have been assigned before the applicant entered the UK if the application is for permission to stay and the applicant last had permission as a Visitor undertaking permitted activities for sportspersons; and\n    3.   (c) include a start date, stated by the sponsor, which must be no more than three months after the date of application; and\n    4.   (d) not have been used in a previous application which was either granted or refused (but can have been used in a previous application which was rejected as invalid, made void or withdrawn); and\n    5.   (e) not have been withdrawn by the sponsor or cancelled by the Home Office; and\n    6.   (f) state the unique endorsement number that has been issued to the applicant by the appropriate governing body specified in Appendix Sports Governing Bodies; and\n    7.   (g) confirm that the applicant intends to be based in the UK; and\n    8.   (h) confirm that the job is one the applicant is qualified to undertake.\n\nISP. 5.3. The sponsor must be authorised by the Home Office to sponsor the job in question under the International Sportsperson route.\n\nISP 5.4. The sponsor must be listed as A-rated on the Home Office’s register of licensed sponsors unless the applicant was last granted permission as an International Sportsperson and is applying to continue working for the same sponsor as in their last permission.\n\nISP 5.5. The decision maker must not have reasonable grounds to believe the job the applicant is being sponsored to do does not comply with the National Minimum Wage Regulations or the Working Time Regulations.",
      "summary": "International Sportspersons must have a valid Certificate of Sponsorship that confirms their name, job details, salary, start date (within three months), and qualification. The certificate must be assigned before entry (if applying for permission to stay) and not previously used in a granted or refused application. Sponsors require Home Office authorization to issue this certificate.",
      "augmented_text": "Document: Immigration Rules Appendix International Sportsperson\nPart: Immigration Rules Appendix International Sportsperson\nSection ID: ISP 5.2\nSection: Certificate of sponsorship requirement for an International Sportsperson\nTopic: sponsorship\n\nSummary: International Sportspersons must have a valid Certificate of Sponsorship that confirms their name, job details, salary, start date (within three months), and qualification. The certificate must be assigned before entry (if applying for permission to stay) and not previously used in a granted or refused application. Sponsors require Home Office authorization to issue this certificate.\n\n### Certificate of sponsorship requirement for an International Sportsperson\n\n1.   ISP 5.2. The applicant must have a valid Certificate of Sponsorship for the job they are planning to do; which to be valid must: \n    1.   (a) confirm the applicant’s name, that they are being sponsored as an International Sportsperson, details of the job and salary the sponsor is offering them; and\n    2.   (b) must have been assigned before the applicant entered the UK if the application is for permission to stay and the applicant last had permission as a Visitor undertaking permitted activities for sportspersons; and\n    3.   (c) include a start date, stated by the sponsor, which must be no more than three months after the date of application; and\n    4.   (d) not have been used in a previous application which was either granted or refused (but can have been used in a previous application which was rejected as invalid, made void or withdrawn); and\n    5.   (e) not have been withdrawn by the sponsor or cancelled by the Home Office; and\n    6.   (f) state the unique endorsement number that has been issued to the applicant by the appropriate governing body specified in Appendix Sports Governing Bodies; and\n    7.   (g) confirm that the applicant intends to be based in the UK; and\n    8.   (h) confirm that the job is one the applicant is qualified to undertake.\n\nISP. 5.3. The sponsor must be authorised by the Home Office to sponsor the job in question under the International Sportsperson route.\n\nISP 5.4. The sponsor must be listed as A-rated on the Home Office’s register of licensed sponsors unless the applicant was last granted permission as an International Sportsperson and is applying to continue working for the same sponsor as in their last permission.\n\nISP 5.5. The decision maker must not have reasonable grounds to believe the job the applicant is being sponsored to do does not comply with the National Minimum Wage Regulations or the Working Time Regulations.",
      "needs_review": false
    },
    {
      "metadata": {
        "source": "Immigration Rules Appendix International Sportsperson",
        "part": "Immigration Rules Appendix International Sportsperson",
        "section_id": "ISP 6.1",
        "section_title": "Genuineness requirement for an International Sportsperson",
        "parent_section": null,
        "hierarchy_level": 1,
        "topic": "eligibility",
        "url": "https://www.gov.uk/guidance/immigration-rules/immigration-rules-appendix-international-sportsperson",
        "scraped_at": "2025-12-06T17:28:01.169696"
      },
      "text": "### Genuineness requirement for an International Sportsperson\n\n1.   ISP 6.1. The applicant must: \n    1.   (a) genuinely intend, and be able, to undertake the role for which they are being sponsored; and\n    2.   (b) not intend to undertake employment other than in the role for which they are being sponsored, or as otherwise permitted at ISP 11.3.",
      "summary": "International sportsperson applicants must genuinely intend and be capable of performing their sponsored role, not engaging in unauthorized employment beyond that role, adhering to specific permitted exceptions.",
      "augmented_text": "Document: Immigration Rules Appendix International Sportsperson\nPart: Immigration Rules Appendix International Sportsperson\nSection ID: ISP 6.1\nSection: Genuineness requirement for an International Sportsperson\nTopic: eligibility\n\nSummary: International sportsperson applicants must genuinely intend and be capable of performing their sponsored role, not engaging in unauthorized employment beyond that role, adhering to specific permitted exceptions.\n\n### Genuineness requirement for an International Sportsperson\n\n1.   ISP 6.1. The applicant must: \n    1.   (a) genuinely intend, and be able, to undertake the role for which they are being sponsored; and\n    2.   (b) not intend to undertake employment other than in the role for which they are being sponsored, or as otherwise permitted at ISP 11.3.",
      "needs_review": false
    },
    {
      "metadata": {
        "source": "Immigration Rules Appendix International Sportsperson",
        "part": "Immigration Rules Appendix International Sportsperson",
        "section_id": "ISP 7.1",
        "section_title": "Financial requirement for an International Sportsperson",
        "parent_section": "ISP 7",
        "hierarchy_level": 2,
        "topic": "financial",
        "url": "https://www.gov.uk/guidance/immigration-rules/immigration-rules-appendix-international-sportsperson",
        "scraped_at": "2025-12-06T17:28:01.169714"
      },
      "text": "### Financial requirement for an International Sportsperson\n\nISP 7.1. If the applicant is applying for permission to stay and has been living in the UK with permission for 12 months or longer on the date of application, they will meet the financial requirement and do not need to show funds.\n\n1.   ISP 7.2. If the applicant is applying for entry clearance, or is applying for permission to stay and has been living in the UK for less than 12 months on the date of application, either: \n    1.   (a) the applicant must have funds of at least £1,270; or\n    2.   (b) the applicant’s A rated sponsor must confirm on the Certificate of Sponsorship that they will, if it is necessary, maintain and accommodate the applicant up to the end of the first month of their employment for an amount of at least £1,270.\n\nISP 7.3. If ISP 7.2 (a) applies, the applicant must have held the required level of funds for a 28 day period and must show funds as specified in Appendix Finance.",
      "summary": "International sportspersons applying for entry clearance or short-term stay must have at least £1,270 in funds or sponsor confirmation, unless they have been in the UK for 12+ months, then no funds are required. The funds must have been held for 28 days if applicable.",
      "augmented_text": "Document: Immigration Rules Appendix International Sportsperson\nPart: Immigration Rules Appendix International Sportsperson\nSection ID: ISP 7.1\nSection: Financial requirement for an International Sportsperson\nTopic: financial\n\nSummary: International sportspersons applying for entry clearance or short-term stay must have at least £1,270 in funds or sponsor confirmation, unless they have been in the UK for 12+ months, then no funds are required. The funds must have been held for 28 days if applicable.\n\n### Financial requirement for an International Sportsperson\n\nISP 7.1. If the applicant is applying for permission to stay and has been living in the UK with permission for 12 months or longer on the date of application, they will meet the financial requirement and do not need to show funds.\n\n1.   ISP 7.2. If the applicant is applying for entry clearance, or is applying for permission to stay and has been living in the UK for less than 12 months on the date of application, either: \n    1.   (a) the applicant must have funds of at least £1,270; or\n    2.   (b) the applicant’s A rated sponsor must confirm on the Certificate of Sponsorship that they will, if it is necessary, maintain and accommodate the applicant up to the end of the first month of their employment for an amount of at least £1,270.\n\nISP 7.3. If ISP 7.2 (a) applies, the applicant must have held the required level of funds for a 28 day period and must show funds as specified in Appendix Finance.",
      "needs_review": false
    },
    {
      "metadata": {
        "source": "Immigration Rules Appendix International Sportsperson",
        "part": "Immigration Rules Appendix International Sportsperson",
        "section_id": "ISP 8.1",
        "section_title": "English language requirement for an International Sportsperson",
        "parent_section": "ISP 8",
        "hierarchy_level": 2,
        "topic": "english-language",
        "url": "https://www.gov.uk/guidance/immigration-rules/immigration-rules-appendix-international-sportsperson",
        "scraped_at": "2025-12-06T17:28:01.169732"
      },
      "text": "### English language requirement for an International Sportsperson\n\nISP 8.1. Unless an exemption applies, if the applicant is applying for entry clearance or permission to stay as an International Sportsperson for a period exceeding 12 months, the applicant must show English language ability on the Common European Framework of Reference for Languages in speaking and listening of at least level A1.\n\nISP 8.2. If ISP 8.1. applies, the applicant must show they meet the English Language requirement as specified in Appendix English Language.",
      "summary": "International Sportspersons applying for stays over 12 months must demonstrate at least A1 level in speaking and listening, unless exempted. They must also meet the English language criteria set out in the relevant appendix.",
      "augmented_text": "Document: Immigration Rules Appendix International Sportsperson\nPart: Immigration Rules Appendix International Sportsperson\nSection ID: ISP 8.1\nSection: English language requirement for an International Sportsperson\nTopic: english-language\n\nSummary: International Sportspersons applying for stays over 12 months must demonstrate at least A1 level in speaking and listening, unless exempted. They must also meet the English language criteria set out in the relevant appendix.\n\n### English language requirement for an International Sportsperson\n\nISP 8.1. Unless an exemption applies, if the applicant is applying for entry clearance or permission to stay as an International Sportsperson for a period exceeding 12 months, the applicant must show English language ability on the Common European Framework of Reference for Languages in speaking and listening of at least level A1.\n\nISP 8.2. If ISP 8.1. applies, the applicant must show they meet the English Language requirement as specified in Appendix English Language.",
      "needs_review": false
    },
    {
      "metadata": {
        "source": "Immigration Rules Appendix International Sportsperson",
        "part": "Immigration Rules Appendix International Sportsperson",
        "section_id": "1",
        "section_title": "Parental consent requirement for an International Sportsperson aged under 18",
        "parent_section": null,
        "hierarchy_level": 1,
        "topic": "family",
        "url": "https://www.gov.uk/guidance/immigration-rules/immigration-rules-appendix-international-sportsperson",
        "scraped_at": "2025-12-06T17:28:01.169762"
      },
      "text": "### Parental consent requirement for an International Sportsperson aged under 18\n\n1.   ISP 9.1. The applicant must meet the parental consent requirement for an applicant not applying as a dependent child in Appendix Children.\n\n1.   ISP 9.2. DELETED.",
      "summary": "This provision applies to international sportsperson applicants under 18. They must obtain parental consent unless applying as a dependent child under Appendix Children; no other exceptions are specified.",
      "augmented_text": "Document: Immigration Rules Appendix International Sportsperson\nPart: Immigration Rules Appendix International Sportsperson\nSection ID: 1\nSection: Parental consent requirement for an International Sportsperson aged under 18\nTopic: family\n\nSummary: This provision applies to international sportsperson applicants under 18. They must obtain parental consent unless applying as a dependent child under Appendix Children; no other exceptions are specified.\n\n### Parental consent requirement for an International Sportsperson aged under 18\n\n1.   ISP 9.1. The applicant must meet the parental consent requirement for an applicant not applying as a dependent child in Appendix Children.\n\n1.   ISP 9.2. DELETED.",
      "needs_review": false
    },
    {
      "metadata": {
        "source": "Immigration Rules Appendix International Sportsperson",
        "part": "Immigration Rules Appendix International Sportsperson",
        "section_id": "ISP 10.1",
        "section_title": "Decision on an application as an International Sportsperson",
        "parent_section": "ISP 10",
        "hierarchy_level": 2,
        "topic": "eligibility",
        "url": "https://www.gov.uk/guidance/immigration-rules/immigration-rules-appendix-international-sportsperson",
        "scraped_at": "2025-12-06T17:28:01.169776"
      },
      "text": "### Decision on an application as an International Sportsperson\n\nISP 10.1. If the decision maker is satisfied that all the suitability and eligibility requirements are met for an International Sportsperson, the application will be granted, otherwise the application will be refused.\n\nISP 10.2. If the application is refused the person can apply for an Administrative Review under Appendix AR: Administrative Review.",
      "summary": "This provision applies to international sportsperson applicants. If they meet all suitability and eligibility criteria, their application will be granted; otherwise, it will be refused, but they may request an Administrative Review.",
      "augmented_text": "Document: Immigration Rules Appendix International Sportsperson\nPart: Immigration Rules Appendix International Sportsperson\nSection ID: ISP 10.1\nSection: Decision on an application as an International Sportsperson\nTopic: eligibility\n\nSummary: This provision applies to international sportsperson applicants. If they meet all suitability and eligibility criteria, their application will be granted; otherwise, it will be refused, but they may request an Administrative Review.\n\n### Decision on an application as an International Sportsperson\n\nISP 10.1. If the decision maker is satisfied that all the suitability and eligibility requirements are met for an International Sportsperson, the application will be granted, otherwise the application will be refused.\n\nISP 10.2. If the application is refused the person can apply for an Administrative Review under Appendix AR: Administrative Review.",
      "needs_review": false
    },
    {
      "metadata": {
        "source": "Immigration Rules Appendix International Sportsperson",
        "part": "Immigration Rules Appendix International Sportsperson",
        "section_id": "1",
        "section_title": "Period of grant for an International Sportsperson",
        "parent_section": null,
        "hierarchy_level": 1,
        "topic": "leave-to-enter",
        "url": "https://www.gov.uk/guidance/immigration-rules/immigration-rules-appendix-international-sportsperson",
        "scraped_at": "2025-12-06T17:28:01.169801"
      },
      "text": "### Period of grant for an International Sportsperson\n\n1.   ISP 11.1. If the applicant is applying for entry clearance or permission to stay as an International Sportsperson for a period of 12 months or less, they will be granted entry clearance or permission to stay for whichever is the shorter of: \n    1.   (a) up to 14 days after the period of employment stated on their Certificate of Sponsorship; or\n    2.   (b) 12 months.\n\n1.   ISP 11.2. If the applicant is applying for entry clearance or permission to stay as an International Sportsperson for a period exceeding 12 months, they will be granted entry clearance or permission to stay for whichever is the shorter of: \n    1.   (a) up to 14 days after the period of employment stated on their Certificate of Sponsorship; or\n    2.   (b) three years.",
      "summary": "This provision applies to International Sportsperson applicants seeking UK entry or stay. They are eligible for a grant lasting up to 14 days after their employment period or 12 months if applying for 12 months or less, and up to 14 days after or three years for stays exceeding 12 months. The period granted depends on the employment duration and specified thresholds.",
      "augmented_text": "Document: Immigration Rules Appendix International Sportsperson\nPart: Immigration Rules Appendix International Sportsperson\nSection ID: 1\nSection: Period of grant for an International Sportsperson\nTopic: leave-to-enter\n\nSummary: This provision applies to International Sportsperson applicants seeking UK entry or stay. They are eligible for a grant lasting up to 14 days after their employment period or 12 months if applying for 12 months or less, and up to 14 days after or three years for stays exceeding 12 months. The period granted depends on the employment duration and specified thresholds.\n\n### Period of grant for an International Sportsperson\n\n1.   ISP 11.1. If the applicant is applying for entry clearance or permission to stay as an International Sportsperson for a period of 12 months or less, they will be granted entry clearance or permission to stay for whichever is the shorter of: \n    1.   (a) up to 14 days after the period of employment stated on their Certificate of Sponsorship; or\n    2.   (b) 12 months.\n\n1.   ISP 11.2. If the applicant is applying for entry clearance or permission to stay as an International Sportsperson for a period exceeding 12 months, they will be granted entry clearance or permission to stay for whichever is the shorter of: \n    1.   (a) up to 14 days after the period of employment stated on their Certificate of Sponsorship; or\n    2.   (b) three years.",
      "needs_review": false
    },
    {
      "metadata": {
        "source": "Immigration Rules Appendix International Sportsperson",
        "part": "Immigration Rules Appendix International Sportsperson",
        "section_id": "1",
        "section_title": "Conditions of grant for an International Sportsperson",
        "parent_section": null,
        "hierarchy_level": 1,
        "topic": "financial",
        "url": "https://www.gov.uk/guidance/immigration-rules/immigration-rules-appendix-international-sportsperson",
        "scraped_at": "2025-12-06T17:28:01.169819"
      },
      "text": "### Conditions of grant for an International Sportsperson\n\n1.   ISP 11.3. The grant will be subject to all the following conditions: \n    1.   (a) no access to public funds; and\n    2.   (b) work is permitted in the job the applicant is being sponsored for; and\n    3.   (c) supplementary employment is permitted; and\n    4.   (d) voluntary work is permitted; and\n    5.   (e) working out a contractual notice period is permitted, for a job the applicant was lawfully working in on the date of application; and\n    6.   (f) employment as a sportsperson for the applicant’s national team while their national team is in the UK, playing in British University and College Sport (BUCS) competitions, and temporary engagements as a sports broadcaster providing guest expert commentary on a particular sporting event, are permitted; and\n    7.   (g) study is permitted, subject to the ATAS condition in Appendix ATAS.\n    8.   (h) DELETED.",
      "summary": "International sportspersons granted a visa can work in their sponsored role, undertake supplementary or voluntary work, and participate in national team events or sports broadcasting, provided they do not access public funds. They may also study with ATAS conditions; other employment types or access exceptions are not specified.",
      "augmented_text": "Document: Immigration Rules Appendix International Sportsperson\nPart: Immigration Rules Appendix International Sportsperson\nSection ID: 1\nSection: Conditions of grant for an International Sportsperson\nTopic: financial\n\nSummary: International sportspersons granted a visa can work in their sponsored role, undertake supplementary or voluntary work, and participate in national team events or sports broadcasting, provided they do not access public funds. They may also study with ATAS conditions; other employment types or access exceptions are not specified.\n\n### Conditions of grant for an International Sportsperson\n\n1.   ISP 11.3. The grant will be subject to all the following conditions: \n    1.   (a) no access to public funds; and\n    2.   (b) work is permitted in the job the applicant is being sponsored for; and\n    3.   (c) supplementary employment is permitted; and\n    4.   (d) voluntary work is permitted; and\n    5.   (e) working out a contractual notice period is permitted, for a job the applicant was lawfully working in on the date of application; and\n    6.   (f) employment as a sportsperson for the applicant’s national team while their national team is in the UK, playing in British University and College Sport (BUCS) competitions, and temporary engagements as a sports broadcaster providing guest expert commentary on a particular sporting event, are permitted; and\n    7.   (g) study is permitted, subject to the ATAS condition in Appendix ATAS.\n    8.   (h) DELETED.",
      "needs_review": false
    },
    {
      "metadata": {
        "source": "Immigration Rules Appendix International Sportsperson",
        "part": "Immigration Rules Appendix International Sportsperson",
        "section_id": "Settlement as an International Sportsperson",
        "section_title": "Settlement as an International Sportsperson",
        "parent_section": null,
        "hierarchy_level": 2,
        "topic": "settlement",
        "url": "https://www.gov.uk/guidance/immigration-rules/immigration-rules-appendix-international-sportsperson",
        "scraped_at": "2025-12-06T17:28:01.169836"
      },
      "text": "### Settlement as an International Sportsperson",
      "summary": "This provision applies to international sportspersons seeking settlement. They must demonstrate significant achievement and recognition in their sport, meeting specific criteria, with exceptions or thresholds outlined for eligibility.",
      "augmented_text": "Document: Immigration Rules Appendix International Sportsperson\nPart: Immigration Rules Appendix International Sportsperson\nSection ID: Settlement as an International Sportsperson\nSection: Settlement as an International Sportsperson\nTopic: settlement\n\nSummary: This provision applies to international sportspersons seeking settlement. They must demonstrate significant achievement and recognition in their sport, meeting specific criteria, with exceptions or thresholds outlined for eligibility.\n\n### Settlement as an International Sportsperson",
      "needs_review": false
    },
    {
      "metadata": {
        "source": "Immigration Rules Appendix International Sportsperson",
        "part": "Immigration Rules Appendix International Sportsperson",
        "section_id": "ISP 12.1",
        "section_title": "Validity requirements for settlement as an International Sportsperson",
        "parent_section": "ISP 12",
        "hierarchy_level": 2,
        "topic": "settlement",
        "url": "https://www.gov.uk/guidance/immigration-rules/immigration-rules-appendix-international-sportsperson",
        "scraped_at": "2025-12-06T17:28:01.169874"
      },
      "text": "### Validity requirements for settlement as an International Sportsperson\n\nISP 12.1. A person applying for settlement as an International Sportsperson must apply online on the gov.uk website on the specified form, “Settle in the UK in various immigration categories: form SET(O)”.\n\n1.   ISP 12.2. An application for settlement as an International Sportsperson must meet all the following requirements: \n    1.   (a) any fee must have been paid; and\n    2.   (b) the applicant must have provided biometrics when required; and\n    3.   (c) the applicant must have provided a passport or other travel document which satisfactorily establishes their identity and nationality; and\n    4.   (d) the applicant must be in the UK on the date of application.\n\n1.   ISP 12.3. The applicant must: \n    1.   (a) have, or have last been granted, permission as an International Sportsperson; and\n    2.   (b) have, at any point during the five year continuous residence period, been granted leave as an International Sportsperson for a period exceeding 12 months.\n\nISP 12.4. An application which does not meet all the validity requirements for settlement as an International Sportsperson may be rejected as invalid and not considered.",
      "summary": "Applicants seeking settlement as an International Sportsperson must submit an online application via gov.uk, paying fees, providing biometrics and travel documents, and being in the UK on the application date. They must also have held or currently hold International Sportsperson permission and have previously been granted such permission for over 12 months within a five-year residence. Failure to meet all requirements may result in application rejection.",
      "augmented_text": "Document: Immigration Rules Appendix International Sportsperson\nPart: Immigration Rules Appendix International Sportsperson\nSection ID: ISP 12.1\nSection: Validity requirements for settlement as an International Sportsperson\nTopic: settlement\n\nSummary: Applicants seeking settlement as an International Sportsperson must submit an online application via gov.uk, paying fees, providing biometrics and travel documents, and being in the UK on the application date. They must also have held or currently hold International Sportsperson permission and have previously been granted such permission for over 12 months within a five-year residence. Failure to meet all requirements may result in application rejection.\n\n### Validity requirements for settlement as an International Sportsperson\n\nISP 12.1. A person applying for settlement as an International Sportsperson must apply online on the gov.uk website on the specified form, “Settle in the UK in various immigration categories: form SET(O)”.\n\n1.   ISP 12.2. An application for settlement as an International Sportsperson must meet all the following requirements: \n    1.   (a) any fee must have been paid; and\n    2.   (b) the applicant must have provided biometrics when required; and\n    3.   (c) the applicant must have provided a passport or other travel document which satisfactorily establishes their identity and nationality; and\n    4.   (d) the applicant must be in the UK on the date of application.\n\n1.   ISP 12.3. The applicant must: \n    1.   (a) have, or have last been granted, permission as an International Sportsperson; and\n    2.   (b) have, at any point during the five year continuous residence period, been granted leave as an International Sportsperson for a period exceeding 12 months.\n\nISP 12.4. An application which does not meet all the validity requirements for settlement as an International Sportsperson may be rejected as invalid and not considered.",
      "needs_review": false
    },
    {
      "metadata": {
        "source": "Immigration Rules Appendix International Sportsperson",
        "part": "Immigration Rules Appendix International Sportsperson",
        "section_id": "ISP 13.1",
        "section_title": "Suitability requirements for settlement as an International Sportsperson",
        "parent_section": "ISP 13",
        "hierarchy_level": 2,
        "topic": "suitability",
        "url": "https://www.gov.uk/guidance/immigration-rules/immigration-rules-appendix-international-sportsperson",
        "scraped_at": "2025-12-06T17:28:01.169895"
      },
      "text": "### Suitability requirements for settlement as an International Sportsperson\n\nISP 13.1. The applicant must not fall for refusal under Part Suitability.\n\n1.   ISP 13.2. The applicant must not be: \n    1.   (a) in breach of immigration laws, except that where the Exceptions for overstayers section of Part Suitability applies, that period of overstaying will be disregarded; or\n    2.   (b) on immigration bail.",
      "summary": "Applicants seeking settlement as an International Sportsperson must meet suitability requirements, including not breaching immigration laws (unless qualifying for exceptions) and not being on immigration bail.",
      "augmented_text": "Document: Immigration Rules Appendix International Sportsperson\nPart: Immigration Rules Appendix International Sportsperson\nSection ID: ISP 13.1\nSection: Suitability requirements for settlement as an International Sportsperson\nTopic: suitability\n\nSummary: Applicants seeking settlement as an International Sportsperson must meet suitability requirements, including not breaching immigration laws (unless qualifying for exceptions) and not being on immigration bail.\n\n### Suitability requirements for settlement as an International Sportsperson\n\nISP 13.1. The applicant must not fall for refusal under Part Suitability.\n\n1.   ISP 13.2. The applicant must not be: \n    1.   (a) in breach of immigration laws, except that where the Exceptions for overstayers section of Part Suitability applies, that period of overstaying will be disregarded; or\n    2.   (b) on immigration bail.",
      "needs_review": false
    },
    {
      "metadata": {
        "source": "Immigration Rules Appendix International Sportsperson",
        "part": "Immigration Rules Appendix International Sportsperson",
        "section_id": "Eligibility requirements for settlement as an International Sportsperson",
        "section_title": "Eligibility requirements for settlement as an International Sportsperson",
        "parent_section": null,
        "hierarchy_level": 3,
        "topic": "eligibility",
        "url": "https://www.gov.uk/guidance/immigration-rules/immigration-rules-appendix-international-sportsperson",
        "scraped_at": "2025-12-06T17:28:01.169905"
      },
      "text": "### Eligibility requirements for settlement as an International Sportsperson",
      "summary": "This provision applies to international sportsperson applicants seeking settlement. It requires them to meet specific eligibility criteria, including achievements and recognition in their sport, with certain thresholds or conditions specified, such as proven international reputation. Exceptions or additional conditions may apply based on individual circumstances.",
      "augmented_text": "Document: Immigration Rules Appendix International Sportsperson\nPart: Immigration Rules Appendix International Sportsperson\nSection ID: Eligibility requirements for settlement as an International Sportsperson\nSection: Eligibility requirements for settlement as an International Sportsperson\nTopic: eligibility\n\nSummary: This provision applies to international sportsperson applicants seeking settlement. It requires them to meet specific eligibility criteria, including achievements and recognition in their sport, with certain thresholds or conditions specified, such as proven international reputation. Exceptions or additional conditions may apply based on individual circumstances.\n\n### Eligibility requirements for settlement as an International Sportsperson",
      "needs_review": false
    },
    {
      "metadata": {
        "source": "Immigration Rules Appendix International Sportsperson",
        "part": "Immigration Rules Appendix International Sportsperson",
        "section_id": "ISP 14.1",
        "section_title": "Qualifying period requirement for settlement as an International Sportsperson",
        "parent_section": "ISP 14",
        "hierarchy_level": 2,
        "topic": "settlement",
        "url": "https://www.gov.uk/guidance/immigration-rules/immigration-rules-appendix-international-sportsperson",
        "scraped_at": "2025-12-06T17:28:01.169934"
      },
      "text": "### Qualifying period requirement for settlement as an International Sportsperson\n\nISP 14.1. The applicant must have spent a continuous period of five years in the UK.\n\n1.   ISP 14.2. The five year continuous period must consist of time with permission (not as a dependant) on any of, or any combination of, the following routes: \n    1.   (a) Skilled Worker; or\n    2.   (b) Global talent; or\n    3.   (c) Innovator Founder; or\n    4.   (d) T2 Minister of Religion; or\n    5.   (e) International Sportsperson; or\n    6.   (f) Representative of an Overseas Business; or\n    7.   (g) Tier 1, other than Tier 1 (Graduate Entrepreneur); or\n    8.   (h) Scale-up; or\n    9.   (i) permission on any other route, during the time the applicant was waiting for a decision on their application as an International Sportsperson, providing that application: \n        1.   (i) was for permission to stay; and\n        2.   (ii) was made between 24 January 2020 and 30 June 2021 (inclusive); and\n        3.   (iii) was supported on the date of application by a certificate of sponsorship assigned by a licensed sponsor; and\n        4.   (iv) was granted.",
      "summary": "The provision applies to international sportsperson applicants seeking settlement. They must have a continuous five-year UK residence, primarily under specific routes like Skilled Worker or International Sportsperson, with certain conditions during application waiting periods between Jan 2020 and June 2021. Exceptions include permissions granted during specified application processes supported by a licensed sponsor.",
      "augmented_text": "Document: Immigration Rules Appendix International Sportsperson\nPart: Immigration Rules Appendix International Sportsperson\nSection ID: ISP 14.1\nSection: Qualifying period requirement for settlement as an International Sportsperson\nTopic: settlement\n\nSummary: The provision applies to international sportsperson applicants seeking settlement. They must have a continuous five-year UK residence, primarily under specific routes like Skilled Worker or International Sportsperson, with certain conditions during application waiting periods between Jan 2020 and June 2021. Exceptions include permissions granted during specified application processes supported by a licensed sponsor.\n\n### Qualifying period requirement for settlement as an International Sportsperson\n\nISP 14.1. The applicant must have spent a continuous period of five years in the UK.\n\n1.   ISP 14.2. The five year continuous period must consist of time with permission (not as a dependant) on any of, or any combination of, the following routes: \n    1.   (a) Skilled Worker; or\n    2.   (b) Global talent; or\n    3.   (c) Innovator Founder; or\n    4.   (d) T2 Minister of Religion; or\n    5.   (e) International Sportsperson; or\n    6.   (f) Representative of an Overseas Business; or\n    7.   (g) Tier 1, other than Tier 1 (Graduate Entrepreneur); or\n    8.   (h) Scale-up; or\n    9.   (i) permission on any other route, during the time the applicant was waiting for a decision on their application as an International Sportsperson, providing that application: \n        1.   (i) was for permission to stay; and\n        2.   (ii) was made between 24 January 2020 and 30 June 2021 (inclusive); and\n        3.   (iii) was supported on the date of application by a certificate of sponsorship assigned by a licensed sponsor; and\n        4.   (iv) was granted.",
      "needs_review": false
    },
    {
      "metadata": {
        "source": "Immigration Rules Appendix International Sportsperson",
        "part": "Immigration Rules Appendix International Sportsperson",
        "section_id": "ISP 15.1",
        "section_title": "Continuous residence requirement for settlement as an International Sportsperson",
        "parent_section": "ISP 15",
        "hierarchy_level": 2,
        "topic": "settlement",
        "url": "https://www.gov.uk/guidance/immigration-rules/immigration-rules-appendix-international-sportsperson",
        "scraped_at": "2025-12-06T17:28:01.169960"
      },
      "text": "### Continuous residence requirement for settlement as an International Sportsperson\n\nISP 15.1. The applicant must meet the continuous residence requirement as set out in Appendix Continuous Residence during the period in ISP 14.1.",
      "summary": "This provision applies to international sportsperson applicants seeking settlement. They must meet the continuous residence requirement outlined in Appendix Continuous Residence during the period specified in ISP 14.1. No exceptions or thresholds beyond this requirement are specified.",
      "augmented_text": "Document: Immigration Rules Appendix International Sportsperson\nPart: Immigration Rules Appendix International Sportsperson\nSection ID: ISP 15.1\nSection: Continuous residence requirement for settlement as an International Sportsperson\nTopic: settlement\n\nSummary: This provision applies to international sportsperson applicants seeking settlement. They must meet the continuous residence requirement outlined in Appendix Continuous Residence during the period specified in ISP 14.1. No exceptions or thresholds beyond this requirement are specified.\n\n### Continuous residence requirement for settlement as an International Sportsperson\n\nISP 15.1. The applicant must meet the continuous residence requirement as set out in Appendix Continuous Residence during the period in ISP 14.1.",
      "needs_review": false
    },
    {
      "metadata": {
        "source": "Immigration Rules Appendix International Sportsperson",
        "part": "Immigration Rules Appendix International Sportsperson",
        "section_id": "ISP 16.1",
        "section_title": "English language requirement for settlement as an International Sportsperson",
        "parent_section": "ISP 16",
        "hierarchy_level": 2,
        "topic": "english-language",
        "url": "https://www.gov.uk/guidance/immigration-rules/immigration-rules-appendix-international-sportsperson",
        "scraped_at": "2025-12-06T17:28:01.169977"
      },
      "text": "### English language requirement for settlement as an International Sportsperson\n\nISP 16.1. Unless an exemption applies, the applicant must show English language ability on the Common European Framework of Reference for Languages in speaking and listening to at least level B1.\n\nISP 16.2. If ISP 16.1. applies, the applicant must show they meet the English language requirement as specified in Appendix English Language.",
      "summary": "International Sportsperson applicants must demonstrate English language ability at Level B1 in speaking and listening, unless exempted, as a condition for settlement; compliance must align with Appendix English Language.",
      "augmented_text": "Document: Immigration Rules Appendix International Sportsperson\nPart: Immigration Rules Appendix International Sportsperson\nSection ID: ISP 16.1\nSection: English language requirement for settlement as an International Sportsperson\nTopic: english-language\n\nSummary: International Sportsperson applicants must demonstrate English language ability at Level B1 in speaking and listening, unless exempted, as a condition for settlement; compliance must align with Appendix English Language.\n\n### English language requirement for settlement as an International Sportsperson\n\nISP 16.1. Unless an exemption applies, the applicant must show English language ability on the Common European Framework of Reference for Languages in speaking and listening to at least level B1.\n\nISP 16.2. If ISP 16.1. applies, the applicant must show they meet the English language requirement as specified in Appendix English Language.",
      "needs_review": false
    },
    {
      "metadata": {
        "source": "Immigration Rules Appendix International Sportsperson",
        "part": "Immigration Rules Appendix International Sportsperson",
        "section_id": "ISP 17.1",
        "section_title": "Knowledge of Life in the UK requirement for settlement as an International Sportsperson",
        "parent_section": "ISP 17",
        "hierarchy_level": 2,
        "topic": "settlement",
        "url": "https://www.gov.uk/guidance/immigration-rules/immigration-rules-appendix-international-sportsperson",
        "scraped_at": "2025-12-06T17:28:01.170003"
      },
      "text": "### Knowledge of Life in the UK requirement for settlement as an International Sportsperson\n\nISP 17.1. Unless an exemption applies, the applicant must meet the Knowledge of Life in the UK requirement as set out in Appendix KOL UK.",
      "summary": "International Sportspersons seeking settlement must, unless exempt, demonstrate knowledge of Life in the UK as specified in Appendix KOL UK, with certain conditions or exemptions applying.",
      "augmented_text": "Document: Immigration Rules Appendix International Sportsperson\nPart: Immigration Rules Appendix International Sportsperson\nSection ID: ISP 17.1\nSection: Knowledge of Life in the UK requirement for settlement as an International Sportsperson\nTopic: settlement\n\nSummary: International Sportspersons seeking settlement must, unless exempt, demonstrate knowledge of Life in the UK as specified in Appendix KOL UK, with certain conditions or exemptions applying.\n\n### Knowledge of Life in the UK requirement for settlement as an International Sportsperson\n\nISP 17.1. Unless an exemption applies, the applicant must meet the Knowledge of Life in the UK requirement as set out in Appendix KOL UK.",
      "needs_review": false
    },
    {
      "metadata": {
        "source": "Immigration Rules Appendix International Sportsperson",
        "part": "Immigration Rules Appendix International Sportsperson",
        "section_id": "ISP 18.1",
        "section_title": "Sponsorship requirement for settlement as an International Sportsperson",
        "parent_section": "ISP 18",
        "hierarchy_level": 2,
        "topic": "settlement",
        "url": "https://www.gov.uk/guidance/immigration-rules/immigration-rules-appendix-international-sportsperson",
        "scraped_at": "2025-12-06T17:28:01.170039"
      },
      "text": "### Sponsorship requirement for settlement as an International Sportsperson\n\nISP 18.1. The sponsor in the applicant’s most recent permission must still be approved by the Home Office to sponsor International Sportspersons on the date of decision.\n\nISP 18.2. The sponsor must confirm that they still require the applicant to work for them for the foreseeable future, and that the applicant is paid, and will be paid for the foreseeable future, at least the salary of £35,800 per year.\n\n1.   ISP 18.3. The salary in ISP 18.2. is subject to the following requirements: \n    1.   (a) the salary must: \n        1.   (i) be basic pay (excluding overtime); and\n        2.   (ii) only include allowances where they are part of the guaranteed salary package and would be paid to a local settled worker in similar circumstances; and\n        3.   (iii) not include other allowances and benefits, such as bonus or incentive pay, employer pension contributions, travel and subsistence (including travel to and from the applicant’s home country); and\n        4.   (iv) not include the value of any shares the applicant has received as an employee- owner in exchange for some of their UK employment rights; and\n\n    2.   (b) if the applicant is being sponsored to work more than 48 hours a week, only the salary for the first 48 hours a week will be considered towards the salary threshold of £35,800; and\n    3.   (c) if the applicant is currently absent from work for one of the reasons set out in Part Suitability, paragraph SUI 36.1. or has returned from such an absence within the month before the date of application, consideration will be based on their salary on their return to work, as stated by their sponsor.",
      "summary": "This provision applies to sponsors of International Sportspersons seeking settlement. It requires the sponsor’s approval, confirmation of ongoing sponsorship needs, and that the applicant is paid a minimum basic salary of £35,800 per year, excluding bonuses, benefits, or shares. The salary must meet specific conditions, and only the salary for up to 48 hours per week is counted if the applicant works longer hours.",
      "augmented_text": "Document: Immigration Rules Appendix International Sportsperson\nPart: Immigration Rules Appendix International Sportsperson\nSection ID: ISP 18.1\nSection: Sponsorship requirement for settlement as an International Sportsperson\nTopic: settlement\n\nSummary: This provision applies to sponsors of International Sportspersons seeking settlement. It requires the sponsor’s approval, confirmation of ongoing sponsorship needs, and that the applicant is paid a minimum basic salary of £35,800 per year, excluding bonuses, benefits, or shares. The salary must meet specific conditions, and only the salary for up to 48 hours per week is counted if the applicant works longer hours.\n\n### Sponsorship requirement for settlement as an International Sportsperson\n\nISP 18.1. The sponsor in the applicant’s most recent permission must still be approved by the Home Office to sponsor International Sportspersons on the date of decision.\n\nISP 18.2. The sponsor must confirm that they still require the applicant to work for them for the foreseeable future, and that the applicant is paid, and will be paid for the foreseeable future, at least the salary of £35,800 per year.\n\n1.   ISP 18.3. The salary in ISP 18.2. is subject to the following requirements: \n    1.   (a) the salary must: \n        1.   (i) be basic pay (excluding overtime); and\n        2.   (ii) only include allowances where they are part of the guaranteed salary package and would be paid to a local settled worker in similar circumstances; and\n        3.   (iii) not include other allowances and benefits, such as bonus or incentive pay, employer pension contributions, travel and subsistence (including travel to and from the applicant’s home country); and\n        4.   (iv) not include the value of any shares the applicant has received as an employee- owner in exchange for some of their UK employment rights; and\n\n    2.   (b) if the applicant is being sponsored to work more than 48 hours a week, only the salary for the first 48 hours a week will be considered towards the salary threshold of £35,800; and\n    3.   (c) if the applicant is currently absent from work for one of the reasons set out in Part Suitability, paragraph SUI 36.1. or has returned from such an absence within the month before the date of application, consideration will be based on their salary on their return to work, as stated by their sponsor.",
      "needs_review": false
    },
    {
      "metadata": {
        "source": "Immigration Rules Appendix International Sportsperson",
        "part": "Immigration Rules Appendix International Sportsperson",
        "section_id": "ISP 19.1",
        "section_title": "Decision on an application for settlement as an International Sportsperson",
        "parent_section": "ISP 19",
        "hierarchy_level": 2,
        "topic": "eligibility",
        "url": "https://www.gov.uk/guidance/immigration-rules/immigration-rules-appendix-international-sportsperson",
        "scraped_at": "2025-12-06T17:28:01.170051"
      },
      "text": "### Decision on an application for settlement as an International Sportsperson\n\nISP 19.1. If the decision maker is satisfied all the suitability and eligibility requirements for settlement as an International Sportsperson are met, the applicant will be granted settlement, otherwise the application will be refused.\n\nISP 19.2. If the application is refused, the person can apply for an Administrative Review under Appendix AR: Administrative Review.",
      "summary": "This provision applies to International Sportsperson applicants seeking settlement. It requires the decision maker to verify all suitability and eligibility criteria; failure to do so results in refusal, with applicants eligible to request an Administrative Review.",
      "augmented_text": "Document: Immigration Rules Appendix International Sportsperson\nPart: Immigration Rules Appendix International Sportsperson\nSection ID: ISP 19.1\nSection: Decision on an application for settlement as an International Sportsperson\nTopic: eligibility\n\nSummary: This provision applies to International Sportsperson applicants seeking settlement. It requires the decision maker to verify all suitability and eligibility criteria; failure to do so results in refusal, with applicants eligible to request an Administrative Review.\n\n### Decision on an application for settlement as an International Sportsperson\n\nISP 19.1. If the decision maker is satisfied all the suitability and eligibility requirements for settlement as an International Sportsperson are met, the applicant will be granted settlement, otherwise the application will be refused.\n\nISP 19.2. If the application is refused, the person can apply for an Administrative Review under Appendix AR: Administrative Review.",
      "needs_review": false
    },
    {
      "metadata": {
        "source": "Immigration Rules Appendix International Sportsperson",
        "part": "Immigration Rules Appendix International Sportsperson",
        "section_id": "SW 1.1",
        "section_title": "Dependants of an International Sportsperson",
        "parent_section": null,
        "hierarchy_level": 2,
        "topic": "dependants",
        "url": "https://www.gov.uk/guidance/immigration-rules/immigration-rules-appendix-international-sportsperson",
        "scraped_at": "2025-12-06T17:28:01.170071"
      },
      "text": "### Dependants of an International Sportsperson",
      "summary": "This provision applies to dependants of international sportspersons seeking entry or residence. Dependants must demonstrate genuine family relationships and may need to meet specific criteria, such as financial support, with exceptions for certain categories of dependants based on their relationship or circumstances.",
      "augmented_text": "Document: Immigration Rules Appendix International Sportsperson\nPart: Immigration Rules Appendix International Sportsperson\nSection ID: SW 1.1\nSection: Dependants of an International Sportsperson\nTopic: dependants\n\nSummary: This provision applies to dependants of international sportspersons seeking entry or residence. Dependants must demonstrate genuine family relationships and may need to meet specific criteria, such as financial support, with exceptions for certain categories of dependants based on their relationship or circumstances.\n\n### Dependants of an International Sportsperson",
      "needs_review": false
    },
    {
      "metadata": {
        "source": "Immigration Rules Appendix International Sportsperson",
        "part": "Immigration Rules Appendix International Sportsperson",
        "section_id": "ISP 20.1",
        "section_title": "Validity requirements for a dependent partner or dependent child of an International Sportsperson",
        "parent_section": "ISP 20",
        "hierarchy_level": 2,
        "topic": "leave-to-enter",
        "url": "https://www.gov.uk/guidance/immigration-rules/immigration-rules-appendix-international-sportsperson",
        "scraped_at": "2025-12-06T17:28:01.170111"
      },
      "text": "### Validity requirements for a dependent partner or dependent child of an International Sportsperson\n\nISP 20.1. A person applying for entry clearance or permission to stay as a dependent partner or dependent child of an International Sportsperson must apply online on the gov.uk website on the specified form as follows:\n\n| Applicant | Specified form |\n| --- | --- |\n| EEA national with a chipped passport | Either (as applicable): • Dependant partner or dependant child using the UK Immigration: ID Check app; or • the forms listed below for dependant applicants outside or inside the UK as relevant. |\n| Applicants outside the UK | Dependant partner visa Dependant child visa |\n| Applicants inside the UK | If the dependant is applying at the same time as the International Sportsperson, they can be included in the form International Sportsperson where the form allows dependants to be added. Otherwise: - Dependant partner - Dependant child |\n\n1.   ISP 20.2. An application for entry clearance or permission to stay as a partner or child of an International Sportsperson must meet all the following requirements: \n    1.   (a) any fee and Immigration Health Charge must have been paid; and\n    2.   (b) the applicant must have provided biometrics when required; and\n    3.   (c) the applicant must have provided a passport or other travel document which satisfactorily establishes their identity and nationality; and\n    4.   (d) the applicant must be applying as partner or child of a person (P) who: \n        1.   (i) has made a valid application for entry clearance or permission to stay on the International Sportsperson route that has not been decided; or\n        2.   (ii) has entry clearance or permission to stay on the International Sportsperson route; or\n        3.   (iii) is settled or has become a British citizen, providing that P had permission on the International Sportsperson route when they settled and the applicant either had permission as their partner or child at that time, or the applicant is applying as a child of P and the applicant was born in the UK before P settled.\n\nISP 20.3. An applicant applying as a dependent partner must be aged 18 or over on the date of application.\n\nISP 20.4. If applying for permission to stay, the applicant must be in the UK on the date of application.\n\n1.   ISP 20.4ZA. If applying for permission to stay, the applicant must not have, or have last been granted, permission: \n    1.   (a) as a Visitor; or\n    2.   (b) as a Short-term Student; or\n    3.   (c) as a Parent of a Child Student; or\n    4.   (d) as a Seasonal Worker; or\n    5.   (e) as a Domestic Worker in a Private Household; or\n    6.   (f) outside the Immigration Rules.\n\n1.   ISP 20.4A. An applicant who is applying for permission to stay and has, or last had, permission as a Student, must fulfil one of the Conditions A or B below on the date of application: \n    1.   (a) Condition A: the applicant must have completed the course of study for which the Confirmation of Acceptance for Studies was assigned (or a course to which ST 27.3 of Appendix Student applies); or\n    2.   (b) Condition B: the applicant must: \n        1.   (i) be studying a full-time course of study leading to the award of a PhD with a higher education provider which has a track record of compliance; and\n        2.   (ii) have completed at least 24 months of study on that course.\n\nISP 20.5. An application which does not meet all the validity requirements for a partner or child of an International Sportsperson may be rejected as invalid and not considered.",
      "summary": "This provision applies to dependents (partners or children) of International Sportspersons seeking entry clearance or permission to stay. Dependents must apply online using specified forms, pay applicable fees and health charges, provide biometrics, and submit valid travel documentation. Exceptions apply for applicants inside the UK applying simultaneously with the sportsperson or using specific digital verification methods.",
      "augmented_text": "Document: Immigration Rules Appendix International Sportsperson\nPart: Immigration Rules Appendix International Sportsperson\nSection ID: ISP 20.1\nSection: Validity requirements for a dependent partner or dependent child of an International Sportsperson\nTopic: leave-to-enter\n\nSummary: This provision applies to dependents (partners or children) of International Sportspersons seeking entry clearance or permission to stay. Dependents must apply online using specified forms, pay applicable fees and health charges, provide biometrics, and submit valid travel documentation. Exceptions apply for applicants inside the UK applying simultaneously with the sportsperson or using specific digital verification methods.\n\n### Validity requirements for a dependent partner or dependent child of an International Sportsperson\n\nISP 20.1. A person applying for entry clearance or permission to stay as a dependent partner or dependent child of an International Sportsperson must apply online on the gov.uk website on the specified form as follows:\n\n| Applicant | Specified form |\n| --- | --- |\n| EEA national with a chipped passport | Either (as applicable): • Dependant partner or dependant child using the UK Immigration: ID Check app; or • the forms listed below for dependant applicants outside or inside the UK as relevant. |\n| Applicants outside the UK | Dependant partner visa Dependant child visa |\n| Applicants inside the UK | If the dependant is applying at the same time as the International Sportsperson, they can be included in the form International Sportsperson where the form allows dependants to be added. Otherwise: - Dependant partner - Dependant child |\n\n1.   ISP 20.2. An application for entry clearance or permission to stay as a partner or child of an International Sportsperson must meet all the following requirements: \n    1.   (a) any fee and Immigration Health Charge must have been paid; and\n    2.   (b) the applicant must have provided biometrics when required; and\n    3.   (c) the applicant must have provided a passport or other travel document which satisfactorily establishes their identity and nationality; and\n    4.   (d) the applicant must be applying as partner or child of a person (P) who: \n        1.   (i) has made a valid application for entry clearance or permission to stay on the International Sportsperson route that has not been decided; or\n        2.   (ii) has entry clearance or permission to stay on the International Sportsperson route; or\n        3.   (iii) is settled or has become a British citizen, providing that P had permission on the International Sportsperson route when they settled and the applicant either had permission as their partner or child at that time, or the applicant is applying as a child of P and the applicant was born in the UK before P settled.\n\nISP 20.3. An applicant applying as a dependent partner must be aged 18 or over on the date of application.\n\nISP 20.4. If applying for permission to stay, the applicant must be in the UK on the date of application.\n\n1.   ISP 20.4ZA. If applying for permission to stay, the applicant must not have, or have last been granted, permission: \n    1.   (a) as a Visitor; or\n    2.   (b) as a Short-term Student; or\n    3.   (c) as a Parent of a Child Student; or\n    4.   (d) as a Seasonal Worker; or\n    5.   (e) as a Domestic Worker in a Private Household; or\n    6.   (f) outside the Immigration Rules.\n\n1.   ISP 20.4A. An applicant who is applying for permission to stay and has, or last had, permission as a Student, must fulfil one of the Conditions A or B below on the date of application: \n    1.   (a) Condition A: the applicant must have completed the course of study for which the Confirmation of Acceptance for Studies was assigned (or a course to which ST 27.3 of Appendix Student applies); or\n    2.   (b) Condition B: the applicant must: \n        1.   (i) be studying a full-time course of study leading to the award of a PhD with a higher education provider which has a track record of compliance; and\n        2.   (ii) have completed at least 24 months of study on that course.\n\nISP 20.5. An application which does not meet all the validity requirements for a partner or child of an International Sportsperson may be rejected as invalid and not considered.",
      "needs_review": false
    },
    {
      "metadata": {
        "source": "Immigration Rules Appendix International Sportsperson",
        "part": "Immigration Rules Appendix International Sportsperson",
        "section_id": "ISP 21.1",
        "section_title": "Suitability requirements for a dependent partner or dependent child of an International Sportsperson",
        "parent_section": "ISP 21",
        "hierarchy_level": 2,
        "topic": "suitability",
        "url": "https://www.gov.uk/guidance/immigration-rules/immigration-rules-appendix-international-sportsperson",
        "scraped_at": "2025-12-06T17:28:01.170132"
      },
      "text": "### Suitability requirements for a dependent partner or dependent child of an International Sportsperson\n\nISP 21.1. The applicant must not fall for refusal under Part Suitability.\n\n1.   ISP 21.2. If applying for permission to stay the applicant must not be: \n    1.   (a) in breach of immigration laws, except that where the Exceptions for overstayers section of Part Suitability applies, that period of overstaying will be disregarded; or\n    2.   (b) on immigration bail.",
      "summary": "This provision applies to dependent partners and children of International Sportspersons. They must be suitable, not breach immigration laws (unless overstaying exceptions apply), and not be on immigration bail to qualify for permission to stay.",
      "augmented_text": "Document: Immigration Rules Appendix International Sportsperson\nPart: Immigration Rules Appendix International Sportsperson\nSection ID: ISP 21.1\nSection: Suitability requirements for a dependent partner or dependent child of an International Sportsperson\nTopic: suitability\n\nSummary: This provision applies to dependent partners and children of International Sportspersons. They must be suitable, not breach immigration laws (unless overstaying exceptions apply), and not be on immigration bail to qualify for permission to stay.\n\n### Suitability requirements for a dependent partner or dependent child of an International Sportsperson\n\nISP 21.1. The applicant must not fall for refusal under Part Suitability.\n\n1.   ISP 21.2. If applying for permission to stay the applicant must not be: \n    1.   (a) in breach of immigration laws, except that where the Exceptions for overstayers section of Part Suitability applies, that period of overstaying will be disregarded; or\n    2.   (b) on immigration bail.",
      "needs_review": false
    },
    {
      "metadata": {
        "source": "Immigration Rules Appendix International Sportsperson",
        "part": "Immigration Rules Appendix International Sportsperson",
        "section_id": "Eligibility requirements for a dependent partner or dependent child of an International Sportsperson",
        "section_title": "Eligibility requirements for a dependent partner or dependent child of an International Sportsperson",
        "parent_section": null,
        "hierarchy_level": 3,
        "topic": "eligibility",
        "url": "https://www.gov.uk/guidance/immigration-rules/immigration-rules-appendix-international-sportsperson",
        "scraped_at": "2025-12-06T17:28:01.170142"
      },
      "text": "### Eligibility requirements for a dependent partner or dependent child of an International Sportsperson",
      "summary": "This provision applies to dependent partners or children of International Sportspersons. They must demonstrate genuine dependency and meet specific relationship and financial requirements; exceptions or thresholds are not specified here.",
      "augmented_text": "Document: Immigration Rules Appendix International Sportsperson\nPart: Immigration Rules Appendix International Sportsperson\nSection ID: Eligibility requirements for a dependent partner or dependent child of an International Sportsperson\nSection: Eligibility requirements for a dependent partner or dependent child of an International Sportsperson\nTopic: eligibility\n\nSummary: This provision applies to dependent partners or children of International Sportspersons. They must demonstrate genuine dependency and meet specific relationship and financial requirements; exceptions or thresholds are not specified here.\n\n### Eligibility requirements for a dependent partner or dependent child of an International Sportsperson",
      "needs_review": false
    },
    {
      "metadata": {
        "source": "Immigration Rules Appendix International Sportsperson",
        "part": "Immigration Rules Appendix International Sportsperson",
        "section_id": "ISP 22.1",
        "section_title": "Entry requirement for a dependent partner or dependent child of an International Sportsperson",
        "parent_section": "ISP 22",
        "hierarchy_level": 2,
        "topic": "leave-to-enter",
        "url": "https://www.gov.uk/guidance/immigration-rules/immigration-rules-appendix-international-sportsperson",
        "scraped_at": "2025-12-06T17:28:01.170167"
      },
      "text": "### Entry requirement for a dependent partner or dependent child of an International Sportsperson\n\nISP 22.1. A person seeking to come to the UK as a dependent partner or dependent child of an International Sportsperson must apply for and obtain entry clearance as a dependent partner or dependent child of an International Sportsperson before they arrive in the UK.\n\nISP 22.2. A person applying for entry clearance as the partner or child of an International Sportsperson must, if Appendix Tuberculosis applies, provide a valid medical certificate confirming that they have undergone screening for active pulmonary tuberculosis and that this tuberculosis is not present in them.",
      "summary": "Dependents of International Sportspersons must apply for and obtain entry clearance before arriving in the UK. If applicable under Appendix Tuberculosis, they must also provide a medical certificate confirming they are free from active pulmonary tuberculosis.",
      "augmented_text": "Document: Immigration Rules Appendix International Sportsperson\nPart: Immigration Rules Appendix International Sportsperson\nSection ID: ISP 22.1\nSection: Entry requirement for a dependent partner or dependent child of an International Sportsperson\nTopic: leave-to-enter\n\nSummary: Dependents of International Sportspersons must apply for and obtain entry clearance before arriving in the UK. If applicable under Appendix Tuberculosis, they must also provide a medical certificate confirming they are free from active pulmonary tuberculosis.\n\n### Entry requirement for a dependent partner or dependent child of an International Sportsperson\n\nISP 22.1. A person seeking to come to the UK as a dependent partner or dependent child of an International Sportsperson must apply for and obtain entry clearance as a dependent partner or dependent child of an International Sportsperson before they arrive in the UK.\n\nISP 22.2. A person applying for entry clearance as the partner or child of an International Sportsperson must, if Appendix Tuberculosis applies, provide a valid medical certificate confirming that they have undergone screening for active pulmonary tuberculosis and that this tuberculosis is not present in them.",
      "needs_review": false
    },
    {
      "metadata": {
        "source": "Immigration Rules Appendix International Sportsperson",
        "part": "Immigration Rules Appendix International Sportsperson",
        "section_id": "1",
        "section_title": "Relationship requirement for a dependent partner of an International Sportsperson",
        "parent_section": null,
        "hierarchy_level": 1,
        "topic": "family",
        "url": "https://www.gov.uk/guidance/immigration-rules/immigration-rules-appendix-international-sportsperson",
        "scraped_at": "2025-12-06T17:28:01.170197"
      },
      "text": "### Relationship requirement for a dependent partner of an International Sportsperson\n\n1.   ISP 23.1. The applicant must be the partner of a person (P) where one of the following applies: \n    1.   (a) P has permission on the International Sportsperson route; or\n    2.   (b) P is, at the same time, applying for (and is granted) entry clearance or permission on the International Sportsperson route; or\n    3.   (c) P is settled or has become a British citizen, providing P had permission on the International Sportsperson route when they settled and the applicant had permission as P’s partner at that time.\n\nISP 23.2. The requirements of Appendix Relationship with Partner must be met.\n\nISP 23.3. DELETED.\n\nISP 23.4. DELETED.",
      "summary": "This provision applies to dependents of International Sportsperson route applicants. The dependent partner must lawfully be the partner of a person with permission, approved application, or settled status on this route, meeting specific relationship criteria, with certain conditions regarding permission status at settlement or application.",
      "augmented_text": "Document: Immigration Rules Appendix International Sportsperson\nPart: Immigration Rules Appendix International Sportsperson\nSection ID: 1\nSection: Relationship requirement for a dependent partner of an International Sportsperson\nTopic: family\n\nSummary: This provision applies to dependents of International Sportsperson route applicants. The dependent partner must lawfully be the partner of a person with permission, approved application, or settled status on this route, meeting specific relationship criteria, with certain conditions regarding permission status at settlement or application.\n\n### Relationship requirement for a dependent partner of an International Sportsperson\n\n1.   ISP 23.1. The applicant must be the partner of a person (P) where one of the following applies: \n    1.   (a) P has permission on the International Sportsperson route; or\n    2.   (b) P is, at the same time, applying for (and is granted) entry clearance or permission on the International Sportsperson route; or\n    3.   (c) P is settled or has become a British citizen, providing P had permission on the International Sportsperson route when they settled and the applicant had permission as P’s partner at that time.\n\nISP 23.2. The requirements of Appendix Relationship with Partner must be met.\n\nISP 23.3. DELETED.\n\nISP 23.4. DELETED.",
      "needs_review": false
    },
    {
      "metadata": {
        "source": "Immigration Rules Appendix International Sportsperson",
        "part": "Immigration Rules Appendix International Sportsperson",
        "section_id": "1",
        "section_title": "Relationship requirement for a dependent child of an International Sportsperson",
        "parent_section": null,
        "hierarchy_level": 1,
        "topic": "family",
        "url": "https://www.gov.uk/guidance/immigration-rules/immigration-rules-appendix-international-sportsperson",
        "scraped_at": "2025-12-06T17:28:01.170222"
      },
      "text": "### Relationship requirement for a dependent child of an International Sportsperson\n\n1.   ISP 24.1. DELETED.\n\n1.   ISP 24.2. DELETED.\n\nISP 24.3. DELETED.",
      "summary": "This provision applies to dependent children of International Sportspersons applying for entry or stay, requiring proof of genuine parent-child relationship. There are no specified exceptions or thresholds provided in this section.",
      "augmented_text": "Document: Immigration Rules Appendix International Sportsperson\nPart: Immigration Rules Appendix International Sportsperson\nSection ID: 1\nSection: Relationship requirement for a dependent child of an International Sportsperson\nTopic: family\n\nSummary: This provision applies to dependent children of International Sportspersons applying for entry or stay, requiring proof of genuine parent-child relationship. There are no specified exceptions or thresholds provided in this section.\n\n### Relationship requirement for a dependent child of an International Sportsperson\n\n1.   ISP 24.1. DELETED.\n\n1.   ISP 24.2. DELETED.\n\nISP 24.3. DELETED.",
      "needs_review": false
    },
    {
      "metadata": {
        "source": "Immigration Rules Appendix International Sportsperson",
        "part": "Immigration Rules Appendix International Sportsperson",
        "section_id": "ISP 25.1",
        "section_title": "Care requirement for a dependent child of an International Sportsperson",
        "parent_section": "ISP 25",
        "hierarchy_level": 2,
        "topic": "family",
        "url": "https://www.gov.uk/guidance/immigration-rules/immigration-rules-appendix-international-sportsperson",
        "scraped_at": "2025-12-06T17:28:01.170244"
      },
      "text": "### Care requirement for a dependent child of an International Sportsperson\n\nISP 25.1. DELETED.",
      "summary": "This provision applies to dependent children of international sportspersons. It requires the sportsperson to ensure the child receives proper care, with specific conditions or exceptions outlined in the full rules.",
      "augmented_text": "Document: Immigration Rules Appendix International Sportsperson\nPart: Immigration Rules Appendix International Sportsperson\nSection ID: ISP 25.1\nSection: Care requirement for a dependent child of an International Sportsperson\nTopic: family\n\nSummary: This provision applies to dependent children of international sportspersons. It requires the sportsperson to ensure the child receives proper care, with specific conditions or exceptions outlined in the full rules.\n\n### Care requirement for a dependent child of an International Sportsperson\n\nISP 25.1. DELETED.",
      "needs_review": false
    },
    {
      "metadata": {
        "source": "Immigration Rules Appendix International Sportsperson",
        "part": "Immigration Rules Appendix International Sportsperson",
        "section_id": "ISP 26.1",
        "section_title": "Age requirement for a dependent child of an International Sportsperson",
        "parent_section": "ISP 26",
        "hierarchy_level": 2,
        "topic": "family",
        "url": "https://www.gov.uk/guidance/immigration-rules/immigration-rules-appendix-international-sportsperson",
        "scraped_at": "2025-12-06T17:28:01.170267"
      },
      "text": "### Age requirement for a dependent child of an International Sportsperson\n\nISP 26.1. DELETED.\n\nISP 26.2. DELETED.",
      "summary": "This provision applies to dependent children of International Sportspersons. It requires that dependents be under 18 years of age to qualify; there are no specified exceptions or thresholds beyond this age limit.",
      "augmented_text": "Document: Immigration Rules Appendix International Sportsperson\nPart: Immigration Rules Appendix International Sportsperson\nSection ID: ISP 26.1\nSection: Age requirement for a dependent child of an International Sportsperson\nTopic: family\n\nSummary: This provision applies to dependent children of International Sportspersons. It requires that dependents be under 18 years of age to qualify; there are no specified exceptions or thresholds beyond this age limit.\n\n### Age requirement for a dependent child of an International Sportsperson\n\nISP 26.1. DELETED.\n\nISP 26.2. DELETED.",
      "needs_review": false
    },
    {
      "metadata": {
        "source": "Immigration Rules Appendix International Sportsperson",
        "part": "Immigration Rules Appendix International Sportsperson",
        "section_id": "1",
        "section_title": "Requirements for a dependent child of an International Sportsperson",
        "parent_section": null,
        "hierarchy_level": 1,
        "topic": "leave-to-enter",
        "url": "https://www.gov.uk/guidance/immigration-rules/immigration-rules-appendix-international-sportsperson",
        "scraped_at": "2025-12-06T17:28:01.170292"
      },
      "text": "### Requirements for a dependent child of an International Sportsperson\n\n1.   ISP 26A.1. The applicant must meet the following requirements for a dependent child in Appendix Children: \n    1.   (a) relationship requirement: entry clearance and permission to stay; and\n    2.   (b) care requirement; and\n    3.   (c) age and independent life requirement.",
      "summary": "Dependent children of International Sportspersons must meet relationship, care, and age/independent life requirements for entry clearance and permission to stay, as outlined in Appendix Children. Eligible children must satisfy these criteria without specific exceptions noted in this section.",
      "augmented_text": "Document: Immigration Rules Appendix International Sportsperson\nPart: Immigration Rules Appendix International Sportsperson\nSection ID: 1\nSection: Requirements for a dependent child of an International Sportsperson\nTopic: leave-to-enter\n\nSummary: Dependent children of International Sportspersons must meet relationship, care, and age/independent life requirements for entry clearance and permission to stay, as outlined in Appendix Children. Eligible children must satisfy these criteria without specific exceptions noted in this section.\n\n### Requirements for a dependent child of an International Sportsperson\n\n1.   ISP 26A.1. The applicant must meet the following requirements for a dependent child in Appendix Children: \n    1.   (a) relationship requirement: entry clearance and permission to stay; and\n    2.   (b) care requirement; and\n    3.   (c) age and independent life requirement.",
      "needs_review": false
    },
    {
      "metadata": {
        "source": "Immigration Rules Appendix International Sportsperson",
        "part": "Immigration Rules Appendix International Sportsperson",
        "section_id": "ISP 27.1",
        "section_title": "Financial requirement for a dependent partner or dependent child of an International Sportsperson",
        "parent_section": "ISP 27",
        "hierarchy_level": 2,
        "topic": "financial",
        "url": "https://www.gov.uk/guidance/immigration-rules/immigration-rules-appendix-international-sportsperson",
        "scraped_at": "2025-12-06T17:28:01.170311"
      },
      "text": "### Financial requirement for a dependent partner or dependent child of an International Sportsperson\n\nISP 27.1. If the applicant is applying for permission to stay and has been living in the UK with permission for 12 months or longer on the date of application, they will meet the financial requirement and do not need to show funds.\n\n1.   ISP 27.2. If the applicant is applying for entry clearance, or has been in the UK for less than 12 months on the date of application, either: \n    1.   (a) funds of at least the amount required in ISP 27.3. must be held collectively by one or more of the following: \n        1.   i) the applicant; and\n        2.   ii) the International Sportsperson (P); and\n        3.   iii) if the applicant is applying as a dependent child, their parent who is lawfully present in the UK or being granted entry clearance, or permission to stay, at the same time; or\n\n    2.   (b) the International Sportsperson’s A-rated sponsor must certify that they will, if necessary, maintain and accommodate the dependent partner and/or any dependent child as well as the International Sportsperson, up to the end of the first month of each of their grants of permission, to at least the amounts required in ISP 27.3.\n\n1.   ISP 27.3. The funds required are: \n    1.   (a) £285 for a dependent partner in the UK, or applying for entry clearance; and\n    2.   (b) £315 for the first dependent child in the UK, or applying for entry clearance; and\n    3.   (c) £200 for any other dependent child in the UK, or applying for entry clearance.\n\nISP 27.4. If ISP 27.2.(a) applies, the funds held for the applicant must be held in addition to any funds required for the International Sportsperson to meet the financial requirement and any other dependants in the UK or applying at the same time.\n\nISP 27.5. If ISP 27.2.(a) applies, the funds must have been held for a 28-day period and as specified in Appendix Finance.",
      "summary": "Dependent partners and children of International Sportspersons must meet financial requirements unless residing in the UK with permission for over 12 months. For shorter stays, applicants must hold specified funds (£285 for a partner, £315 for a child, or £200 for others) or an A-rated sponsor's certification to cover living costs until the first month of permission.",
      "augmented_text": "Document: Immigration Rules Appendix International Sportsperson\nPart: Immigration Rules Appendix International Sportsperson\nSection ID: ISP 27.1\nSection: Financial requirement for a dependent partner or dependent child of an International Sportsperson\nTopic: financial\n\nSummary: Dependent partners and children of International Sportspersons must meet financial requirements unless residing in the UK with permission for over 12 months. For shorter stays, applicants must hold specified funds (£285 for a partner, £315 for a child, or £200 for others) or an A-rated sponsor's certification to cover living costs until the first month of permission.\n\n### Financial requirement for a dependent partner or dependent child of an International Sportsperson\n\nISP 27.1. If the applicant is applying for permission to stay and has been living in the UK with permission for 12 months or longer on the date of application, they will meet the financial requirement and do not need to show funds.\n\n1.   ISP 27.2. If the applicant is applying for entry clearance, or has been in the UK for less than 12 months on the date of application, either: \n    1.   (a) funds of at least the amount required in ISP 27.3. must be held collectively by one or more of the following: \n        1.   i) the applicant; and\n        2.   ii) the International Sportsperson (P); and\n        3.   iii) if the applicant is applying as a dependent child, their parent who is lawfully present in the UK or being granted entry clearance, or permission to stay, at the same time; or\n\n    2.   (b) the International Sportsperson’s A-rated sponsor must certify that they will, if necessary, maintain and accommodate the dependent partner and/or any dependent child as well as the International Sportsperson, up to the end of the first month of each of their grants of permission, to at least the amounts required in ISP 27.3.\n\n1.   ISP 27.3. The funds required are: \n    1.   (a) £285 for a dependent partner in the UK, or applying for entry clearance; and\n    2.   (b) £315 for the first dependent child in the UK, or applying for entry clearance; and\n    3.   (c) £200 for any other dependent child in the UK, or applying for entry clearance.\n\nISP 27.4. If ISP 27.2.(a) applies, the funds held for the applicant must be held in addition to any funds required for the International Sportsperson to meet the financial requirement and any other dependants in the UK or applying at the same time.\n\nISP 27.5. If ISP 27.2.(a) applies, the funds must have been held for a 28-day period and as specified in Appendix Finance.",
      "needs_review": false
    },
    {
      "metadata": {
        "source": "Immigration Rules Appendix International Sportsperson",
        "part": "Immigration Rules Appendix International Sportsperson",
        "section_id": "ISP 28.1",
        "section_title": "Decision on an application as a dependent partner or dependent child of an International Sportsperson",
        "parent_section": "ISP 28",
        "hierarchy_level": 2,
        "topic": "eligibility",
        "url": "https://www.gov.uk/guidance/immigration-rules/immigration-rules-appendix-international-sportsperson",
        "scraped_at": "2025-12-06T17:28:01.170324"
      },
      "text": "### Decision on an application as a dependent partner or dependent child of an International Sportsperson\n\nISP 28.1. If the decision maker is satisfied that all the suitability and eligibility requirements for a dependent partner or dependent child of an International Sportsperson are met, the application will be granted, otherwise the application will be refused.\n\nISP 28.2. If the application is refused, the person can apply for an Administrative Review under Appendix AR: Administrative Review.",
      "summary": "This provision applies to dependent partners and children of International Sportspersons. Applications are granted if all suitability and eligibility criteria are met; otherwise, they are refused, with the option to request an Administrative Review.",
      "augmented_text": "Document: Immigration Rules Appendix International Sportsperson\nPart: Immigration Rules Appendix International Sportsperson\nSection ID: ISP 28.1\nSection: Decision on an application as a dependent partner or dependent child of an International Sportsperson\nTopic: eligibility\n\nSummary: This provision applies to dependent partners and children of International Sportspersons. Applications are granted if all suitability and eligibility criteria are met; otherwise, they are refused, with the option to request an Administrative Review.\n\n### Decision on an application as a dependent partner or dependent child of an International Sportsperson\n\nISP 28.1. If the decision maker is satisfied that all the suitability and eligibility requirements for a dependent partner or dependent child of an International Sportsperson are met, the application will be granted, otherwise the application will be refused.\n\nISP 28.2. If the application is refused, the person can apply for an Administrative Review under Appendix AR: Administrative Review.",
      "needs_review": false
    },
    {
      "metadata": {
        "source": "Immigration Rules Appendix International Sportsperson",
        "part": "Immigration Rules Appendix International Sportsperson",
        "section_id": "1",
        "section_title": "Period of grant for a dependent partner or dependent child of an International Sportsperson",
        "parent_section": null,
        "hierarchy_level": 1,
        "topic": "family",
        "url": "https://www.gov.uk/guidance/immigration-rules/immigration-rules-appendix-international-sportsperson",
        "scraped_at": "2025-12-06T17:28:01.170358"
      },
      "text": "### Period of grant for a dependent partner or dependent child of an International Sportsperson\n\n1.   ISP 29.1. A partner will be granted: \n    1.   (a) permission which ends on the same date as their partner’s permission as an International Sportsperson; or\n    2.   (b) three years’ permission if the International Sportsperson was (or is being) granted settlement as an International Sportsperson.\n\nISP 29.2. A child will be granted permission which ends on the same date as whichever of their parents’ permission ends first, unless both parents have (or are being granted) settlement or British citizenship, in which case the child will be granted permission for three years.",
      "summary": "Dependent partners and children of International Sportspersons are granted permission aligned with the sportsperson's permission, up to three years if the sportsperson has or is applying for settlement; exceptions apply if both parents have settled status or British citizenship.",
      "augmented_text": "Document: Immigration Rules Appendix International Sportsperson\nPart: Immigration Rules Appendix International Sportsperson\nSection ID: 1\nSection: Period of grant for a dependent partner or dependent child of an International Sportsperson\nTopic: family\n\nSummary: Dependent partners and children of International Sportspersons are granted permission aligned with the sportsperson's permission, up to three years if the sportsperson has or is applying for settlement; exceptions apply if both parents have settled status or British citizenship.\n\n### Period of grant for a dependent partner or dependent child of an International Sportsperson\n\n1.   ISP 29.1. A partner will be granted: \n    1.   (a) permission which ends on the same date as their partner’s permission as an International Sportsperson; or\n    2.   (b) three years’ permission if the International Sportsperson was (or is being) granted settlement as an International Sportsperson.\n\nISP 29.2. A child will be granted permission which ends on the same date as whichever of their parents’ permission ends first, unless both parents have (or are being granted) settlement or British citizenship, in which case the child will be granted permission for three years.",
      "needs_review": false
    },
    {
      "metadata": {
        "source": "Immigration Rules Appendix International Sportsperson",
        "part": "Immigration Rules Appendix International Sportsperson",
        "section_id": "1",
        "section_title": "Conditions of grant for a dependent partner and dependent child of an International Sportsperson",
        "parent_section": null,
        "hierarchy_level": 1,
        "topic": "financial",
        "url": "https://www.gov.uk/guidance/immigration-rules/immigration-rules-appendix-international-sportsperson",
        "scraped_at": "2025-12-06T17:28:01.170374"
      },
      "text": "### Conditions of grant for a dependent partner and dependent child of an International Sportsperson\n\n1.   ISP 29.3. The grant will be subject to all the following conditions: \n    1.   (a) no access to public funds; and\n    2.   (b) work (including self-employment and voluntary work) is permitted, except as a professional sportsperson (including as a sports coach); and\n    3.   (c) study is permitted, subject to the ATAS condition in Appendix ATAS if the applicant is over the age of 18.\n    4.   (d) DELETED.",
      "summary": "Dependent partners and children of an International Sportsperson must not access public funds, can work (excluding as a professional sportsperson), and may study (with ATAS if over 18). These conditions apply unless otherwise specified.",
      "augmented_text": "Document: Immigration Rules Appendix International Sportsperson\nPart: Immigration Rules Appendix International Sportsperson\nSection ID: 1\nSection: Conditions of grant for a dependent partner and dependent child of an International Sportsperson\nTopic: financial\n\nSummary: Dependent partners and children of an International Sportsperson must not access public funds, can work (excluding as a professional sportsperson), and may study (with ATAS if over 18). These conditions apply unless otherwise specified.\n\n### Conditions of grant for a dependent partner and dependent child of an International Sportsperson\n\n1.   ISP 29.3. The grant will be subject to all the following conditions: \n    1.   (a) no access to public funds; and\n    2.   (b) work (including self-employment and voluntary work) is permitted, except as a professional sportsperson (including as a sports coach); and\n    3.   (c) study is permitted, subject to the ATAS condition in Appendix ATAS if the applicant is over the age of 18.\n    4.   (d) DELETED.",
      "needs_review": false
    },
    {
      "metadata": {
        "source": "Immigration Rules Appendix International Sportsperson",
        "part": "Immigration Rules Appendix International Sportsperson",
        "section_id": "Settlement as a dependent partner or dependent child of an International Sportsperson",
        "section_title": "Settlement as a dependent partner or dependent child of an International Sportsperson",
        "parent_section": null,
        "hierarchy_level": 2,
        "topic": "settlement",
        "url": "https://www.gov.uk/guidance/immigration-rules/immigration-rules-appendix-international-sportsperson",
        "scraped_at": "2025-12-06T17:28:01.170392"
      },
      "text": "### Settlement as a dependent partner or dependent child of an International Sportsperson",
      "summary": "This provision applies to dependents (partners or children) of international sportspersons seeking settlement. It requires them to meet eligibility criteria, including dependency and relationship requirements, with specific conditions for sportspersons' status; exceptions or thresholds are not specified.",
      "augmented_text": "Document: Immigration Rules Appendix International Sportsperson\nPart: Immigration Rules Appendix International Sportsperson\nSection ID: Settlement as a dependent partner or dependent child of an International Sportsperson\nSection: Settlement as a dependent partner or dependent child of an International Sportsperson\nTopic: settlement\n\nSummary: This provision applies to dependents (partners or children) of international sportspersons seeking settlement. It requires them to meet eligibility criteria, including dependency and relationship requirements, with specific conditions for sportspersons' status; exceptions or thresholds are not specified.\n\n### Settlement as a dependent partner or dependent child of an International Sportsperson",
      "needs_review": false
    },
    {
      "metadata": {
        "source": "Immigration Rules Appendix International Sportsperson",
        "part": "Immigration Rules Appendix International Sportsperson",
        "section_id": "ISP 30.1",
        "section_title": "Validity requirements for settlement as a dependent partner or dependent child of International Sportsperson",
        "parent_section": "ISP 30",
        "hierarchy_level": 2,
        "topic": "settlement",
        "url": "https://www.gov.uk/guidance/immigration-rules/immigration-rules-appendix-international-sportsperson",
        "scraped_at": "2025-12-06T17:28:01.170431"
      },
      "text": "### Validity requirements for settlement as a dependent partner or dependent child of International Sportsperson\n\nISP 30.1. A person applying for settlement as a dependent partner or dependent child of an International Sportsperson must apply online on the gov.uk website on the specified form, “Settle in the UK in various immigration categories: form SET(O)”.\n\n1.   ISP 30.2. An application for settlement as a partner or child of an International Sportsperson must meet all the following requirements: \n    1.   (a) any fee must have been paid; and\n    2.   (b) the applicant must have provided biometrics when required; and\n    3.   (c) the applicant must have provided either a passport or other travel document which satisfactorily establishes their identity and nationality; and\n    4.   (d) the applicant must be in the UK on the date of application; and\n    5.   (e) the applicant must be applying as a partner or child of a person (P) who: \n        1.   (i) has made a valid application for settlement in the UK as an International Sportsperson and that application has not been decided; or\n        2.   (ii) is settled or has become a British citizen, providing they had permission as an International Sportsperson when they settled and the applicant either had permission as their partner or child at that time or is applying as a child of P and was born in the UK before P settled.\n\nISP 30.3. An application which does not meet the validity requirements for settlement as a partner or child of an International Sportsperson may be rejected as invalid and not considered.",
      "summary": "Applicants seeking settlement as a dependent partner or child of an International Sportsperson must apply online, pay fees, provide biometrics, and submit identity documents. They must be in the UK on the application date and be linked to a Sportsperson in the process of settlement or already settled or British citizen, with specific permissions at the time.",
      "augmented_text": "Document: Immigration Rules Appendix International Sportsperson\nPart: Immigration Rules Appendix International Sportsperson\nSection ID: ISP 30.1\nSection: Validity requirements for settlement as a dependent partner or dependent child of International Sportsperson\nTopic: settlement\n\nSummary: Applicants seeking settlement as a dependent partner or child of an International Sportsperson must apply online, pay fees, provide biometrics, and submit identity documents. They must be in the UK on the application date and be linked to a Sportsperson in the process of settlement or already settled or British citizen, with specific permissions at the time.\n\n### Validity requirements for settlement as a dependent partner or dependent child of International Sportsperson\n\nISP 30.1. A person applying for settlement as a dependent partner or dependent child of an International Sportsperson must apply online on the gov.uk website on the specified form, “Settle in the UK in various immigration categories: form SET(O)”.\n\n1.   ISP 30.2. An application for settlement as a partner or child of an International Sportsperson must meet all the following requirements: \n    1.   (a) any fee must have been paid; and\n    2.   (b) the applicant must have provided biometrics when required; and\n    3.   (c) the applicant must have provided either a passport or other travel document which satisfactorily establishes their identity and nationality; and\n    4.   (d) the applicant must be in the UK on the date of application; and\n    5.   (e) the applicant must be applying as a partner or child of a person (P) who: \n        1.   (i) has made a valid application for settlement in the UK as an International Sportsperson and that application has not been decided; or\n        2.   (ii) is settled or has become a British citizen, providing they had permission as an International Sportsperson when they settled and the applicant either had permission as their partner or child at that time or is applying as a child of P and was born in the UK before P settled.\n\nISP 30.3. An application which does not meet the validity requirements for settlement as a partner or child of an International Sportsperson may be rejected as invalid and not considered.",
      "needs_review": false
    },
    {
      "metadata": {
        "source": "Immigration Rules Appendix International Sportsperson",
        "part": "Immigration Rules Appendix International Sportsperson",
        "section_id": "ISP 31.1",
        "section_title": "Suitability requirements for settlement as a dependent partner or dependent child of an International Sportsperson",
        "parent_section": "ISP 31",
        "hierarchy_level": 2,
        "topic": "suitability",
        "url": "https://www.gov.uk/guidance/immigration-rules/immigration-rules-appendix-international-sportsperson",
        "scraped_at": "2025-12-06T17:28:01.170453"
      },
      "text": "### Suitability requirements for settlement as a dependent partner or dependent child of an International Sportsperson\n\nISP 31.1. The applicant must not fall for refusal under Part Suitability.\n\n1.   ISP 31.2. The applicant must not be: \n    1.   (a) in breach of immigration laws, except that where the Exceptions for overstayers section of Part Suitability applies, that period of overstaying will be disregarded; or\n    2.   (b) on immigration bail.",
      "summary": "Dependents of International Sportspersons must meet suitability criteria, including not breaching immigration laws (unless overstaying qualifies for an exception) and not being on immigration bail, to qualify for settlement.",
      "augmented_text": "Document: Immigration Rules Appendix International Sportsperson\nPart: Immigration Rules Appendix International Sportsperson\nSection ID: ISP 31.1\nSection: Suitability requirements for settlement as a dependent partner or dependent child of an International Sportsperson\nTopic: suitability\n\nSummary: Dependents of International Sportspersons must meet suitability criteria, including not breaching immigration laws (unless overstaying qualifies for an exception) and not being on immigration bail, to qualify for settlement.\n\n### Suitability requirements for settlement as a dependent partner or dependent child of an International Sportsperson\n\nISP 31.1. The applicant must not fall for refusal under Part Suitability.\n\n1.   ISP 31.2. The applicant must not be: \n    1.   (a) in breach of immigration laws, except that where the Exceptions for overstayers section of Part Suitability applies, that period of overstaying will be disregarded; or\n    2.   (b) on immigration bail.",
      "needs_review": false
    },
    {
      "metadata": {
        "source": "Immigration Rules Appendix International Sportsperson",
        "part": "Immigration Rules Appendix International Sportsperson",
        "section_id": "Eligibility requirements for settlement as a dependent partner or dependent child of an International Sportsperson",
        "section_title": "Eligibility requirements for settlement as a dependent partner or dependent child of an International Sportsperson",
        "parent_section": null,
        "hierarchy_level": 3,
        "topic": "eligibility",
        "url": "https://www.gov.uk/guidance/immigration-rules/immigration-rules-appendix-international-sportsperson",
        "scraped_at": "2025-12-06T17:28:01.170462"
      },
      "text": "### Eligibility requirements for settlement as a dependent partner or dependent child of an International Sportsperson",
      "summary": "This provision applies to dependent partners or children of international sportspersons seeking settlement. It requires demonstrating their eligibility, including dependency or familial relationship, with specific conditions and exceptions outlined for settlement approval.",
      "augmented_text": "Document: Immigration Rules Appendix International Sportsperson\nPart: Immigration Rules Appendix International Sportsperson\nSection ID: Eligibility requirements for settlement as a dependent partner or dependent child of an International Sportsperson\nSection: Eligibility requirements for settlement as a dependent partner or dependent child of an International Sportsperson\nTopic: eligibility\n\nSummary: This provision applies to dependent partners or children of international sportspersons seeking settlement. It requires demonstrating their eligibility, including dependency or familial relationship, with specific conditions and exceptions outlined for settlement approval.\n\n### Eligibility requirements for settlement as a dependent partner or dependent child of an International Sportsperson",
      "needs_review": false
    },
    {
      "metadata": {
        "source": "Immigration Rules Appendix International Sportsperson",
        "part": "Immigration Rules Appendix International Sportsperson",
        "section_id": "1",
        "section_title": "Relationship requirement for settlement as a dependent partner or dependent child of an International Sportsperson",
        "parent_section": null,
        "hierarchy_level": 1,
        "topic": "settlement",
        "url": "https://www.gov.uk/guidance/immigration-rules/immigration-rules-appendix-international-sportsperson",
        "scraped_at": "2025-12-06T17:28:01.170493"
      },
      "text": "### Relationship requirement for settlement as a dependent partner or dependent child of an International Sportsperson\n\n1.   ISP 32.1. The applicant must be the partner or child of a person (P) where one of the following applies: \n    1.   (a) P is, at the same time, being granted settlement as an International Sportsperson; or\n    2.   (b) P is settled in the UK or has become a British citizen, providing P had permission as an International Sportsperson when they settled and the applicant either: \n        1.   (i) had permission as P’s partner or child at that time; or\n        2.   (ii) is applying as a child of P, and was born in the UK before P settled.\n\n1.   ISP 32.2. The applicant must either: \n    1.   (a) have last been granted permission as a dependent partner or dependent child of the person (P) in ISP 32.1; or\n    2.   (b) have been born in the UK and be applying as a child of the person (P) in ISP 32.1.\n\n1.   ISP 32.3. If applying as a child, the applicant must meet the relationship requirement for settlement in Appendix Children.\n\nISP 32.4. If applying as a partner, the requirements of Appendix Relationship with Partner must be met.",
      "summary": "This provision applies to dependents (partners or children) of International Sportspersons seeking settlement. Applicants must be related to a person who is, or was, granted settlement as a Sportsperson, or who is settled/UK citizen, with specific conditions for children born in the UK or who previously held dependent status. Exceptions include applicants already granted dependent permission or born in the UK.",
      "augmented_text": "Document: Immigration Rules Appendix International Sportsperson\nPart: Immigration Rules Appendix International Sportsperson\nSection ID: 1\nSection: Relationship requirement for settlement as a dependent partner or dependent child of an International Sportsperson\nTopic: settlement\n\nSummary: This provision applies to dependents (partners or children) of International Sportspersons seeking settlement. Applicants must be related to a person who is, or was, granted settlement as a Sportsperson, or who is settled/UK citizen, with specific conditions for children born in the UK or who previously held dependent status. Exceptions include applicants already granted dependent permission or born in the UK.\n\n### Relationship requirement for settlement as a dependent partner or dependent child of an International Sportsperson\n\n1.   ISP 32.1. The applicant must be the partner or child of a person (P) where one of the following applies: \n    1.   (a) P is, at the same time, being granted settlement as an International Sportsperson; or\n    2.   (b) P is settled in the UK or has become a British citizen, providing P had permission as an International Sportsperson when they settled and the applicant either: \n        1.   (i) had permission as P’s partner or child at that time; or\n        2.   (ii) is applying as a child of P, and was born in the UK before P settled.\n\n1.   ISP 32.2. The applicant must either: \n    1.   (a) have last been granted permission as a dependent partner or dependent child of the person (P) in ISP 32.1; or\n    2.   (b) have been born in the UK and be applying as a child of the person (P) in ISP 32.1.\n\n1.   ISP 32.3. If applying as a child, the applicant must meet the relationship requirement for settlement in Appendix Children.\n\nISP 32.4. If applying as a partner, the requirements of Appendix Relationship with Partner must be met.",
      "needs_review": false
    },
    {
      "metadata": {
        "source": "Immigration Rules Appendix International Sportsperson",
        "part": "Immigration Rules Appendix International Sportsperson",
        "section_id": "ISP 33.1",
        "section_title": "Care requirement for settlement as a dependent child of an International Sportsperson",
        "parent_section": "ISP 33",
        "hierarchy_level": 2,
        "topic": "settlement",
        "url": "https://www.gov.uk/guidance/immigration-rules/immigration-rules-appendix-international-sportsperson",
        "scraped_at": "2025-12-06T17:28:01.170514"
      },
      "text": "### Care requirement for settlement as a dependent child of an International Sportsperson\n\nISP 33.1. DELETED.",
      "summary": "This provision applies to dependent children of International Sportspersons seeking settlement. It requires demonstrating that appropriate care arrangements exist, with certain conditions or exceptions applicable, as detailed in the deleted section.",
      "augmented_text": "Document: Immigration Rules Appendix International Sportsperson\nPart: Immigration Rules Appendix International Sportsperson\nSection ID: ISP 33.1\nSection: Care requirement for settlement as a dependent child of an International Sportsperson\nTopic: settlement\n\nSummary: This provision applies to dependent children of International Sportspersons seeking settlement. It requires demonstrating that appropriate care arrangements exist, with certain conditions or exceptions applicable, as detailed in the deleted section.\n\n### Care requirement for settlement as a dependent child of an International Sportsperson\n\nISP 33.1. DELETED.",
      "needs_review": false
    },
    {
      "metadata": {
        "source": "Immigration Rules Appendix International Sportsperson",
        "part": "Immigration Rules Appendix International Sportsperson",
        "section_id": "ISP 34.1",
        "section_title": "Age requirement for settlement as a dependent child of an International Sportsperson",
        "parent_section": "ISP 34",
        "hierarchy_level": 2,
        "topic": "settlement",
        "url": "https://www.gov.uk/guidance/immigration-rules/immigration-rules-appendix-international-sportsperson",
        "scraped_at": "2025-12-06T17:28:01.170536"
      },
      "text": "### Age requirement for settlement as a dependent child of an International Sportsperson\n\nISP 34.1. DELETED.\n\nISP 34.2. DELETED.",
      "summary": "This provision applies to dependent children of an International Sportsperson seeking settlement. It requires that applicants be under 18 at the date of application unless specific exceptions apply; the age limit is a key condition for eligibility.",
      "augmented_text": "Document: Immigration Rules Appendix International Sportsperson\nPart: Immigration Rules Appendix International Sportsperson\nSection ID: ISP 34.1\nSection: Age requirement for settlement as a dependent child of an International Sportsperson\nTopic: settlement\n\nSummary: This provision applies to dependent children of an International Sportsperson seeking settlement. It requires that applicants be under 18 at the date of application unless specific exceptions apply; the age limit is a key condition for eligibility.\n\n### Age requirement for settlement as a dependent child of an International Sportsperson\n\nISP 34.1. DELETED.\n\nISP 34.2. DELETED.",
      "needs_review": false
    },
    {
      "metadata": {
        "source": "Immigration Rules Appendix International Sportsperson",
        "part": "Immigration Rules Appendix International Sportsperson",
        "section_id": "1",
        "section_title": "Requirements for settlement as a dependent child of an International Sportsperson",
        "parent_section": null,
        "hierarchy_level": 1,
        "topic": "settlement",
        "url": "https://www.gov.uk/guidance/immigration-rules/immigration-rules-appendix-international-sportsperson",
        "scraped_at": "2025-12-06T17:28:01.170562"
      },
      "text": "### Requirements for settlement as a dependent child of an International Sportsperson\n\n1.   ISP 34A.1. The applicant must meet the following requirements for a dependent child in Appendix Children: \n    1.   (a) care requirement; and\n    2.   (b) age and independent life requirement.",
      "summary": "Dependent children of International Sportspersons must meet the care and age/independent life requirements specified in Appendix Children to qualify for settlement. These criteria ensure suitable care arrangements and appropriate age thresholds, with no additional exceptions noted.",
      "augmented_text": "Document: Immigration Rules Appendix International Sportsperson\nPart: Immigration Rules Appendix International Sportsperson\nSection ID: 1\nSection: Requirements for settlement as a dependent child of an International Sportsperson\nTopic: settlement\n\nSummary: Dependent children of International Sportspersons must meet the care and age/independent life requirements specified in Appendix Children to qualify for settlement. These criteria ensure suitable care arrangements and appropriate age thresholds, with no additional exceptions noted.\n\n### Requirements for settlement as a dependent child of an International Sportsperson\n\n1.   ISP 34A.1. The applicant must meet the following requirements for a dependent child in Appendix Children: \n    1.   (a) care requirement; and\n    2.   (b) age and independent life requirement.",
      "needs_review": false
    },
    {
      "metadata": {
        "source": "Immigration Rules Appendix International Sportsperson",
        "part": "Immigration Rules Appendix International Sportsperson",
        "section_id": "ISP 35.1",
        "section_title": "Qualifying period requirement for settlement as a dependent partner of an International Sportsperson",
        "parent_section": "ISP 35",
        "hierarchy_level": 2,
        "topic": "settlement",
        "url": "https://www.gov.uk/guidance/immigration-rules/immigration-rules-appendix-international-sportsperson",
        "scraped_at": "2025-12-06T17:28:01.170588"
      },
      "text": "### Qualifying period requirement for settlement as a dependent partner of an International Sportsperson\n\nISP 35.1. The applicant must have spent a continuous period of five years in the UK with permission as a dependent partner of the person (P) in ISP 32.1.",
      "summary": "This provision applies to dependent partners of International Sportspersons seeking settlement. They must have resided continuously in the UK for five years with permission as a dependent partner. No exemptions or exceptions are specified.",
      "augmented_text": "Document: Immigration Rules Appendix International Sportsperson\nPart: Immigration Rules Appendix International Sportsperson\nSection ID: ISP 35.1\nSection: Qualifying period requirement for settlement as a dependent partner of an International Sportsperson\nTopic: settlement\n\nSummary: This provision applies to dependent partners of International Sportspersons seeking settlement. They must have resided continuously in the UK for five years with permission as a dependent partner. No exemptions or exceptions are specified.\n\n### Qualifying period requirement for settlement as a dependent partner of an International Sportsperson\n\nISP 35.1. The applicant must have spent a continuous period of five years in the UK with permission as a dependent partner of the person (P) in ISP 32.1.",
      "needs_review": false
    },
    {
      "metadata": {
        "source": "Immigration Rules Appendix International Sportsperson",
        "part": "Immigration Rules Appendix International Sportsperson",
        "section_id": "ISP 36.1",
        "section_title": "Continuous residence requirement for settlement as a dependent partner of an International Sportsperson",
        "parent_section": "ISP 36",
        "hierarchy_level": 2,
        "topic": "settlement",
        "url": "https://www.gov.uk/guidance/immigration-rules/immigration-rules-appendix-international-sportsperson",
        "scraped_at": "2025-12-06T17:28:01.170614"
      },
      "text": "### Continuous residence requirement for settlement as a dependent partner of an International Sportsperson\n\nISP 36.1. The applicant must meet the continuous residence requirement as set out in Appendix Continuous Residence during the period in ISP 35.1.",
      "summary": "Dependent partners of International Sportspersons must fulfill a continuous residence requirement outlined in Appendix Continuous Residence, applicable during the period specified in ISP 35.1; failure to meet this requirement may affect their eligibility for settlement.",
      "augmented_text": "Document: Immigration Rules Appendix International Sportsperson\nPart: Immigration Rules Appendix International Sportsperson\nSection ID: ISP 36.1\nSection: Continuous residence requirement for settlement as a dependent partner of an International Sportsperson\nTopic: settlement\n\nSummary: Dependent partners of International Sportspersons must fulfill a continuous residence requirement outlined in Appendix Continuous Residence, applicable during the period specified in ISP 35.1; failure to meet this requirement may affect their eligibility for settlement.\n\n### Continuous residence requirement for settlement as a dependent partner of an International Sportsperson\n\nISP 36.1. The applicant must meet the continuous residence requirement as set out in Appendix Continuous Residence during the period in ISP 35.1.",
      "needs_review": false
    },
    {
      "metadata": {
        "source": "Immigration Rules Appendix International Sportsperson",
        "part": "Immigration Rules Appendix International Sportsperson",
        "section_id": "ISP 37.1",
        "section_title": "English language requirement for settlement as a dependent partner or dependent child of an International Sportsperson",
        "parent_section": "ISP 37",
        "hierarchy_level": 2,
        "topic": "english-language",
        "url": "https://www.gov.uk/guidance/immigration-rules/immigration-rules-appendix-international-sportsperson",
        "scraped_at": "2025-12-06T17:28:01.170631"
      },
      "text": "### English language requirement for settlement as a dependent partner or dependent child of an International Sportsperson\n\nISP 37.1. Unless an exemption applies, the applicant must show English language ability on the Common European Framework of Reference for Languages in speaking and listening to at least level B1.\n\nISP 37.2. The applicant must show they meet the English language requirement as specified in Appendix English Language.",
      "summary": "Dependent partners or children of an International Sportsperson applying for settlement must meet the English language requirement at B1 level in speaking and listening, unless exempted, as per Appendix English Language.",
      "augmented_text": "Document: Immigration Rules Appendix International Sportsperson\nPart: Immigration Rules Appendix International Sportsperson\nSection ID: ISP 37.1\nSection: English language requirement for settlement as a dependent partner or dependent child of an International Sportsperson\nTopic: english-language\n\nSummary: Dependent partners or children of an International Sportsperson applying for settlement must meet the English language requirement at B1 level in speaking and listening, unless exempted, as per Appendix English Language.\n\n### English language requirement for settlement as a dependent partner or dependent child of an International Sportsperson\n\nISP 37.1. Unless an exemption applies, the applicant must show English language ability on the Common European Framework of Reference for Languages in speaking and listening to at least level B1.\n\nISP 37.2. The applicant must show they meet the English language requirement as specified in Appendix English Language.",
      "needs_review": false
    },
    {
      "metadata": {
        "source": "Immigration Rules Appendix International Sportsperson",
        "part": "Immigration Rules Appendix International Sportsperson",
        "section_id": "ISP 38.1",
        "section_title": "Knowledge of Life in the UK requirement for settlement as a dependent partner or dependent child of an International Sportsperson",
        "parent_section": "ISP 38",
        "hierarchy_level": 2,
        "topic": "settlement",
        "url": "https://www.gov.uk/guidance/immigration-rules/immigration-rules-appendix-international-sportsperson",
        "scraped_at": "2025-12-06T17:28:01.170657"
      },
      "text": "### Knowledge of Life in the UK requirement for settlement as a dependent partner or dependent child of an International Sportsperson\n\nISP 38.1. Unless an exemption applies, the applicant must meet the Knowledge of Life in the UK requirement as set out in Appendix KOL UK.",
      "summary": "Dependent partners or children of international sportspersons seeking settlement must usually meet the Knowledge of Life in the UK requirement outlined in Appendix KOL UK, unless an exemption applies.",
      "augmented_text": "Document: Immigration Rules Appendix International Sportsperson\nPart: Immigration Rules Appendix International Sportsperson\nSection ID: ISP 38.1\nSection: Knowledge of Life in the UK requirement for settlement as a dependent partner or dependent child of an International Sportsperson\nTopic: settlement\n\nSummary: Dependent partners or children of international sportspersons seeking settlement must usually meet the Knowledge of Life in the UK requirement outlined in Appendix KOL UK, unless an exemption applies.\n\n### Knowledge of Life in the UK requirement for settlement as a dependent partner or dependent child of an International Sportsperson\n\nISP 38.1. Unless an exemption applies, the applicant must meet the Knowledge of Life in the UK requirement as set out in Appendix KOL UK.",
      "needs_review": false
    },
    {
      "metadata": {
        "source": "Immigration Rules Appendix International Sportsperson",
        "part": "Immigration Rules Appendix International Sportsperson",
        "section_id": "ISP 39.1",
        "section_title": "Decision on an application for settlement as a dependent partner or dependent child of an International Sportsperson",
        "parent_section": "ISP 39",
        "hierarchy_level": 2,
        "topic": "eligibility",
        "url": "https://www.gov.uk/guidance/immigration-rules/immigration-rules-appendix-international-sportsperson",
        "scraped_at": "2025-12-06T17:28:01.170670"
      },
      "text": "### Decision on an application for settlement as a dependent partner or dependent child of an International Sportsperson\n\nISP 39.1. If the decision maker is satisfied all the suitability and eligibility requirements are met for settlement as a dependent partner or dependent child of an International Sportsperson, the application will be granted, otherwise the application will be refused.\n\nISP 39.2. If the application is refused the person can apply for an Administrative Review under Appendix AR: Administrative Review.\n\nPrint this page",
      "summary": "This provision applies to dependent partners or children of International Sportspersons applying for settlement. The key requirement is that all suitability and eligibility criteria must be met for approval; otherwise, the application will be refused, with the option to request an Administrative Review.",
      "augmented_text": "Document: Immigration Rules Appendix International Sportsperson\nPart: Immigration Rules Appendix International Sportsperson\nSection ID: ISP 39.1\nSection: Decision on an application for settlement as a dependent partner or dependent child of an International Sportsperson\nTopic: eligibility\n\nSummary: This provision applies to dependent partners or children of International Sportspersons applying for settlement. The key requirement is that all suitability and eligibility criteria must be met for approval; otherwise, the application will be refused, with the option to request an Administrative Review.\n\n### Decision on an application for settlement as a dependent partner or dependent child of an International Sportsperson\n\nISP 39.1. If the decision maker is satisfied all the suitability and eligibility requirements are met for settlement as a dependent partner or dependent child of an International Sportsperson, the application will be granted, otherwise the application will be refused.\n\nISP 39.2. If the application is refused the person can apply for an Administrative Review under Appendix AR: Administrative Review.\n\nPrint this page",
      "needs_review": false
    }
  ]
}