{
  "url": "https://www.gov.uk/guidance/immigration-rules/immigration-rules-appendix-skilled-worker",
  "part_name": "Immigration Rules Appendix Skilled Worker",
  "scraped_at": "2025-12-06T17:28:54.497749",
  "chunk_count": 52,
  "chunks": [
    {
      "metadata": {
        "source": "Immigration Rules Appendix Skilled Worker",
        "part": "Immigration Rules Appendix Skilled Worker",
        "section_id": "SW 3.1",
        "section_title": "Entry requirements for a Skilled Worker",
        "parent_section": "SW 3",
        "hierarchy_level": 2,
        "topic": "leave-to-enter",
        "url": "https://www.gov.uk/guidance/immigration-rules/immigration-rules-appendix-skilled-worker",
        "scraped_at": "2025-12-06T17:28:54.497031"
      },
      "text": "### Entry requirements for a Skilled Worker\n\nSW 3.1. A person seeking to come to the UK as a Skilled Worker must apply for and obtain entry clearance as a Skilled Worker before they arrive in the UK.\n\nSW 3.2. A person applying for entry clearance as a Skilled Worker must, if Appendix Tuberculosis applies, provide a valid medical certificate confirming that they have undergone screening for active pulmonary tuberculosis and that this tuberculosis is not present in them.",
      "summary": "Applicants seeking entry as a Skilled Worker must obtain prior entry clearance, including a tuberculosis screening certificate if applicable.",
      "augmented_text": "Document: Immigration Rules Appendix Skilled Worker\nPart: Immigration Rules Appendix Skilled Worker\nSection ID: SW 3.1\nSection: Entry requirements for a Skilled Worker\nTopic: leave-to-enter\n\nSummary: Applicants seeking entry as a Skilled Worker must obtain prior entry clearance, including a tuberculosis screening certificate if applicable.\n\n### Entry requirements for a Skilled Worker\n\nSW 3.1. A person seeking to come to the UK as a Skilled Worker must apply for and obtain entry clearance as a Skilled Worker before they arrive in the UK.\n\nSW 3.2. A person applying for entry clearance as a Skilled Worker must, if Appendix Tuberculosis applies, provide a valid medical certificate confirming that they have undergone screening for active pulmonary tuberculosis and that this tuberculosis is not present in them.",
      "needs_review": false
    },
    {
      "metadata": {
        "source": "Immigration Rules Appendix Skilled Worker",
        "part": "Immigration Rules Appendix Skilled Worker",
        "section_id": "SW 4.1",
        "section_title": "Points requirement for a Skilled Worker",
        "parent_section": "SW 4",
        "hierarchy_level": 2,
        "topic": "points",
        "url": "https://www.gov.uk/guidance/immigration-rules/immigration-rules-appendix-skilled-worker",
        "scraped_at": "2025-12-06T17:28:54.497062"
      },
      "text": "### Points requirement for a Skilled Worker\n\nSW 4.1. The applicant must be awarded all 50 points in the table below. Details of how these points are awarded are set out in SW 5.1. to SW 7.4.\n\n| Mandatory points requirements | Relevant rules | Points |\n| --- | --- | --- |\n| Sponsorship | SW 5.1. to SW 5.7. | 20 |\n| Job at an appropriate skill level | SW 6.1. to SW 6.5. | 20 |\n| English language skills at level B1 | SW 7.1. to SW 7.3. | 10 |\n\n1.   SW 4.2. The applicant must be awarded 20 points from one of the options in the table below and for the purpose of meeting these points: \n    1.   (a) an applicant can only be awarded points from options A to E, unless they meet the requirements in (b) or (c).\n    2.   (b) An applicant can only be awarded points from options F to J if: \n        1.   (i) they are being sponsored for a Health and Care ASHE salary job; or\n        2.   (ii) the date of application is before 4 April 2030, they were granted permission as a Skilled Worker under the rules in place before 4 April 2024, and they have had continuous permission as a Skilled Worker since then (except that where the Exceptions for overstayers section of Part Suitability applies, that period of overstaying will be disregarded).\n\n    3.   (c) An applicant can only be awarded points from option K if they are being sponsored for a job in an appropriate eligible SOC 2020 occupation code listed in Table 3 or Table 3a of Appendix Skilled Occupations.\n\nSW 4.3. Details of how these points are awarded are set out in the table and in SW 8.1. to SW 13.3. The salary for each option will be considered as set out in SW 14.1. to SW 14.5.\n\nSW 4.4. If the requirements for the relevant option are met, the applicant will be awarded 20 points. However, no points will be awarded if the applicant is not also being awarded the 20 points for sponsorship under SW 5.7. and the 20 points for a job at the appropriate skill level under SW 6.4.\n\n| Option | Requirements | Relevant further rules | Points |\n| --- | --- | --- | --- |\n| A | The applicant’s salary equals or exceeds both: • £41,700 per year; and • the going rate for the SOC 2020 occupation code. | SW 8.1. | 20 |\n| B | The applicant has a PhD in a subject relevant to the job and their salary equals or exceeds both: • £37,500 per year; and • 90% of the going rate for the SOC 2020 occupation code. | SW 9.1. to SW 9.4 | 20 |\n| C | The applicant has a PhD in a STEM subject relevant to the job and their salary equals or exceeds both: • £33,400 per year; and • 80% of the going rate for the SOC 2020 occupation code. | SW 10.1. to SW 10.3. | 20 |\n| D | The applicant is being sponsored for a job on the Immigration Salary List and their salary equals or exceeds both: • £33,400 per year; and • the going rate for the SOC 2020 occupation code | SW 11.1. to SW 11.3. | 20 |\n| E | The applicant is a new entrant at the start of their career and their salary equals or exceeds both: • £33,400 per year and • 70% of the going rate for the SOC 2020 occupation code. | SW 12.1. to SW 12.3. | 20 |\n| F | The applicant’s salary equals or exceeds both: • £31,300 per year; and • the going rate for the SOC 2020 occupation code. | SW 8.1 | 20 |\n| G | The applicant has a PhD in a subject relevant to the job and their salary equals or exceeds both: • £28,200 per year; and • 90% of the going rate for the SOC 2020 occupation code. | SW 9.1 to 9.4 | 20 |\n| H | The applicant has a PhD in a STEM subject relevant to the job and their salary equals or exceeds both: • £25,000 per year; and • 80% of the going rate for the SOC 2020 occupation code. | SW 10.1 to 10.3. | 20 |\n| I | The applicant is being sponsored for a job on the Immigration Salary List and their salary equals or exceeds both: • £25,000 per year; and • the going rate for the SOC 2020 occupation code. | SW 11.1. to 11.3. | 20 |\n| J | The applicant is a new entrant at the start of their career and their salary equals or exceeds both: • £25,000 per year; and • 70% of the going rate for the SOC 2020 occupation code. | SW 12.1. to 12.3. | 20 |\n| K | The applicant is being sponsored for a job in a listed health or education occupation and their salary equals or exceeds both: • £25,000 per year; and • the going rate for the SOC 2020 occupation code. | SW 13.1. to 13.3. | 20 |",
      "summary": "This provision applies to Skilled Worker applicants aiming to meet the 50-point threshold. Applicants must earn all points through sponsorship (20), job skill level (20), and English language ability (10), with specific conditions for earning the 20 points based on job type, sponsorship, and application timing. Certain point options are limited based on occupation, sponsorship, and application date.",
      "augmented_text": "Document: Immigration Rules Appendix Skilled Worker\nPart: Immigration Rules Appendix Skilled Worker\nSection ID: SW 4.1\nSection: Points requirement for a Skilled Worker\nTopic: points\n\nSummary: This provision applies to Skilled Worker applicants aiming to meet the 50-point threshold. Applicants must earn all points through sponsorship (20), job skill level (20), and English language ability (10), with specific conditions for earning the 20 points based on job type, sponsorship, and application timing. Certain point options are limited based on occupation, sponsorship, and application date.\n\n### Points requirement for a Skilled Worker\n\nSW 4.1. The applicant must be awarded all 50 points in the table below. Details of how these points are awarded are set out in SW 5.1. to SW 7.4.\n\n| Mandatory points requirements | Relevant rules | Points |\n| --- | --- | --- |\n| Sponsorship | SW 5.1. to SW 5.7. | 20 |\n| Job at an appropriate skill level | SW 6.1. to SW 6.5. | 20 |\n| English language skills at level B1 | SW 7.1. to SW 7.3. | 10 |\n\n1.   SW 4.2. The applicant must be awarded 20 points from one of the options in the table below and for the purpose of meeting these points: \n    1.   (a) an applicant can only be awarded points from options A to E, unless they meet the requirements in (b) or (c).\n    2.   (b) An applicant can only be awarded points from options F to J if: \n        1.   (i) they are being sponsored for a Health and Care ASHE salary job; or\n        2.   (ii) the date of application is before 4 April 2030, they were granted permission as a Skilled Worker under the rules in place before 4 April 2024, and they have had continuous permission as a Skilled Worker since then (except that where the Exceptions for overstayers section of Part Suitability applies, that period of overstaying will be disregarded).\n\n    3.   (c) An applicant can only be awarded points from option K if they are being sponsored for a job in an appropriate eligible SOC 2020 occupation code listed in Table 3 or Table 3a of Appendix Skilled Occupations.\n\nSW 4.3. Details of how these points are awarded are set out in the table and in SW 8.1. to SW 13.3. The salary for each option will be considered as set out in SW 14.1. to SW 14.5.\n\nSW 4.4. If the requirements for the relevant option are met, the applicant will be awarded 20 points. However, no points will be awarded if the applicant is not also being awarded the 20 points for sponsorship under SW 5.7. and the 20 points for a job at the appropriate skill level under SW 6.4.\n\n| Option | Requirements | Relevant further rules | Points |\n| --- | --- | --- | --- |\n| A | The applicant’s salary equals or exceeds both: • £41,700 per year; and • the going rate for the SOC 2020 occupation code. | SW 8.1. | 20 |\n| B | The applicant has a PhD in a subject relevant to the job and their salary equals or exceeds both: • £37,500 per year; and • 90% of the going rate for the SOC 2020 occupation code. | SW 9.1. to SW 9.4 | 20 |\n| C | The applicant has a PhD in a STEM subject relevant to the job and their salary equals or exceeds both: • £33,400 per year; and • 80% of the going rate for the SOC 2020 occupation code. | SW 10.1. to SW 10.3. | 20 |\n| D | The applicant is being sponsored for a job on the Immigration Salary List and their salary equals or exceeds both: • £33,400 per year; and • the going rate for the SOC 2020 occupation code | SW 11.1. to SW 11.3. | 20 |\n| E | The applicant is a new entrant at the start of their career and their salary equals or exceeds both: • £33,400 per year and • 70% of the going rate for the SOC 2020 occupation code. | SW 12.1. to SW 12.3. | 20 |\n| F | The applicant’s salary equals or exceeds both: • £31,300 per year; and • the going rate for the SOC 2020 occupation code. | SW 8.1 | 20 |\n| G | The applicant has a PhD in a subject relevant to the job and their salary equals or exceeds both: • £28,200 per year; and • 90% of the going rate for the SOC 2020 occupation code. | SW 9.1 to 9.4 | 20 |\n| H | The applicant has a PhD in a STEM subject relevant to the job and their salary equals or exceeds both: • £25,000 per year; and • 80% of the going rate for the SOC 2020 occupation code. | SW 10.1 to 10.3. | 20 |\n| I | The applicant is being sponsored for a job on the Immigration Salary List and their salary equals or exceeds both: • £25,000 per year; and • the going rate for the SOC 2020 occupation code. | SW 11.1. to 11.3. | 20 |\n| J | The applicant is a new entrant at the start of their career and their salary equals or exceeds both: • £25,000 per year; and • 70% of the going rate for the SOC 2020 occupation code. | SW 12.1. to 12.3. | 20 |\n| K | The applicant is being sponsored for a job in a listed health or education occupation and their salary equals or exceeds both: • £25,000 per year; and • the going rate for the SOC 2020 occupation code. | SW 13.1. to 13.3. | 20 |",
      "needs_review": false
    },
    {
      "metadata": {
        "source": "Immigration Rules Appendix Skilled Worker",
        "part": "Immigration Rules Appendix Skilled Worker",
        "section_id": "1",
        "section_title": "Points for sponsorship (mandatory)",
        "parent_section": null,
        "hierarchy_level": 1,
        "topic": "points",
        "url": "https://www.gov.uk/guidance/immigration-rules/immigration-rules-appendix-skilled-worker",
        "scraped_at": "2025-12-06T17:28:54.497086"
      },
      "text": "### Points for sponsorship (mandatory)\n\n1.   SW 5.1. The applicant must have a valid Certificate of Sponsorship for the job they are planning to do; which to be valid must: \n    1.   (a) confirm the applicant’s name, that they are being sponsored as a Skilled Worker, details of the job and salary the sponsor is offering them and PAYE details if HM Revenue and Customs (HMRC) requires income tax and National Insurance for the sponsored job to be paid via PAYE; and\n    2.   (b) if the application is for entry clearance, have been allocated by the Home Office to that sponsor for the specific job and salary details shown; and\n    3.   (c) include a start date, stated by the sponsor, which is no more than 3 months after the date of application; and\n    4.   (d) not have been used in a previous application which was either granted or refused (but can have been used in a previous application which was rejected as invalid, made void or withdrawn); and\n    5.   (e) not have been withdrawn by the sponsor or cancelled by the Home Office; and (f) confirm whether or not the Academic Technology Approval Scheme (ATAS) requirement in Appendix ATAS applies.\n\nSW 5.2. The sponsor must be authorised by the Home Office to sponsor the job in question under the Skilled Worker route.\n\nSW 5.3. The sponsor must be listed as A-rated on the Home Office’s register of licensed sponsors, unless the applicant was last granted permission as a Skilled Worker and is applying to continue working for the same sponsor as in their last permission.\n\nSW 5.4. The sponsor must have paid in full any required Immigration Skills Charge.\n\n1.   SW 5.5. The decision maker must not have reasonable grounds to believe the job the applicant is being sponsored to do: \n    1.   (a) does not exist; or\n    2.   (b) is a sham; or\n    3.   (c) has been created mainly so the applicant can apply for entry clearance or permission to stay.\n\n1.   SW 5.6. The decision maker must not have reasonable grounds to believe the job the applicant is being sponsored to do amounts to: \n    1.   (a) the hire of the applicant to a third party who is not the sponsor to fill a position with that party, whether temporary or permanent; or\n    2.   (b) contract work to undertake an ongoing routine role or to provide an ongoing routine service for a third party who is not the sponsor, regardless of the nature or length of any arrangement between the sponsor and the third party.\n\nSW 5.6A. The decision maker must not have reasonable grounds to believe the job the applicant is being sponsored to do does not comply with the National Minimum Wage Regulations or the Working Time Regulations.\n\nSW 5.7. If the requirements in SW 5.1. to SW 5.6A. are met, the applicant will be awarded 20 mandatory points for sponsorship.",
      "summary": "Applicants must have a valid Certificate of Sponsorship confirming job details, salary, and compliance with eligibility criteria, including no prior use or withdrawal. Sponsors require Home Office authorization and must be A-rated licensed sponsors unless retaining existing permission.",
      "augmented_text": "Document: Immigration Rules Appendix Skilled Worker\nPart: Immigration Rules Appendix Skilled Worker\nSection ID: 1\nSection: Points for sponsorship (mandatory)\nTopic: points\n\nSummary: Applicants must have a valid Certificate of Sponsorship confirming job details, salary, and compliance with eligibility criteria, including no prior use or withdrawal. Sponsors require Home Office authorization and must be A-rated licensed sponsors unless retaining existing permission.\n\n### Points for sponsorship (mandatory)\n\n1.   SW 5.1. The applicant must have a valid Certificate of Sponsorship for the job they are planning to do; which to be valid must: \n    1.   (a) confirm the applicant’s name, that they are being sponsored as a Skilled Worker, details of the job and salary the sponsor is offering them and PAYE details if HM Revenue and Customs (HMRC) requires income tax and National Insurance for the sponsored job to be paid via PAYE; and\n    2.   (b) if the application is for entry clearance, have been allocated by the Home Office to that sponsor for the specific job and salary details shown; and\n    3.   (c) include a start date, stated by the sponsor, which is no more than 3 months after the date of application; and\n    4.   (d) not have been used in a previous application which was either granted or refused (but can have been used in a previous application which was rejected as invalid, made void or withdrawn); and\n    5.   (e) not have been withdrawn by the sponsor or cancelled by the Home Office; and (f) confirm whether or not the Academic Technology Approval Scheme (ATAS) requirement in Appendix ATAS applies.\n\nSW 5.2. The sponsor must be authorised by the Home Office to sponsor the job in question under the Skilled Worker route.\n\nSW 5.3. The sponsor must be listed as A-rated on the Home Office’s register of licensed sponsors, unless the applicant was last granted permission as a Skilled Worker and is applying to continue working for the same sponsor as in their last permission.\n\nSW 5.4. The sponsor must have paid in full any required Immigration Skills Charge.\n\n1.   SW 5.5. The decision maker must not have reasonable grounds to believe the job the applicant is being sponsored to do: \n    1.   (a) does not exist; or\n    2.   (b) is a sham; or\n    3.   (c) has been created mainly so the applicant can apply for entry clearance or permission to stay.\n\n1.   SW 5.6. The decision maker must not have reasonable grounds to believe the job the applicant is being sponsored to do amounts to: \n    1.   (a) the hire of the applicant to a third party who is not the sponsor to fill a position with that party, whether temporary or permanent; or\n    2.   (b) contract work to undertake an ongoing routine role or to provide an ongoing routine service for a third party who is not the sponsor, regardless of the nature or length of any arrangement between the sponsor and the third party.\n\nSW 5.6A. The decision maker must not have reasonable grounds to believe the job the applicant is being sponsored to do does not comply with the National Minimum Wage Regulations or the Working Time Regulations.\n\nSW 5.7. If the requirements in SW 5.1. to SW 5.6A. are met, the applicant will be awarded 20 mandatory points for sponsorship.",
      "needs_review": false
    },
    {
      "metadata": {
        "source": "Immigration Rules Appendix Skilled Worker",
        "part": "Immigration Rules Appendix Skilled Worker",
        "section_id": "1",
        "section_title": "Points for a job at the appropriate skill level (mandatory)",
        "parent_section": null,
        "hierarchy_level": 1,
        "topic": "eligibility",
        "url": "https://www.gov.uk/guidance/immigration-rules/immigration-rules-appendix-skilled-worker",
        "scraped_at": "2025-12-06T17:28:54.497112"
      },
      "text": "### Points for a job at the appropriate skill level (mandatory)\n\n1.   SW 6.1. Subject to SW 6.1A to SW 6.3A, the applicant must be sponsored for a job in an eligible SOC 2020 occupation code (or, where relevant, an eligible job within a SOC 2020 occupation code), listed as eligible in: \n    1.   (a) Table 1, Table 2 or Table 3 of Appendix Skilled Occupations; or\n    2.   (b) the Immigration Salary List in Appendix Immigration Salary List; or\n    3.   (c) the Temporary Shortage List in SW 6.1A; or\n    4.   (d) Table 1a, Table 2aa or Table 3a of Appendix Skilled Occupations if the applicant was granted permission as a Skilled Worker under the rules in place before 22 July 2025, and they have had continuous permission as a Skilled Worker since then (except that where the Exceptions for overstayers section of Part Suitability applies, that period of overstaying will be disregarded); or\n    5.   (e) Table 2aa of Appendix Skilled Occupations, if the applicant is being awarded points under options F to J in the table following SW 4.4 and meets the requirement in SW 4.2(b)(ii); or\n    6.   (f) Table 2a of Appendix Skilled Occupations, if the applicant is being awarded points under options F to J in the table following SW 4.4, meets the requirement in SW 4.2(b)(ii), and is applying to work for the same sponsor as in their most recent permission.\n\n1.   SW 6.1A. A SOC 2020 occupation code (or, where relevant, an eligible job within a SOC 2020 occupation code) is only included on the Temporary Shortage List where: \n    1.   (a) it appears in the list below; and\n    2.   (b) an application has been made using a certificate of sponsorship issued by a sponsor to an applicant before 31 December 2026.\n\n**Temporary Shortage List**\n\n*   1243 Managers in logistics\n*   1258 Directors in consultancy services\n*   3111 Laboratory technicians\n*   3112 Electrical and electronics technicians\n*   3113 Engineering technicians\n*   3114 Building and civil engineering technicians\n*   3115 Quality assurance technicians\n*   3116 Planning, process and production technicians\n*   3120 CAD, drawing and architectural technicians\n*   3131 IT operations technicians\n*   3132 IT user support technicians\n*   3133 Database administrators and web content technicians\n*   3412 Authors, writers and translators\n*   3414 Dancers and choreographers\n*   3417 Photographers, audio-visual and broadcasting equipment operators\n*   3422 Clothing, fashion and accessories designers\n*   3429 Design occupations not elsewhere classified – only the following job types: \n    *   Industrial and product designers\n    *   Packaging designers\n    *   Performance make-up artists\n    *   Set designers\n    *   Visual merchandising managers and designers\n\n*   3512 Ship and hovercraft officers\n*   3520 Legal associate professionals\n*   3532 Insurance underwriters\n*   3533 Financial and accounting technicians\n*   3541 Estimators, valuers and assessors\n*   3544 Data analysts\n*   3549 Business associate professionals not elsewhere classified – only the following job types: \n    *   Business support officers\n    *   Business systems analysts\n    *   Contract administrators\n    *   Clinical coders\n    *   Clinical trials administrators\n    *   Research coordinators\n\n*   3552 Business sales executives\n*   3554 Advertising and marketing associate professionals\n*   3571 Human resources and industrial relations officers\n*   3573 Information technology trainers\n*   4121 Credit controllers\n*   4122 Book-keepers, payroll managers and wages clerks\n*   4129 Financial administrative occupations not elsewhere classified – only the following job types: \n    *   Box office assistants\n    *   Grants officers\n    *   Mortgage administrators\n    *   Revenue assistants (excludes National and Local government revenue occupations)\n    *   Treasury assistants\n\n*   4132 Pensions and insurance clerks and assistants\n*   5213 Welding trades\n*   5214 Pipe fitters\n*   5223 Metal working production and maintenance fitters\n*   5225 Air-conditioning and refrigeration installers and repairers\n*   5231 Vehicle technicians, mechanics and electricians\n*   5232 Vehicle body builders and repairers\n*   5233 Vehicle paint technicians\n*   5235 Boat and ship builders and repairers\n*   5241 Electricians and electrical fitters\n*   5242 Telecoms and related network installers and repairers\n*   5244 Computer system and equipment installers and servicers\n*   5245 Security system installers and repairers\n*   5249 Electrical and electronic trades not elsewhere classified\n*   5311 Steel erectors\n*   5315 Plumbers and heating and ventilating installers and repairers\n*   5319 Construction and building trades not elsewhere classified – only the following job types: \n    *   Builders\n    *   Divers\n    *   Fence erectors\n    *   Industrial climbers\n    *   Remotely Operated Vehicle (ROV) operators\n    *   Steel fixers and underpinners\n\n*   5322 Floorers and wall tilers\n*   5323 Painters and decorators\n*   5330 Construction and building trades supervisors\n*   8133 Energy plant operatives\n\n1.   SW 6.1B. If the applicant is being sponsored in the SOC 2020 occupation code “6135 Care workers and home carers” or “6136 Senior care workers”, the application must be for permission to stay, and either: \n    1.   (a) (i) the applicant must have been legally working for the sponsor in one of these SOC 2020 occupation codes for at least the three months ending on the date the certificate of sponsorship was issued by the sponsor to the applicant; and \n        1.   (ii) the date of application must be before 22 July 2028; or\n\n    2.   (b) the applicant must have permission as a Skilled Worker, sponsored in either of these SOC 2020 occupations codes (or the SOC 2010 occupation codes “6145 Care workers and home carers” or “6146 Senior care workers”) (except that where the Exceptions for overstayers section of Part Suitability applies, that period of overstaying will be disregarded).\n\n1.   SW 6.1C. If SW 6.1B applies and the applicant: \n    1.   (a) was previously granted permission as a Skilled Worker, sponsored in the SOC 2010 occupation code “6145 Care workers and home carers” or “6146 Senior care workers”, under the Rules in force before 11 March 2024; and\n    2.   (b) since then, has continuously had permission as a Skilled Worker, sponsored in either or both these SOC 2010 occupation codes, or SOC 2020 occupation codes “6135 Care workers and home carers” or “6136 Senior care workers” (except that where the Exceptions for overstayers section of Part Suitability applies, that period of overstaying will be disregarded); and\n    3.   (c) is applying to continue working with the same sponsor as in their most recent grant of permission,\n\n2.   the Care Quality Commission regulation requirement for these occupation codes does not apply.\n\n1.   SW 6.2. The sponsor must choose an appropriate SOC 2020 occupation code, and the decision maker must not have reasonable grounds to believe the sponsor has chosen a less appropriate SOC 2020 occupation code for any of the following reasons: \n    1.   (a) the most appropriate SOC 2020 occupation code is not eligible under the Skilled Worker route; or\n    2.   (b) the most appropriate SOC 2020 occupation code has a higher going rate than the proposed salary; or\n    3.   (c) the most appropriate SOC 2020 occupation code is not on the Immigration Salary List and the applicant is claiming points for a job on the Immigration Salary List; or\n    4.   (d) the most appropriate SOC 2020 occupation code is not listed as “eligible for PhD points” in Table 1 of Appendix Skilled Occupations and the applicant is claiming points for an educational qualification.\n\n1.   SW 6.3. To support the assessment in SW 6.2., the decision maker may, in particular, consider: \n    1.   (a) whether the sponsor has shown a genuine need for the job as described; and\n    2.   (b) whether the applicant has the appropriate skills, qualifications and experience needed to do the job as described; and\n    3.   (c) the sponsor’s history of compliance with the immigration system including, but not limited to, paying its sponsored workers appropriately; and\n    4.   (d) any additional information from the sponsor.\n\nSW 6.3A. If the ATAS requirement in Appendix ATAS applies, the applicant must provide a valid ATAS certificate.\n\nSW 6.4. If the requirements in SW 6.1. to SW 6.3A. are met, an applicant will be awarded 20 mandatory points for a job at the appropriate skill level, subject to SW 6.5.\n\nSW 6.5. No points will be awarded for a job at the appropriate skill level if the applicant is not also being awarded the 20 mandatory points for sponsorship under SW 5.7.",
      "summary": "This provision applies to Skilled Worker applicants. They must be sponsored for jobs in eligible SOC 2020 occupation codes listed in specified tables or lists, with certain conditions for previous permissions and employment specifics. Critical thresholds include continuous permission since 22 July 2025 and meeting points-based criteria under specific tables or options.",
      "augmented_text": "Document: Immigration Rules Appendix Skilled Worker\nPart: Immigration Rules Appendix Skilled Worker\nSection ID: 1\nSection: Points for a job at the appropriate skill level (mandatory)\nTopic: eligibility\n\nSummary: This provision applies to Skilled Worker applicants. They must be sponsored for jobs in eligible SOC 2020 occupation codes listed in specified tables or lists, with certain conditions for previous permissions and employment specifics. Critical thresholds include continuous permission since 22 July 2025 and meeting points-based criteria under specific tables or options.\n\n### Points for a job at the appropriate skill level (mandatory)\n\n1.   SW 6.1. Subject to SW 6.1A to SW 6.3A, the applicant must be sponsored for a job in an eligible SOC 2020 occupation code (or, where relevant, an eligible job within a SOC 2020 occupation code), listed as eligible in: \n    1.   (a) Table 1, Table 2 or Table 3 of Appendix Skilled Occupations; or\n    2.   (b) the Immigration Salary List in Appendix Immigration Salary List; or\n    3.   (c) the Temporary Shortage List in SW 6.1A; or\n    4.   (d) Table 1a, Table 2aa or Table 3a of Appendix Skilled Occupations if the applicant was granted permission as a Skilled Worker under the rules in place before 22 July 2025, and they have had continuous permission as a Skilled Worker since then (except that where the Exceptions for overstayers section of Part Suitability applies, that period of overstaying will be disregarded); or\n    5.   (e) Table 2aa of Appendix Skilled Occupations, if the applicant is being awarded points under options F to J in the table following SW 4.4 and meets the requirement in SW 4.2(b)(ii); or\n    6.   (f) Table 2a of Appendix Skilled Occupations, if the applicant is being awarded points under options F to J in the table following SW 4.4, meets the requirement in SW 4.2(b)(ii), and is applying to work for the same sponsor as in their most recent permission.\n\n1.   SW 6.1A. A SOC 2020 occupation code (or, where relevant, an eligible job within a SOC 2020 occupation code) is only included on the Temporary Shortage List where: \n    1.   (a) it appears in the list below; and\n    2.   (b) an application has been made using a certificate of sponsorship issued by a sponsor to an applicant before 31 December 2026.\n\n**Temporary Shortage List**\n\n*   1243 Managers in logistics\n*   1258 Directors in consultancy services\n*   3111 Laboratory technicians\n*   3112 Electrical and electronics technicians\n*   3113 Engineering technicians\n*   3114 Building and civil engineering technicians\n*   3115 Quality assurance technicians\n*   3116 Planning, process and production technicians\n*   3120 CAD, drawing and architectural technicians\n*   3131 IT operations technicians\n*   3132 IT user support technicians\n*   3133 Database administrators and web content technicians\n*   3412 Authors, writers and translators\n*   3414 Dancers and choreographers\n*   3417 Photographers, audio-visual and broadcasting equipment operators\n*   3422 Clothing, fashion and accessories designers\n*   3429 Design occupations not elsewhere classified – only the following job types: \n    *   Industrial and product designers\n    *   Packaging designers\n    *   Performance make-up artists\n    *   Set designers\n    *   Visual merchandising managers and designers\n\n*   3512 Ship and hovercraft officers\n*   3520 Legal associate professionals\n*   3532 Insurance underwriters\n*   3533 Financial and accounting technicians\n*   3541 Estimators, valuers and assessors\n*   3544 Data analysts\n*   3549 Business associate professionals not elsewhere classified – only the following job types: \n    *   Business support officers\n    *   Business systems analysts\n    *   Contract administrators\n    *   Clinical coders\n    *   Clinical trials administrators\n    *   Research coordinators\n\n*   3552 Business sales executives\n*   3554 Advertising and marketing associate professionals\n*   3571 Human resources and industrial relations officers\n*   3573 Information technology trainers\n*   4121 Credit controllers\n*   4122 Book-keepers, payroll managers and wages clerks\n*   4129 Financial administrative occupations not elsewhere classified – only the following job types: \n    *   Box office assistants\n    *   Grants officers\n    *   Mortgage administrators\n    *   Revenue assistants (excludes National and Local government revenue occupations)\n    *   Treasury assistants\n\n*   4132 Pensions and insurance clerks and assistants\n*   5213 Welding trades\n*   5214 Pipe fitters\n*   5223 Metal working production and maintenance fitters\n*   5225 Air-conditioning and refrigeration installers and repairers\n*   5231 Vehicle technicians, mechanics and electricians\n*   5232 Vehicle body builders and repairers\n*   5233 Vehicle paint technicians\n*   5235 Boat and ship builders and repairers\n*   5241 Electricians and electrical fitters\n*   5242 Telecoms and related network installers and repairers\n*   5244 Computer system and equipment installers and servicers\n*   5245 Security system installers and repairers\n*   5249 Electrical and electronic trades not elsewhere classified\n*   5311 Steel erectors\n*   5315 Plumbers and heating and ventilating installers and repairers\n*   5319 Construction and building trades not elsewhere classified – only the following job types: \n    *   Builders\n    *   Divers\n    *   Fence erectors\n    *   Industrial climbers\n    *   Remotely Operated Vehicle (ROV) operators\n    *   Steel fixers and underpinners\n\n*   5322 Floorers and wall tilers\n*   5323 Painters and decorators\n*   5330 Construction and building trades supervisors\n*   8133 Energy plant operatives\n\n1.   SW 6.1B. If the applicant is being sponsored in the SOC 2020 occupation code “6135 Care workers and home carers” or “6136 Senior care workers”, the application must be for permission to stay, and either: \n    1.   (a) (i) the applicant must have been legally working for the sponsor in one of these SOC 2020 occupation codes for at least the three months ending on the date the certificate of sponsorship was issued by the sponsor to the applicant; and \n        1.   (ii) the date of application must be before 22 July 2028; or\n\n    2.   (b) the applicant must have permission as a Skilled Worker, sponsored in either of these SOC 2020 occupations codes (or the SOC 2010 occupation codes “6145 Care workers and home carers” or “6146 Senior care workers”) (except that where the Exceptions for overstayers section of Part Suitability applies, that period of overstaying will be disregarded).\n\n1.   SW 6.1C. If SW 6.1B applies and the applicant: \n    1.   (a) was previously granted permission as a Skilled Worker, sponsored in the SOC 2010 occupation code “6145 Care workers and home carers” or “6146 Senior care workers”, under the Rules in force before 11 March 2024; and\n    2.   (b) since then, has continuously had permission as a Skilled Worker, sponsored in either or both these SOC 2010 occupation codes, or SOC 2020 occupation codes “6135 Care workers and home carers” or “6136 Senior care workers” (except that where the Exceptions for overstayers section of Part Suitability applies, that period of overstaying will be disregarded); and\n    3.   (c) is applying to continue working with the same sponsor as in their most recent grant of permission,\n\n2.   the Care Quality Commission regulation requirement for these occupation codes does not apply.\n\n1.   SW 6.2. The sponsor must choose an appropriate SOC 2020 occupation code, and the decision maker must not have reasonable grounds to believe the sponsor has chosen a less appropriate SOC 2020 occupation code for any of the following reasons: \n    1.   (a) the most appropriate SOC 2020 occupation code is not eligible under the Skilled Worker route; or\n    2.   (b) the most appropriate SOC 2020 occupation code has a higher going rate than the proposed salary; or\n    3.   (c) the most appropriate SOC 2020 occupation code is not on the Immigration Salary List and the applicant is claiming points for a job on the Immigration Salary List; or\n    4.   (d) the most appropriate SOC 2020 occupation code is not listed as “eligible for PhD points” in Table 1 of Appendix Skilled Occupations and the applicant is claiming points for an educational qualification.\n\n1.   SW 6.3. To support the assessment in SW 6.2., the decision maker may, in particular, consider: \n    1.   (a) whether the sponsor has shown a genuine need for the job as described; and\n    2.   (b) whether the applicant has the appropriate skills, qualifications and experience needed to do the job as described; and\n    3.   (c) the sponsor’s history of compliance with the immigration system including, but not limited to, paying its sponsored workers appropriately; and\n    4.   (d) any additional information from the sponsor.\n\nSW 6.3A. If the ATAS requirement in Appendix ATAS applies, the applicant must provide a valid ATAS certificate.\n\nSW 6.4. If the requirements in SW 6.1. to SW 6.3A. are met, an applicant will be awarded 20 mandatory points for a job at the appropriate skill level, subject to SW 6.5.\n\nSW 6.5. No points will be awarded for a job at the appropriate skill level if the applicant is not also being awarded the 20 mandatory points for sponsorship under SW 5.7.",
      "needs_review": false
    },
    {
      "metadata": {
        "source": "Immigration Rules Appendix Skilled Worker",
        "part": "Immigration Rules Appendix Skilled Worker",
        "section_id": "SW 7.1",
        "section_title": "Points for the English language requirement (mandatory)",
        "parent_section": "SW 7",
        "hierarchy_level": 2,
        "topic": "english-language",
        "url": "https://www.gov.uk/guidance/immigration-rules/immigration-rules-appendix-skilled-worker",
        "scraped_at": "2025-12-06T17:28:54.497122"
      },
      "text": "### Points for the English language requirement (mandatory)\n\nSW 7.1. An applicant must show English language ability on the Common European Framework of Reference for Languages in all 4 components (reading, writing, speaking and listening) of at least level B1.\n\nSW 7.2. The applicant must show they meet the English language requirement as specified in Appendix English Language.\n\nSW 7.3. If the requirements in SW 7.1. to SW 7.2. are met, the applicant will be awarded 10 mandatory points for meeting the English language requirement.",
      "summary": "Skilled Worker applicants must demonstrate at least B1 level in all four skills (reading, writing, speaking, listening) per CEFR standards and meet criteria in Appendix English Language to earn 10 mandatory points.",
      "augmented_text": "Document: Immigration Rules Appendix Skilled Worker\nPart: Immigration Rules Appendix Skilled Worker\nSection ID: SW 7.1\nSection: Points for the English language requirement (mandatory)\nTopic: english-language\n\nSummary: Skilled Worker applicants must demonstrate at least B1 level in all four skills (reading, writing, speaking, listening) per CEFR standards and meet criteria in Appendix English Language to earn 10 mandatory points.\n\n### Points for the English language requirement (mandatory)\n\nSW 7.1. An applicant must show English language ability on the Common European Framework of Reference for Languages in all 4 components (reading, writing, speaking and listening) of at least level B1.\n\nSW 7.2. The applicant must show they meet the English language requirement as specified in Appendix English Language.\n\nSW 7.3. If the requirements in SW 7.1. to SW 7.2. are met, the applicant will be awarded 10 mandatory points for meeting the English language requirement.",
      "needs_review": false
    },
    {
      "metadata": {
        "source": "Immigration Rules Appendix Skilled Worker",
        "part": "Immigration Rules Appendix Skilled Worker",
        "section_id": "1",
        "section_title": "Points options A and F",
        "parent_section": null,
        "hierarchy_level": 1,
        "topic": "financial",
        "url": "https://www.gov.uk/guidance/immigration-rules/immigration-rules-appendix-skilled-worker",
        "scraped_at": "2025-12-06T17:28:54.497130"
      },
      "text": "### Points options A and F\n\n1.   SW 8.1. The applicant must meet the going rate salary requirement for the SOC 2020 occupation code they are being sponsored for a job in, as shown for the relevant option in: \n    1.   (a) Table 1 or Table 1a of Appendix Skilled Occupations, if being awarded points under option A; or\n    2.   (b) Table 2, Table 2aa or Table 2a of Appendix Skilled Occupations, if being awarded points under option F.",
      "summary": "Applicants must meet the specified going rate salary for their SOC 2020 occupation when applying under Points options A or F, based on the relevant salary tables; meeting this threshold is essential for eligibility.",
      "augmented_text": "Document: Immigration Rules Appendix Skilled Worker\nPart: Immigration Rules Appendix Skilled Worker\nSection ID: 1\nSection: Points options A and F\nTopic: financial\n\nSummary: Applicants must meet the specified going rate salary for their SOC 2020 occupation when applying under Points options A or F, based on the relevant salary tables; meeting this threshold is essential for eligibility.\n\n### Points options A and F\n\n1.   SW 8.1. The applicant must meet the going rate salary requirement for the SOC 2020 occupation code they are being sponsored for a job in, as shown for the relevant option in: \n    1.   (a) Table 1 or Table 1a of Appendix Skilled Occupations, if being awarded points under option A; or\n    2.   (b) Table 2, Table 2aa or Table 2a of Appendix Skilled Occupations, if being awarded points under option F.",
      "needs_review": false
    },
    {
      "metadata": {
        "source": "Immigration Rules Appendix Skilled Worker",
        "part": "Immigration Rules Appendix Skilled Worker",
        "section_id": "1",
        "section_title": "Points options B and G",
        "parent_section": null,
        "hierarchy_level": 1,
        "topic": "eligibility",
        "url": "https://www.gov.uk/guidance/immigration-rules/immigration-rules-appendix-skilled-worker",
        "scraped_at": "2025-12-06T17:28:54.497140"
      },
      "text": "### Points options B and G\n\n1.   SW 9.1. The applicant must be sponsored for a job in a SOC 2020 occupation code listed as being “eligible for PhD points” in: \n    1.   (a) Table 1 or Table 1a of Appendix Skilled Occupations, if being awarded points under option B; or\n    2.   (b) Table 2, Table 2aa or Table 2a of Appendix Skilled Occupations, if being awarded points under option G;\n\n2.   and the applicant must meet the relevant going rate salary requirement for the SOC 2020 occupation code shown for the relevant option in that table.\n\nSW 9.2. The applicant must have a UK PhD or other academic doctoral qualification, or an overseas academic qualification which Ecctis confirms meets the recognised standard of a UK PhD.\n\nSW 9.3. The applicant’s sponsor must have provided a credible explanation of how the qualification is relevant to the job for which the applicant is being sponsored.\n\nSW 9.4. If the applicant has been correctly awarded points for an educational qualification in a previous grant of permission as a Skilled Worker, the applicant does not need to provide evidence of the qualification again, but the sponsor must still have provided the explanation of how the qualification is relevant to the job for which the applicant is being sponsored.",
      "summary": "Applicants must be sponsored for roles in specific SOC codes listed as “eligible for PhD points” and meet the relevant salary requirements. They must hold a UK or recognized overseas PhD, with the sponsor explaining the qualification's relevance; previous valid qualifications do not require re-submission.",
      "augmented_text": "Document: Immigration Rules Appendix Skilled Worker\nPart: Immigration Rules Appendix Skilled Worker\nSection ID: 1\nSection: Points options B and G\nTopic: eligibility\n\nSummary: Applicants must be sponsored for roles in specific SOC codes listed as “eligible for PhD points” and meet the relevant salary requirements. They must hold a UK or recognized overseas PhD, with the sponsor explaining the qualification's relevance; previous valid qualifications do not require re-submission.\n\n### Points options B and G\n\n1.   SW 9.1. The applicant must be sponsored for a job in a SOC 2020 occupation code listed as being “eligible for PhD points” in: \n    1.   (a) Table 1 or Table 1a of Appendix Skilled Occupations, if being awarded points under option B; or\n    2.   (b) Table 2, Table 2aa or Table 2a of Appendix Skilled Occupations, if being awarded points under option G;\n\n2.   and the applicant must meet the relevant going rate salary requirement for the SOC 2020 occupation code shown for the relevant option in that table.\n\nSW 9.2. The applicant must have a UK PhD or other academic doctoral qualification, or an overseas academic qualification which Ecctis confirms meets the recognised standard of a UK PhD.\n\nSW 9.3. The applicant’s sponsor must have provided a credible explanation of how the qualification is relevant to the job for which the applicant is being sponsored.\n\nSW 9.4. If the applicant has been correctly awarded points for an educational qualification in a previous grant of permission as a Skilled Worker, the applicant does not need to provide evidence of the qualification again, but the sponsor must still have provided the explanation of how the qualification is relevant to the job for which the applicant is being sponsored.",
      "needs_review": false
    },
    {
      "metadata": {
        "source": "Immigration Rules Appendix Skilled Worker",
        "part": "Immigration Rules Appendix Skilled Worker",
        "section_id": "1",
        "section_title": "Points options C and H",
        "parent_section": null,
        "hierarchy_level": 1,
        "topic": "eligibility",
        "url": "https://www.gov.uk/guidance/immigration-rules/immigration-rules-appendix-skilled-worker",
        "scraped_at": "2025-12-06T17:28:54.497148"
      },
      "text": "### Points options C and H\n\n1.   SW 10.1. The applicant must be sponsored for a job in a SOC 2020 occupation code listed as being “eligible for PhD points” in: \n    1.   (a) Table 1 or Table 1a of Appendix Skilled Occupations, if being awarded points under option C; or\n    2.   (b) Table 2, Table 2aa or Table 2a of Appendix Skilled Occupations, if being awarded points under option H;\n\n2.   and the applicant must meet the relevant going rate salary requirement for the SOC 2020 occupation code shown for the relevant option in that table.\n\nSW 10.2. The applicant must meet the requirements in SW 9.2. to SW 9.4.\n\nSW 10.3. The applicant’s sponsor must have provided a credible explanation that the qualification in question is in a Science, Technology, Engineering or Mathematics (STEM) subject.",
      "summary": "Applicants applying under Points options C or H must be sponsored for a PhD-eligible SOC 2020 occupation and meet the relevant salary threshold, with their sponsor providing a credible STEM qualification explanation. Specific occupation tables and conditions apply.",
      "augmented_text": "Document: Immigration Rules Appendix Skilled Worker\nPart: Immigration Rules Appendix Skilled Worker\nSection ID: 1\nSection: Points options C and H\nTopic: eligibility\n\nSummary: Applicants applying under Points options C or H must be sponsored for a PhD-eligible SOC 2020 occupation and meet the relevant salary threshold, with their sponsor providing a credible STEM qualification explanation. Specific occupation tables and conditions apply.\n\n### Points options C and H\n\n1.   SW 10.1. The applicant must be sponsored for a job in a SOC 2020 occupation code listed as being “eligible for PhD points” in: \n    1.   (a) Table 1 or Table 1a of Appendix Skilled Occupations, if being awarded points under option C; or\n    2.   (b) Table 2, Table 2aa or Table 2a of Appendix Skilled Occupations, if being awarded points under option H;\n\n2.   and the applicant must meet the relevant going rate salary requirement for the SOC 2020 occupation code shown for the relevant option in that table.\n\nSW 10.2. The applicant must meet the requirements in SW 9.2. to SW 9.4.\n\nSW 10.3. The applicant’s sponsor must have provided a credible explanation that the qualification in question is in a Science, Technology, Engineering or Mathematics (STEM) subject.",
      "needs_review": false
    },
    {
      "metadata": {
        "source": "Immigration Rules Appendix Skilled Worker",
        "part": "Immigration Rules Appendix Skilled Worker",
        "section_id": "SW 11.1",
        "section_title": "Points options D and I",
        "parent_section": "SW 11",
        "hierarchy_level": 2,
        "topic": "eligibility",
        "url": "https://www.gov.uk/guidance/immigration-rules/immigration-rules-appendix-skilled-worker",
        "scraped_at": "2025-12-06T17:28:54.497157"
      },
      "text": "### Points options D and I\n\nSW 11.1. The applicant must be sponsored for a job in an eligible SOC 2020 occupation code (or, where relevant, an eligible job within a SOC 2020 occupation code) listed in Appendix Immigration Salary List for the nation of the UK where that job is based, unless SW 11.2. applies.\n\n1.   SW 11.2. If, on or before the date the sponsor assigned the Certificate of Sponsorship to the applicant, the applicant’s job was removed from Appendix Immigration Salary List (or the previous Appendix Shortage Occupation List), both of the following conditions must be met: \n    1.   (a) the applicant’s most recent permission was as a Skilled Worker in which they were sponsored to work in a job listed in Appendix Immigration Salary List (or the previous Appendix Shortage Occupation List) under the applicable rules at that time; and\n    2.   (b) the applicant is being sponsored to continue working in the same job for the same sponsor as in their previous permission.\n\n1.   SW 11.3. The applicant must meet the going rate salary requirement for the SOC 2020 occupation code they are being sponsored for a job in, as shown for the relevant option in: \n    1.   (a) Table 1 or Table 1a of Appendix Skilled Occupations, if being awarded points under option D; or\n    2.   (b) Table 2, Table 2aa or Table 2a of Appendix Skilled Occupations, if being awarded points under option I.",
      "summary": "Applicants must be sponsored for a job in an eligible SOC 2020 code listed in the Immigration Salary List, unless previously employed in a qualifying shortage occupation and continuing in the same role. They must also meet the specified salary thresholds for their occupation as per the relevant tables in the Appendix.",
      "augmented_text": "Document: Immigration Rules Appendix Skilled Worker\nPart: Immigration Rules Appendix Skilled Worker\nSection ID: SW 11.1\nSection: Points options D and I\nTopic: eligibility\n\nSummary: Applicants must be sponsored for a job in an eligible SOC 2020 code listed in the Immigration Salary List, unless previously employed in a qualifying shortage occupation and continuing in the same role. They must also meet the specified salary thresholds for their occupation as per the relevant tables in the Appendix.\n\n### Points options D and I\n\nSW 11.1. The applicant must be sponsored for a job in an eligible SOC 2020 occupation code (or, where relevant, an eligible job within a SOC 2020 occupation code) listed in Appendix Immigration Salary List for the nation of the UK where that job is based, unless SW 11.2. applies.\n\n1.   SW 11.2. If, on or before the date the sponsor assigned the Certificate of Sponsorship to the applicant, the applicant’s job was removed from Appendix Immigration Salary List (or the previous Appendix Shortage Occupation List), both of the following conditions must be met: \n    1.   (a) the applicant’s most recent permission was as a Skilled Worker in which they were sponsored to work in a job listed in Appendix Immigration Salary List (or the previous Appendix Shortage Occupation List) under the applicable rules at that time; and\n    2.   (b) the applicant is being sponsored to continue working in the same job for the same sponsor as in their previous permission.\n\n1.   SW 11.3. The applicant must meet the going rate salary requirement for the SOC 2020 occupation code they are being sponsored for a job in, as shown for the relevant option in: \n    1.   (a) Table 1 or Table 1a of Appendix Skilled Occupations, if being awarded points under option D; or\n    2.   (b) Table 2, Table 2aa or Table 2a of Appendix Skilled Occupations, if being awarded points under option I.",
      "needs_review": false
    },
    {
      "metadata": {
        "source": "Immigration Rules Appendix Skilled Worker",
        "part": "Immigration Rules Appendix Skilled Worker",
        "section_id": "1",
        "section_title": "Points options E and J",
        "parent_section": null,
        "hierarchy_level": 1,
        "topic": "financial",
        "url": "https://www.gov.uk/guidance/immigration-rules/immigration-rules-appendix-skilled-worker",
        "scraped_at": "2025-12-06T17:28:54.497171"
      },
      "text": "### Points options E and J\n\n1.   SW 12.1. The applicant must meet the going rate salary requirement for the SOC 2020 occupation code they are being sponsored for a job in, as shown for the relevant option in: \n    1.   (a) Table 1 or Table 1a of Appendix Skilled Occupations, if being awarded points under option E; or\n    2.   (b) Table 2, Table 2aa or Table 2a of Appendix Skilled Occupations, if being awarded points under option J.\n\n1.   SW 12.2. The applicant must meet one or more of the following requirements: \n    1.   (a) the applicant must be under the age of 26 on the date of application; or\n    2.   (b) the job for which the applicant is being sponsored must be a postdoctoral position in any of the following SOC 2020 occupation codes: \n        1.   • 2111 Chemical scientists\n        2.   • 2112 Biological scientists\n        3.   • 2113 Biochemists and biomedical scientists\n        4.   • 2114 Physical scientists\n        5.   • 2115 Social and humanities scientists\n        6.   • 2119 Natural and social science professionals not elsewhere classified\n        7.   • 2162 Other researchers, unspecified discipline\n        8.   • 2311 Higher education teaching professionals; or\n\n    3.   (c) the job for which the applicant is being sponsored must be in a UK Regulated Profession and the applicant must be working towards a recognised UK professional qualification for that profession; or\n    4.   (d) the applicant must be working towards full registration or chartered status with the relevant professional body for the job for which they are being sponsored; or\n    5.   (e) all of the following conditions apply: \n        1.   (i) the applicant’s most recent permission (disregarding any permission as a visitor) was as a Student; and\n        2.   (ii) if that Student permission has expired, it must have expired less than 2 years before the date of application; and\n        3.   (iii) in that Student permission or any previous permission as a Student, the applicant was sponsored to study one of the following courses (not any other qualifications of an equivalent level): \n            1.   • a UK bachelor’s degree; or\n            2.   • a UK master’s degree; or\n            3.   • a UK PhD or other doctoral qualification; or\n            4.   • a Postgraduate Certificate in Education; or\n            5.   • a Professional Graduate Diploma of Education; and\n\n        4.   (iv) the applicant has completed (or is applying no more than 3 months before they are expected to complete) the course in SW 12.2(e)(iii) above, or the applicant is currently studying for a PhD for which they have completed at least 12 months study in the UK, or\n\n    6.   (f) the applicant’s most recent permission (disregarding any permission as a visitor) was as a Graduate, and if that permission has expired, it must have expired less than 2 years before the date of application.\n\nSW 12.3. Granting the application must not mean the applicant’s combined permission as a Skilled Worker, Graduate and/or Tier 2 Migrant would be more than 4 years in total, whether or not the permission is for a continuous period.",
      "summary": "Applicants must meet the salary threshold for their SOC code under Points options E or J and satisfy one of these conditions: be under 26, hold a postdoctoral role in specific science or research fields, work in a UK-regulated profession while pursuing a recognized qualification, or be progressing toward full registration or chartered status.",
      "augmented_text": "Document: Immigration Rules Appendix Skilled Worker\nPart: Immigration Rules Appendix Skilled Worker\nSection ID: 1\nSection: Points options E and J\nTopic: financial\n\nSummary: Applicants must meet the salary threshold for their SOC code under Points options E or J and satisfy one of these conditions: be under 26, hold a postdoctoral role in specific science or research fields, work in a UK-regulated profession while pursuing a recognized qualification, or be progressing toward full registration or chartered status.\n\n### Points options E and J\n\n1.   SW 12.1. The applicant must meet the going rate salary requirement for the SOC 2020 occupation code they are being sponsored for a job in, as shown for the relevant option in: \n    1.   (a) Table 1 or Table 1a of Appendix Skilled Occupations, if being awarded points under option E; or\n    2.   (b) Table 2, Table 2aa or Table 2a of Appendix Skilled Occupations, if being awarded points under option J.\n\n1.   SW 12.2. The applicant must meet one or more of the following requirements: \n    1.   (a) the applicant must be under the age of 26 on the date of application; or\n    2.   (b) the job for which the applicant is being sponsored must be a postdoctoral position in any of the following SOC 2020 occupation codes: \n        1.   • 2111 Chemical scientists\n        2.   • 2112 Biological scientists\n        3.   • 2113 Biochemists and biomedical scientists\n        4.   • 2114 Physical scientists\n        5.   • 2115 Social and humanities scientists\n        6.   • 2119 Natural and social science professionals not elsewhere classified\n        7.   • 2162 Other researchers, unspecified discipline\n        8.   • 2311 Higher education teaching professionals; or\n\n    3.   (c) the job for which the applicant is being sponsored must be in a UK Regulated Profession and the applicant must be working towards a recognised UK professional qualification for that profession; or\n    4.   (d) the applicant must be working towards full registration or chartered status with the relevant professional body for the job for which they are being sponsored; or\n    5.   (e) all of the following conditions apply: \n        1.   (i) the applicant’s most recent permission (disregarding any permission as a visitor) was as a Student; and\n        2.   (ii) if that Student permission has expired, it must have expired less than 2 years before the date of application; and\n        3.   (iii) in that Student permission or any previous permission as a Student, the applicant was sponsored to study one of the following courses (not any other qualifications of an equivalent level): \n            1.   • a UK bachelor’s degree; or\n            2.   • a UK master’s degree; or\n            3.   • a UK PhD or other doctoral qualification; or\n            4.   • a Postgraduate Certificate in Education; or\n            5.   • a Professional Graduate Diploma of Education; and\n\n        4.   (iv) the applicant has completed (or is applying no more than 3 months before they are expected to complete) the course in SW 12.2(e)(iii) above, or the applicant is currently studying for a PhD for which they have completed at least 12 months study in the UK, or\n\n    6.   (f) the applicant’s most recent permission (disregarding any permission as a visitor) was as a Graduate, and if that permission has expired, it must have expired less than 2 years before the date of application.\n\nSW 12.3. Granting the application must not mean the applicant’s combined permission as a Skilled Worker, Graduate and/or Tier 2 Migrant would be more than 4 years in total, whether or not the permission is for a continuous period.",
      "needs_review": false
    },
    {
      "metadata": {
        "source": "Immigration Rules Appendix Skilled Worker",
        "part": "Immigration Rules Appendix Skilled Worker",
        "section_id": "SW 13.1",
        "section_title": "Points option K",
        "parent_section": "SW 13",
        "hierarchy_level": 2,
        "topic": "financial",
        "url": "https://www.gov.uk/guidance/immigration-rules/immigration-rules-appendix-skilled-worker",
        "scraped_at": "2025-12-06T17:28:54.497182"
      },
      "text": "### Points option K\n\nSW 13.1. The applicant must meet the going rate salary requirement for the SOC 2020 occupation code they are being sponsored for a job in (or, where relevant, the job within that SOC 2020 occupation code), as shown in Table 3, 3a, 4 or 5 of Appendix Skilled Occupations.\n\n1.   SW 13.2. If the applicant is being sponsored for a job in one of the following SOC 2020 occupation codes: \n    1.   • 2231 Midwifery nurses\n    2.   •2232 Community nurses\n    3.   • 2233 Specialist nurses\n    4.   • 2234 Nurse practitioners\n    5.   • 2235 Mental health nurses\n    6.   • 2236 Children’s nurses\n    7.   • 2237 Other nursing professionals\n\n2.   their salary may be temporarily (for up to 8 months) less than the £25,000 per year required under points option K in either of the following circumstances: \n    1.   (a) the applicant has previously held Nursing and Midwifery Council (NMC) registration and is undertaking an NMC-approved programme with a view to returning to practice; or\n    2.   (b) the applicant is working towards NMC registration, and both of the following apply: \n        1.   (i) the applicant has passed the NMC’s English language requirements and Computer Based Test of competence, before the date of application; and\n        2.   (ii) the applicant will sit an Objective Structured Clinical Examination (OSCE) to obtain NMC registration no later than 3 months after the stated job start date.\n\n1.   SW 13.3. Where SW 13.2. applies: \n    1.   (a) the sponsor must have confirmed that the applicant will stop being sponsored if they do not achieve full NMC registration within 8 months of the job start date (if the applicant was last granted permission to work in one of the SOC 2020 occupation codes in SW 13.2, or either of the SOC 2010 occupation codes “2231 Nurses” or “2232 Midwives”, on the Skilled Worker route, the 8 months is counted from the start date of the job they were sponsored to do in their most recent permission); and\n    2.   (b) during the 8 months in (a), or until the applicant achieves NMC registration (if sooner), the applicant’s salary must be at least equal to the appropriate Agenda for Change Band 3 rate, as stated in Table 4 of Appendix Skilled Occupations.",
      "summary": "Applicants seeking Skilled Worker visas must meet the relevant salary threshold for their SOC 2020 occupation, with certain nursing roles allowed temporary below-threshold pay for up to 8 months if pursuing or returning to NMC registration. This exemption applies only under specific qualifications related to nursing registration and training milestones.",
      "augmented_text": "Document: Immigration Rules Appendix Skilled Worker\nPart: Immigration Rules Appendix Skilled Worker\nSection ID: SW 13.1\nSection: Points option K\nTopic: financial\n\nSummary: Applicants seeking Skilled Worker visas must meet the relevant salary threshold for their SOC 2020 occupation, with certain nursing roles allowed temporary below-threshold pay for up to 8 months if pursuing or returning to NMC registration. This exemption applies only under specific qualifications related to nursing registration and training milestones.\n\n### Points option K\n\nSW 13.1. The applicant must meet the going rate salary requirement for the SOC 2020 occupation code they are being sponsored for a job in (or, where relevant, the job within that SOC 2020 occupation code), as shown in Table 3, 3a, 4 or 5 of Appendix Skilled Occupations.\n\n1.   SW 13.2. If the applicant is being sponsored for a job in one of the following SOC 2020 occupation codes: \n    1.   • 2231 Midwifery nurses\n    2.   •2232 Community nurses\n    3.   • 2233 Specialist nurses\n    4.   • 2234 Nurse practitioners\n    5.   • 2235 Mental health nurses\n    6.   • 2236 Children’s nurses\n    7.   • 2237 Other nursing professionals\n\n2.   their salary may be temporarily (for up to 8 months) less than the £25,000 per year required under points option K in either of the following circumstances: \n    1.   (a) the applicant has previously held Nursing and Midwifery Council (NMC) registration and is undertaking an NMC-approved programme with a view to returning to practice; or\n    2.   (b) the applicant is working towards NMC registration, and both of the following apply: \n        1.   (i) the applicant has passed the NMC’s English language requirements and Computer Based Test of competence, before the date of application; and\n        2.   (ii) the applicant will sit an Objective Structured Clinical Examination (OSCE) to obtain NMC registration no later than 3 months after the stated job start date.\n\n1.   SW 13.3. Where SW 13.2. applies: \n    1.   (a) the sponsor must have confirmed that the applicant will stop being sponsored if they do not achieve full NMC registration within 8 months of the job start date (if the applicant was last granted permission to work in one of the SOC 2020 occupation codes in SW 13.2, or either of the SOC 2010 occupation codes “2231 Nurses” or “2232 Midwives”, on the Skilled Worker route, the 8 months is counted from the start date of the job they were sponsored to do in their most recent permission); and\n    2.   (b) during the 8 months in (a), or until the applicant achieves NMC registration (if sooner), the applicant’s salary must be at least equal to the appropriate Agenda for Change Band 3 rate, as stated in Table 4 of Appendix Skilled Occupations.",
      "needs_review": false
    },
    {
      "metadata": {
        "source": "Immigration Rules Appendix Skilled Worker",
        "part": "Immigration Rules Appendix Skilled Worker",
        "section_id": "SW 14.1",
        "section_title": "Consideration of salary (all tradeable points options)",
        "parent_section": "SW 14",
        "hierarchy_level": 2,
        "topic": "financial",
        "url": "https://www.gov.uk/guidance/immigration-rules/immigration-rules-appendix-skilled-worker",
        "scraped_at": "2025-12-06T17:28:54.497194"
      },
      "text": "### Consideration of salary (all tradeable points options)\n\nSW 14.1. Salary only includes guaranteed basic gross pay (before income tax and including employee pension and national insurance contributions) and other guaranteed payments which are treated exactly the same as basic gross pay for tax, pension and national insurance purposes .\n\n1.   SW 14.2. Salary does not include other pay and benefits, such as any of the following: \n    1.   (a) pay which cannot be guaranteed because the nature of the job means that hours fluctuate; or\n    2.   (b) additional pay such as shift, overtime or bonus pay, (whether or not it is guaranteed); or\n    3.   (c) employer pension and employer national insurance contributions; or\n    4.   (d) any allowances, such as accommodation or cost of living allowances; or\n    5.   (e) in-kind benefits, such as equity shares, health insurance, school or university fees, company cars or food; or\n    6.   (f) one-off payments, such as ‘golden hellos’; or\n    7.   (g) any payments relating to immigration costs, such as the fee or Immigration Health Charge; or\n    8.   (h) payments to cover business expenses, including (but not limited to) travel to and from the applicant’s country of residence, equipment, clothing, travel or subsistence.\n\n1.   SW 14.2A. Any money paid by the applicant to the sponsor (or a related organisation) will be considered as follows: \n    1.   (a) The following payments will be subtracted from salary, unless (c) applies: \n        1.   (i) deductions from salary; or\n        2.   (ii) repayments of loans; or\n        3.   (iii) investments.\n\n    2.   (b) Any such subtractions will be averaged over the length of time the applicant is being sponsored for, for the purpose of salary considerations.\n    3.   (c) Money will not be deducted where the payment is not related to business costs, immigration costs or investment, but rather an additional benefit offer which the applicant has a genuine choice whether to take up, for example salary sacrifice arrangements.\n\nSW 14.3. If the applicant is being sponsored to work more than 48 hours a week, subject to SW 14.3A, only the salary for the first 48 hours a week will be considered towards the salary thresholds referred to in the table following SW 4.4.\n\nFor example, an applicant who works 60 hours a week for £15 per hour will be considered to have a salary of £37,440 (£15 x 48 x 52) per year and not £46,800 (£15 x 60 x 52).\n\n1.   SW 14.3A. If the applicant is being sponsored to work a pattern where the regular hours are not the same each week, resulting in uneven pay: \n    1.   (a) work in excess of 48 hours in some weeks can be considered towards the salary thresholds, providing the average over a regular cycle (which can be less than, but not more than, 17 weeks) is not more than 48 hours a week; and\n    2.   (b) any unpaid rest weeks will count towards the average when considering whether the salary thresholds are met; and\n    3.   (c) any unpaid rest weeks will not count as absences from employment for the purpose of paragraph SUI 36.1. of Part Suitability of these rules.\n\n2.   For example, an applicant who works a pattern of 60 hours a week for £12 per hour for two weeks, followed by an unpaid rest week, will be considered to work 40 hours a week on average and have a salary of £24,960 (£12 x 40 x 52) per year.\n\n1.   SW 14.4. Going rates will be pro-rated to the applicant’s working pattern, as follows: \n    1.   (a) going rates for SOC 2020 occupation codes listed in Tables 1 to 2a of Appendix Skilled Occupations are based on a 37.5-hour week and will be pro-rated as follows:\n\n2.   (the going rate for the SOC 2020 occupation code stated in Tables 1 to 2a of Appendix Skilled Occupations) x (the number of weekly working hours stated by the sponsor ÷ 37.5) \n    1.   (b) where an applicant’s salary is required to be 70%, 80% or 90% of the going rate, the resulting figure from the calculation in (a) will be multiplied by 0.7, 0.8 or 0.9 as appropriate, to calculate the required salary; and.\n    2.   (c) going rates for the health and education SOC 2020 occupation codes listed in Tables 3 to 5 of Appendix Skilled Occupations will be pro-rated as stated in Appendix Skilled Occupations; and\n    3.   (d) the applicant’s full weekly hours will be included when checking their salary against the going rate, even if they work more than 48 hours a week.",
      "summary": "This provision applies to Skilled Worker applicants and outlines how salary is assessed for tradeable points. Salary includes guaranteed basic gross pay, excluding bonuses, allowances, benefits, and non-guaranteed pay, with any payments made by the applicant to the sponsor deducted unless specified. Critical conditions include excluding non-guaranteed and in-kind payments and considering applicant payments in salary calculations.",
      "augmented_text": "Document: Immigration Rules Appendix Skilled Worker\nPart: Immigration Rules Appendix Skilled Worker\nSection ID: SW 14.1\nSection: Consideration of salary (all tradeable points options)\nTopic: financial\n\nSummary: This provision applies to Skilled Worker applicants and outlines how salary is assessed for tradeable points. Salary includes guaranteed basic gross pay, excluding bonuses, allowances, benefits, and non-guaranteed pay, with any payments made by the applicant to the sponsor deducted unless specified. Critical conditions include excluding non-guaranteed and in-kind payments and considering applicant payments in salary calculations.\n\n### Consideration of salary (all tradeable points options)\n\nSW 14.1. Salary only includes guaranteed basic gross pay (before income tax and including employee pension and national insurance contributions) and other guaranteed payments which are treated exactly the same as basic gross pay for tax, pension and national insurance purposes .\n\n1.   SW 14.2. Salary does not include other pay and benefits, such as any of the following: \n    1.   (a) pay which cannot be guaranteed because the nature of the job means that hours fluctuate; or\n    2.   (b) additional pay such as shift, overtime or bonus pay, (whether or not it is guaranteed); or\n    3.   (c) employer pension and employer national insurance contributions; or\n    4.   (d) any allowances, such as accommodation or cost of living allowances; or\n    5.   (e) in-kind benefits, such as equity shares, health insurance, school or university fees, company cars or food; or\n    6.   (f) one-off payments, such as ‘golden hellos’; or\n    7.   (g) any payments relating to immigration costs, such as the fee or Immigration Health Charge; or\n    8.   (h) payments to cover business expenses, including (but not limited to) travel to and from the applicant’s country of residence, equipment, clothing, travel or subsistence.\n\n1.   SW 14.2A. Any money paid by the applicant to the sponsor (or a related organisation) will be considered as follows: \n    1.   (a) The following payments will be subtracted from salary, unless (c) applies: \n        1.   (i) deductions from salary; or\n        2.   (ii) repayments of loans; or\n        3.   (iii) investments.\n\n    2.   (b) Any such subtractions will be averaged over the length of time the applicant is being sponsored for, for the purpose of salary considerations.\n    3.   (c) Money will not be deducted where the payment is not related to business costs, immigration costs or investment, but rather an additional benefit offer which the applicant has a genuine choice whether to take up, for example salary sacrifice arrangements.\n\nSW 14.3. If the applicant is being sponsored to work more than 48 hours a week, subject to SW 14.3A, only the salary for the first 48 hours a week will be considered towards the salary thresholds referred to in the table following SW 4.4.\n\nFor example, an applicant who works 60 hours a week for £15 per hour will be considered to have a salary of £37,440 (£15 x 48 x 52) per year and not £46,800 (£15 x 60 x 52).\n\n1.   SW 14.3A. If the applicant is being sponsored to work a pattern where the regular hours are not the same each week, resulting in uneven pay: \n    1.   (a) work in excess of 48 hours in some weeks can be considered towards the salary thresholds, providing the average over a regular cycle (which can be less than, but not more than, 17 weeks) is not more than 48 hours a week; and\n    2.   (b) any unpaid rest weeks will count towards the average when considering whether the salary thresholds are met; and\n    3.   (c) any unpaid rest weeks will not count as absences from employment for the purpose of paragraph SUI 36.1. of Part Suitability of these rules.\n\n2.   For example, an applicant who works a pattern of 60 hours a week for £12 per hour for two weeks, followed by an unpaid rest week, will be considered to work 40 hours a week on average and have a salary of £24,960 (£12 x 40 x 52) per year.\n\n1.   SW 14.4. Going rates will be pro-rated to the applicant’s working pattern, as follows: \n    1.   (a) going rates for SOC 2020 occupation codes listed in Tables 1 to 2a of Appendix Skilled Occupations are based on a 37.5-hour week and will be pro-rated as follows:\n\n2.   (the going rate for the SOC 2020 occupation code stated in Tables 1 to 2a of Appendix Skilled Occupations) x (the number of weekly working hours stated by the sponsor ÷ 37.5) \n    1.   (b) where an applicant’s salary is required to be 70%, 80% or 90% of the going rate, the resulting figure from the calculation in (a) will be multiplied by 0.7, 0.8 or 0.9 as appropriate, to calculate the required salary; and.\n    2.   (c) going rates for the health and education SOC 2020 occupation codes listed in Tables 3 to 5 of Appendix Skilled Occupations will be pro-rated as stated in Appendix Skilled Occupations; and\n    3.   (d) the applicant’s full weekly hours will be included when checking their salary against the going rate, even if they work more than 48 hours a week.",
      "needs_review": false
    },
    {
      "metadata": {
        "source": "Immigration Rules Appendix Skilled Worker",
        "part": "Immigration Rules Appendix Skilled Worker",
        "section_id": "1",
        "section_title": "Transitional arrangements for salary on the Skilled Worker route",
        "parent_section": null,
        "hierarchy_level": 1,
        "topic": "financial",
        "url": "https://www.gov.uk/guidance/immigration-rules/immigration-rules-appendix-skilled-worker",
        "scraped_at": "2025-12-06T17:28:54.497207"
      },
      "text": "### Transitional arrangements for salary on the Skilled Worker route\n\n1.   SW 14.5. If the applicant is applying for permission to stay or settlement, the applicant was granted permission as a Tier 2 (General) Migrant and has had continuous permission as a Skilled Worker ever since, the following transitional arrangements apply: \n    1.   (a) if the date of application is before 1 December 2026 salary may also include allowances (the other restrictions in SW 14.20 also apply), providing the following conditions are met: \n        1.   (i) the applicant is applying to work for the same sponsor as in their previous permission; and\n        2.   (ii) the allowances are guaranteed, will be paid for the duration of the applicant’s permission, and would be paid to a local settled worker in similar circumstances, such as London weighting; and\n\n    2.   (b) DELETED\n    3.   (c) if the applicant: \n        1.   (i) was sponsored to work in one of the SOC 2010 occupation codes in the table below at the time they applied for their last permission as a Tier 2 (General) Migrant; and\n        2.   (ii) has continued to be sponsored in that SOC 2010 occupation code or an equivalent SOC 2020 occupation code ever since (whether as a Tier 2 (General) Migrant and/or as a Skilled Worker); and\n        3.   (iii) the date of application is before 1 December 2026;\n\n2.   the going rates in the table below apply, instead of the going rates listed in Table 2 of Appendix Skilled Occupations. These going rates are based on a 37.5-hour working week and must be pro-rated for other working patterns, based on the weekly working hours stated by the applicant’s sponsor:\n\n| SOC 2010 occupation code | Equivalent SOC 2020 occupation code(s) | Going rate – options F and I | 90% of going rate – option G | 80% of going rate – option H | 70% of going rate – option J |\n| --- | --- | --- | --- | --- | --- |\n| 2113 Physical scientists | • 2114 Physical scientists | £27,190 (£13.94 per hour) | £25,000 (£12.82 per hour) | £25,000 (£12.82 per hour) | £25,000 (£12.82 per hour) |\n| 2119 Natural and social science professionals not elsewhere classified | • 2119 Natural and social science professionals not elsewhere classified • 2162 Other researchers, unspecified discipline | £27,190 (£13.94 per hour) | £25,000 (£12.82 per hour) | £25,000 (£12.82 per hour) | £25,000 (£12.82 per hour) |\n| 2311 Higher education teaching professionals | • 2162 Other researchers, unspecified discipline • 2311 Higher education teaching professionals • 2322 Education managers | £30,940 (£15.87 per hour) | £27,840 (£14.28 per hour) | £25,000 (£12.82 per hour) | £25,000 (£12.82 per hour) |\n\nSW 14.6. DELETED.",
      "summary": "Applicants applying to stay or settle as Skilled Workers must meet transitional salary arrangements if previously granted Tier 2 (General) permission, with allowances included if applied before 1 Dec 2026, provided continuous sponsorship and occupation conditions are met.",
      "augmented_text": "Document: Immigration Rules Appendix Skilled Worker\nPart: Immigration Rules Appendix Skilled Worker\nSection ID: 1\nSection: Transitional arrangements for salary on the Skilled Worker route\nTopic: financial\n\nSummary: Applicants applying to stay or settle as Skilled Workers must meet transitional salary arrangements if previously granted Tier 2 (General) permission, with allowances included if applied before 1 Dec 2026, provided continuous sponsorship and occupation conditions are met.\n\n### Transitional arrangements for salary on the Skilled Worker route\n\n1.   SW 14.5. If the applicant is applying for permission to stay or settlement, the applicant was granted permission as a Tier 2 (General) Migrant and has had continuous permission as a Skilled Worker ever since, the following transitional arrangements apply: \n    1.   (a) if the date of application is before 1 December 2026 salary may also include allowances (the other restrictions in SW 14.20 also apply), providing the following conditions are met: \n        1.   (i) the applicant is applying to work for the same sponsor as in their previous permission; and\n        2.   (ii) the allowances are guaranteed, will be paid for the duration of the applicant’s permission, and would be paid to a local settled worker in similar circumstances, such as London weighting; and\n\n    2.   (b) DELETED\n    3.   (c) if the applicant: \n        1.   (i) was sponsored to work in one of the SOC 2010 occupation codes in the table below at the time they applied for their last permission as a Tier 2 (General) Migrant; and\n        2.   (ii) has continued to be sponsored in that SOC 2010 occupation code or an equivalent SOC 2020 occupation code ever since (whether as a Tier 2 (General) Migrant and/or as a Skilled Worker); and\n        3.   (iii) the date of application is before 1 December 2026;\n\n2.   the going rates in the table below apply, instead of the going rates listed in Table 2 of Appendix Skilled Occupations. These going rates are based on a 37.5-hour working week and must be pro-rated for other working patterns, based on the weekly working hours stated by the applicant’s sponsor:\n\n| SOC 2010 occupation code | Equivalent SOC 2020 occupation code(s) | Going rate – options F and I | 90% of going rate – option G | 80% of going rate – option H | 70% of going rate – option J |\n| --- | --- | --- | --- | --- | --- |\n| 2113 Physical scientists | • 2114 Physical scientists | £27,190 (£13.94 per hour) | £25,000 (£12.82 per hour) | £25,000 (£12.82 per hour) | £25,000 (£12.82 per hour) |\n| 2119 Natural and social science professionals not elsewhere classified | • 2119 Natural and social science professionals not elsewhere classified • 2162 Other researchers, unspecified discipline | £27,190 (£13.94 per hour) | £25,000 (£12.82 per hour) | £25,000 (£12.82 per hour) | £25,000 (£12.82 per hour) |\n| 2311 Higher education teaching professionals | • 2162 Other researchers, unspecified discipline • 2311 Higher education teaching professionals • 2322 Education managers | £30,940 (£15.87 per hour) | £27,840 (£14.28 per hour) | £25,000 (£12.82 per hour) | £25,000 (£12.82 per hour) |\n\nSW 14.6. DELETED.",
      "needs_review": false
    },
    {
      "metadata": {
        "source": "Immigration Rules Appendix Skilled Worker",
        "part": "Immigration Rules Appendix Skilled Worker",
        "section_id": "SW 14A.1",
        "section_title": "Genuineness requirement for a Skilled Worker",
        "parent_section": null,
        "hierarchy_level": 1,
        "topic": "eligibility",
        "url": "https://www.gov.uk/guidance/immigration-rules/immigration-rules-appendix-skilled-worker",
        "scraped_at": "2025-12-06T17:28:54.497224"
      },
      "text": "### Genuineness requirement for a Skilled Worker\n\n1.   SW 14A.1. The applicant must: \n    1.   (a) genuinely intend, and be able, to undertake the role for which they are being sponsored; and\n    2.   (b) not intend to undertake employment other than in the role for which they are being sponsored, or as otherwise permitted by SW 18.2.",
      "summary": "Skilled Worker applicants must genuinely intend and be able to undertake their sponsored role, not engaging in other employment unless permitted. They must meet the genuineness requirement, with exceptions specified in SW 18.2.",
      "augmented_text": "Document: Immigration Rules Appendix Skilled Worker\nPart: Immigration Rules Appendix Skilled Worker\nSection ID: SW 14A.1\nSection: Genuineness requirement for a Skilled Worker\nTopic: eligibility\n\nSummary: Skilled Worker applicants must genuinely intend and be able to undertake their sponsored role, not engaging in other employment unless permitted. They must meet the genuineness requirement, with exceptions specified in SW 18.2.\n\n### Genuineness requirement for a Skilled Worker\n\n1.   SW 14A.1. The applicant must: \n    1.   (a) genuinely intend, and be able, to undertake the role for which they are being sponsored; and\n    2.   (b) not intend to undertake employment other than in the role for which they are being sponsored, or as otherwise permitted by SW 18.2.",
      "needs_review": false
    },
    {
      "metadata": {
        "source": "Immigration Rules Appendix Skilled Worker",
        "part": "Immigration Rules Appendix Skilled Worker",
        "section_id": "SW 15.1",
        "section_title": "Financial requirement (mandatory) for a Skilled Worker",
        "parent_section": "SW 15",
        "hierarchy_level": 2,
        "topic": "financial",
        "url": "https://www.gov.uk/guidance/immigration-rules/immigration-rules-appendix-skilled-worker",
        "scraped_at": "2025-12-06T17:28:54.497232"
      },
      "text": "### Financial requirement (mandatory) for a Skilled Worker\n\nSW 15.1. If the applicant is applying for permission to stay and has been in the UK with permission for 12 months or longer on the date of application, they will meet the financial requirement and do not need to show funds.\n\n1.   SW 15.2. If the applicant is applying for entry clearance, or has been in the UK for less than 12 months on the date of application, either: \n    1.   (a) the applicant must have funds of at least £1,270; or\n    2.   (b) the applicant’s A-rated sponsor must certify that they will, if necessary, maintain and accommodate the applicant up to the end of the first month of their employment, to an amount of at least £1,270.\n\nSW 15.3. If SW 15.2.(a) applies, the applicant must show that they have held the required funds for a 28-day period and as specified in Appendix Finance.",
      "summary": "Skilled Workers applying for entry clearance or with less than 12 months' UK permission must demonstrate at least £1,270 in funds or have an A-rated sponsor certify maintenance; applicants with over 12 months' UK permission are exempt. The funds must be held for 28 days if applicable.",
      "augmented_text": "Document: Immigration Rules Appendix Skilled Worker\nPart: Immigration Rules Appendix Skilled Worker\nSection ID: SW 15.1\nSection: Financial requirement (mandatory) for a Skilled Worker\nTopic: financial\n\nSummary: Skilled Workers applying for entry clearance or with less than 12 months' UK permission must demonstrate at least £1,270 in funds or have an A-rated sponsor certify maintenance; applicants with over 12 months' UK permission are exempt. The funds must be held for 28 days if applicable.\n\n### Financial requirement (mandatory) for a Skilled Worker\n\nSW 15.1. If the applicant is applying for permission to stay and has been in the UK with permission for 12 months or longer on the date of application, they will meet the financial requirement and do not need to show funds.\n\n1.   SW 15.2. If the applicant is applying for entry clearance, or has been in the UK for less than 12 months on the date of application, either: \n    1.   (a) the applicant must have funds of at least £1,270; or\n    2.   (b) the applicant’s A-rated sponsor must certify that they will, if necessary, maintain and accommodate the applicant up to the end of the first month of their employment, to an amount of at least £1,270.\n\nSW 15.3. If SW 15.2.(a) applies, the applicant must show that they have held the required funds for a 28-day period and as specified in Appendix Finance.",
      "needs_review": false
    },
    {
      "metadata": {
        "source": "Immigration Rules Appendix Skilled Worker",
        "part": "Immigration Rules Appendix Skilled Worker",
        "section_id": "1",
        "section_title": "Criminal record certificate requirement (mandatory) for a Skilled Worker",
        "parent_section": null,
        "hierarchy_level": 1,
        "topic": "leave-to-enter",
        "url": "https://www.gov.uk/guidance/immigration-rules/immigration-rules-appendix-skilled-worker",
        "scraped_at": "2025-12-06T17:28:54.497251"
      },
      "text": "### Criminal record certificate requirement (mandatory) for a Skilled Worker\n\n1.   SW 16.1. If the applicant is applying for entry clearance and is being sponsored for a job in any of the SOC 2020 occupation codes listed below, they must provide a criminal record certificate from the relevant authority in any country in which they have been present for 12 months or more (whether continuously or in total) in the 10 years before the date of application, and while aged 18 or over: \n    1.   • 1171 Health services and public health managers and directors\n    2.   • 1172 Social services managers and directors\n    3.   • 1231 Health care practice managers\n    4.   • 1232 Residential, day and domiciliary care managers and proprietors\n    5.   • 1233 Early education and childcare services proprietors\n    6.   • 2211 Generalist medical practitioners\n    7.   • 2212 Specialist medical practitioners\n    8.   • 2221 Physiotherapists\n    9.   • 2222 Occupational therapists\n    10.   • 2223 Speech and language therapists\n    11.   • 2224 Psychotherapists and cognitive behaviour therapists\n    12.   • 2225 Clinical psychologists\n    13.   • 2226 Other psychologists\n    14.   • 2229 Therapy professionals not elsewhere classified\n    15.   • 2231 Midwifery nurses\n    16.   • 2232 Community nurses\n    17.   • 2233 Specialist nurses\n    18.   • 2234 Nurse practitioners\n    19.   • 2235 Mental health nurses\n    20.   • 2236 Children’s nurses\n    21.   • 2237 Other nursing professionals\n    22.   • 2251 Pharmacists\n    23.   • 2252 Optometrists\n    24.   • 2253 Dental practitioners\n    25.   • 2254 Medical radiographers\n    26.   • 2255 Paramedics\n    27.   • 2256 Podiatrists\n    28.   • 2259 Other health professionals not elsewhere classified\n    29.   • 2312 Further education teaching professionals\n    30.   • 2313 Secondary education teaching professionals\n    31.   • 2314 Primary education teaching professionals\n    32.   • 2315 Nursery education teaching professionals\n    33.   • 2316 Special and additional needs education teaching professionals\n    34.   • 2317 Teachers of English as a foreign language\n    35.   • 2319 Teaching professionals not elsewhere classified\n    36.   • 2321 Head teachers and principals\n    37.   • 2322 Education managers\n    38.   • 2323 Education advisers and school inspectors\n    39.   • 2324 Early education and childcare services managers\n    40.   • 2329 Other educational professionals not elsewhere classified\n    41.   • 2461 Social workers\n    42.   • 2462 Probation officers\n    43.   •2464 Youth work professionals\n    44.   • 2469 Welfare professionals not elsewhere classified\n    45.   • 3211 Dispensing opticians\n    46.   • 3212 Pharmaceutical technicians\n    47.   • 3213 Medical and dental technicians\n    48.   • 3214 Complementary health associate professionals\n    49.   • 3219 Health associate professionals not elsewhere classified\n    50.   • 3221 Youth and community workers\n    51.   • 3222 Child and early years officers\n    52.   • 3223 Housing officers\n    53.   • 3224 Counsellors\n    54.   • 3229 Welfare and housing associate professionals not elsewhere classified\n    55.   • 3231 Higher level teaching assistants\n    56.   • 3232 Early education and childcare practitioners\n    57.   • 3433 Fitness and wellbeing instructors\n    58.   • 3571 Human resources and industrial relations officers\n    59.   • 6111 Early education and childcare assistants\n    60.   • 6112 Teaching assistants\n    61.   • 6113 Educational support assistants\n    62.   • 6114 Childminders\n    63.   • 6117 Playworkers\n    64.   • 6131 Nursing auxiliaries and assistants\n    65.   • 6132 Ambulance staff (excluding paramedics)\n    66.   • 6133 Dental nurses\n    67.   • 6134 Houseparents and residential wardens\n    68.   • 6135 Care workers and home carers\n    69.   • 6136 Senior care workers\n\nSW 16.2. The requirement in SW 16.1. does not apply if the applicant provides a satisfactory explanation why it is not reasonably practicable for them to obtain a criminal record certificate from any or all of the relevant authorities.\n\nSW 17.1. If the decision maker is satisfied all the suitability and relevant eligibility requirements for a Skilled Worker are met, the application will be granted, otherwise the application will be refused.\n\nSW 17.2. If the application is refused, the person can apply for an Administrative Review under Appendix AR: Administrative Review.",
      "summary": "Skilled Worker applicants being sponsored for certain healthcare and social care roles in specified SOC codes must provide a criminal record certificate from relevant authorities in countries where they've been present for 12 months or more within the past 10 years, aged over 18. This requirement is mandatory for entry clearance, with no specified exceptions.",
      "augmented_text": "Document: Immigration Rules Appendix Skilled Worker\nPart: Immigration Rules Appendix Skilled Worker\nSection ID: 1\nSection: Criminal record certificate requirement (mandatory) for a Skilled Worker\nTopic: leave-to-enter\n\nSummary: Skilled Worker applicants being sponsored for certain healthcare and social care roles in specified SOC codes must provide a criminal record certificate from relevant authorities in countries where they've been present for 12 months or more within the past 10 years, aged over 18. This requirement is mandatory for entry clearance, with no specified exceptions.\n\n### Criminal record certificate requirement (mandatory) for a Skilled Worker\n\n1.   SW 16.1. If the applicant is applying for entry clearance and is being sponsored for a job in any of the SOC 2020 occupation codes listed below, they must provide a criminal record certificate from the relevant authority in any country in which they have been present for 12 months or more (whether continuously or in total) in the 10 years before the date of application, and while aged 18 or over: \n    1.   • 1171 Health services and public health managers and directors\n    2.   • 1172 Social services managers and directors\n    3.   • 1231 Health care practice managers\n    4.   • 1232 Residential, day and domiciliary care managers and proprietors\n    5.   • 1233 Early education and childcare services proprietors\n    6.   • 2211 Generalist medical practitioners\n    7.   • 2212 Specialist medical practitioners\n    8.   • 2221 Physiotherapists\n    9.   • 2222 Occupational therapists\n    10.   • 2223 Speech and language therapists\n    11.   • 2224 Psychotherapists and cognitive behaviour therapists\n    12.   • 2225 Clinical psychologists\n    13.   • 2226 Other psychologists\n    14.   • 2229 Therapy professionals not elsewhere classified\n    15.   • 2231 Midwifery nurses\n    16.   • 2232 Community nurses\n    17.   • 2233 Specialist nurses\n    18.   • 2234 Nurse practitioners\n    19.   • 2235 Mental health nurses\n    20.   • 2236 Children’s nurses\n    21.   • 2237 Other nursing professionals\n    22.   • 2251 Pharmacists\n    23.   • 2252 Optometrists\n    24.   • 2253 Dental practitioners\n    25.   • 2254 Medical radiographers\n    26.   • 2255 Paramedics\n    27.   • 2256 Podiatrists\n    28.   • 2259 Other health professionals not elsewhere classified\n    29.   • 2312 Further education teaching professionals\n    30.   • 2313 Secondary education teaching professionals\n    31.   • 2314 Primary education teaching professionals\n    32.   • 2315 Nursery education teaching professionals\n    33.   • 2316 Special and additional needs education teaching professionals\n    34.   • 2317 Teachers of English as a foreign language\n    35.   • 2319 Teaching professionals not elsewhere classified\n    36.   • 2321 Head teachers and principals\n    37.   • 2322 Education managers\n    38.   • 2323 Education advisers and school inspectors\n    39.   • 2324 Early education and childcare services managers\n    40.   • 2329 Other educational professionals not elsewhere classified\n    41.   • 2461 Social workers\n    42.   • 2462 Probation officers\n    43.   •2464 Youth work professionals\n    44.   • 2469 Welfare professionals not elsewhere classified\n    45.   • 3211 Dispensing opticians\n    46.   • 3212 Pharmaceutical technicians\n    47.   • 3213 Medical and dental technicians\n    48.   • 3214 Complementary health associate professionals\n    49.   • 3219 Health associate professionals not elsewhere classified\n    50.   • 3221 Youth and community workers\n    51.   • 3222 Child and early years officers\n    52.   • 3223 Housing officers\n    53.   • 3224 Counsellors\n    54.   • 3229 Welfare and housing associate professionals not elsewhere classified\n    55.   • 3231 Higher level teaching assistants\n    56.   • 3232 Early education and childcare practitioners\n    57.   • 3433 Fitness and wellbeing instructors\n    58.   • 3571 Human resources and industrial relations officers\n    59.   • 6111 Early education and childcare assistants\n    60.   • 6112 Teaching assistants\n    61.   • 6113 Educational support assistants\n    62.   • 6114 Childminders\n    63.   • 6117 Playworkers\n    64.   • 6131 Nursing auxiliaries and assistants\n    65.   • 6132 Ambulance staff (excluding paramedics)\n    66.   • 6133 Dental nurses\n    67.   • 6134 Houseparents and residential wardens\n    68.   • 6135 Care workers and home carers\n    69.   • 6136 Senior care workers\n\nSW 16.2. The requirement in SW 16.1. does not apply if the applicant provides a satisfactory explanation why it is not reasonably practicable for them to obtain a criminal record certificate from any or all of the relevant authorities.\n\nSW 17.1. If the decision maker is satisfied all the suitability and relevant eligibility requirements for a Skilled Worker are met, the application will be granted, otherwise the application will be refused.\n\nSW 17.2. If the application is refused, the person can apply for an Administrative Review under Appendix AR: Administrative Review.",
      "needs_review": false
    },
    {
      "metadata": {
        "source": "Immigration Rules Appendix Skilled Worker",
        "part": "Immigration Rules Appendix Skilled Worker",
        "section_id": "SW 18.1",
        "section_title": "Period of grant for a Skilled Worker",
        "parent_section": "SW 18",
        "hierarchy_level": 2,
        "topic": "leave-to-enter",
        "url": "https://www.gov.uk/guidance/immigration-rules/immigration-rules-appendix-skilled-worker",
        "scraped_at": "2025-12-06T17:28:54.497263"
      },
      "text": "### Period of grant for a Skilled Worker\n\nSW 18.1. The applicant will be granted entry clearance or permission to stay until 14 days after the end date of their certificate of sponsorship (the end date of the certificate of sponsorship may be up to a maximum of 5 years after the start date of their certificate of sponsorship), subject to SW 18.1A.\n\nSW 18.1A. If the applicant is being sponsored in the SOC 2020 occupation code “2211 Generalist medical practitioners” for General Practitioner (GP) specialty training, they will be granted entry clearance or permission to stay until 4 months after the end date of their certificate of sponsorship.",
      "summary": "Skilled Workers are granted entry clearance or permission to stay until 14 days after their certificate of sponsorship's end date, which can be up to 5 years. For GPs under SOC 2020 code “2211,” the stay extends until 4 months after the sponsorship end date. These durations are subject to specific exceptions outlined in SW 18.1A.",
      "augmented_text": "Document: Immigration Rules Appendix Skilled Worker\nPart: Immigration Rules Appendix Skilled Worker\nSection ID: SW 18.1\nSection: Period of grant for a Skilled Worker\nTopic: leave-to-enter\n\nSummary: Skilled Workers are granted entry clearance or permission to stay until 14 days after their certificate of sponsorship's end date, which can be up to 5 years. For GPs under SOC 2020 code “2211,” the stay extends until 4 months after the sponsorship end date. These durations are subject to specific exceptions outlined in SW 18.1A.\n\n### Period of grant for a Skilled Worker\n\nSW 18.1. The applicant will be granted entry clearance or permission to stay until 14 days after the end date of their certificate of sponsorship (the end date of the certificate of sponsorship may be up to a maximum of 5 years after the start date of their certificate of sponsorship), subject to SW 18.1A.\n\nSW 18.1A. If the applicant is being sponsored in the SOC 2020 occupation code “2211 Generalist medical practitioners” for General Practitioner (GP) specialty training, they will be granted entry clearance or permission to stay until 4 months after the end date of their certificate of sponsorship.",
      "needs_review": false
    },
    {
      "metadata": {
        "source": "Immigration Rules Appendix Skilled Worker",
        "part": "Immigration Rules Appendix Skilled Worker",
        "section_id": "1",
        "section_title": "Conditions of grant for a Skilled Worker",
        "parent_section": null,
        "hierarchy_level": 1,
        "topic": "financial",
        "url": "https://www.gov.uk/guidance/immigration-rules/immigration-rules-appendix-skilled-worker",
        "scraped_at": "2025-12-06T17:28:54.497272"
      },
      "text": "### Conditions of grant for a Skilled Worker\n\n1.   SW 18.2. The grant will be subject to all the following conditions: \n    1.   (a) no access to public funds; and\n    2.   (b) work is permitted only in the job the applicant is being sponsored for, subject to (c) to (e); and\n    3.   (c) supplementary employment is permitted, providing the person continues to work in the job for which they are being sponsored (and where the supplementary employment takes place during the 4-month period after the end date of their certificate of sponsorship referred to in SW 18.1A the requirement to continue to work for the sponsor will not apply); and\n    4.   (d) voluntary work is permitted; and\n    5.   (e) working out a contractual notice period is permitted, for a job the applicant was lawfully working in on the date of application; and\n    6.   (f) study is permitted, subject to the ATAS condition in Appendix ATAS.\n    7.   (g) DELETED",
      "summary": "Skilled Workers are subject to conditions including no access to public funds, work only for the sponsored job (with limited supplementary employment), and permitted activities like voluntary work and studying (with ATAS). Exceptions apply during a four-month post-certificate period, and specific conditions such as contractual notice periods are also permitted.",
      "augmented_text": "Document: Immigration Rules Appendix Skilled Worker\nPart: Immigration Rules Appendix Skilled Worker\nSection ID: 1\nSection: Conditions of grant for a Skilled Worker\nTopic: financial\n\nSummary: Skilled Workers are subject to conditions including no access to public funds, work only for the sponsored job (with limited supplementary employment), and permitted activities like voluntary work and studying (with ATAS). Exceptions apply during a four-month post-certificate period, and specific conditions such as contractual notice periods are also permitted.\n\n### Conditions of grant for a Skilled Worker\n\n1.   SW 18.2. The grant will be subject to all the following conditions: \n    1.   (a) no access to public funds; and\n    2.   (b) work is permitted only in the job the applicant is being sponsored for, subject to (c) to (e); and\n    3.   (c) supplementary employment is permitted, providing the person continues to work in the job for which they are being sponsored (and where the supplementary employment takes place during the 4-month period after the end date of their certificate of sponsorship referred to in SW 18.1A the requirement to continue to work for the sponsor will not apply); and\n    4.   (d) voluntary work is permitted; and\n    5.   (e) working out a contractual notice period is permitted, for a job the applicant was lawfully working in on the date of application; and\n    6.   (f) study is permitted, subject to the ATAS condition in Appendix ATAS.\n    7.   (g) DELETED",
      "needs_review": false
    },
    {
      "metadata": {
        "source": "Immigration Rules Appendix Skilled Worker",
        "part": "Immigration Rules Appendix Skilled Worker",
        "section_id": "SW 19.1",
        "section_title": "Validity requirements for settlement as a Skilled Worker",
        "parent_section": "SW 19",
        "hierarchy_level": 2,
        "topic": "settlement",
        "url": "https://www.gov.uk/guidance/immigration-rules/immigration-rules-appendix-skilled-worker",
        "scraped_at": "2025-12-06T17:28:54.497291"
      },
      "text": "### Validity requirements for settlement as a Skilled Worker\n\nSW 19.1. A person applying for settlement as a Skilled Worker must apply online on the gov.uk website on the specified form, “Settle in the UK in various immigration categories: form SET(O)”.\n\n1.   SW 19.2. An application for settlement as a Skilled Worker must meet all the following requirements: \n    1.   (a) any fee must have been paid; and\n    2.   (b) the applicant must have provided biometrics when required; and\n    3.   (c) the applicant must have provided a passport or other travel document which satisfactorily establishes their identity and nationality; and\n    4.   (d) the applicant must be in the UK on the date of application.\n\nSW 19.3. The applicant must have, or have last been granted, permission as a Skilled Worker.\n\nSW 19.4. An application which does not meet the validity requirements for settlement as a Skilled worker may be rejected as invalid and not considered.",
      "summary": "Applicants seeking settlement as a Skilled Worker must apply online, pay fees, provide biometrics and valid travel documents, and be present in the UK on application date. They must also have current or previous Skilled Worker permission; failure to meet these requirements may result in rejection.",
      "augmented_text": "Document: Immigration Rules Appendix Skilled Worker\nPart: Immigration Rules Appendix Skilled Worker\nSection ID: SW 19.1\nSection: Validity requirements for settlement as a Skilled Worker\nTopic: settlement\n\nSummary: Applicants seeking settlement as a Skilled Worker must apply online, pay fees, provide biometrics and valid travel documents, and be present in the UK on application date. They must also have current or previous Skilled Worker permission; failure to meet these requirements may result in rejection.\n\n### Validity requirements for settlement as a Skilled Worker\n\nSW 19.1. A person applying for settlement as a Skilled Worker must apply online on the gov.uk website on the specified form, “Settle in the UK in various immigration categories: form SET(O)”.\n\n1.   SW 19.2. An application for settlement as a Skilled Worker must meet all the following requirements: \n    1.   (a) any fee must have been paid; and\n    2.   (b) the applicant must have provided biometrics when required; and\n    3.   (c) the applicant must have provided a passport or other travel document which satisfactorily establishes their identity and nationality; and\n    4.   (d) the applicant must be in the UK on the date of application.\n\nSW 19.3. The applicant must have, or have last been granted, permission as a Skilled Worker.\n\nSW 19.4. An application which does not meet the validity requirements for settlement as a Skilled worker may be rejected as invalid and not considered.",
      "needs_review": false
    },
    {
      "metadata": {
        "source": "Immigration Rules Appendix Skilled Worker",
        "part": "Immigration Rules Appendix Skilled Worker",
        "section_id": "SW 20.1",
        "section_title": "Suitability requirements for settlement as a Skilled Worker",
        "parent_section": "SW 20",
        "hierarchy_level": 2,
        "topic": "suitability",
        "url": "https://www.gov.uk/guidance/immigration-rules/immigration-rules-appendix-skilled-worker",
        "scraped_at": "2025-12-06T17:28:54.497301"
      },
      "text": "### Suitability requirements for settlement as a Skilled Worker\n\nSW 20.1. The applicant must not fall for refusal under Part Suitability.\n\n1.   SW 20.2. The applicant must not be; \n    1.   (a) in breach of immigration laws, except that where the Exceptions for overstayers section of Part Suitability applies, that period of overstaying will be disregarded; or\n    2.   (b) on immigration bail.",
      "summary": "Applicants seeking settlement as a Skilled Worker must meet suitability criteria, including not breaching immigration laws or being on bail, with certain overstaying exceptions.",
      "augmented_text": "Document: Immigration Rules Appendix Skilled Worker\nPart: Immigration Rules Appendix Skilled Worker\nSection ID: SW 20.1\nSection: Suitability requirements for settlement as a Skilled Worker\nTopic: suitability\n\nSummary: Applicants seeking settlement as a Skilled Worker must meet suitability criteria, including not breaching immigration laws or being on bail, with certain overstaying exceptions.\n\n### Suitability requirements for settlement as a Skilled Worker\n\nSW 20.1. The applicant must not fall for refusal under Part Suitability.\n\n1.   SW 20.2. The applicant must not be; \n    1.   (a) in breach of immigration laws, except that where the Exceptions for overstayers section of Part Suitability applies, that period of overstaying will be disregarded; or\n    2.   (b) on immigration bail.",
      "needs_review": false
    },
    {
      "metadata": {
        "source": "Immigration Rules Appendix Skilled Worker",
        "part": "Immigration Rules Appendix Skilled Worker",
        "section_id": "Eligibility requirements for settlement as a Skilled Worker",
        "section_title": "Eligibility requirements for settlement as a Skilled Worker",
        "parent_section": null,
        "hierarchy_level": 3,
        "topic": "eligibility",
        "url": "https://www.gov.uk/guidance/immigration-rules/immigration-rules-appendix-skilled-worker",
        "scraped_at": "2025-12-06T17:28:54.497307"
      },
      "text": "### Eligibility requirements for settlement as a Skilled Worker",
      "summary": "This section applies to Skilled Worker applicants seeking settlement. It requires candidates to meet specific employment, salary, and skill criteria, with exceptions or adjustments based on age or qualifications. Meeting these thresholds is essential for eligibility.",
      "augmented_text": "Document: Immigration Rules Appendix Skilled Worker\nPart: Immigration Rules Appendix Skilled Worker\nSection ID: Eligibility requirements for settlement as a Skilled Worker\nSection: Eligibility requirements for settlement as a Skilled Worker\nTopic: eligibility\n\nSummary: This section applies to Skilled Worker applicants seeking settlement. It requires candidates to meet specific employment, salary, and skill criteria, with exceptions or adjustments based on age or qualifications. Meeting these thresholds is essential for eligibility.\n\n### Eligibility requirements for settlement as a Skilled Worker",
      "needs_review": false
    },
    {
      "metadata": {
        "source": "Immigration Rules Appendix Skilled Worker",
        "part": "Immigration Rules Appendix Skilled Worker",
        "section_id": "SW 21.1",
        "section_title": "Qualifying period requirement for settlement as a Skilled Worker",
        "parent_section": "SW 21",
        "hierarchy_level": 2,
        "topic": "settlement",
        "url": "https://www.gov.uk/guidance/immigration-rules/immigration-rules-appendix-skilled-worker",
        "scraped_at": "2025-12-06T17:28:54.497321"
      },
      "text": "### Qualifying period requirement for settlement as a Skilled Worker\n\nSW 21.1. The applicant must have spent a continuous period of 5 years in the UK.\n\n1.   SW 21.2. The 5-year continuous period must consist of time with permission (not as a dependant) on any of, or any combination of, the following routes: \n    1.   (a) Skilled Worker; or\n    2.   (b) Global talent; or\n    3.   (c) Innovator Founder; or\n    4.   (d) T2 Minister of Religion; or\n    5.   (e) International Sportsperson; or\n    6.   (f) Representative of an Overseas Business; or\n    7.   (g) Tier 1, other than Tier 1 (Graduate Entrepreneur); or\n    8.   (h) Scale-up; or\n    9.   (i) permission on any other route, during the time the applicant was waiting for a decision on their application as a Skilled Worker, provided that application: \n        1.   (i) was for permission to stay; and\n        2.   (ii) was made between 24 January 2020 and 30 June 2021 (inclusive); and\n        3.   (iii) was supported on the date of application by a certificate of sponsorship assigned by a licensed sponsor; and\n        4.   (iv) was granted.",
      "summary": "This provision applies to Skilled Worker applicants seeking settlement. They must have completed a continuous 5-year period in the UK under specific visa routes, including Skilled Worker, Global Talent, and others, with some conditions for permissions granted between Jan 2020 and Jun 2021. Time as a dependant or on other routes generally does not count unless conditions are met.",
      "augmented_text": "Document: Immigration Rules Appendix Skilled Worker\nPart: Immigration Rules Appendix Skilled Worker\nSection ID: SW 21.1\nSection: Qualifying period requirement for settlement as a Skilled Worker\nTopic: settlement\n\nSummary: This provision applies to Skilled Worker applicants seeking settlement. They must have completed a continuous 5-year period in the UK under specific visa routes, including Skilled Worker, Global Talent, and others, with some conditions for permissions granted between Jan 2020 and Jun 2021. Time as a dependant or on other routes generally does not count unless conditions are met.\n\n### Qualifying period requirement for settlement as a Skilled Worker\n\nSW 21.1. The applicant must have spent a continuous period of 5 years in the UK.\n\n1.   SW 21.2. The 5-year continuous period must consist of time with permission (not as a dependant) on any of, or any combination of, the following routes: \n    1.   (a) Skilled Worker; or\n    2.   (b) Global talent; or\n    3.   (c) Innovator Founder; or\n    4.   (d) T2 Minister of Religion; or\n    5.   (e) International Sportsperson; or\n    6.   (f) Representative of an Overseas Business; or\n    7.   (g) Tier 1, other than Tier 1 (Graduate Entrepreneur); or\n    8.   (h) Scale-up; or\n    9.   (i) permission on any other route, during the time the applicant was waiting for a decision on their application as a Skilled Worker, provided that application: \n        1.   (i) was for permission to stay; and\n        2.   (ii) was made between 24 January 2020 and 30 June 2021 (inclusive); and\n        3.   (iii) was supported on the date of application by a certificate of sponsorship assigned by a licensed sponsor; and\n        4.   (iv) was granted.",
      "needs_review": false
    },
    {
      "metadata": {
        "source": "Immigration Rules Appendix Skilled Worker",
        "part": "Immigration Rules Appendix Skilled Worker",
        "section_id": "SW 22.1",
        "section_title": "Continuous residence requirement for settlement as a Skilled Worker",
        "parent_section": "SW 22",
        "hierarchy_level": 2,
        "topic": "settlement",
        "url": "https://www.gov.uk/guidance/immigration-rules/immigration-rules-appendix-skilled-worker",
        "scraped_at": "2025-12-06T17:28:54.497334"
      },
      "text": "### Continuous residence requirement for settlement as a Skilled Worker\n\nSW 22.1. The applicant must meet the continuous residence requirement as set out in Appendix Continuous Residence during the period in SW 21.1.",
      "summary": "Skilled Worker applicants must meet the continuous residence requirement outlined in Appendix Continuous Residence during the specified period, with conditions and thresholds detailed in SW 21.1.",
      "augmented_text": "Document: Immigration Rules Appendix Skilled Worker\nPart: Immigration Rules Appendix Skilled Worker\nSection ID: SW 22.1\nSection: Continuous residence requirement for settlement as a Skilled Worker\nTopic: settlement\n\nSummary: Skilled Worker applicants must meet the continuous residence requirement outlined in Appendix Continuous Residence during the specified period, with conditions and thresholds detailed in SW 21.1.\n\n### Continuous residence requirement for settlement as a Skilled Worker\n\nSW 22.1. The applicant must meet the continuous residence requirement as set out in Appendix Continuous Residence during the period in SW 21.1.",
      "needs_review": false
    },
    {
      "metadata": {
        "source": "Immigration Rules Appendix Skilled Worker",
        "part": "Immigration Rules Appendix Skilled Worker",
        "section_id": "SW 23.1",
        "section_title": "Knowledge of life in the UK requirement for settlement as a Skilled Worker",
        "parent_section": "SW 23",
        "hierarchy_level": 2,
        "topic": "settlement",
        "url": "https://www.gov.uk/guidance/immigration-rules/immigration-rules-appendix-skilled-worker",
        "scraped_at": "2025-12-06T17:28:54.497347"
      },
      "text": "### Knowledge of life in the UK requirement for settlement as a Skilled Worker\n\nSW 23.1. The applicant must meet the knowledge of Life in the UK requirement as set out in Appendix KOL UK.",
      "summary": "Skilled Worker applicants must meet the knowledge of Life in the UK requirement as specified in Appendix KOL UK, subject to any applicable exceptions or thresholds outlined in the rules.",
      "augmented_text": "Document: Immigration Rules Appendix Skilled Worker\nPart: Immigration Rules Appendix Skilled Worker\nSection ID: SW 23.1\nSection: Knowledge of life in the UK requirement for settlement as a Skilled Worker\nTopic: settlement\n\nSummary: Skilled Worker applicants must meet the knowledge of Life in the UK requirement as specified in Appendix KOL UK, subject to any applicable exceptions or thresholds outlined in the rules.\n\n### Knowledge of life in the UK requirement for settlement as a Skilled Worker\n\nSW 23.1. The applicant must meet the knowledge of Life in the UK requirement as set out in Appendix KOL UK.",
      "needs_review": false
    },
    {
      "metadata": {
        "source": "Immigration Rules Appendix Skilled Worker",
        "part": "Immigration Rules Appendix Skilled Worker",
        "section_id": "SW 24.1",
        "section_title": "Sponsorship and salary requirement for settlement as a Skilled Worker",
        "parent_section": "SW 24",
        "hierarchy_level": 2,
        "topic": "financial",
        "url": "https://www.gov.uk/guidance/immigration-rules/immigration-rules-appendix-skilled-worker",
        "scraped_at": "2025-12-06T17:28:54.497359"
      },
      "text": "### Sponsorship and salary requirement for settlement as a Skilled Worker\n\nSW 24.1. The sponsor in the applicant’s most recent permission must still be approved by the Home Office to sponsor Skilled Workers on the date of decision.\n\nSW 24.2. The sponsor must confirm that they still require the applicant to work for them for the foreseeable future, and that the applicant is paid, and will be paid for the foreseeable future, at least the salary in SW 24.3.\n\nSW 24.3. Subject to SW 24.4, the applicant’s salary must equal or exceed both salary requirements shown in the relevant row of the table below.\n\n|  | Applicant’s circumstances | General salary | Going rate |\n| --- | --- | --- |\n| **A** | All cases where rows B to E do not apply | Salary of at least £41,700 per year | At least the relevant going rate listed in Table 1 or Table 1a of Appendix Skilled Occupations |\n| **B** | The applicant was sponsored in their most recent permission for a job in Appendix Immigration Salary List, and rows C to E do not apply. | Salary of at least £33,400 per year | At least the relevant going rate listed in Table 1 or Table 1a of Appendix Skilled Occupations |\n| **C** | The applicant meets the requirements of SW 4.2(b), save that references to being sponsored should be read as meeting the requirements in SW 24.1. to SW 24.2, and rows D and E do not apply. | Salary of at least £31,300 per year | At least the relevant going rate listed in Tables 2 to 2a of Appendix Skilled Occupations |\n| **D** | The applicant was sponsored in their most recent permission for a job in either: • Appendix Immigration Salary List (or the previous Appendix Shortage Occupation List), and the applicant meets the requirements of SW 4.2(b), save that references to being sponsored should be read as meeting the requirements in SW 24.1. to SW 24.2; or • a health or education SOC 2020 occupation code listed in Table 3 of Appendix Skilled Occupations (or a related SOC 2010 occupation code shown in that table); and, in either case, row E does not apply. | Salary of at least £25,000 per year | At least the relevant going rate listed in Tables 2 to 5 of Appendix Skilled Occupations |\n| **E** | The 5-year qualifying period for settlement includes time as a Tier 2 (General) Migrant in which the applicant was sponsored for a job in one of the following SOC 2010 occupation codes: • 2111 Chemical scientists • 2112 Biological scientists and biochemists • 2113 Physical scientists • 2114 Social and humanities scientists • 2119 Natural and social science professionals not elsewhere classified • 2150 Research and development managers • 2311 Higher education teaching professionals | Salary of at least £25,000 per year | At least the going rate in the table at SW 14.5(c), if the applicant has continued to be sponsored in that SOC 2010 occupation code, or the equivalent SOC 2020 occupation code shown in Table 2 of Appendix Skilled Occupations, ever since. At least the relevant going rate in Tables 2 to 5 of Appendix Skilled Occupations, in other cases. |\n\n1.   SW 24.4. Salary under the table in SW 24.3 is subject to the following: \n    1.   (a) salary will be considered as set out in SW 14.1. to SW 14.5. (and in SW 14.3., references to the salary thresholds of £41,700, £33,400, £31,300 or £25,000 per year should be read as including references in the table in SW 24.3 above); and\n    2.   (b) if the applicant is currently absent from work for one of the reasons set out in Part Suitability paragraph SUI 36.1., or has returned from such an absence within the month before the date of application, consideration will be based on their salary on their return to work, as stated by their sponsor.",
      "summary": "The provision applies to Skilled Worker applicants seeking settlement, requiring sponsors to remain approved by the Home Office and confirm ongoing need for the applicant. The applicant’s salary must meet or exceed specified thresholds—either £41,700, £33,400, or £31,300 per year, depending on circumstances—with additional conditions and relevant salary benchmarks outlined in the rules.",
      "augmented_text": "Document: Immigration Rules Appendix Skilled Worker\nPart: Immigration Rules Appendix Skilled Worker\nSection ID: SW 24.1\nSection: Sponsorship and salary requirement for settlement as a Skilled Worker\nTopic: financial\n\nSummary: The provision applies to Skilled Worker applicants seeking settlement, requiring sponsors to remain approved by the Home Office and confirm ongoing need for the applicant. The applicant’s salary must meet or exceed specified thresholds—either £41,700, £33,400, or £31,300 per year, depending on circumstances—with additional conditions and relevant salary benchmarks outlined in the rules.\n\n### Sponsorship and salary requirement for settlement as a Skilled Worker\n\nSW 24.1. The sponsor in the applicant’s most recent permission must still be approved by the Home Office to sponsor Skilled Workers on the date of decision.\n\nSW 24.2. The sponsor must confirm that they still require the applicant to work for them for the foreseeable future, and that the applicant is paid, and will be paid for the foreseeable future, at least the salary in SW 24.3.\n\nSW 24.3. Subject to SW 24.4, the applicant’s salary must equal or exceed both salary requirements shown in the relevant row of the table below.\n\n|  | Applicant’s circumstances | General salary | Going rate |\n| --- | --- | --- |\n| **A** | All cases where rows B to E do not apply | Salary of at least £41,700 per year | At least the relevant going rate listed in Table 1 or Table 1a of Appendix Skilled Occupations |\n| **B** | The applicant was sponsored in their most recent permission for a job in Appendix Immigration Salary List, and rows C to E do not apply. | Salary of at least £33,400 per year | At least the relevant going rate listed in Table 1 or Table 1a of Appendix Skilled Occupations |\n| **C** | The applicant meets the requirements of SW 4.2(b), save that references to being sponsored should be read as meeting the requirements in SW 24.1. to SW 24.2, and rows D and E do not apply. | Salary of at least £31,300 per year | At least the relevant going rate listed in Tables 2 to 2a of Appendix Skilled Occupations |\n| **D** | The applicant was sponsored in their most recent permission for a job in either: • Appendix Immigration Salary List (or the previous Appendix Shortage Occupation List), and the applicant meets the requirements of SW 4.2(b), save that references to being sponsored should be read as meeting the requirements in SW 24.1. to SW 24.2; or • a health or education SOC 2020 occupation code listed in Table 3 of Appendix Skilled Occupations (or a related SOC 2010 occupation code shown in that table); and, in either case, row E does not apply. | Salary of at least £25,000 per year | At least the relevant going rate listed in Tables 2 to 5 of Appendix Skilled Occupations |\n| **E** | The 5-year qualifying period for settlement includes time as a Tier 2 (General) Migrant in which the applicant was sponsored for a job in one of the following SOC 2010 occupation codes: • 2111 Chemical scientists • 2112 Biological scientists and biochemists • 2113 Physical scientists • 2114 Social and humanities scientists • 2119 Natural and social science professionals not elsewhere classified • 2150 Research and development managers • 2311 Higher education teaching professionals | Salary of at least £25,000 per year | At least the going rate in the table at SW 14.5(c), if the applicant has continued to be sponsored in that SOC 2010 occupation code, or the equivalent SOC 2020 occupation code shown in Table 2 of Appendix Skilled Occupations, ever since. At least the relevant going rate in Tables 2 to 5 of Appendix Skilled Occupations, in other cases. |\n\n1.   SW 24.4. Salary under the table in SW 24.3 is subject to the following: \n    1.   (a) salary will be considered as set out in SW 14.1. to SW 14.5. (and in SW 14.3., references to the salary thresholds of £41,700, £33,400, £31,300 or £25,000 per year should be read as including references in the table in SW 24.3 above); and\n    2.   (b) if the applicant is currently absent from work for one of the reasons set out in Part Suitability paragraph SUI 36.1., or has returned from such an absence within the month before the date of application, consideration will be based on their salary on their return to work, as stated by their sponsor.",
      "needs_review": false
    },
    {
      "metadata": {
        "source": "Immigration Rules Appendix Skilled Worker",
        "part": "Immigration Rules Appendix Skilled Worker",
        "section_id": "SW 25.1",
        "section_title": "Decision on an application for settlement as a Skilled Worker",
        "parent_section": "SW 25",
        "hierarchy_level": 2,
        "topic": "eligibility",
        "url": "https://www.gov.uk/guidance/immigration-rules/immigration-rules-appendix-skilled-worker",
        "scraped_at": "2025-12-06T17:28:54.497366"
      },
      "text": "### Decision on an application for settlement as a Skilled Worker\n\nSW 25.1. If the decision maker is satisfied all the suitability and eligibility requirements for settlement as a Skilled Worker are met, the applicant will be granted settlement, otherwise the application will be refused.\n\nSW 25.2. If the application is refused, the person can apply for an Administrative Review under Appendix AR: Administrative Review.",
      "summary": "This provision applies to Skilled Worker applicants seeking settlement. It requires the decision-maker to confirm all suitability and eligibility criteria are met for settlement approval; failure results in refusal, but applicants may request an Administrative Review.",
      "augmented_text": "Document: Immigration Rules Appendix Skilled Worker\nPart: Immigration Rules Appendix Skilled Worker\nSection ID: SW 25.1\nSection: Decision on an application for settlement as a Skilled Worker\nTopic: eligibility\n\nSummary: This provision applies to Skilled Worker applicants seeking settlement. It requires the decision-maker to confirm all suitability and eligibility criteria are met for settlement approval; failure results in refusal, but applicants may request an Administrative Review.\n\n### Decision on an application for settlement as a Skilled Worker\n\nSW 25.1. If the decision maker is satisfied all the suitability and eligibility requirements for settlement as a Skilled Worker are met, the applicant will be granted settlement, otherwise the application will be refused.\n\nSW 25.2. If the application is refused, the person can apply for an Administrative Review under Appendix AR: Administrative Review.",
      "needs_review": false
    },
    {
      "metadata": {
        "source": "Immigration Rules Appendix Skilled Worker",
        "part": "Immigration Rules Appendix Skilled Worker",
        "section_id": "SW 26.1",
        "section_title": "Validity requirements for a dependent partner or dependent child of a Skilled Worker",
        "parent_section": "SW 26",
        "hierarchy_level": 2,
        "topic": "leave-to-enter",
        "url": "https://www.gov.uk/guidance/immigration-rules/immigration-rules-appendix-skilled-worker",
        "scraped_at": "2025-12-06T17:28:54.497381"
      },
      "text": "### Validity requirements for a dependent partner or dependent child of a Skilled Worker\n\nSW 26.1. A person applying for entry clearance or permission to stay as a dependent partner or dependent child of a Skilled Worker must apply online on the gov.uk website on the specified form as follows:\n\n| Location of Partner or Child | Specified form |\n| --- | --- |\n| Applicant outside the UK | Dependant partner visa Dependant child visa |\n| Applicant inside the UK | Dependant partner Dependant child |\n\n1.   SW 26.2. An application for entry clearance or permission to stay as a partner or child of a Skilled Worker must meet all the following requirements: \n    1.   (a) any fee and Immigration Health Charge must have been paid; and\n    2.   (b) the applicant must have provided biometrics when required; and\n    3.   (c) the applicant must have provided a passport or other travel document which satisfactorily establishes their identity and nationality; and\n    4.   (d) the applicant must be applying as partner or child of a person (P) who: \n        1.   (i) has made a valid application for entry clearance or permission to stay in the UK on the Skilled Worker route that has not been decided; or\n        2.   (ii) has entry clearance or permission to stay on the Skilled Worker route; or\n        3.   (iii) is settled or has become a British citizen, providing that P had permission on the Skilled Worker route when they settled and the applicant either had permission as their partner or child at that time, or the applicant is applying as a child of P and the applicant was born in the UK before P settled.\n\nSW 26.3. If the applicant is applying as a dependent partner they must be aged 18 or over on the date of application.\n\n1.   SW 26.4. If applying for permission to stay, the applicant must be in the UK on the date of application.\n2.   SW 26.4ZA. If applying for permission to stay, the applicant must not have, or have last been granted, permission: \n    1.   (a) as a Visitor; or\n    2.   (b) as a Short-term Student; or\n    3.   (c) as a Parent of a Child Student; or\n    4.   (d) as a Seasonal Worker; or\n    5.   (e) as a Domestic Worker in a Private Household; or\n    6.   (f) outside the Immigration Rules.\n\n1.   SW 26.4A. An applicant who is applying for permission to stay and has, or last had, permission as a Student, must fulfil one of the Conditions A or B below on the date of application: \n    1.   (a) Condition A: the applicant must have completed the course of study for which the Confirmation of Acceptance for Studies was assigned (or a course to which ST 27.3 of Appendix Student applies); or\n    2.   (b) Condition B: the applicant must: \n        1.   (i) be studying a full-time course of study leading to the award of a PhD with a higher education provider which has a track record of compliance; and\n        2.   (ii) have completed at least 24 months of study on that course.\n\nSW 26.5. An application which does not meet all the validity requirements for a partner or child of a Skilled Worker may be rejected as invalid and not considered.",
      "summary": "Dependent partners or children of Skilled Workers must apply online, pay fees, provide biometrics and travel documents, and be related to a Skilled Worker with valid or settled status on the route. They must meet these criteria at the time of application, with exceptions for settled or British citizens.",
      "augmented_text": "Document: Immigration Rules Appendix Skilled Worker\nPart: Immigration Rules Appendix Skilled Worker\nSection ID: SW 26.1\nSection: Validity requirements for a dependent partner or dependent child of a Skilled Worker\nTopic: leave-to-enter\n\nSummary: Dependent partners or children of Skilled Workers must apply online, pay fees, provide biometrics and travel documents, and be related to a Skilled Worker with valid or settled status on the route. They must meet these criteria at the time of application, with exceptions for settled or British citizens.\n\n### Validity requirements for a dependent partner or dependent child of a Skilled Worker\n\nSW 26.1. A person applying for entry clearance or permission to stay as a dependent partner or dependent child of a Skilled Worker must apply online on the gov.uk website on the specified form as follows:\n\n| Location of Partner or Child | Specified form |\n| --- | --- |\n| Applicant outside the UK | Dependant partner visa Dependant child visa |\n| Applicant inside the UK | Dependant partner Dependant child |\n\n1.   SW 26.2. An application for entry clearance or permission to stay as a partner or child of a Skilled Worker must meet all the following requirements: \n    1.   (a) any fee and Immigration Health Charge must have been paid; and\n    2.   (b) the applicant must have provided biometrics when required; and\n    3.   (c) the applicant must have provided a passport or other travel document which satisfactorily establishes their identity and nationality; and\n    4.   (d) the applicant must be applying as partner or child of a person (P) who: \n        1.   (i) has made a valid application for entry clearance or permission to stay in the UK on the Skilled Worker route that has not been decided; or\n        2.   (ii) has entry clearance or permission to stay on the Skilled Worker route; or\n        3.   (iii) is settled or has become a British citizen, providing that P had permission on the Skilled Worker route when they settled and the applicant either had permission as their partner or child at that time, or the applicant is applying as a child of P and the applicant was born in the UK before P settled.\n\nSW 26.3. If the applicant is applying as a dependent partner they must be aged 18 or over on the date of application.\n\n1.   SW 26.4. If applying for permission to stay, the applicant must be in the UK on the date of application.\n2.   SW 26.4ZA. If applying for permission to stay, the applicant must not have, or have last been granted, permission: \n    1.   (a) as a Visitor; or\n    2.   (b) as a Short-term Student; or\n    3.   (c) as a Parent of a Child Student; or\n    4.   (d) as a Seasonal Worker; or\n    5.   (e) as a Domestic Worker in a Private Household; or\n    6.   (f) outside the Immigration Rules.\n\n1.   SW 26.4A. An applicant who is applying for permission to stay and has, or last had, permission as a Student, must fulfil one of the Conditions A or B below on the date of application: \n    1.   (a) Condition A: the applicant must have completed the course of study for which the Confirmation of Acceptance for Studies was assigned (or a course to which ST 27.3 of Appendix Student applies); or\n    2.   (b) Condition B: the applicant must: \n        1.   (i) be studying a full-time course of study leading to the award of a PhD with a higher education provider which has a track record of compliance; and\n        2.   (ii) have completed at least 24 months of study on that course.\n\nSW 26.5. An application which does not meet all the validity requirements for a partner or child of a Skilled Worker may be rejected as invalid and not considered.",
      "needs_review": false
    },
    {
      "metadata": {
        "source": "Immigration Rules Appendix Skilled Worker",
        "part": "Immigration Rules Appendix Skilled Worker",
        "section_id": "SW 27.1",
        "section_title": "Suitability requirements for a dependent partner or dependent child of a Skilled Worker",
        "parent_section": "SW 27",
        "hierarchy_level": 2,
        "topic": "suitability",
        "url": "https://www.gov.uk/guidance/immigration-rules/immigration-rules-appendix-skilled-worker",
        "scraped_at": "2025-12-06T17:28:54.497392"
      },
      "text": "### Suitability requirements for a dependent partner or dependent child of a Skilled Worker\n\nSW 27.1. The applicant must not fall for refusal under Part Suitability.\n\n1.   SW 27.2. If applying for permission to stay the applicant must not be: \n    1.   (a) in breach of immigration laws, except that where the Exceptions for overstayers section of Part Suitability applies, that period of overstaying will be disregarded; or\n    2.   (b) on immigration bail.",
      "summary": "This provision applies to dependent partners and children of Skilled Workers seeking permission to stay. They must meet suitability criteria, not breach immigration laws (with certain overstaying exceptions), and must not be on immigration bail.",
      "augmented_text": "Document: Immigration Rules Appendix Skilled Worker\nPart: Immigration Rules Appendix Skilled Worker\nSection ID: SW 27.1\nSection: Suitability requirements for a dependent partner or dependent child of a Skilled Worker\nTopic: suitability\n\nSummary: This provision applies to dependent partners and children of Skilled Workers seeking permission to stay. They must meet suitability criteria, not breach immigration laws (with certain overstaying exceptions), and must not be on immigration bail.\n\n### Suitability requirements for a dependent partner or dependent child of a Skilled Worker\n\nSW 27.1. The applicant must not fall for refusal under Part Suitability.\n\n1.   SW 27.2. If applying for permission to stay the applicant must not be: \n    1.   (a) in breach of immigration laws, except that where the Exceptions for overstayers section of Part Suitability applies, that period of overstaying will be disregarded; or\n    2.   (b) on immigration bail.",
      "needs_review": false
    },
    {
      "metadata": {
        "source": "Immigration Rules Appendix Skilled Worker",
        "part": "Immigration Rules Appendix Skilled Worker",
        "section_id": "Eligibility requirements for a dependent partner or dependent child of a Skilled Worker",
        "section_title": "Eligibility requirements for a dependent partner or dependent child of a Skilled Worker",
        "parent_section": null,
        "hierarchy_level": 3,
        "topic": "eligibility",
        "url": "https://www.gov.uk/guidance/immigration-rules/immigration-rules-appendix-skilled-worker",
        "scraped_at": "2025-12-06T17:28:54.497396"
      },
      "text": "### Eligibility requirements for a dependent partner or dependent child of a Skilled Worker",
      "summary": "This provision applies to dependent partners and children of Skilled Workers, outlining their eligibility criteria. Dependents must meet qualification and relationship requirements and not fall under exceptions unless specified. Eligibility depends on the Skilled Worker's visa status and adherence to specified conditions.",
      "augmented_text": "Document: Immigration Rules Appendix Skilled Worker\nPart: Immigration Rules Appendix Skilled Worker\nSection ID: Eligibility requirements for a dependent partner or dependent child of a Skilled Worker\nSection: Eligibility requirements for a dependent partner or dependent child of a Skilled Worker\nTopic: eligibility\n\nSummary: This provision applies to dependent partners and children of Skilled Workers, outlining their eligibility criteria. Dependents must meet qualification and relationship requirements and not fall under exceptions unless specified. Eligibility depends on the Skilled Worker's visa status and adherence to specified conditions.\n\n### Eligibility requirements for a dependent partner or dependent child of a Skilled Worker",
      "needs_review": false
    },
    {
      "metadata": {
        "source": "Immigration Rules Appendix Skilled Worker",
        "part": "Immigration Rules Appendix Skilled Worker",
        "section_id": "SW 28.1",
        "section_title": "Entry requirement for a dependent partner or dependent child of a Skilled Worker",
        "parent_section": "SW 28",
        "hierarchy_level": 2,
        "topic": "leave-to-enter",
        "url": "https://www.gov.uk/guidance/immigration-rules/immigration-rules-appendix-skilled-worker",
        "scraped_at": "2025-12-06T17:28:54.497409"
      },
      "text": "### Entry requirement for a dependent partner or dependent child of a Skilled Worker\n\nSW 28.1. A person seeking to come to the UK as a dependent partner or dependent child of a Skilled Worker must apply for and obtain entry clearance as a dependent partner or dependent child of a Skilled Worker before they arrive in the UK.\n\nSW 28.2. A person applying for entry clearance as the partner or child of a Skilled Worker must, if Appendix Tuberculosis applies, provide a valid medical certificate confirming that they have undergone screening for active pulmonary tuberculosis and that this tuberculosis is not present in them.",
      "summary": "Dependents of Skilled Workers must apply for and obtain entry clearance before arriving in the UK. If applicable, they must also provide a valid TB screening certificate; there are no exceptions specified.",
      "augmented_text": "Document: Immigration Rules Appendix Skilled Worker\nPart: Immigration Rules Appendix Skilled Worker\nSection ID: SW 28.1\nSection: Entry requirement for a dependent partner or dependent child of a Skilled Worker\nTopic: leave-to-enter\n\nSummary: Dependents of Skilled Workers must apply for and obtain entry clearance before arriving in the UK. If applicable, they must also provide a valid TB screening certificate; there are no exceptions specified.\n\n### Entry requirement for a dependent partner or dependent child of a Skilled Worker\n\nSW 28.1. A person seeking to come to the UK as a dependent partner or dependent child of a Skilled Worker must apply for and obtain entry clearance as a dependent partner or dependent child of a Skilled Worker before they arrive in the UK.\n\nSW 28.2. A person applying for entry clearance as the partner or child of a Skilled Worker must, if Appendix Tuberculosis applies, provide a valid medical certificate confirming that they have undergone screening for active pulmonary tuberculosis and that this tuberculosis is not present in them.",
      "needs_review": false
    },
    {
      "metadata": {
        "source": "Immigration Rules Appendix Skilled Worker",
        "part": "Immigration Rules Appendix Skilled Worker",
        "section_id": "1",
        "section_title": "Relationship requirement for a dependent partner of a Skilled Worker",
        "parent_section": null,
        "hierarchy_level": 1,
        "topic": "family",
        "url": "https://www.gov.uk/guidance/immigration-rules/immigration-rules-appendix-skilled-worker",
        "scraped_at": "2025-12-06T17:28:54.497426"
      },
      "text": "### Relationship requirement for a dependent partner of a Skilled Worker\n\n1.   SW 29.1. Subject to SW 29.1A, the applicant must be the partner of a person (P) where one of the following applies: \n    1.   (a) P has permission on the Skilled Worker route; or\n    2.   (b) P is, at the same time, applying for (and is granted) entry clearance or permission on the Skilled Worker route; or\n    3.   (c) P is settled or has become a British citizen, providing P had permission on the Skilled Worker route when they settled and the applicant had permission as P’s partner at that time.\n\n1.   SW 29.1A. In SW 29.1(a) and (b), P must have (or be applying for) entry clearance or permission as a Skilled Worker sponsored for a job in Table 1, Table 2 or Table 3 of Appendix Skilled Occupations, unless P: \n    1.   (a) was (or is being) granted entry clearance or permission as a Skilled Worker, sponsored in: \n        1.   (i) the SOC 2010 occupation code “6145 Care workers and home carers” or “6146 Senior care workers”, under the Rules in force before 11 March 2024; or\n        2.   (ii) a SOC 2020 occupation code listed in Table 1a, Table 2aa, Table 2a or Table 3a (or an equivalent SOC 2010 occupation code listed in any of those tables), other than “6135 Care workers and home carers” or “6136 Senior care workers”, under the Rules in force before 22 July 2025;\n        3.   and\n\n    2.   (b) since the grant of entry clearance or permission in (a), P has continuously had permission as a Skilled Worker, sponsored in one or more of these SOC 2010 occupation codes or SOC 2020 occupation codes (except that where the Exceptions for overstayers section of Part Suitability applies, that period of overstaying will be disregarded).\n\nSW 29.2. The requirements of Appendix Relationship with Partner must be met.\n\nSW 29.3. DELETED\n\nSW 29.4. DELETED",
      "summary": "This provision applies to dependants of Skilled Workers, requiring them to be partners of individuals with current or past permission under the Skilled Worker route. The partner must have, or be applying for, entry clearance or permission as a Skilled Worker, with specific occupation and timing conditions; exceptions apply if the partner is settled or a British citizen. Critical thresholds include sponsorship, occupation codes, and continuous permission status.",
      "augmented_text": "Document: Immigration Rules Appendix Skilled Worker\nPart: Immigration Rules Appendix Skilled Worker\nSection ID: 1\nSection: Relationship requirement for a dependent partner of a Skilled Worker\nTopic: family\n\nSummary: This provision applies to dependants of Skilled Workers, requiring them to be partners of individuals with current or past permission under the Skilled Worker route. The partner must have, or be applying for, entry clearance or permission as a Skilled Worker, with specific occupation and timing conditions; exceptions apply if the partner is settled or a British citizen. Critical thresholds include sponsorship, occupation codes, and continuous permission status.\n\n### Relationship requirement for a dependent partner of a Skilled Worker\n\n1.   SW 29.1. Subject to SW 29.1A, the applicant must be the partner of a person (P) where one of the following applies: \n    1.   (a) P has permission on the Skilled Worker route; or\n    2.   (b) P is, at the same time, applying for (and is granted) entry clearance or permission on the Skilled Worker route; or\n    3.   (c) P is settled or has become a British citizen, providing P had permission on the Skilled Worker route when they settled and the applicant had permission as P’s partner at that time.\n\n1.   SW 29.1A. In SW 29.1(a) and (b), P must have (or be applying for) entry clearance or permission as a Skilled Worker sponsored for a job in Table 1, Table 2 or Table 3 of Appendix Skilled Occupations, unless P: \n    1.   (a) was (or is being) granted entry clearance or permission as a Skilled Worker, sponsored in: \n        1.   (i) the SOC 2010 occupation code “6145 Care workers and home carers” or “6146 Senior care workers”, under the Rules in force before 11 March 2024; or\n        2.   (ii) a SOC 2020 occupation code listed in Table 1a, Table 2aa, Table 2a or Table 3a (or an equivalent SOC 2010 occupation code listed in any of those tables), other than “6135 Care workers and home carers” or “6136 Senior care workers”, under the Rules in force before 22 July 2025;\n        3.   and\n\n    2.   (b) since the grant of entry clearance or permission in (a), P has continuously had permission as a Skilled Worker, sponsored in one or more of these SOC 2010 occupation codes or SOC 2020 occupation codes (except that where the Exceptions for overstayers section of Part Suitability applies, that period of overstaying will be disregarded).\n\nSW 29.2. The requirements of Appendix Relationship with Partner must be met.\n\nSW 29.3. DELETED\n\nSW 29.4. DELETED",
      "needs_review": false
    },
    {
      "metadata": {
        "source": "Immigration Rules Appendix Skilled Worker",
        "part": "Immigration Rules Appendix Skilled Worker",
        "section_id": "1",
        "section_title": "Relationship requirement for a dependent child of a Skilled Worker",
        "parent_section": null,
        "hierarchy_level": 1,
        "topic": "family",
        "url": "https://www.gov.uk/guidance/immigration-rules/immigration-rules-appendix-skilled-worker",
        "scraped_at": "2025-12-06T17:28:54.497438"
      },
      "text": "### Relationship requirement for a dependent child of a Skilled Worker\n\n1.   SW 30.1. DELETED.\n\n1.   SW 30.2 DELETED.\n\nSW 30.3. DELETED",
      "summary": "This provision applies to dependent children of Skilled Workers. It requires proof of a genuine familial relationship; specific conditions or exceptions are not provided in the excerpt. The rule ensures dependents meet relationship criteria for immigration eligibility.",
      "augmented_text": "Document: Immigration Rules Appendix Skilled Worker\nPart: Immigration Rules Appendix Skilled Worker\nSection ID: 1\nSection: Relationship requirement for a dependent child of a Skilled Worker\nTopic: family\n\nSummary: This provision applies to dependent children of Skilled Workers. It requires proof of a genuine familial relationship; specific conditions or exceptions are not provided in the excerpt. The rule ensures dependents meet relationship criteria for immigration eligibility.\n\n### Relationship requirement for a dependent child of a Skilled Worker\n\n1.   SW 30.1. DELETED.\n\n1.   SW 30.2 DELETED.\n\nSW 30.3. DELETED",
      "needs_review": false
    },
    {
      "metadata": {
        "source": "Immigration Rules Appendix Skilled Worker",
        "part": "Immigration Rules Appendix Skilled Worker",
        "section_id": "SW 31.1",
        "section_title": "Care requirement for a dependent child of a Skilled Worker",
        "parent_section": "SW 31",
        "hierarchy_level": 2,
        "topic": "family",
        "url": "https://www.gov.uk/guidance/immigration-rules/immigration-rules-appendix-skilled-worker",
        "scraped_at": "2025-12-06T17:28:54.497449"
      },
      "text": "### Care requirement for a dependent child of a Skilled Worker\n\nSW 31.1. DELETED.",
      "summary": "This provision applies to dependent children of Skilled Workers. It requires the sponsor to ensure appropriate care arrangements are in place for the child, with specific conditions or exceptions being detailed elsewhere in the rules.",
      "augmented_text": "Document: Immigration Rules Appendix Skilled Worker\nPart: Immigration Rules Appendix Skilled Worker\nSection ID: SW 31.1\nSection: Care requirement for a dependent child of a Skilled Worker\nTopic: family\n\nSummary: This provision applies to dependent children of Skilled Workers. It requires the sponsor to ensure appropriate care arrangements are in place for the child, with specific conditions or exceptions being detailed elsewhere in the rules.\n\n### Care requirement for a dependent child of a Skilled Worker\n\nSW 31.1. DELETED.",
      "needs_review": false
    },
    {
      "metadata": {
        "source": "Immigration Rules Appendix Skilled Worker",
        "part": "Immigration Rules Appendix Skilled Worker",
        "section_id": "SW 32.1",
        "section_title": "Age requirement for a dependent child of a Skilled Worker",
        "parent_section": "SW 32",
        "hierarchy_level": 2,
        "topic": "family",
        "url": "https://www.gov.uk/guidance/immigration-rules/immigration-rules-appendix-skilled-worker",
        "scraped_at": "2025-12-06T17:28:54.497461"
      },
      "text": "### Age requirement for a dependent child of a Skilled Worker\n\nSW 32.1. DELETED.\n\nSW 32.2. DELETED.",
      "summary": "This provision applies to dependent children of Skilled Workers. It requires that dependents be under 18 years of age to qualify, with no specific exceptions outlined.",
      "augmented_text": "Document: Immigration Rules Appendix Skilled Worker\nPart: Immigration Rules Appendix Skilled Worker\nSection ID: SW 32.1\nSection: Age requirement for a dependent child of a Skilled Worker\nTopic: family\n\nSummary: This provision applies to dependent children of Skilled Workers. It requires that dependents be under 18 years of age to qualify, with no specific exceptions outlined.\n\n### Age requirement for a dependent child of a Skilled Worker\n\nSW 32.1. DELETED.\n\nSW 32.2. DELETED.",
      "needs_review": true,
      "review_reasons": [
        "generic_summary"
      ]
    },
    {
      "metadata": {
        "source": "Immigration Rules Appendix Skilled Worker",
        "part": "Immigration Rules Appendix Skilled Worker",
        "section_id": "1",
        "section_title": "Requirements for a dependent child of a Skilled Worker",
        "parent_section": null,
        "hierarchy_level": 1,
        "topic": "leave-to-enter",
        "url": "https://www.gov.uk/guidance/immigration-rules/immigration-rules-appendix-skilled-worker",
        "scraped_at": "2025-12-06T17:28:54.497477"
      },
      "text": "### Requirements for a dependent child of a Skilled Worker\n\n1.   SW 32A.1. Subject to SW 32A.2, the applicant must meet the following requirements for a dependent child in Appendix Children: \n    1.   (a) relationship requirement: entry clearance and permission to stay; and\n    2.   (b) care requirement; and\n    3.   (c) age and independent life requirement.\n\n1.   SW 32A.2. In Appendix Children, where CHI 3.1 (a) or (b) refer to the applicant applying as the child of a person (P), P must be a Skilled Worker sponsored for a job in Table 1, Table 2 or Table 3 of Appendix Skilled Occupations, unless: \n    1.   (a) P was (or is being) granted entry clearance or permission as a Skilled Worker, sponsored in: \n        1.   (i) the SOC 2010 occupation code “6145 Care workers and home carers” or “6146 Senior care workers”, under the Rules in force before 11 March 2024; or\n        2.   (ii) a SOC 2020 occupation code listed in Table 1a, Table 2aa, Table 2a or Table 3a (or an equivalent SOC 2010 occupation code listed in any of those tables), other than “6135 Care workers and home carers” or “6136 Senior care workers”, under the Rules in force before 22 July 2025;\n        3.   and since that grant of entry clearance or permission, P has continuously had permission as a Skilled Worker, sponsored in one or more of these SOC 2010 occupation codes or SOC 2020 occupation codes (except that where the Exceptions for overstayers section of Part Suitability applies, that period of overstaying will be disregarded); or\n\n    2.   (b) the applicant was born in the UK; or\n    3.   (c) P is the sole surviving parent or has sole responsibility for the applicant and this is an application for permission to stay; or\n    4.   (d) P has joint responsibility for the applicant with another Skilled Worker who is also sponsored for a job in one of the occupation codes referred to in (a) and this is an application for permission to stay.",
      "summary": "This provision applies to dependent children of Skilled Workers seeking entry or permission to stay in the UK. It requires them to satisfy relationship, care, and age/independent life criteria, with additional conditions if their parent was granted Skilled Worker status under specific occupation codes before certain dates.",
      "augmented_text": "Document: Immigration Rules Appendix Skilled Worker\nPart: Immigration Rules Appendix Skilled Worker\nSection ID: 1\nSection: Requirements for a dependent child of a Skilled Worker\nTopic: leave-to-enter\n\nSummary: This provision applies to dependent children of Skilled Workers seeking entry or permission to stay in the UK. It requires them to satisfy relationship, care, and age/independent life criteria, with additional conditions if their parent was granted Skilled Worker status under specific occupation codes before certain dates.\n\n### Requirements for a dependent child of a Skilled Worker\n\n1.   SW 32A.1. Subject to SW 32A.2, the applicant must meet the following requirements for a dependent child in Appendix Children: \n    1.   (a) relationship requirement: entry clearance and permission to stay; and\n    2.   (b) care requirement; and\n    3.   (c) age and independent life requirement.\n\n1.   SW 32A.2. In Appendix Children, where CHI 3.1 (a) or (b) refer to the applicant applying as the child of a person (P), P must be a Skilled Worker sponsored for a job in Table 1, Table 2 or Table 3 of Appendix Skilled Occupations, unless: \n    1.   (a) P was (or is being) granted entry clearance or permission as a Skilled Worker, sponsored in: \n        1.   (i) the SOC 2010 occupation code “6145 Care workers and home carers” or “6146 Senior care workers”, under the Rules in force before 11 March 2024; or\n        2.   (ii) a SOC 2020 occupation code listed in Table 1a, Table 2aa, Table 2a or Table 3a (or an equivalent SOC 2010 occupation code listed in any of those tables), other than “6135 Care workers and home carers” or “6136 Senior care workers”, under the Rules in force before 22 July 2025;\n        3.   and since that grant of entry clearance or permission, P has continuously had permission as a Skilled Worker, sponsored in one or more of these SOC 2010 occupation codes or SOC 2020 occupation codes (except that where the Exceptions for overstayers section of Part Suitability applies, that period of overstaying will be disregarded); or\n\n    2.   (b) the applicant was born in the UK; or\n    3.   (c) P is the sole surviving parent or has sole responsibility for the applicant and this is an application for permission to stay; or\n    4.   (d) P has joint responsibility for the applicant with another Skilled Worker who is also sponsored for a job in one of the occupation codes referred to in (a) and this is an application for permission to stay.",
      "needs_review": false
    },
    {
      "metadata": {
        "source": "Immigration Rules Appendix Skilled Worker",
        "part": "Immigration Rules Appendix Skilled Worker",
        "section_id": "SW 33.1",
        "section_title": "Financial requirement for a dependent partner or dependent child of a Skilled Worker",
        "parent_section": "SW 33",
        "hierarchy_level": 2,
        "topic": "financial",
        "url": "https://www.gov.uk/guidance/immigration-rules/immigration-rules-appendix-skilled-worker",
        "scraped_at": "2025-12-06T17:28:54.497489"
      },
      "text": "### Financial requirement for a dependent partner or dependent child of a Skilled Worker\n\nSW 33.1. If the applicant is applying for permission to stay and has been living in the UK with permission for 12 months or longer on the date of application, they will meet the financial requirement and do not need to show funds.\n\n1.   SW 33.2. If the applicant is applying for entry clearance, or has been in the UK for less than 12 months on the date of application, either: \n    1.   (a) funds of at least the amount required in SW 33.3 must be held collectively by one or more of the following: \n        1.   i) the applicant; and\n        2.   ii) the Skilled Worker (P); and\n        3.   iii) if the applicant is applying as a dependent child, their parent who is lawfully present in the UK or being granted entry clearance, or permission to stay, at the same time;\n\n    2.   or\n    3.   (b) the Skilled Worker’s A-rated sponsor must certify that they will, if necessary, maintain and accommodate the dependent partner and/or any dependent child as well as the Skilled Worker, up to the end of the first month of each of their grants of permission, to at least the amounts required in SW 33.3.\n\n1.   SW 33.3. The funds required are: \n    1.   (a) £285 for a dependent partner in the UK, or applying for entry clearance; and\n    2.   (b) £315 for the first dependent child in the UK, or applying for entry clearance; and\n    3.   (c) £200 for any other dependent child in the UK, or applying for entry clearance.\n\nSW 33.4. If SW 33.2.(a) applies, the funds held for the applicant must be held in addition to any funds required for the Skilled Worker to meet the financial requirement and any other dependants in the UK or applying at the same time.\n\nSW 33.5. If SW 33.2.(a) applies, the funds must have been held for a 28-day period and as specified in Appendix Finance.",
      "summary": "Dependent partners or children of Skilled Workers must meet specific financial requirements unless they have been in the UK for over 12 months with permission. For shorter stays or entry clearance, applicants must hold or be certified to have funds amounting to £285 per partner, £315 per first child, and £200 for additional children, unless already residing in the UK for over a year.",
      "augmented_text": "Document: Immigration Rules Appendix Skilled Worker\nPart: Immigration Rules Appendix Skilled Worker\nSection ID: SW 33.1\nSection: Financial requirement for a dependent partner or dependent child of a Skilled Worker\nTopic: financial\n\nSummary: Dependent partners or children of Skilled Workers must meet specific financial requirements unless they have been in the UK for over 12 months with permission. For shorter stays or entry clearance, applicants must hold or be certified to have funds amounting to £285 per partner, £315 per first child, and £200 for additional children, unless already residing in the UK for over a year.\n\n### Financial requirement for a dependent partner or dependent child of a Skilled Worker\n\nSW 33.1. If the applicant is applying for permission to stay and has been living in the UK with permission for 12 months or longer on the date of application, they will meet the financial requirement and do not need to show funds.\n\n1.   SW 33.2. If the applicant is applying for entry clearance, or has been in the UK for less than 12 months on the date of application, either: \n    1.   (a) funds of at least the amount required in SW 33.3 must be held collectively by one or more of the following: \n        1.   i) the applicant; and\n        2.   ii) the Skilled Worker (P); and\n        3.   iii) if the applicant is applying as a dependent child, their parent who is lawfully present in the UK or being granted entry clearance, or permission to stay, at the same time;\n\n    2.   or\n    3.   (b) the Skilled Worker’s A-rated sponsor must certify that they will, if necessary, maintain and accommodate the dependent partner and/or any dependent child as well as the Skilled Worker, up to the end of the first month of each of their grants of permission, to at least the amounts required in SW 33.3.\n\n1.   SW 33.3. The funds required are: \n    1.   (a) £285 for a dependent partner in the UK, or applying for entry clearance; and\n    2.   (b) £315 for the first dependent child in the UK, or applying for entry clearance; and\n    3.   (c) £200 for any other dependent child in the UK, or applying for entry clearance.\n\nSW 33.4. If SW 33.2.(a) applies, the funds held for the applicant must be held in addition to any funds required for the Skilled Worker to meet the financial requirement and any other dependants in the UK or applying at the same time.\n\nSW 33.5. If SW 33.2.(a) applies, the funds must have been held for a 28-day period and as specified in Appendix Finance.",
      "needs_review": false
    },
    {
      "metadata": {
        "source": "Immigration Rules Appendix Skilled Worker",
        "part": "Immigration Rules Appendix Skilled Worker",
        "section_id": "SW 34.1",
        "section_title": "Criminal record certificate requirement for a dependent partner of a Skilled Worker",
        "parent_section": "SW 34",
        "hierarchy_level": 2,
        "topic": "leave-to-enter",
        "url": "https://www.gov.uk/guidance/immigration-rules/immigration-rules-appendix-skilled-worker",
        "scraped_at": "2025-12-06T17:28:54.497504"
      },
      "text": "### Criminal record certificate requirement for a dependent partner of a Skilled Worker\n\nSW 34.1. Where a Skilled Worker is being sponsored for a job in an SOC 2020 occupation code listed in SW 16.1, an applicant applying for entry clearance as the partner of the Skilled Worker must provide a criminal record certificate from the relevant authority in any country in which they have been present for 12 months or more (whether continuously or in total) in the 10 years before the date of application, and while aged 18 or over.\n\nSW 34.2. The requirement in SW 34.1. does not apply if the applicant provides a satisfactory explanation why it is not reasonably practicable for them to obtain a criminal record certificate from any or all of the relevant authorities.",
      "summary": "Dependent partners of Skilled Workers must provide a criminal record certificate from relevant countries where they have spent 12+ months in the past 10 years and are aged 18 or over, unless they can justify the impracticality of obtaining it.",
      "augmented_text": "Document: Immigration Rules Appendix Skilled Worker\nPart: Immigration Rules Appendix Skilled Worker\nSection ID: SW 34.1\nSection: Criminal record certificate requirement for a dependent partner of a Skilled Worker\nTopic: leave-to-enter\n\nSummary: Dependent partners of Skilled Workers must provide a criminal record certificate from relevant countries where they have spent 12+ months in the past 10 years and are aged 18 or over, unless they can justify the impracticality of obtaining it.\n\n### Criminal record certificate requirement for a dependent partner of a Skilled Worker\n\nSW 34.1. Where a Skilled Worker is being sponsored for a job in an SOC 2020 occupation code listed in SW 16.1, an applicant applying for entry clearance as the partner of the Skilled Worker must provide a criminal record certificate from the relevant authority in any country in which they have been present for 12 months or more (whether continuously or in total) in the 10 years before the date of application, and while aged 18 or over.\n\nSW 34.2. The requirement in SW 34.1. does not apply if the applicant provides a satisfactory explanation why it is not reasonably practicable for them to obtain a criminal record certificate from any or all of the relevant authorities.",
      "needs_review": false
    },
    {
      "metadata": {
        "source": "Immigration Rules Appendix Skilled Worker",
        "part": "Immigration Rules Appendix Skilled Worker",
        "section_id": "SW 35.1",
        "section_title": "Decision on an application as a dependent partner or dependent child of a Skilled Worker",
        "parent_section": "SW 35",
        "hierarchy_level": 2,
        "topic": "eligibility",
        "url": "https://www.gov.uk/guidance/immigration-rules/immigration-rules-appendix-skilled-worker",
        "scraped_at": "2025-12-06T17:28:54.497512"
      },
      "text": "### Decision on an application as a dependent partner or dependent child of a Skilled Worker\n\nSW 35.1. If the decision maker is satisfied that all the suitability and eligibility requirements for a dependent partner or dependent child of a Skilled Worker are met, the application will be granted, otherwise the application will be refused.\n\nSW 35.2. If the application is refused, the person can apply for an Administrative Review under Appendix AR: Administrative Review.",
      "summary": "This provision applies to dependent partners and children of Skilled Workers. If suitability and eligibility criteria are met, the application is granted; otherwise, it is refused, but the applicant can seek an Administrative Review.",
      "augmented_text": "Document: Immigration Rules Appendix Skilled Worker\nPart: Immigration Rules Appendix Skilled Worker\nSection ID: SW 35.1\nSection: Decision on an application as a dependent partner or dependent child of a Skilled Worker\nTopic: eligibility\n\nSummary: This provision applies to dependent partners and children of Skilled Workers. If suitability and eligibility criteria are met, the application is granted; otherwise, it is refused, but the applicant can seek an Administrative Review.\n\n### Decision on an application as a dependent partner or dependent child of a Skilled Worker\n\nSW 35.1. If the decision maker is satisfied that all the suitability and eligibility requirements for a dependent partner or dependent child of a Skilled Worker are met, the application will be granted, otherwise the application will be refused.\n\nSW 35.2. If the application is refused, the person can apply for an Administrative Review under Appendix AR: Administrative Review.",
      "needs_review": false
    },
    {
      "metadata": {
        "source": "Immigration Rules Appendix Skilled Worker",
        "part": "Immigration Rules Appendix Skilled Worker",
        "section_id": "1",
        "section_title": "Period of grant for a dependent partner or dependent child of a Skilled Worker",
        "parent_section": null,
        "hierarchy_level": 1,
        "topic": "family",
        "url": "https://www.gov.uk/guidance/immigration-rules/immigration-rules-appendix-skilled-worker",
        "scraped_at": "2025-12-06T17:28:54.497531"
      },
      "text": "### Period of grant for a dependent partner or dependent child of a Skilled Worker\n\n1.   SW 36.1. A partner will be granted: \n    1.   (a) permission which ends on the same date as their partner’s permission as a Skilled Worker; or\n    2.   (b) 3 years’ permission if the Skilled Worker was (or is being) granted settlement as a Skilled Worker.\n\nSW 36.2. A child will be granted permission which ends on the same date as whichever of their parents’ permission ends first, unless both parents have (or are being granted) settlement or British Citizenship, in which case the child will be granted permission for 3 years.",
      "summary": "This provision applies to dependents of Skilled Workers. Partners receive permission matching the main worker's duration or up to 3 years if settlement is granted; children’s permission ends when the earlier parent’s ends unless both parents have settlement or citizenship, then they get 3 years.",
      "augmented_text": "Document: Immigration Rules Appendix Skilled Worker\nPart: Immigration Rules Appendix Skilled Worker\nSection ID: 1\nSection: Period of grant for a dependent partner or dependent child of a Skilled Worker\nTopic: family\n\nSummary: This provision applies to dependents of Skilled Workers. Partners receive permission matching the main worker's duration or up to 3 years if settlement is granted; children’s permission ends when the earlier parent’s ends unless both parents have settlement or citizenship, then they get 3 years.\n\n### Period of grant for a dependent partner or dependent child of a Skilled Worker\n\n1.   SW 36.1. A partner will be granted: \n    1.   (a) permission which ends on the same date as their partner’s permission as a Skilled Worker; or\n    2.   (b) 3 years’ permission if the Skilled Worker was (or is being) granted settlement as a Skilled Worker.\n\nSW 36.2. A child will be granted permission which ends on the same date as whichever of their parents’ permission ends first, unless both parents have (or are being granted) settlement or British Citizenship, in which case the child will be granted permission for 3 years.",
      "needs_review": false
    },
    {
      "metadata": {
        "source": "Immigration Rules Appendix Skilled Worker",
        "part": "Immigration Rules Appendix Skilled Worker",
        "section_id": "1",
        "section_title": "Conditions of grant for a dependent partner or dependent child of a Skilled Worker",
        "parent_section": null,
        "hierarchy_level": 1,
        "topic": "financial",
        "url": "https://www.gov.uk/guidance/immigration-rules/immigration-rules-appendix-skilled-worker",
        "scraped_at": "2025-12-06T17:28:54.497539"
      },
      "text": "### Conditions of grant for a dependent partner or dependent child of a Skilled Worker\n\n1.   SW 36.3. The grant will be subject to all the following conditions: \n    1.   (a) no access to public funds; and\n    2.   (b) work (including self-employment and voluntary work) is permitted, except as a professional sportsperson (including as a sports coach); and\n    3.   (c) study is permitted, subject to the ATAS condition in Appendix ATAS, if the applicant is over the age of 18.\n    4.   (d) DELETED",
      "summary": "Dependent partners and children of Skilled Workers must not access public funds, can work (excluding professional sports), and may study (if over 18 and subject to ATAS). These conditions apply unless specified otherwise.",
      "augmented_text": "Document: Immigration Rules Appendix Skilled Worker\nPart: Immigration Rules Appendix Skilled Worker\nSection ID: 1\nSection: Conditions of grant for a dependent partner or dependent child of a Skilled Worker\nTopic: financial\n\nSummary: Dependent partners and children of Skilled Workers must not access public funds, can work (excluding professional sports), and may study (if over 18 and subject to ATAS). These conditions apply unless specified otherwise.\n\n### Conditions of grant for a dependent partner or dependent child of a Skilled Worker\n\n1.   SW 36.3. The grant will be subject to all the following conditions: \n    1.   (a) no access to public funds; and\n    2.   (b) work (including self-employment and voluntary work) is permitted, except as a professional sportsperson (including as a sports coach); and\n    3.   (c) study is permitted, subject to the ATAS condition in Appendix ATAS, if the applicant is over the age of 18.\n    4.   (d) DELETED",
      "needs_review": false
    },
    {
      "metadata": {
        "source": "Immigration Rules Appendix Skilled Worker",
        "part": "Immigration Rules Appendix Skilled Worker",
        "section_id": "SW 37.1",
        "section_title": "Validity requirements for settlement as a dependent partner or dependent child of a Skilled Worker",
        "parent_section": "SW 37",
        "hierarchy_level": 2,
        "topic": "settlement",
        "url": "https://www.gov.uk/guidance/immigration-rules/immigration-rules-appendix-skilled-worker",
        "scraped_at": "2025-12-06T17:28:54.497559"
      },
      "text": "### Validity requirements for settlement as a dependent partner or dependent child of a Skilled Worker\n\nSW 37.1. A person applying for settlement as a dependent partner or dependent child of a Skilled Worker must apply online on the gov.uk website on the specified form, “Settle in the UK in various immigration categories: form SET(O)”.\n\n1.   SW 37.2. An application for settlement as a partner or child of a person on the Skilled Worker route must meet all the following requirements: \n    1.   (a) any fee must have been paid; and\n    2.   (b) the applicant must have provided biometrics when required; and\n    3.   (c) the applicant must have provided either a passport or other travel document which satisfactorily establishes their identity and nationality; and\n    4.   (d) the applicant must be in the UK on the date of application; and\n    5.   (e) the applicant must be applying as a partner or child of a person (P) who: \n        1.   (i) has made a valid application for settlement in the UK on the Skilled Worker route and that application has not been decided; or\n        2.   (ii) is settled or has become a British citizen, provided that P had permission on the Skilled Worker route when they settled and the applicant either had permission as their partner or child at that time, or the applicant is applying as a child of P and the applicant was born in the UK before P settled.\n\nSW 37.3. An application which does not meet the validity requirements for settlement as a partner or child of a Skilled Worker may be rejected as invalid and not considered.",
      "summary": "Applicants who are dependents of Skilled Worker visa holders must apply online using form SET(O), paying fees, providing biometrics, valid travel documentation, and currently being in the UK. Their application must be linked to a Skilled Worker visa holder who has pending settlement or is settled or a British citizen under specific permission conditions.",
      "augmented_text": "Document: Immigration Rules Appendix Skilled Worker\nPart: Immigration Rules Appendix Skilled Worker\nSection ID: SW 37.1\nSection: Validity requirements for settlement as a dependent partner or dependent child of a Skilled Worker\nTopic: settlement\n\nSummary: Applicants who are dependents of Skilled Worker visa holders must apply online using form SET(O), paying fees, providing biometrics, valid travel documentation, and currently being in the UK. Their application must be linked to a Skilled Worker visa holder who has pending settlement or is settled or a British citizen under specific permission conditions.\n\n### Validity requirements for settlement as a dependent partner or dependent child of a Skilled Worker\n\nSW 37.1. A person applying for settlement as a dependent partner or dependent child of a Skilled Worker must apply online on the gov.uk website on the specified form, “Settle in the UK in various immigration categories: form SET(O)”.\n\n1.   SW 37.2. An application for settlement as a partner or child of a person on the Skilled Worker route must meet all the following requirements: \n    1.   (a) any fee must have been paid; and\n    2.   (b) the applicant must have provided biometrics when required; and\n    3.   (c) the applicant must have provided either a passport or other travel document which satisfactorily establishes their identity and nationality; and\n    4.   (d) the applicant must be in the UK on the date of application; and\n    5.   (e) the applicant must be applying as a partner or child of a person (P) who: \n        1.   (i) has made a valid application for settlement in the UK on the Skilled Worker route and that application has not been decided; or\n        2.   (ii) is settled or has become a British citizen, provided that P had permission on the Skilled Worker route when they settled and the applicant either had permission as their partner or child at that time, or the applicant is applying as a child of P and the applicant was born in the UK before P settled.\n\nSW 37.3. An application which does not meet the validity requirements for settlement as a partner or child of a Skilled Worker may be rejected as invalid and not considered.",
      "needs_review": false
    },
    {
      "metadata": {
        "source": "Immigration Rules Appendix Skilled Worker",
        "part": "Immigration Rules Appendix Skilled Worker",
        "section_id": "SW 38.1",
        "section_title": "Suitability requirements for settlement as a dependent partner or dependent child of a Skilled Worker",
        "parent_section": "SW 38",
        "hierarchy_level": 2,
        "topic": "suitability",
        "url": "https://www.gov.uk/guidance/immigration-rules/immigration-rules-appendix-skilled-worker",
        "scraped_at": "2025-12-06T17:28:54.497569"
      },
      "text": "### Suitability requirements for settlement as a dependent partner or dependent child of a Skilled Worker\n\nSW 38.1. The applicant must not fall for refusal under Part Suitability.\n\n1.   SW 38.2. The applicant must not be: \n    1.   (a) in breach of immigration laws, except that where the Exceptions for overstayers section of Part Suitability applies, that period of overstaying will be disregarded; or\n    2.   (b) on immigration bail.",
      "summary": "This provision applies to dependents applying for settlement as partners or children of Skilled Workers. They must meet suitability criteria, including lawful immigration conduct and not being on immigration bail; exceptions exist for certain overstayers.",
      "augmented_text": "Document: Immigration Rules Appendix Skilled Worker\nPart: Immigration Rules Appendix Skilled Worker\nSection ID: SW 38.1\nSection: Suitability requirements for settlement as a dependent partner or dependent child of a Skilled Worker\nTopic: suitability\n\nSummary: This provision applies to dependents applying for settlement as partners or children of Skilled Workers. They must meet suitability criteria, including lawful immigration conduct and not being on immigration bail; exceptions exist for certain overstayers.\n\n### Suitability requirements for settlement as a dependent partner or dependent child of a Skilled Worker\n\nSW 38.1. The applicant must not fall for refusal under Part Suitability.\n\n1.   SW 38.2. The applicant must not be: \n    1.   (a) in breach of immigration laws, except that where the Exceptions for overstayers section of Part Suitability applies, that period of overstaying will be disregarded; or\n    2.   (b) on immigration bail.",
      "needs_review": false
    },
    {
      "metadata": {
        "source": "Immigration Rules Appendix Skilled Worker",
        "part": "Immigration Rules Appendix Skilled Worker",
        "section_id": "Eligibility requirements for settlement as a dependent partner or dependent child of a Skilled Worker",
        "section_title": "Eligibility requirements for settlement as a dependent partner or dependent child of a Skilled Worker",
        "parent_section": null,
        "hierarchy_level": 3,
        "topic": "eligibility",
        "url": "https://www.gov.uk/guidance/immigration-rules/immigration-rules-appendix-skilled-worker",
        "scraped_at": "2025-12-06T17:28:54.497574"
      },
      "text": "### Eligibility requirements for settlement as a dependent partner or dependent child of a Skilled Worker",
      "summary": "This provision applies to dependent partners and children of Skilled Worker applicants seeking settlement. It requires they meet specific eligibility criteria, including relationship and dependency conditions, with exceptions for certain visas or circumstances.",
      "augmented_text": "Document: Immigration Rules Appendix Skilled Worker\nPart: Immigration Rules Appendix Skilled Worker\nSection ID: Eligibility requirements for settlement as a dependent partner or dependent child of a Skilled Worker\nSection: Eligibility requirements for settlement as a dependent partner or dependent child of a Skilled Worker\nTopic: eligibility\n\nSummary: This provision applies to dependent partners and children of Skilled Worker applicants seeking settlement. It requires they meet specific eligibility criteria, including relationship and dependency conditions, with exceptions for certain visas or circumstances.\n\n### Eligibility requirements for settlement as a dependent partner or dependent child of a Skilled Worker",
      "needs_review": false
    },
    {
      "metadata": {
        "source": "Immigration Rules Appendix Skilled Worker",
        "part": "Immigration Rules Appendix Skilled Worker",
        "section_id": "1",
        "section_title": "Relationship requirement for settlement for a dependent partner or dependent child of a Skilled Worker",
        "parent_section": null,
        "hierarchy_level": 1,
        "topic": "settlement",
        "url": "https://www.gov.uk/guidance/immigration-rules/immigration-rules-appendix-skilled-worker",
        "scraped_at": "2025-12-06T17:28:54.497590"
      },
      "text": "### Relationship requirement for settlement for a dependent partner or dependent child of a Skilled Worker\n\n1.   SW 39.1. The applicant must be the partner or child of a person (P) where one of the following applies: \n    1.   (a) P is, at the same time, being granted settlement as a Skilled Worker; or\n    2.   (b) P is settled in the UK or has become a British citizen, providing P had permission as a Skilled Worker when they settled and the applicant either: \n        1.   i) had permission as P’s partner or child at that time; or\n        2.   ii) is applying as a child of P, and was born in the UK before P settled.\n\n1.   SW 39.2. The applicant must either: \n    1.   (a) have last been granted permission as a dependent partner or dependent child of the person (P) in SW 39.1; or\n    2.   (b) have been born in the UK and be applying as a child of the person (P) in SW 39.1.\n\nSW 39.3. If applying as a partner, the requirements of Appendix Relationship with Partner must be met.\n\nSW 39.4. If applying as a child, the applicant must meet the relationship requirement for settlement in Appendix Children.",
      "summary": "This provision applies to dependents (partners or children) of Skilled Workers seeking settlement. They must be related to a Skilled Worker who is being granted or has settled in the UK, with specific conditions if born in the UK or applying as a child. Applicants must have prior permission as dependents or meet additional relationship criteria outlined in relevant Appendices.",
      "augmented_text": "Document: Immigration Rules Appendix Skilled Worker\nPart: Immigration Rules Appendix Skilled Worker\nSection ID: 1\nSection: Relationship requirement for settlement for a dependent partner or dependent child of a Skilled Worker\nTopic: settlement\n\nSummary: This provision applies to dependents (partners or children) of Skilled Workers seeking settlement. They must be related to a Skilled Worker who is being granted or has settled in the UK, with specific conditions if born in the UK or applying as a child. Applicants must have prior permission as dependents or meet additional relationship criteria outlined in relevant Appendices.\n\n### Relationship requirement for settlement for a dependent partner or dependent child of a Skilled Worker\n\n1.   SW 39.1. The applicant must be the partner or child of a person (P) where one of the following applies: \n    1.   (a) P is, at the same time, being granted settlement as a Skilled Worker; or\n    2.   (b) P is settled in the UK or has become a British citizen, providing P had permission as a Skilled Worker when they settled and the applicant either: \n        1.   i) had permission as P’s partner or child at that time; or\n        2.   ii) is applying as a child of P, and was born in the UK before P settled.\n\n1.   SW 39.2. The applicant must either: \n    1.   (a) have last been granted permission as a dependent partner or dependent child of the person (P) in SW 39.1; or\n    2.   (b) have been born in the UK and be applying as a child of the person (P) in SW 39.1.\n\nSW 39.3. If applying as a partner, the requirements of Appendix Relationship with Partner must be met.\n\nSW 39.4. If applying as a child, the applicant must meet the relationship requirement for settlement in Appendix Children.",
      "needs_review": false
    },
    {
      "metadata": {
        "source": "Immigration Rules Appendix Skilled Worker",
        "part": "Immigration Rules Appendix Skilled Worker",
        "section_id": "SW 40.1",
        "section_title": "Care requirement for settlement as a dependent child of a Skilled Worker",
        "parent_section": "SW 40",
        "hierarchy_level": 2,
        "topic": "settlement",
        "url": "https://www.gov.uk/guidance/immigration-rules/immigration-rules-appendix-skilled-worker",
        "scraped_at": "2025-12-06T17:28:54.497600"
      },
      "text": "### Care requirement for settlement as a dependent child of a Skilled Worker\n\nSW 40.1. DELETED.",
      "summary": "This provision applies to dependent children of Skilled Workers seeking settlement. It requires demonstrate adequate care arrangements for the child's welfare, with no specific exceptions or thresholds detailed.",
      "augmented_text": "Document: Immigration Rules Appendix Skilled Worker\nPart: Immigration Rules Appendix Skilled Worker\nSection ID: SW 40.1\nSection: Care requirement for settlement as a dependent child of a Skilled Worker\nTopic: settlement\n\nSummary: This provision applies to dependent children of Skilled Workers seeking settlement. It requires demonstrate adequate care arrangements for the child's welfare, with no specific exceptions or thresholds detailed.\n\n### Care requirement for settlement as a dependent child of a Skilled Worker\n\nSW 40.1. DELETED.",
      "needs_review": false
    },
    {
      "metadata": {
        "source": "Immigration Rules Appendix Skilled Worker",
        "part": "Immigration Rules Appendix Skilled Worker",
        "section_id": "SW 41.1",
        "section_title": "Age requirement for settlement as a dependent child of a Skilled Worker",
        "parent_section": "SW 41",
        "hierarchy_level": 2,
        "topic": "settlement",
        "url": "https://www.gov.uk/guidance/immigration-rules/immigration-rules-appendix-skilled-worker",
        "scraped_at": "2025-12-06T17:28:54.497611"
      },
      "text": "### Age requirement for settlement as a dependent child of a Skilled Worker\n\nSW 41.1. DELETED.\n\nSW 41.2. DELETED.",
      "summary": "This provision applies to dependent children of Skilled Workers seeking settlement. It states that children must be under 18 at the time of application unless specific exceptions apply. The regulation emphasizes age thresholds for settlement eligibility, with deletions indicating potential updates or clarified criteria.",
      "augmented_text": "Document: Immigration Rules Appendix Skilled Worker\nPart: Immigration Rules Appendix Skilled Worker\nSection ID: SW 41.1\nSection: Age requirement for settlement as a dependent child of a Skilled Worker\nTopic: settlement\n\nSummary: This provision applies to dependent children of Skilled Workers seeking settlement. It states that children must be under 18 at the time of application unless specific exceptions apply. The regulation emphasizes age thresholds for settlement eligibility, with deletions indicating potential updates or clarified criteria.\n\n### Age requirement for settlement as a dependent child of a Skilled Worker\n\nSW 41.1. DELETED.\n\nSW 41.2. DELETED.",
      "needs_review": false
    },
    {
      "metadata": {
        "source": "Immigration Rules Appendix Skilled Worker",
        "part": "Immigration Rules Appendix Skilled Worker",
        "section_id": "1",
        "section_title": "Requirements for settlement as a dependent child of a Skilled Worker",
        "parent_section": null,
        "hierarchy_level": 1,
        "topic": "settlement",
        "url": "https://www.gov.uk/guidance/immigration-rules/immigration-rules-appendix-skilled-worker",
        "scraped_at": "2025-12-06T17:28:54.497625"
      },
      "text": "### Requirements for settlement as a dependent child of a Skilled Worker\n\n1.   SW 41A.1. The applicant must meet the following requirements for a dependent child in Appendix Children: \n    1.   (a) care requirement; and\n    2.   (b) age and independent life requirement.",
      "summary": "This provision applies to dependent children of Skilled Workers seeking settlement. They must satisfy the care requirement and age and independent life criteria outlined in Appendix Children. No exceptions or thresholds are specified beyond meeting these conditions.",
      "augmented_text": "Document: Immigration Rules Appendix Skilled Worker\nPart: Immigration Rules Appendix Skilled Worker\nSection ID: 1\nSection: Requirements for settlement as a dependent child of a Skilled Worker\nTopic: settlement\n\nSummary: This provision applies to dependent children of Skilled Workers seeking settlement. They must satisfy the care requirement and age and independent life criteria outlined in Appendix Children. No exceptions or thresholds are specified beyond meeting these conditions.\n\n### Requirements for settlement as a dependent child of a Skilled Worker\n\n1.   SW 41A.1. The applicant must meet the following requirements for a dependent child in Appendix Children: \n    1.   (a) care requirement; and\n    2.   (b) age and independent life requirement.",
      "needs_review": false
    },
    {
      "metadata": {
        "source": "Immigration Rules Appendix Skilled Worker",
        "part": "Immigration Rules Appendix Skilled Worker",
        "section_id": "SW 42.1",
        "section_title": "Qualifying period requirement for settlement as a dependent partner of a Skilled Worker",
        "parent_section": "SW 42",
        "hierarchy_level": 2,
        "topic": "settlement",
        "url": "https://www.gov.uk/guidance/immigration-rules/immigration-rules-appendix-skilled-worker",
        "scraped_at": "2025-12-06T17:28:54.497637"
      },
      "text": "### Qualifying period requirement for settlement as a dependent partner of a Skilled Worker\n\nSW 42.1. The applicant must have spent a continuous period of 5 years in the UK with permission as a dependent partner of the person (P) in SW 39.1.",
      "summary": "Dependent partners of Skilled Workers must have completed a continuous 5-year period in the UK with valid permission as their partner. No exceptions are specified; the period must be uninterrupted.",
      "augmented_text": "Document: Immigration Rules Appendix Skilled Worker\nPart: Immigration Rules Appendix Skilled Worker\nSection ID: SW 42.1\nSection: Qualifying period requirement for settlement as a dependent partner of a Skilled Worker\nTopic: settlement\n\nSummary: Dependent partners of Skilled Workers must have completed a continuous 5-year period in the UK with valid permission as their partner. No exceptions are specified; the period must be uninterrupted.\n\n### Qualifying period requirement for settlement as a dependent partner of a Skilled Worker\n\nSW 42.1. The applicant must have spent a continuous period of 5 years in the UK with permission as a dependent partner of the person (P) in SW 39.1.",
      "needs_review": false
    },
    {
      "metadata": {
        "source": "Immigration Rules Appendix Skilled Worker",
        "part": "Immigration Rules Appendix Skilled Worker",
        "section_id": "SW 43.1",
        "section_title": "Continuous residence requirement for settlement as a dependent partner of a Skilled Worker",
        "parent_section": "SW 43",
        "hierarchy_level": 2,
        "topic": "settlement",
        "url": "https://www.gov.uk/guidance/immigration-rules/immigration-rules-appendix-skilled-worker",
        "scraped_at": "2025-12-06T17:28:54.497652"
      },
      "text": "### Continuous residence requirement for settlement as a dependent partner of a Skilled Worker\n\nSW 43.1. The applicant must meet the continuous residence requirement as set out in Appendix Continuous Residence during the period in SW 42.1.",
      "summary": "This provision applies to dependent partners of Skilled Workers seeking settlement. They must meet the continuous residence requirement outlined in Appendix Continuous Residence during the relevant period specified in SW 42.1, with eligibility contingent upon maintaining continuous lawful residence.",
      "augmented_text": "Document: Immigration Rules Appendix Skilled Worker\nPart: Immigration Rules Appendix Skilled Worker\nSection ID: SW 43.1\nSection: Continuous residence requirement for settlement as a dependent partner of a Skilled Worker\nTopic: settlement\n\nSummary: This provision applies to dependent partners of Skilled Workers seeking settlement. They must meet the continuous residence requirement outlined in Appendix Continuous Residence during the relevant period specified in SW 42.1, with eligibility contingent upon maintaining continuous lawful residence.\n\n### Continuous residence requirement for settlement as a dependent partner of a Skilled Worker\n\nSW 43.1. The applicant must meet the continuous residence requirement as set out in Appendix Continuous Residence during the period in SW 42.1.",
      "needs_review": false
    },
    {
      "metadata": {
        "source": "Immigration Rules Appendix Skilled Worker",
        "part": "Immigration Rules Appendix Skilled Worker",
        "section_id": "SW 44.1",
        "section_title": "English language requirement for settlement as a dependent partner or dependent child of a Skilled Worker",
        "parent_section": "SW 44",
        "hierarchy_level": 2,
        "topic": "english-language",
        "url": "https://www.gov.uk/guidance/immigration-rules/immigration-rules-appendix-skilled-worker",
        "scraped_at": "2025-12-06T17:28:54.497661"
      },
      "text": "### English language requirement for settlement as a dependent partner or dependent child of a Skilled Worker\n\nSW 44.1. Unless an exemption applies, the applicant must show English language ability on the Common European Framework of Reference for Languages in speaking and listening to at least level B1.\n\nSW 44.2. The applicant must show they meet the English language requirement as specified in Appendix English Language.",
      "summary": "Dependent partners and children of Skilled Workers must demonstrate English language proficiency at B1 level in speaking and listening, unless exempt, in order to settle. They must also meet the specific criteria outlined in the Appendix English Language.",
      "augmented_text": "Document: Immigration Rules Appendix Skilled Worker\nPart: Immigration Rules Appendix Skilled Worker\nSection ID: SW 44.1\nSection: English language requirement for settlement as a dependent partner or dependent child of a Skilled Worker\nTopic: english-language\n\nSummary: Dependent partners and children of Skilled Workers must demonstrate English language proficiency at B1 level in speaking and listening, unless exempt, in order to settle. They must also meet the specific criteria outlined in the Appendix English Language.\n\n### English language requirement for settlement as a dependent partner or dependent child of a Skilled Worker\n\nSW 44.1. Unless an exemption applies, the applicant must show English language ability on the Common European Framework of Reference for Languages in speaking and listening to at least level B1.\n\nSW 44.2. The applicant must show they meet the English language requirement as specified in Appendix English Language.",
      "needs_review": false
    },
    {
      "metadata": {
        "source": "Immigration Rules Appendix Skilled Worker",
        "part": "Immigration Rules Appendix Skilled Worker",
        "section_id": "SW 45.1",
        "section_title": "Knowledge of life in the UK requirement for settlement as a dependent partner or dependent child of a Skilled Worker",
        "parent_section": "SW 45",
        "hierarchy_level": 2,
        "topic": "settlement",
        "url": "https://www.gov.uk/guidance/immigration-rules/immigration-rules-appendix-skilled-worker",
        "scraped_at": "2025-12-06T17:28:54.497675"
      },
      "text": "### Knowledge of life in the UK requirement for settlement as a dependent partner or dependent child of a Skilled Worker\n\nSW 45.1. If the applicant is aged 18 or over on the date of application, they must meet the knowledge of Life in the UK requirement as set out in Appendix KOL UK.",
      "summary": "Dependent partners or children aged 18 or over applying for settlement must meet the Life in the UK requirement outlined in Appendix KOL UK. This applies specifically to those aged 18 or above on the application date, with no additional exceptions stated.",
      "augmented_text": "Document: Immigration Rules Appendix Skilled Worker\nPart: Immigration Rules Appendix Skilled Worker\nSection ID: SW 45.1\nSection: Knowledge of life in the UK requirement for settlement as a dependent partner or dependent child of a Skilled Worker\nTopic: settlement\n\nSummary: Dependent partners or children aged 18 or over applying for settlement must meet the Life in the UK requirement outlined in Appendix KOL UK. This applies specifically to those aged 18 or above on the application date, with no additional exceptions stated.\n\n### Knowledge of life in the UK requirement for settlement as a dependent partner or dependent child of a Skilled Worker\n\nSW 45.1. If the applicant is aged 18 or over on the date of application, they must meet the knowledge of Life in the UK requirement as set out in Appendix KOL UK.",
      "needs_review": false
    },
    {
      "metadata": {
        "source": "Immigration Rules Appendix Skilled Worker",
        "part": "Immigration Rules Appendix Skilled Worker",
        "section_id": "SW 46.1",
        "section_title": "Decision on an application for settlement as a dependent partner or dependent child of a Skilled Worker",
        "parent_section": "SW 46",
        "hierarchy_level": 2,
        "topic": "eligibility",
        "url": "https://www.gov.uk/guidance/immigration-rules/immigration-rules-appendix-skilled-worker",
        "scraped_at": "2025-12-06T17:28:54.497681"
      },
      "text": "### Decision on an application for settlement as a dependent partner or dependent child of a Skilled Worker\n\nSW 46.1. If the decision maker is satisfied all the suitability and eligibility requirements are met for settlement as a dependent partner or dependent child of a Skilled Worker, the application will be granted, otherwise the application will be refused.\n\nSW 46.2. If the application is refused the person can apply for an Administrative Review under Appendix AR: Administrative Review.",
      "summary": "This provision applies to dependent partners or children of Skilled Workers applying for settlement. It requires the decision-maker to assess all suitability and eligibility criteria; applications are granted if met, otherwise refused, with a right to an Administrative Review if refused.",
      "augmented_text": "Document: Immigration Rules Appendix Skilled Worker\nPart: Immigration Rules Appendix Skilled Worker\nSection ID: SW 46.1\nSection: Decision on an application for settlement as a dependent partner or dependent child of a Skilled Worker\nTopic: eligibility\n\nSummary: This provision applies to dependent partners or children of Skilled Workers applying for settlement. It requires the decision-maker to assess all suitability and eligibility criteria; applications are granted if met, otherwise refused, with a right to an Administrative Review if refused.\n\n### Decision on an application for settlement as a dependent partner or dependent child of a Skilled Worker\n\nSW 46.1. If the decision maker is satisfied all the suitability and eligibility requirements are met for settlement as a dependent partner or dependent child of a Skilled Worker, the application will be granted, otherwise the application will be refused.\n\nSW 46.2. If the application is refused the person can apply for an Administrative Review under Appendix AR: Administrative Review.",
      "needs_review": false
    }
  ]
}