{
  "url": "https://www.gov.uk/guidance/immigration-rules/immigration-rules-appendix-family-reunion-sponsors-with-protection",
  "part_name": "Immigration Rules Appendix Family Reunion (Sponsors with Protection)",
  "scraped_at": "2025-12-06T17:27:14.194157",
  "chunk_count": 12,
  "chunks": [
    {
      "metadata": {
        "source": "Immigration Rules Appendix Family Reunion (Sponsors with Protection)",
        "part": "Immigration Rules Appendix Family Reunion (Sponsors with Protection)",
        "section_id": "FRP 1.1",
        "section_title": "Validity requirements for Family Reunion",
        "parent_section": "FRP 1",
        "hierarchy_level": 2,
        "topic": "family",
        "url": "https://www.gov.uk/guidance/immigration-rules/immigration-rules-appendix-family-reunion-sponsors-with-protection",
        "scraped_at": "2025-12-06T17:27:14.193763"
      },
      "text": "### Validity requirements for Family Reunion\n\nFRP 1.1. DELETED.\n\n1.   FRP 1.2. DELETED.\n\n1.   FRP 1.3. DELETED.\n\nFRP 1.4. DELETED.",
      "summary": "This provision applies to sponsors with protection seeking family reunion, outlining validity requirements. Specific details are deleted, but generally, it mandates that sponsors meet certain eligibility criteria and adhere to designated validity standards for family reunion applications, with key conditions and thresholds not specified in the provided excerpt.",
      "augmented_text": "Document: Immigration Rules Appendix Family Reunion (Sponsors with Protection)\nPart: Immigration Rules Appendix Family Reunion (Sponsors with Protection)\nSection ID: FRP 1.1\nSection: Validity requirements for Family Reunion\nTopic: family\n\nSummary: This provision applies to sponsors with protection seeking family reunion, outlining validity requirements. Specific details are deleted, but generally, it mandates that sponsors meet certain eligibility criteria and adhere to designated validity standards for family reunion applications, with key conditions and thresholds not specified in the provided excerpt.\n\n### Validity requirements for Family Reunion\n\nFRP 1.1. DELETED.\n\n1.   FRP 1.2. DELETED.\n\n1.   FRP 1.3. DELETED.\n\nFRP 1.4. DELETED.",
      "needs_review": false
    },
    {
      "metadata": {
        "source": "Immigration Rules Appendix Family Reunion (Sponsors with Protection)",
        "part": "Immigration Rules Appendix Family Reunion (Sponsors with Protection)",
        "section_id": "FRP 2.1",
        "section_title": "Suitability requirements for Family Reunion",
        "parent_section": "FRP 2",
        "hierarchy_level": 2,
        "topic": "suitability",
        "url": "https://www.gov.uk/guidance/immigration-rules/immigration-rules-appendix-family-reunion-sponsors-with-protection",
        "scraped_at": "2025-12-06T17:27:14.193799"
      },
      "text": "### Suitability requirements for Family Reunion\n\nFRP 2.1. The applicant must not fall for refusal under Part Suitability.\n\nFRP 2.2. DELETED.",
      "summary": "This provision applies to applicants seeking Family Reunion under protection claims. They must meet suitability requirements, ensuring they are not grounds for refusal under Part Suitability. No specific exceptions or thresholds are outlined in this section.",
      "augmented_text": "Document: Immigration Rules Appendix Family Reunion (Sponsors with Protection)\nPart: Immigration Rules Appendix Family Reunion (Sponsors with Protection)\nSection ID: FRP 2.1\nSection: Suitability requirements for Family Reunion\nTopic: suitability\n\nSummary: This provision applies to applicants seeking Family Reunion under protection claims. They must meet suitability requirements, ensuring they are not grounds for refusal under Part Suitability. No specific exceptions or thresholds are outlined in this section.\n\n### Suitability requirements for Family Reunion\n\nFRP 2.1. The applicant must not fall for refusal under Part Suitability.\n\nFRP 2.2. DELETED.",
      "needs_review": false
    },
    {
      "metadata": {
        "source": "Immigration Rules Appendix Family Reunion (Sponsors with Protection)",
        "part": "Immigration Rules Appendix Family Reunion (Sponsors with Protection)",
        "section_id": "Eligibility requirements for Family Reunion",
        "section_title": "Eligibility requirements for Family Reunion",
        "parent_section": null,
        "hierarchy_level": 2,
        "topic": "eligibility",
        "url": "https://www.gov.uk/guidance/immigration-rules/immigration-rules-appendix-family-reunion-sponsors-with-protection",
        "scraped_at": "2025-12-06T17:27:14.193814"
      },
      "text": "### Eligibility requirements for Family Reunion",
      "summary": "This provision applies to sponsors with protected status seeking family reunion. It requires them to demonstrate their qualifying relationship and meet the necessary criteria, with possible exceptions based on individual circumstances or thresholds outlined in the rules.",
      "augmented_text": "Document: Immigration Rules Appendix Family Reunion (Sponsors with Protection)\nPart: Immigration Rules Appendix Family Reunion (Sponsors with Protection)\nSection ID: Eligibility requirements for Family Reunion\nSection: Eligibility requirements for Family Reunion\nTopic: eligibility\n\nSummary: This provision applies to sponsors with protected status seeking family reunion. It requires them to demonstrate their qualifying relationship and meet the necessary criteria, with possible exceptions based on individual circumstances or thresholds outlined in the rules.\n\n### Eligibility requirements for Family Reunion",
      "needs_review": false
    },
    {
      "metadata": {
        "source": "Immigration Rules Appendix Family Reunion (Sponsors with Protection)",
        "part": "Immigration Rules Appendix Family Reunion (Sponsors with Protection)",
        "section_id": "FRP 3.1",
        "section_title": "Identity requirement for Family Reunion",
        "parent_section": "FRP 3",
        "hierarchy_level": 2,
        "topic": "family",
        "url": "https://www.gov.uk/guidance/immigration-rules/immigration-rules-appendix-family-reunion-sponsors-with-protection",
        "scraped_at": "2025-12-06T17:27:14.193845"
      },
      "text": "### Identity requirement for Family Reunion\n\nFRP 3.1 DELETED.",
      "summary": "This provision applies to sponsors with protection status seeking family reunion. It requires them to verify identity unless they qualify for specific exceptions, ensuring proper identification for the application process. No detailed exceptions are provided in this excerpt.",
      "augmented_text": "Document: Immigration Rules Appendix Family Reunion (Sponsors with Protection)\nPart: Immigration Rules Appendix Family Reunion (Sponsors with Protection)\nSection ID: FRP 3.1\nSection: Identity requirement for Family Reunion\nTopic: family\n\nSummary: This provision applies to sponsors with protection status seeking family reunion. It requires them to verify identity unless they qualify for specific exceptions, ensuring proper identification for the application process. No detailed exceptions are provided in this excerpt.\n\n### Identity requirement for Family Reunion\n\nFRP 3.1 DELETED.",
      "needs_review": false
    },
    {
      "metadata": {
        "source": "Immigration Rules Appendix Family Reunion (Sponsors with Protection)",
        "part": "Immigration Rules Appendix Family Reunion (Sponsors with Protection)",
        "section_id": "1",
        "section_title": "Relationship requirements for a partner applying for Family Reunion",
        "parent_section": null,
        "hierarchy_level": 1,
        "topic": "family",
        "url": "https://www.gov.uk/guidance/immigration-rules/immigration-rules-appendix-family-reunion-sponsors-with-protection",
        "scraped_at": "2025-12-06T17:27:14.193887"
      },
      "text": "### Relationship requirements for a partner applying for Family Reunion\n\n1.   FRP 4.1. DELETED.\n\nFRP 4.2. DELETED.",
      "summary": "This provision applies to partners applying for Family Reunion under protection. It requires proof of a genuine relationship, meeting specific relationship criteria, with certain conditions or exceptions outlined elsewhere.",
      "augmented_text": "Document: Immigration Rules Appendix Family Reunion (Sponsors with Protection)\nPart: Immigration Rules Appendix Family Reunion (Sponsors with Protection)\nSection ID: 1\nSection: Relationship requirements for a partner applying for Family Reunion\nTopic: family\n\nSummary: This provision applies to partners applying for Family Reunion under protection. It requires proof of a genuine relationship, meeting specific relationship criteria, with certain conditions or exceptions outlined elsewhere.\n\n### Relationship requirements for a partner applying for Family Reunion\n\n1.   FRP 4.1. DELETED.\n\nFRP 4.2. DELETED.",
      "needs_review": false
    },
    {
      "metadata": {
        "source": "Immigration Rules Appendix Family Reunion (Sponsors with Protection)",
        "part": "Immigration Rules Appendix Family Reunion (Sponsors with Protection)",
        "section_id": "1",
        "section_title": "Relationship requirement for a child applying for Family Reunion",
        "parent_section": null,
        "hierarchy_level": 1,
        "topic": "family",
        "url": "https://www.gov.uk/guidance/immigration-rules/immigration-rules-appendix-family-reunion-sponsors-with-protection",
        "scraped_at": "2025-12-06T17:27:14.193917"
      },
      "text": "### Relationship requirement for a child applying for Family Reunion\n\n1.   FRP 5.1 DELETED.",
      "summary": "This provision applies to children applying for Family Reunion under protection. It requires evidence of a genuine parent-child relationship; specific conditions or exceptions are not detailed in this excerpt.",
      "augmented_text": "Document: Immigration Rules Appendix Family Reunion (Sponsors with Protection)\nPart: Immigration Rules Appendix Family Reunion (Sponsors with Protection)\nSection ID: 1\nSection: Relationship requirement for a child applying for Family Reunion\nTopic: family\n\nSummary: This provision applies to children applying for Family Reunion under protection. It requires evidence of a genuine parent-child relationship; specific conditions or exceptions are not detailed in this excerpt.\n\n### Relationship requirement for a child applying for Family Reunion\n\n1.   FRP 5.1 DELETED.",
      "needs_review": false
    },
    {
      "metadata": {
        "source": "Immigration Rules Appendix Family Reunion (Sponsors with Protection)",
        "part": "Immigration Rules Appendix Family Reunion (Sponsors with Protection)",
        "section_id": "1",
        "section_title": "Family life requirements for a child applying for Family Reunion",
        "parent_section": null,
        "hierarchy_level": 1,
        "topic": "family",
        "url": "https://www.gov.uk/guidance/immigration-rules/immigration-rules-appendix-family-reunion-sponsors-with-protection",
        "scraped_at": "2025-12-06T17:27:14.193947"
      },
      "text": "### Family life requirements for a child applying for Family Reunion\n\n1.   FRP 6.1. DELETED.\n\n1.   FRP 6.2. DELETED.",
      "summary": "This provision applies to children applying for Family Reunion under sponsors with protection. It details the family life requirements they must meet, though specific conditions and the full criteria are not included in the provided text.",
      "augmented_text": "Document: Immigration Rules Appendix Family Reunion (Sponsors with Protection)\nPart: Immigration Rules Appendix Family Reunion (Sponsors with Protection)\nSection ID: 1\nSection: Family life requirements for a child applying for Family Reunion\nTopic: family\n\nSummary: This provision applies to children applying for Family Reunion under sponsors with protection. It details the family life requirements they must meet, though specific conditions and the full criteria are not included in the provided text.\n\n### Family life requirements for a child applying for Family Reunion\n\n1.   FRP 6.1. DELETED.\n\n1.   FRP 6.2. DELETED.",
      "needs_review": false
    },
    {
      "metadata": {
        "source": "Immigration Rules Appendix Family Reunion (Sponsors with Protection)",
        "part": "Immigration Rules Appendix Family Reunion (Sponsors with Protection)",
        "section_id": "FRP 7.1",
        "section_title": "Eligibility under Article 8 of the Human Rights Convention",
        "parent_section": "FRP 7",
        "hierarchy_level": 2,
        "topic": "eligibility",
        "url": "https://www.gov.uk/guidance/immigration-rules/immigration-rules-appendix-family-reunion-sponsors-with-protection",
        "scraped_at": "2025-12-06T17:27:14.193966"
      },
      "text": "### Eligibility under Article 8 of the Human Rights Convention\n\nFRP 7.1. DELETED.\n\nFRP 7.2. DELETED.",
      "summary": "This provision applies to family members seeking to reunite with protected sponsors under Article 8 of the Human Rights Convention. It requires demonstrating their right to family life and the necessity of reunion, with specific eligibility criteria and exceptions outlined in the detailed regulations.",
      "augmented_text": "Document: Immigration Rules Appendix Family Reunion (Sponsors with Protection)\nPart: Immigration Rules Appendix Family Reunion (Sponsors with Protection)\nSection ID: FRP 7.1\nSection: Eligibility under Article 8 of the Human Rights Convention\nTopic: eligibility\n\nSummary: This provision applies to family members seeking to reunite with protected sponsors under Article 8 of the Human Rights Convention. It requires demonstrating their right to family life and the necessity of reunion, with specific eligibility criteria and exceptions outlined in the detailed regulations.\n\n### Eligibility under Article 8 of the Human Rights Convention\n\nFRP 7.1. DELETED.\n\nFRP 7.2. DELETED.",
      "needs_review": false
    },
    {
      "metadata": {
        "source": "Immigration Rules Appendix Family Reunion (Sponsors with Protection)",
        "part": "Immigration Rules Appendix Family Reunion (Sponsors with Protection)",
        "section_id": "FRP 8.1",
        "section_title": "Decision on an application for Family Reunion",
        "parent_section": "FRP 8",
        "hierarchy_level": 2,
        "topic": "family",
        "url": "https://www.gov.uk/guidance/immigration-rules/immigration-rules-appendix-family-reunion-sponsors-with-protection",
        "scraped_at": "2025-12-06T17:27:14.193994"
      },
      "text": "### Decision on an application for Family Reunion\n\nFRP 8.1. DELETED.",
      "summary": "This provision applies to sponsors with protection status applying for family reunion. It requires a decision on the application, with specific conditions and eligibility criteria, subject to applicable law and exceptions outlined elsewhere in the rules.",
      "augmented_text": "Document: Immigration Rules Appendix Family Reunion (Sponsors with Protection)\nPart: Immigration Rules Appendix Family Reunion (Sponsors with Protection)\nSection ID: FRP 8.1\nSection: Decision on an application for Family Reunion\nTopic: family\n\nSummary: This provision applies to sponsors with protection status applying for family reunion. It requires a decision on the application, with specific conditions and eligibility criteria, subject to applicable law and exceptions outlined elsewhere in the rules.\n\n### Decision on an application for Family Reunion\n\nFRP 8.1. DELETED.",
      "needs_review": false
    },
    {
      "metadata": {
        "source": "Immigration Rules Appendix Family Reunion (Sponsors with Protection)",
        "part": "Immigration Rules Appendix Family Reunion (Sponsors with Protection)",
        "section_id": "FRP 9.1",
        "section_title": "Period of grant for Family Reunion",
        "parent_section": "FRP 9",
        "hierarchy_level": 2,
        "topic": "family",
        "url": "https://www.gov.uk/guidance/immigration-rules/immigration-rules-appendix-family-reunion-sponsors-with-protection",
        "scraped_at": "2025-12-06T17:27:14.194024"
      },
      "text": "### Period of grant for Family Reunion\n\nFRP 9.1. DELETED.\n\n1.   FRP 9.2. DELETED.\n\nFRP 9.3. DELETED.",
      "summary": "This provision applies to sponsors with protection who facilitate family reunion. It specifies the period of grant for family reunion, with certain conditions and exceptions outlined in the deleted sections. Critical thresholds or detailed conditions are not provided in this excerpt.",
      "augmented_text": "Document: Immigration Rules Appendix Family Reunion (Sponsors with Protection)\nPart: Immigration Rules Appendix Family Reunion (Sponsors with Protection)\nSection ID: FRP 9.1\nSection: Period of grant for Family Reunion\nTopic: family\n\nSummary: This provision applies to sponsors with protection who facilitate family reunion. It specifies the period of grant for family reunion, with certain conditions and exceptions outlined in the deleted sections. Critical thresholds or detailed conditions are not provided in this excerpt.\n\n### Period of grant for Family Reunion\n\nFRP 9.1. DELETED.\n\n1.   FRP 9.2. DELETED.\n\nFRP 9.3. DELETED.",
      "needs_review": false
    },
    {
      "metadata": {
        "source": "Immigration Rules Appendix Family Reunion (Sponsors with Protection)",
        "part": "Immigration Rules Appendix Family Reunion (Sponsors with Protection)",
        "section_id": "1",
        "section_title": "Conditions of grant for Family Reunion",
        "parent_section": null,
        "hierarchy_level": 1,
        "topic": "family",
        "url": "https://www.gov.uk/guidance/immigration-rules/immigration-rules-appendix-family-reunion-sponsors-with-protection",
        "scraped_at": "2025-12-06T17:27:14.194052"
      },
      "text": "### Conditions of grant for Family Reunion\n\n1.   FRP 10.1. DELETED.",
      "summary": "This provision applies to sponsors with protection status seeking family reunion. It outlines conditions for granting the application, emphasizing compliance with specific requirements; however, the detailed conditions are not specified in the deleted section.",
      "augmented_text": "Document: Immigration Rules Appendix Family Reunion (Sponsors with Protection)\nPart: Immigration Rules Appendix Family Reunion (Sponsors with Protection)\nSection ID: 1\nSection: Conditions of grant for Family Reunion\nTopic: family\n\nSummary: This provision applies to sponsors with protection status seeking family reunion. It outlines conditions for granting the application, emphasizing compliance with specific requirements; however, the detailed conditions are not specified in the deleted section.\n\n### Conditions of grant for Family Reunion\n\n1.   FRP 10.1. DELETED.",
      "needs_review": false
    },
    {
      "metadata": {
        "source": "Immigration Rules Appendix Family Reunion (Sponsors with Protection)",
        "part": "Immigration Rules Appendix Family Reunion (Sponsors with Protection)",
        "section_id": "FRP 11.1",
        "section_title": "Transitional provisions",
        "parent_section": "FRP 11",
        "hierarchy_level": 2,
        "topic": "family",
        "url": "https://www.gov.uk/guidance/immigration-rules/immigration-rules-appendix-family-reunion-sponsors-with-protection",
        "scraped_at": "2025-12-06T17:27:14.194085"
      },
      "text": "### Transitional provisions\n\nFRP 11.1. Applications made before 1500 on 4 September 2025 by a partner or child of a person with protection status will be decided under the Appendix Family Reunion (Sponsors with Protection) rules in force on that date. In any other case, the partner or child of a person with protection status must apply under Appendix FM to stay with or join that person until further notice.\n\nPrint this page",
      "summary": "This provision applies to partners or children of persons with protection status applying before 4 September 2025. They must be decided under the rules in force before that date, while other applicants must apply under Appendix FM. The key condition is the application date; after that, different rules apply.",
      "augmented_text": "Document: Immigration Rules Appendix Family Reunion (Sponsors with Protection)\nPart: Immigration Rules Appendix Family Reunion (Sponsors with Protection)\nSection ID: FRP 11.1\nSection: Transitional provisions\nTopic: family\n\nSummary: This provision applies to partners or children of persons with protection status applying before 4 September 2025. They must be decided under the rules in force before that date, while other applicants must apply under Appendix FM. The key condition is the application date; after that, different rules apply.\n\n### Transitional provisions\n\nFRP 11.1. Applications made before 1500 on 4 September 2025 by a partner or child of a person with protection status will be decided under the Appendix Family Reunion (Sponsors with Protection) rules in force on that date. In any other case, the partner or child of a person with protection status must apply under Appendix FM to stay with or join that person until further notice.\n\nPrint this page",
      "needs_review": false
    }
  ]
}