{
  "url": "https://www.gov.uk/guidance/immigration-rules/immigration-rules-appendix-start-up",
  "part_name": "Immigration Rules Appendix Start-up",
  "scraped_at": "2025-12-06T17:29:01.840049",
  "chunk_count": 26,
  "chunks": [
    {
      "metadata": {
        "source": "Immigration Rules Appendix Start-up",
        "part": "Immigration Rules Appendix Start-up",
        "section_id": "SU 1.1",
        "section_title": "Validity requirements for Start-up route",
        "parent_section": "SU 1",
        "hierarchy_level": 2,
        "topic": "leave-to-enter",
        "url": "https://www.gov.uk/guidance/immigration-rules/immigration-rules-appendix-start-up",
        "scraped_at": "2025-12-06T17:29:01.839506"
      },
      "text": "### Validity requirements for Start-up route\n\nSU 1.1. A person applying for entry clearance or permission to stay on the Start-up route must apply online on the gov.uk website on the specified form as follows:\n\n| Applicant | Specified form |\n| --- | --- |\n| EEA national with a chipped passport | Either: • Start-up or Innovator using the UK Immigration: ID Check app (when available); or • the forms listed below for applicants outside or inside the UK (as relevant) |\n| Applicants outside the UK | Start-up or Innovator visa |\n| Applicants inside the UK | Start-up or Innovator permission to stay |\n\n1.   SU 1.2. An application for entry clearance or permission to stay on the Start-up route must meet all the following requirements: \n    1.   (a) any fee and Immigration Health Charge must have been paid; and\n    2.   (b) the applicant must have provided any required biometrics; and\n    3.   (c) the applicant must have provided a passport or other travel document which satisfactorily establishes their identity and nationality; and\n    4.   (d) the applicant must have been issued with an endorsement letter by an endorsing body dated no more than 3 months before the date of application, and issued before the 13 April 2023, and that endorsement must not have been withdrawn.\n\nSU 1.3. The applicant must be aged 18 or over on the date of application.\n\nSU 1.4. If the applicant has in the last 12 months before the date of application received an award from a Government or international scholarship agency covering both fees and living costs for study in the UK, they must provide written consent to the application from that Government or agency.\n\n1.   SU 1.5. A person applying for permission to stay must be in the UK and must not have, or have last been granted, permission: \n    1.   (a) as a Visitor; or\n    2.   (b) as a Short-term Student; or\n    3.   (c) as a Parent of a Child Student; or\n    4.   (d) as a Seasonal Worker; or\n    5.   (e) as a domestic worker in a private household; or\n    6.   (f) outside the Immigration Rules.\n\nSU 1.6. An application which does not meet all the validity requirements for the Start-up route may be rejected as invalid and not considered.",
      "summary": "Applicants applying for the UK Start-up route must submit online applications with required fees, biometrics, valid travel documents, and an endorsement letter issued within the past three months (before 13 April 2023). They must be aged 18 or over and meet specific identity and endorsement conditions.",
      "augmented_text": "Document: Immigration Rules Appendix Start-up\nPart: Immigration Rules Appendix Start-up\nSection ID: SU 1.1\nSection: Validity requirements for Start-up route\nTopic: leave-to-enter\n\nSummary: Applicants applying for the UK Start-up route must submit online applications with required fees, biometrics, valid travel documents, and an endorsement letter issued within the past three months (before 13 April 2023). They must be aged 18 or over and meet specific identity and endorsement conditions.\n\n### Validity requirements for Start-up route\n\nSU 1.1. A person applying for entry clearance or permission to stay on the Start-up route must apply online on the gov.uk website on the specified form as follows:\n\n| Applicant | Specified form |\n| --- | --- |\n| EEA national with a chipped passport | Either: • Start-up or Innovator using the UK Immigration: ID Check app (when available); or • the forms listed below for applicants outside or inside the UK (as relevant) |\n| Applicants outside the UK | Start-up or Innovator visa |\n| Applicants inside the UK | Start-up or Innovator permission to stay |\n\n1.   SU 1.2. An application for entry clearance or permission to stay on the Start-up route must meet all the following requirements: \n    1.   (a) any fee and Immigration Health Charge must have been paid; and\n    2.   (b) the applicant must have provided any required biometrics; and\n    3.   (c) the applicant must have provided a passport or other travel document which satisfactorily establishes their identity and nationality; and\n    4.   (d) the applicant must have been issued with an endorsement letter by an endorsing body dated no more than 3 months before the date of application, and issued before the 13 April 2023, and that endorsement must not have been withdrawn.\n\nSU 1.3. The applicant must be aged 18 or over on the date of application.\n\nSU 1.4. If the applicant has in the last 12 months before the date of application received an award from a Government or international scholarship agency covering both fees and living costs for study in the UK, they must provide written consent to the application from that Government or agency.\n\n1.   SU 1.5. A person applying for permission to stay must be in the UK and must not have, or have last been granted, permission: \n    1.   (a) as a Visitor; or\n    2.   (b) as a Short-term Student; or\n    3.   (c) as a Parent of a Child Student; or\n    4.   (d) as a Seasonal Worker; or\n    5.   (e) as a domestic worker in a private household; or\n    6.   (f) outside the Immigration Rules.\n\nSU 1.6. An application which does not meet all the validity requirements for the Start-up route may be rejected as invalid and not considered.",
      "needs_review": false
    },
    {
      "metadata": {
        "source": "Immigration Rules Appendix Start-up",
        "part": "Immigration Rules Appendix Start-up",
        "section_id": "SU 2.1",
        "section_title": "Suitability requirements for the Start-up route",
        "parent_section": "SU 2",
        "hierarchy_level": 2,
        "topic": "suitability",
        "url": "https://www.gov.uk/guidance/immigration-rules/immigration-rules-appendix-start-up",
        "scraped_at": "2025-12-06T17:29:01.839535"
      },
      "text": "### Suitability requirements for the Start-up route\n\nSU 2.1. The applicant must not fall for refusal under Part Suitability.\n\n1.   SU 2.2. If applying for permission to stay the applicant must not be: \n    1.   (a) in breach of immigration laws, except that where the Exceptions for overstayers section of Part Suitability applies, that period of overstaying will be disregarded; or\n    2.   (b) on immigration bail.",
      "summary": "Applicants for the UK Start-up route must meet suitability criteria, ensuring they are not in breach of immigration laws or on bail, with certain overstaying exceptions.",
      "augmented_text": "Document: Immigration Rules Appendix Start-up\nPart: Immigration Rules Appendix Start-up\nSection ID: SU 2.1\nSection: Suitability requirements for the Start-up route\nTopic: suitability\n\nSummary: Applicants for the UK Start-up route must meet suitability criteria, ensuring they are not in breach of immigration laws or on bail, with certain overstaying exceptions.\n\n### Suitability requirements for the Start-up route\n\nSU 2.1. The applicant must not fall for refusal under Part Suitability.\n\n1.   SU 2.2. If applying for permission to stay the applicant must not be: \n    1.   (a) in breach of immigration laws, except that where the Exceptions for overstayers section of Part Suitability applies, that period of overstaying will be disregarded; or\n    2.   (b) on immigration bail.",
      "needs_review": false
    },
    {
      "metadata": {
        "source": "Immigration Rules Appendix Start-up",
        "part": "Immigration Rules Appendix Start-up",
        "section_id": "Eligibility requirements for the Start-up route",
        "section_title": "Eligibility requirements for the Start-up route",
        "parent_section": null,
        "hierarchy_level": 2,
        "topic": "eligibility",
        "url": "https://www.gov.uk/guidance/immigration-rules/immigration-rules-appendix-start-up",
        "scraped_at": "2025-12-06T17:29:01.839544"
      },
      "text": "### Eligibility requirements for the Start-up route",
      "summary": "The Start-up route applies to new entrepreneurs seeking to establish a business in the UK. Applicants must demonstrate innovative, viable, and scalable business ideas, meeting specified eligibility criteria. No prior experience or funding thresholds are mandated, but the business must be genuinely innovative and suitable for the UK market.",
      "augmented_text": "Document: Immigration Rules Appendix Start-up\nPart: Immigration Rules Appendix Start-up\nSection ID: Eligibility requirements for the Start-up route\nSection: Eligibility requirements for the Start-up route\nTopic: eligibility\n\nSummary: The Start-up route applies to new entrepreneurs seeking to establish a business in the UK. Applicants must demonstrate innovative, viable, and scalable business ideas, meeting specified eligibility criteria. No prior experience or funding thresholds are mandated, but the business must be genuinely innovative and suitable for the UK market.\n\n### Eligibility requirements for the Start-up route",
      "needs_review": false
    },
    {
      "metadata": {
        "source": "Immigration Rules Appendix Start-up",
        "part": "Immigration Rules Appendix Start-up",
        "section_id": "SU 3.1",
        "section_title": "Entry requirements for the Start-up route",
        "parent_section": "SU 3",
        "hierarchy_level": 2,
        "topic": "leave-to-enter",
        "url": "https://www.gov.uk/guidance/immigration-rules/immigration-rules-appendix-start-up",
        "scraped_at": "2025-12-06T17:29:01.839562"
      },
      "text": "### Entry requirements for the Start-up route\n\nSU 3.1. A person seeking to come to the UK on the Start-up route must apply for and obtain entry clearance on the Start-up route before they arrive in the UK.\n\nSU 3.2. A person applying for entry clearance on the Start-up route must, if Appendix Tuberculosis applies, provide a valid medical certificate confirming that they have undergone screening for active pulmonary tuberculosis and that this tuberculosis is not present in them.",
      "summary": "Applicants must obtain entry clearance on the Start-up route before arriving in the UK and, if applicable, provide a valid TB screening certificate confirming they are not infectious.",
      "augmented_text": "Document: Immigration Rules Appendix Start-up\nPart: Immigration Rules Appendix Start-up\nSection ID: SU 3.1\nSection: Entry requirements for the Start-up route\nTopic: leave-to-enter\n\nSummary: Applicants must obtain entry clearance on the Start-up route before arriving in the UK and, if applicable, provide a valid TB screening certificate confirming they are not infectious.\n\n### Entry requirements for the Start-up route\n\nSU 3.1. A person seeking to come to the UK on the Start-up route must apply for and obtain entry clearance on the Start-up route before they arrive in the UK.\n\nSU 3.2. A person applying for entry clearance on the Start-up route must, if Appendix Tuberculosis applies, provide a valid medical certificate confirming that they have undergone screening for active pulmonary tuberculosis and that this tuberculosis is not present in them.",
      "needs_review": false
    },
    {
      "metadata": {
        "source": "Immigration Rules Appendix Start-up",
        "part": "Immigration Rules Appendix Start-up",
        "section_id": "SU 4.1",
        "section_title": "Points requirement for Start-up",
        "parent_section": "SU 4",
        "hierarchy_level": 2,
        "topic": "points",
        "url": "https://www.gov.uk/guidance/immigration-rules/immigration-rules-appendix-start-up",
        "scraped_at": "2025-12-06T17:29:01.839584"
      },
      "text": "### Points requirement for Start-up\n\nSU 4.1. The applicant must be awarded a total of 70 points from the table below.\n\n| Requirement (mandatory) | Points available |\n| --- | --- |\n| Business is innovative, viable and scalable. | 25 |\n| The applicant has not previously established a business in the UK | 25 |\n| English Language at level B2 | 10 |\n| Financial requirement | 10 |\n| **Total number of points required** | 70 |",
      "summary": "This provision applies to Start-up applicants. They must earn at least 70 points by meeting requirements: a viable, scalable business (25), no prior UK business (25), English B2 (10), and financial criteria (10), with all conditions being mandatory to qualify.",
      "augmented_text": "Document: Immigration Rules Appendix Start-up\nPart: Immigration Rules Appendix Start-up\nSection ID: SU 4.1\nSection: Points requirement for Start-up\nTopic: points\n\nSummary: This provision applies to Start-up applicants. They must earn at least 70 points by meeting requirements: a viable, scalable business (25), no prior UK business (25), English B2 (10), and financial criteria (10), with all conditions being mandatory to qualify.\n\n### Points requirement for Start-up\n\nSU 4.1. The applicant must be awarded a total of 70 points from the table below.\n\n| Requirement (mandatory) | Points available |\n| --- | --- |\n| Business is innovative, viable and scalable. | 25 |\n| The applicant has not previously established a business in the UK | 25 |\n| English Language at level B2 | 10 |\n| Financial requirement | 10 |\n| **Total number of points required** | 70 |",
      "needs_review": false
    },
    {
      "metadata": {
        "source": "Immigration Rules Appendix Start-up",
        "part": "Immigration Rules Appendix Start-up",
        "section_id": "SU 5.1",
        "section_title": "Innovative, viable and scalable business requirement for Start-up route",
        "parent_section": null,
        "hierarchy_level": 1,
        "topic": "eligibility",
        "url": "https://www.gov.uk/guidance/immigration-rules/immigration-rules-appendix-start-up",
        "scraped_at": "2025-12-06T17:29:01.839610"
      },
      "text": "### Innovative, viable and scalable business requirement for Start-up route\n\n1.   SU 5.1. An applicant will meet the innovative, viable and scalable business venture requirement if all the following requirements are met: \n    1.   (a) the applicant has a genuine, original business plan that meets new or existing market needs and/or creates a competitive advantage; and\n    2.   (b) the applicant’s business plan is realistic and achievable based on the applicant’s available resources; and\n    3.   (c) the applicant has, or is actively developing, the necessary skills, knowledge, experience and market awareness to successfully run the business; and\n    4.   (d) there is evidence of structured planning and of potential for job creation and growth into national markets.",
      "summary": "Applicants applying for the UK Start-up route must demonstrate a genuine, innovative, and scalable business plan that addresses market needs, is realistic with their resources, and shows evidence of skills, structured planning, and potential for growth and job creation. Critical conditions include meeting all criteria simultaneously; exceptions are not specified.",
      "augmented_text": "Document: Immigration Rules Appendix Start-up\nPart: Immigration Rules Appendix Start-up\nSection ID: SU 5.1\nSection: Innovative, viable and scalable business requirement for Start-up route\nTopic: eligibility\n\nSummary: Applicants applying for the UK Start-up route must demonstrate a genuine, innovative, and scalable business plan that addresses market needs, is realistic with their resources, and shows evidence of skills, structured planning, and potential for growth and job creation. Critical conditions include meeting all criteria simultaneously; exceptions are not specified.\n\n### Innovative, viable and scalable business requirement for Start-up route\n\n1.   SU 5.1. An applicant will meet the innovative, viable and scalable business venture requirement if all the following requirements are met: \n    1.   (a) the applicant has a genuine, original business plan that meets new or existing market needs and/or creates a competitive advantage; and\n    2.   (b) the applicant’s business plan is realistic and achievable based on the applicant’s available resources; and\n    3.   (c) the applicant has, or is actively developing, the necessary skills, knowledge, experience and market awareness to successfully run the business; and\n    4.   (d) there is evidence of structured planning and of potential for job creation and growth into national markets.",
      "needs_review": false
    },
    {
      "metadata": {
        "source": "Immigration Rules Appendix Start-up",
        "part": "Immigration Rules Appendix Start-up",
        "section_id": "SU 6.1",
        "section_title": "No other established business in the UK requirement for Start-up route",
        "parent_section": null,
        "hierarchy_level": 1,
        "topic": "eligibility",
        "url": "https://www.gov.uk/guidance/immigration-rules/immigration-rules-appendix-start-up",
        "scraped_at": "2025-12-06T17:29:01.839640"
      },
      "text": "### No other established business in the UK requirement for Start-up route\n\n1.   SU 6.1. The applicant must not have previously established any business in the UK which commenced trading, unless this business commenced trading during the applicant’s last period of permission and that permission was for any of the following routes: \n    1.   (a) Start-up; or\n    2.   (b) Tier 1 (Graduate Entrepreneur); or\n    3.   (c) Student on the doctorate extension scheme.",
      "summary": "The provision applies to applicants for the Start-up route, requiring they have no prior UK business activity unless it began during their last permission under Start-up, Graduate Entrepreneur, or Doctorate Extension schemes. This prevents past business establishment unless within specific permissions.",
      "augmented_text": "Document: Immigration Rules Appendix Start-up\nPart: Immigration Rules Appendix Start-up\nSection ID: SU 6.1\nSection: No other established business in the UK requirement for Start-up route\nTopic: eligibility\n\nSummary: The provision applies to applicants for the Start-up route, requiring they have no prior UK business activity unless it began during their last permission under Start-up, Graduate Entrepreneur, or Doctorate Extension schemes. This prevents past business establishment unless within specific permissions.\n\n### No other established business in the UK requirement for Start-up route\n\n1.   SU 6.1. The applicant must not have previously established any business in the UK which commenced trading, unless this business commenced trading during the applicant’s last period of permission and that permission was for any of the following routes: \n    1.   (a) Start-up; or\n    2.   (b) Tier 1 (Graduate Entrepreneur); or\n    3.   (c) Student on the doctorate extension scheme.",
      "needs_review": false
    },
    {
      "metadata": {
        "source": "Immigration Rules Appendix Start-up",
        "part": "Immigration Rules Appendix Start-up",
        "section_id": "SU 7.1",
        "section_title": "Genuine Start-up requirement",
        "parent_section": "SU 7",
        "hierarchy_level": 2,
        "topic": "eligibility",
        "url": "https://www.gov.uk/guidance/immigration-rules/immigration-rules-appendix-start-up",
        "scraped_at": "2025-12-06T17:29:01.839658"
      },
      "text": "### Genuine Start-up requirement\n\nSU 7.1. The applicant must be a genuine Start-up applicant.",
      "summary": "The rule applies to Start-up applicants, requiring them to be genuine and authentic in their application. They must demonstrate the establishment of a viable business idea, with no specified exemptions or thresholds.",
      "augmented_text": "Document: Immigration Rules Appendix Start-up\nPart: Immigration Rules Appendix Start-up\nSection ID: SU 7.1\nSection: Genuine Start-up requirement\nTopic: eligibility\n\nSummary: The rule applies to Start-up applicants, requiring them to be genuine and authentic in their application. They must demonstrate the establishment of a viable business idea, with no specified exemptions or thresholds.\n\n### Genuine Start-up requirement\n\nSU 7.1. The applicant must be a genuine Start-up applicant.",
      "needs_review": false
    },
    {
      "metadata": {
        "source": "Immigration Rules Appendix Start-up",
        "part": "Immigration Rules Appendix Start-up",
        "section_id": "SU 8.1",
        "section_title": "Financial requirement for the Start-up route",
        "parent_section": "SU 8",
        "hierarchy_level": 2,
        "topic": "financial",
        "url": "https://www.gov.uk/guidance/immigration-rules/immigration-rules-appendix-start-up",
        "scraped_at": "2025-12-06T17:29:01.839669"
      },
      "text": "### Financial requirement for the Start-up route\n\nSU 8.1. If the applicant is applying for permission to stay and has been living in the UK with permission for 12 months or more on the date of application, they will meet the financial requirement and do not need to show funds.\n\nSU 8.2. If an applicant is applying for entry clearance or has been in the UK for less than 12 months at the date of application, they must have funds of at least £1,270.\n\nSU 8.3. The applicant must show that they have held the required level of funds for a 28 day period and as set out in Appendix Finance unless their endorsing body confirms they have been awarded funding of at least the amount in SU 8.2.",
      "summary": "Applicants applying for the Start-up route must either have lived in the UK with permission for 12 months or more (requiring no funds) or demonstrate at least £1,270 in funds held for 28 days if less than 12 months. The funds requirement applies unless endorsed funding confirms the applicant already has the necessary funds.",
      "augmented_text": "Document: Immigration Rules Appendix Start-up\nPart: Immigration Rules Appendix Start-up\nSection ID: SU 8.1\nSection: Financial requirement for the Start-up route\nTopic: financial\n\nSummary: Applicants applying for the Start-up route must either have lived in the UK with permission for 12 months or more (requiring no funds) or demonstrate at least £1,270 in funds held for 28 days if less than 12 months. The funds requirement applies unless endorsed funding confirms the applicant already has the necessary funds.\n\n### Financial requirement for the Start-up route\n\nSU 8.1. If the applicant is applying for permission to stay and has been living in the UK with permission for 12 months or more on the date of application, they will meet the financial requirement and do not need to show funds.\n\nSU 8.2. If an applicant is applying for entry clearance or has been in the UK for less than 12 months at the date of application, they must have funds of at least £1,270.\n\nSU 8.3. The applicant must show that they have held the required level of funds for a 28 day period and as set out in Appendix Finance unless their endorsing body confirms they have been awarded funding of at least the amount in SU 8.2.",
      "needs_review": false
    },
    {
      "metadata": {
        "source": "Immigration Rules Appendix Start-up",
        "part": "Immigration Rules Appendix Start-up",
        "section_id": "SU 9.1",
        "section_title": "English language requirement for the Start-up route",
        "parent_section": "SU 9",
        "hierarchy_level": 2,
        "topic": "english-language",
        "url": "https://www.gov.uk/guidance/immigration-rules/immigration-rules-appendix-start-up",
        "scraped_at": "2025-12-06T17:29:01.839681"
      },
      "text": "### English language requirement for the Start-up route\n\nSU 9.1. The applicant must show English language ability on the Common European Framework of Reference for Languages in all 4 components (reading, writing, speaking and listening) of at least level B2.\n\nSU 9.2. The applicant must show they meet the English language requirement as specified in Appendix English Language.",
      "summary": "Applicants for the Start-up route must demonstrate English language proficiency at level B2 across all four components (reading, writing, speaking, listening) according to the CEFR; this must be evidenced as per the standards in Appendix English Language.",
      "augmented_text": "Document: Immigration Rules Appendix Start-up\nPart: Immigration Rules Appendix Start-up\nSection ID: SU 9.1\nSection: English language requirement for the Start-up route\nTopic: english-language\n\nSummary: Applicants for the Start-up route must demonstrate English language proficiency at level B2 across all four components (reading, writing, speaking, listening) according to the CEFR; this must be evidenced as per the standards in Appendix English Language.\n\n### English language requirement for the Start-up route\n\nSU 9.1. The applicant must show English language ability on the Common European Framework of Reference for Languages in all 4 components (reading, writing, speaking and listening) of at least level B2.\n\nSU 9.2. The applicant must show they meet the English language requirement as specified in Appendix English Language.",
      "needs_review": false
    },
    {
      "metadata": {
        "source": "Immigration Rules Appendix Start-up",
        "part": "Immigration Rules Appendix Start-up",
        "section_id": "SU 10.1",
        "section_title": "Endorsement requirement for the Start-up route",
        "parent_section": null,
        "hierarchy_level": 1,
        "topic": "sponsorship",
        "url": "https://www.gov.uk/guidance/immigration-rules/immigration-rules-appendix-start-up",
        "scraped_at": "2025-12-06T17:29:01.839705"
      },
      "text": "### Endorsement requirement for the Start-up route\n\n1.   SU 10.1. The applicant must provide a letter from their endorsing body which includes all the following information: \n    1.   (a) the name of the endorsing body; and\n    2.   (b) the endorsement reference number; and\n    3.   (c) the name, telephone number, email and workplace address of a person at the endorsing body who will verify the contents of the letter to the Home Office if requested; and\n    4.   (d) the date of endorsement; and\n    5.   (e) the applicant’s name, date of birth, nationality and passport or other travel document number; and\n    6.   (f) a short description of the applicant’s business venture and the main products or services it will provide to its customers; and\n    7.   (g) confirmation that in the view of the endorsing body the applicant’s business is innovative, viable and scalable as set out at SU 5.1.; and\n    8.   (h) confirmation that the endorsing body is satisfied that the applicant will spend the majority of their working time in the UK on developing their business venture; and\n    9.   (i) confirmation that the endorsing body is satisfied the applicant is either the sole founder of the business or an instrumental member of the founding team; and\n    10.   (j) confirmation the endorsing body is satisfied that the applicant has created and is relying on their own business plan.",
      "summary": "Applicants for the UK Start-up route must obtain an endorsement letter from a recognised endorsing body, detailing business viability, innovation, and the applicant's role. The letter must include specific information about the applicant, the business, and confirmation of the applicant's involvement and business plan. Critical conditions include the endorsement's support for the business's viability and the applicant's primary focus on developing the venture in the UK.",
      "augmented_text": "Document: Immigration Rules Appendix Start-up\nPart: Immigration Rules Appendix Start-up\nSection ID: SU 10.1\nSection: Endorsement requirement for the Start-up route\nTopic: sponsorship\n\nSummary: Applicants for the UK Start-up route must obtain an endorsement letter from a recognised endorsing body, detailing business viability, innovation, and the applicant's role. The letter must include specific information about the applicant, the business, and confirmation of the applicant's involvement and business plan. Critical conditions include the endorsement's support for the business's viability and the applicant's primary focus on developing the venture in the UK.\n\n### Endorsement requirement for the Start-up route\n\n1.   SU 10.1. The applicant must provide a letter from their endorsing body which includes all the following information: \n    1.   (a) the name of the endorsing body; and\n    2.   (b) the endorsement reference number; and\n    3.   (c) the name, telephone number, email and workplace address of a person at the endorsing body who will verify the contents of the letter to the Home Office if requested; and\n    4.   (d) the date of endorsement; and\n    5.   (e) the applicant’s name, date of birth, nationality and passport or other travel document number; and\n    6.   (f) a short description of the applicant’s business venture and the main products or services it will provide to its customers; and\n    7.   (g) confirmation that in the view of the endorsing body the applicant’s business is innovative, viable and scalable as set out at SU 5.1.; and\n    8.   (h) confirmation that the endorsing body is satisfied that the applicant will spend the majority of their working time in the UK on developing their business venture; and\n    9.   (i) confirmation that the endorsing body is satisfied the applicant is either the sole founder of the business or an instrumental member of the founding team; and\n    10.   (j) confirmation the endorsing body is satisfied that the applicant has created and is relying on their own business plan.",
      "needs_review": false
    },
    {
      "metadata": {
        "source": "Immigration Rules Appendix Start-up",
        "part": "Immigration Rules Appendix Start-up",
        "section_id": "SU 11.1",
        "section_title": "Decision on the Start-up route",
        "parent_section": "SU 11",
        "hierarchy_level": 2,
        "topic": "eligibility",
        "url": "https://www.gov.uk/guidance/immigration-rules/immigration-rules-appendix-start-up",
        "scraped_at": "2025-12-06T17:29:01.839714"
      },
      "text": "### Decision on the Start-up route\n\nSU 11.1. If the decision- maker is satisfied that all the suitability and eligibility requirements are met for the Start-up route, the application will be granted, otherwise the application will be refused.\n\nSU 11.2. If the application is refused the person can apply for Administrative Review under Appendix AR: Administrative Review.",
      "summary": "This provision applies to Start-up applicants, specifying that applications are granted if all suitability and eligibility requirements are met; otherwise, they are refused. Refused applicants may request an Administrative Review. No additional thresholds or exceptions are detailed.",
      "augmented_text": "Document: Immigration Rules Appendix Start-up\nPart: Immigration Rules Appendix Start-up\nSection ID: SU 11.1\nSection: Decision on the Start-up route\nTopic: eligibility\n\nSummary: This provision applies to Start-up applicants, specifying that applications are granted if all suitability and eligibility requirements are met; otherwise, they are refused. Refused applicants may request an Administrative Review. No additional thresholds or exceptions are detailed.\n\n### Decision on the Start-up route\n\nSU 11.1. If the decision- maker is satisfied that all the suitability and eligibility requirements are met for the Start-up route, the application will be granted, otherwise the application will be refused.\n\nSU 11.2. If the application is refused the person can apply for Administrative Review under Appendix AR: Administrative Review.",
      "needs_review": false
    },
    {
      "metadata": {
        "source": "Immigration Rules Appendix Start-up",
        "part": "Immigration Rules Appendix Start-up",
        "section_id": "1",
        "section_title": "Conditions and period of grant on the Start-up route",
        "parent_section": null,
        "hierarchy_level": 1,
        "topic": "financial",
        "url": "https://www.gov.uk/guidance/immigration-rules/immigration-rules-appendix-start-up",
        "scraped_at": "2025-12-06T17:29:01.839726"
      },
      "text": "### Conditions and period of grant on the Start-up route\n\n1.   SU 12.1. The grant will be subject to all the following conditions: \n    1.   (a) no access to public funds; and\n    2.   (b) work (including self-employment and voluntary work) permitted except for employment as a professional sportsperson, including as a sports coach; and\n    3.   (c) study is permitted, subject to the ATAS condition in Appendix ATAS.\n    4.   (d) DELETED\n\nSU 12.2. The applicant will be granted permission for a maximum period of 2 years, and a person must not be granted further permission which would result in them spending more than 2 years with permission on the Start-up route, or a combination of the Start-up route and the Tier 1 (Graduate Entrepreneur) route.",
      "summary": "Applicants on the Start-up route are granted up to 2 years with conditions including no access to public funds, permitted work (excluding professional sports employment), and optional study (with ATAS). They must comply with these conditions throughout their stay, which cannot exceed a total of 2 years across related routes.",
      "augmented_text": "Document: Immigration Rules Appendix Start-up\nPart: Immigration Rules Appendix Start-up\nSection ID: 1\nSection: Conditions and period of grant on the Start-up route\nTopic: financial\n\nSummary: Applicants on the Start-up route are granted up to 2 years with conditions including no access to public funds, permitted work (excluding professional sports employment), and optional study (with ATAS). They must comply with these conditions throughout their stay, which cannot exceed a total of 2 years across related routes.\n\n### Conditions and period of grant on the Start-up route\n\n1.   SU 12.1. The grant will be subject to all the following conditions: \n    1.   (a) no access to public funds; and\n    2.   (b) work (including self-employment and voluntary work) permitted except for employment as a professional sportsperson, including as a sports coach; and\n    3.   (c) study is permitted, subject to the ATAS condition in Appendix ATAS.\n    4.   (d) DELETED\n\nSU 12.2. The applicant will be granted permission for a maximum period of 2 years, and a person must not be granted further permission which would result in them spending more than 2 years with permission on the Start-up route, or a combination of the Start-up route and the Tier 1 (Graduate Entrepreneur) route.",
      "needs_review": false
    },
    {
      "metadata": {
        "source": "Immigration Rules Appendix Start-up",
        "part": "Immigration Rules Appendix Start-up",
        "section_id": "SW 3.1",
        "section_title": "Dependants on the Start-up route",
        "parent_section": null,
        "hierarchy_level": 2,
        "topic": "dependants",
        "url": "https://www.gov.uk/guidance/immigration-rules/immigration-rules-appendix-start-up",
        "scraped_at": "2025-12-06T17:29:01.839739"
      },
      "text": "### Dependants on the Start-up route",
      "summary": "Dependants applying on the Start-up route must demonstrate genuine family relationships and meet relevant eligibility criteria. They can join the main applicant unless excluded by specific conditions, such as inadmissibility or certain security considerations.",
      "augmented_text": "Document: Immigration Rules Appendix Start-up\nPart: Immigration Rules Appendix Start-up\nSection ID: SW 3.1\nSection: Dependants on the Start-up route\nTopic: dependants\n\nSummary: Dependants applying on the Start-up route must demonstrate genuine family relationships and meet relevant eligibility criteria. They can join the main applicant unless excluded by specific conditions, such as inadmissibility or certain security considerations.\n\n### Dependants on the Start-up route",
      "needs_review": false
    },
    {
      "metadata": {
        "source": "Immigration Rules Appendix Start-up",
        "part": "Immigration Rules Appendix Start-up",
        "section_id": "SU 13.1",
        "section_title": "Validity requirements for a dependent partner or dependent child on the Start-up route",
        "parent_section": "SU 13",
        "hierarchy_level": 2,
        "topic": "family",
        "url": "https://www.gov.uk/guidance/immigration-rules/immigration-rules-appendix-start-up",
        "scraped_at": "2025-12-06T17:29:01.839780"
      },
      "text": "### Validity requirements for a dependent partner or dependent child on the Start-up route\n\nSU 13.1. An application as a partner or child on the Start-up route must be made online on the gov.uk website on the specified form as follows:\n\n| Applicant | Specified form |\n| --- | --- |\n| EEA national with a chipped passport | Either (as applicable): • Dependant partner or dependant child using the UK Immigration: ID Check app; or • the forms listed below for dependant applicants outside or inside the UK as relevant. |\n| Applicants outside the UK | Dependant partner visa Dependant child visa |\n| Applicants inside the UK | If the dependant is applying at the same time as the Start-Up route applicant, they can be included in the form “Start-Up or Innovator permission to stay” where the form allows dependants to be added. Otherwise: - Dependant partner - Dependant child |\n\n1.   SU 13.2. An application for entry clearance or permission to stay as a partner or child of a person on the Start-up route must meet all the following requirements: \n    1.   (a) any fee and Immigration Health Charge must have been paid; and\n    2.   (b) the applicant must have provided any required biometrics; and\n    3.   (c) the applicant must have provided a passport or other travel document which satisfactorily establishes their identity and nationality; and\n    4.   (d) the applicant must be applying as partner or child of a person (P) who: \n        1.   (i) has made a valid application for entry clearance or permission to stay on the Start-up not been decided; or\n        2.   (ii) has entry clearance or permission to stay on the Start-up route; or\n        3.   (iii) is settled or has become a British citizen, providing that P had permission on the Start-up route when they settled and the applicant either had permission as their partner or child at that time, or the applicant is applying as a child of P and the applicant was born in the UK before P settled.\n\nSU 13.3. A person applying as a dependent partner must be aged 18 or over on the date of application.\n\nSU 13.4. DELETED.\n\n1.   SU 13.5. A person applying for permission to stay must be in the UK and must not have, or have last been granted, permission: \n    1.   (a) as a Visitor; or\n    2.   (b) as a Short-term Student; or\n    3.   (c) as a Parent of a Child Student; or\n    4.   (d) as a Seasonal Worker; or\n    5.   (e) as a domestic worker in a private household; or\n    6.   (f)outside the Immigration Rules.\n\nSU 13.6. An application which does not meet all the validity requirements as a partner or child on the Start-up route may be rejected as invalid and not considered.",
      "summary": "Dependent partners or children applying on the Start-up route must submit online applications with required fees, biometrics, and valid travel documents. Applicants outside or inside the UK follow specific form procedures, and dependants can be included with the main applicant when applying simultaneously.",
      "augmented_text": "Document: Immigration Rules Appendix Start-up\nPart: Immigration Rules Appendix Start-up\nSection ID: SU 13.1\nSection: Validity requirements for a dependent partner or dependent child on the Start-up route\nTopic: family\n\nSummary: Dependent partners or children applying on the Start-up route must submit online applications with required fees, biometrics, and valid travel documents. Applicants outside or inside the UK follow specific form procedures, and dependants can be included with the main applicant when applying simultaneously.\n\n### Validity requirements for a dependent partner or dependent child on the Start-up route\n\nSU 13.1. An application as a partner or child on the Start-up route must be made online on the gov.uk website on the specified form as follows:\n\n| Applicant | Specified form |\n| --- | --- |\n| EEA national with a chipped passport | Either (as applicable): • Dependant partner or dependant child using the UK Immigration: ID Check app; or • the forms listed below for dependant applicants outside or inside the UK as relevant. |\n| Applicants outside the UK | Dependant partner visa Dependant child visa |\n| Applicants inside the UK | If the dependant is applying at the same time as the Start-Up route applicant, they can be included in the form “Start-Up or Innovator permission to stay” where the form allows dependants to be added. Otherwise: - Dependant partner - Dependant child |\n\n1.   SU 13.2. An application for entry clearance or permission to stay as a partner or child of a person on the Start-up route must meet all the following requirements: \n    1.   (a) any fee and Immigration Health Charge must have been paid; and\n    2.   (b) the applicant must have provided any required biometrics; and\n    3.   (c) the applicant must have provided a passport or other travel document which satisfactorily establishes their identity and nationality; and\n    4.   (d) the applicant must be applying as partner or child of a person (P) who: \n        1.   (i) has made a valid application for entry clearance or permission to stay on the Start-up not been decided; or\n        2.   (ii) has entry clearance or permission to stay on the Start-up route; or\n        3.   (iii) is settled or has become a British citizen, providing that P had permission on the Start-up route when they settled and the applicant either had permission as their partner or child at that time, or the applicant is applying as a child of P and the applicant was born in the UK before P settled.\n\nSU 13.3. A person applying as a dependent partner must be aged 18 or over on the date of application.\n\nSU 13.4. DELETED.\n\n1.   SU 13.5. A person applying for permission to stay must be in the UK and must not have, or have last been granted, permission: \n    1.   (a) as a Visitor; or\n    2.   (b) as a Short-term Student; or\n    3.   (c) as a Parent of a Child Student; or\n    4.   (d) as a Seasonal Worker; or\n    5.   (e) as a domestic worker in a private household; or\n    6.   (f)outside the Immigration Rules.\n\nSU 13.6. An application which does not meet all the validity requirements as a partner or child on the Start-up route may be rejected as invalid and not considered.",
      "needs_review": false
    },
    {
      "metadata": {
        "source": "Immigration Rules Appendix Start-up",
        "part": "Immigration Rules Appendix Start-up",
        "section_id": "SU 14.1",
        "section_title": "Suitability requirements for a dependent partner or dependent child on the Start-up route",
        "parent_section": "SU 14",
        "hierarchy_level": 2,
        "topic": "suitability",
        "url": "https://www.gov.uk/guidance/immigration-rules/immigration-rules-appendix-start-up",
        "scraped_at": "2025-12-06T17:29:01.839795"
      },
      "text": "### Suitability requirements for a dependent partner or dependent child on the Start-up route\n\nSU 14.1. The suitability requirements for a partner or child on the Start-up route are that they must not fall for refusal under Part Suitability.\n\n1.   SU 14.2. If applying for permission to stay the applicant must not be: \n    1.   (a) in breach of immigration laws, except that where the Exceptions for overstayers section of Part Suitability applies, that period of overstaying will be disregarded; or\n    2.   (b) on immigration bail.",
      "summary": "This provision applies to dependent partners and children on the Start-up route, requiring them to meet suitability criteria. They must not breach immigration laws (unless covered by specific exceptions) or be on immigration bail to be granted or maintain permission.",
      "augmented_text": "Document: Immigration Rules Appendix Start-up\nPart: Immigration Rules Appendix Start-up\nSection ID: SU 14.1\nSection: Suitability requirements for a dependent partner or dependent child on the Start-up route\nTopic: suitability\n\nSummary: This provision applies to dependent partners and children on the Start-up route, requiring them to meet suitability criteria. They must not breach immigration laws (unless covered by specific exceptions) or be on immigration bail to be granted or maintain permission.\n\n### Suitability requirements for a dependent partner or dependent child on the Start-up route\n\nSU 14.1. The suitability requirements for a partner or child on the Start-up route are that they must not fall for refusal under Part Suitability.\n\n1.   SU 14.2. If applying for permission to stay the applicant must not be: \n    1.   (a) in breach of immigration laws, except that where the Exceptions for overstayers section of Part Suitability applies, that period of overstaying will be disregarded; or\n    2.   (b) on immigration bail.",
      "needs_review": false
    },
    {
      "metadata": {
        "source": "Immigration Rules Appendix Start-up",
        "part": "Immigration Rules Appendix Start-up",
        "section_id": "Eligibility requirements for a dependent partner and dependent child on the Start-up route",
        "section_title": "Eligibility requirements for a dependent partner and dependent child on the Start-up route",
        "parent_section": null,
        "hierarchy_level": 2,
        "topic": "eligibility",
        "url": "https://www.gov.uk/guidance/immigration-rules/immigration-rules-appendix-start-up",
        "scraped_at": "2025-12-06T17:29:01.839801"
      },
      "text": "### Eligibility requirements for a dependent partner and dependent child on the Start-up route",
      "summary": "This provision applies to dependent partners and children on the UK Start-up route, outlining their eligibility criteria. They must meet specific relationship and support requirements to qualify, with exceptions or thresholds specified in the detailed rules.",
      "augmented_text": "Document: Immigration Rules Appendix Start-up\nPart: Immigration Rules Appendix Start-up\nSection ID: Eligibility requirements for a dependent partner and dependent child on the Start-up route\nSection: Eligibility requirements for a dependent partner and dependent child on the Start-up route\nTopic: eligibility\n\nSummary: This provision applies to dependent partners and children on the UK Start-up route, outlining their eligibility criteria. They must meet specific relationship and support requirements to qualify, with exceptions or thresholds specified in the detailed rules.\n\n### Eligibility requirements for a dependent partner and dependent child on the Start-up route",
      "needs_review": false
    },
    {
      "metadata": {
        "source": "Immigration Rules Appendix Start-up",
        "part": "Immigration Rules Appendix Start-up",
        "section_id": "SU 15.1",
        "section_title": "Entry requirement for a dependent partner and dependent child on the Start-up route",
        "parent_section": "SU 15",
        "hierarchy_level": 2,
        "topic": "leave-to-enter",
        "url": "https://www.gov.uk/guidance/immigration-rules/immigration-rules-appendix-start-up",
        "scraped_at": "2025-12-06T17:29:01.839819"
      },
      "text": "### Entry requirement for a dependent partner and dependent child on the Start-up route\n\nSU 15.1. A person seeking to come to the UK as a partner or child must apply for and obtain entry clearance as a partner or child before they arrive in the UK.\n\nSU 15.2. A person applying for entry clearance as a partner or child on the Start-up route must, if Appendix Tuberculosis applies, provide a valid medical certificate confirming that they have undergone screening for active pulmonary tuberculosis and that this tuberculosis is not present in them.",
      "summary": "Dependents (partners and children) applying for the Start-up route must obtain entry clearance before arriving in the UK. They must also provide a valid TB test certificate if specified in the Tuberculosis Appendix.",
      "augmented_text": "Document: Immigration Rules Appendix Start-up\nPart: Immigration Rules Appendix Start-up\nSection ID: SU 15.1\nSection: Entry requirement for a dependent partner and dependent child on the Start-up route\nTopic: leave-to-enter\n\nSummary: Dependents (partners and children) applying for the Start-up route must obtain entry clearance before arriving in the UK. They must also provide a valid TB test certificate if specified in the Tuberculosis Appendix.\n\n### Entry requirement for a dependent partner and dependent child on the Start-up route\n\nSU 15.1. A person seeking to come to the UK as a partner or child must apply for and obtain entry clearance as a partner or child before they arrive in the UK.\n\nSU 15.2. A person applying for entry clearance as a partner or child on the Start-up route must, if Appendix Tuberculosis applies, provide a valid medical certificate confirming that they have undergone screening for active pulmonary tuberculosis and that this tuberculosis is not present in them.",
      "needs_review": false
    },
    {
      "metadata": {
        "source": "Immigration Rules Appendix Start-up",
        "part": "Immigration Rules Appendix Start-up",
        "section_id": "1",
        "section_title": "Relationship requirements for a dependent partner on the Start-up route",
        "parent_section": null,
        "hierarchy_level": 1,
        "topic": "family",
        "url": "https://www.gov.uk/guidance/immigration-rules/immigration-rules-appendix-start-up",
        "scraped_at": "2025-12-06T17:29:01.839838"
      },
      "text": "### Relationship requirements for a dependent partner on the Start-up route\n\n1.   SU 16.1. The applicant must be the partner of a person (P) and one of the following must apply: \n    1.   (a) P has permission on the Start-up route; or\n    2.   (b) P is, at the same time, applying for (and is granted) permission on the Start-up route.\n\n2.   SU 16.2. The applicant must show that the relationship meets the relationship requirements as specified in Appendix Relationship with Partner.\n\nSU 16.3. DELETED.\n\nSU 16.4. DELETED.",
      "summary": "Dependent partners on the Start-up route must be partners of individuals with valid or concurrent permission on the Start-up route and must meet specified relationship requirements as per the relevant Appendix.",
      "augmented_text": "Document: Immigration Rules Appendix Start-up\nPart: Immigration Rules Appendix Start-up\nSection ID: 1\nSection: Relationship requirements for a dependent partner on the Start-up route\nTopic: family\n\nSummary: Dependent partners on the Start-up route must be partners of individuals with valid or concurrent permission on the Start-up route and must meet specified relationship requirements as per the relevant Appendix.\n\n### Relationship requirements for a dependent partner on the Start-up route\n\n1.   SU 16.1. The applicant must be the partner of a person (P) and one of the following must apply: \n    1.   (a) P has permission on the Start-up route; or\n    2.   (b) P is, at the same time, applying for (and is granted) permission on the Start-up route.\n\n2.   SU 16.2. The applicant must show that the relationship meets the relationship requirements as specified in Appendix Relationship with Partner.\n\nSU 16.3. DELETED.\n\nSU 16.4. DELETED.",
      "needs_review": false
    },
    {
      "metadata": {
        "source": "Immigration Rules Appendix Start-up",
        "part": "Immigration Rules Appendix Start-up",
        "section_id": "1",
        "section_title": "Relationship requirement for a dependent child on the Start-up route",
        "parent_section": null,
        "hierarchy_level": 1,
        "topic": "family",
        "url": "https://www.gov.uk/guidance/immigration-rules/immigration-rules-appendix-start-up",
        "scraped_at": "2025-12-06T17:29:01.839854"
      },
      "text": "### Relationship requirement for a dependent child on the Start-up route\n\n1.   SU 17.1. DELETED.\n2.   SU 17.2. DELETED.",
      "summary": "This provision applies to dependent children on the Start-up route, requiring proof of their relationship to the main applicant. No specific details are provided in the excerpt, but compliance with relationship verification is essential, with potential conditions or exceptions outlined elsewhere.",
      "augmented_text": "Document: Immigration Rules Appendix Start-up\nPart: Immigration Rules Appendix Start-up\nSection ID: 1\nSection: Relationship requirement for a dependent child on the Start-up route\nTopic: family\n\nSummary: This provision applies to dependent children on the Start-up route, requiring proof of their relationship to the main applicant. No specific details are provided in the excerpt, but compliance with relationship verification is essential, with potential conditions or exceptions outlined elsewhere.\n\n### Relationship requirement for a dependent child on the Start-up route\n\n1.   SU 17.1. DELETED.\n2.   SU 17.2. DELETED.",
      "needs_review": false
    },
    {
      "metadata": {
        "source": "Immigration Rules Appendix Start-up",
        "part": "Immigration Rules Appendix Start-up",
        "section_id": "SU 18.1",
        "section_title": "Care requirement for a dependent child on the Start-up route",
        "parent_section": "SU 18",
        "hierarchy_level": 2,
        "topic": "family",
        "url": "https://www.gov.uk/guidance/immigration-rules/immigration-rules-appendix-start-up",
        "scraped_at": "2025-12-06T17:29:01.839870"
      },
      "text": "### Care requirement for a dependent child on the Start-up route\n\nSU 18.1. DELETED.",
      "summary": "This provision applies to dependent children on the Start-up route, requiring their caregiver to ensure proper care. It emphasizes the importance of meeting care standards, with specific conditions or exceptions not detailed in this excerpt.",
      "augmented_text": "Document: Immigration Rules Appendix Start-up\nPart: Immigration Rules Appendix Start-up\nSection ID: SU 18.1\nSection: Care requirement for a dependent child on the Start-up route\nTopic: family\n\nSummary: This provision applies to dependent children on the Start-up route, requiring their caregiver to ensure proper care. It emphasizes the importance of meeting care standards, with specific conditions or exceptions not detailed in this excerpt.\n\n### Care requirement for a dependent child on the Start-up route\n\nSU 18.1. DELETED.",
      "needs_review": false
    },
    {
      "metadata": {
        "source": "Immigration Rules Appendix Start-up",
        "part": "Immigration Rules Appendix Start-up",
        "section_id": "SU 19.1",
        "section_title": "Age requirement for a dependent child on the Start-up route",
        "parent_section": "SU 19",
        "hierarchy_level": 2,
        "topic": "family",
        "url": "https://www.gov.uk/guidance/immigration-rules/immigration-rules-appendix-start-up",
        "scraped_at": "2025-12-06T17:29:01.839886"
      },
      "text": "### Age requirement for a dependent child on the Start-up route\n\nSU 19.1. DELETED.\n\nSU 19.2. DELETED.",
      "summary": "This provision applies to dependent children on the Start-up route, requiring them to meet specific age criteria. The rules specify age thresholds for dependents to qualify. No detailed conditions or exceptions are provided in the current excerpt.",
      "augmented_text": "Document: Immigration Rules Appendix Start-up\nPart: Immigration Rules Appendix Start-up\nSection ID: SU 19.1\nSection: Age requirement for a dependent child on the Start-up route\nTopic: family\n\nSummary: This provision applies to dependent children on the Start-up route, requiring them to meet specific age criteria. The rules specify age thresholds for dependents to qualify. No detailed conditions or exceptions are provided in the current excerpt.\n\n### Age requirement for a dependent child on the Start-up route\n\nSU 19.1. DELETED.\n\nSU 19.2. DELETED.",
      "needs_review": false
    },
    {
      "metadata": {
        "source": "Immigration Rules Appendix Start-up",
        "part": "Immigration Rules Appendix Start-up",
        "section_id": "1",
        "section_title": "Requirements for a dependent child on the Start-up route",
        "parent_section": null,
        "hierarchy_level": 1,
        "topic": "leave-to-enter",
        "url": "https://www.gov.uk/guidance/immigration-rules/immigration-rules-appendix-start-up",
        "scraped_at": "2025-12-06T17:29:01.839903"
      },
      "text": "### Requirements for a dependent child on the Start-up route\n\n1.   SU 19A.1. The applicant must meet the following requirements for a dependent child in Appendix Children: \n    1.   (a) relationship requirement: entry clearance and permission to stay; and\n    2.   (b) care requirement; and\n    3.   (c) age and independent life requirement.",
      "summary": "Dependent children on the Start-up route must meet relationship, care, and age/independent life requirements outlined in Appendix Children to qualify for entry and stay; these conditions apply universally without specified exceptions.",
      "augmented_text": "Document: Immigration Rules Appendix Start-up\nPart: Immigration Rules Appendix Start-up\nSection ID: 1\nSection: Requirements for a dependent child on the Start-up route\nTopic: leave-to-enter\n\nSummary: Dependent children on the Start-up route must meet relationship, care, and age/independent life requirements outlined in Appendix Children to qualify for entry and stay; these conditions apply universally without specified exceptions.\n\n### Requirements for a dependent child on the Start-up route\n\n1.   SU 19A.1. The applicant must meet the following requirements for a dependent child in Appendix Children: \n    1.   (a) relationship requirement: entry clearance and permission to stay; and\n    2.   (b) care requirement; and\n    3.   (c) age and independent life requirement.",
      "needs_review": false
    },
    {
      "metadata": {
        "source": "Immigration Rules Appendix Start-up",
        "part": "Immigration Rules Appendix Start-up",
        "section_id": "SU 20.1",
        "section_title": "Financial requirement for a dependent partner or dependent child on the Start-up route",
        "parent_section": "SU 20",
        "hierarchy_level": 2,
        "topic": "financial",
        "url": "https://www.gov.uk/guidance/immigration-rules/immigration-rules-appendix-start-up",
        "scraped_at": "2025-12-06T17:29:01.839916"
      },
      "text": "### Financial requirement for a dependent partner or dependent child on the Start-up route\n\nSU 20.1. If the applicant is applying for permission to stay and has been living in the UK with permission for 12 months or longer on the date of application, they will meet the financial requirement and do not need to show funds.\n\n1.   SU 20.2. If the applicant is applying for entry clearance, or has been in the UK for less than 12 months on the date of application, funds of at least the amount required in SU 20.2A must be held collectively by one or more of the following: \n    1.   (a) the applicant; and\n    2.   (b) the person on the Start-up route (P); and\n    3.   (c) if the applicant is applying as a dependent child, their parent who is lawfully present in the UK or being granted entry clearance, or permission to stay, at the same time.\n\n1.   SU 20.2A. The funds required are: \n    1.   (a) £285 for a dependent partner in the UK, or applying for entry clearance; and\n    2.   (b) £315 for the first dependent child in the UK, or applying for entry clearance; and\n    3.   (c) £200 for any other dependent child in the UK, or applying for entry clearance.\n\nSU 20.3. The funds must be in addition to any funds required by the Start-up applicant to meet the financial requirement and for any dependants in the UK or applying at the same time.\n\nSU 20.4. The required level of funds must have been held for a 28-day period and as set out in Appendix Finance.",
      "summary": "This section applies to dependents of Start-up route applicants. Dependents must hold specified funds (£285 for a partner, £315 for the first child, and £200 for additional children) unless the applicant has been in the UK for 12+ months, in which case no funds are required. Funds must be held for 28 days and be in addition to the main applicant’s financial requirements.",
      "augmented_text": "Document: Immigration Rules Appendix Start-up\nPart: Immigration Rules Appendix Start-up\nSection ID: SU 20.1\nSection: Financial requirement for a dependent partner or dependent child on the Start-up route\nTopic: financial\n\nSummary: This section applies to dependents of Start-up route applicants. Dependents must hold specified funds (£285 for a partner, £315 for the first child, and £200 for additional children) unless the applicant has been in the UK for 12+ months, in which case no funds are required. Funds must be held for 28 days and be in addition to the main applicant’s financial requirements.\n\n### Financial requirement for a dependent partner or dependent child on the Start-up route\n\nSU 20.1. If the applicant is applying for permission to stay and has been living in the UK with permission for 12 months or longer on the date of application, they will meet the financial requirement and do not need to show funds.\n\n1.   SU 20.2. If the applicant is applying for entry clearance, or has been in the UK for less than 12 months on the date of application, funds of at least the amount required in SU 20.2A must be held collectively by one or more of the following: \n    1.   (a) the applicant; and\n    2.   (b) the person on the Start-up route (P); and\n    3.   (c) if the applicant is applying as a dependent child, their parent who is lawfully present in the UK or being granted entry clearance, or permission to stay, at the same time.\n\n1.   SU 20.2A. The funds required are: \n    1.   (a) £285 for a dependent partner in the UK, or applying for entry clearance; and\n    2.   (b) £315 for the first dependent child in the UK, or applying for entry clearance; and\n    3.   (c) £200 for any other dependent child in the UK, or applying for entry clearance.\n\nSU 20.3. The funds must be in addition to any funds required by the Start-up applicant to meet the financial requirement and for any dependants in the UK or applying at the same time.\n\nSU 20.4. The required level of funds must have been held for a 28-day period and as set out in Appendix Finance.",
      "needs_review": false
    },
    {
      "metadata": {
        "source": "Immigration Rules Appendix Start-up",
        "part": "Immigration Rules Appendix Start-up",
        "section_id": "SU 21.1",
        "section_title": "Decision on application for a dependent partner and dependent child on the Start-up route",
        "parent_section": "SU 21",
        "hierarchy_level": 2,
        "topic": "eligibility",
        "url": "https://www.gov.uk/guidance/immigration-rules/immigration-rules-appendix-start-up",
        "scraped_at": "2025-12-06T17:29:01.839926"
      },
      "text": "### Decision on application for a dependent partner and dependent child on the Start-up route\n\nSU 21.1. If the decision maker is satisfied that all the suitability and eligibility requirements are met for a dependent partner or dependent child on the Start-up route the application will be granted, otherwise the application will be refused.\n\nSU 21.2. If the application is refused the person can apply for an Administrative Review under Appendix AR: Administrative Review.",
      "summary": "This provision applies to dependent partners and children applying under the Start-up route. Applications are granted if suitability and eligibility criteria are satisfied; otherwise, they are refused, with a right to seek Administrative Review.",
      "augmented_text": "Document: Immigration Rules Appendix Start-up\nPart: Immigration Rules Appendix Start-up\nSection ID: SU 21.1\nSection: Decision on application for a dependent partner and dependent child on the Start-up route\nTopic: eligibility\n\nSummary: This provision applies to dependent partners and children applying under the Start-up route. Applications are granted if suitability and eligibility criteria are satisfied; otherwise, they are refused, with a right to seek Administrative Review.\n\n### Decision on application for a dependent partner and dependent child on the Start-up route\n\nSU 21.1. If the decision maker is satisfied that all the suitability and eligibility requirements are met for a dependent partner or dependent child on the Start-up route the application will be granted, otherwise the application will be refused.\n\nSU 21.2. If the application is refused the person can apply for an Administrative Review under Appendix AR: Administrative Review.",
      "needs_review": false
    },
    {
      "metadata": {
        "source": "Immigration Rules Appendix Start-up",
        "part": "Immigration Rules Appendix Start-up",
        "section_id": "SU 22.1",
        "section_title": "Period and conditions of grant for a dependent partner and dependent child on the Start-up route",
        "parent_section": "SU 22",
        "hierarchy_level": 2,
        "topic": "family",
        "url": "https://www.gov.uk/guidance/immigration-rules/immigration-rules-appendix-start-up",
        "scraped_at": "2025-12-06T17:29:01.839952"
      },
      "text": "### Period and conditions of grant for a dependent partner and dependent child on the Start-up route\n\nSU 22.1. A partner will be granted permission which ends on the same date as their partner’s permission on the Start-up route\n\nSU 22.2. A child will be granted permission which ends on the same date as whichever of their parents’ permission ends first.\n\n1.   SU 22.3. The grant will be subject to all the following conditions: *(a) no access to public funds; and \n    1.   (b) work (including self-employment and voluntary work) permitted; except for employment as a professional sportsperson, including as a sports coach; and\n    2.   (c) study is permitted, subject to the ATAs condition in Appendix ATAS.\n    3.   (d) DELETED\n\nPrint this page",
      "summary": "Dependent partners’ and children’s permissions on the Start-up route end concurrently with the main applicant's or their respective parent’s permission. They are subject to conditions including no access to public funds, permitted work and study (with some restrictions), and their durations align with the primary permissions.",
      "augmented_text": "Document: Immigration Rules Appendix Start-up\nPart: Immigration Rules Appendix Start-up\nSection ID: SU 22.1\nSection: Period and conditions of grant for a dependent partner and dependent child on the Start-up route\nTopic: family\n\nSummary: Dependent partners’ and children’s permissions on the Start-up route end concurrently with the main applicant's or their respective parent’s permission. They are subject to conditions including no access to public funds, permitted work and study (with some restrictions), and their durations align with the primary permissions.\n\n### Period and conditions of grant for a dependent partner and dependent child on the Start-up route\n\nSU 22.1. A partner will be granted permission which ends on the same date as their partner’s permission on the Start-up route\n\nSU 22.2. A child will be granted permission which ends on the same date as whichever of their parents’ permission ends first.\n\n1.   SU 22.3. The grant will be subject to all the following conditions: *(a) no access to public funds; and \n    1.   (b) work (including self-employment and voluntary work) permitted; except for employment as a professional sportsperson, including as a sports coach; and\n    2.   (c) study is permitted, subject to the ATAs condition in Appendix ATAS.\n    3.   (d) DELETED\n\nPrint this page",
      "needs_review": false
    }
  ]
}