{
  "url": "https://www.gov.uk/guidance/immigration-rules/immigration-rules-appendix-vip-delegate-visa",
  "part_name": "Immigration Rules Appendix VIP Delegate Visa",
  "scraped_at": "2025-12-06T17:29:49.947820",
  "chunk_count": 7,
  "chunks": [
    {
      "metadata": {
        "source": "Immigration Rules Appendix VIP Delegate Visa",
        "part": "Immigration Rules Appendix VIP Delegate Visa",
        "section_id": "DEL 1.1",
        "section_title": "Entry requirements for a VIP Delegate",
        "parent_section": "DEL 1",
        "hierarchy_level": 2,
        "topic": "leave-to-enter",
        "url": "https://www.gov.uk/guidance/immigration-rules/immigration-rules-appendix-vip-delegate-visa",
        "scraped_at": "2025-12-06T17:29:49.947530"
      },
      "text": "### Entry requirements for a VIP Delegate\n\nDEL 1.1. A person seeking to come to the UK as a VIP Delegate must apply for and obtain entry clearance before they arrive in the UK.",
      "summary": "This provision applies to VIP Delegates seeking entry to the UK. They must obtain prior entry clearance before arrival, with no specified exceptions or thresholds.",
      "augmented_text": "Document: Immigration Rules Appendix VIP Delegate Visa\nPart: Immigration Rules Appendix VIP Delegate Visa\nSection ID: DEL 1.1\nSection: Entry requirements for a VIP Delegate\nTopic: leave-to-enter\n\nSummary: This provision applies to VIP Delegates seeking entry to the UK. They must obtain prior entry clearance before arrival, with no specified exceptions or thresholds.\n\n### Entry requirements for a VIP Delegate\n\nDEL 1.1. A person seeking to come to the UK as a VIP Delegate must apply for and obtain entry clearance before they arrive in the UK.",
      "needs_review": true,
      "review_reasons": [
        "generic_summary"
      ]
    },
    {
      "metadata": {
        "source": "Immigration Rules Appendix VIP Delegate Visa",
        "part": "Immigration Rules Appendix VIP Delegate Visa",
        "section_id": "DEL 2.1",
        "section_title": "Validity requirements for entry clearance as a VIP Delegate",
        "parent_section": "DEL 2",
        "hierarchy_level": 2,
        "topic": "leave-to-enter",
        "url": "https://www.gov.uk/guidance/immigration-rules/immigration-rules-appendix-vip-delegate-visa",
        "scraped_at": "2025-12-06T17:29:49.947597"
      },
      "text": "### Validity requirements for entry clearance as a VIP Delegate\n\nDEL 2.1. A person applying for entry clearance as a VIP Delegate must apply online on the gov.uk website on the specified form: [“A exempt, diplomatic, official visit vignette or S2 Healthcare Visitor visa”](https://www.gov.uk/exempt-vignette).\n\n1.   DEL 2.2. An application for entry clearance as a VIP Delegate must satisfy all the following requirements: \n    1.   (a) the applicant must be named in a Note Verbale provided by their government, confirming that they are part of the official delegation accompanying their Head of State or serving government Minister; and\n    2.   (b) the applicant must have provided a valid passport which satisfactorily establishes their identity and nationality; and\n    3.   (c) the applicant must provide a facial image in accordance with the application process, and which complies with the rules for digital photos on [“https://www.gov.uk/photos-for-passports”](https://www.gov.uk/photos-for-passports); and\n    4.   (d) the applicant must be aged 18 or older on the date of application.\n\nDEL 2.3. An application for entry clearance as a VIP Delegate must be made while the applicant is outside the UK and to a Visa Application Centre (VAC) designated to accept such applications.\n\nDEL 2.4. An application which does not meet all the validity requirements for a VIP Delegate may be rejected as invalid and not considered.",
      "summary": "This provision applies to individuals applying for entry clearance as VIP Delegates. Applicants must submit an online application while outside the UK, be named in an official government Note Verbale, hold a valid passport, provide a compliant digital photo, and be at least 18 years old. Applications failing any validity requirement may be rejected.",
      "augmented_text": "Document: Immigration Rules Appendix VIP Delegate Visa\nPart: Immigration Rules Appendix VIP Delegate Visa\nSection ID: DEL 2.1\nSection: Validity requirements for entry clearance as a VIP Delegate\nTopic: leave-to-enter\n\nSummary: This provision applies to individuals applying for entry clearance as VIP Delegates. Applicants must submit an online application while outside the UK, be named in an official government Note Verbale, hold a valid passport, provide a compliant digital photo, and be at least 18 years old. Applications failing any validity requirement may be rejected.\n\n### Validity requirements for entry clearance as a VIP Delegate\n\nDEL 2.1. A person applying for entry clearance as a VIP Delegate must apply online on the gov.uk website on the specified form: [“A exempt, diplomatic, official visit vignette or S2 Healthcare Visitor visa”](https://www.gov.uk/exempt-vignette).\n\n1.   DEL 2.2. An application for entry clearance as a VIP Delegate must satisfy all the following requirements: \n    1.   (a) the applicant must be named in a Note Verbale provided by their government, confirming that they are part of the official delegation accompanying their Head of State or serving government Minister; and\n    2.   (b) the applicant must have provided a valid passport which satisfactorily establishes their identity and nationality; and\n    3.   (c) the applicant must provide a facial image in accordance with the application process, and which complies with the rules for digital photos on [“https://www.gov.uk/photos-for-passports”](https://www.gov.uk/photos-for-passports); and\n    4.   (d) the applicant must be aged 18 or older on the date of application.\n\nDEL 2.3. An application for entry clearance as a VIP Delegate must be made while the applicant is outside the UK and to a Visa Application Centre (VAC) designated to accept such applications.\n\nDEL 2.4. An application which does not meet all the validity requirements for a VIP Delegate may be rejected as invalid and not considered.",
      "needs_review": false
    },
    {
      "metadata": {
        "source": "Immigration Rules Appendix VIP Delegate Visa",
        "part": "Immigration Rules Appendix VIP Delegate Visa",
        "section_id": "DEL 3.1",
        "section_title": "Suitability requirements for a VIP Delegate",
        "parent_section": "DEL 3",
        "hierarchy_level": 2,
        "topic": "suitability",
        "url": "https://www.gov.uk/guidance/immigration-rules/immigration-rules-appendix-vip-delegate-visa",
        "scraped_at": "2025-12-06T17:29:49.947628"
      },
      "text": "### Suitability requirements for a VIP Delegate\n\nDEL 3.1. The decision maker must be satisfied that the applicant should not be refused under Part Suitability.",
      "summary": "This provision applies to VIP Delegate applicants, requiring the decision maker to ensure they meet suitability criteria. The applicant must not be refused under Part Suitability, with no specific exceptions noted.",
      "augmented_text": "Document: Immigration Rules Appendix VIP Delegate Visa\nPart: Immigration Rules Appendix VIP Delegate Visa\nSection ID: DEL 3.1\nSection: Suitability requirements for a VIP Delegate\nTopic: suitability\n\nSummary: This provision applies to VIP Delegate applicants, requiring the decision maker to ensure they meet suitability criteria. The applicant must not be refused under Part Suitability, with no specific exceptions noted.\n\n### Suitability requirements for a VIP Delegate\n\nDEL 3.1. The decision maker must be satisfied that the applicant should not be refused under Part Suitability.",
      "needs_review": false
    },
    {
      "metadata": {
        "source": "Immigration Rules Appendix VIP Delegate Visa",
        "part": "Immigration Rules Appendix VIP Delegate Visa",
        "section_id": "1",
        "section_title": "Eligibility requirements for a VIP Delegate",
        "parent_section": null,
        "hierarchy_level": 1,
        "topic": "eligibility",
        "url": "https://www.gov.uk/guidance/immigration-rules/immigration-rules-appendix-vip-delegate-visa",
        "scraped_at": "2025-12-06T17:29:49.947654"
      },
      "text": "### Eligibility requirements for a VIP Delegate\n\n1.   DEL 4.1. The decision maker must be satisfied that the applicant meets the following eligibility requirements: \n    1.   (a) the applicant is visiting the UK with the intention and sole purpose of accompanying their Head of State or serving government Minister on official business of their government; and\n    2.   (b) the applicant is a government official; and\n    3.   (c) the applicant’s intended dates of travel are consistent with the dates of the official visit; and\n    4.   (d) the applicant is aged 18 or older.\n\nDEL 4.2. The decision maker must be satisfied that the Note Verbale referred to in DEL 2.2(a) meets all the eligibility requirements in DEL 4.3. to DEL 4.6.\n\n1.   DEL 4.3. The Note Verbale must: \n    1.   (a) be issued by the government of the country sending the delegation; and\n    2.   (b) not contain a list of names that exceeds the allocated cap per visit.\n\n1.   DEL 4.4. The cap per visit referred to in DEL 4.3(b) is: \n    1.   (a) for delegations accompanying a head of state – 20; and\n    2.   (b) for delegations accompanying a serving government minister – 10.\n\n1.   DEL 4.5. The Note Verbale must also contain the following information: \n    1.   (a) the applicant’s name, date of birth and passport number; and\n    2.   (b) confirmation of the title and purpose of the official visit and the dates that the official visit will take place; and\n    3.   (c) confirmation that the application is supported by the country sending the delegation; and\n    4.   (d) confirmation that the applicant has sufficient funds to cover all reasonable costs in relation to their visit without unauthorised working or accessing public funds.\n\nDEL 4.6. The Note Verbale must have been issued prior to the application date and must not have been withdrawn after the issue date.",
      "summary": "This provision applies to government officials seeking a VIP Delegate Visa to accompany heads of state or ministers on official visits. Applicants must be aged 18 or over, and their government must issue a compliant Note Verbale with specific details, within delegation caps—20 for heads of state and 10 for ministers. Key conditions include matching travel dates, official purpose, and adherence to submission requirements.",
      "augmented_text": "Document: Immigration Rules Appendix VIP Delegate Visa\nPart: Immigration Rules Appendix VIP Delegate Visa\nSection ID: 1\nSection: Eligibility requirements for a VIP Delegate\nTopic: eligibility\n\nSummary: This provision applies to government officials seeking a VIP Delegate Visa to accompany heads of state or ministers on official visits. Applicants must be aged 18 or over, and their government must issue a compliant Note Verbale with specific details, within delegation caps—20 for heads of state and 10 for ministers. Key conditions include matching travel dates, official purpose, and adherence to submission requirements.\n\n### Eligibility requirements for a VIP Delegate\n\n1.   DEL 4.1. The decision maker must be satisfied that the applicant meets the following eligibility requirements: \n    1.   (a) the applicant is visiting the UK with the intention and sole purpose of accompanying their Head of State or serving government Minister on official business of their government; and\n    2.   (b) the applicant is a government official; and\n    3.   (c) the applicant’s intended dates of travel are consistent with the dates of the official visit; and\n    4.   (d) the applicant is aged 18 or older.\n\nDEL 4.2. The decision maker must be satisfied that the Note Verbale referred to in DEL 2.2(a) meets all the eligibility requirements in DEL 4.3. to DEL 4.6.\n\n1.   DEL 4.3. The Note Verbale must: \n    1.   (a) be issued by the government of the country sending the delegation; and\n    2.   (b) not contain a list of names that exceeds the allocated cap per visit.\n\n1.   DEL 4.4. The cap per visit referred to in DEL 4.3(b) is: \n    1.   (a) for delegations accompanying a head of state – 20; and\n    2.   (b) for delegations accompanying a serving government minister – 10.\n\n1.   DEL 4.5. The Note Verbale must also contain the following information: \n    1.   (a) the applicant’s name, date of birth and passport number; and\n    2.   (b) confirmation of the title and purpose of the official visit and the dates that the official visit will take place; and\n    3.   (c) confirmation that the application is supported by the country sending the delegation; and\n    4.   (d) confirmation that the applicant has sufficient funds to cover all reasonable costs in relation to their visit without unauthorised working or accessing public funds.\n\nDEL 4.6. The Note Verbale must have been issued prior to the application date and must not have been withdrawn after the issue date.",
      "needs_review": false
    },
    {
      "metadata": {
        "source": "Immigration Rules Appendix VIP Delegate Visa",
        "part": "Immigration Rules Appendix VIP Delegate Visa",
        "section_id": "DEL 5.1",
        "section_title": "Decision on an application as a VIP Delegate",
        "parent_section": "DEL 5",
        "hierarchy_level": 2,
        "topic": "eligibility",
        "url": "https://www.gov.uk/guidance/immigration-rules/immigration-rules-appendix-vip-delegate-visa",
        "scraped_at": "2025-12-06T17:29:49.947674"
      },
      "text": "### Decision on an application as a VIP Delegate\n\nDEL 5.1. If the decision maker is satisfied the suitability and eligibility requirements for entry clearance as a VIP Delegate are met, the application will be granted, otherwise the application will be refused.",
      "summary": "This provision applies to VIP Delegate applicants seeking entry clearance. It requires the decision maker to assess suitability and eligibility; if satisfied, the application is granted, otherwise refused. No specific exceptions are detailed.",
      "augmented_text": "Document: Immigration Rules Appendix VIP Delegate Visa\nPart: Immigration Rules Appendix VIP Delegate Visa\nSection ID: DEL 5.1\nSection: Decision on an application as a VIP Delegate\nTopic: eligibility\n\nSummary: This provision applies to VIP Delegate applicants seeking entry clearance. It requires the decision maker to assess suitability and eligibility; if satisfied, the application is granted, otherwise refused. No specific exceptions are detailed.\n\n### Decision on an application as a VIP Delegate\n\nDEL 5.1. If the decision maker is satisfied the suitability and eligibility requirements for entry clearance as a VIP Delegate are met, the application will be granted, otherwise the application will be refused.",
      "needs_review": false
    },
    {
      "metadata": {
        "source": "Immigration Rules Appendix VIP Delegate Visa",
        "part": "Immigration Rules Appendix VIP Delegate Visa",
        "section_id": "DEL 6.1",
        "section_title": "Period of grant for a VIP Delegate",
        "parent_section": "DEL 6",
        "hierarchy_level": 2,
        "topic": "leave-to-enter",
        "url": "https://www.gov.uk/guidance/immigration-rules/immigration-rules-appendix-vip-delegate-visa",
        "scraped_at": "2025-12-06T17:29:49.947704"
      },
      "text": "### Period of grant for a VIP Delegate\n\nDEL 6.1. Entry clearance as a VIP Delegate will be granted for the period beginning three days before the commencement of the official visit to the UK and ending three days after the end of the official visit to the UK and must not exceed in any case the maximum period of one month.",
      "summary": "VIP Delegates are granted entry clearance for the duration of their official visit, starting three days prior and ending three days after, with a maximum stay of one month. The grant is limited to the official visit period and cannot exceed one month.",
      "augmented_text": "Document: Immigration Rules Appendix VIP Delegate Visa\nPart: Immigration Rules Appendix VIP Delegate Visa\nSection ID: DEL 6.1\nSection: Period of grant for a VIP Delegate\nTopic: leave-to-enter\n\nSummary: VIP Delegates are granted entry clearance for the duration of their official visit, starting three days prior and ending three days after, with a maximum stay of one month. The grant is limited to the official visit period and cannot exceed one month.\n\n### Period of grant for a VIP Delegate\n\nDEL 6.1. Entry clearance as a VIP Delegate will be granted for the period beginning three days before the commencement of the official visit to the UK and ending three days after the end of the official visit to the UK and must not exceed in any case the maximum period of one month.",
      "needs_review": false
    },
    {
      "metadata": {
        "source": "Immigration Rules Appendix VIP Delegate Visa",
        "part": "Immigration Rules Appendix VIP Delegate Visa",
        "section_id": "1",
        "section_title": "Conditions of grant for a VIP Delegate",
        "parent_section": null,
        "hierarchy_level": 1,
        "topic": "financial",
        "url": "https://www.gov.uk/guidance/immigration-rules/immigration-rules-appendix-vip-delegate-visa",
        "scraped_at": "2025-12-06T17:29:49.947738"
      },
      "text": "### Conditions of grant for a VIP Delegate\n\n1.   DEL 7.1. The grant will be subject to all the following conditions: \n    1.   (a) no access to public funds; and\n    2.   (b) no work for purposes other than directly related to the purpose of their official visit as stated in the Note Verbale; and\n    3.   (c) no study.",
      "summary": "VIP Delegates must not access public funds, work outside their official visit purpose, or study during their stay. These conditions apply to all granted VIP Delegate visas, with no exceptions specified.",
      "augmented_text": "Document: Immigration Rules Appendix VIP Delegate Visa\nPart: Immigration Rules Appendix VIP Delegate Visa\nSection ID: 1\nSection: Conditions of grant for a VIP Delegate\nTopic: financial\n\nSummary: VIP Delegates must not access public funds, work outside their official visit purpose, or study during their stay. These conditions apply to all granted VIP Delegate visas, with no exceptions specified.\n\n### Conditions of grant for a VIP Delegate\n\n1.   DEL 7.1. The grant will be subject to all the following conditions: \n    1.   (a) no access to public funds; and\n    2.   (b) no work for purposes other than directly related to the purpose of their official visit as stated in the Note Verbale; and\n    3.   (c) no study.",
      "needs_review": false
    }
  ]
}