{
  "url": "https://www.gov.uk/guidance/immigration-rules/immigration-rules-appendix-adult-dependent-relative",
  "part_name": "Immigration Rules Appendix Adult Dependent Relative",
  "scraped_at": "2025-12-06T17:26:12.417520",
  "chunk_count": 19,
  "chunks": [
    {
      "metadata": {
        "source": "Immigration Rules Appendix Adult Dependent Relative",
        "part": "Immigration Rules Appendix Adult Dependent Relative",
        "section_id": "1",
        "section_title": "Validity requirements for an Adult Dependent Relative",
        "parent_section": null,
        "hierarchy_level": 1,
        "topic": "leave-to-enter",
        "url": "https://www.gov.uk/guidance/immigration-rules/immigration-rules-appendix-adult-dependent-relative",
        "scraped_at": "2025-12-06T17:26:12.416868"
      },
      "text": "### Validity requirements for an Adult Dependent Relative\n\n1.   ADR 1.1. A person applying for entry clearance or permission to stay as an Adult Dependent Relative must apply online on the gov.uk website on the specified form as follows: \n    1.   (a) for applicants outside the UK, form “Join or accompany a family member”; or\n    2.   (b) for applicants in the UK, form “Further leave to remain – Human Rights.\n\n1.   ADR 1.2. An application for entry clearance or permission to stay as an Adult Dependent Relative must meet all the following requirements: \n    1.   (a) any fee and Immigration Health Charge must have been paid (unless the applicant has been granted a fee waiver in whole or part); and\n    2.   (b) the applicant must have provided biometrics when required; and\n    3.   (c) the applicant must have provided a passport or other document which satisfactorily establishes their identity and nationality; and\n    4.   (d) the applicant and their sponsor must both be aged 18 or over at the date of application.\n\nADR 1.3. If applying for permission to stay, the applicant must be in the UK on the date of application.\n\nADR 1.3A. If applying for permission to stay, the applicant must have, or have last been granted, entry clearance or permission to stay as an Adult Dependent Relative.\n\nADR 1.4. An application which does not meet all the validity requirements for the Adult Dependent Relative route may be rejected as invalid and not considered.",
      "summary": "Applicants for entry clearance or permission to stay as Adult Dependent Relatives must apply online, meet fee, biometrics, identity, and age requirements, and be in the UK if applying to stay. Applications failing these criteria may be rejected as invalid.",
      "augmented_text": "Document: Immigration Rules Appendix Adult Dependent Relative\nPart: Immigration Rules Appendix Adult Dependent Relative\nSection ID: 1\nSection: Validity requirements for an Adult Dependent Relative\nTopic: leave-to-enter\n\nSummary: Applicants for entry clearance or permission to stay as Adult Dependent Relatives must apply online, meet fee, biometrics, identity, and age requirements, and be in the UK if applying to stay. Applications failing these criteria may be rejected as invalid.\n\n### Validity requirements for an Adult Dependent Relative\n\n1.   ADR 1.1. A person applying for entry clearance or permission to stay as an Adult Dependent Relative must apply online on the gov.uk website on the specified form as follows: \n    1.   (a) for applicants outside the UK, form “Join or accompany a family member”; or\n    2.   (b) for applicants in the UK, form “Further leave to remain – Human Rights.\n\n1.   ADR 1.2. An application for entry clearance or permission to stay as an Adult Dependent Relative must meet all the following requirements: \n    1.   (a) any fee and Immigration Health Charge must have been paid (unless the applicant has been granted a fee waiver in whole or part); and\n    2.   (b) the applicant must have provided biometrics when required; and\n    3.   (c) the applicant must have provided a passport or other document which satisfactorily establishes their identity and nationality; and\n    4.   (d) the applicant and their sponsor must both be aged 18 or over at the date of application.\n\nADR 1.3. If applying for permission to stay, the applicant must be in the UK on the date of application.\n\nADR 1.3A. If applying for permission to stay, the applicant must have, or have last been granted, entry clearance or permission to stay as an Adult Dependent Relative.\n\nADR 1.4. An application which does not meet all the validity requirements for the Adult Dependent Relative route may be rejected as invalid and not considered.",
      "needs_review": false
    },
    {
      "metadata": {
        "source": "Immigration Rules Appendix Adult Dependent Relative",
        "part": "Immigration Rules Appendix Adult Dependent Relative",
        "section_id": "ADR 2.1",
        "section_title": "Suitability requirements for an Adult Dependent Relative",
        "parent_section": "ADR 2",
        "hierarchy_level": 2,
        "topic": "suitability",
        "url": "https://www.gov.uk/guidance/immigration-rules/immigration-rules-appendix-adult-dependent-relative",
        "scraped_at": "2025-12-06T17:26:12.416904"
      },
      "text": "### Suitability requirements for an Adult Dependent Relative\n\nADR 2.1. The applicant must not fall for refusal under Part Suitability.\n\n1.   ADR 2.2. If applying for permission to stay, the applicant must not be: \n    1.   (a) in breach of immigration laws, except that where the Exceptions for overstayers section of Part Suitability applies, that period of overstaying will be disregarded; or\n    2.   (b) on immigration bail.",
      "summary": "This provision applies to Adult Dependent Relative applicants seeking permission to stay. They must not breach immigration laws or be on immigration bail, unless specific overstaying exceptions apply.",
      "augmented_text": "Document: Immigration Rules Appendix Adult Dependent Relative\nPart: Immigration Rules Appendix Adult Dependent Relative\nSection ID: ADR 2.1\nSection: Suitability requirements for an Adult Dependent Relative\nTopic: suitability\n\nSummary: This provision applies to Adult Dependent Relative applicants seeking permission to stay. They must not breach immigration laws or be on immigration bail, unless specific overstaying exceptions apply.\n\n### Suitability requirements for an Adult Dependent Relative\n\nADR 2.1. The applicant must not fall for refusal under Part Suitability.\n\n1.   ADR 2.2. If applying for permission to stay, the applicant must not be: \n    1.   (a) in breach of immigration laws, except that where the Exceptions for overstayers section of Part Suitability applies, that period of overstaying will be disregarded; or\n    2.   (b) on immigration bail.",
      "needs_review": false
    },
    {
      "metadata": {
        "source": "Immigration Rules Appendix Adult Dependent Relative",
        "part": "Immigration Rules Appendix Adult Dependent Relative",
        "section_id": "Eligibility requirements for an Adult Dependent Relative",
        "section_title": "Eligibility requirements for an Adult Dependent Relative",
        "parent_section": null,
        "hierarchy_level": 2,
        "topic": "eligibility",
        "url": "https://www.gov.uk/guidance/immigration-rules/immigration-rules-appendix-adult-dependent-relative",
        "scraped_at": "2025-12-06T17:26:12.416912"
      },
      "text": "### Eligibility requirements for an Adult Dependent Relative",
      "summary": "This provision applies to adult dependent relatives seeking entry under UK immigration rules. It requires demonstrating sufficient dependency, suitable accommodation, and an inability to meet needs without support; exceptions are limited and depend on specific circumstances.",
      "augmented_text": "Document: Immigration Rules Appendix Adult Dependent Relative\nPart: Immigration Rules Appendix Adult Dependent Relative\nSection ID: Eligibility requirements for an Adult Dependent Relative\nSection: Eligibility requirements for an Adult Dependent Relative\nTopic: eligibility\n\nSummary: This provision applies to adult dependent relatives seeking entry under UK immigration rules. It requires demonstrating sufficient dependency, suitable accommodation, and an inability to meet needs without support; exceptions are limited and depend on specific circumstances.\n\n### Eligibility requirements for an Adult Dependent Relative",
      "needs_review": false
    },
    {
      "metadata": {
        "source": "Immigration Rules Appendix Adult Dependent Relative",
        "part": "Immigration Rules Appendix Adult Dependent Relative",
        "section_id": "ADR 3.1",
        "section_title": "Entry requirements for an Adult Dependent Relative",
        "parent_section": "ADR 3",
        "hierarchy_level": 2,
        "topic": "leave-to-enter",
        "url": "https://www.gov.uk/guidance/immigration-rules/immigration-rules-appendix-adult-dependent-relative",
        "scraped_at": "2025-12-06T17:26:12.416958"
      },
      "text": "### Entry requirements for an Adult Dependent Relative\n\nADR 3.1. A person seeking to come to the UK as an Adult Dependent Relative must apply for and obtain entry clearance as an Adult Dependent Relative before they arrive in the UK.\n\nADR 3.2. A person applying for entry clearance as an Adult Dependent Relative must, if Appendix Tuberculosis applies, provide a valid medical certificate confirming that they have undergone screening for active pulmonary tuberculosis and that this tuberculosis is not present in them.",
      "summary": "Adult Dependent Relatives must obtain prior entry clearance before arriving in the UK and, if applicable, must provide a tuberculosis screening certificate. This applies to those seeking dependency status, with specific health requirements if relevant.",
      "augmented_text": "Document: Immigration Rules Appendix Adult Dependent Relative\nPart: Immigration Rules Appendix Adult Dependent Relative\nSection ID: ADR 3.1\nSection: Entry requirements for an Adult Dependent Relative\nTopic: leave-to-enter\n\nSummary: Adult Dependent Relatives must obtain prior entry clearance before arriving in the UK and, if applicable, must provide a tuberculosis screening certificate. This applies to those seeking dependency status, with specific health requirements if relevant.\n\n### Entry requirements for an Adult Dependent Relative\n\nADR 3.1. A person seeking to come to the UK as an Adult Dependent Relative must apply for and obtain entry clearance as an Adult Dependent Relative before they arrive in the UK.\n\nADR 3.2. A person applying for entry clearance as an Adult Dependent Relative must, if Appendix Tuberculosis applies, provide a valid medical certificate confirming that they have undergone screening for active pulmonary tuberculosis and that this tuberculosis is not present in them.",
      "needs_review": false
    },
    {
      "metadata": {
        "source": "Immigration Rules Appendix Adult Dependent Relative",
        "part": "Immigration Rules Appendix Adult Dependent Relative",
        "section_id": "1",
        "section_title": "Relationship requirements for an Adult Dependent Relative",
        "parent_section": null,
        "hierarchy_level": 1,
        "topic": "leave-to-enter",
        "url": "https://www.gov.uk/guidance/immigration-rules/immigration-rules-appendix-adult-dependent-relative",
        "scraped_at": "2025-12-06T17:26:12.416983"
      },
      "text": "### Relationship requirements for an Adult Dependent Relative\n\n1.   ADR 4.1. An applicant applying for entry clearance or permission to stay as an Adult Dependent Relative must be one of the following: \n    1.   (a) the parent; or\n    2.   (b) the grandparent; or\n    3.   (c) the son or daughter; or\n    4.   (d) the brother or sister,\n\n2.   of a person in the UK (“the sponsor”).\n\n1.   ADR 4.2. The sponsor of the applicant must be one of the following: \n    1.   (a) a British Citizen; or\n    2.   (b) settled in the UK; or\n    3.   (c) in the UK with protection status; or\n    4.   (d) an EEA national with limited leave to enter or remain granted under paragraph EU3 of Appendix EU on the basis of meeting condition 1(a)(i) in paragraph EU14 of that Appendix.\n\nADR 4.3. Where the applicant is applying for permission to stay, the sponsor must be the same person who sponsored the applicant when they were last granted entry clearance or permission as an Adult Dependent Relative.",
      "summary": "This provision applies to adult dependent relative applicants seeking entry or stay in the UK. They must be a parent, grandparent, child, or sibling of a qualifying sponsor who is a British citizen, settled, protected, or an EEA national with limited leave. The sponsor must be the same individual as in the previous entry or permission grant.",
      "augmented_text": "Document: Immigration Rules Appendix Adult Dependent Relative\nPart: Immigration Rules Appendix Adult Dependent Relative\nSection ID: 1\nSection: Relationship requirements for an Adult Dependent Relative\nTopic: leave-to-enter\n\nSummary: This provision applies to adult dependent relative applicants seeking entry or stay in the UK. They must be a parent, grandparent, child, or sibling of a qualifying sponsor who is a British citizen, settled, protected, or an EEA national with limited leave. The sponsor must be the same individual as in the previous entry or permission grant.\n\n### Relationship requirements for an Adult Dependent Relative\n\n1.   ADR 4.1. An applicant applying for entry clearance or permission to stay as an Adult Dependent Relative must be one of the following: \n    1.   (a) the parent; or\n    2.   (b) the grandparent; or\n    3.   (c) the son or daughter; or\n    4.   (d) the brother or sister,\n\n2.   of a person in the UK (“the sponsor”).\n\n1.   ADR 4.2. The sponsor of the applicant must be one of the following: \n    1.   (a) a British Citizen; or\n    2.   (b) settled in the UK; or\n    3.   (c) in the UK with protection status; or\n    4.   (d) an EEA national with limited leave to enter or remain granted under paragraph EU3 of Appendix EU on the basis of meeting condition 1(a)(i) in paragraph EU14 of that Appendix.\n\nADR 4.3. Where the applicant is applying for permission to stay, the sponsor must be the same person who sponsored the applicant when they were last granted entry clearance or permission as an Adult Dependent Relative.",
      "needs_review": false
    },
    {
      "metadata": {
        "source": "Immigration Rules Appendix Adult Dependent Relative",
        "part": "Immigration Rules Appendix Adult Dependent Relative",
        "section_id": "ADR 5.1",
        "section_title": "Dependency requirements for an Adult Dependent Relative",
        "parent_section": "ADR 5",
        "hierarchy_level": 2,
        "topic": "family",
        "url": "https://www.gov.uk/guidance/immigration-rules/immigration-rules-appendix-adult-dependent-relative",
        "scraped_at": "2025-12-06T17:26:12.417008"
      },
      "text": "### Dependency requirements for an Adult Dependent Relative\n\nADR 5.1. The applicant, or if the applicant is applying as a parent or grandparent, the applicant’s partner, must as a result of age, illness or disability require long term personal care to perform everyday tasks.\n\n1.   ADR 5.2. Where the application is for entry clearance, the applicant, or if the applicant is applying as a parent or grandparent, the applicant’s partner, must be unable to obtain the required level of care in the country where they are living, even with the financial help of the sponsor because either: \n    1.   (a) the care is not available and there is no person in that country who can reasonably provide it: or\n    2.   (b) the care is not affordable.\n\n1.   ADR 5.3. DELETED",
      "summary": "This provision applies to adult dependent relatives or their partners seeking entry as long-term carers needing age- or illness-related care. Applicants must require personal care they cannot obtain or afford in their home country, even with sponsor support. The care unavailability or unaffordability in the home country is a critical threshold for eligibility.",
      "augmented_text": "Document: Immigration Rules Appendix Adult Dependent Relative\nPart: Immigration Rules Appendix Adult Dependent Relative\nSection ID: ADR 5.1\nSection: Dependency requirements for an Adult Dependent Relative\nTopic: family\n\nSummary: This provision applies to adult dependent relatives or their partners seeking entry as long-term carers needing age- or illness-related care. Applicants must require personal care they cannot obtain or afford in their home country, even with sponsor support. The care unavailability or unaffordability in the home country is a critical threshold for eligibility.\n\n### Dependency requirements for an Adult Dependent Relative\n\nADR 5.1. The applicant, or if the applicant is applying as a parent or grandparent, the applicant’s partner, must as a result of age, illness or disability require long term personal care to perform everyday tasks.\n\n1.   ADR 5.2. Where the application is for entry clearance, the applicant, or if the applicant is applying as a parent or grandparent, the applicant’s partner, must be unable to obtain the required level of care in the country where they are living, even with the financial help of the sponsor because either: \n    1.   (a) the care is not available and there is no person in that country who can reasonably provide it: or\n    2.   (b) the care is not affordable.\n\n1.   ADR 5.3. DELETED",
      "needs_review": false
    },
    {
      "metadata": {
        "source": "Immigration Rules Appendix Adult Dependent Relative",
        "part": "Immigration Rules Appendix Adult Dependent Relative",
        "section_id": "ADR 5.3A",
        "section_title": "Partner requirement on the Adult Dependent Relative route",
        "parent_section": "ADR 5",
        "hierarchy_level": 2,
        "topic": "leave-to-enter",
        "url": "https://www.gov.uk/guidance/immigration-rules/immigration-rules-appendix-adult-dependent-relative",
        "scraped_at": "2025-12-06T17:26:12.417025"
      },
      "text": "### Partner requirement on the Adult Dependent Relative route\n\nADR 5.3A.1. If the applicant is the sponsor’s parent or grandparent they must not be in a subsisting relationship with a partner, unless that partner is applying for entry clearance or permission to stay as an Adult Dependent Relative at the same time.",
      "summary": "This provision applies to adult dependent relatives, specifically parents or grandparents, applying under the route. They must not be in a subsisting relationship with a partner unless the partner is also applying as an Adult Dependent Relative simultaneously. The rule ensures independence from other relationships unless jointly applying.",
      "augmented_text": "Document: Immigration Rules Appendix Adult Dependent Relative\nPart: Immigration Rules Appendix Adult Dependent Relative\nSection ID: ADR 5.3A\nSection: Partner requirement on the Adult Dependent Relative route\nTopic: leave-to-enter\n\nSummary: This provision applies to adult dependent relatives, specifically parents or grandparents, applying under the route. They must not be in a subsisting relationship with a partner unless the partner is also applying as an Adult Dependent Relative simultaneously. The rule ensures independence from other relationships unless jointly applying.\n\n### Partner requirement on the Adult Dependent Relative route\n\nADR 5.3A.1. If the applicant is the sponsor’s parent or grandparent they must not be in a subsisting relationship with a partner, unless that partner is applying for entry clearance or permission to stay as an Adult Dependent Relative at the same time.",
      "needs_review": false
    },
    {
      "metadata": {
        "source": "Immigration Rules Appendix Adult Dependent Relative",
        "part": "Immigration Rules Appendix Adult Dependent Relative",
        "section_id": "ADR 6.1",
        "section_title": "Financial requirement for an Adult Dependent Relative",
        "parent_section": "ADR 6",
        "hierarchy_level": 2,
        "topic": "financial",
        "url": "https://www.gov.uk/guidance/immigration-rules/immigration-rules-appendix-adult-dependent-relative",
        "scraped_at": "2025-12-06T17:26:12.417035"
      },
      "text": "### Financial requirement for an Adult Dependent Relative\n\nADR 6.1. The sponsor must be able to provide adequate maintenance, accommodation and care for the applicant in the UK without access to public funds.\n\n1.   ADR. 6.2. The sponsor must provide evidence of income or cash savings sufficient to show they can meet the financial requirement and: \n    1.   (a) evidence from income (other than self-employment) or savings must cover the 6 month period immediately before the date of application; or\n    2.   (b) where the sponsor is receiving maternity, paternity, adoption or sick pay, their income from salaried employment can be shown for either the 6 months immediately before the date of application or the start date of the maternity, paternity, adoption or sick leave; or\n    3.   (c) where the income is from self-employment it must be shown for the last full financial year before the date of application, with additional evidence of ongoing self-employment as in paragraphs 7 or 9 (as relevant) of Appendix FM-SE; or\n    4.   (d) where there is non-employment income it must be shown to have been received in the 12 months before the date of application except where specified in paragraph 10 of Appendix FM-SE; or\n    5.   (e) where property has been sold and the money received has been converted into cash savings the requirements in paragraph 11A(d) of Appendix FM-SE must be met.\n\nADR 6.3. The income or cash savings must be evidenced as specified in paragraphs 1, 12A and 12B of Appendix FM-SE.\n\n1.   ADR 6.4. The sponsor must provide a signed maintenance undertaking confirming that the applicant will not have access to public funds, and that the sponsor will be responsible for the maintenance, accommodation and care of the applicant for either: \n    1.   (a) a period of 5 years from the date the applicant arrives in the UK if the applicant is to be granted settlement; or\n    2.   (b) the duration of the period of permission to be granted if the applicant is being granted temporary permission to stay.\n\nADR 6.5. If the applicant receives public funds during the period covered by the maintenance undertaking (see ADR 6.4.) the UK Government may seek to recover the public funds from the sponsor who gave the undertaking.",
      "summary": "This provision applies to sponsors seeking to support an Adult Dependent Relative. The sponsor must demonstrate sufficient income or savings to provide for the applicant's maintenance, accommodation, and care without public funds, based on specific evidence periods related to income type. Critical conditions include demonstrating ongoing income or savings for the relevant period and meeting specific evidence requirements outlined in the rules.",
      "augmented_text": "Document: Immigration Rules Appendix Adult Dependent Relative\nPart: Immigration Rules Appendix Adult Dependent Relative\nSection ID: ADR 6.1\nSection: Financial requirement for an Adult Dependent Relative\nTopic: financial\n\nSummary: This provision applies to sponsors seeking to support an Adult Dependent Relative. The sponsor must demonstrate sufficient income or savings to provide for the applicant's maintenance, accommodation, and care without public funds, based on specific evidence periods related to income type. Critical conditions include demonstrating ongoing income or savings for the relevant period and meeting specific evidence requirements outlined in the rules.\n\n### Financial requirement for an Adult Dependent Relative\n\nADR 6.1. The sponsor must be able to provide adequate maintenance, accommodation and care for the applicant in the UK without access to public funds.\n\n1.   ADR. 6.2. The sponsor must provide evidence of income or cash savings sufficient to show they can meet the financial requirement and: \n    1.   (a) evidence from income (other than self-employment) or savings must cover the 6 month period immediately before the date of application; or\n    2.   (b) where the sponsor is receiving maternity, paternity, adoption or sick pay, their income from salaried employment can be shown for either the 6 months immediately before the date of application or the start date of the maternity, paternity, adoption or sick leave; or\n    3.   (c) where the income is from self-employment it must be shown for the last full financial year before the date of application, with additional evidence of ongoing self-employment as in paragraphs 7 or 9 (as relevant) of Appendix FM-SE; or\n    4.   (d) where there is non-employment income it must be shown to have been received in the 12 months before the date of application except where specified in paragraph 10 of Appendix FM-SE; or\n    5.   (e) where property has been sold and the money received has been converted into cash savings the requirements in paragraph 11A(d) of Appendix FM-SE must be met.\n\nADR 6.3. The income or cash savings must be evidenced as specified in paragraphs 1, 12A and 12B of Appendix FM-SE.\n\n1.   ADR 6.4. The sponsor must provide a signed maintenance undertaking confirming that the applicant will not have access to public funds, and that the sponsor will be responsible for the maintenance, accommodation and care of the applicant for either: \n    1.   (a) a period of 5 years from the date the applicant arrives in the UK if the applicant is to be granted settlement; or\n    2.   (b) the duration of the period of permission to be granted if the applicant is being granted temporary permission to stay.\n\nADR 6.5. If the applicant receives public funds during the period covered by the maintenance undertaking (see ADR 6.4.) the UK Government may seek to recover the public funds from the sponsor who gave the undertaking.",
      "needs_review": false
    },
    {
      "metadata": {
        "source": "Immigration Rules Appendix Adult Dependent Relative",
        "part": "Immigration Rules Appendix Adult Dependent Relative",
        "section_id": "ADR 7.1",
        "section_title": "Eligibility under Article 8 ECHR for an Adult Dependent Relative",
        "parent_section": "ADR 7",
        "hierarchy_level": 2,
        "topic": "eligibility",
        "url": "https://www.gov.uk/guidance/immigration-rules/immigration-rules-appendix-adult-dependent-relative",
        "scraped_at": "2025-12-06T17:26:12.417042"
      },
      "text": "### Eligibility under Article 8 ECHR for an Adult Dependent Relative\n\nADR 7.1. If the applicant does not meet all the suitability requirements (subject to ADR 7.2) or does not meet all of the eligibility requirements in ADR 3.1. to ADR 6.4., but the decision maker is satisfied that refusal of the application would breach Article 8 of the Human Rights Convention, because it would result in unjustifiably harsh consequences for the applicant or their family, the applicant will meet the Article 8 ECHR eligibility requirement.\n\nADR 7.2. Where ADR 7.1. applies and the applicant falls for refusal on suitability grounds under S-EC.1.2 to S-EC.1.5, or S-LTR.1.2 to S-LTR.1.6. of Appendix FM of these rules the application as an Adult Dependent Relative must be refused.",
      "summary": "This provision applies to adult dependent relatives seeking entry under Article 8 ECHR. If they fail suitability or other eligibility requirements but refusal would cause unjustifiably harsh consequences, they may still qualify under Article 8. However, if they fail suitability grounds outlined in specific sections, the application must be refused.",
      "augmented_text": "Document: Immigration Rules Appendix Adult Dependent Relative\nPart: Immigration Rules Appendix Adult Dependent Relative\nSection ID: ADR 7.1\nSection: Eligibility under Article 8 ECHR for an Adult Dependent Relative\nTopic: eligibility\n\nSummary: This provision applies to adult dependent relatives seeking entry under Article 8 ECHR. If they fail suitability or other eligibility requirements but refusal would cause unjustifiably harsh consequences, they may still qualify under Article 8. However, if they fail suitability grounds outlined in specific sections, the application must be refused.\n\n### Eligibility under Article 8 ECHR for an Adult Dependent Relative\n\nADR 7.1. If the applicant does not meet all the suitability requirements (subject to ADR 7.2) or does not meet all of the eligibility requirements in ADR 3.1. to ADR 6.4., but the decision maker is satisfied that refusal of the application would breach Article 8 of the Human Rights Convention, because it would result in unjustifiably harsh consequences for the applicant or their family, the applicant will meet the Article 8 ECHR eligibility requirement.\n\nADR 7.2. Where ADR 7.1. applies and the applicant falls for refusal on suitability grounds under S-EC.1.2 to S-EC.1.5, or S-LTR.1.2 to S-LTR.1.6. of Appendix FM of these rules the application as an Adult Dependent Relative must be refused.",
      "needs_review": false
    },
    {
      "metadata": {
        "source": "Immigration Rules Appendix Adult Dependent Relative",
        "part": "Immigration Rules Appendix Adult Dependent Relative",
        "section_id": "ADR 8.1",
        "section_title": "Decision on an application as an Adult Dependent Relative",
        "parent_section": "ADR 8",
        "hierarchy_level": 2,
        "topic": "eligibility",
        "url": "https://www.gov.uk/guidance/immigration-rules/immigration-rules-appendix-adult-dependent-relative",
        "scraped_at": "2025-12-06T17:26:12.417049"
      },
      "text": "### Decision on an application as an Adult Dependent Relative\n\nADR 8.1. If the decision maker is satisfied that all the suitability and the relevant eligibility requirements are met, unless paragraph ADR 7.2. applies, the application will be granted as an Adult Dependent Relative; otherwise, the application will be refused.",
      "summary": "This provision applies to Adult Dependent Relative applicants. It requires the decision maker to confirm all suitability and eligibility criteria are met before granting, unless paragraph ADR 7.2. applies; failure to meet these criteria results in refusal.",
      "augmented_text": "Document: Immigration Rules Appendix Adult Dependent Relative\nPart: Immigration Rules Appendix Adult Dependent Relative\nSection ID: ADR 8.1\nSection: Decision on an application as an Adult Dependent Relative\nTopic: eligibility\n\nSummary: This provision applies to Adult Dependent Relative applicants. It requires the decision maker to confirm all suitability and eligibility criteria are met before granting, unless paragraph ADR 7.2. applies; failure to meet these criteria results in refusal.\n\n### Decision on an application as an Adult Dependent Relative\n\nADR 8.1. If the decision maker is satisfied that all the suitability and the relevant eligibility requirements are met, unless paragraph ADR 7.2. applies, the application will be granted as an Adult Dependent Relative; otherwise, the application will be refused.",
      "needs_review": false
    },
    {
      "metadata": {
        "source": "Immigration Rules Appendix Adult Dependent Relative",
        "part": "Immigration Rules Appendix Adult Dependent Relative",
        "section_id": "ADR 9.1",
        "section_title": "Period of grant for an Adult Dependent Relative",
        "parent_section": "ADR 9",
        "hierarchy_level": 2,
        "topic": "leave-to-enter",
        "url": "https://www.gov.uk/guidance/immigration-rules/immigration-rules-appendix-adult-dependent-relative",
        "scraped_at": "2025-12-06T17:26:12.417062"
      },
      "text": "### Period of grant for an Adult Dependent Relative\n\nADR 9.1. An applicant applying for entry clearance will, if the sponsor is a British Citizen or settled in the UK, be granted settlement.\n\nADR 9.2. An applicant applying for entry clearance or permission to stay where an applicant’s sponsor has temporary permission to stay in the UK will be granted temporary permission which expires on the same date as their sponsor’s temporary permission.\n\nADR 9.3 Where an applicant is applying for permission to stay and, their sponsor is a British Citizen or settled in the UK, the applicant will be granted permission for 30 months.",
      "summary": "Adult Dependent Relatives applying for entry clearance or permission to stay must be granted settlement if sponsored by a British Citizen or settled in the UK, or temporary permission matching the sponsor’s status or lasting 30 months if the sponsor has temporary permission; exceptions include cases where temporary permission aligns with the sponsor’s status.",
      "augmented_text": "Document: Immigration Rules Appendix Adult Dependent Relative\nPart: Immigration Rules Appendix Adult Dependent Relative\nSection ID: ADR 9.1\nSection: Period of grant for an Adult Dependent Relative\nTopic: leave-to-enter\n\nSummary: Adult Dependent Relatives applying for entry clearance or permission to stay must be granted settlement if sponsored by a British Citizen or settled in the UK, or temporary permission matching the sponsor’s status or lasting 30 months if the sponsor has temporary permission; exceptions include cases where temporary permission aligns with the sponsor’s status.\n\n### Period of grant for an Adult Dependent Relative\n\nADR 9.1. An applicant applying for entry clearance will, if the sponsor is a British Citizen or settled in the UK, be granted settlement.\n\nADR 9.2. An applicant applying for entry clearance or permission to stay where an applicant’s sponsor has temporary permission to stay in the UK will be granted temporary permission which expires on the same date as their sponsor’s temporary permission.\n\nADR 9.3 Where an applicant is applying for permission to stay and, their sponsor is a British Citizen or settled in the UK, the applicant will be granted permission for 30 months.",
      "needs_review": false
    },
    {
      "metadata": {
        "source": "Immigration Rules Appendix Adult Dependent Relative",
        "part": "Immigration Rules Appendix Adult Dependent Relative",
        "section_id": "1",
        "section_title": "Conditions of grant for an Adult Dependent Relative",
        "parent_section": null,
        "hierarchy_level": 1,
        "topic": "financial",
        "url": "https://www.gov.uk/guidance/immigration-rules/immigration-rules-appendix-adult-dependent-relative",
        "scraped_at": "2025-12-06T17:26:12.417071"
      },
      "text": "### Conditions of grant for an Adult Dependent Relative\n\n1.   ADR 9.4. If the applicant is granted temporary permission, it will be subject to the following conditions: \n    1.   (a) no access to public funds; and\n    2.   (b) work permitted (including self-employment and voluntary work); and\n    3.   (c) study permitted, subject to the ATAS condition in Appendix ATAS.",
      "summary": "This provision applies to Adult Dependent Relative applicants granted temporary permission. It specifies that such applicants cannot access public funds but may work, including self-employment and voluntary work, and study (subject to ATAS conditions).",
      "augmented_text": "Document: Immigration Rules Appendix Adult Dependent Relative\nPart: Immigration Rules Appendix Adult Dependent Relative\nSection ID: 1\nSection: Conditions of grant for an Adult Dependent Relative\nTopic: financial\n\nSummary: This provision applies to Adult Dependent Relative applicants granted temporary permission. It specifies that such applicants cannot access public funds but may work, including self-employment and voluntary work, and study (subject to ATAS conditions).\n\n### Conditions of grant for an Adult Dependent Relative\n\n1.   ADR 9.4. If the applicant is granted temporary permission, it will be subject to the following conditions: \n    1.   (a) no access to public funds; and\n    2.   (b) work permitted (including self-employment and voluntary work); and\n    3.   (c) study permitted, subject to the ATAS condition in Appendix ATAS.",
      "needs_review": false
    },
    {
      "metadata": {
        "source": "Immigration Rules Appendix Adult Dependent Relative",
        "part": "Immigration Rules Appendix Adult Dependent Relative",
        "section_id": "Settlement as an Adult Dependent Relative for those with temporary permission to stay as an Adult Dependent Relative",
        "section_title": "Settlement as an Adult Dependent Relative for those with temporary permission to stay as an Adult Dependent Relative",
        "parent_section": null,
        "hierarchy_level": 2,
        "topic": "settlement",
        "url": "https://www.gov.uk/guidance/immigration-rules/immigration-rules-appendix-adult-dependent-relative",
        "scraped_at": "2025-12-06T17:26:12.417082"
      },
      "text": "### Settlement as an Adult Dependent Relative for those with temporary permission to stay as an Adult Dependent Relative",
      "summary": "This provision applies to adult dependents with temporary permission to stay as Adult Dependent Relatives seeking settlement. They must demonstrate continued dependence and meet health, accommodation, and income requirements; exceptions are limited and subject to specific conditions.",
      "augmented_text": "Document: Immigration Rules Appendix Adult Dependent Relative\nPart: Immigration Rules Appendix Adult Dependent Relative\nSection ID: Settlement as an Adult Dependent Relative for those with temporary permission to stay as an Adult Dependent Relative\nSection: Settlement as an Adult Dependent Relative for those with temporary permission to stay as an Adult Dependent Relative\nTopic: settlement\n\nSummary: This provision applies to adult dependents with temporary permission to stay as Adult Dependent Relatives seeking settlement. They must demonstrate continued dependence and meet health, accommodation, and income requirements; exceptions are limited and subject to specific conditions.\n\n### Settlement as an Adult Dependent Relative for those with temporary permission to stay as an Adult Dependent Relative",
      "needs_review": false
    },
    {
      "metadata": {
        "source": "Immigration Rules Appendix Adult Dependent Relative",
        "part": "Immigration Rules Appendix Adult Dependent Relative",
        "section_id": "ADR 10.1",
        "section_title": "Validity requirements for settlement as an Adult Dependent Relative for those with permission to stay as an Adult Dependent Relative",
        "parent_section": "ADR 10",
        "hierarchy_level": 2,
        "topic": "settlement",
        "url": "https://www.gov.uk/guidance/immigration-rules/immigration-rules-appendix-adult-dependent-relative",
        "scraped_at": "2025-12-06T17:26:12.417101"
      },
      "text": "### Validity requirements for settlement as an Adult Dependent Relative for those with permission to stay as an Adult Dependent Relative\n\nADR 10.1. A person in the UK applying for settlement as an Adult Dependent Relative must apply online on the gov.uk website on the specified form “Settle in the UK in various immigration categories: form SET(O)”.\n\nADR 10.2. The applicant must be in the UK on the date of application.\n\nADR 10.2A. The applicant must have, or have previously been granted, permission as an Adult Dependent Relative.\n\n1.   ADR 10.3. An application for settlement as an Adult Dependent Relative must meet all the following requirements: \n    1.   (a) any fee must have been paid; and\n    2.   (b) the applicant must have provided biometrics when required; and\n    3.   (c) the applicant must have provided a passport or other document which satisfactorily establishes their identity and nationality.\n\nADR 10.4. An application which does not meet all the validity requirements for settlement as an Adult Dependent Relative may be rejected as invalid and not considered.",
      "summary": "Adult Dependent Relatives in the UK applying for settlement must submit an online application on form SET(O) while in the UK, having previously or currently permission as an Adult Dependent Relative. They must meet validity criteria, including paying fees, providing biometrics, and proof of identity; failure to do so may result in rejection.",
      "augmented_text": "Document: Immigration Rules Appendix Adult Dependent Relative\nPart: Immigration Rules Appendix Adult Dependent Relative\nSection ID: ADR 10.1\nSection: Validity requirements for settlement as an Adult Dependent Relative for those with permission to stay as an Adult Dependent Relative\nTopic: settlement\n\nSummary: Adult Dependent Relatives in the UK applying for settlement must submit an online application on form SET(O) while in the UK, having previously or currently permission as an Adult Dependent Relative. They must meet validity criteria, including paying fees, providing biometrics, and proof of identity; failure to do so may result in rejection.\n\n### Validity requirements for settlement as an Adult Dependent Relative for those with permission to stay as an Adult Dependent Relative\n\nADR 10.1. A person in the UK applying for settlement as an Adult Dependent Relative must apply online on the gov.uk website on the specified form “Settle in the UK in various immigration categories: form SET(O)”.\n\nADR 10.2. The applicant must be in the UK on the date of application.\n\nADR 10.2A. The applicant must have, or have previously been granted, permission as an Adult Dependent Relative.\n\n1.   ADR 10.3. An application for settlement as an Adult Dependent Relative must meet all the following requirements: \n    1.   (a) any fee must have been paid; and\n    2.   (b) the applicant must have provided biometrics when required; and\n    3.   (c) the applicant must have provided a passport or other document which satisfactorily establishes their identity and nationality.\n\nADR 10.4. An application which does not meet all the validity requirements for settlement as an Adult Dependent Relative may be rejected as invalid and not considered.",
      "needs_review": false
    },
    {
      "metadata": {
        "source": "Immigration Rules Appendix Adult Dependent Relative",
        "part": "Immigration Rules Appendix Adult Dependent Relative",
        "section_id": "ADR 11.1",
        "section_title": "Suitability requirements for settlement as an Adult Dependent Relative for those with permission to stay as an Adult Dependent Relative",
        "parent_section": "ADR 11",
        "hierarchy_level": 2,
        "topic": "suitability",
        "url": "https://www.gov.uk/guidance/immigration-rules/immigration-rules-appendix-adult-dependent-relative",
        "scraped_at": "2025-12-06T17:26:12.417116"
      },
      "text": "### Suitability requirements for settlement as an Adult Dependent Relative for those with permission to stay as an Adult Dependent Relative\n\nADR 11.1. The applicant must not fall for refusal under Part Suitability.\n\n1.   ADR 11.2. The applicant must not be: \n    1.   (a) in breach of immigration laws, except that where the Exceptions for overstayers section of Part Suitability applies, that period of overstaying will be disregarded; or\n    2.   (b) on immigration bail.\n\nADR 11.3. DELETED.\n\nADR 11.4. The applicant must not fall for refusal under SUI 5.3. of Part Suitability, unless the applicant has completed a qualifying period of 10 years with permission and the applicant has spent at least 5 years with such permission since the end of their sentence.\n\n1.   ADR 11.5. Where any of the following have occurred, the applicant must be refused settlement unless the applicant has completed a continuous qualifying period of 10 years with permission, and has completed 5 years continuous residence with such permission after the date of the first grant of permission after the suitability ground came to the attention of the decision maker: \n    1.   (a) involvement in a sham marriage or civil partnership (SUI 8.1. of Part Suitability); or\n    2.   (b) use of false documents or information or deception (SUI 9.1. and SUI 10.1. of Part Suitability); or\n    3.   (c) litigation debt owed to the Home Office, unless the debt has been paid (SUI 17.1. of Part Suitability); or\n    4.   (d) debt to the NHS, unless the debt has been paid, or the total value of outstanding charges is under £500 (SUI 16.1. of Part Suitability); or\n    5.   (e) the applicant has breached the conditions of their permission (SUI 11.1. of Part Suitability).",
      "summary": "Applicants seeking settlement as an Adult Dependent Relative must meet suitability criteria, including no breach of immigration laws (except certain overstaying), no immigration bail, and a qualified residence period of at least 10 years with 5 years after any sentence. They are also barred if involved in sham marriages, deception, or unpaid debts unless these conditions are remedied, with some exceptions.",
      "augmented_text": "Document: Immigration Rules Appendix Adult Dependent Relative\nPart: Immigration Rules Appendix Adult Dependent Relative\nSection ID: ADR 11.1\nSection: Suitability requirements for settlement as an Adult Dependent Relative for those with permission to stay as an Adult Dependent Relative\nTopic: suitability\n\nSummary: Applicants seeking settlement as an Adult Dependent Relative must meet suitability criteria, including no breach of immigration laws (except certain overstaying), no immigration bail, and a qualified residence period of at least 10 years with 5 years after any sentence. They are also barred if involved in sham marriages, deception, or unpaid debts unless these conditions are remedied, with some exceptions.\n\n### Suitability requirements for settlement as an Adult Dependent Relative for those with permission to stay as an Adult Dependent Relative\n\nADR 11.1. The applicant must not fall for refusal under Part Suitability.\n\n1.   ADR 11.2. The applicant must not be: \n    1.   (a) in breach of immigration laws, except that where the Exceptions for overstayers section of Part Suitability applies, that period of overstaying will be disregarded; or\n    2.   (b) on immigration bail.\n\nADR 11.3. DELETED.\n\nADR 11.4. The applicant must not fall for refusal under SUI 5.3. of Part Suitability, unless the applicant has completed a qualifying period of 10 years with permission and the applicant has spent at least 5 years with such permission since the end of their sentence.\n\n1.   ADR 11.5. Where any of the following have occurred, the applicant must be refused settlement unless the applicant has completed a continuous qualifying period of 10 years with permission, and has completed 5 years continuous residence with such permission after the date of the first grant of permission after the suitability ground came to the attention of the decision maker: \n    1.   (a) involvement in a sham marriage or civil partnership (SUI 8.1. of Part Suitability); or\n    2.   (b) use of false documents or information or deception (SUI 9.1. and SUI 10.1. of Part Suitability); or\n    3.   (c) litigation debt owed to the Home Office, unless the debt has been paid (SUI 17.1. of Part Suitability); or\n    4.   (d) debt to the NHS, unless the debt has been paid, or the total value of outstanding charges is under £500 (SUI 16.1. of Part Suitability); or\n    5.   (e) the applicant has breached the conditions of their permission (SUI 11.1. of Part Suitability).",
      "needs_review": false
    },
    {
      "metadata": {
        "source": "Immigration Rules Appendix Adult Dependent Relative",
        "part": "Immigration Rules Appendix Adult Dependent Relative",
        "section_id": "Eligibility requirements for settlement as an Adult Dependent Relative for those with permission to stay as an Adult Dependent Relative",
        "section_title": "Eligibility requirements for settlement as an Adult Dependent Relative for those with permission to stay as an Adult Dependent Relative",
        "parent_section": null,
        "hierarchy_level": 3,
        "topic": "eligibility",
        "url": "https://www.gov.uk/guidance/immigration-rules/immigration-rules-appendix-adult-dependent-relative",
        "scraped_at": "2025-12-06T17:26:12.417367"
      },
      "text": "### Eligibility requirements for settlement as an Adult Dependent Relative for those with permission to stay as an Adult Dependent Relative",
      "summary": "This provision applies to Adult Dependent Relatives with permission to stay as such, outlining their eligibility for settlement. To qualify, they must demonstrate ongoing dependency and meet specific relationship and accommodation conditions; exceptions are limited and depend on individual circumstances.",
      "augmented_text": "Document: Immigration Rules Appendix Adult Dependent Relative\nPart: Immigration Rules Appendix Adult Dependent Relative\nSection ID: Eligibility requirements for settlement as an Adult Dependent Relative for those with permission to stay as an Adult Dependent Relative\nSection: Eligibility requirements for settlement as an Adult Dependent Relative for those with permission to stay as an Adult Dependent Relative\nTopic: eligibility\n\nSummary: This provision applies to Adult Dependent Relatives with permission to stay as such, outlining their eligibility for settlement. To qualify, they must demonstrate ongoing dependency and meet specific relationship and accommodation conditions; exceptions are limited and depend on individual circumstances.\n\n### Eligibility requirements for settlement as an Adult Dependent Relative for those with permission to stay as an Adult Dependent Relative",
      "needs_review": false
    },
    {
      "metadata": {
        "source": "Immigration Rules Appendix Adult Dependent Relative",
        "part": "Immigration Rules Appendix Adult Dependent Relative",
        "section_id": "1",
        "section_title": "Sponsorship requirement for settlement as an Adult Dependent Relative for those with permission to stay as an Adult Dependent Relative",
        "parent_section": null,
        "hierarchy_level": 1,
        "topic": "settlement",
        "url": "https://www.gov.uk/guidance/immigration-rules/immigration-rules-appendix-adult-dependent-relative",
        "scraped_at": "2025-12-06T17:26:12.417402"
      },
      "text": "### Sponsorship requirement for settlement as an Adult Dependent Relative for those with permission to stay as an Adult Dependent Relative\n\n1.   ADR 12.1. The applicant’s sponsor must be the same sponsor as when the applicant was last granted permission as an Adult Dependent Relative. The sponsor must be in the UK and must be one of the following: \n    1.   (a) a British Citizen; or\n    2.   (b) settled; or\n    3.   (c) have protection status and have, at the same time as the applicant, applied for settlement which is granted; or\n    4.   (d) an EEA national in the UK with limited leave to enter or remain granted under paragraph EU3 of Appendix EU to these rules on the basis of meeting condition 1 in paragraph EU14 of that Appendix and have, at the same time as the applicant, applied for settlement which is granted.",
      "summary": "Applicants seeking settlement as an Adult Dependent Relative must be sponsored by the same qualifying sponsor as when first granted permission. The sponsor must be in the UK and be a British Citizen, settled, have protection status with granted settlement, or be an EEA national with limited leave and granted settlement simultaneously.",
      "augmented_text": "Document: Immigration Rules Appendix Adult Dependent Relative\nPart: Immigration Rules Appendix Adult Dependent Relative\nSection ID: 1\nSection: Sponsorship requirement for settlement as an Adult Dependent Relative for those with permission to stay as an Adult Dependent Relative\nTopic: settlement\n\nSummary: Applicants seeking settlement as an Adult Dependent Relative must be sponsored by the same qualifying sponsor as when first granted permission. The sponsor must be in the UK and be a British Citizen, settled, have protection status with granted settlement, or be an EEA national with limited leave and granted settlement simultaneously.\n\n### Sponsorship requirement for settlement as an Adult Dependent Relative for those with permission to stay as an Adult Dependent Relative\n\n1.   ADR 12.1. The applicant’s sponsor must be the same sponsor as when the applicant was last granted permission as an Adult Dependent Relative. The sponsor must be in the UK and must be one of the following: \n    1.   (a) a British Citizen; or\n    2.   (b) settled; or\n    3.   (c) have protection status and have, at the same time as the applicant, applied for settlement which is granted; or\n    4.   (d) an EEA national in the UK with limited leave to enter or remain granted under paragraph EU3 of Appendix EU to these rules on the basis of meeting condition 1 in paragraph EU14 of that Appendix and have, at the same time as the applicant, applied for settlement which is granted.",
      "needs_review": false
    },
    {
      "metadata": {
        "source": "Immigration Rules Appendix Adult Dependent Relative",
        "part": "Immigration Rules Appendix Adult Dependent Relative",
        "section_id": "ADR 13.1",
        "section_title": "Financial requirement for settlement as an Adult Dependent Relative for those with permission to stay as an Adult Dependent Relative",
        "parent_section": "ADR 13",
        "hierarchy_level": 2,
        "topic": "financial",
        "url": "https://www.gov.uk/guidance/immigration-rules/immigration-rules-appendix-adult-dependent-relative",
        "scraped_at": "2025-12-06T17:26:12.417417"
      },
      "text": "### Financial requirement for settlement as an Adult Dependent Relative for those with permission to stay as an Adult Dependent Relative\n\nADR 13.1. The sponsor must be able to provide adequate maintenance, accommodation and care for the applicant in the UK without reliance on public funds.\n\n1.   ADR 13.2. The sponsor must provide evidence of income or cash savings sufficient to show they can meet the financial requirement and: \n    1.   (a) evidence of income (other than self-employment) or savings must cover the 6 month period immediately before the date of application; or\n    2.   (b) where the sponsor is receiving maternity, paternity, adoption or sick pay, their income from salaried employment can be shown for either the 6 months immediately before the date of application or the start date of the maternity, paternity, adoption or sick leave; or\n    3.   (c) where the income is from self-employment it must be shown for the last full financial year before the date of application, with additional evidence of ongoing employment as in paragraphs 7 or 9 (as relevant) of Appendix FM-SE; or\n    4.   (d) where there is non-employment income it must be shown to have been received in the 12 months before the date of application except where specified in paragraph 10 of Appendix FM-SE; or\n    5.   (e) where property has been sold and the money received has been converted into cash savings the requirements in paragraph 11A(d) of Appendix FM-SE must be met.\n\nADR 13.3. The income or cash savings must be evidenced as specified in paragraphs 1, 12A and 12B of Appendix FM-SE.\n\nADR 13.4. The sponsor must provide a signed maintenance undertaking confirming that the applicant will not have access to public funds, and that the sponsor will be responsible for the maintenance, accommodation and care of the applicant for a period of 5 years from the date of grant under ADR 14.1. or the duration of the period of permission to be granted under ADR 14.4.\n\nADR 13.5. If the applicant receives public funds during the periods set out in ADR 13.4., the UK Government may seek to recover public funds from the sponsor who gave the undertaking.",
      "summary": "This provision applies to sponsors seeking to settle an Adult Dependent Relative in the UK. The sponsor must demonstrate sufficient income or savings to provide adequate maintenance, accommodation, and care without relying on public funds, with specific evidence required based on income type and timing. Exceptions involve income from maternity, paternity, adoption, sick pay, or proceeds from property sales, subject to specific documentation thresholds.",
      "augmented_text": "Document: Immigration Rules Appendix Adult Dependent Relative\nPart: Immigration Rules Appendix Adult Dependent Relative\nSection ID: ADR 13.1\nSection: Financial requirement for settlement as an Adult Dependent Relative for those with permission to stay as an Adult Dependent Relative\nTopic: financial\n\nSummary: This provision applies to sponsors seeking to settle an Adult Dependent Relative in the UK. The sponsor must demonstrate sufficient income or savings to provide adequate maintenance, accommodation, and care without relying on public funds, with specific evidence required based on income type and timing. Exceptions involve income from maternity, paternity, adoption, sick pay, or proceeds from property sales, subject to specific documentation thresholds.\n\n### Financial requirement for settlement as an Adult Dependent Relative for those with permission to stay as an Adult Dependent Relative\n\nADR 13.1. The sponsor must be able to provide adequate maintenance, accommodation and care for the applicant in the UK without reliance on public funds.\n\n1.   ADR 13.2. The sponsor must provide evidence of income or cash savings sufficient to show they can meet the financial requirement and: \n    1.   (a) evidence of income (other than self-employment) or savings must cover the 6 month period immediately before the date of application; or\n    2.   (b) where the sponsor is receiving maternity, paternity, adoption or sick pay, their income from salaried employment can be shown for either the 6 months immediately before the date of application or the start date of the maternity, paternity, adoption or sick leave; or\n    3.   (c) where the income is from self-employment it must be shown for the last full financial year before the date of application, with additional evidence of ongoing employment as in paragraphs 7 or 9 (as relevant) of Appendix FM-SE; or\n    4.   (d) where there is non-employment income it must be shown to have been received in the 12 months before the date of application except where specified in paragraph 10 of Appendix FM-SE; or\n    5.   (e) where property has been sold and the money received has been converted into cash savings the requirements in paragraph 11A(d) of Appendix FM-SE must be met.\n\nADR 13.3. The income or cash savings must be evidenced as specified in paragraphs 1, 12A and 12B of Appendix FM-SE.\n\nADR 13.4. The sponsor must provide a signed maintenance undertaking confirming that the applicant will not have access to public funds, and that the sponsor will be responsible for the maintenance, accommodation and care of the applicant for a period of 5 years from the date of grant under ADR 14.1. or the duration of the period of permission to be granted under ADR 14.4.\n\nADR 13.5. If the applicant receives public funds during the periods set out in ADR 13.4., the UK Government may seek to recover public funds from the sponsor who gave the undertaking.",
      "needs_review": false
    },
    {
      "metadata": {
        "source": "Immigration Rules Appendix Adult Dependent Relative",
        "part": "Immigration Rules Appendix Adult Dependent Relative",
        "section_id": "ADR 14.1",
        "section_title": "Decision on an application for settlement as an Adult Dependent Relative for those with permission to stay as an Adult Dependent Relative",
        "parent_section": "ADR 14",
        "hierarchy_level": 2,
        "topic": "eligibility",
        "url": "https://www.gov.uk/guidance/immigration-rules/immigration-rules-appendix-adult-dependent-relative",
        "scraped_at": "2025-12-06T17:26:12.417429"
      },
      "text": "### Decision on an application for settlement as an Adult Dependent Relative for those with permission to stay as an Adult Dependent Relative\n\nADR 14.1. If the decision maker is satisfied that all the suitability and eligibility requirements for settlement as an Adult Dependent Relative are met, the applicant will be granted settlement.\n\n1.   ADR 14.2. If the requirements for settlement are not met, but the decision maker believes the applicant is likely to meet all the suitability and eligibility requirements for permission to stay as an Adult Dependent Relative, the application will be varied by the Secretary of State to an application for temporary permission to stay as an Adult Dependent Relative, and where this happens: \n    1.   (a) no additional application fee for the application for permission to stay will be required and the settlement application fee will not be refunded; and\n    2.   (b) the Secretary of State will write to the applicant informing them of this variation and will request the applicant pay the required Immigration Health Charge.\n\nADR 14.3. If the applicant does not pay the requested Immigration Health Charge, the application for permission to stay will be rejected as invalid and the applicant will not be refunded the fee paid for the settlement application.\n\nADR 14.4. Where an application is varied and the applicant meets the requirements for permission to stay the applicant will be granted permission to stay which expires on the same date as their sponsor’s permission, or, if the sponsor is a British Citizen or settled in the UK, the applicant will be granted permission for 30 months.\n\n1.   ADR 14.5. If the applicant is granted permission to stay, it will be subject to the following conditions: \n    1.   (a) no access to public funds; and\n    2.   (b) work allowed (including self-employment and voluntary work); and\n    3.   (c) study allowed subject to the ATAS requirement in Appendix ATAS.\n\nADR 14.6. If the decision maker is not satisfied that the applicant meets all the suitability and relevant eligibility requirements for settlement or permission to stay the application for settlement will be refused.\n\nPrint this page",
      "summary": "This provision applies to Adult Dependent Relatives applying for settlement. If they meet all eligibility and suitability criteria, they are granted settlement; otherwise, their application may be varied to a temporary stay, subject to paying the Immigration Health Charge, which is mandatory for the variation. Failure to pay results in application rejection.",
      "augmented_text": "Document: Immigration Rules Appendix Adult Dependent Relative\nPart: Immigration Rules Appendix Adult Dependent Relative\nSection ID: ADR 14.1\nSection: Decision on an application for settlement as an Adult Dependent Relative for those with permission to stay as an Adult Dependent Relative\nTopic: eligibility\n\nSummary: This provision applies to Adult Dependent Relatives applying for settlement. If they meet all eligibility and suitability criteria, they are granted settlement; otherwise, their application may be varied to a temporary stay, subject to paying the Immigration Health Charge, which is mandatory for the variation. Failure to pay results in application rejection.\n\n### Decision on an application for settlement as an Adult Dependent Relative for those with permission to stay as an Adult Dependent Relative\n\nADR 14.1. If the decision maker is satisfied that all the suitability and eligibility requirements for settlement as an Adult Dependent Relative are met, the applicant will be granted settlement.\n\n1.   ADR 14.2. If the requirements for settlement are not met, but the decision maker believes the applicant is likely to meet all the suitability and eligibility requirements for permission to stay as an Adult Dependent Relative, the application will be varied by the Secretary of State to an application for temporary permission to stay as an Adult Dependent Relative, and where this happens: \n    1.   (a) no additional application fee for the application for permission to stay will be required and the settlement application fee will not be refunded; and\n    2.   (b) the Secretary of State will write to the applicant informing them of this variation and will request the applicant pay the required Immigration Health Charge.\n\nADR 14.3. If the applicant does not pay the requested Immigration Health Charge, the application for permission to stay will be rejected as invalid and the applicant will not be refunded the fee paid for the settlement application.\n\nADR 14.4. Where an application is varied and the applicant meets the requirements for permission to stay the applicant will be granted permission to stay which expires on the same date as their sponsor’s permission, or, if the sponsor is a British Citizen or settled in the UK, the applicant will be granted permission for 30 months.\n\n1.   ADR 14.5. If the applicant is granted permission to stay, it will be subject to the following conditions: \n    1.   (a) no access to public funds; and\n    2.   (b) work allowed (including self-employment and voluntary work); and\n    3.   (c) study allowed subject to the ATAS requirement in Appendix ATAS.\n\nADR 14.6. If the decision maker is not satisfied that the applicant meets all the suitability and relevant eligibility requirements for settlement or permission to stay the application for settlement will be refused.\n\nPrint this page",
      "needs_review": false
    }
  ]
}