{
  "url": "https://www.gov.uk/guidance/immigration-rules/immigration-rules-appendix-t5-temporary-worker-international-agreement-worker",
  "part_name": "Appendix Temporary Work - International Agreement",
  "scraped_at": "2025-12-06T17:25:32.223634",
  "chunk_count": 54,
  "chunks": [
    {
      "metadata": {
        "source": "Appendix Temporary Work - International Agreement",
        "part": "Appendix Temporary Work - International Agreement",
        "section_id": "IA 1.1",
        "section_title": "Validity Requirements for the International Agreement route",
        "parent_section": "IA 1",
        "hierarchy_level": 2,
        "topic": "leave-to-enter",
        "url": "https://www.gov.uk/guidance/immigration-rules/immigration-rules-appendix-t5-temporary-worker-international-agreement-worker",
        "scraped_at": "2025-12-06T17:25:32.220271"
      },
      "text": "### Validity Requirements for the International Agreement route\n\nIA 1.1. A person applying for entry clearance or permission to stay on the International Agreement route must apply online on gov.uk on the specified form as follows:\n\n| Applicant | Specified form |\n| --- | --- |\n| EEA national with a chipped passport | Either: •Temporary Worker using the UK Immigration: ID Check app; or • the forms listed below for applicants outside or inside the UK (as relevant) |\n| Applicants outside the UK | Temporary Worker visa |\n| Applicants inside the UK | Temporary Worker |\n\n1.   IA 1.2. An application for entry clearance or permission to stay on the International Agreement route must meet all the following requirements: \n    1.   (a) any fee and Immigration Health Charge must have been paid; and\n    2.   (b) the applicant must have provided biometrics when required; and\n    3.   (c) the applicant must have provided a passport or other travel document which satisfactorily establishes their identity and nationality; and\n    4.   (d) the applicant must have a Certificate of Sponsorship that was issued to them no more than 3 months before the date of application.\n\nIA 1.3. The applicant must be aged 18 or over on the date of application.\n\nIA 1.4. If applying for permission to stay, the applicant must be in the UK on the date of application.\n\nIA 1.4A. If applying for permission to stay, the applicant must have, or have last had, permission on the International Agreement route.\n\nIA 1.5. An application which does not meet all the validity requirements for the International Agreement route may be rejected as invalid and not considered.",
      "summary": "Applicants on the International Agreement route, including EEA nationals and others, must apply online with specific forms, pay fees and the Immigration Health Charge, provide biometrics, a valid travel document, and a recent Certificate of Sponsorship. They must be aged 18 or over, with those applying for permission to stay already in the UK on this route and holding current or previous permission.",
      "augmented_text": "Document: Appendix Temporary Work - International Agreement\nPart: Appendix Temporary Work - International Agreement\nSection ID: IA 1.1\nSection: Validity Requirements for the International Agreement route\nTopic: leave-to-enter\n\nSummary: Applicants on the International Agreement route, including EEA nationals and others, must apply online with specific forms, pay fees and the Immigration Health Charge, provide biometrics, a valid travel document, and a recent Certificate of Sponsorship. They must be aged 18 or over, with those applying for permission to stay already in the UK on this route and holding current or previous permission.\n\n### Validity Requirements for the International Agreement route\n\nIA 1.1. A person applying for entry clearance or permission to stay on the International Agreement route must apply online on gov.uk on the specified form as follows:\n\n| Applicant | Specified form |\n| --- | --- |\n| EEA national with a chipped passport | Either: •Temporary Worker using the UK Immigration: ID Check app; or • the forms listed below for applicants outside or inside the UK (as relevant) |\n| Applicants outside the UK | Temporary Worker visa |\n| Applicants inside the UK | Temporary Worker |\n\n1.   IA 1.2. An application for entry clearance or permission to stay on the International Agreement route must meet all the following requirements: \n    1.   (a) any fee and Immigration Health Charge must have been paid; and\n    2.   (b) the applicant must have provided biometrics when required; and\n    3.   (c) the applicant must have provided a passport or other travel document which satisfactorily establishes their identity and nationality; and\n    4.   (d) the applicant must have a Certificate of Sponsorship that was issued to them no more than 3 months before the date of application.\n\nIA 1.3. The applicant must be aged 18 or over on the date of application.\n\nIA 1.4. If applying for permission to stay, the applicant must be in the UK on the date of application.\n\nIA 1.4A. If applying for permission to stay, the applicant must have, or have last had, permission on the International Agreement route.\n\nIA 1.5. An application which does not meet all the validity requirements for the International Agreement route may be rejected as invalid and not considered.",
      "needs_review": false
    },
    {
      "metadata": {
        "source": "Appendix Temporary Work - International Agreement",
        "part": "Appendix Temporary Work - International Agreement",
        "section_id": "IA 2.1",
        "section_title": "Suitability Requirements for the International Agreement route",
        "parent_section": "IA 2",
        "hierarchy_level": 2,
        "topic": "suitability",
        "url": "https://www.gov.uk/guidance/immigration-rules/immigration-rules-appendix-t5-temporary-worker-international-agreement-worker",
        "scraped_at": "2025-12-06T17:25:32.220535"
      },
      "text": "### Suitability Requirements for the International Agreement route\n\nIA 2.1. The applicant must not fall for refusal under Part Suitability.\n\n1.   IA 2.2. If applying for permission to stay the applicant must not be: \n    1.   (a) in breach of immigration laws, except that where the Exceptions for overstayers section of Part Suitability applies, that period of overstaying will be disregarded; or\n    2.   (b) on immigration bail.",
      "summary": "Applicants applying under the International Agreement route must not breach immigration laws (beyond specified exceptions) or be on immigration bail. They must also meet suitability criteria established under Part Suitability to avoid refusal.",
      "augmented_text": "Document: Appendix Temporary Work - International Agreement\nPart: Appendix Temporary Work - International Agreement\nSection ID: IA 2.1\nSection: Suitability Requirements for the International Agreement route\nTopic: suitability\n\nSummary: Applicants applying under the International Agreement route must not breach immigration laws (beyond specified exceptions) or be on immigration bail. They must also meet suitability criteria established under Part Suitability to avoid refusal.\n\n### Suitability Requirements for the International Agreement route\n\nIA 2.1. The applicant must not fall for refusal under Part Suitability.\n\n1.   IA 2.2. If applying for permission to stay the applicant must not be: \n    1.   (a) in breach of immigration laws, except that where the Exceptions for overstayers section of Part Suitability applies, that period of overstaying will be disregarded; or\n    2.   (b) on immigration bail.",
      "needs_review": false
    },
    {
      "metadata": {
        "source": "Appendix Temporary Work - International Agreement",
        "part": "Appendix Temporary Work - International Agreement",
        "section_id": "Eligibility Requirements for the International Agreement route",
        "section_title": "Eligibility Requirements for the International Agreement route",
        "parent_section": null,
        "hierarchy_level": 2,
        "topic": "eligibility",
        "url": "https://www.gov.uk/guidance/immigration-rules/immigration-rules-appendix-t5-temporary-worker-international-agreement-worker",
        "scraped_at": "2025-12-06T17:25:32.220558"
      },
      "text": "### Eligibility Requirements for the International Agreement route",
      "summary": "This provision applies to applicants seeking entry under the International Agreement route. It requires meeting specific eligibility criteria, including demonstrating a qualifying international agreement, with any relevant exceptions or thresholds specified in the rules.",
      "augmented_text": "Document: Appendix Temporary Work - International Agreement\nPart: Appendix Temporary Work - International Agreement\nSection ID: Eligibility Requirements for the International Agreement route\nSection: Eligibility Requirements for the International Agreement route\nTopic: eligibility\n\nSummary: This provision applies to applicants seeking entry under the International Agreement route. It requires meeting specific eligibility criteria, including demonstrating a qualifying international agreement, with any relevant exceptions or thresholds specified in the rules.\n\n### Eligibility Requirements for the International Agreement route",
      "needs_review": false
    },
    {
      "metadata": {
        "source": "Appendix Temporary Work - International Agreement",
        "part": "Appendix Temporary Work - International Agreement",
        "section_id": "IA 3.1",
        "section_title": "Entry requirement for the International Agreement route",
        "parent_section": "IA 3",
        "hierarchy_level": 2,
        "topic": "leave-to-enter",
        "url": "https://www.gov.uk/guidance/immigration-rules/immigration-rules-appendix-t5-temporary-worker-international-agreement-worker",
        "scraped_at": "2025-12-06T17:25:32.220698"
      },
      "text": "### Entry requirement for the International Agreement route\n\nIA 3.1. A person seeking to come to the UK on the International Agreement route must apply for and obtain entry clearance on the International Agreement route before they arrive in the UK.\n\nIA 3.2. A person applying for entry clearance on the International Agreement route must, if Appendix Tuberculosis applies, provide a valid medical certificate confirming that they have undergone screening for active pulmonary tuberculosis and that this tuberculosis is not present in them.",
      "summary": "Applicants seeking to enter the UK under the International Agreement route must obtain entry clearance before arrival, including a medical certificate confirming tuberculosis screening if applicable.",
      "augmented_text": "Document: Appendix Temporary Work - International Agreement\nPart: Appendix Temporary Work - International Agreement\nSection ID: IA 3.1\nSection: Entry requirement for the International Agreement route\nTopic: leave-to-enter\n\nSummary: Applicants seeking to enter the UK under the International Agreement route must obtain entry clearance before arrival, including a medical certificate confirming tuberculosis screening if applicable.\n\n### Entry requirement for the International Agreement route\n\nIA 3.1. A person seeking to come to the UK on the International Agreement route must apply for and obtain entry clearance on the International Agreement route before they arrive in the UK.\n\nIA 3.2. A person applying for entry clearance on the International Agreement route must, if Appendix Tuberculosis applies, provide a valid medical certificate confirming that they have undergone screening for active pulmonary tuberculosis and that this tuberculosis is not present in them.",
      "needs_review": false
    },
    {
      "metadata": {
        "source": "Appendix Temporary Work - International Agreement",
        "part": "Appendix Temporary Work - International Agreement",
        "section_id": "IA 4.1",
        "section_title": "Sponsorship requirement for the International Agreement route",
        "parent_section": null,
        "hierarchy_level": 1,
        "topic": "sponsorship",
        "url": "https://www.gov.uk/guidance/immigration-rules/immigration-rules-appendix-t5-temporary-worker-international-agreement-worker",
        "scraped_at": "2025-12-06T17:25:32.220767"
      },
      "text": "### Sponsorship requirement for the International Agreement route\n\n1.   IA 4.1. The applicant must have a valid Certificate of Sponsorship for the job they are planning to do; which to be valid must: \n    1.   (a) confirm the applicant’s name, that they are being sponsored on the International Agreement route, details of the job and salary the sponsor is offering them, and that these arrangements comply with the National Minimum Wage; and\n    2.   (b)include a start date, stated by the sponsor, which is no more than three months after the date of application; and\n    3.   (c) not have been used in a previous application which was either granted or refused (but can have been used in a previous application which was rejected as invalid, made void or withdrawn); and\n    4.   (d) not have been withdrawn by the sponsor or cancelled by the Home Office; and\n    5.   (e) include confirmation that the role meets the relevant requirements at IA 6.1, depending on the role; and\n    6.   (f) confirm whether the Academic Technology Approval Scheme (ATAS) requirement in Appendix ATAS applies.\n\nIA 4.2. The sponsor must be authorised by the Home Office to sponsor the job in question under the International Agreement route.\n\nIA 4.3. The sponsor must be listed as A-rated on the Home Office’s register of licensed sponsors, unless the applicant was last granted permission on the International Agreement route and is applying to continue working for the same sponsor as in their last permission.\n\nIA 4.4. The decision maker must not have reasonable grounds to believe the job the applicant is being sponsored to do does not comply with the National Minimum Wage Regulations or the Working Time Regulations.",
      "summary": "Applicants using the International Agreement route must have a valid Certificate of Sponsorship confirming job details, salary, start date within three months, and compliance with wage and role requirements. The sponsor must be authorized by the Home Office, A-rated (unless continuing with the same sponsor), and the sponsorship must not have been previously invalid or withdrawn.",
      "augmented_text": "Document: Appendix Temporary Work - International Agreement\nPart: Appendix Temporary Work - International Agreement\nSection ID: IA 4.1\nSection: Sponsorship requirement for the International Agreement route\nTopic: sponsorship\n\nSummary: Applicants using the International Agreement route must have a valid Certificate of Sponsorship confirming job details, salary, start date within three months, and compliance with wage and role requirements. The sponsor must be authorized by the Home Office, A-rated (unless continuing with the same sponsor), and the sponsorship must not have been previously invalid or withdrawn.\n\n### Sponsorship requirement for the International Agreement route\n\n1.   IA 4.1. The applicant must have a valid Certificate of Sponsorship for the job they are planning to do; which to be valid must: \n    1.   (a) confirm the applicant’s name, that they are being sponsored on the International Agreement route, details of the job and salary the sponsor is offering them, and that these arrangements comply with the National Minimum Wage; and\n    2.   (b)include a start date, stated by the sponsor, which is no more than three months after the date of application; and\n    3.   (c) not have been used in a previous application which was either granted or refused (but can have been used in a previous application which was rejected as invalid, made void or withdrawn); and\n    4.   (d) not have been withdrawn by the sponsor or cancelled by the Home Office; and\n    5.   (e) include confirmation that the role meets the relevant requirements at IA 6.1, depending on the role; and\n    6.   (f) confirm whether the Academic Technology Approval Scheme (ATAS) requirement in Appendix ATAS applies.\n\nIA 4.2. The sponsor must be authorised by the Home Office to sponsor the job in question under the International Agreement route.\n\nIA 4.3. The sponsor must be listed as A-rated on the Home Office’s register of licensed sponsors, unless the applicant was last granted permission on the International Agreement route and is applying to continue working for the same sponsor as in their last permission.\n\nIA 4.4. The decision maker must not have reasonable grounds to believe the job the applicant is being sponsored to do does not comply with the National Minimum Wage Regulations or the Working Time Regulations.",
      "needs_review": false
    },
    {
      "metadata": {
        "source": "Appendix Temporary Work - International Agreement",
        "part": "Appendix Temporary Work - International Agreement",
        "section_id": "IA 5.1",
        "section_title": "Genuineness requirement for the International Agreement route",
        "parent_section": null,
        "hierarchy_level": 1,
        "topic": "eligibility",
        "url": "https://www.gov.uk/guidance/immigration-rules/immigration-rules-appendix-t5-temporary-worker-international-agreement-worker",
        "scraped_at": "2025-12-06T17:25:32.220809"
      },
      "text": "### Genuineness requirement for the International Agreement route\n\n1.   IA 5.1. The applicant must: \n    1.   (a) genuinely intend to, and be able to, undertake the role for which they are sponsored; and\n    2.   (b) not intend to undertake employment other than in the role for which they are being sponsored, or as otherwise permitted by paragraph IA14.7.",
      "summary": "Applicants applying under the International Agreement route must genuinely intend and be able to perform their sponsored role, without plans to undertake unrelated employment unless explicitly permitted. They must adhere strictly to the role for which they are sponsored, with limited exceptions.",
      "augmented_text": "Document: Appendix Temporary Work - International Agreement\nPart: Appendix Temporary Work - International Agreement\nSection ID: IA 5.1\nSection: Genuineness requirement for the International Agreement route\nTopic: eligibility\n\nSummary: Applicants applying under the International Agreement route must genuinely intend and be able to perform their sponsored role, without plans to undertake unrelated employment unless explicitly permitted. They must adhere strictly to the role for which they are sponsored, with limited exceptions.\n\n### Genuineness requirement for the International Agreement route\n\n1.   IA 5.1. The applicant must: \n    1.   (a) genuinely intend to, and be able to, undertake the role for which they are sponsored; and\n    2.   (b) not intend to undertake employment other than in the role for which they are being sponsored, or as otherwise permitted by paragraph IA14.7.",
      "needs_review": false
    },
    {
      "metadata": {
        "source": "Appendix Temporary Work - International Agreement",
        "part": "Appendix Temporary Work - International Agreement",
        "section_id": "IA 5.1A",
        "section_title": "ATAS requirement for the International Agreement route",
        "parent_section": "IA 5",
        "hierarchy_level": 2,
        "topic": "eligibility",
        "url": "https://www.gov.uk/guidance/immigration-rules/immigration-rules-appendix-t5-temporary-worker-international-agreement-worker",
        "scraped_at": "2025-12-06T17:25:32.220847"
      },
      "text": "### ATAS requirement for the International Agreement route\n\nIA 5.1A. If the ATAS requirement in Appendix ATAS applies, the applicant must provide a valid ATAS certificate.",
      "summary": "Applicants using the International Agreement route must obtain and submit a valid ATAS certificate if the ATAS requirement applies, with no specified exceptions or thresholds.",
      "augmented_text": "Document: Appendix Temporary Work - International Agreement\nPart: Appendix Temporary Work - International Agreement\nSection ID: IA 5.1A\nSection: ATAS requirement for the International Agreement route\nTopic: eligibility\n\nSummary: Applicants using the International Agreement route must obtain and submit a valid ATAS certificate if the ATAS requirement applies, with no specified exceptions or thresholds.\n\n### ATAS requirement for the International Agreement route\n\nIA 5.1A. If the ATAS requirement in Appendix ATAS applies, the applicant must provide a valid ATAS certificate.",
      "needs_review": false
    },
    {
      "metadata": {
        "source": "Appendix Temporary Work - International Agreement",
        "part": "Appendix Temporary Work - International Agreement",
        "section_id": "IA 6.1",
        "section_title": "International Agreement requirement",
        "parent_section": null,
        "hierarchy_level": 1,
        "topic": "eligibility",
        "url": "https://www.gov.uk/guidance/immigration-rules/immigration-rules-appendix-t5-temporary-worker-international-agreement-worker",
        "scraped_at": "2025-12-06T17:25:32.220887"
      },
      "text": "### International Agreement requirement\n\n1.   IA 6.1. The role the applicant is applying to do must be as one of the following (and the applicant must also meet the specific requirements for that work): \n    1.   (a) a private servant in a diplomatic household; or\n    2.   (b) an employee of an overseas government or other international organisation established under an international treaty signed by UK.\n    3.   (c) DELETED.",
      "summary": "This provision applies to applicants seeking roles under UK International Agreement categories. They must be engaging in specific jobs—such as private servants in diplomatic households or employees of overseas governments or international organizations—and meet particular requirements for these roles. The roles are limited to those explicitly listed, with some provisions deleted or no longer applicable.",
      "augmented_text": "Document: Appendix Temporary Work - International Agreement\nPart: Appendix Temporary Work - International Agreement\nSection ID: IA 6.1\nSection: International Agreement requirement\nTopic: eligibility\n\nSummary: This provision applies to applicants seeking roles under UK International Agreement categories. They must be engaging in specific jobs—such as private servants in diplomatic households or employees of overseas governments or international organizations—and meet particular requirements for these roles. The roles are limited to those explicitly listed, with some provisions deleted or no longer applicable.\n\n### International Agreement requirement\n\n1.   IA 6.1. The role the applicant is applying to do must be as one of the following (and the applicant must also meet the specific requirements for that work): \n    1.   (a) a private servant in a diplomatic household; or\n    2.   (b) an employee of an overseas government or other international organisation established under an international treaty signed by UK.\n    3.   (c) DELETED.",
      "needs_review": false
    },
    {
      "metadata": {
        "source": "Appendix Temporary Work - International Agreement",
        "part": "Appendix Temporary Work - International Agreement",
        "section_id": "IA 7.1",
        "section_title": "Private servant in diplomatic household requirements",
        "parent_section": null,
        "hierarchy_level": 1,
        "topic": "eligibility",
        "url": "https://www.gov.uk/guidance/immigration-rules/immigration-rules-appendix-t5-temporary-worker-international-agreement-worker",
        "scraped_at": "2025-12-06T17:25:32.220931"
      },
      "text": "### Private servant in diplomatic household requirements\n\n1.   IA 7.1. The applicant must be employed as a private servant by, and in the household of, either: \n    1.   (a) a named member of staff of a diplomatic or consular mission who has diplomatic privileges and immunity as defined by the Vienna Convention on Diplomatic Relations; or\n    2.   (b) a named official employed by an international organisation recognised by the UK government with diplomatic privileges or immunities under UK or international law.\n\n2.   IA 7.2. DELETED.\n\nIA 7.3. The applicant must not intend to undertake any other role for the sponsor other than as a private servant in the specified household.\n\nIA 7.4. The applicant must intend to work full time in the role they are being sponsored for.\n\nIA 7.5. The applicant must not be a relative of the employer, or employer’s spouse, either by blood or by marriage (including but not limited to, the spouse or unmarried partner, child, parent, grandparent or sibling of either the employer or the employer’s spouse).\n\nIA 7.6. DELETED\n\nIA 7.7. The applicant must be paid at least the level of the National Minimum Wage throughout their stay.\n\nIA 7.8. The applicant must provide the evidence of employment terms and conditions as set out in Appendix Domestic Worker Statement.\n\nIA 7.9. The applicant must provide a signed statement from the sponsor confirming that the role will not constitute work done in relation to the employer’s family household within the meaning of regulation 57 of the National Minimum Wage Regulations 2015.\n\nIA 7.10. Where the application is for permission to stay, they must provide evidence of payment of salary for no less than 3 months prior to the date of application. Evidence must be submitted in accordance with Appendix Finance.",
      "summary": "This provision applies to applicants employed as private servants in diplomatic or international organization households. They must work full-time, exclusively in that role, not be relatives of the employer, and be paid at least the minimum wage. Evidence of employment terms and a sponsor’s confirmation are required.",
      "augmented_text": "Document: Appendix Temporary Work - International Agreement\nPart: Appendix Temporary Work - International Agreement\nSection ID: IA 7.1\nSection: Private servant in diplomatic household requirements\nTopic: eligibility\n\nSummary: This provision applies to applicants employed as private servants in diplomatic or international organization households. They must work full-time, exclusively in that role, not be relatives of the employer, and be paid at least the minimum wage. Evidence of employment terms and a sponsor’s confirmation are required.\n\n### Private servant in diplomatic household requirements\n\n1.   IA 7.1. The applicant must be employed as a private servant by, and in the household of, either: \n    1.   (a) a named member of staff of a diplomatic or consular mission who has diplomatic privileges and immunity as defined by the Vienna Convention on Diplomatic Relations; or\n    2.   (b) a named official employed by an international organisation recognised by the UK government with diplomatic privileges or immunities under UK or international law.\n\n2.   IA 7.2. DELETED.\n\nIA 7.3. The applicant must not intend to undertake any other role for the sponsor other than as a private servant in the specified household.\n\nIA 7.4. The applicant must intend to work full time in the role they are being sponsored for.\n\nIA 7.5. The applicant must not be a relative of the employer, or employer’s spouse, either by blood or by marriage (including but not limited to, the spouse or unmarried partner, child, parent, grandparent or sibling of either the employer or the employer’s spouse).\n\nIA 7.6. DELETED\n\nIA 7.7. The applicant must be paid at least the level of the National Minimum Wage throughout their stay.\n\nIA 7.8. The applicant must provide the evidence of employment terms and conditions as set out in Appendix Domestic Worker Statement.\n\nIA 7.9. The applicant must provide a signed statement from the sponsor confirming that the role will not constitute work done in relation to the employer’s family household within the meaning of regulation 57 of the National Minimum Wage Regulations 2015.\n\nIA 7.10. Where the application is for permission to stay, they must provide evidence of payment of salary for no less than 3 months prior to the date of application. Evidence must be submitted in accordance with Appendix Finance.",
      "needs_review": false
    },
    {
      "metadata": {
        "source": "Appendix Temporary Work - International Agreement",
        "part": "Appendix Temporary Work - International Agreement",
        "section_id": "IA 7.11",
        "section_title": "English language requirement for a private servant in a diplomatic household",
        "parent_section": "IA 7",
        "hierarchy_level": 2,
        "topic": "english-language",
        "url": "https://www.gov.uk/guidance/immigration-rules/immigration-rules-appendix-t5-temporary-worker-international-agreement-worker",
        "scraped_at": "2025-12-06T17:25:32.220958"
      },
      "text": "### English language requirement for a private servant in a diplomatic household\n\nIA 7.11. Where the application is for entry clearance, the applicant must show English language ability on the Common European Framework of Reference for Languages in all 4 components (reading, writing, speaking and listening) of at least B1 (intermediate).\n\nIA 7.12. The applicant must show they meet the English language requirement as specified in Appendix English Language.",
      "summary": "This provision applies to private servants in diplomatic households applying for entry clearance. They must demonstrate at least B1 level English across all four components (reading, writing, speaking, listening) per the Common European Framework. No exceptions or thresholds beyond meeting the B1 requirement are specified.",
      "augmented_text": "Document: Appendix Temporary Work - International Agreement\nPart: Appendix Temporary Work - International Agreement\nSection ID: IA 7.11\nSection: English language requirement for a private servant in a diplomatic household\nTopic: english-language\n\nSummary: This provision applies to private servants in diplomatic households applying for entry clearance. They must demonstrate at least B1 level English across all four components (reading, writing, speaking, listening) per the Common European Framework. No exceptions or thresholds beyond meeting the B1 requirement are specified.\n\n### English language requirement for a private servant in a diplomatic household\n\nIA 7.11. Where the application is for entry clearance, the applicant must show English language ability on the Common European Framework of Reference for Languages in all 4 components (reading, writing, speaking and listening) of at least B1 (intermediate).\n\nIA 7.12. The applicant must show they meet the English language requirement as specified in Appendix English Language.",
      "needs_review": false
    },
    {
      "metadata": {
        "source": "Appendix Temporary Work - International Agreement",
        "part": "Appendix Temporary Work - International Agreement",
        "section_id": "IA 8.1",
        "section_title": "Employee of an overseas government or other international organisation requirement",
        "parent_section": "IA 8",
        "hierarchy_level": 2,
        "topic": "eligibility",
        "url": "https://www.gov.uk/guidance/immigration-rules/immigration-rules-appendix-t5-temporary-worker-international-agreement-worker",
        "scraped_at": "2025-12-06T17:25:32.221013"
      },
      "text": "### Employee of an overseas government or other international organisation requirement\n\nIA 8.1. The applicant must be under a contract of employment with the overseas government or international organisation.\n\nIA 8.1A. Where the applicant is, or will be, working on a contract basis (being supplied as labour from one organisation to another), the decision maker must be satisfied that the applicant will not be filling a permanent position, including on a temporary basis.\n\nIA 8.2. The applicant must not intend to take any other form of role for the sponsor other than that for which the Certificate of Sponsorship was assigned.\n\nIA 8.3. The applicant must not be working as a private servant in a diplomatic household or as a domestic worker in a private household.",
      "summary": "This provision applies to employees of overseas governments or international organizations seeking UK immigration. Applicants must have a valid employment contract with such entities, not intend to work outside their assigned role, and not work as private servants or domestic workers. Additionally, contract staff working on a temporary, non-permanent basis must be satisfied to not fill permanent roles.",
      "augmented_text": "Document: Appendix Temporary Work - International Agreement\nPart: Appendix Temporary Work - International Agreement\nSection ID: IA 8.1\nSection: Employee of an overseas government or other international organisation requirement\nTopic: eligibility\n\nSummary: This provision applies to employees of overseas governments or international organizations seeking UK immigration. Applicants must have a valid employment contract with such entities, not intend to work outside their assigned role, and not work as private servants or domestic workers. Additionally, contract staff working on a temporary, non-permanent basis must be satisfied to not fill permanent roles.\n\n### Employee of an overseas government or other international organisation requirement\n\nIA 8.1. The applicant must be under a contract of employment with the overseas government or international organisation.\n\nIA 8.1A. Where the applicant is, or will be, working on a contract basis (being supplied as labour from one organisation to another), the decision maker must be satisfied that the applicant will not be filling a permanent position, including on a temporary basis.\n\nIA 8.2. The applicant must not intend to take any other form of role for the sponsor other than that for which the Certificate of Sponsorship was assigned.\n\nIA 8.3. The applicant must not be working as a private servant in a diplomatic household or as a domestic worker in a private household.",
      "needs_review": false
    },
    {
      "metadata": {
        "source": "Appendix Temporary Work - International Agreement",
        "part": "Appendix Temporary Work - International Agreement",
        "section_id": "IA 9.1",
        "section_title": "Contractual Service Supplier requirement",
        "parent_section": "IA 9",
        "hierarchy_level": 2,
        "topic": "eligibility",
        "url": "https://www.gov.uk/guidance/immigration-rules/immigration-rules-appendix-t5-temporary-worker-international-agreement-worker",
        "scraped_at": "2025-12-06T17:25:32.221053"
      },
      "text": "### Contractual Service Supplier requirement\n\nIA 9.1. DELETED.\n\nIA 9.2. DELETED.\n\nIA 9.3. DELETED.\n\nIA 9.4. DELETED.\n\nIA 9.5. DELETED.\n\nIA 9.6. DELETED.\n\nIA 9.7. DELETED.\n\nIA 9.8. DELETED.\n\nIA 9.9. DELETED\n\nIA 9.10. DELETED.",
      "summary": "This provision applies to Contractual Service Suppliers under International Agreements, requiring them to meet specified criteria. The key obligation involves adhering to relevant contractual and licensing conditions; however, specific requirements have been deleted, indicating they may be governed by other provisions or agreements. Critical conditions or thresholds are not detailed in this excerpt.",
      "augmented_text": "Document: Appendix Temporary Work - International Agreement\nPart: Appendix Temporary Work - International Agreement\nSection ID: IA 9.1\nSection: Contractual Service Supplier requirement\nTopic: eligibility\n\nSummary: This provision applies to Contractual Service Suppliers under International Agreements, requiring them to meet specified criteria. The key obligation involves adhering to relevant contractual and licensing conditions; however, specific requirements have been deleted, indicating they may be governed by other provisions or agreements. Critical conditions or thresholds are not detailed in this excerpt.\n\n### Contractual Service Supplier requirement\n\nIA 9.1. DELETED.\n\nIA 9.2. DELETED.\n\nIA 9.3. DELETED.\n\nIA 9.4. DELETED.\n\nIA 9.5. DELETED.\n\nIA 9.6. DELETED.\n\nIA 9.7. DELETED.\n\nIA 9.8. DELETED.\n\nIA 9.9. DELETED\n\nIA 9.10. DELETED.",
      "needs_review": false
    },
    {
      "metadata": {
        "source": "Appendix Temporary Work - International Agreement",
        "part": "Appendix Temporary Work - International Agreement",
        "section_id": "IA 10.1",
        "section_title": "Independent Professional requirement",
        "parent_section": "IA 10",
        "hierarchy_level": 2,
        "topic": "eligibility",
        "url": "https://www.gov.uk/guidance/immigration-rules/immigration-rules-appendix-t5-temporary-worker-international-agreement-worker",
        "scraped_at": "2025-12-06T17:25:32.221091"
      },
      "text": "### Independent Professional requirement\n\nIA 10.1. DELETED.\n\nIA 10.2. DELETED.\n\nIA 10.3. DELETED.\n\nIA 10.4. DELETED.\n\nIA 10.5. DELETED.\n\nIA 10.6. DELETED.\n\nIA 10.7. DELETED.\n\nIA 10.8 DELETED.",
      "summary": "This provision applies to applicants seeking entry under the International Agreement route, requiring them to be recognized as independent professionals. They must meet certain criteria confirming their independence and professional status, with specific conditions likely detailed elsewhere; no additional details are provided here.",
      "augmented_text": "Document: Appendix Temporary Work - International Agreement\nPart: Appendix Temporary Work - International Agreement\nSection ID: IA 10.1\nSection: Independent Professional requirement\nTopic: eligibility\n\nSummary: This provision applies to applicants seeking entry under the International Agreement route, requiring them to be recognized as independent professionals. They must meet certain criteria confirming their independence and professional status, with specific conditions likely detailed elsewhere; no additional details are provided here.\n\n### Independent Professional requirement\n\nIA 10.1. DELETED.\n\nIA 10.2. DELETED.\n\nIA 10.3. DELETED.\n\nIA 10.4. DELETED.\n\nIA 10.5. DELETED.\n\nIA 10.6. DELETED.\n\nIA 10.7. DELETED.\n\nIA 10.8 DELETED.",
      "needs_review": false
    },
    {
      "metadata": {
        "source": "Appendix Temporary Work - International Agreement",
        "part": "Appendix Temporary Work - International Agreement",
        "section_id": "IA 11.1",
        "section_title": "Financial Requirement for the International Agreement route",
        "parent_section": "IA 11",
        "hierarchy_level": 2,
        "topic": "financial",
        "url": "https://www.gov.uk/guidance/immigration-rules/immigration-rules-appendix-t5-temporary-worker-international-agreement-worker",
        "scraped_at": "2025-12-06T17:25:32.221125"
      },
      "text": "### Financial Requirement for the International Agreement route\n\nIA 11.1. If the applicant is applying for permission to stay and has been in the UK with permission for 12 months or longer on the date of application, they will meet the financial requirement and do not need to show funds.\n\n1.   IA 11.2. If the applicant is applying for entry clearance, or is applying for permission to stay and has been in the UK for less than 12 months on the date of application, either: \n    1.   (a) the applicant must have funds of at least £1,270; or\n    2.   (b) the applicant’s A rated sponsor must confirm on the Certificate of Sponsorship that they will, if it is necessary, maintain and accommodate the applicant up to the end of the first month of their employment for an amount of at least £1,270.\n\nIA 11.3. If IA 11.2. applies, the applicant must show that they have held the required level of funds for a 28-day period and as specified in Appendix Finance.",
      "summary": "Applicants applying for permission to stay after being in the UK for 12 months or more do not need to show funds. Those with less than 12 months' residence must demonstrate or have a sponsor confirm at least £1,270 in funds, maintained for 28 days, unless they already meet the 12-month residence condition.",
      "augmented_text": "Document: Appendix Temporary Work - International Agreement\nPart: Appendix Temporary Work - International Agreement\nSection ID: IA 11.1\nSection: Financial Requirement for the International Agreement route\nTopic: financial\n\nSummary: Applicants applying for permission to stay after being in the UK for 12 months or more do not need to show funds. Those with less than 12 months' residence must demonstrate or have a sponsor confirm at least £1,270 in funds, maintained for 28 days, unless they already meet the 12-month residence condition.\n\n### Financial Requirement for the International Agreement route\n\nIA 11.1. If the applicant is applying for permission to stay and has been in the UK with permission for 12 months or longer on the date of application, they will meet the financial requirement and do not need to show funds.\n\n1.   IA 11.2. If the applicant is applying for entry clearance, or is applying for permission to stay and has been in the UK for less than 12 months on the date of application, either: \n    1.   (a) the applicant must have funds of at least £1,270; or\n    2.   (b) the applicant’s A rated sponsor must confirm on the Certificate of Sponsorship that they will, if it is necessary, maintain and accommodate the applicant up to the end of the first month of their employment for an amount of at least £1,270.\n\nIA 11.3. If IA 11.2. applies, the applicant must show that they have held the required level of funds for a 28-day period and as specified in Appendix Finance.",
      "needs_review": false
    },
    {
      "metadata": {
        "source": "Appendix Temporary Work - International Agreement",
        "part": "Appendix Temporary Work - International Agreement",
        "section_id": "IA 13.1",
        "section_title": "Decision on an application on the International Agreement route",
        "parent_section": "IA 13",
        "hierarchy_level": 2,
        "topic": "eligibility",
        "url": "https://www.gov.uk/guidance/immigration-rules/immigration-rules-appendix-t5-temporary-worker-international-agreement-worker",
        "scraped_at": "2025-12-06T17:25:32.221147"
      },
      "text": "### Decision on an application on the International Agreement route\n\nIA 13.1. If the decision maker is satisfied that all the suitability and eligibility requirements for the International Agreement route are met, the application will be granted, otherwise the application will be refused.\n\nIA 13.2. If the application is refused, the person can apply for an Administrative Review under Appendix AR: Administrative Review.",
      "summary": "This provision applies to applicants seeking entry via the International Agreement route. It requires the decision-maker to verify all suitability and eligibility criteria; if met, the application is granted, otherwise refused. Applicants can request an Administrative Review if refused.",
      "augmented_text": "Document: Appendix Temporary Work - International Agreement\nPart: Appendix Temporary Work - International Agreement\nSection ID: IA 13.1\nSection: Decision on an application on the International Agreement route\nTopic: eligibility\n\nSummary: This provision applies to applicants seeking entry via the International Agreement route. It requires the decision-maker to verify all suitability and eligibility criteria; if met, the application is granted, otherwise refused. Applicants can request an Administrative Review if refused.\n\n### Decision on an application on the International Agreement route\n\nIA 13.1. If the decision maker is satisfied that all the suitability and eligibility requirements for the International Agreement route are met, the application will be granted, otherwise the application will be refused.\n\nIA 13.2. If the application is refused, the person can apply for an Administrative Review under Appendix AR: Administrative Review.",
      "needs_review": false
    },
    {
      "metadata": {
        "source": "Appendix Temporary Work - International Agreement",
        "part": "Appendix Temporary Work - International Agreement",
        "section_id": "IA 14.1",
        "section_title": "Period of grant for the International Agreement route",
        "parent_section": "IA 14",
        "hierarchy_level": 2,
        "topic": "leave-to-enter",
        "url": "https://www.gov.uk/guidance/immigration-rules/immigration-rules-appendix-t5-temporary-worker-international-agreement-worker",
        "scraped_at": "2025-12-06T17:25:32.221205"
      },
      "text": "### Period of grant for the International Agreement route\n\nIA 14.1. DELETED.\n\nIA 14.2. DELETED.\n\n1.   IA 14.3. If the application is for entry clearance, the applicant will be granted whichever is the shorter of: \n    1.   (a) the period of the role on the Certificate of Sponsorship plus 14 days before and 14 days after that period; or\n    2.   (b) 24 months.\n\n1.   IA 14.4. If the applicant is an employee of an overseas government or other international organisation and their application is for permission to stay, the applicant will be granted whichever is the shorter of: \n    1.   (a) the period of the role on the Certificate of Sponsorship plus 14 days after that period; or\n    2.   (b) the difference between 24 months and the period they have already been granted permission on the International Agreement route.\n\n1.   IA 14.5. If the applicant is a private servant in a diplomatic household and their application is for permission to stay, the applicant will be granted whichever is the shorter of: \n    1.   (a) the period of the role on the Certificate of Sponsorship plus 14 days after that period; or\n    2.   (b) 24 months; or\n    3.   (c) the difference between five years and the period they have already been granted permission on the International Agreement route.\n\nIA 14.6. DELETED.",
      "summary": "This provision applies to applicants under the International Agreement route seeking entry clearance or permission to stay. The grant period is limited to the shorter of specified durations—such as the role’s length plus 14 days, up to 24 months, or other thresholds depending on the applicant’s status—ensuring time restrictions based on role duration and prior permissions.",
      "augmented_text": "Document: Appendix Temporary Work - International Agreement\nPart: Appendix Temporary Work - International Agreement\nSection ID: IA 14.1\nSection: Period of grant for the International Agreement route\nTopic: leave-to-enter\n\nSummary: This provision applies to applicants under the International Agreement route seeking entry clearance or permission to stay. The grant period is limited to the shorter of specified durations—such as the role’s length plus 14 days, up to 24 months, or other thresholds depending on the applicant’s status—ensuring time restrictions based on role duration and prior permissions.\n\n### Period of grant for the International Agreement route\n\nIA 14.1. DELETED.\n\nIA 14.2. DELETED.\n\n1.   IA 14.3. If the application is for entry clearance, the applicant will be granted whichever is the shorter of: \n    1.   (a) the period of the role on the Certificate of Sponsorship plus 14 days before and 14 days after that period; or\n    2.   (b) 24 months.\n\n1.   IA 14.4. If the applicant is an employee of an overseas government or other international organisation and their application is for permission to stay, the applicant will be granted whichever is the shorter of: \n    1.   (a) the period of the role on the Certificate of Sponsorship plus 14 days after that period; or\n    2.   (b) the difference between 24 months and the period they have already been granted permission on the International Agreement route.\n\n1.   IA 14.5. If the applicant is a private servant in a diplomatic household and their application is for permission to stay, the applicant will be granted whichever is the shorter of: \n    1.   (a) the period of the role on the Certificate of Sponsorship plus 14 days after that period; or\n    2.   (b) 24 months; or\n    3.   (c) the difference between five years and the period they have already been granted permission on the International Agreement route.\n\nIA 14.6. DELETED.",
      "needs_review": false
    },
    {
      "metadata": {
        "source": "Appendix Temporary Work - International Agreement",
        "part": "Appendix Temporary Work - International Agreement",
        "section_id": "1",
        "section_title": "Conditions of grant on the International Agreement route",
        "parent_section": null,
        "hierarchy_level": 1,
        "topic": "financial",
        "url": "https://www.gov.uk/guidance/immigration-rules/immigration-rules-appendix-t5-temporary-worker-international-agreement-worker",
        "scraped_at": "2025-12-06T17:25:32.221259"
      },
      "text": "### Conditions of grant on the International Agreement route\n\n1.   IA 14.7. The grant will be subject to all the following conditions: \n    1.   (a) no access to public funds; and\n    2.   (b) the only work permitted is \n        1.   (i) the job the applicant is being sponsored for; and\n        2.   (ii) supplementary employment only for a person being sponsored for a job as an employee of overseas governments or international organisations (but not as a private servant in a diplomatic household) and only provided the job in (i) is also being done.\n\n    3.   (c) study is permitted, subject to the ATAS condition in Appendix ATAS.\n    4.   (d) DELETED.\n\nIA 14.8. If the applicant is being sponsored as a private servant in a diplomatic household, IA 14.7.(b) does not prevent them from taking employment as a domestic worker in a different household from the one specified in the Certificate of Sponsorship.",
      "summary": "Applicants under the International Agreement route must not access public funds, work only in their sponsored role or supplementary employment for overseas government/organization employees (not private servants), and may study with ATAS clearance. Private servants can work as domestic workers elsewhere, despite these conditions.",
      "augmented_text": "Document: Appendix Temporary Work - International Agreement\nPart: Appendix Temporary Work - International Agreement\nSection ID: 1\nSection: Conditions of grant on the International Agreement route\nTopic: financial\n\nSummary: Applicants under the International Agreement route must not access public funds, work only in their sponsored role or supplementary employment for overseas government/organization employees (not private servants), and may study with ATAS clearance. Private servants can work as domestic workers elsewhere, despite these conditions.\n\n### Conditions of grant on the International Agreement route\n\n1.   IA 14.7. The grant will be subject to all the following conditions: \n    1.   (a) no access to public funds; and\n    2.   (b) the only work permitted is \n        1.   (i) the job the applicant is being sponsored for; and\n        2.   (ii) supplementary employment only for a person being sponsored for a job as an employee of overseas governments or international organisations (but not as a private servant in a diplomatic household) and only provided the job in (i) is also being done.\n\n    3.   (c) study is permitted, subject to the ATAS condition in Appendix ATAS.\n    4.   (d) DELETED.\n\nIA 14.8. If the applicant is being sponsored as a private servant in a diplomatic household, IA 14.7.(b) does not prevent them from taking employment as a domestic worker in a different household from the one specified in the Certificate of Sponsorship.",
      "needs_review": false
    },
    {
      "metadata": {
        "source": "Appendix Temporary Work - International Agreement",
        "part": "Appendix Temporary Work - International Agreement",
        "section_id": "Settlement by a Private Servant in a diplomatic household",
        "section_title": "Settlement by a Private Servant in a diplomatic household",
        "parent_section": null,
        "hierarchy_level": 2,
        "topic": "settlement",
        "url": "https://www.gov.uk/guidance/immigration-rules/immigration-rules-appendix-t5-temporary-worker-international-agreement-worker",
        "scraped_at": "2025-12-06T17:25:32.221287"
      },
      "text": "### Settlement by a Private Servant in a diplomatic household",
      "summary": "This provision applies to private servants working in diplomatic households seeking settlement. It requires them to demonstrate continuous lawful residence and employment, with specific thresholds for employment duration, and may be subject to exceptions or additional criteria.",
      "augmented_text": "Document: Appendix Temporary Work - International Agreement\nPart: Appendix Temporary Work - International Agreement\nSection ID: Settlement by a Private Servant in a diplomatic household\nSection: Settlement by a Private Servant in a diplomatic household\nTopic: settlement\n\nSummary: This provision applies to private servants working in diplomatic households seeking settlement. It requires them to demonstrate continuous lawful residence and employment, with specific thresholds for employment duration, and may be subject to exceptions or additional criteria.\n\n### Settlement by a Private Servant in a diplomatic household",
      "needs_review": false
    },
    {
      "metadata": {
        "source": "Appendix Temporary Work - International Agreement",
        "part": "Appendix Temporary Work - International Agreement",
        "section_id": "IA 15.1",
        "section_title": "Validity requirements for settlement by a Private Servant in a diplomatic household",
        "parent_section": "IA 15",
        "hierarchy_level": 2,
        "topic": "settlement",
        "url": "https://www.gov.uk/guidance/immigration-rules/immigration-rules-appendix-t5-temporary-worker-international-agreement-worker",
        "scraped_at": "2025-12-06T17:25:32.221323"
      },
      "text": "### Validity requirements for settlement by a Private Servant in a diplomatic household\n\nIA 15.1. DELETED.\n\nIA 15.2. DELETED.\n\nIA 15.3. DELETED.\n\nIA 15.4. DELETED.",
      "summary": "This provision concerns private servants in diplomatic households seeking settlement. It outlines the validity requirements they must meet, with specific conditions and thresholds for eligibility, though the detailed criteria are deleted from the current document.",
      "augmented_text": "Document: Appendix Temporary Work - International Agreement\nPart: Appendix Temporary Work - International Agreement\nSection ID: IA 15.1\nSection: Validity requirements for settlement by a Private Servant in a diplomatic household\nTopic: settlement\n\nSummary: This provision concerns private servants in diplomatic households seeking settlement. It outlines the validity requirements they must meet, with specific conditions and thresholds for eligibility, though the detailed criteria are deleted from the current document.\n\n### Validity requirements for settlement by a Private Servant in a diplomatic household\n\nIA 15.1. DELETED.\n\nIA 15.2. DELETED.\n\nIA 15.3. DELETED.\n\nIA 15.4. DELETED.",
      "needs_review": false
    },
    {
      "metadata": {
        "source": "Appendix Temporary Work - International Agreement",
        "part": "Appendix Temporary Work - International Agreement",
        "section_id": "IA 16.1",
        "section_title": "Suitability Requirements for settlement as a Private Servant in a diplomatic household",
        "parent_section": "IA 16",
        "hierarchy_level": 2,
        "topic": "suitability",
        "url": "https://www.gov.uk/guidance/immigration-rules/immigration-rules-appendix-t5-temporary-worker-international-agreement-worker",
        "scraped_at": "2025-12-06T17:25:32.221349"
      },
      "text": "### Suitability Requirements for settlement as a Private Servant in a diplomatic household\n\nIA 16.1. DELETED.\n\nIA 16.2. DELETED.",
      "summary": "This provision applies to private servants seeking settlement in diplomatic households. It requires they meet suitability criteria, with specific conditions and exceptions outlined in the full regulation. The section emphasizes the importance of assessing their eligibility before settlement.",
      "augmented_text": "Document: Appendix Temporary Work - International Agreement\nPart: Appendix Temporary Work - International Agreement\nSection ID: IA 16.1\nSection: Suitability Requirements for settlement as a Private Servant in a diplomatic household\nTopic: suitability\n\nSummary: This provision applies to private servants seeking settlement in diplomatic households. It requires they meet suitability criteria, with specific conditions and exceptions outlined in the full regulation. The section emphasizes the importance of assessing their eligibility before settlement.\n\n### Suitability Requirements for settlement as a Private Servant in a diplomatic household\n\nIA 16.1. DELETED.\n\nIA 16.2. DELETED.",
      "needs_review": false
    },
    {
      "metadata": {
        "source": "Appendix Temporary Work - International Agreement",
        "part": "Appendix Temporary Work - International Agreement",
        "section_id": "Eligibility requirements for settlement as a Private Servant in a diplomatic household",
        "section_title": "Eligibility requirements for settlement as a Private Servant in a diplomatic household",
        "parent_section": null,
        "hierarchy_level": 3,
        "topic": "eligibility",
        "url": "https://www.gov.uk/guidance/immigration-rules/immigration-rules-appendix-t5-temporary-worker-international-agreement-worker",
        "scraped_at": "2025-12-06T17:25:32.221388"
      },
      "text": "### Eligibility requirements for settlement as a Private Servant in a diplomatic household",
      "summary": "This provision applies to private servants in diplomatic households seeking settlement. Applicants must demonstrate lawful residence, sufficient period of service, and compliance with immigration rules, with specific requirements or thresholds detailed for eligibility.",
      "augmented_text": "Document: Appendix Temporary Work - International Agreement\nPart: Appendix Temporary Work - International Agreement\nSection ID: Eligibility requirements for settlement as a Private Servant in a diplomatic household\nSection: Eligibility requirements for settlement as a Private Servant in a diplomatic household\nTopic: eligibility\n\nSummary: This provision applies to private servants in diplomatic households seeking settlement. Applicants must demonstrate lawful residence, sufficient period of service, and compliance with immigration rules, with specific requirements or thresholds detailed for eligibility.\n\n### Eligibility requirements for settlement as a Private Servant in a diplomatic household",
      "needs_review": false
    },
    {
      "metadata": {
        "source": "Appendix Temporary Work - International Agreement",
        "part": "Appendix Temporary Work - International Agreement",
        "section_id": "IA 17.1",
        "section_title": "Qualifying period requirement for settlement as a Private Servant in a diplomatic household",
        "parent_section": "IA 17",
        "hierarchy_level": 2,
        "topic": "settlement",
        "url": "https://www.gov.uk/guidance/immigration-rules/immigration-rules-appendix-t5-temporary-worker-international-agreement-worker",
        "scraped_at": "2025-12-06T17:25:32.221429"
      },
      "text": "### Qualifying period requirement for settlement as a Private Servant in a diplomatic household\n\nIA 17.1. DELETED.\n\nIA 17.2. DELETED.",
      "summary": "This provision applies to private servants in diplomatic households seeking settlement. It requires meeting a qualifying period, though specific details and conditions have been deleted or are unavailable.",
      "augmented_text": "Document: Appendix Temporary Work - International Agreement\nPart: Appendix Temporary Work - International Agreement\nSection ID: IA 17.1\nSection: Qualifying period requirement for settlement as a Private Servant in a diplomatic household\nTopic: settlement\n\nSummary: This provision applies to private servants in diplomatic households seeking settlement. It requires meeting a qualifying period, though specific details and conditions have been deleted or are unavailable.\n\n### Qualifying period requirement for settlement as a Private Servant in a diplomatic household\n\nIA 17.1. DELETED.\n\nIA 17.2. DELETED.",
      "needs_review": false
    },
    {
      "metadata": {
        "source": "Appendix Temporary Work - International Agreement",
        "part": "Appendix Temporary Work - International Agreement",
        "section_id": "IA 18.1",
        "section_title": "Continuous residence requirement for settlement as a Private Servant in a diplomatic household",
        "parent_section": "IA 18",
        "hierarchy_level": 2,
        "topic": "settlement",
        "url": "https://www.gov.uk/guidance/immigration-rules/immigration-rules-appendix-t5-temporary-worker-international-agreement-worker",
        "scraped_at": "2025-12-06T17:25:32.221462"
      },
      "text": "### Continuous residence requirement for settlement as a Private Servant in a diplomatic household\n\nIA 18.1. DELETED.",
      "summary": "This provision applies to private servants in diplomatic households seeking settlement. It requires them to have maintained continuous residence in the UK, with specific conditions and exceptions outlined in the full regulation.",
      "augmented_text": "Document: Appendix Temporary Work - International Agreement\nPart: Appendix Temporary Work - International Agreement\nSection ID: IA 18.1\nSection: Continuous residence requirement for settlement as a Private Servant in a diplomatic household\nTopic: settlement\n\nSummary: This provision applies to private servants in diplomatic households seeking settlement. It requires them to have maintained continuous residence in the UK, with specific conditions and exceptions outlined in the full regulation.\n\n### Continuous residence requirement for settlement as a Private Servant in a diplomatic household\n\nIA 18.1. DELETED.",
      "needs_review": false
    },
    {
      "metadata": {
        "source": "Appendix Temporary Work - International Agreement",
        "part": "Appendix Temporary Work - International Agreement",
        "section_id": "IA 19.1",
        "section_title": "English language requirement for settlement as a Private Servant in a diplomatic household",
        "parent_section": "IA 19",
        "hierarchy_level": 2,
        "topic": "english-language",
        "url": "https://www.gov.uk/guidance/immigration-rules/immigration-rules-appendix-t5-temporary-worker-international-agreement-worker",
        "scraped_at": "2025-12-06T17:25:32.221485"
      },
      "text": "### English language requirement for settlement as a Private Servant in a diplomatic household\n\nIA 19.1. DELETED.\n\nIA 19.2. DELETED.",
      "summary": "This provision applies to private servants in diplomatic households seeking settlement. It requires demonstrating sufficient English language skills unless exempted, with specific conditions or exceptions not detailed here.",
      "augmented_text": "Document: Appendix Temporary Work - International Agreement\nPart: Appendix Temporary Work - International Agreement\nSection ID: IA 19.1\nSection: English language requirement for settlement as a Private Servant in a diplomatic household\nTopic: english-language\n\nSummary: This provision applies to private servants in diplomatic households seeking settlement. It requires demonstrating sufficient English language skills unless exempted, with specific conditions or exceptions not detailed here.\n\n### English language requirement for settlement as a Private Servant in a diplomatic household\n\nIA 19.1. DELETED.\n\nIA 19.2. DELETED.",
      "needs_review": false
    },
    {
      "metadata": {
        "source": "Appendix Temporary Work - International Agreement",
        "part": "Appendix Temporary Work - International Agreement",
        "section_id": "IA 20.1",
        "section_title": "Knowledge of Life in the UK requirement for settlement as a Private Servant in a diplomatic household",
        "parent_section": "IA 20",
        "hierarchy_level": 2,
        "topic": "settlement",
        "url": "https://www.gov.uk/guidance/immigration-rules/immigration-rules-appendix-t5-temporary-worker-international-agreement-worker",
        "scraped_at": "2025-12-06T17:25:32.221660"
      },
      "text": "### Knowledge of Life in the UK requirement for settlement as a Private Servant in a diplomatic household\n\nIA 20.1. DELETED.",
      "summary": "This provision applies to private servants in diplomatic households applying for settlement. They must demonstrate knowledge of Life in the UK, satisfying specific requirements unless they qualify for exemptions; failure to do so can prevent settlement approval.",
      "augmented_text": "Document: Appendix Temporary Work - International Agreement\nPart: Appendix Temporary Work - International Agreement\nSection ID: IA 20.1\nSection: Knowledge of Life in the UK requirement for settlement as a Private Servant in a diplomatic household\nTopic: settlement\n\nSummary: This provision applies to private servants in diplomatic households applying for settlement. They must demonstrate knowledge of Life in the UK, satisfying specific requirements unless they qualify for exemptions; failure to do so can prevent settlement approval.\n\n### Knowledge of Life in the UK requirement for settlement as a Private Servant in a diplomatic household\n\nIA 20.1. DELETED.",
      "needs_review": false
    },
    {
      "metadata": {
        "source": "Appendix Temporary Work - International Agreement",
        "part": "Appendix Temporary Work - International Agreement",
        "section_id": "IA 21.1",
        "section_title": "Decision on an application for settlement by Private Servant in a diplomatic household",
        "parent_section": "IA 21",
        "hierarchy_level": 2,
        "topic": "settlement",
        "url": "https://www.gov.uk/guidance/immigration-rules/immigration-rules-appendix-t5-temporary-worker-international-agreement-worker",
        "scraped_at": "2025-12-06T17:25:32.221732"
      },
      "text": "### Decision on an application for settlement by Private Servant in a diplomatic household\n\nIA 21.1. DELETED.\n\nIA 21.2. DELETED.",
      "summary": "This provision applies to private servants in diplomatic households applying for settlement. It addresses the decision process for such applications, with specific conditions and exceptions (details deleted) that determine eligibility for settlement under diplomatic immunity rules.",
      "augmented_text": "Document: Appendix Temporary Work - International Agreement\nPart: Appendix Temporary Work - International Agreement\nSection ID: IA 21.1\nSection: Decision on an application for settlement by Private Servant in a diplomatic household\nTopic: settlement\n\nSummary: This provision applies to private servants in diplomatic households applying for settlement. It addresses the decision process for such applications, with specific conditions and exceptions (details deleted) that determine eligibility for settlement under diplomatic immunity rules.\n\n### Decision on an application for settlement by Private Servant in a diplomatic household\n\nIA 21.1. DELETED.\n\nIA 21.2. DELETED.",
      "needs_review": false
    },
    {
      "metadata": {
        "source": "Appendix Temporary Work - International Agreement",
        "part": "Appendix Temporary Work - International Agreement",
        "section_id": "SW 3.1",
        "section_title": "Dependants on the International Agreement route",
        "parent_section": null,
        "hierarchy_level": 2,
        "topic": "eligibility",
        "url": "https://www.gov.uk/guidance/immigration-rules/immigration-rules-appendix-t5-temporary-worker-international-agreement-worker",
        "scraped_at": "2025-12-06T17:25:32.221768"
      },
      "text": "### Dependants on the International Agreement route",
      "summary": "Dependants on the International Agreement route refer to family members of primary UK visa holders under specific international agreements. They must meet eligibility criteria and may need to obtain visas or permissions; specific conditions apply based on the agreement involved.",
      "augmented_text": "Document: Appendix Temporary Work - International Agreement\nPart: Appendix Temporary Work - International Agreement\nSection ID: SW 3.1\nSection: Dependants on the International Agreement route\nTopic: eligibility\n\nSummary: Dependants on the International Agreement route refer to family members of primary UK visa holders under specific international agreements. They must meet eligibility criteria and may need to obtain visas or permissions; specific conditions apply based on the agreement involved.\n\n### Dependants on the International Agreement route",
      "needs_review": false
    },
    {
      "metadata": {
        "source": "Appendix Temporary Work - International Agreement",
        "part": "Appendix Temporary Work - International Agreement",
        "section_id": "IA 22.1",
        "section_title": "Validity requirements for a dependent partner or dependent child on the International Agreement route",
        "parent_section": "IA 22",
        "hierarchy_level": 2,
        "topic": "leave-to-enter",
        "url": "https://www.gov.uk/guidance/immigration-rules/immigration-rules-appendix-t5-temporary-worker-international-agreement-worker",
        "scraped_at": "2025-12-06T17:25:32.221808"
      },
      "text": "### Validity requirements for a dependent partner or dependent child on the International Agreement route\n\nIA 22.1. A person applying for entry clearance or permission to stay as a dependent partner or dependent child on the International Agreement route must apply online on the gov.uk website on the specified form as follows:\n\n| Applicant | Specified form |\n| --- | --- |\n| EEA national with a chipped passport | Either (as applicable): • Dependant partner or dependant child using the UK Immigration: ID Check app; or • the forms listed below for dependant applicants outside or inside the UK as relevant. |\n| Applicants outside the UK | Dependant partner visa Dependant child visa |\n| Applicants inside the UK | If the dependant is applying at the same time as the person on the International Agreement route, they can be included in the form Temporary Worker where the form allows dependants to be added. Otherwise: - Dependant partner - Dependant child |\n\n1.   IA 22.2. An application for entry clearance or permission to stay as a partner or child on the International Agreement route must meet all the following requirements: \n    1.   (a) any fee and Immigration Health Charge must have been paid; and\n    2.   (b) the applicant must have provided biometrics when required; and\n    3.   (c) the applicant must have provided a passport or other travel document which satisfactorily establishes their identity and nationality; and\n    4.   (d) the applicant must be applying as a partner or child of a person who: \n        1.   (i) has made a valid application for entry clearance or permission to stay as a person on the International Agreement route that has not been decided; or\n        2.   (ii) has entry clearance or permission to stay as a person on the International Agreement route.\n\nIA 22.3. An applicant applying as a dependent partner must be aged 18 or over on the date of application.\n\nIA 22.4. If applying for permission to stay, the applicant must be in the UK on the date of application.\n\n1.   IA 22.4ZA. If applying for permission to stay, the applicant must not have, or have last been granted, permission: \n    1.   (a) as a Visitor; or\n    2.   (b) as a Short-term Student; or\n    3.   (c) as a Parent of a Child Student; or\n    4.   (d) as a Seasonal Worker; or\n    5.   (e) as a Domestic Worker in a Private Household; or\n    6.   (f) outside the Immigration Rules.\n\n1.   IA 22.4A. An applicant who is applying for permission to stay and has, or last had, permission as a Student, must fulfil one of the Conditions A or B below on the date of application: \n    1.   (a) Condition A: the applicant must have completed the course of study for which the Confirmation of Acceptance for Studies was assigned (or a course to which ST 27.3 of Appendix Student applies); or\n    2.   (b) Condition B: the applicant must: \n        1.   (i) be studying a full-time course of study leading to the award of a PhD with a higher education provider which has a track record of compliance; and\n        2.   (ii) have completed at least 24 months of study on that course.\n\nIA 22.5. An application which does not meet all the validity requirements for a partner or child on the International Agreement route may be rejected as invalid and not considered.",
      "summary": "Dependents (partners or children) applying via the International Agreement route must submit online forms specified for their circumstances, pay fees and the Immigration Health Charge, provide biometrics, and submit valid travel documents. Applications within or outside the UK must comply with these requirements, with certain forms applicable depending on location and relationship timing.",
      "augmented_text": "Document: Appendix Temporary Work - International Agreement\nPart: Appendix Temporary Work - International Agreement\nSection ID: IA 22.1\nSection: Validity requirements for a dependent partner or dependent child on the International Agreement route\nTopic: leave-to-enter\n\nSummary: Dependents (partners or children) applying via the International Agreement route must submit online forms specified for their circumstances, pay fees and the Immigration Health Charge, provide biometrics, and submit valid travel documents. Applications within or outside the UK must comply with these requirements, with certain forms applicable depending on location and relationship timing.\n\n### Validity requirements for a dependent partner or dependent child on the International Agreement route\n\nIA 22.1. A person applying for entry clearance or permission to stay as a dependent partner or dependent child on the International Agreement route must apply online on the gov.uk website on the specified form as follows:\n\n| Applicant | Specified form |\n| --- | --- |\n| EEA national with a chipped passport | Either (as applicable): • Dependant partner or dependant child using the UK Immigration: ID Check app; or • the forms listed below for dependant applicants outside or inside the UK as relevant. |\n| Applicants outside the UK | Dependant partner visa Dependant child visa |\n| Applicants inside the UK | If the dependant is applying at the same time as the person on the International Agreement route, they can be included in the form Temporary Worker where the form allows dependants to be added. Otherwise: - Dependant partner - Dependant child |\n\n1.   IA 22.2. An application for entry clearance or permission to stay as a partner or child on the International Agreement route must meet all the following requirements: \n    1.   (a) any fee and Immigration Health Charge must have been paid; and\n    2.   (b) the applicant must have provided biometrics when required; and\n    3.   (c) the applicant must have provided a passport or other travel document which satisfactorily establishes their identity and nationality; and\n    4.   (d) the applicant must be applying as a partner or child of a person who: \n        1.   (i) has made a valid application for entry clearance or permission to stay as a person on the International Agreement route that has not been decided; or\n        2.   (ii) has entry clearance or permission to stay as a person on the International Agreement route.\n\nIA 22.3. An applicant applying as a dependent partner must be aged 18 or over on the date of application.\n\nIA 22.4. If applying for permission to stay, the applicant must be in the UK on the date of application.\n\n1.   IA 22.4ZA. If applying for permission to stay, the applicant must not have, or have last been granted, permission: \n    1.   (a) as a Visitor; or\n    2.   (b) as a Short-term Student; or\n    3.   (c) as a Parent of a Child Student; or\n    4.   (d) as a Seasonal Worker; or\n    5.   (e) as a Domestic Worker in a Private Household; or\n    6.   (f) outside the Immigration Rules.\n\n1.   IA 22.4A. An applicant who is applying for permission to stay and has, or last had, permission as a Student, must fulfil one of the Conditions A or B below on the date of application: \n    1.   (a) Condition A: the applicant must have completed the course of study for which the Confirmation of Acceptance for Studies was assigned (or a course to which ST 27.3 of Appendix Student applies); or\n    2.   (b) Condition B: the applicant must: \n        1.   (i) be studying a full-time course of study leading to the award of a PhD with a higher education provider which has a track record of compliance; and\n        2.   (ii) have completed at least 24 months of study on that course.\n\nIA 22.5. An application which does not meet all the validity requirements for a partner or child on the International Agreement route may be rejected as invalid and not considered.",
      "needs_review": false
    },
    {
      "metadata": {
        "source": "Appendix Temporary Work - International Agreement",
        "part": "Appendix Temporary Work - International Agreement",
        "section_id": "IA 23.1",
        "section_title": "Suitability requirements for a dependent partner or dependent child on the International Agreement route",
        "parent_section": "IA 23",
        "hierarchy_level": 2,
        "topic": "suitability",
        "url": "https://www.gov.uk/guidance/immigration-rules/immigration-rules-appendix-t5-temporary-worker-international-agreement-worker",
        "scraped_at": "2025-12-06T17:25:32.221824"
      },
      "text": "### Suitability requirements for a dependent partner or dependent child on the International Agreement route\n\nIA 23.1. The applicant must not fall for refusal under Part Suitability.\n\n1.   IA 23.2. If applying for permission to stay the applicant must not be: \n    1.   (a) in breach of immigration laws, except that where the Exceptions for overstayers section of Part Suitability applies, that period of overstaying will be disregarded; or\n    2.   (b) on immigration bail.",
      "summary": "This provision applies to dependent partners or children under the International Agreement route. They must meet suitability requirements, including not breaching immigration laws or being on immigration bail, unless overstaying is disregarded under specific exceptions.",
      "augmented_text": "Document: Appendix Temporary Work - International Agreement\nPart: Appendix Temporary Work - International Agreement\nSection ID: IA 23.1\nSection: Suitability requirements for a dependent partner or dependent child on the International Agreement route\nTopic: suitability\n\nSummary: This provision applies to dependent partners or children under the International Agreement route. They must meet suitability requirements, including not breaching immigration laws or being on immigration bail, unless overstaying is disregarded under specific exceptions.\n\n### Suitability requirements for a dependent partner or dependent child on the International Agreement route\n\nIA 23.1. The applicant must not fall for refusal under Part Suitability.\n\n1.   IA 23.2. If applying for permission to stay the applicant must not be: \n    1.   (a) in breach of immigration laws, except that where the Exceptions for overstayers section of Part Suitability applies, that period of overstaying will be disregarded; or\n    2.   (b) on immigration bail.",
      "needs_review": false
    },
    {
      "metadata": {
        "source": "Appendix Temporary Work - International Agreement",
        "part": "Appendix Temporary Work - International Agreement",
        "section_id": "Eligibility requirements for a dependent partner or dependent child on the International Agreement route",
        "section_title": "Eligibility requirements for a dependent partner or dependent child on the International Agreement route",
        "parent_section": null,
        "hierarchy_level": 3,
        "topic": "eligibility",
        "url": "https://www.gov.uk/guidance/immigration-rules/immigration-rules-appendix-t5-temporary-worker-international-agreement-worker",
        "scraped_at": "2025-12-06T17:25:32.221830"
      },
      "text": "### Eligibility requirements for a dependent partner or dependent child on the International Agreement route",
      "summary": "This provision applies to dependent partners and children applying under the International Agreement route. They must meet specific eligibility criteria demonstrating genuine dependency or familial relationship; exceptions are limited and depend on individual circumstances.",
      "augmented_text": "Document: Appendix Temporary Work - International Agreement\nPart: Appendix Temporary Work - International Agreement\nSection ID: Eligibility requirements for a dependent partner or dependent child on the International Agreement route\nSection: Eligibility requirements for a dependent partner or dependent child on the International Agreement route\nTopic: eligibility\n\nSummary: This provision applies to dependent partners and children applying under the International Agreement route. They must meet specific eligibility criteria demonstrating genuine dependency or familial relationship; exceptions are limited and depend on individual circumstances.\n\n### Eligibility requirements for a dependent partner or dependent child on the International Agreement route",
      "needs_review": false
    },
    {
      "metadata": {
        "source": "Appendix Temporary Work - International Agreement",
        "part": "Appendix Temporary Work - International Agreement",
        "section_id": "IA 24.1",
        "section_title": "Entry requirement for a dependent partner or dependent child on the International Agreement route",
        "parent_section": "IA 24",
        "hierarchy_level": 2,
        "topic": "leave-to-enter",
        "url": "https://www.gov.uk/guidance/immigration-rules/immigration-rules-appendix-t5-temporary-worker-international-agreement-worker",
        "scraped_at": "2025-12-06T17:25:32.221847"
      },
      "text": "### Entry requirement for a dependent partner or dependent child on the International Agreement route\n\nIA 24.1. A person seeking to come to the UK as a dependent partner or dependent child on the International Agreement route must apply for and obtain entry clearance as a dependent partner or dependent child on the International Agreement route before they arrive in the UK.\n\nIA 24.2. A person applying for entry clearance as the partner or child on the International Agreement route must, if Appendix Tuberculosis applies, provide a valid medical certificate confirming that they have undergone screening for active pulmonary tuberculosis and that this tuberculosis is not present in them.",
      "summary": "Dependents (partners or children) applying under the International Agreement route must obtain entry clearance before arriving in the UK. If applicable, they must also provide a medical certificate confirming TB screening results.",
      "augmented_text": "Document: Appendix Temporary Work - International Agreement\nPart: Appendix Temporary Work - International Agreement\nSection ID: IA 24.1\nSection: Entry requirement for a dependent partner or dependent child on the International Agreement route\nTopic: leave-to-enter\n\nSummary: Dependents (partners or children) applying under the International Agreement route must obtain entry clearance before arriving in the UK. If applicable, they must also provide a medical certificate confirming TB screening results.\n\n### Entry requirement for a dependent partner or dependent child on the International Agreement route\n\nIA 24.1. A person seeking to come to the UK as a dependent partner or dependent child on the International Agreement route must apply for and obtain entry clearance as a dependent partner or dependent child on the International Agreement route before they arrive in the UK.\n\nIA 24.2. A person applying for entry clearance as the partner or child on the International Agreement route must, if Appendix Tuberculosis applies, provide a valid medical certificate confirming that they have undergone screening for active pulmonary tuberculosis and that this tuberculosis is not present in them.",
      "needs_review": false
    },
    {
      "metadata": {
        "source": "Appendix Temporary Work - International Agreement",
        "part": "Appendix Temporary Work - International Agreement",
        "section_id": "1",
        "section_title": "Relationship requirement for a dependent partner on the International Agreement route",
        "parent_section": null,
        "hierarchy_level": 1,
        "topic": "family",
        "url": "https://www.gov.uk/guidance/immigration-rules/immigration-rules-appendix-t5-temporary-worker-international-agreement-worker",
        "scraped_at": "2025-12-06T17:25:32.221946"
      },
      "text": "### Relationship requirement for a dependent partner on the International Agreement route\n\n1.   IA 25.1. The applicant must be the partner of a person (P) where one of the following applies: \n    1.   (a) P has permission on the International Agreement route; or\n    2.   (b) P is, at the same time, applying for (and is granted) entry clearance or permission on the International Agreement route.\n\n2.   IA 25.2. The requirements of Appendix Relationship with Partner must be met.\n\nIA 25.3. DELETED.\n\nIA 25.4. DELETED.",
      "summary": "Dependents applying via the International Agreement route must be partners of individuals with existing or pending permission on the same route. They must also meet the Relationship with Partner requirements, with no exceptions specified.",
      "augmented_text": "Document: Appendix Temporary Work - International Agreement\nPart: Appendix Temporary Work - International Agreement\nSection ID: 1\nSection: Relationship requirement for a dependent partner on the International Agreement route\nTopic: family\n\nSummary: Dependents applying via the International Agreement route must be partners of individuals with existing or pending permission on the same route. They must also meet the Relationship with Partner requirements, with no exceptions specified.\n\n### Relationship requirement for a dependent partner on the International Agreement route\n\n1.   IA 25.1. The applicant must be the partner of a person (P) where one of the following applies: \n    1.   (a) P has permission on the International Agreement route; or\n    2.   (b) P is, at the same time, applying for (and is granted) entry clearance or permission on the International Agreement route.\n\n2.   IA 25.2. The requirements of Appendix Relationship with Partner must be met.\n\nIA 25.3. DELETED.\n\nIA 25.4. DELETED.",
      "needs_review": false
    },
    {
      "metadata": {
        "source": "Appendix Temporary Work - International Agreement",
        "part": "Appendix Temporary Work - International Agreement",
        "section_id": "1",
        "section_title": "Relationship requirement for a dependent child on the International Agreement route",
        "parent_section": null,
        "hierarchy_level": 1,
        "topic": "family",
        "url": "https://www.gov.uk/guidance/immigration-rules/immigration-rules-appendix-t5-temporary-worker-international-agreement-worker",
        "scraped_at": "2025-12-06T17:25:32.222042"
      },
      "text": "### Relationship requirement for a dependent child on the International Agreement route\n\n1.   IA 26.1. DELETED.\n2.   IA 26.2. DELETED.\n\nIA 26.3. DELETED.",
      "summary": "This provision applies to dependent children on the International Agreement route. It requires that the child maintains a valid relationship with the sponsor and meets specified dependency criteria. Certain conditions or exceptions are not detailed in this excerpt.",
      "augmented_text": "Document: Appendix Temporary Work - International Agreement\nPart: Appendix Temporary Work - International Agreement\nSection ID: 1\nSection: Relationship requirement for a dependent child on the International Agreement route\nTopic: family\n\nSummary: This provision applies to dependent children on the International Agreement route. It requires that the child maintains a valid relationship with the sponsor and meets specified dependency criteria. Certain conditions or exceptions are not detailed in this excerpt.\n\n### Relationship requirement for a dependent child on the International Agreement route\n\n1.   IA 26.1. DELETED.\n2.   IA 26.2. DELETED.\n\nIA 26.3. DELETED.",
      "needs_review": false
    },
    {
      "metadata": {
        "source": "Appendix Temporary Work - International Agreement",
        "part": "Appendix Temporary Work - International Agreement",
        "section_id": "IA 27.1",
        "section_title": "Care requirement for a dependent child on the International Agreement route",
        "parent_section": "IA 27",
        "hierarchy_level": 2,
        "topic": "family",
        "url": "https://www.gov.uk/guidance/immigration-rules/immigration-rules-appendix-t5-temporary-worker-international-agreement-worker",
        "scraped_at": "2025-12-06T17:25:32.222100"
      },
      "text": "### Care requirement for a dependent child on the International Agreement route\n\nIA 27.1. DELETED.",
      "summary": "This provision applies to dependent children on the International Agreement route, requiring applicants to demonstrate adequate care arrangements. There are no specific exceptions noted; failure to meet care standards may result in application refusal.",
      "augmented_text": "Document: Appendix Temporary Work - International Agreement\nPart: Appendix Temporary Work - International Agreement\nSection ID: IA 27.1\nSection: Care requirement for a dependent child on the International Agreement route\nTopic: family\n\nSummary: This provision applies to dependent children on the International Agreement route, requiring applicants to demonstrate adequate care arrangements. There are no specific exceptions noted; failure to meet care standards may result in application refusal.\n\n### Care requirement for a dependent child on the International Agreement route\n\nIA 27.1. DELETED.",
      "needs_review": false
    },
    {
      "metadata": {
        "source": "Appendix Temporary Work - International Agreement",
        "part": "Appendix Temporary Work - International Agreement",
        "section_id": "IA 28.1",
        "section_title": "Age requirement for a dependent child on the International Agreement route",
        "parent_section": "IA 28",
        "hierarchy_level": 2,
        "topic": "family",
        "url": "https://www.gov.uk/guidance/immigration-rules/immigration-rules-appendix-t5-temporary-worker-international-agreement-worker",
        "scraped_at": "2025-12-06T17:25:32.222135"
      },
      "text": "### Age requirement for a dependent child on the International Agreement route\n\nIA 28.1. DELETED.\n\nIA 28.2. DELETED.",
      "summary": "This provision applies to dependent children applying via the International Agreement route. It specifies an age requirement, with certain conditions and exceptions, though detailed details are deleted in this extract.",
      "augmented_text": "Document: Appendix Temporary Work - International Agreement\nPart: Appendix Temporary Work - International Agreement\nSection ID: IA 28.1\nSection: Age requirement for a dependent child on the International Agreement route\nTopic: family\n\nSummary: This provision applies to dependent children applying via the International Agreement route. It specifies an age requirement, with certain conditions and exceptions, though detailed details are deleted in this extract.\n\n### Age requirement for a dependent child on the International Agreement route\n\nIA 28.1. DELETED.\n\nIA 28.2. DELETED.",
      "needs_review": false
    },
    {
      "metadata": {
        "source": "Appendix Temporary Work - International Agreement",
        "part": "Appendix Temporary Work - International Agreement",
        "section_id": "1",
        "section_title": "Requirements for a dependent child on the International Agreement route",
        "parent_section": null,
        "hierarchy_level": 1,
        "topic": "leave-to-enter",
        "url": "https://www.gov.uk/guidance/immigration-rules/immigration-rules-appendix-t5-temporary-worker-international-agreement-worker",
        "scraped_at": "2025-12-06T17:25:32.222171"
      },
      "text": "### Requirements for a dependent child on the International Agreement route\n\n1.   IA 28A.1. The applicant must meet the following requirements for a dependent child in Appendix Children: \n    1.   (a) relationship requirement: entry clearance and permission to stay; and\n    2.   (b) care requirement; and\n    3.   (c) age and independent life requirement.",
      "summary": "This section applies to dependent children on the International Agreement route, requiring them to meet relationship, care, and age/independent living criteria for entry and stay, with specific conditions outlined in Appendix Children.",
      "augmented_text": "Document: Appendix Temporary Work - International Agreement\nPart: Appendix Temporary Work - International Agreement\nSection ID: 1\nSection: Requirements for a dependent child on the International Agreement route\nTopic: leave-to-enter\n\nSummary: This section applies to dependent children on the International Agreement route, requiring them to meet relationship, care, and age/independent living criteria for entry and stay, with specific conditions outlined in Appendix Children.\n\n### Requirements for a dependent child on the International Agreement route\n\n1.   IA 28A.1. The applicant must meet the following requirements for a dependent child in Appendix Children: \n    1.   (a) relationship requirement: entry clearance and permission to stay; and\n    2.   (b) care requirement; and\n    3.   (c) age and independent life requirement.",
      "needs_review": false
    },
    {
      "metadata": {
        "source": "Appendix Temporary Work - International Agreement",
        "part": "Appendix Temporary Work - International Agreement",
        "section_id": "IA 29.1",
        "section_title": "Financial requirement for a dependent partner or dependent child on the International Agreement route",
        "parent_section": "IA 29",
        "hierarchy_level": 2,
        "topic": "financial",
        "url": "https://www.gov.uk/guidance/immigration-rules/immigration-rules-appendix-t5-temporary-worker-international-agreement-worker",
        "scraped_at": "2025-12-06T17:25:32.222201"
      },
      "text": "### Financial requirement for a dependent partner or dependent child on the International Agreement route\n\nIA 29.1. If the applicant is applying for permission to stay and has been living in the UK with permission for 12 months or longer on the date of application, they will meet the financial requirement and do not need to show funds.\n\n1.   IA 29.2. If the applicant is applying for entry clearance, or has been in the UK for less than 12 months on the date of application, either: \n    1.   (a) funds of at least the amount required in IA 29.3. must be held collectively by one or more of the following: \n        1.   i) the applicant; and\n        2.   ii) the person on the International Agreement route (P); and\n        3.   iii) if the applicant is applying as a dependent child, their parent who is lawfully present in the UK or being granted entry clearance, or permission to stay, at the same time; or\n\n    2.   (b) the A-rated sponsor of the person on the International Agreement route must certify that they will, if necessary, maintain and accommodate the dependent partner and/or any dependent child as well as the person on the International Agreement route, up to the end of the first month of each of their grants of permission, to at least the amounts required in 29.3.\n\n2.   IA 29.3. The funds required are: \n    1.   (a) £285 for a dependent partner in the UK, or applying for entry clearance; and\n    2.   (b) £315 for the first dependent child in the UK, or applying for entry clearance; and\n    3.   (c) £200 for any other dependent child in the UK, or applying for entry clearance.\n\nIA 29.4, If IA 29.2(a) applies, the funds held for the applicant must be held in addition to any funds required for the person on the International Agreement route to meet the financial requirement and any other dependants in the UK or applying at the same time.\n\nIA 29.5. If IA 29.2(a) applies, the funds must have been held for a 28-day period and as specified in Appendix Finance.",
      "summary": "Dependents applying under the International Agreement route must either have lived in the UK for over 12 months (meeting the financial requirement) or show funds of at least £285 per partner and £315 per child, held collectively or certified by an A-rated sponsor if ineligible. Critical conditions include applying within 12 months of entry or residence, with exceptions for those with 12+ months permission.",
      "augmented_text": "Document: Appendix Temporary Work - International Agreement\nPart: Appendix Temporary Work - International Agreement\nSection ID: IA 29.1\nSection: Financial requirement for a dependent partner or dependent child on the International Agreement route\nTopic: financial\n\nSummary: Dependents applying under the International Agreement route must either have lived in the UK for over 12 months (meeting the financial requirement) or show funds of at least £285 per partner and £315 per child, held collectively or certified by an A-rated sponsor if ineligible. Critical conditions include applying within 12 months of entry or residence, with exceptions for those with 12+ months permission.\n\n### Financial requirement for a dependent partner or dependent child on the International Agreement route\n\nIA 29.1. If the applicant is applying for permission to stay and has been living in the UK with permission for 12 months or longer on the date of application, they will meet the financial requirement and do not need to show funds.\n\n1.   IA 29.2. If the applicant is applying for entry clearance, or has been in the UK for less than 12 months on the date of application, either: \n    1.   (a) funds of at least the amount required in IA 29.3. must be held collectively by one or more of the following: \n        1.   i) the applicant; and\n        2.   ii) the person on the International Agreement route (P); and\n        3.   iii) if the applicant is applying as a dependent child, their parent who is lawfully present in the UK or being granted entry clearance, or permission to stay, at the same time; or\n\n    2.   (b) the A-rated sponsor of the person on the International Agreement route must certify that they will, if necessary, maintain and accommodate the dependent partner and/or any dependent child as well as the person on the International Agreement route, up to the end of the first month of each of their grants of permission, to at least the amounts required in 29.3.\n\n2.   IA 29.3. The funds required are: \n    1.   (a) £285 for a dependent partner in the UK, or applying for entry clearance; and\n    2.   (b) £315 for the first dependent child in the UK, or applying for entry clearance; and\n    3.   (c) £200 for any other dependent child in the UK, or applying for entry clearance.\n\nIA 29.4, If IA 29.2(a) applies, the funds held for the applicant must be held in addition to any funds required for the person on the International Agreement route to meet the financial requirement and any other dependants in the UK or applying at the same time.\n\nIA 29.5. If IA 29.2(a) applies, the funds must have been held for a 28-day period and as specified in Appendix Finance.",
      "needs_review": false
    },
    {
      "metadata": {
        "source": "Appendix Temporary Work - International Agreement",
        "part": "Appendix Temporary Work - International Agreement",
        "section_id": "IA 30.1",
        "section_title": "Decision on an application as a dependent partner or dependent child on the International Agreement route",
        "parent_section": "IA 30",
        "hierarchy_level": 2,
        "topic": "eligibility",
        "url": "https://www.gov.uk/guidance/immigration-rules/immigration-rules-appendix-t5-temporary-worker-international-agreement-worker",
        "scraped_at": "2025-12-06T17:25:32.222239"
      },
      "text": "### Decision on an application as a dependent partner or dependent child on the International Agreement route\n\nIA 30.1. If the decision maker is satisfied that all the suitability and eligibility requirements for a dependent partner or dependent child on the International Agreement route are met, the application will be granted, otherwise the application will be refused.\n\nIA 30.2. If the application is refused, the person can apply for an Administrative Review under Appendix AR: Administrative Review.",
      "summary": "This provision applies to dependent partners and children on the International Agreement route, requiring the decision-maker to confirm all suitability and eligibility criteria are met for approval. If denied, applicants may request an Administrative Review; no specific thresholds or exceptions are indicated.",
      "augmented_text": "Document: Appendix Temporary Work - International Agreement\nPart: Appendix Temporary Work - International Agreement\nSection ID: IA 30.1\nSection: Decision on an application as a dependent partner or dependent child on the International Agreement route\nTopic: eligibility\n\nSummary: This provision applies to dependent partners and children on the International Agreement route, requiring the decision-maker to confirm all suitability and eligibility criteria are met for approval. If denied, applicants may request an Administrative Review; no specific thresholds or exceptions are indicated.\n\n### Decision on an application as a dependent partner or dependent child on the International Agreement route\n\nIA 30.1. If the decision maker is satisfied that all the suitability and eligibility requirements for a dependent partner or dependent child on the International Agreement route are met, the application will be granted, otherwise the application will be refused.\n\nIA 30.2. If the application is refused, the person can apply for an Administrative Review under Appendix AR: Administrative Review.",
      "needs_review": false
    },
    {
      "metadata": {
        "source": "Appendix Temporary Work - International Agreement",
        "part": "Appendix Temporary Work - International Agreement",
        "section_id": "IA 31.1",
        "section_title": "Period of grant for a dependent partner or dependent child on the International Agreement route",
        "parent_section": "IA 31",
        "hierarchy_level": 2,
        "topic": "family",
        "url": "https://www.gov.uk/guidance/immigration-rules/immigration-rules-appendix-t5-temporary-worker-international-agreement-worker",
        "scraped_at": "2025-12-06T17:25:32.222327"
      },
      "text": "### Period of grant for a dependent partner or dependent child on the International Agreement route\n\nIA 31.1. A partner will be granted permission which ends on the same date as their partner’s permission on the International Agreement route.\n\nIA 31.2 A child will be granted permission which ends on the same date as whichever of their parents’ permission ends first.",
      "summary": "This provision applies to dependent partners and children of individuals on the International Agreement route. Dependents’ permission duration is tied to the primary applicant’s, with partners matching the same end date and children ending with the earliest parental expiry.",
      "augmented_text": "Document: Appendix Temporary Work - International Agreement\nPart: Appendix Temporary Work - International Agreement\nSection ID: IA 31.1\nSection: Period of grant for a dependent partner or dependent child on the International Agreement route\nTopic: family\n\nSummary: This provision applies to dependent partners and children of individuals on the International Agreement route. Dependents’ permission duration is tied to the primary applicant’s, with partners matching the same end date and children ending with the earliest parental expiry.\n\n### Period of grant for a dependent partner or dependent child on the International Agreement route\n\nIA 31.1. A partner will be granted permission which ends on the same date as their partner’s permission on the International Agreement route.\n\nIA 31.2 A child will be granted permission which ends on the same date as whichever of their parents’ permission ends first.",
      "needs_review": false
    },
    {
      "metadata": {
        "source": "Appendix Temporary Work - International Agreement",
        "part": "Appendix Temporary Work - International Agreement",
        "section_id": "1",
        "section_title": "Conditions of grant for a dependent partner or dependent child on the International Agreement route",
        "parent_section": null,
        "hierarchy_level": 1,
        "topic": "financial",
        "url": "https://www.gov.uk/guidance/immigration-rules/immigration-rules-appendix-t5-temporary-worker-international-agreement-worker",
        "scraped_at": "2025-12-06T17:25:32.222355"
      },
      "text": "### Conditions of grant for a dependent partner or dependent child on the International Agreement route\n\n1.   IA 31.3. The grant will be subject to all the following conditions: \n    1.   (a) no access to public funds; and\n    2.   (b) work (including self-employment and voluntary work) is permitted, except as a professional sportsperson (including as a sports coach); and\n    3.   (c) study is permitted, subject to the ATAS condition in Appendix ATAS if the applicant is over the age of 18.\n    4.   (d) DELETED.",
      "summary": "Dependent partners and children under the International Agreement route must not access public funds, can work (excluding professional sports), and may study (with ATAS if over 18). These conditions apply universally without exceptions.",
      "augmented_text": "Document: Appendix Temporary Work - International Agreement\nPart: Appendix Temporary Work - International Agreement\nSection ID: 1\nSection: Conditions of grant for a dependent partner or dependent child on the International Agreement route\nTopic: financial\n\nSummary: Dependent partners and children under the International Agreement route must not access public funds, can work (excluding professional sports), and may study (with ATAS if over 18). These conditions apply universally without exceptions.\n\n### Conditions of grant for a dependent partner or dependent child on the International Agreement route\n\n1.   IA 31.3. The grant will be subject to all the following conditions: \n    1.   (a) no access to public funds; and\n    2.   (b) work (including self-employment and voluntary work) is permitted, except as a professional sportsperson (including as a sports coach); and\n    3.   (c) study is permitted, subject to the ATAS condition in Appendix ATAS if the applicant is over the age of 18.\n    4.   (d) DELETED.",
      "needs_review": false
    },
    {
      "metadata": {
        "source": "Appendix Temporary Work - International Agreement",
        "part": "Appendix Temporary Work - International Agreement",
        "section_id": "Settlement as a dependent partner or dependent child on the International Agreement route",
        "section_title": "Settlement as a dependent partner or dependent child on the International Agreement route",
        "parent_section": null,
        "hierarchy_level": 3,
        "topic": "settlement",
        "url": "https://www.gov.uk/guidance/immigration-rules/immigration-rules-appendix-t5-temporary-worker-international-agreement-worker",
        "scraped_at": "2025-12-06T17:25:32.222382"
      },
      "text": "### Settlement as a dependent partner or dependent child on the International Agreement route",
      "summary": "This provision applies to dependent partners and children applying for settlement under the International Agreement route. They must demonstrate continuous residence and meet specific relationship and eligibility criteria. Critical conditions include meeting integration requirements, with no general exceptions noted.",
      "augmented_text": "Document: Appendix Temporary Work - International Agreement\nPart: Appendix Temporary Work - International Agreement\nSection ID: Settlement as a dependent partner or dependent child on the International Agreement route\nSection: Settlement as a dependent partner or dependent child on the International Agreement route\nTopic: settlement\n\nSummary: This provision applies to dependent partners and children applying for settlement under the International Agreement route. They must demonstrate continuous residence and meet specific relationship and eligibility criteria. Critical conditions include meeting integration requirements, with no general exceptions noted.\n\n### Settlement as a dependent partner or dependent child on the International Agreement route",
      "needs_review": false
    },
    {
      "metadata": {
        "source": "Appendix Temporary Work - International Agreement",
        "part": "Appendix Temporary Work - International Agreement",
        "section_id": "IA 32.1",
        "section_title": "Validity requirements for settlement as a dependent partner or dependent child of a Private Servant in a diplomatic household",
        "parent_section": "IA 32",
        "hierarchy_level": 2,
        "topic": "settlement",
        "url": "https://www.gov.uk/guidance/immigration-rules/immigration-rules-appendix-t5-temporary-worker-international-agreement-worker",
        "scraped_at": "2025-12-06T17:25:32.222417"
      },
      "text": "### Validity requirements for settlement as a dependent partner or dependent child of a Private Servant in a diplomatic household\n\nIA 32.1. DELETED.\n\nIA 32.2. DELETED.\n\nIA 32.3. DELETED.\n\nIA 32.4. DELETED.",
      "summary": "This provision applies to dependent partners or children of private servants in diplomatic households seeking settlement. They must meet specific validity requirements, with certain conditions or exceptions outlined; the detailed criteria are deleted from the current document.",
      "augmented_text": "Document: Appendix Temporary Work - International Agreement\nPart: Appendix Temporary Work - International Agreement\nSection ID: IA 32.1\nSection: Validity requirements for settlement as a dependent partner or dependent child of a Private Servant in a diplomatic household\nTopic: settlement\n\nSummary: This provision applies to dependent partners or children of private servants in diplomatic households seeking settlement. They must meet specific validity requirements, with certain conditions or exceptions outlined; the detailed criteria are deleted from the current document.\n\n### Validity requirements for settlement as a dependent partner or dependent child of a Private Servant in a diplomatic household\n\nIA 32.1. DELETED.\n\nIA 32.2. DELETED.\n\nIA 32.3. DELETED.\n\nIA 32.4. DELETED.",
      "needs_review": false
    },
    {
      "metadata": {
        "source": "Appendix Temporary Work - International Agreement",
        "part": "Appendix Temporary Work - International Agreement",
        "section_id": "IA 33.1",
        "section_title": "Suitability requirements for settlement as a dependent partner or dependent child of a Private Servant in a diplomatic household",
        "parent_section": "IA 33",
        "hierarchy_level": 2,
        "topic": "suitability",
        "url": "https://www.gov.uk/guidance/immigration-rules/immigration-rules-appendix-t5-temporary-worker-international-agreement-worker",
        "scraped_at": "2025-12-06T17:25:32.222444"
      },
      "text": "### Suitability requirements for settlement as a dependent partner or dependent child of a Private Servant in a diplomatic household\n\nIA 33.1. DELETED.\n\nIA 33.2. DELETED.",
      "summary": "This provision applies to dependent partners and children of Private Servants in diplomatic households seeking settlement. They must meet suitability requirements, including conduct standards, with certain exceptions, to qualify for settlement.",
      "augmented_text": "Document: Appendix Temporary Work - International Agreement\nPart: Appendix Temporary Work - International Agreement\nSection ID: IA 33.1\nSection: Suitability requirements for settlement as a dependent partner or dependent child of a Private Servant in a diplomatic household\nTopic: suitability\n\nSummary: This provision applies to dependent partners and children of Private Servants in diplomatic households seeking settlement. They must meet suitability requirements, including conduct standards, with certain exceptions, to qualify for settlement.\n\n### Suitability requirements for settlement as a dependent partner or dependent child of a Private Servant in a diplomatic household\n\nIA 33.1. DELETED.\n\nIA 33.2. DELETED.",
      "needs_review": false
    },
    {
      "metadata": {
        "source": "Appendix Temporary Work - International Agreement",
        "part": "Appendix Temporary Work - International Agreement",
        "section_id": "Eligibility requirements for settlement as a dependent partner or dependent child of a Private Servant in a diplomatic household on the International Agreement route",
        "section_title": "Eligibility requirements for settlement as a dependent partner or dependent child of a Private Servant in a diplomatic household on the International Agreement route",
        "parent_section": null,
        "hierarchy_level": 3,
        "topic": "eligibility",
        "url": "https://www.gov.uk/guidance/immigration-rules/immigration-rules-appendix-t5-temporary-worker-international-agreement-worker",
        "scraped_at": "2025-12-06T17:25:32.222460"
      },
      "text": "### Eligibility requirements for settlement as a dependent partner or dependent child of a Private Servant in a diplomatic household on the International Agreement route",
      "summary": "This provision applies to dependent partners and children of private servants in diplomatic households under the International Agreement route. They must meet specific eligibility criteria to settle, including being genuinely dependent and meeting any relevant residence or conduct conditions; exceptions are not specified here.",
      "augmented_text": "Document: Appendix Temporary Work - International Agreement\nPart: Appendix Temporary Work - International Agreement\nSection ID: Eligibility requirements for settlement as a dependent partner or dependent child of a Private Servant in a diplomatic household on the International Agreement route\nSection: Eligibility requirements for settlement as a dependent partner or dependent child of a Private Servant in a diplomatic household on the International Agreement route\nTopic: eligibility\n\nSummary: This provision applies to dependent partners and children of private servants in diplomatic households under the International Agreement route. They must meet specific eligibility criteria to settle, including being genuinely dependent and meeting any relevant residence or conduct conditions; exceptions are not specified here.\n\n### Eligibility requirements for settlement as a dependent partner or dependent child of a Private Servant in a diplomatic household on the International Agreement route",
      "needs_review": false
    },
    {
      "metadata": {
        "source": "Appendix Temporary Work - International Agreement",
        "part": "Appendix Temporary Work - International Agreement",
        "section_id": "IA 34.1",
        "section_title": "Relationship requirement for settlement as a dependent partner of a Private Servant in a diplomatic household",
        "parent_section": "IA 34",
        "hierarchy_level": 2,
        "topic": "settlement",
        "url": "https://www.gov.uk/guidance/immigration-rules/immigration-rules-appendix-t5-temporary-worker-international-agreement-worker",
        "scraped_at": "2025-12-06T17:25:32.222493"
      },
      "text": "### Relationship requirement for settlement as a dependent partner of a Private Servant in a diplomatic household\n\nIA 34.1. DELETED.\n\nIA 34.2. DELETED.",
      "summary": "This provision applies to dependent partners of Private Servants in diplomatic households seeking settlement. It requires them to meet specified relationship criteria, with the relevant details deleted; no exceptions or thresholds are provided in the available text.",
      "augmented_text": "Document: Appendix Temporary Work - International Agreement\nPart: Appendix Temporary Work - International Agreement\nSection ID: IA 34.1\nSection: Relationship requirement for settlement as a dependent partner of a Private Servant in a diplomatic household\nTopic: settlement\n\nSummary: This provision applies to dependent partners of Private Servants in diplomatic households seeking settlement. It requires them to meet specified relationship criteria, with the relevant details deleted; no exceptions or thresholds are provided in the available text.\n\n### Relationship requirement for settlement as a dependent partner of a Private Servant in a diplomatic household\n\nIA 34.1. DELETED.\n\nIA 34.2. DELETED.",
      "needs_review": false
    },
    {
      "metadata": {
        "source": "Appendix Temporary Work - International Agreement",
        "part": "Appendix Temporary Work - International Agreement",
        "section_id": "IA 35.1",
        "section_title": "Qualifying period requirement for settlement as a dependent partner of a Private Servant in a diplomatic household",
        "parent_section": "IA 35",
        "hierarchy_level": 2,
        "topic": "settlement",
        "url": "https://www.gov.uk/guidance/immigration-rules/immigration-rules-appendix-t5-temporary-worker-international-agreement-worker",
        "scraped_at": "2025-12-06T17:25:32.222524"
      },
      "text": "### Qualifying period requirement for settlement as a dependent partner of a Private Servant in a diplomatic household\n\nIA 35.1. DELETED.",
      "summary": "This provision applies to dependent partners of Private Servants in diplomatic households seeking settlement. It requires fulfilling a qualifying period of residence, with specific conditions, although detailed criteria are not provided in the excerpt.",
      "augmented_text": "Document: Appendix Temporary Work - International Agreement\nPart: Appendix Temporary Work - International Agreement\nSection ID: IA 35.1\nSection: Qualifying period requirement for settlement as a dependent partner of a Private Servant in a diplomatic household\nTopic: settlement\n\nSummary: This provision applies to dependent partners of Private Servants in diplomatic households seeking settlement. It requires fulfilling a qualifying period of residence, with specific conditions, although detailed criteria are not provided in the excerpt.\n\n### Qualifying period requirement for settlement as a dependent partner of a Private Servant in a diplomatic household\n\nIA 35.1. DELETED.",
      "needs_review": false
    },
    {
      "metadata": {
        "source": "Appendix Temporary Work - International Agreement",
        "part": "Appendix Temporary Work - International Agreement",
        "section_id": "IA 36.1",
        "section_title": "Continuous residence requirement for settlement as a dependent partner of a Private Servant in a diplomatic household",
        "parent_section": "IA 36",
        "hierarchy_level": 2,
        "topic": "settlement",
        "url": "https://www.gov.uk/guidance/immigration-rules/immigration-rules-appendix-t5-temporary-worker-international-agreement-worker",
        "scraped_at": "2025-12-06T17:25:32.222566"
      },
      "text": "### Continuous residence requirement for settlement as a dependent partner of a Private Servant in a diplomatic household\n\nIA 36.1. DELETED.",
      "summary": "This provision applies to dependent partners of Private Servants in diplomatic households seeking settlement. It requires them to demonstrate continuous residence in the UK, with specific conditions and exceptions applicable to their circumstances.",
      "augmented_text": "Document: Appendix Temporary Work - International Agreement\nPart: Appendix Temporary Work - International Agreement\nSection ID: IA 36.1\nSection: Continuous residence requirement for settlement as a dependent partner of a Private Servant in a diplomatic household\nTopic: settlement\n\nSummary: This provision applies to dependent partners of Private Servants in diplomatic households seeking settlement. It requires them to demonstrate continuous residence in the UK, with specific conditions and exceptions applicable to their circumstances.\n\n### Continuous residence requirement for settlement as a dependent partner of a Private Servant in a diplomatic household\n\nIA 36.1. DELETED.",
      "needs_review": false
    },
    {
      "metadata": {
        "source": "Appendix Temporary Work - International Agreement",
        "part": "Appendix Temporary Work - International Agreement",
        "section_id": "IA 37.1",
        "section_title": "English language requirement for settlement as a dependent partner of a Private Servant in a diplomatic household",
        "parent_section": "IA 37",
        "hierarchy_level": 2,
        "topic": "english-language",
        "url": "https://www.gov.uk/guidance/immigration-rules/immigration-rules-appendix-t5-temporary-worker-international-agreement-worker",
        "scraped_at": "2025-12-06T17:25:32.222590"
      },
      "text": "### English language requirement for settlement as a dependent partner of a Private Servant in a diplomatic household\n\nIA 37.1. DELETED.\n\nIA 37.2. DELETED.",
      "summary": "This provision applies to dependent partners of Private Servants in diplomatic households seeking settlement. They must meet an English language requirement unless exemptions apply, with specific conditions outlined in the deleted sections.",
      "augmented_text": "Document: Appendix Temporary Work - International Agreement\nPart: Appendix Temporary Work - International Agreement\nSection ID: IA 37.1\nSection: English language requirement for settlement as a dependent partner of a Private Servant in a diplomatic household\nTopic: english-language\n\nSummary: This provision applies to dependent partners of Private Servants in diplomatic households seeking settlement. They must meet an English language requirement unless exemptions apply, with specific conditions outlined in the deleted sections.\n\n### English language requirement for settlement as a dependent partner of a Private Servant in a diplomatic household\n\nIA 37.1. DELETED.\n\nIA 37.2. DELETED.",
      "needs_review": false
    },
    {
      "metadata": {
        "source": "Appendix Temporary Work - International Agreement",
        "part": "Appendix Temporary Work - International Agreement",
        "section_id": "IA 38.1",
        "section_title": "Knowledge of Life in the UK requirement for settlement as a dependent partner of a Private Servant in a diplomatic household",
        "parent_section": "IA 38",
        "hierarchy_level": 2,
        "topic": "settlement",
        "url": "https://www.gov.uk/guidance/immigration-rules/immigration-rules-appendix-t5-temporary-worker-international-agreement-worker",
        "scraped_at": "2025-12-06T17:25:32.222870"
      },
      "text": "### Knowledge of Life in the UK requirement for settlement as a dependent partner of a Private Servant in a diplomatic household\n\nIA 38.1. DELETED.",
      "summary": "This provision applies to dependent partners of private servants in diplomatic households seeking settlement. They must meet the Knowledge of Life in the UK requirement unless they qualify for an exception, with specific conditions applying to diplomatic dependents.",
      "augmented_text": "Document: Appendix Temporary Work - International Agreement\nPart: Appendix Temporary Work - International Agreement\nSection ID: IA 38.1\nSection: Knowledge of Life in the UK requirement for settlement as a dependent partner of a Private Servant in a diplomatic household\nTopic: settlement\n\nSummary: This provision applies to dependent partners of private servants in diplomatic households seeking settlement. They must meet the Knowledge of Life in the UK requirement unless they qualify for an exception, with specific conditions applying to diplomatic dependents.\n\n### Knowledge of Life in the UK requirement for settlement as a dependent partner of a Private Servant in a diplomatic household\n\nIA 38.1. DELETED.",
      "needs_review": false
    },
    {
      "metadata": {
        "source": "Appendix Temporary Work - International Agreement",
        "part": "Appendix Temporary Work - International Agreement",
        "section_id": "Eligibility requirements for settlement as a dependent child of a Private Servant in a diplomatic household",
        "section_title": "Eligibility requirements for settlement as a dependent child of a Private Servant in a diplomatic household",
        "parent_section": null,
        "hierarchy_level": 3,
        "topic": "eligibility",
        "url": "https://www.gov.uk/guidance/immigration-rules/immigration-rules-appendix-t5-temporary-worker-international-agreement-worker",
        "scraped_at": "2025-12-06T17:25:32.223305"
      },
      "text": "### Eligibility requirements for settlement as a dependent child of a Private Servant in a diplomatic household",
      "summary": "This provision applies to dependent children of private servants in diplomatic households applying for settlement. They must meet specific eligibility criteria, including proof of relationship and lawful residence, with exceptions only where stipulated by diplomatic or immigration rules.",
      "augmented_text": "Document: Appendix Temporary Work - International Agreement\nPart: Appendix Temporary Work - International Agreement\nSection ID: Eligibility requirements for settlement as a dependent child of a Private Servant in a diplomatic household\nSection: Eligibility requirements for settlement as a dependent child of a Private Servant in a diplomatic household\nTopic: eligibility\n\nSummary: This provision applies to dependent children of private servants in diplomatic households applying for settlement. They must meet specific eligibility criteria, including proof of relationship and lawful residence, with exceptions only where stipulated by diplomatic or immigration rules.\n\n### Eligibility requirements for settlement as a dependent child of a Private Servant in a diplomatic household",
      "needs_review": false
    },
    {
      "metadata": {
        "source": "Appendix Temporary Work - International Agreement",
        "part": "Appendix Temporary Work - International Agreement",
        "section_id": "IA 39.1",
        "section_title": "Relationship requirement for settlement as a dependent child of a Private Servant in a diplomatic household",
        "parent_section": "IA 39",
        "hierarchy_level": 2,
        "topic": "settlement",
        "url": "https://www.gov.uk/guidance/immigration-rules/immigration-rules-appendix-t5-temporary-worker-international-agreement-worker",
        "scraped_at": "2025-12-06T17:25:32.223361"
      },
      "text": "### Relationship requirement for settlement as a dependent child of a Private Servant in a diplomatic household\n\nIA 39.1. DELETED.\n\nIA 39.2. DELETED.\n\nIA 39.3. DELETED.\n\nIA 39.4. DELETED.",
      "summary": "This provision applies to dependent children of Private Servants in diplomatic households applying for settlement. It requires establishing a genuine familial relationship, with no specific thresholds or exceptions noted in the provided text.",
      "augmented_text": "Document: Appendix Temporary Work - International Agreement\nPart: Appendix Temporary Work - International Agreement\nSection ID: IA 39.1\nSection: Relationship requirement for settlement as a dependent child of a Private Servant in a diplomatic household\nTopic: settlement\n\nSummary: This provision applies to dependent children of Private Servants in diplomatic households applying for settlement. It requires establishing a genuine familial relationship, with no specific thresholds or exceptions noted in the provided text.\n\n### Relationship requirement for settlement as a dependent child of a Private Servant in a diplomatic household\n\nIA 39.1. DELETED.\n\nIA 39.2. DELETED.\n\nIA 39.3. DELETED.\n\nIA 39.4. DELETED.",
      "needs_review": false
    },
    {
      "metadata": {
        "source": "Appendix Temporary Work - International Agreement",
        "part": "Appendix Temporary Work - International Agreement",
        "section_id": "IA 40.1",
        "section_title": "English language requirement for settlement as a dependent child of a Private Servant in a diplomatic household",
        "parent_section": "IA 40",
        "hierarchy_level": 2,
        "topic": "english-language",
        "url": "https://www.gov.uk/guidance/immigration-rules/immigration-rules-appendix-t5-temporary-worker-international-agreement-worker",
        "scraped_at": "2025-12-06T17:25:32.223374"
      },
      "text": "### English language requirement for settlement as a dependent child of a Private Servant in a diplomatic household\n\nIA 40.1. DELETED.\n\nIA 40.2. DELETED.",
      "summary": "This provision applies to dependent children of Private Servants in diplomatic households seeking settlement. It requires demonstrating a specified level of English language ability, with certain conditions or exceptions outlined in the full regulation.",
      "augmented_text": "Document: Appendix Temporary Work - International Agreement\nPart: Appendix Temporary Work - International Agreement\nSection ID: IA 40.1\nSection: English language requirement for settlement as a dependent child of a Private Servant in a diplomatic household\nTopic: english-language\n\nSummary: This provision applies to dependent children of Private Servants in diplomatic households seeking settlement. It requires demonstrating a specified level of English language ability, with certain conditions or exceptions outlined in the full regulation.\n\n### English language requirement for settlement as a dependent child of a Private Servant in a diplomatic household\n\nIA 40.1. DELETED.\n\nIA 40.2. DELETED.",
      "needs_review": false
    },
    {
      "metadata": {
        "source": "Appendix Temporary Work - International Agreement",
        "part": "Appendix Temporary Work - International Agreement",
        "section_id": "IA 41.1",
        "section_title": "Knowledge of Life in the UK requirement for settlement as a dependent child of a Private Servant in a diplomatic household",
        "parent_section": "IA 41",
        "hierarchy_level": 2,
        "topic": "settlement",
        "url": "https://www.gov.uk/guidance/immigration-rules/immigration-rules-appendix-t5-temporary-worker-international-agreement-worker",
        "scraped_at": "2025-12-06T17:25:32.223388"
      },
      "text": "### Knowledge of Life in the UK requirement for settlement as a dependent child of a Private Servant in a diplomatic household\n\nIA 41.1. DELETED.",
      "summary": "This provision applies to dependent children of private servants in diplomatic households seeking settlement. They must meet the Knowledge of Life in the UK requirement unless an exception applies; specific conditions or exemptions are not detailed here.",
      "augmented_text": "Document: Appendix Temporary Work - International Agreement\nPart: Appendix Temporary Work - International Agreement\nSection ID: IA 41.1\nSection: Knowledge of Life in the UK requirement for settlement as a dependent child of a Private Servant in a diplomatic household\nTopic: settlement\n\nSummary: This provision applies to dependent children of private servants in diplomatic households seeking settlement. They must meet the Knowledge of Life in the UK requirement unless an exception applies; specific conditions or exemptions are not detailed here.\n\n### Knowledge of Life in the UK requirement for settlement as a dependent child of a Private Servant in a diplomatic household\n\nIA 41.1. DELETED.",
      "needs_review": false
    },
    {
      "metadata": {
        "source": "Appendix Temporary Work - International Agreement",
        "part": "Appendix Temporary Work - International Agreement",
        "section_id": "IA 42.1",
        "section_title": "Decision on an application for settlement as a dependent partner or dependent child of a Private Servant in a diplomatic household",
        "parent_section": "IA 42",
        "hierarchy_level": 2,
        "topic": "settlement",
        "url": "https://www.gov.uk/guidance/immigration-rules/immigration-rules-appendix-t5-temporary-worker-international-agreement-worker",
        "scraped_at": "2025-12-06T17:25:32.223403"
      },
      "text": "### Decision on an application for settlement as a dependent partner or dependent child of a Private Servant in a diplomatic household\n\nIA 42.1. DELETED.\n\nIA 42.2. DELETED.\n\nPrint this page",
      "summary": "This provision applies to dependent partners or children of Private Servants in diplomatic households applying for settlement. It specifies that the application will be decided based on relevant criteria, with certain conditions or exceptions potentially outlined elsewhere; no detailed requirements are provided in the excerpt.",
      "augmented_text": "Document: Appendix Temporary Work - International Agreement\nPart: Appendix Temporary Work - International Agreement\nSection ID: IA 42.1\nSection: Decision on an application for settlement as a dependent partner or dependent child of a Private Servant in a diplomatic household\nTopic: settlement\n\nSummary: This provision applies to dependent partners or children of Private Servants in diplomatic households applying for settlement. It specifies that the application will be decided based on relevant criteria, with certain conditions or exceptions potentially outlined elsewhere; no detailed requirements are provided in the excerpt.\n\n### Decision on an application for settlement as a dependent partner or dependent child of a Private Servant in a diplomatic household\n\nIA 42.1. DELETED.\n\nIA 42.2. DELETED.\n\nPrint this page",
      "needs_review": false
    }
  ]
}