{
  "url": "https://www.gov.uk/guidance/immigration-rules/immigration-rules-appendix-t5-temporary-worker-charity-worker",
  "part_name": "Appendix Temporary Work - Charity Worker",
  "scraped_at": "2025-12-06T17:25:30.159107",
  "chunk_count": 24,
  "chunks": [
    {
      "metadata": {
        "source": "Appendix Temporary Work - Charity Worker",
        "part": "Appendix Temporary Work - Charity Worker",
        "section_id": "CW 1.1",
        "section_title": "Validity requirements for a Charity Worker",
        "parent_section": "CW 1",
        "hierarchy_level": 2,
        "topic": "leave-to-enter",
        "url": "https://www.gov.uk/guidance/immigration-rules/immigration-rules-appendix-t5-temporary-worker-charity-worker",
        "scraped_at": "2025-12-06T17:25:30.158234"
      },
      "text": "### Validity requirements for a Charity Worker\n\nCW 1.1. A person applying for entry clearance or permission to stay as a Charity Worker must apply online on gov.uk on the specified form as follows:\n\n| Applicant | Specified form |\n| --- | --- |\n| EEA national with a chipped passport | Either: •Temporary Worker using the UK Immigration: ID Check app; or • the forms listed below for applicants outside or inside the UK (as relevant) |\n| Applicants outside the UK | Temporary Worker visa |\n| Applicants inside the UK | Temporary Worker |\n\n1.   CW 1.2. An application for entry clearance or permission to stay as a Charity Worker must meet all the following requirements: \n    1.   (a) any fee and Immigration Health Charge must have been paid; and\n    2.   (b) the applicant must have provided biometrics when required; and\n    3.   (c) the applicant must have provided a passport or other travel document which satisfactorily establishes their identity and nationality; and\n    4.   (d) the applicant must have a Certificate of Sponsorship that was issued to them no more than 3 months before the date of application.\n\nCW 1.3. The applicant must be aged 18 or over on the date of application.\n\nCW 1.4. If applying for permission to stay, the applicant must be in the UK on the date of application.\n\nCW 1.4A. If applying for permission to stay, the applicant must have, or have last had, permission as a Charity Worker.\n\nCW 1.5. An application which does not meet all the validity requirements for a Charity Worker may be rejected as invalid and not considered.",
      "summary": "Charity Worker applicants must apply online using specified forms, pay fees, provide biometrics and identification, and hold a valid Certificate of Sponsorship issued within three months. They must be 18 or over and, if applying for permission to stay, be in the UK with prior valid permission. Exceptions apply based on applicant status and application timing.",
      "augmented_text": "Document: Appendix Temporary Work - Charity Worker\nPart: Appendix Temporary Work - Charity Worker\nSection ID: CW 1.1\nSection: Validity requirements for a Charity Worker\nTopic: leave-to-enter\n\nSummary: Charity Worker applicants must apply online using specified forms, pay fees, provide biometrics and identification, and hold a valid Certificate of Sponsorship issued within three months. They must be 18 or over and, if applying for permission to stay, be in the UK with prior valid permission. Exceptions apply based on applicant status and application timing.\n\n### Validity requirements for a Charity Worker\n\nCW 1.1. A person applying for entry clearance or permission to stay as a Charity Worker must apply online on gov.uk on the specified form as follows:\n\n| Applicant | Specified form |\n| --- | --- |\n| EEA national with a chipped passport | Either: •Temporary Worker using the UK Immigration: ID Check app; or • the forms listed below for applicants outside or inside the UK (as relevant) |\n| Applicants outside the UK | Temporary Worker visa |\n| Applicants inside the UK | Temporary Worker |\n\n1.   CW 1.2. An application for entry clearance or permission to stay as a Charity Worker must meet all the following requirements: \n    1.   (a) any fee and Immigration Health Charge must have been paid; and\n    2.   (b) the applicant must have provided biometrics when required; and\n    3.   (c) the applicant must have provided a passport or other travel document which satisfactorily establishes their identity and nationality; and\n    4.   (d) the applicant must have a Certificate of Sponsorship that was issued to them no more than 3 months before the date of application.\n\nCW 1.3. The applicant must be aged 18 or over on the date of application.\n\nCW 1.4. If applying for permission to stay, the applicant must be in the UK on the date of application.\n\nCW 1.4A. If applying for permission to stay, the applicant must have, or have last had, permission as a Charity Worker.\n\nCW 1.5. An application which does not meet all the validity requirements for a Charity Worker may be rejected as invalid and not considered.",
      "needs_review": false
    },
    {
      "metadata": {
        "source": "Appendix Temporary Work - Charity Worker",
        "part": "Appendix Temporary Work - Charity Worker",
        "section_id": "CW 2.1",
        "section_title": "Suitability requirements for a Charity Worker",
        "parent_section": "CW 2",
        "hierarchy_level": 2,
        "topic": "suitability",
        "url": "https://www.gov.uk/guidance/immigration-rules/immigration-rules-appendix-t5-temporary-worker-charity-worker",
        "scraped_at": "2025-12-06T17:25:30.158279"
      },
      "text": "### Suitability requirements for a Charity Worker\n\nCW 2.1. The applicant must not fall for refusal under Part Suitability.\n\n1.   CW 2.2. If applying for permission to stay the applicant must not be: \n    1.   (a) in breach of immigration laws, except that where the Exceptions for overstayers section of Part Suitability applies, that period of overstaying will be disregarded; or\n    2.   (b) on immigration bail.",
      "summary": "This provision applies to charity worker applicants. They must not breach immigration laws (excluding certain overstays) or be on immigration bail to be considered suitable for permission to stay.",
      "augmented_text": "Document: Appendix Temporary Work - Charity Worker\nPart: Appendix Temporary Work - Charity Worker\nSection ID: CW 2.1\nSection: Suitability requirements for a Charity Worker\nTopic: suitability\n\nSummary: This provision applies to charity worker applicants. They must not breach immigration laws (excluding certain overstays) or be on immigration bail to be considered suitable for permission to stay.\n\n### Suitability requirements for a Charity Worker\n\nCW 2.1. The applicant must not fall for refusal under Part Suitability.\n\n1.   CW 2.2. If applying for permission to stay the applicant must not be: \n    1.   (a) in breach of immigration laws, except that where the Exceptions for overstayers section of Part Suitability applies, that period of overstaying will be disregarded; or\n    2.   (b) on immigration bail.",
      "needs_review": true,
      "review_reasons": [
        "generic_summary"
      ]
    },
    {
      "metadata": {
        "source": "Appendix Temporary Work - Charity Worker",
        "part": "Appendix Temporary Work - Charity Worker",
        "section_id": "Eligibility requirements for a Charity Worker",
        "section_title": "Eligibility requirements for a Charity Worker",
        "parent_section": null,
        "hierarchy_level": 2,
        "topic": "eligibility",
        "url": "https://www.gov.uk/guidance/immigration-rules/immigration-rules-appendix-t5-temporary-worker-charity-worker",
        "scraped_at": "2025-12-06T17:25:30.158296"
      },
      "text": "### Eligibility requirements for a Charity Worker",
      "summary": "This provision applies to individuals applying as Charity Workers. Applicants must meet specified eligibility criteria, including demonstrating they will work for a recognized charity and meet the relevant conditions. Critical thresholds or exceptions are not specified in this excerpt.",
      "augmented_text": "Document: Appendix Temporary Work - Charity Worker\nPart: Appendix Temporary Work - Charity Worker\nSection ID: Eligibility requirements for a Charity Worker\nSection: Eligibility requirements for a Charity Worker\nTopic: eligibility\n\nSummary: This provision applies to individuals applying as Charity Workers. Applicants must meet specified eligibility criteria, including demonstrating they will work for a recognized charity and meet the relevant conditions. Critical thresholds or exceptions are not specified in this excerpt.\n\n### Eligibility requirements for a Charity Worker",
      "needs_review": false
    },
    {
      "metadata": {
        "source": "Appendix Temporary Work - Charity Worker",
        "part": "Appendix Temporary Work - Charity Worker",
        "section_id": "CW 3.1",
        "section_title": "Entry requirements for a Charity Worker",
        "parent_section": "CW 3",
        "hierarchy_level": 2,
        "topic": "leave-to-enter",
        "url": "https://www.gov.uk/guidance/immigration-rules/immigration-rules-appendix-t5-temporary-worker-charity-worker",
        "scraped_at": "2025-12-06T17:25:30.158328"
      },
      "text": "### Entry requirements for a Charity Worker\n\nCW 3.1. A person seeking to come to the UK on the Charity Worker route must have applied for and obtained entry clearance as a Charity Worker before they arrive in the UK.\n\nCW 3.2. A person applying for entry clearance as a Charity Worker must, if Appendix Tuberculosis applies, provide a valid medical certificate confirming that they have undergone screening for active pulmonary tuberculosis and that this tuberculosis is not present in them.\n\nCW 3.3. An applicant for entry clearance must not have had permission as a Religious Worker or Charity Worker at any time during the 12 months immediately before the date of application unless they can show they were not in the UK at any time during those 12 months.",
      "summary": "Charity Workers seeking entry to the UK must obtain prior entry clearance as a Charity Worker, and, if applicable, provide a TB screening certificate; recent permission as a Religious or Charity Worker within the past 12 months may disqualify unless they were not in the UK during that period.",
      "augmented_text": "Document: Appendix Temporary Work - Charity Worker\nPart: Appendix Temporary Work - Charity Worker\nSection ID: CW 3.1\nSection: Entry requirements for a Charity Worker\nTopic: leave-to-enter\n\nSummary: Charity Workers seeking entry to the UK must obtain prior entry clearance as a Charity Worker, and, if applicable, provide a TB screening certificate; recent permission as a Religious or Charity Worker within the past 12 months may disqualify unless they were not in the UK during that period.\n\n### Entry requirements for a Charity Worker\n\nCW 3.1. A person seeking to come to the UK on the Charity Worker route must have applied for and obtained entry clearance as a Charity Worker before they arrive in the UK.\n\nCW 3.2. A person applying for entry clearance as a Charity Worker must, if Appendix Tuberculosis applies, provide a valid medical certificate confirming that they have undergone screening for active pulmonary tuberculosis and that this tuberculosis is not present in them.\n\nCW 3.3. An applicant for entry clearance must not have had permission as a Religious Worker or Charity Worker at any time during the 12 months immediately before the date of application unless they can show they were not in the UK at any time during those 12 months.",
      "needs_review": false
    },
    {
      "metadata": {
        "source": "Appendix Temporary Work - Charity Worker",
        "part": "Appendix Temporary Work - Charity Worker",
        "section_id": "CW 4.1",
        "section_title": "Sponsorship requirement for a Charity Worker",
        "parent_section": null,
        "hierarchy_level": 1,
        "topic": "sponsorship",
        "url": "https://www.gov.uk/guidance/immigration-rules/immigration-rules-appendix-t5-temporary-worker-charity-worker",
        "scraped_at": "2025-12-06T17:25:30.158381"
      },
      "text": "### Sponsorship requirement for a Charity Worker\n\n1.   CW 4.1. The applicant must have a valid Certificate of Sponsorship for the job they are planning to do; which to be valid must: \n    1.   (a) confirm the applicant’s name, that they are being sponsored as a Charity Worker, details of the job the sponsor is offering them; and\n    2.   (b) include a start date, stated by the sponsor, which is no more than three months after the date of application; and\n    3.   (c) not have been used in a previous application which was either granted or refused (but can have been used in a previous application which was rejected as invalid, made void or withdrawn); and\n    4.   (d) not have been withdrawn by the sponsor or cancelled by the Home Office; and\n    5.   (e) include confirmation that the role meets the requirement at CW 4.2.\n\n2.   CW 4.2. The sponsor must ensure the role meets the following requirements: \n    1.   (a) it is voluntary fieldwork which contributes directly to the achievement or advancement of the sponsor’s charitable purpose; and\n    2.   (b) it must be voluntary work and not be paid or otherwise remunerated, including receipt of benefits in kind, except for reasonable expenses and the provision of accommodation as is reasonable in the circumstances as defined in the National Minimum Wage Act 1988; and\n    3.   (c) the applicant must not be filling a permanent position, including on a temporary basis.\n\nCW 4.3. The sponsor must be authorised by the Home Office to sponsor the job in question under the Charity Worker route.\n\nCW 4.4. The sponsor must be listed as A-rated on the Home Office’s register of licensed sponsors, unless the applicant was last granted permission as a Charity Worker and is applying to continue working for the same sponsor as in their last permission.\n\nCW 4.5. The decision maker must not have reasonable grounds to believe the job the applicant is being sponsored to do does not comply with the National Minimum Wage Regulations or the Working Time Regulations.",
      "summary": "This provision applies to applicants seeking to work as Charity Workers under the UK Immigration Rules. They must hold a valid Certificate of Sponsorship confirming their role, which must meet voluntary, non-remunerated criteria and not fill a permanent position; the certificate’s validity depends on specific conditions and must be issued within three months of application.",
      "augmented_text": "Document: Appendix Temporary Work - Charity Worker\nPart: Appendix Temporary Work - Charity Worker\nSection ID: CW 4.1\nSection: Sponsorship requirement for a Charity Worker\nTopic: sponsorship\n\nSummary: This provision applies to applicants seeking to work as Charity Workers under the UK Immigration Rules. They must hold a valid Certificate of Sponsorship confirming their role, which must meet voluntary, non-remunerated criteria and not fill a permanent position; the certificate’s validity depends on specific conditions and must be issued within three months of application.\n\n### Sponsorship requirement for a Charity Worker\n\n1.   CW 4.1. The applicant must have a valid Certificate of Sponsorship for the job they are planning to do; which to be valid must: \n    1.   (a) confirm the applicant’s name, that they are being sponsored as a Charity Worker, details of the job the sponsor is offering them; and\n    2.   (b) include a start date, stated by the sponsor, which is no more than three months after the date of application; and\n    3.   (c) not have been used in a previous application which was either granted or refused (but can have been used in a previous application which was rejected as invalid, made void or withdrawn); and\n    4.   (d) not have been withdrawn by the sponsor or cancelled by the Home Office; and\n    5.   (e) include confirmation that the role meets the requirement at CW 4.2.\n\n2.   CW 4.2. The sponsor must ensure the role meets the following requirements: \n    1.   (a) it is voluntary fieldwork which contributes directly to the achievement or advancement of the sponsor’s charitable purpose; and\n    2.   (b) it must be voluntary work and not be paid or otherwise remunerated, including receipt of benefits in kind, except for reasonable expenses and the provision of accommodation as is reasonable in the circumstances as defined in the National Minimum Wage Act 1988; and\n    3.   (c) the applicant must not be filling a permanent position, including on a temporary basis.\n\nCW 4.3. The sponsor must be authorised by the Home Office to sponsor the job in question under the Charity Worker route.\n\nCW 4.4. The sponsor must be listed as A-rated on the Home Office’s register of licensed sponsors, unless the applicant was last granted permission as a Charity Worker and is applying to continue working for the same sponsor as in their last permission.\n\nCW 4.5. The decision maker must not have reasonable grounds to believe the job the applicant is being sponsored to do does not comply with the National Minimum Wage Regulations or the Working Time Regulations.",
      "needs_review": false
    },
    {
      "metadata": {
        "source": "Appendix Temporary Work - Charity Worker",
        "part": "Appendix Temporary Work - Charity Worker",
        "section_id": "CW 5.1",
        "section_title": "Genuineness requirement for a Charity Worker",
        "parent_section": null,
        "hierarchy_level": 1,
        "topic": "eligibility",
        "url": "https://www.gov.uk/guidance/immigration-rules/immigration-rules-appendix-t5-temporary-worker-charity-worker",
        "scraped_at": "2025-12-06T17:25:30.158420"
      },
      "text": "### Genuineness requirement for a Charity Worker\n\n1.   CW 5.1. The applicant must: \n    1.   (a) genuinely intend, and be able, to undertake the role for which they are being sponsored; and\n    2.   (b) not intend to undertake employment other than in the role for which they are being sponsored, or as otherwise permitted by paragraph CW 8.3.",
      "summary": "Charity Worker applicants must genuinely intend and be capable of performing the sponsored role, and restrict employment to that role unless permitted. They must not intend to undertake other employment beyond their sponsored position.",
      "augmented_text": "Document: Appendix Temporary Work - Charity Worker\nPart: Appendix Temporary Work - Charity Worker\nSection ID: CW 5.1\nSection: Genuineness requirement for a Charity Worker\nTopic: eligibility\n\nSummary: Charity Worker applicants must genuinely intend and be capable of performing the sponsored role, and restrict employment to that role unless permitted. They must not intend to undertake other employment beyond their sponsored position.\n\n### Genuineness requirement for a Charity Worker\n\n1.   CW 5.1. The applicant must: \n    1.   (a) genuinely intend, and be able, to undertake the role for which they are being sponsored; and\n    2.   (b) not intend to undertake employment other than in the role for which they are being sponsored, or as otherwise permitted by paragraph CW 8.3.",
      "needs_review": false
    },
    {
      "metadata": {
        "source": "Appendix Temporary Work - Charity Worker",
        "part": "Appendix Temporary Work - Charity Worker",
        "section_id": "CW 6.1",
        "section_title": "Financial Requirement for a Charity Worker",
        "parent_section": "CW 6",
        "hierarchy_level": 2,
        "topic": "financial",
        "url": "https://www.gov.uk/guidance/immigration-rules/immigration-rules-appendix-t5-temporary-worker-charity-worker",
        "scraped_at": "2025-12-06T17:25:30.158445"
      },
      "text": "### Financial Requirement for a Charity Worker\n\nCW 6.1. If the applicant is applying for permission to stay and has been in the UK with permission for 12 months or longer on the date of application, they will meet the financial requirement and do not need to show funds.\n\n1.   CW 6.2. If the applicant is applying for entry clearance, or is applying for permission to stay and has been in the UK for less than 12 months on the date of application, either: \n    1.   (a) the applicant must have funds of at least £1,270; or\n    2.   (b) the applicant’s A rated sponsor must confirm on the Certificate of Sponsorship that they will, if it is necessary, maintain and accommodate the applicant up to the end of the first month of their employment for an amount of at least £1,270.\n\nCW 6.3. If CW 6.2.(a) applies, the applicant must show that they have held the required level of funds for a 28-day period and as specified in Appendix Finance.",
      "summary": "Charity Worker applicants in the UK must have £1,270 in funds if in the country for less than 12 months or obtain sponsor confirmation; those in the UK for over 12 months are deemed to meet the financial requirement without additional proof.",
      "augmented_text": "Document: Appendix Temporary Work - Charity Worker\nPart: Appendix Temporary Work - Charity Worker\nSection ID: CW 6.1\nSection: Financial Requirement for a Charity Worker\nTopic: financial\n\nSummary: Charity Worker applicants in the UK must have £1,270 in funds if in the country for less than 12 months or obtain sponsor confirmation; those in the UK for over 12 months are deemed to meet the financial requirement without additional proof.\n\n### Financial Requirement for a Charity Worker\n\nCW 6.1. If the applicant is applying for permission to stay and has been in the UK with permission for 12 months or longer on the date of application, they will meet the financial requirement and do not need to show funds.\n\n1.   CW 6.2. If the applicant is applying for entry clearance, or is applying for permission to stay and has been in the UK for less than 12 months on the date of application, either: \n    1.   (a) the applicant must have funds of at least £1,270; or\n    2.   (b) the applicant’s A rated sponsor must confirm on the Certificate of Sponsorship that they will, if it is necessary, maintain and accommodate the applicant up to the end of the first month of their employment for an amount of at least £1,270.\n\nCW 6.3. If CW 6.2.(a) applies, the applicant must show that they have held the required level of funds for a 28-day period and as specified in Appendix Finance.",
      "needs_review": false
    },
    {
      "metadata": {
        "source": "Appendix Temporary Work - Charity Worker",
        "part": "Appendix Temporary Work - Charity Worker",
        "section_id": "CW 7.1",
        "section_title": "Decision on an application as a Charity Worker",
        "parent_section": "CW 7",
        "hierarchy_level": 2,
        "topic": "eligibility",
        "url": "https://www.gov.uk/guidance/immigration-rules/immigration-rules-appendix-t5-temporary-worker-charity-worker",
        "scraped_at": "2025-12-06T17:25:30.158464"
      },
      "text": "### Decision on an application as a Charity Worker\n\nCW 7.1. If the decision maker is satisfied that all the suitability and eligibility requirements for the Charity Worker route are met, the application will be granted, otherwise the application will be refused.\n\nCW 7.2. If the application is refused, the person can apply for an Administrative Review under Appendix AR: Administrative Review.",
      "summary": "This provision applies to applicants for the Charity Worker route. Decisions depend on meeting all suitability and eligibility criteria; applications are granted if satisfied, otherwise refused, with refusals eligible for Administrative Review.",
      "augmented_text": "Document: Appendix Temporary Work - Charity Worker\nPart: Appendix Temporary Work - Charity Worker\nSection ID: CW 7.1\nSection: Decision on an application as a Charity Worker\nTopic: eligibility\n\nSummary: This provision applies to applicants for the Charity Worker route. Decisions depend on meeting all suitability and eligibility criteria; applications are granted if satisfied, otherwise refused, with refusals eligible for Administrative Review.\n\n### Decision on an application as a Charity Worker\n\nCW 7.1. If the decision maker is satisfied that all the suitability and eligibility requirements for the Charity Worker route are met, the application will be granted, otherwise the application will be refused.\n\nCW 7.2. If the application is refused, the person can apply for an Administrative Review under Appendix AR: Administrative Review.",
      "needs_review": false
    },
    {
      "metadata": {
        "source": "Appendix Temporary Work - Charity Worker",
        "part": "Appendix Temporary Work - Charity Worker",
        "section_id": "1",
        "section_title": "Period of grant for a Charity Worker",
        "parent_section": null,
        "hierarchy_level": 1,
        "topic": "leave-to-enter",
        "url": "https://www.gov.uk/guidance/immigration-rules/immigration-rules-appendix-t5-temporary-worker-charity-worker",
        "scraped_at": "2025-12-06T17:25:30.158494"
      },
      "text": "### Period of grant for a Charity Worker\n\n1.   CW 8.1. If the application is for entry clearance, the applicant will be granted whichever is the shorter of: \n    1.   (a) the period of the job on the Certificate of Sponsorship plus 14 days before and after; or\n    2.   (b) 12 months.\n\n2.   CW 8.2. If the application is for permission to stay, the applicant will be granted whichever is the shorter of: \n    1.   (a) the period of the job on the Certificate of Sponsorship plus 14 days; or\n    2.   (b) the difference between the period the applicant has already spent in the UK since their last grant of permission as a Charity Worker and 12 months.",
      "summary": "Charity Workers applying for entry clearance or permission to stay are granted a period up to 12 months or the sponsorship period plus 14 days, whichever is shorter. For those already in the UK, the stay cannot exceed 12 months minus their existing time in the UK, ensuring a maximum one-year duration.",
      "augmented_text": "Document: Appendix Temporary Work - Charity Worker\nPart: Appendix Temporary Work - Charity Worker\nSection ID: 1\nSection: Period of grant for a Charity Worker\nTopic: leave-to-enter\n\nSummary: Charity Workers applying for entry clearance or permission to stay are granted a period up to 12 months or the sponsorship period plus 14 days, whichever is shorter. For those already in the UK, the stay cannot exceed 12 months minus their existing time in the UK, ensuring a maximum one-year duration.\n\n### Period of grant for a Charity Worker\n\n1.   CW 8.1. If the application is for entry clearance, the applicant will be granted whichever is the shorter of: \n    1.   (a) the period of the job on the Certificate of Sponsorship plus 14 days before and after; or\n    2.   (b) 12 months.\n\n2.   CW 8.2. If the application is for permission to stay, the applicant will be granted whichever is the shorter of: \n    1.   (a) the period of the job on the Certificate of Sponsorship plus 14 days; or\n    2.   (b) the difference between the period the applicant has already spent in the UK since their last grant of permission as a Charity Worker and 12 months.",
      "needs_review": false
    },
    {
      "metadata": {
        "source": "Appendix Temporary Work - Charity Worker",
        "part": "Appendix Temporary Work - Charity Worker",
        "section_id": "1",
        "section_title": "Conditions of grant for a Charity Worker",
        "parent_section": null,
        "hierarchy_level": 1,
        "topic": "financial",
        "url": "https://www.gov.uk/guidance/immigration-rules/immigration-rules-appendix-t5-temporary-worker-charity-worker",
        "scraped_at": "2025-12-06T17:25:30.158516"
      },
      "text": "### Conditions of grant for a Charity Worker\n\n1.   CW 8.3. The grant will be subject to all the following conditions: \n    1.   (a) no access to public funds; and\n    2.   (b) work is permitted only in the role the applicant is being sponsored for; and\n    3.   (c) voluntary work with another organisation is permitted, providing it is in the same role as the one listed on the Certificate of Sponsorship; and\n    4.   (d) study is permitted, subject to the ATAS condition in Appendix ATAS.\n    5.   (e) DELETED.",
      "summary": "This provision applies to Charity Workers granted permission under Appendix Temporary Work. It requires they do not access public funds, work only in their sponsored role (including voluntary work in the same role), and may study with ATAS compliance; exceptions or modifications are not specified.",
      "augmented_text": "Document: Appendix Temporary Work - Charity Worker\nPart: Appendix Temporary Work - Charity Worker\nSection ID: 1\nSection: Conditions of grant for a Charity Worker\nTopic: financial\n\nSummary: This provision applies to Charity Workers granted permission under Appendix Temporary Work. It requires they do not access public funds, work only in their sponsored role (including voluntary work in the same role), and may study with ATAS compliance; exceptions or modifications are not specified.\n\n### Conditions of grant for a Charity Worker\n\n1.   CW 8.3. The grant will be subject to all the following conditions: \n    1.   (a) no access to public funds; and\n    2.   (b) work is permitted only in the role the applicant is being sponsored for; and\n    3.   (c) voluntary work with another organisation is permitted, providing it is in the same role as the one listed on the Certificate of Sponsorship; and\n    4.   (d) study is permitted, subject to the ATAS condition in Appendix ATAS.\n    5.   (e) DELETED.",
      "needs_review": false
    },
    {
      "metadata": {
        "source": "Appendix Temporary Work - Charity Worker",
        "part": "Appendix Temporary Work - Charity Worker",
        "section_id": "SW 3.1",
        "section_title": "Dependants of a Charity Worker",
        "parent_section": null,
        "hierarchy_level": 2,
        "topic": "eligibility",
        "url": "https://www.gov.uk/guidance/immigration-rules/immigration-rules-appendix-t5-temporary-worker-charity-worker",
        "scraped_at": "2025-12-06T17:25:30.158577"
      },
      "text": "### Dependants of a Charity Worker",
      "summary": "Dependants of a charity worker must obtain entry clearance to join or remain with the main applicant. They are subject to specific eligibility criteria, including proving their relationship and meeting health and character requirements, with exceptions or variations specified in the rules.",
      "augmented_text": "Document: Appendix Temporary Work - Charity Worker\nPart: Appendix Temporary Work - Charity Worker\nSection ID: SW 3.1\nSection: Dependants of a Charity Worker\nTopic: eligibility\n\nSummary: Dependants of a charity worker must obtain entry clearance to join or remain with the main applicant. They are subject to specific eligibility criteria, including proving their relationship and meeting health and character requirements, with exceptions or variations specified in the rules.\n\n### Dependants of a Charity Worker",
      "needs_review": false
    },
    {
      "metadata": {
        "source": "Appendix Temporary Work - Charity Worker",
        "part": "Appendix Temporary Work - Charity Worker",
        "section_id": "CW 9.1",
        "section_title": "Validity requirements for a dependent partner or dependent child of a Charity Worker",
        "parent_section": "CW 9",
        "hierarchy_level": 2,
        "topic": "leave-to-enter",
        "url": "https://www.gov.uk/guidance/immigration-rules/immigration-rules-appendix-t5-temporary-worker-charity-worker",
        "scraped_at": "2025-12-06T17:25:30.158628"
      },
      "text": "### Validity requirements for a dependent partner or dependent child of a Charity Worker\n\nCW 9.1. A person applying for entry clearance or permission to stay as a dependent partner or dependent child of a Charity Worker must apply online on the gov.uk website on the specified form as follows:\n\n| Applicant | Specified form |\n| --- | --- |\n| EEA national with a chipped passport | Either (as applicable): • Dependant partner or dependant child using the UK Immigration: ID Check app; or • the forms listed below for dependant applicants outside or inside the UK as relevant. |\n| Applicants outside the UK | Dependant partner visa Dependant child visa |\n| Applicants inside the UK | If the dependant is applying at the same time as the Charity Worker, they can be included in the form Temporary Worker where the form allows dependants to be added. Otherwise: - Dependant partner - Dependant child |\n\n1.   CW 9.2. An application for entry clearance or permission to stay as a partner or child of a Charity Worker must meet all the following requirements: \n    1.   (a) any fee and Immigration Health Charge must have been paid; and\n    2.   (b) the applicant must have provided biometrics when required; and\n    3.   (c) the applicant must have provided a passport or other travel document which satisfactorily establishes their identity and nationality; and\n    4.   (d) the applicant must be applying as a partner or child of a person who: \n        1.   (i) has made a valid application for entry clearance or permission to stay on the Charity Worker route that has not been decided; or\n        2.   (ii) has entry clearance or permission to stay on the Charity Worker route.\n\nCW 9.3. An applicant applying as a dependent partner must be aged 18 or over on the date of application.\n\nCW 9.4. If applying for permission to stay, the applicant must be in the UK on the date of application.\n\n1.   CW 9.4ZA. If applying for permission to stay, the applicant must not have, or have last been granted, permission: \n    1.   (a) as a Visitor; or\n    2.   (b) as a Short-term Student; or\n    3.   (c) as a Parent of a Child Student; or\n    4.   (d) as a Seasonal Worker; or\n    5.   (e) as a Domestic Worker in a Private Household; or\n    6.   (f) outside the Immigration Rules.\n\n1.   CW 9.4A. An applicant who is applying for permission to stay and has, or last had, permission as a Student, must fulfil one of the Conditions A or B below on the date of application: \n    1.   (a) Condition A: the applicant must have completed the course of study for which the Confirmation of Acceptance for Studies was assigned (or a course to which ST 27.3 of Appendix Student applies); or\n    2.   (b) Condition B: the applicant must: \n        1.   (i) be studying a full-time course of study leading to the award of a PhD with a higher education provider which has a track record of compliance; and\n        2.   (ii) have completed at least 24 months of study on that course.\n\nCW 9.5. An application which does not meet all the validity requirements for a partner or child of a Charity Worker may be rejected as invalid and not considered.",
      "summary": "This provision applies to dependents of Charity Workers seeking entry clearance or permission to stay. Applicants must submit online forms, pay fees, provide biometric data, and verify identity, with specific requirements for those inside or outside the UK. Dependents must be linked to a valid Charity Worker application, with conditions met for their immigration process.",
      "augmented_text": "Document: Appendix Temporary Work - Charity Worker\nPart: Appendix Temporary Work - Charity Worker\nSection ID: CW 9.1\nSection: Validity requirements for a dependent partner or dependent child of a Charity Worker\nTopic: leave-to-enter\n\nSummary: This provision applies to dependents of Charity Workers seeking entry clearance or permission to stay. Applicants must submit online forms, pay fees, provide biometric data, and verify identity, with specific requirements for those inside or outside the UK. Dependents must be linked to a valid Charity Worker application, with conditions met for their immigration process.\n\n### Validity requirements for a dependent partner or dependent child of a Charity Worker\n\nCW 9.1. A person applying for entry clearance or permission to stay as a dependent partner or dependent child of a Charity Worker must apply online on the gov.uk website on the specified form as follows:\n\n| Applicant | Specified form |\n| --- | --- |\n| EEA national with a chipped passport | Either (as applicable): • Dependant partner or dependant child using the UK Immigration: ID Check app; or • the forms listed below for dependant applicants outside or inside the UK as relevant. |\n| Applicants outside the UK | Dependant partner visa Dependant child visa |\n| Applicants inside the UK | If the dependant is applying at the same time as the Charity Worker, they can be included in the form Temporary Worker where the form allows dependants to be added. Otherwise: - Dependant partner - Dependant child |\n\n1.   CW 9.2. An application for entry clearance or permission to stay as a partner or child of a Charity Worker must meet all the following requirements: \n    1.   (a) any fee and Immigration Health Charge must have been paid; and\n    2.   (b) the applicant must have provided biometrics when required; and\n    3.   (c) the applicant must have provided a passport or other travel document which satisfactorily establishes their identity and nationality; and\n    4.   (d) the applicant must be applying as a partner or child of a person who: \n        1.   (i) has made a valid application for entry clearance or permission to stay on the Charity Worker route that has not been decided; or\n        2.   (ii) has entry clearance or permission to stay on the Charity Worker route.\n\nCW 9.3. An applicant applying as a dependent partner must be aged 18 or over on the date of application.\n\nCW 9.4. If applying for permission to stay, the applicant must be in the UK on the date of application.\n\n1.   CW 9.4ZA. If applying for permission to stay, the applicant must not have, or have last been granted, permission: \n    1.   (a) as a Visitor; or\n    2.   (b) as a Short-term Student; or\n    3.   (c) as a Parent of a Child Student; or\n    4.   (d) as a Seasonal Worker; or\n    5.   (e) as a Domestic Worker in a Private Household; or\n    6.   (f) outside the Immigration Rules.\n\n1.   CW 9.4A. An applicant who is applying for permission to stay and has, or last had, permission as a Student, must fulfil one of the Conditions A or B below on the date of application: \n    1.   (a) Condition A: the applicant must have completed the course of study for which the Confirmation of Acceptance for Studies was assigned (or a course to which ST 27.3 of Appendix Student applies); or\n    2.   (b) Condition B: the applicant must: \n        1.   (i) be studying a full-time course of study leading to the award of a PhD with a higher education provider which has a track record of compliance; and\n        2.   (ii) have completed at least 24 months of study on that course.\n\nCW 9.5. An application which does not meet all the validity requirements for a partner or child of a Charity Worker may be rejected as invalid and not considered.",
      "needs_review": false
    },
    {
      "metadata": {
        "source": "Appendix Temporary Work - Charity Worker",
        "part": "Appendix Temporary Work - Charity Worker",
        "section_id": "CW 10.1",
        "section_title": "Suitability requirements for a dependent partner or dependent child of a Charity Worker",
        "parent_section": "CW 10",
        "hierarchy_level": 2,
        "topic": "suitability",
        "url": "https://www.gov.uk/guidance/immigration-rules/immigration-rules-appendix-t5-temporary-worker-charity-worker",
        "scraped_at": "2025-12-06T17:25:30.158658"
      },
      "text": "### Suitability requirements for a dependent partner or dependent child of a Charity Worker\n\nCW 10.1. The applicant must not fall for refusal under Part Suitability.\n\n1.   CW 10.2. If applying for permission to stay the applicant must not be: \n    1.   (a) in breach of immigration laws, except that where the Exceptions for overstayers section of Part Suitability applies, that period of overstaying will be disregarded; or\n    2.   (b) on immigration bail.",
      "summary": "This provision applies to dependent partners or children of Charity Workers. They must not breach immigration laws (except where overstaying is disregarded) or be on immigration bail to be considered suitable for permission to stay.",
      "augmented_text": "Document: Appendix Temporary Work - Charity Worker\nPart: Appendix Temporary Work - Charity Worker\nSection ID: CW 10.1\nSection: Suitability requirements for a dependent partner or dependent child of a Charity Worker\nTopic: suitability\n\nSummary: This provision applies to dependent partners or children of Charity Workers. They must not breach immigration laws (except where overstaying is disregarded) or be on immigration bail to be considered suitable for permission to stay.\n\n### Suitability requirements for a dependent partner or dependent child of a Charity Worker\n\nCW 10.1. The applicant must not fall for refusal under Part Suitability.\n\n1.   CW 10.2. If applying for permission to stay the applicant must not be: \n    1.   (a) in breach of immigration laws, except that where the Exceptions for overstayers section of Part Suitability applies, that period of overstaying will be disregarded; or\n    2.   (b) on immigration bail.",
      "needs_review": false
    },
    {
      "metadata": {
        "source": "Appendix Temporary Work - Charity Worker",
        "part": "Appendix Temporary Work - Charity Worker",
        "section_id": "Eligibility requirements for a dependent partner or dependent child of a Charity Worker",
        "section_title": "Eligibility requirements for a dependent partner or dependent child of a Charity Worker",
        "parent_section": null,
        "hierarchy_level": 3,
        "topic": "eligibility",
        "url": "https://www.gov.uk/guidance/immigration-rules/immigration-rules-appendix-t5-temporary-worker-charity-worker",
        "scraped_at": "2025-12-06T17:25:30.158673"
      },
      "text": "### Eligibility requirements for a dependent partner or dependent child of a Charity Worker",
      "summary": "This provision applies to dependents of Charity Workers. It requires them to meet specific eligibility criteria, including dependency status and relationship proof, with exceptions based on the primary worker’s status; detailed conditions must be satisfied for approval.",
      "augmented_text": "Document: Appendix Temporary Work - Charity Worker\nPart: Appendix Temporary Work - Charity Worker\nSection ID: Eligibility requirements for a dependent partner or dependent child of a Charity Worker\nSection: Eligibility requirements for a dependent partner or dependent child of a Charity Worker\nTopic: eligibility\n\nSummary: This provision applies to dependents of Charity Workers. It requires them to meet specific eligibility criteria, including dependency status and relationship proof, with exceptions based on the primary worker’s status; detailed conditions must be satisfied for approval.\n\n### Eligibility requirements for a dependent partner or dependent child of a Charity Worker",
      "needs_review": false
    },
    {
      "metadata": {
        "source": "Appendix Temporary Work - Charity Worker",
        "part": "Appendix Temporary Work - Charity Worker",
        "section_id": "CW 11.1",
        "section_title": "Entry requirement for a dependent partner or dependent child of a Charity Worker",
        "parent_section": "CW 11",
        "hierarchy_level": 2,
        "topic": "leave-to-enter",
        "url": "https://www.gov.uk/guidance/immigration-rules/immigration-rules-appendix-t5-temporary-worker-charity-worker",
        "scraped_at": "2025-12-06T17:25:30.158705"
      },
      "text": "### Entry requirement for a dependent partner or dependent child of a Charity Worker\n\nCW 11.1. A person seeking to come to the UK as a dependent partner or dependent child of a Charity Worker must apply for and obtain entry clearance as a dependent partner or dependent child of a Charity Worker before they arrive in the UK.\n\nCW 11.2. A person applying for entry clearance as the partner or child of a Charity Worker must, if Appendix Tuberculosis applies, provide a valid medical certificate confirming that they have undergone screening for active pulmonary tuberculosis and that this tuberculosis is not present in them.",
      "summary": "Dependent partners or children of Charity Workers must apply for and obtain entry clearance before arriving in the UK. If Appendix Tuberculosis applies, they must also provide certification confirming they are free of active pulmonary tuberculosis.",
      "augmented_text": "Document: Appendix Temporary Work - Charity Worker\nPart: Appendix Temporary Work - Charity Worker\nSection ID: CW 11.1\nSection: Entry requirement for a dependent partner or dependent child of a Charity Worker\nTopic: leave-to-enter\n\nSummary: Dependent partners or children of Charity Workers must apply for and obtain entry clearance before arriving in the UK. If Appendix Tuberculosis applies, they must also provide certification confirming they are free of active pulmonary tuberculosis.\n\n### Entry requirement for a dependent partner or dependent child of a Charity Worker\n\nCW 11.1. A person seeking to come to the UK as a dependent partner or dependent child of a Charity Worker must apply for and obtain entry clearance as a dependent partner or dependent child of a Charity Worker before they arrive in the UK.\n\nCW 11.2. A person applying for entry clearance as the partner or child of a Charity Worker must, if Appendix Tuberculosis applies, provide a valid medical certificate confirming that they have undergone screening for active pulmonary tuberculosis and that this tuberculosis is not present in them.",
      "needs_review": false
    },
    {
      "metadata": {
        "source": "Appendix Temporary Work - Charity Worker",
        "part": "Appendix Temporary Work - Charity Worker",
        "section_id": "1",
        "section_title": "Relationship requirement for a dependent partner of a Charity Worker",
        "parent_section": null,
        "hierarchy_level": 1,
        "topic": "family",
        "url": "https://www.gov.uk/guidance/immigration-rules/immigration-rules-appendix-t5-temporary-worker-charity-worker",
        "scraped_at": "2025-12-06T17:25:30.158741"
      },
      "text": "### Relationship requirement for a dependent partner of a Charity Worker\n\n1.   CW 12.1. The applicant must be the partner of a person (P) where one of the following applies: \n    1.   (a) P has permission on the Charity Worker route; or\n    2.   (b) P is, at the same time, applying for (and is granted) entry clearance or permission on the Charity Worker route.\n\n2.   CW 12.2. The requirements of Appendix Relationship with Partner must be met.\n\nCW 12.3. DELETED.\n\nCW 12.4. DELETED.",
      "summary": "This provision applies to dependent partners of Charity Workers. They must be the partner of someone with permission or applying for permission under the Charity Worker route and meet the Appendix Relationship with Partner requirements. No additional conditions or thresholds are specified.",
      "augmented_text": "Document: Appendix Temporary Work - Charity Worker\nPart: Appendix Temporary Work - Charity Worker\nSection ID: 1\nSection: Relationship requirement for a dependent partner of a Charity Worker\nTopic: family\n\nSummary: This provision applies to dependent partners of Charity Workers. They must be the partner of someone with permission or applying for permission under the Charity Worker route and meet the Appendix Relationship with Partner requirements. No additional conditions or thresholds are specified.\n\n### Relationship requirement for a dependent partner of a Charity Worker\n\n1.   CW 12.1. The applicant must be the partner of a person (P) where one of the following applies: \n    1.   (a) P has permission on the Charity Worker route; or\n    2.   (b) P is, at the same time, applying for (and is granted) entry clearance or permission on the Charity Worker route.\n\n2.   CW 12.2. The requirements of Appendix Relationship with Partner must be met.\n\nCW 12.3. DELETED.\n\nCW 12.4. DELETED.",
      "needs_review": false
    },
    {
      "metadata": {
        "source": "Appendix Temporary Work - Charity Worker",
        "part": "Appendix Temporary Work - Charity Worker",
        "section_id": "1",
        "section_title": "Relationship requirement for a dependent child of a Charity Worker",
        "parent_section": null,
        "hierarchy_level": 1,
        "topic": "family",
        "url": "https://www.gov.uk/guidance/immigration-rules/immigration-rules-appendix-t5-temporary-worker-charity-worker",
        "scraped_at": "2025-12-06T17:25:30.158772"
      },
      "text": "### Relationship requirement for a dependent child of a Charity Worker\n\n1.   CW 13.1. DELETED.\n2.   CW 13.2. DELETED.\n\nCW 13.3. DELETED.",
      "summary": "This provision applies to dependent children of Charity Workers. They must demonstrate a genuine and subsisting relationship with the charity worker, meeting specific eligibility criteria. Deleted sections indicate additional conditions or standards previously outlined.",
      "augmented_text": "Document: Appendix Temporary Work - Charity Worker\nPart: Appendix Temporary Work - Charity Worker\nSection ID: 1\nSection: Relationship requirement for a dependent child of a Charity Worker\nTopic: family\n\nSummary: This provision applies to dependent children of Charity Workers. They must demonstrate a genuine and subsisting relationship with the charity worker, meeting specific eligibility criteria. Deleted sections indicate additional conditions or standards previously outlined.\n\n### Relationship requirement for a dependent child of a Charity Worker\n\n1.   CW 13.1. DELETED.\n2.   CW 13.2. DELETED.\n\nCW 13.3. DELETED.",
      "needs_review": false
    },
    {
      "metadata": {
        "source": "Appendix Temporary Work - Charity Worker",
        "part": "Appendix Temporary Work - Charity Worker",
        "section_id": "CW 14.1",
        "section_title": "Care requirement for a dependent child of a Charity Worker",
        "parent_section": "CW 14",
        "hierarchy_level": 2,
        "topic": "family",
        "url": "https://www.gov.uk/guidance/immigration-rules/immigration-rules-appendix-t5-temporary-worker-charity-worker",
        "scraped_at": "2025-12-06T17:25:30.158802"
      },
      "text": "### Care requirement for a dependent child of a Charity Worker\n\nCW 14.1. DELETED.",
      "summary": "This provision applies to dependent children of Charity Workers. It requires evidence of adequate care arrangements and financial support for the child's wellbeing, with exceptions only if specified conditions are met. The key focus is ensuring adequate care before granting permission.",
      "augmented_text": "Document: Appendix Temporary Work - Charity Worker\nPart: Appendix Temporary Work - Charity Worker\nSection ID: CW 14.1\nSection: Care requirement for a dependent child of a Charity Worker\nTopic: family\n\nSummary: This provision applies to dependent children of Charity Workers. It requires evidence of adequate care arrangements and financial support for the child's wellbeing, with exceptions only if specified conditions are met. The key focus is ensuring adequate care before granting permission.\n\n### Care requirement for a dependent child of a Charity Worker\n\nCW 14.1. DELETED.",
      "needs_review": false
    },
    {
      "metadata": {
        "source": "Appendix Temporary Work - Charity Worker",
        "part": "Appendix Temporary Work - Charity Worker",
        "section_id": "CW 15.1",
        "section_title": "Age requirement for a dependent child of a Charity Worker",
        "parent_section": "CW 15",
        "hierarchy_level": 2,
        "topic": "family",
        "url": "https://www.gov.uk/guidance/immigration-rules/immigration-rules-appendix-t5-temporary-worker-charity-worker",
        "scraped_at": "2025-12-06T17:25:30.158831"
      },
      "text": "### Age requirement for a dependent child of a Charity Worker\n\nCW 15.1. DELETED.\n\nCW 15.2. DELETED.",
      "summary": "This provision applies to dependent children of Charity Workers. It stipulates an age requirement for dependents, with specific conditions or exceptions outlined elsewhere, though details are not provided in this excerpt.",
      "augmented_text": "Document: Appendix Temporary Work - Charity Worker\nPart: Appendix Temporary Work - Charity Worker\nSection ID: CW 15.1\nSection: Age requirement for a dependent child of a Charity Worker\nTopic: family\n\nSummary: This provision applies to dependent children of Charity Workers. It stipulates an age requirement for dependents, with specific conditions or exceptions outlined elsewhere, though details are not provided in this excerpt.\n\n### Age requirement for a dependent child of a Charity Worker\n\nCW 15.1. DELETED.\n\nCW 15.2. DELETED.",
      "needs_review": false
    },
    {
      "metadata": {
        "source": "Appendix Temporary Work - Charity Worker",
        "part": "Appendix Temporary Work - Charity Worker",
        "section_id": "1",
        "section_title": "Requirements for a dependent child of a Charity Worker",
        "parent_section": null,
        "hierarchy_level": 1,
        "topic": "leave-to-enter",
        "url": "https://www.gov.uk/guidance/immigration-rules/immigration-rules-appendix-t5-temporary-worker-charity-worker",
        "scraped_at": "2025-12-06T17:25:30.158868"
      },
      "text": "### Requirements for a dependent child of a Charity Worker\n\n1.   CW 15A.1. The applicant must meet the following requirements for a dependent child in Appendix Children: \n    1.   (a) relationship requirement: entry clearance and permission to stay; and\n    2.   (b) care requirement; and\n    3.   (c) age and independent life requirement.",
      "summary": "This provision applies to dependent children of Charity Workers. They must meet relationship, care, and age/independent life requirements for entry clearance and permission to stay, with specific criteria outlined in Appendix Children. No exceptions are specified here.",
      "augmented_text": "Document: Appendix Temporary Work - Charity Worker\nPart: Appendix Temporary Work - Charity Worker\nSection ID: 1\nSection: Requirements for a dependent child of a Charity Worker\nTopic: leave-to-enter\n\nSummary: This provision applies to dependent children of Charity Workers. They must meet relationship, care, and age/independent life requirements for entry clearance and permission to stay, with specific criteria outlined in Appendix Children. No exceptions are specified here.\n\n### Requirements for a dependent child of a Charity Worker\n\n1.   CW 15A.1. The applicant must meet the following requirements for a dependent child in Appendix Children: \n    1.   (a) relationship requirement: entry clearance and permission to stay; and\n    2.   (b) care requirement; and\n    3.   (c) age and independent life requirement.",
      "needs_review": false
    },
    {
      "metadata": {
        "source": "Appendix Temporary Work - Charity Worker",
        "part": "Appendix Temporary Work - Charity Worker",
        "section_id": "CW 16.1",
        "section_title": "Financial requirement for a dependent partner or dependent child of a Charity Worker",
        "parent_section": "CW 16",
        "hierarchy_level": 2,
        "topic": "financial",
        "url": "https://www.gov.uk/guidance/immigration-rules/immigration-rules-appendix-t5-temporary-worker-charity-worker",
        "scraped_at": "2025-12-06T17:25:30.158896"
      },
      "text": "### Financial requirement for a dependent partner or dependent child of a Charity Worker\n\nCW 16.1. If the applicant is applying for permission to stay and has been living in the UK with permission for 12 months or longer on the date of application, they will meet the financial requirement and do not need to show funds.\n\n1.   CW 16.2. If the applicant is applying for entry clearance, or has been in the UK for less than 12 months on the date of application, either: \n    1.   (a) funds of at least the amount required in CW 16.3. must be held collectively by one or more of the following: \n        1.   i) the applicant; and\n        2.   ii) the Charity Worker (P); and\n        3.   iii) if the applicant is applying as a dependent child, their parent who is lawfully present in the UK or being granted entry clearance, or permission to stay, at the same time; or\n\n    2.   (b) the Charity Worker’s A-rated sponsor must certify that they will, if necessary, maintain and accommodate the dependent partner and/or any dependent child as well as the Charity Worker, up to the end of the first month of each of their grants of permission, to at least the amounts required in CW 16.3.\n\n2.   CW 16.3. The funds required are: \n    1.   (a) £285 for a dependent partner in the UK, or applying for entry clearance; and\n    2.   (b) £315 for the first dependent child in the UK, or applying for entry clearance; and\n    3.   (c) £200 for any other dependent child in the UK, or applying for entry clearance.\n\nCW 16.4. If CW 16.2.(a) applies, the funds held for the applicant must be held in addition to any funds required for the Charity Worker to meet the financial requirement and any other dependants in the UK or applying at the same time.\n\nCW 16.5. If CW 16.2.(a) applies, the funds must have been held for a 28-day period and as specified in Appendix Finance.",
      "summary": "Charity Worker dependents applying for permission to stay or entry clearance must meet financial requirements if they have been in the UK for less than 12 months, requiring funds of specified amounts (£285, £315, or £200) held collectively or guaranteed by the sponsor. If they have been in the UK for 12 months or more, they automatically meet the financial requirement.",
      "augmented_text": "Document: Appendix Temporary Work - Charity Worker\nPart: Appendix Temporary Work - Charity Worker\nSection ID: CW 16.1\nSection: Financial requirement for a dependent partner or dependent child of a Charity Worker\nTopic: financial\n\nSummary: Charity Worker dependents applying for permission to stay or entry clearance must meet financial requirements if they have been in the UK for less than 12 months, requiring funds of specified amounts (£285, £315, or £200) held collectively or guaranteed by the sponsor. If they have been in the UK for 12 months or more, they automatically meet the financial requirement.\n\n### Financial requirement for a dependent partner or dependent child of a Charity Worker\n\nCW 16.1. If the applicant is applying for permission to stay and has been living in the UK with permission for 12 months or longer on the date of application, they will meet the financial requirement and do not need to show funds.\n\n1.   CW 16.2. If the applicant is applying for entry clearance, or has been in the UK for less than 12 months on the date of application, either: \n    1.   (a) funds of at least the amount required in CW 16.3. must be held collectively by one or more of the following: \n        1.   i) the applicant; and\n        2.   ii) the Charity Worker (P); and\n        3.   iii) if the applicant is applying as a dependent child, their parent who is lawfully present in the UK or being granted entry clearance, or permission to stay, at the same time; or\n\n    2.   (b) the Charity Worker’s A-rated sponsor must certify that they will, if necessary, maintain and accommodate the dependent partner and/or any dependent child as well as the Charity Worker, up to the end of the first month of each of their grants of permission, to at least the amounts required in CW 16.3.\n\n2.   CW 16.3. The funds required are: \n    1.   (a) £285 for a dependent partner in the UK, or applying for entry clearance; and\n    2.   (b) £315 for the first dependent child in the UK, or applying for entry clearance; and\n    3.   (c) £200 for any other dependent child in the UK, or applying for entry clearance.\n\nCW 16.4. If CW 16.2.(a) applies, the funds held for the applicant must be held in addition to any funds required for the Charity Worker to meet the financial requirement and any other dependants in the UK or applying at the same time.\n\nCW 16.5. If CW 16.2.(a) applies, the funds must have been held for a 28-day period and as specified in Appendix Finance.",
      "needs_review": false
    },
    {
      "metadata": {
        "source": "Appendix Temporary Work - Charity Worker",
        "part": "Appendix Temporary Work - Charity Worker",
        "section_id": "CW 17.1",
        "section_title": "Decision on an application as a dependent partner or dependent child of a Charity Worker",
        "parent_section": "CW 17",
        "hierarchy_level": 2,
        "topic": "eligibility",
        "url": "https://www.gov.uk/guidance/immigration-rules/immigration-rules-appendix-t5-temporary-worker-charity-worker",
        "scraped_at": "2025-12-06T17:25:30.158920"
      },
      "text": "### Decision on an application as a dependent partner or dependent child of a Charity Worker\n\nCW 17.1. If the decision maker is satisfied that all the suitability and eligibility requirements for a dependent partner or dependent child of a Charity Worker are met, the application will be granted, otherwise the application will be refused.\n\nCW 17.2. If the application is refused, the person can apply for an Administrative Review under Appendix AR: Administrative Review.",
      "summary": "This provision applies to dependent partners or children of Charity Workers. Applications are granted if all suitability and eligibility criteria are met; otherwise, they are refused, with the right to request an Administrative Review.",
      "augmented_text": "Document: Appendix Temporary Work - Charity Worker\nPart: Appendix Temporary Work - Charity Worker\nSection ID: CW 17.1\nSection: Decision on an application as a dependent partner or dependent child of a Charity Worker\nTopic: eligibility\n\nSummary: This provision applies to dependent partners or children of Charity Workers. Applications are granted if all suitability and eligibility criteria are met; otherwise, they are refused, with the right to request an Administrative Review.\n\n### Decision on an application as a dependent partner or dependent child of a Charity Worker\n\nCW 17.1. If the decision maker is satisfied that all the suitability and eligibility requirements for a dependent partner or dependent child of a Charity Worker are met, the application will be granted, otherwise the application will be refused.\n\nCW 17.2. If the application is refused, the person can apply for an Administrative Review under Appendix AR: Administrative Review.",
      "needs_review": false
    },
    {
      "metadata": {
        "source": "Appendix Temporary Work - Charity Worker",
        "part": "Appendix Temporary Work - Charity Worker",
        "section_id": "CW 18.1",
        "section_title": "Period of grant for a dependent partner or dependent child of a Charity Worker",
        "parent_section": "CW 18",
        "hierarchy_level": 2,
        "topic": "family",
        "url": "https://www.gov.uk/guidance/immigration-rules/immigration-rules-appendix-t5-temporary-worker-charity-worker",
        "scraped_at": "2025-12-06T17:25:30.158988"
      },
      "text": "### Period of grant for a dependent partner or dependent child of a Charity Worker\n\nCW 18.1. A partner will be granted permission which ends on the same date as their partner’s permission as a Charity Worker.\n\nCW 18.2. A child will be granted permission which ends on the same date as whichever of their parents’ permission ends first.",
      "summary": "This provision applies to dependents of Charity Workers. Dependent partners receive permission valid until the Charity Worker’s permission ends; dependents children’s permission expires when the earliest of their parents’ permissions ends.",
      "augmented_text": "Document: Appendix Temporary Work - Charity Worker\nPart: Appendix Temporary Work - Charity Worker\nSection ID: CW 18.1\nSection: Period of grant for a dependent partner or dependent child of a Charity Worker\nTopic: family\n\nSummary: This provision applies to dependents of Charity Workers. Dependent partners receive permission valid until the Charity Worker’s permission ends; dependents children’s permission expires when the earliest of their parents’ permissions ends.\n\n### Period of grant for a dependent partner or dependent child of a Charity Worker\n\nCW 18.1. A partner will be granted permission which ends on the same date as their partner’s permission as a Charity Worker.\n\nCW 18.2. A child will be granted permission which ends on the same date as whichever of their parents’ permission ends first.",
      "needs_review": false
    },
    {
      "metadata": {
        "source": "Appendix Temporary Work - Charity Worker",
        "part": "Appendix Temporary Work - Charity Worker",
        "section_id": "1",
        "section_title": "Conditions of grant for a dependent partner or dependent child of a Charity Worker",
        "parent_section": null,
        "hierarchy_level": 1,
        "topic": "financial",
        "url": "https://www.gov.uk/guidance/immigration-rules/immigration-rules-appendix-t5-temporary-worker-charity-worker",
        "scraped_at": "2025-12-06T17:25:30.159029"
      },
      "text": "### Conditions of grant for a dependent partner or dependent child of a Charity Worker\n\n1.   CW 18.3. The grant will be subject to all the following conditions: \n    1.   (a) no access to public funds; and\n    2.   (b) work (including self-employment and voluntary work) is permitted, except as a professional sportsperson (including as a sports coach); and\n    3.   (c) study is permitted, subject to the ATAS condition in Appendix ATAS if the applicant is over the age of 18.\n    4.   (d) DELETED.\n\nPrint this page",
      "summary": "Dependent partners and children of Charity Workers must not access public funds; they are permitted to work and study (with ATAS if over 18), except as professional sportspeople. Conditions apply uniformly, with no exceptions noted.",
      "augmented_text": "Document: Appendix Temporary Work - Charity Worker\nPart: Appendix Temporary Work - Charity Worker\nSection ID: 1\nSection: Conditions of grant for a dependent partner or dependent child of a Charity Worker\nTopic: financial\n\nSummary: Dependent partners and children of Charity Workers must not access public funds; they are permitted to work and study (with ATAS if over 18), except as professional sportspeople. Conditions apply uniformly, with no exceptions noted.\n\n### Conditions of grant for a dependent partner or dependent child of a Charity Worker\n\n1.   CW 18.3. The grant will be subject to all the following conditions: \n    1.   (a) no access to public funds; and\n    2.   (b) work (including self-employment and voluntary work) is permitted, except as a professional sportsperson (including as a sports coach); and\n    3.   (c) study is permitted, subject to the ATAS condition in Appendix ATAS if the applicant is over the age of 18.\n    4.   (d) DELETED.\n\nPrint this page",
      "needs_review": false
    }
  ]
}