{
  "url": "https://www.gov.uk/guidance/immigration-rules/immigration-rules-appendix-bereaved-partner",
  "part_name": "Immigration Rules Appendix Bereaved Partner",
  "scraped_at": "2025-12-06T17:26:17.147546",
  "chunk_count": 13,
  "chunks": [
    {
      "metadata": {
        "source": "Immigration Rules Appendix Bereaved Partner",
        "part": "Immigration Rules Appendix Bereaved Partner",
        "section_id": "BP 1.1",
        "section_title": "Validity requirements for the Bereaved Partner route",
        "parent_section": "BP 1",
        "hierarchy_level": 2,
        "topic": "leave-to-enter",
        "url": "https://www.gov.uk/guidance/immigration-rules/immigration-rules-appendix-bereaved-partner",
        "scraped_at": "2025-12-06T17:26:17.146911"
      },
      "text": "### Validity requirements for the Bereaved Partner route\n\nBP 1.1. A person applying from outside the UK on the Bereaved Partner route must apply online for entry clearance on the gov.uk website on form “VAF (AF)”.\n\n1.   BP 1.2. A person applying in the UK on the Bereaved Partner route must apply online on the gov.uk website on the specified form as follows: \n    1.   (a) for applicants who were last granted permission as a partner or child under Appendix HM Armed Forces, form “SET (AF)”; or\n    2.   (b) for all other bereaved partners or where a child is applying for permission on the Bereaved Partner route at the same time as their parent and who is included in their parent’s application (with the exception of children granted permission under Appendix HM Armed Forces), form “SET(O)”; or\n    3.   (c) for children in the UK who are not applying for permission on the Bereaved Partner route at the same time as their parent (with the exception of those granted permission under Appendix HM Armed Forces), form “SET(F)”.\n\n1.   BP 1.3. An application on the Bereaved Partner route must meet all the following validity requirements: \n    1.   (a) any fee must have been paid (unless the applicant has been granted a fee waiver); and\n    2.   (b) the applicant must have provided biometrics when required; and\n    3.   (c) the applicant must have provided a passport or other document which satisfactorily establishes their identity and nationality.\n\nBP 1.4. An application which does not meet all the validity requirements for the Bereaved Partner route may be rejected as invalid and not considered.",
      "summary": "Applicants outside or inside the UK applying for the Bereaved Partner route must submit online applications using specified forms, pay fees or obtain waivers, provide biometrics, and verify their identity with valid documents. Eligibility conditions include correct form use based on applicant status, with specific requirements for children and partners.",
      "augmented_text": "Document: Immigration Rules Appendix Bereaved Partner\nPart: Immigration Rules Appendix Bereaved Partner\nSection ID: BP 1.1\nSection: Validity requirements for the Bereaved Partner route\nTopic: leave-to-enter\n\nSummary: Applicants outside or inside the UK applying for the Bereaved Partner route must submit online applications using specified forms, pay fees or obtain waivers, provide biometrics, and verify their identity with valid documents. Eligibility conditions include correct form use based on applicant status, with specific requirements for children and partners.\n\n### Validity requirements for the Bereaved Partner route\n\nBP 1.1. A person applying from outside the UK on the Bereaved Partner route must apply online for entry clearance on the gov.uk website on form “VAF (AF)”.\n\n1.   BP 1.2. A person applying in the UK on the Bereaved Partner route must apply online on the gov.uk website on the specified form as follows: \n    1.   (a) for applicants who were last granted permission as a partner or child under Appendix HM Armed Forces, form “SET (AF)”; or\n    2.   (b) for all other bereaved partners or where a child is applying for permission on the Bereaved Partner route at the same time as their parent and who is included in their parent’s application (with the exception of children granted permission under Appendix HM Armed Forces), form “SET(O)”; or\n    3.   (c) for children in the UK who are not applying for permission on the Bereaved Partner route at the same time as their parent (with the exception of those granted permission under Appendix HM Armed Forces), form “SET(F)”.\n\n1.   BP 1.3. An application on the Bereaved Partner route must meet all the following validity requirements: \n    1.   (a) any fee must have been paid (unless the applicant has been granted a fee waiver); and\n    2.   (b) the applicant must have provided biometrics when required; and\n    3.   (c) the applicant must have provided a passport or other document which satisfactorily establishes their identity and nationality.\n\nBP 1.4. An application which does not meet all the validity requirements for the Bereaved Partner route may be rejected as invalid and not considered.",
      "needs_review": false
    },
    {
      "metadata": {
        "source": "Immigration Rules Appendix Bereaved Partner",
        "part": "Immigration Rules Appendix Bereaved Partner",
        "section_id": "BP 2.1",
        "section_title": "Suitability requirements for the Bereaved Partner route",
        "parent_section": "BP 2",
        "hierarchy_level": 2,
        "topic": "suitability",
        "url": "https://www.gov.uk/guidance/immigration-rules/immigration-rules-appendix-bereaved-partner",
        "scraped_at": "2025-12-06T17:26:17.146954"
      },
      "text": "### Suitability requirements for the Bereaved Partner route\n\nBP 2.1. The applicant must not fall for refusal under Part Suitability, but paragraph SUI 11.4(a) does not apply.",
      "summary": "This provision applies to applicants seeking the Bereaved Partner route. They must meet suitability requirements, ensuring they are not refused under Part Suitability, with an exception to paragraph SUI 11.4(a).",
      "augmented_text": "Document: Immigration Rules Appendix Bereaved Partner\nPart: Immigration Rules Appendix Bereaved Partner\nSection ID: BP 2.1\nSection: Suitability requirements for the Bereaved Partner route\nTopic: suitability\n\nSummary: This provision applies to applicants seeking the Bereaved Partner route. They must meet suitability requirements, ensuring they are not refused under Part Suitability, with an exception to paragraph SUI 11.4(a).\n\n### Suitability requirements for the Bereaved Partner route\n\nBP 2.1. The applicant must not fall for refusal under Part Suitability, but paragraph SUI 11.4(a) does not apply.",
      "needs_review": false
    },
    {
      "metadata": {
        "source": "Immigration Rules Appendix Bereaved Partner",
        "part": "Immigration Rules Appendix Bereaved Partner",
        "section_id": "Eligibility requirements for the Bereaved Partner route",
        "section_title": "Eligibility requirements for the Bereaved Partner route",
        "parent_section": null,
        "hierarchy_level": 2,
        "topic": "eligibility",
        "url": "https://www.gov.uk/guidance/immigration-rules/immigration-rules-appendix-bereaved-partner",
        "scraped_at": "2025-12-06T17:26:17.146967"
      },
      "text": "### Eligibility requirements for the Bereaved Partner route",
      "summary": "The Bereaved Partner route applies to partners of deceased UK residents or citizens seeking settlement. Applicants must demonstrate a genuine relationship, meet language and financial requirements, and provide evidence of bereavement; exceptions are limited and subject to specific conditions.",
      "augmented_text": "Document: Immigration Rules Appendix Bereaved Partner\nPart: Immigration Rules Appendix Bereaved Partner\nSection ID: Eligibility requirements for the Bereaved Partner route\nSection: Eligibility requirements for the Bereaved Partner route\nTopic: eligibility\n\nSummary: The Bereaved Partner route applies to partners of deceased UK residents or citizens seeking settlement. Applicants must demonstrate a genuine relationship, meet language and financial requirements, and provide evidence of bereavement; exceptions are limited and subject to specific conditions.\n\n### Eligibility requirements for the Bereaved Partner route",
      "needs_review": false
    },
    {
      "metadata": {
        "source": "Immigration Rules Appendix Bereaved Partner",
        "part": "Immigration Rules Appendix Bereaved Partner",
        "section_id": "BP 3.1",
        "section_title": "Entry requirements for the Bereaved Partner route",
        "parent_section": "BP 3",
        "hierarchy_level": 2,
        "topic": "leave-to-enter",
        "url": "https://www.gov.uk/guidance/immigration-rules/immigration-rules-appendix-bereaved-partner",
        "scraped_at": "2025-12-06T17:26:17.146996"
      },
      "text": "### Entry requirements for the Bereaved Partner route\n\nBP 3.1. Where a person is outside the UK they must apply for and obtain entry clearance on the Bereaved Partner route before they arrive in the UK.\n\nBP 3.2. Where a person is applying for entry clearance on the Bereaved Partner route they must, if Appendix Tuberculosis applies, provide a valid medical certificate confirming that they have undergone screening for active pulmonary tuberculosis and that this tuberculosis is not present in them.",
      "summary": "Applicants seeking entry clearance on the Bereaved Partner route must apply and obtain permission before arriving in the UK. If applicable, they must also provide a tuberculosis screening certificate. There are no specified exceptions.",
      "augmented_text": "Document: Immigration Rules Appendix Bereaved Partner\nPart: Immigration Rules Appendix Bereaved Partner\nSection ID: BP 3.1\nSection: Entry requirements for the Bereaved Partner route\nTopic: leave-to-enter\n\nSummary: Applicants seeking entry clearance on the Bereaved Partner route must apply and obtain permission before arriving in the UK. If applicable, they must also provide a tuberculosis screening certificate. There are no specified exceptions.\n\n### Entry requirements for the Bereaved Partner route\n\nBP 3.1. Where a person is outside the UK they must apply for and obtain entry clearance on the Bereaved Partner route before they arrive in the UK.\n\nBP 3.2. Where a person is applying for entry clearance on the Bereaved Partner route they must, if Appendix Tuberculosis applies, provide a valid medical certificate confirming that they have undergone screening for active pulmonary tuberculosis and that this tuberculosis is not present in them.",
      "needs_review": false
    },
    {
      "metadata": {
        "source": "Immigration Rules Appendix Bereaved Partner",
        "part": "Immigration Rules Appendix Bereaved Partner",
        "section_id": "1",
        "section_title": "Immigration status requirements for a Bereaved Partner in the UK",
        "parent_section": null,
        "hierarchy_level": 1,
        "topic": "family",
        "url": "https://www.gov.uk/guidance/immigration-rules/immigration-rules-appendix-bereaved-partner",
        "scraped_at": "2025-12-06T17:26:17.147031"
      },
      "text": "### Immigration status requirements for a Bereaved Partner in the UK\n\n1.   BP 4.1. An applicant who is in the UK at the date of application must have, or have last been granted, permission as one of the following: \n    1.   (a) a partner under Appendix FM (except for permission as a fiancé(e) or proposed civil partner) of a person who is a British citizen, settled in the UK or an EEA national in the UK with limited leave to enter or remain granted under paragraph EU3 of Appendix EU on the basis of meeting condition 1 in paragraph EU14 of Appendix EU; or\n    2.   (b) a partner of a person present and settled in the UK under paragraph 285 or 295E of Part 8 of these rules; or\n    3.   (c) a Bereaved Partner under Appendix FM; or\n    4.   (d) a partner under Appendix HM Armed Forces or Part 7 (except for permission as a fiancé(e) or proposed civil partner), of any of the below: \n        1.   (i) a person who is a British citizen; or\n        2.   (ii) a foreign and commonwealth citizen who was serving member of HM forces; or\n        3.   (iii) a member of HM Armed forces who has applied for or been granted permission or settlement as a foreign and commonwealth citizen discharged from HM Armed Forces.",
      "summary": "Bereaved Partners seeking UK residence must have prior immigration permission under specified categories (e.g., Appendix FM, settled persons, or armed forces members). They must have been granted or last permitted to be in the UK under these conditions; exceptions include fiancé(e) or proposed civil partner permissions.",
      "augmented_text": "Document: Immigration Rules Appendix Bereaved Partner\nPart: Immigration Rules Appendix Bereaved Partner\nSection ID: 1\nSection: Immigration status requirements for a Bereaved Partner in the UK\nTopic: family\n\nSummary: Bereaved Partners seeking UK residence must have prior immigration permission under specified categories (e.g., Appendix FM, settled persons, or armed forces members). They must have been granted or last permitted to be in the UK under these conditions; exceptions include fiancé(e) or proposed civil partner permissions.\n\n### Immigration status requirements for a Bereaved Partner in the UK\n\n1.   BP 4.1. An applicant who is in the UK at the date of application must have, or have last been granted, permission as one of the following: \n    1.   (a) a partner under Appendix FM (except for permission as a fiancé(e) or proposed civil partner) of a person who is a British citizen, settled in the UK or an EEA national in the UK with limited leave to enter or remain granted under paragraph EU3 of Appendix EU on the basis of meeting condition 1 in paragraph EU14 of Appendix EU; or\n    2.   (b) a partner of a person present and settled in the UK under paragraph 285 or 295E of Part 8 of these rules; or\n    3.   (c) a Bereaved Partner under Appendix FM; or\n    4.   (d) a partner under Appendix HM Armed Forces or Part 7 (except for permission as a fiancé(e) or proposed civil partner), of any of the below: \n        1.   (i) a person who is a British citizen; or\n        2.   (ii) a foreign and commonwealth citizen who was serving member of HM forces; or\n        3.   (iii) a member of HM Armed forces who has applied for or been granted permission or settlement as a foreign and commonwealth citizen discharged from HM Armed Forces.",
      "needs_review": false
    },
    {
      "metadata": {
        "source": "Immigration Rules Appendix Bereaved Partner",
        "part": "Immigration Rules Appendix Bereaved Partner",
        "section_id": "1",
        "section_title": "Immigration status requirements for a Bereaved Partner overseas",
        "parent_section": null,
        "hierarchy_level": 1,
        "topic": "family",
        "url": "https://www.gov.uk/guidance/immigration-rules/immigration-rules-appendix-bereaved-partner",
        "scraped_at": "2025-12-06T17:26:17.147062"
      },
      "text": "### Immigration status requirements for a Bereaved Partner overseas\n\n1.   BP 5.1. An applicant who is in overseas on the date of application must have, or have last been granted, permission as: \n    1.   (a) a partner under Appendix HM Armed Forces or Part 7 (except for permission as a fiancé(e) or proposed civil partner), of one of the following: \n        1.   (i) a person who at the time of their death was a British citizen; or\n        2.   (ii) a foreign and commonwealth citizen who was at the time of their death a serving member of HM forces; or\n        3.   (iii) a member of HM Armed forces who at the time of their death had applied for, and would have been granted if they had not died, or had been granted, permission to stay or settlement as a foreign and commonwealth citizen discharged from HM Armed Forces.",
      "summary": "This provision applies to overseas bereaved partners seeking immigration status. They must have, or have last been granted, permission as a partner under specified military or familial categories linked to a deceased British or Commonwealth service member. Critical conditions include being in permission at the time of application and excluding fiancé(e) or proposed civil partner statuses.",
      "augmented_text": "Document: Immigration Rules Appendix Bereaved Partner\nPart: Immigration Rules Appendix Bereaved Partner\nSection ID: 1\nSection: Immigration status requirements for a Bereaved Partner overseas\nTopic: family\n\nSummary: This provision applies to overseas bereaved partners seeking immigration status. They must have, or have last been granted, permission as a partner under specified military or familial categories linked to a deceased British or Commonwealth service member. Critical conditions include being in permission at the time of application and excluding fiancé(e) or proposed civil partner statuses.\n\n### Immigration status requirements for a Bereaved Partner overseas\n\n1.   BP 5.1. An applicant who is in overseas on the date of application must have, or have last been granted, permission as: \n    1.   (a) a partner under Appendix HM Armed Forces or Part 7 (except for permission as a fiancé(e) or proposed civil partner), of one of the following: \n        1.   (i) a person who at the time of their death was a British citizen; or\n        2.   (ii) a foreign and commonwealth citizen who was at the time of their death a serving member of HM forces; or\n        3.   (iii) a member of HM Armed forces who at the time of their death had applied for, and would have been granted if they had not died, or had been granted, permission to stay or settlement as a foreign and commonwealth citizen discharged from HM Armed Forces.",
      "needs_review": false
    },
    {
      "metadata": {
        "source": "Immigration Rules Appendix Bereaved Partner",
        "part": "Immigration Rules Appendix Bereaved Partner",
        "section_id": "BP 6.1",
        "section_title": "Relationship requirement for a Bereaved Partner",
        "parent_section": "BP 6",
        "hierarchy_level": 2,
        "topic": "family",
        "url": "https://www.gov.uk/guidance/immigration-rules/immigration-rules-appendix-bereaved-partner",
        "scraped_at": "2025-12-06T17:26:17.147098"
      },
      "text": "### Relationship requirement for a Bereaved Partner\n\nBP 6.1. The person who was the applicant’s partner at the time of the applicant’s last grant of permission as a partner, must have died.\n\nBP 6.2. The applicant and their partner must have been in a genuine and subsisting relationship immediately before the partner’s death.",
      "summary": "This provision applies to bereaved partners seeking permission to remain or enter. The applicant must have been in a genuine, subsisting relationship with their deceased partner at the time of their last grant of permission, and the partner must have died. No exceptions are specified.",
      "augmented_text": "Document: Immigration Rules Appendix Bereaved Partner\nPart: Immigration Rules Appendix Bereaved Partner\nSection ID: BP 6.1\nSection: Relationship requirement for a Bereaved Partner\nTopic: family\n\nSummary: This provision applies to bereaved partners seeking permission to remain or enter. The applicant must have been in a genuine, subsisting relationship with their deceased partner at the time of their last grant of permission, and the partner must have died. No exceptions are specified.\n\n### Relationship requirement for a Bereaved Partner\n\nBP 6.1. The person who was the applicant’s partner at the time of the applicant’s last grant of permission as a partner, must have died.\n\nBP 6.2. The applicant and their partner must have been in a genuine and subsisting relationship immediately before the partner’s death.",
      "needs_review": false
    },
    {
      "metadata": {
        "source": "Immigration Rules Appendix Bereaved Partner",
        "part": "Immigration Rules Appendix Bereaved Partner",
        "section_id": "1",
        "section_title": "Requirements for a dependent child of a Bereaved Partner",
        "parent_section": null,
        "hierarchy_level": 1,
        "topic": "settlement",
        "url": "https://www.gov.uk/guidance/immigration-rules/immigration-rules-appendix-bereaved-partner",
        "scraped_at": "2025-12-06T17:26:17.147164"
      },
      "text": "### Requirements for a dependent child of a Bereaved Partner\n\n1.   BP 7.1. The applicant must meet the following requirements for a dependent child in Appendix Children: \n    1.   (a) relationship requirement for settlement; and\n    2.   (b) care requirement; and\n    3.   (c) age and independent life requirement.",
      "summary": "Dependent children of Bereaved Partners must meet specific criteria—including relationship, care, and age/independent life requirements—to qualify for settlement, subject to conditions detailed in Appendix Children.",
      "augmented_text": "Document: Immigration Rules Appendix Bereaved Partner\nPart: Immigration Rules Appendix Bereaved Partner\nSection ID: 1\nSection: Requirements for a dependent child of a Bereaved Partner\nTopic: settlement\n\nSummary: Dependent children of Bereaved Partners must meet specific criteria—including relationship, care, and age/independent life requirements—to qualify for settlement, subject to conditions detailed in Appendix Children.\n\n### Requirements for a dependent child of a Bereaved Partner\n\n1.   BP 7.1. The applicant must meet the following requirements for a dependent child in Appendix Children: \n    1.   (a) relationship requirement for settlement; and\n    2.   (b) care requirement; and\n    3.   (c) age and independent life requirement.",
      "needs_review": false
    },
    {
      "metadata": {
        "source": "Immigration Rules Appendix Bereaved Partner",
        "part": "Immigration Rules Appendix Bereaved Partner",
        "section_id": "BP 8.1",
        "section_title": "English language requirements for a child of a Bereaved Partner",
        "parent_section": "BP 8",
        "hierarchy_level": 2,
        "topic": "english-language",
        "url": "https://www.gov.uk/guidance/immigration-rules/immigration-rules-appendix-bereaved-partner",
        "scraped_at": "2025-12-06T17:26:17.147213"
      },
      "text": "### English language requirements for a child of a Bereaved Partner\n\nBP 8.1. If the applicant is applying as a child of a bereaved partner and is aged over 18, the applicant must show English language ability on the Common European Framework of Reference for Languages in speaking and listening of at least level B1.\n\nBP 8.2. The applicant must show they meet the English language requirement, or that an exemption applies, as specified in Appendix English Language.",
      "summary": "Applicants over 18 applying as children of a bereaved partner must demonstrate English language proficiency at B1 level in speaking and listening, or qualify for an exemption per Appendix English Language.",
      "augmented_text": "Document: Immigration Rules Appendix Bereaved Partner\nPart: Immigration Rules Appendix Bereaved Partner\nSection ID: BP 8.1\nSection: English language requirements for a child of a Bereaved Partner\nTopic: english-language\n\nSummary: Applicants over 18 applying as children of a bereaved partner must demonstrate English language proficiency at B1 level in speaking and listening, or qualify for an exemption per Appendix English Language.\n\n### English language requirements for a child of a Bereaved Partner\n\nBP 8.1. If the applicant is applying as a child of a bereaved partner and is aged over 18, the applicant must show English language ability on the Common European Framework of Reference for Languages in speaking and listening of at least level B1.\n\nBP 8.2. The applicant must show they meet the English language requirement, or that an exemption applies, as specified in Appendix English Language.",
      "needs_review": false
    },
    {
      "metadata": {
        "source": "Immigration Rules Appendix Bereaved Partner",
        "part": "Immigration Rules Appendix Bereaved Partner",
        "section_id": "BP 9.1",
        "section_title": "Knowledge of life requirements for a child of a Bereaved Partner",
        "parent_section": "BP 9",
        "hierarchy_level": 2,
        "topic": "family",
        "url": "https://www.gov.uk/guidance/immigration-rules/immigration-rules-appendix-bereaved-partner",
        "scraped_at": "2025-12-06T17:26:17.147241"
      },
      "text": "### Knowledge of life requirements for a child of a Bereaved Partner\n\nBP 9.1. The applicant must meet the Knowledge of Life in the UK requirement, or an exemption must apply, as set out in Appendix KOL UK.",
      "summary": "This provision applies to children of Bereaved Partners applying under Appendix BP. They must meet the Knowledge of Life in the UK requirement or qualify for an exemption per Appendix KOL UK. No other specific thresholds or conditions are specified here.",
      "augmented_text": "Document: Immigration Rules Appendix Bereaved Partner\nPart: Immigration Rules Appendix Bereaved Partner\nSection ID: BP 9.1\nSection: Knowledge of life requirements for a child of a Bereaved Partner\nTopic: family\n\nSummary: This provision applies to children of Bereaved Partners applying under Appendix BP. They must meet the Knowledge of Life in the UK requirement or qualify for an exemption per Appendix KOL UK. No other specific thresholds or conditions are specified here.\n\n### Knowledge of life requirements for a child of a Bereaved Partner\n\nBP 9.1. The applicant must meet the Knowledge of Life in the UK requirement, or an exemption must apply, as set out in Appendix KOL UK.",
      "needs_review": false
    },
    {
      "metadata": {
        "source": "Immigration Rules Appendix Bereaved Partner",
        "part": "Immigration Rules Appendix Bereaved Partner",
        "section_id": "BP 10.1",
        "section_title": "Maintenance and Accommodation requirements for a child of a Bereaved Partner",
        "parent_section": "BP 10",
        "hierarchy_level": 2,
        "topic": "financial",
        "url": "https://www.gov.uk/guidance/immigration-rules/immigration-rules-appendix-bereaved-partner",
        "scraped_at": "2025-12-06T17:26:17.147259"
      },
      "text": "### Maintenance and Accommodation requirements for a child of a Bereaved Partner\n\nBP 10.1. Where the applicant is applying as a child, the decision maker must be satisfied that there will be adequate maintenance and accommodation for the applicant without recourse to public funds.\n\nBP 10.2. Funds must be shown as specified in Appendix FM-SE.",
      "summary": "This provision applies to children of Bereaved Partners applying for entry. Applicants must demonstrate they will have adequate maintenance and accommodation without recourse to public funds, using funds specified in Appendix FM-SE.",
      "augmented_text": "Document: Immigration Rules Appendix Bereaved Partner\nPart: Immigration Rules Appendix Bereaved Partner\nSection ID: BP 10.1\nSection: Maintenance and Accommodation requirements for a child of a Bereaved Partner\nTopic: financial\n\nSummary: This provision applies to children of Bereaved Partners applying for entry. Applicants must demonstrate they will have adequate maintenance and accommodation without recourse to public funds, using funds specified in Appendix FM-SE.\n\n### Maintenance and Accommodation requirements for a child of a Bereaved Partner\n\nBP 10.1. Where the applicant is applying as a child, the decision maker must be satisfied that there will be adequate maintenance and accommodation for the applicant without recourse to public funds.\n\nBP 10.2. Funds must be shown as specified in Appendix FM-SE.",
      "needs_review": false
    },
    {
      "metadata": {
        "source": "Immigration Rules Appendix Bereaved Partner",
        "part": "Immigration Rules Appendix Bereaved Partner",
        "section_id": "BP 11.1",
        "section_title": "Decision on an application for settlement on the Bereaved Partner route",
        "parent_section": "BP 11",
        "hierarchy_level": 2,
        "topic": "eligibility",
        "url": "https://www.gov.uk/guidance/immigration-rules/immigration-rules-appendix-bereaved-partner",
        "scraped_at": "2025-12-06T17:26:17.147273"
      },
      "text": "### Decision on an application for settlement on the Bereaved Partner route\n\nBP 11.1. If the decision maker is satisfied that the suitability and relevant eligibility requirements on the Bereaved Partner route are met, the application will be granted, otherwise the application will be refused.\n\nBP 11.2. If the application is refused, the person can apply for an Administrative Review under Appendix AR: Administrative Review.",
      "summary": "This provision applies to applicants seeking settlement as Bereaved Partners. It requires the decision-maker to verify eligibility and suitability; applications are granted if conditions are met, otherwise refused, with an option for Administrative Review.",
      "augmented_text": "Document: Immigration Rules Appendix Bereaved Partner\nPart: Immigration Rules Appendix Bereaved Partner\nSection ID: BP 11.1\nSection: Decision on an application for settlement on the Bereaved Partner route\nTopic: eligibility\n\nSummary: This provision applies to applicants seeking settlement as Bereaved Partners. It requires the decision-maker to verify eligibility and suitability; applications are granted if conditions are met, otherwise refused, with an option for Administrative Review.\n\n### Decision on an application for settlement on the Bereaved Partner route\n\nBP 11.1. If the decision maker is satisfied that the suitability and relevant eligibility requirements on the Bereaved Partner route are met, the application will be granted, otherwise the application will be refused.\n\nBP 11.2. If the application is refused, the person can apply for an Administrative Review under Appendix AR: Administrative Review.",
      "needs_review": false
    },
    {
      "metadata": {
        "source": "Immigration Rules Appendix Bereaved Partner",
        "part": "Immigration Rules Appendix Bereaved Partner",
        "section_id": "BP 12.1",
        "section_title": "Period and conditions of grant on the Bereaved Partner Route",
        "parent_section": "BP 12",
        "hierarchy_level": 2,
        "topic": "leave-to-enter",
        "url": "https://www.gov.uk/guidance/immigration-rules/immigration-rules-appendix-bereaved-partner",
        "scraped_at": "2025-12-06T17:26:17.147351"
      },
      "text": "### Period and conditions of grant on the Bereaved Partner Route\n\nBP 12.1. Where the applicant is outside the UK, they will be granted entry clearance for settlement.\n\nBP 12.2. Where the applicant is in the UK, they will be granted settlement.\n\nPrint this page",
      "summary": "This provision applies to bereaved partners applying for settlement. Applicants outside the UK receive entry clearance for settlement, while those inside the UK are granted settlement directly. No specific conditions or exceptions are detailed in this excerpt.",
      "augmented_text": "Document: Immigration Rules Appendix Bereaved Partner\nPart: Immigration Rules Appendix Bereaved Partner\nSection ID: BP 12.1\nSection: Period and conditions of grant on the Bereaved Partner Route\nTopic: leave-to-enter\n\nSummary: This provision applies to bereaved partners applying for settlement. Applicants outside the UK receive entry clearance for settlement, while those inside the UK are granted settlement directly. No specific conditions or exceptions are detailed in this excerpt.\n\n### Period and conditions of grant on the Bereaved Partner Route\n\nBP 12.1. Where the applicant is outside the UK, they will be granted entry clearance for settlement.\n\nBP 12.2. Where the applicant is in the UK, they will be granted settlement.\n\nPrint this page",
      "needs_review": false
    }
  ]
}