{
  "url": "https://www.gov.uk/guidance/immigration-rules/immigration-rules-appendix-t5-temporary-worker-creative-or-sporting-worker",
  "part_name": "Appendix Temporary Work – Creative Worker",
  "scraped_at": "2025-12-06T17:25:38.765954",
  "chunk_count": 25,
  "chunks": [
    {
      "metadata": {
        "source": "Appendix Temporary Work – Creative Worker",
        "part": "Appendix Temporary Work – Creative Worker",
        "section_id": "CRV 1.1",
        "section_title": "Validity requirements for a Creative Worker",
        "parent_section": "CRV 1",
        "hierarchy_level": 2,
        "topic": "leave-to-enter",
        "url": "https://www.gov.uk/guidance/immigration-rules/immigration-rules-appendix-t5-temporary-worker-creative-or-sporting-worker",
        "scraped_at": "2025-12-06T17:25:38.763973"
      },
      "text": "### Validity requirements for a Creative Worker\n\nCRV 1.1. A person applying for entry clearance or permission to stay as a Creative Worker must apply online on gov.uk on the specified form as follows:\n\n| Applicant | Specified form |\n| --- | --- |\n| EEA national with a chipped passport | Either: • Temporary Worker using the UK Immigration: ID Check app; or • the forms listed below for applicants outside or inside the UK (as relevant) |\n| Applicants outside the UK | Temporary Worker visa |\n| Applicants inside the UK | Temporary Worker |\n\n1.   CRV 1.2. An application for entry clearance or permission to stay as a Creative Worker must meet all the following requirements: \n    1.   (a) any fee and Immigration Health Charge must have been paid; and\n    2.   (b) the applicant must have provided biometrics when required; and\n    3.   (c) the applicant must have provided a passport or other travel document which satisfactorily establishes their identity and nationality; and\n    4.   (d) the applicant must have a Certificate of Sponsorship that was issued to them no more than three months before the date of application.\n\nCRV 1.3. If applying for permission to stay, the applicant must be in the UK on the date of application.\n\nCRV 1.3A. If applying for permission to stay, the applicant must have, or have last had, permission as a Creative Worker.\n\nCRV 1.4. An application which does not meet all the validity requirements for a Creative Worker may be rejected as invalid and not considered.",
      "summary": "This provision applies to applicants seeking entry clearance or permission to stay as Creative Workers. They must apply online, pay fees and health charges, provide biometrics, valid travel documents, and a recent Certificate of Sponsorship. Applications must meet all requirements; otherwise, they may be rejected as invalid.",
      "augmented_text": "Document: Appendix Temporary Work – Creative Worker\nPart: Appendix Temporary Work – Creative Worker\nSection ID: CRV 1.1\nSection: Validity requirements for a Creative Worker\nTopic: leave-to-enter\n\nSummary: This provision applies to applicants seeking entry clearance or permission to stay as Creative Workers. They must apply online, pay fees and health charges, provide biometrics, valid travel documents, and a recent Certificate of Sponsorship. Applications must meet all requirements; otherwise, they may be rejected as invalid.\n\n### Validity requirements for a Creative Worker\n\nCRV 1.1. A person applying for entry clearance or permission to stay as a Creative Worker must apply online on gov.uk on the specified form as follows:\n\n| Applicant | Specified form |\n| --- | --- |\n| EEA national with a chipped passport | Either: • Temporary Worker using the UK Immigration: ID Check app; or • the forms listed below for applicants outside or inside the UK (as relevant) |\n| Applicants outside the UK | Temporary Worker visa |\n| Applicants inside the UK | Temporary Worker |\n\n1.   CRV 1.2. An application for entry clearance or permission to stay as a Creative Worker must meet all the following requirements: \n    1.   (a) any fee and Immigration Health Charge must have been paid; and\n    2.   (b) the applicant must have provided biometrics when required; and\n    3.   (c) the applicant must have provided a passport or other travel document which satisfactorily establishes their identity and nationality; and\n    4.   (d) the applicant must have a Certificate of Sponsorship that was issued to them no more than three months before the date of application.\n\nCRV 1.3. If applying for permission to stay, the applicant must be in the UK on the date of application.\n\nCRV 1.3A. If applying for permission to stay, the applicant must have, or have last had, permission as a Creative Worker.\n\nCRV 1.4. An application which does not meet all the validity requirements for a Creative Worker may be rejected as invalid and not considered.",
      "needs_review": false
    },
    {
      "metadata": {
        "source": "Appendix Temporary Work – Creative Worker",
        "part": "Appendix Temporary Work – Creative Worker",
        "section_id": "CRV 2.1",
        "section_title": "Suitability requirements for a Creative Worker",
        "parent_section": "CRV 2",
        "hierarchy_level": 2,
        "topic": "suitability",
        "url": "https://www.gov.uk/guidance/immigration-rules/immigration-rules-appendix-t5-temporary-worker-creative-or-sporting-worker",
        "scraped_at": "2025-12-06T17:25:38.764001"
      },
      "text": "### Suitability requirements for a Creative Worker\n\nCRV 2.1. The applicant must not fall for refusal under Part Suitability.\n\n1.   CRV 2.2. If applying for permission to stay the applicant must not be: \n    1.   (a) in breach of immigration laws, except that where the Exceptions for overstayers section of Part Suitability applies, that period of overstaying will be disregarded; or\n    2.   (b) on immigration bail.",
      "summary": "This provision applies to Creative Worker applicants seeking permission to stay. They must not breach immigration laws (excluding certain overstays) or be on immigration bail. Non-compliance leads to refusal under suitability criteria.",
      "augmented_text": "Document: Appendix Temporary Work – Creative Worker\nPart: Appendix Temporary Work – Creative Worker\nSection ID: CRV 2.1\nSection: Suitability requirements for a Creative Worker\nTopic: suitability\n\nSummary: This provision applies to Creative Worker applicants seeking permission to stay. They must not breach immigration laws (excluding certain overstays) or be on immigration bail. Non-compliance leads to refusal under suitability criteria.\n\n### Suitability requirements for a Creative Worker\n\nCRV 2.1. The applicant must not fall for refusal under Part Suitability.\n\n1.   CRV 2.2. If applying for permission to stay the applicant must not be: \n    1.   (a) in breach of immigration laws, except that where the Exceptions for overstayers section of Part Suitability applies, that period of overstaying will be disregarded; or\n    2.   (b) on immigration bail.",
      "needs_review": false
    },
    {
      "metadata": {
        "source": "Appendix Temporary Work – Creative Worker",
        "part": "Appendix Temporary Work – Creative Worker",
        "section_id": "Eligibility requirements for a Creative Worker",
        "section_title": "Eligibility requirements for a Creative Worker",
        "parent_section": null,
        "hierarchy_level": 2,
        "topic": "eligibility",
        "url": "https://www.gov.uk/guidance/immigration-rules/immigration-rules-appendix-t5-temporary-worker-creative-or-sporting-worker",
        "scraped_at": "2025-12-06T17:25:38.764009"
      },
      "text": "### Eligibility requirements for a Creative Worker",
      "summary": "This provision applies to Creative Workers seeking entry under the UK Temporary Work route. It requires applicants to demonstrate their skills and experience meet specific criteria, with exceptions for certain cultural and artistic roles. Meeting the eligibility thresholds is essential for approval.",
      "augmented_text": "Document: Appendix Temporary Work – Creative Worker\nPart: Appendix Temporary Work – Creative Worker\nSection ID: Eligibility requirements for a Creative Worker\nSection: Eligibility requirements for a Creative Worker\nTopic: eligibility\n\nSummary: This provision applies to Creative Workers seeking entry under the UK Temporary Work route. It requires applicants to demonstrate their skills and experience meet specific criteria, with exceptions for certain cultural and artistic roles. Meeting the eligibility thresholds is essential for approval.\n\n### Eligibility requirements for a Creative Worker",
      "needs_review": false
    },
    {
      "metadata": {
        "source": "Appendix Temporary Work – Creative Worker",
        "part": "Appendix Temporary Work – Creative Worker",
        "section_id": "CRV 3.1",
        "section_title": "Entry requirements for a Creative Worker",
        "parent_section": "CRV 3",
        "hierarchy_level": 2,
        "topic": "leave-to-enter",
        "url": "https://www.gov.uk/guidance/immigration-rules/immigration-rules-appendix-t5-temporary-worker-creative-or-sporting-worker",
        "scraped_at": "2025-12-06T17:25:38.764027"
      },
      "text": "### Entry requirements for a Creative Worker\n\nCRV 3.1. A person seeking to come to the UK as a Creative Worker must have applied for and obtained entry clearance as a Creative Worker before they arrive in the UK, except where CRV 3.2. applies.\n\n1.   CRV 3.2. A person arriving in the UK who is seeking entry as a Creative Worker and does not have a valid entry clearance on that route may be granted permission to enter if the following requirements are met: \n    1.   (a) the applicant is not a visa national; and\n    2.   (aa) has, where required under Appendix Electronic Travel Authorisation, obtained an Electronic Travel Authorisation before travelling to the UK.; and\n    3.   (b) the applicant has a valid Certificate of Sponsorship from an approved sponsor for the Creative Worker route; and\n    4.   (c) if the applicant has consecutive engagements, the total length of all the periods of engagement, together with any gap between those engagements, is three months or less; and\n    5.   (d) if the applicant does not have consecutive engagements, the total length of the period of engagement is three months or less; and\n    6.   (e) the person otherwise meets the requirements to be granted permission as a Creative Worker.\n\nCRV 3.3. A person applying for entry clearance as a Creative Worker must, if Appendix Tuberculosis applies, provide a valid medical certificate confirming that they have undergone screening for active pulmonary tuberculosis and that this tuberculosis is not present in them.",
      "summary": "Creative Workers must generally obtain entry clearance before arriving in the UK. If not, they can be admitted without prior clearance if they are non-visa nationals, have a valid Electronic Travel Authorization (if required), hold a Certificate of Sponsorship, and their engagement periods total three months or less. Additionally, tuberculosis screening must be provided if applicable.",
      "augmented_text": "Document: Appendix Temporary Work – Creative Worker\nPart: Appendix Temporary Work – Creative Worker\nSection ID: CRV 3.1\nSection: Entry requirements for a Creative Worker\nTopic: leave-to-enter\n\nSummary: Creative Workers must generally obtain entry clearance before arriving in the UK. If not, they can be admitted without prior clearance if they are non-visa nationals, have a valid Electronic Travel Authorization (if required), hold a Certificate of Sponsorship, and their engagement periods total three months or less. Additionally, tuberculosis screening must be provided if applicable.\n\n### Entry requirements for a Creative Worker\n\nCRV 3.1. A person seeking to come to the UK as a Creative Worker must have applied for and obtained entry clearance as a Creative Worker before they arrive in the UK, except where CRV 3.2. applies.\n\n1.   CRV 3.2. A person arriving in the UK who is seeking entry as a Creative Worker and does not have a valid entry clearance on that route may be granted permission to enter if the following requirements are met: \n    1.   (a) the applicant is not a visa national; and\n    2.   (aa) has, where required under Appendix Electronic Travel Authorisation, obtained an Electronic Travel Authorisation before travelling to the UK.; and\n    3.   (b) the applicant has a valid Certificate of Sponsorship from an approved sponsor for the Creative Worker route; and\n    4.   (c) if the applicant has consecutive engagements, the total length of all the periods of engagement, together with any gap between those engagements, is three months or less; and\n    5.   (d) if the applicant does not have consecutive engagements, the total length of the period of engagement is three months or less; and\n    6.   (e) the person otherwise meets the requirements to be granted permission as a Creative Worker.\n\nCRV 3.3. A person applying for entry clearance as a Creative Worker must, if Appendix Tuberculosis applies, provide a valid medical certificate confirming that they have undergone screening for active pulmonary tuberculosis and that this tuberculosis is not present in them.",
      "needs_review": false
    },
    {
      "metadata": {
        "source": "Appendix Temporary Work – Creative Worker",
        "part": "Appendix Temporary Work – Creative Worker",
        "section_id": "CRV 4.1",
        "section_title": "Sponsorship requirement for a Creative Worker",
        "parent_section": null,
        "hierarchy_level": 1,
        "topic": "sponsorship",
        "url": "https://www.gov.uk/guidance/immigration-rules/immigration-rules-appendix-t5-temporary-worker-creative-or-sporting-worker",
        "scraped_at": "2025-12-06T17:25:38.764207"
      },
      "text": "### Sponsorship requirement for a Creative Worker\n\n1.   CRV 4.1. The applicant must have a valid Certificate of Sponsorship for the job they are planning to do; which to be valid must: \n    1.   (a) confirm the applicant’s name, that they are being sponsored as a Creative Worker, and details of the job and pay the sponsor is offering them confirming that these arrangements comply with the National Minimum Wage; and\n    2.   (b) include a start date, stated by the sponsor, which is no more than 3 months after the date of application; and\n    3.   (c) not have been used in a previous application which was either granted or refused (but can have been used in a previous application which was rejected as invalid, made void or withdrawn); and\n    4.   (d) not have been withdrawn by the sponsor or cancelled by the Home Office; and\n    5.   (e) confirm that the role meets the relevant requirements at CRV 4.2.\n\n2.   CRV 4.2. The sponsor must demonstrate that: \n    1.   (a) the details of the occupation the applicant will be doing comply with the relevant Code of Practice under Appendix Creative Workers Codes of Practice where one exists for that occupation; or\n    2.   (b) where there is no relevant Code of Practice under Appendix Creative Workers Codes of Practice for the occupation the applicant will be doing, the applicant will: \n        1.   (i) be performing a role in the creative industries that appears in Appendix Skilled Occupations; and\n        2.   (ii) make a unique contribution to creative life in the UK.\n\nCRV 4.3. If the Certificate of Sponsorship records that the applicant is being sponsored for more than one engagement by the same sponsor, there must be no more than 14 days between each individual engagement. Time spent by the applicant outside the UK (including the dates of their departure from and return to the UK) will not be counted towards this period.\n\nCRV 4.4. If the applicant has consecutive engagements, each sponsor must assign its own Certificate of Sponsorship to the applicant, and each Certificate of Sponsorship must meet the requirements in CRV 4.1. to CRV 4.3.\n\nCRV 4.5. The sponsor must operate or intend to operate within the creative sector and be authorised by the Home Office to sponsor the job in question under the Creative Worker route.\n\nCRV 4.6. The sponsor must be listed as A-rated on the Home Office’s register of licensed sponsors, unless the applicant was last granted permission as a Creative Worker and is applying to continue working for the same sponsor as in their last permission.\n\nCRV 4.7. The decision maker must not have reasonable grounds to believe the job the applicant is being sponsored to do does not comply with the National Minimum Wage Regulations or the Working Time Regulations.\n\nCRV 4.8. The applicant must provide details of any transport, living allowances and other expenses paid by the sponsor or any other person or organisation to the applicant and whether the sponsor will seek to recoup these costs, either through payroll deductions or any other means.\n\nCRV 4.9. If the Certificate of Sponsorship associated with the application is declared part of a group by the sponsor and the work of the applicant is directly related to the employment of an entertainer or a cultural artist whose application has been refused, all applications within the group will be refused.\n\nCRV 4.10. The applicant must not be filling a permanent position, including on a temporary basis.",
      "summary": "This provision applies to Creative Worker applicants requiring a valid Certificate of Sponsorship. The sponsor must confirm job details, wages, and compliance within three months of application, ensuring the role meets relevant codes or qualifies under the Skilled Occupations list. Exceptions include previously invalid, withdrawn, or canceled certificates.",
      "augmented_text": "Document: Appendix Temporary Work – Creative Worker\nPart: Appendix Temporary Work – Creative Worker\nSection ID: CRV 4.1\nSection: Sponsorship requirement for a Creative Worker\nTopic: sponsorship\n\nSummary: This provision applies to Creative Worker applicants requiring a valid Certificate of Sponsorship. The sponsor must confirm job details, wages, and compliance within three months of application, ensuring the role meets relevant codes or qualifies under the Skilled Occupations list. Exceptions include previously invalid, withdrawn, or canceled certificates.\n\n### Sponsorship requirement for a Creative Worker\n\n1.   CRV 4.1. The applicant must have a valid Certificate of Sponsorship for the job they are planning to do; which to be valid must: \n    1.   (a) confirm the applicant’s name, that they are being sponsored as a Creative Worker, and details of the job and pay the sponsor is offering them confirming that these arrangements comply with the National Minimum Wage; and\n    2.   (b) include a start date, stated by the sponsor, which is no more than 3 months after the date of application; and\n    3.   (c) not have been used in a previous application which was either granted or refused (but can have been used in a previous application which was rejected as invalid, made void or withdrawn); and\n    4.   (d) not have been withdrawn by the sponsor or cancelled by the Home Office; and\n    5.   (e) confirm that the role meets the relevant requirements at CRV 4.2.\n\n2.   CRV 4.2. The sponsor must demonstrate that: \n    1.   (a) the details of the occupation the applicant will be doing comply with the relevant Code of Practice under Appendix Creative Workers Codes of Practice where one exists for that occupation; or\n    2.   (b) where there is no relevant Code of Practice under Appendix Creative Workers Codes of Practice for the occupation the applicant will be doing, the applicant will: \n        1.   (i) be performing a role in the creative industries that appears in Appendix Skilled Occupations; and\n        2.   (ii) make a unique contribution to creative life in the UK.\n\nCRV 4.3. If the Certificate of Sponsorship records that the applicant is being sponsored for more than one engagement by the same sponsor, there must be no more than 14 days between each individual engagement. Time spent by the applicant outside the UK (including the dates of their departure from and return to the UK) will not be counted towards this period.\n\nCRV 4.4. If the applicant has consecutive engagements, each sponsor must assign its own Certificate of Sponsorship to the applicant, and each Certificate of Sponsorship must meet the requirements in CRV 4.1. to CRV 4.3.\n\nCRV 4.5. The sponsor must operate or intend to operate within the creative sector and be authorised by the Home Office to sponsor the job in question under the Creative Worker route.\n\nCRV 4.6. The sponsor must be listed as A-rated on the Home Office’s register of licensed sponsors, unless the applicant was last granted permission as a Creative Worker and is applying to continue working for the same sponsor as in their last permission.\n\nCRV 4.7. The decision maker must not have reasonable grounds to believe the job the applicant is being sponsored to do does not comply with the National Minimum Wage Regulations or the Working Time Regulations.\n\nCRV 4.8. The applicant must provide details of any transport, living allowances and other expenses paid by the sponsor or any other person or organisation to the applicant and whether the sponsor will seek to recoup these costs, either through payroll deductions or any other means.\n\nCRV 4.9. If the Certificate of Sponsorship associated with the application is declared part of a group by the sponsor and the work of the applicant is directly related to the employment of an entertainer or a cultural artist whose application has been refused, all applications within the group will be refused.\n\nCRV 4.10. The applicant must not be filling a permanent position, including on a temporary basis.",
      "needs_review": false
    },
    {
      "metadata": {
        "source": "Appendix Temporary Work – Creative Worker",
        "part": "Appendix Temporary Work – Creative Worker",
        "section_id": "CRV 5.1",
        "section_title": "Genuineness requirement for a Creative Worker",
        "parent_section": null,
        "hierarchy_level": 1,
        "topic": "eligibility",
        "url": "https://www.gov.uk/guidance/immigration-rules/immigration-rules-appendix-t5-temporary-worker-creative-or-sporting-worker",
        "scraped_at": "2025-12-06T17:25:38.764230"
      },
      "text": "### Genuineness requirement for a Creative Worker\n\n1.   CRV 5.1. The applicant must: \n    1.   (a) genuinely intend, and be able, to undertake the role for which they are being sponsored; and\n    2.   (b) not intend to undertake employment other than in the role for which they are being sponsored, or as otherwise permitted by paragraph CRV 9.5.",
      "summary": "This provision applies to Creative Worker applicants. They must genuinely intend and be able to undertake their sponsored role and not seek other employment unless explicitly permitted, ensuring the bona fide nature of their application.",
      "augmented_text": "Document: Appendix Temporary Work – Creative Worker\nPart: Appendix Temporary Work – Creative Worker\nSection ID: CRV 5.1\nSection: Genuineness requirement for a Creative Worker\nTopic: eligibility\n\nSummary: This provision applies to Creative Worker applicants. They must genuinely intend and be able to undertake their sponsored role and not seek other employment unless explicitly permitted, ensuring the bona fide nature of their application.\n\n### Genuineness requirement for a Creative Worker\n\n1.   CRV 5.1. The applicant must: \n    1.   (a) genuinely intend, and be able, to undertake the role for which they are being sponsored; and\n    2.   (b) not intend to undertake employment other than in the role for which they are being sponsored, or as otherwise permitted by paragraph CRV 9.5.",
      "needs_review": false
    },
    {
      "metadata": {
        "source": "Appendix Temporary Work – Creative Worker",
        "part": "Appendix Temporary Work – Creative Worker",
        "section_id": "CRV 6.1",
        "section_title": "Financial requirement for a Creative Worker",
        "parent_section": "CRV 6",
        "hierarchy_level": 2,
        "topic": "financial",
        "url": "https://www.gov.uk/guidance/immigration-rules/immigration-rules-appendix-t5-temporary-worker-creative-or-sporting-worker",
        "scraped_at": "2025-12-06T17:25:38.764242"
      },
      "text": "### Financial requirement for a Creative Worker\n\nCRV 6.1. If the applicant is applying for permission to stay and has been in the UK with permission for 12 months or longer on the date of application, they will meet the financial requirement and do not need to show funds.\n\n1.   CRV 6.2. If the applicant is applying for entry clearance, or is applying for permission to enter under CRV 3.2, or is applying for permission to stay and has been in the UK for less than 12 months on the date of application, either: \n    1.   (a) the applicant must have funds of at least £1,270; or\n    2.   (b) the applicant’s A rated sponsor must confirm on the Certificate of Sponsorship that they will, if it is necessary, maintain and accommodate the applicant up to the end of the first month of their employment for an amount of at least £1,270.\n\nCRV 6.3. If CRV 6.2.(a) applies, the applicant must show that they have held the required level of funds for a 28-day period and as specified in Appendix Finance.",
      "summary": "This provision applies to Creative Workers applying for permission to stay or entry clearance. Applicants must demonstrate £1,270 in funds or sponsor confirmation if in the UK less than 12 months; those present in the UK for 12+ months meet the requirement automatically. Critical conditions include fund holding for 28 days if relying on personal funds.",
      "augmented_text": "Document: Appendix Temporary Work – Creative Worker\nPart: Appendix Temporary Work – Creative Worker\nSection ID: CRV 6.1\nSection: Financial requirement for a Creative Worker\nTopic: financial\n\nSummary: This provision applies to Creative Workers applying for permission to stay or entry clearance. Applicants must demonstrate £1,270 in funds or sponsor confirmation if in the UK less than 12 months; those present in the UK for 12+ months meet the requirement automatically. Critical conditions include fund holding for 28 days if relying on personal funds.\n\n### Financial requirement for a Creative Worker\n\nCRV 6.1. If the applicant is applying for permission to stay and has been in the UK with permission for 12 months or longer on the date of application, they will meet the financial requirement and do not need to show funds.\n\n1.   CRV 6.2. If the applicant is applying for entry clearance, or is applying for permission to enter under CRV 3.2, or is applying for permission to stay and has been in the UK for less than 12 months on the date of application, either: \n    1.   (a) the applicant must have funds of at least £1,270; or\n    2.   (b) the applicant’s A rated sponsor must confirm on the Certificate of Sponsorship that they will, if it is necessary, maintain and accommodate the applicant up to the end of the first month of their employment for an amount of at least £1,270.\n\nCRV 6.3. If CRV 6.2.(a) applies, the applicant must show that they have held the required level of funds for a 28-day period and as specified in Appendix Finance.",
      "needs_review": false
    },
    {
      "metadata": {
        "source": "Appendix Temporary Work – Creative Worker",
        "part": "Appendix Temporary Work – Creative Worker",
        "section_id": "CRV 7.1",
        "section_title": "Parental consent requirement for a Creative Worker",
        "parent_section": "CRV 7",
        "hierarchy_level": 2,
        "topic": "family",
        "url": "https://www.gov.uk/guidance/immigration-rules/immigration-rules-appendix-t5-temporary-worker-creative-or-sporting-worker",
        "scraped_at": "2025-12-06T17:25:38.764265"
      },
      "text": "### Parental consent requirement for a Creative Worker\n\nCRV 7.1. The applicant must meet the parental consent requirement for “applicant not applying as a dependent child” in Appendix Children.\n\nCRV 7.2. DELETED.",
      "summary": "This provision applies to Creative Workers who are not applying as dependent children. They must satisfy the parental consent requirement outlined in Appendix Children. No additional conditions or exceptions are specified.",
      "augmented_text": "Document: Appendix Temporary Work – Creative Worker\nPart: Appendix Temporary Work – Creative Worker\nSection ID: CRV 7.1\nSection: Parental consent requirement for a Creative Worker\nTopic: family\n\nSummary: This provision applies to Creative Workers who are not applying as dependent children. They must satisfy the parental consent requirement outlined in Appendix Children. No additional conditions or exceptions are specified.\n\n### Parental consent requirement for a Creative Worker\n\nCRV 7.1. The applicant must meet the parental consent requirement for “applicant not applying as a dependent child” in Appendix Children.\n\nCRV 7.2. DELETED.",
      "needs_review": false
    },
    {
      "metadata": {
        "source": "Appendix Temporary Work – Creative Worker",
        "part": "Appendix Temporary Work – Creative Worker",
        "section_id": "CRV 8.1",
        "section_title": "Decision on an application as a Creative Worker",
        "parent_section": "CRV 8",
        "hierarchy_level": 2,
        "topic": "eligibility",
        "url": "https://www.gov.uk/guidance/immigration-rules/immigration-rules-appendix-t5-temporary-worker-creative-or-sporting-worker",
        "scraped_at": "2025-12-06T17:25:38.764274"
      },
      "text": "### Decision on an application as a Creative Worker\n\nCRV 8.1. If the decision maker is satisfied that all the suitability and eligibility requirements for the Creative Worker route are met, the application will be granted, otherwise the application will be refused.\n\nCRV 8.2. If the application is refused, the person can apply for an Administrative Review under Appendix AR: Administrative Review.",
      "summary": "This provision applies to applicants seeking a Creative Worker visa. The decision maker grants or refuses the application based on meeting suitability and eligibility criteria; if refused, the applicant may request an Administrative Review.",
      "augmented_text": "Document: Appendix Temporary Work – Creative Worker\nPart: Appendix Temporary Work – Creative Worker\nSection ID: CRV 8.1\nSection: Decision on an application as a Creative Worker\nTopic: eligibility\n\nSummary: This provision applies to applicants seeking a Creative Worker visa. The decision maker grants or refuses the application based on meeting suitability and eligibility criteria; if refused, the applicant may request an Administrative Review.\n\n### Decision on an application as a Creative Worker\n\nCRV 8.1. If the decision maker is satisfied that all the suitability and eligibility requirements for the Creative Worker route are met, the application will be granted, otherwise the application will be refused.\n\nCRV 8.2. If the application is refused, the person can apply for an Administrative Review under Appendix AR: Administrative Review.",
      "needs_review": false
    },
    {
      "metadata": {
        "source": "Appendix Temporary Work – Creative Worker",
        "part": "Appendix Temporary Work – Creative Worker",
        "section_id": "1",
        "section_title": "Period of grant for a Creative Worker",
        "parent_section": null,
        "hierarchy_level": 1,
        "topic": "leave-to-enter",
        "url": "https://www.gov.uk/guidance/immigration-rules/immigration-rules-appendix-t5-temporary-worker-creative-or-sporting-worker",
        "scraped_at": "2025-12-06T17:25:38.764293"
      },
      "text": "### Period of grant for a Creative Worker\n\n1.   CRV 9.1. If the application is for entry clearance, the applicant will be granted whichever is the shorter of: \n    1.   (a) a period starting 14 days before the first engagement and ending 14 days after the final engagement, if the applicant has consecutive engagements; or\n    2.   (b) the period of the job on the Certificate of Sponsorship plus 14 days before and after, if the applicant does not have consecutive engagements; or\n    3.   (c) 12 months.\n\n2.   CRV 9.2. If the application is for permission to enter, in accordance with CRV 3.2, the applicant will be granted permission to enter for whichever is the shorter of: \n    1.   (a) a period starting up to 14 days before the first engagement and ending 14 days after the final engagement, if the applicant has consecutive engagements; or\n    2.   (b) the period of the job on the Certificate of Sponsorship plus up to 14 days before and 14 days after, if the applicant does not have consecutive engagements; or\n    3.   (c) 3 months.\n\n3.   CRV 9.3. Unless CRV 9.4. applies, if the application is for permission to stay, the applicant will be granted whichever is the shorter of: \n    1.   (a) a period ending 14 days after the final engagement, if the applicant has consecutive engagements; or\n    2.   (b) the period of the job on the Certificate of Sponsorship plus 14 days, if the applicant does not have consecutive engagements; or\n    3.   (c) the difference between the period the applicant has already spent in the UK as a Creative Worker and 12 months.\n\n4.   CRV 9.4. If the applicant is applying for permission to stay and the sponsor is the same sponsor as in the application which led to the applicant’s last grant of permission, the applicant will be granted whichever is the shorter of: \n    1.   (a) a period ending 14 days after the final engagement, if the applicant has consecutive engagements; or\n    2.   (b) the period of the job on the Certificate of Sponsorship plus 14 days, if the applicant does not have consecutive engagements; or\n    3.   (c) 12 months; or\n    4.   (d) the difference between the period the applicant has already spent in the UK as a Creative Worker and 24 months.",
      "summary": "This provision applies to Creative Workers applying for entry clearance, permission to enter, or permission to stay. It sets out the maximum grant periods, which depend on engagement continuity, sponsorship duration, and specific timeframes—typically up to 3 months or 12 months—ensuring flexibility based on engagement patterns. Critical conditions include considerations for consecutive vs. non-consecutive engagements and allowances of up to 14 days before or after engagements.",
      "augmented_text": "Document: Appendix Temporary Work – Creative Worker\nPart: Appendix Temporary Work – Creative Worker\nSection ID: 1\nSection: Period of grant for a Creative Worker\nTopic: leave-to-enter\n\nSummary: This provision applies to Creative Workers applying for entry clearance, permission to enter, or permission to stay. It sets out the maximum grant periods, which depend on engagement continuity, sponsorship duration, and specific timeframes—typically up to 3 months or 12 months—ensuring flexibility based on engagement patterns. Critical conditions include considerations for consecutive vs. non-consecutive engagements and allowances of up to 14 days before or after engagements.\n\n### Period of grant for a Creative Worker\n\n1.   CRV 9.1. If the application is for entry clearance, the applicant will be granted whichever is the shorter of: \n    1.   (a) a period starting 14 days before the first engagement and ending 14 days after the final engagement, if the applicant has consecutive engagements; or\n    2.   (b) the period of the job on the Certificate of Sponsorship plus 14 days before and after, if the applicant does not have consecutive engagements; or\n    3.   (c) 12 months.\n\n2.   CRV 9.2. If the application is for permission to enter, in accordance with CRV 3.2, the applicant will be granted permission to enter for whichever is the shorter of: \n    1.   (a) a period starting up to 14 days before the first engagement and ending 14 days after the final engagement, if the applicant has consecutive engagements; or\n    2.   (b) the period of the job on the Certificate of Sponsorship plus up to 14 days before and 14 days after, if the applicant does not have consecutive engagements; or\n    3.   (c) 3 months.\n\n3.   CRV 9.3. Unless CRV 9.4. applies, if the application is for permission to stay, the applicant will be granted whichever is the shorter of: \n    1.   (a) a period ending 14 days after the final engagement, if the applicant has consecutive engagements; or\n    2.   (b) the period of the job on the Certificate of Sponsorship plus 14 days, if the applicant does not have consecutive engagements; or\n    3.   (c) the difference between the period the applicant has already spent in the UK as a Creative Worker and 12 months.\n\n4.   CRV 9.4. If the applicant is applying for permission to stay and the sponsor is the same sponsor as in the application which led to the applicant’s last grant of permission, the applicant will be granted whichever is the shorter of: \n    1.   (a) a period ending 14 days after the final engagement, if the applicant has consecutive engagements; or\n    2.   (b) the period of the job on the Certificate of Sponsorship plus 14 days, if the applicant does not have consecutive engagements; or\n    3.   (c) 12 months; or\n    4.   (d) the difference between the period the applicant has already spent in the UK as a Creative Worker and 24 months.",
      "needs_review": false
    },
    {
      "metadata": {
        "source": "Appendix Temporary Work – Creative Worker",
        "part": "Appendix Temporary Work – Creative Worker",
        "section_id": "1",
        "section_title": "Conditions of grant for a Creative Worker",
        "parent_section": null,
        "hierarchy_level": 1,
        "topic": "financial",
        "url": "https://www.gov.uk/guidance/immigration-rules/immigration-rules-appendix-t5-temporary-worker-creative-or-sporting-worker",
        "scraped_at": "2025-12-06T17:25:38.764304"
      },
      "text": "### Conditions of grant for a Creative Worker\n\n1.   CRV 9.5. The grant will be subject to all the following conditions: \n    1.   (a) no access to public funds; and\n    2.   (b) work is permitted only in the role(s) the applicant is being sponsored for; and\n    3.   (c) supplementary employment is permitted; and\n    4.   (d) study is permitted, subject to the ATAS condition in Appendix ATAS.\n    5.   (e) DELETED.",
      "summary": "This provision applies to Creative Workers granted a temporary visa, outlining conditions such as no access to public funds, work limited to sponsored roles, and permitted supplementary employment or study (subject to ATAS). Exceptions or modifications are not specified beyond these conditions.",
      "augmented_text": "Document: Appendix Temporary Work – Creative Worker\nPart: Appendix Temporary Work – Creative Worker\nSection ID: 1\nSection: Conditions of grant for a Creative Worker\nTopic: financial\n\nSummary: This provision applies to Creative Workers granted a temporary visa, outlining conditions such as no access to public funds, work limited to sponsored roles, and permitted supplementary employment or study (subject to ATAS). Exceptions or modifications are not specified beyond these conditions.\n\n### Conditions of grant for a Creative Worker\n\n1.   CRV 9.5. The grant will be subject to all the following conditions: \n    1.   (a) no access to public funds; and\n    2.   (b) work is permitted only in the role(s) the applicant is being sponsored for; and\n    3.   (c) supplementary employment is permitted; and\n    4.   (d) study is permitted, subject to the ATAS condition in Appendix ATAS.\n    5.   (e) DELETED.",
      "needs_review": false
    },
    {
      "metadata": {
        "source": "Appendix Temporary Work – Creative Worker",
        "part": "Appendix Temporary Work – Creative Worker",
        "section_id": "CW 1.1",
        "section_title": "Dependants of a Creative Worker",
        "parent_section": null,
        "hierarchy_level": 2,
        "topic": "eligibility",
        "url": "https://www.gov.uk/guidance/immigration-rules/immigration-rules-appendix-t5-temporary-worker-creative-or-sporting-worker",
        "scraped_at": "2025-12-06T17:25:38.764316"
      },
      "text": "### Dependants of a Creative Worker",
      "summary": "Dependants of a Creative Worker may apply to join or stay with the main applicant. They must meet relevant criteria, such as proof of relationship and financial support, with specific conditions for their stay; exceptions are not specified here.",
      "augmented_text": "Document: Appendix Temporary Work – Creative Worker\nPart: Appendix Temporary Work – Creative Worker\nSection ID: CW 1.1\nSection: Dependants of a Creative Worker\nTopic: eligibility\n\nSummary: Dependants of a Creative Worker may apply to join or stay with the main applicant. They must meet relevant criteria, such as proof of relationship and financial support, with specific conditions for their stay; exceptions are not specified here.\n\n### Dependants of a Creative Worker",
      "needs_review": false
    },
    {
      "metadata": {
        "source": "Appendix Temporary Work – Creative Worker",
        "part": "Appendix Temporary Work – Creative Worker",
        "section_id": "CRV 10.1",
        "section_title": "Validity requirements for a dependent partner or dependent child of a Creative Worker",
        "parent_section": "CRV 10",
        "hierarchy_level": 2,
        "topic": "leave-to-enter",
        "url": "https://www.gov.uk/guidance/immigration-rules/immigration-rules-appendix-t5-temporary-worker-creative-or-sporting-worker",
        "scraped_at": "2025-12-06T17:25:38.764395"
      },
      "text": "### Validity requirements for a dependent partner or dependent child of a Creative Worker\n\nCRV 10.1. A person applying for entry clearance or permission to stay as a dependent partner or dependent child of a Creative Worker must apply online on the gov.uk website on the specified form as follows:\n\n| Applicant | Specified form |\n| --- | --- |\n| EEA national with a chipped passport | Either (as applicable): • Dependant partner or dependant child using the UK Immigration: ID Check app; or • the forms listed below for dependant applicants outside or inside the UK as relevant. |\n| Applicants outside the UK | Dependant partner visa Dependant child visa |\n| Applicants inside the UK | If the dependant is applying at the same time as the Creative Worker, they can be included in the form Temporary Worker where the form allows dependants to be added. Otherwise: - Dependant partner - Dependant child |\n\n1.   CRV 10.2. An application for entry clearance or permission to stay as a partner or child of a Creative Worker must meet all the following requirements: \n    1.   (a) any fee and Immigration Health Charge must have been paid; and\n    2.   (b) the applicant must have provided biometrics when required; and\n    3.   (c) the applicant must have provided a passport or other travel document which satisfactorily establishes their identity and nationality; and\n    4.   (d) the applicant must be applying as a partner or child of person who: \n        1.   (i) has made a valid application for entry clearance or permission to stay on the Creative Worker route that has not been decided; or\n        2.   (ii) has entry clearance or permission to stay on the Creative Worker route.\n\nCRV 10.3. An applicant applying as a dependent partner must be aged 18 or over on the date of application.\n\nCRV 10.4. If applying for permission to stay, the applicant must be in the UK on the date of application.\n\n1.   CRV 10.4ZA. If applying for permission to stay, the applicant must not have, or have last been granted, permission: \n    1.   (a) as a Visitor; or\n    2.   (b) as a Short-term Student; or\n    3.   (c) as a Parent of a Child Student; or\n    4.   (d) as a Seasonal Worker; or\n    5.   (e) as a Domestic Worker in a Private Household; or\n    6.   (f) outside the Immigration Rules.\n\n1.   CRV 10.4A. An applicant who is applying for permission to stay and has, or last had, permission as a Student, must fulfil one of the Conditions A or B below on the date of application: \n    1.   (a) Condition A: the applicant must have completed the course of study for which the Confirmation of Acceptance for Studies was assigned (or a course to which ST 27.3 of Appendix Student applies); or\n    2.   (b) Condition B: the applicant must: \n        1.   (i) be studying a full-time course of study leading to the award of a PhD with a higher education provider which has a track record of compliance; and\n        2.   (ii) have completed at least 24 months of study on that course.\n\nCRV 10.5. An application which does not meet all the validity requirements for a partner or child of a Creative Worker may be rejected as invalid and not considered.",
      "summary": "This provision applies to dependents (partners or children) of Creative Workers seeking entry clearance or permission to stay. Applicants must submit their applications online with the required fee, biometric data, and valid travel documents, and must be linked to a valid Creative Worker application. Critical conditions include compliance with all documentation, fee payments, and establishing their relationship to the Creative Worker.",
      "augmented_text": "Document: Appendix Temporary Work – Creative Worker\nPart: Appendix Temporary Work – Creative Worker\nSection ID: CRV 10.1\nSection: Validity requirements for a dependent partner or dependent child of a Creative Worker\nTopic: leave-to-enter\n\nSummary: This provision applies to dependents (partners or children) of Creative Workers seeking entry clearance or permission to stay. Applicants must submit their applications online with the required fee, biometric data, and valid travel documents, and must be linked to a valid Creative Worker application. Critical conditions include compliance with all documentation, fee payments, and establishing their relationship to the Creative Worker.\n\n### Validity requirements for a dependent partner or dependent child of a Creative Worker\n\nCRV 10.1. A person applying for entry clearance or permission to stay as a dependent partner or dependent child of a Creative Worker must apply online on the gov.uk website on the specified form as follows:\n\n| Applicant | Specified form |\n| --- | --- |\n| EEA national with a chipped passport | Either (as applicable): • Dependant partner or dependant child using the UK Immigration: ID Check app; or • the forms listed below for dependant applicants outside or inside the UK as relevant. |\n| Applicants outside the UK | Dependant partner visa Dependant child visa |\n| Applicants inside the UK | If the dependant is applying at the same time as the Creative Worker, they can be included in the form Temporary Worker where the form allows dependants to be added. Otherwise: - Dependant partner - Dependant child |\n\n1.   CRV 10.2. An application for entry clearance or permission to stay as a partner or child of a Creative Worker must meet all the following requirements: \n    1.   (a) any fee and Immigration Health Charge must have been paid; and\n    2.   (b) the applicant must have provided biometrics when required; and\n    3.   (c) the applicant must have provided a passport or other travel document which satisfactorily establishes their identity and nationality; and\n    4.   (d) the applicant must be applying as a partner or child of person who: \n        1.   (i) has made a valid application for entry clearance or permission to stay on the Creative Worker route that has not been decided; or\n        2.   (ii) has entry clearance or permission to stay on the Creative Worker route.\n\nCRV 10.3. An applicant applying as a dependent partner must be aged 18 or over on the date of application.\n\nCRV 10.4. If applying for permission to stay, the applicant must be in the UK on the date of application.\n\n1.   CRV 10.4ZA. If applying for permission to stay, the applicant must not have, or have last been granted, permission: \n    1.   (a) as a Visitor; or\n    2.   (b) as a Short-term Student; or\n    3.   (c) as a Parent of a Child Student; or\n    4.   (d) as a Seasonal Worker; or\n    5.   (e) as a Domestic Worker in a Private Household; or\n    6.   (f) outside the Immigration Rules.\n\n1.   CRV 10.4A. An applicant who is applying for permission to stay and has, or last had, permission as a Student, must fulfil one of the Conditions A or B below on the date of application: \n    1.   (a) Condition A: the applicant must have completed the course of study for which the Confirmation of Acceptance for Studies was assigned (or a course to which ST 27.3 of Appendix Student applies); or\n    2.   (b) Condition B: the applicant must: \n        1.   (i) be studying a full-time course of study leading to the award of a PhD with a higher education provider which has a track record of compliance; and\n        2.   (ii) have completed at least 24 months of study on that course.\n\nCRV 10.5. An application which does not meet all the validity requirements for a partner or child of a Creative Worker may be rejected as invalid and not considered.",
      "needs_review": false
    },
    {
      "metadata": {
        "source": "Appendix Temporary Work – Creative Worker",
        "part": "Appendix Temporary Work – Creative Worker",
        "section_id": "CRV 11.1",
        "section_title": "Suitability requirements for a dependent partner or dependent child of a Creative Worker",
        "parent_section": "CRV 11",
        "hierarchy_level": 2,
        "topic": "suitability",
        "url": "https://www.gov.uk/guidance/immigration-rules/immigration-rules-appendix-t5-temporary-worker-creative-or-sporting-worker",
        "scraped_at": "2025-12-06T17:25:38.764409"
      },
      "text": "### Suitability requirements for a dependent partner or dependent child of a Creative Worker\n\nCRV 11.1. The applicant must not fall for refusal under Part Suitability.\n\n1.   CRV 11.2. If applying for permission to stay the applicant must not be: \n    1.   (a) in breach of immigration laws, except that where the Exceptions for overstayers section of Part Suitability applies, that period of overstaying will be disregarded; or\n    2.   (b) on immigration bail.",
      "summary": "This provision applies to dependent partners or children of Creative Workers. They must meet suitability requirements, including not breaching immigration laws (with certain overstaying exceptions) or being on immigration bail, to avoid refusal.",
      "augmented_text": "Document: Appendix Temporary Work – Creative Worker\nPart: Appendix Temporary Work – Creative Worker\nSection ID: CRV 11.1\nSection: Suitability requirements for a dependent partner or dependent child of a Creative Worker\nTopic: suitability\n\nSummary: This provision applies to dependent partners or children of Creative Workers. They must meet suitability requirements, including not breaching immigration laws (with certain overstaying exceptions) or being on immigration bail, to avoid refusal.\n\n### Suitability requirements for a dependent partner or dependent child of a Creative Worker\n\nCRV 11.1. The applicant must not fall for refusal under Part Suitability.\n\n1.   CRV 11.2. If applying for permission to stay the applicant must not be: \n    1.   (a) in breach of immigration laws, except that where the Exceptions for overstayers section of Part Suitability applies, that period of overstaying will be disregarded; or\n    2.   (b) on immigration bail.",
      "needs_review": false
    },
    {
      "metadata": {
        "source": "Appendix Temporary Work – Creative Worker",
        "part": "Appendix Temporary Work – Creative Worker",
        "section_id": "Eligibility requirements for a dependent partner or dependent child of a Creative Worker",
        "section_title": "Eligibility requirements for a dependent partner or dependent child of a Creative Worker",
        "parent_section": null,
        "hierarchy_level": 3,
        "topic": "eligibility",
        "url": "https://www.gov.uk/guidance/immigration-rules/immigration-rules-appendix-t5-temporary-worker-creative-or-sporting-worker",
        "scraped_at": "2025-12-06T17:25:38.764415"
      },
      "text": "### Eligibility requirements for a dependent partner or dependent child of a Creative Worker",
      "summary": "This provision applies to dependents of Creative Workers entering the UK. Dependents must demonstrate genuine relationship, meet health and character requirements, and may need to satisfy certain financial thresholds; no exceptions are specified in this excerpt.",
      "augmented_text": "Document: Appendix Temporary Work – Creative Worker\nPart: Appendix Temporary Work – Creative Worker\nSection ID: Eligibility requirements for a dependent partner or dependent child of a Creative Worker\nSection: Eligibility requirements for a dependent partner or dependent child of a Creative Worker\nTopic: eligibility\n\nSummary: This provision applies to dependents of Creative Workers entering the UK. Dependents must demonstrate genuine relationship, meet health and character requirements, and may need to satisfy certain financial thresholds; no exceptions are specified in this excerpt.\n\n### Eligibility requirements for a dependent partner or dependent child of a Creative Worker",
      "needs_review": false
    },
    {
      "metadata": {
        "source": "Appendix Temporary Work – Creative Worker",
        "part": "Appendix Temporary Work – Creative Worker",
        "section_id": "CRV 12.1",
        "section_title": "Entry requirement for a dependent partner or dependent child of a Creative Worker",
        "parent_section": "CRV 12",
        "hierarchy_level": 2,
        "topic": "leave-to-enter",
        "url": "https://www.gov.uk/guidance/immigration-rules/immigration-rules-appendix-t5-temporary-worker-creative-or-sporting-worker",
        "scraped_at": "2025-12-06T17:25:38.764433"
      },
      "text": "### Entry requirement for a dependent partner or dependent child of a Creative Worker\n\nCRV 12.1. A person seeking to come to the UK as a dependent partner or dependent child of a Creative Worker must apply for and obtain entry clearance as a dependent partner or dependent child of a Creative Worker before they arrive in the UK, unless CRV 12.2. applies.\n\n1.   CRV 12.2. A person arriving in the UK and seeking entry as a dependent partner or dependent child of a Creative Worker who does not have a valid entry clearance may be granted permission to enter if the following requirements are met: \n    1.   (a) the applicant is not a visa national; and\n    2.   (aa) the applicant has obtained an Electronic Travel Authorisation; and\n    3.   (b) the applicant is seeking entry at the same time as the person they are a dependant of, and who meets the requirements at CRV 3.2.; and\n    4.   (c) the applicant meets the requirements to be granted permission as a dependent partner or dependent child of a Creative Worker.\n\nCRV 12.3. A person applying for entry clearance as the partner or child of a Creative Worker must, if Appendix Tuberculosis applies, provide a valid medical certificate confirming that they have undergone screening for active pulmonary tuberculosis and that this tuberculosis is not present in them.",
      "summary": "This provision applies to dependents (partners or children) of Creative Workers. They must obtain entry clearance before arriving, unless qualifying under specific conditions (no visa, Electronic Travel Authorization, arrival with the principal worker, and meeting dependent criteria). Additionally, TB screening is required if applicable.",
      "augmented_text": "Document: Appendix Temporary Work – Creative Worker\nPart: Appendix Temporary Work – Creative Worker\nSection ID: CRV 12.1\nSection: Entry requirement for a dependent partner or dependent child of a Creative Worker\nTopic: leave-to-enter\n\nSummary: This provision applies to dependents (partners or children) of Creative Workers. They must obtain entry clearance before arriving, unless qualifying under specific conditions (no visa, Electronic Travel Authorization, arrival with the principal worker, and meeting dependent criteria). Additionally, TB screening is required if applicable.\n\n### Entry requirement for a dependent partner or dependent child of a Creative Worker\n\nCRV 12.1. A person seeking to come to the UK as a dependent partner or dependent child of a Creative Worker must apply for and obtain entry clearance as a dependent partner or dependent child of a Creative Worker before they arrive in the UK, unless CRV 12.2. applies.\n\n1.   CRV 12.2. A person arriving in the UK and seeking entry as a dependent partner or dependent child of a Creative Worker who does not have a valid entry clearance may be granted permission to enter if the following requirements are met: \n    1.   (a) the applicant is not a visa national; and\n    2.   (aa) the applicant has obtained an Electronic Travel Authorisation; and\n    3.   (b) the applicant is seeking entry at the same time as the person they are a dependant of, and who meets the requirements at CRV 3.2.; and\n    4.   (c) the applicant meets the requirements to be granted permission as a dependent partner or dependent child of a Creative Worker.\n\nCRV 12.3. A person applying for entry clearance as the partner or child of a Creative Worker must, if Appendix Tuberculosis applies, provide a valid medical certificate confirming that they have undergone screening for active pulmonary tuberculosis and that this tuberculosis is not present in them.",
      "needs_review": false
    },
    {
      "metadata": {
        "source": "Appendix Temporary Work – Creative Worker",
        "part": "Appendix Temporary Work – Creative Worker",
        "section_id": "1",
        "section_title": "Relationship requirement for a dependent partner of a Creative Worker",
        "parent_section": null,
        "hierarchy_level": 1,
        "topic": "family",
        "url": "https://www.gov.uk/guidance/immigration-rules/immigration-rules-appendix-t5-temporary-worker-creative-or-sporting-worker",
        "scraped_at": "2025-12-06T17:25:38.764451"
      },
      "text": "### Relationship requirement for a dependent partner of a Creative Worker\n\n1.   CRV 13.1. The applicant must be the partner of a person (P) where one of the following applies: \n    1.   (a) P has permission on the Creative Worker route; or\n    2.   (b) P is, at the same time, applying for (and is granted) entry clearance or permission on the Creative Worker route.\n\n2.   CRV 13.2. The requirements of Appendix Relationship with Partner must be met.\n\nCRV 13.3. DELETED.\n\nCRV 13.4. DELETED.",
      "summary": "This provision applies to dependent partners of Creative Workers. They must be partners of individuals with permission or applying on the Creative Worker route and meet the specified relationship requirements, with certain conditions and exceptions outlined in the related appendix.",
      "augmented_text": "Document: Appendix Temporary Work – Creative Worker\nPart: Appendix Temporary Work – Creative Worker\nSection ID: 1\nSection: Relationship requirement for a dependent partner of a Creative Worker\nTopic: family\n\nSummary: This provision applies to dependent partners of Creative Workers. They must be partners of individuals with permission or applying on the Creative Worker route and meet the specified relationship requirements, with certain conditions and exceptions outlined in the related appendix.\n\n### Relationship requirement for a dependent partner of a Creative Worker\n\n1.   CRV 13.1. The applicant must be the partner of a person (P) where one of the following applies: \n    1.   (a) P has permission on the Creative Worker route; or\n    2.   (b) P is, at the same time, applying for (and is granted) entry clearance or permission on the Creative Worker route.\n\n2.   CRV 13.2. The requirements of Appendix Relationship with Partner must be met.\n\nCRV 13.3. DELETED.\n\nCRV 13.4. DELETED.",
      "needs_review": false
    },
    {
      "metadata": {
        "source": "Appendix Temporary Work – Creative Worker",
        "part": "Appendix Temporary Work – Creative Worker",
        "section_id": "1",
        "section_title": "Relationship requirement for a dependent child of a Creative Worker",
        "parent_section": null,
        "hierarchy_level": 1,
        "topic": "family",
        "url": "https://www.gov.uk/guidance/immigration-rules/immigration-rules-appendix-t5-temporary-worker-creative-or-sporting-worker",
        "scraped_at": "2025-12-06T17:25:38.764467"
      },
      "text": "### Relationship requirement for a dependent child of a Creative Worker\n\n1.   CRV 14.1. DELETED.\n2.   CRV 14.2. DELETED.\n\nCRV 14.3. DELETED.",
      "summary": "This provision applies to dependent children of Creative Workers. It establishes the relationship requirement for dependents to qualify, with certain conditions and exclusions; however, specific details are deleted in this excerpt.",
      "augmented_text": "Document: Appendix Temporary Work – Creative Worker\nPart: Appendix Temporary Work – Creative Worker\nSection ID: 1\nSection: Relationship requirement for a dependent child of a Creative Worker\nTopic: family\n\nSummary: This provision applies to dependent children of Creative Workers. It establishes the relationship requirement for dependents to qualify, with certain conditions and exclusions; however, specific details are deleted in this excerpt.\n\n### Relationship requirement for a dependent child of a Creative Worker\n\n1.   CRV 14.1. DELETED.\n2.   CRV 14.2. DELETED.\n\nCRV 14.3. DELETED.",
      "needs_review": false
    },
    {
      "metadata": {
        "source": "Appendix Temporary Work – Creative Worker",
        "part": "Appendix Temporary Work – Creative Worker",
        "section_id": "CRV 15.1",
        "section_title": "Care requirement for a dependent child of a Creative Worker",
        "parent_section": "CRV 15",
        "hierarchy_level": 2,
        "topic": "family",
        "url": "https://www.gov.uk/guidance/immigration-rules/immigration-rules-appendix-t5-temporary-worker-creative-or-sporting-worker",
        "scraped_at": "2025-12-06T17:25:38.764481"
      },
      "text": "### Care requirement for a dependent child of a Creative Worker\n\nCRV 15.1. DELETED.",
      "summary": "This provision applies to dependent children of Creative Workers. It requires them to be cared for adequately, with specific conditions, unless an exception or alternative evidence is provided. The detailed care criteria and possible exemptions are outlined in the deleted section.",
      "augmented_text": "Document: Appendix Temporary Work – Creative Worker\nPart: Appendix Temporary Work – Creative Worker\nSection ID: CRV 15.1\nSection: Care requirement for a dependent child of a Creative Worker\nTopic: family\n\nSummary: This provision applies to dependent children of Creative Workers. It requires them to be cared for adequately, with specific conditions, unless an exception or alternative evidence is provided. The detailed care criteria and possible exemptions are outlined in the deleted section.\n\n### Care requirement for a dependent child of a Creative Worker\n\nCRV 15.1. DELETED.",
      "needs_review": false
    },
    {
      "metadata": {
        "source": "Appendix Temporary Work – Creative Worker",
        "part": "Appendix Temporary Work – Creative Worker",
        "section_id": "CRV 16.1",
        "section_title": "Age requirement for a dependent child of a Creative Worker",
        "parent_section": "CRV 16",
        "hierarchy_level": 2,
        "topic": "family",
        "url": "https://www.gov.uk/guidance/immigration-rules/immigration-rules-appendix-t5-temporary-worker-creative-or-sporting-worker",
        "scraped_at": "2025-12-06T17:25:38.764496"
      },
      "text": "### Age requirement for a dependent child of a Creative Worker\n\nCRV 16.1. DELETED.\n\nCRV 16.2. DELETED.",
      "summary": "This provision applies to dependent children of Creative Workers. It previously outlined age requirements but has been deleted, indicating no current age restrictions or conditions for such dependents.",
      "augmented_text": "Document: Appendix Temporary Work – Creative Worker\nPart: Appendix Temporary Work – Creative Worker\nSection ID: CRV 16.1\nSection: Age requirement for a dependent child of a Creative Worker\nTopic: family\n\nSummary: This provision applies to dependent children of Creative Workers. It previously outlined age requirements but has been deleted, indicating no current age restrictions or conditions for such dependents.\n\n### Age requirement for a dependent child of a Creative Worker\n\nCRV 16.1. DELETED.\n\nCRV 16.2. DELETED.",
      "needs_review": false
    },
    {
      "metadata": {
        "source": "Appendix Temporary Work – Creative Worker",
        "part": "Appendix Temporary Work – Creative Worker",
        "section_id": "1",
        "section_title": "Requirements for a dependent child of a Creative Worker",
        "parent_section": null,
        "hierarchy_level": 1,
        "topic": "leave-to-enter",
        "url": "https://www.gov.uk/guidance/immigration-rules/immigration-rules-appendix-t5-temporary-worker-creative-or-sporting-worker",
        "scraped_at": "2025-12-06T17:25:38.764512"
      },
      "text": "### Requirements for a dependent child of a Creative Worker\n\n1.   CRV 16A.1. The applicant must meet the following requirements for a dependent child in Appendix Children: \n    1.   (a) relationship requirement: entry clearance and permission to stay; and\n    2.   (b) care requirement; and\n    3.   (c) age and independent life requirement.",
      "summary": "This provision applies to dependent children of Creative Workers. They must meet relationship, care, and age/independent life requirements to obtain entry clearance or permission to stay, with specific criteria outlined in Appendix Children.",
      "augmented_text": "Document: Appendix Temporary Work – Creative Worker\nPart: Appendix Temporary Work – Creative Worker\nSection ID: 1\nSection: Requirements for a dependent child of a Creative Worker\nTopic: leave-to-enter\n\nSummary: This provision applies to dependent children of Creative Workers. They must meet relationship, care, and age/independent life requirements to obtain entry clearance or permission to stay, with specific criteria outlined in Appendix Children.\n\n### Requirements for a dependent child of a Creative Worker\n\n1.   CRV 16A.1. The applicant must meet the following requirements for a dependent child in Appendix Children: \n    1.   (a) relationship requirement: entry clearance and permission to stay; and\n    2.   (b) care requirement; and\n    3.   (c) age and independent life requirement.",
      "needs_review": false
    },
    {
      "metadata": {
        "source": "Appendix Temporary Work – Creative Worker",
        "part": "Appendix Temporary Work – Creative Worker",
        "section_id": "CRV 17.1",
        "section_title": "Financial requirement for a dependent partner or dependent child of a Creative Worker",
        "parent_section": "CRV 17",
        "hierarchy_level": 2,
        "topic": "financial",
        "url": "https://www.gov.uk/guidance/immigration-rules/immigration-rules-appendix-t5-temporary-worker-creative-or-sporting-worker",
        "scraped_at": "2025-12-06T17:25:38.764524"
      },
      "text": "### Financial requirement for a dependent partner or dependent child of a Creative Worker\n\nCRV 17.1. If the applicant is applying for permission to stay and has been living in the UK with permission for 12 months or longer on the date of application, they will meet the financial requirement and do not need to show funds.\n\n1.   CRV 17.2. If the applicant is applying for entry clearance or permission to enter, or has been in the UK for less than 12 months on the date of application, either: \n    1.   (a) funds of at least the amount required in CRV 17.3. must be held collectively by one or more of the following: \n        1.   (i) the applicant; and\n        2.   (ii) the Creative Worker (P); and\n        3.   (iii) if the applicant is applying as a dependent child, their parent who is lawfully present in the UK or being granted entry clearance, or permission, at the same time; or\n\n    2.   (b) the Creative Worker’s A-rated sponsor must certify that they will, if necessary, maintain and accommodate the dependent partner and/or any dependent child as well as the Creative Worker, up to the end of the first month of each of their grants of permission, to at least the amounts required in CRV 17.3.\n\n2.   CRV 17.3. The funds required are: \n    1.   (a) £285 for a partner in the UK, or applying for entry clearance or permission to enter; and\n    2.   (b) £315 for the first dependent child in the UK, or applying for entry clearance or permission to enter; and\n    3.   (c) £200 for any other dependent child in the UK, or applying for entry clearance or permission to enter.\n\nCRV 17.4. If CRV 17.2.(a) applies, the funds held for the applicant must be held in addition to any funds required for the Creative Worker to meet the financial requirement and any other dependants in the UK or applying at the same time.\n\nCRV 17.5. If CRV 17.2.(a) applies, the funds must have been held for a 28-day period and as specified in Appendix Finance.",
      "summary": "This provision applies to dependents of Creative Workers applying to stay or enter the UK. Dependents must either hold specified funds (£285 for a partner, £315 for a child) if under 12 months in the UK or have their sponsor certify financial support; those with over 12 months' UK permission automatically meet the requirement. Exceptions apply for applicants with 12+ months' UK residence.",
      "augmented_text": "Document: Appendix Temporary Work – Creative Worker\nPart: Appendix Temporary Work – Creative Worker\nSection ID: CRV 17.1\nSection: Financial requirement for a dependent partner or dependent child of a Creative Worker\nTopic: financial\n\nSummary: This provision applies to dependents of Creative Workers applying to stay or enter the UK. Dependents must either hold specified funds (£285 for a partner, £315 for a child) if under 12 months in the UK or have their sponsor certify financial support; those with over 12 months' UK permission automatically meet the requirement. Exceptions apply for applicants with 12+ months' UK residence.\n\n### Financial requirement for a dependent partner or dependent child of a Creative Worker\n\nCRV 17.1. If the applicant is applying for permission to stay and has been living in the UK with permission for 12 months or longer on the date of application, they will meet the financial requirement and do not need to show funds.\n\n1.   CRV 17.2. If the applicant is applying for entry clearance or permission to enter, or has been in the UK for less than 12 months on the date of application, either: \n    1.   (a) funds of at least the amount required in CRV 17.3. must be held collectively by one or more of the following: \n        1.   (i) the applicant; and\n        2.   (ii) the Creative Worker (P); and\n        3.   (iii) if the applicant is applying as a dependent child, their parent who is lawfully present in the UK or being granted entry clearance, or permission, at the same time; or\n\n    2.   (b) the Creative Worker’s A-rated sponsor must certify that they will, if necessary, maintain and accommodate the dependent partner and/or any dependent child as well as the Creative Worker, up to the end of the first month of each of their grants of permission, to at least the amounts required in CRV 17.3.\n\n2.   CRV 17.3. The funds required are: \n    1.   (a) £285 for a partner in the UK, or applying for entry clearance or permission to enter; and\n    2.   (b) £315 for the first dependent child in the UK, or applying for entry clearance or permission to enter; and\n    3.   (c) £200 for any other dependent child in the UK, or applying for entry clearance or permission to enter.\n\nCRV 17.4. If CRV 17.2.(a) applies, the funds held for the applicant must be held in addition to any funds required for the Creative Worker to meet the financial requirement and any other dependants in the UK or applying at the same time.\n\nCRV 17.5. If CRV 17.2.(a) applies, the funds must have been held for a 28-day period and as specified in Appendix Finance.",
      "needs_review": false
    },
    {
      "metadata": {
        "source": "Appendix Temporary Work – Creative Worker",
        "part": "Appendix Temporary Work – Creative Worker",
        "section_id": "CRV 18.1",
        "section_title": "Decision on an application as a dependent partner or dependent child of a Creative Worker",
        "parent_section": "CRV 18",
        "hierarchy_level": 2,
        "topic": "eligibility",
        "url": "https://www.gov.uk/guidance/immigration-rules/immigration-rules-appendix-t5-temporary-worker-creative-or-sporting-worker",
        "scraped_at": "2025-12-06T17:25:38.764532"
      },
      "text": "### Decision on an application as a dependent partner or dependent child of a Creative Worker\n\nCRV 18.1. If the decision maker is satisfied that all the suitability and eligibility requirements for a dependent partner or dependent child of a Creative Worker are met, the application will be granted, otherwise the application will be refused.\n\nCRV 18.2. If the application is refused, the person can apply for an Administrative Review under Appendix AR: Administrative Review.",
      "summary": "This provision applies to dependent partners and children of Creative Workers. It requires the decision-maker to confirm all suitability and eligibility criteria are met for approval; otherwise, the application is refused. Refused applicants may request an Administrative Review.",
      "augmented_text": "Document: Appendix Temporary Work – Creative Worker\nPart: Appendix Temporary Work – Creative Worker\nSection ID: CRV 18.1\nSection: Decision on an application as a dependent partner or dependent child of a Creative Worker\nTopic: eligibility\n\nSummary: This provision applies to dependent partners and children of Creative Workers. It requires the decision-maker to confirm all suitability and eligibility criteria are met for approval; otherwise, the application is refused. Refused applicants may request an Administrative Review.\n\n### Decision on an application as a dependent partner or dependent child of a Creative Worker\n\nCRV 18.1. If the decision maker is satisfied that all the suitability and eligibility requirements for a dependent partner or dependent child of a Creative Worker are met, the application will be granted, otherwise the application will be refused.\n\nCRV 18.2. If the application is refused, the person can apply for an Administrative Review under Appendix AR: Administrative Review.",
      "needs_review": false
    },
    {
      "metadata": {
        "source": "Appendix Temporary Work – Creative Worker",
        "part": "Appendix Temporary Work – Creative Worker",
        "section_id": "CRV 19.1",
        "section_title": "Period of grant for a dependent partner or dependent child of a Creative Worker",
        "parent_section": "CRV 19",
        "hierarchy_level": 2,
        "topic": "family",
        "url": "https://www.gov.uk/guidance/immigration-rules/immigration-rules-appendix-t5-temporary-worker-creative-or-sporting-worker",
        "scraped_at": "2025-12-06T17:25:38.764554"
      },
      "text": "### Period of grant for a dependent partner or dependent child of a Creative Worker\n\nCRV 19.1. A partner will be granted permission which ends on the same date as their partner’s permission as a Creative Worker.\n\nCRV 19.2. A child will be granted permission which ends on the same date as whichever of their parents’ permission ends first.",
      "summary": "This provision applies to dependents of Creative Workers. Dependents' visas are granted to align with the main Creative Worker’s permission, with partners sharing the same end date and children’s permissions ending when the earliest parent’s permission expires.",
      "augmented_text": "Document: Appendix Temporary Work – Creative Worker\nPart: Appendix Temporary Work – Creative Worker\nSection ID: CRV 19.1\nSection: Period of grant for a dependent partner or dependent child of a Creative Worker\nTopic: family\n\nSummary: This provision applies to dependents of Creative Workers. Dependents' visas are granted to align with the main Creative Worker’s permission, with partners sharing the same end date and children’s permissions ending when the earliest parent’s permission expires.\n\n### Period of grant for a dependent partner or dependent child of a Creative Worker\n\nCRV 19.1. A partner will be granted permission which ends on the same date as their partner’s permission as a Creative Worker.\n\nCRV 19.2. A child will be granted permission which ends on the same date as whichever of their parents’ permission ends first.",
      "needs_review": false
    },
    {
      "metadata": {
        "source": "Appendix Temporary Work – Creative Worker",
        "part": "Appendix Temporary Work – Creative Worker",
        "section_id": "1",
        "section_title": "Conditions of grant for a dependent partner or dependent child of a Creative Worker",
        "parent_section": null,
        "hierarchy_level": 1,
        "topic": "financial",
        "url": "https://www.gov.uk/guidance/immigration-rules/immigration-rules-appendix-t5-temporary-worker-creative-or-sporting-worker",
        "scraped_at": "2025-12-06T17:25:38.764564"
      },
      "text": "### Conditions of grant for a dependent partner or dependent child of a Creative Worker\n\n1.   CRV 19.3. The grant will be subject to all the following conditions: \n    1.   (a) no access to public funds; and\n    2.   (b) work (including self-employment and voluntary work) is permitted, except as a professional sportsperson (including as a sports coach); and\n    3.   (c) study is permitted, subject to the ATAS condition in Appendix ATAS if the applicant is over the age of 18.\n    4.   (d) DELETED.\n\nPrint this page",
      "summary": "Dependent partners or children of Creative Workers must not access public funds; can work (excluding professional sportspersons) and study (if over 18 and subject to ATAS). These conditions apply unless specifically exempted.",
      "augmented_text": "Document: Appendix Temporary Work – Creative Worker\nPart: Appendix Temporary Work – Creative Worker\nSection ID: 1\nSection: Conditions of grant for a dependent partner or dependent child of a Creative Worker\nTopic: financial\n\nSummary: Dependent partners or children of Creative Workers must not access public funds; can work (excluding professional sportspersons) and study (if over 18 and subject to ATAS). These conditions apply unless specifically exempted.\n\n### Conditions of grant for a dependent partner or dependent child of a Creative Worker\n\n1.   CRV 19.3. The grant will be subject to all the following conditions: \n    1.   (a) no access to public funds; and\n    2.   (b) work (including self-employment and voluntary work) is permitted, except as a professional sportsperson (including as a sports coach); and\n    3.   (c) study is permitted, subject to the ATAS condition in Appendix ATAS if the applicant is over the age of 18.\n    4.   (d) DELETED.\n\nPrint this page",
      "needs_review": false
    }
  ]
}