{
  "url": "https://www.gov.uk/guidance/immigration-rules/immigration-rules-appendix-scale-up",
  "part_name": "Immigration Rules Appendix Scale-up",
  "scraped_at": "2025-12-06T17:28:36.806646",
  "chunk_count": 52,
  "chunks": [
    {
      "metadata": {
        "source": "Immigration Rules Appendix Scale-up",
        "part": "Immigration Rules Appendix Scale-up",
        "section_id": "1",
        "section_title": "Validity requirements for a Scale-up Worker",
        "parent_section": null,
        "hierarchy_level": 1,
        "topic": "leave-to-enter",
        "url": "https://www.gov.uk/guidance/immigration-rules/immigration-rules-appendix-scale-up",
        "scraped_at": "2025-12-06T17:28:36.804357"
      },
      "text": "### Validity requirements for a Scale-up Worker\n\n1.   SCU 1.1. A person applying for entry clearance or permission to stay as a Scale-up Worker must apply online on the gov.uk website on the specified form as follows: \n    1.   (a) for applicants outside the UK, form “Scale-up visa”; or\n    2.   (b) for applicants inside the UK, form “Scale-up”.\n\n2.   SCU 1.2. An application for entry clearance or permission to stay as a Scale-up Worker must meet all the following validity requirements: \n    1.   (a) any fee and Immigration Health Charge must have been paid; and\n    2.   (b) the applicant must have provided biometrics when required; and\n    3.   (c) the applicant must have provided a passport or other travel document which satisfactorily establishes their identity and nationality; and\n    4.   (d) if the applicant is making a sponsored application, they must have a Certificate of Sponsorship that was issued to them by their Sponsor no more than 3 months before the date of application.\n\nSCU 1.3. The applicant must be aged 18 or over on the date of application.\n\nSCU 1.4. If the applicant has in the last 12 months before the date of application received an award from a Government or international scholarship agency covering both fees and living costs for study in the UK, they must provide written consent to the application from that Government or agency.\n\n1.   SCU 1.5. If applying for permission to stay, the applicant must be in the UK on the date of application.\n2.   SCU 1.5ZA. If applying for permission to stay, the applicant must not have, or have last been granted, permission: \n    1.   (a) as a Visitor; or\n    2.   (b) as a Short-term Student; or\n    3.   (c) as a Parent of a Child Student; or\n    4.   (d) as a Seasonal Worker; or\n    5.   (e) as a Domestic Worker in a Private Household; or\n    6.   (f) outside the Immigration Rules.\n\n1.   SCU 1.5A. An applicant who is applying for permission to stay and has, or last had, permission as a Student, must fulfil one of the Conditions A, B or C below on the date of application: \n    1.   (a) Condition A: the applicant must have completed the course of study for which the Confirmation of Acceptance for Studies was assigned (or a course to which ST 27.3 of Appendix Student applies); or\n    2.   (b) Condition B: \n        1.   (i) the applicant must be studying a full-time course of study at degree level or above with a higher education provider which has a track record of compliance; and\n        2.   (ii) the Certificate of Sponsorship in SCU 1.2(d) must have a start date no earlier than the course completion date; or\n\n    3.   (c) Condition C: \n        1.   (i) the applicant must be studying a full-time course of study leading to the award of a PhD with a higher education provider which has a track record of compliance; and\n        2.   (ii) the Certificate of Sponsorship in SCU 1.2(d) must have a start date no earlier than 24 months after the start date of that course.\n\nSCU 1.6. An application which does not meet all the validity requirements for the Scale-up route may be rejected as invalid and not considered.",
      "summary": "The provision applies to individuals applying for entry clearance or permission to stay as a Scale-up Worker. Applicants must submit online applications, pay fees, provide biometrics, hold a valid passport, and, if sponsored, possess a recent Certificate of Sponsorship; applicants must also be at least 18 and, if staying, be present in the UK at application time.",
      "augmented_text": "Document: Immigration Rules Appendix Scale-up\nPart: Immigration Rules Appendix Scale-up\nSection ID: 1\nSection: Validity requirements for a Scale-up Worker\nTopic: leave-to-enter\n\nSummary: The provision applies to individuals applying for entry clearance or permission to stay as a Scale-up Worker. Applicants must submit online applications, pay fees, provide biometrics, hold a valid passport, and, if sponsored, possess a recent Certificate of Sponsorship; applicants must also be at least 18 and, if staying, be present in the UK at application time.\n\n### Validity requirements for a Scale-up Worker\n\n1.   SCU 1.1. A person applying for entry clearance or permission to stay as a Scale-up Worker must apply online on the gov.uk website on the specified form as follows: \n    1.   (a) for applicants outside the UK, form “Scale-up visa”; or\n    2.   (b) for applicants inside the UK, form “Scale-up”.\n\n2.   SCU 1.2. An application for entry clearance or permission to stay as a Scale-up Worker must meet all the following validity requirements: \n    1.   (a) any fee and Immigration Health Charge must have been paid; and\n    2.   (b) the applicant must have provided biometrics when required; and\n    3.   (c) the applicant must have provided a passport or other travel document which satisfactorily establishes their identity and nationality; and\n    4.   (d) if the applicant is making a sponsored application, they must have a Certificate of Sponsorship that was issued to them by their Sponsor no more than 3 months before the date of application.\n\nSCU 1.3. The applicant must be aged 18 or over on the date of application.\n\nSCU 1.4. If the applicant has in the last 12 months before the date of application received an award from a Government or international scholarship agency covering both fees and living costs for study in the UK, they must provide written consent to the application from that Government or agency.\n\n1.   SCU 1.5. If applying for permission to stay, the applicant must be in the UK on the date of application.\n2.   SCU 1.5ZA. If applying for permission to stay, the applicant must not have, or have last been granted, permission: \n    1.   (a) as a Visitor; or\n    2.   (b) as a Short-term Student; or\n    3.   (c) as a Parent of a Child Student; or\n    4.   (d) as a Seasonal Worker; or\n    5.   (e) as a Domestic Worker in a Private Household; or\n    6.   (f) outside the Immigration Rules.\n\n1.   SCU 1.5A. An applicant who is applying for permission to stay and has, or last had, permission as a Student, must fulfil one of the Conditions A, B or C below on the date of application: \n    1.   (a) Condition A: the applicant must have completed the course of study for which the Confirmation of Acceptance for Studies was assigned (or a course to which ST 27.3 of Appendix Student applies); or\n    2.   (b) Condition B: \n        1.   (i) the applicant must be studying a full-time course of study at degree level or above with a higher education provider which has a track record of compliance; and\n        2.   (ii) the Certificate of Sponsorship in SCU 1.2(d) must have a start date no earlier than the course completion date; or\n\n    3.   (c) Condition C: \n        1.   (i) the applicant must be studying a full-time course of study leading to the award of a PhD with a higher education provider which has a track record of compliance; and\n        2.   (ii) the Certificate of Sponsorship in SCU 1.2(d) must have a start date no earlier than 24 months after the start date of that course.\n\nSCU 1.6. An application which does not meet all the validity requirements for the Scale-up route may be rejected as invalid and not considered.",
      "needs_review": false
    },
    {
      "metadata": {
        "source": "Immigration Rules Appendix Scale-up",
        "part": "Immigration Rules Appendix Scale-up",
        "section_id": "SCU 2.1",
        "section_title": "Suitability requirements for a Scale-up Worker",
        "parent_section": "SCU 2",
        "hierarchy_level": 2,
        "topic": "suitability",
        "url": "https://www.gov.uk/guidance/immigration-rules/immigration-rules-appendix-scale-up",
        "scraped_at": "2025-12-06T17:28:36.804415"
      },
      "text": "### Suitability requirements for a Scale-up Worker\n\nSCU 2.1. The applicant must not fall for refusal under Part Suitability.\n\n1.   SCU 2.2. If applying for permission to stay the applicant must not be: \n    1.   (a) in breach of immigration laws, except that where the Exceptions for overstayers section of Part Suitability applies, that period of overstaying will be disregarded; or\n    2.   (b) on immigration bail.",
      "summary": "This provision applies to Scale-up Workers seeking permission to stay. Applicants must not breach immigration laws (excluding certain overstays) or be on immigration bail. Compliance with suitability criteria is essential for approval.",
      "augmented_text": "Document: Immigration Rules Appendix Scale-up\nPart: Immigration Rules Appendix Scale-up\nSection ID: SCU 2.1\nSection: Suitability requirements for a Scale-up Worker\nTopic: suitability\n\nSummary: This provision applies to Scale-up Workers seeking permission to stay. Applicants must not breach immigration laws (excluding certain overstays) or be on immigration bail. Compliance with suitability criteria is essential for approval.\n\n### Suitability requirements for a Scale-up Worker\n\nSCU 2.1. The applicant must not fall for refusal under Part Suitability.\n\n1.   SCU 2.2. If applying for permission to stay the applicant must not be: \n    1.   (a) in breach of immigration laws, except that where the Exceptions for overstayers section of Part Suitability applies, that period of overstaying will be disregarded; or\n    2.   (b) on immigration bail.",
      "needs_review": false
    },
    {
      "metadata": {
        "source": "Immigration Rules Appendix Scale-up",
        "part": "Immigration Rules Appendix Scale-up",
        "section_id": "Eligibility requirements for a Scale-up Worker",
        "section_title": "Eligibility requirements for a Scale-up Worker",
        "parent_section": null,
        "hierarchy_level": 2,
        "topic": "eligibility",
        "url": "https://www.gov.uk/guidance/immigration-rules/immigration-rules-appendix-scale-up",
        "scraped_at": "2025-12-06T17:28:36.804460"
      },
      "text": "### Eligibility requirements for a Scale-up Worker",
      "summary": "This provision applies to applicants seeking a Scale-up Worker visa. Applicants must have a genuine job offer from an approved sponsor, meet salary and skill level requirements, and demonstrate a genuine need for the role; no specific exceptions are outlined.",
      "augmented_text": "Document: Immigration Rules Appendix Scale-up\nPart: Immigration Rules Appendix Scale-up\nSection ID: Eligibility requirements for a Scale-up Worker\nSection: Eligibility requirements for a Scale-up Worker\nTopic: eligibility\n\nSummary: This provision applies to applicants seeking a Scale-up Worker visa. Applicants must have a genuine job offer from an approved sponsor, meet salary and skill level requirements, and demonstrate a genuine need for the role; no specific exceptions are outlined.\n\n### Eligibility requirements for a Scale-up Worker",
      "needs_review": false
    },
    {
      "metadata": {
        "source": "Immigration Rules Appendix Scale-up",
        "part": "Immigration Rules Appendix Scale-up",
        "section_id": "SCU 3.1",
        "section_title": "Entry requirements for a Scale-up Worker",
        "parent_section": "SCU 3",
        "hierarchy_level": 2,
        "topic": "leave-to-enter",
        "url": "https://www.gov.uk/guidance/immigration-rules/immigration-rules-appendix-scale-up",
        "scraped_at": "2025-12-06T17:28:36.804498"
      },
      "text": "### Entry requirements for a Scale-up Worker\n\nSCU 3.1. A person seeking to come to the UK as a Scale-up Worker must apply for and obtain entry clearance as a Scale-up Worker before they arrive in the UK.\n\nSCU 3.2. A person applying for entry clearance as a Scale-up Worker must, if Appendix Tuberculosis applies, provide a valid medical certificate confirming that they have undergone screening for active pulmonary tuberculosis and that this tuberculosis is not present in them.",
      "summary": "Scale-up Workers must apply for and secure entry clearance before arriving in the UK. Applicants where Appendix Tuberculosis applies must also provide a valid medical certificate confirming tuberculosis screening and absence of active pulmonary TB.",
      "augmented_text": "Document: Immigration Rules Appendix Scale-up\nPart: Immigration Rules Appendix Scale-up\nSection ID: SCU 3.1\nSection: Entry requirements for a Scale-up Worker\nTopic: leave-to-enter\n\nSummary: Scale-up Workers must apply for and secure entry clearance before arriving in the UK. Applicants where Appendix Tuberculosis applies must also provide a valid medical certificate confirming tuberculosis screening and absence of active pulmonary TB.\n\n### Entry requirements for a Scale-up Worker\n\nSCU 3.1. A person seeking to come to the UK as a Scale-up Worker must apply for and obtain entry clearance as a Scale-up Worker before they arrive in the UK.\n\nSCU 3.2. A person applying for entry clearance as a Scale-up Worker must, if Appendix Tuberculosis applies, provide a valid medical certificate confirming that they have undergone screening for active pulmonary tuberculosis and that this tuberculosis is not present in them.",
      "needs_review": false
    },
    {
      "metadata": {
        "source": "Immigration Rules Appendix Scale-up",
        "part": "Immigration Rules Appendix Scale-up",
        "section_id": "SCU 4.1",
        "section_title": "Points requirement for a Scale-up Worker",
        "parent_section": "SCU 4",
        "hierarchy_level": 2,
        "topic": "points",
        "url": "https://www.gov.uk/guidance/immigration-rules/immigration-rules-appendix-scale-up",
        "scraped_at": "2025-12-06T17:28:36.804544"
      },
      "text": "### Points requirement for a Scale-up Worker\n\nSCU 4.1. The applicant must be awarded 70 points in the table below. An applicant may only be awarded points from one of the first two rows of the table. All applicants must meet the requirements in the final two rows of the table.\n\nSCU 4.2. An applicant may only make a Sponsored Application and score 50 points in the first row of the table if the conditions for making an Unsponsored Application in SCU 4.3. are not met.\n\n1.   SCU 4.3. An applicant must make an Unsponsored Application and score 50 points in the second row of the table if they have been employed as a Scale-up Worker by a sponsor for at least 6 months in a previous permission on the Scale-up route and – \n    1.   (a) the applicant has permission as a Scale-up Worker on the date of application; or\n    2.   (b) the applicant last had permission as a Scale-up Worker and \n        1.   (i) if the applicant is applying for entry clearance, that permission expired less than 6 months before the date of application; or\n        2.   (ii) if the applicant is applying for permission to stay, the Exceptions for overstayers section of Part Suitability applies.\n\n| Type of application | Relevant requirements to be met | Relevant rules | Points |\n| --- | --- | --- | --- |\n| Sponsored Application | Sponsorship | SCU 5.1 to SCU 5.6 | 50 |\n|  | Job at an appropriate skill level | SCU 6.1 to SCU 6.4 |  |\n|  | Appropriate salary | SCU 7.1 to SCU 7.6 |  |\n| Unsponsored Application | UK earnings during most recent permission on the Scale-up route | SCU 8.1 to SCU 8.7 | 50 |\n| All applications | English language requirement at level B1 | SCU 9.1 to SCU 9.3 | 10 |\n| All applications | Financial requirement | SCU 10.1 to SCU 10.4 | 10 |",
      "summary": "Scale-up Workers must accrue 70 points, achieved via sponsored (50 points with sponsorship, skill, and salary requirements) or unsponsored routes (50 points if employed for 6 months and meeting specific permission conditions). Applicants can only choose one route and must meet detailed eligibility criteria, including timeframes and previous permission status.",
      "augmented_text": "Document: Immigration Rules Appendix Scale-up\nPart: Immigration Rules Appendix Scale-up\nSection ID: SCU 4.1\nSection: Points requirement for a Scale-up Worker\nTopic: points\n\nSummary: Scale-up Workers must accrue 70 points, achieved via sponsored (50 points with sponsorship, skill, and salary requirements) or unsponsored routes (50 points if employed for 6 months and meeting specific permission conditions). Applicants can only choose one route and must meet detailed eligibility criteria, including timeframes and previous permission status.\n\n### Points requirement for a Scale-up Worker\n\nSCU 4.1. The applicant must be awarded 70 points in the table below. An applicant may only be awarded points from one of the first two rows of the table. All applicants must meet the requirements in the final two rows of the table.\n\nSCU 4.2. An applicant may only make a Sponsored Application and score 50 points in the first row of the table if the conditions for making an Unsponsored Application in SCU 4.3. are not met.\n\n1.   SCU 4.3. An applicant must make an Unsponsored Application and score 50 points in the second row of the table if they have been employed as a Scale-up Worker by a sponsor for at least 6 months in a previous permission on the Scale-up route and – \n    1.   (a) the applicant has permission as a Scale-up Worker on the date of application; or\n    2.   (b) the applicant last had permission as a Scale-up Worker and \n        1.   (i) if the applicant is applying for entry clearance, that permission expired less than 6 months before the date of application; or\n        2.   (ii) if the applicant is applying for permission to stay, the Exceptions for overstayers section of Part Suitability applies.\n\n| Type of application | Relevant requirements to be met | Relevant rules | Points |\n| --- | --- | --- | --- |\n| Sponsored Application | Sponsorship | SCU 5.1 to SCU 5.6 | 50 |\n|  | Job at an appropriate skill level | SCU 6.1 to SCU 6.4 |  |\n|  | Appropriate salary | SCU 7.1 to SCU 7.6 |  |\n| Unsponsored Application | UK earnings during most recent permission on the Scale-up route | SCU 8.1 to SCU 8.7 | 50 |\n| All applications | English language requirement at level B1 | SCU 9.1 to SCU 9.3 | 10 |\n| All applications | Financial requirement | SCU 10.1 to SCU 10.4 | 10 |",
      "needs_review": false
    },
    {
      "metadata": {
        "source": "Immigration Rules Appendix Scale-up",
        "part": "Immigration Rules Appendix Scale-up",
        "section_id": "SW 3.1",
        "section_title": "Sponsored Application",
        "parent_section": null,
        "hierarchy_level": 2,
        "topic": "sponsorship",
        "url": "https://www.gov.uk/guidance/immigration-rules/immigration-rules-appendix-scale-up",
        "scraped_at": "2025-12-06T17:28:36.804570"
      },
      "text": "### Sponsored Application",
      "summary": "This provision applies to sponsors submitting applications under the Scale-up route. It requires sponsors to demonstrate they meet specific eligibility criteria and maintain compliance; applications may be rejected if conditions are not met or if eligibility is not proven.",
      "augmented_text": "Document: Immigration Rules Appendix Scale-up\nPart: Immigration Rules Appendix Scale-up\nSection ID: SW 3.1\nSection: Sponsored Application\nTopic: sponsorship\n\nSummary: This provision applies to sponsors submitting applications under the Scale-up route. It requires sponsors to demonstrate they meet specific eligibility criteria and maintain compliance; applications may be rejected if conditions are not met or if eligibility is not proven.\n\n### Sponsored Application",
      "needs_review": false
    },
    {
      "metadata": {
        "source": "Immigration Rules Appendix Scale-up",
        "part": "Immigration Rules Appendix Scale-up",
        "section_id": "SCU 5.1",
        "section_title": "Sponsorship requirement for Sponsored Application",
        "parent_section": null,
        "hierarchy_level": 1,
        "topic": "sponsorship",
        "url": "https://www.gov.uk/guidance/immigration-rules/immigration-rules-appendix-scale-up",
        "scraped_at": "2025-12-06T17:28:36.804623"
      },
      "text": "### Sponsorship requirement for Sponsored Application\n\n1.   SCU 5.1. The applicant must have a valid Certificate of Sponsorship for the job they are planning to do, which must: \n    1.   (a) confirm the applicant’s name, that they are being sponsored as a Scale-up Worker, details of the job and salary the Sponsor is offering them and PAYE details; and\n    2.   (b) include a start date for the job, stated by the Sponsor, which is no more than 3 months after the date of application; and\n    3.   (c) confirm the applicant is expected to work for the Sponsor for at least the first 6 months of their permission; and\n    4.   (d) not have been used in a previous application which was either granted or refused (but can have been used in a previous application which was rejected as invalid, made void or withdrawn); and\n    5.   (e) not have been withdrawn by the Sponsor or cancelled by the Home Office; and\n    6.   (f) confirm whether or not the Academic Technology Approval Scheme (ATAS) requirement in Appendix ATAS applies.\n\nSCU 5.2. The sponsor must be authorised by the Home Office to sponsor the job in question under the Scale-up route.\n\nSCU 5.3. The Sponsor must be listed as A-rated on the Home Office’s register of licensed sponsors.\n\n1.   SCU 5.4. The decision maker must not have reasonable grounds to believe the job the applicant is being sponsored to do: \n    1.   (a) does not exist; or\n    2.   (b) is a sham; or\n    3.   (c) has been created mainly so the applicant can apply for entry clearance or permission to stay.\n\n2.   SCU 5.5. The decision maker must not have reasonable grounds to believe the job the applicant is being sponsored to do amounts to: \n    1.   (a) the hire of the applicant to a third party who is not the Sponsor to fill a position with that party, whether temporary or permanent; or\n    2.   (b) contract work to undertake an ongoing routine role or to provide an ongoing routine service for a third party who is not the sponsor, regardless of the nature or length of any arrangement between the sponsor and the third party.\n\n1.   SCU 5.6. The decision maker must not have reasonable grounds to believe the job the applicant is being sponsored to do does not comply with the National Minimum Wage Regulations or the Working Time Regulations.",
      "summary": "This provision applies to applicants seeking to work as Scale-up Workers under UK Sponsorship Rules. They must hold a valid, unused Certificate of Sponsorship confirming job details, salary, start date within 3 months, and an expected 6-month employment period; sponsors must be Home Office-licensed A-rated entities. The decision also considers whether the sponsored job exists, is genuine, and not created solely for an application.",
      "augmented_text": "Document: Immigration Rules Appendix Scale-up\nPart: Immigration Rules Appendix Scale-up\nSection ID: SCU 5.1\nSection: Sponsorship requirement for Sponsored Application\nTopic: sponsorship\n\nSummary: This provision applies to applicants seeking to work as Scale-up Workers under UK Sponsorship Rules. They must hold a valid, unused Certificate of Sponsorship confirming job details, salary, start date within 3 months, and an expected 6-month employment period; sponsors must be Home Office-licensed A-rated entities. The decision also considers whether the sponsored job exists, is genuine, and not created solely for an application.\n\n### Sponsorship requirement for Sponsored Application\n\n1.   SCU 5.1. The applicant must have a valid Certificate of Sponsorship for the job they are planning to do, which must: \n    1.   (a) confirm the applicant’s name, that they are being sponsored as a Scale-up Worker, details of the job and salary the Sponsor is offering them and PAYE details; and\n    2.   (b) include a start date for the job, stated by the Sponsor, which is no more than 3 months after the date of application; and\n    3.   (c) confirm the applicant is expected to work for the Sponsor for at least the first 6 months of their permission; and\n    4.   (d) not have been used in a previous application which was either granted or refused (but can have been used in a previous application which was rejected as invalid, made void or withdrawn); and\n    5.   (e) not have been withdrawn by the Sponsor or cancelled by the Home Office; and\n    6.   (f) confirm whether or not the Academic Technology Approval Scheme (ATAS) requirement in Appendix ATAS applies.\n\nSCU 5.2. The sponsor must be authorised by the Home Office to sponsor the job in question under the Scale-up route.\n\nSCU 5.3. The Sponsor must be listed as A-rated on the Home Office’s register of licensed sponsors.\n\n1.   SCU 5.4. The decision maker must not have reasonable grounds to believe the job the applicant is being sponsored to do: \n    1.   (a) does not exist; or\n    2.   (b) is a sham; or\n    3.   (c) has been created mainly so the applicant can apply for entry clearance or permission to stay.\n\n2.   SCU 5.5. The decision maker must not have reasonable grounds to believe the job the applicant is being sponsored to do amounts to: \n    1.   (a) the hire of the applicant to a third party who is not the Sponsor to fill a position with that party, whether temporary or permanent; or\n    2.   (b) contract work to undertake an ongoing routine role or to provide an ongoing routine service for a third party who is not the sponsor, regardless of the nature or length of any arrangement between the sponsor and the third party.\n\n1.   SCU 5.6. The decision maker must not have reasonable grounds to believe the job the applicant is being sponsored to do does not comply with the National Minimum Wage Regulations or the Working Time Regulations.",
      "needs_review": false
    },
    {
      "metadata": {
        "source": "Immigration Rules Appendix Scale-up",
        "part": "Immigration Rules Appendix Scale-up",
        "section_id": "SCU 6.1",
        "section_title": "Job at an appropriate skill level requirement for Sponsored Application",
        "parent_section": "SCU 6",
        "hierarchy_level": 2,
        "topic": "eligibility",
        "url": "https://www.gov.uk/guidance/immigration-rules/immigration-rules-appendix-scale-up",
        "scraped_at": "2025-12-06T17:28:36.804735"
      },
      "text": "### Job at an appropriate skill level requirement for Sponsored Application\n\nSCU 6.1. The applicant must be sponsored for a job in a SOC 2020 occupation code listed in Table 2 or Table 3 of Appendix Skilled Occupations.\n\n1.   SCU 6.2. The sponsor must have chosen an appropriate SOC 2020 occupation code, and the decision maker must not have reasonable grounds to believe the sponsor has chosen a less appropriate SOC 2020 occupation code for any of the following reasons: \n    1.   (a) the most appropriate SOC 2020 occupation code is not eligible under the Scale-up route; or\n    2.   (b) the most appropriate SOC 2020 occupation code has a higher going rate than the proposed salary.\n\n2.   SCU 6.3. To support the assessment in SCU 6.2, the decision maker may, in particular, consider: \n    1.   (a) whether the Sponsor has shown a genuine need for the job as described; and\n    2.   (b) whether the applicant has the appropriate skills, qualifications and experience needed to do the job as described; and\n    3.   (c) the sponsor’s history of compliance with the immigration system including, but not limited to, paying its sponsored workers appropriately; and\n    4.   (d) any additional information from the sponsor.\n\nSCU 6.4. If the ATAS requirement in Appendix ATAS applies, the applicant must provide a valid ATAS certificate.",
      "summary": "This provision applies to sponsored applicants under the Scale-up route. Applicants must have jobs in SOC 2020 codes listed in specified tables, sponsored by an appropriate employer. Conditions include ensuring the job's suitability, the sponsor's compliance, and, if applicable, valid ATAS certification.",
      "augmented_text": "Document: Immigration Rules Appendix Scale-up\nPart: Immigration Rules Appendix Scale-up\nSection ID: SCU 6.1\nSection: Job at an appropriate skill level requirement for Sponsored Application\nTopic: eligibility\n\nSummary: This provision applies to sponsored applicants under the Scale-up route. Applicants must have jobs in SOC 2020 codes listed in specified tables, sponsored by an appropriate employer. Conditions include ensuring the job's suitability, the sponsor's compliance, and, if applicable, valid ATAS certification.\n\n### Job at an appropriate skill level requirement for Sponsored Application\n\nSCU 6.1. The applicant must be sponsored for a job in a SOC 2020 occupation code listed in Table 2 or Table 3 of Appendix Skilled Occupations.\n\n1.   SCU 6.2. The sponsor must have chosen an appropriate SOC 2020 occupation code, and the decision maker must not have reasonable grounds to believe the sponsor has chosen a less appropriate SOC 2020 occupation code for any of the following reasons: \n    1.   (a) the most appropriate SOC 2020 occupation code is not eligible under the Scale-up route; or\n    2.   (b) the most appropriate SOC 2020 occupation code has a higher going rate than the proposed salary.\n\n2.   SCU 6.3. To support the assessment in SCU 6.2, the decision maker may, in particular, consider: \n    1.   (a) whether the Sponsor has shown a genuine need for the job as described; and\n    2.   (b) whether the applicant has the appropriate skills, qualifications and experience needed to do the job as described; and\n    3.   (c) the sponsor’s history of compliance with the immigration system including, but not limited to, paying its sponsored workers appropriately; and\n    4.   (d) any additional information from the sponsor.\n\nSCU 6.4. If the ATAS requirement in Appendix ATAS applies, the applicant must provide a valid ATAS certificate.",
      "needs_review": false
    },
    {
      "metadata": {
        "source": "Immigration Rules Appendix Scale-up",
        "part": "Immigration Rules Appendix Scale-up",
        "section_id": "1",
        "section_title": "Appropriate salary requirement for Sponsored Application",
        "parent_section": null,
        "hierarchy_level": 1,
        "topic": "financial",
        "url": "https://www.gov.uk/guidance/immigration-rules/immigration-rules-appendix-scale-up",
        "scraped_at": "2025-12-06T17:28:36.804771"
      },
      "text": "### Appropriate salary requirement for Sponsored Application\n\n1.   SCU 7.1. The salary for the job for which the applicant is being sponsored must equal or exceed all of the following: \n    1.   (a) £39,100 per year; and\n    2.   (b) the going rate for the SOC 2020 occupation code.\n    3.   (c) DELETED.\n\nSCU 7.2. Salary only includes guaranteed basic gross pay (before income tax and including employee pension and national insurance contributions).\n\n1.   SCU 7.3. Salary does not include other pay and benefits, such as any of the following: \n    1.   (a) pay which cannot be guaranteed because the nature of the job means that hours fluctuate; or\n    2.   (b) additional pay such as shift, overtime or bonus pay, (whether or not it is guaranteed); or\n    3.   (c) employer pension and employer national insurance contributions; or\n    4.   (d) any allowances, such as accommodation or cost of living allowances; or\n    5.   (e) in-kind benefits, such as equity shares, health insurance, school or university fees, company cars or food; or\n    6.   (f) one-off payments, such as ‘golden hellos’; or\n    7.   (g) any payments relating to immigration costs, such as the fee or Immigration Health Charge; or\n    8.   (h) payments to cover business expenses, including (but not limited to) travel to and from the applicant’s country of residence, equipment, clothing, travel or subsistence.\n\nSCU 7.4. If the applicant is being sponsored to work more than 48 hours a week, subject to SCU 7.4A, only the salary for the first 48 hours a week will be considered towards the salary requirements set out in SCU 7.1 (a).\n\nFor example, an applicant who works 60 hours a week for £15 per hour will be considered to have a salary of £37,440 (£15 x 48 x 52) per year and not £46,800 (£15 x 60 x 52).\n\n1.   SCU 7.4A. If the applicant is being sponsored to work a pattern where the regular hours are not the same each week, resulting in uneven pay: \n    1.   (a) work in excess of 48 hours in some weeks can be considered towards the salary threshold of £39,100, providing the average over a regular cycle (which can be less than, but not more than, 17 weeks) is not more than 48 hours a week; and\n    2.   (b) any unpaid rest weeks will count towards the average when considering whether the salary thresholds are met; and\n    3.   (c) any unpaid rest weeks will not count as absences from employment for the purpose of paragraph SUI 36.1. in Part Suitability of these rules.\n\n2.   For example, an applicant who works a pattern of 60 hours a week for £15 per hour for two weeks, followed by an unpaid rest week, will be considered to work 40 hours a week on average and have a salary of just £31,200 (£15 x 40 x 52) per year.\n\n1.   SCU 7.5. Going rates in Table 2 of Appendix Skilled Occupations are based on a 37.5-hour week and will be pro-rated to the applicant’s working pattern, as follows: \n    1.   (a) (the going rate for the SOC 2020 occupation code stated in Table 2 of Appendix Skilled Occupations) x (the number of weekly working hours stated by the sponsor ÷ 37.5)\n    2.   (b) the applicant’s full weekly hours will be included when checking their salary against the going rate, even if they work more than 48 hours a week.\n\nSCU 7.6. If the requirements in SCU 5.1. to SCU 7.5. are met, the applicant will be awarded 50 points for meeting the Sponsored Application requirements.",
      "summary": "Sponsored applicants must receive a salary of at least £39,100 per year and the SOC 2020 going rate, covering guaranteed basic gross pay. The salary excludes variable earnings, benefits, allowances, and in-kind payments, with additional hours exceeding 48 per week subject to specific conditions.",
      "augmented_text": "Document: Immigration Rules Appendix Scale-up\nPart: Immigration Rules Appendix Scale-up\nSection ID: 1\nSection: Appropriate salary requirement for Sponsored Application\nTopic: financial\n\nSummary: Sponsored applicants must receive a salary of at least £39,100 per year and the SOC 2020 going rate, covering guaranteed basic gross pay. The salary excludes variable earnings, benefits, allowances, and in-kind payments, with additional hours exceeding 48 per week subject to specific conditions.\n\n### Appropriate salary requirement for Sponsored Application\n\n1.   SCU 7.1. The salary for the job for which the applicant is being sponsored must equal or exceed all of the following: \n    1.   (a) £39,100 per year; and\n    2.   (b) the going rate for the SOC 2020 occupation code.\n    3.   (c) DELETED.\n\nSCU 7.2. Salary only includes guaranteed basic gross pay (before income tax and including employee pension and national insurance contributions).\n\n1.   SCU 7.3. Salary does not include other pay and benefits, such as any of the following: \n    1.   (a) pay which cannot be guaranteed because the nature of the job means that hours fluctuate; or\n    2.   (b) additional pay such as shift, overtime or bonus pay, (whether or not it is guaranteed); or\n    3.   (c) employer pension and employer national insurance contributions; or\n    4.   (d) any allowances, such as accommodation or cost of living allowances; or\n    5.   (e) in-kind benefits, such as equity shares, health insurance, school or university fees, company cars or food; or\n    6.   (f) one-off payments, such as ‘golden hellos’; or\n    7.   (g) any payments relating to immigration costs, such as the fee or Immigration Health Charge; or\n    8.   (h) payments to cover business expenses, including (but not limited to) travel to and from the applicant’s country of residence, equipment, clothing, travel or subsistence.\n\nSCU 7.4. If the applicant is being sponsored to work more than 48 hours a week, subject to SCU 7.4A, only the salary for the first 48 hours a week will be considered towards the salary requirements set out in SCU 7.1 (a).\n\nFor example, an applicant who works 60 hours a week for £15 per hour will be considered to have a salary of £37,440 (£15 x 48 x 52) per year and not £46,800 (£15 x 60 x 52).\n\n1.   SCU 7.4A. If the applicant is being sponsored to work a pattern where the regular hours are not the same each week, resulting in uneven pay: \n    1.   (a) work in excess of 48 hours in some weeks can be considered towards the salary threshold of £39,100, providing the average over a regular cycle (which can be less than, but not more than, 17 weeks) is not more than 48 hours a week; and\n    2.   (b) any unpaid rest weeks will count towards the average when considering whether the salary thresholds are met; and\n    3.   (c) any unpaid rest weeks will not count as absences from employment for the purpose of paragraph SUI 36.1. in Part Suitability of these rules.\n\n2.   For example, an applicant who works a pattern of 60 hours a week for £15 per hour for two weeks, followed by an unpaid rest week, will be considered to work 40 hours a week on average and have a salary of just £31,200 (£15 x 40 x 52) per year.\n\n1.   SCU 7.5. Going rates in Table 2 of Appendix Skilled Occupations are based on a 37.5-hour week and will be pro-rated to the applicant’s working pattern, as follows: \n    1.   (a) (the going rate for the SOC 2020 occupation code stated in Table 2 of Appendix Skilled Occupations) x (the number of weekly working hours stated by the sponsor ÷ 37.5)\n    2.   (b) the applicant’s full weekly hours will be included when checking their salary against the going rate, even if they work more than 48 hours a week.\n\nSCU 7.6. If the requirements in SCU 5.1. to SCU 7.5. are met, the applicant will be awarded 50 points for meeting the Sponsored Application requirements.",
      "needs_review": false
    },
    {
      "metadata": {
        "source": "Immigration Rules Appendix Scale-up",
        "part": "Immigration Rules Appendix Scale-up",
        "section_id": "SCU 7A.1",
        "section_title": "Genuineness requirement for a Scale-Up Worker",
        "parent_section": null,
        "hierarchy_level": 1,
        "topic": "eligibility",
        "url": "https://www.gov.uk/guidance/immigration-rules/immigration-rules-appendix-scale-up",
        "scraped_at": "2025-12-06T17:28:36.804805"
      },
      "text": "### Genuineness requirement for a Scale-Up Worker\n\nSCU 7A.1. The applicant must genuinely intend, and be able, to undertake the role for which they are being sponsored.",
      "summary": "This provision applies to Scale-Up Workers. The applicant must genuinely intend and be capable of performing their sponsored role, with no specific exceptions or thresholds outlined.",
      "augmented_text": "Document: Immigration Rules Appendix Scale-up\nPart: Immigration Rules Appendix Scale-up\nSection ID: SCU 7A.1\nSection: Genuineness requirement for a Scale-Up Worker\nTopic: eligibility\n\nSummary: This provision applies to Scale-Up Workers. The applicant must genuinely intend and be capable of performing their sponsored role, with no specific exceptions or thresholds outlined.\n\n### Genuineness requirement for a Scale-Up Worker\n\nSCU 7A.1. The applicant must genuinely intend, and be able, to undertake the role for which they are being sponsored.",
      "needs_review": true,
      "review_reasons": [
        "generic_summary"
      ]
    },
    {
      "metadata": {
        "source": "Immigration Rules Appendix Scale-up",
        "part": "Immigration Rules Appendix Scale-up",
        "section_id": "SW 3.1",
        "section_title": "Entry requirements for students",
        "parent_section": null,
        "hierarchy_level": 2,
        "topic": "eligibility",
        "url": "https://www.gov.uk/guidance/immigration-rules/immigration-rules-appendix-scale-up",
        "scraped_at": "2025-12-06T17:28:36.804825"
      },
      "text": "### Unsponsored Application",
      "summary": "This provision applies to applicants submitting unsponsored immigration applications. It requires demonstrating eligibility without a sponsor, subject to specific criteria and thresholds outlined in the rules. Exceptions or detailed conditions depend on the application type and circumstances.",
      "augmented_text": "Document: Immigration Rules Appendix Scale-up\nPart: Immigration Rules Appendix Scale-up\nSection ID: SW 3.1\nSection: Entry requirements for students\nTopic: eligibility\n\nSummary: This provision applies to applicants submitting unsponsored immigration applications. It requires demonstrating eligibility without a sponsor, subject to specific criteria and thresholds outlined in the rules. Exceptions or detailed conditions depend on the application type and circumstances.\n\n### Unsponsored Application",
      "needs_review": false
    },
    {
      "metadata": {
        "source": "Immigration Rules Appendix Scale-up",
        "part": "Immigration Rules Appendix Scale-up",
        "section_id": "SCU 8.1",
        "section_title": "Earnings requirement for Scale-up Worker",
        "parent_section": null,
        "hierarchy_level": 1,
        "topic": "financial",
        "url": "https://www.gov.uk/guidance/immigration-rules/immigration-rules-appendix-scale-up",
        "scraped_at": "2025-12-06T17:28:36.804902"
      },
      "text": "### UK earnings in most recent grant of permission as a Scale-up Worker requirement for Unsponsored Application\n\n1.   SCU 8.1. The applicant must, during at least 50% of their most recent permission as a Scale-up Worker (for example, an applicant with 2 years’ permission as a Scale-up Worker must have had this level of earnings during at least 12 months of that permission), have had monthly PAYE earnings in the UK equivalent to at least: \n    1.   (a) £39,100 per year; or\n    2.   (b) £36,300 per year if their most recent permission on the route was on the basis of a Certificate of Sponsorship assigned between 4 April 2024 and 21 July 2025; or\n    3.   (c) £34,600 per year if their most recent permission on the route was on the basis of a Certificate of Sponsorship assigned between 12 April 2023 and 3 April 2024; or\n    4.   (d) £33,000 per year if their most recent permission on the route was on the basis of a Certificate of Sponsorship assigned on or before 11 April 2023.\n\n1.   SCU 8.2. For the purpose of meeting the requirement in SCU 8.1, periods of absence from work for any of the following reasons will be treated as periods during which the applicant was paid at the required level: \n    1.   (a) statutory maternity, paternity, parental, or shared parental leave; or\n    2.   (b) statutory adoption leave; or\n    3.   (c) sick leave\n\n2.   Providing at the time the absence starts the applicant’s job had PAYE earnings equivalent to at least: \n    1.   (i) £39,100 per year; or\n    2.   (ii) £36,300 per year if their most recent permission on the route was on the basis of a Certificate of Sponsorship assigned between 4 April 2024 and 21 July 2025; or\n    3.   (iii) £34,600 per year if their most recent permission on the route was on the basis of a Certificate of Sponsorship assigned between 12 April 2023 and 3 April 2024; or\n    4.   (iv) £33,000 per year if their most recent permission on the route was on the basis of a Certificate of Sponsorship assigned on or before 11 April 2023.\n\n3.   For example, an applicant with 2 years’ permission, who spent 6 months on the above types of leave during a 2-year permission as a Scale-up Worker, must have had PAYE earnings in the UK equivalent to the level stated in SCU 8.1. per year during at least 6 months of the remaining 18 months of that permission.\n\nSCU 8.3. PAYE means the guaranteed basic gross pay (before income tax and including employee pension and national insurance contributions), recorded through PAYE.\n\n1.   SCU 8.4. Earnings do not include other sources of income, such as any of the following: \n    1.   (a) earnings from self-employment; or\n    2.   (b) earnings from outside the UK; or\n    3.   (c) payments not recorded through PAYE; or\n    4.   (d) employer pension and employer national insurance contributions; or\n    5.   (e) income from savings, investments, property, inheritance, gambling or competitions.\n\nSCU 8.5. The decision maker must not have reasonable grounds to believe the PAYE earnings, or any part of the PAYE earnings, the applicant is relying on have been fabricated or inflated or do not relate to genuine employment.\n\n1.   SCU 8.6. To support the assessment in SCU 8.5, the decision maker may in particular consider any of the following: \n    1.   (a) whether the business from which the earnings are claimed can be shown to exist and be lawfully and genuinely trading; and\n    2.   (b) any payments made by the applicant to other parties; and\n    3.   (c) any additional information.\n\nSCU 8.7. If the requirements in SCU 8.1. to SCU 8.6. are met, the applicant will be awarded 50 points for meeting the Unsponsored Application requirements.",
      "summary": "This provision applies to Scale-up Workers seeking unsponsored application approval. Applicants must have, during at least 50% of their recent permission, monthly UK PAYE earnings meeting specific thresholds (£33,000–£39,100), with certain leave periods, like maternity or sick leave, counting towards this requirement. Thresholds vary based on the Certificate of Sponsorship issue date.",
      "augmented_text": "Document: Immigration Rules Appendix Scale-up\nPart: Immigration Rules Appendix Scale-up\nSection ID: SCU 8.1\nSection: Earnings requirement for Scale-up Worker\nTopic: financial\n\nSummary: This provision applies to Scale-up Workers seeking unsponsored application approval. Applicants must have, during at least 50% of their recent permission, monthly UK PAYE earnings meeting specific thresholds (£33,000–£39,100), with certain leave periods, like maternity or sick leave, counting towards this requirement. Thresholds vary based on the Certificate of Sponsorship issue date.\n\n### UK earnings in most recent grant of permission as a Scale-up Worker requirement for Unsponsored Application\n\n1.   SCU 8.1. The applicant must, during at least 50% of their most recent permission as a Scale-up Worker (for example, an applicant with 2 years’ permission as a Scale-up Worker must have had this level of earnings during at least 12 months of that permission), have had monthly PAYE earnings in the UK equivalent to at least: \n    1.   (a) £39,100 per year; or\n    2.   (b) £36,300 per year if their most recent permission on the route was on the basis of a Certificate of Sponsorship assigned between 4 April 2024 and 21 July 2025; or\n    3.   (c) £34,600 per year if their most recent permission on the route was on the basis of a Certificate of Sponsorship assigned between 12 April 2023 and 3 April 2024; or\n    4.   (d) £33,000 per year if their most recent permission on the route was on the basis of a Certificate of Sponsorship assigned on or before 11 April 2023.\n\n1.   SCU 8.2. For the purpose of meeting the requirement in SCU 8.1, periods of absence from work for any of the following reasons will be treated as periods during which the applicant was paid at the required level: \n    1.   (a) statutory maternity, paternity, parental, or shared parental leave; or\n    2.   (b) statutory adoption leave; or\n    3.   (c) sick leave\n\n2.   Providing at the time the absence starts the applicant’s job had PAYE earnings equivalent to at least: \n    1.   (i) £39,100 per year; or\n    2.   (ii) £36,300 per year if their most recent permission on the route was on the basis of a Certificate of Sponsorship assigned between 4 April 2024 and 21 July 2025; or\n    3.   (iii) £34,600 per year if their most recent permission on the route was on the basis of a Certificate of Sponsorship assigned between 12 April 2023 and 3 April 2024; or\n    4.   (iv) £33,000 per year if their most recent permission on the route was on the basis of a Certificate of Sponsorship assigned on or before 11 April 2023.\n\n3.   For example, an applicant with 2 years’ permission, who spent 6 months on the above types of leave during a 2-year permission as a Scale-up Worker, must have had PAYE earnings in the UK equivalent to the level stated in SCU 8.1. per year during at least 6 months of the remaining 18 months of that permission.\n\nSCU 8.3. PAYE means the guaranteed basic gross pay (before income tax and including employee pension and national insurance contributions), recorded through PAYE.\n\n1.   SCU 8.4. Earnings do not include other sources of income, such as any of the following: \n    1.   (a) earnings from self-employment; or\n    2.   (b) earnings from outside the UK; or\n    3.   (c) payments not recorded through PAYE; or\n    4.   (d) employer pension and employer national insurance contributions; or\n    5.   (e) income from savings, investments, property, inheritance, gambling or competitions.\n\nSCU 8.5. The decision maker must not have reasonable grounds to believe the PAYE earnings, or any part of the PAYE earnings, the applicant is relying on have been fabricated or inflated or do not relate to genuine employment.\n\n1.   SCU 8.6. To support the assessment in SCU 8.5, the decision maker may in particular consider any of the following: \n    1.   (a) whether the business from which the earnings are claimed can be shown to exist and be lawfully and genuinely trading; and\n    2.   (b) any payments made by the applicant to other parties; and\n    3.   (c) any additional information.\n\nSCU 8.7. If the requirements in SCU 8.1. to SCU 8.6. are met, the applicant will be awarded 50 points for meeting the Unsponsored Application requirements.",
      "needs_review": false
    },
    {
      "metadata": {
        "source": "Immigration Rules Appendix Scale-up",
        "part": "Immigration Rules Appendix Scale-up",
        "section_id": "SW 1",
        "section_title": "All Applications by Scale-up Workers",
        "parent_section": null,
        "hierarchy_level": 2,
        "topic": "application process",
        "url": "https://www.gov.uk/guidance/immigration-rules/immigration-rules-appendix-scale-up",
        "scraped_at": "2025-12-06T17:28:36.804922"
      },
      "text": "### All Applications by Scale-up Workers",
      "summary": "This provision applies to all Scale-up Workers applying for visa extensions or permissions. It requires demonstrating continued employment with a qualifying scale-up employer and meeting relevant eligibility criteria. No specific exceptions are noted.",
      "augmented_text": "Document: Immigration Rules Appendix Scale-up\nPart: Immigration Rules Appendix Scale-up\nSection ID: SW 1\nSection: All Applications by Scale-up Workers\nTopic: application process\n\nSummary: This provision applies to all Scale-up Workers applying for visa extensions or permissions. It requires demonstrating continued employment with a qualifying scale-up employer and meeting relevant eligibility criteria. No specific exceptions are noted.\n\n### All Applications by Scale-up Workers",
      "needs_review": false
    },
    {
      "metadata": {
        "source": "Immigration Rules Appendix Scale-up",
        "part": "Immigration Rules Appendix Scale-up",
        "section_id": "SCU 9.1",
        "section_title": "English language requirement for Scale-up Worker",
        "parent_section": "SCU 9",
        "hierarchy_level": 2,
        "topic": "english-language",
        "url": "https://www.gov.uk/guidance/immigration-rules/immigration-rules-appendix-scale-up",
        "scraped_at": "2025-12-06T17:28:36.804943"
      },
      "text": "### English language requirement for Scale-up Worker\n\nSCU 9.1. Unless an exemption applies, the applicant must show English language ability on the Common European Framework of Reference for Languages in all 4 components (reading, writing, speaking and listening) of at least level B1.\n\nSCU 9.2. The applicant must show they meet the English language requirement as specified in Appendix English Language.\n\nSCU 9.3. If the requirements in SCU 9.1. and SCU 9.2. are met, the applicant will be awarded 10 points for meeting the English language requirement.",
      "summary": "Scale-up Workers must demonstrate at least B1 level in all four skills (reading, writing, speaking, listening) on the CEFR, unless exempt. Meeting this requirement grants 10 points towards their application, with further details in the Appendix English Language.",
      "augmented_text": "Document: Immigration Rules Appendix Scale-up\nPart: Immigration Rules Appendix Scale-up\nSection ID: SCU 9.1\nSection: English language requirement for Scale-up Worker\nTopic: english-language\n\nSummary: Scale-up Workers must demonstrate at least B1 level in all four skills (reading, writing, speaking, listening) on the CEFR, unless exempt. Meeting this requirement grants 10 points towards their application, with further details in the Appendix English Language.\n\n### English language requirement for Scale-up Worker\n\nSCU 9.1. Unless an exemption applies, the applicant must show English language ability on the Common European Framework of Reference for Languages in all 4 components (reading, writing, speaking and listening) of at least level B1.\n\nSCU 9.2. The applicant must show they meet the English language requirement as specified in Appendix English Language.\n\nSCU 9.3. If the requirements in SCU 9.1. and SCU 9.2. are met, the applicant will be awarded 10 points for meeting the English language requirement.",
      "needs_review": false
    },
    {
      "metadata": {
        "source": "Immigration Rules Appendix Scale-up",
        "part": "Immigration Rules Appendix Scale-up",
        "section_id": "SCU 10.1",
        "section_title": "Financial requirement for Scale-up Worker",
        "parent_section": "SCU 10",
        "hierarchy_level": 2,
        "topic": "financial",
        "url": "https://www.gov.uk/guidance/immigration-rules/immigration-rules-appendix-scale-up",
        "scraped_at": "2025-12-06T17:28:36.804962"
      },
      "text": "### Financial requirement for Scale-up Worker\n\nSCU 10.1. If the applicant is applying for permission to stay and has been in the UK with permission for 12 months or longer on the date of application, they will meet the financial requirement and do not need to show funds.\n\n1.   SCU 10.2. If the applicant is applying for entry clearance, or has been in the UK for less than 12 months on the date of application, either: \n    1.   (a) the applicant must have funds of at least £1,270; or\n    2.   (b) if the applicant is applying as a sponsored applicant, the applicant’s A-rated sponsor must confirm on the Certificate of Sponsorship that they will, if necessary, maintain and accommodate the applicant up to the end of the first month of their employment, to an amount of at least £1,270.\n\nSCU 10.3. If SCU 10.2.(a) applies, the applicant must show that they have held the required funds for a 28-day period and must show funds as specified in Appendix Finance.\n\nSCU 10.4. If the requirements in SCU 10.1 to SCU 10.3. are met, the applicant will be awarded 10 points for meeting the financial requirement.",
      "summary": "Scale-up Workers applying for permission to stay with 12+ months' UK permission are exempt from financial proof; those with less than 12 months’ UK presence must show at least £1,270 or sponsor support, with funds held for 28 days. Applicants meeting these criteria earn 10 points for the financial requirement.",
      "augmented_text": "Document: Immigration Rules Appendix Scale-up\nPart: Immigration Rules Appendix Scale-up\nSection ID: SCU 10.1\nSection: Financial requirement for Scale-up Worker\nTopic: financial\n\nSummary: Scale-up Workers applying for permission to stay with 12+ months' UK permission are exempt from financial proof; those with less than 12 months’ UK presence must show at least £1,270 or sponsor support, with funds held for 28 days. Applicants meeting these criteria earn 10 points for the financial requirement.\n\n### Financial requirement for Scale-up Worker\n\nSCU 10.1. If the applicant is applying for permission to stay and has been in the UK with permission for 12 months or longer on the date of application, they will meet the financial requirement and do not need to show funds.\n\n1.   SCU 10.2. If the applicant is applying for entry clearance, or has been in the UK for less than 12 months on the date of application, either: \n    1.   (a) the applicant must have funds of at least £1,270; or\n    2.   (b) if the applicant is applying as a sponsored applicant, the applicant’s A-rated sponsor must confirm on the Certificate of Sponsorship that they will, if necessary, maintain and accommodate the applicant up to the end of the first month of their employment, to an amount of at least £1,270.\n\nSCU 10.3. If SCU 10.2.(a) applies, the applicant must show that they have held the required funds for a 28-day period and must show funds as specified in Appendix Finance.\n\nSCU 10.4. If the requirements in SCU 10.1 to SCU 10.3. are met, the applicant will be awarded 10 points for meeting the financial requirement.",
      "needs_review": false
    },
    {
      "metadata": {
        "source": "Immigration Rules Appendix Scale-up",
        "part": "Immigration Rules Appendix Scale-up",
        "section_id": "SCU 11.1",
        "section_title": "Decision on an application as a Scale-up worker",
        "parent_section": "SCU 11",
        "hierarchy_level": 2,
        "topic": "eligibility",
        "url": "https://www.gov.uk/guidance/immigration-rules/immigration-rules-appendix-scale-up",
        "scraped_at": "2025-12-06T17:28:36.804976"
      },
      "text": "### Decision on an application as a Scale-up worker\n\nSCU 11.1. If the decision maker is satisfied that all the suitability and the relevant eligibility requirements for a Scale-up Worker are met, the application will be granted, otherwise the application will be refused.\n\nSCU 11.2. If the application is refused the person can apply for an Administrative Review under Appendix AR: Administrative Review.",
      "summary": "This provision applies to applicants for a Scale-up Worker visa. It requires the decision-maker to verify that all suitability and eligibility criteria are met for approval; otherwise, the application is refused, with the option for an Administrative Review.",
      "augmented_text": "Document: Immigration Rules Appendix Scale-up\nPart: Immigration Rules Appendix Scale-up\nSection ID: SCU 11.1\nSection: Decision on an application as a Scale-up worker\nTopic: eligibility\n\nSummary: This provision applies to applicants for a Scale-up Worker visa. It requires the decision-maker to verify that all suitability and eligibility criteria are met for approval; otherwise, the application is refused, with the option for an Administrative Review.\n\n### Decision on an application as a Scale-up worker\n\nSCU 11.1. If the decision maker is satisfied that all the suitability and the relevant eligibility requirements for a Scale-up Worker are met, the application will be granted, otherwise the application will be refused.\n\nSCU 11.2. If the application is refused the person can apply for an Administrative Review under Appendix AR: Administrative Review.",
      "needs_review": false
    },
    {
      "metadata": {
        "source": "Immigration Rules Appendix Scale-up",
        "part": "Immigration Rules Appendix Scale-up",
        "section_id": "SCU 12.1",
        "section_title": "Period and conditions of grant for a Scale-up Worker",
        "parent_section": "SCU 12",
        "hierarchy_level": 2,
        "topic": "leave-to-enter",
        "url": "https://www.gov.uk/guidance/immigration-rules/immigration-rules-appendix-scale-up",
        "scraped_at": "2025-12-06T17:28:36.805003"
      },
      "text": "### Period and conditions of grant for a Scale-up Worker\n\nSCU 12.1. If the applicant was awarded 50 points for meeting the Sponsored Application requirements, they will be granted entry clearance or permission to stay for 2 years.\n\n1.   SCU 12.2. If the applicant was awarded 50 points for meeting the Sponsored Application requirements, the grant will be subject to all the following conditions: \n    1.   (a) no access to public funds; and\n    2.   (b) for the first 6 months of their permission, the applicant must be employed in the job for which the applicant is being sponsored; and\n    3.   (c) in addition to (b), work (including self-employment and voluntary work) is permitted, except for work as a professional sportsperson (including as a sports coach); and\n    4.   (d) study is permitted, subject to the ATAS condition in Appendix ATAS.\n    5.   (e) DELETED\n\nSCU 12.3. If the applicant was awarded 50 points for meeting the Unsponsored Application requirements, they will be granted entry clearance or permission to stay for 3 years.\n\n1.   SCU 12.4. If the applicant was awarded 50 points for meeting the Unsponsored Application requirements, the grant will be subject to all the following conditions: \n    1.   (a) no access to public funds; and\n    2.   (b) work (including self-employment and voluntary work) is permitted, except for work as a professional sportsperson (including as a sports coach); and\n    3.   (c) study is permitted, subject to the ATAS condition in Appendix ATAS.\n    4.   (d) DELETED",
      "summary": "Scale-up Workers awarded 50 points are granted permission to stay—2 years if sponsored, 3 years if unsponsored—under conditions including no public funds, permitted employment (excluding professional sports), and authorized study (with ATAS). For sponsored applicants, cover the initial 6 months of employment; unsponsored applicants have broader work rights.",
      "augmented_text": "Document: Immigration Rules Appendix Scale-up\nPart: Immigration Rules Appendix Scale-up\nSection ID: SCU 12.1\nSection: Period and conditions of grant for a Scale-up Worker\nTopic: leave-to-enter\n\nSummary: Scale-up Workers awarded 50 points are granted permission to stay—2 years if sponsored, 3 years if unsponsored—under conditions including no public funds, permitted employment (excluding professional sports), and authorized study (with ATAS). For sponsored applicants, cover the initial 6 months of employment; unsponsored applicants have broader work rights.\n\n### Period and conditions of grant for a Scale-up Worker\n\nSCU 12.1. If the applicant was awarded 50 points for meeting the Sponsored Application requirements, they will be granted entry clearance or permission to stay for 2 years.\n\n1.   SCU 12.2. If the applicant was awarded 50 points for meeting the Sponsored Application requirements, the grant will be subject to all the following conditions: \n    1.   (a) no access to public funds; and\n    2.   (b) for the first 6 months of their permission, the applicant must be employed in the job for which the applicant is being sponsored; and\n    3.   (c) in addition to (b), work (including self-employment and voluntary work) is permitted, except for work as a professional sportsperson (including as a sports coach); and\n    4.   (d) study is permitted, subject to the ATAS condition in Appendix ATAS.\n    5.   (e) DELETED\n\nSCU 12.3. If the applicant was awarded 50 points for meeting the Unsponsored Application requirements, they will be granted entry clearance or permission to stay for 3 years.\n\n1.   SCU 12.4. If the applicant was awarded 50 points for meeting the Unsponsored Application requirements, the grant will be subject to all the following conditions: \n    1.   (a) no access to public funds; and\n    2.   (b) work (including self-employment and voluntary work) is permitted, except for work as a professional sportsperson (including as a sports coach); and\n    3.   (c) study is permitted, subject to the ATAS condition in Appendix ATAS.\n    4.   (d) DELETED",
      "needs_review": false
    },
    {
      "metadata": {
        "source": "Immigration Rules Appendix Scale-up",
        "part": "Immigration Rules Appendix Scale-up",
        "section_id": "Settlement as a Scale-up Worker",
        "section_title": "Settlement as a Scale-up Worker",
        "parent_section": null,
        "hierarchy_level": 2,
        "topic": "settlement",
        "url": "https://www.gov.uk/guidance/immigration-rules/immigration-rules-appendix-scale-up",
        "scraped_at": "2025-12-06T17:28:36.805020"
      },
      "text": "### Settlement as a Scale-up Worker",
      "summary": "This provision applies to Scale-up Workers seeking settlement. It requires meeting specific criteria, including continuous employment and valid immigration status, with certain exceptions and thresholds outlined in the immigration rules.",
      "augmented_text": "Document: Immigration Rules Appendix Scale-up\nPart: Immigration Rules Appendix Scale-up\nSection ID: Settlement as a Scale-up Worker\nSection: Settlement as a Scale-up Worker\nTopic: settlement\n\nSummary: This provision applies to Scale-up Workers seeking settlement. It requires meeting specific criteria, including continuous employment and valid immigration status, with certain exceptions and thresholds outlined in the immigration rules.\n\n### Settlement as a Scale-up Worker",
      "needs_review": false
    },
    {
      "metadata": {
        "source": "Immigration Rules Appendix Scale-up",
        "part": "Immigration Rules Appendix Scale-up",
        "section_id": "SCU 13.1",
        "section_title": "Validity requirements for settlement as a Scale-up Worker",
        "parent_section": "SCU 13",
        "hierarchy_level": 2,
        "topic": "settlement",
        "url": "https://www.gov.uk/guidance/immigration-rules/immigration-rules-appendix-scale-up",
        "scraped_at": "2025-12-06T17:28:36.805055"
      },
      "text": "### Validity requirements for settlement as a Scale-up Worker\n\nSCU 13.1. A person applying for settlement as a Scale-up Worker must apply online on the gov.uk website on the specified form, “Settle in the UK in various immigration categories: form SET(O)”.\n\n1.   SCU 13.2. An application for settlement as a Scale-up Worker must meet all the following requirements: \n    1.   (a) any fee must have been paid; and\n    2.   (b) the applicant must have provided biometrics when required; and\n    3.   (c) the applicant must have provided either a passport or other travel document which satisfactorily establishes their identity and nationality; and\n    4.   (d) the applicant must be in the UK on the date of application.\n\nSCU 13.3. The applicant must have, or have last been granted, permission as a Scale-up Worker.\n\nSCU 13.4. An application which does not meet all the validity requirements for settlement as a Scale-up Worker may be rejected as invalid and not considered.",
      "summary": "Applicants seeking settlement as a Scale-up Worker must submit an online application meeting requirements such as fee payment, biometric provision, valid travel document, and current UK presence. They must have held or currently hold Scale-up Worker permission; failure to meet these conditions results in rejection.",
      "augmented_text": "Document: Immigration Rules Appendix Scale-up\nPart: Immigration Rules Appendix Scale-up\nSection ID: SCU 13.1\nSection: Validity requirements for settlement as a Scale-up Worker\nTopic: settlement\n\nSummary: Applicants seeking settlement as a Scale-up Worker must submit an online application meeting requirements such as fee payment, biometric provision, valid travel document, and current UK presence. They must have held or currently hold Scale-up Worker permission; failure to meet these conditions results in rejection.\n\n### Validity requirements for settlement as a Scale-up Worker\n\nSCU 13.1. A person applying for settlement as a Scale-up Worker must apply online on the gov.uk website on the specified form, “Settle in the UK in various immigration categories: form SET(O)”.\n\n1.   SCU 13.2. An application for settlement as a Scale-up Worker must meet all the following requirements: \n    1.   (a) any fee must have been paid; and\n    2.   (b) the applicant must have provided biometrics when required; and\n    3.   (c) the applicant must have provided either a passport or other travel document which satisfactorily establishes their identity and nationality; and\n    4.   (d) the applicant must be in the UK on the date of application.\n\nSCU 13.3. The applicant must have, or have last been granted, permission as a Scale-up Worker.\n\nSCU 13.4. An application which does not meet all the validity requirements for settlement as a Scale-up Worker may be rejected as invalid and not considered.",
      "needs_review": false
    },
    {
      "metadata": {
        "source": "Immigration Rules Appendix Scale-up",
        "part": "Immigration Rules Appendix Scale-up",
        "section_id": "SCU 14.1",
        "section_title": "Suitability requirements for settlement as a Scale-up Worker",
        "parent_section": "SCU 14",
        "hierarchy_level": 2,
        "topic": "suitability",
        "url": "https://www.gov.uk/guidance/immigration-rules/immigration-rules-appendix-scale-up",
        "scraped_at": "2025-12-06T17:28:36.805076"
      },
      "text": "### Suitability requirements for settlement as a Scale-up Worker\n\nSCU 14.1. The applicant must not fall for refusal under Part Suitability.\n\n1.   SCU 14.2. The applicant must not be: \n    1.   (a) in breach of immigration laws, except that where the Exceptions for overstayers section of Part Suitability applies, that period of overstaying will be disregarded; or\n    2.   (b) on immigration bail.",
      "summary": "This provision applies to Scale-up Worker applicants seeking settlement. It requires them to meet suitability criteria, including not breaching immigration laws (unless overstaying is disregarded under specific exceptions) or being on immigration bail.",
      "augmented_text": "Document: Immigration Rules Appendix Scale-up\nPart: Immigration Rules Appendix Scale-up\nSection ID: SCU 14.1\nSection: Suitability requirements for settlement as a Scale-up Worker\nTopic: suitability\n\nSummary: This provision applies to Scale-up Worker applicants seeking settlement. It requires them to meet suitability criteria, including not breaching immigration laws (unless overstaying is disregarded under specific exceptions) or being on immigration bail.\n\n### Suitability requirements for settlement as a Scale-up Worker\n\nSCU 14.1. The applicant must not fall for refusal under Part Suitability.\n\n1.   SCU 14.2. The applicant must not be: \n    1.   (a) in breach of immigration laws, except that where the Exceptions for overstayers section of Part Suitability applies, that period of overstaying will be disregarded; or\n    2.   (b) on immigration bail.",
      "needs_review": false
    },
    {
      "metadata": {
        "source": "Immigration Rules Appendix Scale-up",
        "part": "Immigration Rules Appendix Scale-up",
        "section_id": "Eligibility requirements for settlement as a Scale-up Worker",
        "section_title": "Eligibility requirements for settlement as a Scale-up Worker",
        "parent_section": null,
        "hierarchy_level": 3,
        "topic": "eligibility",
        "url": "https://www.gov.uk/guidance/immigration-rules/immigration-rules-appendix-scale-up",
        "scraped_at": "2025-12-06T17:28:36.805086"
      },
      "text": "### Eligibility requirements for settlement as a Scale-up Worker",
      "summary": "This provision applies to Scale-up Workers seeking settlement in the UK. It requires them to meet specified duration and employment conditions, with no explicit exceptions noted. Meeting these criteria is essential for settlement eligibility under the Scale-up route.",
      "augmented_text": "Document: Immigration Rules Appendix Scale-up\nPart: Immigration Rules Appendix Scale-up\nSection ID: Eligibility requirements for settlement as a Scale-up Worker\nSection: Eligibility requirements for settlement as a Scale-up Worker\nTopic: eligibility\n\nSummary: This provision applies to Scale-up Workers seeking settlement in the UK. It requires them to meet specified duration and employment conditions, with no explicit exceptions noted. Meeting these criteria is essential for settlement eligibility under the Scale-up route.\n\n### Eligibility requirements for settlement as a Scale-up Worker",
      "needs_review": false
    },
    {
      "metadata": {
        "source": "Immigration Rules Appendix Scale-up",
        "part": "Immigration Rules Appendix Scale-up",
        "section_id": "SCU 15.1",
        "section_title": "Qualifying period requirement for settlement as a Scale-up Worker",
        "parent_section": "SCU 15",
        "hierarchy_level": 2,
        "topic": "settlement",
        "url": "https://www.gov.uk/guidance/immigration-rules/immigration-rules-appendix-scale-up",
        "scraped_at": "2025-12-06T17:28:36.805114"
      },
      "text": "### Qualifying period requirement for settlement as a Scale-up Worker\n\nSCU 15.1. The applicant must have spent a continuous period of 5 years in the UK.\n\n1.   SCU 15.2. The 5-year continuous period must consist of time with permission (not as a dependant) on any of, or any combination of, the following routes: \n    1.   (a) Scale-up; or\n    2.   (b) Skilled Worker; or\n    3.   (c) Global Talent; or\n    4.   (d) Innovator; or\n    5.   (e) T2 Minister of Religion; or\n    6.   (f) International Sportsperson; or\n    7.   (g) Representative of an Overseas Business; or\n    8.   (h) Tier 1, other than Tier 1 (Graduate Entrepreneur).",
      "summary": "This provision applies to applicants seeking settlement as a Scale-up Worker. They must have a continuous 5-year UK residence, comprising permission under specified routes such as Scale-up, Skilled Worker, Global Talent, or Innovator. The period excludes dependants and requires time accrued under these qualifying categories.",
      "augmented_text": "Document: Immigration Rules Appendix Scale-up\nPart: Immigration Rules Appendix Scale-up\nSection ID: SCU 15.1\nSection: Qualifying period requirement for settlement as a Scale-up Worker\nTopic: settlement\n\nSummary: This provision applies to applicants seeking settlement as a Scale-up Worker. They must have a continuous 5-year UK residence, comprising permission under specified routes such as Scale-up, Skilled Worker, Global Talent, or Innovator. The period excludes dependants and requires time accrued under these qualifying categories.\n\n### Qualifying period requirement for settlement as a Scale-up Worker\n\nSCU 15.1. The applicant must have spent a continuous period of 5 years in the UK.\n\n1.   SCU 15.2. The 5-year continuous period must consist of time with permission (not as a dependant) on any of, or any combination of, the following routes: \n    1.   (a) Scale-up; or\n    2.   (b) Skilled Worker; or\n    3.   (c) Global Talent; or\n    4.   (d) Innovator; or\n    5.   (e) T2 Minister of Religion; or\n    6.   (f) International Sportsperson; or\n    7.   (g) Representative of an Overseas Business; or\n    8.   (h) Tier 1, other than Tier 1 (Graduate Entrepreneur).",
      "needs_review": false
    },
    {
      "metadata": {
        "source": "Immigration Rules Appendix Scale-up",
        "part": "Immigration Rules Appendix Scale-up",
        "section_id": "SCU 16.1",
        "section_title": "Continuous residence requirement for settlement as a Scale-up Worker",
        "parent_section": "SCU 16",
        "hierarchy_level": 2,
        "topic": "settlement",
        "url": "https://www.gov.uk/guidance/immigration-rules/immigration-rules-appendix-scale-up",
        "scraped_at": "2025-12-06T17:28:36.805139"
      },
      "text": "### Continuous residence requirement for settlement as a Scale-up Worker\n\nSCU 16.1. The applicant must meet the continuous residence requirement as set out in Appendix Continuous Residence during the period in SCU 15.1.",
      "summary": "This provision applies to Scale-up Workers seeking settlement. They must meet the continuous residence requirement outlined in Appendix Continuous Residence during the specified period, with no explicit exceptions noted.",
      "augmented_text": "Document: Immigration Rules Appendix Scale-up\nPart: Immigration Rules Appendix Scale-up\nSection ID: SCU 16.1\nSection: Continuous residence requirement for settlement as a Scale-up Worker\nTopic: settlement\n\nSummary: This provision applies to Scale-up Workers seeking settlement. They must meet the continuous residence requirement outlined in Appendix Continuous Residence during the specified period, with no explicit exceptions noted.\n\n### Continuous residence requirement for settlement as a Scale-up Worker\n\nSCU 16.1. The applicant must meet the continuous residence requirement as set out in Appendix Continuous Residence during the period in SCU 15.1.",
      "needs_review": false
    },
    {
      "metadata": {
        "source": "Immigration Rules Appendix Scale-up",
        "part": "Immigration Rules Appendix Scale-up",
        "section_id": "SCU 17.1",
        "section_title": "Knowledge of life in the UK requirement for settlement as a Scale-up Worker",
        "parent_section": "SCU 17",
        "hierarchy_level": 2,
        "topic": "settlement",
        "url": "https://www.gov.uk/guidance/immigration-rules/immigration-rules-appendix-scale-up",
        "scraped_at": "2025-12-06T17:28:36.805165"
      },
      "text": "### Knowledge of life in the UK requirement for settlement as a Scale-up Worker\n\nSCU 17.1. Unless an exemption applies, the applicant must meet the knowledge of Life in the UK requirement as set out in Appendix KOL UK.",
      "summary": "Scale-up Workers applying for settlement must, unless exempt, meet the Knowledge of Life in the UK requirement outlined in Appendix KOL UK. This obligation ensures applicants possess essential UK cultural and civic understanding, with specific exemptions possibly applying.",
      "augmented_text": "Document: Immigration Rules Appendix Scale-up\nPart: Immigration Rules Appendix Scale-up\nSection ID: SCU 17.1\nSection: Knowledge of life in the UK requirement for settlement as a Scale-up Worker\nTopic: settlement\n\nSummary: Scale-up Workers applying for settlement must, unless exempt, meet the Knowledge of Life in the UK requirement outlined in Appendix KOL UK. This obligation ensures applicants possess essential UK cultural and civic understanding, with specific exemptions possibly applying.\n\n### Knowledge of life in the UK requirement for settlement as a Scale-up Worker\n\nSCU 17.1. Unless an exemption applies, the applicant must meet the knowledge of Life in the UK requirement as set out in Appendix KOL UK.",
      "needs_review": false
    },
    {
      "metadata": {
        "source": "Immigration Rules Appendix Scale-up",
        "part": "Immigration Rules Appendix Scale-up",
        "section_id": "1",
        "section_title": "UK earnings in most recent permission requirement",
        "parent_section": null,
        "hierarchy_level": 1,
        "topic": "financial",
        "url": "https://www.gov.uk/guidance/immigration-rules/immigration-rules-appendix-scale-up",
        "scraped_at": "2025-12-06T17:28:36.805192"
      },
      "text": "### UK earnings in most recent permission requirement\n\n1.   SCU 18.1. On the date of application, the applicant must be in employment in the UK with a salary paid through PAYE of at least: \n    1.   (a) £39,100 per year; or\n    2.   (b) £36,300 per year if their most recent permission on the route was on the basis of a Certificate of Sponsorship assigned between 4 April 2024 and 21 July 2025; or\n    3.   (c) £34,600 per year if their most recent permission on the route was on the basis of a Certificate of Sponsorship assigned between 12 April 2023 and 3 April 2024; or\n    4.   (d) £33,000 per year if their most recent permission on the route was on the basis of a Certificate of Sponsorship assigned on or before 11 April 2023.\n\n1.   SCU 18.2. The applicant must, during at least 24 months of the three years immediately before the date of application, have had monthly PAYE earnings in the UK equivalent to at least: \n    1.   (a) £39,100 per year; or\n    2.   (b) £36,300 per year if their most recent permission on the route was on the basis of a Certificate of Sponsorship assigned between 4 April 2024 and 21 July 2025; or\n    3.   (c) £34,600 per year if their most recent permission on the route was on the basis of a Certificate of Sponsorship assigned between 12 April 2023 and 3 April 2024; or\n    4.   (d) £33,000 per year if their most recent permission on the route was on the basis of a Certificate of Sponsorship assigned on or before 11 April 2023.\n\n1.   SCU 18.3. For the purpose of meeting the requirement in SCU 18.2, periods of absence from work, for any of the following reasons will be treated as periods during which the applicant was paid at the required level: \n    1.   (a) statutory maternity, paternity, parental, or shared parental leave; or\n    2.   (b) statutory adoption leave; or\n    3.   (c) sick leave.\n\n2.   Providing at the time the absence starts the applicant’s job had PAYE earnings equivalent to: \n    1.   (i) £39,100 per year; or\n    2.   (ii) £36,300 per year if their most recent permission on the route was on the basis of a Certificate of Sponsorship assigned between 4 April 2024 and 21 July 2025; or\n    3.   (iii) £34,600 per year if their most recent permission on the route was on the basis of a Certificate of Sponsorship assigned between 12 April 2023 and 3 April 2024; or\n    4.   (iv) £33,000 per year if their most recent permission on the route was on the basis of a Certificate of Sponsorship assigned on or before 11 April 2023.\n\n3.   For example, an applicant, who spent 6 months on the above types of leave during their last 3-year’s permission as a Scale-up Worker, must have had monthly PAYE earnings in the UK equivalent to at least £39,100 per year during at least 18 months of the remaining 30 months of that permission.\n\nSCU 18.4. Earnings only include guaranteed basic gross pay (before income tax and including employee pension and national insurance contributions), recorded through PAYE.\n\n1.   SCU 18.5. Earnings do not include other sources of income, such as any of the following: \n    1.   (a) earnings from self-employment; or\n    2.   (b) earnings from outside the UK; or\n    3.   (c) payments not recorded through PAYE; or\n    4.   (d) employer pension and employer national insurance contributions; or\n    5.   (e) income from savings, investments, property, inheritance, gambling or competitions.\n\nSCU 18.6. The decision maker must not have reasonable grounds to believe the PAYE earnings the applicant is relying on have been inflated or fabricated or do not relate to genuine employment.\n\n1.   SCU 18.7. To support the assessment in SCU 18.6, the decision maker may in particular consider any of the following: \n    1.   (a) whether the business from which the earnings are claimed can be shown to exist and be lawfully and genuinely trading; and\n    2.   (b) any payments made by the applicant to other parties; and\n    3.   (c) any other relevant information.",
      "summary": "Applicants must have been employed in the UK with PAYE earnings of at least £33,000–£39,100 annually, depending on their Certificate of Sponsorship's assignment date. Additionally, they must have earned at least the relevant threshold monthly over 24 months within the past three years. Exceptions apply based on the timing of their most recent sponsorship.",
      "augmented_text": "Document: Immigration Rules Appendix Scale-up\nPart: Immigration Rules Appendix Scale-up\nSection ID: 1\nSection: UK earnings in most recent permission requirement\nTopic: financial\n\nSummary: Applicants must have been employed in the UK with PAYE earnings of at least £33,000–£39,100 annually, depending on their Certificate of Sponsorship's assignment date. Additionally, they must have earned at least the relevant threshold monthly over 24 months within the past three years. Exceptions apply based on the timing of their most recent sponsorship.\n\n### UK earnings in most recent permission requirement\n\n1.   SCU 18.1. On the date of application, the applicant must be in employment in the UK with a salary paid through PAYE of at least: \n    1.   (a) £39,100 per year; or\n    2.   (b) £36,300 per year if their most recent permission on the route was on the basis of a Certificate of Sponsorship assigned between 4 April 2024 and 21 July 2025; or\n    3.   (c) £34,600 per year if their most recent permission on the route was on the basis of a Certificate of Sponsorship assigned between 12 April 2023 and 3 April 2024; or\n    4.   (d) £33,000 per year if their most recent permission on the route was on the basis of a Certificate of Sponsorship assigned on or before 11 April 2023.\n\n1.   SCU 18.2. The applicant must, during at least 24 months of the three years immediately before the date of application, have had monthly PAYE earnings in the UK equivalent to at least: \n    1.   (a) £39,100 per year; or\n    2.   (b) £36,300 per year if their most recent permission on the route was on the basis of a Certificate of Sponsorship assigned between 4 April 2024 and 21 July 2025; or\n    3.   (c) £34,600 per year if their most recent permission on the route was on the basis of a Certificate of Sponsorship assigned between 12 April 2023 and 3 April 2024; or\n    4.   (d) £33,000 per year if their most recent permission on the route was on the basis of a Certificate of Sponsorship assigned on or before 11 April 2023.\n\n1.   SCU 18.3. For the purpose of meeting the requirement in SCU 18.2, periods of absence from work, for any of the following reasons will be treated as periods during which the applicant was paid at the required level: \n    1.   (a) statutory maternity, paternity, parental, or shared parental leave; or\n    2.   (b) statutory adoption leave; or\n    3.   (c) sick leave.\n\n2.   Providing at the time the absence starts the applicant’s job had PAYE earnings equivalent to: \n    1.   (i) £39,100 per year; or\n    2.   (ii) £36,300 per year if their most recent permission on the route was on the basis of a Certificate of Sponsorship assigned between 4 April 2024 and 21 July 2025; or\n    3.   (iii) £34,600 per year if their most recent permission on the route was on the basis of a Certificate of Sponsorship assigned between 12 April 2023 and 3 April 2024; or\n    4.   (iv) £33,000 per year if their most recent permission on the route was on the basis of a Certificate of Sponsorship assigned on or before 11 April 2023.\n\n3.   For example, an applicant, who spent 6 months on the above types of leave during their last 3-year’s permission as a Scale-up Worker, must have had monthly PAYE earnings in the UK equivalent to at least £39,100 per year during at least 18 months of the remaining 30 months of that permission.\n\nSCU 18.4. Earnings only include guaranteed basic gross pay (before income tax and including employee pension and national insurance contributions), recorded through PAYE.\n\n1.   SCU 18.5. Earnings do not include other sources of income, such as any of the following: \n    1.   (a) earnings from self-employment; or\n    2.   (b) earnings from outside the UK; or\n    3.   (c) payments not recorded through PAYE; or\n    4.   (d) employer pension and employer national insurance contributions; or\n    5.   (e) income from savings, investments, property, inheritance, gambling or competitions.\n\nSCU 18.6. The decision maker must not have reasonable grounds to believe the PAYE earnings the applicant is relying on have been inflated or fabricated or do not relate to genuine employment.\n\n1.   SCU 18.7. To support the assessment in SCU 18.6, the decision maker may in particular consider any of the following: \n    1.   (a) whether the business from which the earnings are claimed can be shown to exist and be lawfully and genuinely trading; and\n    2.   (b) any payments made by the applicant to other parties; and\n    3.   (c) any other relevant information.",
      "needs_review": false
    },
    {
      "metadata": {
        "source": "Immigration Rules Appendix Scale-up",
        "part": "Immigration Rules Appendix Scale-up",
        "section_id": "SCU 19.1",
        "section_title": "Decision on an application for settlement as a Scale-up Worker",
        "parent_section": "SCU 19",
        "hierarchy_level": 2,
        "topic": "eligibility",
        "url": "https://www.gov.uk/guidance/immigration-rules/immigration-rules-appendix-scale-up",
        "scraped_at": "2025-12-06T17:28:36.805205"
      },
      "text": "### Decision on an application for settlement as a Scale-up Worker\n\nSCU 19.1. If the decision maker is satisfied all the suitability and eligibility requirements for settlement as a Scale-up Worker are met, the applicant will be granted settlement, otherwise the application will be refused.\n\nSCU 19.2. If the application is refused, the person can apply for an Administrative Review under Appendix AR: Administrative Review.",
      "summary": "This provision applies to applicants seeking settlement as Scale-up Workers. It requires the decision-maker to confirm all suitability and eligibility criteria are met; failure leads to refusal, with the option for an Administrative Review. There are no specified thresholds or exceptions detailed in this section.",
      "augmented_text": "Document: Immigration Rules Appendix Scale-up\nPart: Immigration Rules Appendix Scale-up\nSection ID: SCU 19.1\nSection: Decision on an application for settlement as a Scale-up Worker\nTopic: eligibility\n\nSummary: This provision applies to applicants seeking settlement as Scale-up Workers. It requires the decision-maker to confirm all suitability and eligibility criteria are met; failure leads to refusal, with the option for an Administrative Review. There are no specified thresholds or exceptions detailed in this section.\n\n### Decision on an application for settlement as a Scale-up Worker\n\nSCU 19.1. If the decision maker is satisfied all the suitability and eligibility requirements for settlement as a Scale-up Worker are met, the applicant will be granted settlement, otherwise the application will be refused.\n\nSCU 19.2. If the application is refused, the person can apply for an Administrative Review under Appendix AR: Administrative Review.",
      "needs_review": false
    },
    {
      "metadata": {
        "source": "Immigration Rules Appendix Scale-up",
        "part": "Immigration Rules Appendix Scale-up",
        "section_id": "Dependent partner (“partner”) and dependent child (“child”) on the Scale-up route",
        "section_title": "Dependent partner (“partner”) and dependent child (“child”) on the Scale-up route",
        "parent_section": null,
        "hierarchy_level": 2,
        "topic": "family",
        "url": "https://www.gov.uk/guidance/immigration-rules/immigration-rules-appendix-scale-up",
        "scraped_at": "2025-12-06T17:28:36.805228"
      },
      "text": "### Dependent partner (“partner”) and dependent child (“child”) on the Scale-up route",
      "summary": "This provision applies to dependents—partners and children—of individuals on the UK Scale-up route. Dependents must meet specified eligibility criteria to join or remain; exceptions or conditions are not detailed here.",
      "augmented_text": "Document: Immigration Rules Appendix Scale-up\nPart: Immigration Rules Appendix Scale-up\nSection ID: Dependent partner (“partner”) and dependent child (“child”) on the Scale-up route\nSection: Dependent partner (“partner”) and dependent child (“child”) on the Scale-up route\nTopic: family\n\nSummary: This provision applies to dependents—partners and children—of individuals on the UK Scale-up route. Dependents must meet specified eligibility criteria to join or remain; exceptions or conditions are not detailed here.\n\n### Dependent partner (“partner”) and dependent child (“child”) on the Scale-up route",
      "needs_review": false
    },
    {
      "metadata": {
        "source": "Immigration Rules Appendix Scale-up",
        "part": "Immigration Rules Appendix Scale-up",
        "section_id": "SCU 20.1",
        "section_title": "Validity requirements for a partner or child on the Scale-up route",
        "parent_section": "SCU 20",
        "hierarchy_level": 2,
        "topic": "leave-to-enter",
        "url": "https://www.gov.uk/guidance/immigration-rules/immigration-rules-appendix-scale-up",
        "scraped_at": "2025-12-06T17:28:36.805261"
      },
      "text": "### Validity requirements for a partner or child on the Scale-up route\n\nSCU 20.1. A person applying for entry clearance or permission to stay as a partner or child on the Scale-up Worker route must apply online on the gov.uk website on the specified form as follows:\n\n| Location of Partner or Child | Specified form |\n| --- | --- |\n| Applicant outside the UK | • Dependant partner visa • Dependant child visa |\n| Applicant inside the UK | • Dependant partner • Dependant child |\n\n1.   SCU 20.2. An application for entry clearance or permission to stay as a partner or child of a Scale-up Worker must meet all the following requirements: \n    1.   (a) any fee and Immigration Health Charge must have been paid; and \n    2.   (b) the applicant must have provided biometrics when required; and \n    3.   (c) the applicant must have provided a passport or other travel document which satisfactorily establishes their identity and nationality; and\n    4.   (d) the applicant must be applying as partner or child of a person (P) who: \n        1.   (i) has made a valid application for entry clearance or permission to stay on the Scale-up route that has not been decided; or\n        2.   (ii) has entry clearance or permission to stay on the Scale-up route; or\n        3.   (iii) is settled or has become a British citizen, providing that P had permission on the Scale-up route when they settled and the applicant either had permission as their partner or child at that time, or the applicant is applying as a child of P and the applicant was born in the UK before P settled.\n\nSCU 20.3. A person applying as a partner must be aged 18 or over on the date of application.\n\n1.   SCU 20.4. If applying for permission to stay, the applicant must be in the UK on the date of application.\n2.   SCU 20.4ZA. If applying for permission to stay, the applicant must not have, or have last been granted, permission: \n    1.   (a) as a Visitor; or\n    2.   (b) as a Short-term Student; or\n    3.   (c) as a Parent of a Child Student; or\n    4.   (d) as a Seasonal Worker; or\n    5.   (e) as a Domestic Worker in a Private Household; or\n    6.   (f) outside the Immigration Rules.\n\n1.   SCU 20.4A. An applicant who is applying for permission to stay and has, or last had, permission as a Student, must fulfil one of the Conditions A or B below on the date of application: \n    1.   (a) Condition A: the applicant must have completed the course of study for which the Confirmation of Acceptance for Studies was assigned (or a course to which ST 27.3 of Appendix Student applies); or\n    2.   (b) Condition B: the applicant must: \n        1.   (i) be studying a full-time course of study leading to the award of a PhD with a higher education provider which has a track record of compliance; and\n        2.   (ii) have completed at least 24 months of study on that course.\n\nSCU 20.5. An application which does not meet all the validity requirements as partner or child on the Scale-up route may be rejected as invalid and not considered.",
      "summary": "Applicants applying for a partner or child on the Scale-up route must submit online applications, pay applicable fees, provide biometrics, and furnish valid travel documents. They must also be linked to a person with pending, current, or settled Scale-up permission, or British citizenship, ensuring all route eligibility conditions are met.",
      "augmented_text": "Document: Immigration Rules Appendix Scale-up\nPart: Immigration Rules Appendix Scale-up\nSection ID: SCU 20.1\nSection: Validity requirements for a partner or child on the Scale-up route\nTopic: leave-to-enter\n\nSummary: Applicants applying for a partner or child on the Scale-up route must submit online applications, pay applicable fees, provide biometrics, and furnish valid travel documents. They must also be linked to a person with pending, current, or settled Scale-up permission, or British citizenship, ensuring all route eligibility conditions are met.\n\n### Validity requirements for a partner or child on the Scale-up route\n\nSCU 20.1. A person applying for entry clearance or permission to stay as a partner or child on the Scale-up Worker route must apply online on the gov.uk website on the specified form as follows:\n\n| Location of Partner or Child | Specified form |\n| --- | --- |\n| Applicant outside the UK | • Dependant partner visa • Dependant child visa |\n| Applicant inside the UK | • Dependant partner • Dependant child |\n\n1.   SCU 20.2. An application for entry clearance or permission to stay as a partner or child of a Scale-up Worker must meet all the following requirements: \n    1.   (a) any fee and Immigration Health Charge must have been paid; and \n    2.   (b) the applicant must have provided biometrics when required; and \n    3.   (c) the applicant must have provided a passport or other travel document which satisfactorily establishes their identity and nationality; and\n    4.   (d) the applicant must be applying as partner or child of a person (P) who: \n        1.   (i) has made a valid application for entry clearance or permission to stay on the Scale-up route that has not been decided; or\n        2.   (ii) has entry clearance or permission to stay on the Scale-up route; or\n        3.   (iii) is settled or has become a British citizen, providing that P had permission on the Scale-up route when they settled and the applicant either had permission as their partner or child at that time, or the applicant is applying as a child of P and the applicant was born in the UK before P settled.\n\nSCU 20.3. A person applying as a partner must be aged 18 or over on the date of application.\n\n1.   SCU 20.4. If applying for permission to stay, the applicant must be in the UK on the date of application.\n2.   SCU 20.4ZA. If applying for permission to stay, the applicant must not have, or have last been granted, permission: \n    1.   (a) as a Visitor; or\n    2.   (b) as a Short-term Student; or\n    3.   (c) as a Parent of a Child Student; or\n    4.   (d) as a Seasonal Worker; or\n    5.   (e) as a Domestic Worker in a Private Household; or\n    6.   (f) outside the Immigration Rules.\n\n1.   SCU 20.4A. An applicant who is applying for permission to stay and has, or last had, permission as a Student, must fulfil one of the Conditions A or B below on the date of application: \n    1.   (a) Condition A: the applicant must have completed the course of study for which the Confirmation of Acceptance for Studies was assigned (or a course to which ST 27.3 of Appendix Student applies); or\n    2.   (b) Condition B: the applicant must: \n        1.   (i) be studying a full-time course of study leading to the award of a PhD with a higher education provider which has a track record of compliance; and\n        2.   (ii) have completed at least 24 months of study on that course.\n\nSCU 20.5. An application which does not meet all the validity requirements as partner or child on the Scale-up route may be rejected as invalid and not considered.",
      "needs_review": false
    },
    {
      "metadata": {
        "source": "Immigration Rules Appendix Scale-up",
        "part": "Immigration Rules Appendix Scale-up",
        "section_id": "SCU 21.1",
        "section_title": "Suitability requirements for a partner or child on the Scale-up route",
        "parent_section": "SCU 21",
        "hierarchy_level": 2,
        "topic": "suitability",
        "url": "https://www.gov.uk/guidance/immigration-rules/immigration-rules-appendix-scale-up",
        "scraped_at": "2025-12-06T17:28:36.805282"
      },
      "text": "### Suitability requirements for a partner or child on the Scale-up route\n\nSCU 21.1. The applicant must not fall for refusal under Part Suitability.\n\n1.   SCU 21.2. If applying for permission to stay the applicant must not be: \n    1.   (a) in breach of immigration laws, except that where the Exceptions for overstayers section of Part Suitability applies, that period of overstaying will be disregarded; or\n    2.   (b) on immigration bail.",
      "summary": "This provision applies to partners or children on the UK Scale-up route. They must not breach immigration laws (subject to exceptions) or be on immigration bail to be deemed suitable for permission to stay.",
      "augmented_text": "Document: Immigration Rules Appendix Scale-up\nPart: Immigration Rules Appendix Scale-up\nSection ID: SCU 21.1\nSection: Suitability requirements for a partner or child on the Scale-up route\nTopic: suitability\n\nSummary: This provision applies to partners or children on the UK Scale-up route. They must not breach immigration laws (subject to exceptions) or be on immigration bail to be deemed suitable for permission to stay.\n\n### Suitability requirements for a partner or child on the Scale-up route\n\nSCU 21.1. The applicant must not fall for refusal under Part Suitability.\n\n1.   SCU 21.2. If applying for permission to stay the applicant must not be: \n    1.   (a) in breach of immigration laws, except that where the Exceptions for overstayers section of Part Suitability applies, that period of overstaying will be disregarded; or\n    2.   (b) on immigration bail.",
      "needs_review": false
    },
    {
      "metadata": {
        "source": "Immigration Rules Appendix Scale-up",
        "part": "Immigration Rules Appendix Scale-up",
        "section_id": "Eligibility requirements for a partner and child on the Scale-up route",
        "section_title": "Eligibility requirements for a partner and child on the Scale-up route",
        "parent_section": null,
        "hierarchy_level": 3,
        "topic": "eligibility",
        "url": "https://www.gov.uk/guidance/immigration-rules/immigration-rules-appendix-scale-up",
        "scraped_at": "2025-12-06T17:28:36.805290"
      },
      "text": "### Eligibility requirements for a partner and child on the Scale-up route",
      "summary": "This provision applies to partners and children applying under the Scale-up route. They must demonstrate genuine family ties and meet relevant eligibility criteria, with exceptions only as specified, to qualify for entry and residence.",
      "augmented_text": "Document: Immigration Rules Appendix Scale-up\nPart: Immigration Rules Appendix Scale-up\nSection ID: Eligibility requirements for a partner and child on the Scale-up route\nSection: Eligibility requirements for a partner and child on the Scale-up route\nTopic: eligibility\n\nSummary: This provision applies to partners and children applying under the Scale-up route. They must demonstrate genuine family ties and meet relevant eligibility criteria, with exceptions only as specified, to qualify for entry and residence.\n\n### Eligibility requirements for a partner and child on the Scale-up route",
      "needs_review": false
    },
    {
      "metadata": {
        "source": "Immigration Rules Appendix Scale-up",
        "part": "Immigration Rules Appendix Scale-up",
        "section_id": "SCU 22.1",
        "section_title": "Entry requirement for a partner and child on the Scale-up route",
        "parent_section": "SCU 22",
        "hierarchy_level": 2,
        "topic": "leave-to-enter",
        "url": "https://www.gov.uk/guidance/immigration-rules/immigration-rules-appendix-scale-up",
        "scraped_at": "2025-12-06T17:28:36.805315"
      },
      "text": "### Entry requirement for a partner and child on the Scale-up route\n\nSCU 22.1. A person seeking to come to the UK as a partner or child of a Scale-up Worker must apply for and obtain entry clearance as a partner or child of a Scale-up Worker before they arrive in the UK.\n\nSCU 22.2. A person applying for entry clearance as the partner or child on the Scale-up router must, if Appendix Tuberculosis applies, provide a valid medical certificate confirming that they have undergone screening for active pulmonary tuberculosis and that this tuberculosis is not present in them.",
      "summary": "Partners and children of Scale-up Workers must apply for and obtain entry clearance before arriving in the UK. They are required to provide a tuberculosis screening certificate if applicable. There are no exceptions specified.",
      "augmented_text": "Document: Immigration Rules Appendix Scale-up\nPart: Immigration Rules Appendix Scale-up\nSection ID: SCU 22.1\nSection: Entry requirement for a partner and child on the Scale-up route\nTopic: leave-to-enter\n\nSummary: Partners and children of Scale-up Workers must apply for and obtain entry clearance before arriving in the UK. They are required to provide a tuberculosis screening certificate if applicable. There are no exceptions specified.\n\n### Entry requirement for a partner and child on the Scale-up route\n\nSCU 22.1. A person seeking to come to the UK as a partner or child of a Scale-up Worker must apply for and obtain entry clearance as a partner or child of a Scale-up Worker before they arrive in the UK.\n\nSCU 22.2. A person applying for entry clearance as the partner or child on the Scale-up router must, if Appendix Tuberculosis applies, provide a valid medical certificate confirming that they have undergone screening for active pulmonary tuberculosis and that this tuberculosis is not present in them.",
      "needs_review": false
    },
    {
      "metadata": {
        "source": "Immigration Rules Appendix Scale-up",
        "part": "Immigration Rules Appendix Scale-up",
        "section_id": "1",
        "section_title": "Relationship requirements for a partner on the Scale-up route",
        "parent_section": null,
        "hierarchy_level": 1,
        "topic": "family",
        "url": "https://www.gov.uk/guidance/immigration-rules/immigration-rules-appendix-scale-up",
        "scraped_at": "2025-12-06T17:28:36.805344"
      },
      "text": "### Relationship requirements for a partner on the Scale-up route\n\n1.   SCU 23.1. The applicant must be the partner of a person (P) and one of the following must apply: \n    1.   (a) P has permission on the Scale-up route; or\n    2.   (b) P is, at the same time, applying for (and is granted) permission on the Scale-up route; or\n    3.   (c) P is settled or has become a British citizen, providing P had permission on the Scale-up route when they settled, and the applicant had permission as P’s partner at that time.\n\n2.   SCU 23.2. The requirements of Appendix Relationship with Partner must be met.\n\nSCU 23.3. DELETED.\n\nSCU 23.4. DELETED.",
      "summary": "This provision applies to partners of applicants on the Scale-up route. The partner must be with someone currently on, applying for, or settled after having permission on the route, meeting specified relationship requirements; exceptions include settled or British citizen partners with prior route permission.",
      "augmented_text": "Document: Immigration Rules Appendix Scale-up\nPart: Immigration Rules Appendix Scale-up\nSection ID: 1\nSection: Relationship requirements for a partner on the Scale-up route\nTopic: family\n\nSummary: This provision applies to partners of applicants on the Scale-up route. The partner must be with someone currently on, applying for, or settled after having permission on the route, meeting specified relationship requirements; exceptions include settled or British citizen partners with prior route permission.\n\n### Relationship requirements for a partner on the Scale-up route\n\n1.   SCU 23.1. The applicant must be the partner of a person (P) and one of the following must apply: \n    1.   (a) P has permission on the Scale-up route; or\n    2.   (b) P is, at the same time, applying for (and is granted) permission on the Scale-up route; or\n    3.   (c) P is settled or has become a British citizen, providing P had permission on the Scale-up route when they settled, and the applicant had permission as P’s partner at that time.\n\n2.   SCU 23.2. The requirements of Appendix Relationship with Partner must be met.\n\nSCU 23.3. DELETED.\n\nSCU 23.4. DELETED.",
      "needs_review": false
    },
    {
      "metadata": {
        "source": "Immigration Rules Appendix Scale-up",
        "part": "Immigration Rules Appendix Scale-up",
        "section_id": "1",
        "section_title": "Relationship requirement for a dependent child on the Scale-up route",
        "parent_section": null,
        "hierarchy_level": 1,
        "topic": "family",
        "url": "https://www.gov.uk/guidance/immigration-rules/immigration-rules-appendix-scale-up",
        "scraped_at": "2025-12-06T17:28:36.805368"
      },
      "text": "### Relationship requirement for a dependent child on the Scale-up route\n\n1.   SCU 24.1. DELETED.\n2.   SCU 24.2. DELETED.\n\nSCU 24.3. DELETED.",
      "summary": "This provision applies to dependent children on the Scale-up route, requiring them to be members of the sponsor's family and meet relationship criteria. No specific conditions or exceptions are detailed in the provided text.",
      "augmented_text": "Document: Immigration Rules Appendix Scale-up\nPart: Immigration Rules Appendix Scale-up\nSection ID: 1\nSection: Relationship requirement for a dependent child on the Scale-up route\nTopic: family\n\nSummary: This provision applies to dependent children on the Scale-up route, requiring them to be members of the sponsor's family and meet relationship criteria. No specific conditions or exceptions are detailed in the provided text.\n\n### Relationship requirement for a dependent child on the Scale-up route\n\n1.   SCU 24.1. DELETED.\n2.   SCU 24.2. DELETED.\n\nSCU 24.3. DELETED.",
      "needs_review": false
    },
    {
      "metadata": {
        "source": "Immigration Rules Appendix Scale-up",
        "part": "Immigration Rules Appendix Scale-up",
        "section_id": "SCU 25.1",
        "section_title": "Age requirement for a dependent child on the Scale-up route",
        "parent_section": "SCU 25",
        "hierarchy_level": 2,
        "topic": "family",
        "url": "https://www.gov.uk/guidance/immigration-rules/immigration-rules-appendix-scale-up",
        "scraped_at": "2025-12-06T17:28:36.805391"
      },
      "text": "### Age requirement for a dependent child on the Scale-up route\n\nSCU 25.1. DELETED.\n\nSCU 25.2. DELETED.",
      "summary": "This provision applies to dependent children on the Scale-up route, requiring them to be under 18 years old. There are no specified exceptions or alternative age thresholds, emphasizing the age limit for eligibility.",
      "augmented_text": "Document: Immigration Rules Appendix Scale-up\nPart: Immigration Rules Appendix Scale-up\nSection ID: SCU 25.1\nSection: Age requirement for a dependent child on the Scale-up route\nTopic: family\n\nSummary: This provision applies to dependent children on the Scale-up route, requiring them to be under 18 years old. There are no specified exceptions or alternative age thresholds, emphasizing the age limit for eligibility.\n\n### Age requirement for a dependent child on the Scale-up route\n\nSCU 25.1. DELETED.\n\nSCU 25.2. DELETED.",
      "needs_review": false
    },
    {
      "metadata": {
        "source": "Immigration Rules Appendix Scale-up",
        "part": "Immigration Rules Appendix Scale-up",
        "section_id": "SCU 26.1",
        "section_title": "Care requirement for a dependent child on the Scale-up route",
        "parent_section": "SCU 26",
        "hierarchy_level": 2,
        "topic": "family",
        "url": "https://www.gov.uk/guidance/immigration-rules/immigration-rules-appendix-scale-up",
        "scraped_at": "2025-12-06T17:28:36.805413"
      },
      "text": "### Care requirement for a dependent child on the Scale-up route\n\nSCU 26.1. DELETED.",
      "summary": "This provision applies to dependent children on the Scale-up route, requiring proof of appropriate care arrangements. The rule ensures the child's wellbeing is safeguarded, with specific conditions for demonstrating suitable care, though detailed requirements are not specified in this excerpt.",
      "augmented_text": "Document: Immigration Rules Appendix Scale-up\nPart: Immigration Rules Appendix Scale-up\nSection ID: SCU 26.1\nSection: Care requirement for a dependent child on the Scale-up route\nTopic: family\n\nSummary: This provision applies to dependent children on the Scale-up route, requiring proof of appropriate care arrangements. The rule ensures the child's wellbeing is safeguarded, with specific conditions for demonstrating suitable care, though detailed requirements are not specified in this excerpt.\n\n### Care requirement for a dependent child on the Scale-up route\n\nSCU 26.1. DELETED.",
      "needs_review": false
    },
    {
      "metadata": {
        "source": "Immigration Rules Appendix Scale-up",
        "part": "Immigration Rules Appendix Scale-up",
        "section_id": "1",
        "section_title": "Requirements for a dependent child on the Scale-up route",
        "parent_section": null,
        "hierarchy_level": 1,
        "topic": "leave-to-enter",
        "url": "https://www.gov.uk/guidance/immigration-rules/immigration-rules-appendix-scale-up",
        "scraped_at": "2025-12-06T17:28:36.805438"
      },
      "text": "### Requirements for a dependent child on the Scale-up route\n\n1.   SCU 26A.1. The applicant must meet the following requirements for a dependent child in Appendix Children: \n    1.   (a) relationship requirement: entry clearance and permission to stay; and\n    2.   (b) care requirement; and\n    3.   (c) age and independent life requirement.",
      "summary": "Dependent children applying under the Scale-up route must meet relationship, care, and age/independence requirements as outlined in Appendix Children, including valid entry clearance and permission to stay; no specific exceptions are specified.",
      "augmented_text": "Document: Immigration Rules Appendix Scale-up\nPart: Immigration Rules Appendix Scale-up\nSection ID: 1\nSection: Requirements for a dependent child on the Scale-up route\nTopic: leave-to-enter\n\nSummary: Dependent children applying under the Scale-up route must meet relationship, care, and age/independence requirements as outlined in Appendix Children, including valid entry clearance and permission to stay; no specific exceptions are specified.\n\n### Requirements for a dependent child on the Scale-up route\n\n1.   SCU 26A.1. The applicant must meet the following requirements for a dependent child in Appendix Children: \n    1.   (a) relationship requirement: entry clearance and permission to stay; and\n    2.   (b) care requirement; and\n    3.   (c) age and independent life requirement.",
      "needs_review": false
    },
    {
      "metadata": {
        "source": "Immigration Rules Appendix Scale-up",
        "part": "Immigration Rules Appendix Scale-up",
        "section_id": "SCU 27.1",
        "section_title": "Financial requirement for a partner or child on the Scale-up route",
        "parent_section": "SCU 27",
        "hierarchy_level": 2,
        "topic": "financial",
        "url": "https://www.gov.uk/guidance/immigration-rules/immigration-rules-appendix-scale-up",
        "scraped_at": "2025-12-06T17:28:36.805458"
      },
      "text": "### Financial requirement for a partner or child on the Scale-up route\n\nSCU 27.1. If the applicant is applying for permission to stay and has been living in the UK with permission for 12 months or longer on the date of application, they will meet the financial requirement and do not need to show funds.\n\n1.   SCU 27.2. If an applicant is applying for entry clearance, or has been living in the UK for less than 12 months on the date of application, either: \n    1.   (a) funds of at least the amount required in SCU 27.4. must be held collectively by one or more of the following: \n        1.   (i) the applicant; and\n        2.   (ii) the Scale-up Worker (P); and\n        3.   (iii) if the applicant is applying as a child, their parent who is lawfully present in the UK or being granted entry clearance, or permission to stay, at the same time; or\n\n    2.   (b) the Scale-up Worker’s A-rated sponsor must certify that they will, if necessary, maintain and accommodate the partner and/or any child as well as the Scale-up Worker, up to the end of the first month of each of their grants of permission, to at least the amounts required in SCU 27.4.\n\nSCU 27.3. An applicant may only rely on the option in SCU 27.2(b) if the date of application is at least one calendar month before the end of the first 6 months of the Scale-up Worker’s first grant of permission on the Scale-up route.\n\n1.   SCU 27.4. The funds required are: \n    1.   (a) at least £285 for a partner in the UK or applying for entry clearance; and\n    2.   (b) at least £315 for the first child in the UK or applying for entry clearance; and\n    3.   (c) at least £200 for each additional child in the UK or applying for entry clearance.\n\nSCU 27.5. If SCU 27.2(a) applies, the funds held by the applicant must be held in addition to any funds required for the Scale-up Worker to meet the financial requirement and any other dependants in the UK or applying at the same time.\n\nSCU 27.6. If SCU 27.2(a) applies, the funds must have been held for a 28-day period and as set out in Appendix Finance.",
      "summary": "Applicants on the Scale-up route requiring a partner or child must demonstrate sufficient funds if in the UK for less than 12 months; those living 12+ months are exempt. Funds can be held collectively or guaranteed by an approved sponsor, with specific timing and certification conditions.",
      "augmented_text": "Document: Immigration Rules Appendix Scale-up\nPart: Immigration Rules Appendix Scale-up\nSection ID: SCU 27.1\nSection: Financial requirement for a partner or child on the Scale-up route\nTopic: financial\n\nSummary: Applicants on the Scale-up route requiring a partner or child must demonstrate sufficient funds if in the UK for less than 12 months; those living 12+ months are exempt. Funds can be held collectively or guaranteed by an approved sponsor, with specific timing and certification conditions.\n\n### Financial requirement for a partner or child on the Scale-up route\n\nSCU 27.1. If the applicant is applying for permission to stay and has been living in the UK with permission for 12 months or longer on the date of application, they will meet the financial requirement and do not need to show funds.\n\n1.   SCU 27.2. If an applicant is applying for entry clearance, or has been living in the UK for less than 12 months on the date of application, either: \n    1.   (a) funds of at least the amount required in SCU 27.4. must be held collectively by one or more of the following: \n        1.   (i) the applicant; and\n        2.   (ii) the Scale-up Worker (P); and\n        3.   (iii) if the applicant is applying as a child, their parent who is lawfully present in the UK or being granted entry clearance, or permission to stay, at the same time; or\n\n    2.   (b) the Scale-up Worker’s A-rated sponsor must certify that they will, if necessary, maintain and accommodate the partner and/or any child as well as the Scale-up Worker, up to the end of the first month of each of their grants of permission, to at least the amounts required in SCU 27.4.\n\nSCU 27.3. An applicant may only rely on the option in SCU 27.2(b) if the date of application is at least one calendar month before the end of the first 6 months of the Scale-up Worker’s first grant of permission on the Scale-up route.\n\n1.   SCU 27.4. The funds required are: \n    1.   (a) at least £285 for a partner in the UK or applying for entry clearance; and\n    2.   (b) at least £315 for the first child in the UK or applying for entry clearance; and\n    3.   (c) at least £200 for each additional child in the UK or applying for entry clearance.\n\nSCU 27.5. If SCU 27.2(a) applies, the funds held by the applicant must be held in addition to any funds required for the Scale-up Worker to meet the financial requirement and any other dependants in the UK or applying at the same time.\n\nSCU 27.6. If SCU 27.2(a) applies, the funds must have been held for a 28-day period and as set out in Appendix Finance.",
      "needs_review": false
    },
    {
      "metadata": {
        "source": "Immigration Rules Appendix Scale-up",
        "part": "Immigration Rules Appendix Scale-up",
        "section_id": "SCU 28.1",
        "section_title": "Decision on an application as a partner or child on the Scale-up route",
        "parent_section": "SCU 28",
        "hierarchy_level": 2,
        "topic": "eligibility",
        "url": "https://www.gov.uk/guidance/immigration-rules/immigration-rules-appendix-scale-up",
        "scraped_at": "2025-12-06T17:28:36.805471"
      },
      "text": "### Decision on an application as a partner or child on the Scale-up route\n\nSCU 28.1. If the decision maker is satisfied that all the suitability and eligibility requirements are met for a partner or child of a Scale-up Worker, the application will be granted, otherwise the application will be refused.\n\nSCU 28.2. If the application is refused the person can apply for an Administrative Review under Appendix AR: Administrative Review.",
      "summary": "This provision applies to partners or children of Scale-up Workers. Applications are granted if all suitability and eligibility criteria are met; otherwise, they are refused, with an option for Administrative Review.",
      "augmented_text": "Document: Immigration Rules Appendix Scale-up\nPart: Immigration Rules Appendix Scale-up\nSection ID: SCU 28.1\nSection: Decision on an application as a partner or child on the Scale-up route\nTopic: eligibility\n\nSummary: This provision applies to partners or children of Scale-up Workers. Applications are granted if all suitability and eligibility criteria are met; otherwise, they are refused, with an option for Administrative Review.\n\n### Decision on an application as a partner or child on the Scale-up route\n\nSCU 28.1. If the decision maker is satisfied that all the suitability and eligibility requirements are met for a partner or child of a Scale-up Worker, the application will be granted, otherwise the application will be refused.\n\nSCU 28.2. If the application is refused the person can apply for an Administrative Review under Appendix AR: Administrative Review.",
      "needs_review": false
    },
    {
      "metadata": {
        "source": "Immigration Rules Appendix Scale-up",
        "part": "Immigration Rules Appendix Scale-up",
        "section_id": "1",
        "section_title": "Period and conditions of grant for a partner and child on the Scale-up route",
        "parent_section": null,
        "hierarchy_level": 1,
        "topic": "leave-to-enter",
        "url": "https://www.gov.uk/guidance/immigration-rules/immigration-rules-appendix-scale-up",
        "scraped_at": "2025-12-06T17:28:36.805510"
      },
      "text": "### Period and conditions of grant for a partner and child on the Scale-up route\n\n1.   SCU 29.1. A partner will be granted: \n    1.   (a) entry clearance or permission to stay which ends on the same date as their partner’s permission as a Scale-up Worker; or\n    2.   (b) 3 years’ entry clearance or permission if the Scale-up Worker was (or is being) granted settlement as a Scale-up Worker.\n\nSCU 29.2. A child will be granted permission which ends on the same date as whichever of their parents’ permission ends first, unless both parents have (or are being granted) settlement or British Citizenship, in which case the child will be granted permission for 3 years.\n\n1.   SCU 29.3. The grant will be subject to all the following conditions: \n    1.   (a) no access to public funds; and\n    2.   (b) work (including self-employment and voluntary work) permitted; except work as a professional sportsperson (including as a sports coach); and\n    3.   (c) study is permitted, subject to the ATAS condition in Appendix ATAS (if the study will commence when the person is aged over 18).\n    4.   (d) DELETED",
      "summary": "Partners and children of Scale-up route migrants are granted permission matching the main migrant’s duration—up to 3 years or until settlement—subject to conditions including no public funds, permitted work (excluding professional sports), and allowable study with ATAS if over 18. Permissions end according to their parent’s status unless both parents obtain settlement or British Citizenship.",
      "augmented_text": "Document: Immigration Rules Appendix Scale-up\nPart: Immigration Rules Appendix Scale-up\nSection ID: 1\nSection: Period and conditions of grant for a partner and child on the Scale-up route\nTopic: leave-to-enter\n\nSummary: Partners and children of Scale-up route migrants are granted permission matching the main migrant’s duration—up to 3 years or until settlement—subject to conditions including no public funds, permitted work (excluding professional sports), and allowable study with ATAS if over 18. Permissions end according to their parent’s status unless both parents obtain settlement or British Citizenship.\n\n### Period and conditions of grant for a partner and child on the Scale-up route\n\n1.   SCU 29.1. A partner will be granted: \n    1.   (a) entry clearance or permission to stay which ends on the same date as their partner’s permission as a Scale-up Worker; or\n    2.   (b) 3 years’ entry clearance or permission if the Scale-up Worker was (or is being) granted settlement as a Scale-up Worker.\n\nSCU 29.2. A child will be granted permission which ends on the same date as whichever of their parents’ permission ends first, unless both parents have (or are being granted) settlement or British Citizenship, in which case the child will be granted permission for 3 years.\n\n1.   SCU 29.3. The grant will be subject to all the following conditions: \n    1.   (a) no access to public funds; and\n    2.   (b) work (including self-employment and voluntary work) permitted; except work as a professional sportsperson (including as a sports coach); and\n    3.   (c) study is permitted, subject to the ATAS condition in Appendix ATAS (if the study will commence when the person is aged over 18).\n    4.   (d) DELETED",
      "needs_review": false
    },
    {
      "metadata": {
        "source": "Immigration Rules Appendix Scale-up",
        "part": "Immigration Rules Appendix Scale-up",
        "section_id": "Settlement for a partner or child on the Scale-up route",
        "section_title": "Settlement for a partner or child on the Scale-up route",
        "parent_section": null,
        "hierarchy_level": 2,
        "topic": "settlement",
        "url": "https://www.gov.uk/guidance/immigration-rules/immigration-rules-appendix-scale-up",
        "scraped_at": "2025-12-06T17:28:36.805528"
      },
      "text": "### Settlement for a partner or child on the Scale-up route",
      "summary": "This provision applies to partners or children of individuals on the Scale-up route. It requires them to meet eligibility criteria for settlement, including lawful residence and continuous presence, with specific conditions or exceptions detailed in the full rules.",
      "augmented_text": "Document: Immigration Rules Appendix Scale-up\nPart: Immigration Rules Appendix Scale-up\nSection ID: Settlement for a partner or child on the Scale-up route\nSection: Settlement for a partner or child on the Scale-up route\nTopic: settlement\n\nSummary: This provision applies to partners or children of individuals on the Scale-up route. It requires them to meet eligibility criteria for settlement, including lawful residence and continuous presence, with specific conditions or exceptions detailed in the full rules.\n\n### Settlement for a partner or child on the Scale-up route",
      "needs_review": false
    },
    {
      "metadata": {
        "source": "Immigration Rules Appendix Scale-up",
        "part": "Immigration Rules Appendix Scale-up",
        "section_id": "SCU 30.1",
        "section_title": "Validity requirements for settlement as a partner or child on the Scale-up route",
        "parent_section": "SCU 30",
        "hierarchy_level": 2,
        "topic": "settlement",
        "url": "https://www.gov.uk/guidance/immigration-rules/immigration-rules-appendix-scale-up",
        "scraped_at": "2025-12-06T17:28:36.805562"
      },
      "text": "### Validity requirements for settlement as a partner or child on the Scale-up route\n\nSCU 30.1. A person applying for settlement as a partner or child of a Scale-up Worker must apply online on the gov.uk website on the specified form, “Settle in the UK in various immigration categories: form SET(O)”.\n\n1.   SCU 30.2. An application for settlement as a partner or child of a Scale-up Worker must meet all the following requirements: \n    1.   (a) any fee must have been paid; and\n    2.   (b) the applicant must have provided biometrics when required; and\n    3.   (c) the applicant must have provided a passport or other travel document which satisfactorily establishes their identity and nationality; and\n    4.   (d) the applicant must be in the UK on the date of application; and\n    5.   (e) the applicant must be applying as a partner or child of a person (P) who: \n        1.   (i) has made a valid application for settlement in the UK on the Scale-up route and that application has not been decided; or\n        2.   (ii) is settled or has become a British citizen, provided that P had permission on the Scale-up route when they settled and the applicant either had permission as their partner or child at that time, or the applicant is applying as a child of P and the applicant was born in the UK before P settled.\n\nSCU 30.3. An application which does not meet the validity requirements for settlement as a partner or child of a Scale-up Worker may be rejected as invalid and not considered.",
      "summary": "Applicants who are partners or children of Scale-up Workers must apply online using form SET(O), paying fees, providing biometrics and identity documents, and being in the UK at the time. Their application must also stem from a valid, pending or settled application or status of the Scale-up Worker; otherwise, it may be rejected.",
      "augmented_text": "Document: Immigration Rules Appendix Scale-up\nPart: Immigration Rules Appendix Scale-up\nSection ID: SCU 30.1\nSection: Validity requirements for settlement as a partner or child on the Scale-up route\nTopic: settlement\n\nSummary: Applicants who are partners or children of Scale-up Workers must apply online using form SET(O), paying fees, providing biometrics and identity documents, and being in the UK at the time. Their application must also stem from a valid, pending or settled application or status of the Scale-up Worker; otherwise, it may be rejected.\n\n### Validity requirements for settlement as a partner or child on the Scale-up route\n\nSCU 30.1. A person applying for settlement as a partner or child of a Scale-up Worker must apply online on the gov.uk website on the specified form, “Settle in the UK in various immigration categories: form SET(O)”.\n\n1.   SCU 30.2. An application for settlement as a partner or child of a Scale-up Worker must meet all the following requirements: \n    1.   (a) any fee must have been paid; and\n    2.   (b) the applicant must have provided biometrics when required; and\n    3.   (c) the applicant must have provided a passport or other travel document which satisfactorily establishes their identity and nationality; and\n    4.   (d) the applicant must be in the UK on the date of application; and\n    5.   (e) the applicant must be applying as a partner or child of a person (P) who: \n        1.   (i) has made a valid application for settlement in the UK on the Scale-up route and that application has not been decided; or\n        2.   (ii) is settled or has become a British citizen, provided that P had permission on the Scale-up route when they settled and the applicant either had permission as their partner or child at that time, or the applicant is applying as a child of P and the applicant was born in the UK before P settled.\n\nSCU 30.3. An application which does not meet the validity requirements for settlement as a partner or child of a Scale-up Worker may be rejected as invalid and not considered.",
      "needs_review": false
    },
    {
      "metadata": {
        "source": "Immigration Rules Appendix Scale-up",
        "part": "Immigration Rules Appendix Scale-up",
        "section_id": "SCU 31.1",
        "section_title": "Suitability requirements for settlement as a dependent partner or dependent child on the Scale-up route",
        "parent_section": "SCU 31",
        "hierarchy_level": 2,
        "topic": "suitability",
        "url": "https://www.gov.uk/guidance/immigration-rules/immigration-rules-appendix-scale-up",
        "scraped_at": "2025-12-06T17:28:36.805583"
      },
      "text": "### Suitability requirements for settlement as a dependent partner or dependent child on the Scale-up route\n\nSCU 31.1. The applicant must not fall for refusal under Part Suitability.\n\n1.   SCU 31.2. The applicant must not be: \n    1.   (a) in breach of immigration laws, except that where the Exceptions for overstayers section of Part Suitability applies, that period of overstaying will be disregarded; or\n    2.   (b) on immigration bail.",
      "summary": "Applicants seeking settlement as a dependent partner or child on the Scale-up route must meet suitability criteria, including compliance with immigration laws and not being on immigration bail, with certain overstaying exceptions.",
      "augmented_text": "Document: Immigration Rules Appendix Scale-up\nPart: Immigration Rules Appendix Scale-up\nSection ID: SCU 31.1\nSection: Suitability requirements for settlement as a dependent partner or dependent child on the Scale-up route\nTopic: suitability\n\nSummary: Applicants seeking settlement as a dependent partner or child on the Scale-up route must meet suitability criteria, including compliance with immigration laws and not being on immigration bail, with certain overstaying exceptions.\n\n### Suitability requirements for settlement as a dependent partner or dependent child on the Scale-up route\n\nSCU 31.1. The applicant must not fall for refusal under Part Suitability.\n\n1.   SCU 31.2. The applicant must not be: \n    1.   (a) in breach of immigration laws, except that where the Exceptions for overstayers section of Part Suitability applies, that period of overstaying will be disregarded; or\n    2.   (b) on immigration bail.",
      "needs_review": false
    },
    {
      "metadata": {
        "source": "Immigration Rules Appendix Scale-up",
        "part": "Immigration Rules Appendix Scale-up",
        "section_id": "Eligibility requirements for settlement as a dependent partner or dependent child on the Scale-up route",
        "section_title": "Eligibility requirements for settlement as a dependent partner or dependent child on the Scale-up route",
        "parent_section": null,
        "hierarchy_level": 3,
        "topic": "eligibility",
        "url": "https://www.gov.uk/guidance/immigration-rules/immigration-rules-appendix-scale-up",
        "scraped_at": "2025-12-06T17:28:36.805592"
      },
      "text": "### Eligibility requirements for settlement as a dependent partner or dependent child on the Scale-up route",
      "summary": "This provision applies to dependent partners and children on the Scale-up route seeking settlement. They must meet specified relationship and residence requirements, with exceptions for certain circumstances, to qualify for settlement.",
      "augmented_text": "Document: Immigration Rules Appendix Scale-up\nPart: Immigration Rules Appendix Scale-up\nSection ID: Eligibility requirements for settlement as a dependent partner or dependent child on the Scale-up route\nSection: Eligibility requirements for settlement as a dependent partner or dependent child on the Scale-up route\nTopic: eligibility\n\nSummary: This provision applies to dependent partners and children on the Scale-up route seeking settlement. They must meet specified relationship and residence requirements, with exceptions for certain circumstances, to qualify for settlement.\n\n### Eligibility requirements for settlement as a dependent partner or dependent child on the Scale-up route",
      "needs_review": false
    },
    {
      "metadata": {
        "source": "Immigration Rules Appendix Scale-up",
        "part": "Immigration Rules Appendix Scale-up",
        "section_id": "1",
        "section_title": "Relationship requirement for settlement as a dependent partner or dependent child of a Scale-up Worker",
        "parent_section": null,
        "hierarchy_level": 1,
        "topic": "settlement",
        "url": "https://www.gov.uk/guidance/immigration-rules/immigration-rules-appendix-scale-up",
        "scraped_at": "2025-12-06T17:28:36.805622"
      },
      "text": "### Relationship requirement for settlement as a dependent partner or dependent child of a Scale-up Worker\n\n1.   SCU 32.1. The applicant must be the partner or child of a person (P) where one of the following applies: \n    1.   (a) P is, at the same time, being granted settlement as a Scale-up Worker; or\n    2.   (b) P is settled in the UK or has become a British citizen, providing P had permission as a Scale-up Worker when they settled and the applicant either: \n        1.   (i) had permission as P’s partner or child at that time; or\n        2.   (ii) is applying as a child of P and was born in the UK before P settled.\n\n2.   SCU 32.2. The applicant must either: \n    1.   (a) have last been granted permission as a partner or child of the person (P) in SCU 32.1; or\n    2.   (b) have been born in the UK and be applying as a child of the person (P) in SCU 32.1.\n\nSCU 32.3. If applying as a partner, the requirements of Appendix Relationship with Partner must be met.\n\n1.   SCU 32.4. If applying as a child, the applicant must meet the relationship requirement for settlement in Appendix Children.",
      "summary": "This provision applies to dependents (partners or children) of Scale-up Workers seeking settlement. They must be related to a qualifying individual who is either granted settlement as a Scale-up Worker or is settled/British citizen with prior permission, and meet specific relationship and application conditions. Exceptions include children born in the UK or previously granted permission as a partner or child of the qualifying person.",
      "augmented_text": "Document: Immigration Rules Appendix Scale-up\nPart: Immigration Rules Appendix Scale-up\nSection ID: 1\nSection: Relationship requirement for settlement as a dependent partner or dependent child of a Scale-up Worker\nTopic: settlement\n\nSummary: This provision applies to dependents (partners or children) of Scale-up Workers seeking settlement. They must be related to a qualifying individual who is either granted settlement as a Scale-up Worker or is settled/British citizen with prior permission, and meet specific relationship and application conditions. Exceptions include children born in the UK or previously granted permission as a partner or child of the qualifying person.\n\n### Relationship requirement for settlement as a dependent partner or dependent child of a Scale-up Worker\n\n1.   SCU 32.1. The applicant must be the partner or child of a person (P) where one of the following applies: \n    1.   (a) P is, at the same time, being granted settlement as a Scale-up Worker; or\n    2.   (b) P is settled in the UK or has become a British citizen, providing P had permission as a Scale-up Worker when they settled and the applicant either: \n        1.   (i) had permission as P’s partner or child at that time; or\n        2.   (ii) is applying as a child of P and was born in the UK before P settled.\n\n2.   SCU 32.2. The applicant must either: \n    1.   (a) have last been granted permission as a partner or child of the person (P) in SCU 32.1; or\n    2.   (b) have been born in the UK and be applying as a child of the person (P) in SCU 32.1.\n\nSCU 32.3. If applying as a partner, the requirements of Appendix Relationship with Partner must be met.\n\n1.   SCU 32.4. If applying as a child, the applicant must meet the relationship requirement for settlement in Appendix Children.",
      "needs_review": false
    },
    {
      "metadata": {
        "source": "Immigration Rules Appendix Scale-up",
        "part": "Immigration Rules Appendix Scale-up",
        "section_id": "SCU 33.1",
        "section_title": "Age requirement for settlement as a dependent child on the Scale-up route",
        "parent_section": "SCU 33",
        "hierarchy_level": 2,
        "topic": "settlement",
        "url": "https://www.gov.uk/guidance/immigration-rules/immigration-rules-appendix-scale-up",
        "scraped_at": "2025-12-06T17:28:36.805644"
      },
      "text": "### Age requirement for settlement as a dependent child on the Scale-up route\n\nSCU 33.1. DELETED.\n\nSCU 33.2. DELETED.",
      "summary": "This provision applies to dependent children seeking settlement under the Scale-up route. It requires that applicants must be under 18 years old at the time of settlement, with specific age thresholds and conditions applying; any exceptions are not specified here.",
      "augmented_text": "Document: Immigration Rules Appendix Scale-up\nPart: Immigration Rules Appendix Scale-up\nSection ID: SCU 33.1\nSection: Age requirement for settlement as a dependent child on the Scale-up route\nTopic: settlement\n\nSummary: This provision applies to dependent children seeking settlement under the Scale-up route. It requires that applicants must be under 18 years old at the time of settlement, with specific age thresholds and conditions applying; any exceptions are not specified here.\n\n### Age requirement for settlement as a dependent child on the Scale-up route\n\nSCU 33.1. DELETED.\n\nSCU 33.2. DELETED.",
      "needs_review": false
    },
    {
      "metadata": {
        "source": "Immigration Rules Appendix Scale-up",
        "part": "Immigration Rules Appendix Scale-up",
        "section_id": "SCU 34.1",
        "section_title": "Care requirement for settlement as a dependent child of a Scale-up Worker",
        "parent_section": "SCU 34",
        "hierarchy_level": 2,
        "topic": "settlement",
        "url": "https://www.gov.uk/guidance/immigration-rules/immigration-rules-appendix-scale-up",
        "scraped_at": "2025-12-06T17:28:36.805665"
      },
      "text": "### Care requirement for settlement as a dependent child of a Scale-up Worker\n\nSCU 34.1. DELETED.",
      "summary": "This provision applies to dependent children of Scale-up Workers seeking settlement. It requires applicants to demonstrate that appropriate care arrangements are in place, with no specific exceptions noted.",
      "augmented_text": "Document: Immigration Rules Appendix Scale-up\nPart: Immigration Rules Appendix Scale-up\nSection ID: SCU 34.1\nSection: Care requirement for settlement as a dependent child of a Scale-up Worker\nTopic: settlement\n\nSummary: This provision applies to dependent children of Scale-up Workers seeking settlement. It requires applicants to demonstrate that appropriate care arrangements are in place, with no specific exceptions noted.\n\n### Care requirement for settlement as a dependent child of a Scale-up Worker\n\nSCU 34.1. DELETED.",
      "needs_review": false
    },
    {
      "metadata": {
        "source": "Immigration Rules Appendix Scale-up",
        "part": "Immigration Rules Appendix Scale-up",
        "section_id": "1",
        "section_title": "Requirements for settlement as a dependent child on the Scale-up route",
        "parent_section": null,
        "hierarchy_level": 1,
        "topic": "settlement",
        "url": "https://www.gov.uk/guidance/immigration-rules/immigration-rules-appendix-scale-up",
        "scraped_at": "2025-12-06T17:28:36.805691"
      },
      "text": "### Requirements for settlement as a dependent child on the Scale-up route\n\n1.   SCU 34A.1. The applicant must meet the following requirements for a dependent child in Appendix Children: \n    1.   (a) care requirement; and\n    2.   (b) age and independent life requirement.",
      "summary": "Dependent children applying for settlement on the Scale-up route must satisfy care and age/independent life requirements outlined in Appendix Children, ensuring they are appropriately cared for and of suitable age to live independently.",
      "augmented_text": "Document: Immigration Rules Appendix Scale-up\nPart: Immigration Rules Appendix Scale-up\nSection ID: 1\nSection: Requirements for settlement as a dependent child on the Scale-up route\nTopic: settlement\n\nSummary: Dependent children applying for settlement on the Scale-up route must satisfy care and age/independent life requirements outlined in Appendix Children, ensuring they are appropriately cared for and of suitable age to live independently.\n\n### Requirements for settlement as a dependent child on the Scale-up route\n\n1.   SCU 34A.1. The applicant must meet the following requirements for a dependent child in Appendix Children: \n    1.   (a) care requirement; and\n    2.   (b) age and independent life requirement.",
      "needs_review": false
    },
    {
      "metadata": {
        "source": "Immigration Rules Appendix Scale-up",
        "part": "Immigration Rules Appendix Scale-up",
        "section_id": "SCU 35.1",
        "section_title": "Qualifying period requirement for settlement as a partner on the Scale-up route",
        "parent_section": "SCU 35",
        "hierarchy_level": 2,
        "topic": "settlement",
        "url": "https://www.gov.uk/guidance/immigration-rules/immigration-rules-appendix-scale-up",
        "scraped_at": "2025-12-06T17:28:36.805715"
      },
      "text": "### Qualifying period requirement for settlement as a partner on the Scale-up route\n\nSCU 35.1. The applicant must have spent a continuous period of 5 years in the UK with permission as a partner of the person (P) in SCU 32.1.",
      "summary": "Applicants seeking settlement as a partner on the Scale-up route must have continuously resided in the UK for 5 years with permission as a partner of the specified individual. The period must be uninterrupted, and the applicant must have held valid permission throughout.",
      "augmented_text": "Document: Immigration Rules Appendix Scale-up\nPart: Immigration Rules Appendix Scale-up\nSection ID: SCU 35.1\nSection: Qualifying period requirement for settlement as a partner on the Scale-up route\nTopic: settlement\n\nSummary: Applicants seeking settlement as a partner on the Scale-up route must have continuously resided in the UK for 5 years with permission as a partner of the specified individual. The period must be uninterrupted, and the applicant must have held valid permission throughout.\n\n### Qualifying period requirement for settlement as a partner on the Scale-up route\n\nSCU 35.1. The applicant must have spent a continuous period of 5 years in the UK with permission as a partner of the person (P) in SCU 32.1.",
      "needs_review": false
    },
    {
      "metadata": {
        "source": "Immigration Rules Appendix Scale-up",
        "part": "Immigration Rules Appendix Scale-up",
        "section_id": "SCU 36.1",
        "section_title": "Continuous residence requirement for settlement as a partner on the Scale-up route",
        "parent_section": "SCU 36",
        "hierarchy_level": 2,
        "topic": "settlement",
        "url": "https://www.gov.uk/guidance/immigration-rules/immigration-rules-appendix-scale-up",
        "scraped_at": "2025-12-06T17:28:36.805741"
      },
      "text": "### Continuous residence requirement for settlement as a partner on the Scale-up route\n\nSCU 36.1. The applicant must meet the continuous residence requirement as set out in Appendix Continuous Residence during the period in SCU 35.1.",
      "summary": "Applicants applying for settlement as a partner on the Scale-up route must fulfill the continuous residence requirement specified in Appendix Continuous Residence during the period outlined in SCU 35.1.",
      "augmented_text": "Document: Immigration Rules Appendix Scale-up\nPart: Immigration Rules Appendix Scale-up\nSection ID: SCU 36.1\nSection: Continuous residence requirement for settlement as a partner on the Scale-up route\nTopic: settlement\n\nSummary: Applicants applying for settlement as a partner on the Scale-up route must fulfill the continuous residence requirement specified in Appendix Continuous Residence during the period outlined in SCU 35.1.\n\n### Continuous residence requirement for settlement as a partner on the Scale-up route\n\nSCU 36.1. The applicant must meet the continuous residence requirement as set out in Appendix Continuous Residence during the period in SCU 35.1.",
      "needs_review": false
    },
    {
      "metadata": {
        "source": "Immigration Rules Appendix Scale-up",
        "part": "Immigration Rules Appendix Scale-up",
        "section_id": "SCU 37.1",
        "section_title": "English language requirement for settlement as a partner or child on the Scale-up route",
        "parent_section": "SCU 37",
        "hierarchy_level": 2,
        "topic": "english-language",
        "url": "https://www.gov.uk/guidance/immigration-rules/immigration-rules-appendix-scale-up",
        "scraped_at": "2025-12-06T17:28:36.805758"
      },
      "text": "### English language requirement for settlement as a partner or child on the Scale-up route\n\nSCU 37.1. Unless an exemption applies, the applicant must show English language ability on the Common European Framework of Reference for Languages in speaking and listening to at least level B1.\n\nSCU 37.2. The applicant must show they meet the English language requirement as specified in Appendix English Language.",
      "summary": "Applicants applying for settlement as a partner or child on the Scale-up route must demonstrate at least B1 level in speaking and listening English unless exempted, meeting the criteria outlined in Appendix English Language.",
      "augmented_text": "Document: Immigration Rules Appendix Scale-up\nPart: Immigration Rules Appendix Scale-up\nSection ID: SCU 37.1\nSection: English language requirement for settlement as a partner or child on the Scale-up route\nTopic: english-language\n\nSummary: Applicants applying for settlement as a partner or child on the Scale-up route must demonstrate at least B1 level in speaking and listening English unless exempted, meeting the criteria outlined in Appendix English Language.\n\n### English language requirement for settlement as a partner or child on the Scale-up route\n\nSCU 37.1. Unless an exemption applies, the applicant must show English language ability on the Common European Framework of Reference for Languages in speaking and listening to at least level B1.\n\nSCU 37.2. The applicant must show they meet the English language requirement as specified in Appendix English Language.",
      "needs_review": false
    },
    {
      "metadata": {
        "source": "Immigration Rules Appendix Scale-up",
        "part": "Immigration Rules Appendix Scale-up",
        "section_id": "SCU 38.1",
        "section_title": "Knowledge of life in the UK requirement for settlement as a partner or child on the Scale-up route",
        "parent_section": "SCU 38",
        "hierarchy_level": 2,
        "topic": "settlement",
        "url": "https://www.gov.uk/guidance/immigration-rules/immigration-rules-appendix-scale-up",
        "scraped_at": "2025-12-06T17:28:36.805784"
      },
      "text": "### Knowledge of life in the UK requirement for settlement as a partner or child on the Scale-up route\n\nSCU 38.1. Unless an exemption applies, the applicant must meet the knowledge of Life in the UK requirement as set out in Appendix KOL UK.",
      "summary": "Applicants seeking settlement as a partner or child on the Scale-up route mustMeet the Knowledge of Life in the UK requirement, unless exempt, as specified in Appendix KOL UK. This applies to most applicants, with certain exceptions based on specific criteria.",
      "augmented_text": "Document: Immigration Rules Appendix Scale-up\nPart: Immigration Rules Appendix Scale-up\nSection ID: SCU 38.1\nSection: Knowledge of life in the UK requirement for settlement as a partner or child on the Scale-up route\nTopic: settlement\n\nSummary: Applicants seeking settlement as a partner or child on the Scale-up route mustMeet the Knowledge of Life in the UK requirement, unless exempt, as specified in Appendix KOL UK. This applies to most applicants, with certain exceptions based on specific criteria.\n\n### Knowledge of life in the UK requirement for settlement as a partner or child on the Scale-up route\n\nSCU 38.1. Unless an exemption applies, the applicant must meet the knowledge of Life in the UK requirement as set out in Appendix KOL UK.",
      "needs_review": false
    },
    {
      "metadata": {
        "source": "Immigration Rules Appendix Scale-up",
        "part": "Immigration Rules Appendix Scale-up",
        "section_id": "SCU 39.1",
        "section_title": "Decision on an application for settlement as a partner or child on the Scale-up route",
        "parent_section": "SCU 39",
        "hierarchy_level": 2,
        "topic": "eligibility",
        "url": "https://www.gov.uk/guidance/immigration-rules/immigration-rules-appendix-scale-up",
        "scraped_at": "2025-12-06T17:28:36.805796"
      },
      "text": "### Decision on an application for settlement as a partner or child on the Scale-up route\n\nSCU 39.1. If the decision maker is satisfied all the suitability and eligibility requirements are met for settlement as a partner or child of a Scale-up Worker, the application will be granted settlement, otherwise the application will be refused.\n\nSCU 39.2. If the application is refused the person can apply for an Administrative Review under Appendix AR: Administrative Review.\n\nPrint this page",
      "summary": "Applicants seeking settlement as a partner or child on the Scale-up route must meet all suitability and eligibility criteria; approval results in settlement, while failure leads to refusal, with an option for Administrative Review.",
      "augmented_text": "Document: Immigration Rules Appendix Scale-up\nPart: Immigration Rules Appendix Scale-up\nSection ID: SCU 39.1\nSection: Decision on an application for settlement as a partner or child on the Scale-up route\nTopic: eligibility\n\nSummary: Applicants seeking settlement as a partner or child on the Scale-up route must meet all suitability and eligibility criteria; approval results in settlement, while failure leads to refusal, with an option for Administrative Review.\n\n### Decision on an application for settlement as a partner or child on the Scale-up route\n\nSCU 39.1. If the decision maker is satisfied all the suitability and eligibility requirements are met for settlement as a partner or child of a Scale-up Worker, the application will be granted settlement, otherwise the application will be refused.\n\nSCU 39.2. If the application is refused the person can apply for an Administrative Review under Appendix AR: Administrative Review.\n\nPrint this page",
      "needs_review": false
    }
  ]
}