{
  "url": "https://www.gov.uk/guidance/immigration-rules/immigration-rules-appendix-adoption",
  "part_name": "Immigration Rules Appendix Adoption",
  "scraped_at": "2025-12-06T17:26:08.455605",
  "chunk_count": 60,
  "chunks": [
    {
      "metadata": {
        "source": "Immigration Rules Appendix Adoption",
        "part": "Immigration Rules Appendix Adoption",
        "section_id": "SW 3.1",
        "section_title": "Adoption: Hague Convention",
        "parent_section": null,
        "hierarchy_level": 2,
        "topic": "adoption",
        "url": "https://www.gov.uk/guidance/immigration-rules/immigration-rules-appendix-adoption",
        "scraped_at": "2025-12-06T17:26:08.444359"
      },
      "text": "### Adoption: Hague Convention",
      "summary": "This provision applies to applicants pursuing adoption under the Hague Convention. It requires compliance with specific procedural and legal obligations to ensure international adoption validity. Exceptions or thresholds are not specified in the provided excerpt.",
      "augmented_text": "Document: Immigration Rules Appendix Adoption\nPart: Immigration Rules Appendix Adoption\nSection ID: SW 3.1\nSection: Adoption: Hague Convention\nTopic: adoption\n\nSummary: This provision applies to applicants pursuing adoption under the Hague Convention. It requires compliance with specific procedural and legal obligations to ensure international adoption validity. Exceptions or thresholds are not specified in the provided excerpt.\n\n### Adoption: Hague Convention",
      "needs_review": false
    },
    {
      "metadata": {
        "source": "Immigration Rules Appendix Adoption",
        "part": "Immigration Rules Appendix Adoption",
        "section_id": "Entry clearance for the Adoption: Hague Convention route",
        "section_title": "Entry clearance for the Adoption: Hague Convention route",
        "parent_section": null,
        "hierarchy_level": 3,
        "topic": "leave-to-enter",
        "url": "https://www.gov.uk/guidance/immigration-rules/immigration-rules-appendix-adoption",
        "scraped_at": "2025-12-06T17:26:08.444397"
      },
      "text": "### Entry clearance for the Adoption: Hague Convention route",
      "summary": "This provision applies to applicants seeking entry clearance for adoption under the Hague Convention route. It requires applicants to meet specific legal and procedural criteria, including compliance with adoption standards and documentation, with certain exceptions based on individual circumstances.",
      "augmented_text": "Document: Immigration Rules Appendix Adoption\nPart: Immigration Rules Appendix Adoption\nSection ID: Entry clearance for the Adoption: Hague Convention route\nSection: Entry clearance for the Adoption: Hague Convention route\nTopic: leave-to-enter\n\nSummary: This provision applies to applicants seeking entry clearance for adoption under the Hague Convention route. It requires applicants to meet specific legal and procedural criteria, including compliance with adoption standards and documentation, with certain exceptions based on individual circumstances.\n\n### Entry clearance for the Adoption: Hague Convention route",
      "needs_review": false
    },
    {
      "metadata": {
        "source": "Immigration Rules Appendix Adoption",
        "part": "Immigration Rules Appendix Adoption",
        "section_id": "AD 1.1",
        "section_title": "Validity requirements for the Adoption: Hague Convention route",
        "parent_section": "AD 1",
        "hierarchy_level": 2,
        "topic": "leave-to-enter",
        "url": "https://www.gov.uk/guidance/immigration-rules/immigration-rules-appendix-adoption",
        "scraped_at": "2025-12-06T17:26:08.444552"
      },
      "text": "### Validity requirements for the Adoption: Hague Convention route\n\nAD 1.1. A child applying for entry clearance on the Adoption: Hague Convention route must apply online on the gov.uk website on the specified form: ‘Non-British adopted child or child coming to the UK for adoption of a parent or parents who are British citizens or settled in the UK’.\n\n1.   AD 1.2. An application for entry clearance must meet all the following requirements: \n    1.   (a) any fee and the Immigration Health Charge must have been paid; and\n    2.   (b) the applicant must have provided biometrics when required; and\n    3.   (c) the applicant must have provided a passport or other document which satisfactorily establishes their identity and nationality.\n\nAD 1.3. An application which does not meet all the validity requirements of the Adoption: Hague Convention route may be rejected as invalid and not considered.",
      "summary": "This provision applies to children applying for entry clearance via the Hague Convention route. Applicants must submit an online application, pay fees and health charges, provide biometrics, and verify identity and nationality; failure to meet these requirements may result in rejection.",
      "augmented_text": "Document: Immigration Rules Appendix Adoption\nPart: Immigration Rules Appendix Adoption\nSection ID: AD 1.1\nSection: Validity requirements for the Adoption: Hague Convention route\nTopic: leave-to-enter\n\nSummary: This provision applies to children applying for entry clearance via the Hague Convention route. Applicants must submit an online application, pay fees and health charges, provide biometrics, and verify identity and nationality; failure to meet these requirements may result in rejection.\n\n### Validity requirements for the Adoption: Hague Convention route\n\nAD 1.1. A child applying for entry clearance on the Adoption: Hague Convention route must apply online on the gov.uk website on the specified form: ‘Non-British adopted child or child coming to the UK for adoption of a parent or parents who are British citizens or settled in the UK’.\n\n1.   AD 1.2. An application for entry clearance must meet all the following requirements: \n    1.   (a) any fee and the Immigration Health Charge must have been paid; and\n    2.   (b) the applicant must have provided biometrics when required; and\n    3.   (c) the applicant must have provided a passport or other document which satisfactorily establishes their identity and nationality.\n\nAD 1.3. An application which does not meet all the validity requirements of the Adoption: Hague Convention route may be rejected as invalid and not considered.",
      "needs_review": false
    },
    {
      "metadata": {
        "source": "Immigration Rules Appendix Adoption",
        "part": "Immigration Rules Appendix Adoption",
        "section_id": "AD 2.1",
        "section_title": "Suitability requirements for the Adoption: Hague Convention route",
        "parent_section": "AD 2",
        "hierarchy_level": 2,
        "topic": "suitability",
        "url": "https://www.gov.uk/guidance/immigration-rules/immigration-rules-appendix-adoption",
        "scraped_at": "2025-12-06T17:26:08.444585"
      },
      "text": "### Suitability requirements for the Adoption: Hague Convention route\n\nAD 2.1. The applicant must not fall for refusal under Part Suitability.",
      "summary": "Applicants adopting via the Hague Convention route must meet suitability criteria outlined in Part Suitability, ensuring they are appropriate candidates for adoption and meeting necessary legal standards; failure to meet these requirements can lead to refusal.",
      "augmented_text": "Document: Immigration Rules Appendix Adoption\nPart: Immigration Rules Appendix Adoption\nSection ID: AD 2.1\nSection: Suitability requirements for the Adoption: Hague Convention route\nTopic: suitability\n\nSummary: Applicants adopting via the Hague Convention route must meet suitability criteria outlined in Part Suitability, ensuring they are appropriate candidates for adoption and meeting necessary legal standards; failure to meet these requirements can lead to refusal.\n\n### Suitability requirements for the Adoption: Hague Convention route\n\nAD 2.1. The applicant must not fall for refusal under Part Suitability.",
      "needs_review": false
    },
    {
      "metadata": {
        "source": "Immigration Rules Appendix Adoption",
        "part": "Immigration Rules Appendix Adoption",
        "section_id": "Eligibility requirements for the Adoption: Hague Convention route",
        "section_title": "Eligibility requirements for the Adoption: Hague Convention route",
        "parent_section": null,
        "hierarchy_level": 3,
        "topic": "eligibility",
        "url": "https://www.gov.uk/guidance/immigration-rules/immigration-rules-appendix-adoption",
        "scraped_at": "2025-12-06T17:26:08.444602"
      },
      "text": "### Eligibility requirements for the Adoption: Hague Convention route",
      "summary": "This provision applies to applicants seeking adoption via the Hague Convention route. It requires the adopter to meet specific eligibility criteria, including being a suitable and fit parent under UK law, with certain thresholds depending on the child's circumstances. Critical conditions include adherence to convention standards and obtaining necessary approvals.",
      "augmented_text": "Document: Immigration Rules Appendix Adoption\nPart: Immigration Rules Appendix Adoption\nSection ID: Eligibility requirements for the Adoption: Hague Convention route\nSection: Eligibility requirements for the Adoption: Hague Convention route\nTopic: eligibility\n\nSummary: This provision applies to applicants seeking adoption via the Hague Convention route. It requires the adopter to meet specific eligibility criteria, including being a suitable and fit parent under UK law, with certain thresholds depending on the child's circumstances. Critical conditions include adherence to convention standards and obtaining necessary approvals.\n\n### Eligibility requirements for the Adoption: Hague Convention route",
      "needs_review": false
    },
    {
      "metadata": {
        "source": "Immigration Rules Appendix Adoption",
        "part": "Immigration Rules Appendix Adoption",
        "section_id": "AD 3.1",
        "section_title": "Entry requirements for the Adoption: Hague Convention route",
        "parent_section": "AD 3",
        "hierarchy_level": 2,
        "topic": "leave-to-enter",
        "url": "https://www.gov.uk/guidance/immigration-rules/immigration-rules-appendix-adoption",
        "scraped_at": "2025-12-06T17:26:08.444641"
      },
      "text": "### Entry requirements for the Adoption: Hague Convention route\n\nAD 3.1. A child seeking to come to the UK under the Adoption: Hague Convention route must apply for and obtain entry clearance on the Adoption: Hague Convention route before they arrive in the UK.\n\nAD 3.2. A child applying for entry clearance on the Adoption: Hague Convention route must, if Appendix Tuberculosis applies, provide a valid medical certificate confirming they have undergone screening for active pulmonary tuberculosis and that this tuberculosis is not present in them.",
      "summary": "Children seeking to enter the UK via the Hague Convention route must obtain prior entry clearance and, if applicable, provide a valid tuberculosis screening certificate; the process requires adherence to specified medical and application criteria.",
      "augmented_text": "Document: Immigration Rules Appendix Adoption\nPart: Immigration Rules Appendix Adoption\nSection ID: AD 3.1\nSection: Entry requirements for the Adoption: Hague Convention route\nTopic: leave-to-enter\n\nSummary: Children seeking to enter the UK via the Hague Convention route must obtain prior entry clearance and, if applicable, provide a valid tuberculosis screening certificate; the process requires adherence to specified medical and application criteria.\n\n### Entry requirements for the Adoption: Hague Convention route\n\nAD 3.1. A child seeking to come to the UK under the Adoption: Hague Convention route must apply for and obtain entry clearance on the Adoption: Hague Convention route before they arrive in the UK.\n\nAD 3.2. A child applying for entry clearance on the Adoption: Hague Convention route must, if Appendix Tuberculosis applies, provide a valid medical certificate confirming they have undergone screening for active pulmonary tuberculosis and that this tuberculosis is not present in them.",
      "needs_review": false
    },
    {
      "metadata": {
        "source": "Immigration Rules Appendix Adoption",
        "part": "Immigration Rules Appendix Adoption",
        "section_id": "AD 4.1",
        "section_title": "Adoption requirements for the Adoption: Hague Convention route",
        "parent_section": "AD 4",
        "hierarchy_level": 2,
        "topic": "family",
        "url": "https://www.gov.uk/guidance/immigration-rules/immigration-rules-appendix-adoption",
        "scraped_at": "2025-12-06T17:26:08.444681"
      },
      "text": "### Adoption requirements for the Adoption: Hague Convention route\n\nAD 4.1. The adoptive parents or, if there is sole responsibility, the adoptive parent, must be habitually resident in the UK.\n\nAD 4.2. The adoption must be the subject of an agreement made under Article 17(c) of the Hague Convention.\n\nAD 4.3. The applicant must have been entrusted to the adoptive parent(s) by the competent administrative authority of the child’s country of origin the purpose of adoption under the Hague Convention.\n\nAD 4.4. The decision maker must be satisfied that the adoption is not one of convenience arranged to facilitate the admission of the child to the UK.",
      "summary": "Eligible adoptive parents must be habitually resident in the UK and have an adoption agreement under the Hague Convention, with the child entrusted by the child's origin authority. The process requires adherence to Hague procedures and assurance that the adoption isn't merely for convenience, ensuring genuine safeguarding of the child's best interests.",
      "augmented_text": "Document: Immigration Rules Appendix Adoption\nPart: Immigration Rules Appendix Adoption\nSection ID: AD 4.1\nSection: Adoption requirements for the Adoption: Hague Convention route\nTopic: family\n\nSummary: Eligible adoptive parents must be habitually resident in the UK and have an adoption agreement under the Hague Convention, with the child entrusted by the child's origin authority. The process requires adherence to Hague procedures and assurance that the adoption isn't merely for convenience, ensuring genuine safeguarding of the child's best interests.\n\n### Adoption requirements for the Adoption: Hague Convention route\n\nAD 4.1. The adoptive parents or, if there is sole responsibility, the adoptive parent, must be habitually resident in the UK.\n\nAD 4.2. The adoption must be the subject of an agreement made under Article 17(c) of the Hague Convention.\n\nAD 4.3. The applicant must have been entrusted to the adoptive parent(s) by the competent administrative authority of the child’s country of origin the purpose of adoption under the Hague Convention.\n\nAD 4.4. The decision maker must be satisfied that the adoption is not one of convenience arranged to facilitate the admission of the child to the UK.",
      "needs_review": false
    },
    {
      "metadata": {
        "source": "Immigration Rules Appendix Adoption",
        "part": "Immigration Rules Appendix Adoption",
        "section_id": "1",
        "section_title": "Dependent child requirements for the Adoption: Hague Convention route",
        "parent_section": null,
        "hierarchy_level": 1,
        "topic": "family",
        "url": "https://www.gov.uk/guidance/immigration-rules/immigration-rules-appendix-adoption",
        "scraped_at": "2025-12-06T17:26:08.444718"
      },
      "text": "### Dependent child requirements for the Adoption: Hague Convention route\n\n1.   AD 5.1. The applicant must meet the following requirements for a dependent child in Appendix Children: \n    1.   (a) age requirement; and\n    2.   (b) independent life requirement; and\n    3.   (c) care requirement.",
      "summary": "Applicants seeking adoption via the Hague Convention route must demonstrate that their dependent child meets age, independence, and care requirements. The child must satisfy specific criteria outlined in Appendix Children, with no explicit exceptions noted.",
      "augmented_text": "Document: Immigration Rules Appendix Adoption\nPart: Immigration Rules Appendix Adoption\nSection ID: 1\nSection: Dependent child requirements for the Adoption: Hague Convention route\nTopic: family\n\nSummary: Applicants seeking adoption via the Hague Convention route must demonstrate that their dependent child meets age, independence, and care requirements. The child must satisfy specific criteria outlined in Appendix Children, with no explicit exceptions noted.\n\n### Dependent child requirements for the Adoption: Hague Convention route\n\n1.   AD 5.1. The applicant must meet the following requirements for a dependent child in Appendix Children: \n    1.   (a) age requirement; and\n    2.   (b) independent life requirement; and\n    3.   (c) care requirement.",
      "needs_review": false
    },
    {
      "metadata": {
        "source": "Immigration Rules Appendix Adoption",
        "part": "Immigration Rules Appendix Adoption",
        "section_id": "1",
        "section_title": "Immigration status requirements of parents for the Adoption: Hague Convention route",
        "parent_section": null,
        "hierarchy_level": 1,
        "topic": "family",
        "url": "https://www.gov.uk/guidance/immigration-rules/immigration-rules-appendix-adoption",
        "scraped_at": "2025-12-06T17:26:08.444755"
      },
      "text": "### Immigration status requirements of parents for the Adoption: Hague Convention route\n\n1.   AD 6.1. The applicant must be joining their adoptive parent(s) and one of the following must apply: \n    1.   (a) both adoptive parents are British Citizens, are settled in the UK, or live in the UK and have a right to stay without restriction; or\n    2.   (b) the adoptive parent has sole responsibility for the applicant and is a British Citizen, is settled in the UK, or lives in the UK and has a right to stay without restriction.",
      "summary": "This provision applies to applicants seeking adoption via the Hague Convention route. They must join adoptive parent(s) who are either British Citizens, settled in the UK, or have indefinite rights to remain; or, if only one adoptive parent has sole responsibility, that parent must meet these status criteria. Both parents or the responsible parent must have secure immigration status in the UK.",
      "augmented_text": "Document: Immigration Rules Appendix Adoption\nPart: Immigration Rules Appendix Adoption\nSection ID: 1\nSection: Immigration status requirements of parents for the Adoption: Hague Convention route\nTopic: family\n\nSummary: This provision applies to applicants seeking adoption via the Hague Convention route. They must join adoptive parent(s) who are either British Citizens, settled in the UK, or have indefinite rights to remain; or, if only one adoptive parent has sole responsibility, that parent must meet these status criteria. Both parents or the responsible parent must have secure immigration status in the UK.\n\n### Immigration status requirements of parents for the Adoption: Hague Convention route\n\n1.   AD 6.1. The applicant must be joining their adoptive parent(s) and one of the following must apply: \n    1.   (a) both adoptive parents are British Citizens, are settled in the UK, or live in the UK and have a right to stay without restriction; or\n    2.   (b) the adoptive parent has sole responsibility for the applicant and is a British Citizen, is settled in the UK, or lives in the UK and has a right to stay without restriction.",
      "needs_review": false
    },
    {
      "metadata": {
        "source": "Immigration Rules Appendix Adoption",
        "part": "Immigration Rules Appendix Adoption",
        "section_id": "AD 7.1",
        "section_title": "Financial requirements for the Adoption: Hague Convention route",
        "parent_section": "AD 7",
        "hierarchy_level": 2,
        "topic": "financial",
        "url": "https://www.gov.uk/guidance/immigration-rules/immigration-rules-appendix-adoption",
        "scraped_at": "2025-12-06T17:26:08.444778"
      },
      "text": "### Financial requirements for the Adoption: Hague Convention route\n\nAD 7.1. The applicant must show that they will be adequately maintained in the UK by the adoptive parent(s), without access to public funds.\n\n1.   AD 7.2. The applicant must provide evidence from the adoptive parent(s) of income or cash savings sufficient to show the financial requirement is met, and: \n    1.   (a) evidence from income (other than self-employment) or savings must cover the 6-month period immediately before the date of application; or\n    2.   (b) where the adoptive parent(s) is receiving maternity, paternity, adoption or sick pay, their income from salaried employment can be shown for either the 6 months immediately before the date of application or the start date of the maternity, paternity, adoption or sick leave; or\n    3.   (c) where the income is from self-employment it must be shown for the last full financial year before the date of application, with additional evidence of ongoing self-employment as in paragraphs 7 or 9 (as relevant) of Appendix FM-SE; or\n    4.   (d) where there is non-employment income it must be shown to have been received in the 12 months before the date of application except where specified in paragraph 10 of Appendix FM-SE; or\n    5.   (e) where property has been sold and the money received has been converted into cash savings the requirements in paragraph 11A(d) of Appendix FM-SE must be met.\n\nAD 7.3. The applicant must show they meet the financial requirement as set out in Appendix FM-SE.",
      "summary": "Applicants applying via the Hague Convention route must demonstrate they will be adequately maintained by the adoptive parent(s) without recourse to public funds. They must provide evidence of sufficient income or savings, covering the required period (typically 6 or 12 months), with specific documentation depending on income type and circumstances.",
      "augmented_text": "Document: Immigration Rules Appendix Adoption\nPart: Immigration Rules Appendix Adoption\nSection ID: AD 7.1\nSection: Financial requirements for the Adoption: Hague Convention route\nTopic: financial\n\nSummary: Applicants applying via the Hague Convention route must demonstrate they will be adequately maintained by the adoptive parent(s) without recourse to public funds. They must provide evidence of sufficient income or savings, covering the required period (typically 6 or 12 months), with specific documentation depending on income type and circumstances.\n\n### Financial requirements for the Adoption: Hague Convention route\n\nAD 7.1. The applicant must show that they will be adequately maintained in the UK by the adoptive parent(s), without access to public funds.\n\n1.   AD 7.2. The applicant must provide evidence from the adoptive parent(s) of income or cash savings sufficient to show the financial requirement is met, and: \n    1.   (a) evidence from income (other than self-employment) or savings must cover the 6-month period immediately before the date of application; or\n    2.   (b) where the adoptive parent(s) is receiving maternity, paternity, adoption or sick pay, their income from salaried employment can be shown for either the 6 months immediately before the date of application or the start date of the maternity, paternity, adoption or sick leave; or\n    3.   (c) where the income is from self-employment it must be shown for the last full financial year before the date of application, with additional evidence of ongoing self-employment as in paragraphs 7 or 9 (as relevant) of Appendix FM-SE; or\n    4.   (d) where there is non-employment income it must be shown to have been received in the 12 months before the date of application except where specified in paragraph 10 of Appendix FM-SE; or\n    5.   (e) where property has been sold and the money received has been converted into cash savings the requirements in paragraph 11A(d) of Appendix FM-SE must be met.\n\nAD 7.3. The applicant must show they meet the financial requirement as set out in Appendix FM-SE.",
      "needs_review": false
    },
    {
      "metadata": {
        "source": "Immigration Rules Appendix Adoption",
        "part": "Immigration Rules Appendix Adoption",
        "section_id": "AD 8.1",
        "section_title": "Accommodation requirement for the Adoption: Hague Convention route",
        "parent_section": "AD 8",
        "hierarchy_level": 2,
        "topic": "accommodation",
        "url": "https://www.gov.uk/guidance/immigration-rules/immigration-rules-appendix-adoption",
        "scraped_at": "2025-12-06T17:26:08.444807"
      },
      "text": "### Accommodation requirement for the Adoption: Hague Convention route\n\nAD 8.1. The applicant’s accommodation in the UK must not be overcrowded or contravene public health regulations.",
      "summary": "This provision applies to applicants adopting via the Hague Convention route. They must have accommodation that is not overcrowded and complies with public health regulations. No specific thresholds or exceptions are specified.",
      "augmented_text": "Document: Immigration Rules Appendix Adoption\nPart: Immigration Rules Appendix Adoption\nSection ID: AD 8.1\nSection: Accommodation requirement for the Adoption: Hague Convention route\nTopic: accommodation\n\nSummary: This provision applies to applicants adopting via the Hague Convention route. They must have accommodation that is not overcrowded and complies with public health regulations. No specific thresholds or exceptions are specified.\n\n### Accommodation requirement for the Adoption: Hague Convention route\n\nAD 8.1. The applicant’s accommodation in the UK must not be overcrowded or contravene public health regulations.",
      "needs_review": false
    },
    {
      "metadata": {
        "source": "Immigration Rules Appendix Adoption",
        "part": "Immigration Rules Appendix Adoption",
        "section_id": "AD 9.1",
        "section_title": "Eligibility under Article 8 of the Human Rights Convention for the Adoption: Hague Convention route",
        "parent_section": "AD 9",
        "hierarchy_level": 2,
        "topic": "eligibility",
        "url": "https://www.gov.uk/guidance/immigration-rules/immigration-rules-appendix-adoption",
        "scraped_at": "2025-12-06T17:26:08.444827"
      },
      "text": "### Eligibility under Article 8 of the Human Rights Convention for the Adoption: Hague Convention route\n\nAD 9.1. If the applicant meets the Requirements for Adoption, but does not meet the suitability or other eligibility requirements (subject to AD 9.2.), the decision maker must be satisfied that refusal of the application would breach Article 8 of the Human Rights Convention, because it would result in unjustifiably harsh consequences for the applicant or their adoptive family.\n\nAD 9.2. Where AD 9.1. applies and the applicant falls for refusal under SUI 2.1, SUI 2.3, SUI 3.1., SUI 4.1, SUI 5.1. of Part Suitability, the application on the Adoption: Hague Convention route must be refused.",
      "summary": "This provision applies to applicants seeking adoption under the Hague Convention who meet the adoption requirements but lack suitability or eligibility; decisions must consider whether refusal would breach Article 8 rights due to harsh consequences. If the applicant falls under specified suitability criteria, the application must be refused, even if Article 8 considerations apply.",
      "augmented_text": "Document: Immigration Rules Appendix Adoption\nPart: Immigration Rules Appendix Adoption\nSection ID: AD 9.1\nSection: Eligibility under Article 8 of the Human Rights Convention for the Adoption: Hague Convention route\nTopic: eligibility\n\nSummary: This provision applies to applicants seeking adoption under the Hague Convention who meet the adoption requirements but lack suitability or eligibility; decisions must consider whether refusal would breach Article 8 rights due to harsh consequences. If the applicant falls under specified suitability criteria, the application must be refused, even if Article 8 considerations apply.\n\n### Eligibility under Article 8 of the Human Rights Convention for the Adoption: Hague Convention route\n\nAD 9.1. If the applicant meets the Requirements for Adoption, but does not meet the suitability or other eligibility requirements (subject to AD 9.2.), the decision maker must be satisfied that refusal of the application would breach Article 8 of the Human Rights Convention, because it would result in unjustifiably harsh consequences for the applicant or their adoptive family.\n\nAD 9.2. Where AD 9.1. applies and the applicant falls for refusal under SUI 2.1, SUI 2.3, SUI 3.1., SUI 4.1, SUI 5.1. of Part Suitability, the application on the Adoption: Hague Convention route must be refused.",
      "needs_review": false
    },
    {
      "metadata": {
        "source": "Immigration Rules Appendix Adoption",
        "part": "Immigration Rules Appendix Adoption",
        "section_id": "AD 10.1",
        "section_title": "Decision on an application on the Adoption: Hague Convention route",
        "parent_section": "AD 10",
        "hierarchy_level": 2,
        "topic": "eligibility",
        "url": "https://www.gov.uk/guidance/immigration-rules/immigration-rules-appendix-adoption",
        "scraped_at": "2025-12-06T17:26:08.444846"
      },
      "text": "### Decision on an application on the Adoption: Hague Convention route\n\nAD 10.1. If the decision maker is satisfied that the validity, suitability and eligibility requirements are met, or the applicant meets the eligibility requirements at AD 4.1. to AD 4.4. and AD 9.1. (unless paragraph AD 9.2. applies), the applicant will be granted entry clearance on the Adoption: Hague Convention route, otherwise the application will be refused.",
      "summary": "Applicants seeking adoption under the Hague Convention route must satisfy validity, suitability, and eligibility criteria set out in relevant sections; if met, entry clearance is granted. If these requirements are not satisfied, the application will be refused.",
      "augmented_text": "Document: Immigration Rules Appendix Adoption\nPart: Immigration Rules Appendix Adoption\nSection ID: AD 10.1\nSection: Decision on an application on the Adoption: Hague Convention route\nTopic: eligibility\n\nSummary: Applicants seeking adoption under the Hague Convention route must satisfy validity, suitability, and eligibility criteria set out in relevant sections; if met, entry clearance is granted. If these requirements are not satisfied, the application will be refused.\n\n### Decision on an application on the Adoption: Hague Convention route\n\nAD 10.1. If the decision maker is satisfied that the validity, suitability and eligibility requirements are met, or the applicant meets the eligibility requirements at AD 4.1. to AD 4.4. and AD 9.1. (unless paragraph AD 9.2. applies), the applicant will be granted entry clearance on the Adoption: Hague Convention route, otherwise the application will be refused.",
      "needs_review": false
    },
    {
      "metadata": {
        "source": "Immigration Rules Appendix Adoption",
        "part": "Immigration Rules Appendix Adoption",
        "section_id": "AD 11.1",
        "section_title": "Period of grant on the Adoption: Hague Convention route",
        "parent_section": "AD 11",
        "hierarchy_level": 2,
        "topic": "leave-to-enter",
        "url": "https://www.gov.uk/guidance/immigration-rules/immigration-rules-appendix-adoption",
        "scraped_at": "2025-12-06T17:26:08.444875"
      },
      "text": "### Period of grant on the Adoption: Hague Convention route\n\nAD 11.1. The applicant will be granted entry clearance for 24 months, which is to allow the Hague adoption to be completed in the UK.",
      "summary": "This provision applies to applicants using the Hague Convention route for adoption. They are granted entry clearance for 24 months to complete the adoption process in the UK. No exceptions or additional conditions are specified.",
      "augmented_text": "Document: Immigration Rules Appendix Adoption\nPart: Immigration Rules Appendix Adoption\nSection ID: AD 11.1\nSection: Period of grant on the Adoption: Hague Convention route\nTopic: leave-to-enter\n\nSummary: This provision applies to applicants using the Hague Convention route for adoption. They are granted entry clearance for 24 months to complete the adoption process in the UK. No exceptions or additional conditions are specified.\n\n### Period of grant on the Adoption: Hague Convention route\n\nAD 11.1. The applicant will be granted entry clearance for 24 months, which is to allow the Hague adoption to be completed in the UK.",
      "needs_review": false
    },
    {
      "metadata": {
        "source": "Immigration Rules Appendix Adoption",
        "part": "Immigration Rules Appendix Adoption",
        "section_id": "1",
        "section_title": "Conditions of grant on the Adoption: Hague Convention route",
        "parent_section": null,
        "hierarchy_level": 1,
        "topic": "financial",
        "url": "https://www.gov.uk/guidance/immigration-rules/immigration-rules-appendix-adoption",
        "scraped_at": "2025-12-06T17:26:08.444897"
      },
      "text": "### Conditions of grant on the Adoption: Hague Convention route\n\n1.   AD 12.2. The grant will be subject to the following conditions: \n    1.   (a) work is permitted; and\n    2.   (b) study is permitted; and\n    3.   (c) no access to public funds.",
      "summary": "Applicants applying via the Adoption: Hague Convention route are granted permission with conditions allowing work and study but prohibiting access to public funds. These conditions must be met for the grant to be valid.",
      "augmented_text": "Document: Immigration Rules Appendix Adoption\nPart: Immigration Rules Appendix Adoption\nSection ID: 1\nSection: Conditions of grant on the Adoption: Hague Convention route\nTopic: financial\n\nSummary: Applicants applying via the Adoption: Hague Convention route are granted permission with conditions allowing work and study but prohibiting access to public funds. These conditions must be met for the grant to be valid.\n\n### Conditions of grant on the Adoption: Hague Convention route\n\n1.   AD 12.2. The grant will be subject to the following conditions: \n    1.   (a) work is permitted; and\n    2.   (b) study is permitted; and\n    3.   (c) no access to public funds.",
      "needs_review": false
    },
    {
      "metadata": {
        "source": "Immigration Rules Appendix Adoption",
        "part": "Immigration Rules Appendix Adoption",
        "section_id": "AD 1.1",
        "section_title": "Recognised Overseas Adoption",
        "parent_section": null,
        "hierarchy_level": 2,
        "topic": "adoption",
        "url": "https://www.gov.uk/guidance/immigration-rules/immigration-rules-appendix-adoption",
        "scraped_at": "2025-12-06T17:26:08.444922"
      },
      "text": "### Adoption: Recognised Overseas Adoption",
      "summary": "This provision applies to individuals seeking recognition of overseas adoptions under UK immigration rules. It requires that the adoption is legally recognized in the issuing country and meets specified criteria, with exceptions for certain types of legal adoptions or revocations. Compliance with these conditions is essential for eligibility.",
      "augmented_text": "Document: Immigration Rules Appendix Adoption\nPart: Immigration Rules Appendix Adoption\nSection ID: AD 1.1\nSection: Recognised Overseas Adoption\nTopic: adoption\n\nSummary: This provision applies to individuals seeking recognition of overseas adoptions under UK immigration rules. It requires that the adoption is legally recognized in the issuing country and meets specified criteria, with exceptions for certain types of legal adoptions or revocations. Compliance with these conditions is essential for eligibility.\n\n### Adoption: Recognised Overseas Adoption",
      "needs_review": false
    },
    {
      "metadata": {
        "source": "Immigration Rules Appendix Adoption",
        "part": "Immigration Rules Appendix Adoption",
        "section_id": "Entry clearance for the Adoption: Recognised Overseas Adoption route",
        "section_title": "Entry clearance for the Adoption: Recognised Overseas Adoption route",
        "parent_section": null,
        "hierarchy_level": 3,
        "topic": "leave-to-enter",
        "url": "https://www.gov.uk/guidance/immigration-rules/immigration-rules-appendix-adoption",
        "scraped_at": "2025-12-06T17:26:08.444944"
      },
      "text": "### Entry clearance for the Adoption: Recognised Overseas Adoption route",
      "summary": "This provision applies to applicants seeking entry clearance under the Recognised Overseas Adoption route. It requires proof of a recognized overseas adoption and compliance with relevant legal standards; no exceptions are specified, and proper documentation must be provided to qualify.",
      "augmented_text": "Document: Immigration Rules Appendix Adoption\nPart: Immigration Rules Appendix Adoption\nSection ID: Entry clearance for the Adoption: Recognised Overseas Adoption route\nSection: Entry clearance for the Adoption: Recognised Overseas Adoption route\nTopic: leave-to-enter\n\nSummary: This provision applies to applicants seeking entry clearance under the Recognised Overseas Adoption route. It requires proof of a recognized overseas adoption and compliance with relevant legal standards; no exceptions are specified, and proper documentation must be provided to qualify.\n\n### Entry clearance for the Adoption: Recognised Overseas Adoption route",
      "needs_review": false
    },
    {
      "metadata": {
        "source": "Immigration Rules Appendix Adoption",
        "part": "Immigration Rules Appendix Adoption",
        "section_id": "AD 13.1",
        "section_title": "Validity requirements for the Adoption: Recognised Overseas Adoption route",
        "parent_section": "AD 13",
        "hierarchy_level": 2,
        "topic": "leave-to-enter",
        "url": "https://www.gov.uk/guidance/immigration-rules/immigration-rules-appendix-adoption",
        "scraped_at": "2025-12-06T17:26:08.444984"
      },
      "text": "### Validity requirements for the Adoption: Recognised Overseas Adoption route\n\nAD 13.1. A child applying for entry clearance on the Adoption: Recognised Overseas Adoption route must apply online on the gov.uk website on the specified form: ‘Non-British adopted child or child coming to the UK for adoption of a parent or parents who are British citizens or settled in the UK’.\n\n1.   AD 13.2. An application for entry clearance on the Adoption: Recognised Overseas Adoption route must meet all the following requirements: \n    1.   (a) any fee and Immigration Health Charge must have been paid; and\n    2.   (b) the applicant must have provided biometrics when required; and\n    3.   (c) the applicant must have provided a passport or other document which satisfactorily establishes their identity and nationality.\n\nAD 13.3. An application which does not meet all the validity requirements for the Adoption: Recognised Overseas Adoption route may be rejected as invalid and not considered.",
      "summary": "This provision applies to children applying for entry clearance via the Recognised Overseas Adoption route. Applicants must submit an online application, pay applicable fees and health surcharges, provide biometrics, and establish identity and nationality; failure to meet these requirements may result in rejection.",
      "augmented_text": "Document: Immigration Rules Appendix Adoption\nPart: Immigration Rules Appendix Adoption\nSection ID: AD 13.1\nSection: Validity requirements for the Adoption: Recognised Overseas Adoption route\nTopic: leave-to-enter\n\nSummary: This provision applies to children applying for entry clearance via the Recognised Overseas Adoption route. Applicants must submit an online application, pay applicable fees and health surcharges, provide biometrics, and establish identity and nationality; failure to meet these requirements may result in rejection.\n\n### Validity requirements for the Adoption: Recognised Overseas Adoption route\n\nAD 13.1. A child applying for entry clearance on the Adoption: Recognised Overseas Adoption route must apply online on the gov.uk website on the specified form: ‘Non-British adopted child or child coming to the UK for adoption of a parent or parents who are British citizens or settled in the UK’.\n\n1.   AD 13.2. An application for entry clearance on the Adoption: Recognised Overseas Adoption route must meet all the following requirements: \n    1.   (a) any fee and Immigration Health Charge must have been paid; and\n    2.   (b) the applicant must have provided biometrics when required; and\n    3.   (c) the applicant must have provided a passport or other document which satisfactorily establishes their identity and nationality.\n\nAD 13.3. An application which does not meet all the validity requirements for the Adoption: Recognised Overseas Adoption route may be rejected as invalid and not considered.",
      "needs_review": false
    },
    {
      "metadata": {
        "source": "Immigration Rules Appendix Adoption",
        "part": "Immigration Rules Appendix Adoption",
        "section_id": "AD 14.1",
        "section_title": "Suitability requirement for the Adoption: Recognised Overseas Adoption route",
        "parent_section": "AD 14",
        "hierarchy_level": 2,
        "topic": "suitability",
        "url": "https://www.gov.uk/guidance/immigration-rules/immigration-rules-appendix-adoption",
        "scraped_at": "2025-12-06T17:26:08.445010"
      },
      "text": "### Suitability requirement for the Adoption: Recognised Overseas Adoption route\n\nAD 14.1. The applicant must not fall for refusal under Part Suitability.",
      "summary": "Applicants seeking recognition under the Overseas Adoption route must meet suitability requirements, ensuring they are not disqualified under Part Suitability. They must satisfy all relevant criteria; failure to do so may lead to refusal.",
      "augmented_text": "Document: Immigration Rules Appendix Adoption\nPart: Immigration Rules Appendix Adoption\nSection ID: AD 14.1\nSection: Suitability requirement for the Adoption: Recognised Overseas Adoption route\nTopic: suitability\n\nSummary: Applicants seeking recognition under the Overseas Adoption route must meet suitability requirements, ensuring they are not disqualified under Part Suitability. They must satisfy all relevant criteria; failure to do so may lead to refusal.\n\n### Suitability requirement for the Adoption: Recognised Overseas Adoption route\n\nAD 14.1. The applicant must not fall for refusal under Part Suitability.",
      "needs_review": false
    },
    {
      "metadata": {
        "source": "Immigration Rules Appendix Adoption",
        "part": "Immigration Rules Appendix Adoption",
        "section_id": "Eligibility requirements for the Adoption: Recognised Overseas Adoption route",
        "section_title": "Eligibility requirements for the Adoption: Recognised Overseas Adoption route",
        "parent_section": null,
        "hierarchy_level": 3,
        "topic": "eligibility",
        "url": "https://www.gov.uk/guidance/immigration-rules/immigration-rules-appendix-adoption",
        "scraped_at": "2025-12-06T17:26:08.445023"
      },
      "text": "### Eligibility requirements for the Adoption: Recognised Overseas Adoption route",
      "summary": "This provision applies to individuals seeking UK immigration via the Recognised Overseas Adoption route. It requires applicants to have a valid recognised overseas adoption, with key conditions including prior approval from relevant authorities and adherence to specific age, relationship, and procedural criteria; exceptions may apply based on country recognition status.",
      "augmented_text": "Document: Immigration Rules Appendix Adoption\nPart: Immigration Rules Appendix Adoption\nSection ID: Eligibility requirements for the Adoption: Recognised Overseas Adoption route\nSection: Eligibility requirements for the Adoption: Recognised Overseas Adoption route\nTopic: eligibility\n\nSummary: This provision applies to individuals seeking UK immigration via the Recognised Overseas Adoption route. It requires applicants to have a valid recognised overseas adoption, with key conditions including prior approval from relevant authorities and adherence to specific age, relationship, and procedural criteria; exceptions may apply based on country recognition status.\n\n### Eligibility requirements for the Adoption: Recognised Overseas Adoption route",
      "needs_review": false
    },
    {
      "metadata": {
        "source": "Immigration Rules Appendix Adoption",
        "part": "Immigration Rules Appendix Adoption",
        "section_id": "AD 15.1",
        "section_title": "Entry requirements for the Adoption: Recognised Overseas Adoption route",
        "parent_section": "AD 15",
        "hierarchy_level": 2,
        "topic": "leave-to-enter",
        "url": "https://www.gov.uk/guidance/immigration-rules/immigration-rules-appendix-adoption",
        "scraped_at": "2025-12-06T17:26:08.445055"
      },
      "text": "### Entry requirements for the Adoption: Recognised Overseas Adoption route\n\nAD 15.1. A child seeking to come to the UK on the Recognised Overseas Adoption route must apply for and obtain entry clearance on the Adoption: Overseas Adoption route before they arrive in the UK.\n\nAD 15.2. A child applying for entry clearance on the Recognised Overseas Adoption route must, if Appendix Tuberculosis applies, provide a valid medical certificate confirming they have undergone screening for active pulmonary tuberculosis and that this tuberculosis is not present in them.",
      "summary": "This provision applies to children seeking entry via the Recognised Overseas Adoption route. They must obtain entry clearance before arriving in the UK and, if applicable, provide a TB screening certificate. Entry is contingent on fulfilling these requirements and any relevant health checks.",
      "augmented_text": "Document: Immigration Rules Appendix Adoption\nPart: Immigration Rules Appendix Adoption\nSection ID: AD 15.1\nSection: Entry requirements for the Adoption: Recognised Overseas Adoption route\nTopic: leave-to-enter\n\nSummary: This provision applies to children seeking entry via the Recognised Overseas Adoption route. They must obtain entry clearance before arriving in the UK and, if applicable, provide a TB screening certificate. Entry is contingent on fulfilling these requirements and any relevant health checks.\n\n### Entry requirements for the Adoption: Recognised Overseas Adoption route\n\nAD 15.1. A child seeking to come to the UK on the Recognised Overseas Adoption route must apply for and obtain entry clearance on the Adoption: Overseas Adoption route before they arrive in the UK.\n\nAD 15.2. A child applying for entry clearance on the Recognised Overseas Adoption route must, if Appendix Tuberculosis applies, provide a valid medical certificate confirming they have undergone screening for active pulmonary tuberculosis and that this tuberculosis is not present in them.",
      "needs_review": false
    },
    {
      "metadata": {
        "source": "Immigration Rules Appendix Adoption",
        "part": "Immigration Rules Appendix Adoption",
        "section_id": "AD 16.1",
        "section_title": "Adoption recognition and legality",
        "parent_section": "AD 16",
        "hierarchy_level": 2,
        "topic": "eligibility",
        "url": "https://www.gov.uk/guidance/immigration-rules/immigration-rules-appendix-adoption",
        "scraped_at": "2025-12-06T17:26:08.445111"
      },
      "text": "### Adoption requirements for Adoption: Recognised Overseas Adoption route\n\nAD 16.1. The applicant must have been legally adopted in a country whose adoption orders are, or at the time of the applicant’s adoption were, recognised under UK law.\n\nAD 16.2. The overseas adoption must have been in accordance with a decision taken by the competent Central Authority, as set out in AD 16.4., or court in the child’s country of origin, or the country in which they are resident.\n\n1.   AD 16.3. The applicant must provide evidence from the relevant Central Authority to confirm a Certificate of Eligibility has been issued if the adoption engages the requirements in: \n    1.   (a) section 83 of the Adoption and Children Act 2002; or\n    2.   (b) articles 58ZA and 58ZB of the Adoption (Northern Ireland) Order 1987; or\n    3.   (c) section 58 of the Adoption and Children (Scotland) Act 2007.\n\nAD 16.4. For the purpose of this Appendix “Central Authority” depends on the country of habitual residence for the adoptive parent: for residents in England, the Central Authority for an adoption under the Hague Convention is the Department for Education and the Devolved Administrations in Wales, Scotland and Northern Ireland and the Isle of Man Government are Central Authorities in their respective regions.\n\nAD 16.5. If the requirements in AD 16.1. and AD 16.2. are not met, the adoption must have been recognised by order of the High Court in the UK.\n\nAD 16.6. The decision maker must be satisfied that the adoption is not one of convenience arranged to facilitate the admission of the child to the UK.",
      "summary": "Applicants must have been legally adopted abroad in a country whose adoption orders are recognized under UK law, or via a UK High Court recognition. They must provide evidence from the relevant Central Authority if the adoption involves certain Acts or Orders, with specific authorities depending on the country of residence.",
      "augmented_text": "Document: Immigration Rules Appendix Adoption\nPart: Immigration Rules Appendix Adoption\nSection ID: AD 16.1\nSection: Adoption recognition and legality\nTopic: eligibility\n\nSummary: Applicants must have been legally adopted abroad in a country whose adoption orders are recognized under UK law, or via a UK High Court recognition. They must provide evidence from the relevant Central Authority if the adoption involves certain Acts or Orders, with specific authorities depending on the country of residence.\n\n### Adoption requirements for Adoption: Recognised Overseas Adoption route\n\nAD 16.1. The applicant must have been legally adopted in a country whose adoption orders are, or at the time of the applicant’s adoption were, recognised under UK law.\n\nAD 16.2. The overseas adoption must have been in accordance with a decision taken by the competent Central Authority, as set out in AD 16.4., or court in the child’s country of origin, or the country in which they are resident.\n\n1.   AD 16.3. The applicant must provide evidence from the relevant Central Authority to confirm a Certificate of Eligibility has been issued if the adoption engages the requirements in: \n    1.   (a) section 83 of the Adoption and Children Act 2002; or\n    2.   (b) articles 58ZA and 58ZB of the Adoption (Northern Ireland) Order 1987; or\n    3.   (c) section 58 of the Adoption and Children (Scotland) Act 2007.\n\nAD 16.4. For the purpose of this Appendix “Central Authority” depends on the country of habitual residence for the adoptive parent: for residents in England, the Central Authority for an adoption under the Hague Convention is the Department for Education and the Devolved Administrations in Wales, Scotland and Northern Ireland and the Isle of Man Government are Central Authorities in their respective regions.\n\nAD 16.5. If the requirements in AD 16.1. and AD 16.2. are not met, the adoption must have been recognised by order of the High Court in the UK.\n\nAD 16.6. The decision maker must be satisfied that the adoption is not one of convenience arranged to facilitate the admission of the child to the UK.",
      "needs_review": false
    },
    {
      "metadata": {
        "source": "Immigration Rules Appendix Adoption",
        "part": "Immigration Rules Appendix Adoption",
        "section_id": "1",
        "section_title": "Dependent child requirements for the Adoption: Recognised Overseas Adoption route",
        "parent_section": null,
        "hierarchy_level": 1,
        "topic": "family",
        "url": "https://www.gov.uk/guidance/immigration-rules/immigration-rules-appendix-adoption",
        "scraped_at": "2025-12-06T17:26:08.445149"
      },
      "text": "### Dependent child requirements for the Adoption: Recognised Overseas Adoption route\n\n1.   AD 17.1. The applicant must meet the following requirements for a dependent child in Appendix Children: \n    1.   (a) age requirement; and\n    2.   (b) independent life requirement; and\n    3.   (c) care requirement.",
      "summary": "This provision applies to applicants seeking the Recognised Overseas Adoption route for dependent children. Applicants must meet age, independence, and care requirements as specified in Appendix Children. Critical conditions include adherence to these thresholds and requirements to qualify.",
      "augmented_text": "Document: Immigration Rules Appendix Adoption\nPart: Immigration Rules Appendix Adoption\nSection ID: 1\nSection: Dependent child requirements for the Adoption: Recognised Overseas Adoption route\nTopic: family\n\nSummary: This provision applies to applicants seeking the Recognised Overseas Adoption route for dependent children. Applicants must meet age, independence, and care requirements as specified in Appendix Children. Critical conditions include adherence to these thresholds and requirements to qualify.\n\n### Dependent child requirements for the Adoption: Recognised Overseas Adoption route\n\n1.   AD 17.1. The applicant must meet the following requirements for a dependent child in Appendix Children: \n    1.   (a) age requirement; and\n    2.   (b) independent life requirement; and\n    3.   (c) care requirement.",
      "needs_review": false
    },
    {
      "metadata": {
        "source": "Immigration Rules Appendix Adoption",
        "part": "Immigration Rules Appendix Adoption",
        "section_id": "1",
        "section_title": "Immigration status requirements of parents for the Adoption: Recognised Overseas Adoption route",
        "parent_section": null,
        "hierarchy_level": 1,
        "topic": "family",
        "url": "https://www.gov.uk/guidance/immigration-rules/immigration-rules-appendix-adoption",
        "scraped_at": "2025-12-06T17:26:08.445187"
      },
      "text": "### Immigration status requirements of parents for the Adoption: Recognised Overseas Adoption route\n\n1.   AD 18.1. The applicant must be joining or accompanying their adoptive parent(s) and one of the following must apply: \n    1.   (a) both adoptive parents are British Citizens, are settled in the UK, or live in the UK and have a right to stay without restriction; or\n    2.   (b) the adoptive parent has sole responsibility for the applicant and is a British Citizen, is settled in the UK or lives in the UK and has a right to stay without restriction; or\n    3.   (c) one adoptive parent is a British Citizen, or is settled in the UK, or lives in the UK and has a right to stay without restriction and the other adoptive parent has, or is applying for (and is granted), entry clearance or permission to stay on a route to settlement; or\n    4.   (d) the adoptive parent has sole parental responsibility, and is applying for (and is granted), entry clearance or permission on a route to settlement; or\n    5.   (e) one adoptive parent is a British Citizen, is settled, or lives in the UK and has a right to stay without restriction and the decision maker is satisfied there are serious and compelling reasons to grant the applicant entry clearance; or\n    6.   (f) one adoptive parent has, or is applying for (and is granted), entry clearance or permission to stay on a route to settlement and the decision maker is satisfied there are serious and compelling reasons to grant the applicant entry clearance.",
      "summary": "This provision applies to applicants joining or accompanying adoptive parents under the Recognised Overseas Adoption route. It requires that at least one adoptive parent meets UK residence or citizenship criteria, with specific conditions for sole responsibility, parental rights, or compelling reasons for entry clearance, provided thresholds and permissions are satisfied.",
      "augmented_text": "Document: Immigration Rules Appendix Adoption\nPart: Immigration Rules Appendix Adoption\nSection ID: 1\nSection: Immigration status requirements of parents for the Adoption: Recognised Overseas Adoption route\nTopic: family\n\nSummary: This provision applies to applicants joining or accompanying adoptive parents under the Recognised Overseas Adoption route. It requires that at least one adoptive parent meets UK residence or citizenship criteria, with specific conditions for sole responsibility, parental rights, or compelling reasons for entry clearance, provided thresholds and permissions are satisfied.\n\n### Immigration status requirements of parents for the Adoption: Recognised Overseas Adoption route\n\n1.   AD 18.1. The applicant must be joining or accompanying their adoptive parent(s) and one of the following must apply: \n    1.   (a) both adoptive parents are British Citizens, are settled in the UK, or live in the UK and have a right to stay without restriction; or\n    2.   (b) the adoptive parent has sole responsibility for the applicant and is a British Citizen, is settled in the UK or lives in the UK and has a right to stay without restriction; or\n    3.   (c) one adoptive parent is a British Citizen, or is settled in the UK, or lives in the UK and has a right to stay without restriction and the other adoptive parent has, or is applying for (and is granted), entry clearance or permission to stay on a route to settlement; or\n    4.   (d) the adoptive parent has sole parental responsibility, and is applying for (and is granted), entry clearance or permission on a route to settlement; or\n    5.   (e) one adoptive parent is a British Citizen, is settled, or lives in the UK and has a right to stay without restriction and the decision maker is satisfied there are serious and compelling reasons to grant the applicant entry clearance; or\n    6.   (f) one adoptive parent has, or is applying for (and is granted), entry clearance or permission to stay on a route to settlement and the decision maker is satisfied there are serious and compelling reasons to grant the applicant entry clearance.",
      "needs_review": false
    },
    {
      "metadata": {
        "source": "Immigration Rules Appendix Adoption",
        "part": "Immigration Rules Appendix Adoption",
        "section_id": "AD 19.1",
        "section_title": "Financial requirements for the Adoption: Recognised Overseas Adoption route",
        "parent_section": "AD 19",
        "hierarchy_level": 2,
        "topic": "financial",
        "url": "https://www.gov.uk/guidance/immigration-rules/immigration-rules-appendix-adoption",
        "scraped_at": "2025-12-06T17:26:08.445210"
      },
      "text": "### Financial requirements for the Adoption: Recognised Overseas Adoption route\n\nAD 19.1. The applicant must show that they will be adequately maintained in the UK by their adoptive parent(s) without access to public funds, unless AD 19.2. applies.\n\nAD 19.2. Where the adoptive parent(s) of the applicant has, or is applying for (and is granted), entry clearance or permission to stay on a route to settlement, the applicant must meet the financial requirement for a dependent child under that route.\n\n1.   AD 19.3. The applicant must provide evidence from the adoptive parent(s) of income or cash savings sufficient to show the financial requirement is met, and: \n    1.   (a) evidence from income (other than self-employment) or savings must cover the 6-month period immediately before the date of application; or\n    2.   (b) where the sponsor is receiving maternity, paternity, adoption or sick pay, their income from salaried employment can be shown for either the 6 months immediately before the date of application or the start date of the maternity, paternity, adoption or sick leave; or\n    3.   (c) where the income is from self-employment it must be shown for the last full financial year before the date of application, with additional evidence of ongoing self-employment as in paragraphs 7 or 9 (as relevant) of Appendix FM-SE; or\n    4.   (d) where there is non-employment income it must be shown to have been received in the 12 months before the date of application except where specified in paragraph 10 of Appendix FM-SE; or\n    5.   (e) where property has been sold and the money received has been converted into cash savings the requirements in paragraph 11A(d) of Appendix FM-SE must be met.\n\nAD 19.4. The applicant must show they meet the financial requirement as set out in Appendix FM-SE.",
      "summary": "Applicants for the Recognised Overseas Adoption route must demonstrate they will be maintained in the UK without public funds, unless linked to a route to settlement. They must provide evidence of sufficient income or savings, covering specific periods based on income type (e.g., six months for employment income, one year for non-employment income), with exceptions for certain income sources like maternity or sick pay.",
      "augmented_text": "Document: Immigration Rules Appendix Adoption\nPart: Immigration Rules Appendix Adoption\nSection ID: AD 19.1\nSection: Financial requirements for the Adoption: Recognised Overseas Adoption route\nTopic: financial\n\nSummary: Applicants for the Recognised Overseas Adoption route must demonstrate they will be maintained in the UK without public funds, unless linked to a route to settlement. They must provide evidence of sufficient income or savings, covering specific periods based on income type (e.g., six months for employment income, one year for non-employment income), with exceptions for certain income sources like maternity or sick pay.\n\n### Financial requirements for the Adoption: Recognised Overseas Adoption route\n\nAD 19.1. The applicant must show that they will be adequately maintained in the UK by their adoptive parent(s) without access to public funds, unless AD 19.2. applies.\n\nAD 19.2. Where the adoptive parent(s) of the applicant has, or is applying for (and is granted), entry clearance or permission to stay on a route to settlement, the applicant must meet the financial requirement for a dependent child under that route.\n\n1.   AD 19.3. The applicant must provide evidence from the adoptive parent(s) of income or cash savings sufficient to show the financial requirement is met, and: \n    1.   (a) evidence from income (other than self-employment) or savings must cover the 6-month period immediately before the date of application; or\n    2.   (b) where the sponsor is receiving maternity, paternity, adoption or sick pay, their income from salaried employment can be shown for either the 6 months immediately before the date of application or the start date of the maternity, paternity, adoption or sick leave; or\n    3.   (c) where the income is from self-employment it must be shown for the last full financial year before the date of application, with additional evidence of ongoing self-employment as in paragraphs 7 or 9 (as relevant) of Appendix FM-SE; or\n    4.   (d) where there is non-employment income it must be shown to have been received in the 12 months before the date of application except where specified in paragraph 10 of Appendix FM-SE; or\n    5.   (e) where property has been sold and the money received has been converted into cash savings the requirements in paragraph 11A(d) of Appendix FM-SE must be met.\n\nAD 19.4. The applicant must show they meet the financial requirement as set out in Appendix FM-SE.",
      "needs_review": false
    },
    {
      "metadata": {
        "source": "Immigration Rules Appendix Adoption",
        "part": "Immigration Rules Appendix Adoption",
        "section_id": "AD 20.1",
        "section_title": "Accommodation requirement for the Adoption: Recognised Overseas Adoption route",
        "parent_section": "AD 20",
        "hierarchy_level": 2,
        "topic": "accommodation",
        "url": "https://www.gov.uk/guidance/immigration-rules/immigration-rules-appendix-adoption",
        "scraped_at": "2025-12-06T17:26:08.445237"
      },
      "text": "### Accommodation requirement for the Adoption: Recognised Overseas Adoption route\n\nAD 20.1. The applicant’s accommodation in the UK must not be overcrowded or contravene public health regulations.",
      "summary": "Applicants under the Recognised Overseas Adoption route must have UK accommodation that is not overcrowded and complies with public health regulations.",
      "augmented_text": "Document: Immigration Rules Appendix Adoption\nPart: Immigration Rules Appendix Adoption\nSection ID: AD 20.1\nSection: Accommodation requirement for the Adoption: Recognised Overseas Adoption route\nTopic: accommodation\n\nSummary: Applicants under the Recognised Overseas Adoption route must have UK accommodation that is not overcrowded and complies with public health regulations.\n\n### Accommodation requirement for the Adoption: Recognised Overseas Adoption route\n\nAD 20.1. The applicant’s accommodation in the UK must not be overcrowded or contravene public health regulations.",
      "needs_review": false
    },
    {
      "metadata": {
        "source": "Immigration Rules Appendix Adoption",
        "part": "Immigration Rules Appendix Adoption",
        "section_id": "AD 21.1",
        "section_title": "Eligibility under Article 8 of the Human Rights Convention for the Adoption: Recognised Overseas Adoption route",
        "parent_section": "AD 21",
        "hierarchy_level": 2,
        "topic": "eligibility",
        "url": "https://www.gov.uk/guidance/immigration-rules/immigration-rules-appendix-adoption",
        "scraped_at": "2025-12-06T17:26:08.445263"
      },
      "text": "### Eligibility under Article 8 of the Human Rights Convention for the Adoption: Recognised Overseas Adoption route\n\nAD 21.1. If the applicant meets the Requirements for Adoption, but does not meet the suitability or other eligibility requirements (subject to AD 21.2.), the decision maker must be satisfied that refusal of the application would breach Article 8 of the Human Rights Convention, because it would result in unjustifiably harsh consequences for the applicant or their adoptive family.\n\nAD 21.2. Where AD 21.1. applies and the applicant falls for refusal under SUI 2.1., SUI 2.3., SUI 3.1., SUI 4.1., SUI 5.1. of Part Suitability of these rules the application on the Adoption: Recognised Overseas Adoption route, must be refused.",
      "summary": "This provision applies to applicants seeking recognition under the Recognised Overseas Adoption route. If they meet adoption requirements but lack suitability or other eligibility factors, a refusal must be reconsidered if it would violate Article 8 rights, unless specific suitability conditions apply, leading to automatic refusal.",
      "augmented_text": "Document: Immigration Rules Appendix Adoption\nPart: Immigration Rules Appendix Adoption\nSection ID: AD 21.1\nSection: Eligibility under Article 8 of the Human Rights Convention for the Adoption: Recognised Overseas Adoption route\nTopic: eligibility\n\nSummary: This provision applies to applicants seeking recognition under the Recognised Overseas Adoption route. If they meet adoption requirements but lack suitability or other eligibility factors, a refusal must be reconsidered if it would violate Article 8 rights, unless specific suitability conditions apply, leading to automatic refusal.\n\n### Eligibility under Article 8 of the Human Rights Convention for the Adoption: Recognised Overseas Adoption route\n\nAD 21.1. If the applicant meets the Requirements for Adoption, but does not meet the suitability or other eligibility requirements (subject to AD 21.2.), the decision maker must be satisfied that refusal of the application would breach Article 8 of the Human Rights Convention, because it would result in unjustifiably harsh consequences for the applicant or their adoptive family.\n\nAD 21.2. Where AD 21.1. applies and the applicant falls for refusal under SUI 2.1., SUI 2.3., SUI 3.1., SUI 4.1., SUI 5.1. of Part Suitability of these rules the application on the Adoption: Recognised Overseas Adoption route, must be refused.",
      "needs_review": false
    },
    {
      "metadata": {
        "source": "Immigration Rules Appendix Adoption",
        "part": "Immigration Rules Appendix Adoption",
        "section_id": "AD 22.1",
        "section_title": "Decision on an application on the Adoption: Recognised Overseas Adoption route",
        "parent_section": "AD 22",
        "hierarchy_level": 2,
        "topic": "eligibility",
        "url": "https://www.gov.uk/guidance/immigration-rules/immigration-rules-appendix-adoption",
        "scraped_at": "2025-12-06T17:26:08.445282"
      },
      "text": "### Decision on an application on the Adoption: Recognised Overseas Adoption route\n\nAD 22.1. If the decision maker is satisfied that the validity, suitability and the relevant eligibility requirements are met, or the applicant meets the eligibility requirements at AD16.1. to AD 16.6 and AD21.1. (unless paragraph AD 21.2. applies), the applicant will be granted permission to stay on the Adoption: Recognised Overseas Adoption route, otherwise the application will be refused.",
      "summary": "Applicants seeking recognition of an overseas adoption must satisfy validity, suitability, and eligibility criteria outlined in AD16.1-AD16.6 and AD21.1 (excluding AD21.2). If these are met, permission is granted; otherwise, the application is refused.",
      "augmented_text": "Document: Immigration Rules Appendix Adoption\nPart: Immigration Rules Appendix Adoption\nSection ID: AD 22.1\nSection: Decision on an application on the Adoption: Recognised Overseas Adoption route\nTopic: eligibility\n\nSummary: Applicants seeking recognition of an overseas adoption must satisfy validity, suitability, and eligibility criteria outlined in AD16.1-AD16.6 and AD21.1 (excluding AD21.2). If these are met, permission is granted; otherwise, the application is refused.\n\n### Decision on an application on the Adoption: Recognised Overseas Adoption route\n\nAD 22.1. If the decision maker is satisfied that the validity, suitability and the relevant eligibility requirements are met, or the applicant meets the eligibility requirements at AD16.1. to AD 16.6 and AD21.1. (unless paragraph AD 21.2. applies), the applicant will be granted permission to stay on the Adoption: Recognised Overseas Adoption route, otherwise the application will be refused.",
      "needs_review": false
    },
    {
      "metadata": {
        "source": "Immigration Rules Appendix Adoption",
        "part": "Immigration Rules Appendix Adoption",
        "section_id": "1",
        "section_title": "Period of grant on the Adoption: Recognised Overseas Adoption route",
        "parent_section": null,
        "hierarchy_level": 1,
        "topic": "settlement",
        "url": "https://www.gov.uk/guidance/immigration-rules/immigration-rules-appendix-adoption",
        "scraped_at": "2025-12-06T17:26:08.445314"
      },
      "text": "### Period of grant on the Adoption: Recognised Overseas Adoption route\n\n1.   AD 23.1. The applicant will be granted settlement, if either: \n    1.   (a) both adoptive parents are a British Citizen, settled or live in the UK and have a right to stay without restriction; or\n    2.   (b) in the case of sole parental responsibility, the adoptive parent is a British Citizen, settled or lives in the UK and has a right to stay without restriction,\n\nAD 23.2. If the adoptive parent(s) is not a British Citizen, settled or living in the UK with a right to stay without restriction, the applicant will be granted permission which ends on the same date as the permission granted to their adoptive parent(s).",
      "summary": "This provision applies to applicants under the Recognised Overseas Adoption route. They must have adoptive parents who are either UK citizens, settled, or have indefinite leave to stay; if not, their permission ends with that of the adoptive parent(s).",
      "augmented_text": "Document: Immigration Rules Appendix Adoption\nPart: Immigration Rules Appendix Adoption\nSection ID: 1\nSection: Period of grant on the Adoption: Recognised Overseas Adoption route\nTopic: settlement\n\nSummary: This provision applies to applicants under the Recognised Overseas Adoption route. They must have adoptive parents who are either UK citizens, settled, or have indefinite leave to stay; if not, their permission ends with that of the adoptive parent(s).\n\n### Period of grant on the Adoption: Recognised Overseas Adoption route\n\n1.   AD 23.1. The applicant will be granted settlement, if either: \n    1.   (a) both adoptive parents are a British Citizen, settled or live in the UK and have a right to stay without restriction; or\n    2.   (b) in the case of sole parental responsibility, the adoptive parent is a British Citizen, settled or lives in the UK and has a right to stay without restriction,\n\nAD 23.2. If the adoptive parent(s) is not a British Citizen, settled or living in the UK with a right to stay without restriction, the applicant will be granted permission which ends on the same date as the permission granted to their adoptive parent(s).",
      "needs_review": false
    },
    {
      "metadata": {
        "source": "Immigration Rules Appendix Adoption",
        "part": "Immigration Rules Appendix Adoption",
        "section_id": "1",
        "section_title": "Conditions of grant on the Adoption: Recognised Overseas Adoption route",
        "parent_section": null,
        "hierarchy_level": 1,
        "topic": "financial",
        "url": "https://www.gov.uk/guidance/immigration-rules/immigration-rules-appendix-adoption",
        "scraped_at": "2025-12-06T17:26:08.445336"
      },
      "text": "### Conditions of grant on the Adoption: Recognised Overseas Adoption route\n\n1.   AD 24.1. The grant will be subject to the following conditions: \n    1.   (a) work is permitted: and\n    2.   (b) study is permitted; and\n    3.   (c) no access to public funds.",
      "summary": "This provision applies to applicants granted leave via the Recognised Overseas Adoption route. It stipulates that the grant allows work and study rights but prohibits access to public funds, subject to these conditions.",
      "augmented_text": "Document: Immigration Rules Appendix Adoption\nPart: Immigration Rules Appendix Adoption\nSection ID: 1\nSection: Conditions of grant on the Adoption: Recognised Overseas Adoption route\nTopic: financial\n\nSummary: This provision applies to applicants granted leave via the Recognised Overseas Adoption route. It stipulates that the grant allows work and study rights but prohibits access to public funds, subject to these conditions.\n\n### Conditions of grant on the Adoption: Recognised Overseas Adoption route\n\n1.   AD 24.1. The grant will be subject to the following conditions: \n    1.   (a) work is permitted: and\n    2.   (b) study is permitted; and\n    3.   (c) no access to public funds.",
      "needs_review": false
    },
    {
      "metadata": {
        "source": "Immigration Rules Appendix Adoption",
        "part": "Immigration Rules Appendix Adoption",
        "section_id": "De Facto Adoption",
        "section_title": "De Facto Adoption",
        "parent_section": null,
        "hierarchy_level": 2,
        "topic": "family",
        "url": "https://www.gov.uk/guidance/immigration-rules/immigration-rules-appendix-adoption",
        "scraped_at": "2025-12-06T17:26:08.445361"
      },
      "text": "### De Facto Adoption",
      "summary": "This provision applies to individuals engaged in de facto adoption within the UK immigration context. It requires evidence of a genuine, long-term parental relationship akin to formal adoption, with specific thresholds for duration and conduct. Exceptions or additional criteria are not specified in this excerpt.",
      "augmented_text": "Document: Immigration Rules Appendix Adoption\nPart: Immigration Rules Appendix Adoption\nSection ID: De Facto Adoption\nSection: De Facto Adoption\nTopic: family\n\nSummary: This provision applies to individuals engaged in de facto adoption within the UK immigration context. It requires evidence of a genuine, long-term parental relationship akin to formal adoption, with specific thresholds for duration and conduct. Exceptions or additional criteria are not specified in this excerpt.\n\n### De Facto Adoption",
      "needs_review": false
    },
    {
      "metadata": {
        "source": "Immigration Rules Appendix Adoption",
        "part": "Immigration Rules Appendix Adoption",
        "section_id": "Entry clearance for the Adoption: De Facto route",
        "section_title": "Entry clearance for the Adoption: De Facto route",
        "parent_section": null,
        "hierarchy_level": 3,
        "topic": "leave-to-enter",
        "url": "https://www.gov.uk/guidance/immigration-rules/immigration-rules-appendix-adoption",
        "scraped_at": "2025-12-06T17:26:08.445382"
      },
      "text": "### Entry clearance for the Adoption: De Facto route",
      "summary": "This provision applies to applicants seeking entry clearance for adoption via the De Facto route. It requires applicants to meet specific criteria demonstrating genuine intention to adopt and satisfy relevant UK immigration requirements. Critical conditions include proof of ongoing legal adoption proceedings and adherence to eligibility thresholds.",
      "augmented_text": "Document: Immigration Rules Appendix Adoption\nPart: Immigration Rules Appendix Adoption\nSection ID: Entry clearance for the Adoption: De Facto route\nSection: Entry clearance for the Adoption: De Facto route\nTopic: leave-to-enter\n\nSummary: This provision applies to applicants seeking entry clearance for adoption via the De Facto route. It requires applicants to meet specific criteria demonstrating genuine intention to adopt and satisfy relevant UK immigration requirements. Critical conditions include proof of ongoing legal adoption proceedings and adherence to eligibility thresholds.\n\n### Entry clearance for the Adoption: De Facto route",
      "needs_review": false
    },
    {
      "metadata": {
        "source": "Immigration Rules Appendix Adoption",
        "part": "Immigration Rules Appendix Adoption",
        "section_id": "AD 25.1",
        "section_title": "Validity requirements for Adoption: De Facto route",
        "parent_section": "AD 25",
        "hierarchy_level": 2,
        "topic": "leave-to-enter",
        "url": "https://www.gov.uk/guidance/immigration-rules/immigration-rules-appendix-adoption",
        "scraped_at": "2025-12-06T17:26:08.445419"
      },
      "text": "### Validity requirements for Adoption: De Facto route\n\nAD 25.1. A child applying for entry clearance on the Adoption: de facto route must apply online on the gov.uk website on the specified form ‘Non-British adopted child or child coming to the UK for adoption of a parent or parents who are British citizens or settled in the UK’.\n\n1.   AD 25.2. An application for entry clearance on the Adoption: de facto route must meet all the following requirements: \n    1.   (a) any fee and the Immigration Health Charge must have been paid; and\n    2.   (b) the applicant must have provided biometrics when required; and\n    3.   (c) the applicant must have provided a passport or other document which satisfactorily establishes their identity and nationality.\n\nAD 25.3. An application which does not meet all the validity requirements for the Adoption: de facto route may be rejected as invalid and not considered.",
      "summary": "This provision applies to children applying for entry clearance via the Adoption: de facto route. The key requirements include submitting a valid online application, paying fees and the Immigration Health Charge, providing biometrics, and establishing identity and nationality. Applications failing these criteria may be rejected as invalid.",
      "augmented_text": "Document: Immigration Rules Appendix Adoption\nPart: Immigration Rules Appendix Adoption\nSection ID: AD 25.1\nSection: Validity requirements for Adoption: De Facto route\nTopic: leave-to-enter\n\nSummary: This provision applies to children applying for entry clearance via the Adoption: de facto route. The key requirements include submitting a valid online application, paying fees and the Immigration Health Charge, providing biometrics, and establishing identity and nationality. Applications failing these criteria may be rejected as invalid.\n\n### Validity requirements for Adoption: De Facto route\n\nAD 25.1. A child applying for entry clearance on the Adoption: de facto route must apply online on the gov.uk website on the specified form ‘Non-British adopted child or child coming to the UK for adoption of a parent or parents who are British citizens or settled in the UK’.\n\n1.   AD 25.2. An application for entry clearance on the Adoption: de facto route must meet all the following requirements: \n    1.   (a) any fee and the Immigration Health Charge must have been paid; and\n    2.   (b) the applicant must have provided biometrics when required; and\n    3.   (c) the applicant must have provided a passport or other document which satisfactorily establishes their identity and nationality.\n\nAD 25.3. An application which does not meet all the validity requirements for the Adoption: de facto route may be rejected as invalid and not considered.",
      "needs_review": false
    },
    {
      "metadata": {
        "source": "Immigration Rules Appendix Adoption",
        "part": "Immigration Rules Appendix Adoption",
        "section_id": "AD 26.1",
        "section_title": "Suitability requirement for the Adoption: De Facto route",
        "parent_section": "AD 26",
        "hierarchy_level": 2,
        "topic": "suitability",
        "url": "https://www.gov.uk/guidance/immigration-rules/immigration-rules-appendix-adoption",
        "scraped_at": "2025-12-06T17:26:08.445444"
      },
      "text": "### Suitability requirement for the Adoption: De Facto route\n\nAD 26.1. The applicant must not fall for refusal under Part Suitability.",
      "summary": "Applicants using the De Facto adoption route must meet suitability requirements, ensuring they do not fall foul of refusal under Part Suitability. No specific exceptions are noted, but adherence to general suitability standards is mandatory.",
      "augmented_text": "Document: Immigration Rules Appendix Adoption\nPart: Immigration Rules Appendix Adoption\nSection ID: AD 26.1\nSection: Suitability requirement for the Adoption: De Facto route\nTopic: suitability\n\nSummary: Applicants using the De Facto adoption route must meet suitability requirements, ensuring they do not fall foul of refusal under Part Suitability. No specific exceptions are noted, but adherence to general suitability standards is mandatory.\n\n### Suitability requirement for the Adoption: De Facto route\n\nAD 26.1. The applicant must not fall for refusal under Part Suitability.",
      "needs_review": false
    },
    {
      "metadata": {
        "source": "Immigration Rules Appendix Adoption",
        "part": "Immigration Rules Appendix Adoption",
        "section_id": "Eligibility requirements for the Adoption: De Facto route",
        "section_title": "Eligibility requirements for the Adoption: De Facto route",
        "parent_section": null,
        "hierarchy_level": 3,
        "topic": "eligibility",
        "url": "https://www.gov.uk/guidance/immigration-rules/immigration-rules-appendix-adoption",
        "scraped_at": "2025-12-06T17:26:08.445457"
      },
      "text": "### Eligibility requirements for the Adoption: De Facto route",
      "summary": "This provision applies to individuals seeking to adopt via the De Facto route. Applicants must demonstrate a genuine and lasting de facto relationship with the child, meeting specific eligibility criteria, with no significant exceptions noted.",
      "augmented_text": "Document: Immigration Rules Appendix Adoption\nPart: Immigration Rules Appendix Adoption\nSection ID: Eligibility requirements for the Adoption: De Facto route\nSection: Eligibility requirements for the Adoption: De Facto route\nTopic: eligibility\n\nSummary: This provision applies to individuals seeking to adopt via the De Facto route. Applicants must demonstrate a genuine and lasting de facto relationship with the child, meeting specific eligibility criteria, with no significant exceptions noted.\n\n### Eligibility requirements for the Adoption: De Facto route",
      "needs_review": false
    },
    {
      "metadata": {
        "source": "Immigration Rules Appendix Adoption",
        "part": "Immigration Rules Appendix Adoption",
        "section_id": "AD 27.1",
        "section_title": "Entry requirements for the Adoption: De Facto route",
        "parent_section": "AD 27",
        "hierarchy_level": 2,
        "topic": "leave-to-enter",
        "url": "https://www.gov.uk/guidance/immigration-rules/immigration-rules-appendix-adoption",
        "scraped_at": "2025-12-06T17:26:08.445488"
      },
      "text": "### Entry requirements for the Adoption: De Facto route\n\nAD 27.1. A child seeking to come to the UK under the Adoption: De Facto route must apply for and obtain entry clearance on the Adoption: de facto route before they arrive in the UK.\n\nAD 27.2. A person applying for entry clearance on the Adoption: De Facto route must, if Appendix Tuberculosis applies, provide a valid medical certificate confirming they have undergone screening for active pulmonary tuberculosis and that this tuberculosis is not present in them.",
      "summary": "This provision applies to children seeking entry to the UK under the Adoption: De Facto route. Applicants must obtain entry clearance before arrival and, if applicable under Appendix Tuberculosis, provide medical evidence of tuberculosis screening. The rules specify prior clearance and health requirements as conditions for entry.",
      "augmented_text": "Document: Immigration Rules Appendix Adoption\nPart: Immigration Rules Appendix Adoption\nSection ID: AD 27.1\nSection: Entry requirements for the Adoption: De Facto route\nTopic: leave-to-enter\n\nSummary: This provision applies to children seeking entry to the UK under the Adoption: De Facto route. Applicants must obtain entry clearance before arrival and, if applicable under Appendix Tuberculosis, provide medical evidence of tuberculosis screening. The rules specify prior clearance and health requirements as conditions for entry.\n\n### Entry requirements for the Adoption: De Facto route\n\nAD 27.1. A child seeking to come to the UK under the Adoption: De Facto route must apply for and obtain entry clearance on the Adoption: de facto route before they arrive in the UK.\n\nAD 27.2. A person applying for entry clearance on the Adoption: De Facto route must, if Appendix Tuberculosis applies, provide a valid medical certificate confirming they have undergone screening for active pulmonary tuberculosis and that this tuberculosis is not present in them.",
      "needs_review": false
    },
    {
      "metadata": {
        "source": "Immigration Rules Appendix Adoption",
        "part": "Immigration Rules Appendix Adoption",
        "section_id": "1",
        "section_title": "Adoption requirements for the Adoption: De Facto route",
        "parent_section": null,
        "hierarchy_level": 1,
        "topic": "family",
        "url": "https://www.gov.uk/guidance/immigration-rules/immigration-rules-appendix-adoption",
        "scraped_at": "2025-12-06T17:26:08.445527"
      },
      "text": "### Adoption requirements for the Adoption: De Facto route\n\n1.   AD 28.1. At the date of application, the adoptive parents must both have: \n    1.   (a) been resident together overseas for at least 18 months; and\n    2.   (b) lived with the applicant for the 12 months immediately before the date of application; and\n    3.   (c) assumed the role of the applicant’s parent(s) since the beginning of the 18- month period, so that there has been a genuine transfer of parental responsibility.\n\n1.   AD 28.2. Where the adoptive parent has sole responsibility, at the date of application they must have: \n    1.   (a) been resident overseas for at least 18 months; and\n    2.   (b) lived with the applicant for the 12 months immediately before the date of application; and\n    3.   (c) assumed the role of the applicant’s parent since the beginning of the 18-month period, so that there has been a genuine transfer of parental responsibility.\n\n1.   AD 28.3. The applicant must provide evidence that: \n    1.   (a) the de facto adoption is not one of convenience arranged to facilitate the applicant’s admission to the UK; and\n    2.   (b) they will have the same rights and obligations as any other child of the de facto adoptive parent(s)’s family; and\n    3.   (c) the birth parent(s) or those looking after the applicant immediately before they were physically transferred to the care of their de facto adoptive parent(s) are unable to care for the applicant; and\n    4.   (d) the applicant has broken or lost ties with their biological family.",
      "summary": "This provision applies to applicants seeking the Adoption: De Facto route. They must demonstrate that adoptive parents have resided together overseas for 18 months, lived with the applicant for 12 months prior, and assumed parental responsibility continuously, with evidence that the adoption is genuine and not for convenience, and that prior guardians cannot care for the applicant.",
      "augmented_text": "Document: Immigration Rules Appendix Adoption\nPart: Immigration Rules Appendix Adoption\nSection ID: 1\nSection: Adoption requirements for the Adoption: De Facto route\nTopic: family\n\nSummary: This provision applies to applicants seeking the Adoption: De Facto route. They must demonstrate that adoptive parents have resided together overseas for 18 months, lived with the applicant for 12 months prior, and assumed parental responsibility continuously, with evidence that the adoption is genuine and not for convenience, and that prior guardians cannot care for the applicant.\n\n### Adoption requirements for the Adoption: De Facto route\n\n1.   AD 28.1. At the date of application, the adoptive parents must both have: \n    1.   (a) been resident together overseas for at least 18 months; and\n    2.   (b) lived with the applicant for the 12 months immediately before the date of application; and\n    3.   (c) assumed the role of the applicant’s parent(s) since the beginning of the 18- month period, so that there has been a genuine transfer of parental responsibility.\n\n1.   AD 28.2. Where the adoptive parent has sole responsibility, at the date of application they must have: \n    1.   (a) been resident overseas for at least 18 months; and\n    2.   (b) lived with the applicant for the 12 months immediately before the date of application; and\n    3.   (c) assumed the role of the applicant’s parent since the beginning of the 18-month period, so that there has been a genuine transfer of parental responsibility.\n\n1.   AD 28.3. The applicant must provide evidence that: \n    1.   (a) the de facto adoption is not one of convenience arranged to facilitate the applicant’s admission to the UK; and\n    2.   (b) they will have the same rights and obligations as any other child of the de facto adoptive parent(s)’s family; and\n    3.   (c) the birth parent(s) or those looking after the applicant immediately before they were physically transferred to the care of their de facto adoptive parent(s) are unable to care for the applicant; and\n    4.   (d) the applicant has broken or lost ties with their biological family.",
      "needs_review": false
    },
    {
      "metadata": {
        "source": "Immigration Rules Appendix Adoption",
        "part": "Immigration Rules Appendix Adoption",
        "section_id": "1",
        "section_title": "Dependent child requirements for the Adoption: De Facto route",
        "parent_section": null,
        "hierarchy_level": 1,
        "topic": "family",
        "url": "https://www.gov.uk/guidance/immigration-rules/immigration-rules-appendix-adoption",
        "scraped_at": "2025-12-06T17:26:08.445561"
      },
      "text": "### Dependent child requirements for the Adoption: De Facto route\n\n1.   AD 29.1. The applicant must meet the following requirements for a dependent child in Appendix Children: \n    1.   (a) age requirement; and\n    2.   (b) independent life requirement; and\n    3.   (c) care requirement.",
      "summary": "This provision applies to applicants seeking adoption via the De Facto route. They must meet specific dependent child criteria from Appendix Children, including age, independence, and care requirements. Conditions include adherence to these criteria; no explicit exceptions are detailed.",
      "augmented_text": "Document: Immigration Rules Appendix Adoption\nPart: Immigration Rules Appendix Adoption\nSection ID: 1\nSection: Dependent child requirements for the Adoption: De Facto route\nTopic: family\n\nSummary: This provision applies to applicants seeking adoption via the De Facto route. They must meet specific dependent child criteria from Appendix Children, including age, independence, and care requirements. Conditions include adherence to these criteria; no explicit exceptions are detailed.\n\n### Dependent child requirements for the Adoption: De Facto route\n\n1.   AD 29.1. The applicant must meet the following requirements for a dependent child in Appendix Children: \n    1.   (a) age requirement; and\n    2.   (b) independent life requirement; and\n    3.   (c) care requirement.",
      "needs_review": false
    },
    {
      "metadata": {
        "source": "Immigration Rules Appendix Adoption",
        "part": "Immigration Rules Appendix Adoption",
        "section_id": "1",
        "section_title": "Immigration status requirement of parents for the Adoption: De Facto route",
        "parent_section": null,
        "hierarchy_level": 1,
        "topic": "family",
        "url": "https://www.gov.uk/guidance/immigration-rules/immigration-rules-appendix-adoption",
        "scraped_at": "2025-12-06T17:26:08.445597"
      },
      "text": "### Immigration status requirement of parents for the Adoption: De Facto route\n\n1.   AD 30.1. The applicant must be accompanying their adoptive parent(s) and one of the following must apply: \n    1.   (a) both adoptive parents are British Citizens, are settled in the UK, or have a right to stay in the UK without restriction or are being admitted to the UK for settlement; or\n    2.   (b) the adoptive parent has sole responsibility for the applicant and is a British Citizen, is settled in the UK, or has a right to stay in the UK without restriction, or is being admitted to the UK for settlement; or\n    3.   (c) one adoptive parent is a British Citizen, or is settled in the UK, or has a right to stay in the UK without restriction, or is being admitted to the UK for settlement and the other adoptive parent has or is being given permission to come to the UK on a route to settlement; or\n    4.   (d) one adoptive parent is a British Citizen, or is settled in the UK, or has a right to stay in the UK without restriction, or is being admitted to the UK for settlement, and the decision maker is satisfied there are serious and compelling reasons to grant the applicant entry clearance.",
      "summary": "This provision applies to applicants applying via the Adoption: De Facto route. They must accompany their adoptive parent(s), with key criteria regarding the parents' British or settled status, or a route to settlement, with exceptions if serious and compelling reasons are satisfied. Conditions include specific parent status and the applicant's accompanying status.",
      "augmented_text": "Document: Immigration Rules Appendix Adoption\nPart: Immigration Rules Appendix Adoption\nSection ID: 1\nSection: Immigration status requirement of parents for the Adoption: De Facto route\nTopic: family\n\nSummary: This provision applies to applicants applying via the Adoption: De Facto route. They must accompany their adoptive parent(s), with key criteria regarding the parents' British or settled status, or a route to settlement, with exceptions if serious and compelling reasons are satisfied. Conditions include specific parent status and the applicant's accompanying status.\n\n### Immigration status requirement of parents for the Adoption: De Facto route\n\n1.   AD 30.1. The applicant must be accompanying their adoptive parent(s) and one of the following must apply: \n    1.   (a) both adoptive parents are British Citizens, are settled in the UK, or have a right to stay in the UK without restriction or are being admitted to the UK for settlement; or\n    2.   (b) the adoptive parent has sole responsibility for the applicant and is a British Citizen, is settled in the UK, or has a right to stay in the UK without restriction, or is being admitted to the UK for settlement; or\n    3.   (c) one adoptive parent is a British Citizen, or is settled in the UK, or has a right to stay in the UK without restriction, or is being admitted to the UK for settlement and the other adoptive parent has or is being given permission to come to the UK on a route to settlement; or\n    4.   (d) one adoptive parent is a British Citizen, or is settled in the UK, or has a right to stay in the UK without restriction, or is being admitted to the UK for settlement, and the decision maker is satisfied there are serious and compelling reasons to grant the applicant entry clearance.",
      "needs_review": false
    },
    {
      "metadata": {
        "source": "Immigration Rules Appendix Adoption",
        "part": "Immigration Rules Appendix Adoption",
        "section_id": "AD 31.1",
        "section_title": "Financial requirements for the Adoption: De Facto route",
        "parent_section": "AD 31",
        "hierarchy_level": 2,
        "topic": "financial",
        "url": "https://www.gov.uk/guidance/immigration-rules/immigration-rules-appendix-adoption",
        "scraped_at": "2025-12-06T17:26:08.445621"
      },
      "text": "### Financial requirements for the Adoption: De Facto route\n\nAD 31.1. The applicant must show that they will be adequately maintained in the UK by the adoptive parent(s) without access to public funds, unless AD 31.2. applies.\n\nAD 31.2. Where an adoptive parent of the applicant has, or is applying for, permission on a route to settlement, the applicant must meet the financial requirement as a dependent child under that route.\n\n1.   AD 31.3. The applicant must provide evidence from the adoptive parent(s) of income or cash savings sufficient to show the financial requirement is met, and: \n    1.   (a) evidence from income (other than self-employment) or savings must cover the 6-month period immediately before the date of application; or\n    2.   (b) where the sponsor is receiving maternity, paternity, adoption or sick pay, their income from salaried employment can be shown for either the 6 months immediately before the date of application or the start date of the maternity, paternity, adoption or sick leave; or\n    3.   (c) where the income is from self-employment it must be shown for the last full financial year before the date of application, with additional evidence of ongoing self-employment as in paragraphs 7 or 9 (as relevant) of Appendix FM-SE; or\n    4.   (d) where there is non-employment income it must be shown to have been received in the 12 months before the date of application except where specified in paragraph 10 of Appendix FM-SE; or\n    5.   (e) where property has been sold and the money received has been converted into cash savings the requirements in paragraph 11A(d) of Appendix FM-SE must be met.\n\nAD 31.4. The applicant must show they meet the financial requirement as set out in Appendix FM-SE.",
      "summary": "The Immigration Rules Appendix Adoption (Section AD 31.1) requires applicants for the De Facto Adoption route to demonstrate they can financially support the child without public funds, unless applying under a route for settlement. They must provide evidence of income or savings covering specific periods, depending on source, with specific conditions for employment, self-employment, or other income types. Critical thresholds include six months' income or savings evidence and adherence to specified financial periods.",
      "augmented_text": "Document: Immigration Rules Appendix Adoption\nPart: Immigration Rules Appendix Adoption\nSection ID: AD 31.1\nSection: Financial requirements for the Adoption: De Facto route\nTopic: financial\n\nSummary: The Immigration Rules Appendix Adoption (Section AD 31.1) requires applicants for the De Facto Adoption route to demonstrate they can financially support the child without public funds, unless applying under a route for settlement. They must provide evidence of income or savings covering specific periods, depending on source, with specific conditions for employment, self-employment, or other income types. Critical thresholds include six months' income or savings evidence and adherence to specified financial periods.\n\n### Financial requirements for the Adoption: De Facto route\n\nAD 31.1. The applicant must show that they will be adequately maintained in the UK by the adoptive parent(s) without access to public funds, unless AD 31.2. applies.\n\nAD 31.2. Where an adoptive parent of the applicant has, or is applying for, permission on a route to settlement, the applicant must meet the financial requirement as a dependent child under that route.\n\n1.   AD 31.3. The applicant must provide evidence from the adoptive parent(s) of income or cash savings sufficient to show the financial requirement is met, and: \n    1.   (a) evidence from income (other than self-employment) or savings must cover the 6-month period immediately before the date of application; or\n    2.   (b) where the sponsor is receiving maternity, paternity, adoption or sick pay, their income from salaried employment can be shown for either the 6 months immediately before the date of application or the start date of the maternity, paternity, adoption or sick leave; or\n    3.   (c) where the income is from self-employment it must be shown for the last full financial year before the date of application, with additional evidence of ongoing self-employment as in paragraphs 7 or 9 (as relevant) of Appendix FM-SE; or\n    4.   (d) where there is non-employment income it must be shown to have been received in the 12 months before the date of application except where specified in paragraph 10 of Appendix FM-SE; or\n    5.   (e) where property has been sold and the money received has been converted into cash savings the requirements in paragraph 11A(d) of Appendix FM-SE must be met.\n\nAD 31.4. The applicant must show they meet the financial requirement as set out in Appendix FM-SE.",
      "needs_review": false
    },
    {
      "metadata": {
        "source": "Immigration Rules Appendix Adoption",
        "part": "Immigration Rules Appendix Adoption",
        "section_id": "AD 32.1",
        "section_title": "Accommodation requirement for the Adoption: De Facto route",
        "parent_section": "AD 32",
        "hierarchy_level": 2,
        "topic": "accommodation",
        "url": "https://www.gov.uk/guidance/immigration-rules/immigration-rules-appendix-adoption",
        "scraped_at": "2025-12-06T17:26:08.445648"
      },
      "text": "### Accommodation requirement for the Adoption: De Facto route\n\nAD 32.1. The applicant’s accommodation in the UK must not be overcrowded or contravene public health regulations.",
      "summary": "Applicants using the Adoption: De Facto route must have UK accommodation that is not overcrowded and complies with public health standards. No specific thresholds are set, but overcrowding or health regulation violations disqualify eligibility.",
      "augmented_text": "Document: Immigration Rules Appendix Adoption\nPart: Immigration Rules Appendix Adoption\nSection ID: AD 32.1\nSection: Accommodation requirement for the Adoption: De Facto route\nTopic: accommodation\n\nSummary: Applicants using the Adoption: De Facto route must have UK accommodation that is not overcrowded and complies with public health standards. No specific thresholds are set, but overcrowding or health regulation violations disqualify eligibility.\n\n### Accommodation requirement for the Adoption: De Facto route\n\nAD 32.1. The applicant’s accommodation in the UK must not be overcrowded or contravene public health regulations.",
      "needs_review": false
    },
    {
      "metadata": {
        "source": "Immigration Rules Appendix Adoption",
        "part": "Immigration Rules Appendix Adoption",
        "section_id": "AD 33.1",
        "section_title": "Eligibility under Article 8 of the Human Rights Convention for the Adoption: De Facto route",
        "parent_section": "AD 33",
        "hierarchy_level": 2,
        "topic": "eligibility",
        "url": "https://www.gov.uk/guidance/immigration-rules/immigration-rules-appendix-adoption",
        "scraped_at": "2025-12-06T17:26:08.445668"
      },
      "text": "### Eligibility under Article 8 of the Human Rights Convention for the Adoption: De Facto route\n\nAD 33.1. If the applicant meets the requirements for Adoption but does not meet the suitability or other eligibility requirements (subject to AD 33.2.), the decision maker must be satisfied that refusal of the application would breach Article 8 of the Human Rights Convention, because it would result in unjustifiably harsh consequences for the applicant or their adoptive family.\n\nAD 33.2. Where AD 33.1. applies and the applicant falls for refusal under SUI 2.1., SUI 2.3., SUI 3.1., SUI 4.1., SUI 5.1. of Part Suitability of these rules the application on the Adoption: De Facto route, must be refused.",
      "summary": "This provision applies to adoption applicants using the De Facto route. It requires decision makers to consider granting leave if refusing would breach Article 8 rights due to unjustifiably harsh consequences, unless the applicant fails suitability criteria specified in AD 33.2., which mandates refusal.",
      "augmented_text": "Document: Immigration Rules Appendix Adoption\nPart: Immigration Rules Appendix Adoption\nSection ID: AD 33.1\nSection: Eligibility under Article 8 of the Human Rights Convention for the Adoption: De Facto route\nTopic: eligibility\n\nSummary: This provision applies to adoption applicants using the De Facto route. It requires decision makers to consider granting leave if refusing would breach Article 8 rights due to unjustifiably harsh consequences, unless the applicant fails suitability criteria specified in AD 33.2., which mandates refusal.\n\n### Eligibility under Article 8 of the Human Rights Convention for the Adoption: De Facto route\n\nAD 33.1. If the applicant meets the requirements for Adoption but does not meet the suitability or other eligibility requirements (subject to AD 33.2.), the decision maker must be satisfied that refusal of the application would breach Article 8 of the Human Rights Convention, because it would result in unjustifiably harsh consequences for the applicant or their adoptive family.\n\nAD 33.2. Where AD 33.1. applies and the applicant falls for refusal under SUI 2.1., SUI 2.3., SUI 3.1., SUI 4.1., SUI 5.1. of Part Suitability of these rules the application on the Adoption: De Facto route, must be refused.",
      "needs_review": false
    },
    {
      "metadata": {
        "source": "Immigration Rules Appendix Adoption",
        "part": "Immigration Rules Appendix Adoption",
        "section_id": "AD 34.1",
        "section_title": "Decision on an application for the Adoption: De Facto route",
        "parent_section": "AD 34",
        "hierarchy_level": 2,
        "topic": "eligibility",
        "url": "https://www.gov.uk/guidance/immigration-rules/immigration-rules-appendix-adoption",
        "scraped_at": "2025-12-06T17:26:08.445686"
      },
      "text": "### Decision on an application for the Adoption: De Facto route\n\nAD 34.1. If the decision maker is satisfied that the validity, suitability and the relevant eligibility requirements are met, or the applicant meets the eligibility requirements at AD 28.1. to AD 28.3. and AD 33.1. (unless paragraph AD 33.2. applies), the applicant will be granted permission to stay on the Adoption: De Facto route, otherwise the application will be refused.",
      "summary": "This provision applies to applicants seeking permission via the Adoption: De Facto route. They must meet validity, suitability, and eligibility criteria; if these are satisfied, permission is granted. Applications will be refused if requirements are not met, unless specific exceptions apply.",
      "augmented_text": "Document: Immigration Rules Appendix Adoption\nPart: Immigration Rules Appendix Adoption\nSection ID: AD 34.1\nSection: Decision on an application for the Adoption: De Facto route\nTopic: eligibility\n\nSummary: This provision applies to applicants seeking permission via the Adoption: De Facto route. They must meet validity, suitability, and eligibility criteria; if these are satisfied, permission is granted. Applications will be refused if requirements are not met, unless specific exceptions apply.\n\n### Decision on an application for the Adoption: De Facto route\n\nAD 34.1. If the decision maker is satisfied that the validity, suitability and the relevant eligibility requirements are met, or the applicant meets the eligibility requirements at AD 28.1. to AD 28.3. and AD 33.1. (unless paragraph AD 33.2. applies), the applicant will be granted permission to stay on the Adoption: De Facto route, otherwise the application will be refused.",
      "needs_review": false
    },
    {
      "metadata": {
        "source": "Immigration Rules Appendix Adoption",
        "part": "Immigration Rules Appendix Adoption",
        "section_id": "1",
        "section_title": "Period of grant for the Adoption: De Facto route",
        "parent_section": null,
        "hierarchy_level": 1,
        "topic": "settlement",
        "url": "https://www.gov.uk/guidance/immigration-rules/immigration-rules-appendix-adoption",
        "scraped_at": "2025-12-06T17:26:08.455031"
      },
      "text": "### Period of grant for the Adoption: De Facto route\n\n1.   AD 35.1. The applicant will be granted settlement, if either: \n    1.   (a) both adoptive parents are a British Citizen, settled or have a right to stay in the UK without restriction; or\n    2.   (b) in the case of sole parental responsibility, the adoptive parent is a British Citizen, settled or has a right to stay in the UK without restriction.\n\nAD 35.2. In all other cases the applicant will be granted permission which ends on the same date as the permission granted to their de facto adoptive parent.",
      "summary": "This provision applies to applicants seeking settlement through the De Facto Adoption route. Eligibility depends on whether adoptive parents are British Citizens or settled in the UK, with permissions ending on the same date as the adoptive parent's permission in other cases. Critical conditions include sole parental responsibility status and the adoptive parent’s immigration status.",
      "augmented_text": "Document: Immigration Rules Appendix Adoption\nPart: Immigration Rules Appendix Adoption\nSection ID: 1\nSection: Period of grant for the Adoption: De Facto route\nTopic: settlement\n\nSummary: This provision applies to applicants seeking settlement through the De Facto Adoption route. Eligibility depends on whether adoptive parents are British Citizens or settled in the UK, with permissions ending on the same date as the adoptive parent's permission in other cases. Critical conditions include sole parental responsibility status and the adoptive parent’s immigration status.\n\n### Period of grant for the Adoption: De Facto route\n\n1.   AD 35.1. The applicant will be granted settlement, if either: \n    1.   (a) both adoptive parents are a British Citizen, settled or have a right to stay in the UK without restriction; or\n    2.   (b) in the case of sole parental responsibility, the adoptive parent is a British Citizen, settled or has a right to stay in the UK without restriction.\n\nAD 35.2. In all other cases the applicant will be granted permission which ends on the same date as the permission granted to their de facto adoptive parent.",
      "needs_review": false
    },
    {
      "metadata": {
        "source": "Immigration Rules Appendix Adoption",
        "part": "Immigration Rules Appendix Adoption",
        "section_id": "1",
        "section_title": "Conditions of grant for the Adoption: De Facto route",
        "parent_section": null,
        "hierarchy_level": 1,
        "topic": "financial",
        "url": "https://www.gov.uk/guidance/immigration-rules/immigration-rules-appendix-adoption",
        "scraped_at": "2025-12-06T17:26:08.455097"
      },
      "text": "### Conditions of grant for the Adoption: De Facto route\n\n1.   AD 36.1. The grant will be subject to the following conditions: \n    1.   (a) work is permitted: and\n    2.   (b) study is permitted, and\n    3.   (c) no access to public funds.",
      "summary": "This provision applies to adopters applying via the De Facto route. It permits work and study but restricts access to public funds as conditions for the grant of residence. No additional thresholds or exceptions are specified.",
      "augmented_text": "Document: Immigration Rules Appendix Adoption\nPart: Immigration Rules Appendix Adoption\nSection ID: 1\nSection: Conditions of grant for the Adoption: De Facto route\nTopic: financial\n\nSummary: This provision applies to adopters applying via the De Facto route. It permits work and study but restricts access to public funds as conditions for the grant of residence. No additional thresholds or exceptions are specified.\n\n### Conditions of grant for the Adoption: De Facto route\n\n1.   AD 36.1. The grant will be subject to the following conditions: \n    1.   (a) work is permitted: and\n    2.   (b) study is permitted, and\n    3.   (c) no access to public funds.",
      "needs_review": false
    },
    {
      "metadata": {
        "source": "Immigration Rules Appendix Adoption",
        "part": "Immigration Rules Appendix Adoption",
        "section_id": "AD 1.1",
        "section_title": "Adoption: coming to the UK for adoption",
        "parent_section": null,
        "hierarchy_level": 2,
        "topic": "adoption",
        "url": "https://www.gov.uk/guidance/immigration-rules/immigration-rules-appendix-adoption",
        "scraped_at": "2025-12-06T17:26:08.455122"
      },
      "text": "### Adoption: coming to the UK for adoption",
      "summary": "This provision applies to individuals coming to the UK for adoption. It requires that prospective adopters meet specified eligibility criteria, including approval from the child's current country, unless an exception applies, and must comply with relevant immigration health and character requirements.",
      "augmented_text": "Document: Immigration Rules Appendix Adoption\nPart: Immigration Rules Appendix Adoption\nSection ID: AD 1.1\nSection: Adoption: coming to the UK for adoption\nTopic: adoption\n\nSummary: This provision applies to individuals coming to the UK for adoption. It requires that prospective adopters meet specified eligibility criteria, including approval from the child's current country, unless an exception applies, and must comply with relevant immigration health and character requirements.\n\n### Adoption: coming to the UK for adoption",
      "needs_review": false
    },
    {
      "metadata": {
        "source": "Immigration Rules Appendix Adoption",
        "part": "Immigration Rules Appendix Adoption",
        "section_id": "Entry clearance for the Adoption: coming to the UK for adoption route",
        "section_title": "Entry clearance for the Adoption: coming to the UK for adoption route",
        "parent_section": null,
        "hierarchy_level": 3,
        "topic": "leave-to-enter",
        "url": "https://www.gov.uk/guidance/immigration-rules/immigration-rules-appendix-adoption",
        "scraped_at": "2025-12-06T17:26:08.455142"
      },
      "text": "### Entry clearance for the Adoption: coming to the UK for adoption route",
      "summary": "This provision applies to prospective adopters applying for UK entry clearance under the 'coming to the UK for adoption' route. Applicants must demonstrate their intention to adopt a child in the UK and meet specific eligibility criteria, including suitability and background checks; exceptions may apply if conditions are not satisfied.",
      "augmented_text": "Document: Immigration Rules Appendix Adoption\nPart: Immigration Rules Appendix Adoption\nSection ID: Entry clearance for the Adoption: coming to the UK for adoption route\nSection: Entry clearance for the Adoption: coming to the UK for adoption route\nTopic: leave-to-enter\n\nSummary: This provision applies to prospective adopters applying for UK entry clearance under the 'coming to the UK for adoption' route. Applicants must demonstrate their intention to adopt a child in the UK and meet specific eligibility criteria, including suitability and background checks; exceptions may apply if conditions are not satisfied.\n\n### Entry clearance for the Adoption: coming to the UK for adoption route",
      "needs_review": false
    },
    {
      "metadata": {
        "source": "Immigration Rules Appendix Adoption",
        "part": "Immigration Rules Appendix Adoption",
        "section_id": "AD 37.1",
        "section_title": "Validity requirements for the Adoption: coming to the UK for adoption route",
        "parent_section": "AD 37",
        "hierarchy_level": 2,
        "topic": "leave-to-enter",
        "url": "https://www.gov.uk/guidance/immigration-rules/immigration-rules-appendix-adoption",
        "scraped_at": "2025-12-06T17:26:08.455193"
      },
      "text": "### Validity requirements for the Adoption: coming to the UK for adoption route\n\nAD 37.1. A child applying for entry clearance or permission to stay on the Adoption: coming to the UK for adoption route must apply online on the gov.uk website on the specified form: ‘Non-British adopted child or child coming to the UK for adoption of a parent or parents who are British citizens or settled in the UK’.\n\n1.   AD 37.2. An application for entry clearance on the Adoption: coming to the UK for adoption route must meet all of the following requirements: \n    1.   (a) any fee and Immigration Health Charge must have been paid; and\n    2.   (b) the applicant must have provided biometrics when required; and\n    3.   (c) the applicant must have provided a passport or other document which satisfactorily establishes their identity and nationality.\n\nAD 37.3. An application which does not meet all the requirements for the Adoption: coming to the UK for adoption route may be rejected as invalid and not considered.",
      "summary": "This provision applies to children applying for entry clearance or permission to stay under the UK adoption route. Applicants must submit an online application, pay fees and Immigration Health Charge, provide biometrics, and submit proof of identity and nationality. Failure to meet these requirements may result in rejection of the application.",
      "augmented_text": "Document: Immigration Rules Appendix Adoption\nPart: Immigration Rules Appendix Adoption\nSection ID: AD 37.1\nSection: Validity requirements for the Adoption: coming to the UK for adoption route\nTopic: leave-to-enter\n\nSummary: This provision applies to children applying for entry clearance or permission to stay under the UK adoption route. Applicants must submit an online application, pay fees and Immigration Health Charge, provide biometrics, and submit proof of identity and nationality. Failure to meet these requirements may result in rejection of the application.\n\n### Validity requirements for the Adoption: coming to the UK for adoption route\n\nAD 37.1. A child applying for entry clearance or permission to stay on the Adoption: coming to the UK for adoption route must apply online on the gov.uk website on the specified form: ‘Non-British adopted child or child coming to the UK for adoption of a parent or parents who are British citizens or settled in the UK’.\n\n1.   AD 37.2. An application for entry clearance on the Adoption: coming to the UK for adoption route must meet all of the following requirements: \n    1.   (a) any fee and Immigration Health Charge must have been paid; and\n    2.   (b) the applicant must have provided biometrics when required; and\n    3.   (c) the applicant must have provided a passport or other document which satisfactorily establishes their identity and nationality.\n\nAD 37.3. An application which does not meet all the requirements for the Adoption: coming to the UK for adoption route may be rejected as invalid and not considered.",
      "needs_review": false
    },
    {
      "metadata": {
        "source": "Immigration Rules Appendix Adoption",
        "part": "Immigration Rules Appendix Adoption",
        "section_id": "AD 38.1",
        "section_title": "Suitability requirement for the Adoption: coming to the UK for adoption route",
        "parent_section": "AD 38",
        "hierarchy_level": 2,
        "topic": "suitability",
        "url": "https://www.gov.uk/guidance/immigration-rules/immigration-rules-appendix-adoption",
        "scraped_at": "2025-12-06T17:26:08.455216"
      },
      "text": "### Suitability requirement for the Adoption: coming to the UK for adoption route\n\nAD 38.1. The applicant must not fall for refusal under Part Suitability.",
      "summary": "Applicants coming to the UK via the adoption route must meet suitability requirements, ensuring they are appropriate for entry under adoption rules. They must not be refused under Part Suitability, with no specific exceptions noted.",
      "augmented_text": "Document: Immigration Rules Appendix Adoption\nPart: Immigration Rules Appendix Adoption\nSection ID: AD 38.1\nSection: Suitability requirement for the Adoption: coming to the UK for adoption route\nTopic: suitability\n\nSummary: Applicants coming to the UK via the adoption route must meet suitability requirements, ensuring they are appropriate for entry under adoption rules. They must not be refused under Part Suitability, with no specific exceptions noted.\n\n### Suitability requirement for the Adoption: coming to the UK for adoption route\n\nAD 38.1. The applicant must not fall for refusal under Part Suitability.",
      "needs_review": false
    },
    {
      "metadata": {
        "source": "Immigration Rules Appendix Adoption",
        "part": "Immigration Rules Appendix Adoption",
        "section_id": "Eligibility requirements for the Adoption: coming to the UK for adoption route",
        "section_title": "Eligibility requirements for the Adoption: coming to the UK for adoption route",
        "parent_section": null,
        "hierarchy_level": 3,
        "topic": "eligibility",
        "url": "https://www.gov.uk/guidance/immigration-rules/immigration-rules-appendix-adoption",
        "scraped_at": "2025-12-06T17:26:08.455226"
      },
      "text": "### Eligibility requirements for the Adoption: coming to the UK for adoption route",
      "summary": "This provision applies to individuals seeking to come to the UK for adoption. Applicants must meet specific eligibility criteria, including approval from the relevant authorities in their home country, and must demonstrate they are suitable adopters. No exceptions are specified beyond standard eligibility conditions.",
      "augmented_text": "Document: Immigration Rules Appendix Adoption\nPart: Immigration Rules Appendix Adoption\nSection ID: Eligibility requirements for the Adoption: coming to the UK for adoption route\nSection: Eligibility requirements for the Adoption: coming to the UK for adoption route\nTopic: eligibility\n\nSummary: This provision applies to individuals seeking to come to the UK for adoption. Applicants must meet specific eligibility criteria, including approval from the relevant authorities in their home country, and must demonstrate they are suitable adopters. No exceptions are specified beyond standard eligibility conditions.\n\n### Eligibility requirements for the Adoption: coming to the UK for adoption route",
      "needs_review": false
    },
    {
      "metadata": {
        "source": "Immigration Rules Appendix Adoption",
        "part": "Immigration Rules Appendix Adoption",
        "section_id": "AD 39.1",
        "section_title": "Entry requirements for the Adoption: coming to the UK for adoption route",
        "parent_section": "AD 39",
        "hierarchy_level": 2,
        "topic": "leave-to-enter",
        "url": "https://www.gov.uk/guidance/immigration-rules/immigration-rules-appendix-adoption",
        "scraped_at": "2025-12-06T17:26:08.455253"
      },
      "text": "### Entry requirements for the Adoption: coming to the UK for adoption route\n\nAD 39.1. A child seeking to come to the UK under the Adoption: coming to the UK for adoption route must apply for and obtain entry clearance on the Adoption: coming to the UK for adoption route before they arrive in the UK.\n\nAD 39.2. A child applying for entry clearance under the Adoption: coming to the UK for adoption must, if Appendix Tuberculosis of these rules applies, provide a valid medical certificate confirming they have undergone screening for active pulmonary tuberculosis and that this tuberculosis is not present in them.",
      "summary": "This provision applies to children seeking entry to the UK for adoption. They must obtain entry clearance under the specified route before arrival and, if applicable, provide a medical certificate confirming they have been screened for active tuberculosis.",
      "augmented_text": "Document: Immigration Rules Appendix Adoption\nPart: Immigration Rules Appendix Adoption\nSection ID: AD 39.1\nSection: Entry requirements for the Adoption: coming to the UK for adoption route\nTopic: leave-to-enter\n\nSummary: This provision applies to children seeking entry to the UK for adoption. They must obtain entry clearance under the specified route before arrival and, if applicable, provide a medical certificate confirming they have been screened for active tuberculosis.\n\n### Entry requirements for the Adoption: coming to the UK for adoption route\n\nAD 39.1. A child seeking to come to the UK under the Adoption: coming to the UK for adoption route must apply for and obtain entry clearance on the Adoption: coming to the UK for adoption route before they arrive in the UK.\n\nAD 39.2. A child applying for entry clearance under the Adoption: coming to the UK for adoption must, if Appendix Tuberculosis of these rules applies, provide a valid medical certificate confirming they have undergone screening for active pulmonary tuberculosis and that this tuberculosis is not present in them.",
      "needs_review": false
    },
    {
      "metadata": {
        "source": "Immigration Rules Appendix Adoption",
        "part": "Immigration Rules Appendix Adoption",
        "section_id": "1",
        "section_title": "Dependent child requirements for the Adoption: coming to the UK for adoption route",
        "parent_section": null,
        "hierarchy_level": 1,
        "topic": "family",
        "url": "https://www.gov.uk/guidance/immigration-rules/immigration-rules-appendix-adoption",
        "scraped_at": "2025-12-06T17:26:08.455285"
      },
      "text": "### Dependent child requirements for the Adoption: coming to the UK for adoption route\n\n1.   AD 40.1. The applicant must meet the following requirements for a dependent child in Appendix Children: \n    1.   (a) age requirement; and\n    2.   (b) independent life requirement; and\n    3.   (c) care requirement.",
      "summary": "This provision applies to applicants seeking to bring dependent children via the UK adoption route. They must meet age, independent life, and care requirements in accordance with Appendix Children. Critical conditions include ensuring the child’s suitability, with no specific exceptions noted.",
      "augmented_text": "Document: Immigration Rules Appendix Adoption\nPart: Immigration Rules Appendix Adoption\nSection ID: 1\nSection: Dependent child requirements for the Adoption: coming to the UK for adoption route\nTopic: family\n\nSummary: This provision applies to applicants seeking to bring dependent children via the UK adoption route. They must meet age, independent life, and care requirements in accordance with Appendix Children. Critical conditions include ensuring the child’s suitability, with no specific exceptions noted.\n\n### Dependent child requirements for the Adoption: coming to the UK for adoption route\n\n1.   AD 40.1. The applicant must meet the following requirements for a dependent child in Appendix Children: \n    1.   (a) age requirement; and\n    2.   (b) independent life requirement; and\n    3.   (c) care requirement.",
      "needs_review": false
    },
    {
      "metadata": {
        "source": "Immigration Rules Appendix Adoption",
        "part": "Immigration Rules Appendix Adoption",
        "section_id": "1",
        "section_title": "Adoption requirements for the Adoption: coming to the UK for adoption route",
        "parent_section": null,
        "hierarchy_level": 1,
        "topic": "family",
        "url": "https://www.gov.uk/guidance/immigration-rules/immigration-rules-appendix-adoption",
        "scraped_at": "2025-12-06T17:26:08.455319"
      },
      "text": "### Adoption requirements for the Adoption: coming to the UK for adoption route\n\n1.   AD 41.1. The applicant must: \n    1.   (a) be coming to the UK for adoption by an adoptive parent(s), in accordance with the laws relating to adoption in the UK; and\n    2.   (b) demonstrate that the adoption is not one of convenience arranged to facilitate the applicant’s admission to the UK; and\n    3.   (c) demonstrate they will have the same rights and obligations as any other child of the adoptive parent(s)’s family; and\n    4.   (d) be being adopted due to the inability of the applicant’s birth parent(s) or current carer(s) (or those looking after the applicant immediately before they were physically transferred to the care of their adoptive parent(s)) to care for the applicant and there has been a genuine transfer of parental responsibility to the adoptive parent(s).\n\n1.   AD 41.2. The applicant must provide evidence from the relevant Central Authority (see AD 16.4) to confirm a Certificate of Eligibility has been issued if the adoption engages the requirements in: \n    1.   (a) section 83 of the Adoption and Children Act 2002; or\n    2.   (b) articles 58ZA and 58ZB of the Adoption (Northern Ireland) order 1987; or\n    3.   (c) section 58 of Adoption and Children (Scotland) Act 2007.",
      "summary": "Applicants coming to the UK for adoption must be adopted by an approved parent under UK law, demonstrating genuine parental transfer and no convenience purpose. They must also provide a Certificate of Eligibility from the Central Authority if the adoption involves specific legal criteria under UK or regional legislation.",
      "augmented_text": "Document: Immigration Rules Appendix Adoption\nPart: Immigration Rules Appendix Adoption\nSection ID: 1\nSection: Adoption requirements for the Adoption: coming to the UK for adoption route\nTopic: family\n\nSummary: Applicants coming to the UK for adoption must be adopted by an approved parent under UK law, demonstrating genuine parental transfer and no convenience purpose. They must also provide a Certificate of Eligibility from the Central Authority if the adoption involves specific legal criteria under UK or regional legislation.\n\n### Adoption requirements for the Adoption: coming to the UK for adoption route\n\n1.   AD 41.1. The applicant must: \n    1.   (a) be coming to the UK for adoption by an adoptive parent(s), in accordance with the laws relating to adoption in the UK; and\n    2.   (b) demonstrate that the adoption is not one of convenience arranged to facilitate the applicant’s admission to the UK; and\n    3.   (c) demonstrate they will have the same rights and obligations as any other child of the adoptive parent(s)’s family; and\n    4.   (d) be being adopted due to the inability of the applicant’s birth parent(s) or current carer(s) (or those looking after the applicant immediately before they were physically transferred to the care of their adoptive parent(s)) to care for the applicant and there has been a genuine transfer of parental responsibility to the adoptive parent(s).\n\n1.   AD 41.2. The applicant must provide evidence from the relevant Central Authority (see AD 16.4) to confirm a Certificate of Eligibility has been issued if the adoption engages the requirements in: \n    1.   (a) section 83 of the Adoption and Children Act 2002; or\n    2.   (b) articles 58ZA and 58ZB of the Adoption (Northern Ireland) order 1987; or\n    3.   (c) section 58 of Adoption and Children (Scotland) Act 2007.",
      "needs_review": false
    },
    {
      "metadata": {
        "source": "Immigration Rules Appendix Adoption",
        "part": "Immigration Rules Appendix Adoption",
        "section_id": "AD 42.1",
        "section_title": "Financial requirements for the Adoption: coming to the UK for adoption route",
        "parent_section": "AD 42",
        "hierarchy_level": 2,
        "topic": "financial",
        "url": "https://www.gov.uk/guidance/immigration-rules/immigration-rules-appendix-adoption",
        "scraped_at": "2025-12-06T17:26:08.455336"
      },
      "text": "### Financial requirements for the Adoption: coming to the UK for adoption route\n\nAD 42.1. The applicant must show that they will be adequately maintained in the UK by the adoptive parent(s), without access to public funds, unless AD 42.2. applies.\n\nAD 42.2. Where an adoptive parent of the applicant has, or is applying for (and is granted), permission on a route to settlement, the applicant must meet the financial requirement as a dependent under that route.\n\n1.   AD 42.3. The adoptive parent(s) must provide evidence of income or cash savings sufficient to show they can meet the financial requirements and: \n    1.   (a) evidence from income (other than self-employment) or savings must cover the 6-month period immediately before the date of application; or\n    2.   (b) where the sponsor is receiving maternity, paternity, adoption or sick pay, their income from salaried employment can be shown for either the 6 months immediately before the date of application or the start date of the maternity, paternity, adoption or sick leave; or\n    3.   (c) where the income is from self-employment it must be shown for the last full financial year before the date of application, with additional evidence of ongoing self-employment as in paragraphs 7 or 9 (as relevant) of Appendix FM-SE; or\n    4.   (d) where there is non-employment income it must be shown to have been received in the 12 months before the date of application except where specified in paragraph 10 of Appendix FM-SE; or\n    5.   (e) where property has been sold and the money received has been converted into cash savings the requirements in paragraph 11A(d) of Appendix FM-SE must be met.\n\nAD 42.4. The applicant must show they meet the financial requirements as set out in Appendix FM-SE.",
      "summary": "This provision applies to applicants coming to the UK for adoption. They must demonstrate they will be adequately maintained by the adoptive parent(s) without recourse to public funds, unless applying under a route that grants settlement. Evidence of sufficient income or savings over specified periods is required, with conditions varying based on employment type and existing permissions.",
      "augmented_text": "Document: Immigration Rules Appendix Adoption\nPart: Immigration Rules Appendix Adoption\nSection ID: AD 42.1\nSection: Financial requirements for the Adoption: coming to the UK for adoption route\nTopic: financial\n\nSummary: This provision applies to applicants coming to the UK for adoption. They must demonstrate they will be adequately maintained by the adoptive parent(s) without recourse to public funds, unless applying under a route that grants settlement. Evidence of sufficient income or savings over specified periods is required, with conditions varying based on employment type and existing permissions.\n\n### Financial requirements for the Adoption: coming to the UK for adoption route\n\nAD 42.1. The applicant must show that they will be adequately maintained in the UK by the adoptive parent(s), without access to public funds, unless AD 42.2. applies.\n\nAD 42.2. Where an adoptive parent of the applicant has, or is applying for (and is granted), permission on a route to settlement, the applicant must meet the financial requirement as a dependent under that route.\n\n1.   AD 42.3. The adoptive parent(s) must provide evidence of income or cash savings sufficient to show they can meet the financial requirements and: \n    1.   (a) evidence from income (other than self-employment) or savings must cover the 6-month period immediately before the date of application; or\n    2.   (b) where the sponsor is receiving maternity, paternity, adoption or sick pay, their income from salaried employment can be shown for either the 6 months immediately before the date of application or the start date of the maternity, paternity, adoption or sick leave; or\n    3.   (c) where the income is from self-employment it must be shown for the last full financial year before the date of application, with additional evidence of ongoing self-employment as in paragraphs 7 or 9 (as relevant) of Appendix FM-SE; or\n    4.   (d) where there is non-employment income it must be shown to have been received in the 12 months before the date of application except where specified in paragraph 10 of Appendix FM-SE; or\n    5.   (e) where property has been sold and the money received has been converted into cash savings the requirements in paragraph 11A(d) of Appendix FM-SE must be met.\n\nAD 42.4. The applicant must show they meet the financial requirements as set out in Appendix FM-SE.",
      "needs_review": false
    },
    {
      "metadata": {
        "source": "Immigration Rules Appendix Adoption",
        "part": "Immigration Rules Appendix Adoption",
        "section_id": "AD 43.1",
        "section_title": "Accommodation requirement for the Adoption: coming to the UK for adoption route",
        "parent_section": "AD 43",
        "hierarchy_level": 2,
        "topic": "accommodation",
        "url": "https://www.gov.uk/guidance/immigration-rules/immigration-rules-appendix-adoption",
        "scraped_at": "2025-12-06T17:26:08.455358"
      },
      "text": "### Accommodation requirement for the Adoption: coming to the UK for adoption route\n\nAD 43.1. The applicant’s accommodation in the UK must not be overcrowded or contravene public health regulations.",
      "summary": "Applicants coming to the UK for adoption must have accommodation that is not overcrowded and complies with public health laws. This requirement ensures suitable living conditions for adopters and any children involved.",
      "augmented_text": "Document: Immigration Rules Appendix Adoption\nPart: Immigration Rules Appendix Adoption\nSection ID: AD 43.1\nSection: Accommodation requirement for the Adoption: coming to the UK for adoption route\nTopic: accommodation\n\nSummary: Applicants coming to the UK for adoption must have accommodation that is not overcrowded and complies with public health laws. This requirement ensures suitable living conditions for adopters and any children involved.\n\n### Accommodation requirement for the Adoption: coming to the UK for adoption route\n\nAD 43.1. The applicant’s accommodation in the UK must not be overcrowded or contravene public health regulations.",
      "needs_review": false
    },
    {
      "metadata": {
        "source": "Immigration Rules Appendix Adoption",
        "part": "Immigration Rules Appendix Adoption",
        "section_id": "1",
        "section_title": "Adoptive parent’s immigration status requirements for the Adoption: coming to the UK for adoption route",
        "parent_section": null,
        "hierarchy_level": 1,
        "topic": "family",
        "url": "https://www.gov.uk/guidance/immigration-rules/immigration-rules-appendix-adoption",
        "scraped_at": "2025-12-06T17:26:08.455397"
      },
      "text": "### Adoptive parent’s immigration status requirements for the Adoption: coming to the UK for adoption route\n\n1.   AD 44.1. The applicant must be accompanying their adoptive parent(s) and one of the following must apply: \n    1.   (a) both adoptive parents are British Citizens, are settled in the UK, or live in the UK and have a right to stay without restriction; or\n    2.   (b) the adoptive parent has sole responsibility for the applicant and is a British Citizen, is settled in the UK, or lives in the UK and has a right to stay without restriction; or\n    3.   (c) one adoptive parent is a British Citizen, or is settled in the UK, or lives in the UK and has a right to stay without restriction and the other adoptive parent has, or is applying for (and is granted), entry clearance or permission to stay on a route to settlement; or\n    4.   (d) the adoptive parent has sole parental responsibility, and is applying for (and is granted), entry clearance or permission on a route to settlement; or\n    5.   (e) one adoptive parent is a British Citizen, is settled in the UK, or lives in the UK and has a right to stay without restriction and the decision maker is satisfied there are serious and compelling reasons to grant the applicant entry clearance; or\n    6.   (f) one adoptive parent has, or is applying for (and is granted), entry clearance or permission to stay on a route to settlement and the decision maker is satisfied there are serious and compelling reasons to grant the applicant entry clearance.",
      "summary": "This provision applies to applicants coming to the UK with adoptive parents under the adoption route. It requires the applicant to accompany adoptive parent(s) meeting specific settlement or British citizenship criteria or have permission on a route to settlement, with certain conditions for sole responsibility or serious reasons to grant entry. Exceptions are made for cases with compelling reasons or granted permissions on a settlement route.",
      "augmented_text": "Document: Immigration Rules Appendix Adoption\nPart: Immigration Rules Appendix Adoption\nSection ID: 1\nSection: Adoptive parent’s immigration status requirements for the Adoption: coming to the UK for adoption route\nTopic: family\n\nSummary: This provision applies to applicants coming to the UK with adoptive parents under the adoption route. It requires the applicant to accompany adoptive parent(s) meeting specific settlement or British citizenship criteria or have permission on a route to settlement, with certain conditions for sole responsibility or serious reasons to grant entry. Exceptions are made for cases with compelling reasons or granted permissions on a settlement route.\n\n### Adoptive parent’s immigration status requirements for the Adoption: coming to the UK for adoption route\n\n1.   AD 44.1. The applicant must be accompanying their adoptive parent(s) and one of the following must apply: \n    1.   (a) both adoptive parents are British Citizens, are settled in the UK, or live in the UK and have a right to stay without restriction; or\n    2.   (b) the adoptive parent has sole responsibility for the applicant and is a British Citizen, is settled in the UK, or lives in the UK and has a right to stay without restriction; or\n    3.   (c) one adoptive parent is a British Citizen, or is settled in the UK, or lives in the UK and has a right to stay without restriction and the other adoptive parent has, or is applying for (and is granted), entry clearance or permission to stay on a route to settlement; or\n    4.   (d) the adoptive parent has sole parental responsibility, and is applying for (and is granted), entry clearance or permission on a route to settlement; or\n    5.   (e) one adoptive parent is a British Citizen, is settled in the UK, or lives in the UK and has a right to stay without restriction and the decision maker is satisfied there are serious and compelling reasons to grant the applicant entry clearance; or\n    6.   (f) one adoptive parent has, or is applying for (and is granted), entry clearance or permission to stay on a route to settlement and the decision maker is satisfied there are serious and compelling reasons to grant the applicant entry clearance.",
      "needs_review": false
    },
    {
      "metadata": {
        "source": "Immigration Rules Appendix Adoption",
        "part": "Immigration Rules Appendix Adoption",
        "section_id": "AD 45.1",
        "section_title": "Eligibility under Article 8 of the Human Rights Convention for the Adoption: coming to the UK for adoption route",
        "parent_section": "AD 45",
        "hierarchy_level": 2,
        "topic": "eligibility",
        "url": "https://www.gov.uk/guidance/immigration-rules/immigration-rules-appendix-adoption",
        "scraped_at": "2025-12-06T17:26:08.455412"
      },
      "text": "### Eligibility under Article 8 of the Human Rights Convention for the Adoption: coming to the UK for adoption route\n\nAD 45.1. If the applicant meets the Requirements for Adoption, but does not meet the suitability or other eligibility requirements (subject to AD 45.2.), the decision maker must be satisfied that refusal of the application would breach Article 8 of the Human Rights Convention, because it would result in unjustifiably harsh consequences for the applicant or their adoptive family.\n\nAD 45.2. Where AD 45.1. applies and the applicant falls for refusal under SUI 2.1., SUI 2.3., SUI 3.1., SUI 4.1., SUI 5.1. of Part Suitability of these rules the application on the Adoption: coming to the UK for adoption route, must be refused.",
      "summary": "This provision applies to applicants seeking entry to the UK for adoption under Article 8 rights. If they meet adoption requirements but fail suitability criteria, refusal may be overridden to prevent unjustifiable hardship for their family. However, applications must be refused if they fall under specific suitability refusal grounds.",
      "augmented_text": "Document: Immigration Rules Appendix Adoption\nPart: Immigration Rules Appendix Adoption\nSection ID: AD 45.1\nSection: Eligibility under Article 8 of the Human Rights Convention for the Adoption: coming to the UK for adoption route\nTopic: eligibility\n\nSummary: This provision applies to applicants seeking entry to the UK for adoption under Article 8 rights. If they meet adoption requirements but fail suitability criteria, refusal may be overridden to prevent unjustifiable hardship for their family. However, applications must be refused if they fall under specific suitability refusal grounds.\n\n### Eligibility under Article 8 of the Human Rights Convention for the Adoption: coming to the UK for adoption route\n\nAD 45.1. If the applicant meets the Requirements for Adoption, but does not meet the suitability or other eligibility requirements (subject to AD 45.2.), the decision maker must be satisfied that refusal of the application would breach Article 8 of the Human Rights Convention, because it would result in unjustifiably harsh consequences for the applicant or their adoptive family.\n\nAD 45.2. Where AD 45.1. applies and the applicant falls for refusal under SUI 2.1., SUI 2.3., SUI 3.1., SUI 4.1., SUI 5.1. of Part Suitability of these rules the application on the Adoption: coming to the UK for adoption route, must be refused.",
      "needs_review": false
    },
    {
      "metadata": {
        "source": "Immigration Rules Appendix Adoption",
        "part": "Immigration Rules Appendix Adoption",
        "section_id": "AD 46.1",
        "section_title": "Decision on an application for the Adoption: coming to the UK for adoption route",
        "parent_section": "AD 46",
        "hierarchy_level": 2,
        "topic": "eligibility",
        "url": "https://www.gov.uk/guidance/immigration-rules/immigration-rules-appendix-adoption",
        "scraped_at": "2025-12-06T17:26:08.455425"
      },
      "text": "### Decision on an application for the Adoption: coming to the UK for adoption route\n\nAD 46.1. If the decision maker is satisfied that the validity, suitability and the relevant eligibility requirements are met, or the applicant meets the eligibility requirements at AD 41.1. to AD 41.2. and AD 45.1. (unless paragraph AD 45.2 applies) the applicant will be granted permission to stay on the Adoption: coming to the UK for adoption route, otherwise the application will be refused.",
      "summary": "Applicants seeking permission to come to the UK for adoption must meet validity, suitability, and eligibility criteria; if satisfied, they will be granted permission, otherwise the application will be refused. Exceptions apply if specific eligibility conditions are met under AD 41 and AD 45.",
      "augmented_text": "Document: Immigration Rules Appendix Adoption\nPart: Immigration Rules Appendix Adoption\nSection ID: AD 46.1\nSection: Decision on an application for the Adoption: coming to the UK for adoption route\nTopic: eligibility\n\nSummary: Applicants seeking permission to come to the UK for adoption must meet validity, suitability, and eligibility criteria; if satisfied, they will be granted permission, otherwise the application will be refused. Exceptions apply if specific eligibility conditions are met under AD 41 and AD 45.\n\n### Decision on an application for the Adoption: coming to the UK for adoption route\n\nAD 46.1. If the decision maker is satisfied that the validity, suitability and the relevant eligibility requirements are met, or the applicant meets the eligibility requirements at AD 41.1. to AD 41.2. and AD 45.1. (unless paragraph AD 45.2 applies) the applicant will be granted permission to stay on the Adoption: coming to the UK for adoption route, otherwise the application will be refused.",
      "needs_review": false
    },
    {
      "metadata": {
        "source": "Immigration Rules Appendix Adoption",
        "part": "Immigration Rules Appendix Adoption",
        "section_id": "AD 47.1",
        "section_title": "Period of grant for the Adoption: coming to the UK for adoption route",
        "parent_section": "AD 47",
        "hierarchy_level": 2,
        "topic": "leave-to-enter",
        "url": "https://www.gov.uk/guidance/immigration-rules/immigration-rules-appendix-adoption",
        "scraped_at": "2025-12-06T17:26:08.455447"
      },
      "text": "### Period of grant for the Adoption: coming to the UK for adoption route\n\nAD 47.1. An applicant applying for entry clearance to come to the UK for adoption will be granted permission for 24 months.",
      "summary": "Applicants coming to the UK for adoption will be granted a 24-month entry clearance. This applies specifically to those entering via the adoption route, with no mention of exceptions or additional conditions.",
      "augmented_text": "Document: Immigration Rules Appendix Adoption\nPart: Immigration Rules Appendix Adoption\nSection ID: AD 47.1\nSection: Period of grant for the Adoption: coming to the UK for adoption route\nTopic: leave-to-enter\n\nSummary: Applicants coming to the UK for adoption will be granted a 24-month entry clearance. This applies specifically to those entering via the adoption route, with no mention of exceptions or additional conditions.\n\n### Period of grant for the Adoption: coming to the UK for adoption route\n\nAD 47.1. An applicant applying for entry clearance to come to the UK for adoption will be granted permission for 24 months.",
      "needs_review": false
    },
    {
      "metadata": {
        "source": "Immigration Rules Appendix Adoption",
        "part": "Immigration Rules Appendix Adoption",
        "section_id": "1",
        "section_title": "Conditions of grant for the Adoption: coming to the UK for adoption route",
        "parent_section": null,
        "hierarchy_level": 1,
        "topic": "financial",
        "url": "https://www.gov.uk/guidance/immigration-rules/immigration-rules-appendix-adoption",
        "scraped_at": "2025-12-06T17:26:08.455463"
      },
      "text": "### Conditions of grant for the Adoption: coming to the UK for adoption route\n\n1.   AD 48.1. The grant will be subject to the following conditions: \n    1.   (a) work is permitted; and\n    2.   (b) study is permitted; and\n    3.   (c) no access to public funds.\n\nPrint this page",
      "summary": "This provision applies to applicants coming to the UK for adoption and grants permission contingent on work and study being permitted and the applicant having no access to public funds. These conditions must be met for the grant to be valid, with no exceptions specified.",
      "augmented_text": "Document: Immigration Rules Appendix Adoption\nPart: Immigration Rules Appendix Adoption\nSection ID: 1\nSection: Conditions of grant for the Adoption: coming to the UK for adoption route\nTopic: financial\n\nSummary: This provision applies to applicants coming to the UK for adoption and grants permission contingent on work and study being permitted and the applicant having no access to public funds. These conditions must be met for the grant to be valid, with no exceptions specified.\n\n### Conditions of grant for the Adoption: coming to the UK for adoption route\n\n1.   AD 48.1. The grant will be subject to the following conditions: \n    1.   (a) work is permitted; and\n    2.   (b) study is permitted; and\n    3.   (c) no access to public funds.\n\nPrint this page",
      "needs_review": false
    }
  ]
}