{
  "url": "https://www.gov.uk/guidance/immigration-rules/immigration-rules-appendix-uk-ancestry",
  "part_name": "Immigration Rules Appendix UK Ancestry",
  "scraped_at": "2025-12-06T17:29:33.647250",
  "chunk_count": 45,
  "chunks": [
    {
      "metadata": {
        "source": "Immigration Rules Appendix UK Ancestry",
        "part": "Immigration Rules Appendix UK Ancestry",
        "section_id": "1",
        "section_title": "Validity requirements for UK Ancestry",
        "parent_section": null,
        "hierarchy_level": 1,
        "topic": "leave-to-enter",
        "url": "https://www.gov.uk/guidance/immigration-rules/immigration-rules-appendix-uk-ancestry",
        "scraped_at": "2025-12-06T17:29:33.645967"
      },
      "text": "### Validity requirements for UK Ancestry\n\n1.   UKA 1.1. A person applying for entry clearance or permission to stay on the UK Ancestry route must apply online on the gov.uk website on the specified form as follows: \n    1.   (a) for entry clearance, form “UK Ancestry, Right of Abode or Returning Residents visa”; or\n    2.   (b) for permission to stay, form “Application to extend stay in the UK: FLR(IR)”.\n\n1.   UKA 1.2. An application for entry clearance or permission to stay on the UK Ancestry route must meet all the following requirements: \n    1.   (a) any fee and Immigration Health Charge must have been paid; and\n    2.   (b) the applicant must have provided biometrics when required; and\n    3.   (c) the applicant must have provided a passport or other travel document which satisfactorily establishes their identity and nationality.\n\nUKA 1.3. The applicant must be a Commonwealth citizen.\n\nUKA 1.4. If applying for entry clearance, the applicant must be aged 17 or over on the date of their intended arrival in the UK.\n\nUKA 1.5. If applying for permission to stay, the applicant must be in the UK on the date of application.\n\nUKA 1.5A. If applying for permission to stay, the applicant must have previously been granted permission on the UK Ancestry route as a person with UK Ancestry.\n\nUKA 1.6. An application which does not meet all the validity requirements for the UK Ancestry route may be rejected as invalid and not considered.",
      "summary": "Applicants must apply online for UK Ancestry, meet fee, biometrics, and identity requirements, and be Commonwealth citizens aged 17+ (if applying for entry clearance) or already in the UK with prior permission (if extending stay). Applications failing these criteria will be rejected.",
      "augmented_text": "Document: Immigration Rules Appendix UK Ancestry\nPart: Immigration Rules Appendix UK Ancestry\nSection ID: 1\nSection: Validity requirements for UK Ancestry\nTopic: leave-to-enter\n\nSummary: Applicants must apply online for UK Ancestry, meet fee, biometrics, and identity requirements, and be Commonwealth citizens aged 17+ (if applying for entry clearance) or already in the UK with prior permission (if extending stay). Applications failing these criteria will be rejected.\n\n### Validity requirements for UK Ancestry\n\n1.   UKA 1.1. A person applying for entry clearance or permission to stay on the UK Ancestry route must apply online on the gov.uk website on the specified form as follows: \n    1.   (a) for entry clearance, form “UK Ancestry, Right of Abode or Returning Residents visa”; or\n    2.   (b) for permission to stay, form “Application to extend stay in the UK: FLR(IR)”.\n\n1.   UKA 1.2. An application for entry clearance or permission to stay on the UK Ancestry route must meet all the following requirements: \n    1.   (a) any fee and Immigration Health Charge must have been paid; and\n    2.   (b) the applicant must have provided biometrics when required; and\n    3.   (c) the applicant must have provided a passport or other travel document which satisfactorily establishes their identity and nationality.\n\nUKA 1.3. The applicant must be a Commonwealth citizen.\n\nUKA 1.4. If applying for entry clearance, the applicant must be aged 17 or over on the date of their intended arrival in the UK.\n\nUKA 1.5. If applying for permission to stay, the applicant must be in the UK on the date of application.\n\nUKA 1.5A. If applying for permission to stay, the applicant must have previously been granted permission on the UK Ancestry route as a person with UK Ancestry.\n\nUKA 1.6. An application which does not meet all the validity requirements for the UK Ancestry route may be rejected as invalid and not considered.",
      "needs_review": false
    },
    {
      "metadata": {
        "source": "Immigration Rules Appendix UK Ancestry",
        "part": "Immigration Rules Appendix UK Ancestry",
        "section_id": "UKA 2.1",
        "section_title": "Suitability requirements for UK Ancestry",
        "parent_section": "UKA 2",
        "hierarchy_level": 2,
        "topic": "suitability",
        "url": "https://www.gov.uk/guidance/immigration-rules/immigration-rules-appendix-uk-ancestry",
        "scraped_at": "2025-12-06T17:29:33.646368"
      },
      "text": "### Suitability requirements for UK Ancestry\n\nUKA 2.1. The applicant must not fall for refusal under Part Suitability.\n\n1.   UKA 2.2. If applying for permission to stay, the applicant must not be: \n    1.   (a) in breach of immigration laws, except that where the Exceptions for overstayers section of Part Suitability applies, that period of overstaying will be disregarded; or\n    2.   (b) on immigration bail.",
      "summary": "Applicants seeking UK Ancestry permission must not breach immigration laws or be on bail, except where overstaying is disregarded under specific exceptions.",
      "augmented_text": "Document: Immigration Rules Appendix UK Ancestry\nPart: Immigration Rules Appendix UK Ancestry\nSection ID: UKA 2.1\nSection: Suitability requirements for UK Ancestry\nTopic: suitability\n\nSummary: Applicants seeking UK Ancestry permission must not breach immigration laws or be on bail, except where overstaying is disregarded under specific exceptions.\n\n### Suitability requirements for UK Ancestry\n\nUKA 2.1. The applicant must not fall for refusal under Part Suitability.\n\n1.   UKA 2.2. If applying for permission to stay, the applicant must not be: \n    1.   (a) in breach of immigration laws, except that where the Exceptions for overstayers section of Part Suitability applies, that period of overstaying will be disregarded; or\n    2.   (b) on immigration bail.",
      "needs_review": false
    },
    {
      "metadata": {
        "source": "Immigration Rules Appendix UK Ancestry",
        "part": "Immigration Rules Appendix UK Ancestry",
        "section_id": "Eligibility requirements for UK Ancestry",
        "section_title": "Eligibility requirements for UK Ancestry",
        "parent_section": null,
        "hierarchy_level": 2,
        "topic": "eligibility",
        "url": "https://www.gov.uk/guidance/immigration-rules/immigration-rules-appendix-uk-ancestry",
        "scraped_at": "2025-12-06T17:29:33.646394"
      },
      "text": "### Eligibility requirements for UK Ancestry",
      "summary": "Applicants must demonstrate a commonwealth nationality, be aged 17 or over, and intend to take or seek employment in the UK. They must also meet financial and other specified criteria, with exceptions or additional conditions outlined for certain circumstances.",
      "augmented_text": "Document: Immigration Rules Appendix UK Ancestry\nPart: Immigration Rules Appendix UK Ancestry\nSection ID: Eligibility requirements for UK Ancestry\nSection: Eligibility requirements for UK Ancestry\nTopic: eligibility\n\nSummary: Applicants must demonstrate a commonwealth nationality, be aged 17 or over, and intend to take or seek employment in the UK. They must also meet financial and other specified criteria, with exceptions or additional conditions outlined for certain circumstances.\n\n### Eligibility requirements for UK Ancestry",
      "needs_review": false
    },
    {
      "metadata": {
        "source": "Immigration Rules Appendix UK Ancestry",
        "part": "Immigration Rules Appendix UK Ancestry",
        "section_id": "UKA 3.1",
        "section_title": "Entry requirements for UK Ancestry",
        "parent_section": "UKA 3",
        "hierarchy_level": 2,
        "topic": "leave-to-enter",
        "url": "https://www.gov.uk/guidance/immigration-rules/immigration-rules-appendix-uk-ancestry",
        "scraped_at": "2025-12-06T17:29:33.646424"
      },
      "text": "### Entry requirements for UK Ancestry\n\nUKA 3.1. A person seeking to come to the UK on the UK Ancestry route must apply for and obtain entry clearance on the UK Ancestry route before they arrive in the UK.\n\nUKA 3.2. A person applying for entry clearance on the UK Ancestry route must, if Appendix Tuberculosis applies, provide a valid medical certificate confirming that they have undergone screening for active pulmonary tuberculosis and that this tuberculosis is not present in them.",
      "summary": "Applicants seeking UK Ancestry must obtain entry clearance before arriving, including providing a tuberculosis screening certificate if required.",
      "augmented_text": "Document: Immigration Rules Appendix UK Ancestry\nPart: Immigration Rules Appendix UK Ancestry\nSection ID: UKA 3.1\nSection: Entry requirements for UK Ancestry\nTopic: leave-to-enter\n\nSummary: Applicants seeking UK Ancestry must obtain entry clearance before arriving, including providing a tuberculosis screening certificate if required.\n\n### Entry requirements for UK Ancestry\n\nUKA 3.1. A person seeking to come to the UK on the UK Ancestry route must apply for and obtain entry clearance on the UK Ancestry route before they arrive in the UK.\n\nUKA 3.2. A person applying for entry clearance on the UK Ancestry route must, if Appendix Tuberculosis applies, provide a valid medical certificate confirming that they have undergone screening for active pulmonary tuberculosis and that this tuberculosis is not present in them.",
      "needs_review": false
    },
    {
      "metadata": {
        "source": "Immigration Rules Appendix UK Ancestry",
        "part": "Immigration Rules Appendix UK Ancestry",
        "section_id": "UKA 4.1",
        "section_title": "Grandparent born in the UK or Islands requirement",
        "parent_section": "UKA 4",
        "hierarchy_level": 2,
        "topic": "family",
        "url": "https://www.gov.uk/guidance/immigration-rules/immigration-rules-appendix-uk-ancestry",
        "scraped_at": "2025-12-06T17:29:33.646439"
      },
      "text": "### Grandparent born in the UK or Islands requirement\n\nUKA 4.1. The applicant must have a grandparent born in the UK or Islands.",
      "summary": "Applicants must prove that at least one grandparent was born in the UK or Islands to qualify under UKA 4.1; this requirement applies universally without specific exceptions.",
      "augmented_text": "Document: Immigration Rules Appendix UK Ancestry\nPart: Immigration Rules Appendix UK Ancestry\nSection ID: UKA 4.1\nSection: Grandparent born in the UK or Islands requirement\nTopic: family\n\nSummary: Applicants must prove that at least one grandparent was born in the UK or Islands to qualify under UKA 4.1; this requirement applies universally without specific exceptions.\n\n### Grandparent born in the UK or Islands requirement\n\nUKA 4.1. The applicant must have a grandparent born in the UK or Islands.",
      "needs_review": false
    },
    {
      "metadata": {
        "source": "Immigration Rules Appendix UK Ancestry",
        "part": "Immigration Rules Appendix UK Ancestry",
        "section_id": "UKA 5.1",
        "section_title": "Financial requirement for UK Ancestry",
        "parent_section": "UKA 5",
        "hierarchy_level": 2,
        "topic": "financial",
        "url": "https://www.gov.uk/guidance/immigration-rules/immigration-rules-appendix-uk-ancestry",
        "scraped_at": "2025-12-06T17:29:33.646455"
      },
      "text": "### Financial requirement for UK Ancestry\n\nUKA 5.1. The decision maker must be satisfied that the applicant can and will adequately maintain and accommodate themselves, and any dependants in the UK, or applying for entry clearance, without recourse to public funds.\n\nUKA 5.2. Funds must be shown as specified in Appendix Finance.\n\nUKA 5.3. In assessing whether the applicant meets the financial requirement in UKA 5.1, the decision maker may take into account credible promises of financial support from a third party, such as a relative or friend of the applicant.",
      "summary": "Applicants for UK Ancestry must demonstrate they can adequately support and accommodate themselves without relying on public funds, using funds as specified in Appendix Finance. Credible promises of financial support from third parties may also be considered.",
      "augmented_text": "Document: Immigration Rules Appendix UK Ancestry\nPart: Immigration Rules Appendix UK Ancestry\nSection ID: UKA 5.1\nSection: Financial requirement for UK Ancestry\nTopic: financial\n\nSummary: Applicants for UK Ancestry must demonstrate they can adequately support and accommodate themselves without relying on public funds, using funds as specified in Appendix Finance. Credible promises of financial support from third parties may also be considered.\n\n### Financial requirement for UK Ancestry\n\nUKA 5.1. The decision maker must be satisfied that the applicant can and will adequately maintain and accommodate themselves, and any dependants in the UK, or applying for entry clearance, without recourse to public funds.\n\nUKA 5.2. Funds must be shown as specified in Appendix Finance.\n\nUKA 5.3. In assessing whether the applicant meets the financial requirement in UKA 5.1, the decision maker may take into account credible promises of financial support from a third party, such as a relative or friend of the applicant.",
      "needs_review": false
    },
    {
      "metadata": {
        "source": "Immigration Rules Appendix UK Ancestry",
        "part": "Immigration Rules Appendix UK Ancestry",
        "section_id": "UKA 6.1",
        "section_title": "Work requirement for UK Ancestry",
        "parent_section": "UKA 6",
        "hierarchy_level": 2,
        "topic": "eligibility",
        "url": "https://www.gov.uk/guidance/immigration-rules/immigration-rules-appendix-uk-ancestry",
        "scraped_at": "2025-12-06T17:29:33.646469"
      },
      "text": "### Work requirement for UK Ancestry\n\nUKA 6.1. The applicant must be able to work and intend to seek and take employment in the UK.",
      "summary": "Applicants applying under UK Ancestry must demonstrate the ability and intention to seek and undertake employment in the UK; no specific employment sectors or job types are specified, but active engagement in employment is required.",
      "augmented_text": "Document: Immigration Rules Appendix UK Ancestry\nPart: Immigration Rules Appendix UK Ancestry\nSection ID: UKA 6.1\nSection: Work requirement for UK Ancestry\nTopic: eligibility\n\nSummary: Applicants applying under UK Ancestry must demonstrate the ability and intention to seek and undertake employment in the UK; no specific employment sectors or job types are specified, but active engagement in employment is required.\n\n### Work requirement for UK Ancestry\n\nUKA 6.1. The applicant must be able to work and intend to seek and take employment in the UK.",
      "needs_review": false
    },
    {
      "metadata": {
        "source": "Immigration Rules Appendix UK Ancestry",
        "part": "Immigration Rules Appendix UK Ancestry",
        "section_id": "1",
        "section_title": "Parental consent requirement for UK Ancestry applicant aged under 18",
        "parent_section": null,
        "hierarchy_level": 1,
        "topic": "family",
        "url": "https://www.gov.uk/guidance/immigration-rules/immigration-rules-appendix-uk-ancestry",
        "scraped_at": "2025-12-06T17:29:33.646484"
      },
      "text": "### Parental consent requirement for UK Ancestry applicant aged under 18\n\n1.   UKA 7.1. The applicant must meet the parental consent requirement for an applicant not applying as a dependent child in Appendix Children .\n\n1.   UKA 7.2. DELETED.",
      "summary": "Applicants under 18 applying for UK Ancestry must obtain parental consent unless qualifying as a dependent child under the Children Appendix. This requirement ensures minors’ legal approval before application, with certain exceptions outlined in the rules.",
      "augmented_text": "Document: Immigration Rules Appendix UK Ancestry\nPart: Immigration Rules Appendix UK Ancestry\nSection ID: 1\nSection: Parental consent requirement for UK Ancestry applicant aged under 18\nTopic: family\n\nSummary: Applicants under 18 applying for UK Ancestry must obtain parental consent unless qualifying as a dependent child under the Children Appendix. This requirement ensures minors’ legal approval before application, with certain exceptions outlined in the rules.\n\n### Parental consent requirement for UK Ancestry applicant aged under 18\n\n1.   UKA 7.1. The applicant must meet the parental consent requirement for an applicant not applying as a dependent child in Appendix Children .\n\n1.   UKA 7.2. DELETED.",
      "needs_review": false
    },
    {
      "metadata": {
        "source": "Immigration Rules Appendix UK Ancestry",
        "part": "Immigration Rules Appendix UK Ancestry",
        "section_id": "UKA 8.1",
        "section_title": "Decision on an application for UK Ancestry",
        "parent_section": "UKA 8",
        "hierarchy_level": 2,
        "topic": "eligibility",
        "url": "https://www.gov.uk/guidance/immigration-rules/immigration-rules-appendix-uk-ancestry",
        "scraped_at": "2025-12-06T17:29:33.646492"
      },
      "text": "### Decision on an application for UK Ancestry\n\nUKA 8.1. If the decision maker is satisfied that all the suitability and eligibility requirements are met for UK Ancestry, the application will be granted, otherwise the application will be refused.\n\nUKA 8.2. If the application is refused the person can apply for an Administrative Review under Appendix AR: Administrative Review.",
      "summary": "This provision applies to applicants seeking UK Ancestry. A decision will be granted if all suitability and eligibility criteria are met; otherwise, the application is refused, with a right to Administrative Review.",
      "augmented_text": "Document: Immigration Rules Appendix UK Ancestry\nPart: Immigration Rules Appendix UK Ancestry\nSection ID: UKA 8.1\nSection: Decision on an application for UK Ancestry\nTopic: eligibility\n\nSummary: This provision applies to applicants seeking UK Ancestry. A decision will be granted if all suitability and eligibility criteria are met; otherwise, the application is refused, with a right to Administrative Review.\n\n### Decision on an application for UK Ancestry\n\nUKA 8.1. If the decision maker is satisfied that all the suitability and eligibility requirements are met for UK Ancestry, the application will be granted, otherwise the application will be refused.\n\nUKA 8.2. If the application is refused the person can apply for an Administrative Review under Appendix AR: Administrative Review.",
      "needs_review": false
    },
    {
      "metadata": {
        "source": "Immigration Rules Appendix UK Ancestry",
        "part": "Immigration Rules Appendix UK Ancestry",
        "section_id": "UKA 9.1",
        "section_title": "Period of grant on the UK Ancestry route",
        "parent_section": "UKA 9",
        "hierarchy_level": 2,
        "topic": "duration",
        "url": "https://www.gov.uk/guidance/immigration-rules/immigration-rules-appendix-uk-ancestry",
        "scraped_at": "2025-12-06T17:29:33.646505"
      },
      "text": "### Period of grant on the UK Ancestry route\n\nUKA 9.1. The applicant will be granted permission for 5 years.",
      "summary": "Applicants applying under the UK Ancestry route will be granted permission for a period of 5 years, subject to compliance with relevant conditions.",
      "augmented_text": "Document: Immigration Rules Appendix UK Ancestry\nPart: Immigration Rules Appendix UK Ancestry\nSection ID: UKA 9.1\nSection: Period of grant on the UK Ancestry route\nTopic: duration\n\nSummary: Applicants applying under the UK Ancestry route will be granted permission for a period of 5 years, subject to compliance with relevant conditions.\n\n### Period of grant on the UK Ancestry route\n\nUKA 9.1. The applicant will be granted permission for 5 years.",
      "needs_review": false
    },
    {
      "metadata": {
        "source": "Immigration Rules Appendix UK Ancestry",
        "part": "Immigration Rules Appendix UK Ancestry",
        "section_id": "1",
        "section_title": "Conditions of grant on the UK Ancestry route",
        "parent_section": null,
        "hierarchy_level": 1,
        "topic": "financial",
        "url": "https://www.gov.uk/guidance/immigration-rules/immigration-rules-appendix-uk-ancestry",
        "scraped_at": "2025-12-06T17:29:33.646514"
      },
      "text": "### Conditions of grant on the UK Ancestry route\n\n1.   UKA 9.2. The grant will be subject to all the following conditions: \n    1.   (a) no access to public funds; and\n    2.   (b) work is permitted (including self-employment); and\n    3.   (c) voluntary work is permitted; and\n    4.   (d) study is permitted, subject to the ATAS condition in Appendix ATAS.\n    5.   (e) DELETED",
      "summary": "Applicants under the UK Ancestry route must not access public funds, are permitted to work (including self-employment) and voluntary work, and may study subject to ATAS requirements; these conditions apply to ensure compliance during their stay.",
      "augmented_text": "Document: Immigration Rules Appendix UK Ancestry\nPart: Immigration Rules Appendix UK Ancestry\nSection ID: 1\nSection: Conditions of grant on the UK Ancestry route\nTopic: financial\n\nSummary: Applicants under the UK Ancestry route must not access public funds, are permitted to work (including self-employment) and voluntary work, and may study subject to ATAS requirements; these conditions apply to ensure compliance during their stay.\n\n### Conditions of grant on the UK Ancestry route\n\n1.   UKA 9.2. The grant will be subject to all the following conditions: \n    1.   (a) no access to public funds; and\n    2.   (b) work is permitted (including self-employment); and\n    3.   (c) voluntary work is permitted; and\n    4.   (d) study is permitted, subject to the ATAS condition in Appendix ATAS.\n    5.   (e) DELETED",
      "needs_review": false
    },
    {
      "metadata": {
        "source": "Immigration Rules Appendix UK Ancestry",
        "part": "Immigration Rules Appendix UK Ancestry",
        "section_id": "Settlement on the UK Ancestry route",
        "section_title": "Settlement on the UK Ancestry route",
        "parent_section": null,
        "hierarchy_level": 2,
        "topic": "settlement",
        "url": "https://www.gov.uk/guidance/immigration-rules/immigration-rules-appendix-uk-ancestry",
        "scraped_at": "2025-12-06T17:29:33.646523"
      },
      "text": "### Settlement on the UK Ancestry route",
      "summary": "This provision applies to individuals seeking settlement on the UK Ancestry route. It requires applicants to satisfy specified residence, ancestry, and other eligibility criteria; failure to meet these conditions may result in application rejection or refusal of settlement. There are no additional exceptions beyond the standard eligibility thresholds.",
      "augmented_text": "Document: Immigration Rules Appendix UK Ancestry\nPart: Immigration Rules Appendix UK Ancestry\nSection ID: Settlement on the UK Ancestry route\nSection: Settlement on the UK Ancestry route\nTopic: settlement\n\nSummary: This provision applies to individuals seeking settlement on the UK Ancestry route. It requires applicants to satisfy specified residence, ancestry, and other eligibility criteria; failure to meet these conditions may result in application rejection or refusal of settlement. There are no additional exceptions beyond the standard eligibility thresholds.\n\n### Settlement on the UK Ancestry route",
      "needs_review": false
    },
    {
      "metadata": {
        "source": "Immigration Rules Appendix UK Ancestry",
        "part": "Immigration Rules Appendix UK Ancestry",
        "section_id": "UKA 10.1",
        "section_title": "Validity requirements for settlement on the UK Ancestry route",
        "parent_section": "UKA 10",
        "hierarchy_level": 2,
        "topic": "settlement",
        "url": "https://www.gov.uk/guidance/immigration-rules/immigration-rules-appendix-uk-ancestry",
        "scraped_at": "2025-12-06T17:29:33.646553"
      },
      "text": "### Validity requirements for settlement on the UK Ancestry route\n\nUKA 10.1. A person on the UK Ancestry route who is applying for settlement must apply online on the gov.uk website on the specified form “Settle in the UK in various immigration categories: form SET(O)”.\n\n1.   UKA 10.2. An application for settlement must meet all the following requirements: \n    1.   (a) any fee must have been paid; and\n    2.   (b) the applicant must have provided biometrics when required; and\n    3.   (c) the applicant must have provided a passport or other travel document which satisfactorily establishes their identity and nationality; and\n    4.   (d) the applicant must be in the UK.\n\nUKA 10.3. The applicant must be a Commonwealth citizen on the date of application.\n\nUKA 10.4. An application which does not meet all the validity requirements for settlement on the UK Ancestry route may be rejected as invalid and not considered.",
      "summary": "Applicants on the UK Ancestry route applying for settlement must submit an online application, pay fees, provide biometrics and valid travel documents, and be in the UK as a Commonwealth citizen. Failure to meet these conditions may result in rejection.",
      "augmented_text": "Document: Immigration Rules Appendix UK Ancestry\nPart: Immigration Rules Appendix UK Ancestry\nSection ID: UKA 10.1\nSection: Validity requirements for settlement on the UK Ancestry route\nTopic: settlement\n\nSummary: Applicants on the UK Ancestry route applying for settlement must submit an online application, pay fees, provide biometrics and valid travel documents, and be in the UK as a Commonwealth citizen. Failure to meet these conditions may result in rejection.\n\n### Validity requirements for settlement on the UK Ancestry route\n\nUKA 10.1. A person on the UK Ancestry route who is applying for settlement must apply online on the gov.uk website on the specified form “Settle in the UK in various immigration categories: form SET(O)”.\n\n1.   UKA 10.2. An application for settlement must meet all the following requirements: \n    1.   (a) any fee must have been paid; and\n    2.   (b) the applicant must have provided biometrics when required; and\n    3.   (c) the applicant must have provided a passport or other travel document which satisfactorily establishes their identity and nationality; and\n    4.   (d) the applicant must be in the UK.\n\nUKA 10.3. The applicant must be a Commonwealth citizen on the date of application.\n\nUKA 10.4. An application which does not meet all the validity requirements for settlement on the UK Ancestry route may be rejected as invalid and not considered.",
      "needs_review": false
    },
    {
      "metadata": {
        "source": "Immigration Rules Appendix UK Ancestry",
        "part": "Immigration Rules Appendix UK Ancestry",
        "section_id": "UKA 11.1",
        "section_title": "Suitability Requirements for settlement on the UK Ancestry route",
        "parent_section": "UKA 11",
        "hierarchy_level": 2,
        "topic": "suitability",
        "url": "https://www.gov.uk/guidance/immigration-rules/immigration-rules-appendix-uk-ancestry",
        "scraped_at": "2025-12-06T17:29:33.646566"
      },
      "text": "### Suitability Requirements for settlement on the UK Ancestry route\n\nUKA 11.1. The applicant must not fall for refusal under Part Suitability.\n\n1.   UKA 11.2. The applicant must not be: \n    1.   (a) in breach of immigration laws, except that where the Exceptions for overstayers section of Part Suitability applies, that period of overstaying will be disregarded; or\n    2.   (b) on immigration bail.",
      "summary": "Applicants applying for settlement via the UK Ancestry route must meet suitability criteria, including not breaching immigration laws (excluding permitted overstays) or being on bail. They must also satisfy Part Suitability requirements to avoid refusal.",
      "augmented_text": "Document: Immigration Rules Appendix UK Ancestry\nPart: Immigration Rules Appendix UK Ancestry\nSection ID: UKA 11.1\nSection: Suitability Requirements for settlement on the UK Ancestry route\nTopic: suitability\n\nSummary: Applicants applying for settlement via the UK Ancestry route must meet suitability criteria, including not breaching immigration laws (excluding permitted overstays) or being on bail. They must also satisfy Part Suitability requirements to avoid refusal.\n\n### Suitability Requirements for settlement on the UK Ancestry route\n\nUKA 11.1. The applicant must not fall for refusal under Part Suitability.\n\n1.   UKA 11.2. The applicant must not be: \n    1.   (a) in breach of immigration laws, except that where the Exceptions for overstayers section of Part Suitability applies, that period of overstaying will be disregarded; or\n    2.   (b) on immigration bail.",
      "needs_review": false
    },
    {
      "metadata": {
        "source": "Immigration Rules Appendix UK Ancestry",
        "part": "Immigration Rules Appendix UK Ancestry",
        "section_id": "UKA 12.1",
        "section_title": "Eligibility requirements for settlement on the UK Ancestry route",
        "parent_section": "UKA 12",
        "hierarchy_level": 2,
        "topic": "eligibility",
        "url": "https://www.gov.uk/guidance/immigration-rules/immigration-rules-appendix-uk-ancestry",
        "scraped_at": "2025-12-06T17:29:33.646572"
      },
      "text": "### Eligibility requirements for settlement on the UK Ancestry route\n\nUKA 12.1. The applicant must continue to meet the eligibility requirements of UKA 4.1 to UKA 6.1.",
      "summary": "Applicants seeking settlement via the UK Ancestry route must continue to meet the initial eligibility criteria outlined in UKA 4.1 to UKA 6.1; failure to do so may disqualify them from settlement.",
      "augmented_text": "Document: Immigration Rules Appendix UK Ancestry\nPart: Immigration Rules Appendix UK Ancestry\nSection ID: UKA 12.1\nSection: Eligibility requirements for settlement on the UK Ancestry route\nTopic: eligibility\n\nSummary: Applicants seeking settlement via the UK Ancestry route must continue to meet the initial eligibility criteria outlined in UKA 4.1 to UKA 6.1; failure to do so may disqualify them from settlement.\n\n### Eligibility requirements for settlement on the UK Ancestry route\n\nUKA 12.1. The applicant must continue to meet the eligibility requirements of UKA 4.1 to UKA 6.1.",
      "needs_review": false
    },
    {
      "metadata": {
        "source": "Immigration Rules Appendix UK Ancestry",
        "part": "Immigration Rules Appendix UK Ancestry",
        "section_id": "UKA 13.1",
        "section_title": "Qualifying period requirement for settlement on the UK Ancestry route",
        "parent_section": "UKA 13",
        "hierarchy_level": 2,
        "topic": "settlement",
        "url": "https://www.gov.uk/guidance/immigration-rules/immigration-rules-appendix-uk-ancestry",
        "scraped_at": "2025-12-06T17:29:33.646585"
      },
      "text": "### Qualifying period requirement for settlement on the UK Ancestry route\n\nUKA 13.1. The applicant must have spent 5 years in the UK with permission on the UK Ancestry route as a person with UK Ancestry.",
      "summary": "Applicants on the UK Ancestry route must have completed a continuous five-year period of lawful residence in the UK under this route to qualify for settlement; there are no specified exceptions.",
      "augmented_text": "Document: Immigration Rules Appendix UK Ancestry\nPart: Immigration Rules Appendix UK Ancestry\nSection ID: UKA 13.1\nSection: Qualifying period requirement for settlement on the UK Ancestry route\nTopic: settlement\n\nSummary: Applicants on the UK Ancestry route must have completed a continuous five-year period of lawful residence in the UK under this route to qualify for settlement; there are no specified exceptions.\n\n### Qualifying period requirement for settlement on the UK Ancestry route\n\nUKA 13.1. The applicant must have spent 5 years in the UK with permission on the UK Ancestry route as a person with UK Ancestry.",
      "needs_review": false
    },
    {
      "metadata": {
        "source": "Immigration Rules Appendix UK Ancestry",
        "part": "Immigration Rules Appendix UK Ancestry",
        "section_id": "UKA 14.1",
        "section_title": "Continuous residence requirement for settlement on the UK Ancestry route",
        "parent_section": "UKA 14",
        "hierarchy_level": 2,
        "topic": "settlement",
        "url": "https://www.gov.uk/guidance/immigration-rules/immigration-rules-appendix-uk-ancestry",
        "scraped_at": "2025-12-06T17:29:33.646598"
      },
      "text": "### Continuous residence requirement for settlement on the UK Ancestry route\n\nUKA 14.1. The applicant must meet the continuous residence requirement in Appendix Continuous Residence during the period in UKA 13.1.",
      "summary": "Applicants on the UK Ancestry route must satisfy the continuous residence requirement outlined in Appendix Continuous Residence during the specified period in UKA 13.1; failure to do so may affect their eligibility for settlement.",
      "augmented_text": "Document: Immigration Rules Appendix UK Ancestry\nPart: Immigration Rules Appendix UK Ancestry\nSection ID: UKA 14.1\nSection: Continuous residence requirement for settlement on the UK Ancestry route\nTopic: settlement\n\nSummary: Applicants on the UK Ancestry route must satisfy the continuous residence requirement outlined in Appendix Continuous Residence during the specified period in UKA 13.1; failure to do so may affect their eligibility for settlement.\n\n### Continuous residence requirement for settlement on the UK Ancestry route\n\nUKA 14.1. The applicant must meet the continuous residence requirement in Appendix Continuous Residence during the period in UKA 13.1.",
      "needs_review": false
    },
    {
      "metadata": {
        "source": "Immigration Rules Appendix UK Ancestry",
        "part": "Immigration Rules Appendix UK Ancestry",
        "section_id": "UKA 15.1",
        "section_title": "English language requirement for settlement on the UK Ancestry route",
        "parent_section": "UKA 15",
        "hierarchy_level": 2,
        "topic": "english-language",
        "url": "https://www.gov.uk/guidance/immigration-rules/immigration-rules-appendix-uk-ancestry",
        "scraped_at": "2025-12-06T17:29:33.646608"
      },
      "text": "### English language requirement for settlement on the UK Ancestry route\n\nUKA 15.1. Unless an exemption applies, the applicant must show English language ability on the Common European Framework of Reference for Languages in speaking and listening to at least level B1.\n\nUKA 15.2. The applicant must show they meet the English language requirement as specified in Appendix English Language.",
      "summary": "Applicants seeking settlement via the UK Ancestry route must, unless exempt, demonstrate at least B1 level speaking and listening English language proficiency under the CEFR. Exemptions may apply, and compliance with Appendix English Language is required.",
      "augmented_text": "Document: Immigration Rules Appendix UK Ancestry\nPart: Immigration Rules Appendix UK Ancestry\nSection ID: UKA 15.1\nSection: English language requirement for settlement on the UK Ancestry route\nTopic: english-language\n\nSummary: Applicants seeking settlement via the UK Ancestry route must, unless exempt, demonstrate at least B1 level speaking and listening English language proficiency under the CEFR. Exemptions may apply, and compliance with Appendix English Language is required.\n\n### English language requirement for settlement on the UK Ancestry route\n\nUKA 15.1. Unless an exemption applies, the applicant must show English language ability on the Common European Framework of Reference for Languages in speaking and listening to at least level B1.\n\nUKA 15.2. The applicant must show they meet the English language requirement as specified in Appendix English Language.",
      "needs_review": false
    },
    {
      "metadata": {
        "source": "Immigration Rules Appendix UK Ancestry",
        "part": "Immigration Rules Appendix UK Ancestry",
        "section_id": "UKA 16.1",
        "section_title": "Knowledge of life in the UK requirement for settlement on the UK Ancestry route",
        "parent_section": "UKA 16",
        "hierarchy_level": 2,
        "topic": "settlement",
        "url": "https://www.gov.uk/guidance/immigration-rules/immigration-rules-appendix-uk-ancestry",
        "scraped_at": "2025-12-06T17:29:33.646620"
      },
      "text": "### Knowledge of life in the UK requirement for settlement on the UK Ancestry route\n\nUKA 16.1. The applicant must meet the knowledge of Life in the UK requirement as specified in Appendix KOL UK.",
      "summary": "Applicants applying for settlement on the UK Ancestry route must demonstrate knowledge of life in the UK as specified in Appendix KOL UK; meeting this requirement is essential for approval.",
      "augmented_text": "Document: Immigration Rules Appendix UK Ancestry\nPart: Immigration Rules Appendix UK Ancestry\nSection ID: UKA 16.1\nSection: Knowledge of life in the UK requirement for settlement on the UK Ancestry route\nTopic: settlement\n\nSummary: Applicants applying for settlement on the UK Ancestry route must demonstrate knowledge of life in the UK as specified in Appendix KOL UK; meeting this requirement is essential for approval.\n\n### Knowledge of life in the UK requirement for settlement on the UK Ancestry route\n\nUKA 16.1. The applicant must meet the knowledge of Life in the UK requirement as specified in Appendix KOL UK.",
      "needs_review": false
    },
    {
      "metadata": {
        "source": "Immigration Rules Appendix UK Ancestry",
        "part": "Immigration Rules Appendix UK Ancestry",
        "section_id": "UKA 17.1",
        "section_title": "Decision on an application for settlement on the UK Ancestry route",
        "parent_section": "UKA 17",
        "hierarchy_level": 2,
        "topic": "eligibility",
        "url": "https://www.gov.uk/guidance/immigration-rules/immigration-rules-appendix-uk-ancestry",
        "scraped_at": "2025-12-06T17:29:33.646627"
      },
      "text": "### Decision on an application for settlement on the UK Ancestry route\n\nUKA 17.1. If the decision maker is satisfied all the suitability and eligibility requirements are met for settlement on the UK Ancestry route, the applicant will be granted settlement, otherwise the application will be refused.\n\nUKA 17.2. If the application is refused the person can apply for an Administrative Review under Appendix AR: Administrative Review.",
      "summary": "Applicants seeking settlement via the UK Ancestry route will be granted permission if all suitability and eligibility criteria are met; otherwise, the application is refused. If refused, applicants may request an Administrative Review.",
      "augmented_text": "Document: Immigration Rules Appendix UK Ancestry\nPart: Immigration Rules Appendix UK Ancestry\nSection ID: UKA 17.1\nSection: Decision on an application for settlement on the UK Ancestry route\nTopic: eligibility\n\nSummary: Applicants seeking settlement via the UK Ancestry route will be granted permission if all suitability and eligibility criteria are met; otherwise, the application is refused. If refused, applicants may request an Administrative Review.\n\n### Decision on an application for settlement on the UK Ancestry route\n\nUKA 17.1. If the decision maker is satisfied all the suitability and eligibility requirements are met for settlement on the UK Ancestry route, the applicant will be granted settlement, otherwise the application will be refused.\n\nUKA 17.2. If the application is refused the person can apply for an Administrative Review under Appendix AR: Administrative Review.",
      "needs_review": false
    },
    {
      "metadata": {
        "source": "Immigration Rules Appendix UK Ancestry",
        "part": "Immigration Rules Appendix UK Ancestry",
        "section_id": "UKA 1.1",
        "section_title": "Dependants of a person with UK Ancestry",
        "parent_section": null,
        "hierarchy_level": 2,
        "topic": "eligibility",
        "url": "https://www.gov.uk/guidance/immigration-rules/immigration-rules-appendix-uk-ancestry",
        "scraped_at": "2025-12-06T17:29:33.646637"
      },
      "text": "### Dependants of a person with UK Ancestry",
      "summary": "This provision applies to dependants of individuals with UK Ancestry seeking to join or remain in the UK. Dependants must meet requirements such as proving genuine relationship and, in some cases, financial or maintenance thresholds. Exceptions or specific conditions are not detailed in this excerpt.",
      "augmented_text": "Document: Immigration Rules Appendix UK Ancestry\nPart: Immigration Rules Appendix UK Ancestry\nSection ID: UKA 1.1\nSection: Dependants of a person with UK Ancestry\nTopic: eligibility\n\nSummary: This provision applies to dependants of individuals with UK Ancestry seeking to join or remain in the UK. Dependants must meet requirements such as proving genuine relationship and, in some cases, financial or maintenance thresholds. Exceptions or specific conditions are not detailed in this excerpt.\n\n### Dependants of a person with UK Ancestry",
      "needs_review": false
    },
    {
      "metadata": {
        "source": "Immigration Rules Appendix UK Ancestry",
        "part": "Immigration Rules Appendix UK Ancestry",
        "section_id": "1",
        "section_title": "Validity requirements for a dependent partner or dependent child on the UK Ancestry route",
        "parent_section": null,
        "hierarchy_level": 1,
        "topic": "leave-to-enter",
        "url": "https://www.gov.uk/guidance/immigration-rules/immigration-rules-appendix-uk-ancestry",
        "scraped_at": "2025-12-06T17:29:33.646658"
      },
      "text": "### Validity requirements for a dependent partner or dependent child on the UK Ancestry route\n\n1.   UKA 18.1. A person applying for entry clearance or permission to stay as a dependent partner or dependent child on the UK Ancestry route must apply online on the gov.uk website on the specified form as follows: \n    1.   (a) for entry clearance, “Join or accompany a family member” on the “Find and apply for other visas from outside the UK” form; or\n    2.   (b) for permission to stay, form “Application to extend stay in the UK: FLR(IR)”.\n\n1.   UKA 18.2. An application for entry clearance or permission to stay as a partner or child of a person on the UK Ancestry route must meet all the following requirements: \n    1.   (a) any fee and Immigration Health Charge must have been paid; and\n    2.   (b) the applicant must have provided biometrics when required; and\n    3.   (c) the applicant must have provided a passport or other travel document which satisfactorily establishes their identity and nationality; and\n    4.   (d) the applicant must be applying as partner or child of a person who: \n        1.   (i) has made a valid application for entry clearance or permission to stay on the UK Ancestry route that has not been decided; or\n        2.   (ii) has entry clearance or permission to stay on the UK Ancestry route; or\n        3.   (iii) is settled or has become a British citizen, providing that person (P) had permission on the UK Ancestry route when they settled.\n\n1.   UKA 18.3. If applying for permission to stay, the applicant must be in the UK on the date of application.\n2.   UKA 18.3ZA. If applying for permission to stay, the applicant must not have, or have last been granted, permission: \n    1.   (a) as a Visitor; or\n    2.   (b) as a Short-term Student; or\n    3.   (c) as a Parent of a Child Student; or\n    4.   (d) as a Seasonal Worker; or\n    5.   (e) as a Domestic Worker in a Private Household; or\n    6.   (f) outside the Immigration Rules.\n\n1.   UKA 18.3A. An applicant who is applying for permission to stay and has, or last had, permission as a Student, must fulfil one of the Conditions A or B below on the date of application: \n    1.   (a) Condition A: the applicant must have completed the course of study for which the Confirmation of Acceptance for Studies was assigned (or a course to which ST 27.3 of Appendix Student applies); or\n    2.   (b) Condition B: the applicant must: \n        1.   (i) be studying a full-time course of study leading to the award of a PhD with a higher education provider which has a track record of compliance; and\n        2.   (ii) have completed at least 24 months of study on that course.\n\nUKA 18.4. An application which does not meet all the validity requirements for a partner or child on the UK Ancestry route may be rejected as invalid and not considered.",
      "summary": "Dependents (partners or children) of UK Ancestry visa holders must apply online, pay applicable fees and health charges, provide biometrics and valid travel documents, and have a qualifying relationship to someone on the UK Ancestry route. The applicant’s sponsor must have a valid, pending, or settled UK Ancestry status at the time of application.",
      "augmented_text": "Document: Immigration Rules Appendix UK Ancestry\nPart: Immigration Rules Appendix UK Ancestry\nSection ID: 1\nSection: Validity requirements for a dependent partner or dependent child on the UK Ancestry route\nTopic: leave-to-enter\n\nSummary: Dependents (partners or children) of UK Ancestry visa holders must apply online, pay applicable fees and health charges, provide biometrics and valid travel documents, and have a qualifying relationship to someone on the UK Ancestry route. The applicant’s sponsor must have a valid, pending, or settled UK Ancestry status at the time of application.\n\n### Validity requirements for a dependent partner or dependent child on the UK Ancestry route\n\n1.   UKA 18.1. A person applying for entry clearance or permission to stay as a dependent partner or dependent child on the UK Ancestry route must apply online on the gov.uk website on the specified form as follows: \n    1.   (a) for entry clearance, “Join or accompany a family member” on the “Find and apply for other visas from outside the UK” form; or\n    2.   (b) for permission to stay, form “Application to extend stay in the UK: FLR(IR)”.\n\n1.   UKA 18.2. An application for entry clearance or permission to stay as a partner or child of a person on the UK Ancestry route must meet all the following requirements: \n    1.   (a) any fee and Immigration Health Charge must have been paid; and\n    2.   (b) the applicant must have provided biometrics when required; and\n    3.   (c) the applicant must have provided a passport or other travel document which satisfactorily establishes their identity and nationality; and\n    4.   (d) the applicant must be applying as partner or child of a person who: \n        1.   (i) has made a valid application for entry clearance or permission to stay on the UK Ancestry route that has not been decided; or\n        2.   (ii) has entry clearance or permission to stay on the UK Ancestry route; or\n        3.   (iii) is settled or has become a British citizen, providing that person (P) had permission on the UK Ancestry route when they settled.\n\n1.   UKA 18.3. If applying for permission to stay, the applicant must be in the UK on the date of application.\n2.   UKA 18.3ZA. If applying for permission to stay, the applicant must not have, or have last been granted, permission: \n    1.   (a) as a Visitor; or\n    2.   (b) as a Short-term Student; or\n    3.   (c) as a Parent of a Child Student; or\n    4.   (d) as a Seasonal Worker; or\n    5.   (e) as a Domestic Worker in a Private Household; or\n    6.   (f) outside the Immigration Rules.\n\n1.   UKA 18.3A. An applicant who is applying for permission to stay and has, or last had, permission as a Student, must fulfil one of the Conditions A or B below on the date of application: \n    1.   (a) Condition A: the applicant must have completed the course of study for which the Confirmation of Acceptance for Studies was assigned (or a course to which ST 27.3 of Appendix Student applies); or\n    2.   (b) Condition B: the applicant must: \n        1.   (i) be studying a full-time course of study leading to the award of a PhD with a higher education provider which has a track record of compliance; and\n        2.   (ii) have completed at least 24 months of study on that course.\n\nUKA 18.4. An application which does not meet all the validity requirements for a partner or child on the UK Ancestry route may be rejected as invalid and not considered.",
      "needs_review": false
    },
    {
      "metadata": {
        "source": "Immigration Rules Appendix UK Ancestry",
        "part": "Immigration Rules Appendix UK Ancestry",
        "section_id": "UKA 19.1",
        "section_title": "Suitability requirements for a dependent partner or dependent child on the UK Ancestry route",
        "parent_section": "UKA 19",
        "hierarchy_level": 2,
        "topic": "suitability",
        "url": "https://www.gov.uk/guidance/immigration-rules/immigration-rules-appendix-uk-ancestry",
        "scraped_at": "2025-12-06T17:29:33.646669"
      },
      "text": "### Suitability requirements for a dependent partner or dependent child on the UK Ancestry route\n\nUKA 19.1. The suitability requirements for a dependent partner or dependent child on the UK Ancestry route are that they must not fall for refusal under Part Suitability.\n\n1.   UKA 19.2. The applicant must not be: \n    1.   (a) in breach of immigration laws, except that where the Exceptions for overstayers section of Part Suitability applies, that period of overstaying will be disregarded; or\n    2.   (b) on immigration bail.",
      "summary": "Dependent partners or children on the UK Ancestry route must meet suitability criteria by not breaching immigration laws (subject to overstaying exceptions) or being on immigration bail.",
      "augmented_text": "Document: Immigration Rules Appendix UK Ancestry\nPart: Immigration Rules Appendix UK Ancestry\nSection ID: UKA 19.1\nSection: Suitability requirements for a dependent partner or dependent child on the UK Ancestry route\nTopic: suitability\n\nSummary: Dependent partners or children on the UK Ancestry route must meet suitability criteria by not breaching immigration laws (subject to overstaying exceptions) or being on immigration bail.\n\n### Suitability requirements for a dependent partner or dependent child on the UK Ancestry route\n\nUKA 19.1. The suitability requirements for a dependent partner or dependent child on the UK Ancestry route are that they must not fall for refusal under Part Suitability.\n\n1.   UKA 19.2. The applicant must not be: \n    1.   (a) in breach of immigration laws, except that where the Exceptions for overstayers section of Part Suitability applies, that period of overstaying will be disregarded; or\n    2.   (b) on immigration bail.",
      "needs_review": false
    },
    {
      "metadata": {
        "source": "Immigration Rules Appendix UK Ancestry",
        "part": "Immigration Rules Appendix UK Ancestry",
        "section_id": "Eligibility requirements for a dependent partner or dependent child on the UK Ancestry route",
        "section_title": "Eligibility requirements for a dependent partner or dependent child on the UK Ancestry route",
        "parent_section": null,
        "hierarchy_level": 3,
        "topic": "eligibility",
        "url": "https://www.gov.uk/guidance/immigration-rules/immigration-rules-appendix-uk-ancestry",
        "scraped_at": "2025-12-06T17:29:33.646674"
      },
      "text": "### Eligibility requirements for a dependent partner or dependent child on the UK Ancestry route",
      "summary": "This provision applies to dependent partners and children applying under the UK Ancestry route. They must demonstrate genuine dependence and meet eligibility criteria, including relationship and suitability requirements. Exceptions may apply if they fail to meet specified conditions or if their circumstances do not align with the route’s thresholds.",
      "augmented_text": "Document: Immigration Rules Appendix UK Ancestry\nPart: Immigration Rules Appendix UK Ancestry\nSection ID: Eligibility requirements for a dependent partner or dependent child on the UK Ancestry route\nSection: Eligibility requirements for a dependent partner or dependent child on the UK Ancestry route\nTopic: eligibility\n\nSummary: This provision applies to dependent partners and children applying under the UK Ancestry route. They must demonstrate genuine dependence and meet eligibility criteria, including relationship and suitability requirements. Exceptions may apply if they fail to meet specified conditions or if their circumstances do not align with the route’s thresholds.\n\n### Eligibility requirements for a dependent partner or dependent child on the UK Ancestry route",
      "needs_review": false
    },
    {
      "metadata": {
        "source": "Immigration Rules Appendix UK Ancestry",
        "part": "Immigration Rules Appendix UK Ancestry",
        "section_id": "UKA 20.1",
        "section_title": "Entry requirement for a dependent partner or dependent child on the UK Ancestry route",
        "parent_section": "UKA 20",
        "hierarchy_level": 2,
        "topic": "leave-to-enter",
        "url": "https://www.gov.uk/guidance/immigration-rules/immigration-rules-appendix-uk-ancestry",
        "scraped_at": "2025-12-06T17:29:33.646688"
      },
      "text": "### Entry requirement for a dependent partner or dependent child on the UK Ancestry route\n\nUKA 20.1. A person seeking to come to the UK as a partner or child must apply for and obtain an entry clearance as a partner or child before they arrive in the UK.\n\nUKA 20.2. A person applying for entry clearance as a partner or child on the UK Ancestry route must, if Appendix Tuberculosis applies, provide a valid medical certificate confirming that they have undergone screening for active pulmonary tuberculosis and that this tuberculosis is not present in them.",
      "summary": "Dependent partners or children applying under the UK Ancestry route must obtain entry clearance before arrival. They must also provide TB screening proof if applicable, complying with medical certification requirements.",
      "augmented_text": "Document: Immigration Rules Appendix UK Ancestry\nPart: Immigration Rules Appendix UK Ancestry\nSection ID: UKA 20.1\nSection: Entry requirement for a dependent partner or dependent child on the UK Ancestry route\nTopic: leave-to-enter\n\nSummary: Dependent partners or children applying under the UK Ancestry route must obtain entry clearance before arrival. They must also provide TB screening proof if applicable, complying with medical certification requirements.\n\n### Entry requirement for a dependent partner or dependent child on the UK Ancestry route\n\nUKA 20.1. A person seeking to come to the UK as a partner or child must apply for and obtain an entry clearance as a partner or child before they arrive in the UK.\n\nUKA 20.2. A person applying for entry clearance as a partner or child on the UK Ancestry route must, if Appendix Tuberculosis applies, provide a valid medical certificate confirming that they have undergone screening for active pulmonary tuberculosis and that this tuberculosis is not present in them.",
      "needs_review": false
    },
    {
      "metadata": {
        "source": "Immigration Rules Appendix UK Ancestry",
        "part": "Immigration Rules Appendix UK Ancestry",
        "section_id": "1",
        "section_title": "Relationship requirements for a partner on the UK Ancestry route",
        "parent_section": null,
        "hierarchy_level": 1,
        "topic": "family",
        "url": "https://www.gov.uk/guidance/immigration-rules/immigration-rules-appendix-uk-ancestry",
        "scraped_at": "2025-12-06T17:29:33.646724"
      },
      "text": "### Relationship requirements for a partner on the UK Ancestry route\n\n1.   UKA 21.1. The applicant must be the partner of a person (P) and one of the following must apply: \n    1.   (a) P has permission on the UK Ancestry route; or\n    2.   (b) P is, at the same time, applying for (and is granted) permission on the UK Ancestry route; or\n    3.   (c) if the applicant is applying for permission to stay, P is settled or has become a British citizen, providing P had permission on the UK Ancestry route when they settled.\n\nUKA 21.2. The requirements of Appendix Relationship with Partner must be met.\n\nUKA 21.3. DELETED\n\nUKA 21.4. DELETED",
      "summary": "This provision applies to partners applying via the UK Ancestry route. The applicant must be the partner of someone with current or former UK Ancestry permission or settled status gained while on that route, meeting specific relationship criteria. Critical conditions include P's permission status and relationship requirements outlined in the relevant appendix.",
      "augmented_text": "Document: Immigration Rules Appendix UK Ancestry\nPart: Immigration Rules Appendix UK Ancestry\nSection ID: 1\nSection: Relationship requirements for a partner on the UK Ancestry route\nTopic: family\n\nSummary: This provision applies to partners applying via the UK Ancestry route. The applicant must be the partner of someone with current or former UK Ancestry permission or settled status gained while on that route, meeting specific relationship criteria. Critical conditions include P's permission status and relationship requirements outlined in the relevant appendix.\n\n### Relationship requirements for a partner on the UK Ancestry route\n\n1.   UKA 21.1. The applicant must be the partner of a person (P) and one of the following must apply: \n    1.   (a) P has permission on the UK Ancestry route; or\n    2.   (b) P is, at the same time, applying for (and is granted) permission on the UK Ancestry route; or\n    3.   (c) if the applicant is applying for permission to stay, P is settled or has become a British citizen, providing P had permission on the UK Ancestry route when they settled.\n\nUKA 21.2. The requirements of Appendix Relationship with Partner must be met.\n\nUKA 21.3. DELETED\n\nUKA 21.4. DELETED",
      "needs_review": false
    },
    {
      "metadata": {
        "source": "Immigration Rules Appendix UK Ancestry",
        "part": "Immigration Rules Appendix UK Ancestry",
        "section_id": "1",
        "section_title": "Relationship requirement for a dependent child on the UK Ancestry route",
        "parent_section": null,
        "hierarchy_level": 1,
        "topic": "family",
        "url": "https://www.gov.uk/guidance/immigration-rules/immigration-rules-appendix-uk-ancestry",
        "scraped_at": "2025-12-06T17:29:33.646816"
      },
      "text": "### Relationship requirement for a dependent child on the UK Ancestry route\n\n1.   UKA 22.1. DELETED.\n\n1.   UKA 22.2. DELETED.",
      "summary": "This provision applies to dependent children heading to the UK via the Ancestry route. It requires verifying the child's relationship with the applicant and ensuring they meet the specified criteria, with detailed conditions possibly outlined elsewhere. No specific exceptions are provided in this excerpt.",
      "augmented_text": "Document: Immigration Rules Appendix UK Ancestry\nPart: Immigration Rules Appendix UK Ancestry\nSection ID: 1\nSection: Relationship requirement for a dependent child on the UK Ancestry route\nTopic: family\n\nSummary: This provision applies to dependent children heading to the UK via the Ancestry route. It requires verifying the child's relationship with the applicant and ensuring they meet the specified criteria, with detailed conditions possibly outlined elsewhere. No specific exceptions are provided in this excerpt.\n\n### Relationship requirement for a dependent child on the UK Ancestry route\n\n1.   UKA 22.1. DELETED.\n\n1.   UKA 22.2. DELETED.",
      "needs_review": false
    },
    {
      "metadata": {
        "source": "Immigration Rules Appendix UK Ancestry",
        "part": "Immigration Rules Appendix UK Ancestry",
        "section_id": "UKA 23.1",
        "section_title": "Care requirement for a dependent child on the UK Ancestry route",
        "parent_section": "UKA 23",
        "hierarchy_level": 2,
        "topic": "family",
        "url": "https://www.gov.uk/guidance/immigration-rules/immigration-rules-appendix-uk-ancestry",
        "scraped_at": "2025-12-06T17:29:33.646837"
      },
      "text": "### Care requirement for a dependent child on the UK Ancestry route\n\nUKA 23.1. DELETED.",
      "summary": "This provision applies to dependent children applying via the UK Ancestry route. They must demonstrate they are in genuine need of care and are supported by their parent or guardian in the UK. No specific conditions or exceptions are detailed in the provided snippet.",
      "augmented_text": "Document: Immigration Rules Appendix UK Ancestry\nPart: Immigration Rules Appendix UK Ancestry\nSection ID: UKA 23.1\nSection: Care requirement for a dependent child on the UK Ancestry route\nTopic: family\n\nSummary: This provision applies to dependent children applying via the UK Ancestry route. They must demonstrate they are in genuine need of care and are supported by their parent or guardian in the UK. No specific conditions or exceptions are detailed in the provided snippet.\n\n### Care requirement for a dependent child on the UK Ancestry route\n\nUKA 23.1. DELETED.",
      "needs_review": false
    },
    {
      "metadata": {
        "source": "Immigration Rules Appendix UK Ancestry",
        "part": "Immigration Rules Appendix UK Ancestry",
        "section_id": "UKA 24.1",
        "section_title": "Age requirement for a dependent child on the UK Ancestry route",
        "parent_section": "UKA 24",
        "hierarchy_level": 2,
        "topic": "family",
        "url": "https://www.gov.uk/guidance/immigration-rules/immigration-rules-appendix-uk-ancestry",
        "scraped_at": "2025-12-06T17:29:33.646852"
      },
      "text": "### Age requirement for a dependent child on the UK Ancestry route\n\nUKA 24.1. DELETED.\n\nUKA 24.2. DELETED.",
      "summary": "This provision pertains to dependent children applying via the UK Ancestry route. It requires that the child is under 18 years old at the date of application, with no specified exceptions. The age threshold is a key eligibility criterion for dependents under this route.",
      "augmented_text": "Document: Immigration Rules Appendix UK Ancestry\nPart: Immigration Rules Appendix UK Ancestry\nSection ID: UKA 24.1\nSection: Age requirement for a dependent child on the UK Ancestry route\nTopic: family\n\nSummary: This provision pertains to dependent children applying via the UK Ancestry route. It requires that the child is under 18 years old at the date of application, with no specified exceptions. The age threshold is a key eligibility criterion for dependents under this route.\n\n### Age requirement for a dependent child on the UK Ancestry route\n\nUKA 24.1. DELETED.\n\nUKA 24.2. DELETED.",
      "needs_review": false
    },
    {
      "metadata": {
        "source": "Immigration Rules Appendix UK Ancestry",
        "part": "Immigration Rules Appendix UK Ancestry",
        "section_id": "1",
        "section_title": "Requirements for a dependent child on the UK Ancestry route",
        "parent_section": null,
        "hierarchy_level": 1,
        "topic": "leave-to-enter",
        "url": "https://www.gov.uk/guidance/immigration-rules/immigration-rules-appendix-uk-ancestry",
        "scraped_at": "2025-12-06T17:29:33.646874"
      },
      "text": "### Requirements for a dependent child on the UK Ancestry route\n\n1.   UKA 24A.1. The applicant must meet the following requirements for a dependent child in Appendix Children: \n    1.   (a) relationship requirement: entry clearance and permission to stay; and\n    2.   (b) care requirement; and\n    3.   (c) age and independent life requirement.",
      "summary": "Dependent children applying via the UK Ancestry route must meet relationship, care, and age/independence requirements as specified in Appendix Children, with entry clearance and stay permission contingent on these conditions.",
      "augmented_text": "Document: Immigration Rules Appendix UK Ancestry\nPart: Immigration Rules Appendix UK Ancestry\nSection ID: 1\nSection: Requirements for a dependent child on the UK Ancestry route\nTopic: leave-to-enter\n\nSummary: Dependent children applying via the UK Ancestry route must meet relationship, care, and age/independence requirements as specified in Appendix Children, with entry clearance and stay permission contingent on these conditions.\n\n### Requirements for a dependent child on the UK Ancestry route\n\n1.   UKA 24A.1. The applicant must meet the following requirements for a dependent child in Appendix Children: \n    1.   (a) relationship requirement: entry clearance and permission to stay; and\n    2.   (b) care requirement; and\n    3.   (c) age and independent life requirement.",
      "needs_review": false
    },
    {
      "metadata": {
        "source": "Immigration Rules Appendix UK Ancestry",
        "part": "Immigration Rules Appendix UK Ancestry",
        "section_id": "UKA 25.1",
        "section_title": "Financial requirement for a partner or child on the UK Ancestry route",
        "parent_section": "UKA 25",
        "hierarchy_level": 2,
        "topic": "financial",
        "url": "https://www.gov.uk/guidance/immigration-rules/immigration-rules-appendix-uk-ancestry",
        "scraped_at": "2025-12-06T17:29:33.646884"
      },
      "text": "### Financial requirement for a partner or child on the UK Ancestry route\n\nUKA 25.1. The decision maker must be satisfied that there will be adequate maintenance and accommodation for the applicant, the person with UK Ancestry, and any other dependants in the UK, without recourse to public funds.\n\nUKA 25.2. Funds must be shown as specified in Appendix Finance.\n\nUKA 25.3. In assessing whether the applicant meets the financial requirement in UKA 25.1, the decision maker may take into account credible promises of financial support from a third party, such as a relative or friend of the applicant.",
      "summary": "This provision applies to partners or children on the UK Ancestry route. Applicants must demonstrate adequate maintenance and accommodation without recourse to public funds, with funds shown as per Appendix Finance. Credible promises of financial support from third parties may be considered.",
      "augmented_text": "Document: Immigration Rules Appendix UK Ancestry\nPart: Immigration Rules Appendix UK Ancestry\nSection ID: UKA 25.1\nSection: Financial requirement for a partner or child on the UK Ancestry route\nTopic: financial\n\nSummary: This provision applies to partners or children on the UK Ancestry route. Applicants must demonstrate adequate maintenance and accommodation without recourse to public funds, with funds shown as per Appendix Finance. Credible promises of financial support from third parties may be considered.\n\n### Financial requirement for a partner or child on the UK Ancestry route\n\nUKA 25.1. The decision maker must be satisfied that there will be adequate maintenance and accommodation for the applicant, the person with UK Ancestry, and any other dependants in the UK, without recourse to public funds.\n\nUKA 25.2. Funds must be shown as specified in Appendix Finance.\n\nUKA 25.3. In assessing whether the applicant meets the financial requirement in UKA 25.1, the decision maker may take into account credible promises of financial support from a third party, such as a relative or friend of the applicant.",
      "needs_review": false
    },
    {
      "metadata": {
        "source": "Immigration Rules Appendix UK Ancestry",
        "part": "Immigration Rules Appendix UK Ancestry",
        "section_id": "UKA 26.1",
        "section_title": "Decision on an application for a dependent partner and dependent child on the UK Ancestry route",
        "parent_section": "UKA 26",
        "hierarchy_level": 2,
        "topic": "eligibility",
        "url": "https://www.gov.uk/guidance/immigration-rules/immigration-rules-appendix-uk-ancestry",
        "scraped_at": "2025-12-06T17:29:33.646892"
      },
      "text": "### Decision on an application for a dependent partner and dependent child on the UK Ancestry route\n\nUKA 26.1. If the decision maker is satisfied that all the suitability and eligibility requirements are met for a dependent partner or dependent child on the UK Ancestry route, the application will be granted, otherwise the application will be refused.\n\nUKA 26.2. If the application is refused the person can apply for an Administrative Review under Appendix AR: Administrative Review.",
      "summary": "This provision applies to dependent partners and children applying under the UK Ancestry route. It requires the decision-maker to confirm all suitability and eligibility criteria are met for approval; otherwise, the application is refused, but applicants may request an Administrative Review.",
      "augmented_text": "Document: Immigration Rules Appendix UK Ancestry\nPart: Immigration Rules Appendix UK Ancestry\nSection ID: UKA 26.1\nSection: Decision on an application for a dependent partner and dependent child on the UK Ancestry route\nTopic: eligibility\n\nSummary: This provision applies to dependent partners and children applying under the UK Ancestry route. It requires the decision-maker to confirm all suitability and eligibility criteria are met for approval; otherwise, the application is refused, but applicants may request an Administrative Review.\n\n### Decision on an application for a dependent partner and dependent child on the UK Ancestry route\n\nUKA 26.1. If the decision maker is satisfied that all the suitability and eligibility requirements are met for a dependent partner or dependent child on the UK Ancestry route, the application will be granted, otherwise the application will be refused.\n\nUKA 26.2. If the application is refused the person can apply for an Administrative Review under Appendix AR: Administrative Review.",
      "needs_review": false
    },
    {
      "metadata": {
        "source": "Immigration Rules Appendix UK Ancestry",
        "part": "Immigration Rules Appendix UK Ancestry",
        "section_id": "UKA 27.1",
        "section_title": "Period of grant for a dependent partner and dependent child on the UK Ancestry route",
        "parent_section": "UKA 27",
        "hierarchy_level": 2,
        "topic": "family",
        "url": "https://www.gov.uk/guidance/immigration-rules/immigration-rules-appendix-uk-ancestry",
        "scraped_at": "2025-12-06T17:29:33.646908"
      },
      "text": "### Period of grant for a dependent partner and dependent child on the UK Ancestry route\n\nUKA 27.1. Unless UKA 27.2 applies, the applicant will be granted permission which ends on the same date as the person with UK Ancestry.\n\nUKA 27.2. If the application is for permission to stay, and the person with UK Ancestry is being, or has been, granted settlement on the UK Ancestry route, or has become a British Citizen having previously had permission on the UK Ancestry route, the applicant will be granted permission to stay for 30 months.",
      "summary": "Dependent partners and children of UK Ancestry route applicants are granted permission until the same expiry as the principal applicant, unless the principal has settled or become a British citizen, in which case they receive a 30-month stay.",
      "augmented_text": "Document: Immigration Rules Appendix UK Ancestry\nPart: Immigration Rules Appendix UK Ancestry\nSection ID: UKA 27.1\nSection: Period of grant for a dependent partner and dependent child on the UK Ancestry route\nTopic: family\n\nSummary: Dependent partners and children of UK Ancestry route applicants are granted permission until the same expiry as the principal applicant, unless the principal has settled or become a British citizen, in which case they receive a 30-month stay.\n\n### Period of grant for a dependent partner and dependent child on the UK Ancestry route\n\nUKA 27.1. Unless UKA 27.2 applies, the applicant will be granted permission which ends on the same date as the person with UK Ancestry.\n\nUKA 27.2. If the application is for permission to stay, and the person with UK Ancestry is being, or has been, granted settlement on the UK Ancestry route, or has become a British Citizen having previously had permission on the UK Ancestry route, the applicant will be granted permission to stay for 30 months.",
      "needs_review": false
    },
    {
      "metadata": {
        "source": "Immigration Rules Appendix UK Ancestry",
        "part": "Immigration Rules Appendix UK Ancestry",
        "section_id": "1",
        "section_title": "Conditions of grant for a dependent partner and dependent child on the UK Ancestry route",
        "parent_section": null,
        "hierarchy_level": 1,
        "topic": "financial",
        "url": "https://www.gov.uk/guidance/immigration-rules/immigration-rules-appendix-uk-ancestry",
        "scraped_at": "2025-12-06T17:29:33.646917"
      },
      "text": "### Conditions of grant for a dependent partner and dependent child on the UK Ancestry route\n\n1.   UKA 27.3. The grant will be subject to all the following conditions: \n    1.   (a) no access to public funds; and\n    2.   (b) work (including self-employment and voluntary work) permitted; and\n    3.   (c) study is permitted, subject to the ATAS condition in Appendix ATAS.\n    4.   (d) DELETED",
      "summary": "Dependent partners and children on the UK Ancestry route must not access public funds, are permitted to work and study (with ATAS approval), subject to specified conditions.",
      "augmented_text": "Document: Immigration Rules Appendix UK Ancestry\nPart: Immigration Rules Appendix UK Ancestry\nSection ID: 1\nSection: Conditions of grant for a dependent partner and dependent child on the UK Ancestry route\nTopic: financial\n\nSummary: Dependent partners and children on the UK Ancestry route must not access public funds, are permitted to work and study (with ATAS approval), subject to specified conditions.\n\n### Conditions of grant for a dependent partner and dependent child on the UK Ancestry route\n\n1.   UKA 27.3. The grant will be subject to all the following conditions: \n    1.   (a) no access to public funds; and\n    2.   (b) work (including self-employment and voluntary work) permitted; and\n    3.   (c) study is permitted, subject to the ATAS condition in Appendix ATAS.\n    4.   (d) DELETED",
      "needs_review": false
    },
    {
      "metadata": {
        "source": "Immigration Rules Appendix UK Ancestry",
        "part": "Immigration Rules Appendix UK Ancestry",
        "section_id": "Settlement by a dependent partner and dependent child on the UK Ancestry route",
        "section_title": "Settlement by a dependent partner and dependent child on the UK Ancestry route",
        "parent_section": null,
        "hierarchy_level": 3,
        "topic": "settlement",
        "url": "https://www.gov.uk/guidance/immigration-rules/immigration-rules-appendix-uk-ancestry",
        "scraped_at": "2025-12-06T17:29:33.646926"
      },
      "text": "### Settlement by a dependent partner and dependent child on the UK Ancestry route",
      "summary": "This provision applies to dependent partners and children applying for settlement under the UK Ancestry route. They must demonstrate continued family relationship and meet the eligibility requirements; certain conditions or thresholds may apply, such as evidence of genuine dependency.",
      "augmented_text": "Document: Immigration Rules Appendix UK Ancestry\nPart: Immigration Rules Appendix UK Ancestry\nSection ID: Settlement by a dependent partner and dependent child on the UK Ancestry route\nSection: Settlement by a dependent partner and dependent child on the UK Ancestry route\nTopic: settlement\n\nSummary: This provision applies to dependent partners and children applying for settlement under the UK Ancestry route. They must demonstrate continued family relationship and meet the eligibility requirements; certain conditions or thresholds may apply, such as evidence of genuine dependency.\n\n### Settlement by a dependent partner and dependent child on the UK Ancestry route",
      "needs_review": false
    },
    {
      "metadata": {
        "source": "Immigration Rules Appendix UK Ancestry",
        "part": "Immigration Rules Appendix UK Ancestry",
        "section_id": "UKA 28.1",
        "section_title": "Validity requirements for settlement by a dependent partner or dependent child on the UK Ancestry route",
        "parent_section": "UKA 28",
        "hierarchy_level": 2,
        "topic": "settlement",
        "url": "https://www.gov.uk/guidance/immigration-rules/immigration-rules-appendix-uk-ancestry",
        "scraped_at": "2025-12-06T17:29:33.646951"
      },
      "text": "### Validity requirements for settlement by a dependent partner or dependent child on the UK Ancestry route\n\nUKA 28.1. A partner or child on the UK Ancestry route who is applying for settlement must apply online on the gov.uk website on the specified form “Settle in the UK in various immigration categories: form SET(O)”.\n\n1.   UKA 28.2. An application for settlement must meet all the following requirements: \n    1.   (a) any fee must have been paid; and\n    2.   (b) the applicant must have provided biometrics when required; and\n    3.   (c) the applicant must have provided either a passport or other travel document which satisfactorily establishes their identity and nationality; and\n    4.   (d) the applicant must be in the UK; and\n    5.   (e) the applicant must be applying as a partner or child of a person (P) who: \n        1.   (i) has made a valid application for settlement on the UK Ancestry route and that application has not been decided; or\n        2.   (ii) is settled or has become a British citizen, providing P had permission on the UK Ancestry route when they settled.\n\n1.   UKA 28.3. The applicant must not have, or have last been granted, permission: \n    1.   (a) as a Visitor; or\n    2.   (b) as a Short-term Student; or\n    3.   (c) as a Parent of a Child Student; or\n    4.   (d) as a Seasonal Worker; or\n    5.   (e) as a Domestic Worker in a Private Household; or\n    6.   (f) outside the Immigration Rules.\n\n1.   UKA 28.3A. An applicant who has, or last had, permission as a Student, must fulfil one of the Conditions A or B below on the date of application: \n    1.   (a) Condition A: the applicant must have completed the course of study for which the Confirmation of Acceptance for Studies was assigned (or a course to which ST 27.3 of Appendix Student applies); or\n    2.   (b) Condition B: the applicant must: \n        1.   (i) be studying a full-time course of study leading to the award of a PhD with a higher education provider which has a track record of compliance; and\n        2.   (ii) have completed at least 24 months of study on that course.\n\nUKA 28.4. An application which does not meet the validity requirements for settlement as a partner or child on the UK Ancestry route may be rejected as invalid and not considered.",
      "summary": "Dependent partners or children applying for settlement under the UK Ancestry route must submit an online application, paying fees, providing biometrics and proof of identity, and be in the UK. They must be linked to a sponsor with a valid or settled UK Ancestry application and must not have previous permission as a visitor, student, seasonal worker, or domestic worker.",
      "augmented_text": "Document: Immigration Rules Appendix UK Ancestry\nPart: Immigration Rules Appendix UK Ancestry\nSection ID: UKA 28.1\nSection: Validity requirements for settlement by a dependent partner or dependent child on the UK Ancestry route\nTopic: settlement\n\nSummary: Dependent partners or children applying for settlement under the UK Ancestry route must submit an online application, paying fees, providing biometrics and proof of identity, and be in the UK. They must be linked to a sponsor with a valid or settled UK Ancestry application and must not have previous permission as a visitor, student, seasonal worker, or domestic worker.\n\n### Validity requirements for settlement by a dependent partner or dependent child on the UK Ancestry route\n\nUKA 28.1. A partner or child on the UK Ancestry route who is applying for settlement must apply online on the gov.uk website on the specified form “Settle in the UK in various immigration categories: form SET(O)”.\n\n1.   UKA 28.2. An application for settlement must meet all the following requirements: \n    1.   (a) any fee must have been paid; and\n    2.   (b) the applicant must have provided biometrics when required; and\n    3.   (c) the applicant must have provided either a passport or other travel document which satisfactorily establishes their identity and nationality; and\n    4.   (d) the applicant must be in the UK; and\n    5.   (e) the applicant must be applying as a partner or child of a person (P) who: \n        1.   (i) has made a valid application for settlement on the UK Ancestry route and that application has not been decided; or\n        2.   (ii) is settled or has become a British citizen, providing P had permission on the UK Ancestry route when they settled.\n\n1.   UKA 28.3. The applicant must not have, or have last been granted, permission: \n    1.   (a) as a Visitor; or\n    2.   (b) as a Short-term Student; or\n    3.   (c) as a Parent of a Child Student; or\n    4.   (d) as a Seasonal Worker; or\n    5.   (e) as a Domestic Worker in a Private Household; or\n    6.   (f) outside the Immigration Rules.\n\n1.   UKA 28.3A. An applicant who has, or last had, permission as a Student, must fulfil one of the Conditions A or B below on the date of application: \n    1.   (a) Condition A: the applicant must have completed the course of study for which the Confirmation of Acceptance for Studies was assigned (or a course to which ST 27.3 of Appendix Student applies); or\n    2.   (b) Condition B: the applicant must: \n        1.   (i) be studying a full-time course of study leading to the award of a PhD with a higher education provider which has a track record of compliance; and\n        2.   (ii) have completed at least 24 months of study on that course.\n\nUKA 28.4. An application which does not meet the validity requirements for settlement as a partner or child on the UK Ancestry route may be rejected as invalid and not considered.",
      "needs_review": false
    },
    {
      "metadata": {
        "source": "Immigration Rules Appendix UK Ancestry",
        "part": "Immigration Rules Appendix UK Ancestry",
        "section_id": "UKA 29.1",
        "section_title": "Suitability requirements for settlement by a dependent partner and dependent child on the UK Ancestry route",
        "parent_section": "UKA 29",
        "hierarchy_level": 2,
        "topic": "suitability",
        "url": "https://www.gov.uk/guidance/immigration-rules/immigration-rules-appendix-uk-ancestry",
        "scraped_at": "2025-12-06T17:29:33.646963"
      },
      "text": "### Suitability requirements for settlement by a dependent partner and dependent child on the UK Ancestry route\n\nUKA 29.1. The applicant must not fall for refusal under Part Suitability.\n\n1.   UKA 29.2. The applicant must not be: \n    1.   (a) in breach of immigration laws, except that where the Exceptions for overstayers section of Part Suitability applies, that period of overstaying will be disregarded; or\n    2.   (b) on immigration bail.",
      "summary": "This provision applies to dependent partners and children applying for settlement on the UK Ancestry route. They must meet suitability requirements, including not breaching immigration laws (unless overstaying is disregarded under specific exceptions) or being on immigration bail.",
      "augmented_text": "Document: Immigration Rules Appendix UK Ancestry\nPart: Immigration Rules Appendix UK Ancestry\nSection ID: UKA 29.1\nSection: Suitability requirements for settlement by a dependent partner and dependent child on the UK Ancestry route\nTopic: suitability\n\nSummary: This provision applies to dependent partners and children applying for settlement on the UK Ancestry route. They must meet suitability requirements, including not breaching immigration laws (unless overstaying is disregarded under specific exceptions) or being on immigration bail.\n\n### Suitability requirements for settlement by a dependent partner and dependent child on the UK Ancestry route\n\nUKA 29.1. The applicant must not fall for refusal under Part Suitability.\n\n1.   UKA 29.2. The applicant must not be: \n    1.   (a) in breach of immigration laws, except that where the Exceptions for overstayers section of Part Suitability applies, that period of overstaying will be disregarded; or\n    2.   (b) on immigration bail.",
      "needs_review": false
    },
    {
      "metadata": {
        "source": "Immigration Rules Appendix UK Ancestry",
        "part": "Immigration Rules Appendix UK Ancestry",
        "section_id": "Eligibility requirements for settlement by a dependent partner or dependent child on the UK Ancestry route",
        "section_title": "Eligibility requirements for settlement by a dependent partner or dependent child on the UK Ancestry route",
        "parent_section": null,
        "hierarchy_level": 3,
        "topic": "eligibility",
        "url": "https://www.gov.uk/guidance/immigration-rules/immigration-rules-appendix-uk-ancestry",
        "scraped_at": "2025-12-06T17:29:33.646970"
      },
      "text": "### Eligibility requirements for settlement by a dependent partner or dependent child on the UK Ancestry route\n\nRelationship requirement for settlement by a partner or child on the UK Ancestry route\n\n1.   UKA 30.1. The applicant must be the partner or child of a person (P) where one of the following applies: \n    1.   (a) P is, at the same time, being granted settlement on the UK Ancestry route; or\n    2.   (b) P is settled or has become a British citizen, providing P had permission on the UK Ancestry route when they settled.\n\nUKA 30.2. If applying as a partner, the requirements of Appendix Relationship with Partner must be met.\n\nUKA 30.3. DELETED\n\nUKA 30.4. DELETED\n\nUKA 30.5. If applying as a child, the applicant must meet the relationship requirement for settlement in Appendix Children.",
      "summary": "Dependent partners or children applying for settlement on the UK Ancestry route must be related to an individual who is either granted settlement or British citizenship under the route. Partners must also satisfy specific relationship criteria, and children must meet additional relationship requirements outlined in the relevant appendix.",
      "augmented_text": "Document: Immigration Rules Appendix UK Ancestry\nPart: Immigration Rules Appendix UK Ancestry\nSection ID: Eligibility requirements for settlement by a dependent partner or dependent child on the UK Ancestry route\nSection: Eligibility requirements for settlement by a dependent partner or dependent child on the UK Ancestry route\nTopic: eligibility\n\nSummary: Dependent partners or children applying for settlement on the UK Ancestry route must be related to an individual who is either granted settlement or British citizenship under the route. Partners must also satisfy specific relationship criteria, and children must meet additional relationship requirements outlined in the relevant appendix.\n\n### Eligibility requirements for settlement by a dependent partner or dependent child on the UK Ancestry route\n\nRelationship requirement for settlement by a partner or child on the UK Ancestry route\n\n1.   UKA 30.1. The applicant must be the partner or child of a person (P) where one of the following applies: \n    1.   (a) P is, at the same time, being granted settlement on the UK Ancestry route; or\n    2.   (b) P is settled or has become a British citizen, providing P had permission on the UK Ancestry route when they settled.\n\nUKA 30.2. If applying as a partner, the requirements of Appendix Relationship with Partner must be met.\n\nUKA 30.3. DELETED\n\nUKA 30.4. DELETED\n\nUKA 30.5. If applying as a child, the applicant must meet the relationship requirement for settlement in Appendix Children.",
      "needs_review": false
    },
    {
      "metadata": {
        "source": "Immigration Rules Appendix UK Ancestry",
        "part": "Immigration Rules Appendix UK Ancestry",
        "section_id": "UKA 31.1",
        "section_title": "Care requirement for settlement by a child on the UK Ancestry route",
        "parent_section": "UKA 31",
        "hierarchy_level": 2,
        "topic": "settlement",
        "url": "https://www.gov.uk/guidance/immigration-rules/immigration-rules-appendix-uk-ancestry",
        "scraped_at": "2025-12-06T17:29:33.646981"
      },
      "text": "### Care requirement for settlement by a child on the UK Ancestry route\n\nUKA 31.1. DELETED.",
      "summary": "This provision applies to children seeking settlement via the UK Ancestry route. It requires the parent or guardian to have provided proper care and support suitable for the child's wellbeing. There are no specific exceptions detailed in this excerpt.",
      "augmented_text": "Document: Immigration Rules Appendix UK Ancestry\nPart: Immigration Rules Appendix UK Ancestry\nSection ID: UKA 31.1\nSection: Care requirement for settlement by a child on the UK Ancestry route\nTopic: settlement\n\nSummary: This provision applies to children seeking settlement via the UK Ancestry route. It requires the parent or guardian to have provided proper care and support suitable for the child's wellbeing. There are no specific exceptions detailed in this excerpt.\n\n### Care requirement for settlement by a child on the UK Ancestry route\n\nUKA 31.1. DELETED.",
      "needs_review": false
    },
    {
      "metadata": {
        "source": "Immigration Rules Appendix UK Ancestry",
        "part": "Immigration Rules Appendix UK Ancestry",
        "section_id": "UKA 32.1",
        "section_title": "Age requirement for settlement by a child on the UK Ancestry route",
        "parent_section": "UKA 32",
        "hierarchy_level": 2,
        "topic": "settlement",
        "url": "https://www.gov.uk/guidance/immigration-rules/immigration-rules-appendix-uk-ancestry",
        "scraped_at": "2025-12-06T17:29:33.646992"
      },
      "text": "### Age requirement for settlement by a child on the UK Ancestry route\n\nUKA 32.1. DELETED.\n\nUKA 32.2. DELETED.",
      "summary": "This provision applies to children seeking settlement via the UK Ancestry route. It requires the child to have reached a specified minimum age to qualify for settlement, with certain conditions or exceptions potentially outlined elsewhere in the rules.",
      "augmented_text": "Document: Immigration Rules Appendix UK Ancestry\nPart: Immigration Rules Appendix UK Ancestry\nSection ID: UKA 32.1\nSection: Age requirement for settlement by a child on the UK Ancestry route\nTopic: settlement\n\nSummary: This provision applies to children seeking settlement via the UK Ancestry route. It requires the child to have reached a specified minimum age to qualify for settlement, with certain conditions or exceptions potentially outlined elsewhere in the rules.\n\n### Age requirement for settlement by a child on the UK Ancestry route\n\nUKA 32.1. DELETED.\n\nUKA 32.2. DELETED.",
      "needs_review": false
    },
    {
      "metadata": {
        "source": "Immigration Rules Appendix UK Ancestry",
        "part": "Immigration Rules Appendix UK Ancestry",
        "section_id": "1",
        "section_title": "Requirements for settlement as a dependent child on the UK Ancestry route",
        "parent_section": null,
        "hierarchy_level": 1,
        "topic": "settlement",
        "url": "https://www.gov.uk/guidance/immigration-rules/immigration-rules-appendix-uk-ancestry",
        "scraped_at": "2025-12-06T17:29:33.647007"
      },
      "text": "### Requirements for settlement as a dependent child on the UK Ancestry route\n\n1.   UKA 32A.1. The applicant must meet the following requirements for a dependent child in Appendix Children: \n    1.   (a) care requirement; and\n    2.   (b) age and independent life requirement.",
      "summary": "Dependent children applying for settlement on the UK Ancestry route must meet specific care and age/independent life requirements as outlined in Appendix Children, with eligibility contingent on satisfying these criteria.",
      "augmented_text": "Document: Immigration Rules Appendix UK Ancestry\nPart: Immigration Rules Appendix UK Ancestry\nSection ID: 1\nSection: Requirements for settlement as a dependent child on the UK Ancestry route\nTopic: settlement\n\nSummary: Dependent children applying for settlement on the UK Ancestry route must meet specific care and age/independent life requirements as outlined in Appendix Children, with eligibility contingent on satisfying these criteria.\n\n### Requirements for settlement as a dependent child on the UK Ancestry route\n\n1.   UKA 32A.1. The applicant must meet the following requirements for a dependent child in Appendix Children: \n    1.   (a) care requirement; and\n    2.   (b) age and independent life requirement.",
      "needs_review": false
    },
    {
      "metadata": {
        "source": "Immigration Rules Appendix UK Ancestry",
        "part": "Immigration Rules Appendix UK Ancestry",
        "section_id": "UKA 33.1",
        "section_title": "Financial requirement for settlement for a partner or child on the UK Ancestry route",
        "parent_section": "UKA 33",
        "hierarchy_level": 2,
        "topic": "financial",
        "url": "https://www.gov.uk/guidance/immigration-rules/immigration-rules-appendix-uk-ancestry",
        "scraped_at": "2025-12-06T17:29:33.647016"
      },
      "text": "### Financial requirement for settlement for a partner or child on the UK Ancestry route\n\nUKA 33.1. The decision maker must be satisfied that there will be adequate maintenance and accommodation for the applicant, the person with UK Ancestry, and any other dependants in the UK, without recourse to public funds.\n\nUKA 33.2. Funds must be shown as specified in Appendix Finance.\n\nUKA 33.3. In assessing whether the applicant meets the financial requirement in UKA 33.1, the decision maker may take into account credible promises of financial support from a third party, such as a relative or friend of the applicant.",
      "summary": "Applicants on the UK Ancestry route must demonstrate adequate maintenance and accommodation in the UK without recourse to public funds. Funds must meet specified requirements, and credible third-party financial support may be considered.",
      "augmented_text": "Document: Immigration Rules Appendix UK Ancestry\nPart: Immigration Rules Appendix UK Ancestry\nSection ID: UKA 33.1\nSection: Financial requirement for settlement for a partner or child on the UK Ancestry route\nTopic: financial\n\nSummary: Applicants on the UK Ancestry route must demonstrate adequate maintenance and accommodation in the UK without recourse to public funds. Funds must meet specified requirements, and credible third-party financial support may be considered.\n\n### Financial requirement for settlement for a partner or child on the UK Ancestry route\n\nUKA 33.1. The decision maker must be satisfied that there will be adequate maintenance and accommodation for the applicant, the person with UK Ancestry, and any other dependants in the UK, without recourse to public funds.\n\nUKA 33.2. Funds must be shown as specified in Appendix Finance.\n\nUKA 33.3. In assessing whether the applicant meets the financial requirement in UKA 33.1, the decision maker may take into account credible promises of financial support from a third party, such as a relative or friend of the applicant.",
      "needs_review": false
    },
    {
      "metadata": {
        "source": "Immigration Rules Appendix UK Ancestry",
        "part": "Immigration Rules Appendix UK Ancestry",
        "section_id": "UKA 34.1",
        "section_title": "English language requirement for settlement by a partner or child on the UK Ancestry route",
        "parent_section": "UKA 34",
        "hierarchy_level": 2,
        "topic": "english-language",
        "url": "https://www.gov.uk/guidance/immigration-rules/immigration-rules-appendix-uk-ancestry",
        "scraped_at": "2025-12-06T17:29:33.647025"
      },
      "text": "### English language requirement for settlement by a partner or child on the UK Ancestry route\n\nUKA 34.1. Unless an exemption applies, the applicant must show English language ability on the Common European Framework of Reference for Languages in speaking and listening of at least level B1.\n\nUKA 34.2. The applicant must show they meet the English language requirement as specified in Appendix English Language.",
      "summary": "Applicants applying for settlement as a partner or child on the UK Ancestry route must demonstrate at least B1 level in speaking and listening English, unless exempted, as per Appendix English Language.",
      "augmented_text": "Document: Immigration Rules Appendix UK Ancestry\nPart: Immigration Rules Appendix UK Ancestry\nSection ID: UKA 34.1\nSection: English language requirement for settlement by a partner or child on the UK Ancestry route\nTopic: english-language\n\nSummary: Applicants applying for settlement as a partner or child on the UK Ancestry route must demonstrate at least B1 level in speaking and listening English, unless exempted, as per Appendix English Language.\n\n### English language requirement for settlement by a partner or child on the UK Ancestry route\n\nUKA 34.1. Unless an exemption applies, the applicant must show English language ability on the Common European Framework of Reference for Languages in speaking and listening of at least level B1.\n\nUKA 34.2. The applicant must show they meet the English language requirement as specified in Appendix English Language.",
      "needs_review": false
    },
    {
      "metadata": {
        "source": "Immigration Rules Appendix UK Ancestry",
        "part": "Immigration Rules Appendix UK Ancestry",
        "section_id": "UKA 35.1",
        "section_title": "Knowledge of life in the UK requirement for settlement by a partner or child on the UK Ancestry route",
        "parent_section": "UKA 35",
        "hierarchy_level": 2,
        "topic": "settlement",
        "url": "https://www.gov.uk/guidance/immigration-rules/immigration-rules-appendix-uk-ancestry",
        "scraped_at": "2025-12-06T17:29:33.647040"
      },
      "text": "### Knowledge of life in the UK requirement for settlement by a partner or child on the UK Ancestry route\n\nUKA 35.1 If the applicant is aged 18 or over at the date of application, they must meet the Knowledge of Life in the UK requirement as set out in Appendix KOL UK.",
      "summary": "Applicants aged 18 or over applying for settlement on the UK Ancestry route must demonstrate knowledge of life in the UK as specified in Appendix KOL UK. This requirement is mandatory for all qualifying applicants without exceptions.",
      "augmented_text": "Document: Immigration Rules Appendix UK Ancestry\nPart: Immigration Rules Appendix UK Ancestry\nSection ID: UKA 35.1\nSection: Knowledge of life in the UK requirement for settlement by a partner or child on the UK Ancestry route\nTopic: settlement\n\nSummary: Applicants aged 18 or over applying for settlement on the UK Ancestry route must demonstrate knowledge of life in the UK as specified in Appendix KOL UK. This requirement is mandatory for all qualifying applicants without exceptions.\n\n### Knowledge of life in the UK requirement for settlement by a partner or child on the UK Ancestry route\n\nUKA 35.1 If the applicant is aged 18 or over at the date of application, they must meet the Knowledge of Life in the UK requirement as set out in Appendix KOL UK.",
      "needs_review": false
    },
    {
      "metadata": {
        "source": "Immigration Rules Appendix UK Ancestry",
        "part": "Immigration Rules Appendix UK Ancestry",
        "section_id": "UKA 36.1",
        "section_title": "Decision on an application for settlement as a partner or child on the UK Ancestry route",
        "parent_section": "UKA 36",
        "hierarchy_level": 2,
        "topic": "eligibility",
        "url": "https://www.gov.uk/guidance/immigration-rules/immigration-rules-appendix-uk-ancestry",
        "scraped_at": "2025-12-06T17:29:33.647047"
      },
      "text": "### Decision on an application for settlement as a partner or child on the UK Ancestry route\n\nUKA 36.1. If the decision maker is satisfied all the suitability and eligibility requirements are met for settlement as a dependent partner or dependent child on the UK Ancestry route the applicant will be granted settlement, otherwise the application will be refused.\n\nUKA 36.2. If the application is refused the person can apply for an Administrative Review under Appendix AR: Administrative Review.\n\nPrint this page",
      "summary": "Applicants seeking settlement as a dependent partner or child on the UK Ancestry route must meet all suitability and eligibility criteria; if satisfied, settlement is granted, otherwise refusal occurs. If refused, applicants may request an Administrative Review.",
      "augmented_text": "Document: Immigration Rules Appendix UK Ancestry\nPart: Immigration Rules Appendix UK Ancestry\nSection ID: UKA 36.1\nSection: Decision on an application for settlement as a partner or child on the UK Ancestry route\nTopic: eligibility\n\nSummary: Applicants seeking settlement as a dependent partner or child on the UK Ancestry route must meet all suitability and eligibility criteria; if satisfied, settlement is granted, otherwise refusal occurs. If refused, applicants may request an Administrative Review.\n\n### Decision on an application for settlement as a partner or child on the UK Ancestry route\n\nUKA 36.1. If the decision maker is satisfied all the suitability and eligibility requirements are met for settlement as a dependent partner or dependent child on the UK Ancestry route the applicant will be granted settlement, otherwise the application will be refused.\n\nUKA 36.2. If the application is refused the person can apply for an Administrative Review under Appendix AR: Administrative Review.\n\nPrint this page",
      "needs_review": false
    }
  ]
}