{
  "url": "https://www.gov.uk/guidance/immigration-rules/immigration-rules-appendix-representative-of-an-overseas-business",
  "part_name": "Immigration Rules Appendix Representative of an Overseas Business",
  "scraped_at": "2025-12-06T17:28:25.354465",
  "chunk_count": 51,
  "chunks": [
    {
      "metadata": {
        "source": "Immigration Rules Appendix Representative of an Overseas Business",
        "part": "Immigration Rules Appendix Representative of an Overseas Business",
        "section_id": "1",
        "section_title": "Validity requirements for a Representative of an Overseas Business",
        "parent_section": null,
        "hierarchy_level": 1,
        "topic": "leave-to-enter",
        "url": "https://www.gov.uk/guidance/immigration-rules/immigration-rules-appendix-representative-of-an-overseas-business",
        "scraped_at": "2025-12-06T17:28:25.353483"
      },
      "text": "### Validity requirements for a Representative of an Overseas Business\n\n1.   ROB 1.1. A person applying for entry clearance or permission to stay as a Representative of an Overseas Business must apply online on gov.uk on the specified form as follows: \n    1.   (a) for entry clearance, form “Other work” on the “Find and apply for other visas from outside the UK” form; or\n    2.   (b) for permission to stay, form “Application to extend stay in the UK: FLR(IR)”.\n\n1.   ROB 1.2. An application for entry clearance or permission to stay as the Representative of an Overseas Business must meet all the following requirements: \n    1.   (a) any fee and Immigration Health Charge must have been paid; and\n    2.   (b) the applicant must have provided biometrics when required; and\n    3.   (c) the applicant must have provided a passport or other travel document which satisfactorily establishes their identity and nationality.\n\nROB 1.3. The applicant must be aged 18 or over on the date of application.\n\nROB 1.4. If the applicant has, in the last 12 months before the date of application, received an award from a Government or international scholarship agency covering both fees and living costs for study in the UK, they must provide written consent to the application from that Government or agency.\n\n1.   ROB 1.5. If applying for permission to stay, the applicant must be in the UK on the date of application.\n2.   ROB 1.5ZA. If applying for permission to stay, the applicant must not have, or have last been granted, permission: \n    1.   (a) as a Visitor; or\n    2.   (b) as a Short-term Student; or\n    3.   (c) as a Parent of a Child Student; or\n    4.   (d) as a Seasonal Worker; or\n    5.   (e) as a Domestic Worker in a Private Household; or\n    6.   (f) outside the Immigration Rules.\n\n1.   ROB 1.5A. An applicant who is applying for permission to stay and has, or last had, permission as a Student, must fulfil one of the Conditions A or B below on the date of application: \n    1.   (a) Condition A: the applicant must have completed the course of study for which the Confirmation of Acceptance for Studies was assigned (or a course to which ST 27.3 of Appendix Student applies); or\n    2.   (b) Condition B: the applicant must: \n        1.   (i) be studying a full-time course of study leading to the award of a PhD with a higher education provider which has a track record of compliance; and\n        2.   (ii) have completed at least 24 months of study on that course.\n\nROB 1.6. An application which does not meet all the validity requirements for a Representative of an Overseas Business may be rejected as invalid and not considered.",
      "summary": "Applicants must apply online using specific forms, pay fees, provide biometrics and travel documentation, and be at least 18. If applying to remain, they must be in the UK and may require written consent if formerly funded by a government scholarship in the past year.",
      "augmented_text": "Document: Immigration Rules Appendix Representative of an Overseas Business\nPart: Immigration Rules Appendix Representative of an Overseas Business\nSection ID: 1\nSection: Validity requirements for a Representative of an Overseas Business\nTopic: leave-to-enter\n\nSummary: Applicants must apply online using specific forms, pay fees, provide biometrics and travel documentation, and be at least 18. If applying to remain, they must be in the UK and may require written consent if formerly funded by a government scholarship in the past year.\n\n### Validity requirements for a Representative of an Overseas Business\n\n1.   ROB 1.1. A person applying for entry clearance or permission to stay as a Representative of an Overseas Business must apply online on gov.uk on the specified form as follows: \n    1.   (a) for entry clearance, form “Other work” on the “Find and apply for other visas from outside the UK” form; or\n    2.   (b) for permission to stay, form “Application to extend stay in the UK: FLR(IR)”.\n\n1.   ROB 1.2. An application for entry clearance or permission to stay as the Representative of an Overseas Business must meet all the following requirements: \n    1.   (a) any fee and Immigration Health Charge must have been paid; and\n    2.   (b) the applicant must have provided biometrics when required; and\n    3.   (c) the applicant must have provided a passport or other travel document which satisfactorily establishes their identity and nationality.\n\nROB 1.3. The applicant must be aged 18 or over on the date of application.\n\nROB 1.4. If the applicant has, in the last 12 months before the date of application, received an award from a Government or international scholarship agency covering both fees and living costs for study in the UK, they must provide written consent to the application from that Government or agency.\n\n1.   ROB 1.5. If applying for permission to stay, the applicant must be in the UK on the date of application.\n2.   ROB 1.5ZA. If applying for permission to stay, the applicant must not have, or have last been granted, permission: \n    1.   (a) as a Visitor; or\n    2.   (b) as a Short-term Student; or\n    3.   (c) as a Parent of a Child Student; or\n    4.   (d) as a Seasonal Worker; or\n    5.   (e) as a Domestic Worker in a Private Household; or\n    6.   (f) outside the Immigration Rules.\n\n1.   ROB 1.5A. An applicant who is applying for permission to stay and has, or last had, permission as a Student, must fulfil one of the Conditions A or B below on the date of application: \n    1.   (a) Condition A: the applicant must have completed the course of study for which the Confirmation of Acceptance for Studies was assigned (or a course to which ST 27.3 of Appendix Student applies); or\n    2.   (b) Condition B: the applicant must: \n        1.   (i) be studying a full-time course of study leading to the award of a PhD with a higher education provider which has a track record of compliance; and\n        2.   (ii) have completed at least 24 months of study on that course.\n\nROB 1.6. An application which does not meet all the validity requirements for a Representative of an Overseas Business may be rejected as invalid and not considered.",
      "needs_review": false
    },
    {
      "metadata": {
        "source": "Immigration Rules Appendix Representative of an Overseas Business",
        "part": "Immigration Rules Appendix Representative of an Overseas Business",
        "section_id": "ROB 2.1",
        "section_title": "Suitability requirements for a Representative of an Overseas Business",
        "parent_section": "ROB 2",
        "hierarchy_level": 2,
        "topic": "suitability",
        "url": "https://www.gov.uk/guidance/immigration-rules/immigration-rules-appendix-representative-of-an-overseas-business",
        "scraped_at": "2025-12-06T17:28:25.353515"
      },
      "text": "### Suitability requirements for a Representative of an Overseas Business\n\nROB 2.1. The applicant must not fall for refusal under Part Suitability.\n\n1.   ROB 2.2. If applying for permission to stay the applicant must not be: \n    1.   (a) in breach of immigration laws, except that where the Exceptions for overstayers section of Part Suitability applies, that period of overstaying will be disregarded; or\n    2.   (b) on immigration bail.",
      "summary": "This provision applies to applicants seeking permission as a Representative of an Overseas Business. They must not breach immigration laws or be on immigration bail, unless overstaying falls under specific exceptions. Compliance with suitability criteria is essential for approval.",
      "augmented_text": "Document: Immigration Rules Appendix Representative of an Overseas Business\nPart: Immigration Rules Appendix Representative of an Overseas Business\nSection ID: ROB 2.1\nSection: Suitability requirements for a Representative of an Overseas Business\nTopic: suitability\n\nSummary: This provision applies to applicants seeking permission as a Representative of an Overseas Business. They must not breach immigration laws or be on immigration bail, unless overstaying falls under specific exceptions. Compliance with suitability criteria is essential for approval.\n\n### Suitability requirements for a Representative of an Overseas Business\n\nROB 2.1. The applicant must not fall for refusal under Part Suitability.\n\n1.   ROB 2.2. If applying for permission to stay the applicant must not be: \n    1.   (a) in breach of immigration laws, except that where the Exceptions for overstayers section of Part Suitability applies, that period of overstaying will be disregarded; or\n    2.   (b) on immigration bail.",
      "needs_review": false
    },
    {
      "metadata": {
        "source": "Immigration Rules Appendix Representative of an Overseas Business",
        "part": "Immigration Rules Appendix Representative of an Overseas Business",
        "section_id": "Eligibility requirements for Representative of an Overseas Business",
        "section_title": "Eligibility requirements for Representative of an Overseas Business",
        "parent_section": null,
        "hierarchy_level": 2,
        "topic": "eligibility",
        "url": "https://www.gov.uk/guidance/immigration-rules/immigration-rules-appendix-representative-of-an-overseas-business",
        "scraped_at": "2025-12-06T17:28:25.353522"
      },
      "text": "### Eligibility requirements for Representative of an Overseas Business",
      "summary": "This provision applies to individuals applying as Representatives of an Overseas Business. Applicants must demonstrate their role as a genuine senior employee or owner of the overseas company and meet the specific eligibility criteria, including qualifications and employment conditions, with certain exceptions where applicable.",
      "augmented_text": "Document: Immigration Rules Appendix Representative of an Overseas Business\nPart: Immigration Rules Appendix Representative of an Overseas Business\nSection ID: Eligibility requirements for Representative of an Overseas Business\nSection: Eligibility requirements for Representative of an Overseas Business\nTopic: eligibility\n\nSummary: This provision applies to individuals applying as Representatives of an Overseas Business. Applicants must demonstrate their role as a genuine senior employee or owner of the overseas company and meet the specific eligibility criteria, including qualifications and employment conditions, with certain exceptions where applicable.\n\n### Eligibility requirements for Representative of an Overseas Business",
      "needs_review": false
    },
    {
      "metadata": {
        "source": "Immigration Rules Appendix Representative of an Overseas Business",
        "part": "Immigration Rules Appendix Representative of an Overseas Business",
        "section_id": "ROB 3.1",
        "section_title": "Entry requirements for Representative of an Overseas Business",
        "parent_section": "ROB 3",
        "hierarchy_level": 2,
        "topic": "leave-to-enter",
        "url": "https://www.gov.uk/guidance/immigration-rules/immigration-rules-appendix-representative-of-an-overseas-business",
        "scraped_at": "2025-12-06T17:28:25.353536"
      },
      "text": "### Entry requirements for Representative of an Overseas Business\n\nROB 3.1. A person seeking to come to the UK as a Representative of an Overseas Business must have applied for and obtained entry clearance as a Representative of an Overseas Business before their arrival in the UK.\n\nROB 3.2. A person applying for entry clearance as a Representative of an Overseas Business must, if Appendix Tuberculosis applies, provide a valid medical certificate confirming that they have undergone screening for active pulmonary tuberculosis and that this tuberculosis is not present in them.",
      "summary": "Applicants must obtain entry clearance before arriving in the UK as a Representative of an Overseas Business. They must also provide a tuberculosis screening certificate if required.",
      "augmented_text": "Document: Immigration Rules Appendix Representative of an Overseas Business\nPart: Immigration Rules Appendix Representative of an Overseas Business\nSection ID: ROB 3.1\nSection: Entry requirements for Representative of an Overseas Business\nTopic: leave-to-enter\n\nSummary: Applicants must obtain entry clearance before arriving in the UK as a Representative of an Overseas Business. They must also provide a tuberculosis screening certificate if required.\n\n### Entry requirements for Representative of an Overseas Business\n\nROB 3.1. A person seeking to come to the UK as a Representative of an Overseas Business must have applied for and obtained entry clearance as a Representative of an Overseas Business before their arrival in the UK.\n\nROB 3.2. A person applying for entry clearance as a Representative of an Overseas Business must, if Appendix Tuberculosis applies, provide a valid medical certificate confirming that they have undergone screening for active pulmonary tuberculosis and that this tuberculosis is not present in them.",
      "needs_review": false
    },
    {
      "metadata": {
        "source": "Immigration Rules Appendix Representative of an Overseas Business",
        "part": "Immigration Rules Appendix Representative of an Overseas Business",
        "section_id": "ROB 4.1",
        "section_title": "Work requirement for Representative of an Overseas Business",
        "parent_section": "ROB 4",
        "hierarchy_level": 2,
        "topic": "eligibility",
        "url": "https://www.gov.uk/guidance/immigration-rules/immigration-rules-appendix-representative-of-an-overseas-business",
        "scraped_at": "2025-12-06T17:28:25.353555"
      },
      "text": "### Work requirement for Representative of an Overseas Business\n\nROB 4.1. The overseas business or media organisation that the applicant represents must be active and trading outside the UK, with its headquarters and principal place of business remaining outside the UK.\n\nROB 4.2. The applicant must have been recruited and taken on as an employee outside the UK by the business they will represent.\n\nROB 4.3. The applicant must intend to work full-time as the representative of the overseas business or media organisation and must not intend to undertake work for any other business or engage in business of their own.\n\n1.   ROB 4.4. An applicant must be either: \n    1.   (a) a Sole Representative who already has, or was last granted, permission as a Sole Representative and is a senior employee of an overseas business, who is assigned to the UK to establish and supervise a branch or subsidiary of an overseas business, where that branch or subsidiary will actively trade in the same type of business as the overseas business; or\n    2.   (b) a Media Representative who is posted on a long-term assignment to the UK on behalf of a newspaper, news agency or broadcasting organisation.",
      "summary": "This provision applies to applicants representing overseas businesses or media organizations. They must be recruited outside the UK, intend to work full-time for that organization only, and the overseas business must remain active and headquartered abroad. Exceptions include Sole Representatives and Media Representatives with specific roles.",
      "augmented_text": "Document: Immigration Rules Appendix Representative of an Overseas Business\nPart: Immigration Rules Appendix Representative of an Overseas Business\nSection ID: ROB 4.1\nSection: Work requirement for Representative of an Overseas Business\nTopic: eligibility\n\nSummary: This provision applies to applicants representing overseas businesses or media organizations. They must be recruited outside the UK, intend to work full-time for that organization only, and the overseas business must remain active and headquartered abroad. Exceptions include Sole Representatives and Media Representatives with specific roles.\n\n### Work requirement for Representative of an Overseas Business\n\nROB 4.1. The overseas business or media organisation that the applicant represents must be active and trading outside the UK, with its headquarters and principal place of business remaining outside the UK.\n\nROB 4.2. The applicant must have been recruited and taken on as an employee outside the UK by the business they will represent.\n\nROB 4.3. The applicant must intend to work full-time as the representative of the overseas business or media organisation and must not intend to undertake work for any other business or engage in business of their own.\n\n1.   ROB 4.4. An applicant must be either: \n    1.   (a) a Sole Representative who already has, or was last granted, permission as a Sole Representative and is a senior employee of an overseas business, who is assigned to the UK to establish and supervise a branch or subsidiary of an overseas business, where that branch or subsidiary will actively trade in the same type of business as the overseas business; or\n    2.   (b) a Media Representative who is posted on a long-term assignment to the UK on behalf of a newspaper, news agency or broadcasting organisation.",
      "needs_review": false
    },
    {
      "metadata": {
        "source": "Immigration Rules Appendix Representative of an Overseas Business",
        "part": "Immigration Rules Appendix Representative of an Overseas Business",
        "section_id": "ROB 5.1",
        "section_title": "Genuineness requirement for the Representative of an Overseas Business",
        "parent_section": "ROB 5",
        "hierarchy_level": 2,
        "topic": "eligibility",
        "url": "https://www.gov.uk/guidance/immigration-rules/immigration-rules-appendix-representative-of-an-overseas-business",
        "scraped_at": "2025-12-06T17:28:25.353573"
      },
      "text": "### Genuineness requirement for the Representative of an Overseas Business\n\nROB 5.1. The decision maker must be satisfied that the applicant is a genuine Representative of an Overseas Business.\n\nROB 5.2. The decision maker must not have reasonable grounds to believe the business is being established in the UK by the overseas business, or the applicant has been appointed as a representative of the overseas business or media organisation, mainly so the applicant can apply for entry clearance or permission to stay.",
      "summary": "The provision applies to applicants seeking to be recognized as a Representative of an Overseas Business. They must demonstrate the genuineness of their role, and the decision maker must not suspect the business is being set up primarily to facilitate entry or stay, with no specific exceptions outlined.",
      "augmented_text": "Document: Immigration Rules Appendix Representative of an Overseas Business\nPart: Immigration Rules Appendix Representative of an Overseas Business\nSection ID: ROB 5.1\nSection: Genuineness requirement for the Representative of an Overseas Business\nTopic: eligibility\n\nSummary: The provision applies to applicants seeking to be recognized as a Representative of an Overseas Business. They must demonstrate the genuineness of their role, and the decision maker must not suspect the business is being set up primarily to facilitate entry or stay, with no specific exceptions outlined.\n\n### Genuineness requirement for the Representative of an Overseas Business\n\nROB 5.1. The decision maker must be satisfied that the applicant is a genuine Representative of an Overseas Business.\n\nROB 5.2. The decision maker must not have reasonable grounds to believe the business is being established in the UK by the overseas business, or the applicant has been appointed as a representative of the overseas business or media organisation, mainly so the applicant can apply for entry clearance or permission to stay.",
      "needs_review": false
    },
    {
      "metadata": {
        "source": "Immigration Rules Appendix Representative of an Overseas Business",
        "part": "Immigration Rules Appendix Representative of an Overseas Business",
        "section_id": "ROB 6.1",
        "section_title": "English language requirement for a Representative of an Overseas Business",
        "parent_section": "ROB 6",
        "hierarchy_level": 2,
        "topic": "english-language",
        "url": "https://www.gov.uk/guidance/immigration-rules/immigration-rules-appendix-representative-of-an-overseas-business",
        "scraped_at": "2025-12-06T17:28:25.353582"
      },
      "text": "### English language requirement for a Representative of an Overseas Business\n\nROB 6.1. The applicant must show English language ability on the Common European Framework of Reference for Languages in speaking and listening of at least level A1.\n\nROB 6.2. The applicant must show they meet the English language requirement as specified in Appendix English Language.",
      "summary": "This provision applies to Representatives of an Overseas Business. They must demonstrate English language ability at least A1 level in speaking and listening per CEFR standards, as specified in the Appendices, with no additional exceptions outlined.",
      "augmented_text": "Document: Immigration Rules Appendix Representative of an Overseas Business\nPart: Immigration Rules Appendix Representative of an Overseas Business\nSection ID: ROB 6.1\nSection: English language requirement for a Representative of an Overseas Business\nTopic: english-language\n\nSummary: This provision applies to Representatives of an Overseas Business. They must demonstrate English language ability at least A1 level in speaking and listening per CEFR standards, as specified in the Appendices, with no additional exceptions outlined.\n\n### English language requirement for a Representative of an Overseas Business\n\nROB 6.1. The applicant must show English language ability on the Common European Framework of Reference for Languages in speaking and listening of at least level A1.\n\nROB 6.2. The applicant must show they meet the English language requirement as specified in Appendix English Language.",
      "needs_review": false
    },
    {
      "metadata": {
        "source": "Immigration Rules Appendix Representative of an Overseas Business",
        "part": "Immigration Rules Appendix Representative of an Overseas Business",
        "section_id": "ROB 7.1",
        "section_title": "Financial requirement for a Representative of an Overseas Business",
        "parent_section": "ROB 7",
        "hierarchy_level": 2,
        "topic": "financial",
        "url": "https://www.gov.uk/guidance/immigration-rules/immigration-rules-appendix-representative-of-an-overseas-business",
        "scraped_at": "2025-12-06T17:28:25.353590"
      },
      "text": "### Financial requirement for a Representative of an Overseas Business\n\nROB 7.1. The decision maker must be satisfied that the applicant can, and will, adequately maintain and accommodate themselves, and any dependants in the UK, without access to public funds.\n\nROB 7.2. Funds must be shown as specified in Appendix Finance.",
      "summary": "This provision applies to Representatives of an Overseas Business. They must demonstrate the ability to financially support themselves and dependants without recourse to public funds, meeting specific financial evidence requirements outlined in Appendix Finance.",
      "augmented_text": "Document: Immigration Rules Appendix Representative of an Overseas Business\nPart: Immigration Rules Appendix Representative of an Overseas Business\nSection ID: ROB 7.1\nSection: Financial requirement for a Representative of an Overseas Business\nTopic: financial\n\nSummary: This provision applies to Representatives of an Overseas Business. They must demonstrate the ability to financially support themselves and dependants without recourse to public funds, meeting specific financial evidence requirements outlined in Appendix Finance.\n\n### Financial requirement for a Representative of an Overseas Business\n\nROB 7.1. The decision maker must be satisfied that the applicant can, and will, adequately maintain and accommodate themselves, and any dependants in the UK, without access to public funds.\n\nROB 7.2. Funds must be shown as specified in Appendix Finance.",
      "needs_review": false
    },
    {
      "metadata": {
        "source": "Immigration Rules Appendix Representative of an Overseas Business",
        "part": "Immigration Rules Appendix Representative of an Overseas Business",
        "section_id": "ROB 8.1",
        "section_title": "Additional business requirements for a Sole Representative",
        "parent_section": "ROB 8",
        "hierarchy_level": 2,
        "topic": "eligibility",
        "url": "https://www.gov.uk/guidance/immigration-rules/immigration-rules-appendix-representative-of-an-overseas-business",
        "scraped_at": "2025-12-06T17:28:25.353622"
      },
      "text": "### Additional business requirements for a Sole Representative on the Representative of an Overseas Business route\n\nROB 8.1. Where the applicant is applying as a Sole Representative on the Representative of an Overseas Business route, the applicant must meet the additional business requirements set out in ROB 8.2. to ROB 8.6.\n\nROB 8.2. The applicant must be a senior employee of the overseas business with the skills, experience and knowledge of the business necessary to undertake the role, with full authority to negotiate and take operational decisions on behalf of the overseas business.\n\nROB 8.3. The applicant must not have a majority stake in, or otherwise own or control a majority of the overseas business they represent, whether that ownership or control is by means of a shareholding, partnership agreement, sole proprietorship or any other arrangement.\n\nROB 8.4. DELETED.\n\nROB 8.5. DELETED.\n\n1.   ROB 8.6. The applicant must meet all the following requirements: \n    1.   (a) the applicant must have established the registered branch or wholly-owned subsidiary of the overseas business for which they were last granted permission under this route; and\n    2.   (b) the applicant must be engaged in full time employment and must supervise the registered branch or wholly-owned subsidiary which they have established, and must be required by their employer to continue in that role; and\n    3.   (c) the applicant must provide all of the following: \n        1.   (i) evidence of business that has been generated, principally with firms in the UK, on behalf of their employer since their last grant of permission, in the form of accounts, copies of invoices or letters from businesses with whom the applicant has done business, including the value of transactions; and\n        2.   (ii) a Companies House certificate of registration as a UK establishment (for a branch), or a certificate of incorporation (for a subsidiary), together with either a copy of the share register or a letter from the overseas business’s accountant confirming that the UK business is wholly owned by the overseas business; and\n        3.   (iii) a letter from the applicant’s employer confirming that the applicant supervises the UK branch or subsidiary and is required to continue in that employment; and\n        4.   (iv) evidence of salary paid by the employer in the 12 months immediately before the date of application and details of the remuneration package the employee receives.",
      "summary": "Sole Representatives applying via the UK Immigration route must meet specific business criteria, including being senior employees with full authority and no majority ownership in the overseas business. They must have established and supervise a registered branch or wholly-owned subsidiary, working full-time, and providing evidence of the business; some provisions are deleted or omitted.",
      "augmented_text": "Document: Immigration Rules Appendix Representative of an Overseas Business\nPart: Immigration Rules Appendix Representative of an Overseas Business\nSection ID: ROB 8.1\nSection: Additional business requirements for a Sole Representative\nTopic: eligibility\n\nSummary: Sole Representatives applying via the UK Immigration route must meet specific business criteria, including being senior employees with full authority and no majority ownership in the overseas business. They must have established and supervise a registered branch or wholly-owned subsidiary, working full-time, and providing evidence of the business; some provisions are deleted or omitted.\n\n### Additional business requirements for a Sole Representative on the Representative of an Overseas Business route\n\nROB 8.1. Where the applicant is applying as a Sole Representative on the Representative of an Overseas Business route, the applicant must meet the additional business requirements set out in ROB 8.2. to ROB 8.6.\n\nROB 8.2. The applicant must be a senior employee of the overseas business with the skills, experience and knowledge of the business necessary to undertake the role, with full authority to negotiate and take operational decisions on behalf of the overseas business.\n\nROB 8.3. The applicant must not have a majority stake in, or otherwise own or control a majority of the overseas business they represent, whether that ownership or control is by means of a shareholding, partnership agreement, sole proprietorship or any other arrangement.\n\nROB 8.4. DELETED.\n\nROB 8.5. DELETED.\n\n1.   ROB 8.6. The applicant must meet all the following requirements: \n    1.   (a) the applicant must have established the registered branch or wholly-owned subsidiary of the overseas business for which they were last granted permission under this route; and\n    2.   (b) the applicant must be engaged in full time employment and must supervise the registered branch or wholly-owned subsidiary which they have established, and must be required by their employer to continue in that role; and\n    3.   (c) the applicant must provide all of the following: \n        1.   (i) evidence of business that has been generated, principally with firms in the UK, on behalf of their employer since their last grant of permission, in the form of accounts, copies of invoices or letters from businesses with whom the applicant has done business, including the value of transactions; and\n        2.   (ii) a Companies House certificate of registration as a UK establishment (for a branch), or a certificate of incorporation (for a subsidiary), together with either a copy of the share register or a letter from the overseas business’s accountant confirming that the UK business is wholly owned by the overseas business; and\n        3.   (iii) a letter from the applicant’s employer confirming that the applicant supervises the UK branch or subsidiary and is required to continue in that employment; and\n        4.   (iv) evidence of salary paid by the employer in the 12 months immediately before the date of application and details of the remuneration package the employee receives.",
      "needs_review": false
    },
    {
      "metadata": {
        "source": "Immigration Rules Appendix Representative of an Overseas Business",
        "part": "Immigration Rules Appendix Representative of an Overseas Business",
        "section_id": "ROB 9.1",
        "section_title": "Additional business requirements for a Media Representative",
        "parent_section": "ROB 9",
        "hierarchy_level": 2,
        "topic": "eligibility",
        "url": "https://www.gov.uk/guidance/immigration-rules/immigration-rules-appendix-representative-of-an-overseas-business",
        "scraped_at": "2025-12-06T17:28:25.353642"
      },
      "text": "### Additional business requirements for a Media Representative on the Representative of an Overseas Business route\n\nROB 9.1. Where the applicant is applying as a Media Representative on the Representative of Overseas Business route, the applicant must meet the additional business requirements in ROB 9.2. and ROB 9.3.\n\nROB 9.2. The applicant must be an employee of an overseas newspaper, news agency or broadcasting organisation undertaking a long-term assignment as a representative of their overseas employer.\n\n1.   ROB 9.3. Where the applicant is applying for permission to stay and has, or was last granted, permission as a Media Representative, the applicant must meet all the following: \n    1.   (a) the applicant must be engaged in full time employment for which their last period of permission was granted and be required by their employer to continue in that role; and\n    2.   (b) the applicant must provide the following: \n        1.   (i) a letter from the applicant’s employer confirming that the applicant is required to continue in their employment; and\n        2.   (ii) evidence of the applicant’s salary paid in the 12 months immediately before the date of application and details of the remuneration package the employee receives.",
      "summary": "Media Representatives applying or remaining on the route must be employed by an overseas news or broadcasting organization as long-term representatives. Applicants must provide employer confirmation and recent salary evidence, especially if seeking permission to stay, ensuring continued full-time employment as required.",
      "augmented_text": "Document: Immigration Rules Appendix Representative of an Overseas Business\nPart: Immigration Rules Appendix Representative of an Overseas Business\nSection ID: ROB 9.1\nSection: Additional business requirements for a Media Representative\nTopic: eligibility\n\nSummary: Media Representatives applying or remaining on the route must be employed by an overseas news or broadcasting organization as long-term representatives. Applicants must provide employer confirmation and recent salary evidence, especially if seeking permission to stay, ensuring continued full-time employment as required.\n\n### Additional business requirements for a Media Representative on the Representative of an Overseas Business route\n\nROB 9.1. Where the applicant is applying as a Media Representative on the Representative of Overseas Business route, the applicant must meet the additional business requirements in ROB 9.2. and ROB 9.3.\n\nROB 9.2. The applicant must be an employee of an overseas newspaper, news agency or broadcasting organisation undertaking a long-term assignment as a representative of their overseas employer.\n\n1.   ROB 9.3. Where the applicant is applying for permission to stay and has, or was last granted, permission as a Media Representative, the applicant must meet all the following: \n    1.   (a) the applicant must be engaged in full time employment for which their last period of permission was granted and be required by their employer to continue in that role; and\n    2.   (b) the applicant must provide the following: \n        1.   (i) a letter from the applicant’s employer confirming that the applicant is required to continue in their employment; and\n        2.   (ii) evidence of the applicant’s salary paid in the 12 months immediately before the date of application and details of the remuneration package the employee receives.",
      "needs_review": false
    },
    {
      "metadata": {
        "source": "Immigration Rules Appendix Representative of an Overseas Business",
        "part": "Immigration Rules Appendix Representative of an Overseas Business",
        "section_id": "ROB 10.1",
        "section_title": "Decision on an application as Representative of an Overseas Business",
        "parent_section": "ROB 10",
        "hierarchy_level": 2,
        "topic": "eligibility",
        "url": "https://www.gov.uk/guidance/immigration-rules/immigration-rules-appendix-representative-of-an-overseas-business",
        "scraped_at": "2025-12-06T17:28:25.353649"
      },
      "text": "### Decision on an application as Representative of an Overseas Business\n\nROB 10.1. If the decision maker is satisfied that all the suitability and relevant eligibility requirements are met as a Representative of an Overseas Business the application will be granted, otherwise the application will be refused.\n\nROB 10.2. If the application is refused, a person can apply for an Administrative Review under Appendix AR: Administrative Review.",
      "summary": "Applicants applying as Representatives of an Overseas Business must meet all suitability and eligibility criteria; applications are granted if these are satisfied. If refused, applicants may request an Administrative Review.",
      "augmented_text": "Document: Immigration Rules Appendix Representative of an Overseas Business\nPart: Immigration Rules Appendix Representative of an Overseas Business\nSection ID: ROB 10.1\nSection: Decision on an application as Representative of an Overseas Business\nTopic: eligibility\n\nSummary: Applicants applying as Representatives of an Overseas Business must meet all suitability and eligibility criteria; applications are granted if these are satisfied. If refused, applicants may request an Administrative Review.\n\n### Decision on an application as Representative of an Overseas Business\n\nROB 10.1. If the decision maker is satisfied that all the suitability and relevant eligibility requirements are met as a Representative of an Overseas Business the application will be granted, otherwise the application will be refused.\n\nROB 10.2. If the application is refused, a person can apply for an Administrative Review under Appendix AR: Administrative Review.",
      "needs_review": false
    },
    {
      "metadata": {
        "source": "Immigration Rules Appendix Representative of an Overseas Business",
        "part": "Immigration Rules Appendix Representative of an Overseas Business",
        "section_id": "ROB 11.1",
        "section_title": "Period of grant for a Representative of an Overseas Business",
        "parent_section": "ROB 11",
        "hierarchy_level": 2,
        "topic": "leave-to-enter",
        "url": "https://www.gov.uk/guidance/immigration-rules/immigration-rules-appendix-representative-of-an-overseas-business",
        "scraped_at": "2025-12-06T17:28:25.353662"
      },
      "text": "### Period of grant for a Representative of an Overseas Business\n\nROB 11.1. If the applicant is applying for entry clearance as a Media Representative under the Representative of an Overseas Business route or is applying for permission to stay as a Media Representative and does not have, or did not last have, permission on the Representative of an Overseas Business route they will be granted permission for a period not exceeding 3 years.\n\nROB 11.2. If the applicant has or last had, permission under the Representative of an Overseas Business route, they will be granted permission for a period not exceeding 2 years.",
      "summary": "Applicants applying as Media Representatives under the Overseas Business route are granted permission up to 3 years if they lack prior permission; if they previously held such permission, it is limited to 2 years.",
      "augmented_text": "Document: Immigration Rules Appendix Representative of an Overseas Business\nPart: Immigration Rules Appendix Representative of an Overseas Business\nSection ID: ROB 11.1\nSection: Period of grant for a Representative of an Overseas Business\nTopic: leave-to-enter\n\nSummary: Applicants applying as Media Representatives under the Overseas Business route are granted permission up to 3 years if they lack prior permission; if they previously held such permission, it is limited to 2 years.\n\n### Period of grant for a Representative of an Overseas Business\n\nROB 11.1. If the applicant is applying for entry clearance as a Media Representative under the Representative of an Overseas Business route or is applying for permission to stay as a Media Representative and does not have, or did not last have, permission on the Representative of an Overseas Business route they will be granted permission for a period not exceeding 3 years.\n\nROB 11.2. If the applicant has or last had, permission under the Representative of an Overseas Business route, they will be granted permission for a period not exceeding 2 years.",
      "needs_review": false
    },
    {
      "metadata": {
        "source": "Immigration Rules Appendix Representative of an Overseas Business",
        "part": "Immigration Rules Appendix Representative of an Overseas Business",
        "section_id": "1",
        "section_title": "Conditions of grant for a Representative of an Overseas Business",
        "parent_section": null,
        "hierarchy_level": 1,
        "topic": "financial",
        "url": "https://www.gov.uk/guidance/immigration-rules/immigration-rules-appendix-representative-of-an-overseas-business",
        "scraped_at": "2025-12-06T17:28:25.353671"
      },
      "text": "### Conditions of grant for a Representative of an Overseas Business\n\n1.   ROB 11.3. The grant will be subject to all the following conditions: \n    1.   (a) no access to public funds; and\n    2.   (b) no work permitted other than working for the overseas business which the applicant represents; and\n    3.   (c) study is permitted, subject to the ATAS condition in Appendix ATAS.\n    4.   (d) DELETED",
      "summary": "This provision applies to Representatives of an Overseas Business. They must not access public funds, only work for their overseas employer, and may study subject to ATAS conditions. These conditions are mandatory for the grant of their visa.",
      "augmented_text": "Document: Immigration Rules Appendix Representative of an Overseas Business\nPart: Immigration Rules Appendix Representative of an Overseas Business\nSection ID: 1\nSection: Conditions of grant for a Representative of an Overseas Business\nTopic: financial\n\nSummary: This provision applies to Representatives of an Overseas Business. They must not access public funds, only work for their overseas employer, and may study subject to ATAS conditions. These conditions are mandatory for the grant of their visa.\n\n### Conditions of grant for a Representative of an Overseas Business\n\n1.   ROB 11.3. The grant will be subject to all the following conditions: \n    1.   (a) no access to public funds; and\n    2.   (b) no work permitted other than working for the overseas business which the applicant represents; and\n    3.   (c) study is permitted, subject to the ATAS condition in Appendix ATAS.\n    4.   (d) DELETED",
      "needs_review": false
    },
    {
      "metadata": {
        "source": "Immigration Rules Appendix Representative of an Overseas Business",
        "part": "Immigration Rules Appendix Representative of an Overseas Business",
        "section_id": "Settlement as a Representative of an Overseas Business",
        "section_title": "Settlement as a Representative of an Overseas Business",
        "parent_section": null,
        "hierarchy_level": 2,
        "topic": "settlement",
        "url": "https://www.gov.uk/guidance/immigration-rules/immigration-rules-appendix-representative-of-an-overseas-business",
        "scraped_at": "2025-12-06T17:28:25.353720"
      },
      "text": "### Settlement as a Representative of an Overseas Business",
      "summary": "This provision applies to representatives of overseas businesses seeking settlement in the UK. It requires demonstrating that the applicant has been employed or engaged by the overseas business, with sufficient evidence of their role, and that the business remains operational abroad. Critical conditions include meeting immigration and suitability requirements, with exceptions applicable in certain circumstances.",
      "augmented_text": "Document: Immigration Rules Appendix Representative of an Overseas Business\nPart: Immigration Rules Appendix Representative of an Overseas Business\nSection ID: Settlement as a Representative of an Overseas Business\nSection: Settlement as a Representative of an Overseas Business\nTopic: settlement\n\nSummary: This provision applies to representatives of overseas businesses seeking settlement in the UK. It requires demonstrating that the applicant has been employed or engaged by the overseas business, with sufficient evidence of their role, and that the business remains operational abroad. Critical conditions include meeting immigration and suitability requirements, with exceptions applicable in certain circumstances.\n\n### Settlement as a Representative of an Overseas Business",
      "needs_review": false
    },
    {
      "metadata": {
        "source": "Immigration Rules Appendix Representative of an Overseas Business",
        "part": "Immigration Rules Appendix Representative of an Overseas Business",
        "section_id": "ROB 12.1",
        "section_title": "Validity requirements for Settlement by a Representative of an Overseas Business",
        "parent_section": "ROB 12",
        "hierarchy_level": 2,
        "topic": "settlement",
        "url": "https://www.gov.uk/guidance/immigration-rules/immigration-rules-appendix-representative-of-an-overseas-business",
        "scraped_at": "2025-12-06T17:28:25.353746"
      },
      "text": "### Validity requirements for Settlement by a Representative of an Overseas Business\n\nROB 12.1. A person applying for settlement as a Representative of an Overseas Business must apply online on the gov.uk website on the specified form, “Settle in the UK in various immigration categories: form SET(O)”.\n\n1.   ROB 12.2. An application for settlement as a Representative of an Overseas Business must meet all the following requirements: \n    1.   (a) any fee must have been paid; and\n    2.   (b) the applicant must have provided biometrics when required; and\n    3.   (c) the applicant must have provided a valid passport or other travel document which satisfactorily establishes their identity and nationality.\n\nROB 12.3. The applicant must be in the UK and have, or have last been granted, permission as a Representative of an Overseas Business.\n\nROB 12.4. An application which does not meet the validity requirements for settlement as a Representative of an Overseas Business may be rejected as invalid and not considered.",
      "summary": "Applicants for settlement as a Representative of an Overseas Business must submit an online application, pay applicable fees, provide biometrics, and submit a valid travel document while being in the UK with valid permission; failure to meet these criteria may result in rejection.",
      "augmented_text": "Document: Immigration Rules Appendix Representative of an Overseas Business\nPart: Immigration Rules Appendix Representative of an Overseas Business\nSection ID: ROB 12.1\nSection: Validity requirements for Settlement by a Representative of an Overseas Business\nTopic: settlement\n\nSummary: Applicants for settlement as a Representative of an Overseas Business must submit an online application, pay applicable fees, provide biometrics, and submit a valid travel document while being in the UK with valid permission; failure to meet these criteria may result in rejection.\n\n### Validity requirements for Settlement by a Representative of an Overseas Business\n\nROB 12.1. A person applying for settlement as a Representative of an Overseas Business must apply online on the gov.uk website on the specified form, “Settle in the UK in various immigration categories: form SET(O)”.\n\n1.   ROB 12.2. An application for settlement as a Representative of an Overseas Business must meet all the following requirements: \n    1.   (a) any fee must have been paid; and\n    2.   (b) the applicant must have provided biometrics when required; and\n    3.   (c) the applicant must have provided a valid passport or other travel document which satisfactorily establishes their identity and nationality.\n\nROB 12.3. The applicant must be in the UK and have, or have last been granted, permission as a Representative of an Overseas Business.\n\nROB 12.4. An application which does not meet the validity requirements for settlement as a Representative of an Overseas Business may be rejected as invalid and not considered.",
      "needs_review": false
    },
    {
      "metadata": {
        "source": "Immigration Rules Appendix Representative of an Overseas Business",
        "part": "Immigration Rules Appendix Representative of an Overseas Business",
        "section_id": "ROB 13.1",
        "section_title": "Suitability requirements for settlement by a Representative of an Overseas Business",
        "parent_section": "ROB 13",
        "hierarchy_level": 2,
        "topic": "suitability",
        "url": "https://www.gov.uk/guidance/immigration-rules/immigration-rules-appendix-representative-of-an-overseas-business",
        "scraped_at": "2025-12-06T17:28:25.353757"
      },
      "text": "### Suitability requirements for settlement by a Representative of an Overseas Business\n\nROB 13.1. The applicant must not fall for refusal under Part Suitability.\n\n1.   ROB 13.2. The applicant must not be: \n    1.   (a) in breach of immigration laws, except that where the Exceptions for overstayers section of Part Suitability applies, that period of overstaying will be disregarded; or\n    2.   (b) on immigration bail.",
      "summary": "This provision applies to Representatives of an Overseas Business seeking settlement. Applicants must meet suitability requirements, including not breaching immigration laws (with certain exceptions) or being on immigration bail, to avoid refusal under Part Suitability.",
      "augmented_text": "Document: Immigration Rules Appendix Representative of an Overseas Business\nPart: Immigration Rules Appendix Representative of an Overseas Business\nSection ID: ROB 13.1\nSection: Suitability requirements for settlement by a Representative of an Overseas Business\nTopic: suitability\n\nSummary: This provision applies to Representatives of an Overseas Business seeking settlement. Applicants must meet suitability requirements, including not breaching immigration laws (with certain exceptions) or being on immigration bail, to avoid refusal under Part Suitability.\n\n### Suitability requirements for settlement by a Representative of an Overseas Business\n\nROB 13.1. The applicant must not fall for refusal under Part Suitability.\n\n1.   ROB 13.2. The applicant must not be: \n    1.   (a) in breach of immigration laws, except that where the Exceptions for overstayers section of Part Suitability applies, that period of overstaying will be disregarded; or\n    2.   (b) on immigration bail.",
      "needs_review": false
    },
    {
      "metadata": {
        "source": "Immigration Rules Appendix Representative of an Overseas Business",
        "part": "Immigration Rules Appendix Representative of an Overseas Business",
        "section_id": "Eligibility requirements for settlement by a Representative of an Overseas Business",
        "section_title": "Eligibility requirements for settlement by a Representative of an Overseas Business",
        "parent_section": null,
        "hierarchy_level": 3,
        "topic": "eligibility",
        "url": "https://www.gov.uk/guidance/immigration-rules/immigration-rules-appendix-representative-of-an-overseas-business",
        "scraped_at": "2025-12-06T17:28:25.353762"
      },
      "text": "### Eligibility requirements for settlement by a Representative of an Overseas Business",
      "summary": "This provision applies to Representatives of an Overseas Business seeking settlement. They must demonstrate ongoing employment and meet specified eligibility criteria, including continuous residence and compliance with immigration conditions, with particular thresholds and exceptions outlined in the rules.",
      "augmented_text": "Document: Immigration Rules Appendix Representative of an Overseas Business\nPart: Immigration Rules Appendix Representative of an Overseas Business\nSection ID: Eligibility requirements for settlement by a Representative of an Overseas Business\nSection: Eligibility requirements for settlement by a Representative of an Overseas Business\nTopic: eligibility\n\nSummary: This provision applies to Representatives of an Overseas Business seeking settlement. They must demonstrate ongoing employment and meet specified eligibility criteria, including continuous residence and compliance with immigration conditions, with particular thresholds and exceptions outlined in the rules.\n\n### Eligibility requirements for settlement by a Representative of an Overseas Business",
      "needs_review": false
    },
    {
      "metadata": {
        "source": "Immigration Rules Appendix Representative of an Overseas Business",
        "part": "Immigration Rules Appendix Representative of an Overseas Business",
        "section_id": "ROB 14.1",
        "section_title": "Qualifying period requirement for settlement by a Representative of an Overseas Business",
        "parent_section": "ROB 14",
        "hierarchy_level": 2,
        "topic": "settlement",
        "url": "https://www.gov.uk/guidance/immigration-rules/immigration-rules-appendix-representative-of-an-overseas-business",
        "scraped_at": "2025-12-06T17:28:25.353776"
      },
      "text": "### Qualifying period requirement for settlement by a Representative of an Overseas Business\n\nROB 14.1. The applicant must have spent the last 5 years before the date of application in the UK with permission as a Representative of an Overseas Business.",
      "summary": "Applicants applying for settlement as a Representative of an Overseas Business must have spent the previous five years in the UK lawfully under this status. The entire five-year period must be continuous, with no specified exceptions.",
      "augmented_text": "Document: Immigration Rules Appendix Representative of an Overseas Business\nPart: Immigration Rules Appendix Representative of an Overseas Business\nSection ID: ROB 14.1\nSection: Qualifying period requirement for settlement by a Representative of an Overseas Business\nTopic: settlement\n\nSummary: Applicants applying for settlement as a Representative of an Overseas Business must have spent the previous five years in the UK lawfully under this status. The entire five-year period must be continuous, with no specified exceptions.\n\n### Qualifying period requirement for settlement by a Representative of an Overseas Business\n\nROB 14.1. The applicant must have spent the last 5 years before the date of application in the UK with permission as a Representative of an Overseas Business.",
      "needs_review": false
    },
    {
      "metadata": {
        "source": "Immigration Rules Appendix Representative of an Overseas Business",
        "part": "Immigration Rules Appendix Representative of an Overseas Business",
        "section_id": "ROB 15.1",
        "section_title": "Continuous residence requirement for settlement by a Representative of an Overseas Business",
        "parent_section": "ROB 15",
        "hierarchy_level": 2,
        "topic": "settlement",
        "url": "https://www.gov.uk/guidance/immigration-rules/immigration-rules-appendix-representative-of-an-overseas-business",
        "scraped_at": "2025-12-06T17:28:25.353802"
      },
      "text": "### Continuous residence requirement for settlement by a Representative of an Overseas Business\n\nROB 15.1. The applicant must meet the continuous resident requirement in Appendix Continuous Residence during the period in ROB 14.1.",
      "summary": "This provision applies to Representatives of an Overseas Business seeking settlement. They must meet the continuous residence requirement outlined in Appendix Continuous Residence during the specified period. No exceptions are specified in this excerpt.",
      "augmented_text": "Document: Immigration Rules Appendix Representative of an Overseas Business\nPart: Immigration Rules Appendix Representative of an Overseas Business\nSection ID: ROB 15.1\nSection: Continuous residence requirement for settlement by a Representative of an Overseas Business\nTopic: settlement\n\nSummary: This provision applies to Representatives of an Overseas Business seeking settlement. They must meet the continuous residence requirement outlined in Appendix Continuous Residence during the specified period. No exceptions are specified in this excerpt.\n\n### Continuous residence requirement for settlement by a Representative of an Overseas Business\n\nROB 15.1. The applicant must meet the continuous resident requirement in Appendix Continuous Residence during the period in ROB 14.1.",
      "needs_review": false
    },
    {
      "metadata": {
        "source": "Immigration Rules Appendix Representative of an Overseas Business",
        "part": "Immigration Rules Appendix Representative of an Overseas Business",
        "section_id": "1",
        "section_title": "Work requirement for settlement by a Representative of an Overseas Business",
        "parent_section": null,
        "hierarchy_level": 1,
        "topic": "settlement",
        "url": "https://www.gov.uk/guidance/immigration-rules/immigration-rules-appendix-representative-of-an-overseas-business",
        "scraped_at": "2025-12-06T17:28:25.353819"
      },
      "text": "### Work requirement for settlement by a Representative of an Overseas Business\n\n1.   ROB 16.1. Throughout the period in ROB 14.1: \n    1.   (a) the overseas business or media organisation that the applicant represents must have been active and trading with its headquarters and principal place of business remaining outside the UK; and\n    2.   (b) the applicant must have been employed and working fulltime for the overseas business or media organisation they represent, or for that business’s UK branch or subsidiary, and\n    3.   (c) the applicant must not have undertaken work for any other business or engaged in business of their own.\n\n2.   ROB 16.2. The applicant must provide: \n    1.   (a) evidence of salary paid by their employer in the 12 months immediately before the date of application and details of the renumeration package the employee receives; and\n    2.   (b) a letter from their employer confirming that they still require the applicant to work for them, and that the applicant will be required for the foreseeable future.\n\nROB 16.3. The applicant must be required by their employer to continue in the role for which their last period of permission was granted.",
      "summary": "This provision applies to Representatives of an Overseas Business seeking settlement. Applicants must have been employed full-time by the overseas business or its UK branch, with the business remaining active outside the UK, and must not work for other businesses. They must also provide salary evidence and employer confirmation of ongoing employment requirements.",
      "augmented_text": "Document: Immigration Rules Appendix Representative of an Overseas Business\nPart: Immigration Rules Appendix Representative of an Overseas Business\nSection ID: 1\nSection: Work requirement for settlement by a Representative of an Overseas Business\nTopic: settlement\n\nSummary: This provision applies to Representatives of an Overseas Business seeking settlement. Applicants must have been employed full-time by the overseas business or its UK branch, with the business remaining active outside the UK, and must not work for other businesses. They must also provide salary evidence and employer confirmation of ongoing employment requirements.\n\n### Work requirement for settlement by a Representative of an Overseas Business\n\n1.   ROB 16.1. Throughout the period in ROB 14.1: \n    1.   (a) the overseas business or media organisation that the applicant represents must have been active and trading with its headquarters and principal place of business remaining outside the UK; and\n    2.   (b) the applicant must have been employed and working fulltime for the overseas business or media organisation they represent, or for that business’s UK branch or subsidiary, and\n    3.   (c) the applicant must not have undertaken work for any other business or engaged in business of their own.\n\n2.   ROB 16.2. The applicant must provide: \n    1.   (a) evidence of salary paid by their employer in the 12 months immediately before the date of application and details of the renumeration package the employee receives; and\n    2.   (b) a letter from their employer confirming that they still require the applicant to work for them, and that the applicant will be required for the foreseeable future.\n\nROB 16.3. The applicant must be required by their employer to continue in the role for which their last period of permission was granted.",
      "needs_review": false
    },
    {
      "metadata": {
        "source": "Immigration Rules Appendix Representative of an Overseas Business",
        "part": "Immigration Rules Appendix Representative of an Overseas Business",
        "section_id": "ROB 16A",
        "section_title": "Additional business requirements for settlement by a Sole Representative on the Representative of an Overseas Business route",
        "parent_section": null,
        "hierarchy_level": 1,
        "topic": "settlement",
        "url": "https://www.gov.uk/guidance/immigration-rules/immigration-rules-appendix-representative-of-an-overseas-business",
        "scraped_at": "2025-12-06T17:28:25.353935"
      },
      "text": "### Additional business requirements for settlement by a Sole Representative on the Representative of an Overseas Business route\n\nROB 16A.1. Where the applicant has, or was last granted permission as a Sole Representative, the applicant must meet the additional business requirements set out in ROB 16A.2. and ROB 16A.3.\n\n1.   ROB 16A.2. Throughout the period in ROB 14.1, the applicant must have met the following requirements: \n    1.   (a) they must not have had a majority stake in, or otherwise owned or controlled a majority of the overseas business they represent, whether that ownership or control was by means of a shareholding, partnership agreement, sole proprietorship or any other arrangement; and\n    2.   (b) the applicant must have established and then supervised the registered a branch or wholly owned subsidiary of the overseas business they represent in the UK, where that branch or subsidiary was actively trading in the same type of business as the overseas business.\n\n2.   ROB 16A.3. The applicant must provide all of the following: \n    1.   (a) evidence of business that has been generated, principally with firms in the UK, on behalf of their employer since their last grant of permission, in the form of accounts, copies of invoices or letters from businesses with whom the applicant has done business, including the value of transactions; and\n    2.   (b) either a copy of the share register or a letter from the overseas business’s accountant confirming that the UK business is wholly owned by the overseas business; and\n    3.   (c) a letter from the applicant’s employer confirming that the applicant has supervised the UK branch or subsidiary since the last grant of permission.",
      "summary": "This provision applies to sole representatives seeking settlement under the UK Immigration Rules. It requires them to not hold a majority stake, to have established and supervised a UK branch or subsidiary actively trading in the same business, and to provide evidence of ongoing UK business activities since their last permission. Critical conditions include maintaining control and demonstrating UK business engagement.",
      "augmented_text": "Document: Immigration Rules Appendix Representative of an Overseas Business\nPart: Immigration Rules Appendix Representative of an Overseas Business\nSection ID: ROB 16A\nSection: Additional business requirements for settlement by a Sole Representative on the Representative of an Overseas Business route\nTopic: settlement\n\nSummary: This provision applies to sole representatives seeking settlement under the UK Immigration Rules. It requires them to not hold a majority stake, to have established and supervised a UK branch or subsidiary actively trading in the same business, and to provide evidence of ongoing UK business activities since their last permission. Critical conditions include maintaining control and demonstrating UK business engagement.\n\n### Additional business requirements for settlement by a Sole Representative on the Representative of an Overseas Business route\n\nROB 16A.1. Where the applicant has, or was last granted permission as a Sole Representative, the applicant must meet the additional business requirements set out in ROB 16A.2. and ROB 16A.3.\n\n1.   ROB 16A.2. Throughout the period in ROB 14.1, the applicant must have met the following requirements: \n    1.   (a) they must not have had a majority stake in, or otherwise owned or controlled a majority of the overseas business they represent, whether that ownership or control was by means of a shareholding, partnership agreement, sole proprietorship or any other arrangement; and\n    2.   (b) the applicant must have established and then supervised the registered a branch or wholly owned subsidiary of the overseas business they represent in the UK, where that branch or subsidiary was actively trading in the same type of business as the overseas business.\n\n2.   ROB 16A.3. The applicant must provide all of the following: \n    1.   (a) evidence of business that has been generated, principally with firms in the UK, on behalf of their employer since their last grant of permission, in the form of accounts, copies of invoices or letters from businesses with whom the applicant has done business, including the value of transactions; and\n    2.   (b) either a copy of the share register or a letter from the overseas business’s accountant confirming that the UK business is wholly owned by the overseas business; and\n    3.   (c) a letter from the applicant’s employer confirming that the applicant has supervised the UK branch or subsidiary since the last grant of permission.",
      "needs_review": false
    },
    {
      "metadata": {
        "source": "Immigration Rules Appendix Representative of an Overseas Business",
        "part": "Immigration Rules Appendix Representative of an Overseas Business",
        "section_id": "ROB 16B",
        "section_title": "Additional business requirements for settlement by a Media Representative on the Representative of an Overseas Business route",
        "parent_section": null,
        "hierarchy_level": 1,
        "topic": "settlement",
        "url": "https://www.gov.uk/guidance/immigration-rules/immigration-rules-appendix-representative-of-an-overseas-business",
        "scraped_at": "2025-12-06T17:28:25.354019"
      },
      "text": "### Additional business requirements for settlement by a Media Representative on the Representative of an Overseas Business route\n\nROB 16B.1. Where the applicant has, or was last granted, permission as a Media Representative, the applicant must meet the additional business requirements set out in ROB 16B.2.\n\n1.   ROB 16B.2. Throughout the period in ROB 14.1, the applicant must have met the following requirements: \n    1.   (a) they must have been an employee of an overseas newspaper, news agency or broadcasting organisation undertaking a long-term assignment as a representative of their overseas employer; and\n    2.   (b) the applicant must have been engaged in the employment for which their last period of permission was granted.",
      "summary": "Media Representatives applying for settlement must have been employed by an overseas media organisation on a long-term assignment and engaged in their permitted role throughout their previous permission period.",
      "augmented_text": "Document: Immigration Rules Appendix Representative of an Overseas Business\nPart: Immigration Rules Appendix Representative of an Overseas Business\nSection ID: ROB 16B\nSection: Additional business requirements for settlement by a Media Representative on the Representative of an Overseas Business route\nTopic: settlement\n\nSummary: Media Representatives applying for settlement must have been employed by an overseas media organisation on a long-term assignment and engaged in their permitted role throughout their previous permission period.\n\n### Additional business requirements for settlement by a Media Representative on the Representative of an Overseas Business route\n\nROB 16B.1. Where the applicant has, or was last granted, permission as a Media Representative, the applicant must meet the additional business requirements set out in ROB 16B.2.\n\n1.   ROB 16B.2. Throughout the period in ROB 14.1, the applicant must have met the following requirements: \n    1.   (a) they must have been an employee of an overseas newspaper, news agency or broadcasting organisation undertaking a long-term assignment as a representative of their overseas employer; and\n    2.   (b) the applicant must have been engaged in the employment for which their last period of permission was granted.",
      "needs_review": false
    },
    {
      "metadata": {
        "source": "Immigration Rules Appendix Representative of an Overseas Business",
        "part": "Immigration Rules Appendix Representative of an Overseas Business",
        "section_id": "ROB 17.1",
        "section_title": "English language requirement for settlement by a Representative of an Overseas Business",
        "parent_section": "ROB 17",
        "hierarchy_level": 2,
        "topic": "english-language",
        "url": "https://www.gov.uk/guidance/immigration-rules/immigration-rules-appendix-representative-of-an-overseas-business",
        "scraped_at": "2025-12-06T17:28:25.354028"
      },
      "text": "### English language requirement for settlement by a Representative of an Overseas Business\n\nROB 17.1. Unless an exemption applies, the applicant must show English language ability on the Common European Framework of Reference for Languages in speaking and listening to at least level B1.\n\nROB 17.2. The applicant must show they meet the English language requirement as specified in Appendix English Language.",
      "summary": "Applicants applying for settlement as a Representative of an Overseas Business must demonstrate at least B1 level in speaking and listening on the CEFR, unless exempt.",
      "augmented_text": "Document: Immigration Rules Appendix Representative of an Overseas Business\nPart: Immigration Rules Appendix Representative of an Overseas Business\nSection ID: ROB 17.1\nSection: English language requirement for settlement by a Representative of an Overseas Business\nTopic: english-language\n\nSummary: Applicants applying for settlement as a Representative of an Overseas Business must demonstrate at least B1 level in speaking and listening on the CEFR, unless exempt.\n\n### English language requirement for settlement by a Representative of an Overseas Business\n\nROB 17.1. Unless an exemption applies, the applicant must show English language ability on the Common European Framework of Reference for Languages in speaking and listening to at least level B1.\n\nROB 17.2. The applicant must show they meet the English language requirement as specified in Appendix English Language.",
      "needs_review": false
    },
    {
      "metadata": {
        "source": "Immigration Rules Appendix Representative of an Overseas Business",
        "part": "Immigration Rules Appendix Representative of an Overseas Business",
        "section_id": "ROB 18.1",
        "section_title": "Knowledge of life in the UK requirement for settlement by a Representative of an Overseas Business",
        "parent_section": "ROB 18",
        "hierarchy_level": 2,
        "topic": "settlement",
        "url": "https://www.gov.uk/guidance/immigration-rules/immigration-rules-appendix-representative-of-an-overseas-business",
        "scraped_at": "2025-12-06T17:28:25.354041"
      },
      "text": "### Knowledge of life in the UK requirement for settlement by a Representative of an Overseas Business\n\nROB 18.1. The applicant must meet the Knowledge of Life in the UK requirement as specified in Appendix KOL UK.",
      "summary": "Applicants for settlement as a Representative of an Overseas Business must satisfy the Knowledge of Life in the UK requirement outlined in Appendix KOL UK, with no specified exceptions.",
      "augmented_text": "Document: Immigration Rules Appendix Representative of an Overseas Business\nPart: Immigration Rules Appendix Representative of an Overseas Business\nSection ID: ROB 18.1\nSection: Knowledge of life in the UK requirement for settlement by a Representative of an Overseas Business\nTopic: settlement\n\nSummary: Applicants for settlement as a Representative of an Overseas Business must satisfy the Knowledge of Life in the UK requirement outlined in Appendix KOL UK, with no specified exceptions.\n\n### Knowledge of life in the UK requirement for settlement by a Representative of an Overseas Business\n\nROB 18.1. The applicant must meet the Knowledge of Life in the UK requirement as specified in Appendix KOL UK.",
      "needs_review": false
    },
    {
      "metadata": {
        "source": "Immigration Rules Appendix Representative of an Overseas Business",
        "part": "Immigration Rules Appendix Representative of an Overseas Business",
        "section_id": "ROB 19.1",
        "section_title": "Decision on an application for settlement as a Representative of an Overseas Business Route",
        "parent_section": "ROB 19",
        "hierarchy_level": 2,
        "topic": "eligibility",
        "url": "https://www.gov.uk/guidance/immigration-rules/immigration-rules-appendix-representative-of-an-overseas-business",
        "scraped_at": "2025-12-06T17:28:25.354048"
      },
      "text": "### Decision on an application for settlement as a Representative of an Overseas Business Route\n\nROB 19.1. If the decision maker is satisfied all the suitability and relevant eligibility requirements are met for settlement by a Representative of an Overseas Business, the applicant will be granted settlement, otherwise the application will be refused.\n\nROB 19.2. If the application is refused, a person can apply for an Administrative Review under Appendix AR: Administrative Review.",
      "summary": "Applicants applying for settlement as a Representative of an Overseas Business must meet all suitability and eligibility requirements; if satisfied, settlement is granted, otherwise refused. If refused, applicants can request an Administrative Review under Appendix AR.",
      "augmented_text": "Document: Immigration Rules Appendix Representative of an Overseas Business\nPart: Immigration Rules Appendix Representative of an Overseas Business\nSection ID: ROB 19.1\nSection: Decision on an application for settlement as a Representative of an Overseas Business Route\nTopic: eligibility\n\nSummary: Applicants applying for settlement as a Representative of an Overseas Business must meet all suitability and eligibility requirements; if satisfied, settlement is granted, otherwise refused. If refused, applicants can request an Administrative Review under Appendix AR.\n\n### Decision on an application for settlement as a Representative of an Overseas Business Route\n\nROB 19.1. If the decision maker is satisfied all the suitability and relevant eligibility requirements are met for settlement by a Representative of an Overseas Business, the applicant will be granted settlement, otherwise the application will be refused.\n\nROB 19.2. If the application is refused, a person can apply for an Administrative Review under Appendix AR: Administrative Review.",
      "needs_review": false
    },
    {
      "metadata": {
        "source": "Immigration Rules Appendix Representative of an Overseas Business",
        "part": "Immigration Rules Appendix Representative of an Overseas Business",
        "section_id": "16.2",
        "section_title": "Dependants of Representatives of Overseas Businesses",
        "parent_section": null,
        "hierarchy_level": 2,
        "topic": "dependants",
        "url": "https://www.gov.uk/guidance/immigration-rules/immigration-rules-appendix-representative-of-an-overseas-business",
        "scraped_at": "2025-12-06T17:28:25.354058"
      },
      "text": "### Dependants of Representatives of Overseas Businesses",
      "summary": "This provision applies to dependants of representatives of overseas businesses. Dependants must satisfy eligibility criteria, including relationship and lawful presence, to accompany or join the representative. No specific exceptions are noted beyond standard dependency requirements.",
      "augmented_text": "Document: Immigration Rules Appendix Representative of an Overseas Business\nPart: Immigration Rules Appendix Representative of an Overseas Business\nSection ID: 16.2\nSection: Dependants of Representatives of Overseas Businesses\nTopic: dependants\n\nSummary: This provision applies to dependants of representatives of overseas businesses. Dependants must satisfy eligibility criteria, including relationship and lawful presence, to accompany or join the representative. No specific exceptions are noted beyond standard dependency requirements.\n\n### Dependants of Representatives of Overseas Businesses",
      "needs_review": false
    },
    {
      "metadata": {
        "source": "Immigration Rules Appendix Representative of an Overseas Business",
        "part": "Immigration Rules Appendix Representative of an Overseas Business",
        "section_id": "1",
        "section_title": "Validity requirements for a dependent partner or dependent child of a Representative of an Overseas Business",
        "parent_section": null,
        "hierarchy_level": 1,
        "topic": "leave-to-enter",
        "url": "https://www.gov.uk/guidance/immigration-rules/immigration-rules-appendix-representative-of-an-overseas-business",
        "scraped_at": "2025-12-06T17:28:25.354077"
      },
      "text": "### Validity requirements for a dependent partner or dependent child of a Representative of an Overseas Business\n\n1.   ROB.20.1. A person applying for entry clearance or permission to stay as a partner or child on the Representative of an Overseas Business route must apply online on the gov.uk website on the specified form as follows: \n    1.   (a) for entry clearance, “Join or accompany a family member” on the “Find and apply for other visas from outside the UK” form; or\n    2.   (b) for permission to stay, “Application to extend stay in the UK: FLR(IR)”.\n\n1.   ROB 20.2. An application for entry clearance or permission to stay as a partner or child of a Representative of an Overseas Business must meet all the following requirements: \n    1.   (a) any fee and Immigration Health Charge must have been paid; and\n    2.   (b) the applicant must have provided biometrics when required; and\n    3.   (c) the applicant must have provided a passport or other travel document which satisfactorily establishes their identity and nationality; and\n    4.   (d) the applicant must be applying as partner or child of a person who: \n        1.   (i) has made a valid application for entry clearance or permission to stay on the Representative of an Overseas Business route that has not been decided; or\n        2.   (ii) has entry clearance or permission on the Representative of an Overseas Business route; or\n        3.   (iii)is settled or has become a British citizen, providing that person (P) had permission on the Representative of an Overseas Business route when they settled and the applicant either had permission as their partner or child at that time, or the applicant is applying as a child of P and the applicant was born in the UK before P settled.\n\nROB 20.3. A person applying as a dependent partner must be aged 18 or over on the date of application.\n\n1.   ROB 20.4. If applying for permission to stay, the applicant must be in the UK on the date of application.\n2.   ROB 20.4ZA. If applying for permission to stay, the applicant must not have, or have last been granted, permission: \n    1.   (a) as a Visitor; or\n    2.   (b) as a Short-term Student; or\n    3.   (c) as a Parent of a Child Student; or\n    4.   (d) as a Seasonal Worker; or\n    5.   (e) as a Domestic Worker in a Private Household; or\n    6.   (f) outside the Immigration Rules.\n\n1.   ROB 20.4A. An applicant who is applying for permission to stay and has, or last had, permission as a Student, must fulfil one of the Conditions A or B below on the date of application: \n    1.   (a) Condition A: the applicant must have completed the course of study for which the Confirmation of Acceptance for Studies was assigned (or a course to which ST 27.3 of Appendix Student applies); or\n    2.   (b) Condition B: the applicant must: \n        1.   (i) be studying a full-time course of study leading to the award of a PhD with a higher education provider which has a track record of compliance; and\n        2.   (ii) have completed at least 24 months of study on that course.\n\nROB 20.5. An application which does not meet all the validity requirements for a partner or child of a Representative of an Overseas Business may be rejected as invalid and not considered.",
      "summary": "Dependent partners or children of a Representative of an Overseas Business must apply online with required fees, biometrics, and valid travel documents. Their application must be linked to a sponsor with valid or pending permission under the same route, or settled/British with prior status. These conditions ensure eligibility for entry or stay in the UK.",
      "augmented_text": "Document: Immigration Rules Appendix Representative of an Overseas Business\nPart: Immigration Rules Appendix Representative of an Overseas Business\nSection ID: 1\nSection: Validity requirements for a dependent partner or dependent child of a Representative of an Overseas Business\nTopic: leave-to-enter\n\nSummary: Dependent partners or children of a Representative of an Overseas Business must apply online with required fees, biometrics, and valid travel documents. Their application must be linked to a sponsor with valid or pending permission under the same route, or settled/British with prior status. These conditions ensure eligibility for entry or stay in the UK.\n\n### Validity requirements for a dependent partner or dependent child of a Representative of an Overseas Business\n\n1.   ROB.20.1. A person applying for entry clearance or permission to stay as a partner or child on the Representative of an Overseas Business route must apply online on the gov.uk website on the specified form as follows: \n    1.   (a) for entry clearance, “Join or accompany a family member” on the “Find and apply for other visas from outside the UK” form; or\n    2.   (b) for permission to stay, “Application to extend stay in the UK: FLR(IR)”.\n\n1.   ROB 20.2. An application for entry clearance or permission to stay as a partner or child of a Representative of an Overseas Business must meet all the following requirements: \n    1.   (a) any fee and Immigration Health Charge must have been paid; and\n    2.   (b) the applicant must have provided biometrics when required; and\n    3.   (c) the applicant must have provided a passport or other travel document which satisfactorily establishes their identity and nationality; and\n    4.   (d) the applicant must be applying as partner or child of a person who: \n        1.   (i) has made a valid application for entry clearance or permission to stay on the Representative of an Overseas Business route that has not been decided; or\n        2.   (ii) has entry clearance or permission on the Representative of an Overseas Business route; or\n        3.   (iii)is settled or has become a British citizen, providing that person (P) had permission on the Representative of an Overseas Business route when they settled and the applicant either had permission as their partner or child at that time, or the applicant is applying as a child of P and the applicant was born in the UK before P settled.\n\nROB 20.3. A person applying as a dependent partner must be aged 18 or over on the date of application.\n\n1.   ROB 20.4. If applying for permission to stay, the applicant must be in the UK on the date of application.\n2.   ROB 20.4ZA. If applying for permission to stay, the applicant must not have, or have last been granted, permission: \n    1.   (a) as a Visitor; or\n    2.   (b) as a Short-term Student; or\n    3.   (c) as a Parent of a Child Student; or\n    4.   (d) as a Seasonal Worker; or\n    5.   (e) as a Domestic Worker in a Private Household; or\n    6.   (f) outside the Immigration Rules.\n\n1.   ROB 20.4A. An applicant who is applying for permission to stay and has, or last had, permission as a Student, must fulfil one of the Conditions A or B below on the date of application: \n    1.   (a) Condition A: the applicant must have completed the course of study for which the Confirmation of Acceptance for Studies was assigned (or a course to which ST 27.3 of Appendix Student applies); or\n    2.   (b) Condition B: the applicant must: \n        1.   (i) be studying a full-time course of study leading to the award of a PhD with a higher education provider which has a track record of compliance; and\n        2.   (ii) have completed at least 24 months of study on that course.\n\nROB 20.5. An application which does not meet all the validity requirements for a partner or child of a Representative of an Overseas Business may be rejected as invalid and not considered.",
      "needs_review": false
    },
    {
      "metadata": {
        "source": "Immigration Rules Appendix Representative of an Overseas Business",
        "part": "Immigration Rules Appendix Representative of an Overseas Business",
        "section_id": "ROB 21.1",
        "section_title": "Suitability requirements for a partner or child on the Representative of an Overseas Business route",
        "parent_section": "ROB 21",
        "hierarchy_level": 2,
        "topic": "suitability",
        "url": "https://www.gov.uk/guidance/immigration-rules/immigration-rules-appendix-representative-of-an-overseas-business",
        "scraped_at": "2025-12-06T17:28:25.354088"
      },
      "text": "### Suitability requirements for a partner or child on the Representative of an Overseas Business route\n\nROB 21.1. The applicant must not fall for refusal under Part Suitability.\n\n1.   ROB 21.2. If applying for permission to stay the applicant must not be: \n    1.   (a) in breach of immigration laws, except that where the Exceptions for overstayers section of Part Suitability applies, that period of overstaying will be disregarded; or\n    2.   (b) on immigration bail.",
      "summary": "Applicants applying for a partner or child on the Representative of an Overseas Business route must meet suitability criteria, including not breaching immigration laws (unless overstaying is disregarded) or being on immigration bail.",
      "augmented_text": "Document: Immigration Rules Appendix Representative of an Overseas Business\nPart: Immigration Rules Appendix Representative of an Overseas Business\nSection ID: ROB 21.1\nSection: Suitability requirements for a partner or child on the Representative of an Overseas Business route\nTopic: suitability\n\nSummary: Applicants applying for a partner or child on the Representative of an Overseas Business route must meet suitability criteria, including not breaching immigration laws (unless overstaying is disregarded) or being on immigration bail.\n\n### Suitability requirements for a partner or child on the Representative of an Overseas Business route\n\nROB 21.1. The applicant must not fall for refusal under Part Suitability.\n\n1.   ROB 21.2. If applying for permission to stay the applicant must not be: \n    1.   (a) in breach of immigration laws, except that where the Exceptions for overstayers section of Part Suitability applies, that period of overstaying will be disregarded; or\n    2.   (b) on immigration bail.",
      "needs_review": false
    },
    {
      "metadata": {
        "source": "Immigration Rules Appendix Representative of an Overseas Business",
        "part": "Immigration Rules Appendix Representative of an Overseas Business",
        "section_id": "Eligibility requirements for a partner or child on the Representative of an Overseas Business route",
        "section_title": "Eligibility requirements for a partner or child on the Representative of an Overseas Business route",
        "parent_section": null,
        "hierarchy_level": 3,
        "topic": "eligibility",
        "url": "https://www.gov.uk/guidance/immigration-rules/immigration-rules-appendix-representative-of-an-overseas-business",
        "scraped_at": "2025-12-06T17:28:25.354092"
      },
      "text": "### Eligibility requirements for a partner or child on the Representative of an Overseas Business route",
      "summary": "This provision applies to partners and children of applicants under the Representative of an Overseas Business route. They must meet specific relationship and eligibility criteria, including being dependents, and must not breach immigration conditions; exceptions are limited.",
      "augmented_text": "Document: Immigration Rules Appendix Representative of an Overseas Business\nPart: Immigration Rules Appendix Representative of an Overseas Business\nSection ID: Eligibility requirements for a partner or child on the Representative of an Overseas Business route\nSection: Eligibility requirements for a partner or child on the Representative of an Overseas Business route\nTopic: eligibility\n\nSummary: This provision applies to partners and children of applicants under the Representative of an Overseas Business route. They must meet specific relationship and eligibility criteria, including being dependents, and must not breach immigration conditions; exceptions are limited.\n\n### Eligibility requirements for a partner or child on the Representative of an Overseas Business route",
      "needs_review": false
    },
    {
      "metadata": {
        "source": "Immigration Rules Appendix Representative of an Overseas Business",
        "part": "Immigration Rules Appendix Representative of an Overseas Business",
        "section_id": "ROB 22.1",
        "section_title": "Entry requirement for a partner or child on the Representative of an Overseas Business route",
        "parent_section": "ROB 22",
        "hierarchy_level": 2,
        "topic": "leave-to-enter",
        "url": "https://www.gov.uk/guidance/immigration-rules/immigration-rules-appendix-representative-of-an-overseas-business",
        "scraped_at": "2025-12-06T17:28:25.354105"
      },
      "text": "### Entry requirement for a partner or child on the Representative of an Overseas Business route\n\nROB 22.1. A person seeking to come to the UK as a partner or child must apply for and obtain an entry clearance as a partner or child before they arrive in the UK.\n\nROB 22.2. A person applying for entry clearance as the partner or child of a Representative of an Overseas Business must, if Appendix Tuberculosis applies, provide a valid medical certificate confirming that they have undergone screening for active pulmonary tuberculosis and that this tuberculosis is not present in them.",
      "summary": "Partners or children joining a Representative of an Overseas Business must apply for and obtain entry clearance before arrival, providing a TB certificate if required.",
      "augmented_text": "Document: Immigration Rules Appendix Representative of an Overseas Business\nPart: Immigration Rules Appendix Representative of an Overseas Business\nSection ID: ROB 22.1\nSection: Entry requirement for a partner or child on the Representative of an Overseas Business route\nTopic: leave-to-enter\n\nSummary: Partners or children joining a Representative of an Overseas Business must apply for and obtain entry clearance before arrival, providing a TB certificate if required.\n\n### Entry requirement for a partner or child on the Representative of an Overseas Business route\n\nROB 22.1. A person seeking to come to the UK as a partner or child must apply for and obtain an entry clearance as a partner or child before they arrive in the UK.\n\nROB 22.2. A person applying for entry clearance as the partner or child of a Representative of an Overseas Business must, if Appendix Tuberculosis applies, provide a valid medical certificate confirming that they have undergone screening for active pulmonary tuberculosis and that this tuberculosis is not present in them.",
      "needs_review": false
    },
    {
      "metadata": {
        "source": "Immigration Rules Appendix Representative of an Overseas Business",
        "part": "Immigration Rules Appendix Representative of an Overseas Business",
        "section_id": "1",
        "section_title": "Relationship requirements for a partner of a Representative of an Overseas Business route",
        "parent_section": null,
        "hierarchy_level": 1,
        "topic": "family",
        "url": "https://www.gov.uk/guidance/immigration-rules/immigration-rules-appendix-representative-of-an-overseas-business",
        "scraped_at": "2025-12-06T17:28:25.354121"
      },
      "text": "### Relationship requirements for a partner of a Representative of an Overseas Business route\n\n1.   ROB 23.1. The applicant must be the partner of a person (P) and one of the following must apply: \n    1.   (a) P has permission on the Representative of an Overseas Business route; or\n    2.   (b) P is, at the same time, applying for (and is granted) permission on the Representative of an Overseas Business route; or\n    3.   (c) P is settled or has become a British citizen, providing they had permission on a Representative of an Overseas Business route when they settled and the applicant had permission as their partner at that time.\n\nROB 23.2. The requirements of Appendix Relationship with Partner must be met.\n\nROB 23.3. DELETED\n\nROB 23.4. DELETED",
      "summary": "This provision applies to partners of applicants on the Representative of an Overseas Business route. The partner must be linked to a person with permission or settled status on this route, meeting the specified relationship criteria. Critical conditions include having or applying for permission on the route and the applicant’s previous permission status or British citizenship based on route permission.",
      "augmented_text": "Document: Immigration Rules Appendix Representative of an Overseas Business\nPart: Immigration Rules Appendix Representative of an Overseas Business\nSection ID: 1\nSection: Relationship requirements for a partner of a Representative of an Overseas Business route\nTopic: family\n\nSummary: This provision applies to partners of applicants on the Representative of an Overseas Business route. The partner must be linked to a person with permission or settled status on this route, meeting the specified relationship criteria. Critical conditions include having or applying for permission on the route and the applicant’s previous permission status or British citizenship based on route permission.\n\n### Relationship requirements for a partner of a Representative of an Overseas Business route\n\n1.   ROB 23.1. The applicant must be the partner of a person (P) and one of the following must apply: \n    1.   (a) P has permission on the Representative of an Overseas Business route; or\n    2.   (b) P is, at the same time, applying for (and is granted) permission on the Representative of an Overseas Business route; or\n    3.   (c) P is settled or has become a British citizen, providing they had permission on a Representative of an Overseas Business route when they settled and the applicant had permission as their partner at that time.\n\nROB 23.2. The requirements of Appendix Relationship with Partner must be met.\n\nROB 23.3. DELETED\n\nROB 23.4. DELETED",
      "needs_review": false
    },
    {
      "metadata": {
        "source": "Immigration Rules Appendix Representative of an Overseas Business",
        "part": "Immigration Rules Appendix Representative of an Overseas Business",
        "section_id": "ROB 24.1",
        "section_title": "Relationship requirement for a dependent child on the Representative of an Overseas Business route",
        "parent_section": "ROB 24",
        "hierarchy_level": 2,
        "topic": "family",
        "url": "https://www.gov.uk/guidance/immigration-rules/immigration-rules-appendix-representative-of-an-overseas-business",
        "scraped_at": "2025-12-06T17:28:25.354134"
      },
      "text": "### Relationship requirement for a dependent child on the Representative of an Overseas Business route\n\nROB 24.1. DELETED.\n\nROB 24.2. DELETED.",
      "summary": "This provision applies to dependent children of representatives under the Overseas Business route. They must demonstrate a genuine relationship, typically being the child of the representative, with specific evidence required; exceptions are not specified.",
      "augmented_text": "Document: Immigration Rules Appendix Representative of an Overseas Business\nPart: Immigration Rules Appendix Representative of an Overseas Business\nSection ID: ROB 24.1\nSection: Relationship requirement for a dependent child on the Representative of an Overseas Business route\nTopic: family\n\nSummary: This provision applies to dependent children of representatives under the Overseas Business route. They must demonstrate a genuine relationship, typically being the child of the representative, with specific evidence required; exceptions are not specified.\n\n### Relationship requirement for a dependent child on the Representative of an Overseas Business route\n\nROB 24.1. DELETED.\n\nROB 24.2. DELETED.",
      "needs_review": false
    },
    {
      "metadata": {
        "source": "Immigration Rules Appendix Representative of an Overseas Business",
        "part": "Immigration Rules Appendix Representative of an Overseas Business",
        "section_id": "ROB 25.1",
        "section_title": "Care requirement for a dependent child on the Representative of an Overseas Business route",
        "parent_section": "ROB 25",
        "hierarchy_level": 2,
        "topic": "family",
        "url": "https://www.gov.uk/guidance/immigration-rules/immigration-rules-appendix-representative-of-an-overseas-business",
        "scraped_at": "2025-12-06T17:28:25.354146"
      },
      "text": "### Care requirement for a dependent child on the Representative of an Overseas Business route\n\nROB 25.1. DELETED.",
      "summary": "This provision applies to dependent children of representatives under the Overseas Business route. It mandates that the child must receive adequate care appropriate to their age and needs, subject to any specific conditions or exceptions outlined in the full regulation.",
      "augmented_text": "Document: Immigration Rules Appendix Representative of an Overseas Business\nPart: Immigration Rules Appendix Representative of an Overseas Business\nSection ID: ROB 25.1\nSection: Care requirement for a dependent child on the Representative of an Overseas Business route\nTopic: family\n\nSummary: This provision applies to dependent children of representatives under the Overseas Business route. It mandates that the child must receive adequate care appropriate to their age and needs, subject to any specific conditions or exceptions outlined in the full regulation.\n\n### Care requirement for a dependent child on the Representative of an Overseas Business route\n\nROB 25.1. DELETED.",
      "needs_review": false
    },
    {
      "metadata": {
        "source": "Immigration Rules Appendix Representative of an Overseas Business",
        "part": "Immigration Rules Appendix Representative of an Overseas Business",
        "section_id": "ROB 26.1",
        "section_title": "Age requirement for a dependent child on the Representative of an Overseas Business route",
        "parent_section": "ROB 26",
        "hierarchy_level": 2,
        "topic": "family",
        "url": "https://www.gov.uk/guidance/immigration-rules/immigration-rules-appendix-representative-of-an-overseas-business",
        "scraped_at": "2025-12-06T17:28:25.354158"
      },
      "text": "### Age requirement for a dependent child on the Representative of an Overseas Business route\n\nROB 26.1. DELETED.\n\nROB 26.2. DELETED.",
      "summary": "This provision applies to dependents of applicants under the Representative of an Overseas Business route. It requires dependent children to be under 18 years of age, with certain exceptions permitted; specific conditions are detailed in the full regulation.",
      "augmented_text": "Document: Immigration Rules Appendix Representative of an Overseas Business\nPart: Immigration Rules Appendix Representative of an Overseas Business\nSection ID: ROB 26.1\nSection: Age requirement for a dependent child on the Representative of an Overseas Business route\nTopic: family\n\nSummary: This provision applies to dependents of applicants under the Representative of an Overseas Business route. It requires dependent children to be under 18 years of age, with certain exceptions permitted; specific conditions are detailed in the full regulation.\n\n### Age requirement for a dependent child on the Representative of an Overseas Business route\n\nROB 26.1. DELETED.\n\nROB 26.2. DELETED.",
      "needs_review": false
    },
    {
      "metadata": {
        "source": "Immigration Rules Appendix Representative of an Overseas Business",
        "part": "Immigration Rules Appendix Representative of an Overseas Business",
        "section_id": "1",
        "section_title": "Requirements for a dependent child on the Representative of an Overseas Business route",
        "parent_section": null,
        "hierarchy_level": 1,
        "topic": "leave-to-enter",
        "url": "https://www.gov.uk/guidance/immigration-rules/immigration-rules-appendix-representative-of-an-overseas-business",
        "scraped_at": "2025-12-06T17:28:25.354171"
      },
      "text": "### Requirements for a dependent child on the Representative of an Overseas Business route\n\n1.   ROB 26A.1. The applicant must meet the following requirements for a dependent child in Appendix Children: \n    1.   (a) relationship requirement: entry clearance and permission to stay; and\n    2.   (b) care requirement; and\n    3.   (c) age and independent life requirement.",
      "summary": "Dependent children applying under the Representative of an Overseas Business route must satisfy relationship, care, and age independence requirements outlined in Appendix Children to secure entry clearance and permission to stay.",
      "augmented_text": "Document: Immigration Rules Appendix Representative of an Overseas Business\nPart: Immigration Rules Appendix Representative of an Overseas Business\nSection ID: 1\nSection: Requirements for a dependent child on the Representative of an Overseas Business route\nTopic: leave-to-enter\n\nSummary: Dependent children applying under the Representative of an Overseas Business route must satisfy relationship, care, and age independence requirements outlined in Appendix Children to secure entry clearance and permission to stay.\n\n### Requirements for a dependent child on the Representative of an Overseas Business route\n\n1.   ROB 26A.1. The applicant must meet the following requirements for a dependent child in Appendix Children: \n    1.   (a) relationship requirement: entry clearance and permission to stay; and\n    2.   (b) care requirement; and\n    3.   (c) age and independent life requirement.",
      "needs_review": false
    },
    {
      "metadata": {
        "source": "Immigration Rules Appendix Representative of an Overseas Business",
        "part": "Immigration Rules Appendix Representative of an Overseas Business",
        "section_id": "ROB 27.1",
        "section_title": "Financial requirement for a partner or child on the Representative of an Overseas Business route",
        "parent_section": "ROB 27",
        "hierarchy_level": 2,
        "topic": "financial",
        "url": "https://www.gov.uk/guidance/immigration-rules/immigration-rules-appendix-representative-of-an-overseas-business",
        "scraped_at": "2025-12-06T17:28:25.354179"
      },
      "text": "### Financial requirement for a partner or child on the Representative of an Overseas Business route\n\nROB 27.1. The decision maker must be satisfied that the applicant or the Representative of an Overseas Business can and will adequately maintain and accommodate the applicant, and any other dependants in the UK, or applying for entry clearance, without access to public funds.\n\nROB 27.2. Funds must be shown as specified in Appendix Finance.",
      "summary": "Applicants and their dependants applying under the Representative of an Overseas Business route must demonstrate they can adequately maintain and accommodate themselves without public funds, per specified financial requirements. The decision-maker must be satisfied of this capacity, applicable to both entry and maintenance in the UK.",
      "augmented_text": "Document: Immigration Rules Appendix Representative of an Overseas Business\nPart: Immigration Rules Appendix Representative of an Overseas Business\nSection ID: ROB 27.1\nSection: Financial requirement for a partner or child on the Representative of an Overseas Business route\nTopic: financial\n\nSummary: Applicants and their dependants applying under the Representative of an Overseas Business route must demonstrate they can adequately maintain and accommodate themselves without public funds, per specified financial requirements. The decision-maker must be satisfied of this capacity, applicable to both entry and maintenance in the UK.\n\n### Financial requirement for a partner or child on the Representative of an Overseas Business route\n\nROB 27.1. The decision maker must be satisfied that the applicant or the Representative of an Overseas Business can and will adequately maintain and accommodate the applicant, and any other dependants in the UK, or applying for entry clearance, without access to public funds.\n\nROB 27.2. Funds must be shown as specified in Appendix Finance.",
      "needs_review": false
    },
    {
      "metadata": {
        "source": "Immigration Rules Appendix Representative of an Overseas Business",
        "part": "Immigration Rules Appendix Representative of an Overseas Business",
        "section_id": "ROB 28.1",
        "section_title": "Overseas business requirement for a partner or child on the Representative of an Overseas Business route",
        "parent_section": "ROB 28",
        "hierarchy_level": 2,
        "topic": "family",
        "url": "https://www.gov.uk/guidance/immigration-rules/immigration-rules-appendix-representative-of-an-overseas-business",
        "scraped_at": "2025-12-06T17:28:25.354195"
      },
      "text": "### Overseas business requirement for a partner or child on the Representative of an Overseas Business route\n\nROB 28.1. If the person (P) in ROB 23.1. is a Sole Representative, the applicant must not have a majority stake in, or otherwise own or control a majority of the overseas business P represents, whether that ownership or control is by means of a shareholding, partnership agreement, sole proprietorship or any other arrangement.",
      "summary": "Applicants joining a Sole Representative must not hold a majority stake or control over the overseas business they represent. This requirement ensures they are genuinely representative, with specific restrictions on ownership or control. The rule applies specifically to partners or children on the Representative of an Overseas Business route.",
      "augmented_text": "Document: Immigration Rules Appendix Representative of an Overseas Business\nPart: Immigration Rules Appendix Representative of an Overseas Business\nSection ID: ROB 28.1\nSection: Overseas business requirement for a partner or child on the Representative of an Overseas Business route\nTopic: family\n\nSummary: Applicants joining a Sole Representative must not hold a majority stake or control over the overseas business they represent. This requirement ensures they are genuinely representative, with specific restrictions on ownership or control. The rule applies specifically to partners or children on the Representative of an Overseas Business route.\n\n### Overseas business requirement for a partner or child on the Representative of an Overseas Business route\n\nROB 28.1. If the person (P) in ROB 23.1. is a Sole Representative, the applicant must not have a majority stake in, or otherwise own or control a majority of the overseas business P represents, whether that ownership or control is by means of a shareholding, partnership agreement, sole proprietorship or any other arrangement.",
      "needs_review": false
    },
    {
      "metadata": {
        "source": "Immigration Rules Appendix Representative of an Overseas Business",
        "part": "Immigration Rules Appendix Representative of an Overseas Business",
        "section_id": "ROB 29.1",
        "section_title": "Decision on an application as a dependent partner or dependent child on the Representative of an Overseas Business route",
        "parent_section": "ROB 29",
        "hierarchy_level": 2,
        "topic": "eligibility",
        "url": "https://www.gov.uk/guidance/immigration-rules/immigration-rules-appendix-representative-of-an-overseas-business",
        "scraped_at": "2025-12-06T17:28:25.354201"
      },
      "text": "### Decision on an application as a dependent partner or dependent child on the Representative of an Overseas Business route\n\nROB 29.1. If the decision maker is satisfied that all the suitability and eligibility requirements are met for a dependent partner or dependent child on the Representative of an Overseas Business route the application will be granted, otherwise the application will be refused.\n\nROB 29.2. If the application is refused the person can apply for an Administrative Review under Appendix AR: Administrative Review.",
      "summary": "This provision pertains to dependent partners and children applying under the Representative of an Overseas Business route. Applications are granted if all suitability and eligibility criteria are met; otherwise, they are refused, with applicants able to seek an Administrative Review.",
      "augmented_text": "Document: Immigration Rules Appendix Representative of an Overseas Business\nPart: Immigration Rules Appendix Representative of an Overseas Business\nSection ID: ROB 29.1\nSection: Decision on an application as a dependent partner or dependent child on the Representative of an Overseas Business route\nTopic: eligibility\n\nSummary: This provision pertains to dependent partners and children applying under the Representative of an Overseas Business route. Applications are granted if all suitability and eligibility criteria are met; otherwise, they are refused, with applicants able to seek an Administrative Review.\n\n### Decision on an application as a dependent partner or dependent child on the Representative of an Overseas Business route\n\nROB 29.1. If the decision maker is satisfied that all the suitability and eligibility requirements are met for a dependent partner or dependent child on the Representative of an Overseas Business route the application will be granted, otherwise the application will be refused.\n\nROB 29.2. If the application is refused the person can apply for an Administrative Review under Appendix AR: Administrative Review.",
      "needs_review": false
    },
    {
      "metadata": {
        "source": "Immigration Rules Appendix Representative of an Overseas Business",
        "part": "Immigration Rules Appendix Representative of an Overseas Business",
        "section_id": "1",
        "section_title": "Period of grant for a dependent partner or dependent child on the Representative of an Overseas Business route",
        "parent_section": null,
        "hierarchy_level": 1,
        "topic": "family",
        "url": "https://www.gov.uk/guidance/immigration-rules/immigration-rules-appendix-representative-of-an-overseas-business",
        "scraped_at": "2025-12-06T17:28:25.354227"
      },
      "text": "### Period of grant for a dependent partner or dependent child on the Representative of an Overseas Business route\n\n1.   ROB 30.1. A partner will be granted: \n    1.   (a) permission which ends on the same date as the permission as the Representative of an Overseas Business; or\n    2.   (b) 2 years’ permission if the Representative of an Overseas Business was (or is being) granted settlement as a Representative of an Overseas Business.\n\nROB 30.2. A dependent child will be granted permission which ends on the same date as whichever of their parents’ permission ends first, unless both parents have (or are being granted) settlement or British Citizenship, in which case the child will be granted permission for 30 months.",
      "summary": "Dependents of a Representative of an Overseas Business are granted permission that aligns with the main applicant’s or, if both parents have settlement or British Citizenship, for 30 months; partners' permissions mirror the main permission, while children’s durations depend on their parents' status.",
      "augmented_text": "Document: Immigration Rules Appendix Representative of an Overseas Business\nPart: Immigration Rules Appendix Representative of an Overseas Business\nSection ID: 1\nSection: Period of grant for a dependent partner or dependent child on the Representative of an Overseas Business route\nTopic: family\n\nSummary: Dependents of a Representative of an Overseas Business are granted permission that aligns with the main applicant’s or, if both parents have settlement or British Citizenship, for 30 months; partners' permissions mirror the main permission, while children’s durations depend on their parents' status.\n\n### Period of grant for a dependent partner or dependent child on the Representative of an Overseas Business route\n\n1.   ROB 30.1. A partner will be granted: \n    1.   (a) permission which ends on the same date as the permission as the Representative of an Overseas Business; or\n    2.   (b) 2 years’ permission if the Representative of an Overseas Business was (or is being) granted settlement as a Representative of an Overseas Business.\n\nROB 30.2. A dependent child will be granted permission which ends on the same date as whichever of their parents’ permission ends first, unless both parents have (or are being granted) settlement or British Citizenship, in which case the child will be granted permission for 30 months.",
      "needs_review": false
    },
    {
      "metadata": {
        "source": "Immigration Rules Appendix Representative of an Overseas Business",
        "part": "Immigration Rules Appendix Representative of an Overseas Business",
        "section_id": "1",
        "section_title": "Conditions of grant for a dependent partner or dependent child on the Representative of an Overseas Business route",
        "parent_section": null,
        "hierarchy_level": 1,
        "topic": "financial",
        "url": "https://www.gov.uk/guidance/immigration-rules/immigration-rules-appendix-representative-of-an-overseas-business",
        "scraped_at": "2025-12-06T17:28:25.354236"
      },
      "text": "### Conditions of grant for a dependent partner or dependent child on the Representative of an Overseas Business route\n\n1.   ROB 30.3. The grant will be subject to all the following conditions: \n    1.   (a) no access to public funds; and\n    2.   (b) work (including self-employment and voluntary work) permitted; except for employment as a professional sportsperson (including as a sports coach); and\n    3.   (c) study is permitted, subject to the ATAS condition in Appendix ATAS.\n    4.   (d) DELETED",
      "summary": "Dependents of the Representative of an Overseas Business must not access public funds, can work (excluding professional sports roles), and may study with ATAS approval. These conditions apply to dependent partners and children granted leave under this route.",
      "augmented_text": "Document: Immigration Rules Appendix Representative of an Overseas Business\nPart: Immigration Rules Appendix Representative of an Overseas Business\nSection ID: 1\nSection: Conditions of grant for a dependent partner or dependent child on the Representative of an Overseas Business route\nTopic: financial\n\nSummary: Dependents of the Representative of an Overseas Business must not access public funds, can work (excluding professional sports roles), and may study with ATAS approval. These conditions apply to dependent partners and children granted leave under this route.\n\n### Conditions of grant for a dependent partner or dependent child on the Representative of an Overseas Business route\n\n1.   ROB 30.3. The grant will be subject to all the following conditions: \n    1.   (a) no access to public funds; and\n    2.   (b) work (including self-employment and voluntary work) permitted; except for employment as a professional sportsperson (including as a sports coach); and\n    3.   (c) study is permitted, subject to the ATAS condition in Appendix ATAS.\n    4.   (d) DELETED",
      "needs_review": false
    },
    {
      "metadata": {
        "source": "Immigration Rules Appendix Representative of an Overseas Business",
        "part": "Immigration Rules Appendix Representative of an Overseas Business",
        "section_id": "Settlement by dependent partner and dependent child on the Representative of an Overseas Business route",
        "section_title": "Settlement by dependent partner and dependent child on the Representative of an Overseas Business route",
        "parent_section": null,
        "hierarchy_level": 3,
        "topic": "settlement",
        "url": "https://www.gov.uk/guidance/immigration-rules/immigration-rules-appendix-representative-of-an-overseas-business",
        "scraped_at": "2025-12-06T17:28:25.354246"
      },
      "text": "### Settlement by dependent partner and dependent child on the Representative of an Overseas Business route",
      "summary": "This provision applies to dependents (partners and children) of representatives of an overseas business applying for settlement. They must meet eligibility criteria and demonstrate genuine relationships, with specific conditions applicable to their residence and relationship status, subject to exceptions outlined in the rules.",
      "augmented_text": "Document: Immigration Rules Appendix Representative of an Overseas Business\nPart: Immigration Rules Appendix Representative of an Overseas Business\nSection ID: Settlement by dependent partner and dependent child on the Representative of an Overseas Business route\nSection: Settlement by dependent partner and dependent child on the Representative of an Overseas Business route\nTopic: settlement\n\nSummary: This provision applies to dependents (partners and children) of representatives of an overseas business applying for settlement. They must meet eligibility criteria and demonstrate genuine relationships, with specific conditions applicable to their residence and relationship status, subject to exceptions outlined in the rules.\n\n### Settlement by dependent partner and dependent child on the Representative of an Overseas Business route",
      "needs_review": false
    },
    {
      "metadata": {
        "source": "Immigration Rules Appendix Representative of an Overseas Business",
        "part": "Immigration Rules Appendix Representative of an Overseas Business",
        "section_id": "ROB 31.1",
        "section_title": "Validity requirements for settlement by a dependent partner or dependent child on the Representative of an Overseas Business route",
        "parent_section": "ROB 31",
        "hierarchy_level": 2,
        "topic": "settlement",
        "url": "https://www.gov.uk/guidance/immigration-rules/immigration-rules-appendix-representative-of-an-overseas-business",
        "scraped_at": "2025-12-06T17:28:25.354266"
      },
      "text": "### Validity requirements for settlement by a dependent partner or dependent child on the Representative of an Overseas Business route\n\nROB 31.1. A partner or child on the Representative of an Overseas Business route who is applying for settlement must apply online on the gov.uk website on the specified form “Settle in the UK in various immigration categories: form SET(O)”.\n\n1.   ROB 31.2. An application for settlement as a partner or child of a Representative of an Overseas Business must meet all the following requirements: \n    1.   (a) any fee must have been paid; and\n    2.   (b) the applicant must have provided biometrics when required; and\n    3.   (c) the applicant must have provided either a passport or other travel document which satisfactorily establishes their identity and nationality; and\n    4.   (d) the applicant must be in the UK; and\n    5.   (e) the applicant must be applying as a partner or child of a person (P) who: \n        1.   (i) has made a valid application for settlement in the UK as a Representative of an Overseas Business and that application has not been decided; or\n        2.   (ii) is settled or has become a British citizen, providing P had permission as a Representative of an Overseas Business when they settled and the applicant either had permission as their partner or child at that time or the applicant is applying as a child of P and the applicant was born in the UK before P settled.\n\nROB 31.3. DELETED.\n\nROB 31.4. An application which does not meet all the validity requirements for settlement as a partner or child on the Representative of an Overseas Business route may be rejected as invalid and not considered.",
      "summary": "Dependent partners or children on the Representative of an Overseas Business route must apply online using form SET(O), paying fees, providing biometrics and identity documents, and be in the UK. They can apply if the primary applicant is pending settlement, settled, or British, under specific permission conditions.",
      "augmented_text": "Document: Immigration Rules Appendix Representative of an Overseas Business\nPart: Immigration Rules Appendix Representative of an Overseas Business\nSection ID: ROB 31.1\nSection: Validity requirements for settlement by a dependent partner or dependent child on the Representative of an Overseas Business route\nTopic: settlement\n\nSummary: Dependent partners or children on the Representative of an Overseas Business route must apply online using form SET(O), paying fees, providing biometrics and identity documents, and be in the UK. They can apply if the primary applicant is pending settlement, settled, or British, under specific permission conditions.\n\n### Validity requirements for settlement by a dependent partner or dependent child on the Representative of an Overseas Business route\n\nROB 31.1. A partner or child on the Representative of an Overseas Business route who is applying for settlement must apply online on the gov.uk website on the specified form “Settle in the UK in various immigration categories: form SET(O)”.\n\n1.   ROB 31.2. An application for settlement as a partner or child of a Representative of an Overseas Business must meet all the following requirements: \n    1.   (a) any fee must have been paid; and\n    2.   (b) the applicant must have provided biometrics when required; and\n    3.   (c) the applicant must have provided either a passport or other travel document which satisfactorily establishes their identity and nationality; and\n    4.   (d) the applicant must be in the UK; and\n    5.   (e) the applicant must be applying as a partner or child of a person (P) who: \n        1.   (i) has made a valid application for settlement in the UK as a Representative of an Overseas Business and that application has not been decided; or\n        2.   (ii) is settled or has become a British citizen, providing P had permission as a Representative of an Overseas Business when they settled and the applicant either had permission as their partner or child at that time or the applicant is applying as a child of P and the applicant was born in the UK before P settled.\n\nROB 31.3. DELETED.\n\nROB 31.4. An application which does not meet all the validity requirements for settlement as a partner or child on the Representative of an Overseas Business route may be rejected as invalid and not considered.",
      "needs_review": false
    },
    {
      "metadata": {
        "source": "Immigration Rules Appendix Representative of an Overseas Business",
        "part": "Immigration Rules Appendix Representative of an Overseas Business",
        "section_id": "ROB 32.1",
        "section_title": "Suitability Requirements for settlement by a dependent partner and dependent child on the Representative of an Overseas Business route",
        "parent_section": "ROB 32",
        "hierarchy_level": 2,
        "topic": "suitability",
        "url": "https://www.gov.uk/guidance/immigration-rules/immigration-rules-appendix-representative-of-an-overseas-business",
        "scraped_at": "2025-12-06T17:28:25.354278"
      },
      "text": "### Suitability Requirements for settlement by a dependent partner and dependent child on the Representative of an Overseas Business route\n\nROB 32.1. The applicant must not fall for refusal under Part Suitability.\n\n1.   ROB 32.2. The applicant must not be: \n    1.   (a) in breach of immigration laws, except that where the Exceptions for overstayers section of Part Suitability applies, that period of overstaying will be disregarded; or\n    2.   (b) on immigration bail.",
      "summary": "This provision applies to dependent partners and children applying for settlement under the Representative of an Overseas Business route. They must meet suitability criteria, including not breaching immigration laws (unless exceptions apply) and not being on immigration bail.",
      "augmented_text": "Document: Immigration Rules Appendix Representative of an Overseas Business\nPart: Immigration Rules Appendix Representative of an Overseas Business\nSection ID: ROB 32.1\nSection: Suitability Requirements for settlement by a dependent partner and dependent child on the Representative of an Overseas Business route\nTopic: suitability\n\nSummary: This provision applies to dependent partners and children applying for settlement under the Representative of an Overseas Business route. They must meet suitability criteria, including not breaching immigration laws (unless exceptions apply) and not being on immigration bail.\n\n### Suitability Requirements for settlement by a dependent partner and dependent child on the Representative of an Overseas Business route\n\nROB 32.1. The applicant must not fall for refusal under Part Suitability.\n\n1.   ROB 32.2. The applicant must not be: \n    1.   (a) in breach of immigration laws, except that where the Exceptions for overstayers section of Part Suitability applies, that period of overstaying will be disregarded; or\n    2.   (b) on immigration bail.",
      "needs_review": false
    },
    {
      "metadata": {
        "source": "Immigration Rules Appendix Representative of an Overseas Business",
        "part": "Immigration Rules Appendix Representative of an Overseas Business",
        "section_id": "Eligibility requirements for settlement by a dependent partner or dependent child on the Representative of an Overseas Business route",
        "section_title": "Eligibility requirements for settlement by a dependent partner or dependent child on the Representative of an Overseas Business route",
        "parent_section": null,
        "hierarchy_level": 3,
        "topic": "eligibility",
        "url": "https://www.gov.uk/guidance/immigration-rules/immigration-rules-appendix-representative-of-an-overseas-business",
        "scraped_at": "2025-12-06T17:28:25.354282"
      },
      "text": "### Eligibility requirements for settlement by a dependent partner or dependent child on the Representative of an Overseas Business route",
      "summary": "This provision applies to dependents of representatives or overseas business personnel seeking settlement. They must demonstrate appropriate continuous residence and meet specified eligibility criteria. Critical conditions include maintaining valid status and fulfilling relationship requirements; exceptions are not specified.",
      "augmented_text": "Document: Immigration Rules Appendix Representative of an Overseas Business\nPart: Immigration Rules Appendix Representative of an Overseas Business\nSection ID: Eligibility requirements for settlement by a dependent partner or dependent child on the Representative of an Overseas Business route\nSection: Eligibility requirements for settlement by a dependent partner or dependent child on the Representative of an Overseas Business route\nTopic: eligibility\n\nSummary: This provision applies to dependents of representatives or overseas business personnel seeking settlement. They must demonstrate appropriate continuous residence and meet specified eligibility criteria. Critical conditions include maintaining valid status and fulfilling relationship requirements; exceptions are not specified.\n\n### Eligibility requirements for settlement by a dependent partner or dependent child on the Representative of an Overseas Business route",
      "needs_review": false
    },
    {
      "metadata": {
        "source": "Immigration Rules Appendix Representative of an Overseas Business",
        "part": "Immigration Rules Appendix Representative of an Overseas Business",
        "section_id": "1",
        "section_title": "Relationship requirement for settlement by a partner or child on the Representative of an Overseas Business route",
        "parent_section": null,
        "hierarchy_level": 1,
        "topic": "settlement",
        "url": "https://www.gov.uk/guidance/immigration-rules/immigration-rules-appendix-representative-of-an-overseas-business",
        "scraped_at": "2025-12-06T17:28:25.354299"
      },
      "text": "### Relationship requirement for settlement by a partner or child on the Representative of an Overseas Business route\n\n1.   ROB 33.1. The applicant must be the partner or child of a person (P) where one of the following applies: \n    1.   (a) P is, at the same time, being granted settlement as a Representative of an Overseas Business; or\n    2.   (b) P is settled in the UK or has become a British citizen, providing P had permission as a Representative of an Overseas Business when they settled and the applicant either: \n        1.   i) had permission as P’s partner or child at that time; or\n        2.   ii) is applying as a child of P, and was born in the UK before P settled.\n\n1.   ROB 33.1A. The applicant must either: \n    1.   (a) have last been granted permission as a dependent partner or dependent child of the person (P) in ROB 33.1; or\n    2.   (b) have been born in the UK and be applying as a child of the person (P) in ROB 33.1.\n\nROB 33.2. If applying as a child, the applicant must meet the relationship requirement for settlement for a dependent child in Appendix Children.\n\nROB 33.3. If applying as a partner, the requirements of Appendix Relationship with Partner must be met.",
      "summary": "This provision applies to partners and children seeking settlement under the Representative of an Overseas Business route. Applicants must be related to a person granted or settled as a Business Representative, with specific conditions for dependents, UK-born children, and timing of previous permissions. Critical conditions include meeting relationship requirements for dependents and verifying prior permission as a partner or child.",
      "augmented_text": "Document: Immigration Rules Appendix Representative of an Overseas Business\nPart: Immigration Rules Appendix Representative of an Overseas Business\nSection ID: 1\nSection: Relationship requirement for settlement by a partner or child on the Representative of an Overseas Business route\nTopic: settlement\n\nSummary: This provision applies to partners and children seeking settlement under the Representative of an Overseas Business route. Applicants must be related to a person granted or settled as a Business Representative, with specific conditions for dependents, UK-born children, and timing of previous permissions. Critical conditions include meeting relationship requirements for dependents and verifying prior permission as a partner or child.\n\n### Relationship requirement for settlement by a partner or child on the Representative of an Overseas Business route\n\n1.   ROB 33.1. The applicant must be the partner or child of a person (P) where one of the following applies: \n    1.   (a) P is, at the same time, being granted settlement as a Representative of an Overseas Business; or\n    2.   (b) P is settled in the UK or has become a British citizen, providing P had permission as a Representative of an Overseas Business when they settled and the applicant either: \n        1.   i) had permission as P’s partner or child at that time; or\n        2.   ii) is applying as a child of P, and was born in the UK before P settled.\n\n1.   ROB 33.1A. The applicant must either: \n    1.   (a) have last been granted permission as a dependent partner or dependent child of the person (P) in ROB 33.1; or\n    2.   (b) have been born in the UK and be applying as a child of the person (P) in ROB 33.1.\n\nROB 33.2. If applying as a child, the applicant must meet the relationship requirement for settlement for a dependent child in Appendix Children.\n\nROB 33.3. If applying as a partner, the requirements of Appendix Relationship with Partner must be met.",
      "needs_review": false
    },
    {
      "metadata": {
        "source": "Immigration Rules Appendix Representative of an Overseas Business",
        "part": "Immigration Rules Appendix Representative of an Overseas Business",
        "section_id": "ROB 34.1",
        "section_title": "Care requirement for settlement by a child on the Representative of an Overseas Business route",
        "parent_section": "ROB 34",
        "hierarchy_level": 2,
        "topic": "settlement",
        "url": "https://www.gov.uk/guidance/immigration-rules/immigration-rules-appendix-representative-of-an-overseas-business",
        "scraped_at": "2025-12-06T17:28:25.354310"
      },
      "text": "### Care requirement for settlement by a child on the Representative of an Overseas Business route\n\nROB 34.1. DELETED.",
      "summary": "This provision applies to children seeking settlement via the Representative of an Overseas Business route. It requires demonstrating that appropriate care arrangements are in place, with specific conditions or standards likely specified (though the detailed content is deleted). No exceptions are noted in the provided text.",
      "augmented_text": "Document: Immigration Rules Appendix Representative of an Overseas Business\nPart: Immigration Rules Appendix Representative of an Overseas Business\nSection ID: ROB 34.1\nSection: Care requirement for settlement by a child on the Representative of an Overseas Business route\nTopic: settlement\n\nSummary: This provision applies to children seeking settlement via the Representative of an Overseas Business route. It requires demonstrating that appropriate care arrangements are in place, with specific conditions or standards likely specified (though the detailed content is deleted). No exceptions are noted in the provided text.\n\n### Care requirement for settlement by a child on the Representative of an Overseas Business route\n\nROB 34.1. DELETED.",
      "needs_review": false
    },
    {
      "metadata": {
        "source": "Immigration Rules Appendix Representative of an Overseas Business",
        "part": "Immigration Rules Appendix Representative of an Overseas Business",
        "section_id": "ROB 35.1",
        "section_title": "Age requirement for settlement by a child on the Representative of an Overseas Business route",
        "parent_section": "ROB 35",
        "hierarchy_level": 2,
        "topic": "settlement",
        "url": "https://www.gov.uk/guidance/immigration-rules/immigration-rules-appendix-representative-of-an-overseas-business",
        "scraped_at": "2025-12-06T17:28:25.354321"
      },
      "text": "### Age requirement for settlement by a child on the Representative of an Overseas Business route\n\nROB 35.1. DELETED.\n\nROB 35.2. DELETED.",
      "summary": "This provision applies to children seeking settlement under the Representative of an Overseas Business route. It requires that the child must have been under 18 at the time of application and meet specified age criteria, with certain conditions and exceptions detailed in the full rules.",
      "augmented_text": "Document: Immigration Rules Appendix Representative of an Overseas Business\nPart: Immigration Rules Appendix Representative of an Overseas Business\nSection ID: ROB 35.1\nSection: Age requirement for settlement by a child on the Representative of an Overseas Business route\nTopic: settlement\n\nSummary: This provision applies to children seeking settlement under the Representative of an Overseas Business route. It requires that the child must have been under 18 at the time of application and meet specified age criteria, with certain conditions and exceptions detailed in the full rules.\n\n### Age requirement for settlement by a child on the Representative of an Overseas Business route\n\nROB 35.1. DELETED.\n\nROB 35.2. DELETED.",
      "needs_review": false
    },
    {
      "metadata": {
        "source": "Immigration Rules Appendix Representative of an Overseas Business",
        "part": "Immigration Rules Appendix Representative of an Overseas Business",
        "section_id": "1",
        "section_title": "Requirements for settlement as a dependent child on the Representative of an Overseas Business route",
        "parent_section": null,
        "hierarchy_level": 1,
        "topic": "settlement",
        "url": "https://www.gov.uk/guidance/immigration-rules/immigration-rules-appendix-representative-of-an-overseas-business",
        "scraped_at": "2025-12-06T17:28:25.354336"
      },
      "text": "### Requirements for settlement as a dependent child on the Representative of an Overseas Business route\n\n1.   ROB 35A.1. The applicant must meet the following requirements for a dependent child in Appendix Children: \n    1.   (a) care requirement; and\n    2.   (b) age and independent life requirement.",
      "summary": "Dependent children applying for settlement under the Representative of an Overseas Business route must meet the care and age/independent life requirements outlined in Appendix Children. They must demonstrate adequate care arrangements and satisfy age and independence criteria, with no specific exceptions noted.",
      "augmented_text": "Document: Immigration Rules Appendix Representative of an Overseas Business\nPart: Immigration Rules Appendix Representative of an Overseas Business\nSection ID: 1\nSection: Requirements for settlement as a dependent child on the Representative of an Overseas Business route\nTopic: settlement\n\nSummary: Dependent children applying for settlement under the Representative of an Overseas Business route must meet the care and age/independent life requirements outlined in Appendix Children. They must demonstrate adequate care arrangements and satisfy age and independence criteria, with no specific exceptions noted.\n\n### Requirements for settlement as a dependent child on the Representative of an Overseas Business route\n\n1.   ROB 35A.1. The applicant must meet the following requirements for a dependent child in Appendix Children: \n    1.   (a) care requirement; and\n    2.   (b) age and independent life requirement.",
      "needs_review": false
    },
    {
      "metadata": {
        "source": "Immigration Rules Appendix Representative of an Overseas Business",
        "part": "Immigration Rules Appendix Representative of an Overseas Business",
        "section_id": "ROB 36.1",
        "section_title": "English language requirement for settlement by a partner or child on the Representative of an Overseas Business route",
        "parent_section": "ROB 36",
        "hierarchy_level": 2,
        "topic": "english-language",
        "url": "https://www.gov.uk/guidance/immigration-rules/immigration-rules-appendix-representative-of-an-overseas-business",
        "scraped_at": "2025-12-06T17:28:25.354345"
      },
      "text": "### English language requirement for settlement by a partner or child on the Representative of an Overseas Business route\n\nROB 36.1. Unless an exemption applies, the applicant must show English language ability on the Common European Framework of Reference for Languages in speaking and listening to at least level B1.\n\nROB 36.2. The applicant must show they meet the English language requirement as specified in Appendix English Language.",
      "summary": "Applicants applying for settlement as a partner or child on the Representative of an Overseas Business route must demonstrate English language ability at least level B1 in speaking and listening, unless exempt. This requirement aligns with the criteria in Appendix English Language.",
      "augmented_text": "Document: Immigration Rules Appendix Representative of an Overseas Business\nPart: Immigration Rules Appendix Representative of an Overseas Business\nSection ID: ROB 36.1\nSection: English language requirement for settlement by a partner or child on the Representative of an Overseas Business route\nTopic: english-language\n\nSummary: Applicants applying for settlement as a partner or child on the Representative of an Overseas Business route must demonstrate English language ability at least level B1 in speaking and listening, unless exempt. This requirement aligns with the criteria in Appendix English Language.\n\n### English language requirement for settlement by a partner or child on the Representative of an Overseas Business route\n\nROB 36.1. Unless an exemption applies, the applicant must show English language ability on the Common European Framework of Reference for Languages in speaking and listening to at least level B1.\n\nROB 36.2. The applicant must show they meet the English language requirement as specified in Appendix English Language.",
      "needs_review": false
    },
    {
      "metadata": {
        "source": "Immigration Rules Appendix Representative of an Overseas Business",
        "part": "Immigration Rules Appendix Representative of an Overseas Business",
        "section_id": "ROB 37.1",
        "section_title": "Knowledge of life in the UK requirement for settlement by a partner or child on the Representative of an Overseas Business route",
        "parent_section": "ROB 37",
        "hierarchy_level": 2,
        "topic": "settlement",
        "url": "https://www.gov.uk/guidance/immigration-rules/immigration-rules-appendix-representative-of-an-overseas-business",
        "scraped_at": "2025-12-06T17:28:25.354359"
      },
      "text": "### Knowledge of life in the UK requirement for settlement by a partner or child on the Representative of an Overseas Business route\n\nROB 37.1. If the applicant is aged 18 or over at the date of application, they must meet the Knowledge of Life in the UK requirement as set out in Appendix KOL UK.",
      "summary": "Applicants aged 18 or over applying for settlement as a partner or child under the Representative of an Overseas Business route must meet the Knowledge of Life in the UK requirement, as specified in Appendix KOL UK. This obligation is mandatory unless specific exemptions apply.",
      "augmented_text": "Document: Immigration Rules Appendix Representative of an Overseas Business\nPart: Immigration Rules Appendix Representative of an Overseas Business\nSection ID: ROB 37.1\nSection: Knowledge of life in the UK requirement for settlement by a partner or child on the Representative of an Overseas Business route\nTopic: settlement\n\nSummary: Applicants aged 18 or over applying for settlement as a partner or child under the Representative of an Overseas Business route must meet the Knowledge of Life in the UK requirement, as specified in Appendix KOL UK. This obligation is mandatory unless specific exemptions apply.\n\n### Knowledge of life in the UK requirement for settlement by a partner or child on the Representative of an Overseas Business route\n\nROB 37.1. If the applicant is aged 18 or over at the date of application, they must meet the Knowledge of Life in the UK requirement as set out in Appendix KOL UK.",
      "needs_review": false
    },
    {
      "metadata": {
        "source": "Immigration Rules Appendix Representative of an Overseas Business",
        "part": "Immigration Rules Appendix Representative of an Overseas Business",
        "section_id": "ROB 38.1",
        "section_title": "Decision on an application for settlement as a partner or child on the Representative of an Overseas Business route",
        "parent_section": "ROB 38",
        "hierarchy_level": 2,
        "topic": "eligibility",
        "url": "https://www.gov.uk/guidance/immigration-rules/immigration-rules-appendix-representative-of-an-overseas-business",
        "scraped_at": "2025-12-06T17:28:25.354366"
      },
      "text": "### Decision on an application for settlement as a partner or child on the Representative of an Overseas Business route\n\nROB 38.1. If the decision maker is satisfied all the suitability and eligibility requirements are met for settlement as a dependent partner or dependent child on the Representative of an Overseas Business route, the applicant will be granted settlement, otherwise the application will be refused.\n\nROB 38.2. If the application is refused the person can apply for an Administrative Review under Appendix AR: Administrative Review.\n\nPrint this page",
      "summary": "This provision applies to dependents (partner or child) applying for settlement under the Representative of an Overseas Business route. The key requirement is that all suitability and eligibility criteria are met; failure results in refusal. Applicants can request an Administrative Review if refused.",
      "augmented_text": "Document: Immigration Rules Appendix Representative of an Overseas Business\nPart: Immigration Rules Appendix Representative of an Overseas Business\nSection ID: ROB 38.1\nSection: Decision on an application for settlement as a partner or child on the Representative of an Overseas Business route\nTopic: eligibility\n\nSummary: This provision applies to dependents (partner or child) applying for settlement under the Representative of an Overseas Business route. The key requirement is that all suitability and eligibility criteria are met; failure results in refusal. Applicants can request an Administrative Review if refused.\n\n### Decision on an application for settlement as a partner or child on the Representative of an Overseas Business route\n\nROB 38.1. If the decision maker is satisfied all the suitability and eligibility requirements are met for settlement as a dependent partner or dependent child on the Representative of an Overseas Business route, the applicant will be granted settlement, otherwise the application will be refused.\n\nROB 38.2. If the application is refused the person can apply for an Administrative Review under Appendix AR: Administrative Review.\n\nPrint this page",
      "needs_review": false
    }
  ]
}