{
  "url": "https://www.gov.uk/guidance/immigration-rules/immigration-rules-appendix-private-life",
  "part_name": "Immigration Rules Appendix Private Life",
  "scraped_at": "2025-12-06T17:28:19.333055",
  "chunk_count": 40,
  "chunks": [
    {
      "metadata": {
        "source": "Immigration Rules Appendix Private Life",
        "part": "Immigration Rules Appendix Private Life",
        "section_id": "PL 1.1",
        "section_title": "Validity requirements for the Private Life route",
        "parent_section": "PL 1",
        "hierarchy_level": 2,
        "topic": "family",
        "url": "https://www.gov.uk/guidance/immigration-rules/immigration-rules-appendix-private-life",
        "scraped_at": "2025-12-06T17:28:19.332083"
      },
      "text": "### Validity requirements for the Private Life route\n\nPL 1.1. A person applying for permission to stay on the Private Life route must apply online on the gov.uk website on the specified form: “Application to remain in the UK on the basis of family life or private life”.\n\n1.   PL 1.2. An application for permission to stay on the Private Life route must meet all the following validity requirements: \n    1.   (a) any fee and Immigration Health Charge must have been paid (unless the applicant has been granted a fee waiver in whole or in part); and\n    2.   (b) the applicant must have provided biometrics when required; and\n    3.   (c) the applicant must have provided a passport or other document which satisfactorily establishes their identity and nationality; and\n    4.   (d) the applicant must be in the UK on the date of application.\n\n2.   PL 1.3. If a private life claim is made under Article 8 of the Human Rights Convention and it is made: \n    1.   (a) at the same time as a protection claim or further submission in person after a protection claim has been refused; or\n    2.   (b) when the applicant is in detention (and the claim is submitted to a prison officer, custody officer or a member of Home Office staff at the place of detention); or\n    3.   (c) during an appeal (subject to the consent of the Secretary of State where applicable), the requirements at PL 1.1. and at PL 1.2. (a) and (c) will be waived.\n\nPL 1.4. An application which does not meet all the validity requirements for the Private Life route may be rejected as invalid and not considered.",
      "summary": "Applicants seeking permission to stay under the Private Life route must apply online, pay applicable fees and health charges (or obtain waivers), provide biometrics and proof of identity, and be physically present in the UK at the time of application. Certain claims made under Article 8 during detention, appeals, or with protection claims may be exempt from these requirements.",
      "augmented_text": "Document: Immigration Rules Appendix Private Life\nPart: Immigration Rules Appendix Private Life\nSection ID: PL 1.1\nSection: Validity requirements for the Private Life route\nTopic: family\n\nSummary: Applicants seeking permission to stay under the Private Life route must apply online, pay applicable fees and health charges (or obtain waivers), provide biometrics and proof of identity, and be physically present in the UK at the time of application. Certain claims made under Article 8 during detention, appeals, or with protection claims may be exempt from these requirements.\n\n### Validity requirements for the Private Life route\n\nPL 1.1. A person applying for permission to stay on the Private Life route must apply online on the gov.uk website on the specified form: “Application to remain in the UK on the basis of family life or private life”.\n\n1.   PL 1.2. An application for permission to stay on the Private Life route must meet all the following validity requirements: \n    1.   (a) any fee and Immigration Health Charge must have been paid (unless the applicant has been granted a fee waiver in whole or in part); and\n    2.   (b) the applicant must have provided biometrics when required; and\n    3.   (c) the applicant must have provided a passport or other document which satisfactorily establishes their identity and nationality; and\n    4.   (d) the applicant must be in the UK on the date of application.\n\n2.   PL 1.3. If a private life claim is made under Article 8 of the Human Rights Convention and it is made: \n    1.   (a) at the same time as a protection claim or further submission in person after a protection claim has been refused; or\n    2.   (b) when the applicant is in detention (and the claim is submitted to a prison officer, custody officer or a member of Home Office staff at the place of detention); or\n    3.   (c) during an appeal (subject to the consent of the Secretary of State where applicable), the requirements at PL 1.1. and at PL 1.2. (a) and (c) will be waived.\n\nPL 1.4. An application which does not meet all the validity requirements for the Private Life route may be rejected as invalid and not considered.",
      "needs_review": false
    },
    {
      "metadata": {
        "source": "Immigration Rules Appendix Private Life",
        "part": "Immigration Rules Appendix Private Life",
        "section_id": "PL 2.1",
        "section_title": "Suitability requirements on the Private Life route",
        "parent_section": "PL 2",
        "hierarchy_level": 2,
        "topic": "suitability",
        "url": "https://www.gov.uk/guidance/immigration-rules/immigration-rules-appendix-private-life",
        "scraped_at": "2025-12-06T17:28:19.332102"
      },
      "text": "### Suitability requirements on the Private Life route\n\nPL 2.1. The applicant must not fall for refusal under Part Suitability.\n\nPL 2.2. DELETED.",
      "summary": "This provision applies to applicants seeking entry or extension on the Private Life route. Applicants must meet suitability requirements and must not be refused under Part Suitability, with some provisions deleted. There are no specified exceptions or thresholds in this excerpt.",
      "augmented_text": "Document: Immigration Rules Appendix Private Life\nPart: Immigration Rules Appendix Private Life\nSection ID: PL 2.1\nSection: Suitability requirements on the Private Life route\nTopic: suitability\n\nSummary: This provision applies to applicants seeking entry or extension on the Private Life route. Applicants must meet suitability requirements and must not be refused under Part Suitability, with some provisions deleted. There are no specified exceptions or thresholds in this excerpt.\n\n### Suitability requirements on the Private Life route\n\nPL 2.1. The applicant must not fall for refusal under Part Suitability.\n\nPL 2.2. DELETED.",
      "needs_review": false
    },
    {
      "metadata": {
        "source": "Immigration Rules Appendix Private Life",
        "part": "Immigration Rules Appendix Private Life",
        "section_id": "Eligibility requirements on the Private Life route",
        "section_title": "Eligibility requirements on the Private Life route",
        "parent_section": null,
        "hierarchy_level": 2,
        "topic": "eligibility",
        "url": "https://www.gov.uk/guidance/immigration-rules/immigration-rules-appendix-private-life",
        "scraped_at": "2025-12-06T17:28:19.332108"
      },
      "text": "### Eligibility requirements on the Private Life route",
      "summary": "This provision applies to applicants seeking entry or settlement via the Private Life route. It requires demonstrating sufficient integration, relationship stability, or existing private life ties, with exceptions or thresholds applicable based on age, health, or length of residence in the UK.",
      "augmented_text": "Document: Immigration Rules Appendix Private Life\nPart: Immigration Rules Appendix Private Life\nSection ID: Eligibility requirements on the Private Life route\nSection: Eligibility requirements on the Private Life route\nTopic: eligibility\n\nSummary: This provision applies to applicants seeking entry or settlement via the Private Life route. It requires demonstrating sufficient integration, relationship stability, or existing private life ties, with exceptions or thresholds applicable based on age, health, or length of residence in the UK.\n\n### Eligibility requirements on the Private Life route",
      "needs_review": false
    },
    {
      "metadata": {
        "source": "Immigration Rules Appendix Private Life",
        "part": "Immigration Rules Appendix Private Life",
        "section_id": "1",
        "section_title": "Residence requirements for a child on the Private Life route",
        "parent_section": null,
        "hierarchy_level": 1,
        "topic": "family",
        "url": "https://www.gov.uk/guidance/immigration-rules/immigration-rules-appendix-private-life",
        "scraped_at": "2025-12-06T17:28:19.332124"
      },
      "text": "### Residence requirements for a child on the Private Life route\n\n1.   PL 3.1. Where the applicant is aged under 18 at the date of application the following requirements must be met: \n    1.   (a) the applicant must have been continuously resident in the UK for at least 7 years; and\n    2.   (b) the decision maker must be satisfied that it would not be reasonable to expect the applicant to leave the UK.",
      "summary": "Applicants under 18 applying via the Private Life route must have been continuously resident in the UK for at least 7 years, and it must be unreasonable to expect them to leave, under UK Immigration Rules.",
      "augmented_text": "Document: Immigration Rules Appendix Private Life\nPart: Immigration Rules Appendix Private Life\nSection ID: 1\nSection: Residence requirements for a child on the Private Life route\nTopic: family\n\nSummary: Applicants under 18 applying via the Private Life route must have been continuously resident in the UK for at least 7 years, and it must be unreasonable to expect them to leave, under UK Immigration Rules.\n\n### Residence requirements for a child on the Private Life route\n\n1.   PL 3.1. Where the applicant is aged under 18 at the date of application the following requirements must be met: \n    1.   (a) the applicant must have been continuously resident in the UK for at least 7 years; and\n    2.   (b) the decision maker must be satisfied that it would not be reasonable to expect the applicant to leave the UK.",
      "needs_review": false
    },
    {
      "metadata": {
        "source": "Immigration Rules Appendix Private Life",
        "part": "Immigration Rules Appendix Private Life",
        "section_id": "PL 4.1",
        "section_title": "Residence requirements for a young adult on the Private Life route (where the applicant arrived in the UK as a child)",
        "parent_section": "PL 4",
        "hierarchy_level": 2,
        "topic": "family",
        "url": "https://www.gov.uk/guidance/immigration-rules/immigration-rules-appendix-private-life",
        "scraped_at": "2025-12-06T17:28:19.332141"
      },
      "text": "### Residence requirements for a young adult on the Private Life route (where the applicant arrived in the UK as a child)\n\nPL 4.1. Where the applicant is aged 18 or over and aged under 25 at the date of application and arrived in the UK before the age of 18, the applicant must have spent at least half their life continuously resident in the UK.",
      "summary": "Applicants aged 18-24 applying under the Private Life route must have spent at least half their life continuously in the UK, provided they arrived before age 18. The requirement emphasizes long-term residence, with no specified exceptions.",
      "augmented_text": "Document: Immigration Rules Appendix Private Life\nPart: Immigration Rules Appendix Private Life\nSection ID: PL 4.1\nSection: Residence requirements for a young adult on the Private Life route (where the applicant arrived in the UK as a child)\nTopic: family\n\nSummary: Applicants aged 18-24 applying under the Private Life route must have spent at least half their life continuously in the UK, provided they arrived before age 18. The requirement emphasizes long-term residence, with no specified exceptions.\n\n### Residence requirements for a young adult on the Private Life route (where the applicant arrived in the UK as a child)\n\nPL 4.1. Where the applicant is aged 18 or over and aged under 25 at the date of application and arrived in the UK before the age of 18, the applicant must have spent at least half their life continuously resident in the UK.",
      "needs_review": false
    },
    {
      "metadata": {
        "source": "Immigration Rules Appendix Private Life",
        "part": "Immigration Rules Appendix Private Life",
        "section_id": "PL 5.1",
        "section_title": "Residence requirements for an adult on the Private Life route",
        "parent_section": null,
        "hierarchy_level": 1,
        "topic": "residency",
        "url": "https://www.gov.uk/guidance/immigration-rules/immigration-rules-appendix-private-life",
        "scraped_at": "2025-12-06T17:28:19.332159"
      },
      "text": "### Residence requirements for an adult on the Private Life route (including a young adult who does not qualify under PL 4.1.)\n\n1.   PL 5.1. Where the applicant is aged 18 or over on the date of application: \n    1.   (a) the applicant must have been continuously resident in the UK for more than 20 years; or\n    2.   (b) where the applicant has not been continuously resident in the UK for more than 20 years, the decision maker must be satisfied there would be very significant obstacles to the applicant’s integration into the country where they would have to live if required to leave the UK.",
      "summary": "This provision applies to adult applicants on the Private Life route, including certain young adults. They must have over 20 years of continuous UK residence or face very significant obstacles to integration elsewhere; exceptions may apply if these conditions are not met.",
      "augmented_text": "Document: Immigration Rules Appendix Private Life\nPart: Immigration Rules Appendix Private Life\nSection ID: PL 5.1\nSection: Residence requirements for an adult on the Private Life route\nTopic: residency\n\nSummary: This provision applies to adult applicants on the Private Life route, including certain young adults. They must have over 20 years of continuous UK residence or face very significant obstacles to integration elsewhere; exceptions may apply if these conditions are not met.\n\n### Residence requirements for an adult on the Private Life route (including a young adult who does not qualify under PL 4.1.)\n\n1.   PL 5.1. Where the applicant is aged 18 or over on the date of application: \n    1.   (a) the applicant must have been continuously resident in the UK for more than 20 years; or\n    2.   (b) where the applicant has not been continuously resident in the UK for more than 20 years, the decision maker must be satisfied there would be very significant obstacles to the applicant’s integration into the country where they would have to live if required to leave the UK.",
      "needs_review": false
    },
    {
      "metadata": {
        "source": "Immigration Rules Appendix Private Life",
        "part": "Immigration Rules Appendix Private Life",
        "section_id": "PL 6.1",
        "section_title": "Exclusion of certain asylum seekers",
        "parent_section": "PL 6",
        "hierarchy_level": 2,
        "topic": "suitability",
        "url": "https://www.gov.uk/guidance/immigration-rules/immigration-rules-appendix-private-life",
        "scraped_at": "2025-12-06T17:28:19.332169"
      },
      "text": "### Exclusion of certain asylum seekers\n\nPL 6.1. An applicant who has made a protection or asylum claim which has been declared inadmissible under Part 11 of these rules before 28 June 2022, or under section 80B and 80C of the Nationality, Immigration and Asylum Act 2002, and which continues to be treated as inadmissible, cannot meet the requirement at PL 5.1(b).",
      "summary": "This provision applies to asylum seekers with inadmissible claims declared before 28 June 2022. Such applicants cannot satisfy the requirements under PL 5.1(b). The rule excludes these individuals from certain protections or pathways outlined in the Immigration Rules.",
      "augmented_text": "Document: Immigration Rules Appendix Private Life\nPart: Immigration Rules Appendix Private Life\nSection ID: PL 6.1\nSection: Exclusion of certain asylum seekers\nTopic: suitability\n\nSummary: This provision applies to asylum seekers with inadmissible claims declared before 28 June 2022. Such applicants cannot satisfy the requirements under PL 5.1(b). The rule excludes these individuals from certain protections or pathways outlined in the Immigration Rules.\n\n### Exclusion of certain asylum seekers\n\nPL 6.1. An applicant who has made a protection or asylum claim which has been declared inadmissible under Part 11 of these rules before 28 June 2022, or under section 80B and 80C of the Nationality, Immigration and Asylum Act 2002, and which continues to be treated as inadmissible, cannot meet the requirement at PL 5.1(b).",
      "needs_review": false
    },
    {
      "metadata": {
        "source": "Immigration Rules Appendix Private Life",
        "part": "Immigration Rules Appendix Private Life",
        "section_id": "PL 7.1",
        "section_title": "Continuous residence period",
        "parent_section": "PL 7",
        "hierarchy_level": 2,
        "topic": "residence",
        "url": "https://www.gov.uk/guidance/immigration-rules/immigration-rules-appendix-private-life",
        "scraped_at": "2025-12-06T17:28:19.332186"
      },
      "text": "### Continuous Residence requirements on the Private Life route\n\nPL 7.1. The period of continuous residence at PL 3.1, PL 4.1. or PL 5.1. may include time spent in the UK with or without permission.\n\nPL 7.2. The period of continuous residence at PL 3.1, PL 4.1. or PL 5.1. does not include any period of imprisonment or detention where the applicant was convicted of an offence and sentenced to a period of imprisonment or was directed to be detained in an institution other than a prison.\n\n1.   PL 7.3. The period of continuous residence at PL 3.1, PL 4.1. or PL 5.1 is broken (i.e. is no longer continuous) if any of the following apply: \n    1.   (a) the applicant has been absent from the UK for more than 6 months at any one time; or\n    2.   (b) the applicant has spent a total of 550 days or more absent from the UK during the period of continuous residence at PL 3.1, PL 4.1 or PL 5.1; or\n    3.   (c) the applicant has been removed, deported or has left the UK having had an application for permission to enter or stay in the UK refused; or\n    4.   (d) the applicant left the UK with no reasonable expectation at the time of leaving that they would lawfully be able to return.",
      "summary": "This provision applies to applicants applying under the Private Life route. It requires maintaining continuous residence in the UK, excluding periods of imprisonment, with specific thresholds: absences over 6 months or totaling 550 days break continuity. Exceptions include removals, deportations, or leaving without reasonable expectation of returning.",
      "augmented_text": "Document: Immigration Rules Appendix Private Life\nPart: Immigration Rules Appendix Private Life\nSection ID: PL 7.1\nSection: Continuous residence period\nTopic: residence\n\nSummary: This provision applies to applicants applying under the Private Life route. It requires maintaining continuous residence in the UK, excluding periods of imprisonment, with specific thresholds: absences over 6 months or totaling 550 days break continuity. Exceptions include removals, deportations, or leaving without reasonable expectation of returning.\n\n### Continuous Residence requirements on the Private Life route\n\nPL 7.1. The period of continuous residence at PL 3.1, PL 4.1. or PL 5.1. may include time spent in the UK with or without permission.\n\nPL 7.2. The period of continuous residence at PL 3.1, PL 4.1. or PL 5.1. does not include any period of imprisonment or detention where the applicant was convicted of an offence and sentenced to a period of imprisonment or was directed to be detained in an institution other than a prison.\n\n1.   PL 7.3. The period of continuous residence at PL 3.1, PL 4.1. or PL 5.1 is broken (i.e. is no longer continuous) if any of the following apply: \n    1.   (a) the applicant has been absent from the UK for more than 6 months at any one time; or\n    2.   (b) the applicant has spent a total of 550 days or more absent from the UK during the period of continuous residence at PL 3.1, PL 4.1 or PL 5.1; or\n    3.   (c) the applicant has been removed, deported or has left the UK having had an application for permission to enter or stay in the UK refused; or\n    4.   (d) the applicant left the UK with no reasonable expectation at the time of leaving that they would lawfully be able to return.",
      "needs_review": false
    },
    {
      "metadata": {
        "source": "Immigration Rules Appendix Private Life",
        "part": "Immigration Rules Appendix Private Life",
        "section_id": "PL 8.1",
        "section_title": "Eligibility requirement for Private Life route relying on Article 8 of the Human Rights Convention",
        "parent_section": "PL 8",
        "hierarchy_level": 2,
        "topic": "eligibility",
        "url": "https://www.gov.uk/guidance/immigration-rules/immigration-rules-appendix-private-life",
        "scraped_at": "2025-12-06T17:28:19.332192"
      },
      "text": "### Eligibility requirement for Private Life route relying on Article 8 of the Human Rights Convention\n\nPL 8.1. If the applicant does not meet the suitability requirements (subject to PL 8.2), or does not meet any of the eligibility requirements in PL 3.1., PL 4.1. or PL 5.1. the decision maker must be satisfied that refusal of permission to stay would not breach Article 8 of the Human Rights Convention on the basis of private life.\n\nPL 8.2. Where PL 8.1. applies and the applicant falls for refusal under SUI 2.1. SUI 3.1., SUI 4.1., or SUI 5.1. of Part Suitability the application on the Private Life route will be refused.",
      "summary": "Applicants seeking leave under the Private Life route relying on Article 8 must not fail suitability or other specific eligibility requirements; otherwise, their application will be refused. If these criteria are met, decision-makers must ensure refusal would breach Article 8, unless the applicant falls under certain suitability or eligibility exclusion thresholds.",
      "augmented_text": "Document: Immigration Rules Appendix Private Life\nPart: Immigration Rules Appendix Private Life\nSection ID: PL 8.1\nSection: Eligibility requirement for Private Life route relying on Article 8 of the Human Rights Convention\nTopic: eligibility\n\nSummary: Applicants seeking leave under the Private Life route relying on Article 8 must not fail suitability or other specific eligibility requirements; otherwise, their application will be refused. If these criteria are met, decision-makers must ensure refusal would breach Article 8, unless the applicant falls under certain suitability or eligibility exclusion thresholds.\n\n### Eligibility requirement for Private Life route relying on Article 8 of the Human Rights Convention\n\nPL 8.1. If the applicant does not meet the suitability requirements (subject to PL 8.2), or does not meet any of the eligibility requirements in PL 3.1., PL 4.1. or PL 5.1. the decision maker must be satisfied that refusal of permission to stay would not breach Article 8 of the Human Rights Convention on the basis of private life.\n\nPL 8.2. Where PL 8.1. applies and the applicant falls for refusal under SUI 2.1. SUI 3.1., SUI 4.1., or SUI 5.1. of Part Suitability the application on the Private Life route will be refused.",
      "needs_review": false
    },
    {
      "metadata": {
        "source": "Immigration Rules Appendix Private Life",
        "part": "Immigration Rules Appendix Private Life",
        "section_id": "PL 9.1",
        "section_title": "Decision on an application on the Private Life route",
        "parent_section": "PL 9",
        "hierarchy_level": 2,
        "topic": "eligibility",
        "url": "https://www.gov.uk/guidance/immigration-rules/immigration-rules-appendix-private-life",
        "scraped_at": "2025-12-06T17:28:19.332199"
      },
      "text": "### Decision on an application on the Private Life route\n\nPL 9.1. If the decision maker is satisfied that all the suitability requirements are met and the eligibility requirements at PL 3.1, PL 4.1, PL 5.1 or PL.8.1. are met then, unless paragraph PL 8.2. applies, the applicant will be granted permission to stay on the Private Life route, otherwise the application will be refused.",
      "summary": "This provision applies to applicants on the Private Life route. If they meet all suitability and eligibility requirements, and no exceptional refusal grounds apply, they will be granted permission to stay; otherwise, their application will be refused.",
      "augmented_text": "Document: Immigration Rules Appendix Private Life\nPart: Immigration Rules Appendix Private Life\nSection ID: PL 9.1\nSection: Decision on an application on the Private Life route\nTopic: eligibility\n\nSummary: This provision applies to applicants on the Private Life route. If they meet all suitability and eligibility requirements, and no exceptional refusal grounds apply, they will be granted permission to stay; otherwise, their application will be refused.\n\n### Decision on an application on the Private Life route\n\nPL 9.1. If the decision maker is satisfied that all the suitability requirements are met and the eligibility requirements at PL 3.1, PL 4.1, PL 5.1 or PL.8.1. are met then, unless paragraph PL 8.2. applies, the applicant will be granted permission to stay on the Private Life route, otherwise the application will be refused.",
      "needs_review": false
    },
    {
      "metadata": {
        "source": "Immigration Rules Appendix Private Life",
        "part": "Immigration Rules Appendix Private Life",
        "section_id": "PL 10.1",
        "section_title": "Period of grant for permission to stay on the Private Life route",
        "parent_section": null,
        "hierarchy_level": 1,
        "topic": "duration",
        "url": "https://www.gov.uk/guidance/immigration-rules/immigration-rules-appendix-private-life",
        "scraped_at": "2025-12-06T17:28:19.332215"
      },
      "text": "### Period of grant for permission to stay on the Private Life route\n\n1.   PL 10.1. If the applicant is under 18 at the date of application (or was under 18 when first granted permission on the private life route), they will be granted permission to stay for either: \n    1.   (a) 30 months, where the applicant has applied for a period of 30 months; or\n    2.   (b) 60 months, where the applicant has applied for a period of 60 months.\n\n2.   PL 10.2. If the applicant is a young adult who has spent half their life in the UK at the date of application (or was previously granted as a young adult on the private life route), they will be granted permission to stay for either: \n    1.   (a) 30 months, where the applicant has applied for a period of 30 months; or\n    2.   (b) 60 months, where the applicant has applied for a period of 60 months.\n\nPL 10.3. In all other cases the applicant will be granted 30 months permission to stay.\n\nPL 10.4. Where a person is seeking to extend their permission to stay, any remaining period of permission at the date of application will be added to their next grant of permission, up to a maximum of 28 days.",
      "summary": "This provision applies to applicants on the UK Private Life route. It requires grants of permission to stay for 30 or 60 months based on age and residence history, with extensions adding remaining periods up to 28 days; exceptions apply for other cases, which grant 30 months.",
      "augmented_text": "Document: Immigration Rules Appendix Private Life\nPart: Immigration Rules Appendix Private Life\nSection ID: PL 10.1\nSection: Period of grant for permission to stay on the Private Life route\nTopic: duration\n\nSummary: This provision applies to applicants on the UK Private Life route. It requires grants of permission to stay for 30 or 60 months based on age and residence history, with extensions adding remaining periods up to 28 days; exceptions apply for other cases, which grant 30 months.\n\n### Period of grant for permission to stay on the Private Life route\n\n1.   PL 10.1. If the applicant is under 18 at the date of application (or was under 18 when first granted permission on the private life route), they will be granted permission to stay for either: \n    1.   (a) 30 months, where the applicant has applied for a period of 30 months; or\n    2.   (b) 60 months, where the applicant has applied for a period of 60 months.\n\n2.   PL 10.2. If the applicant is a young adult who has spent half their life in the UK at the date of application (or was previously granted as a young adult on the private life route), they will be granted permission to stay for either: \n    1.   (a) 30 months, where the applicant has applied for a period of 30 months; or\n    2.   (b) 60 months, where the applicant has applied for a period of 60 months.\n\nPL 10.3. In all other cases the applicant will be granted 30 months permission to stay.\n\nPL 10.4. Where a person is seeking to extend their permission to stay, any remaining period of permission at the date of application will be added to their next grant of permission, up to a maximum of 28 days.",
      "needs_review": false
    },
    {
      "metadata": {
        "source": "Immigration Rules Appendix Private Life",
        "part": "Immigration Rules Appendix Private Life",
        "section_id": "PL 10.5",
        "section_title": "Conditions of grant for the Private Life route",
        "parent_section": null,
        "hierarchy_level": 1,
        "topic": "conditions",
        "url": "https://www.gov.uk/guidance/immigration-rules/immigration-rules-appendix-private-life",
        "scraped_at": "2025-12-06T17:28:19.332233"
      },
      "text": "### Conditions of grant for the Private Life route\n\n1.   PL 10.5. The grant of permission will be subject to the following conditions: \n    1.   (a) work (including self-employment and voluntary work) permitted; and\n    2.   (b) study is permitted, subject to the ATAS condition in Appendix ATAS; and\n    3.   (c) if the decision maker is satisfied that: \n        1.   (i) the applicant is destitute, as defined in section 95 of the Immigration and Asylum Act 1999, or is at risk of imminent destitution; or\n        2.   (ii) there are reasons relating to the welfare of a relevant child which outweigh the considerations for imposing or maintaining the condition (treating the best interests of a relevant child as a primary consideration), or\n        3.   (iii) the applicant is facing exceptional circumstances affecting their income or expenditure,\n\n    4.   then the applicant will not be subject to a condition of no access to public funds. If the decision maker is not so satisfied, the applicant will be subject to a condition of no access to public funds.\n\n2.   PL 10.6. For the purposes of PL 10.5.(c)(ii) ‘relevant child’ means a person who: \n    1.   (a) is under the age of 18 years at the date of application; and\n    2.   (b) it is clear from the information provided by the applicant, is a child who would be affected by a decision to impose or maintain the no access to public funds condition.",
      "summary": "This provision applies to applicants granted permission under the Private Life route. It requires that work and study are permitted, with exceptions for destitution, child welfare, or exceptional circumstances, which may waive restrictions on access to public funds. Critical conditions include assessments of destitution or welfare considerations affecting minors under 18.",
      "augmented_text": "Document: Immigration Rules Appendix Private Life\nPart: Immigration Rules Appendix Private Life\nSection ID: PL 10.5\nSection: Conditions of grant for the Private Life route\nTopic: conditions\n\nSummary: This provision applies to applicants granted permission under the Private Life route. It requires that work and study are permitted, with exceptions for destitution, child welfare, or exceptional circumstances, which may waive restrictions on access to public funds. Critical conditions include assessments of destitution or welfare considerations affecting minors under 18.\n\n### Conditions of grant for the Private Life route\n\n1.   PL 10.5. The grant of permission will be subject to the following conditions: \n    1.   (a) work (including self-employment and voluntary work) permitted; and\n    2.   (b) study is permitted, subject to the ATAS condition in Appendix ATAS; and\n    3.   (c) if the decision maker is satisfied that: \n        1.   (i) the applicant is destitute, as defined in section 95 of the Immigration and Asylum Act 1999, or is at risk of imminent destitution; or\n        2.   (ii) there are reasons relating to the welfare of a relevant child which outweigh the considerations for imposing or maintaining the condition (treating the best interests of a relevant child as a primary consideration), or\n        3.   (iii) the applicant is facing exceptional circumstances affecting their income or expenditure,\n\n    4.   then the applicant will not be subject to a condition of no access to public funds. If the decision maker is not so satisfied, the applicant will be subject to a condition of no access to public funds.\n\n2.   PL 10.6. For the purposes of PL 10.5.(c)(ii) ‘relevant child’ means a person who: \n    1.   (a) is under the age of 18 years at the date of application; and\n    2.   (b) it is clear from the information provided by the applicant, is a child who would be affected by a decision to impose or maintain the no access to public funds condition.",
      "needs_review": false
    },
    {
      "metadata": {
        "source": "Immigration Rules Appendix Private Life",
        "part": "Immigration Rules Appendix Private Life",
        "section_id": "Settlement on the Private Life route",
        "section_title": "Settlement on the Private Life route",
        "parent_section": null,
        "hierarchy_level": 2,
        "topic": "settlement",
        "url": "https://www.gov.uk/guidance/immigration-rules/immigration-rules-appendix-private-life",
        "scraped_at": "2025-12-06T17:28:19.332241"
      },
      "text": "### Settlement on the Private Life route",
      "summary": "This provision applies to individuals seeking settlement via the Private Life route. It requires applicants to demonstrate established, long-standing private life in the UK, typically lasting at least 10 years, with limited exceptions. The rules specify thresholds and conditions for granting settlement based on duration and circumstances.",
      "augmented_text": "Document: Immigration Rules Appendix Private Life\nPart: Immigration Rules Appendix Private Life\nSection ID: Settlement on the Private Life route\nSection: Settlement on the Private Life route\nTopic: settlement\n\nSummary: This provision applies to individuals seeking settlement via the Private Life route. It requires applicants to demonstrate established, long-standing private life in the UK, typically lasting at least 10 years, with limited exceptions. The rules specify thresholds and conditions for granting settlement based on duration and circumstances.\n\n### Settlement on the Private Life route",
      "needs_review": false
    },
    {
      "metadata": {
        "source": "Immigration Rules Appendix Private Life",
        "part": "Immigration Rules Appendix Private Life",
        "section_id": "PL 11.1",
        "section_title": "Validity requirements for settlement on the Private Life route",
        "parent_section": "PL 11",
        "hierarchy_level": 2,
        "topic": "settlement",
        "url": "https://www.gov.uk/guidance/immigration-rules/immigration-rules-appendix-private-life",
        "scraped_at": "2025-12-06T17:28:19.332256"
      },
      "text": "### Validity requirements for settlement on the Private Life route\n\nPL 11.1. A person on the Private Life route who is applying for settlement must apply online on the gov.uk website on the specified form as follows:\n\n| Adult (aged 18 or over) | Settlement on the private life route |\n| --- | --- |\n| Child (aged under 18) | Settlement as a child (including a child aged over 18 already in the UK as a dependent) |\n\n1.   PL 11.2. An application for settlement must meet all the following requirements: \n    1.   (a) any fee must have been paid; and\n    2.   (b) the applicant must have provided biometrics when required; and\n    3.   (c) the applicant must have provided a passport or other travel document which satisfactorily establishes their identity and nationality; and\n    4.   (d) the applicant must be in the UK on the date of application.\n\n1.   PL 11.3. An applicant must have, or have last been granted, permission on the Private Life route, unless: \n    1.   (a) they are a child who was born in the UK; or\n    2.   (b) they are a child who has, or last had, permission as a dependent child (under Appendix FM or leave outside the Immigration Rules), before 20 June 2022 and would have met the continuous residence requirements in paragraph PL 3.1(a) at the time that permission or leave was granted; or\n    3.   (c) they are over the age of 18 and meet or met the half-life test, and has, or last had, permission on the basis of their family or private life (under Appendix FM or with leave outside the Immigration Rules), before 20 June 2022.\n\nPL 11.4. An application which does not meet all the validity requirements for settlement on the Private Life route may be rejected as invalid and not considered.",
      "summary": "Applicants aged 18 or over or children in the UK applying for settlement via the Private Life route must submit an online application, pay fees, provide biometrics and travel documents, and be in the UK at application time. They must have current or previous permission on this route unless they are UK-born children, children with prior permission as dependents, or over 18 meeting the half-life test.",
      "augmented_text": "Document: Immigration Rules Appendix Private Life\nPart: Immigration Rules Appendix Private Life\nSection ID: PL 11.1\nSection: Validity requirements for settlement on the Private Life route\nTopic: settlement\n\nSummary: Applicants aged 18 or over or children in the UK applying for settlement via the Private Life route must submit an online application, pay fees, provide biometrics and travel documents, and be in the UK at application time. They must have current or previous permission on this route unless they are UK-born children, children with prior permission as dependents, or over 18 meeting the half-life test.\n\n### Validity requirements for settlement on the Private Life route\n\nPL 11.1. A person on the Private Life route who is applying for settlement must apply online on the gov.uk website on the specified form as follows:\n\n| Adult (aged 18 or over) | Settlement on the private life route |\n| --- | --- |\n| Child (aged under 18) | Settlement as a child (including a child aged over 18 already in the UK as a dependent) |\n\n1.   PL 11.2. An application for settlement must meet all the following requirements: \n    1.   (a) any fee must have been paid; and\n    2.   (b) the applicant must have provided biometrics when required; and\n    3.   (c) the applicant must have provided a passport or other travel document which satisfactorily establishes their identity and nationality; and\n    4.   (d) the applicant must be in the UK on the date of application.\n\n1.   PL 11.3. An applicant must have, or have last been granted, permission on the Private Life route, unless: \n    1.   (a) they are a child who was born in the UK; or\n    2.   (b) they are a child who has, or last had, permission as a dependent child (under Appendix FM or leave outside the Immigration Rules), before 20 June 2022 and would have met the continuous residence requirements in paragraph PL 3.1(a) at the time that permission or leave was granted; or\n    3.   (c) they are over the age of 18 and meet or met the half-life test, and has, or last had, permission on the basis of their family or private life (under Appendix FM or with leave outside the Immigration Rules), before 20 June 2022.\n\nPL 11.4. An application which does not meet all the validity requirements for settlement on the Private Life route may be rejected as invalid and not considered.",
      "needs_review": false
    },
    {
      "metadata": {
        "source": "Immigration Rules Appendix Private Life",
        "part": "Immigration Rules Appendix Private Life",
        "section_id": "PL 12.1",
        "section_title": "Suitability requirements for settlement on the Private Life route",
        "parent_section": "PL 12",
        "hierarchy_level": 2,
        "topic": "suitability",
        "url": "https://www.gov.uk/guidance/immigration-rules/immigration-rules-appendix-private-life",
        "scraped_at": "2025-12-06T17:28:19.332270"
      },
      "text": "### Suitability requirements for settlement on the Private Life route\n\nPL 12.1. The applicant must not fall for refusal under Part Suitability.\n\nPL 12.2. DELETED.\n\nPL 12.3. The applicant must not fall for refusal under SUI 5.3. of Part Suitability, unless the applicant has completed a qualifying period of 10 years continuous residence with permission as set out in PL 12.6. and has completed 5 years continuous residence with such permission since the end of their sentence.\n\n1.   PL 12.4. Where any of the following occur during the applicant’s qualifying period for settlement, the applicant must be refused settlement unless the applicant has completed a continuous qualifying period of 10 years with permission as set out in PL 12.6. and has completed 5 years continuous residence with such permission after the date of the first grant of permission after the suitability ground came to the attention of the decision maker: \n    1.   (a) involvement in a sham marriage or civil partnership (SUI 8.1. of Part Suitability); or\n    2.   (b) use of false documents or information or deception (SUI 9.1. and SUI 10.1. of Part Suitability); or\n    3.   (c) litigation debt owed to the Home Office, unless the debt has been paid (SUI 17.1. of Part Suitability); or\n    4.   (d) debt to the NHS, unless the debt has been paid, or the total value of outstanding charges is under £500 (SUI 16.1. of Part Suitability); or\n    5.   (e) the applicant has breached the conditions of their permission (SUI 11.1. of Part Suitability).\n\nPL 12.5. Unless the applicant is a child or young adult who was granted permission to stay on the basis of private life under paragraphs PL 3.1. or PL 4.1, if the applicant entered the UK illegally settlement must be refused unless the applicant has completed a qualifying period of 10 years with permission under PL 12.6.\n\n1.   PL 12.6. Where an applicant must complete a qualifying period of 10 years continuous residence (under PL 12.3. to PL 12.5.), they must have had permission as (or as a combination of) the following for that 10 year qualifying period: \n    1.   (a) entry clearance or permission granted as a partner or parent under Appendix FM (except for permission as a fiancé(e) or proposed civil partner); or\n    2.   (b) permission described in the Home Office grant letter as “family permission as a parent” or “family permission as a partner”; or\n    3.   (c) permission on the private life route under paragraph 276ADE or 276BE(2) before 20 June 2022 or Appendix Private Life; or\n    4.   (d) entry clearance or permission as a child of a person with limited leave as a partner or parent under Appendix FM; or\n    5.   (e) permission granted outside the rules as a partner, a parent or child or because of private life on the basis of Article 8 of the Human Rights Convention.\n\n2.   PL 12.7. The applicant must not be: \n    1.   (a) in breach of immigration laws, except that where the Exceptions for overstayers section of Part Suitability applies, that period of overstaying will be disregarded; or\n    2.   (b) on immigration bail.",
      "summary": "This provision applies to applicants seeking settlement on the Private Life route. They must not be refused under Part Suitability, with specific conditions allowing for exceptions after completing a 10-year continuous residence, including certain misconduct or debts, provided additional residency criteria are met. Notably, involvement in sham marriages, deception, or unpaid debts during the qualifying period generally lead to refusal unless thresholds are satisfied.",
      "augmented_text": "Document: Immigration Rules Appendix Private Life\nPart: Immigration Rules Appendix Private Life\nSection ID: PL 12.1\nSection: Suitability requirements for settlement on the Private Life route\nTopic: suitability\n\nSummary: This provision applies to applicants seeking settlement on the Private Life route. They must not be refused under Part Suitability, with specific conditions allowing for exceptions after completing a 10-year continuous residence, including certain misconduct or debts, provided additional residency criteria are met. Notably, involvement in sham marriages, deception, or unpaid debts during the qualifying period generally lead to refusal unless thresholds are satisfied.\n\n### Suitability requirements for settlement on the Private Life route\n\nPL 12.1. The applicant must not fall for refusal under Part Suitability.\n\nPL 12.2. DELETED.\n\nPL 12.3. The applicant must not fall for refusal under SUI 5.3. of Part Suitability, unless the applicant has completed a qualifying period of 10 years continuous residence with permission as set out in PL 12.6. and has completed 5 years continuous residence with such permission since the end of their sentence.\n\n1.   PL 12.4. Where any of the following occur during the applicant’s qualifying period for settlement, the applicant must be refused settlement unless the applicant has completed a continuous qualifying period of 10 years with permission as set out in PL 12.6. and has completed 5 years continuous residence with such permission after the date of the first grant of permission after the suitability ground came to the attention of the decision maker: \n    1.   (a) involvement in a sham marriage or civil partnership (SUI 8.1. of Part Suitability); or\n    2.   (b) use of false documents or information or deception (SUI 9.1. and SUI 10.1. of Part Suitability); or\n    3.   (c) litigation debt owed to the Home Office, unless the debt has been paid (SUI 17.1. of Part Suitability); or\n    4.   (d) debt to the NHS, unless the debt has been paid, or the total value of outstanding charges is under £500 (SUI 16.1. of Part Suitability); or\n    5.   (e) the applicant has breached the conditions of their permission (SUI 11.1. of Part Suitability).\n\nPL 12.5. Unless the applicant is a child or young adult who was granted permission to stay on the basis of private life under paragraphs PL 3.1. or PL 4.1, if the applicant entered the UK illegally settlement must be refused unless the applicant has completed a qualifying period of 10 years with permission under PL 12.6.\n\n1.   PL 12.6. Where an applicant must complete a qualifying period of 10 years continuous residence (under PL 12.3. to PL 12.5.), they must have had permission as (or as a combination of) the following for that 10 year qualifying period: \n    1.   (a) entry clearance or permission granted as a partner or parent under Appendix FM (except for permission as a fiancé(e) or proposed civil partner); or\n    2.   (b) permission described in the Home Office grant letter as “family permission as a parent” or “family permission as a partner”; or\n    3.   (c) permission on the private life route under paragraph 276ADE or 276BE(2) before 20 June 2022 or Appendix Private Life; or\n    4.   (d) entry clearance or permission as a child of a person with limited leave as a partner or parent under Appendix FM; or\n    5.   (e) permission granted outside the rules as a partner, a parent or child or because of private life on the basis of Article 8 of the Human Rights Convention.\n\n2.   PL 12.7. The applicant must not be: \n    1.   (a) in breach of immigration laws, except that where the Exceptions for overstayers section of Part Suitability applies, that period of overstaying will be disregarded; or\n    2.   (b) on immigration bail.",
      "needs_review": false
    },
    {
      "metadata": {
        "source": "Immigration Rules Appendix Private Life",
        "part": "Immigration Rules Appendix Private Life",
        "section_id": "Eligibility requirements for settlement on the Private Life route",
        "section_title": "Eligibility requirements for settlement on the Private Life route",
        "parent_section": null,
        "hierarchy_level": 2,
        "topic": "eligibility",
        "url": "https://www.gov.uk/guidance/immigration-rules/immigration-rules-appendix-private-life",
        "scraped_at": "2025-12-06T17:28:19.332274"
      },
      "text": "### Eligibility requirements for settlement on the Private Life route",
      "summary": "This provision applies to applicants seeking settlement via the Private Life route. It requires them to demonstrate continuous lawful residence and meet specific criteria, with exceptions for certain vulnerable groups, ensuring eligibility conditions are satisfied for settlement approval.",
      "augmented_text": "Document: Immigration Rules Appendix Private Life\nPart: Immigration Rules Appendix Private Life\nSection ID: Eligibility requirements for settlement on the Private Life route\nSection: Eligibility requirements for settlement on the Private Life route\nTopic: eligibility\n\nSummary: This provision applies to applicants seeking settlement via the Private Life route. It requires them to demonstrate continuous lawful residence and meet specific criteria, with exceptions for certain vulnerable groups, ensuring eligibility conditions are satisfied for settlement approval.\n\n### Eligibility requirements for settlement on the Private Life route",
      "needs_review": false
    },
    {
      "metadata": {
        "source": "Immigration Rules Appendix Private Life",
        "part": "Immigration Rules Appendix Private Life",
        "section_id": "PL 13.1",
        "section_title": "Child born in the UK requirements for settlement on the Private life route",
        "parent_section": "PL 13",
        "hierarchy_level": 2,
        "topic": "settlement",
        "url": "https://www.gov.uk/guidance/immigration-rules/immigration-rules-appendix-private-life",
        "scraped_at": "2025-12-06T17:28:19.332288"
      },
      "text": "### Child born in the UK requirements for settlement on the Private life route\n\nPL 13.1. The applicant must have been born in the UK and must provide a full UK birth certificate.\n\nPL 13.2. The applicant must have lived continuously in the UK since their birth and for at least 7 years at the date of application.\n\nPL 13.3. The decision maker must be satisfied that it is not reasonable to expect the applicant to leave the UK.",
      "summary": "This provision applies to children born in the UK applying for settlement on the private life route. Applicants must have been born in the UK, provide a birth certificate, and have lived continuously in the UK for at least 7 years; the decision also considers whether it is reasonable for the child to leave the UK.",
      "augmented_text": "Document: Immigration Rules Appendix Private Life\nPart: Immigration Rules Appendix Private Life\nSection ID: PL 13.1\nSection: Child born in the UK requirements for settlement on the Private life route\nTopic: settlement\n\nSummary: This provision applies to children born in the UK applying for settlement on the private life route. Applicants must have been born in the UK, provide a birth certificate, and have lived continuously in the UK for at least 7 years; the decision also considers whether it is reasonable for the child to leave the UK.\n\n### Child born in the UK requirements for settlement on the Private life route\n\nPL 13.1. The applicant must have been born in the UK and must provide a full UK birth certificate.\n\nPL 13.2. The applicant must have lived continuously in the UK since their birth and for at least 7 years at the date of application.\n\nPL 13.3. The decision maker must be satisfied that it is not reasonable to expect the applicant to leave the UK.",
      "needs_review": false
    },
    {
      "metadata": {
        "source": "Immigration Rules Appendix Private Life",
        "part": "Immigration Rules Appendix Private Life",
        "section_id": "PL 14.1",
        "section_title": "Qualifying period requirement for settlement on the Private Life route (where the applicant was not born in the UK)",
        "parent_section": "PL 14",
        "hierarchy_level": 2,
        "topic": "settlement",
        "url": "https://www.gov.uk/guidance/immigration-rules/immigration-rules-appendix-private-life",
        "scraped_at": "2025-12-06T17:28:19.332306"
      },
      "text": "### Qualifying period requirement for settlement on the Private Life route (where the applicant was not born in the UK)\n\nPL 14.1. An applicant who has, or last had, permission to stay on the private life route as a child, or young adult who met the half-life test under PL 4.1, must have lived in the UK for a continuous qualifying period of 5 years with permission as set out in PL 14.3 or 14.4.\n\n1.   PL 14.1A. A child applicant who has, or last had, permission as a dependent child under Appendix FM or leave outside the Immigration Rules before 20 June 2022, and would have met the private life rules at the time they were granted that permission, must: \n    1.   (a) meet the continuous residence requirements for a child at PL 3.1(a) at the date of application or have met the continuous residence requirements for a child at PL 3.1(a) in a previous application; and\n    2.   (b) have lived in the UK for a continuous qualifying period of 5 years with permission as set out in PL 14.3.\n\nPL 14.1B. The periods at PL 14.1A(a) and (b) must not run concurrently.\n\n1.   PL 14.2. An applicant who is aged 18 or over at the date of application and does not meet the requirement in PL 14.1., must either: \n    1.   (a) have lived in the UK for a continuous qualifying period of 10 years with permission set out in PL 14.3. or 14.4.; or\n    2.   (b) have, or last had, permission on the basis of their family or private life (under Appendix FM or leave outside the Immigration Rules before 20 June 2022), before 20 June 2022.\n\n1.   PL 14.2A. Where 14.2(b) applies, the applicant must have lived in the UK for a continuous qualifying period of 5 years with permission as set out in PL 14.3, and either: \n    1.   (a) meet the half-life test at PL 4.1. at the date of application; or\n    2.   (b) have met the half-life test at PL 4.1. in a previous application, or;\n    3.   (c) have been initially granted permission as a child (as set out in PL 14.3.) and have since turned 25 and have spent at least half their life continuously resident in the UK.\n\n1.   PL 14.3. Permission on the following routes (or any combination of those routes) counts towards the qualifying period in PL 14.1, PL 14.2 or PL 14.2A: \n    1.   (a) entry clearance or permission granted as a partner or parent under Appendix FM (except for permission as a fiancé(e) or proposed civil partner); or\n    2.   (b) permission described in the Home Office grant letter as “family permission as a parent” or “family permission as a partner”; or\n    3.   (c) permission on the private life route under paragraph 276ADE or 276BE(2) before 20 June 2022 or Appendix Private Life; or\n    4.   (d) entry clearance or permission as a child of a person with limited leave as a partner or parent under Appendix FM; or\n    5.   (e) permission granted outside the rules as a partner, a parent or child or because of private life on the basis of Article 8 of the Human Rights Convention.\n\n2.   PL 14.4. Permission on any other route that includes rules allowing an applicant to qualify for settlement also counts towards the qualifying period in PL 14.1. or PL 14.2, if the applicant: \n    1.   (a) did not enter the UK illegally (unless they have permission to stay on the private life route as a child or young adult); and\n    2.   (b) has had permission either under paragraph 276ADE or 276 BE(2) before 20 June 2022 or Appendix Private Life for at least one year at the date of application.",
      "summary": "Applicants under the private life route must have lived continuously in the UK for 5 years (if previously granted as a child or young adult meeting the half-life test) or 10 years if over 18 without meeting the half-life test, with relevant permission. Certain conditions apply for child applicants and those whose permissions predate June 2022, with specific residency and permission requirements outlined in PL 14.1 and PL 14.2.",
      "augmented_text": "Document: Immigration Rules Appendix Private Life\nPart: Immigration Rules Appendix Private Life\nSection ID: PL 14.1\nSection: Qualifying period requirement for settlement on the Private Life route (where the applicant was not born in the UK)\nTopic: settlement\n\nSummary: Applicants under the private life route must have lived continuously in the UK for 5 years (if previously granted as a child or young adult meeting the half-life test) or 10 years if over 18 without meeting the half-life test, with relevant permission. Certain conditions apply for child applicants and those whose permissions predate June 2022, with specific residency and permission requirements outlined in PL 14.1 and PL 14.2.\n\n### Qualifying period requirement for settlement on the Private Life route (where the applicant was not born in the UK)\n\nPL 14.1. An applicant who has, or last had, permission to stay on the private life route as a child, or young adult who met the half-life test under PL 4.1, must have lived in the UK for a continuous qualifying period of 5 years with permission as set out in PL 14.3 or 14.4.\n\n1.   PL 14.1A. A child applicant who has, or last had, permission as a dependent child under Appendix FM or leave outside the Immigration Rules before 20 June 2022, and would have met the private life rules at the time they were granted that permission, must: \n    1.   (a) meet the continuous residence requirements for a child at PL 3.1(a) at the date of application or have met the continuous residence requirements for a child at PL 3.1(a) in a previous application; and\n    2.   (b) have lived in the UK for a continuous qualifying period of 5 years with permission as set out in PL 14.3.\n\nPL 14.1B. The periods at PL 14.1A(a) and (b) must not run concurrently.\n\n1.   PL 14.2. An applicant who is aged 18 or over at the date of application and does not meet the requirement in PL 14.1., must either: \n    1.   (a) have lived in the UK for a continuous qualifying period of 10 years with permission set out in PL 14.3. or 14.4.; or\n    2.   (b) have, or last had, permission on the basis of their family or private life (under Appendix FM or leave outside the Immigration Rules before 20 June 2022), before 20 June 2022.\n\n1.   PL 14.2A. Where 14.2(b) applies, the applicant must have lived in the UK for a continuous qualifying period of 5 years with permission as set out in PL 14.3, and either: \n    1.   (a) meet the half-life test at PL 4.1. at the date of application; or\n    2.   (b) have met the half-life test at PL 4.1. in a previous application, or;\n    3.   (c) have been initially granted permission as a child (as set out in PL 14.3.) and have since turned 25 and have spent at least half their life continuously resident in the UK.\n\n1.   PL 14.3. Permission on the following routes (or any combination of those routes) counts towards the qualifying period in PL 14.1, PL 14.2 or PL 14.2A: \n    1.   (a) entry clearance or permission granted as a partner or parent under Appendix FM (except for permission as a fiancé(e) or proposed civil partner); or\n    2.   (b) permission described in the Home Office grant letter as “family permission as a parent” or “family permission as a partner”; or\n    3.   (c) permission on the private life route under paragraph 276ADE or 276BE(2) before 20 June 2022 or Appendix Private Life; or\n    4.   (d) entry clearance or permission as a child of a person with limited leave as a partner or parent under Appendix FM; or\n    5.   (e) permission granted outside the rules as a partner, a parent or child or because of private life on the basis of Article 8 of the Human Rights Convention.\n\n2.   PL 14.4. Permission on any other route that includes rules allowing an applicant to qualify for settlement also counts towards the qualifying period in PL 14.1. or PL 14.2, if the applicant: \n    1.   (a) did not enter the UK illegally (unless they have permission to stay on the private life route as a child or young adult); and\n    2.   (b) has had permission either under paragraph 276ADE or 276 BE(2) before 20 June 2022 or Appendix Private Life for at least one year at the date of application.",
      "needs_review": false
    },
    {
      "metadata": {
        "source": "Immigration Rules Appendix Private Life",
        "part": "Immigration Rules Appendix Private Life",
        "section_id": "PL 15.1",
        "section_title": "Continuous Residence requirement for settlement on the Private Life route",
        "parent_section": "PL 15",
        "hierarchy_level": 2,
        "topic": "settlement",
        "url": "https://www.gov.uk/guidance/immigration-rules/immigration-rules-appendix-private-life",
        "scraped_at": "2025-12-06T17:28:19.332320"
      },
      "text": "### Continuous Residence requirement for settlement on the Private Life route\n\nPL 15.1. The applicant must meet the continuous residence requirements as set out in Appendix Continuous Residence for the qualifying period for settlement, unless they are a child born in the UK.",
      "summary": "Applicants seeking settlement on the Private Life route must meet the continuous residence requirement over the qualifying period, except if they are a UK-born child; compliance with Appendix Continuous Residence is essential.",
      "augmented_text": "Document: Immigration Rules Appendix Private Life\nPart: Immigration Rules Appendix Private Life\nSection ID: PL 15.1\nSection: Continuous Residence requirement for settlement on the Private Life route\nTopic: settlement\n\nSummary: Applicants seeking settlement on the Private Life route must meet the continuous residence requirement over the qualifying period, except if they are a UK-born child; compliance with Appendix Continuous Residence is essential.\n\n### Continuous Residence requirement for settlement on the Private Life route\n\nPL 15.1. The applicant must meet the continuous residence requirements as set out in Appendix Continuous Residence for the qualifying period for settlement, unless they are a child born in the UK.",
      "needs_review": false
    },
    {
      "metadata": {
        "source": "Immigration Rules Appendix Private Life",
        "part": "Immigration Rules Appendix Private Life",
        "section_id": "PL 15A",
        "section_title": "Continuous residence requirements for a child born in the UK applying for settlement on the Private Life route",
        "parent_section": null,
        "hierarchy_level": 1,
        "topic": "settlement",
        "url": "https://www.gov.uk/guidance/immigration-rules/immigration-rules-appendix-private-life",
        "scraped_at": "2025-12-06T17:28:19.332335"
      },
      "text": "### Continuous residence requirements for a child born in the UK applying for settlement on the Private Life route\n\nPL 15A.1. The period of continuous residence at PL 13.2. may include time spent in the UK with or without permission.\n\nPL 15A.2. The period of continuous residence at PL 13.2. does not include any period during which the applicant was serving a sentence of imprisonment or was detained in an institution other than a prison.\n\n1.   PL 15A.3. The period of continuous residence at PL 13.2. is broken (i.e. is no longer continuous) if any of the following apply: \n    1.   (a) the applicant has been absent from the UK for more than 6 months at any one time; or\n    2.   (b) the applicant has spent a total of 550 days or more absent from the UK during the period of continuous residence at PL 13.2.; or\n    3.   (c) the applicant has been removed, deported or has left the UK having had an application for permission to enter or stay in the UK refused; or\n    4.   (d) the applicant left the UK with no reasonable expectation at the time of leaving that they would lawfully be able to return.",
      "summary": "This provision applies to children born in the UK applying for settlement via the Private Life route. It requires them to have maintained continuous residence, with permitted absences under certain limits (no more than 6 months at a time or 550 days total), excluding periods of detention; breaks occur if these thresholds are exceeded or if they have been removed or left unlawfully.",
      "augmented_text": "Document: Immigration Rules Appendix Private Life\nPart: Immigration Rules Appendix Private Life\nSection ID: PL 15A\nSection: Continuous residence requirements for a child born in the UK applying for settlement on the Private Life route\nTopic: settlement\n\nSummary: This provision applies to children born in the UK applying for settlement via the Private Life route. It requires them to have maintained continuous residence, with permitted absences under certain limits (no more than 6 months at a time or 550 days total), excluding periods of detention; breaks occur if these thresholds are exceeded or if they have been removed or left unlawfully.\n\n### Continuous residence requirements for a child born in the UK applying for settlement on the Private Life route\n\nPL 15A.1. The period of continuous residence at PL 13.2. may include time spent in the UK with or without permission.\n\nPL 15A.2. The period of continuous residence at PL 13.2. does not include any period during which the applicant was serving a sentence of imprisonment or was detained in an institution other than a prison.\n\n1.   PL 15A.3. The period of continuous residence at PL 13.2. is broken (i.e. is no longer continuous) if any of the following apply: \n    1.   (a) the applicant has been absent from the UK for more than 6 months at any one time; or\n    2.   (b) the applicant has spent a total of 550 days or more absent from the UK during the period of continuous residence at PL 13.2.; or\n    3.   (c) the applicant has been removed, deported or has left the UK having had an application for permission to enter or stay in the UK refused; or\n    4.   (d) the applicant left the UK with no reasonable expectation at the time of leaving that they would lawfully be able to return.",
      "needs_review": false
    },
    {
      "metadata": {
        "source": "Immigration Rules Appendix Private Life",
        "part": "Immigration Rules Appendix Private Life",
        "section_id": "PL 16.1",
        "section_title": "English language requirement for settlement on the Private Life route",
        "parent_section": "PL 16",
        "hierarchy_level": 2,
        "topic": "english-language",
        "url": "https://www.gov.uk/guidance/immigration-rules/immigration-rules-appendix-private-life",
        "scraped_at": "2025-12-06T17:28:19.332344"
      },
      "text": "### English language requirement for settlement on the Private Life route\n\nPL 16.1. Unless an exemption applies (for example where the applicant is aged under 18), the applicant must show English language ability on the Common European Framework of Reference for Languages in speaking and listening to at least level B1.\n\nPL 16.2. The applicant must show they meet the English language requirement as specified in Appendix English Language.",
      "summary": "Applicants seeking settlement on the Private Life route must demonstrate English language ability at B1 level in speaking and listening, unless exempt (e.g., under 18). They must meet the standards set in Appendix English Language, with specific exemptions applying.",
      "augmented_text": "Document: Immigration Rules Appendix Private Life\nPart: Immigration Rules Appendix Private Life\nSection ID: PL 16.1\nSection: English language requirement for settlement on the Private Life route\nTopic: english-language\n\nSummary: Applicants seeking settlement on the Private Life route must demonstrate English language ability at B1 level in speaking and listening, unless exempt (e.g., under 18). They must meet the standards set in Appendix English Language, with specific exemptions applying.\n\n### English language requirement for settlement on the Private Life route\n\nPL 16.1. Unless an exemption applies (for example where the applicant is aged under 18), the applicant must show English language ability on the Common European Framework of Reference for Languages in speaking and listening to at least level B1.\n\nPL 16.2. The applicant must show they meet the English language requirement as specified in Appendix English Language.",
      "needs_review": false
    },
    {
      "metadata": {
        "source": "Immigration Rules Appendix Private Life",
        "part": "Immigration Rules Appendix Private Life",
        "section_id": "Knowledge of life in the UK requirement for settlement on the Private Life route",
        "section_title": "Knowledge of life in the UK requirement for settlement on the Private Life route",
        "parent_section": null,
        "hierarchy_level": 2,
        "topic": "settlement",
        "url": "https://www.gov.uk/guidance/immigration-rules/immigration-rules-appendix-private-life",
        "scraped_at": "2025-12-06T17:28:19.332358"
      },
      "text": "### Knowledge of life in the UK requirement for settlement on the Private Life route\n\nPL17.1. Unless an exemption applies (for example where the applicant is aged under 18), the applicant must meet the Knowledge of Life in the UK requirement as specified in Appendix KOL UK.",
      "summary": "Applicants seeking settlement on the Private Life route must generally meet the Knowledge of Life in the UK requirement, unless exempt (e.g., under 18). This involves demonstrating knowledge as specified in Appendix KOL UK, with certain exemptions applying based on age or other criteria.",
      "augmented_text": "Document: Immigration Rules Appendix Private Life\nPart: Immigration Rules Appendix Private Life\nSection ID: Knowledge of life in the UK requirement for settlement on the Private Life route\nSection: Knowledge of life in the UK requirement for settlement on the Private Life route\nTopic: settlement\n\nSummary: Applicants seeking settlement on the Private Life route must generally meet the Knowledge of Life in the UK requirement, unless exempt (e.g., under 18). This involves demonstrating knowledge as specified in Appendix KOL UK, with certain exemptions applying based on age or other criteria.\n\n### Knowledge of life in the UK requirement for settlement on the Private Life route\n\nPL17.1. Unless an exemption applies (for example where the applicant is aged under 18), the applicant must meet the Knowledge of Life in the UK requirement as specified in Appendix KOL UK.",
      "needs_review": false
    },
    {
      "metadata": {
        "source": "Immigration Rules Appendix Private Life",
        "part": "Immigration Rules Appendix Private Life",
        "section_id": "PL 18.1",
        "section_title": "Decision on an application for settlement on the Private Life route",
        "parent_section": "PL 18",
        "hierarchy_level": 2,
        "topic": "eligibility",
        "url": "https://www.gov.uk/guidance/immigration-rules/immigration-rules-appendix-private-life",
        "scraped_at": "2025-12-06T17:28:19.332365"
      },
      "text": "### Decision on an application for settlement on the Private Life route\n\nPL 18.1. If the decision maker is satisfied the suitability and eligibility requirements for settlement on the Private Life route are met the applicant will be granted settlement.\n\n1.   PL 18.2. If the requirements for settlement are not met, but the decision maker believes the applicant is likely to meet all the suitability and eligibility requirements for permission to stay on the private life route the application will be varied by the Secretary of State to an application for permission to stay on the private life route. Where this happens: \n    1.   (a) no additional application fee for permission to stay will be required and the settlement application fee will not be refunded; and\n    2.   (b) the Secretary of State will write to the applicant informing them of this variation and if required will request the applicant pay any Immigration Health Charge.\n\nPL 18.3. If the applicant does not pay the requested Immigration Health Charge or does not request a fee waiver for the Immigration Health Charge which is then granted, the application for permission to stay will be rejected as invalid and the applicant will not be refunded the fee paid for the settlement application.\n\nPL 18.4. Where an applicant is granted permission to stay they will be granted for a period as set out in PL 10.1. to 10.4. (as relevant), subject to the conditions in PL 10.5.\n\nPL 18.5. If the decision maker is not satisfied that the applicant meets all the suitability and eligibility requirements for settlement or permission to stay the application for settlement on the Private Life route will be refused.",
      "summary": "Applicants applying for settlement via the Private Life route must meet suitability and eligibility criteria for approval. If criteria are not fully met but likely to be, their application may be varied to permission to stay without additional fee, provided they pay the Immigration Health Charge; failure to pay or request a waiver results in invalid rejection. Successful applicants are granted permission to stay for a specified period subject to conditions.",
      "augmented_text": "Document: Immigration Rules Appendix Private Life\nPart: Immigration Rules Appendix Private Life\nSection ID: PL 18.1\nSection: Decision on an application for settlement on the Private Life route\nTopic: eligibility\n\nSummary: Applicants applying for settlement via the Private Life route must meet suitability and eligibility criteria for approval. If criteria are not fully met but likely to be, their application may be varied to permission to stay without additional fee, provided they pay the Immigration Health Charge; failure to pay or request a waiver results in invalid rejection. Successful applicants are granted permission to stay for a specified period subject to conditions.\n\n### Decision on an application for settlement on the Private Life route\n\nPL 18.1. If the decision maker is satisfied the suitability and eligibility requirements for settlement on the Private Life route are met the applicant will be granted settlement.\n\n1.   PL 18.2. If the requirements for settlement are not met, but the decision maker believes the applicant is likely to meet all the suitability and eligibility requirements for permission to stay on the private life route the application will be varied by the Secretary of State to an application for permission to stay on the private life route. Where this happens: \n    1.   (a) no additional application fee for permission to stay will be required and the settlement application fee will not be refunded; and\n    2.   (b) the Secretary of State will write to the applicant informing them of this variation and if required will request the applicant pay any Immigration Health Charge.\n\nPL 18.3. If the applicant does not pay the requested Immigration Health Charge or does not request a fee waiver for the Immigration Health Charge which is then granted, the application for permission to stay will be rejected as invalid and the applicant will not be refunded the fee paid for the settlement application.\n\nPL 18.4. Where an applicant is granted permission to stay they will be granted for a period as set out in PL 10.1. to 10.4. (as relevant), subject to the conditions in PL 10.5.\n\nPL 18.5. If the decision maker is not satisfied that the applicant meets all the suitability and eligibility requirements for settlement or permission to stay the application for settlement on the Private Life route will be refused.",
      "needs_review": false
    },
    {
      "metadata": {
        "source": "Immigration Rules Appendix Private Life",
        "part": "Immigration Rules Appendix Private Life",
        "section_id": "Dependent child born in the UK to a person on the Private Life Route",
        "section_title": "Dependent child born in the UK to a person on the Private Life Route",
        "parent_section": null,
        "hierarchy_level": 2,
        "topic": "family",
        "url": "https://www.gov.uk/guidance/immigration-rules/immigration-rules-appendix-private-life",
        "scraped_at": "2025-12-06T17:28:19.332375"
      },
      "text": "### Dependent child born in the UK to a person on the Private Life Route",
      "summary": "This provision applies to dependent children born in the UK to individuals on the Private Life Route. It requires the child to meet specific eligibility criteria for settled or qualifying status. Key conditions include demonstrating the child's dependency and, in some cases, meeting continuous residence or relationship thresholds.",
      "augmented_text": "Document: Immigration Rules Appendix Private Life\nPart: Immigration Rules Appendix Private Life\nSection ID: Dependent child born in the UK to a person on the Private Life Route\nSection: Dependent child born in the UK to a person on the Private Life Route\nTopic: family\n\nSummary: This provision applies to dependent children born in the UK to individuals on the Private Life Route. It requires the child to meet specific eligibility criteria for settled or qualifying status. Key conditions include demonstrating the child's dependency and, in some cases, meeting continuous residence or relationship thresholds.\n\n### Dependent child born in the UK to a person on the Private Life Route",
      "needs_review": false
    },
    {
      "metadata": {
        "source": "Immigration Rules Appendix Private Life",
        "part": "Immigration Rules Appendix Private Life",
        "section_id": "PL 19.1",
        "section_title": "Validity requirements for a child born in the UK to a person on the Private Life route",
        "parent_section": "PL 19",
        "hierarchy_level": 2,
        "topic": "family",
        "url": "https://www.gov.uk/guidance/immigration-rules/immigration-rules-appendix-private-life",
        "scraped_at": "2025-12-06T17:28:19.332396"
      },
      "text": "### Validity requirements for a child born in the UK to a person on the Private Life route\n\nPL 19.1. A person applying for permission to stay as a child born in the UK to a person on the Private Life route must apply online on the gov.uk website on the specified form: “Application to remain in the UK on the basis of family life or private life”.\n\n1.   PL 19.2. An application for permission to stay as a child born in the UK to a person on the Private Life route must meet all the following requirements: \n    1.   (a) any fee and Immigration Health Charge must have been paid (unless a fee waiver has been granted in whole or in part); and\n    2.   (b) the applicant must have provided biometrics when required; and\n    3.   (c) the applicant must have provided a passport or other document which satisfactorily establishes their identity and nationality; and\n    4.   (d) the applicant must be applying as a child of a person (P) on the Private Life route who: \n        1.   (i) has made a valid application for permission to stay in the UK on the Private Life route that has not been decided; or\n        2.   (ii) has permission to stay on the Private Life route; or\n        3.   (iii)is settled or has become a British citizen, providing P had permission to stay on the Private Life route when they settled, and the applicant was born before P settled; and\n\n    5.   (e) the applicant must be in the UK on the date of application.\n\nPL 19.3. An applicant must be aged under 18 at the date of application.\n\n1.   PL 19.4. If a claim is made under Article 8 of the Human Rights Convention: \n    1.   (a) at the same time as a protection claim or further submission in person after a protection claim is refused; or\n    2.   (b) in an appeal (subject to the consent of the Secretary of State where applicable); the requirements at PL 19.1. and at PL 19.2. (a) and (c) will be waived.\n\nPL 19.5. An application which does not meet all the validity requirements for a child born in the UK of a person on the Private Life route may be rejected as invalid and not considered.",
      "summary": "Applicants seeking permission to stay in the UK as a child born to a person on the Private Life route must apply online, meet fee, biometric, and identity requirements, and be under 18 on application date. The child's parent must have an active or settled Private Life route status, and the child must be in the UK at the time of application.",
      "augmented_text": "Document: Immigration Rules Appendix Private Life\nPart: Immigration Rules Appendix Private Life\nSection ID: PL 19.1\nSection: Validity requirements for a child born in the UK to a person on the Private Life route\nTopic: family\n\nSummary: Applicants seeking permission to stay in the UK as a child born to a person on the Private Life route must apply online, meet fee, biometric, and identity requirements, and be under 18 on application date. The child's parent must have an active or settled Private Life route status, and the child must be in the UK at the time of application.\n\n### Validity requirements for a child born in the UK to a person on the Private Life route\n\nPL 19.1. A person applying for permission to stay as a child born in the UK to a person on the Private Life route must apply online on the gov.uk website on the specified form: “Application to remain in the UK on the basis of family life or private life”.\n\n1.   PL 19.2. An application for permission to stay as a child born in the UK to a person on the Private Life route must meet all the following requirements: \n    1.   (a) any fee and Immigration Health Charge must have been paid (unless a fee waiver has been granted in whole or in part); and\n    2.   (b) the applicant must have provided biometrics when required; and\n    3.   (c) the applicant must have provided a passport or other document which satisfactorily establishes their identity and nationality; and\n    4.   (d) the applicant must be applying as a child of a person (P) on the Private Life route who: \n        1.   (i) has made a valid application for permission to stay in the UK on the Private Life route that has not been decided; or\n        2.   (ii) has permission to stay on the Private Life route; or\n        3.   (iii)is settled or has become a British citizen, providing P had permission to stay on the Private Life route when they settled, and the applicant was born before P settled; and\n\n    5.   (e) the applicant must be in the UK on the date of application.\n\nPL 19.3. An applicant must be aged under 18 at the date of application.\n\n1.   PL 19.4. If a claim is made under Article 8 of the Human Rights Convention: \n    1.   (a) at the same time as a protection claim or further submission in person after a protection claim is refused; or\n    2.   (b) in an appeal (subject to the consent of the Secretary of State where applicable); the requirements at PL 19.1. and at PL 19.2. (a) and (c) will be waived.\n\nPL 19.5. An application which does not meet all the validity requirements for a child born in the UK of a person on the Private Life route may be rejected as invalid and not considered.",
      "needs_review": false
    },
    {
      "metadata": {
        "source": "Immigration Rules Appendix Private Life",
        "part": "Immigration Rules Appendix Private Life",
        "section_id": "PL 20.1",
        "section_title": "Suitability requirements for a child born in the UK to a person on the Private Life route",
        "parent_section": "PL 20",
        "hierarchy_level": 2,
        "topic": "suitability",
        "url": "https://www.gov.uk/guidance/immigration-rules/immigration-rules-appendix-private-life",
        "scraped_at": "2025-12-06T17:28:19.332405"
      },
      "text": "### Suitability requirements for a child born in the UK to a person on the Private Life route\n\nPL 20.1. The applicant must not fall for refusal under Part Suitability.\n\nPL 20.2. DELETED.",
      "summary": "This section applies to children born in the UK to individuals on the Private Life route, requiring them to meet suitability criteria. The child must not be refused under Part Suitability, with no additional conditions specified.",
      "augmented_text": "Document: Immigration Rules Appendix Private Life\nPart: Immigration Rules Appendix Private Life\nSection ID: PL 20.1\nSection: Suitability requirements for a child born in the UK to a person on the Private Life route\nTopic: suitability\n\nSummary: This section applies to children born in the UK to individuals on the Private Life route, requiring them to meet suitability criteria. The child must not be refused under Part Suitability, with no additional conditions specified.\n\n### Suitability requirements for a child born in the UK to a person on the Private Life route\n\nPL 20.1. The applicant must not fall for refusal under Part Suitability.\n\nPL 20.2. DELETED.",
      "needs_review": false
    },
    {
      "metadata": {
        "source": "Immigration Rules Appendix Private Life",
        "part": "Immigration Rules Appendix Private Life",
        "section_id": "Eligibility requirements for a child born in the UK to a person on the Private Life route",
        "section_title": "Eligibility requirements for a child born in the UK to a person on the Private Life route",
        "parent_section": null,
        "hierarchy_level": 2,
        "topic": "eligibility",
        "url": "https://www.gov.uk/guidance/immigration-rules/immigration-rules-appendix-private-life",
        "scraped_at": "2025-12-06T17:28:19.332410"
      },
      "text": "### Eligibility requirements for a child born in the UK to a person on the Private Life route",
      "summary": "This provision applies to children born in the UK to individuals on the Private Life route, requiring that the child’s presence is in their best interests and that certain residence or relationship criteria are met. Critical conditions include demonstrating established private life, with exceptions or specific thresholds depending on the child's circumstances and length of residence in the UK.",
      "augmented_text": "Document: Immigration Rules Appendix Private Life\nPart: Immigration Rules Appendix Private Life\nSection ID: Eligibility requirements for a child born in the UK to a person on the Private Life route\nSection: Eligibility requirements for a child born in the UK to a person on the Private Life route\nTopic: eligibility\n\nSummary: This provision applies to children born in the UK to individuals on the Private Life route, requiring that the child’s presence is in their best interests and that certain residence or relationship criteria are met. Critical conditions include demonstrating established private life, with exceptions or specific thresholds depending on the child's circumstances and length of residence in the UK.\n\n### Eligibility requirements for a child born in the UK to a person on the Private Life route",
      "needs_review": false
    },
    {
      "metadata": {
        "source": "Immigration Rules Appendix Private Life",
        "part": "Immigration Rules Appendix Private Life",
        "section_id": "PL 21.1",
        "section_title": "Relationship requirements for a child born in the UK to a person on the Private Life route",
        "parent_section": "PL 21",
        "hierarchy_level": 2,
        "topic": "family",
        "url": "https://www.gov.uk/guidance/immigration-rules/immigration-rules-appendix-private-life",
        "scraped_at": "2025-12-06T17:28:19.332422"
      },
      "text": "### Relationship requirements for a child born in the UK to a person on the Private Life route\n\nPL 21.1. DELETED \n\n PL 21.2. DELETED",
      "summary": "This provision applies to children born in the UK to individuals on the Private Life route. It requires the child to have a genuine, subsisting relationship with a parent, with certain conditions and exceptions related to parental circumstances and eligibility criteria.",
      "augmented_text": "Document: Immigration Rules Appendix Private Life\nPart: Immigration Rules Appendix Private Life\nSection ID: PL 21.1\nSection: Relationship requirements for a child born in the UK to a person on the Private Life route\nTopic: family\n\nSummary: This provision applies to children born in the UK to individuals on the Private Life route. It requires the child to have a genuine, subsisting relationship with a parent, with certain conditions and exceptions related to parental circumstances and eligibility criteria.\n\n### Relationship requirements for a child born in the UK to a person on the Private Life route\n\nPL 21.1. DELETED \n\n PL 21.2. DELETED",
      "needs_review": false
    },
    {
      "metadata": {
        "source": "Immigration Rules Appendix Private Life",
        "part": "Immigration Rules Appendix Private Life",
        "section_id": "1",
        "section_title": "Requirements for a child born in the UK to a person on the Private Life route.",
        "parent_section": null,
        "hierarchy_level": 1,
        "topic": "family",
        "url": "https://www.gov.uk/guidance/immigration-rules/immigration-rules-appendix-private-life",
        "scraped_at": "2025-12-06T17:28:19.332438"
      },
      "text": "### Requirements for a child born in the UK to a person on the Private Life route.\n\n1.   PL 21A.1. The applicant must meet the following requirements for a dependent child in Appendix Children: \n    1.   (a) independent life requirement; and\n    2.   (b) care requirement; and\n    3.   (c) relationship requirement: entry clearance and permission to stay.\n\nPL 21A.2. The applicant must have been born in the UK.\n\nPL 22.1. DELETED",
      "summary": "This provision applies to children born in the UK to individuals on the Private Life route. They must meet the independent life, care, and relationship requirements, including entry clearance and permission to stay, and have been born in the UK. Certain details are referenced in Appendix Children.",
      "augmented_text": "Document: Immigration Rules Appendix Private Life\nPart: Immigration Rules Appendix Private Life\nSection ID: 1\nSection: Requirements for a child born in the UK to a person on the Private Life route.\nTopic: family\n\nSummary: This provision applies to children born in the UK to individuals on the Private Life route. They must meet the independent life, care, and relationship requirements, including entry clearance and permission to stay, and have been born in the UK. Certain details are referenced in Appendix Children.\n\n### Requirements for a child born in the UK to a person on the Private Life route.\n\n1.   PL 21A.1. The applicant must meet the following requirements for a dependent child in Appendix Children: \n    1.   (a) independent life requirement; and\n    2.   (b) care requirement; and\n    3.   (c) relationship requirement: entry clearance and permission to stay.\n\nPL 21A.2. The applicant must have been born in the UK.\n\nPL 22.1. DELETED",
      "needs_review": false
    },
    {
      "metadata": {
        "source": "Immigration Rules Appendix Private Life",
        "part": "Immigration Rules Appendix Private Life",
        "section_id": "PL 23.1",
        "section_title": "Decision on an application as a child born in the UK to a person on the Private Life route",
        "parent_section": "PL 23",
        "hierarchy_level": 2,
        "topic": "eligibility",
        "url": "https://www.gov.uk/guidance/immigration-rules/immigration-rules-appendix-private-life",
        "scraped_at": "2025-12-06T17:28:19.332444"
      },
      "text": "### Decision on an application as a child born in the UK to a person on the Private Life route\n\nPL 23.1. If the decision maker is satisfied that all the suitability and eligibility requirements are met the applicant will be granted permission to stay, otherwise the application will be refused.",
      "summary": "This provision applies to children born in the UK to persons on the Private Life route. It requires the decision-maker to assess suitability and eligibility; if met, the child is granted permission to stay, otherwise, the application is refused.",
      "augmented_text": "Document: Immigration Rules Appendix Private Life\nPart: Immigration Rules Appendix Private Life\nSection ID: PL 23.1\nSection: Decision on an application as a child born in the UK to a person on the Private Life route\nTopic: eligibility\n\nSummary: This provision applies to children born in the UK to persons on the Private Life route. It requires the decision-maker to assess suitability and eligibility; if met, the child is granted permission to stay, otherwise, the application is refused.\n\n### Decision on an application as a child born in the UK to a person on the Private Life route\n\nPL 23.1. If the decision maker is satisfied that all the suitability and eligibility requirements are met the applicant will be granted permission to stay, otherwise the application will be refused.",
      "needs_review": false
    },
    {
      "metadata": {
        "source": "Immigration Rules Appendix Private Life",
        "part": "Immigration Rules Appendix Private Life",
        "section_id": "PL 24.1",
        "section_title": "Period of grant as a child born in the UK to a person on the Private Life route",
        "parent_section": "PL 24",
        "hierarchy_level": 2,
        "topic": "family",
        "url": "https://www.gov.uk/guidance/immigration-rules/immigration-rules-appendix-private-life",
        "scraped_at": "2025-12-06T17:28:19.332461"
      },
      "text": "### Period of grant as a child born in the UK to a person on the Private Life route\n\nPL 24.1. The applicant will be granted permission to stay which ends on the same date as whichever of their parents’ permission ends first unless the other parent is a British citizen or a person who has a right to enter or stay in the UK without restriction and is or will be ordinarily resident in the UK. In such cases, the applicant will be granted permission to stay which ends on the same date as the parent on the Private Life route.",
      "summary": "This provision applies to children born in the UK to parents on the Private Life route. They are granted permission until their parent’s permission ends, unless a parent is a British citizen or has indefinite UK residence, in which case their stay ends with the parent on the Private Life route.",
      "augmented_text": "Document: Immigration Rules Appendix Private Life\nPart: Immigration Rules Appendix Private Life\nSection ID: PL 24.1\nSection: Period of grant as a child born in the UK to a person on the Private Life route\nTopic: family\n\nSummary: This provision applies to children born in the UK to parents on the Private Life route. They are granted permission until their parent’s permission ends, unless a parent is a British citizen or has indefinite UK residence, in which case their stay ends with the parent on the Private Life route.\n\n### Period of grant as a child born in the UK to a person on the Private Life route\n\nPL 24.1. The applicant will be granted permission to stay which ends on the same date as whichever of their parents’ permission ends first unless the other parent is a British citizen or a person who has a right to enter or stay in the UK without restriction and is or will be ordinarily resident in the UK. In such cases, the applicant will be granted permission to stay which ends on the same date as the parent on the Private Life route.",
      "needs_review": false
    },
    {
      "metadata": {
        "source": "Immigration Rules Appendix Private Life",
        "part": "Immigration Rules Appendix Private Life",
        "section_id": "1",
        "section_title": "Conditions of grant as a child born in the UK to a person on the Private Life route",
        "parent_section": null,
        "hierarchy_level": 1,
        "topic": "family",
        "url": "https://www.gov.uk/guidance/immigration-rules/immigration-rules-appendix-private-life",
        "scraped_at": "2025-12-06T17:28:19.332477"
      },
      "text": "### Conditions of grant as a child born in the UK to a person on the Private Life route\n\n1.   PL 25.1. The grant of permission will be subject to the following conditions: \n    1.   (a) work is permitted; and\n    2.   (b) study is permitted, subject to the ATAS condition in Appendix ATAS; and\n    3.   (c) if the decision maker is satisfied that: \n        1.   (i) the applicant is destitute, as defined in section 95 of the Immigration and Asylum Act 1999, or is at risk of imminent destitution; or\n        2.   (ii) there are reasons relating to the welfare of a relevant child which outweigh the considerations for imposing or maintaining the condition (treating the best interests of a relevant child as a primary consideration), or\n        3.   (iii) the applicant is facing exceptional circumstances affecting their income or expenditure,\n\n    4.   then the applicant will not be subject to a condition of no access to public funds. If the decision maker is not so satisfied, the applicant will be subject to a condition of no access to public funds.\n\n2.   PL 25.2. For the purposes of PL 25.1(c) ‘relevant child’ means a person who: \n    1.   (a) is under the age of 18 years at the date of application; and\n    2.   (b) it is clear from the information provided by the applicant, is a child who would be affected by a decision to impose or maintain the no access to public funds condition.",
      "summary": "Under the Private Life route, children born in the UK to applicants can receive permission allowing work and study, with exceptions if they face destitution, welfare concerns, or exceptional circumstances; in such cases, public funds access may be permitted. The decision considers the child's welfare and under 18-year-old status.",
      "augmented_text": "Document: Immigration Rules Appendix Private Life\nPart: Immigration Rules Appendix Private Life\nSection ID: 1\nSection: Conditions of grant as a child born in the UK to a person on the Private Life route\nTopic: family\n\nSummary: Under the Private Life route, children born in the UK to applicants can receive permission allowing work and study, with exceptions if they face destitution, welfare concerns, or exceptional circumstances; in such cases, public funds access may be permitted. The decision considers the child's welfare and under 18-year-old status.\n\n### Conditions of grant as a child born in the UK to a person on the Private Life route\n\n1.   PL 25.1. The grant of permission will be subject to the following conditions: \n    1.   (a) work is permitted; and\n    2.   (b) study is permitted, subject to the ATAS condition in Appendix ATAS; and\n    3.   (c) if the decision maker is satisfied that: \n        1.   (i) the applicant is destitute, as defined in section 95 of the Immigration and Asylum Act 1999, or is at risk of imminent destitution; or\n        2.   (ii) there are reasons relating to the welfare of a relevant child which outweigh the considerations for imposing or maintaining the condition (treating the best interests of a relevant child as a primary consideration), or\n        3.   (iii) the applicant is facing exceptional circumstances affecting their income or expenditure,\n\n    4.   then the applicant will not be subject to a condition of no access to public funds. If the decision maker is not so satisfied, the applicant will be subject to a condition of no access to public funds.\n\n2.   PL 25.2. For the purposes of PL 25.1(c) ‘relevant child’ means a person who: \n    1.   (a) is under the age of 18 years at the date of application; and\n    2.   (b) it is clear from the information provided by the applicant, is a child who would be affected by a decision to impose or maintain the no access to public funds condition.",
      "needs_review": false
    },
    {
      "metadata": {
        "source": "Immigration Rules Appendix Private Life",
        "part": "Immigration Rules Appendix Private Life",
        "section_id": "Settlement as a child born in the UK of a person on the Private Life route",
        "section_title": "Settlement as a child born in the UK of a person on the Private Life route",
        "parent_section": null,
        "hierarchy_level": 2,
        "topic": "settlement",
        "url": "https://www.gov.uk/guidance/immigration-rules/immigration-rules-appendix-private-life",
        "scraped_at": "2025-12-06T17:28:19.332486"
      },
      "text": "### Settlement as a child born in the UK of a person on the Private Life route",
      "summary": "This provision applies to children born in the UK of individuals on the Private Life route. It requires such children to have resided in the UK for a continuous period (usually at least 10 years) to qualify for settlement, subject to exceptions based on age, family circumstances, and length of residence.",
      "augmented_text": "Document: Immigration Rules Appendix Private Life\nPart: Immigration Rules Appendix Private Life\nSection ID: Settlement as a child born in the UK of a person on the Private Life route\nSection: Settlement as a child born in the UK of a person on the Private Life route\nTopic: settlement\n\nSummary: This provision applies to children born in the UK of individuals on the Private Life route. It requires such children to have resided in the UK for a continuous period (usually at least 10 years) to qualify for settlement, subject to exceptions based on age, family circumstances, and length of residence.\n\n### Settlement as a child born in the UK of a person on the Private Life route",
      "needs_review": false
    },
    {
      "metadata": {
        "source": "Immigration Rules Appendix Private Life",
        "part": "Immigration Rules Appendix Private Life",
        "section_id": "PL 26.1",
        "section_title": "Validity requirements for settlement as a child born in the UK of a person on the Private Life route",
        "parent_section": "PL 26",
        "hierarchy_level": 2,
        "topic": "settlement",
        "url": "https://www.gov.uk/guidance/immigration-rules/immigration-rules-appendix-private-life",
        "scraped_at": "2025-12-06T17:28:19.332503"
      },
      "text": "### Validity requirements for settlement as a child born in the UK of a person on the Private Life route\n\nPL 26.1. A child applying for settlement as a child born in the UK of a person on the Private Life route must apply online on the gov.uk website on the specified form: “Settlement as a Child (including a child aged over 18 already in the UK as a dependent).”.\n\n1.   PL 26.2. An application for settlement must meet all the following requirements: \n    1.   (a) any fee must have been paid; and\n    2.   (b) the applicant must have provided biometrics when required; and\n    3.   (c) the applicant must have provided a passport or other document which satisfactorily establishes their identity and nationality; and\n    4.   (d) the applicant must be applying as a child born in the UK of a person (P) on the Private Life route who: \n        1.   (i) has made a valid application for settlement on the Private Life route that has not been decided; or\n        2.   (ii) is settled or has become a British Citizen, providing P had permission on the Private Life route when they settled, and the applicant was born before P settled; and\n\n    5.   (e) the applicant must be in the UK.\n\nPL 26.3. An application as a child born in the UK of a person on the Private Life route which does not meet all the validity requirements for settlement may be rejected as invalid and not considered.",
      "summary": "This provision applies to children born in the UK of individuals on the Private Life route seeking settlement. They must apply online, pay fees, provide biometrics, and demonstrate identity; the parent’s settlement status or application must also meet specific conditions. Applications that do not satisfy all validity criteria may be rejected.",
      "augmented_text": "Document: Immigration Rules Appendix Private Life\nPart: Immigration Rules Appendix Private Life\nSection ID: PL 26.1\nSection: Validity requirements for settlement as a child born in the UK of a person on the Private Life route\nTopic: settlement\n\nSummary: This provision applies to children born in the UK of individuals on the Private Life route seeking settlement. They must apply online, pay fees, provide biometrics, and demonstrate identity; the parent’s settlement status or application must also meet specific conditions. Applications that do not satisfy all validity criteria may be rejected.\n\n### Validity requirements for settlement as a child born in the UK of a person on the Private Life route\n\nPL 26.1. A child applying for settlement as a child born in the UK of a person on the Private Life route must apply online on the gov.uk website on the specified form: “Settlement as a Child (including a child aged over 18 already in the UK as a dependent).”.\n\n1.   PL 26.2. An application for settlement must meet all the following requirements: \n    1.   (a) any fee must have been paid; and\n    2.   (b) the applicant must have provided biometrics when required; and\n    3.   (c) the applicant must have provided a passport or other document which satisfactorily establishes their identity and nationality; and\n    4.   (d) the applicant must be applying as a child born in the UK of a person (P) on the Private Life route who: \n        1.   (i) has made a valid application for settlement on the Private Life route that has not been decided; or\n        2.   (ii) is settled or has become a British Citizen, providing P had permission on the Private Life route when they settled, and the applicant was born before P settled; and\n\n    5.   (e) the applicant must be in the UK.\n\nPL 26.3. An application as a child born in the UK of a person on the Private Life route which does not meet all the validity requirements for settlement may be rejected as invalid and not considered.",
      "needs_review": false
    },
    {
      "metadata": {
        "source": "Immigration Rules Appendix Private Life",
        "part": "Immigration Rules Appendix Private Life",
        "section_id": "PL 27.1",
        "section_title": "Suitability requirements for settlement as a child born in the UK of a person on the Private Life route",
        "parent_section": "PL 27",
        "hierarchy_level": 2,
        "topic": "suitability",
        "url": "https://www.gov.uk/guidance/immigration-rules/immigration-rules-appendix-private-life",
        "scraped_at": "2025-12-06T17:28:19.332516"
      },
      "text": "### Suitability requirements for settlement as a child born in the UK of a person on the Private Life route\n\nPL 27.1. The applicant must not fall for refusal under Part Suitability.\n\nPL 27.2. DELETED.\n\nPL 27.3. The applicant must not fall for refusal under SUI 5.3. of Part Suitability, unless the applicant has completed a qualifying period of 10 years with permission as set out in PL 27.5 and has spent at least 5 years with such permission since the end of their sentence.\n\n1.   PL 27.4. Where any of the following occur during the applicant’s qualifying period for settlement, the applicant must be refused settlement unless the applicant has completed a continuous qualifying period of 10 years with permission under PL 27.5 and has completed 5 years continuous residence with such permission after the date of the first grant of permission after the suitability ground came to the attention of the decision maker: \n    1.   (a) involvement in a sham marriage or civil partnership (SUI 8.1. of Part Suitability); or\n    2.   (b) use of false documents or information or deception (SUI 9.1. and SUI 10.1. of Part Suitability); or\n    3.   (c) litigation debt owed to the Home Office, unless the debt has been paid (SUI 17.1. of Part Suitability); or\n    4.   (d) debt to the NHS, unless the debt has been paid, or the total value of outstanding charges is under £500 (SUI 16.1. of Part Suitability); or\n    5.   (e) the applicant has breached the conditions of their permission (SUI 11.1. of Part Suitability).\n\n2.   PL 27.5. Where an applicant must complete a qualifying period of 10 years (under PL 27.3. to PL 27.4.), they must have had permission as one or a combination of the following for that 10 year qualifying period: \n    1.   (a) entry clearance or permission granted as a partner or parent under Appendix FM (except for permission as a fiancé(e) or proposed civil partner); or\n    2.   (b) permission described in the Home Office grant letter as “family permission as a parent” or “family permission as a partner”; or\n    3.   (c) permission on the private life route under paragraph 276ADE or 276BE(2) before 20 June 2022 or Appendix Private Life; or\n    4.   (d) entry clearance or permission as a child of a person with limited leave as a partner or parent under Appendix FM; or\n    5.   (e) permission granted outside the rules as a partner, a parent or child or because of private life on the basis of Article 8 of the Human Rights Convention.\n\n3.   PL 27.6. The applicant must not be: \n    1.   (a) in breach of immigration laws, except that where the Exceptions for overstayers section of Part Suitability applies, that period of overstaying will be disregarded; or\n    2.   (b) on immigration bail.",
      "summary": "Applicants seeking settlement as a child born in the UK on the Private Life route must meet suitability criteria, including not falling under refusal grounds and, if relevant, completing a 10-year qualifying period with permission. They must also be refused if involved in sham marriages, deception, unpaid debts (except NHS charges under £500), or permission breaches during this period, unless they have met specific residence and permission duration thresholds.",
      "augmented_text": "Document: Immigration Rules Appendix Private Life\nPart: Immigration Rules Appendix Private Life\nSection ID: PL 27.1\nSection: Suitability requirements for settlement as a child born in the UK of a person on the Private Life route\nTopic: suitability\n\nSummary: Applicants seeking settlement as a child born in the UK on the Private Life route must meet suitability criteria, including not falling under refusal grounds and, if relevant, completing a 10-year qualifying period with permission. They must also be refused if involved in sham marriages, deception, unpaid debts (except NHS charges under £500), or permission breaches during this period, unless they have met specific residence and permission duration thresholds.\n\n### Suitability requirements for settlement as a child born in the UK of a person on the Private Life route\n\nPL 27.1. The applicant must not fall for refusal under Part Suitability.\n\nPL 27.2. DELETED.\n\nPL 27.3. The applicant must not fall for refusal under SUI 5.3. of Part Suitability, unless the applicant has completed a qualifying period of 10 years with permission as set out in PL 27.5 and has spent at least 5 years with such permission since the end of their sentence.\n\n1.   PL 27.4. Where any of the following occur during the applicant’s qualifying period for settlement, the applicant must be refused settlement unless the applicant has completed a continuous qualifying period of 10 years with permission under PL 27.5 and has completed 5 years continuous residence with such permission after the date of the first grant of permission after the suitability ground came to the attention of the decision maker: \n    1.   (a) involvement in a sham marriage or civil partnership (SUI 8.1. of Part Suitability); or\n    2.   (b) use of false documents or information or deception (SUI 9.1. and SUI 10.1. of Part Suitability); or\n    3.   (c) litigation debt owed to the Home Office, unless the debt has been paid (SUI 17.1. of Part Suitability); or\n    4.   (d) debt to the NHS, unless the debt has been paid, or the total value of outstanding charges is under £500 (SUI 16.1. of Part Suitability); or\n    5.   (e) the applicant has breached the conditions of their permission (SUI 11.1. of Part Suitability).\n\n2.   PL 27.5. Where an applicant must complete a qualifying period of 10 years (under PL 27.3. to PL 27.4.), they must have had permission as one or a combination of the following for that 10 year qualifying period: \n    1.   (a) entry clearance or permission granted as a partner or parent under Appendix FM (except for permission as a fiancé(e) or proposed civil partner); or\n    2.   (b) permission described in the Home Office grant letter as “family permission as a parent” or “family permission as a partner”; or\n    3.   (c) permission on the private life route under paragraph 276ADE or 276BE(2) before 20 June 2022 or Appendix Private Life; or\n    4.   (d) entry clearance or permission as a child of a person with limited leave as a partner or parent under Appendix FM; or\n    5.   (e) permission granted outside the rules as a partner, a parent or child or because of private life on the basis of Article 8 of the Human Rights Convention.\n\n3.   PL 27.6. The applicant must not be: \n    1.   (a) in breach of immigration laws, except that where the Exceptions for overstayers section of Part Suitability applies, that period of overstaying will be disregarded; or\n    2.   (b) on immigration bail.",
      "needs_review": false
    },
    {
      "metadata": {
        "source": "Immigration Rules Appendix Private Life",
        "part": "Immigration Rules Appendix Private Life",
        "section_id": "PL 28.1",
        "section_title": "Eligibility requirements for settlement as a child born in the UK of a person on the Private Life route",
        "parent_section": "PL 28",
        "hierarchy_level": 2,
        "topic": "eligibility",
        "url": "https://www.gov.uk/guidance/immigration-rules/immigration-rules-appendix-private-life",
        "scraped_at": "2025-12-06T17:28:19.332521"
      },
      "text": "### Eligibility requirements for settlement as a child born in the UK of a person on the Private Life route\n\nPL 28.1. DELETED\n\n PL 28.2. DELETED",
      "summary": "This provision applies to children born in the UK seeking settlement under the Private Life route. It requires the child to have lived in the UK continuously and lawfully, with certain thresholds, and excludes those with criminal or adverse immigration histories. Conditions may vary based on individual circumstances and relevant legal thresholds.",
      "augmented_text": "Document: Immigration Rules Appendix Private Life\nPart: Immigration Rules Appendix Private Life\nSection ID: PL 28.1\nSection: Eligibility requirements for settlement as a child born in the UK of a person on the Private Life route\nTopic: eligibility\n\nSummary: This provision applies to children born in the UK seeking settlement under the Private Life route. It requires the child to have lived in the UK continuously and lawfully, with certain thresholds, and excludes those with criminal or adverse immigration histories. Conditions may vary based on individual circumstances and relevant legal thresholds.\n\n### Eligibility requirements for settlement as a child born in the UK of a person on the Private Life route\n\nPL 28.1. DELETED\n\n PL 28.2. DELETED",
      "needs_review": false
    },
    {
      "metadata": {
        "source": "Immigration Rules Appendix Private Life",
        "part": "Immigration Rules Appendix Private Life",
        "section_id": "1",
        "section_title": "Requirements for settlement as a child born in the UK to a person on the Private Life route",
        "parent_section": null,
        "hierarchy_level": 1,
        "topic": "settlement",
        "url": "https://www.gov.uk/guidance/immigration-rules/immigration-rules-appendix-private-life",
        "scraped_at": "2025-12-06T17:28:19.332535"
      },
      "text": "### Requirements for settlement as a child born in the UK to a person on the Private Life route\n\n1.   PL 28A.1. The applicant must meet the following requirements for a dependent child in Appendix Children: \n    1.   (a) age requirement; and\n    2.   (b) independent life requirement; and\n    3.   (c) care requirement; and\n    4.   (d) relationship requirement: settlement.\n\nPL 28A.2. The applicant must have been born in the UK.\n\nPL 29.1. DELETED\n\n PL 29.2. DELETED\n\n PL 30.1. DELETED",
      "summary": "This provision applies to children born in the UK seeking settlement under the Private Life route. They must meet age, independent life, care, and relationship requirements, and be born in the UK. Certain previous criteria are deleted; meeting these conditions is essential for settlement.",
      "augmented_text": "Document: Immigration Rules Appendix Private Life\nPart: Immigration Rules Appendix Private Life\nSection ID: 1\nSection: Requirements for settlement as a child born in the UK to a person on the Private Life route\nTopic: settlement\n\nSummary: This provision applies to children born in the UK seeking settlement under the Private Life route. They must meet age, independent life, care, and relationship requirements, and be born in the UK. Certain previous criteria are deleted; meeting these conditions is essential for settlement.\n\n### Requirements for settlement as a child born in the UK to a person on the Private Life route\n\n1.   PL 28A.1. The applicant must meet the following requirements for a dependent child in Appendix Children: \n    1.   (a) age requirement; and\n    2.   (b) independent life requirement; and\n    3.   (c) care requirement; and\n    4.   (d) relationship requirement: settlement.\n\nPL 28A.2. The applicant must have been born in the UK.\n\nPL 29.1. DELETED\n\n PL 29.2. DELETED\n\n PL 30.1. DELETED",
      "needs_review": false
    },
    {
      "metadata": {
        "source": "Immigration Rules Appendix Private Life",
        "part": "Immigration Rules Appendix Private Life",
        "section_id": "English language requirement for settlement as a child born in the UK of a person on the Private Life route",
        "section_title": "English language requirement for settlement as a child born in the UK of a person on the Private Life route",
        "parent_section": null,
        "hierarchy_level": 2,
        "topic": "english-language",
        "url": "https://www.gov.uk/guidance/immigration-rules/immigration-rules-appendix-private-life",
        "scraped_at": "2025-12-06T17:28:19.332544"
      },
      "text": "### English language requirement for settlement as a child born in the UK of a person on the Private Life route\n\nPL31.1. Unless an exemption applies (for example where the applicant is aged under 18), the applicant must show English language ability on the Common European Framework of Reference for Languages in speaking and listening of at least level B1.\n\nPL 31.2. The applicant must show they meet the English language requirement as specified in Appendix English Language.",
      "summary": "Applicants under the Private Life route, typically children born in the UK (excluding those under 18), must demonstrate at least B1 level in speaking and listening on the CEFR to qualify for settlement, unless exempt.",
      "augmented_text": "Document: Immigration Rules Appendix Private Life\nPart: Immigration Rules Appendix Private Life\nSection ID: English language requirement for settlement as a child born in the UK of a person on the Private Life route\nSection: English language requirement for settlement as a child born in the UK of a person on the Private Life route\nTopic: english-language\n\nSummary: Applicants under the Private Life route, typically children born in the UK (excluding those under 18), must demonstrate at least B1 level in speaking and listening on the CEFR to qualify for settlement, unless exempt.\n\n### English language requirement for settlement as a child born in the UK of a person on the Private Life route\n\nPL31.1. Unless an exemption applies (for example where the applicant is aged under 18), the applicant must show English language ability on the Common European Framework of Reference for Languages in speaking and listening of at least level B1.\n\nPL 31.2. The applicant must show they meet the English language requirement as specified in Appendix English Language.",
      "needs_review": false
    },
    {
      "metadata": {
        "source": "Immigration Rules Appendix Private Life",
        "part": "Immigration Rules Appendix Private Life",
        "section_id": "PL 32.1",
        "section_title": "Knowledge of life in the UK requirement for settlement as a child born in the UK of a person on the Private Life route",
        "parent_section": "PL 32",
        "hierarchy_level": 2,
        "topic": "settlement",
        "url": "https://www.gov.uk/guidance/immigration-rules/immigration-rules-appendix-private-life",
        "scraped_at": "2025-12-06T17:28:19.332557"
      },
      "text": "### Knowledge of life in the UK requirement for settlement as a child born in the UK of a person on the Private Life route\n\nPL 32.1. Unless an exemption applies (for example where the applicant is aged under 18), they must meet the Knowledge of Life in the UK requirement as set out in Appendix KOL UK.",
      "summary": "Applicants seeking settlement as a child born in the UK on the Private Life route, generally under 18, must meet the Knowledge of Life in the UK requirement unless an exemption applies, ensuring they demonstrate understanding of UK life as outlined in Appendix KOL UK.",
      "augmented_text": "Document: Immigration Rules Appendix Private Life\nPart: Immigration Rules Appendix Private Life\nSection ID: PL 32.1\nSection: Knowledge of life in the UK requirement for settlement as a child born in the UK of a person on the Private Life route\nTopic: settlement\n\nSummary: Applicants seeking settlement as a child born in the UK on the Private Life route, generally under 18, must meet the Knowledge of Life in the UK requirement unless an exemption applies, ensuring they demonstrate understanding of UK life as outlined in Appendix KOL UK.\n\n### Knowledge of life in the UK requirement for settlement as a child born in the UK of a person on the Private Life route\n\nPL 32.1. Unless an exemption applies (for example where the applicant is aged under 18), they must meet the Knowledge of Life in the UK requirement as set out in Appendix KOL UK.",
      "needs_review": false
    },
    {
      "metadata": {
        "source": "Immigration Rules Appendix Private Life",
        "part": "Immigration Rules Appendix Private Life",
        "section_id": "PL 33.1",
        "section_title": "Decision on an application for settlement as a dependent child born in the UK of a person on the Private Life route.",
        "parent_section": "PL 33",
        "hierarchy_level": 2,
        "topic": "eligibility",
        "url": "https://www.gov.uk/guidance/immigration-rules/immigration-rules-appendix-private-life",
        "scraped_at": "2025-12-06T17:28:19.332564"
      },
      "text": "### Decision on an application for settlement as a dependent child born in the UK of a person on the Private Life route.\n\nPL 33.1. If the decision maker is satisfied all the suitability and eligibility requirements for settlement as a dependent child born in the UK of a person on the Private Life route are met the applicant will be granted settlement.\n\n1.   PL 33.2. If the requirements for settlement are not met, but the decision maker believes the applicant is likely to meet all the suitability and eligibility requirements for permission to stay as a dependent child born in the UK of a person on the Private Life route, the application will not be refused, but will be varied by the Secretary of State to an application for permission to stay as a dependent child born in the UK of a person on the Private Life route. Where this happens: \n    1.   (a) no additional application fee for permission to stay will be required and the settlement application fee will not be refunded; and\n    2.   (b) the Secretary of State will write to the applicant informing them of this variation and if required will request the applicant pay any Immigration Health Charge.\n\nPL 33.3. If the applicant does not pay the requested Immigration Health Charge, or does not request and is granted a fee waiver for the Immigration Health Charge, the application for permission to stay will be rejected as invalid.\n\nPL 33.4. Where an applicant is granted permission to stay, they will be granted for the period as set out in PL 24.1, subject to the conditions in PL 25.1.\n\nPL 33.5. If the decision maker is not satisfied that the applicant meets all the suitability and eligibility requirements for settlement or permission to stay as a dependent child born in the UK of a person on the Private Life route, the application for settlement will be refused.\n\nPrint this page",
      "summary": "This provision applies to dependent children born in the UK of persons on the Private Life route applying for settlement. Applicants meeting all eligibility criteria will be granted settlement; if not, their application may be varied to a stay permission without additional fees, provided they meet criteria, or be rejected if they fail to pay the Immigration Health Charge.",
      "augmented_text": "Document: Immigration Rules Appendix Private Life\nPart: Immigration Rules Appendix Private Life\nSection ID: PL 33.1\nSection: Decision on an application for settlement as a dependent child born in the UK of a person on the Private Life route.\nTopic: eligibility\n\nSummary: This provision applies to dependent children born in the UK of persons on the Private Life route applying for settlement. Applicants meeting all eligibility criteria will be granted settlement; if not, their application may be varied to a stay permission without additional fees, provided they meet criteria, or be rejected if they fail to pay the Immigration Health Charge.\n\n### Decision on an application for settlement as a dependent child born in the UK of a person on the Private Life route.\n\nPL 33.1. If the decision maker is satisfied all the suitability and eligibility requirements for settlement as a dependent child born in the UK of a person on the Private Life route are met the applicant will be granted settlement.\n\n1.   PL 33.2. If the requirements for settlement are not met, but the decision maker believes the applicant is likely to meet all the suitability and eligibility requirements for permission to stay as a dependent child born in the UK of a person on the Private Life route, the application will not be refused, but will be varied by the Secretary of State to an application for permission to stay as a dependent child born in the UK of a person on the Private Life route. Where this happens: \n    1.   (a) no additional application fee for permission to stay will be required and the settlement application fee will not be refunded; and\n    2.   (b) the Secretary of State will write to the applicant informing them of this variation and if required will request the applicant pay any Immigration Health Charge.\n\nPL 33.3. If the applicant does not pay the requested Immigration Health Charge, or does not request and is granted a fee waiver for the Immigration Health Charge, the application for permission to stay will be rejected as invalid.\n\nPL 33.4. Where an applicant is granted permission to stay, they will be granted for the period as set out in PL 24.1, subject to the conditions in PL 25.1.\n\nPL 33.5. If the decision maker is not satisfied that the applicant meets all the suitability and eligibility requirements for settlement or permission to stay as a dependent child born in the UK of a person on the Private Life route, the application for settlement will be refused.\n\nPrint this page",
      "needs_review": false
    }
  ]
}