{
  "url": "https://www.gov.uk/guidance/immigration-rules/immigration-rules-appendix-short-term-student-english-language",
  "part_name": "Immigration Rules Appendix Short-term Student (English language)",
  "scraped_at": "2025-12-06T17:28:48.507262",
  "chunk_count": 11,
  "chunks": [
    {
      "metadata": {
        "source": "Immigration Rules Appendix Short-term Student (English language)",
        "part": "Immigration Rules Appendix Short-term Student (English language)",
        "section_id": "STS 1.1",
        "section_title": "Validity requirements for a Short-term Student",
        "parent_section": "STS 1",
        "hierarchy_level": 2,
        "topic": "leave-to-enter",
        "url": "https://www.gov.uk/guidance/immigration-rules/immigration-rules-appendix-short-term-student-english-language",
        "scraped_at": "2025-12-06T17:28:48.506968"
      },
      "text": "### Validity requirements for a Short-term Student\n\nSTS 1.1. A person applying for entry clearance as a Short-term Student must apply online on the gov.uk website on the specified form “Short-term Student visa”.\n\n1.   STS 1.2. An application for entry clearance as a Short-term Student must meet all the following requirements: \n    1.   (a) any fee and Immigration Health Charge must have been paid; and\n\n2.   (b) the applicant must have provided biometrics when required; and \n    1.   (c) the applicant must have provided a passport or other travel document which satisfactorily establishes their identity and nationality; and\n    2.   (d) the applicant must be outside the UK.\n\nSTS 1.3. The applicant must be aged 16 or over on the date of application.\n\nSTS 1.4. An application which does not meet all the validity requirements for a Short-term Student may be rejected as invalid and not considered.",
      "summary": "Applicants aged 16 or over applying online for a Short-term Student visa must pay fees, provide biometrics, and submit a valid passport while outside the UK. Failure to meet all requirements can result in rejection of the application.",
      "augmented_text": "Document: Immigration Rules Appendix Short-term Student (English language)\nPart: Immigration Rules Appendix Short-term Student (English language)\nSection ID: STS 1.1\nSection: Validity requirements for a Short-term Student\nTopic: leave-to-enter\n\nSummary: Applicants aged 16 or over applying online for a Short-term Student visa must pay fees, provide biometrics, and submit a valid passport while outside the UK. Failure to meet all requirements can result in rejection of the application.\n\n### Validity requirements for a Short-term Student\n\nSTS 1.1. A person applying for entry clearance as a Short-term Student must apply online on the gov.uk website on the specified form “Short-term Student visa”.\n\n1.   STS 1.2. An application for entry clearance as a Short-term Student must meet all the following requirements: \n    1.   (a) any fee and Immigration Health Charge must have been paid; and\n\n2.   (b) the applicant must have provided biometrics when required; and \n    1.   (c) the applicant must have provided a passport or other travel document which satisfactorily establishes their identity and nationality; and\n    2.   (d) the applicant must be outside the UK.\n\nSTS 1.3. The applicant must be aged 16 or over on the date of application.\n\nSTS 1.4. An application which does not meet all the validity requirements for a Short-term Student may be rejected as invalid and not considered.",
      "needs_review": false
    },
    {
      "metadata": {
        "source": "Immigration Rules Appendix Short-term Student (English language)",
        "part": "Immigration Rules Appendix Short-term Student (English language)",
        "section_id": "STS 2.1",
        "section_title": "Suitability requirements for a Short-term Student",
        "parent_section": "STS 2",
        "hierarchy_level": 2,
        "topic": "suitability",
        "url": "https://www.gov.uk/guidance/immigration-rules/immigration-rules-appendix-short-term-student-english-language",
        "scraped_at": "2025-12-06T17:28:48.506998"
      },
      "text": "### Suitability requirements for a Short-term Student\n\nSTS 2.1. The applicant must not fall for refusal under Part Suitability.",
      "summary": "This provision applies to Short-term Student applicants. They must meet suitability requirements, ensuring they do not face refusal under Part Suitability, with no specified exceptions.",
      "augmented_text": "Document: Immigration Rules Appendix Short-term Student (English language)\nPart: Immigration Rules Appendix Short-term Student (English language)\nSection ID: STS 2.1\nSection: Suitability requirements for a Short-term Student\nTopic: suitability\n\nSummary: This provision applies to Short-term Student applicants. They must meet suitability requirements, ensuring they do not face refusal under Part Suitability, with no specified exceptions.\n\n### Suitability requirements for a Short-term Student\n\nSTS 2.1. The applicant must not fall for refusal under Part Suitability.",
      "needs_review": true,
      "review_reasons": [
        "generic_summary"
      ]
    },
    {
      "metadata": {
        "source": "Immigration Rules Appendix Short-term Student (English language)",
        "part": "Immigration Rules Appendix Short-term Student (English language)",
        "section_id": "Eligibility requirements for a Short-term Student",
        "section_title": "Eligibility requirements for a Short-term Student",
        "parent_section": null,
        "hierarchy_level": 2,
        "topic": "eligibility",
        "url": "https://www.gov.uk/guidance/immigration-rules/immigration-rules-appendix-short-term-student-english-language",
        "scraped_at": "2025-12-06T17:28:48.507010"
      },
      "text": "### Eligibility requirements for a Short-term Student",
      "summary": "This provision applies to prospective Short-term Students (English language) seeking temporary entry. They must demonstrate genuine intent to study for up to six months and meet English language proficiency requirements. No exceptions are specified beyond standard eligibility criteria.",
      "augmented_text": "Document: Immigration Rules Appendix Short-term Student (English language)\nPart: Immigration Rules Appendix Short-term Student (English language)\nSection ID: Eligibility requirements for a Short-term Student\nSection: Eligibility requirements for a Short-term Student\nTopic: eligibility\n\nSummary: This provision applies to prospective Short-term Students (English language) seeking temporary entry. They must demonstrate genuine intent to study for up to six months and meet English language proficiency requirements. No exceptions are specified beyond standard eligibility criteria.\n\n### Eligibility requirements for a Short-term Student",
      "needs_review": false
    },
    {
      "metadata": {
        "source": "Immigration Rules Appendix Short-term Student (English language)",
        "part": "Immigration Rules Appendix Short-term Student (English language)",
        "section_id": "STS 3.1",
        "section_title": "Entry requirements for a Short-term Student",
        "parent_section": "STS 3",
        "hierarchy_level": 2,
        "topic": "leave-to-enter",
        "url": "https://www.gov.uk/guidance/immigration-rules/immigration-rules-appendix-short-term-student-english-language",
        "scraped_at": "2025-12-06T17:28:48.507038"
      },
      "text": "### Entry requirements for a Short-term Student\n\nSTS 3.1. A person seeking to come to the UK as a Short-term Student must obtain entry clearance as a Short-term Student before they arrive in the UK.\n\nSTS 3.2. A person applying for entry clearance as a Short-term Student for more than 6 months must, if Appendix Tuberculosis applies, provide a valid medical certificate confirming that they have undergone screening for active pulmonary tuberculosis and that this tuberculosis is not present in them.",
      "summary": "Applicants seeking to enter the UK as Short-term Students must obtain entry clearance before arrival. For stays over 6 months, they must provide a TB screening certificate if applicable; otherwise, the requirement is waived.",
      "augmented_text": "Document: Immigration Rules Appendix Short-term Student (English language)\nPart: Immigration Rules Appendix Short-term Student (English language)\nSection ID: STS 3.1\nSection: Entry requirements for a Short-term Student\nTopic: leave-to-enter\n\nSummary: Applicants seeking to enter the UK as Short-term Students must obtain entry clearance before arrival. For stays over 6 months, they must provide a TB screening certificate if applicable; otherwise, the requirement is waived.\n\n### Entry requirements for a Short-term Student\n\nSTS 3.1. A person seeking to come to the UK as a Short-term Student must obtain entry clearance as a Short-term Student before they arrive in the UK.\n\nSTS 3.2. A person applying for entry clearance as a Short-term Student for more than 6 months must, if Appendix Tuberculosis applies, provide a valid medical certificate confirming that they have undergone screening for active pulmonary tuberculosis and that this tuberculosis is not present in them.",
      "needs_review": false
    },
    {
      "metadata": {
        "source": "Immigration Rules Appendix Short-term Student (English language)",
        "part": "Immigration Rules Appendix Short-term Student (English language)",
        "section_id": "STS 4.1",
        "section_title": "Course requirements for a Short-term Student",
        "parent_section": "STS 4",
        "hierarchy_level": 2,
        "topic": "sponsorship",
        "url": "https://www.gov.uk/guidance/immigration-rules/immigration-rules-appendix-short-term-student-english-language",
        "scraped_at": "2025-12-06T17:28:48.507072"
      },
      "text": "### Course requirements for a Short-term Student\n\nSTS 4.1. The course provider must be an accredited institution.\n\nSTS 4.2. The applicant must provide written evidence from the course provider that the applicant has been accepted onto an English language course (that does not include any other subject) that lasts at least 6 months and no longer than 11 months.",
      "summary": "This provision applies to Short-term Students undertaking English language courses. Applicants must submit evidence of acceptance to an accredited institution for a course lasting between 6 and 11 months. The course must solely focus on English language learning.",
      "augmented_text": "Document: Immigration Rules Appendix Short-term Student (English language)\nPart: Immigration Rules Appendix Short-term Student (English language)\nSection ID: STS 4.1\nSection: Course requirements for a Short-term Student\nTopic: sponsorship\n\nSummary: This provision applies to Short-term Students undertaking English language courses. Applicants must submit evidence of acceptance to an accredited institution for a course lasting between 6 and 11 months. The course must solely focus on English language learning.\n\n### Course requirements for a Short-term Student\n\nSTS 4.1. The course provider must be an accredited institution.\n\nSTS 4.2. The applicant must provide written evidence from the course provider that the applicant has been accepted onto an English language course (that does not include any other subject) that lasts at least 6 months and no longer than 11 months.",
      "needs_review": false
    },
    {
      "metadata": {
        "source": "Immigration Rules Appendix Short-term Student (English language)",
        "part": "Immigration Rules Appendix Short-term Student (English language)",
        "section_id": "1",
        "section_title": "Study requirement for a Short-term Student",
        "parent_section": null,
        "hierarchy_level": 1,
        "topic": "definitions",
        "url": "https://www.gov.uk/guidance/immigration-rules/immigration-rules-appendix-short-term-student-english-language",
        "scraped_at": "2025-12-06T17:28:48.507098"
      },
      "text": "### Study requirement for a Short-term Student\n\n1.   STS 5.1. The applicant must satisfy the decision maker that they are a genuine Short-term Student, which means they: \n    1.   (a) are genuinely seeking entry for the purpose of undertaking the course of study for which they have demonstrated they have been accepted onto in STS 4.2; and\n    2.   (b) will not study in the UK other than for the course of study for which they have demonstrated they have been accepted onto in STS 4.2; and\n    3.   (c) will not study at an academy or state-funded school; and\n    4.   (d) will leave the UK within 30 days of the end of their English language course, or at the end of 11 months, whichever is sooner; and\n    5.   (e) will not make the UK their main home; and\n    6.   (f) will not work in the UK; and\n    7.   (g) will not engage in any business or professional activities in the UK; and\n    8.   (h) have relied upon funds to meet the Financial Requirement in STS 6.1 to STS 6.4 which are genuinely available to them t for the purposes of undertaking the course of study for which they have demonstrated they have been accepted onto in STS 4.2.\n\nSTS 5.2. DELETED",
      "summary": "This provision applies to Short-term Student visa applicants undertaking English language courses. They must demonstrate they are genuinely seeking to study only their accepted course, intend to leave within 30 days (or 11 months), and will not work, study elsewhere, or make the UK their main home. Exceptions include restrictions on working and studying at state-funded schools.",
      "augmented_text": "Document: Immigration Rules Appendix Short-term Student (English language)\nPart: Immigration Rules Appendix Short-term Student (English language)\nSection ID: 1\nSection: Study requirement for a Short-term Student\nTopic: definitions\n\nSummary: This provision applies to Short-term Student visa applicants undertaking English language courses. They must demonstrate they are genuinely seeking to study only their accepted course, intend to leave within 30 days (or 11 months), and will not work, study elsewhere, or make the UK their main home. Exceptions include restrictions on working and studying at state-funded schools.\n\n### Study requirement for a Short-term Student\n\n1.   STS 5.1. The applicant must satisfy the decision maker that they are a genuine Short-term Student, which means they: \n    1.   (a) are genuinely seeking entry for the purpose of undertaking the course of study for which they have demonstrated they have been accepted onto in STS 4.2; and\n    2.   (b) will not study in the UK other than for the course of study for which they have demonstrated they have been accepted onto in STS 4.2; and\n    3.   (c) will not study at an academy or state-funded school; and\n    4.   (d) will leave the UK within 30 days of the end of their English language course, or at the end of 11 months, whichever is sooner; and\n    5.   (e) will not make the UK their main home; and\n    6.   (f) will not work in the UK; and\n    7.   (g) will not engage in any business or professional activities in the UK; and\n    8.   (h) have relied upon funds to meet the Financial Requirement in STS 6.1 to STS 6.4 which are genuinely available to them t for the purposes of undertaking the course of study for which they have demonstrated they have been accepted onto in STS 4.2.\n\nSTS 5.2. DELETED",
      "needs_review": false
    },
    {
      "metadata": {
        "source": "Immigration Rules Appendix Short-term Student (English language)",
        "part": "Immigration Rules Appendix Short-term Student (English language)",
        "section_id": "STS 6.1",
        "section_title": "Financial requirements for a Short-term Student",
        "parent_section": "STS 6",
        "hierarchy_level": 2,
        "topic": "financial",
        "url": "https://www.gov.uk/guidance/immigration-rules/immigration-rules-appendix-short-term-student-english-language",
        "scraped_at": "2025-12-06T17:28:48.507114"
      },
      "text": "### Financial requirements for a Short-term Student\n\nSTS 6.1. The applicant must be able to maintain and accommodate themselves adequately without receiving public funds.\n\nSTS 6.2. The applicant must have enough funds to meet the cost of their return or onward journey from the UK.\n\nSTS 6.3. At the date of application, the applicant must have paid their course fees or have enough funds to pay their course fees.\n\nSTS 6.4. Funds must be shown as specified in Appendix Finance.",
      "summary": "Short-term students must demonstrate sufficient funds to support themselves, cover their return journey, and pay course fees at the application date, without relying on public funds. Funds must meet the criteria outlined in Appendix Finance.",
      "augmented_text": "Document: Immigration Rules Appendix Short-term Student (English language)\nPart: Immigration Rules Appendix Short-term Student (English language)\nSection ID: STS 6.1\nSection: Financial requirements for a Short-term Student\nTopic: financial\n\nSummary: Short-term students must demonstrate sufficient funds to support themselves, cover their return journey, and pay course fees at the application date, without relying on public funds. Funds must meet the criteria outlined in Appendix Finance.\n\n### Financial requirements for a Short-term Student\n\nSTS 6.1. The applicant must be able to maintain and accommodate themselves adequately without receiving public funds.\n\nSTS 6.2. The applicant must have enough funds to meet the cost of their return or onward journey from the UK.\n\nSTS 6.3. At the date of application, the applicant must have paid their course fees or have enough funds to pay their course fees.\n\nSTS 6.4. Funds must be shown as specified in Appendix Finance.",
      "needs_review": false
    },
    {
      "metadata": {
        "source": "Immigration Rules Appendix Short-term Student (English language)",
        "part": "Immigration Rules Appendix Short-term Student (English language)",
        "section_id": "STS 7.1",
        "section_title": "Parental consent requirement for a Short-term Student aged 16 or 17",
        "parent_section": "STS 7",
        "hierarchy_level": 2,
        "topic": "family",
        "url": "https://www.gov.uk/guidance/immigration-rules/immigration-rules-appendix-short-term-student-english-language",
        "scraped_at": "2025-12-06T17:28:48.507146"
      },
      "text": "### Parental consent requirement for a Short-term Student aged 16 or 17\n\nSTS 7.1. The applicant must meet the parental consent requirement for applicant not applying as a dependent child in Appendix Children.\n\nSTS 7.2. DELETED",
      "summary": "This provision applies to 16 and 17-year-old Short-term Students. They must obtain parental consent unless applying as a dependent child, to meet application requirements. No exceptions are specified beyond the dependence category.",
      "augmented_text": "Document: Immigration Rules Appendix Short-term Student (English language)\nPart: Immigration Rules Appendix Short-term Student (English language)\nSection ID: STS 7.1\nSection: Parental consent requirement for a Short-term Student aged 16 or 17\nTopic: family\n\nSummary: This provision applies to 16 and 17-year-old Short-term Students. They must obtain parental consent unless applying as a dependent child, to meet application requirements. No exceptions are specified beyond the dependence category.\n\n### Parental consent requirement for a Short-term Student aged 16 or 17\n\nSTS 7.1. The applicant must meet the parental consent requirement for applicant not applying as a dependent child in Appendix Children.\n\nSTS 7.2. DELETED",
      "needs_review": false
    },
    {
      "metadata": {
        "source": "Immigration Rules Appendix Short-term Student (English language)",
        "part": "Immigration Rules Appendix Short-term Student (English language)",
        "section_id": "STS 8.1",
        "section_title": "Decision on an application as a Short-term Student",
        "parent_section": "STS 8",
        "hierarchy_level": 2,
        "topic": "eligibility",
        "url": "https://www.gov.uk/guidance/immigration-rules/immigration-rules-appendix-short-term-student-english-language",
        "scraped_at": "2025-12-06T17:28:48.507159"
      },
      "text": "### Decision on an application as a Short-term Student\n\nSTS 8.1. If the decision maker is satisfied that all the suitability and eligibility requirements for a Short-term Student are met the application will be granted, otherwise the application will be refused.\n\nSTS 8.2. If the application is refused, the person can apply for an Administrative Review under Appendix AR: Administrative Review.",
      "summary": "Applicants for a Short-term Student visa will be granted if all suitability and eligibility criteria are satisfied; otherwise, their application will be refused. Refused applicants may seek an Administrative Review under Appendix AR.",
      "augmented_text": "Document: Immigration Rules Appendix Short-term Student (English language)\nPart: Immigration Rules Appendix Short-term Student (English language)\nSection ID: STS 8.1\nSection: Decision on an application as a Short-term Student\nTopic: eligibility\n\nSummary: Applicants for a Short-term Student visa will be granted if all suitability and eligibility criteria are satisfied; otherwise, their application will be refused. Refused applicants may seek an Administrative Review under Appendix AR.\n\n### Decision on an application as a Short-term Student\n\nSTS 8.1. If the decision maker is satisfied that all the suitability and eligibility requirements for a Short-term Student are met the application will be granted, otherwise the application will be refused.\n\nSTS 8.2. If the application is refused, the person can apply for an Administrative Review under Appendix AR: Administrative Review.",
      "needs_review": false
    },
    {
      "metadata": {
        "source": "Immigration Rules Appendix Short-term Student (English language)",
        "part": "Immigration Rules Appendix Short-term Student (English language)",
        "section_id": "STS 9.1",
        "section_title": "Period of grant for a Short-term Student",
        "parent_section": "STS 9",
        "hierarchy_level": 2,
        "topic": "duration",
        "url": "https://www.gov.uk/guidance/immigration-rules/immigration-rules-appendix-short-term-student-english-language",
        "scraped_at": "2025-12-06T17:28:48.507185"
      },
      "text": "### Period of grant for a Short-term Student\n\nSTS 9.1. The applicant will be granted permission for 11 months.",
      "summary": "This provision applies to Short-term Students applying under STS. They will be granted permission for up to 11 months, with no exceptions specified.",
      "augmented_text": "Document: Immigration Rules Appendix Short-term Student (English language)\nPart: Immigration Rules Appendix Short-term Student (English language)\nSection ID: STS 9.1\nSection: Period of grant for a Short-term Student\nTopic: duration\n\nSummary: This provision applies to Short-term Students applying under STS. They will be granted permission for up to 11 months, with no exceptions specified.\n\n### Period of grant for a Short-term Student\n\nSTS 9.1. The applicant will be granted permission for 11 months.",
      "needs_review": true,
      "review_reasons": [
        "generic_summary"
      ]
    },
    {
      "metadata": {
        "source": "Immigration Rules Appendix Short-term Student (English language)",
        "part": "Immigration Rules Appendix Short-term Student (English language)",
        "section_id": "1",
        "section_title": "Conditions of grant for a Short-term Student",
        "parent_section": null,
        "hierarchy_level": 1,
        "topic": "financial",
        "url": "https://www.gov.uk/guidance/immigration-rules/immigration-rules-appendix-short-term-student-english-language",
        "scraped_at": "2025-12-06T17:28:48.507201"
      },
      "text": "### Conditions of grant for a Short-term Student\n\n1.   STS 9.2. The grant will be subject to all the following conditions: \n    1.   (a) no access to public funds; and\n    2.   (b) no work; and\n    3.   (c) study only on the course for which the applicant was granted permission.\n\nPrint this page",
      "summary": "This provision applies to Short-term Students. It requires them to avoid public funds, abstain from work, and study solely on their granted course. These conditions are mandatory and must be adhered to for the duration of their stay.",
      "augmented_text": "Document: Immigration Rules Appendix Short-term Student (English language)\nPart: Immigration Rules Appendix Short-term Student (English language)\nSection ID: 1\nSection: Conditions of grant for a Short-term Student\nTopic: financial\n\nSummary: This provision applies to Short-term Students. It requires them to avoid public funds, abstain from work, and study solely on their granted course. These conditions are mandatory and must be adhered to for the duration of their stay.\n\n### Conditions of grant for a Short-term Student\n\n1.   STS 9.2. The grant will be subject to all the following conditions: \n    1.   (a) no access to public funds; and\n    2.   (b) no work; and\n    3.   (c) study only on the course for which the applicant was granted permission.\n\nPrint this page",
      "needs_review": false
    }
  ]
}