{
  "url": "https://www.gov.uk/guidance/immigration-rules/immigration-rules-appendix-youth-mobility-scheme",
  "part_name": "Immigration Rules Appendix Youth Mobility Scheme",
  "scraped_at": "2025-12-06T17:30:33.927752",
  "chunk_count": 9,
  "chunks": [
    {
      "metadata": {
        "source": "Immigration Rules Appendix Youth Mobility Scheme",
        "part": "Immigration Rules Appendix Youth Mobility Scheme",
        "section_id": "YMS 1.1",
        "section_title": "Validity requirements for the Youth Mobility Scheme route",
        "parent_section": "YMS 1",
        "hierarchy_level": 2,
        "topic": "leave-to-enter",
        "url": "https://www.gov.uk/guidance/immigration-rules/immigration-rules-appendix-youth-mobility-scheme",
        "scraped_at": "2025-12-06T17:30:33.927562"
      },
      "text": "### Validity requirements for the Youth Mobility Scheme route\n\nYMS 1.1. A person applying for entry clearance under the Youth Mobility Scheme route must apply online on gov.uk on the specified form: “Temporary Work or Youth Mobility Scheme”.\n\nYMS 1.1.A. A person applying for permission to stay under the Youth Mobility Scheme route must apply online on gov.uk on the specified form: “Temporary Work or Youth Mobility Scheme permission to stay”.\n\n1.   YMS 1.2. An application for entry clearance or permission to stay under the Youth Mobility Scheme route must meet all the following requirements: \n    1.   (a) any fee and Immigration Health Charge must have been paid; and\n    2.   (b) the applicant must have provided biometrics when required; and\n    3.   (c) the applicant must have provided a passport or other travel document which satisfactorily establishes their identity and nationality.\n\n1.   YMS 1.3. The applicant must be one of the following: \n    1.   (a) a British Overseas citizen, British Overseas Territories citizen or British National (Overseas); or\n    2.   (b) a national or citizen of a country or the holder of a passport issued by a territory, listed in Appendix Youth Mobility Scheme: eligible nationals.\n\n1.   YMS 1.4. An applicant for entry clearance must be: \n    1.   (a) a national of Australia, Canada, New Zealand or the Republic of Korea aged 35 or under on the date of application; or\n    2.   (b) aged 30 or under on the date of application.\n\n1.   YMS 1.4.A. An applicant who is applying for permission to stay must: \n    1.   (a) be an Australian, Canadian or New Zealand national in the UK;\n    2.   (b) have, or have last been granted, permission to enter under the Youth Mobility Scheme route; and\n    3.   (c) not previously have been granted permission to stay under the Youth Mobility Scheme route.\n\nYMS 1.5. An application which does not meet all the validity requirements for the Youth Mobility Scheme may be rejected as invalid and not considered.",
      "summary": "Applicants for the Youth Mobility Scheme must apply online using the designated form, meet fee, biometrics, and passport requirements, and be nationals of specified countries or territories. Entry is restricted to individuals from Australia, Canada, New Zealand, or Korea aged 30 or 35 or under, depending on the category.",
      "augmented_text": "Document: Immigration Rules Appendix Youth Mobility Scheme\nPart: Immigration Rules Appendix Youth Mobility Scheme\nSection ID: YMS 1.1\nSection: Validity requirements for the Youth Mobility Scheme route\nTopic: leave-to-enter\n\nSummary: Applicants for the Youth Mobility Scheme must apply online using the designated form, meet fee, biometrics, and passport requirements, and be nationals of specified countries or territories. Entry is restricted to individuals from Australia, Canada, New Zealand, or Korea aged 30 or 35 or under, depending on the category.\n\n### Validity requirements for the Youth Mobility Scheme route\n\nYMS 1.1. A person applying for entry clearance under the Youth Mobility Scheme route must apply online on gov.uk on the specified form: “Temporary Work or Youth Mobility Scheme”.\n\nYMS 1.1.A. A person applying for permission to stay under the Youth Mobility Scheme route must apply online on gov.uk on the specified form: “Temporary Work or Youth Mobility Scheme permission to stay”.\n\n1.   YMS 1.2. An application for entry clearance or permission to stay under the Youth Mobility Scheme route must meet all the following requirements: \n    1.   (a) any fee and Immigration Health Charge must have been paid; and\n    2.   (b) the applicant must have provided biometrics when required; and\n    3.   (c) the applicant must have provided a passport or other travel document which satisfactorily establishes their identity and nationality.\n\n1.   YMS 1.3. The applicant must be one of the following: \n    1.   (a) a British Overseas citizen, British Overseas Territories citizen or British National (Overseas); or\n    2.   (b) a national or citizen of a country or the holder of a passport issued by a territory, listed in Appendix Youth Mobility Scheme: eligible nationals.\n\n1.   YMS 1.4. An applicant for entry clearance must be: \n    1.   (a) a national of Australia, Canada, New Zealand or the Republic of Korea aged 35 or under on the date of application; or\n    2.   (b) aged 30 or under on the date of application.\n\n1.   YMS 1.4.A. An applicant who is applying for permission to stay must: \n    1.   (a) be an Australian, Canadian or New Zealand national in the UK;\n    2.   (b) have, or have last been granted, permission to enter under the Youth Mobility Scheme route; and\n    3.   (c) not previously have been granted permission to stay under the Youth Mobility Scheme route.\n\nYMS 1.5. An application which does not meet all the validity requirements for the Youth Mobility Scheme may be rejected as invalid and not considered.",
      "needs_review": false
    },
    {
      "metadata": {
        "source": "Immigration Rules Appendix Youth Mobility Scheme",
        "part": "Immigration Rules Appendix Youth Mobility Scheme",
        "section_id": "YMS 2.1",
        "section_title": "Suitability requirements for the Youth Mobility Scheme",
        "parent_section": "YMS 2",
        "hierarchy_level": 2,
        "topic": "suitability",
        "url": "https://www.gov.uk/guidance/immigration-rules/immigration-rules-appendix-youth-mobility-scheme",
        "scraped_at": "2025-12-06T17:30:33.927592"
      },
      "text": "### Suitability requirements for the Youth Mobility Scheme\n\nYMS 2.1. The applicant must not fall for refusal under Part Suitability.\n\n1.   YMS 2.2. If applying for permission to stay the applicant must not be: \n    1.   (a) in breach of immigration laws, except that where the Exceptions for overstayers section of Part Suitability applies, that period of overstaying will be disregarded; or\n    2.   (b) on immigration bail.",
      "summary": "Applicants for the Youth Mobility Scheme must be suitable and not breaching immigration laws or on bail. Exceptions apply for certain overstayers under Part Suitability.",
      "augmented_text": "Document: Immigration Rules Appendix Youth Mobility Scheme\nPart: Immigration Rules Appendix Youth Mobility Scheme\nSection ID: YMS 2.1\nSection: Suitability requirements for the Youth Mobility Scheme\nTopic: suitability\n\nSummary: Applicants for the Youth Mobility Scheme must be suitable and not breaching immigration laws or on bail. Exceptions apply for certain overstayers under Part Suitability.\n\n### Suitability requirements for the Youth Mobility Scheme\n\nYMS 2.1. The applicant must not fall for refusal under Part Suitability.\n\n1.   YMS 2.2. If applying for permission to stay the applicant must not be: \n    1.   (a) in breach of immigration laws, except that where the Exceptions for overstayers section of Part Suitability applies, that period of overstaying will be disregarded; or\n    2.   (b) on immigration bail.",
      "needs_review": false
    },
    {
      "metadata": {
        "source": "Immigration Rules Appendix Youth Mobility Scheme",
        "part": "Immigration Rules Appendix Youth Mobility Scheme",
        "section_id": "Eligibility requirements for the Youth Mobility Scheme",
        "section_title": "Eligibility requirements for the Youth Mobility Scheme",
        "parent_section": null,
        "hierarchy_level": 2,
        "topic": "eligibility",
        "url": "https://www.gov.uk/guidance/immigration-rules/immigration-rules-appendix-youth-mobility-scheme",
        "scraped_at": "2025-12-06T17:30:33.927599"
      },
      "text": "### Eligibility requirements for the Youth Mobility Scheme",
      "summary": "The Youth Mobility Scheme applies to young people seeking to live and work in the UK. Applicants must meet age, nationality, and financial requirements, and may need sponsorship. Certain conditions, like prior compliance, apply, with exceptions for specific nationalities.",
      "augmented_text": "Document: Immigration Rules Appendix Youth Mobility Scheme\nPart: Immigration Rules Appendix Youth Mobility Scheme\nSection ID: Eligibility requirements for the Youth Mobility Scheme\nSection: Eligibility requirements for the Youth Mobility Scheme\nTopic: eligibility\n\nSummary: The Youth Mobility Scheme applies to young people seeking to live and work in the UK. Applicants must meet age, nationality, and financial requirements, and may need sponsorship. Certain conditions, like prior compliance, apply, with exceptions for specific nationalities.\n\n### Eligibility requirements for the Youth Mobility Scheme",
      "needs_review": false
    },
    {
      "metadata": {
        "source": "Immigration Rules Appendix Youth Mobility Scheme",
        "part": "Immigration Rules Appendix Youth Mobility Scheme",
        "section_id": "YMS 3.1",
        "section_title": "Entry requirements for the Youth Mobility Scheme",
        "parent_section": "YMS 3",
        "hierarchy_level": 2,
        "topic": "leave-to-enter",
        "url": "https://www.gov.uk/guidance/immigration-rules/immigration-rules-appendix-youth-mobility-scheme",
        "scraped_at": "2025-12-06T17:30:33.927613"
      },
      "text": "### Entry requirements for the Youth Mobility Scheme\n\nYMS 3.1. A person seeking to come to the UK on the Youth Mobility Scheme route must have applied for and obtained entry clearance under the Youth Mobility Scheme route before they arrive in the UK.\n\nYMS 3.2. A person applying for entry clearance on a Youth Mobility Scheme must, if Appendix Tuberculosis applies, provide a valid medical certificate confirming that they have undergone screening for active pulmonary tuberculosis and that this tuberculosis is not present in them.\n\nYMS 3.3. A person applying for entry clearance must not have previously spent time in the UK on the Youth Mobility Scheme route.\n\nYMS 3.4. The applicant must be aged 18 or over on the date their entry clearance will become valid.",
      "summary": "Applicants seeking entry under the Youth Mobility Scheme must obtain prior entry clearance before arrival, be aged 18 or over, and not have previously spent time in the UK on the scheme. If applicable, they must also provide a tuberculosis screening certificate.",
      "augmented_text": "Document: Immigration Rules Appendix Youth Mobility Scheme\nPart: Immigration Rules Appendix Youth Mobility Scheme\nSection ID: YMS 3.1\nSection: Entry requirements for the Youth Mobility Scheme\nTopic: leave-to-enter\n\nSummary: Applicants seeking entry under the Youth Mobility Scheme must obtain prior entry clearance before arrival, be aged 18 or over, and not have previously spent time in the UK on the scheme. If applicable, they must also provide a tuberculosis screening certificate.\n\n### Entry requirements for the Youth Mobility Scheme\n\nYMS 3.1. A person seeking to come to the UK on the Youth Mobility Scheme route must have applied for and obtained entry clearance under the Youth Mobility Scheme route before they arrive in the UK.\n\nYMS 3.2. A person applying for entry clearance on a Youth Mobility Scheme must, if Appendix Tuberculosis applies, provide a valid medical certificate confirming that they have undergone screening for active pulmonary tuberculosis and that this tuberculosis is not present in them.\n\nYMS 3.3. A person applying for entry clearance must not have previously spent time in the UK on the Youth Mobility Scheme route.\n\nYMS 3.4. The applicant must be aged 18 or over on the date their entry clearance will become valid.",
      "needs_review": false
    },
    {
      "metadata": {
        "source": "Immigration Rules Appendix Youth Mobility Scheme",
        "part": "Immigration Rules Appendix Youth Mobility Scheme",
        "section_id": "YMS 4.1",
        "section_title": "Country-specific eligibility requirements for the Youth Mobility Scheme",
        "parent_section": "YMS 4",
        "hierarchy_level": 2,
        "topic": "eligibility",
        "url": "https://www.gov.uk/guidance/immigration-rules/immigration-rules-appendix-youth-mobility-scheme",
        "scraped_at": "2025-12-06T17:30:33.927623"
      },
      "text": "### Country-specific eligibility requirements for the Youth Mobility Scheme\n\nYMS 4.1. Where the applicant is a national of Australia, Canada, Japan, Monaco, New Zealand or the Republic of Korea, they are not required to meet any country-specific eligibility requirements but if they are applying for entry clearance they must meet the financial requirements in YMS 5.1. to YMS 5.3.\n\nYMS 4.2. Where the applicant is a national, citizen or rightful passport holder of one of the countries or territories listed in the following table of country-specific eligibility requirements, they must meet the requirement listed:\n\n1 Hong Kong \n\n Taiwan The applicant must: \n\na) have been issued with an invitation to apply in accordance with the invitation to apply arrangements set out in Appendix Youth Mobility Scheme: eligible nationals; and \n\nb) have made their application within any time limit specified on that invitation to apply.\n2 San Marino The applicant must provide a letter confirming the applicant is a suitable candidate for the Youth Mobility Scheme from the Directorate of Political and Diplomatic Affairs of the Republic of San Marino Department of Foreign Affairs that has been issued no more than 6 months before the date of application.\n3 Iceland The applicant must provide a Criminal Certificate for Private Use that has been issued no more than 6 months before the date of application.\n4 India The applicant must: \n\n (a) have been issued with an invitation to apply in accordance with the invitation to apply arrangements set out in Appendix Youth Mobility Scheme: eligible nationals; and \n\n (b) have made their application within the period of time specified in that invitation to apply; and \n\n (c) provide the unique application number for that invitation to apply; and \n\n (d) provide a local police certificate or a police clearance certificate that has been issued no more than 6 months before the date of application; and \n\n (e) hold a qualification equal to or above RQF level 6.\n5 Andorra The applicant must provide a certificate of criminal records issued no more than 6 months before the date of application.\n6 Uruguay The applicant must provide a Certificate of Judicial Records that has been issued no more than 6 months before the date of application.\n\nYMS 4.3. The number of places for entry clearance applications allocated to nationals or citizens of the same country, or rightful holders of a passport issued by the same territory, must not have exceeded the annual total allocation of places for that country or territory as set out in Appendix Youth Mobility Scheme: eligible nationals.\n\nYMS 4.4. Where the applicant is a British Overseas citizen, British Overseas Territories citizen or British National (Overseas), YMS 4.1. to YMS 4.2. do not apply.",
      "summary": "This section applies to nationals of specific countries applying under the Youth Mobility Scheme. Applicants from Australia, Canada, Japan, Monaco, New Zealand, or Korea face no country-specific criteria but must meet financial requirements if applying for entry clearance. Conversely, applicants from Hong Kong, Taiwan, San Marino, Iceland, and India must fulfill particular conditions, such as providing invitations, letters, or certificates, with some time-limited to six months.",
      "augmented_text": "Document: Immigration Rules Appendix Youth Mobility Scheme\nPart: Immigration Rules Appendix Youth Mobility Scheme\nSection ID: YMS 4.1\nSection: Country-specific eligibility requirements for the Youth Mobility Scheme\nTopic: eligibility\n\nSummary: This section applies to nationals of specific countries applying under the Youth Mobility Scheme. Applicants from Australia, Canada, Japan, Monaco, New Zealand, or Korea face no country-specific criteria but must meet financial requirements if applying for entry clearance. Conversely, applicants from Hong Kong, Taiwan, San Marino, Iceland, and India must fulfill particular conditions, such as providing invitations, letters, or certificates, with some time-limited to six months.\n\n### Country-specific eligibility requirements for the Youth Mobility Scheme\n\nYMS 4.1. Where the applicant is a national of Australia, Canada, Japan, Monaco, New Zealand or the Republic of Korea, they are not required to meet any country-specific eligibility requirements but if they are applying for entry clearance they must meet the financial requirements in YMS 5.1. to YMS 5.3.\n\nYMS 4.2. Where the applicant is a national, citizen or rightful passport holder of one of the countries or territories listed in the following table of country-specific eligibility requirements, they must meet the requirement listed:\n\n1 Hong Kong \n\n Taiwan The applicant must: \n\na) have been issued with an invitation to apply in accordance with the invitation to apply arrangements set out in Appendix Youth Mobility Scheme: eligible nationals; and \n\nb) have made their application within any time limit specified on that invitation to apply.\n2 San Marino The applicant must provide a letter confirming the applicant is a suitable candidate for the Youth Mobility Scheme from the Directorate of Political and Diplomatic Affairs of the Republic of San Marino Department of Foreign Affairs that has been issued no more than 6 months before the date of application.\n3 Iceland The applicant must provide a Criminal Certificate for Private Use that has been issued no more than 6 months before the date of application.\n4 India The applicant must: \n\n (a) have been issued with an invitation to apply in accordance with the invitation to apply arrangements set out in Appendix Youth Mobility Scheme: eligible nationals; and \n\n (b) have made their application within the period of time specified in that invitation to apply; and \n\n (c) provide the unique application number for that invitation to apply; and \n\n (d) provide a local police certificate or a police clearance certificate that has been issued no more than 6 months before the date of application; and \n\n (e) hold a qualification equal to or above RQF level 6.\n5 Andorra The applicant must provide a certificate of criminal records issued no more than 6 months before the date of application.\n6 Uruguay The applicant must provide a Certificate of Judicial Records that has been issued no more than 6 months before the date of application.\n\nYMS 4.3. The number of places for entry clearance applications allocated to nationals or citizens of the same country, or rightful holders of a passport issued by the same territory, must not have exceeded the annual total allocation of places for that country or territory as set out in Appendix Youth Mobility Scheme: eligible nationals.\n\nYMS 4.4. Where the applicant is a British Overseas citizen, British Overseas Territories citizen or British National (Overseas), YMS 4.1. to YMS 4.2. do not apply.",
      "needs_review": false
    },
    {
      "metadata": {
        "source": "Immigration Rules Appendix Youth Mobility Scheme",
        "part": "Immigration Rules Appendix Youth Mobility Scheme",
        "section_id": "YMS 5.1",
        "section_title": "Financial requirement for the Youth Mobility Scheme",
        "parent_section": "YMS 5",
        "hierarchy_level": 2,
        "topic": "financial",
        "url": "https://www.gov.uk/guidance/immigration-rules/immigration-rules-appendix-youth-mobility-scheme",
        "scraped_at": "2025-12-06T17:30:33.927633"
      },
      "text": "### Financial requirement for the Youth Mobility Scheme\n\nYMS 5.1. The applicant must have funds of £ 2,530.\n\nYMS 5.2. The applicant must show that they have held the required level of funds for a 28- day period and as specified in Appendix Finance.\n\nYMS 5.3. The applicant must not have any children aged under 18 who are either living with them or financially dependent upon them.\n\nYMS 5.4. YMS 5.1. to YMS 5.3. do not apply to applications for permission to stay on the Youth Mobility Scheme route.",
      "summary": "Applicants under the Youth Mobility Scheme must demonstrate funds of £2,530 held for 28 days per Appendix Finance, without any under-18 dependents. These financial requirements generally apply unless seeking permission to stay on the scheme route.",
      "augmented_text": "Document: Immigration Rules Appendix Youth Mobility Scheme\nPart: Immigration Rules Appendix Youth Mobility Scheme\nSection ID: YMS 5.1\nSection: Financial requirement for the Youth Mobility Scheme\nTopic: financial\n\nSummary: Applicants under the Youth Mobility Scheme must demonstrate funds of £2,530 held for 28 days per Appendix Finance, without any under-18 dependents. These financial requirements generally apply unless seeking permission to stay on the scheme route.\n\n### Financial requirement for the Youth Mobility Scheme\n\nYMS 5.1. The applicant must have funds of £ 2,530.\n\nYMS 5.2. The applicant must show that they have held the required level of funds for a 28- day period and as specified in Appendix Finance.\n\nYMS 5.3. The applicant must not have any children aged under 18 who are either living with them or financially dependent upon them.\n\nYMS 5.4. YMS 5.1. to YMS 5.3. do not apply to applications for permission to stay on the Youth Mobility Scheme route.",
      "needs_review": false
    },
    {
      "metadata": {
        "source": "Immigration Rules Appendix Youth Mobility Scheme",
        "part": "Immigration Rules Appendix Youth Mobility Scheme",
        "section_id": "YMS 6.1",
        "section_title": "Decision on an application for the Youth Mobility Scheme",
        "parent_section": "YMS 6",
        "hierarchy_level": 2,
        "topic": "eligibility",
        "url": "https://www.gov.uk/guidance/immigration-rules/immigration-rules-appendix-youth-mobility-scheme",
        "scraped_at": "2025-12-06T17:30:33.927649"
      },
      "text": "### Decision on an application for the Youth Mobility Scheme\n\nYMS 6.1. If the decision maker is satisfied that all the eligibility and suitability requirements are met for the Youth Mobility Scheme route, the application will be granted, otherwise the application will be refused.\n\nYMS 6.2. If the application is refused the person can apply for an Administrative Review under Appendix AR: Administrative Review.",
      "summary": "Applicants for the Youth Mobility Scheme must meet all eligibility and suitability criteria for approval; failure to do so results in refusal. Refused applications may be appealed through an Administrative Review process.",
      "augmented_text": "Document: Immigration Rules Appendix Youth Mobility Scheme\nPart: Immigration Rules Appendix Youth Mobility Scheme\nSection ID: YMS 6.1\nSection: Decision on an application for the Youth Mobility Scheme\nTopic: eligibility\n\nSummary: Applicants for the Youth Mobility Scheme must meet all eligibility and suitability criteria for approval; failure to do so results in refusal. Refused applications may be appealed through an Administrative Review process.\n\n### Decision on an application for the Youth Mobility Scheme\n\nYMS 6.1. If the decision maker is satisfied that all the eligibility and suitability requirements are met for the Youth Mobility Scheme route, the application will be granted, otherwise the application will be refused.\n\nYMS 6.2. If the application is refused the person can apply for an Administrative Review under Appendix AR: Administrative Review.",
      "needs_review": false
    },
    {
      "metadata": {
        "source": "Immigration Rules Appendix Youth Mobility Scheme",
        "part": "Immigration Rules Appendix Youth Mobility Scheme",
        "section_id": "1",
        "section_title": "Period of grant for the Youth Mobility Scheme",
        "parent_section": null,
        "hierarchy_level": 1,
        "topic": "definitions",
        "url": "https://www.gov.uk/guidance/immigration-rules/immigration-rules-appendix-youth-mobility-scheme",
        "scraped_at": "2025-12-06T17:30:33.927673"
      },
      "text": "### Period of grant for the Youth Mobility Scheme\n\n1.   YMS 7.1. The applicant will be granted either: \n    1.   (a) entry clearance for up to 2 years; or\n    2.   (b) permission to stay for a period which means the period of permission (including the original permission to enter) granted under the Youth Mobility Scheme is for a total of 3 continuous years.",
      "summary": "The Youth Mobility Scheme applies to applicants seeking temporary permission to stay in the UK. They may be granted either up to 2 years’ entry clearance or a total stay of 3 continuous years. The key condition is that the total permission cannot exceed 3 years.",
      "augmented_text": "Document: Immigration Rules Appendix Youth Mobility Scheme\nPart: Immigration Rules Appendix Youth Mobility Scheme\nSection ID: 1\nSection: Period of grant for the Youth Mobility Scheme\nTopic: definitions\n\nSummary: The Youth Mobility Scheme applies to applicants seeking temporary permission to stay in the UK. They may be granted either up to 2 years’ entry clearance or a total stay of 3 continuous years. The key condition is that the total permission cannot exceed 3 years.\n\n### Period of grant for the Youth Mobility Scheme\n\n1.   YMS 7.1. The applicant will be granted either: \n    1.   (a) entry clearance for up to 2 years; or\n    2.   (b) permission to stay for a period which means the period of permission (including the original permission to enter) granted under the Youth Mobility Scheme is for a total of 3 continuous years.",
      "needs_review": false
    },
    {
      "metadata": {
        "source": "Immigration Rules Appendix Youth Mobility Scheme",
        "part": "Immigration Rules Appendix Youth Mobility Scheme",
        "section_id": "1",
        "section_title": "Conditions of grant for the Youth Mobility Scheme",
        "parent_section": null,
        "hierarchy_level": 1,
        "topic": "financial",
        "url": "https://www.gov.uk/guidance/immigration-rules/immigration-rules-appendix-youth-mobility-scheme",
        "scraped_at": "2025-12-06T17:30:33.927686"
      },
      "text": "### Conditions of grant for the Youth Mobility Scheme\n\n1.   YMS 7.2. The grant will be subject to all the following conditions: \n    1.   (a) no access to public funds; and\n    2.   (b) work permitted, subject to YMS 7.3; and\n    3.   (c) study is permitted subject to the ATAS condition in Appendix ATAS.\n    4.   (d) DELETED.\n\n1.   YMS 7.3. Work is permitted subject to the following employment conditions: \n    1.   (a) no employment as a professional sportsperson (including as a sports coach); and\n    2.   (b) no self-employment, except where the following conditions are met: \n        1.   (i) the applicant has no premises which they own, other than their home, from which they carry out their business; and\n        2.   (ii) the total value of any equipment used in their business does not exceed £5,000; and\n        3.   (iii) the applicant has no employees.\n\nPrint this page",
      "summary": "The Youth Mobility Scheme applies to young applicants granted entry with conditions including no access to public funds, permitted work and study (subject to ATAS), with restrictions on employment as professional athletes or self-employment unless specific criteria (e.g., limited equipment, no premises, no employees) are met.",
      "augmented_text": "Document: Immigration Rules Appendix Youth Mobility Scheme\nPart: Immigration Rules Appendix Youth Mobility Scheme\nSection ID: 1\nSection: Conditions of grant for the Youth Mobility Scheme\nTopic: financial\n\nSummary: The Youth Mobility Scheme applies to young applicants granted entry with conditions including no access to public funds, permitted work and study (subject to ATAS), with restrictions on employment as professional athletes or self-employment unless specific criteria (e.g., limited equipment, no premises, no employees) are met.\n\n### Conditions of grant for the Youth Mobility Scheme\n\n1.   YMS 7.2. The grant will be subject to all the following conditions: \n    1.   (a) no access to public funds; and\n    2.   (b) work permitted, subject to YMS 7.3; and\n    3.   (c) study is permitted subject to the ATAS condition in Appendix ATAS.\n    4.   (d) DELETED.\n\n1.   YMS 7.3. Work is permitted subject to the following employment conditions: \n    1.   (a) no employment as a professional sportsperson (including as a sports coach); and\n    2.   (b) no self-employment, except where the following conditions are met: \n        1.   (i) the applicant has no premises which they own, other than their home, from which they carry out their business; and\n        2.   (ii) the total value of any equipment used in their business does not exceed £5,000; and\n        3.   (iii) the applicant has no employees.\n\nPrint this page",
      "needs_review": false
    }
  ]
}