{
  "url": "https://www.gov.uk/guidance/immigration-rules/immigration-rules-appendix-t5-temporary-worker-government-authorised-exchange-worker-route",
  "part_name": "Appendix Temporary Work – Government Authorised Exchange",
  "scraped_at": "2025-12-06T17:25:41.385651",
  "chunk_count": 27,
  "chunks": [
    {
      "metadata": {
        "source": "Appendix Temporary Work – Government Authorised Exchange",
        "part": "Appendix Temporary Work – Government Authorised Exchange",
        "section_id": "GAE 1.1",
        "section_title": "Validity requirements for the Government Authorised Exchange route",
        "parent_section": "GAE 1",
        "hierarchy_level": 2,
        "topic": "leave-to-enter",
        "url": "https://www.gov.uk/guidance/immigration-rules/immigration-rules-appendix-t5-temporary-worker-government-authorised-exchange-worker-route",
        "scraped_at": "2025-12-06T17:25:41.384924"
      },
      "text": "### Validity requirements for the Government Authorised Exchange route\n\nGAE 1.1. A person applying for entry clearance or permission to stay on the Government Authorised Exchange route must apply online on the gov.uk website on the specified form ‘Temporary Work – Government Authorised Exchange Scheme’.\n\n1.   GAE 1.2. An application for entry clearance or permission to stay on the Government Authorised Exchange route must meet all the following requirements: \n    1.   (a) any fee and Immigration Health Charge must have been paid; and\n    2.   (b) the applicant must have provided biometrics when required; and\n    3.   (c) the applicant must have provided a passport or other travel document which satisfactorily establishes their identity and nationality; and\n    4.   (d) the applicant must have a Certificate of Sponsorship that was issued to them no more than 3 months (or 90 days, where the Certificate of Sponsorship is linked to a Sponsorship Reference Number, disregarding any days during which an edit requested by a sponsor to their Sponsor a Worker submission is being reviewed) before the date of application.\n\nGAE 1.3. If the applicant has in the last 12 months before the date of application received an award from a Government or international scholarship agency covering both fees and maintenance, they must provide written consent to the application from that Government or agency.\n\nGAE 1.4. An application which does not meet all the validity requirements for the Government Authorised Exchange route may be rejected as invalid and not considered.",
      "summary": "Applicants seeking entry or stay under the Government Authorised Exchange route must apply online, pay fees, provide biometrics, a valid passport, and a recent Certificate of Sponsorship (issued within 90 days). If they received a government or international scholarship in the past year covering fees and maintenance, they must also submit written consent from the issuer.",
      "augmented_text": "Document: Appendix Temporary Work – Government Authorised Exchange\nPart: Appendix Temporary Work – Government Authorised Exchange\nSection ID: GAE 1.1\nSection: Validity requirements for the Government Authorised Exchange route\nTopic: leave-to-enter\n\nSummary: Applicants seeking entry or stay under the Government Authorised Exchange route must apply online, pay fees, provide biometrics, a valid passport, and a recent Certificate of Sponsorship (issued within 90 days). If they received a government or international scholarship in the past year covering fees and maintenance, they must also submit written consent from the issuer.\n\n### Validity requirements for the Government Authorised Exchange route\n\nGAE 1.1. A person applying for entry clearance or permission to stay on the Government Authorised Exchange route must apply online on the gov.uk website on the specified form ‘Temporary Work – Government Authorised Exchange Scheme’.\n\n1.   GAE 1.2. An application for entry clearance or permission to stay on the Government Authorised Exchange route must meet all the following requirements: \n    1.   (a) any fee and Immigration Health Charge must have been paid; and\n    2.   (b) the applicant must have provided biometrics when required; and\n    3.   (c) the applicant must have provided a passport or other travel document which satisfactorily establishes their identity and nationality; and\n    4.   (d) the applicant must have a Certificate of Sponsorship that was issued to them no more than 3 months (or 90 days, where the Certificate of Sponsorship is linked to a Sponsorship Reference Number, disregarding any days during which an edit requested by a sponsor to their Sponsor a Worker submission is being reviewed) before the date of application.\n\nGAE 1.3. If the applicant has in the last 12 months before the date of application received an award from a Government or international scholarship agency covering both fees and maintenance, they must provide written consent to the application from that Government or agency.\n\nGAE 1.4. An application which does not meet all the validity requirements for the Government Authorised Exchange route may be rejected as invalid and not considered.",
      "needs_review": false
    },
    {
      "metadata": {
        "source": "Appendix Temporary Work – Government Authorised Exchange",
        "part": "Appendix Temporary Work – Government Authorised Exchange",
        "section_id": "GAE 2.1",
        "section_title": "Suitability requirements for the Government Authorised Exchange route",
        "parent_section": "GAE 2",
        "hierarchy_level": 2,
        "topic": "suitability",
        "url": "https://www.gov.uk/guidance/immigration-rules/immigration-rules-appendix-t5-temporary-worker-government-authorised-exchange-worker-route",
        "scraped_at": "2025-12-06T17:25:41.384960"
      },
      "text": "### Suitability requirements for the Government Authorised Exchange route\n\nGAE 2.1. The applicant must not fall for refusal under Part Suitability.\n\n1.   GAE 2.2. If applying for permission to stay the applicant must not be: \n    1.   (a) in breach of immigration laws, except that where the Exceptions for overstayers section of Part Suitability applies, that period of overstaying will be disregarded; or\n    2.   (b) on immigration bail.",
      "summary": "Applicants seeking permission under the Government Authorised Exchange route must meet suitability criteria, not breach immigration laws (with certain overstaying exceptions), and not be on immigration bail.",
      "augmented_text": "Document: Appendix Temporary Work – Government Authorised Exchange\nPart: Appendix Temporary Work – Government Authorised Exchange\nSection ID: GAE 2.1\nSection: Suitability requirements for the Government Authorised Exchange route\nTopic: suitability\n\nSummary: Applicants seeking permission under the Government Authorised Exchange route must meet suitability criteria, not breach immigration laws (with certain overstaying exceptions), and not be on immigration bail.\n\n### Suitability requirements for the Government Authorised Exchange route\n\nGAE 2.1. The applicant must not fall for refusal under Part Suitability.\n\n1.   GAE 2.2. If applying for permission to stay the applicant must not be: \n    1.   (a) in breach of immigration laws, except that where the Exceptions for overstayers section of Part Suitability applies, that period of overstaying will be disregarded; or\n    2.   (b) on immigration bail.",
      "needs_review": false
    },
    {
      "metadata": {
        "source": "Appendix Temporary Work – Government Authorised Exchange",
        "part": "Appendix Temporary Work – Government Authorised Exchange",
        "section_id": "Eligibility requirements for the Government Authorised Exchange route",
        "section_title": "Eligibility requirements for the Government Authorised Exchange route",
        "parent_section": null,
        "hierarchy_level": 2,
        "topic": "eligibility",
        "url": "https://www.gov.uk/guidance/immigration-rules/immigration-rules-appendix-t5-temporary-worker-government-authorised-exchange-worker-route",
        "scraped_at": "2025-12-06T17:25:41.384972"
      },
      "text": "### Eligibility requirements for the Government Authorised Exchange route",
      "summary": "This provision applies to applicants seeking entry via the Government Authorised Exchange route. It requires applicants to meet specific eligibility criteria, including sponsorship and compliance with prescribed conditions. Exceptions or thresholds are not specified in this summary.",
      "augmented_text": "Document: Appendix Temporary Work – Government Authorised Exchange\nPart: Appendix Temporary Work – Government Authorised Exchange\nSection ID: Eligibility requirements for the Government Authorised Exchange route\nSection: Eligibility requirements for the Government Authorised Exchange route\nTopic: eligibility\n\nSummary: This provision applies to applicants seeking entry via the Government Authorised Exchange route. It requires applicants to meet specific eligibility criteria, including sponsorship and compliance with prescribed conditions. Exceptions or thresholds are not specified in this summary.\n\n### Eligibility requirements for the Government Authorised Exchange route",
      "needs_review": false
    },
    {
      "metadata": {
        "source": "Appendix Temporary Work – Government Authorised Exchange",
        "part": "Appendix Temporary Work – Government Authorised Exchange",
        "section_id": "GAE 3.1",
        "section_title": "Entry requirements for the Government Authorised Exchange route",
        "parent_section": "GAE 3",
        "hierarchy_level": 2,
        "topic": "leave-to-enter",
        "url": "https://www.gov.uk/guidance/immigration-rules/immigration-rules-appendix-t5-temporary-worker-government-authorised-exchange-worker-route",
        "scraped_at": "2025-12-06T17:25:41.385001"
      },
      "text": "### Entry requirements for the Government Authorised Exchange route\n\nGAE 3.1. A person seeking to come to the UK on the Government Authorised Exchange route must have applied for and obtained entry clearance on the Government Authorised Exchange route before they arrive in the UK.\n\nGAE 3.2. A person applying for entry clearance on the Government Authorised Exchange route must, if Appendix Tuberculosis applies, provide a valid medical certificate confirming that they have undergone screening for active pulmonary tuberculosis and that this tuberculosis is not present in them.",
      "summary": "Applicants seeking entry on the Government Authorised Exchange route must obtain prior entry clearance before arrival and, if applicable, provide a TB screening certificate confirming they do not have active pulmonary tuberculosis.",
      "augmented_text": "Document: Appendix Temporary Work – Government Authorised Exchange\nPart: Appendix Temporary Work – Government Authorised Exchange\nSection ID: GAE 3.1\nSection: Entry requirements for the Government Authorised Exchange route\nTopic: leave-to-enter\n\nSummary: Applicants seeking entry on the Government Authorised Exchange route must obtain prior entry clearance before arrival and, if applicable, provide a TB screening certificate confirming they do not have active pulmonary tuberculosis.\n\n### Entry requirements for the Government Authorised Exchange route\n\nGAE 3.1. A person seeking to come to the UK on the Government Authorised Exchange route must have applied for and obtained entry clearance on the Government Authorised Exchange route before they arrive in the UK.\n\nGAE 3.2. A person applying for entry clearance on the Government Authorised Exchange route must, if Appendix Tuberculosis applies, provide a valid medical certificate confirming that they have undergone screening for active pulmonary tuberculosis and that this tuberculosis is not present in them.",
      "needs_review": false
    },
    {
      "metadata": {
        "source": "Appendix Temporary Work – Government Authorised Exchange",
        "part": "Appendix Temporary Work – Government Authorised Exchange",
        "section_id": "GAE 4.1",
        "section_title": "Previous permission requirement for the Government Authorised Exchange route",
        "parent_section": null,
        "hierarchy_level": 1,
        "topic": "eligibility",
        "url": "https://www.gov.uk/guidance/immigration-rules/immigration-rules-appendix-t5-temporary-worker-government-authorised-exchange-worker-route",
        "scraped_at": "2025-12-06T17:25:41.385040"
      },
      "text": "### Previous permission requirement for the Government Authorised Exchange route\n\n1.   GAE 4.1. An applicant who is applying for permission to stay must be in the UK on the date of application and must have, or have last been granted: \n    1.   (a) permission on the Government Authorised Exchange route; or\n    2.   (b) permission as a Student, who meets the requirements in GAE 4.2. and who is or was last sponsored by either: \n        1.   (i) a higher education provider with a track record of compliance; or\n        2.   (ii) an overseas higher education institution, to do a short-term study abroad programme in the UK.\n\n1.   GAE 4.2. Where the applicant has, or last had, permission as a Student: \n    1.   (a) the applicant must have completed a UK recognised bachelor’s or postgraduate degree during that last period of permission; and\n    2.   (b) the applicant must currently be sponsored for either: \n        1.   (i) a period of postgraduate professional training or work experience which is required to gain a professional qualification or registration in the same field as their degree; or\n        2.   (ii) an internship for up to 12 months which is directly related to their degree; and\n\n    3.   (c) the applicant must not be filling a permanent vacancy; and\n    4.   (d) the sponsor must not intend to employ the applicant in the UK once the training or work experience is completed.",
      "summary": "Applicants must currently be in the UK with permission via the Government Authorised Exchange route or as a qualifying student sponsor. If previously a student, they must have completed a UK recognized degree and be sponsored for relevant training, work experience, or internship related to their degree, without filling a permanent vacancy or intending UK employment afterward.",
      "augmented_text": "Document: Appendix Temporary Work – Government Authorised Exchange\nPart: Appendix Temporary Work – Government Authorised Exchange\nSection ID: GAE 4.1\nSection: Previous permission requirement for the Government Authorised Exchange route\nTopic: eligibility\n\nSummary: Applicants must currently be in the UK with permission via the Government Authorised Exchange route or as a qualifying student sponsor. If previously a student, they must have completed a UK recognized degree and be sponsored for relevant training, work experience, or internship related to their degree, without filling a permanent vacancy or intending UK employment afterward.\n\n### Previous permission requirement for the Government Authorised Exchange route\n\n1.   GAE 4.1. An applicant who is applying for permission to stay must be in the UK on the date of application and must have, or have last been granted: \n    1.   (a) permission on the Government Authorised Exchange route; or\n    2.   (b) permission as a Student, who meets the requirements in GAE 4.2. and who is or was last sponsored by either: \n        1.   (i) a higher education provider with a track record of compliance; or\n        2.   (ii) an overseas higher education institution, to do a short-term study abroad programme in the UK.\n\n1.   GAE 4.2. Where the applicant has, or last had, permission as a Student: \n    1.   (a) the applicant must have completed a UK recognised bachelor’s or postgraduate degree during that last period of permission; and\n    2.   (b) the applicant must currently be sponsored for either: \n        1.   (i) a period of postgraduate professional training or work experience which is required to gain a professional qualification or registration in the same field as their degree; or\n        2.   (ii) an internship for up to 12 months which is directly related to their degree; and\n\n    3.   (c) the applicant must not be filling a permanent vacancy; and\n    4.   (d) the sponsor must not intend to employ the applicant in the UK once the training or work experience is completed.",
      "needs_review": false
    },
    {
      "metadata": {
        "source": "Appendix Temporary Work – Government Authorised Exchange",
        "part": "Appendix Temporary Work – Government Authorised Exchange",
        "section_id": "GAE 5.1",
        "section_title": "Sponsorship requirement for the Government Authorised Exchange route",
        "parent_section": null,
        "hierarchy_level": 1,
        "topic": "sponsorship",
        "url": "https://www.gov.uk/guidance/immigration-rules/immigration-rules-appendix-t5-temporary-worker-government-authorised-exchange-worker-route",
        "scraped_at": "2025-12-06T17:25:41.385083"
      },
      "text": "### Sponsorship requirement for the Government Authorised Exchange route\n\n1.   GAE 5.1. The applicant must have a valid Certificate of Sponsorship for the job they are planning to do; which to be valid must: \n    1.   (a) confirm the applicant’s name, that they are being sponsored on the Government Authorised Exchange route, details of the job and salary the sponsor is offering them, and that these arrangements comply with the National Minimum Wage; and\n    2.   (b) include a start date, stated by the sponsor, which is no more than three months after the date of application; and\n    3.   (c) not have been used in a previous application which was either granted or refused (but can have been used in a previous application which was rejected as invalid, made void or withdrawn); and\n    4.   (d) not have been withdrawn by the sponsor or cancelled by the Home Office; and\n    5.   (e) confirm that the role meets the requirements of the individual exchange scheme as set out in Appendix GAE schemes; and\n    6.   (f) confirm that the role is supernumerary, such that it is in addition to the host employer’s regular, required, or standard number of staff and does not fill a permanent position or ongoing vacancy in the relevant organisation’s workforce, even on a temporary basis (with a full explanation of why it is supernumerary); and\n    7.   (g) confirm that the role appears in Tables 1, 1a, 2, 2aa, 3 or 3a of Appendix Skilled Occupations; and\n    8.   (h) confirm whether the Academic Technology Approval Scheme (ATAS) requirement in Appendix ATAS applies.\n\nGAE 5.2. The sponsor must be authorised by the Home Office to sponsor individuals in the role specified on the Certificate of Sponsorship and on the particular scheme that the applicant has applied to participate in (as set out in Appendix GAE schemes).\n\nGAE 5.3. The sponsor must be listed as A-rated on the Home Office’s register of licensed sponsors, unless the applicant was last granted permission on the Government Authorised Exchange route and is applying to continue working for the same sponsor as in their last permission.\n\nGAE 5.4. The decision maker must not have reasonable grounds to believe the job the applicant is being sponsored to do does not comply with the National Minimum Wage Regulations or the Working Time Regulations.",
      "summary": "Applicants under the Government Authorized Exchange route must hold a valid Certificate of Sponsorship confirming job details, salary, and compliance with the National Minimum Wage, issued within three months of application. The sponsorship must not have been previously used, withdrawn, or canceled and must specify a supernumerary, scheme-compliant role listed in designated occupation tables.",
      "augmented_text": "Document: Appendix Temporary Work – Government Authorised Exchange\nPart: Appendix Temporary Work – Government Authorised Exchange\nSection ID: GAE 5.1\nSection: Sponsorship requirement for the Government Authorised Exchange route\nTopic: sponsorship\n\nSummary: Applicants under the Government Authorized Exchange route must hold a valid Certificate of Sponsorship confirming job details, salary, and compliance with the National Minimum Wage, issued within three months of application. The sponsorship must not have been previously used, withdrawn, or canceled and must specify a supernumerary, scheme-compliant role listed in designated occupation tables.\n\n### Sponsorship requirement for the Government Authorised Exchange route\n\n1.   GAE 5.1. The applicant must have a valid Certificate of Sponsorship for the job they are planning to do; which to be valid must: \n    1.   (a) confirm the applicant’s name, that they are being sponsored on the Government Authorised Exchange route, details of the job and salary the sponsor is offering them, and that these arrangements comply with the National Minimum Wage; and\n    2.   (b) include a start date, stated by the sponsor, which is no more than three months after the date of application; and\n    3.   (c) not have been used in a previous application which was either granted or refused (but can have been used in a previous application which was rejected as invalid, made void or withdrawn); and\n    4.   (d) not have been withdrawn by the sponsor or cancelled by the Home Office; and\n    5.   (e) confirm that the role meets the requirements of the individual exchange scheme as set out in Appendix GAE schemes; and\n    6.   (f) confirm that the role is supernumerary, such that it is in addition to the host employer’s regular, required, or standard number of staff and does not fill a permanent position or ongoing vacancy in the relevant organisation’s workforce, even on a temporary basis (with a full explanation of why it is supernumerary); and\n    7.   (g) confirm that the role appears in Tables 1, 1a, 2, 2aa, 3 or 3a of Appendix Skilled Occupations; and\n    8.   (h) confirm whether the Academic Technology Approval Scheme (ATAS) requirement in Appendix ATAS applies.\n\nGAE 5.2. The sponsor must be authorised by the Home Office to sponsor individuals in the role specified on the Certificate of Sponsorship and on the particular scheme that the applicant has applied to participate in (as set out in Appendix GAE schemes).\n\nGAE 5.3. The sponsor must be listed as A-rated on the Home Office’s register of licensed sponsors, unless the applicant was last granted permission on the Government Authorised Exchange route and is applying to continue working for the same sponsor as in their last permission.\n\nGAE 5.4. The decision maker must not have reasonable grounds to believe the job the applicant is being sponsored to do does not comply with the National Minimum Wage Regulations or the Working Time Regulations.",
      "needs_review": false
    },
    {
      "metadata": {
        "source": "Appendix Temporary Work – Government Authorised Exchange",
        "part": "Appendix Temporary Work – Government Authorised Exchange",
        "section_id": "GAE 6.1",
        "section_title": "Genuineness requirement for the Government Authorised Exchange route",
        "parent_section": null,
        "hierarchy_level": 1,
        "topic": "eligibility",
        "url": "https://www.gov.uk/guidance/immigration-rules/immigration-rules-appendix-t5-temporary-worker-government-authorised-exchange-worker-route",
        "scraped_at": "2025-12-06T17:25:41.385117"
      },
      "text": "### Genuineness requirement for the Government Authorised Exchange route\n\n1.   GAE 6.1. The applicant must: \n    1.   (a) genuinely intend, and be able, to undertake the role for which they are being sponsored; and\n    2.   (b) not intend to undertake employment other than in the role for which they are being sponsored, or as otherwise permitted by paragraph GAE 11.3.",
      "summary": "Applicants applying through the Government Authorised Exchange route must genuinely intend and be able to undertake their sponsored role, without plans to work outside this role unless permitted. They must also demonstrate that their intentions align with the stipulated employment scope.",
      "augmented_text": "Document: Appendix Temporary Work – Government Authorised Exchange\nPart: Appendix Temporary Work – Government Authorised Exchange\nSection ID: GAE 6.1\nSection: Genuineness requirement for the Government Authorised Exchange route\nTopic: eligibility\n\nSummary: Applicants applying through the Government Authorised Exchange route must genuinely intend and be able to undertake their sponsored role, without plans to work outside this role unless permitted. They must also demonstrate that their intentions align with the stipulated employment scope.\n\n### Genuineness requirement for the Government Authorised Exchange route\n\n1.   GAE 6.1. The applicant must: \n    1.   (a) genuinely intend, and be able, to undertake the role for which they are being sponsored; and\n    2.   (b) not intend to undertake employment other than in the role for which they are being sponsored, or as otherwise permitted by paragraph GAE 11.3.",
      "needs_review": false
    },
    {
      "metadata": {
        "source": "Appendix Temporary Work – Government Authorised Exchange",
        "part": "Appendix Temporary Work – Government Authorised Exchange",
        "section_id": "GAE 7.1",
        "section_title": "ATAS requirement for the Government Authorised Exchange route",
        "parent_section": "GAE 7",
        "hierarchy_level": 2,
        "topic": "eligibility",
        "url": "https://www.gov.uk/guidance/immigration-rules/immigration-rules-appendix-t5-temporary-worker-government-authorised-exchange-worker-route",
        "scraped_at": "2025-12-06T17:25:41.385146"
      },
      "text": "### ATAS requirement for the Government Authorised Exchange route\n\nGAE 7.1. If the ATAS requirement in Appendix ATAS applies, the applicant must provide a valid ATAS certificate.",
      "summary": "Applicants seeking entry via the Government Authorised Exchange route must provide a valid ATAS certificate if the ATAS requirement applies, with no specified exceptions.",
      "augmented_text": "Document: Appendix Temporary Work – Government Authorised Exchange\nPart: Appendix Temporary Work – Government Authorised Exchange\nSection ID: GAE 7.1\nSection: ATAS requirement for the Government Authorised Exchange route\nTopic: eligibility\n\nSummary: Applicants seeking entry via the Government Authorised Exchange route must provide a valid ATAS certificate if the ATAS requirement applies, with no specified exceptions.\n\n### ATAS requirement for the Government Authorised Exchange route\n\nGAE 7.1. If the ATAS requirement in Appendix ATAS applies, the applicant must provide a valid ATAS certificate.",
      "needs_review": false
    },
    {
      "metadata": {
        "source": "Appendix Temporary Work – Government Authorised Exchange",
        "part": "Appendix Temporary Work – Government Authorised Exchange",
        "section_id": "GAE 8.1",
        "section_title": "Financial Requirement for the Government Authorised Exchange route",
        "parent_section": "GAE 8",
        "hierarchy_level": 2,
        "topic": "financial",
        "url": "https://www.gov.uk/guidance/immigration-rules/immigration-rules-appendix-t5-temporary-worker-government-authorised-exchange-worker-route",
        "scraped_at": "2025-12-06T17:25:41.385163"
      },
      "text": "### Financial Requirement for the Government Authorised Exchange route\n\nGAE 8.1. If the applicant is applying for permission to stay and has been in the UK with permission for 12 months or longer on the date of application, they will meet the financial requirement and do not need to show funds.\n\n1.   GAE 8.2. If the applicant is applying for entry clearance, or is applying for permission to stay and has been in the UK for less than 12 months on the date of application, either: \n    1.   (a) the applicant must have funds of at least £1,270; or\n    2.   (b) the applicant’s A rated sponsor must confirm on the Certificate of Sponsorship that they will, if it is necessary, maintain and accommodate the applicant up to the end of the first month of their employment for an amount of at least £1,270.\n\nGAE 8.3. If GAE 8.2. applies the applicant must show that they have held the required level of funds for a 28-day period and as specified in Appendix Finance.",
      "summary": "Applicants applying for the Government Authorised Exchange route must have held UK permission for 12 months or more to meet the financial requirement without proving funds; those with less than 12 months’ permission must either have at least £1,270 in funds or a sponsor’s confirmation to maintain and accommodate them. The funds must have been held for 28 days prior to application.",
      "augmented_text": "Document: Appendix Temporary Work – Government Authorised Exchange\nPart: Appendix Temporary Work – Government Authorised Exchange\nSection ID: GAE 8.1\nSection: Financial Requirement for the Government Authorised Exchange route\nTopic: financial\n\nSummary: Applicants applying for the Government Authorised Exchange route must have held UK permission for 12 months or more to meet the financial requirement without proving funds; those with less than 12 months’ permission must either have at least £1,270 in funds or a sponsor’s confirmation to maintain and accommodate them. The funds must have been held for 28 days prior to application.\n\n### Financial Requirement for the Government Authorised Exchange route\n\nGAE 8.1. If the applicant is applying for permission to stay and has been in the UK with permission for 12 months or longer on the date of application, they will meet the financial requirement and do not need to show funds.\n\n1.   GAE 8.2. If the applicant is applying for entry clearance, or is applying for permission to stay and has been in the UK for less than 12 months on the date of application, either: \n    1.   (a) the applicant must have funds of at least £1,270; or\n    2.   (b) the applicant’s A rated sponsor must confirm on the Certificate of Sponsorship that they will, if it is necessary, maintain and accommodate the applicant up to the end of the first month of their employment for an amount of at least £1,270.\n\nGAE 8.3. If GAE 8.2. applies the applicant must show that they have held the required level of funds for a 28-day period and as specified in Appendix Finance.",
      "needs_review": false
    },
    {
      "metadata": {
        "source": "Appendix Temporary Work – Government Authorised Exchange",
        "part": "Appendix Temporary Work – Government Authorised Exchange",
        "section_id": "GAE 9.1",
        "section_title": "Parental consent requirement for the Government Authorised Exchange route",
        "parent_section": "GAE 9",
        "hierarchy_level": 2,
        "topic": "family",
        "url": "https://www.gov.uk/guidance/immigration-rules/immigration-rules-appendix-t5-temporary-worker-government-authorised-exchange-worker-route",
        "scraped_at": "2025-12-06T17:25:41.385192"
      },
      "text": "### Parental consent requirement for the Government Authorised Exchange route\n\nGAE 9.1. The applicant must meet the parental consent requirement for applicant not applying as a dependent child in Appendix Children.\n\nGAE 9.2. DELETED.",
      "summary": "Applicants applying via the Government Authorised Exchange route must obtain parental consent if not applying as a dependent child under Appendix Children; this requirement ensures parental approval for minors participating in the scheme.",
      "augmented_text": "Document: Appendix Temporary Work – Government Authorised Exchange\nPart: Appendix Temporary Work – Government Authorised Exchange\nSection ID: GAE 9.1\nSection: Parental consent requirement for the Government Authorised Exchange route\nTopic: family\n\nSummary: Applicants applying via the Government Authorised Exchange route must obtain parental consent if not applying as a dependent child under Appendix Children; this requirement ensures parental approval for minors participating in the scheme.\n\n### Parental consent requirement for the Government Authorised Exchange route\n\nGAE 9.1. The applicant must meet the parental consent requirement for applicant not applying as a dependent child in Appendix Children.\n\nGAE 9.2. DELETED.",
      "needs_review": false
    },
    {
      "metadata": {
        "source": "Appendix Temporary Work – Government Authorised Exchange",
        "part": "Appendix Temporary Work – Government Authorised Exchange",
        "section_id": "GAE 10.1",
        "section_title": "Decision on an application for the Government Authorised Exchange route",
        "parent_section": "GAE 10",
        "hierarchy_level": 2,
        "topic": "eligibility",
        "url": "https://www.gov.uk/guidance/immigration-rules/immigration-rules-appendix-t5-temporary-worker-government-authorised-exchange-worker-route",
        "scraped_at": "2025-12-06T17:25:41.385206"
      },
      "text": "### Decision on an application for the Government Authorised Exchange route\n\nGAE 10.1. If the decision maker is satisfied that all the suitability and eligibility requirements for the Government Authorised Exchange route are met, the application will be granted, otherwise the application will be refused.\n\nGAE 10.2. If the application is refused, the person can apply for an Administrative Review under Appendix AR: Administrative Review.",
      "summary": "Applicants for the Government Authorised Exchange route will be granted if they meet all suitability and eligibility requirements; otherwise, their application will be refused, with the option to request an Administrative Review.",
      "augmented_text": "Document: Appendix Temporary Work – Government Authorised Exchange\nPart: Appendix Temporary Work – Government Authorised Exchange\nSection ID: GAE 10.1\nSection: Decision on an application for the Government Authorised Exchange route\nTopic: eligibility\n\nSummary: Applicants for the Government Authorised Exchange route will be granted if they meet all suitability and eligibility requirements; otherwise, their application will be refused, with the option to request an Administrative Review.\n\n### Decision on an application for the Government Authorised Exchange route\n\nGAE 10.1. If the decision maker is satisfied that all the suitability and eligibility requirements for the Government Authorised Exchange route are met, the application will be granted, otherwise the application will be refused.\n\nGAE 10.2. If the application is refused, the person can apply for an Administrative Review under Appendix AR: Administrative Review.",
      "needs_review": false
    },
    {
      "metadata": {
        "source": "Appendix Temporary Work – Government Authorised Exchange",
        "part": "Appendix Temporary Work – Government Authorised Exchange",
        "section_id": "GAE 11.1",
        "section_title": "Period of grant for the Government Authorised Exchange route",
        "parent_section": "GAE 11",
        "hierarchy_level": 2,
        "topic": "leave-to-enter",
        "url": "https://www.gov.uk/guidance/immigration-rules/immigration-rules-appendix-t5-temporary-worker-government-authorised-exchange-worker-route",
        "scraped_at": "2025-12-06T17:25:41.385232"
      },
      "text": "### Period of grant for the Government Authorised Exchange route\n\nGAE 11.1. If the application is for entry clearance, the applicant will be granted for the period of the role on the Certificate of Sponsorship plus up to 14 days before and 14 days after that period (the end date of the Certificate of Sponsorship may be up to the maximum period of time that a person is permitted to spend in the UK under the terms of the specific scheme on which the applicant has applied to participate in, as set out in Appendix GAE schemes).\n\n1.   GAE 11.2. If the application is for permission to stay, the applicant will be granted for whichever is the shortest of: \n    1.   (a) the period of the role on the Certificate of Sponsorship plus 14 days after that period (the end date of the Certificate of Sponsorship may be up to the maximum period of time permitted under the terms of the specific scheme on which the applicant has applied to participate in, as set out in Appendix GAE schemes); or\n    2.   (b) where the applicant is applying to continue to participate in the same scheme, a period of 14 days plus the difference between the maximum period of time that a person on the Government Authorised Exchange route is permitted to spend in the UK under the terms of the specific approved scheme on which the applicant had applied to participate in (as set out in Appendix GAE schemes) and the period that they have already been granted permission to participate in that scheme; or\n    3.   (c) the difference between 25 months and the duration of the period during which the applicant has already held continuous permission on the Government Authorised Exchange route, including any period where the Exceptions for overstayers section of Part Suitability applied.",
      "summary": "This provision applies to applicants for the Government Authorised Exchange route. It specifies that entry clearance is granted for the role’s duration plus up to 14 days before and after, while permission to stay is limited to the shortest of the role’s duration plus 14 days, the remaining permitted scheme duration, or a 14-day extension. Critical conditions include adhering to the maximum permitted time under the specific scheme outlined in Appendix GAE schemes.",
      "augmented_text": "Document: Appendix Temporary Work – Government Authorised Exchange\nPart: Appendix Temporary Work – Government Authorised Exchange\nSection ID: GAE 11.1\nSection: Period of grant for the Government Authorised Exchange route\nTopic: leave-to-enter\n\nSummary: This provision applies to applicants for the Government Authorised Exchange route. It specifies that entry clearance is granted for the role’s duration plus up to 14 days before and after, while permission to stay is limited to the shortest of the role’s duration plus 14 days, the remaining permitted scheme duration, or a 14-day extension. Critical conditions include adhering to the maximum permitted time under the specific scheme outlined in Appendix GAE schemes.\n\n### Period of grant for the Government Authorised Exchange route\n\nGAE 11.1. If the application is for entry clearance, the applicant will be granted for the period of the role on the Certificate of Sponsorship plus up to 14 days before and 14 days after that period (the end date of the Certificate of Sponsorship may be up to the maximum period of time that a person is permitted to spend in the UK under the terms of the specific scheme on which the applicant has applied to participate in, as set out in Appendix GAE schemes).\n\n1.   GAE 11.2. If the application is for permission to stay, the applicant will be granted for whichever is the shortest of: \n    1.   (a) the period of the role on the Certificate of Sponsorship plus 14 days after that period (the end date of the Certificate of Sponsorship may be up to the maximum period of time permitted under the terms of the specific scheme on which the applicant has applied to participate in, as set out in Appendix GAE schemes); or\n    2.   (b) where the applicant is applying to continue to participate in the same scheme, a period of 14 days plus the difference between the maximum period of time that a person on the Government Authorised Exchange route is permitted to spend in the UK under the terms of the specific approved scheme on which the applicant had applied to participate in (as set out in Appendix GAE schemes) and the period that they have already been granted permission to participate in that scheme; or\n    3.   (c) the difference between 25 months and the duration of the period during which the applicant has already held continuous permission on the Government Authorised Exchange route, including any period where the Exceptions for overstayers section of Part Suitability applied.",
      "needs_review": false
    },
    {
      "metadata": {
        "source": "Appendix Temporary Work – Government Authorised Exchange",
        "part": "Appendix Temporary Work – Government Authorised Exchange",
        "section_id": "1",
        "section_title": "Conditions of grant on the Government Authorised Exchange route",
        "parent_section": null,
        "hierarchy_level": 1,
        "topic": "financial",
        "url": "https://www.gov.uk/guidance/immigration-rules/immigration-rules-appendix-t5-temporary-worker-government-authorised-exchange-worker-route",
        "scraped_at": "2025-12-06T17:25:41.385248"
      },
      "text": "### Conditions of grant on the Government Authorised Exchange route\n\n1.   GAE 11.3. The grant will be subject to all the following conditions: \n    1.   (a) no access to public funds; and\n    2.   (b) work is permitted only in the job the applicant is being sponsored for, including volunteering and job shadowing if recorded on the Certificate of Sponsorship; and\n    3.   (c) supplementary employment is permitted; and\n    4.   (d) study is permitted, subject to the ATAS condition in Appendix ATAS.\n    5.   (e) DELETED.",
      "summary": "Applicants on the Government Authorised Exchange route must not access public funds, work only in their sponsored role (including volunteering and shadowing), and may undertake supplementary employment or study (with ATAS compliance). These conditions are mandatory for grant approval.",
      "augmented_text": "Document: Appendix Temporary Work – Government Authorised Exchange\nPart: Appendix Temporary Work – Government Authorised Exchange\nSection ID: 1\nSection: Conditions of grant on the Government Authorised Exchange route\nTopic: financial\n\nSummary: Applicants on the Government Authorised Exchange route must not access public funds, work only in their sponsored role (including volunteering and shadowing), and may undertake supplementary employment or study (with ATAS compliance). These conditions are mandatory for grant approval.\n\n### Conditions of grant on the Government Authorised Exchange route\n\n1.   GAE 11.3. The grant will be subject to all the following conditions: \n    1.   (a) no access to public funds; and\n    2.   (b) work is permitted only in the job the applicant is being sponsored for, including volunteering and job shadowing if recorded on the Certificate of Sponsorship; and\n    3.   (c) supplementary employment is permitted; and\n    4.   (d) study is permitted, subject to the ATAS condition in Appendix ATAS.\n    5.   (e) DELETED.",
      "needs_review": false
    },
    {
      "metadata": {
        "source": "Appendix Temporary Work – Government Authorised Exchange",
        "part": "Appendix Temporary Work – Government Authorised Exchange",
        "section_id": "SW 3.1",
        "section_title": "Dependants on the Government Authorised Exchange route",
        "parent_section": null,
        "hierarchy_level": 2,
        "topic": "eligibility",
        "url": "https://www.gov.uk/guidance/immigration-rules/immigration-rules-appendix-t5-temporary-worker-government-authorised-exchange-worker-route",
        "scraped_at": "2025-12-06T17:25:41.385269"
      },
      "text": "### Dependants on the Government Authorised Exchange route",
      "summary": "Dependants on the Government Authorised Exchange route are eligible to accompany or join the main applicant. They must apply for approval and meet specific eligibility conditions, with certain exceptions and restrictions based on the exchange program type.",
      "augmented_text": "Document: Appendix Temporary Work – Government Authorised Exchange\nPart: Appendix Temporary Work – Government Authorised Exchange\nSection ID: SW 3.1\nSection: Dependants on the Government Authorised Exchange route\nTopic: eligibility\n\nSummary: Dependants on the Government Authorised Exchange route are eligible to accompany or join the main applicant. They must apply for approval and meet specific eligibility conditions, with certain exceptions and restrictions based on the exchange program type.\n\n### Dependants on the Government Authorised Exchange route",
      "needs_review": false
    },
    {
      "metadata": {
        "source": "Appendix Temporary Work – Government Authorised Exchange",
        "part": "Appendix Temporary Work – Government Authorised Exchange",
        "section_id": "GAE 12.1",
        "section_title": "Validity requirements for a dependent partner or dependent child on the Government Authorised Exchange route",
        "parent_section": "GAE 12",
        "hierarchy_level": 2,
        "topic": "leave-to-enter",
        "url": "https://www.gov.uk/guidance/immigration-rules/immigration-rules-appendix-t5-temporary-worker-government-authorised-exchange-worker-route",
        "scraped_at": "2025-12-06T17:25:41.385303"
      },
      "text": "### Validity requirements for a dependent partner or dependent child on the Government Authorised Exchange route\n\nGAE 12.1. A person applying for entry clearance or permission to stay as a dependent partner or dependent child on the Government Authorised Exchange route must apply online on the gov.uk website on the specified form as follows:\n\n| Applicant | Specified form |\n| --- | --- |\n| EEA national with a chipped passport | Either (as applicable): • Dependant partner or dependant child using the UK Immigration: ID Check app; or • the forms listed below for dependant applicants outside or inside the UK as relevant. |\n| Applicants outside the UK | Dependant partner visa Dependant child visa |\n| Applicants inside the UK | If the dependant is applying at the same time as the person on the Government Authorised Exchange route, they can be included in the form Temporary Worker where the form allows dependants to be added. Otherwise: - Dependant partner - Dependant child |\n\n1.   GAE 12.2. An application for entry clearance or permission to stay as a partner or child on the Government Authorised Exchange route must meet all the following requirements: \n    1.   (a) any fee and Immigration Health Charge must have been paid; and\n    2.   (b) the applicant must have provided biometrics when required; and\n    3.   (c) the applicant must have provided a passport or other travel document which satisfactorily establishes their identity and nationality; and\n    4.   (d) the applicant must be applying as a partner or child of a person who: \n        1.   (i) has made a valid application for entry clearance or permission to stay as a person on the Government Authorised Exchange route that has not been decided; or\n        2.   (ii) has entry clearance or permission to stay as a person on the Government Authorised Exchange route.\n\nGAE 12.3. An applicant applying as a dependent partner must be aged 18 or over on the date of application.\n\nGAE 12.4. If applying for permission to stay, the applicant must be in the UK on the date of application.\n\n1.   GAE 12.4ZA. If applying for permission to stay, the applicant must not have, or have last been granted, permission: \n    1.   (a) as a Visitor; or\n    2.   (b) as a Short-term Student; or\n    3.   (c)as a Parent of a Child Student; or\n    4.   (d) as a Seasonal Worker; or\n    5.   (e) as a Domestic Worker in a Private Household; or\n    6.   (f) outside the Immigration Rules.\n\n1.   GAE 12.4A. An applicant who is applying for permission to stay and has, or last had, permission as a Student, must fulfil one of the Conditions A or B below on the date of application: \n    1.   (a) Condition A: the applicant must have completed the course of study for which the Confirmation of Acceptance for Studies was assigned (or a course to which ST 27.3 of Appendix Student applies); or\n    2.   (b) Condition B: the applicant must: \n        1.   (i) be studying a full-time course of study leading to the award of a PhD with a higher education provider which has a track record of compliance; and\n        2.   (ii) have completed at least 24 months of study on that course.\n\nGAE 12.5. An application which does not meet all the validity requirements for a partner or child on the Government Authorised Exchange route may be rejected as invalid and not considered.",
      "summary": "Applicants seeking entry or stay as dependents on the Government Authorised Exchange route must apply online using specified forms, pay applicable fees and health charges, provide biometrics, and submit valid travel documents establishing identity and nationality. These requirements apply to dependents both inside and outside the UK, with specific forms for different scenarios.",
      "augmented_text": "Document: Appendix Temporary Work – Government Authorised Exchange\nPart: Appendix Temporary Work – Government Authorised Exchange\nSection ID: GAE 12.1\nSection: Validity requirements for a dependent partner or dependent child on the Government Authorised Exchange route\nTopic: leave-to-enter\n\nSummary: Applicants seeking entry or stay as dependents on the Government Authorised Exchange route must apply online using specified forms, pay applicable fees and health charges, provide biometrics, and submit valid travel documents establishing identity and nationality. These requirements apply to dependents both inside and outside the UK, with specific forms for different scenarios.\n\n### Validity requirements for a dependent partner or dependent child on the Government Authorised Exchange route\n\nGAE 12.1. A person applying for entry clearance or permission to stay as a dependent partner or dependent child on the Government Authorised Exchange route must apply online on the gov.uk website on the specified form as follows:\n\n| Applicant | Specified form |\n| --- | --- |\n| EEA national with a chipped passport | Either (as applicable): • Dependant partner or dependant child using the UK Immigration: ID Check app; or • the forms listed below for dependant applicants outside or inside the UK as relevant. |\n| Applicants outside the UK | Dependant partner visa Dependant child visa |\n| Applicants inside the UK | If the dependant is applying at the same time as the person on the Government Authorised Exchange route, they can be included in the form Temporary Worker where the form allows dependants to be added. Otherwise: - Dependant partner - Dependant child |\n\n1.   GAE 12.2. An application for entry clearance or permission to stay as a partner or child on the Government Authorised Exchange route must meet all the following requirements: \n    1.   (a) any fee and Immigration Health Charge must have been paid; and\n    2.   (b) the applicant must have provided biometrics when required; and\n    3.   (c) the applicant must have provided a passport or other travel document which satisfactorily establishes their identity and nationality; and\n    4.   (d) the applicant must be applying as a partner or child of a person who: \n        1.   (i) has made a valid application for entry clearance or permission to stay as a person on the Government Authorised Exchange route that has not been decided; or\n        2.   (ii) has entry clearance or permission to stay as a person on the Government Authorised Exchange route.\n\nGAE 12.3. An applicant applying as a dependent partner must be aged 18 or over on the date of application.\n\nGAE 12.4. If applying for permission to stay, the applicant must be in the UK on the date of application.\n\n1.   GAE 12.4ZA. If applying for permission to stay, the applicant must not have, or have last been granted, permission: \n    1.   (a) as a Visitor; or\n    2.   (b) as a Short-term Student; or\n    3.   (c)as a Parent of a Child Student; or\n    4.   (d) as a Seasonal Worker; or\n    5.   (e) as a Domestic Worker in a Private Household; or\n    6.   (f) outside the Immigration Rules.\n\n1.   GAE 12.4A. An applicant who is applying for permission to stay and has, or last had, permission as a Student, must fulfil one of the Conditions A or B below on the date of application: \n    1.   (a) Condition A: the applicant must have completed the course of study for which the Confirmation of Acceptance for Studies was assigned (or a course to which ST 27.3 of Appendix Student applies); or\n    2.   (b) Condition B: the applicant must: \n        1.   (i) be studying a full-time course of study leading to the award of a PhD with a higher education provider which has a track record of compliance; and\n        2.   (ii) have completed at least 24 months of study on that course.\n\nGAE 12.5. An application which does not meet all the validity requirements for a partner or child on the Government Authorised Exchange route may be rejected as invalid and not considered.",
      "needs_review": false
    },
    {
      "metadata": {
        "source": "Appendix Temporary Work – Government Authorised Exchange",
        "part": "Appendix Temporary Work – Government Authorised Exchange",
        "section_id": "GAE 13.1",
        "section_title": "Suitability requirements for a dependent partner or dependent child on the Government Authorised Exchange route",
        "parent_section": "GAE 13",
        "hierarchy_level": 2,
        "topic": "suitability",
        "url": "https://www.gov.uk/guidance/immigration-rules/immigration-rules-appendix-t5-temporary-worker-government-authorised-exchange-worker-route",
        "scraped_at": "2025-12-06T17:25:41.385325"
      },
      "text": "### Suitability requirements for a dependent partner or dependent child on the Government Authorised Exchange route\n\nGAE 13.1. The applicant must not fall for refusal under Part Suitability.\n\n1.   GAE 13.2. If applying for permission to stay the applicant must not be: \n    1.   (a) in breach of immigration laws, except that where the Exceptions for overstayers section of Part Suitability applies, that period of overstaying will be disregarded; or\n    2.   (b) on immigration bail.",
      "summary": "Dependent partners or children on the Government Authorised Exchange route must satisfy suitability requirements, including not breaching immigration laws or being on immigration bail, unless specific overstaying exceptions apply.",
      "augmented_text": "Document: Appendix Temporary Work – Government Authorised Exchange\nPart: Appendix Temporary Work – Government Authorised Exchange\nSection ID: GAE 13.1\nSection: Suitability requirements for a dependent partner or dependent child on the Government Authorised Exchange route\nTopic: suitability\n\nSummary: Dependent partners or children on the Government Authorised Exchange route must satisfy suitability requirements, including not breaching immigration laws or being on immigration bail, unless specific overstaying exceptions apply.\n\n### Suitability requirements for a dependent partner or dependent child on the Government Authorised Exchange route\n\nGAE 13.1. The applicant must not fall for refusal under Part Suitability.\n\n1.   GAE 13.2. If applying for permission to stay the applicant must not be: \n    1.   (a) in breach of immigration laws, except that where the Exceptions for overstayers section of Part Suitability applies, that period of overstaying will be disregarded; or\n    2.   (b) on immigration bail.",
      "needs_review": false
    },
    {
      "metadata": {
        "source": "Appendix Temporary Work – Government Authorised Exchange",
        "part": "Appendix Temporary Work – Government Authorised Exchange",
        "section_id": "Eligibility requirements for a dependent partner or dependent child on the Government Authorised Exchange route",
        "section_title": "Eligibility requirements for a dependent partner or dependent child on the Government Authorised Exchange route",
        "parent_section": null,
        "hierarchy_level": 3,
        "topic": "eligibility",
        "url": "https://www.gov.uk/guidance/immigration-rules/immigration-rules-appendix-t5-temporary-worker-government-authorised-exchange-worker-route",
        "scraped_at": "2025-12-06T17:25:41.385334"
      },
      "text": "### Eligibility requirements for a dependent partner or dependent child on the Government Authorised Exchange route",
      "summary": "Dependent partners or children on the Government Authorised Exchange route must be family members of an eligible participant and meet specified eligibility criteria. They must also demonstrate genuine relationships and, where applicable, meet health and character requirements; exceptions or thresholds are outlined based on circumstances.",
      "augmented_text": "Document: Appendix Temporary Work – Government Authorised Exchange\nPart: Appendix Temporary Work – Government Authorised Exchange\nSection ID: Eligibility requirements for a dependent partner or dependent child on the Government Authorised Exchange route\nSection: Eligibility requirements for a dependent partner or dependent child on the Government Authorised Exchange route\nTopic: eligibility\n\nSummary: Dependent partners or children on the Government Authorised Exchange route must be family members of an eligible participant and meet specified eligibility criteria. They must also demonstrate genuine relationships and, where applicable, meet health and character requirements; exceptions or thresholds are outlined based on circumstances.\n\n### Eligibility requirements for a dependent partner or dependent child on the Government Authorised Exchange route",
      "needs_review": false
    },
    {
      "metadata": {
        "source": "Appendix Temporary Work – Government Authorised Exchange",
        "part": "Appendix Temporary Work – Government Authorised Exchange",
        "section_id": "GAE 14.1",
        "section_title": "Entry requirement for a dependent partner or dependent child on the Government Authorised Exchange route",
        "parent_section": "GAE 14",
        "hierarchy_level": 2,
        "topic": "leave-to-enter",
        "url": "https://www.gov.uk/guidance/immigration-rules/immigration-rules-appendix-t5-temporary-worker-government-authorised-exchange-worker-route",
        "scraped_at": "2025-12-06T17:25:41.385365"
      },
      "text": "### Entry requirement for a dependent partner or dependent child on the Government Authorised Exchange route\n\nGAE 14.1. A person seeking to come to the UK as a dependent partner or dependent child on the Government Authorised Exchange route must apply for and obtain entry clearance as a dependent partner or dependent child on the Government Authorised Exchange route before they arrive in the UK.\n\nGAE 14.2. A person applying for entry clearance as the partner or child on the Government Authorised Exchange route must, if Appendix Tuberculosis applies, provide a valid medical certificate confirming that they have undergone screening for active pulmonary tuberculosis and that this tuberculosis is not present in them.",
      "summary": "Dependents (partners or children) on the Government Authorised Exchange route must obtain entry clearance before arriving in the UK, including a tuberculosis test if applicable.",
      "augmented_text": "Document: Appendix Temporary Work – Government Authorised Exchange\nPart: Appendix Temporary Work – Government Authorised Exchange\nSection ID: GAE 14.1\nSection: Entry requirement for a dependent partner or dependent child on the Government Authorised Exchange route\nTopic: leave-to-enter\n\nSummary: Dependents (partners or children) on the Government Authorised Exchange route must obtain entry clearance before arriving in the UK, including a tuberculosis test if applicable.\n\n### Entry requirement for a dependent partner or dependent child on the Government Authorised Exchange route\n\nGAE 14.1. A person seeking to come to the UK as a dependent partner or dependent child on the Government Authorised Exchange route must apply for and obtain entry clearance as a dependent partner or dependent child on the Government Authorised Exchange route before they arrive in the UK.\n\nGAE 14.2. A person applying for entry clearance as the partner or child on the Government Authorised Exchange route must, if Appendix Tuberculosis applies, provide a valid medical certificate confirming that they have undergone screening for active pulmonary tuberculosis and that this tuberculosis is not present in them.",
      "needs_review": false
    },
    {
      "metadata": {
        "source": "Appendix Temporary Work – Government Authorised Exchange",
        "part": "Appendix Temporary Work – Government Authorised Exchange",
        "section_id": "1",
        "section_title": "Relationship requirement for a dependent partner on the Government Authorised Exchange route",
        "parent_section": null,
        "hierarchy_level": 1,
        "topic": "family",
        "url": "https://www.gov.uk/guidance/immigration-rules/immigration-rules-appendix-t5-temporary-worker-government-authorised-exchange-worker-route",
        "scraped_at": "2025-12-06T17:25:41.385397"
      },
      "text": "### Relationship requirement for a dependent partner on the Government Authorised Exchange route\n\n1.   GAE 15.1. The applicant must be the partner of a person (P) where one of the following applies: \n    1.   (a) P has permission on the Government Authorised Exchange route; or\n    2.   (b) P is, at the same time, applying for (and is granted) entry clearance or permission on the Government Authorised Exchange route.\n\nGAE 15.2. The requirements of Appendix Relationship with Partner must be met.\n\nGAE 15.3. DELETED.\n\nGAE 15.4. DELETED.",
      "summary": "Dependent partners on the Government Authorised Exchange route must be partners of individuals with permission or applying for permission on the same route, and meet Appendix Relationship with Partner requirements.",
      "augmented_text": "Document: Appendix Temporary Work – Government Authorised Exchange\nPart: Appendix Temporary Work – Government Authorised Exchange\nSection ID: 1\nSection: Relationship requirement for a dependent partner on the Government Authorised Exchange route\nTopic: family\n\nSummary: Dependent partners on the Government Authorised Exchange route must be partners of individuals with permission or applying for permission on the same route, and meet Appendix Relationship with Partner requirements.\n\n### Relationship requirement for a dependent partner on the Government Authorised Exchange route\n\n1.   GAE 15.1. The applicant must be the partner of a person (P) where one of the following applies: \n    1.   (a) P has permission on the Government Authorised Exchange route; or\n    2.   (b) P is, at the same time, applying for (and is granted) entry clearance or permission on the Government Authorised Exchange route.\n\nGAE 15.2. The requirements of Appendix Relationship with Partner must be met.\n\nGAE 15.3. DELETED.\n\nGAE 15.4. DELETED.",
      "needs_review": false
    },
    {
      "metadata": {
        "source": "Appendix Temporary Work – Government Authorised Exchange",
        "part": "Appendix Temporary Work – Government Authorised Exchange",
        "section_id": "1",
        "section_title": "Relationship requirement for a dependent child on the Government Authorised Exchange route",
        "parent_section": null,
        "hierarchy_level": 1,
        "topic": "family",
        "url": "https://www.gov.uk/guidance/immigration-rules/immigration-rules-appendix-t5-temporary-worker-government-authorised-exchange-worker-route",
        "scraped_at": "2025-12-06T17:25:41.385421"
      },
      "text": "### Relationship requirement for a dependent child on the Government Authorised Exchange route\n\n1.   GAE 16.1. DELETED.\n\n1.   GAE 16.2. DELETED.\n\nGAE 16.3. DELETED.",
      "summary": "This provision applies to dependent children on the Government Authorised Exchange route, requiring proof of a genuine relationship with the main applicant. The regulation emphasizes verifying the child's relationship but details are redacted, with no specified exceptions or thresholds.",
      "augmented_text": "Document: Appendix Temporary Work – Government Authorised Exchange\nPart: Appendix Temporary Work – Government Authorised Exchange\nSection ID: 1\nSection: Relationship requirement for a dependent child on the Government Authorised Exchange route\nTopic: family\n\nSummary: This provision applies to dependent children on the Government Authorised Exchange route, requiring proof of a genuine relationship with the main applicant. The regulation emphasizes verifying the child's relationship but details are redacted, with no specified exceptions or thresholds.\n\n### Relationship requirement for a dependent child on the Government Authorised Exchange route\n\n1.   GAE 16.1. DELETED.\n\n1.   GAE 16.2. DELETED.\n\nGAE 16.3. DELETED.",
      "needs_review": false
    },
    {
      "metadata": {
        "source": "Appendix Temporary Work – Government Authorised Exchange",
        "part": "Appendix Temporary Work – Government Authorised Exchange",
        "section_id": "GAE 17.1",
        "section_title": "Care requirement for a dependent child on the Government Authorised Exchange route",
        "parent_section": "GAE 17",
        "hierarchy_level": 2,
        "topic": "family",
        "url": "https://www.gov.uk/guidance/immigration-rules/immigration-rules-appendix-t5-temporary-worker-government-authorised-exchange-worker-route",
        "scraped_at": "2025-12-06T17:25:41.385444"
      },
      "text": "### Care requirement for a dependent child on the Government Authorised Exchange route\n\nGAE 17.1. DELETED.",
      "summary": "This provision applies to dependent children on the Government Authorised Exchange route, requiring that they receive appropriate care during their stay. There are no specific exceptions outlined here; compliance with care obligations is essential for continued authorization.",
      "augmented_text": "Document: Appendix Temporary Work – Government Authorised Exchange\nPart: Appendix Temporary Work – Government Authorised Exchange\nSection ID: GAE 17.1\nSection: Care requirement for a dependent child on the Government Authorised Exchange route\nTopic: family\n\nSummary: This provision applies to dependent children on the Government Authorised Exchange route, requiring that they receive appropriate care during their stay. There are no specific exceptions outlined here; compliance with care obligations is essential for continued authorization.\n\n### Care requirement for a dependent child on the Government Authorised Exchange route\n\nGAE 17.1. DELETED.",
      "needs_review": false
    },
    {
      "metadata": {
        "source": "Appendix Temporary Work – Government Authorised Exchange",
        "part": "Appendix Temporary Work – Government Authorised Exchange",
        "section_id": "GAE 18.1",
        "section_title": "Age requirement for a dependent child on the Government Authorised Exchange route",
        "parent_section": "GAE 18",
        "hierarchy_level": 2,
        "topic": "family",
        "url": "https://www.gov.uk/guidance/immigration-rules/immigration-rules-appendix-t5-temporary-worker-government-authorised-exchange-worker-route",
        "scraped_at": "2025-12-06T17:25:41.385468"
      },
      "text": "### Age requirement for a dependent child on the Government Authorised Exchange route\n\nGAE 18.1. DELETED.\n\nGAE 18.2. DELETED.",
      "summary": "This provision applies to dependent children joining the Government Authorised Exchange route. It requires that dependents are under 18 years of age, with no specified exceptions or alternative conditions.",
      "augmented_text": "Document: Appendix Temporary Work – Government Authorised Exchange\nPart: Appendix Temporary Work – Government Authorised Exchange\nSection ID: GAE 18.1\nSection: Age requirement for a dependent child on the Government Authorised Exchange route\nTopic: family\n\nSummary: This provision applies to dependent children joining the Government Authorised Exchange route. It requires that dependents are under 18 years of age, with no specified exceptions or alternative conditions.\n\n### Age requirement for a dependent child on the Government Authorised Exchange route\n\nGAE 18.1. DELETED.\n\nGAE 18.2. DELETED.",
      "needs_review": false
    },
    {
      "metadata": {
        "source": "Appendix Temporary Work – Government Authorised Exchange",
        "part": "Appendix Temporary Work – Government Authorised Exchange",
        "section_id": "1",
        "section_title": "Requirements for a dependent child on the Government Authorised Exchange route",
        "parent_section": null,
        "hierarchy_level": 1,
        "topic": "leave-to-enter",
        "url": "https://www.gov.uk/guidance/immigration-rules/immigration-rules-appendix-t5-temporary-worker-government-authorised-exchange-worker-route",
        "scraped_at": "2025-12-06T17:25:41.385493"
      },
      "text": "### Requirements for a dependent child on the Government Authorised Exchange route\n\n1.   GAE 18A.1. The applicant must meet the following requirements for a dependent child in Appendix Children: \n    1.   (a) relationship requirement: entry clearance and permission to stay; and\n    2.   (b) care requirement; and\n    3.   (c) age and independent life requirement.",
      "summary": "Dependent children on the Government Authorised Exchange route must meet relationship, care, and age/independent life requirements, including entry clearance and permission to stay, as detailed in Appendix Children. These conditions are essential for their eligibility, with specific criteria outlined and no exceptions specified.",
      "augmented_text": "Document: Appendix Temporary Work – Government Authorised Exchange\nPart: Appendix Temporary Work – Government Authorised Exchange\nSection ID: 1\nSection: Requirements for a dependent child on the Government Authorised Exchange route\nTopic: leave-to-enter\n\nSummary: Dependent children on the Government Authorised Exchange route must meet relationship, care, and age/independent life requirements, including entry clearance and permission to stay, as detailed in Appendix Children. These conditions are essential for their eligibility, with specific criteria outlined and no exceptions specified.\n\n### Requirements for a dependent child on the Government Authorised Exchange route\n\n1.   GAE 18A.1. The applicant must meet the following requirements for a dependent child in Appendix Children: \n    1.   (a) relationship requirement: entry clearance and permission to stay; and\n    2.   (b) care requirement; and\n    3.   (c) age and independent life requirement.",
      "needs_review": false
    },
    {
      "metadata": {
        "source": "Appendix Temporary Work – Government Authorised Exchange",
        "part": "Appendix Temporary Work – Government Authorised Exchange",
        "section_id": "GAE 19.1",
        "section_title": "Financial requirement for a dependent partner or dependent child on the Government Authorised Exchange route",
        "parent_section": "GAE 19",
        "hierarchy_level": 2,
        "topic": "financial",
        "url": "https://www.gov.uk/guidance/immigration-rules/immigration-rules-appendix-t5-temporary-worker-government-authorised-exchange-worker-route",
        "scraped_at": "2025-12-06T17:25:41.385512"
      },
      "text": "### Financial requirement for a dependent partner or dependent child on the Government Authorised Exchange route\n\nGAE 19.1. If the applicant is applying for permission to stay and has been living in the UK with permission for 12 months or longer on the date of application, they will meet the financial requirement and do not need to show funds.\n\n1.   GAE 19.2. If the applicant is applying for entry clearance, or has been in the UK for less than 12 months on the date of application, either: \n    1.   (a) funds of at least the amount required in GAE 19.3. must be held collectively by one or more of the following: \n        1.   i) the applicant; and\n        2.   ii) the person on the Government Authorised Exchange route (P); and\n        3.   iii) if the applicant is applying as a dependent child, their parent who is lawfully present in the UK or being granted entry clearance, or permission to stay, at the same time; or\n\n    2.   (b) the A-rated sponsor of the person on the Government Authorised Exchange route must certify that they will, if necessary, maintain and accommodate the dependent partner and/or any dependent child as well as the person on the Government Authorised Exchange route, up to the end of the first month of each of their grants of permission, to at least the amounts required in GAE 19.3.\n\n1.   GAE 19.3. The funds required are: \n    1.   (a) £285 for a dependent partner in the UK, or applying for entry clearance; and\n    2.   (b) £315 for the first dependent child in the UK, or applying for entry clearance; and\n    3.   (c) £200 for any other dependent child in the UK, or applying for entry clearance.\n\nGAE 19.4. If GAE 19.2.(a) applies, the funds held for the applicant must be held in addition to any funds required for the person on the Government Authorised Exchange route to meet the financial requirement and any other dependants in the UK or applying at the same time.\n\nGAE 19.5. If GAE 19.2.(a) applies, the funds must have been held for a 28-day period and as specified in Appendix Finance.",
      "summary": "Dependents applying for permission under the GAE route must hold specified funds if in the UK less than 12 months or applying for entry clearance; if in the UK for 12 months or more, they automatically meet the requirement. Funds of £285 per partner or £315 per child are needed, unless the sponsor certifies they will provide maintenance for up to the first month of permission.",
      "augmented_text": "Document: Appendix Temporary Work – Government Authorised Exchange\nPart: Appendix Temporary Work – Government Authorised Exchange\nSection ID: GAE 19.1\nSection: Financial requirement for a dependent partner or dependent child on the Government Authorised Exchange route\nTopic: financial\n\nSummary: Dependents applying for permission under the GAE route must hold specified funds if in the UK less than 12 months or applying for entry clearance; if in the UK for 12 months or more, they automatically meet the requirement. Funds of £285 per partner or £315 per child are needed, unless the sponsor certifies they will provide maintenance for up to the first month of permission.\n\n### Financial requirement for a dependent partner or dependent child on the Government Authorised Exchange route\n\nGAE 19.1. If the applicant is applying for permission to stay and has been living in the UK with permission for 12 months or longer on the date of application, they will meet the financial requirement and do not need to show funds.\n\n1.   GAE 19.2. If the applicant is applying for entry clearance, or has been in the UK for less than 12 months on the date of application, either: \n    1.   (a) funds of at least the amount required in GAE 19.3. must be held collectively by one or more of the following: \n        1.   i) the applicant; and\n        2.   ii) the person on the Government Authorised Exchange route (P); and\n        3.   iii) if the applicant is applying as a dependent child, their parent who is lawfully present in the UK or being granted entry clearance, or permission to stay, at the same time; or\n\n    2.   (b) the A-rated sponsor of the person on the Government Authorised Exchange route must certify that they will, if necessary, maintain and accommodate the dependent partner and/or any dependent child as well as the person on the Government Authorised Exchange route, up to the end of the first month of each of their grants of permission, to at least the amounts required in GAE 19.3.\n\n1.   GAE 19.3. The funds required are: \n    1.   (a) £285 for a dependent partner in the UK, or applying for entry clearance; and\n    2.   (b) £315 for the first dependent child in the UK, or applying for entry clearance; and\n    3.   (c) £200 for any other dependent child in the UK, or applying for entry clearance.\n\nGAE 19.4. If GAE 19.2.(a) applies, the funds held for the applicant must be held in addition to any funds required for the person on the Government Authorised Exchange route to meet the financial requirement and any other dependants in the UK or applying at the same time.\n\nGAE 19.5. If GAE 19.2.(a) applies, the funds must have been held for a 28-day period and as specified in Appendix Finance.",
      "needs_review": false
    },
    {
      "metadata": {
        "source": "Appendix Temporary Work – Government Authorised Exchange",
        "part": "Appendix Temporary Work – Government Authorised Exchange",
        "section_id": "GAE 20.1",
        "section_title": "Decision on an application as a dependent partner or dependent child on the Government Authorised Exchange route",
        "parent_section": "GAE 20",
        "hierarchy_level": 2,
        "topic": "eligibility",
        "url": "https://www.gov.uk/guidance/immigration-rules/immigration-rules-appendix-t5-temporary-worker-government-authorised-exchange-worker-route",
        "scraped_at": "2025-12-06T17:25:41.385525"
      },
      "text": "### Decision on an application as a dependent partner or dependent child on the Government Authorised Exchange route\n\nGAE 20.1. If the decision maker is satisfied that all the suitability and eligibility requirements for a dependent partner or dependent child on the Government Authorised Exchange route are met, the application will be granted, otherwise the application will be refused.\n\nGAE 20.2 If the application is refused, the person can apply for an Administrative Review under Appendix AR: Administrative Review.",
      "summary": "This provision applies to dependent partners or children applying under the Government Authorised Exchange route. The decision-maker must ensure all suitability and eligibility criteria are met; if so, the application is granted, otherwise refused, with the applicant able to request an Administrative Review.",
      "augmented_text": "Document: Appendix Temporary Work – Government Authorised Exchange\nPart: Appendix Temporary Work – Government Authorised Exchange\nSection ID: GAE 20.1\nSection: Decision on an application as a dependent partner or dependent child on the Government Authorised Exchange route\nTopic: eligibility\n\nSummary: This provision applies to dependent partners or children applying under the Government Authorised Exchange route. The decision-maker must ensure all suitability and eligibility criteria are met; if so, the application is granted, otherwise refused, with the applicant able to request an Administrative Review.\n\n### Decision on an application as a dependent partner or dependent child on the Government Authorised Exchange route\n\nGAE 20.1. If the decision maker is satisfied that all the suitability and eligibility requirements for a dependent partner or dependent child on the Government Authorised Exchange route are met, the application will be granted, otherwise the application will be refused.\n\nGAE 20.2 If the application is refused, the person can apply for an Administrative Review under Appendix AR: Administrative Review.",
      "needs_review": false
    },
    {
      "metadata": {
        "source": "Appendix Temporary Work – Government Authorised Exchange",
        "part": "Appendix Temporary Work – Government Authorised Exchange",
        "section_id": "GAE 21.1",
        "section_title": "Period of grant for a dependent partner or dependent child on the Government Authorised Exchange route",
        "parent_section": "GAE 21",
        "hierarchy_level": 2,
        "topic": "family",
        "url": "https://www.gov.uk/guidance/immigration-rules/immigration-rules-appendix-t5-temporary-worker-government-authorised-exchange-worker-route",
        "scraped_at": "2025-12-06T17:25:41.385561"
      },
      "text": "### Period of grant for a dependent partner or dependent child on the Government Authorised Exchange route\n\nGAE 21.1. A partner will be granted permission which ends on the same date as their partner’s permission on the Government Authorised Exchange route.\n\nGAE 21.2. A child will be granted permission which ends on the same date as whichever of their parents’ permission ends first.",
      "summary": "Dependent partners and children on the Government Authorised Exchange route must have their permission end date aligned with that of their primary applicant, with partners sharing the same expiry date and children’s permissions ending when either parent’s permission concludes.",
      "augmented_text": "Document: Appendix Temporary Work – Government Authorised Exchange\nPart: Appendix Temporary Work – Government Authorised Exchange\nSection ID: GAE 21.1\nSection: Period of grant for a dependent partner or dependent child on the Government Authorised Exchange route\nTopic: family\n\nSummary: Dependent partners and children on the Government Authorised Exchange route must have their permission end date aligned with that of their primary applicant, with partners sharing the same expiry date and children’s permissions ending when either parent’s permission concludes.\n\n### Period of grant for a dependent partner or dependent child on the Government Authorised Exchange route\n\nGAE 21.1. A partner will be granted permission which ends on the same date as their partner’s permission on the Government Authorised Exchange route.\n\nGAE 21.2. A child will be granted permission which ends on the same date as whichever of their parents’ permission ends first.",
      "needs_review": false
    },
    {
      "metadata": {
        "source": "Appendix Temporary Work – Government Authorised Exchange",
        "part": "Appendix Temporary Work – Government Authorised Exchange",
        "section_id": "1",
        "section_title": "Conditions of grant for a dependent partner or dependent child on the Government Authorised Exchange route",
        "parent_section": null,
        "hierarchy_level": 1,
        "topic": "financial",
        "url": "https://www.gov.uk/guidance/immigration-rules/immigration-rules-appendix-t5-temporary-worker-government-authorised-exchange-worker-route",
        "scraped_at": "2025-12-06T17:25:41.385578"
      },
      "text": "### Conditions of grant for a dependent partner or dependent child on the Government Authorised Exchange route\n\n1.   GAE 21.3. The grant will be subject to all the following conditions: \n    1.   (a) no access to public funds; and\n    2.   (b) work (including self-employment and voluntary work) is permitted, except as a professional sportsperson (including as a sports coach); and\n    3.   (c) study is permitted, subject to the ATAS condition in Appendix ATAS if the applicant is over the age of 18.\n    4.   (d) DELETED.\n\nPrint this page",
      "summary": "Dependent partners and children on the Government Authorised Exchange route may work, study (with ATAS if over 18), but cannot access public funds or work as professional sportspersons.",
      "augmented_text": "Document: Appendix Temporary Work – Government Authorised Exchange\nPart: Appendix Temporary Work – Government Authorised Exchange\nSection ID: 1\nSection: Conditions of grant for a dependent partner or dependent child on the Government Authorised Exchange route\nTopic: financial\n\nSummary: Dependent partners and children on the Government Authorised Exchange route may work, study (with ATAS if over 18), but cannot access public funds or work as professional sportspersons.\n\n### Conditions of grant for a dependent partner or dependent child on the Government Authorised Exchange route\n\n1.   GAE 21.3. The grant will be subject to all the following conditions: \n    1.   (a) no access to public funds; and\n    2.   (b) work (including self-employment and voluntary work) is permitted, except as a professional sportsperson (including as a sports coach); and\n    3.   (c) study is permitted, subject to the ATAS condition in Appendix ATAS if the applicant is over the age of 18.\n    4.   (d) DELETED.\n\nPrint this page",
      "needs_review": false
    }
  ]
}