{
  "url": "https://www.gov.uk/guidance/immigration-rules/immigration-rules-appendix-t2-minister-of-religion",
  "part_name": "Immigration Rules Appendix T2 Minister of Religion",
  "scraped_at": "2025-12-06T17:29:07.141473",
  "chunk_count": 48,
  "chunks": [
    {
      "metadata": {
        "source": "Immigration Rules Appendix T2 Minister of Religion",
        "part": "Immigration Rules Appendix T2 Minister of Religion",
        "section_id": "1",
        "section_title": "Validity requirements for a T2 Minister of Religion",
        "parent_section": null,
        "hierarchy_level": 1,
        "topic": "leave-to-enter",
        "url": "https://www.gov.uk/guidance/immigration-rules/immigration-rules-appendix-t2-minister-of-religion",
        "scraped_at": "2025-12-06T17:29:07.139824"
      },
      "text": "### Validity requirements for a T2 Minister of Religion\n\n1.   MOR 1.1. A person applying for entry clearance or permission to stay as a T2 Minister of Religion must apply online on the gov.uk website on the specified form as follows: \n    1.   (a) for applicants outside the UK, form “Tier 2 (Minister of Religion) visa”; or\n    2.   (b) for applicants inside the UK, form “Tier 2 (Minister of Religion) leave to remain”.\n\n1.   MOR 1.2. An application for entry clearance or permission to stay as a T2 Minister of Religion must meet all the following requirements: \n    1.   (a) any fee and Immigration Health Charge must have been paid; and\n    2.   (b) the applicant must have provided biometrics when required; and\n    3.   (c) the applicant must have provided a passport or other travel document which satisfactorily establishes their identity and nationality; and\n    4.   (d) the applicant must have a Certificate of Sponsorship that was issued to them by their sponsor no more than 3 months before the date of application.\n\nMOR 1.3. The applicant must be aged 18 or over on the date of application.\n\nMOR 1.4. If the applicant has, in the last 12 months before the date of application, received an award from a Government or international scholarship agency covering both fees and living costs for study in the UK, they must provide written consent to the application from that Government or agency.\n\n1.   MOR 1.5. If applying for permission to stay, the applicant must be in the UK on the date of application.\n2.   MOR 1.5ZA. If applying for permission to stay, the applicant must not have, or have last been granted, permission: \n    1.   (a) as a Visitor; or\n    2.   (b) as a Short-term Student; or\n    3.   (c) as a Parent of a Child Student; or\n    4.   (d) as a Seasonal Worker; or\n    5.   (e) as a Domestic Worker in a Private Household; or\n    6.   (f) outside the Immigration Rules.\n\n1.   MOR 1.5A. An applicant who is applying for permission to stay and has, or last had, permission as a Student, must fulfil one of the Conditions A, B or C below on the date of application: \n    1.   (a) Condition A: the applicant must have completed the course of study for which the Confirmation of Acceptance for Studies was assigned (or a course to which ST 27.3 of Appendix Student applies); or\n    2.   (b) Condition B: \n        1.   (i) the applicant must be studying a full-time course of study at degree level or above with a higher education provider which has a track record of compliance; and\n        2.   (ii) the Certificate of Sponsorship in MOR 1.2(d) must have a start date no earlier than the course completion date; or\n\n    3.   (c) Condition C: \n        1.   (i) the applicant must be studying a full-time course of study leading to the award of a PhD with a higher education provider which has a track record of compliance; and\n        2.   (ii) the Certificate of Sponsorship in MOR 1.2(d) must have a start date no earlier than 24 months after the start date of that course.\n\nMOR 1.6. An application which does not meet all the validity requirements for a T2 Minister of Religion may be rejected as invalid and not considered.",
      "summary": "Applicants for a T2 Minister of Religion must apply online via specified forms, meet fee, biometrics, and identity requirements, and possess a Certificate of Sponsorship issued within three months. They must be at least 18 and, if previously socially funded, provide written consent; for extensions, they must be in the UK on application.",
      "augmented_text": "Document: Immigration Rules Appendix T2 Minister of Religion\nPart: Immigration Rules Appendix T2 Minister of Religion\nSection ID: 1\nSection: Validity requirements for a T2 Minister of Religion\nTopic: leave-to-enter\n\nSummary: Applicants for a T2 Minister of Religion must apply online via specified forms, meet fee, biometrics, and identity requirements, and possess a Certificate of Sponsorship issued within three months. They must be at least 18 and, if previously socially funded, provide written consent; for extensions, they must be in the UK on application.\n\n### Validity requirements for a T2 Minister of Religion\n\n1.   MOR 1.1. A person applying for entry clearance or permission to stay as a T2 Minister of Religion must apply online on the gov.uk website on the specified form as follows: \n    1.   (a) for applicants outside the UK, form “Tier 2 (Minister of Religion) visa”; or\n    2.   (b) for applicants inside the UK, form “Tier 2 (Minister of Religion) leave to remain”.\n\n1.   MOR 1.2. An application for entry clearance or permission to stay as a T2 Minister of Religion must meet all the following requirements: \n    1.   (a) any fee and Immigration Health Charge must have been paid; and\n    2.   (b) the applicant must have provided biometrics when required; and\n    3.   (c) the applicant must have provided a passport or other travel document which satisfactorily establishes their identity and nationality; and\n    4.   (d) the applicant must have a Certificate of Sponsorship that was issued to them by their sponsor no more than 3 months before the date of application.\n\nMOR 1.3. The applicant must be aged 18 or over on the date of application.\n\nMOR 1.4. If the applicant has, in the last 12 months before the date of application, received an award from a Government or international scholarship agency covering both fees and living costs for study in the UK, they must provide written consent to the application from that Government or agency.\n\n1.   MOR 1.5. If applying for permission to stay, the applicant must be in the UK on the date of application.\n2.   MOR 1.5ZA. If applying for permission to stay, the applicant must not have, or have last been granted, permission: \n    1.   (a) as a Visitor; or\n    2.   (b) as a Short-term Student; or\n    3.   (c) as a Parent of a Child Student; or\n    4.   (d) as a Seasonal Worker; or\n    5.   (e) as a Domestic Worker in a Private Household; or\n    6.   (f) outside the Immigration Rules.\n\n1.   MOR 1.5A. An applicant who is applying for permission to stay and has, or last had, permission as a Student, must fulfil one of the Conditions A, B or C below on the date of application: \n    1.   (a) Condition A: the applicant must have completed the course of study for which the Confirmation of Acceptance for Studies was assigned (or a course to which ST 27.3 of Appendix Student applies); or\n    2.   (b) Condition B: \n        1.   (i) the applicant must be studying a full-time course of study at degree level or above with a higher education provider which has a track record of compliance; and\n        2.   (ii) the Certificate of Sponsorship in MOR 1.2(d) must have a start date no earlier than the course completion date; or\n\n    3.   (c) Condition C: \n        1.   (i) the applicant must be studying a full-time course of study leading to the award of a PhD with a higher education provider which has a track record of compliance; and\n        2.   (ii) the Certificate of Sponsorship in MOR 1.2(d) must have a start date no earlier than 24 months after the start date of that course.\n\nMOR 1.6. An application which does not meet all the validity requirements for a T2 Minister of Religion may be rejected as invalid and not considered.",
      "needs_review": false
    },
    {
      "metadata": {
        "source": "Immigration Rules Appendix T2 Minister of Religion",
        "part": "Immigration Rules Appendix T2 Minister of Religion",
        "section_id": "MOR 2.1",
        "section_title": "Suitability Requirements for a T2 Minister of Religion",
        "parent_section": "MOR 2",
        "hierarchy_level": 2,
        "topic": "suitability",
        "url": "https://www.gov.uk/guidance/immigration-rules/immigration-rules-appendix-t2-minister-of-religion",
        "scraped_at": "2025-12-06T17:29:07.139873"
      },
      "text": "### Suitability Requirements for a T2 Minister of Religion\n\nMOR 2.1. The applicant must not fall for refusal under Part Suitability.\n\n1.   MOR 2.2. If applying for permission to stay the applicant must not be: \n    1.   (a) in breach of immigration laws, except that where the Exceptions for overstayers section of Part Suitability applies, that period of overstaying will be disregarded; or\n    2.   (b) on immigration bail.",
      "summary": "This provision applies to applicants for a T2 Minister of Religion. They must not breach immigration laws or be on immigration bail, with certain overstaying exceptions permitted. Compliance with suitability and lawfulness is mandatory for eligibility.",
      "augmented_text": "Document: Immigration Rules Appendix T2 Minister of Religion\nPart: Immigration Rules Appendix T2 Minister of Religion\nSection ID: MOR 2.1\nSection: Suitability Requirements for a T2 Minister of Religion\nTopic: suitability\n\nSummary: This provision applies to applicants for a T2 Minister of Religion. They must not breach immigration laws or be on immigration bail, with certain overstaying exceptions permitted. Compliance with suitability and lawfulness is mandatory for eligibility.\n\n### Suitability Requirements for a T2 Minister of Religion\n\nMOR 2.1. The applicant must not fall for refusal under Part Suitability.\n\n1.   MOR 2.2. If applying for permission to stay the applicant must not be: \n    1.   (a) in breach of immigration laws, except that where the Exceptions for overstayers section of Part Suitability applies, that period of overstaying will be disregarded; or\n    2.   (b) on immigration bail.",
      "needs_review": false
    },
    {
      "metadata": {
        "source": "Immigration Rules Appendix T2 Minister of Religion",
        "part": "Immigration Rules Appendix T2 Minister of Religion",
        "section_id": "Eligibility Requirements for a T2 Minister of Religion",
        "section_title": "Eligibility Requirements for a T2 Minister of Religion",
        "parent_section": null,
        "hierarchy_level": 2,
        "topic": "eligibility",
        "url": "https://www.gov.uk/guidance/immigration-rules/immigration-rules-appendix-t2-minister-of-religion",
        "scraped_at": "2025-12-06T17:29:07.139889"
      },
      "text": "### Eligibility Requirements for a T2 Minister of Religion",
      "summary": "This provision applies to applicants seeking a T2 Minister of Religion visa. It requires applicants to demonstrate approval from the sponsoring organization and meet specific religious and professional criteria. Critical conditions include verification of the sponsor’s legitimacy and adherence to immigration thresholds.",
      "augmented_text": "Document: Immigration Rules Appendix T2 Minister of Religion\nPart: Immigration Rules Appendix T2 Minister of Religion\nSection ID: Eligibility Requirements for a T2 Minister of Religion\nSection: Eligibility Requirements for a T2 Minister of Religion\nTopic: eligibility\n\nSummary: This provision applies to applicants seeking a T2 Minister of Religion visa. It requires applicants to demonstrate approval from the sponsoring organization and meet specific religious and professional criteria. Critical conditions include verification of the sponsor’s legitimacy and adherence to immigration thresholds.\n\n### Eligibility Requirements for a T2 Minister of Religion",
      "needs_review": false
    },
    {
      "metadata": {
        "source": "Immigration Rules Appendix T2 Minister of Religion",
        "part": "Immigration Rules Appendix T2 Minister of Religion",
        "section_id": "MOR 3.1",
        "section_title": "Entry requirement for a T2 Minister of Religion",
        "parent_section": "MOR 3",
        "hierarchy_level": 2,
        "topic": "leave-to-enter",
        "url": "https://www.gov.uk/guidance/immigration-rules/immigration-rules-appendix-t2-minister-of-religion",
        "scraped_at": "2025-12-06T17:29:07.139922"
      },
      "text": "### Entry requirement for a T2 Minister of Religion\n\nMOR 3.1. A person seeking to come to the UK as a T2 Minister of Religion must apply for and obtain entry clearance as a T2 Minister of Religion before they arrive in the UK.\n\nMOR 3.2. A person applying for entry clearance as a T2 Minister of Religion must, if Appendix Tuberculosis applies, provide a valid medical certificate confirming that they have undergone screening for active pulmonary tuberculosis and that this tuberculosis is not present in them.",
      "summary": "Applicants for a T2 Minister of Religion must obtain entry clearance before arrival. If applicable, they must also provide a tuberculosis screening certificate confirming they do not have active pulmonary TB.",
      "augmented_text": "Document: Immigration Rules Appendix T2 Minister of Religion\nPart: Immigration Rules Appendix T2 Minister of Religion\nSection ID: MOR 3.1\nSection: Entry requirement for a T2 Minister of Religion\nTopic: leave-to-enter\n\nSummary: Applicants for a T2 Minister of Religion must obtain entry clearance before arrival. If applicable, they must also provide a tuberculosis screening certificate confirming they do not have active pulmonary TB.\n\n### Entry requirement for a T2 Minister of Religion\n\nMOR 3.1. A person seeking to come to the UK as a T2 Minister of Religion must apply for and obtain entry clearance as a T2 Minister of Religion before they arrive in the UK.\n\nMOR 3.2. A person applying for entry clearance as a T2 Minister of Religion must, if Appendix Tuberculosis applies, provide a valid medical certificate confirming that they have undergone screening for active pulmonary tuberculosis and that this tuberculosis is not present in them.",
      "needs_review": false
    },
    {
      "metadata": {
        "source": "Immigration Rules Appendix T2 Minister of Religion",
        "part": "Immigration Rules Appendix T2 Minister of Religion",
        "section_id": "MOR 4.1",
        "section_title": "Points Requirement for a T2 Minister of Religion",
        "parent_section": "MOR 4",
        "hierarchy_level": 2,
        "topic": "financial",
        "url": "https://www.gov.uk/guidance/immigration-rules/immigration-rules-appendix-t2-minister-of-religion",
        "scraped_at": "2025-12-06T17:29:07.139944"
      },
      "text": "### Points Requirement for a T2 Minister of Religion\n\nMOR 4.1. The applicant must be awarded all 70 points in the table below:\n\n| Points requirements (all mandatory) | Points |\n| --- | --- |\n| Certificate of Sponsorship | 50 |\n| Financial requirement | 10 |\n| English language skills at level B2 | 10 |",
      "summary": "Applicants for a T2 Minister of Religion must earn a total of 70 points, including a sponsor certificate (50 points), meeting the financial requirement (10 points), and demonstrating English proficiency at B2 level (10 points). All criteria are mandatory for eligibility.",
      "augmented_text": "Document: Immigration Rules Appendix T2 Minister of Religion\nPart: Immigration Rules Appendix T2 Minister of Religion\nSection ID: MOR 4.1\nSection: Points Requirement for a T2 Minister of Religion\nTopic: financial\n\nSummary: Applicants for a T2 Minister of Religion must earn a total of 70 points, including a sponsor certificate (50 points), meeting the financial requirement (10 points), and demonstrating English proficiency at B2 level (10 points). All criteria are mandatory for eligibility.\n\n### Points Requirement for a T2 Minister of Religion\n\nMOR 4.1. The applicant must be awarded all 70 points in the table below:\n\n| Points requirements (all mandatory) | Points |\n| --- | --- |\n| Certificate of Sponsorship | 50 |\n| Financial requirement | 10 |\n| English language skills at level B2 | 10 |",
      "needs_review": false
    },
    {
      "metadata": {
        "source": "Immigration Rules Appendix T2 Minister of Religion",
        "part": "Immigration Rules Appendix T2 Minister of Religion",
        "section_id": "MOR 5.1",
        "section_title": "Sponsorship requirements for a T2 Minister of Religion",
        "parent_section": null,
        "hierarchy_level": 1,
        "topic": "sponsorship",
        "url": "https://www.gov.uk/guidance/immigration-rules/immigration-rules-appendix-t2-minister-of-religion",
        "scraped_at": "2025-12-06T17:29:07.139996"
      },
      "text": "### Sponsorship requirements for a T2 Minister of Religion\n\n1.   MOR 5.1. The applicant must have a valid Certificate of Sponsorship for the job they are planning to do, which to be valid, must: \n    1.   (a) confirm the applicant’s name, that they are being sponsored as a T2 Minister of Religion and details of the job and salary the sponsor is offering them, as well as any other remuneration; and\n    2.   (b) include a start date, stated by the sponsor, which must be no more than three months after the date of application; and\n    3.   (c) not have been used in a previous application which was either granted or refused (but can have been used in a previous application which was rejected as invalid, made void or withdrawn); and\n    4.   (d) not have been withdrawn by the sponsor or cancelled by the Home Office; and\n    5.   (e) confirm that the applicant is qualified to do the job of a T2 Minister of Religion; and\n    6.   (f) confirm that the applicant is a member of the sponsor’s religious order (if the sponsor’s organisation is a religious order); and\n    7.   (g) confirm that the applicant will perform religious duties within the sponsor’s organisation or directed by the sponsor’s organisation in the UK (which may include preaching, pastoral and non-pastoral work); and\n    8.   (h) confirm that the applicant’s role will not involve mainly non-pastoral duties, such as school teaching, media production, domestic work or administrative and clerical work, unless the role is a senior position within the sponsor’s organisation; and\n    9.   (i) confirm that the applicant will receive pay and conditions at least equal to those given to settled workers in the same role and compliant with, or exempt from, the national minimum wage.\n\nMOR 5.2. The sponsor must be authorised by the Home Office to sponsor the job in question under the T2 Minister of Religion route.\n\nMOR 5.3. The sponsor must be listed as A-rated on the Home Office’s register of licensed sponsors, unless the applicant was last granted permission as a T2 Minister of Religion and is applying to continue working for the same sponsor as in their last permission.\n\nMOR 5.4. The decision maker must not have reasonable grounds to believe the job the applicant is being sponsored to do does not comply with the National Minimum Wage Regulations or the Working Time Regulations.",
      "summary": "This provision applies to applicants for a T2 Minister of Religion sponsorship. They must hold a valid Certificate of Sponsorship detailing their role, salary, and qualifications, with the start date within three months of application, and the certificate must not be previously used, withdrawn, or cancelled. The role must involve religious duties within the sponsor’s organisation, primarily pastoral, excluding mainly non-pastoral work.",
      "augmented_text": "Document: Immigration Rules Appendix T2 Minister of Religion\nPart: Immigration Rules Appendix T2 Minister of Religion\nSection ID: MOR 5.1\nSection: Sponsorship requirements for a T2 Minister of Religion\nTopic: sponsorship\n\nSummary: This provision applies to applicants for a T2 Minister of Religion sponsorship. They must hold a valid Certificate of Sponsorship detailing their role, salary, and qualifications, with the start date within three months of application, and the certificate must not be previously used, withdrawn, or cancelled. The role must involve religious duties within the sponsor’s organisation, primarily pastoral, excluding mainly non-pastoral work.\n\n### Sponsorship requirements for a T2 Minister of Religion\n\n1.   MOR 5.1. The applicant must have a valid Certificate of Sponsorship for the job they are planning to do, which to be valid, must: \n    1.   (a) confirm the applicant’s name, that they are being sponsored as a T2 Minister of Religion and details of the job and salary the sponsor is offering them, as well as any other remuneration; and\n    2.   (b) include a start date, stated by the sponsor, which must be no more than three months after the date of application; and\n    3.   (c) not have been used in a previous application which was either granted or refused (but can have been used in a previous application which was rejected as invalid, made void or withdrawn); and\n    4.   (d) not have been withdrawn by the sponsor or cancelled by the Home Office; and\n    5.   (e) confirm that the applicant is qualified to do the job of a T2 Minister of Religion; and\n    6.   (f) confirm that the applicant is a member of the sponsor’s religious order (if the sponsor’s organisation is a religious order); and\n    7.   (g) confirm that the applicant will perform religious duties within the sponsor’s organisation or directed by the sponsor’s organisation in the UK (which may include preaching, pastoral and non-pastoral work); and\n    8.   (h) confirm that the applicant’s role will not involve mainly non-pastoral duties, such as school teaching, media production, domestic work or administrative and clerical work, unless the role is a senior position within the sponsor’s organisation; and\n    9.   (i) confirm that the applicant will receive pay and conditions at least equal to those given to settled workers in the same role and compliant with, or exempt from, the national minimum wage.\n\nMOR 5.2. The sponsor must be authorised by the Home Office to sponsor the job in question under the T2 Minister of Religion route.\n\nMOR 5.3. The sponsor must be listed as A-rated on the Home Office’s register of licensed sponsors, unless the applicant was last granted permission as a T2 Minister of Religion and is applying to continue working for the same sponsor as in their last permission.\n\nMOR 5.4. The decision maker must not have reasonable grounds to believe the job the applicant is being sponsored to do does not comply with the National Minimum Wage Regulations or the Working Time Regulations.",
      "needs_review": false
    },
    {
      "metadata": {
        "source": "Immigration Rules Appendix T2 Minister of Religion",
        "part": "Immigration Rules Appendix T2 Minister of Religion",
        "section_id": "MOR 6.1",
        "section_title": "Genuineness requirement for a T2 Minister of Religion",
        "parent_section": null,
        "hierarchy_level": 1,
        "topic": "eligibility",
        "url": "https://www.gov.uk/guidance/immigration-rules/immigration-rules-appendix-t2-minister-of-religion",
        "scraped_at": "2025-12-06T17:29:07.140036"
      },
      "text": "### Genuineness requirement for a T2 Minister of Religion\n\n1.   MOR 6.1. The applicant must: \n    1.   (a) genuinely intend, and be able, to undertake the role for which they are being sponsored; and\n    2.   (b) not intend to undertake employment other than in the role for which they are being sponsored, or as otherwise permitted at MOR 10.3.",
      "summary": "Applicants for a T2 Minister of Religion must genuinely intend and be able to perform the sponsored role exclusively, without seeking other employment unless permitted under MOR 10.3.",
      "augmented_text": "Document: Immigration Rules Appendix T2 Minister of Religion\nPart: Immigration Rules Appendix T2 Minister of Religion\nSection ID: MOR 6.1\nSection: Genuineness requirement for a T2 Minister of Religion\nTopic: eligibility\n\nSummary: Applicants for a T2 Minister of Religion must genuinely intend and be able to perform the sponsored role exclusively, without seeking other employment unless permitted under MOR 10.3.\n\n### Genuineness requirement for a T2 Minister of Religion\n\n1.   MOR 6.1. The applicant must: \n    1.   (a) genuinely intend, and be able, to undertake the role for which they are being sponsored; and\n    2.   (b) not intend to undertake employment other than in the role for which they are being sponsored, or as otherwise permitted at MOR 10.3.",
      "needs_review": false
    },
    {
      "metadata": {
        "source": "Immigration Rules Appendix T2 Minister of Religion",
        "part": "Immigration Rules Appendix T2 Minister of Religion",
        "section_id": "MOR 7.1",
        "section_title": "Financial requirement for a T2 Minister of Religion",
        "parent_section": "MOR 7",
        "hierarchy_level": 2,
        "topic": "financial",
        "url": "https://www.gov.uk/guidance/immigration-rules/immigration-rules-appendix-t2-minister-of-religion",
        "scraped_at": "2025-12-06T17:29:07.140067"
      },
      "text": "### Financial requirement for a T2 Minister of Religion\n\nMOR 7.1. If the applicant is applying for permission to stay and has been living in the UK with permission for 12 months or longer on the date of application, they will meet the financial requirement and do not need to show funds.\n\n1.   MOR 7.2. If the applicant is applying for entry clearance, or is applying for permission to stay and has been living in the UK for less than 12 months on the date of application, either: \n    1.   (a) the applicant must have funds of at least £1,270; or\n    2.   (b) the applicant’s A-rated sponsor must confirm on the Certificate of Sponsorship that they will, if it is necessary, maintain and accommodate the applicant up to the end of the first month of their employment for an amount of at least £1,270.\n\nMOR 7.3. If MOR 7.2.(a) applies, the applicant must have held the required level of funds for a 28-day period and must show funds as specified in Appendix Finance.",
      "summary": "Applicants applying for a T2 Minister of Religion must demonstrate sufficient funds unless they have been UK residents for over 12 months. Those with less than 12 months' residence must show at least £1,270 or have their sponsor confirm maintenance, and funds must be held for 28 days if applicable.",
      "augmented_text": "Document: Immigration Rules Appendix T2 Minister of Religion\nPart: Immigration Rules Appendix T2 Minister of Religion\nSection ID: MOR 7.1\nSection: Financial requirement for a T2 Minister of Religion\nTopic: financial\n\nSummary: Applicants applying for a T2 Minister of Religion must demonstrate sufficient funds unless they have been UK residents for over 12 months. Those with less than 12 months' residence must show at least £1,270 or have their sponsor confirm maintenance, and funds must be held for 28 days if applicable.\n\n### Financial requirement for a T2 Minister of Religion\n\nMOR 7.1. If the applicant is applying for permission to stay and has been living in the UK with permission for 12 months or longer on the date of application, they will meet the financial requirement and do not need to show funds.\n\n1.   MOR 7.2. If the applicant is applying for entry clearance, or is applying for permission to stay and has been living in the UK for less than 12 months on the date of application, either: \n    1.   (a) the applicant must have funds of at least £1,270; or\n    2.   (b) the applicant’s A-rated sponsor must confirm on the Certificate of Sponsorship that they will, if it is necessary, maintain and accommodate the applicant up to the end of the first month of their employment for an amount of at least £1,270.\n\nMOR 7.3. If MOR 7.2.(a) applies, the applicant must have held the required level of funds for a 28-day period and must show funds as specified in Appendix Finance.",
      "needs_review": false
    },
    {
      "metadata": {
        "source": "Immigration Rules Appendix T2 Minister of Religion",
        "part": "Immigration Rules Appendix T2 Minister of Religion",
        "section_id": "MOR 8.1",
        "section_title": "English language requirement for a T2 Minister of Religion",
        "parent_section": "MOR 8",
        "hierarchy_level": 2,
        "topic": "english-language",
        "url": "https://www.gov.uk/guidance/immigration-rules/immigration-rules-appendix-t2-minister-of-religion",
        "scraped_at": "2025-12-06T17:29:07.140092"
      },
      "text": "### English language requirement for a T2 Minister of Religion\n\nMOR 8.1. Unless an exemption applies, the applicant must show English language ability on the Common European Framework of Reference for Languages in all 4 components (reading, writing, speaking and listening) of at least level B2.\n\nMOR 8.2. The applicant must show they meet the English language requirement as specified in Appendix English Language.",
      "summary": "Applicants for a T2 Minister of Religion must demonstrate English language ability at level B2 across all four components unless exempt, as per Appendix English Language.",
      "augmented_text": "Document: Immigration Rules Appendix T2 Minister of Religion\nPart: Immigration Rules Appendix T2 Minister of Religion\nSection ID: MOR 8.1\nSection: English language requirement for a T2 Minister of Religion\nTopic: english-language\n\nSummary: Applicants for a T2 Minister of Religion must demonstrate English language ability at level B2 across all four components unless exempt, as per Appendix English Language.\n\n### English language requirement for a T2 Minister of Religion\n\nMOR 8.1. Unless an exemption applies, the applicant must show English language ability on the Common European Framework of Reference for Languages in all 4 components (reading, writing, speaking and listening) of at least level B2.\n\nMOR 8.2. The applicant must show they meet the English language requirement as specified in Appendix English Language.",
      "needs_review": false
    },
    {
      "metadata": {
        "source": "Immigration Rules Appendix T2 Minister of Religion",
        "part": "Immigration Rules Appendix T2 Minister of Religion",
        "section_id": "MOR 9.1",
        "section_title": "Decision on an application as a T2 Minister of Religion",
        "parent_section": "MOR 9",
        "hierarchy_level": 2,
        "topic": "eligibility",
        "url": "https://www.gov.uk/guidance/immigration-rules/immigration-rules-appendix-t2-minister-of-religion",
        "scraped_at": "2025-12-06T17:29:07.140112"
      },
      "text": "### Decision on an application as a T2 Minister of Religion\n\nMOR 9.1. If the decision maker is satisfied all the suitability and eligibility requirements for a T2 Minister of Religion are met the application will be granted, otherwise the application will be refused.\n\nMOR 9.2. If the application is refused the person can apply for an Administrative Review under Appendix AR: Administrative Review.",
      "summary": "This provision applies to applicants for a T2 Minister of Religion visa. The decision maker grants the application if all suitability and eligibility criteria are met; otherwise, it is refused. Refused applicants may request an Administrative Review.",
      "augmented_text": "Document: Immigration Rules Appendix T2 Minister of Religion\nPart: Immigration Rules Appendix T2 Minister of Religion\nSection ID: MOR 9.1\nSection: Decision on an application as a T2 Minister of Religion\nTopic: eligibility\n\nSummary: This provision applies to applicants for a T2 Minister of Religion visa. The decision maker grants the application if all suitability and eligibility criteria are met; otherwise, it is refused. Refused applicants may request an Administrative Review.\n\n### Decision on an application as a T2 Minister of Religion\n\nMOR 9.1. If the decision maker is satisfied all the suitability and eligibility requirements for a T2 Minister of Religion are met the application will be granted, otherwise the application will be refused.\n\nMOR 9.2. If the application is refused the person can apply for an Administrative Review under Appendix AR: Administrative Review.",
      "needs_review": false
    },
    {
      "metadata": {
        "source": "Immigration Rules Appendix T2 Minister of Religion",
        "part": "Immigration Rules Appendix T2 Minister of Religion",
        "section_id": "1",
        "section_title": "Period of grant for a T2 Minister of Religion",
        "parent_section": null,
        "hierarchy_level": 1,
        "topic": "leave-to-enter",
        "url": "https://www.gov.uk/guidance/immigration-rules/immigration-rules-appendix-t2-minister-of-religion",
        "scraped_at": "2025-12-06T17:29:07.140142"
      },
      "text": "### Period of grant for a T2 Minister of Religion\n\n1.   MOR 10.1. If the applicant is applying for entry clearance, permission will be granted for whichever is the shorter of: \n    1.   (a) up to 14 days after the period of employment stated on their Certificate of Sponsorship; or\n    2.   (b) 3 years and 1 month.\n\n1.   MOR 10.2. If the applicant is applying for permission to stay, it will be granted for whichever is the shorter of: \n    1.   (a) up to 14 days after the period of employment stated on their Certificate of Sponsorship; or\n    2.   (b) 3 years; or\n    3.   (c) the difference between 6 years and the period they have already been granted permission as a T2 Minister of Religion, International Sportsperson, or Skilled Worker (or any combination of these routes).",
      "summary": "This provision applies to T2 Ministers of Religion applying for entry clearance or permission to stay. It requires grants to be for the shorter of either 14 days after the employment period, 3 years (or 3 years and 1 month for entry clearance), or the remaining allowable period based on previous permissions, with specific thresholds outlined.",
      "augmented_text": "Document: Immigration Rules Appendix T2 Minister of Religion\nPart: Immigration Rules Appendix T2 Minister of Religion\nSection ID: 1\nSection: Period of grant for a T2 Minister of Religion\nTopic: leave-to-enter\n\nSummary: This provision applies to T2 Ministers of Religion applying for entry clearance or permission to stay. It requires grants to be for the shorter of either 14 days after the employment period, 3 years (or 3 years and 1 month for entry clearance), or the remaining allowable period based on previous permissions, with specific thresholds outlined.\n\n### Period of grant for a T2 Minister of Religion\n\n1.   MOR 10.1. If the applicant is applying for entry clearance, permission will be granted for whichever is the shorter of: \n    1.   (a) up to 14 days after the period of employment stated on their Certificate of Sponsorship; or\n    2.   (b) 3 years and 1 month.\n\n1.   MOR 10.2. If the applicant is applying for permission to stay, it will be granted for whichever is the shorter of: \n    1.   (a) up to 14 days after the period of employment stated on their Certificate of Sponsorship; or\n    2.   (b) 3 years; or\n    3.   (c) the difference between 6 years and the period they have already been granted permission as a T2 Minister of Religion, International Sportsperson, or Skilled Worker (or any combination of these routes).",
      "needs_review": false
    },
    {
      "metadata": {
        "source": "Immigration Rules Appendix T2 Minister of Religion",
        "part": "Immigration Rules Appendix T2 Minister of Religion",
        "section_id": "1",
        "section_title": "Conditions of grant for a T2 Minister of Religion",
        "parent_section": null,
        "hierarchy_level": 1,
        "topic": "financial",
        "url": "https://www.gov.uk/guidance/immigration-rules/immigration-rules-appendix-t2-minister-of-religion",
        "scraped_at": "2025-12-06T17:29:07.140165"
      },
      "text": "### Conditions of grant for a T2 Minister of Religion\n\n1.   MOR 10.3. The grant will be subject to all the following conditions: \n    1.   (a) no access to public funds; and\n    2.   (b) the only work permitted is: \n        1.   (i) work in the job the applicant is being sponsored for; and\n        2.   (ii) supplementary employment, provided the applicant is still doing the job they were sponsored for; and\n        3.   (iii) voluntary work; and\n        4.   (iv) working out a contractual notice for a job the person was lawfully working in on the date of application; and\n\n    3.   (c) study is permitted, subject to the ATAS condition in Appendix ATAS.\n    4.   (d) DELETED",
      "summary": "This provision applies to T2 Minister of Religion visa holders, outlining conditions for their grant. It requires they have no access to public funds, limit work to their sponsored role, permitted supplementary and voluntary work, and may study subject to ATAS. Exceptions include working out contractual notice and the specific permitted activities.",
      "augmented_text": "Document: Immigration Rules Appendix T2 Minister of Religion\nPart: Immigration Rules Appendix T2 Minister of Religion\nSection ID: 1\nSection: Conditions of grant for a T2 Minister of Religion\nTopic: financial\n\nSummary: This provision applies to T2 Minister of Religion visa holders, outlining conditions for their grant. It requires they have no access to public funds, limit work to their sponsored role, permitted supplementary and voluntary work, and may study subject to ATAS. Exceptions include working out contractual notice and the specific permitted activities.\n\n### Conditions of grant for a T2 Minister of Religion\n\n1.   MOR 10.3. The grant will be subject to all the following conditions: \n    1.   (a) no access to public funds; and\n    2.   (b) the only work permitted is: \n        1.   (i) work in the job the applicant is being sponsored for; and\n        2.   (ii) supplementary employment, provided the applicant is still doing the job they were sponsored for; and\n        3.   (iii) voluntary work; and\n        4.   (iv) working out a contractual notice for a job the person was lawfully working in on the date of application; and\n\n    3.   (c) study is permitted, subject to the ATAS condition in Appendix ATAS.\n    4.   (d) DELETED",
      "needs_review": false
    },
    {
      "metadata": {
        "source": "Immigration Rules Appendix T2 Minister of Religion",
        "part": "Immigration Rules Appendix T2 Minister of Religion",
        "section_id": "Settlement as a T2 Minister of Religion",
        "section_title": "Settlement as a T2 Minister of Religion",
        "parent_section": null,
        "hierarchy_level": 2,
        "topic": "settlement",
        "url": "https://www.gov.uk/guidance/immigration-rules/immigration-rules-appendix-t2-minister-of-religion",
        "scraped_at": "2025-12-06T17:29:07.140188"
      },
      "text": "### Settlement as a T2 Minister of Religion",
      "summary": "This provision applies to T2 Ministers of Religion seeking settlement in the UK. It requires applicants to meet specific residence, employment, and conduct criteria over a qualifying period. Critical conditions include continuous lawful presence and adherence to immigration conditions; exceptions are not specified.",
      "augmented_text": "Document: Immigration Rules Appendix T2 Minister of Religion\nPart: Immigration Rules Appendix T2 Minister of Religion\nSection ID: Settlement as a T2 Minister of Religion\nSection: Settlement as a T2 Minister of Religion\nTopic: settlement\n\nSummary: This provision applies to T2 Ministers of Religion seeking settlement in the UK. It requires applicants to meet specific residence, employment, and conduct criteria over a qualifying period. Critical conditions include continuous lawful presence and adherence to immigration conditions; exceptions are not specified.\n\n### Settlement as a T2 Minister of Religion",
      "needs_review": false
    },
    {
      "metadata": {
        "source": "Immigration Rules Appendix T2 Minister of Religion",
        "part": "Immigration Rules Appendix T2 Minister of Religion",
        "section_id": "MOR 11.1",
        "section_title": "Validity requirements for settlement as a T2 Minister of Religion",
        "parent_section": "MOR 11",
        "hierarchy_level": 2,
        "topic": "settlement",
        "url": "https://www.gov.uk/guidance/immigration-rules/immigration-rules-appendix-t2-minister-of-religion",
        "scraped_at": "2025-12-06T17:29:07.140232"
      },
      "text": "### Validity requirements for settlement as a T2 Minister of Religion\n\nMOR 11.1. A person who is applying for settlement as a T2 Minister of Religion must apply online on the gov.uk website on the specified form “Settle in the UK in various immigration categories: form SET(O)”.\n\n1.   MOR 11.2. An application for settlement must meet all the following requirements: \n    1.   (a) any fee must have been paid; and\n    2.   (b) the applicant must have provided biometrics when required; and\n    3.   (c) the applicant must have provided a passport or other travel document which satisfactorily establishes their identity and nationality; and\n    4.   (d) the applicant must be in the UK on the date of application.\n\nMOR 11.3. The applicant must have, or have last been granted, permission as a T2 Minister of Religion.\n\nMOR 11.4. An application which does not meet all the validity requirements for settlement for a T2 Minister of Religion may be rejected as invalid and not considered.",
      "summary": "Applicants seeking settlement as a T2 Minister of Religion must apply online using the specified form, pay fees, provide biometrics and travel documentation, and be in the UK at the time of application. They must also hold or have previously held valid T2 Minister of Religion permission; failure to meet all requirements renders the application invalid.",
      "augmented_text": "Document: Immigration Rules Appendix T2 Minister of Religion\nPart: Immigration Rules Appendix T2 Minister of Religion\nSection ID: MOR 11.1\nSection: Validity requirements for settlement as a T2 Minister of Religion\nTopic: settlement\n\nSummary: Applicants seeking settlement as a T2 Minister of Religion must apply online using the specified form, pay fees, provide biometrics and travel documentation, and be in the UK at the time of application. They must also hold or have previously held valid T2 Minister of Religion permission; failure to meet all requirements renders the application invalid.\n\n### Validity requirements for settlement as a T2 Minister of Religion\n\nMOR 11.1. A person who is applying for settlement as a T2 Minister of Religion must apply online on the gov.uk website on the specified form “Settle in the UK in various immigration categories: form SET(O)”.\n\n1.   MOR 11.2. An application for settlement must meet all the following requirements: \n    1.   (a) any fee must have been paid; and\n    2.   (b) the applicant must have provided biometrics when required; and\n    3.   (c) the applicant must have provided a passport or other travel document which satisfactorily establishes their identity and nationality; and\n    4.   (d) the applicant must be in the UK on the date of application.\n\nMOR 11.3. The applicant must have, or have last been granted, permission as a T2 Minister of Religion.\n\nMOR 11.4. An application which does not meet all the validity requirements for settlement for a T2 Minister of Religion may be rejected as invalid and not considered.",
      "needs_review": false
    },
    {
      "metadata": {
        "source": "Immigration Rules Appendix T2 Minister of Religion",
        "part": "Immigration Rules Appendix T2 Minister of Religion",
        "section_id": "MOR 12.1",
        "section_title": "Suitability Requirements for settlement as a T2 Minister of Religion",
        "parent_section": "MOR 12",
        "hierarchy_level": 2,
        "topic": "suitability",
        "url": "https://www.gov.uk/guidance/immigration-rules/immigration-rules-appendix-t2-minister-of-religion",
        "scraped_at": "2025-12-06T17:29:07.140260"
      },
      "text": "### Suitability Requirements for settlement as a T2 Minister of Religion\n\nMOR 12.1. The applicant must not fall for refusal under Part Suitability.\n\n1.   MOR 12.2. The applicant must not be: \n    1.   (a) in breach of immigration laws, except that where the Exceptions for overstayers section of Part Suitability applies, that period of overstaying will be disregarded; or\n    2.   (b) on immigration bail.",
      "summary": "This provision applies to applicants seeking settlement as a T2 Minister of Religion. They must not be in breach of immigration laws (unless overstaying falls under specified exceptions) or be on immigration bail. These suitability criteria ensure only lawful applicants are considered.",
      "augmented_text": "Document: Immigration Rules Appendix T2 Minister of Religion\nPart: Immigration Rules Appendix T2 Minister of Religion\nSection ID: MOR 12.1\nSection: Suitability Requirements for settlement as a T2 Minister of Religion\nTopic: suitability\n\nSummary: This provision applies to applicants seeking settlement as a T2 Minister of Religion. They must not be in breach of immigration laws (unless overstaying falls under specified exceptions) or be on immigration bail. These suitability criteria ensure only lawful applicants are considered.\n\n### Suitability Requirements for settlement as a T2 Minister of Religion\n\nMOR 12.1. The applicant must not fall for refusal under Part Suitability.\n\n1.   MOR 12.2. The applicant must not be: \n    1.   (a) in breach of immigration laws, except that where the Exceptions for overstayers section of Part Suitability applies, that period of overstaying will be disregarded; or\n    2.   (b) on immigration bail.",
      "needs_review": false
    },
    {
      "metadata": {
        "source": "Immigration Rules Appendix T2 Minister of Religion",
        "part": "Immigration Rules Appendix T2 Minister of Religion",
        "section_id": "Eligibility requirements for settlement as a T2 Minister of Religion",
        "section_title": "Eligibility requirements for settlement as a T2 Minister of Religion",
        "parent_section": null,
        "hierarchy_level": 3,
        "topic": "eligibility",
        "url": "https://www.gov.uk/guidance/immigration-rules/immigration-rules-appendix-t2-minister-of-religion",
        "scraped_at": "2025-12-06T17:29:07.140275"
      },
      "text": "### Eligibility requirements for settlement as a T2 Minister of Religion",
      "summary": "T2 Ministers of Religion seeking settlement must demonstrate continuous lawful residence and meet specified conduct and employment criteria, including adherence to immigration conditions. Exceptions or thresholds are not detailed in this excerpt.",
      "augmented_text": "Document: Immigration Rules Appendix T2 Minister of Religion\nPart: Immigration Rules Appendix T2 Minister of Religion\nSection ID: Eligibility requirements for settlement as a T2 Minister of Religion\nSection: Eligibility requirements for settlement as a T2 Minister of Religion\nTopic: eligibility\n\nSummary: T2 Ministers of Religion seeking settlement must demonstrate continuous lawful residence and meet specified conduct and employment criteria, including adherence to immigration conditions. Exceptions or thresholds are not detailed in this excerpt.\n\n### Eligibility requirements for settlement as a T2 Minister of Religion",
      "needs_review": false
    },
    {
      "metadata": {
        "source": "Immigration Rules Appendix T2 Minister of Religion",
        "part": "Immigration Rules Appendix T2 Minister of Religion",
        "section_id": "MOR 13.1",
        "section_title": "Sponsorship requirement for settlement as a T2 Minister of Religion",
        "parent_section": "MOR 13",
        "hierarchy_level": 2,
        "topic": "settlement",
        "url": "https://www.gov.uk/guidance/immigration-rules/immigration-rules-appendix-t2-minister-of-religion",
        "scraped_at": "2025-12-06T17:29:07.140315"
      },
      "text": "### Sponsorship requirement for settlement as a T2 Minister of Religion\n\nMOR 13.1. The sponsor in the applicant’s most recent permission must still be approved by the Home Office to sponsor a T2 Minister of Religion.\n\nMOR 13.2. The sponsor must confirm that they still require the applicant to work for them for the foreseeable future, and that the applicant is paid, and will be paid for the foreseeable future, the appropriate salary under MOR 5.1.(i).",
      "summary": "Applicants seeking settlement as a T2 Minister of Religion must be sponsored by an approved Home Office sponsor from their most recent permission. The sponsor must confirm ongoing need for the applicant, who must be paid, and will continue to be paid the appropriate salary.",
      "augmented_text": "Document: Immigration Rules Appendix T2 Minister of Religion\nPart: Immigration Rules Appendix T2 Minister of Religion\nSection ID: MOR 13.1\nSection: Sponsorship requirement for settlement as a T2 Minister of Religion\nTopic: settlement\n\nSummary: Applicants seeking settlement as a T2 Minister of Religion must be sponsored by an approved Home Office sponsor from their most recent permission. The sponsor must confirm ongoing need for the applicant, who must be paid, and will continue to be paid the appropriate salary.\n\n### Sponsorship requirement for settlement as a T2 Minister of Religion\n\nMOR 13.1. The sponsor in the applicant’s most recent permission must still be approved by the Home Office to sponsor a T2 Minister of Religion.\n\nMOR 13.2. The sponsor must confirm that they still require the applicant to work for them for the foreseeable future, and that the applicant is paid, and will be paid for the foreseeable future, the appropriate salary under MOR 5.1.(i).",
      "needs_review": false
    },
    {
      "metadata": {
        "source": "Immigration Rules Appendix T2 Minister of Religion",
        "part": "Immigration Rules Appendix T2 Minister of Religion",
        "section_id": "1",
        "section_title": "Qualifying period requirement for settlement as a T2 Minister of Religion",
        "parent_section": null,
        "hierarchy_level": 1,
        "topic": "settlement",
        "url": "https://www.gov.uk/guidance/immigration-rules/immigration-rules-appendix-t2-minister-of-religion",
        "scraped_at": "2025-12-06T17:29:07.140364"
      },
      "text": "### Qualifying period requirement for settlement as a T2 Minister of Religion\n\n1.   MOR 14.1. The applicant must have spent a continuous period of 5 years in the UK, and that period must consist of time with permission (not as a dependant) on any (or a combination) of the following routes: \n    1.   (a) T2 Minister of Religion; or\n    2.   (b) International Sportsperson; or\n    3.   (c) Skilled Worker; or\n    4.   (d) Tier 1, other than Tier 1 (Graduate Entrepreneur); or\n    5.   (e) Representative of an Overseas Business; or\n    6.   (f) Innovator Founder; or\n    7.   (g) Global Talent; or\n    8.   (h) Scale-up.",
      "summary": "Applicants for settlement as a T2 Minister of Religion must have completed a continuous 5-year period in the UK on specified routes, including T2 Minister of Religion or other skilled routes, without dependence status. The period requires permission (not as a dependent) and can involve various eligible visa categories.",
      "augmented_text": "Document: Immigration Rules Appendix T2 Minister of Religion\nPart: Immigration Rules Appendix T2 Minister of Religion\nSection ID: 1\nSection: Qualifying period requirement for settlement as a T2 Minister of Religion\nTopic: settlement\n\nSummary: Applicants for settlement as a T2 Minister of Religion must have completed a continuous 5-year period in the UK on specified routes, including T2 Minister of Religion or other skilled routes, without dependence status. The period requires permission (not as a dependent) and can involve various eligible visa categories.\n\n### Qualifying period requirement for settlement as a T2 Minister of Religion\n\n1.   MOR 14.1. The applicant must have spent a continuous period of 5 years in the UK, and that period must consist of time with permission (not as a dependant) on any (or a combination) of the following routes: \n    1.   (a) T2 Minister of Religion; or\n    2.   (b) International Sportsperson; or\n    3.   (c) Skilled Worker; or\n    4.   (d) Tier 1, other than Tier 1 (Graduate Entrepreneur); or\n    5.   (e) Representative of an Overseas Business; or\n    6.   (f) Innovator Founder; or\n    7.   (g) Global Talent; or\n    8.   (h) Scale-up.",
      "needs_review": false
    },
    {
      "metadata": {
        "source": "Immigration Rules Appendix T2 Minister of Religion",
        "part": "Immigration Rules Appendix T2 Minister of Religion",
        "section_id": "MOR 15.1",
        "section_title": "Continuous residence requirement for settlement as a T2 Minister of Religion",
        "parent_section": "MOR 15",
        "hierarchy_level": 2,
        "topic": "settlement",
        "url": "https://www.gov.uk/guidance/immigration-rules/immigration-rules-appendix-t2-minister-of-religion",
        "scraped_at": "2025-12-06T17:29:07.140397"
      },
      "text": "### Continuous residence requirement for settlement as a T2 Minister of Religion\n\nMOR 15.1. The applicant must meet the continuous residence requirement as specified in Appendix Continuous residence for the period in MOR 14.1.",
      "summary": "Applicants for settlement as a T2 Minister of Religion must satisfy the continuous residence requirement outlined in Appendix Continuous Residence, covering the period specified in MOR 14.1; failure to meet this requirement may prevent settlement.",
      "augmented_text": "Document: Immigration Rules Appendix T2 Minister of Religion\nPart: Immigration Rules Appendix T2 Minister of Religion\nSection ID: MOR 15.1\nSection: Continuous residence requirement for settlement as a T2 Minister of Religion\nTopic: settlement\n\nSummary: Applicants for settlement as a T2 Minister of Religion must satisfy the continuous residence requirement outlined in Appendix Continuous Residence, covering the period specified in MOR 14.1; failure to meet this requirement may prevent settlement.\n\n### Continuous residence requirement for settlement as a T2 Minister of Religion\n\nMOR 15.1. The applicant must meet the continuous residence requirement as specified in Appendix Continuous residence for the period in MOR 14.1.",
      "needs_review": false
    },
    {
      "metadata": {
        "source": "Immigration Rules Appendix T2 Minister of Religion",
        "part": "Immigration Rules Appendix T2 Minister of Religion",
        "section_id": "MOR 16.1",
        "section_title": "Knowledge of Life in the UK requirement for settlement as a T2 Minister of Religion",
        "parent_section": "MOR 16",
        "hierarchy_level": 2,
        "topic": "settlement",
        "url": "https://www.gov.uk/guidance/immigration-rules/immigration-rules-appendix-t2-minister-of-religion",
        "scraped_at": "2025-12-06T17:29:07.140429"
      },
      "text": "### Knowledge of Life in the UK requirement for settlement as a T2 Minister of Religion\n\nMOR 16.1. Unless an exemption applies, the applicant must meet the Knowledge of Life in the UK requirement as specified in Appendix KOL UK.",
      "summary": "Applicants for settlement as a T2 Minister of Religion must generally meet the Knowledge of Life in the UK requirement, unless exempted, by fulfilling criteria outlined in Appendix KOL UK.",
      "augmented_text": "Document: Immigration Rules Appendix T2 Minister of Religion\nPart: Immigration Rules Appendix T2 Minister of Religion\nSection ID: MOR 16.1\nSection: Knowledge of Life in the UK requirement for settlement as a T2 Minister of Religion\nTopic: settlement\n\nSummary: Applicants for settlement as a T2 Minister of Religion must generally meet the Knowledge of Life in the UK requirement, unless exempted, by fulfilling criteria outlined in Appendix KOL UK.\n\n### Knowledge of Life in the UK requirement for settlement as a T2 Minister of Religion\n\nMOR 16.1. Unless an exemption applies, the applicant must meet the Knowledge of Life in the UK requirement as specified in Appendix KOL UK.",
      "needs_review": false
    },
    {
      "metadata": {
        "source": "Immigration Rules Appendix T2 Minister of Religion",
        "part": "Immigration Rules Appendix T2 Minister of Religion",
        "section_id": "MOR 17.1",
        "section_title": "Decision on an application for settlement as a T2 Minister of Religion",
        "parent_section": "MOR 17",
        "hierarchy_level": 2,
        "topic": "eligibility",
        "url": "https://www.gov.uk/guidance/immigration-rules/immigration-rules-appendix-t2-minister-of-religion",
        "scraped_at": "2025-12-06T17:29:07.140448"
      },
      "text": "### Decision on an application for settlement as a T2 Minister of Religion\n\nMOR 17.1. If the decision maker is satisfied all the suitability and eligibility requirements for settlement as a T2 Minister of Religion are met the applicant will be granted settlement, otherwise the application will be refused.\n\nMOR 17.2. If the application is refused the person can apply for an Administrative Review under Appendix AR: Administrative Review.",
      "summary": "This provision applies to T2 Ministers of Religion applying for settlement. The decision hinges on meeting all suitability and eligibility requirements; failure results in refusal, but applicants may request an Administrative Review.",
      "augmented_text": "Document: Immigration Rules Appendix T2 Minister of Religion\nPart: Immigration Rules Appendix T2 Minister of Religion\nSection ID: MOR 17.1\nSection: Decision on an application for settlement as a T2 Minister of Religion\nTopic: eligibility\n\nSummary: This provision applies to T2 Ministers of Religion applying for settlement. The decision hinges on meeting all suitability and eligibility requirements; failure results in refusal, but applicants may request an Administrative Review.\n\n### Decision on an application for settlement as a T2 Minister of Religion\n\nMOR 17.1. If the decision maker is satisfied all the suitability and eligibility requirements for settlement as a T2 Minister of Religion are met the applicant will be granted settlement, otherwise the application will be refused.\n\nMOR 17.2. If the application is refused the person can apply for an Administrative Review under Appendix AR: Administrative Review.",
      "needs_review": false
    },
    {
      "metadata": {
        "source": "Immigration Rules Appendix T2 Minister of Religion",
        "part": "Immigration Rules Appendix T2 Minister of Religion",
        "section_id": "SW 3.4",
        "section_title": "Dependants of a T2 Minister of Religion",
        "parent_section": null,
        "hierarchy_level": 2,
        "topic": "eligibility",
        "url": "https://www.gov.uk/guidance/immigration-rules/immigration-rules-appendix-t2-minister-of-religion",
        "scraped_at": "2025-12-06T17:29:07.140473"
      },
      "text": "### Dependants of a T2 Minister of Religion",
      "summary": "This provision applies to dependants of a T2 Minister of Religion. Dependants must meet eligibility criteria, including relationship and support requirements, to accompany or join the T2 visa holder, with specific conditions applying when the main applicant is in the UK.",
      "augmented_text": "Document: Immigration Rules Appendix T2 Minister of Religion\nPart: Immigration Rules Appendix T2 Minister of Religion\nSection ID: SW 3.4\nSection: Dependants of a T2 Minister of Religion\nTopic: eligibility\n\nSummary: This provision applies to dependants of a T2 Minister of Religion. Dependants must meet eligibility criteria, including relationship and support requirements, to accompany or join the T2 visa holder, with specific conditions applying when the main applicant is in the UK.\n\n### Dependants of a T2 Minister of Religion",
      "needs_review": false
    },
    {
      "metadata": {
        "source": "Immigration Rules Appendix T2 Minister of Religion",
        "part": "Immigration Rules Appendix T2 Minister of Religion",
        "section_id": "MOR 18.1",
        "section_title": "Validity requirements for a dependent partner (“partner”) or dependent child (“child”) of a T2 Minister of Religion",
        "parent_section": "MOR 18",
        "hierarchy_level": 2,
        "topic": "leave-to-enter",
        "url": "https://www.gov.uk/guidance/immigration-rules/immigration-rules-appendix-t2-minister-of-religion",
        "scraped_at": "2025-12-06T17:29:07.140525"
      },
      "text": "### Validity requirements for a dependent partner (“partner”) or dependent child (“child”) of a T2 Minister of Religion\n\nMOR 18.1. A person applying for entry clearance or permission to stay as a partner or child of a T2 Minister of Religion must apply online on the gov.uk website on the specified form as follows:\n\n| Location of partner or child | Specified form |\n| --- | --- |\n| Outside the UK | Dependant partner visa Dependant child visa |\n| Inside the UK | If applying at the same time as the T2 Minister of Religion, they can be added to the Tier 2 (Minister of Religion) leave to remain form. If applying separately from the T2 Minister of Religion: • Dependant partner • Dependant child |\n\n1.   MOR 18.2. An application for entry clearance or permission to stay as a partner or child of a T2 Minister of Religion must meet all the following requirements: \n    1.   (a) any fee and Immigration Health Charge must have been paid; and\n    2.   (b) the applicant must have provided biometrics when required; and\n    3.   (c) the applicant must have provided a passport or other travel document which satisfactorily establishes their identity and nationality; and \n        1.   (i) has made a valid application for entry clearance or permission to stay on the T2 Minister of Religion route that has not been decided; or\n        2.   (ii) has permission on the T2 Minister of Religion route; or\n        3.   (iii) is settled or has become a British citizen, providing that P had permission on the T2 Minister of Religion route when they settled and the applicant either had permission as their partner or child at that time, or the applicant is applying as a child of P and the applicant was born in the UK before P settled.\n\nMOR 18.3. An applicant applying as a partner must be aged 18 or over on the date of application.\n\n1.   MOR 18.4. If applying for permission to stay, the applicant must be in the UK on the date of application.\n2.   MOR 18.4ZA. If applying for permission to stay, the applicant must not have, or have last been granted, permission: \n    1.   (a) as a Visitor; or\n    2.   (b) as a Short-term Student; or\n    3.   (c) as a Parent of a Child Student; or\n    4.   (d) as a Seasonal Worker; or\n    5.   (e) as a Domestic Worker in a Private Household; or\n    6.   (f) outside the Immigration Rules.\n\n1.   MOR 18.4A. An applicant who is applying for permission to stay and has, or last had, permission as a Student, must fulfil one of the Conditions A or B below on the date of application: \n    1.   (a) Condition A: the applicant must have completed the course of study for which the Confirmation of Acceptance for Studies was assigned (or a course to which ST 27.3 of Appendix Student applies); or\n    2.   (b) Condition B: the applicant must: \n        1.   (i) be studying a full-time course of study leading to the award of a PhD with a higher education provider which has a track record of compliance; and\n        2.   (ii) have completed at least 24 months of study on that course.\n\nMOR 18.5. An application which does not meet all the validity requirements for a partner or child of a T2 Minister of Religion may be rejected as invalid and not considered.",
      "summary": "This provision applies to dependents (partner or child) of a T2 Minister of Religion seeking entry clearance or permission to stay. Applicants must apply online using specified forms, pay fees and the Immigration Health Charge, provide biometrics and valid travel documents, and have a valid, undecided, or existing T2 Minister of Religion permission, with some settled or British citizens exceptions.",
      "augmented_text": "Document: Immigration Rules Appendix T2 Minister of Religion\nPart: Immigration Rules Appendix T2 Minister of Religion\nSection ID: MOR 18.1\nSection: Validity requirements for a dependent partner (“partner”) or dependent child (“child”) of a T2 Minister of Religion\nTopic: leave-to-enter\n\nSummary: This provision applies to dependents (partner or child) of a T2 Minister of Religion seeking entry clearance or permission to stay. Applicants must apply online using specified forms, pay fees and the Immigration Health Charge, provide biometrics and valid travel documents, and have a valid, undecided, or existing T2 Minister of Religion permission, with some settled or British citizens exceptions.\n\n### Validity requirements for a dependent partner (“partner”) or dependent child (“child”) of a T2 Minister of Religion\n\nMOR 18.1. A person applying for entry clearance or permission to stay as a partner or child of a T2 Minister of Religion must apply online on the gov.uk website on the specified form as follows:\n\n| Location of partner or child | Specified form |\n| --- | --- |\n| Outside the UK | Dependant partner visa Dependant child visa |\n| Inside the UK | If applying at the same time as the T2 Minister of Religion, they can be added to the Tier 2 (Minister of Religion) leave to remain form. If applying separately from the T2 Minister of Religion: • Dependant partner • Dependant child |\n\n1.   MOR 18.2. An application for entry clearance or permission to stay as a partner or child of a T2 Minister of Religion must meet all the following requirements: \n    1.   (a) any fee and Immigration Health Charge must have been paid; and\n    2.   (b) the applicant must have provided biometrics when required; and\n    3.   (c) the applicant must have provided a passport or other travel document which satisfactorily establishes their identity and nationality; and \n        1.   (i) has made a valid application for entry clearance or permission to stay on the T2 Minister of Religion route that has not been decided; or\n        2.   (ii) has permission on the T2 Minister of Religion route; or\n        3.   (iii) is settled or has become a British citizen, providing that P had permission on the T2 Minister of Religion route when they settled and the applicant either had permission as their partner or child at that time, or the applicant is applying as a child of P and the applicant was born in the UK before P settled.\n\nMOR 18.3. An applicant applying as a partner must be aged 18 or over on the date of application.\n\n1.   MOR 18.4. If applying for permission to stay, the applicant must be in the UK on the date of application.\n2.   MOR 18.4ZA. If applying for permission to stay, the applicant must not have, or have last been granted, permission: \n    1.   (a) as a Visitor; or\n    2.   (b) as a Short-term Student; or\n    3.   (c) as a Parent of a Child Student; or\n    4.   (d) as a Seasonal Worker; or\n    5.   (e) as a Domestic Worker in a Private Household; or\n    6.   (f) outside the Immigration Rules.\n\n1.   MOR 18.4A. An applicant who is applying for permission to stay and has, or last had, permission as a Student, must fulfil one of the Conditions A or B below on the date of application: \n    1.   (a) Condition A: the applicant must have completed the course of study for which the Confirmation of Acceptance for Studies was assigned (or a course to which ST 27.3 of Appendix Student applies); or\n    2.   (b) Condition B: the applicant must: \n        1.   (i) be studying a full-time course of study leading to the award of a PhD with a higher education provider which has a track record of compliance; and\n        2.   (ii) have completed at least 24 months of study on that course.\n\nMOR 18.5. An application which does not meet all the validity requirements for a partner or child of a T2 Minister of Religion may be rejected as invalid and not considered.",
      "needs_review": false
    },
    {
      "metadata": {
        "source": "Immigration Rules Appendix T2 Minister of Religion",
        "part": "Immigration Rules Appendix T2 Minister of Religion",
        "section_id": "MOR 19.1",
        "section_title": "Suitability requirements for a partner or child of a T2 Minister of Religion",
        "parent_section": "MOR 19",
        "hierarchy_level": 2,
        "topic": "suitability",
        "url": "https://www.gov.uk/guidance/immigration-rules/immigration-rules-appendix-t2-minister-of-religion",
        "scraped_at": "2025-12-06T17:29:07.140553"
      },
      "text": "### Suitability requirements for a partner or child of a T2 Minister of Religion\n\nMOR 19.1. The applicant must not fall for refusal under Part Suitability.\n\n1.   MOR 19.2. If applying for permission to stay the applicant must not be: \n    1.   (a) in breach of immigration laws, except that where the Exceptions for overstayers section of Part Suitability applies, that period of overstaying will be disregarded; or\n    2.   (b) on immigration bail.",
      "summary": "This provision applies to partners or children of T2 Ministers of Religion seeking permission to stay. They must meet suitability criteria, including not breaching immigration laws (except when overstaying is disregarded) or being on immigration bail.",
      "augmented_text": "Document: Immigration Rules Appendix T2 Minister of Religion\nPart: Immigration Rules Appendix T2 Minister of Religion\nSection ID: MOR 19.1\nSection: Suitability requirements for a partner or child of a T2 Minister of Religion\nTopic: suitability\n\nSummary: This provision applies to partners or children of T2 Ministers of Religion seeking permission to stay. They must meet suitability criteria, including not breaching immigration laws (except when overstaying is disregarded) or being on immigration bail.\n\n### Suitability requirements for a partner or child of a T2 Minister of Religion\n\nMOR 19.1. The applicant must not fall for refusal under Part Suitability.\n\n1.   MOR 19.2. If applying for permission to stay the applicant must not be: \n    1.   (a) in breach of immigration laws, except that where the Exceptions for overstayers section of Part Suitability applies, that period of overstaying will be disregarded; or\n    2.   (b) on immigration bail.",
      "needs_review": false
    },
    {
      "metadata": {
        "source": "Immigration Rules Appendix T2 Minister of Religion",
        "part": "Immigration Rules Appendix T2 Minister of Religion",
        "section_id": "Eligibility requirements for partner or child of a T2 Minister of Religion",
        "section_title": "Eligibility requirements for partner or child of a T2 Minister of Religion",
        "parent_section": null,
        "hierarchy_level": 3,
        "topic": "eligibility",
        "url": "https://www.gov.uk/guidance/immigration-rules/immigration-rules-appendix-t2-minister-of-religion",
        "scraped_at": "2025-12-06T17:29:07.140567"
      },
      "text": "### Eligibility requirements for partner or child of a T2 Minister of Religion",
      "summary": "This provision applies to partners and children of T2 Ministers of Religion. They must meet specific eligibility criteria to join or remain with the sponsor, including proof of relationship and suitability, with exceptions or conditions specified in the full rules.",
      "augmented_text": "Document: Immigration Rules Appendix T2 Minister of Religion\nPart: Immigration Rules Appendix T2 Minister of Religion\nSection ID: Eligibility requirements for partner or child of a T2 Minister of Religion\nSection: Eligibility requirements for partner or child of a T2 Minister of Religion\nTopic: eligibility\n\nSummary: This provision applies to partners and children of T2 Ministers of Religion. They must meet specific eligibility criteria to join or remain with the sponsor, including proof of relationship and suitability, with exceptions or conditions specified in the full rules.\n\n### Eligibility requirements for partner or child of a T2 Minister of Religion",
      "needs_review": false
    },
    {
      "metadata": {
        "source": "Immigration Rules Appendix T2 Minister of Religion",
        "part": "Immigration Rules Appendix T2 Minister of Religion",
        "section_id": "MOR 20.1",
        "section_title": "Entry requirements for a partner or child of a T2 Minister of Religion",
        "parent_section": "MOR 20",
        "hierarchy_level": 2,
        "topic": "leave-to-enter",
        "url": "https://www.gov.uk/guidance/immigration-rules/immigration-rules-appendix-t2-minister-of-religion",
        "scraped_at": "2025-12-06T17:29:07.140641"
      },
      "text": "### Entry requirements for a partner or child of a T2 Minister of Religion\n\nMOR 20.1. A person seeking to come to the UK as a partner or child of a T2 Minister of Religion must apply for and obtain an entry clearance as a partner or child of a T2 Minister of Religion before they arrive in the UK.\n\nMOR 20.2. A person applying for entry clearance as the partner or child of a T2 Minister of Religion must, if Appendix Tuberculosis applies, provide a valid medical certificate confirming that they have undergone screening for active pulmonary tuberculosis and that this tuberculosis is not present in them.",
      "summary": "Partners or children of T2 Ministers of Religion must secure prior entry clearance before arriving, with applicants potentially needing to provide a medical certificate confirming tuberculosis screening if applicable.",
      "augmented_text": "Document: Immigration Rules Appendix T2 Minister of Religion\nPart: Immigration Rules Appendix T2 Minister of Religion\nSection ID: MOR 20.1\nSection: Entry requirements for a partner or child of a T2 Minister of Religion\nTopic: leave-to-enter\n\nSummary: Partners or children of T2 Ministers of Religion must secure prior entry clearance before arriving, with applicants potentially needing to provide a medical certificate confirming tuberculosis screening if applicable.\n\n### Entry requirements for a partner or child of a T2 Minister of Religion\n\nMOR 20.1. A person seeking to come to the UK as a partner or child of a T2 Minister of Religion must apply for and obtain an entry clearance as a partner or child of a T2 Minister of Religion before they arrive in the UK.\n\nMOR 20.2. A person applying for entry clearance as the partner or child of a T2 Minister of Religion must, if Appendix Tuberculosis applies, provide a valid medical certificate confirming that they have undergone screening for active pulmonary tuberculosis and that this tuberculosis is not present in them.",
      "needs_review": false
    },
    {
      "metadata": {
        "source": "Immigration Rules Appendix T2 Minister of Religion",
        "part": "Immigration Rules Appendix T2 Minister of Religion",
        "section_id": "1",
        "section_title": "Relationship requirement for a partner of a T2 Minister or Religion",
        "parent_section": null,
        "hierarchy_level": 1,
        "topic": "family",
        "url": "https://www.gov.uk/guidance/immigration-rules/immigration-rules-appendix-t2-minister-of-religion",
        "scraped_at": "2025-12-06T17:29:07.140751"
      },
      "text": "### Relationship requirement for a partner of a T2 Minister or Religion\n\n1.   MOR 21.1. The applicant must be the partner of a person (P) where one of the following applies: \n    1.   (a) P has permission as a T2 Minister of Religion; or\n    2.   (b) P is, at the same time, applying for (and is granted) entry clearance or permission as a T2 Minister of Religion; or\n    3.   (c) P is settled or has become a British citizen, providing P had permission as a T2 Minister of Religion when they settled, and the applicant had permission as P’s partner at that time.\n\nMOR 21.2. The requirements of Appendix Relationship with Partner must be met.\n\nMOR 21.3. DELETED\n\nMOR 21.4. DELETED",
      "summary": "This provision applies to partners of T2 Ministers of Religion. The applicant must be their partner under specific conditions, such as the partner holding or applying for T2 permission or being settled/born in the UK with the relevant permission. Critical conditions include maintaining the relationship during the application and meeting Appendix Relationship with Partner requirements.",
      "augmented_text": "Document: Immigration Rules Appendix T2 Minister of Religion\nPart: Immigration Rules Appendix T2 Minister of Religion\nSection ID: 1\nSection: Relationship requirement for a partner of a T2 Minister or Religion\nTopic: family\n\nSummary: This provision applies to partners of T2 Ministers of Religion. The applicant must be their partner under specific conditions, such as the partner holding or applying for T2 permission or being settled/born in the UK with the relevant permission. Critical conditions include maintaining the relationship during the application and meeting Appendix Relationship with Partner requirements.\n\n### Relationship requirement for a partner of a T2 Minister or Religion\n\n1.   MOR 21.1. The applicant must be the partner of a person (P) where one of the following applies: \n    1.   (a) P has permission as a T2 Minister of Religion; or\n    2.   (b) P is, at the same time, applying for (and is granted) entry clearance or permission as a T2 Minister of Religion; or\n    3.   (c) P is settled or has become a British citizen, providing P had permission as a T2 Minister of Religion when they settled, and the applicant had permission as P’s partner at that time.\n\nMOR 21.2. The requirements of Appendix Relationship with Partner must be met.\n\nMOR 21.3. DELETED\n\nMOR 21.4. DELETED",
      "needs_review": false
    },
    {
      "metadata": {
        "source": "Immigration Rules Appendix T2 Minister of Religion",
        "part": "Immigration Rules Appendix T2 Minister of Religion",
        "section_id": "MOR 22.1",
        "section_title": "Relationship requirement for a child of a T2 Minister of Religion",
        "parent_section": "MOR 22",
        "hierarchy_level": 2,
        "topic": "family",
        "url": "https://www.gov.uk/guidance/immigration-rules/immigration-rules-appendix-t2-minister-of-religion",
        "scraped_at": "2025-12-06T17:29:07.140788"
      },
      "text": "### Relationship requirement for a child of a T2 Minister of Religion\n\nMOR 22.1. DELETED.\n\nMOR 22.2. DELETED.\n\nMOR 22.3. DELETED.",
      "summary": "This provision applies to children of a T2 Minister of Religion seeking immigration. It requires demonstrating a genuine parent-child relationship, with specific conditions likely outlined in the deleted sections. No additional conditions or exceptions are specified in the available text.",
      "augmented_text": "Document: Immigration Rules Appendix T2 Minister of Religion\nPart: Immigration Rules Appendix T2 Minister of Religion\nSection ID: MOR 22.1\nSection: Relationship requirement for a child of a T2 Minister of Religion\nTopic: family\n\nSummary: This provision applies to children of a T2 Minister of Religion seeking immigration. It requires demonstrating a genuine parent-child relationship, with specific conditions likely outlined in the deleted sections. No additional conditions or exceptions are specified in the available text.\n\n### Relationship requirement for a child of a T2 Minister of Religion\n\nMOR 22.1. DELETED.\n\nMOR 22.2. DELETED.\n\nMOR 22.3. DELETED.",
      "needs_review": false
    },
    {
      "metadata": {
        "source": "Immigration Rules Appendix T2 Minister of Religion",
        "part": "Immigration Rules Appendix T2 Minister of Religion",
        "section_id": "MOR 23.1",
        "section_title": "Age requirement for a child of a T2 Minister of Religion",
        "parent_section": "MOR 23",
        "hierarchy_level": 2,
        "topic": "family",
        "url": "https://www.gov.uk/guidance/immigration-rules/immigration-rules-appendix-t2-minister-of-religion",
        "scraped_at": "2025-12-06T17:29:07.140817"
      },
      "text": "### Age requirement for a child of a T2 Minister of Religion\n\nMOR 23.1 DELETED.\n\nMOR 23.2. DELETED.",
      "summary": "This provision applies to children of T2 Ministers of Religion. It sets age-related requirements for their eligibility to accompany or join the sponsor, with specific conditions and thresholds detailed elsewhere in the rules, which are not included in this excerpt.",
      "augmented_text": "Document: Immigration Rules Appendix T2 Minister of Religion\nPart: Immigration Rules Appendix T2 Minister of Religion\nSection ID: MOR 23.1\nSection: Age requirement for a child of a T2 Minister of Religion\nTopic: family\n\nSummary: This provision applies to children of T2 Ministers of Religion. It sets age-related requirements for their eligibility to accompany or join the sponsor, with specific conditions and thresholds detailed elsewhere in the rules, which are not included in this excerpt.\n\n### Age requirement for a child of a T2 Minister of Religion\n\nMOR 23.1 DELETED.\n\nMOR 23.2. DELETED.",
      "needs_review": false
    },
    {
      "metadata": {
        "source": "Immigration Rules Appendix T2 Minister of Religion",
        "part": "Immigration Rules Appendix T2 Minister of Religion",
        "section_id": "MOR 24.1",
        "section_title": "Care requirement for a child of a T2 Minister of Religion",
        "parent_section": "MOR 24",
        "hierarchy_level": 2,
        "topic": "family",
        "url": "https://www.gov.uk/guidance/immigration-rules/immigration-rules-appendix-t2-minister-of-religion",
        "scraped_at": "2025-12-06T17:29:07.140841"
      },
      "text": "### Care requirement for a child of a T2 Minister of Religion\n\nMOR 24.1. DELETED.",
      "summary": "This provision applies to children of T2 Ministers of Religion. It requires that the applicant demonstrates appropriate care arrangements for the child. No specific conditions or exceptions are provided in the deleted section.",
      "augmented_text": "Document: Immigration Rules Appendix T2 Minister of Religion\nPart: Immigration Rules Appendix T2 Minister of Religion\nSection ID: MOR 24.1\nSection: Care requirement for a child of a T2 Minister of Religion\nTopic: family\n\nSummary: This provision applies to children of T2 Ministers of Religion. It requires that the applicant demonstrates appropriate care arrangements for the child. No specific conditions or exceptions are provided in the deleted section.\n\n### Care requirement for a child of a T2 Minister of Religion\n\nMOR 24.1. DELETED.",
      "needs_review": false
    },
    {
      "metadata": {
        "source": "Immigration Rules Appendix T2 Minister of Religion",
        "part": "Immigration Rules Appendix T2 Minister of Religion",
        "section_id": "1",
        "section_title": "Requirements for a dependent child of a T2 Minister of Religion",
        "parent_section": null,
        "hierarchy_level": 1,
        "topic": "leave-to-enter",
        "url": "https://www.gov.uk/guidance/immigration-rules/immigration-rules-appendix-t2-minister-of-religion",
        "scraped_at": "2025-12-06T17:29:07.140869"
      },
      "text": "### Requirements for a dependent child of a T2 Minister of Religion\n\n1.   MOR 24A.1. The applicant must meet the following requirements for a dependent child in Appendix Children \n    1.   (a) relationship requirement: entry clearance and permission to stay; and\n    2.   (b) care requirement; and\n    3.   (c) age and independent life requirement.",
      "summary": "Dependent children of T2 Ministers of Religion must meet the relationship, care, and age/independent life requirements outlined in Appendix Children to qualify for entry clearance and permission to stay, with specific conditions relating to their relationship, care needs, and age eligibility.",
      "augmented_text": "Document: Immigration Rules Appendix T2 Minister of Religion\nPart: Immigration Rules Appendix T2 Minister of Religion\nSection ID: 1\nSection: Requirements for a dependent child of a T2 Minister of Religion\nTopic: leave-to-enter\n\nSummary: Dependent children of T2 Ministers of Religion must meet the relationship, care, and age/independent life requirements outlined in Appendix Children to qualify for entry clearance and permission to stay, with specific conditions relating to their relationship, care needs, and age eligibility.\n\n### Requirements for a dependent child of a T2 Minister of Religion\n\n1.   MOR 24A.1. The applicant must meet the following requirements for a dependent child in Appendix Children \n    1.   (a) relationship requirement: entry clearance and permission to stay; and\n    2.   (b) care requirement; and\n    3.   (c) age and independent life requirement.",
      "needs_review": false
    },
    {
      "metadata": {
        "source": "Immigration Rules Appendix T2 Minister of Religion",
        "part": "Immigration Rules Appendix T2 Minister of Religion",
        "section_id": "MOR 25.1",
        "section_title": "Financial requirement for a partner or child on the T2 Minister of Religion route",
        "parent_section": "MOR 25",
        "hierarchy_level": 2,
        "topic": "financial",
        "url": "https://www.gov.uk/guidance/immigration-rules/immigration-rules-appendix-t2-minister-of-religion",
        "scraped_at": "2025-12-06T17:29:07.140893"
      },
      "text": "### Financial requirement for a partner or child on the T2 Minister of Religion route\n\nMOR 25.1. If the applicant is applying for permission to stay and has been living in the UK with permission for 12 months or longer on the date of application, they will meet the financial requirement and do not need to show funds.\n\n1.   MOR 25.2. If an applicant is applying for entry clearance, or has been in the UK for less than 12 months on the date of application, either: \n    1.   (a) funds of at least the amount required in MOR 25.3. must be held collectively by one or more of the following: \n        1.   (i) the applicant; and\n        2.   (ii) the T2 Minister of Religion; and\n        3.   (iii) if the applicant is applying as a dependent child, their parent who is lawfully present in the UK or being granted entry clearance, or permission to stay, at the same time; or\n\n    2.   (b) the T2 Minister of Religion’s A-rated sponsor must certify that they will, if necessary, maintain and accommodate the partner and/or any dependent child as well as the T2 Minister of Religion, up to the end of the first month of each of their grants of permission, to at least the amounts required in MOR 25.3.\n\n1.   MOR 25.3. The level of funds required are: \n    1.   (a) £285 for a partner in the UK, or applying for entry clearance; and\n    2.   (b) £315 for the first dependent child in the UK, or applying for entry clearance; and\n    3.   (c) £200 for any other dependent child in the UK, or applying for entry clearance.\n\nMOR 25.4. If MOR 25.2(a) applies, the funds held for the applicant must be held in addition to any funds required for the T2 Minister of Religion to meet the financial requirement and any other dependents in the UK or applying at the same time.\n\nMOR 25.5. If MOR 25.2.(a) applies, the funds must have been held for a 28- day period and as specified in Appendix Finance.",
      "summary": "Applicants applying to stay or with less than 12 months' UK permission must demonstrate funds of at least £285 for a partner, £315 for the first child, or £200 for additional children, either held collectively or certified by their sponsor. Those with 12+ months' residence are exempt from this financial requirement.",
      "augmented_text": "Document: Immigration Rules Appendix T2 Minister of Religion\nPart: Immigration Rules Appendix T2 Minister of Religion\nSection ID: MOR 25.1\nSection: Financial requirement for a partner or child on the T2 Minister of Religion route\nTopic: financial\n\nSummary: Applicants applying to stay or with less than 12 months' UK permission must demonstrate funds of at least £285 for a partner, £315 for the first child, or £200 for additional children, either held collectively or certified by their sponsor. Those with 12+ months' residence are exempt from this financial requirement.\n\n### Financial requirement for a partner or child on the T2 Minister of Religion route\n\nMOR 25.1. If the applicant is applying for permission to stay and has been living in the UK with permission for 12 months or longer on the date of application, they will meet the financial requirement and do not need to show funds.\n\n1.   MOR 25.2. If an applicant is applying for entry clearance, or has been in the UK for less than 12 months on the date of application, either: \n    1.   (a) funds of at least the amount required in MOR 25.3. must be held collectively by one or more of the following: \n        1.   (i) the applicant; and\n        2.   (ii) the T2 Minister of Religion; and\n        3.   (iii) if the applicant is applying as a dependent child, their parent who is lawfully present in the UK or being granted entry clearance, or permission to stay, at the same time; or\n\n    2.   (b) the T2 Minister of Religion’s A-rated sponsor must certify that they will, if necessary, maintain and accommodate the partner and/or any dependent child as well as the T2 Minister of Religion, up to the end of the first month of each of their grants of permission, to at least the amounts required in MOR 25.3.\n\n1.   MOR 25.3. The level of funds required are: \n    1.   (a) £285 for a partner in the UK, or applying for entry clearance; and\n    2.   (b) £315 for the first dependent child in the UK, or applying for entry clearance; and\n    3.   (c) £200 for any other dependent child in the UK, or applying for entry clearance.\n\nMOR 25.4. If MOR 25.2(a) applies, the funds held for the applicant must be held in addition to any funds required for the T2 Minister of Religion to meet the financial requirement and any other dependents in the UK or applying at the same time.\n\nMOR 25.5. If MOR 25.2.(a) applies, the funds must have been held for a 28- day period and as specified in Appendix Finance.",
      "needs_review": false
    },
    {
      "metadata": {
        "source": "Immigration Rules Appendix T2 Minister of Religion",
        "part": "Immigration Rules Appendix T2 Minister of Religion",
        "section_id": "MOR 26.1",
        "section_title": "Decision on an application as a partner or child of a T2 Minister of Religion",
        "parent_section": "MOR 26",
        "hierarchy_level": 2,
        "topic": "eligibility",
        "url": "https://www.gov.uk/guidance/immigration-rules/immigration-rules-appendix-t2-minister-of-religion",
        "scraped_at": "2025-12-06T17:29:07.140907"
      },
      "text": "### Decision on an application as a partner or child of a T2 Minister of Religion\n\nMOR 26.1. If the decision maker is satisfied that all the suitability and eligibility requirements for a partner or child of a T2 Minister of Religion are met, the application will be granted, otherwise the application will be refused.\n\nMOR 26.2. If the application is refused, the person can apply for an Administrative Review under Appendix AR: Administrative Review.",
      "summary": "This provision applies to partners or children of T2 Ministers of Religion. It requires the decision-maker to determine if all suitability and eligibility criteria are satisfied for approval; otherwise, the application is refused, with an option for Administrative Review.",
      "augmented_text": "Document: Immigration Rules Appendix T2 Minister of Religion\nPart: Immigration Rules Appendix T2 Minister of Religion\nSection ID: MOR 26.1\nSection: Decision on an application as a partner or child of a T2 Minister of Religion\nTopic: eligibility\n\nSummary: This provision applies to partners or children of T2 Ministers of Religion. It requires the decision-maker to determine if all suitability and eligibility criteria are satisfied for approval; otherwise, the application is refused, with an option for Administrative Review.\n\n### Decision on an application as a partner or child of a T2 Minister of Religion\n\nMOR 26.1. If the decision maker is satisfied that all the suitability and eligibility requirements for a partner or child of a T2 Minister of Religion are met, the application will be granted, otherwise the application will be refused.\n\nMOR 26.2. If the application is refused, the person can apply for an Administrative Review under Appendix AR: Administrative Review.",
      "needs_review": false
    },
    {
      "metadata": {
        "source": "Immigration Rules Appendix T2 Minister of Religion",
        "part": "Immigration Rules Appendix T2 Minister of Religion",
        "section_id": "1",
        "section_title": "Period of grant for a partner or a child of a T2 Minister of Religion route",
        "parent_section": null,
        "hierarchy_level": 1,
        "topic": "family",
        "url": "https://www.gov.uk/guidance/immigration-rules/immigration-rules-appendix-t2-minister-of-religion",
        "scraped_at": "2025-12-06T17:29:07.140945"
      },
      "text": "### Period of grant for a partner or a child of a T2 Minister of Religion route\n\n1.   MOR 27.1. A partner will be granted: \n    1.   (a) permission which ends on the same date as their partner’s permission as a T2 Minister of Religion; or\n    2.   (b) 3 years’ permission if the T2 Minister of Religion was (or is being) granted settlement as a T2 Minister of Religion.\n\nMOR 27.2. A child will be granted permission which ends on the same date as whichever of their parents’ permission ends first, unless both parents have (or are being granted) settlement or British Citizenship, in which case the child will be granted permission for 3 years.",
      "summary": "Partners of T2 Ministers of Religion are granted permission for either the same duration as their partner or up to 3 years if settlement is pending; children’s permissions align with the earliest parental expiry date, unless both parents have settlement or British Citizenship, then they receive 3 years.",
      "augmented_text": "Document: Immigration Rules Appendix T2 Minister of Religion\nPart: Immigration Rules Appendix T2 Minister of Religion\nSection ID: 1\nSection: Period of grant for a partner or a child of a T2 Minister of Religion route\nTopic: family\n\nSummary: Partners of T2 Ministers of Religion are granted permission for either the same duration as their partner or up to 3 years if settlement is pending; children’s permissions align with the earliest parental expiry date, unless both parents have settlement or British Citizenship, then they receive 3 years.\n\n### Period of grant for a partner or a child of a T2 Minister of Religion route\n\n1.   MOR 27.1. A partner will be granted: \n    1.   (a) permission which ends on the same date as their partner’s permission as a T2 Minister of Religion; or\n    2.   (b) 3 years’ permission if the T2 Minister of Religion was (or is being) granted settlement as a T2 Minister of Religion.\n\nMOR 27.2. A child will be granted permission which ends on the same date as whichever of their parents’ permission ends first, unless both parents have (or are being granted) settlement or British Citizenship, in which case the child will be granted permission for 3 years.",
      "needs_review": false
    },
    {
      "metadata": {
        "source": "Immigration Rules Appendix T2 Minister of Religion",
        "part": "Immigration Rules Appendix T2 Minister of Religion",
        "section_id": "1",
        "section_title": "Conditions of grant for a partner or child of a T2 Minister of Religion",
        "parent_section": null,
        "hierarchy_level": 1,
        "topic": "financial",
        "url": "https://www.gov.uk/guidance/immigration-rules/immigration-rules-appendix-t2-minister-of-religion",
        "scraped_at": "2025-12-06T17:29:07.140968"
      },
      "text": "### Conditions of grant for a partner or child of a T2 Minister of Religion\n\n1.   MOR 27.3. The grant will be subject to all the following conditions: \n    1.   (a) no access to public funds; and\n    2.   (b) work (including self-employment and voluntary work) is permitted; except for employment as a professional sportsperson (including as a sports coach); and\n    3.   (c) study is permitted, subject to the ATAS condition in Appendix ATAS if the applicant is over the age of 18.\n    4.   (d) DELETED",
      "summary": "This provision applies to partners and children of T2 Ministers of Religion. They must not access public funds, are permitted to work (excluding professional sport), and can study (with ATAS if aged over 18). These conditions are mandatory for their grant eligibility.",
      "augmented_text": "Document: Immigration Rules Appendix T2 Minister of Religion\nPart: Immigration Rules Appendix T2 Minister of Religion\nSection ID: 1\nSection: Conditions of grant for a partner or child of a T2 Minister of Religion\nTopic: financial\n\nSummary: This provision applies to partners and children of T2 Ministers of Religion. They must not access public funds, are permitted to work (excluding professional sport), and can study (with ATAS if aged over 18). These conditions are mandatory for their grant eligibility.\n\n### Conditions of grant for a partner or child of a T2 Minister of Religion\n\n1.   MOR 27.3. The grant will be subject to all the following conditions: \n    1.   (a) no access to public funds; and\n    2.   (b) work (including self-employment and voluntary work) is permitted; except for employment as a professional sportsperson (including as a sports coach); and\n    3.   (c) study is permitted, subject to the ATAS condition in Appendix ATAS if the applicant is over the age of 18.\n    4.   (d) DELETED",
      "needs_review": false
    },
    {
      "metadata": {
        "source": "Immigration Rules Appendix T2 Minister of Religion",
        "part": "Immigration Rules Appendix T2 Minister of Religion",
        "section_id": "Settlement as a partner or child of a T2 Minister of Religion",
        "section_title": "Settlement as a partner or child of a T2 Minister of Religion",
        "parent_section": null,
        "hierarchy_level": 3,
        "topic": "settlement",
        "url": "https://www.gov.uk/guidance/immigration-rules/immigration-rules-appendix-t2-minister-of-religion",
        "scraped_at": "2025-12-06T17:29:07.140987"
      },
      "text": "### Settlement as a partner or child of a T2 Minister of Religion",
      "summary": "This provision applies to partners or children of T2 Ministers of Religion seeking settlement. They must meet specific residence and relationship requirements, with eligibility contingent on maintained eligibility as dependents during their stay. Critical conditions include ensuring continuous residence and dependency status.",
      "augmented_text": "Document: Immigration Rules Appendix T2 Minister of Religion\nPart: Immigration Rules Appendix T2 Minister of Religion\nSection ID: Settlement as a partner or child of a T2 Minister of Religion\nSection: Settlement as a partner or child of a T2 Minister of Religion\nTopic: settlement\n\nSummary: This provision applies to partners or children of T2 Ministers of Religion seeking settlement. They must meet specific residence and relationship requirements, with eligibility contingent on maintained eligibility as dependents during their stay. Critical conditions include ensuring continuous residence and dependency status.\n\n### Settlement as a partner or child of a T2 Minister of Religion",
      "needs_review": false
    },
    {
      "metadata": {
        "source": "Immigration Rules Appendix T2 Minister of Religion",
        "part": "Immigration Rules Appendix T2 Minister of Religion",
        "section_id": "MOR 28.1",
        "section_title": "Validity requirements for settlement as a partner or child of a T2 Minister of Religion",
        "parent_section": "MOR 28",
        "hierarchy_level": 2,
        "topic": "settlement",
        "url": "https://www.gov.uk/guidance/immigration-rules/immigration-rules-appendix-t2-minister-of-religion",
        "scraped_at": "2025-12-06T17:29:07.141028"
      },
      "text": "### Validity requirements for settlement as a partner or child of a T2 Minister of Religion\n\nMOR 28.1. person applying for settlement as a partner or child of a T2 Minister of Religion must apply online on the gov.uk website on the specified form “Settle in the UK in various immigration categories: form SET(O)”.\n\n1.   MOR 28.2. An application for settlement as a partner or child of a T2 Minister of Religion must meet all the following requirements: \n    1.   (a) any fee must have been paid; and\n    2.   (b) the applicant must have provided biometrics when required; and\n    3.   (c) the applicant must have provided a passport or other travel document which satisfactorily establishes their identity and nationality; and\n    4.   (d) the applicant must be in the UK on the date of application; and\n    5.   (e) the applicant must be applying as a partner or child of a person (P) who: \n        1.   (i) has made a valid application for settlement in the UK on the T2 Minister of Religion route and that application has not been decided; or\n        2.   (ii) is settled or has become a British citizen, provided that P had permission on the T2 Minister of Religion route when they settled and the applicant either had permission as their partner or child at that time, or the applicant is applying as a child of P and the applicant was born in the UK before P settled.\n\nMOR 28.3. An application which does not meet all the validity requirements for settlement as a partner or child of a T2 Minister of Religion may be rejected as invalid and not considered.",
      "summary": "Applicants who seek settlement as a partner or child of a T2 Minister of Religion must apply online using form SET(O), pay fees, provide biometrics and travel documents, and be in the UK at the time. They must also have a qualifying relationship to a person who has a valid unsettled or settled T2 Minister of Religion application or British citizenship, with specific conditions for children born in the UK.",
      "augmented_text": "Document: Immigration Rules Appendix T2 Minister of Religion\nPart: Immigration Rules Appendix T2 Minister of Religion\nSection ID: MOR 28.1\nSection: Validity requirements for settlement as a partner or child of a T2 Minister of Religion\nTopic: settlement\n\nSummary: Applicants who seek settlement as a partner or child of a T2 Minister of Religion must apply online using form SET(O), pay fees, provide biometrics and travel documents, and be in the UK at the time. They must also have a qualifying relationship to a person who has a valid unsettled or settled T2 Minister of Religion application or British citizenship, with specific conditions for children born in the UK.\n\n### Validity requirements for settlement as a partner or child of a T2 Minister of Religion\n\nMOR 28.1. person applying for settlement as a partner or child of a T2 Minister of Religion must apply online on the gov.uk website on the specified form “Settle in the UK in various immigration categories: form SET(O)”.\n\n1.   MOR 28.2. An application for settlement as a partner or child of a T2 Minister of Religion must meet all the following requirements: \n    1.   (a) any fee must have been paid; and\n    2.   (b) the applicant must have provided biometrics when required; and\n    3.   (c) the applicant must have provided a passport or other travel document which satisfactorily establishes their identity and nationality; and\n    4.   (d) the applicant must be in the UK on the date of application; and\n    5.   (e) the applicant must be applying as a partner or child of a person (P) who: \n        1.   (i) has made a valid application for settlement in the UK on the T2 Minister of Religion route and that application has not been decided; or\n        2.   (ii) is settled or has become a British citizen, provided that P had permission on the T2 Minister of Religion route when they settled and the applicant either had permission as their partner or child at that time, or the applicant is applying as a child of P and the applicant was born in the UK before P settled.\n\nMOR 28.3. An application which does not meet all the validity requirements for settlement as a partner or child of a T2 Minister of Religion may be rejected as invalid and not considered.",
      "needs_review": false
    },
    {
      "metadata": {
        "source": "Immigration Rules Appendix T2 Minister of Religion",
        "part": "Immigration Rules Appendix T2 Minister of Religion",
        "section_id": "MOR 29.1",
        "section_title": "Suitability requirements for settlement as a partner or child of a T2 Minister of Religion",
        "parent_section": "MOR 29",
        "hierarchy_level": 2,
        "topic": "suitability",
        "url": "https://www.gov.uk/guidance/immigration-rules/immigration-rules-appendix-t2-minister-of-religion",
        "scraped_at": "2025-12-06T17:29:07.141050"
      },
      "text": "### Suitability requirements for settlement as a partner or child of a T2 Minister of Religion\n\nMOR 29.1. The applicant must not fall for refusal under Part Suitability.\n\n1.   MOR 29.2. The applicant must not be: \n    1.   (a) in breach of immigration laws, except that where the Exceptions for overstayers section of Part Suitability applies, that period of overstaying will be disregarded; or\n    2.   (b) on immigration bail.",
      "summary": "Applicants seeking settlement as a partner or child of a T2 Minister of Religion must meet suitability requirements, including having no immigration law breaches (excluding certain overstays) and not being on immigration bail.",
      "augmented_text": "Document: Immigration Rules Appendix T2 Minister of Religion\nPart: Immigration Rules Appendix T2 Minister of Religion\nSection ID: MOR 29.1\nSection: Suitability requirements for settlement as a partner or child of a T2 Minister of Religion\nTopic: suitability\n\nSummary: Applicants seeking settlement as a partner or child of a T2 Minister of Religion must meet suitability requirements, including having no immigration law breaches (excluding certain overstays) and not being on immigration bail.\n\n### Suitability requirements for settlement as a partner or child of a T2 Minister of Religion\n\nMOR 29.1. The applicant must not fall for refusal under Part Suitability.\n\n1.   MOR 29.2. The applicant must not be: \n    1.   (a) in breach of immigration laws, except that where the Exceptions for overstayers section of Part Suitability applies, that period of overstaying will be disregarded; or\n    2.   (b) on immigration bail.",
      "needs_review": false
    },
    {
      "metadata": {
        "source": "Immigration Rules Appendix T2 Minister of Religion",
        "part": "Immigration Rules Appendix T2 Minister of Religion",
        "section_id": "Eligibility requirements for settlement as a partner or child of a T2 Minister of Religion",
        "section_title": "Eligibility requirements for settlement as a partner or child of a T2 Minister of Religion",
        "parent_section": null,
        "hierarchy_level": 3,
        "topic": "eligibility",
        "url": "https://www.gov.uk/guidance/immigration-rules/immigration-rules-appendix-t2-minister-of-religion",
        "scraped_at": "2025-12-06T17:29:07.141059"
      },
      "text": "### Eligibility requirements for settlement as a partner or child of a T2 Minister of Religion",
      "summary": "This provision applies to partners and children of T2 Ministers of Religion seeking settlement. They must meet relevant relationship and residency requirements, with specific conditions ensuring eligibility, such as proof of relationship and lawful residence, excluding certain inadmissibilities.",
      "augmented_text": "Document: Immigration Rules Appendix T2 Minister of Religion\nPart: Immigration Rules Appendix T2 Minister of Religion\nSection ID: Eligibility requirements for settlement as a partner or child of a T2 Minister of Religion\nSection: Eligibility requirements for settlement as a partner or child of a T2 Minister of Religion\nTopic: eligibility\n\nSummary: This provision applies to partners and children of T2 Ministers of Religion seeking settlement. They must meet relevant relationship and residency requirements, with specific conditions ensuring eligibility, such as proof of relationship and lawful residence, excluding certain inadmissibilities.\n\n### Eligibility requirements for settlement as a partner or child of a T2 Minister of Religion",
      "needs_review": false
    },
    {
      "metadata": {
        "source": "Immigration Rules Appendix T2 Minister of Religion",
        "part": "Immigration Rules Appendix T2 Minister of Religion",
        "section_id": "1",
        "section_title": "Relationship requirement for settlement as a partner or child of a T2 Minister of Religion",
        "parent_section": null,
        "hierarchy_level": 1,
        "topic": "settlement",
        "url": "https://www.gov.uk/guidance/immigration-rules/immigration-rules-appendix-t2-minister-of-religion",
        "scraped_at": "2025-12-06T17:29:07.141093"
      },
      "text": "### Relationship requirement for settlement as a partner or child of a T2 Minister of Religion\n\n1.   MOR 30.1. The applicant must be the partner or child of a person (P) where one of the following applies: \n    1.   (a) P is, at the same time, being granted settlement as a T2 Minister of Religion; or\n    2.   (b) P is settled or has become a British citizen, providing P had permission as a T2 Minister of Religion when they settled and the applicant either: \n        1.   (i) had permission as P’s partner or child at that time; or\n        2.   (ii) is applying as a child of P and was born in the UK before P settled.\n\nMOR 30.2. If applying as a partner, the requirements of Appendix Relationship with Partner must be met.\n\nMOR 30.3. If applying as a child, the applicant must meet the relationship requirement for settlement in Appendix Children.",
      "summary": "Applicants seeking settlement as a partner or child of a T2 Minister of Religion must be related to a person granted or settled as a T2 Minister, with specific conditions if the sponsor is settled or British citizen. Partners must meet the relationship criteria in the specific Appendix; children must satisfy the child settlement requirements. The applicant’s relationship must align with the described circumstances at the time of the sponsor's settlement.",
      "augmented_text": "Document: Immigration Rules Appendix T2 Minister of Religion\nPart: Immigration Rules Appendix T2 Minister of Religion\nSection ID: 1\nSection: Relationship requirement for settlement as a partner or child of a T2 Minister of Religion\nTopic: settlement\n\nSummary: Applicants seeking settlement as a partner or child of a T2 Minister of Religion must be related to a person granted or settled as a T2 Minister, with specific conditions if the sponsor is settled or British citizen. Partners must meet the relationship criteria in the specific Appendix; children must satisfy the child settlement requirements. The applicant’s relationship must align with the described circumstances at the time of the sponsor's settlement.\n\n### Relationship requirement for settlement as a partner or child of a T2 Minister of Religion\n\n1.   MOR 30.1. The applicant must be the partner or child of a person (P) where one of the following applies: \n    1.   (a) P is, at the same time, being granted settlement as a T2 Minister of Religion; or\n    2.   (b) P is settled or has become a British citizen, providing P had permission as a T2 Minister of Religion when they settled and the applicant either: \n        1.   (i) had permission as P’s partner or child at that time; or\n        2.   (ii) is applying as a child of P and was born in the UK before P settled.\n\nMOR 30.2. If applying as a partner, the requirements of Appendix Relationship with Partner must be met.\n\nMOR 30.3. If applying as a child, the applicant must meet the relationship requirement for settlement in Appendix Children.",
      "needs_review": false
    },
    {
      "metadata": {
        "source": "Immigration Rules Appendix T2 Minister of Religion",
        "part": "Immigration Rules Appendix T2 Minister of Religion",
        "section_id": "MOR 31.1",
        "section_title": "Age requirement for settlement as a child of a T2 Minister of Religion",
        "parent_section": "MOR 31",
        "hierarchy_level": 2,
        "topic": "settlement",
        "url": "https://www.gov.uk/guidance/immigration-rules/immigration-rules-appendix-t2-minister-of-religion",
        "scraped_at": "2025-12-06T17:29:07.141118"
      },
      "text": "### Age requirement for settlement as a child of a T2 Minister of Religion\n\nMOR 31.1. DELETED.\n\nMOR 31.2. DELETED.",
      "summary": "This provision applies to children of T2 Ministers of Religion seeking settlement. It requires children to meet an age threshold to qualify for settlement as a child of a T2 Minister of Religion, with specific conditions or exceptions likely outlined elsewhere.",
      "augmented_text": "Document: Immigration Rules Appendix T2 Minister of Religion\nPart: Immigration Rules Appendix T2 Minister of Religion\nSection ID: MOR 31.1\nSection: Age requirement for settlement as a child of a T2 Minister of Religion\nTopic: settlement\n\nSummary: This provision applies to children of T2 Ministers of Religion seeking settlement. It requires children to meet an age threshold to qualify for settlement as a child of a T2 Minister of Religion, with specific conditions or exceptions likely outlined elsewhere.\n\n### Age requirement for settlement as a child of a T2 Minister of Religion\n\nMOR 31.1. DELETED.\n\nMOR 31.2. DELETED.",
      "needs_review": false
    },
    {
      "metadata": {
        "source": "Immigration Rules Appendix T2 Minister of Religion",
        "part": "Immigration Rules Appendix T2 Minister of Religion",
        "section_id": "MOR 32.1",
        "section_title": "Care requirement for settlement as a child of a T2 Minister of Religion",
        "parent_section": "MOR 32",
        "hierarchy_level": 2,
        "topic": "settlement",
        "url": "https://www.gov.uk/guidance/immigration-rules/immigration-rules-appendix-t2-minister-of-religion",
        "scraped_at": "2025-12-06T17:29:07.141140"
      },
      "text": "### Care requirement for settlement as a child of a T2 Minister of Religion\n\nMOR 32.1. DELETED.",
      "summary": "This provision applies to children seeking settlement as dependents of a T2 Minister of Religion. It requires demonstrating adequate care arrangements for the child's well-being, with specific conditions or exceptions not detailed here.",
      "augmented_text": "Document: Immigration Rules Appendix T2 Minister of Religion\nPart: Immigration Rules Appendix T2 Minister of Religion\nSection ID: MOR 32.1\nSection: Care requirement for settlement as a child of a T2 Minister of Religion\nTopic: settlement\n\nSummary: This provision applies to children seeking settlement as dependents of a T2 Minister of Religion. It requires demonstrating adequate care arrangements for the child's well-being, with specific conditions or exceptions not detailed here.\n\n### Care requirement for settlement as a child of a T2 Minister of Religion\n\nMOR 32.1. DELETED.",
      "needs_review": false
    },
    {
      "metadata": {
        "source": "Immigration Rules Appendix T2 Minister of Religion",
        "part": "Immigration Rules Appendix T2 Minister of Religion",
        "section_id": "1",
        "section_title": "Requirements for settlement as a dependent child of a T2 Minister of Religion",
        "parent_section": null,
        "hierarchy_level": 1,
        "topic": "settlement",
        "url": "https://www.gov.uk/guidance/immigration-rules/immigration-rules-appendix-t2-minister-of-religion",
        "scraped_at": "2025-12-06T17:29:07.141167"
      },
      "text": "### Requirements for settlement as a dependent child of a T2 Minister of Religion\n\n1.   MOR 32A.1. The applicant must meet the following requirements for a dependent child in Appendix Children: \n    1.   (a) care requirement; and\n    2.   (b) age and independent life requirement.",
      "summary": "This provision applies to dependent children of T2 Ministers of Religion seeking settlement. They must meet care and age/independent life requirements as specified in Appendix Children. Critical conditions include satisfying these criteria to qualify for settlement.",
      "augmented_text": "Document: Immigration Rules Appendix T2 Minister of Religion\nPart: Immigration Rules Appendix T2 Minister of Religion\nSection ID: 1\nSection: Requirements for settlement as a dependent child of a T2 Minister of Religion\nTopic: settlement\n\nSummary: This provision applies to dependent children of T2 Ministers of Religion seeking settlement. They must meet care and age/independent life requirements as specified in Appendix Children. Critical conditions include satisfying these criteria to qualify for settlement.\n\n### Requirements for settlement as a dependent child of a T2 Minister of Religion\n\n1.   MOR 32A.1. The applicant must meet the following requirements for a dependent child in Appendix Children: \n    1.   (a) care requirement; and\n    2.   (b) age and independent life requirement.",
      "needs_review": false
    },
    {
      "metadata": {
        "source": "Immigration Rules Appendix T2 Minister of Religion",
        "part": "Immigration Rules Appendix T2 Minister of Religion",
        "section_id": "MOR 33.1",
        "section_title": "Qualifying period requirement for settlement by a partner of a T2 Minister of Religion",
        "parent_section": "MOR 33",
        "hierarchy_level": 2,
        "topic": "settlement",
        "url": "https://www.gov.uk/guidance/immigration-rules/immigration-rules-appendix-t2-minister-of-religion",
        "scraped_at": "2025-12-06T17:29:07.141196"
      },
      "text": "### Qualifying period requirement for settlement by a partner of a T2 Minister of Religion\n\nMOR 33.1. The applicant must have spent a continuous period of 5 years in the UK with permission as a dependent partner of the person (P) in MOR 30.1.",
      "summary": "This provision applies to partners of T2 Ministers of Religion seeking settlement. The applicant must have uninterruptedly resided in the UK for 5 years as a dependent partner, with the permission specified in MOR 30.1. No exceptions or alternative periods are noted.",
      "augmented_text": "Document: Immigration Rules Appendix T2 Minister of Religion\nPart: Immigration Rules Appendix T2 Minister of Religion\nSection ID: MOR 33.1\nSection: Qualifying period requirement for settlement by a partner of a T2 Minister of Religion\nTopic: settlement\n\nSummary: This provision applies to partners of T2 Ministers of Religion seeking settlement. The applicant must have uninterruptedly resided in the UK for 5 years as a dependent partner, with the permission specified in MOR 30.1. No exceptions or alternative periods are noted.\n\n### Qualifying period requirement for settlement by a partner of a T2 Minister of Religion\n\nMOR 33.1. The applicant must have spent a continuous period of 5 years in the UK with permission as a dependent partner of the person (P) in MOR 30.1.",
      "needs_review": false
    },
    {
      "metadata": {
        "source": "Immigration Rules Appendix T2 Minister of Religion",
        "part": "Immigration Rules Appendix T2 Minister of Religion",
        "section_id": "MOR 34.1",
        "section_title": "Continuous residence requirement for settlement as a partner of a T2 Minister of Religion",
        "parent_section": "MOR 34",
        "hierarchy_level": 2,
        "topic": "settlement",
        "url": "https://www.gov.uk/guidance/immigration-rules/immigration-rules-appendix-t2-minister-of-religion",
        "scraped_at": "2025-12-06T17:29:07.141225"
      },
      "text": "### Continuous residence requirement for settlement as a partner of a T2 Minister of Religion\n\nMOR 34.1. The applicant must meet the continuous resident requirement as set out in Appendix Continuous residence during the period in MOR 33.1.",
      "summary": "Applicants applying for settlement as a partner of a T2 Minister of Religion must satisfy the continuous residence requirement outlined in Appendix Continuous Residence, applicable during the period specified in MOR 33.1. They must maintain uninterrupted residence throughout this specified period to qualify.",
      "augmented_text": "Document: Immigration Rules Appendix T2 Minister of Religion\nPart: Immigration Rules Appendix T2 Minister of Religion\nSection ID: MOR 34.1\nSection: Continuous residence requirement for settlement as a partner of a T2 Minister of Religion\nTopic: settlement\n\nSummary: Applicants applying for settlement as a partner of a T2 Minister of Religion must satisfy the continuous residence requirement outlined in Appendix Continuous Residence, applicable during the period specified in MOR 33.1. They must maintain uninterrupted residence throughout this specified period to qualify.\n\n### Continuous residence requirement for settlement as a partner of a T2 Minister of Religion\n\nMOR 34.1. The applicant must meet the continuous resident requirement as set out in Appendix Continuous residence during the period in MOR 33.1.",
      "needs_review": false
    },
    {
      "metadata": {
        "source": "Immigration Rules Appendix T2 Minister of Religion",
        "part": "Immigration Rules Appendix T2 Minister of Religion",
        "section_id": "MOR 35.1",
        "section_title": "English language requirement for settlement as a partner or child of a T2 Minister of Religion",
        "parent_section": "MOR 35",
        "hierarchy_level": 2,
        "topic": "english-language",
        "url": "https://www.gov.uk/guidance/immigration-rules/immigration-rules-appendix-t2-minister-of-religion",
        "scraped_at": "2025-12-06T17:29:07.141246"
      },
      "text": "### English language requirement for settlement as a partner or child of a T2 Minister of Religion\n\nMOR 35.1. Unless an exemption applies, the applicant must show English language ability on the Common European Framework of Reference for Languages in speaking and listening to at least level B1.\n\nMOR 35.2. The applicant must show they meet the English language requirement as specified in Appendix English Language.",
      "summary": "Applicants seeking settlement as a partner or child of a T2 Minister of Religion must demonstrate English language proficiency at Level B1 in speaking and listening unless exempted, as per Appendix English Language.",
      "augmented_text": "Document: Immigration Rules Appendix T2 Minister of Religion\nPart: Immigration Rules Appendix T2 Minister of Religion\nSection ID: MOR 35.1\nSection: English language requirement for settlement as a partner or child of a T2 Minister of Religion\nTopic: english-language\n\nSummary: Applicants seeking settlement as a partner or child of a T2 Minister of Religion must demonstrate English language proficiency at Level B1 in speaking and listening unless exempted, as per Appendix English Language.\n\n### English language requirement for settlement as a partner or child of a T2 Minister of Religion\n\nMOR 35.1. Unless an exemption applies, the applicant must show English language ability on the Common European Framework of Reference for Languages in speaking and listening to at least level B1.\n\nMOR 35.2. The applicant must show they meet the English language requirement as specified in Appendix English Language.",
      "needs_review": false
    },
    {
      "metadata": {
        "source": "Immigration Rules Appendix T2 Minister of Religion",
        "part": "Immigration Rules Appendix T2 Minister of Religion",
        "section_id": "MOR 36.1",
        "section_title": "Knowledge of life in the UK requirement for settlement as a partner or child of a T2 Minister of Religion",
        "parent_section": "MOR 36",
        "hierarchy_level": 2,
        "topic": "settlement",
        "url": "https://www.gov.uk/guidance/immigration-rules/immigration-rules-appendix-t2-minister-of-religion",
        "scraped_at": "2025-12-06T17:29:07.141274"
      },
      "text": "### Knowledge of life in the UK requirement for settlement as a partner or child of a T2 Minister of Religion\n\nMOR 36.1. Unless an exemption applies, the applicant must meet the Knowledge of Life in the UK requirement as set out in Appendix KOL UK.",
      "summary": "Applicants seeking settlement as a partner or child of a T2 Minister of Religion must generally meet the Knowledge of Life in the UK requirement, unless exempt. The requirement ensures familiarity with UK values and society, with specific conditions and exemptions outlined in Appendix KOL UK.",
      "augmented_text": "Document: Immigration Rules Appendix T2 Minister of Religion\nPart: Immigration Rules Appendix T2 Minister of Religion\nSection ID: MOR 36.1\nSection: Knowledge of life in the UK requirement for settlement as a partner or child of a T2 Minister of Religion\nTopic: settlement\n\nSummary: Applicants seeking settlement as a partner or child of a T2 Minister of Religion must generally meet the Knowledge of Life in the UK requirement, unless exempt. The requirement ensures familiarity with UK values and society, with specific conditions and exemptions outlined in Appendix KOL UK.\n\n### Knowledge of life in the UK requirement for settlement as a partner or child of a T2 Minister of Religion\n\nMOR 36.1. Unless an exemption applies, the applicant must meet the Knowledge of Life in the UK requirement as set out in Appendix KOL UK.",
      "needs_review": false
    },
    {
      "metadata": {
        "source": "Immigration Rules Appendix T2 Minister of Religion",
        "part": "Immigration Rules Appendix T2 Minister of Religion",
        "section_id": "MOR 37.1",
        "section_title": "Decision on an application for settlement as a partner or child of a T2 Minister of Religion",
        "parent_section": "MOR 37",
        "hierarchy_level": 2,
        "topic": "eligibility",
        "url": "https://www.gov.uk/guidance/immigration-rules/immigration-rules-appendix-t2-minister-of-religion",
        "scraped_at": "2025-12-06T17:29:07.141290"
      },
      "text": "### Decision on an application for settlement as a partner or child of a T2 Minister of Religion\n\nMOR 37.1. If the decision maker is satisfied all the suitability and eligibility requirements are met for settlement as a partner or child of a T2 Minister of Religion, the application will be granted, otherwise the application will be refused.\n\nMOR 37.2. If the application is refused the person can apply for an Administrative Review under Appendix AR: Administrative Review.\n\nPrint this page",
      "summary": "This provision applies to partners or children of T2 Ministers of Religion seeking settlement. The decision depends on meeting all suitability and eligibility requirements; if these are satisfied, settlement is granted, otherwise refused. Applicants can request an Administrative Review if refused.",
      "augmented_text": "Document: Immigration Rules Appendix T2 Minister of Religion\nPart: Immigration Rules Appendix T2 Minister of Religion\nSection ID: MOR 37.1\nSection: Decision on an application for settlement as a partner or child of a T2 Minister of Religion\nTopic: eligibility\n\nSummary: This provision applies to partners or children of T2 Ministers of Religion seeking settlement. The decision depends on meeting all suitability and eligibility requirements; if these are satisfied, settlement is granted, otherwise refused. Applicants can request an Administrative Review if refused.\n\n### Decision on an application for settlement as a partner or child of a T2 Minister of Religion\n\nMOR 37.1. If the decision maker is satisfied all the suitability and eligibility requirements are met for settlement as a partner or child of a T2 Minister of Religion, the application will be granted, otherwise the application will be refused.\n\nMOR 37.2. If the application is refused the person can apply for an Administrative Review under Appendix AR: Administrative Review.\n\nPrint this page",
      "needs_review": false
    }
  ]
}