{
  "url": "https://www.gov.uk/guidance/immigration-rules/immigration-rules-appendix-hong-kong-british-national-overseas",
  "part_name": "Immigration Rules Appendix Hong Kong British National (Overseas)",
  "scraped_at": "2025-12-06T17:27:49.818618",
  "chunk_count": 82,
  "chunks": [
    {
      "metadata": {
        "source": "Immigration Rules Appendix Hong Kong British National (Overseas)",
        "part": "Immigration Rules Appendix Hong Kong British National (Overseas)",
        "section_id": "BN(O) Status Holder route",
        "section_title": "BN(O) Status Holder route",
        "parent_section": null,
        "hierarchy_level": 2,
        "topic": "eligibility",
        "url": "https://www.gov.uk/guidance/immigration-rules/immigration-rules-appendix-hong-kong-british-national-overseas",
        "scraped_at": "2025-12-06T17:27:49.814762"
      },
      "text": "### BN(O) Status Holder route",
      "summary": "The BN(O) Status Holder route applies to BN(O) visa holders seeking immigration to the UK. It requires holders to meet specific eligibility criteria and follow designated application processes. Critical conditions include maintaining valid BN(O) status and fulfilling any specified health or character requirements.",
      "augmented_text": "Document: Immigration Rules Appendix Hong Kong British National (Overseas)\nPart: Immigration Rules Appendix Hong Kong British National (Overseas)\nSection ID: BN(O) Status Holder route\nSection: BN(O) Status Holder route\nTopic: eligibility\n\nSummary: The BN(O) Status Holder route applies to BN(O) visa holders seeking immigration to the UK. It requires holders to meet specific eligibility criteria and follow designated application processes. Critical conditions include maintaining valid BN(O) status and fulfilling any specified health or character requirements.\n\n### BN(O) Status Holder route",
      "needs_review": false
    },
    {
      "metadata": {
        "source": "Immigration Rules Appendix Hong Kong British National (Overseas)",
        "part": "Immigration Rules Appendix Hong Kong British National (Overseas)",
        "section_id": "HK 1.1",
        "section_title": "Validity requirements for Status Holder route",
        "parent_section": "HK 1",
        "hierarchy_level": 2,
        "topic": "leave-to-enter",
        "url": "https://www.gov.uk/guidance/immigration-rules/immigration-rules-appendix-hong-kong-british-national-overseas",
        "scraped_at": "2025-12-06T17:27:49.814822"
      },
      "text": "### Validity requirements for Status Holder route\n\nHK 1.1. A person applying for entry clearance or permission to stay as a BN(O) Status Holder must apply online on the gov.uk website on the specified form as follows:\n\n| Applicant | Specified form |\n| --- | --- |\n| Applicants with a chipped passport who: • hold a passport which shows they are registered as a British National (Overseas); or • hold a passport issued by the Hong Kong Special Administrative Region. | Either: • Hong Kong British National (Overseas) Visa using the UK Immigration: ID Check app (when available); or • Hong Kong British National (Overseas) Visa |\n| Other applicants | Hong Kong British National (Overseas) Visa |\n\n1.   HK 1.2. An application for entry clearance or permission to stay as a BN(O) Status Holder must meet all the following requirements: \n    1.   (a) any fee and Immigration Health Charge must have been paid, unless the applicant has been granted a fee waiver; and\n    2.   (b) the applicant must have provided biometrics when required; and\n    3.   (c) the applicant must have provided a passport or other travel document which satisfactorily established their identity and nationality.\n\nHK 1.3. The applicant must be aged 18 years or over on the date of application.\n\nHK 1.4. An application which does not meet all the validity requirements for a BN(O) Status Holder may be rejected as invalid and not considered.",
      "summary": "Applicants seeking entry clearance or permission to stay as a BN(O) Status Holder must apply online using the specified form, meet fee and biometrics requirements, and provide valid travel documentation. Applicants must be at least 18 years old, and applications failing to meet these criteria will be rejected.",
      "augmented_text": "Document: Immigration Rules Appendix Hong Kong British National (Overseas)\nPart: Immigration Rules Appendix Hong Kong British National (Overseas)\nSection ID: HK 1.1\nSection: Validity requirements for Status Holder route\nTopic: leave-to-enter\n\nSummary: Applicants seeking entry clearance or permission to stay as a BN(O) Status Holder must apply online using the specified form, meet fee and biometrics requirements, and provide valid travel documentation. Applicants must be at least 18 years old, and applications failing to meet these criteria will be rejected.\n\n### Validity requirements for Status Holder route\n\nHK 1.1. A person applying for entry clearance or permission to stay as a BN(O) Status Holder must apply online on the gov.uk website on the specified form as follows:\n\n| Applicant | Specified form |\n| --- | --- |\n| Applicants with a chipped passport who: • hold a passport which shows they are registered as a British National (Overseas); or • hold a passport issued by the Hong Kong Special Administrative Region. | Either: • Hong Kong British National (Overseas) Visa using the UK Immigration: ID Check app (when available); or • Hong Kong British National (Overseas) Visa |\n| Other applicants | Hong Kong British National (Overseas) Visa |\n\n1.   HK 1.2. An application for entry clearance or permission to stay as a BN(O) Status Holder must meet all the following requirements: \n    1.   (a) any fee and Immigration Health Charge must have been paid, unless the applicant has been granted a fee waiver; and\n    2.   (b) the applicant must have provided biometrics when required; and\n    3.   (c) the applicant must have provided a passport or other travel document which satisfactorily established their identity and nationality.\n\nHK 1.3. The applicant must be aged 18 years or over on the date of application.\n\nHK 1.4. An application which does not meet all the validity requirements for a BN(O) Status Holder may be rejected as invalid and not considered.",
      "needs_review": false
    },
    {
      "metadata": {
        "source": "Immigration Rules Appendix Hong Kong British National (Overseas)",
        "part": "Immigration Rules Appendix Hong Kong British National (Overseas)",
        "section_id": "HK 2.1",
        "section_title": "Suitability requirements for BN(O) Status Holder",
        "parent_section": "HK 2",
        "hierarchy_level": 2,
        "topic": "suitability",
        "url": "https://www.gov.uk/guidance/immigration-rules/immigration-rules-appendix-hong-kong-british-national-overseas",
        "scraped_at": "2025-12-06T17:27:49.814850"
      },
      "text": "### Suitability requirements for BN(O) Status Holder\n\nHK 2.1. The applicant must not fall for refusal under Part Suitability.\n\n1.   HK 2.2. If applying for permission to stay the applicant must not be: \n    1.   (a) in breach of immigration laws, except that where the Exceptions for overstayers section of Part Suitability applies, that period of overstaying will be disregarded; or\n    2.   (b) on immigration bail, except where they have been placed on immigration bail after making an asylum claim in the UK.",
      "summary": "This provision applies to BN(O) Status Holders applying for permission to stay. They must not breach immigration laws or be on immigration bail, with certain overstaying exceptions. Compliance with suitability requirements is essential for approval.",
      "augmented_text": "Document: Immigration Rules Appendix Hong Kong British National (Overseas)\nPart: Immigration Rules Appendix Hong Kong British National (Overseas)\nSection ID: HK 2.1\nSection: Suitability requirements for BN(O) Status Holder\nTopic: suitability\n\nSummary: This provision applies to BN(O) Status Holders applying for permission to stay. They must not breach immigration laws or be on immigration bail, with certain overstaying exceptions. Compliance with suitability requirements is essential for approval.\n\n### Suitability requirements for BN(O) Status Holder\n\nHK 2.1. The applicant must not fall for refusal under Part Suitability.\n\n1.   HK 2.2. If applying for permission to stay the applicant must not be: \n    1.   (a) in breach of immigration laws, except that where the Exceptions for overstayers section of Part Suitability applies, that period of overstaying will be disregarded; or\n    2.   (b) on immigration bail, except where they have been placed on immigration bail after making an asylum claim in the UK.",
      "needs_review": false
    },
    {
      "metadata": {
        "source": "Immigration Rules Appendix Hong Kong British National (Overseas)",
        "part": "Immigration Rules Appendix Hong Kong British National (Overseas)",
        "section_id": "Eligibility requirements BN(O) Status Holder",
        "section_title": "Eligibility requirements BN(O) Status Holder",
        "parent_section": null,
        "hierarchy_level": 2,
        "topic": "eligibility",
        "url": "https://www.gov.uk/guidance/immigration-rules/immigration-rules-appendix-hong-kong-british-national-overseas",
        "scraped_at": "2025-12-06T17:27:49.814862"
      },
      "text": "### Eligibility requirements BN(O) Status Holder",
      "summary": "This provision applies to BN(O) Status Holders seeking immigration benefits. It requires they meet specified eligibility criteria, including past residence and conduct standards; exceptions may exist based on criminal record or certain breaches.",
      "augmented_text": "Document: Immigration Rules Appendix Hong Kong British National (Overseas)\nPart: Immigration Rules Appendix Hong Kong British National (Overseas)\nSection ID: Eligibility requirements BN(O) Status Holder\nSection: Eligibility requirements BN(O) Status Holder\nTopic: eligibility\n\nSummary: This provision applies to BN(O) Status Holders seeking immigration benefits. It requires they meet specified eligibility criteria, including past residence and conduct standards; exceptions may exist based on criminal record or certain breaches.\n\n### Eligibility requirements BN(O) Status Holder",
      "needs_review": false
    },
    {
      "metadata": {
        "source": "Immigration Rules Appendix Hong Kong British National (Overseas)",
        "part": "Immigration Rules Appendix Hong Kong British National (Overseas)",
        "section_id": "HK 3.1",
        "section_title": "Entry requirements for BN(O) Status Holder",
        "parent_section": "HK 3",
        "hierarchy_level": 2,
        "topic": "leave-to-enter",
        "url": "https://www.gov.uk/guidance/immigration-rules/immigration-rules-appendix-hong-kong-british-national-overseas",
        "scraped_at": "2025-12-06T17:27:49.814889"
      },
      "text": "### Entry requirements for BN(O) Status Holder\n\nHK 3.1. A person seeking to come to the UK as a BN(O) Status Holder must apply for and obtain entry clearance as a BN(O) Status Holder before they arrive in the UK.\n\nHK 3.2. A person applying for entry clearance as a BN(O) Status Holder must, if Appendix Tuberculosis applies, provide a valid medical certificate confirming that they have undergone screening for active pulmonary tuberculosis and that this tuberculosis is not present in them.",
      "summary": "BN(O) Status Holders applying to enter the UK must secure entry clearance beforehand; if relevant, they must also provide a TB screening certificate confirming they do not have active pulmonary tuberculosis.",
      "augmented_text": "Document: Immigration Rules Appendix Hong Kong British National (Overseas)\nPart: Immigration Rules Appendix Hong Kong British National (Overseas)\nSection ID: HK 3.1\nSection: Entry requirements for BN(O) Status Holder\nTopic: leave-to-enter\n\nSummary: BN(O) Status Holders applying to enter the UK must secure entry clearance beforehand; if relevant, they must also provide a TB screening certificate confirming they do not have active pulmonary tuberculosis.\n\n### Entry requirements for BN(O) Status Holder\n\nHK 3.1. A person seeking to come to the UK as a BN(O) Status Holder must apply for and obtain entry clearance as a BN(O) Status Holder before they arrive in the UK.\n\nHK 3.2. A person applying for entry clearance as a BN(O) Status Holder must, if Appendix Tuberculosis applies, provide a valid medical certificate confirming that they have undergone screening for active pulmonary tuberculosis and that this tuberculosis is not present in them.",
      "needs_review": false
    },
    {
      "metadata": {
        "source": "Immigration Rules Appendix Hong Kong British National (Overseas)",
        "part": "Immigration Rules Appendix Hong Kong British National (Overseas)",
        "section_id": "HK 4.1",
        "section_title": "BN(O) Status holder requirement",
        "parent_section": "HK 4",
        "hierarchy_level": 2,
        "topic": "eligibility",
        "url": "https://www.gov.uk/guidance/immigration-rules/immigration-rules-appendix-hong-kong-british-national-overseas",
        "scraped_at": "2025-12-06T17:27:49.814919"
      },
      "text": "### BN(O) Status holder requirement\n\nHK 4.1. The applicant must be a British National (Overseas) under the Hong Kong (British Nationality) Order 1986.",
      "summary": "This provision applies to BN(O) status holders applying for immigration under HK 4.1. They must hold BN(O) nationality as defined by the Hong Kong (British Nationality) Order 1986. No additional conditions or exceptions are specified in this section.",
      "augmented_text": "Document: Immigration Rules Appendix Hong Kong British National (Overseas)\nPart: Immigration Rules Appendix Hong Kong British National (Overseas)\nSection ID: HK 4.1\nSection: BN(O) Status holder requirement\nTopic: eligibility\n\nSummary: This provision applies to BN(O) status holders applying for immigration under HK 4.1. They must hold BN(O) nationality as defined by the Hong Kong (British Nationality) Order 1986. No additional conditions or exceptions are specified in this section.\n\n### BN(O) Status holder requirement\n\nHK 4.1. The applicant must be a British National (Overseas) under the Hong Kong (British Nationality) Order 1986.",
      "needs_review": false
    },
    {
      "metadata": {
        "source": "Immigration Rules Appendix Hong Kong British National (Overseas)",
        "part": "Immigration Rules Appendix Hong Kong British National (Overseas)",
        "section_id": "HK 5.1",
        "section_title": "Ordinary residence in Hong Kong requirement for BN(O) Status Holder",
        "parent_section": "HK 5",
        "hierarchy_level": 2,
        "topic": "leave-to-enter",
        "url": "https://www.gov.uk/guidance/immigration-rules/immigration-rules-appendix-hong-kong-british-national-overseas",
        "scraped_at": "2025-12-06T17:27:49.814946"
      },
      "text": "### Ordinary residence in Hong Kong requirement for BN(O) Status Holder\n\nHK 5.1. An applicant applying for entry clearance must be ordinarily resident in Hong Kong at the date of application.\n\nHK 5.2. An applicant applying for permission to stay must be in the UK, and must be ordinarily resident in the UK, the Bailiwick of Guernsey, Bailiwick of Jersey, the Isle of Man or Hong Kong on the date of application.",
      "summary": "This provision applies to BN(O) Status Holders seeking entry clearance or permission to stay. Applicants must be ordinarily resident in Hong Kong (for entry clearance) or in the UK, Bailiwick of Guernsey, Jersey, Isle of Man, or Hong Kong (for permission to stay) at the date of application. No exceptions are specified.",
      "augmented_text": "Document: Immigration Rules Appendix Hong Kong British National (Overseas)\nPart: Immigration Rules Appendix Hong Kong British National (Overseas)\nSection ID: HK 5.1\nSection: Ordinary residence in Hong Kong requirement for BN(O) Status Holder\nTopic: leave-to-enter\n\nSummary: This provision applies to BN(O) Status Holders seeking entry clearance or permission to stay. Applicants must be ordinarily resident in Hong Kong (for entry clearance) or in the UK, Bailiwick of Guernsey, Jersey, Isle of Man, or Hong Kong (for permission to stay) at the date of application. No exceptions are specified.\n\n### Ordinary residence in Hong Kong requirement for BN(O) Status Holder\n\nHK 5.1. An applicant applying for entry clearance must be ordinarily resident in Hong Kong at the date of application.\n\nHK 5.2. An applicant applying for permission to stay must be in the UK, and must be ordinarily resident in the UK, the Bailiwick of Guernsey, Bailiwick of Jersey, the Isle of Man or Hong Kong on the date of application.",
      "needs_review": false
    },
    {
      "metadata": {
        "source": "Immigration Rules Appendix Hong Kong British National (Overseas)",
        "part": "Immigration Rules Appendix Hong Kong British National (Overseas)",
        "section_id": "HK 6.1",
        "section_title": "Financial requirement for BN(O) Status Holder",
        "parent_section": "HK 6",
        "hierarchy_level": 2,
        "topic": "financial",
        "url": "https://www.gov.uk/guidance/immigration-rules/immigration-rules-appendix-hong-kong-british-national-overseas",
        "scraped_at": "2025-12-06T17:27:49.814967"
      },
      "text": "### Financial requirement for BN(O) Status Holder\n\nHK 6.1. If the applicant is applying for permission to stay and has been living in the UK for 12 months or more on the date of application, they will meet the financial requirement unless the applicant’s previous grant of permission was for 12 months Leave Outside the Rules following an unsuccessful application for the Hong Kong British National (Overseas) route.\n\nHK 6.2. If the applicant is applying for entry clearance, or is applying for permission to stay and has been in the UK for less than 12 months on the date of application, or where the applicant’s previous grant of permission was for 12 months Leave Outside the Rules following an unsuccessful application for the Hong Kong British National (Overseas) route, the decision maker must be satisfied that the applicant can adequately maintain and accommodate themselves without recourse to public funds for at least 6 months.\n\n1.   HK 6.3. For the purposes of HK 6.2. accommodation will not be regarded as adequate if: \n    1.   (a) it is, or will be, overcrowded; or\n    2.   (b) it contravenes public health regulations.\n\nHK 6.4. The applicant may rely on credible promises of future third party support.\n\nHK 6.5. Funds must be shown as specified in Appendix Finance.",
      "summary": "The provision applies to BN(O) Status Holders applying for permission to stay or entry clearance. It requires evidence of financial ability to support and house oneself without recourse to public funds for at least 6 months, with conditions based on duration of UK residence and previous grants; accommodation must be adequate, and third-party support may be relied upon.",
      "augmented_text": "Document: Immigration Rules Appendix Hong Kong British National (Overseas)\nPart: Immigration Rules Appendix Hong Kong British National (Overseas)\nSection ID: HK 6.1\nSection: Financial requirement for BN(O) Status Holder\nTopic: financial\n\nSummary: The provision applies to BN(O) Status Holders applying for permission to stay or entry clearance. It requires evidence of financial ability to support and house oneself without recourse to public funds for at least 6 months, with conditions based on duration of UK residence and previous grants; accommodation must be adequate, and third-party support may be relied upon.\n\n### Financial requirement for BN(O) Status Holder\n\nHK 6.1. If the applicant is applying for permission to stay and has been living in the UK for 12 months or more on the date of application, they will meet the financial requirement unless the applicant’s previous grant of permission was for 12 months Leave Outside the Rules following an unsuccessful application for the Hong Kong British National (Overseas) route.\n\nHK 6.2. If the applicant is applying for entry clearance, or is applying for permission to stay and has been in the UK for less than 12 months on the date of application, or where the applicant’s previous grant of permission was for 12 months Leave Outside the Rules following an unsuccessful application for the Hong Kong British National (Overseas) route, the decision maker must be satisfied that the applicant can adequately maintain and accommodate themselves without recourse to public funds for at least 6 months.\n\n1.   HK 6.3. For the purposes of HK 6.2. accommodation will not be regarded as adequate if: \n    1.   (a) it is, or will be, overcrowded; or\n    2.   (b) it contravenes public health regulations.\n\nHK 6.4. The applicant may rely on credible promises of future third party support.\n\nHK 6.5. Funds must be shown as specified in Appendix Finance.",
      "needs_review": false
    },
    {
      "metadata": {
        "source": "Immigration Rules Appendix Hong Kong British National (Overseas)",
        "part": "Immigration Rules Appendix Hong Kong British National (Overseas)",
        "section_id": "HK 7.1",
        "section_title": "In-country tuberculosis certificate requirement for BN(O) Status Holder",
        "parent_section": null,
        "hierarchy_level": 1,
        "topic": "health",
        "url": "https://www.gov.uk/guidance/immigration-rules/immigration-rules-appendix-hong-kong-british-national-overseas",
        "scraped_at": "2025-12-06T17:27:49.815005"
      },
      "text": "### In-country tuberculosis certificate requirement for BN(O) Status Holder\n\n1.   HK 7.1. If the applicant is applying for permission to stay and: \n    1.   (a) their last grant of permission was for 6 months or less; and\n    2.   (b) the applicant was present in a country listed in Appendix Tuberculosis (TB) of these rules for more than six months immediately prior to their last grant of permission,\n\n2.   the applicant must provide a valid medical certificate confirming that they have undergone screening for active pulmonary tuberculosis and that this tuberculosis is not present in them.\n\nHK 7.2. In HK 7.1. a valid medical certificate is a certificate from an approved centre issued within the 6 months immediately before the date of application.\n\nHK 7.3. The in-country tuberculosis requirement is met if the applicant provided a medical certificate described in HK 7.1. as part of a successful application for entry clearance in the 12 months before the date of application.\n\nHK 7.4. The list of approved centres in the UK, updated from time to time, can be found at https://www.gov.uk/government/publications/uk-tuberculosis-test-clinics-for-hong-kong-bno.",
      "summary": "BN(O) Status Holders applying to stay in the UK must provide a recent (within 6 months) medical certificate confirming no active tuberculosis if they previously stayed in a listed country for over six months and their last permission was 6 months or less. This requirement is met if such certification was provided within the past 12 months through an approved health centre.",
      "augmented_text": "Document: Immigration Rules Appendix Hong Kong British National (Overseas)\nPart: Immigration Rules Appendix Hong Kong British National (Overseas)\nSection ID: HK 7.1\nSection: In-country tuberculosis certificate requirement for BN(O) Status Holder\nTopic: health\n\nSummary: BN(O) Status Holders applying to stay in the UK must provide a recent (within 6 months) medical certificate confirming no active tuberculosis if they previously stayed in a listed country for over six months and their last permission was 6 months or less. This requirement is met if such certification was provided within the past 12 months through an approved health centre.\n\n### In-country tuberculosis certificate requirement for BN(O) Status Holder\n\n1.   HK 7.1. If the applicant is applying for permission to stay and: \n    1.   (a) their last grant of permission was for 6 months or less; and\n    2.   (b) the applicant was present in a country listed in Appendix Tuberculosis (TB) of these rules for more than six months immediately prior to their last grant of permission,\n\n2.   the applicant must provide a valid medical certificate confirming that they have undergone screening for active pulmonary tuberculosis and that this tuberculosis is not present in them.\n\nHK 7.2. In HK 7.1. a valid medical certificate is a certificate from an approved centre issued within the 6 months immediately before the date of application.\n\nHK 7.3. The in-country tuberculosis requirement is met if the applicant provided a medical certificate described in HK 7.1. as part of a successful application for entry clearance in the 12 months before the date of application.\n\nHK 7.4. The list of approved centres in the UK, updated from time to time, can be found at https://www.gov.uk/government/publications/uk-tuberculosis-test-clinics-for-hong-kong-bno.",
      "needs_review": false
    },
    {
      "metadata": {
        "source": "Immigration Rules Appendix Hong Kong British National (Overseas)",
        "part": "Immigration Rules Appendix Hong Kong British National (Overseas)",
        "section_id": "HK 8.1",
        "section_title": "Decision on an application as a BN(O) Status Holder",
        "parent_section": "HK 8",
        "hierarchy_level": 2,
        "topic": "eligibility",
        "url": "https://www.gov.uk/guidance/immigration-rules/immigration-rules-appendix-hong-kong-british-national-overseas",
        "scraped_at": "2025-12-06T17:27:49.815019"
      },
      "text": "### Decision on an application as a BN(O) Status Holder\n\nHK 8.1. If the decision-maker is satisfied that all the suitability and eligibility requirements for a BN(O) Status Holder are met, the application will be granted, otherwise the application will be refused.\n\nHK 8.2. If the application is refused the person can apply for an Administrative Review under Appendix AR: Administrative Review.",
      "summary": "This provision applies to BN(O) Status Holder applicants, requiring them to satisfy all suitability and eligibility criteria for approval. If these are met, the application is granted; if not, it is refused, with the option to request an Administrative Review.",
      "augmented_text": "Document: Immigration Rules Appendix Hong Kong British National (Overseas)\nPart: Immigration Rules Appendix Hong Kong British National (Overseas)\nSection ID: HK 8.1\nSection: Decision on an application as a BN(O) Status Holder\nTopic: eligibility\n\nSummary: This provision applies to BN(O) Status Holder applicants, requiring them to satisfy all suitability and eligibility criteria for approval. If these are met, the application is granted; if not, it is refused, with the option to request an Administrative Review.\n\n### Decision on an application as a BN(O) Status Holder\n\nHK 8.1. If the decision-maker is satisfied that all the suitability and eligibility requirements for a BN(O) Status Holder are met, the application will be granted, otherwise the application will be refused.\n\nHK 8.2. If the application is refused the person can apply for an Administrative Review under Appendix AR: Administrative Review.",
      "needs_review": false
    },
    {
      "metadata": {
        "source": "Immigration Rules Appendix Hong Kong British National (Overseas)",
        "part": "Immigration Rules Appendix Hong Kong British National (Overseas)",
        "section_id": "HK 9.1",
        "section_title": "Period of grant for a BN(O) Status Holder",
        "parent_section": null,
        "hierarchy_level": 1,
        "topic": "duration",
        "url": "https://www.gov.uk/guidance/immigration-rules/immigration-rules-appendix-hong-kong-british-national-overseas",
        "scraped_at": "2025-12-06T17:27:49.815051"
      },
      "text": "### Period of grant for a BN(O) Status Holder\n\n1.   HK 9.1. The applicant will be granted permission for either: \n    1.   (a) a period of 5 years, where the applicant has applied for a period of 5 years; or\n    2.   (b) a period of 30 months (plus, where the applicant has extant permission on the Hong Kong BN(O) route, the remaining period of that permission, up to a maximum of 28 days) where the applicant has applied for a period of 30 months.",
      "summary": "BN(O) Status Holders are eligible for a grant of either 5 years or 30 months, depending on their application. The 30-month grant includes any remaining existing permission up to 28 days; no other conditions are specified.",
      "augmented_text": "Document: Immigration Rules Appendix Hong Kong British National (Overseas)\nPart: Immigration Rules Appendix Hong Kong British National (Overseas)\nSection ID: HK 9.1\nSection: Period of grant for a BN(O) Status Holder\nTopic: duration\n\nSummary: BN(O) Status Holders are eligible for a grant of either 5 years or 30 months, depending on their application. The 30-month grant includes any remaining existing permission up to 28 days; no other conditions are specified.\n\n### Period of grant for a BN(O) Status Holder\n\n1.   HK 9.1. The applicant will be granted permission for either: \n    1.   (a) a period of 5 years, where the applicant has applied for a period of 5 years; or\n    2.   (b) a period of 30 months (plus, where the applicant has extant permission on the Hong Kong BN(O) route, the remaining period of that permission, up to a maximum of 28 days) where the applicant has applied for a period of 30 months.",
      "needs_review": false
    },
    {
      "metadata": {
        "source": "Immigration Rules Appendix Hong Kong British National (Overseas)",
        "part": "Immigration Rules Appendix Hong Kong British National (Overseas)",
        "section_id": "1",
        "section_title": "Conditions of grant for a BN(O) Status Holder",
        "parent_section": null,
        "hierarchy_level": 1,
        "topic": "financial",
        "url": "https://www.gov.uk/guidance/immigration-rules/immigration-rules-appendix-hong-kong-british-national-overseas",
        "scraped_at": "2025-12-06T17:27:49.815068"
      },
      "text": "### Conditions of grant for a BN(O) Status Holder\n\n1.   HK 9.2. The permission will be granted subject to the following conditions: \n    1.   (a) no access to public funds; and\n    2.   (b) work (including self-employment and voluntary work) permitted except for employment as a professional sportsperson (including as a sports coach); and\n    3.   (c) study is permitted, subject to the ATAS condition in Appendix ATAS.",
      "summary": "This provision applies to BN(O) Status Holders. They must not access public funds, can work or study (with an ATAS condition for study), but cannot work as professional sportspeople or coaches. These conditions are mandatory for the grant of their permission.",
      "augmented_text": "Document: Immigration Rules Appendix Hong Kong British National (Overseas)\nPart: Immigration Rules Appendix Hong Kong British National (Overseas)\nSection ID: 1\nSection: Conditions of grant for a BN(O) Status Holder\nTopic: financial\n\nSummary: This provision applies to BN(O) Status Holders. They must not access public funds, can work or study (with an ATAS condition for study), but cannot work as professional sportspeople or coaches. These conditions are mandatory for the grant of their permission.\n\n### Conditions of grant for a BN(O) Status Holder\n\n1.   HK 9.2. The permission will be granted subject to the following conditions: \n    1.   (a) no access to public funds; and\n    2.   (b) work (including self-employment and voluntary work) permitted except for employment as a professional sportsperson (including as a sports coach); and\n    3.   (c) study is permitted, subject to the ATAS condition in Appendix ATAS.",
      "needs_review": false
    },
    {
      "metadata": {
        "source": "Immigration Rules Appendix Hong Kong British National (Overseas)",
        "part": "Immigration Rules Appendix Hong Kong British National (Overseas)",
        "section_id": "SW 3.1",
        "section_title": "Dependants on the BN(O) Status Holder route",
        "parent_section": null,
        "hierarchy_level": 2,
        "topic": "eligibility",
        "url": "https://www.gov.uk/guidance/immigration-rules/immigration-rules-appendix-hong-kong-british-national-overseas",
        "scraped_at": "2025-12-06T17:27:49.815088"
      },
      "text": "### Dependants on the BN(O) Status Holder route",
      "summary": "This provision applies to dependants of BN(O) status holders applying under the BN(O) route. Dependants must meet eligibility criteria and provide necessary evidence; exceptions or thresholds are not specified in the excerpt.",
      "augmented_text": "Document: Immigration Rules Appendix Hong Kong British National (Overseas)\nPart: Immigration Rules Appendix Hong Kong British National (Overseas)\nSection ID: SW 3.1\nSection: Dependants on the BN(O) Status Holder route\nTopic: eligibility\n\nSummary: This provision applies to dependants of BN(O) status holders applying under the BN(O) route. Dependants must meet eligibility criteria and provide necessary evidence; exceptions or thresholds are not specified in the excerpt.\n\n### Dependants on the BN(O) Status Holder route",
      "needs_review": false
    },
    {
      "metadata": {
        "source": "Immigration Rules Appendix Hong Kong British National (Overseas)",
        "part": "Immigration Rules Appendix Hong Kong British National (Overseas)",
        "section_id": "HK 10.1",
        "section_title": "Validity requirements for a dependent partner or BN(O) Household Child on the BN(O) Status Holder route",
        "parent_section": "HK 10",
        "hierarchy_level": 2,
        "topic": "leave-to-enter",
        "url": "https://www.gov.uk/guidance/immigration-rules/immigration-rules-appendix-hong-kong-british-national-overseas",
        "scraped_at": "2025-12-06T17:27:49.815131"
      },
      "text": "### Validity requirements for a dependent partner or BN(O) Household Child on the BN(O) Status Holder route\n\nHK 10.1. A person applying for entry clearance or permission to stay as a dependent partner or BN(O) Household Child on the BN(O) Status Holder route must apply online on the gov.uk website on the specified form as follows:\n\n| Applicant | Specified form |\n| --- | --- |\n| Applicants with a chipped passport who: - hold a passport which shows they are registered as a British National (Overseas); or - hold a passport issued by the Hong Kong Special Administrative Region; or - are EEA nationals. | Either: • Hong Kong British National (Overseas) Visa using the UK Immigration: ID Check app (when available); or • Hong Kong British National (Overseas) Visa |\n| Other applicants | Hong Kong British National (Overseas) Visa |\n\n1.   HK 10.2. An application for entry clearance or permission to stay as a partner or BN(O) Household Child on the BN(O) Status Holder route must meet all the following validity requirements: \n    1.   (a) any fee and Immigration Health Charge must have been paid, unless the applicant has been granted a fee waiver; and\n    2.   (b) the applicant must have provided biometrics when required; and\n    3.   (c) the applicant must have provided a passport or other travel document which satisfactorily establishes their identity and nationality; and\n    4.   (d) when applying as a partner on the BN(O) Status Holder route, where the applicant does not currently hold, or did not last hold, permission as a partner on the BN(O) Status Holder route the applicant must be applying as a partner of a BN(O) Status Holder who: \n        1.   (i) has made a valid application for entry clearance or permission to stay in the UK as a BN(O) Status Holder that has not been decided; or\n        2.   (ii) has entry clearance or permission as a BN(O) status holder; or\n        3.   (iii) is both a British citizen and a BN(O) status holder.\n\n    5.   (e) when applying as a BN(O) Household Child on the BN(O) Status Holder route on the basis of being a child of a BN(O) Status Holder or of the partner of a BN(O) Status Holder, the applicant must be applying as a child of a BN(O) Status Holder or of the partner of a BN(O) Status Holder who: \n        1.   (i) has made a valid application for entry clearance or permission to stay in the UK as a BN(O) Status Holder or as the partner of a BN(O) status Holder that has not been decided; or\n        2.   (ii) has entry clearance or permission as a BN(O) Status Holder or as the partner of a BN(O) Status Holder; or\n        3.   (iii)is both a British citizen and a BN(O) status holder; and\n\n    6.   (f) when applying as a BN(O) Household Child on the BN(O) status holder route on the basis of being a grandchild of a BN(O) Status Holder or of the partner of a BN(O) Status Holder, the applicant must apply at the same time as the BN(O) Status Holder.\n\nHK 10.3. An application which does not meet all the validity requirements for a partner or BN(O) Household child on the BN(O) Status Holder route may be rejected as invalid and not considered.",
      "summary": "Applicants seeking entry or stay as a dependent partner or BN(O) Household Child on the BN(O) route must apply online using specified forms and meet requirements including paying fees, providing biometrics, submitting valid travel documents, and satisfying nationality and identity conditions. All conditions must be met unless a fee waiver is granted; certain applicants with specific passports may use alternative application methods.",
      "augmented_text": "Document: Immigration Rules Appendix Hong Kong British National (Overseas)\nPart: Immigration Rules Appendix Hong Kong British National (Overseas)\nSection ID: HK 10.1\nSection: Validity requirements for a dependent partner or BN(O) Household Child on the BN(O) Status Holder route\nTopic: leave-to-enter\n\nSummary: Applicants seeking entry or stay as a dependent partner or BN(O) Household Child on the BN(O) route must apply online using specified forms and meet requirements including paying fees, providing biometrics, submitting valid travel documents, and satisfying nationality and identity conditions. All conditions must be met unless a fee waiver is granted; certain applicants with specific passports may use alternative application methods.\n\n### Validity requirements for a dependent partner or BN(O) Household Child on the BN(O) Status Holder route\n\nHK 10.1. A person applying for entry clearance or permission to stay as a dependent partner or BN(O) Household Child on the BN(O) Status Holder route must apply online on the gov.uk website on the specified form as follows:\n\n| Applicant | Specified form |\n| --- | --- |\n| Applicants with a chipped passport who: - hold a passport which shows they are registered as a British National (Overseas); or - hold a passport issued by the Hong Kong Special Administrative Region; or - are EEA nationals. | Either: • Hong Kong British National (Overseas) Visa using the UK Immigration: ID Check app (when available); or • Hong Kong British National (Overseas) Visa |\n| Other applicants | Hong Kong British National (Overseas) Visa |\n\n1.   HK 10.2. An application for entry clearance or permission to stay as a partner or BN(O) Household Child on the BN(O) Status Holder route must meet all the following validity requirements: \n    1.   (a) any fee and Immigration Health Charge must have been paid, unless the applicant has been granted a fee waiver; and\n    2.   (b) the applicant must have provided biometrics when required; and\n    3.   (c) the applicant must have provided a passport or other travel document which satisfactorily establishes their identity and nationality; and\n    4.   (d) when applying as a partner on the BN(O) Status Holder route, where the applicant does not currently hold, or did not last hold, permission as a partner on the BN(O) Status Holder route the applicant must be applying as a partner of a BN(O) Status Holder who: \n        1.   (i) has made a valid application for entry clearance or permission to stay in the UK as a BN(O) Status Holder that has not been decided; or\n        2.   (ii) has entry clearance or permission as a BN(O) status holder; or\n        3.   (iii) is both a British citizen and a BN(O) status holder.\n\n    5.   (e) when applying as a BN(O) Household Child on the BN(O) Status Holder route on the basis of being a child of a BN(O) Status Holder or of the partner of a BN(O) Status Holder, the applicant must be applying as a child of a BN(O) Status Holder or of the partner of a BN(O) Status Holder who: \n        1.   (i) has made a valid application for entry clearance or permission to stay in the UK as a BN(O) Status Holder or as the partner of a BN(O) status Holder that has not been decided; or\n        2.   (ii) has entry clearance or permission as a BN(O) Status Holder or as the partner of a BN(O) Status Holder; or\n        3.   (iii)is both a British citizen and a BN(O) status holder; and\n\n    6.   (f) when applying as a BN(O) Household Child on the BN(O) status holder route on the basis of being a grandchild of a BN(O) Status Holder or of the partner of a BN(O) Status Holder, the applicant must apply at the same time as the BN(O) Status Holder.\n\nHK 10.3. An application which does not meet all the validity requirements for a partner or BN(O) Household child on the BN(O) Status Holder route may be rejected as invalid and not considered.",
      "needs_review": false
    },
    {
      "metadata": {
        "source": "Immigration Rules Appendix Hong Kong British National (Overseas)",
        "part": "Immigration Rules Appendix Hong Kong British National (Overseas)",
        "section_id": "HK 11.1",
        "section_title": "Suitability requirements for a dependent partner or BN(O) Household Child on the Hong Kong BN(O) Status Holder route",
        "parent_section": "HK 11",
        "hierarchy_level": 2,
        "topic": "suitability",
        "url": "https://www.gov.uk/guidance/immigration-rules/immigration-rules-appendix-hong-kong-british-national-overseas",
        "scraped_at": "2025-12-06T17:27:49.815154"
      },
      "text": "### Suitability requirements for a dependent partner or BN(O) Household Child on the Hong Kong BN(O) Status Holder route\n\nHK 11.1. The applicant must not fall for refusal under Part Suitability.\n\n1.   HK 11.2. If applying for permission to stay the applicant must not be: \n    1.   (a) in breach of immigration laws, except that where the Exceptions for overstayers section of Part Suitability applies, that period of overstaying will be disregarded; or\n    2.   (b) on immigration bail, except where they have been placed on such bail after making an asylum claim in the UK.",
      "summary": "This provision applies to dependent partners and BN(O) Household Children applying under the Hong Kong BN(O) route. They must be suitable under Part Suitability, meaning they cannot breach immigration laws or be on immigration bail (except in specific overstaying cases).",
      "augmented_text": "Document: Immigration Rules Appendix Hong Kong British National (Overseas)\nPart: Immigration Rules Appendix Hong Kong British National (Overseas)\nSection ID: HK 11.1\nSection: Suitability requirements for a dependent partner or BN(O) Household Child on the Hong Kong BN(O) Status Holder route\nTopic: suitability\n\nSummary: This provision applies to dependent partners and BN(O) Household Children applying under the Hong Kong BN(O) route. They must be suitable under Part Suitability, meaning they cannot breach immigration laws or be on immigration bail (except in specific overstaying cases).\n\n### Suitability requirements for a dependent partner or BN(O) Household Child on the Hong Kong BN(O) Status Holder route\n\nHK 11.1. The applicant must not fall for refusal under Part Suitability.\n\n1.   HK 11.2. If applying for permission to stay the applicant must not be: \n    1.   (a) in breach of immigration laws, except that where the Exceptions for overstayers section of Part Suitability applies, that period of overstaying will be disregarded; or\n    2.   (b) on immigration bail, except where they have been placed on such bail after making an asylum claim in the UK.",
      "needs_review": false
    },
    {
      "metadata": {
        "source": "Immigration Rules Appendix Hong Kong British National (Overseas)",
        "part": "Immigration Rules Appendix Hong Kong British National (Overseas)",
        "section_id": "Eligibility requirements for a partner or BN(O) Household Child on the BN(O) Status Holder route",
        "section_title": "Eligibility requirements for a partner or BN(O) Household Child on the BN(O) Status Holder route",
        "parent_section": null,
        "hierarchy_level": 2,
        "topic": "eligibility",
        "url": "https://www.gov.uk/guidance/immigration-rules/immigration-rules-appendix-hong-kong-british-national-overseas",
        "scraped_at": "2025-12-06T17:27:49.815164"
      },
      "text": "### Eligibility requirements for a partner or BN(O) Household Child on the BN(O) Status Holder route",
      "summary": "This provision applies to partners and BN(O) Household Children applying via the BN(O) Status Holder route, requiring genuine relationships and dependency or family ties. Applicants must meet eligibility criteria, including relationship proof and minor thresholds, with exceptions only as specified.",
      "augmented_text": "Document: Immigration Rules Appendix Hong Kong British National (Overseas)\nPart: Immigration Rules Appendix Hong Kong British National (Overseas)\nSection ID: Eligibility requirements for a partner or BN(O) Household Child on the BN(O) Status Holder route\nSection: Eligibility requirements for a partner or BN(O) Household Child on the BN(O) Status Holder route\nTopic: eligibility\n\nSummary: This provision applies to partners and BN(O) Household Children applying via the BN(O) Status Holder route, requiring genuine relationships and dependency or family ties. Applicants must meet eligibility criteria, including relationship proof and minor thresholds, with exceptions only as specified.\n\n### Eligibility requirements for a partner or BN(O) Household Child on the BN(O) Status Holder route",
      "needs_review": false
    },
    {
      "metadata": {
        "source": "Immigration Rules Appendix Hong Kong British National (Overseas)",
        "part": "Immigration Rules Appendix Hong Kong British National (Overseas)",
        "section_id": "HK 12.1",
        "section_title": "Entry requirements for a partner or BN(O) Household Child on the BN(O) Status Holder route",
        "parent_section": "HK 12",
        "hierarchy_level": 2,
        "topic": "leave-to-enter",
        "url": "https://www.gov.uk/guidance/immigration-rules/immigration-rules-appendix-hong-kong-british-national-overseas",
        "scraped_at": "2025-12-06T17:27:49.815190"
      },
      "text": "### Entry requirements for a partner or BN(O) Household Child on the BN(O) Status Holder route\n\nHK 12.1. A person seeking to come to the UK as a partner or BN(O) Household child on the BN(O) Status Holder route must apply for and obtain entry clearance as a partner or BN(O) Household child before they arrive in the UK.\n\nHK 12.2. A person applying for entry clearance on the BN(O) Status Holder route must, if Appendix Tuberculosis applies, provide a valid medical certificate confirming that they have undergone screening for active pulmonary tuberculosis and that this tuberculosis is not present in them.",
      "summary": "Applicants seeking entry as a partner or BN(O) Household Child on the BN(O) Status Holder route must apply for and obtain entry clearance before arriving in the UK. They must also provide a TB medical certificate if tuberculosis screening is required.",
      "augmented_text": "Document: Immigration Rules Appendix Hong Kong British National (Overseas)\nPart: Immigration Rules Appendix Hong Kong British National (Overseas)\nSection ID: HK 12.1\nSection: Entry requirements for a partner or BN(O) Household Child on the BN(O) Status Holder route\nTopic: leave-to-enter\n\nSummary: Applicants seeking entry as a partner or BN(O) Household Child on the BN(O) Status Holder route must apply for and obtain entry clearance before arriving in the UK. They must also provide a TB medical certificate if tuberculosis screening is required.\n\n### Entry requirements for a partner or BN(O) Household Child on the BN(O) Status Holder route\n\nHK 12.1. A person seeking to come to the UK as a partner or BN(O) Household child on the BN(O) Status Holder route must apply for and obtain entry clearance as a partner or BN(O) Household child before they arrive in the UK.\n\nHK 12.2. A person applying for entry clearance on the BN(O) Status Holder route must, if Appendix Tuberculosis applies, provide a valid medical certificate confirming that they have undergone screening for active pulmonary tuberculosis and that this tuberculosis is not present in them.",
      "needs_review": false
    },
    {
      "metadata": {
        "source": "Immigration Rules Appendix Hong Kong British National (Overseas)",
        "part": "Immigration Rules Appendix Hong Kong British National (Overseas)",
        "section_id": "HK 13.1",
        "section_title": "Relationship requirement for dependent partner on the BN(O) Status Holder route",
        "parent_section": "HK 13",
        "hierarchy_level": 2,
        "topic": "family",
        "url": "https://www.gov.uk/guidance/immigration-rules/immigration-rules-appendix-hong-kong-british-national-overseas",
        "scraped_at": "2025-12-06T17:27:49.815226"
      },
      "text": "### Relationship requirement for dependent partner on the BN(O) Status Holder route\n\nHK 13.1. If the applicant is applying for permission to stay and they have permission as a dependent partner on the BN(O) Status Holder route on the date of application, they will meet the relationship requirement.\n\nHK 13.2. If the applicant is applying for entry clearance or permission to stay and they have not previously had permission as a partner on the BN(O) Status Holder route they must meet the relationship requirement in HK 13.3. to HK 13.7.\n\n1.   HK 13.3. The applicant must be the partner of a person (P) where one of the following applies: \n    1.   (a) P has entry clearance or permission on the Hong Kong BN(O) route; or\n    2.   (b) P is, at the same time, applying for (and is granted) entry clearance or permission on the Hong Kong BN(O) route; or\n    3.   (c) P has settlement under the Hong Kong BN(O) Route and when they obtained settlement, the applicant had permission as P’s partner at that time; or\n    4.   (d) P is both a British citizen and a BN(O) Status Holder.\n\nHK 13.4. The requirements of Appendix Relationship with Partner must be met.\n\nHK 13.5. DELETED.\n\nHK 13.6. DELETED.\n\nHK 13.7. DELETED.\n\nHK 13.8. DELETED.",
      "summary": "This provision applies to dependent partners applying under the BN(O) Status Holder route. They must meet the relationship requirement, either by already having permission or by establishing the partnership with a BN(O) route-holder or British citizen BN(O) Status Holder, with specific conditions regarding their and their partner's immigration status. Deleted sections indicate updated or removed conditions.",
      "augmented_text": "Document: Immigration Rules Appendix Hong Kong British National (Overseas)\nPart: Immigration Rules Appendix Hong Kong British National (Overseas)\nSection ID: HK 13.1\nSection: Relationship requirement for dependent partner on the BN(O) Status Holder route\nTopic: family\n\nSummary: This provision applies to dependent partners applying under the BN(O) Status Holder route. They must meet the relationship requirement, either by already having permission or by establishing the partnership with a BN(O) route-holder or British citizen BN(O) Status Holder, with specific conditions regarding their and their partner's immigration status. Deleted sections indicate updated or removed conditions.\n\n### Relationship requirement for dependent partner on the BN(O) Status Holder route\n\nHK 13.1. If the applicant is applying for permission to stay and they have permission as a dependent partner on the BN(O) Status Holder route on the date of application, they will meet the relationship requirement.\n\nHK 13.2. If the applicant is applying for entry clearance or permission to stay and they have not previously had permission as a partner on the BN(O) Status Holder route they must meet the relationship requirement in HK 13.3. to HK 13.7.\n\n1.   HK 13.3. The applicant must be the partner of a person (P) where one of the following applies: \n    1.   (a) P has entry clearance or permission on the Hong Kong BN(O) route; or\n    2.   (b) P is, at the same time, applying for (and is granted) entry clearance or permission on the Hong Kong BN(O) route; or\n    3.   (c) P has settlement under the Hong Kong BN(O) Route and when they obtained settlement, the applicant had permission as P’s partner at that time; or\n    4.   (d) P is both a British citizen and a BN(O) Status Holder.\n\nHK 13.4. The requirements of Appendix Relationship with Partner must be met.\n\nHK 13.5. DELETED.\n\nHK 13.6. DELETED.\n\nHK 13.7. DELETED.\n\nHK 13.8. DELETED.",
      "needs_review": false
    },
    {
      "metadata": {
        "source": "Immigration Rules Appendix Hong Kong British National (Overseas)",
        "part": "Immigration Rules Appendix Hong Kong British National (Overseas)",
        "section_id": "HK 14.1",
        "section_title": "Financial requirement for dependent partner on the BN(O) Status Holder route",
        "parent_section": "HK 14",
        "hierarchy_level": 2,
        "topic": "financial",
        "url": "https://www.gov.uk/guidance/immigration-rules/immigration-rules-appendix-hong-kong-british-national-overseas",
        "scraped_at": "2025-12-06T17:27:49.815245"
      },
      "text": "### Financial requirement for dependent partner on the BN(O) Status Holder route\n\nHK 14.1. If the applicant is applying for permission to stay and has been living in the UK with permission for 12 months or more on the date of application, they will meet the financial requirement unless the applicant’s previous grant of permission was for 12 months Leave Outside the Rules following an unsuccessful application for the Hong Kong British National (Overseas) route.\n\nHK 14.2. If the applicant is applying for entry clearance or is applying for permission to stay and has been in the UK for less than 12 months on the date of application, or where the applicant’s previous grant of permission was for 12 months Leave Outside the Rules following an unsuccessful application for the Hong Kong British National (Overseas) route, the decision maker must be satisfied that the applicant or the BN(O) Status Holder are able to maintain and accommodate the applicant adequately in the UK without recourse to public funds for at least 6 months.\n\n1.   HK 14.3. For the purposes of HK 14.2. accommodation will not be regarded as adequate if: \n    1.   (a) it is, or will be, overcrowded; or\n    2.   (b) it contravenes public health regulations.\n\nHK 14.4. The applicant or the BN(O) Status Holder may rely on credible promises of future third party support.\n\nHK 14.5. The applicant or the BN(O) Status Holder must show that they have the required funds as specified in Appendix Finance.",
      "summary": "Dependent partners applying under the BN(O) route must demonstrate they can maintain and accommodate themselves in the UK without public funds, either after 12 months of residence or, if less than 12 months, with credible third-party support, abiding by accommodation and financial thresholds.",
      "augmented_text": "Document: Immigration Rules Appendix Hong Kong British National (Overseas)\nPart: Immigration Rules Appendix Hong Kong British National (Overseas)\nSection ID: HK 14.1\nSection: Financial requirement for dependent partner on the BN(O) Status Holder route\nTopic: financial\n\nSummary: Dependent partners applying under the BN(O) route must demonstrate they can maintain and accommodate themselves in the UK without public funds, either after 12 months of residence or, if less than 12 months, with credible third-party support, abiding by accommodation and financial thresholds.\n\n### Financial requirement for dependent partner on the BN(O) Status Holder route\n\nHK 14.1. If the applicant is applying for permission to stay and has been living in the UK with permission for 12 months or more on the date of application, they will meet the financial requirement unless the applicant’s previous grant of permission was for 12 months Leave Outside the Rules following an unsuccessful application for the Hong Kong British National (Overseas) route.\n\nHK 14.2. If the applicant is applying for entry clearance or is applying for permission to stay and has been in the UK for less than 12 months on the date of application, or where the applicant’s previous grant of permission was for 12 months Leave Outside the Rules following an unsuccessful application for the Hong Kong British National (Overseas) route, the decision maker must be satisfied that the applicant or the BN(O) Status Holder are able to maintain and accommodate the applicant adequately in the UK without recourse to public funds for at least 6 months.\n\n1.   HK 14.3. For the purposes of HK 14.2. accommodation will not be regarded as adequate if: \n    1.   (a) it is, or will be, overcrowded; or\n    2.   (b) it contravenes public health regulations.\n\nHK 14.4. The applicant or the BN(O) Status Holder may rely on credible promises of future third party support.\n\nHK 14.5. The applicant or the BN(O) Status Holder must show that they have the required funds as specified in Appendix Finance.",
      "needs_review": false
    },
    {
      "metadata": {
        "source": "Immigration Rules Appendix Hong Kong British National (Overseas)",
        "part": "Immigration Rules Appendix Hong Kong British National (Overseas)",
        "section_id": "1",
        "section_title": "Relationship requirement for BN(O) Household Child on the BN(O) Status Holder route",
        "parent_section": null,
        "hierarchy_level": 1,
        "topic": "leave-to-enter",
        "url": "https://www.gov.uk/guidance/immigration-rules/immigration-rules-appendix-hong-kong-british-national-overseas",
        "scraped_at": "2025-12-06T17:27:49.815279"
      },
      "text": "### Relationship requirement for BN(O) Household Child on the BN(O) Status Holder route\n\n1.   HK 15.1. The applicant must be: \n    1.   (a) the child of a parent who: \n        1.   (i) has, or is at the same time being granted, entry clearance or permission as either a BN(O) Status Holder or the partner of a BN(O) Status Holder; or\n        2.   (ii) has settlement under the Hong Kong BN(O) route and when they obtained settlement the applicant had permission as their dependent child; or\n        3.   (iii) is both a British citizen and a BN(O) Status Holder; or\n\n    2.   (b) The grandchild of a grandparent who: \n        1.   (i) has, or is at the same time being granted, entry clearance or permission as either a BN(O) Status Holder or the partner of a BN(O) Status Holder; or\n        2.   (ii) has settlement under the Hong Kong BN(O) route and when they obtained settlement the applicant had permission as their dependent grandchild; or\n        3.   (iii) is both a British citizen and a BN(O) Status Holder.\n\n2.   HK 15.2. If the applicant is applying for entry clearance or permission to stay as the grandchild of a BN(O) Status Holder or the partner of a BN(O) Status Holder and the applicant has not previously had permission as a BN(O) Household Child on the BN(O) Status Holder route: \n    1.   (a) they must form part of the same household as the BN(O) Status Holder on the date of application; and\n    2.   (b) the BN(O) Status Holder must have, or at the same time be being granted, entry clearance or permission on the BN(O) Status Holder route.\n\nHK 15.3. In HK 15.2(a) a person will form part of the same household as the BN(O) Status Holder if they normally live with the BN(O) Status Holder.\n\n1.   HK 15.4. Each of the applicant’s parents must either be applying at the same time as the applicant, or have permission to be in the UK (other than as a Visitor), unless: \n    1.   (a) the parent with entry clearance or permission to stay as a BN(O) Status Holder or as a partner of a BN(O) Status Holder is the sole surviving parent; or\n    2.   (b) the parent with entry clearance or permission to stay as a BN(O) Status Holder or as a partner of a BN(O) Status Holder has sole responsibility for the applicant’s upbringing; or\n    3.   (c) the parent who does not have permission as a BN(O) Status Holder or as a partner of a BN(O) Status Holder – \n        1.   (i) is a British citizen or a person who has a right to enter or stay in the UK without restriction; and\n        2.   (ii) is or will be ordinarily resident in the UK; or\n\n    4.   (d) there are serious and compelling reasons to grant the applicant entry clearance or permission to stay with the parent who has permission on the Hong Kong BN(O) route; or\n    5.   (e) the applicant falls within HK 15.1(b) and there are serious and compelling reasons to grant the applicant entry clearance or permission to stay with the grandparent with entry clearance or permission to stay as a BN(O) Status Holder or as a partner of a BN(O) Status Holder.\n\nHK 15.5. If the applicant is a child born in the UK to a BN(O) Status Holder or their partner, the applicant must provide a full UK birth certificate showing the names of both parents.",
      "summary": "This provision applies to BN(O) Household Children and Grandchildren seeking entry or permission to stay under the BN(O) status route. It requires the applicant to be the child or grandchild of a BN(O) Status Holder or partner, with specific household and permission history conditions if not previously granted BN(O) household status. Critical conditions include forming part of the same household at application and the status of the parent or grandparent.",
      "augmented_text": "Document: Immigration Rules Appendix Hong Kong British National (Overseas)\nPart: Immigration Rules Appendix Hong Kong British National (Overseas)\nSection ID: 1\nSection: Relationship requirement for BN(O) Household Child on the BN(O) Status Holder route\nTopic: leave-to-enter\n\nSummary: This provision applies to BN(O) Household Children and Grandchildren seeking entry or permission to stay under the BN(O) status route. It requires the applicant to be the child or grandchild of a BN(O) Status Holder or partner, with specific household and permission history conditions if not previously granted BN(O) household status. Critical conditions include forming part of the same household at application and the status of the parent or grandparent.\n\n### Relationship requirement for BN(O) Household Child on the BN(O) Status Holder route\n\n1.   HK 15.1. The applicant must be: \n    1.   (a) the child of a parent who: \n        1.   (i) has, or is at the same time being granted, entry clearance or permission as either a BN(O) Status Holder or the partner of a BN(O) Status Holder; or\n        2.   (ii) has settlement under the Hong Kong BN(O) route and when they obtained settlement the applicant had permission as their dependent child; or\n        3.   (iii) is both a British citizen and a BN(O) Status Holder; or\n\n    2.   (b) The grandchild of a grandparent who: \n        1.   (i) has, or is at the same time being granted, entry clearance or permission as either a BN(O) Status Holder or the partner of a BN(O) Status Holder; or\n        2.   (ii) has settlement under the Hong Kong BN(O) route and when they obtained settlement the applicant had permission as their dependent grandchild; or\n        3.   (iii) is both a British citizen and a BN(O) Status Holder.\n\n2.   HK 15.2. If the applicant is applying for entry clearance or permission to stay as the grandchild of a BN(O) Status Holder or the partner of a BN(O) Status Holder and the applicant has not previously had permission as a BN(O) Household Child on the BN(O) Status Holder route: \n    1.   (a) they must form part of the same household as the BN(O) Status Holder on the date of application; and\n    2.   (b) the BN(O) Status Holder must have, or at the same time be being granted, entry clearance or permission on the BN(O) Status Holder route.\n\nHK 15.3. In HK 15.2(a) a person will form part of the same household as the BN(O) Status Holder if they normally live with the BN(O) Status Holder.\n\n1.   HK 15.4. Each of the applicant’s parents must either be applying at the same time as the applicant, or have permission to be in the UK (other than as a Visitor), unless: \n    1.   (a) the parent with entry clearance or permission to stay as a BN(O) Status Holder or as a partner of a BN(O) Status Holder is the sole surviving parent; or\n    2.   (b) the parent with entry clearance or permission to stay as a BN(O) Status Holder or as a partner of a BN(O) Status Holder has sole responsibility for the applicant’s upbringing; or\n    3.   (c) the parent who does not have permission as a BN(O) Status Holder or as a partner of a BN(O) Status Holder – \n        1.   (i) is a British citizen or a person who has a right to enter or stay in the UK without restriction; and\n        2.   (ii) is or will be ordinarily resident in the UK; or\n\n    4.   (d) there are serious and compelling reasons to grant the applicant entry clearance or permission to stay with the parent who has permission on the Hong Kong BN(O) route; or\n    5.   (e) the applicant falls within HK 15.1(b) and there are serious and compelling reasons to grant the applicant entry clearance or permission to stay with the grandparent with entry clearance or permission to stay as a BN(O) Status Holder or as a partner of a BN(O) Status Holder.\n\nHK 15.5. If the applicant is a child born in the UK to a BN(O) Status Holder or their partner, the applicant must provide a full UK birth certificate showing the names of both parents.",
      "needs_review": false
    },
    {
      "metadata": {
        "source": "Immigration Rules Appendix Hong Kong British National (Overseas)",
        "part": "Immigration Rules Appendix Hong Kong British National (Overseas)",
        "section_id": "HK 16.1",
        "section_title": "Care requirement for a BN(O) Household Child on the BN(O) Status Holder route",
        "parent_section": "HK 16",
        "hierarchy_level": 2,
        "topic": "family",
        "url": "https://www.gov.uk/guidance/immigration-rules/immigration-rules-appendix-hong-kong-british-national-overseas",
        "scraped_at": "2025-12-06T17:27:49.815310"
      },
      "text": "### Care requirement for a BN(O) Household Child on the BN(O) Status Holder route\n\nHK 16.1. The applicant must intend to live with a parent who has permission on the BN(O) status holder route during their stay in the UK, unless they can demonstrate a valid reason why they should not live with that parent.\n\nHK 16.2. The applicant must meet the Care Requirement for a dependent child in Appendix Children.",
      "summary": "Applicants applying under the BN(O) Status Holder route for a household child must intend to live with a parent holding BN(O) status in the UK, unless a valid reason exists. Additionally, they must satisfy the Care Requirement outlined in Appendix Children.",
      "augmented_text": "Document: Immigration Rules Appendix Hong Kong British National (Overseas)\nPart: Immigration Rules Appendix Hong Kong British National (Overseas)\nSection ID: HK 16.1\nSection: Care requirement for a BN(O) Household Child on the BN(O) Status Holder route\nTopic: family\n\nSummary: Applicants applying under the BN(O) Status Holder route for a household child must intend to live with a parent holding BN(O) status in the UK, unless a valid reason exists. Additionally, they must satisfy the Care Requirement outlined in Appendix Children.\n\n### Care requirement for a BN(O) Household Child on the BN(O) Status Holder route\n\nHK 16.1. The applicant must intend to live with a parent who has permission on the BN(O) status holder route during their stay in the UK, unless they can demonstrate a valid reason why they should not live with that parent.\n\nHK 16.2. The applicant must meet the Care Requirement for a dependent child in Appendix Children.",
      "needs_review": false
    },
    {
      "metadata": {
        "source": "Immigration Rules Appendix Hong Kong British National (Overseas)",
        "part": "Immigration Rules Appendix Hong Kong British National (Overseas)",
        "section_id": "HK 17.1",
        "section_title": "Age requirement for a BN(O) Household Child on the BN(O) Status Holder route",
        "parent_section": "HK 17",
        "hierarchy_level": 2,
        "topic": "family",
        "url": "https://www.gov.uk/guidance/immigration-rules/immigration-rules-appendix-hong-kong-british-national-overseas",
        "scraped_at": "2025-12-06T17:27:49.815335"
      },
      "text": "### Age requirement for a BN(O) Household Child on the BN(O) Status Holder route\n\nHK 17.1. The applicant must be under the age of 18 at the date of application.",
      "summary": "This provision applies to BN(O) Household Children applying under the BN(O) Status Holder route. Applicants must be under 18 years old on the date of application, with no exceptions specified.",
      "augmented_text": "Document: Immigration Rules Appendix Hong Kong British National (Overseas)\nPart: Immigration Rules Appendix Hong Kong British National (Overseas)\nSection ID: HK 17.1\nSection: Age requirement for a BN(O) Household Child on the BN(O) Status Holder route\nTopic: family\n\nSummary: This provision applies to BN(O) Household Children applying under the BN(O) Status Holder route. Applicants must be under 18 years old on the date of application, with no exceptions specified.\n\n### Age requirement for a BN(O) Household Child on the BN(O) Status Holder route\n\nHK 17.1. The applicant must be under the age of 18 at the date of application.",
      "needs_review": true,
      "review_reasons": [
        "generic_summary"
      ]
    },
    {
      "metadata": {
        "source": "Immigration Rules Appendix Hong Kong British National (Overseas)",
        "part": "Immigration Rules Appendix Hong Kong British National (Overseas)",
        "section_id": "HK 18.1",
        "section_title": "Financial requirement for a BN(O) Household Child on the BN(O) Status Holder route",
        "parent_section": "HK 18",
        "hierarchy_level": 2,
        "topic": "financial",
        "url": "https://www.gov.uk/guidance/immigration-rules/immigration-rules-appendix-hong-kong-british-national-overseas",
        "scraped_at": "2025-12-06T17:27:49.815351"
      },
      "text": "### Financial requirement for a BN(O) Household Child on the BN(O) Status Holder route\n\nHK 18.1. If the applicant is applying for permission to stay and has been living in the UK with permission for 12 months or more on the date of application, they will meet the financial requirement.\n\nHK 18.2. If the applicant is applying for entry clearance, or is applying for permission to stay and has been in the UK for less than 12 months on the date of application, the decision maker must be satisfied that the BN(O) Status Holder or their partner is able to maintain and accommodate the BN(O) Household Child adequately in the UK without recourse to public funds for at least 6 months.\n\n1.   HK 18.3. For the purposes of HK 18.2 accommodation will not be regarded as adequate if \n    1.   (a) it is or will be overcrowded; or\n    2.   (b) it contravenes public health regulations.\n\nHK 18.4. The BN(O) Status Holder or their partner may rely on credible promises of future third party support.\n\nHK 18.5. The BN(O) Status Holder or their partner must show that they have the required funds as specified in Appendix Finance.",
      "summary": "Applicants seeking permission to stay or entry clearance must demonstrate adequate financial support for a BN(O) Household Child, either by having lived in the UK for 12+ months or proof of sufficient resources to maintain and accommodate the child without public funds for at least 6 months; accommodation must be non-overcrowded and compliant with health regulations.",
      "augmented_text": "Document: Immigration Rules Appendix Hong Kong British National (Overseas)\nPart: Immigration Rules Appendix Hong Kong British National (Overseas)\nSection ID: HK 18.1\nSection: Financial requirement for a BN(O) Household Child on the BN(O) Status Holder route\nTopic: financial\n\nSummary: Applicants seeking permission to stay or entry clearance must demonstrate adequate financial support for a BN(O) Household Child, either by having lived in the UK for 12+ months or proof of sufficient resources to maintain and accommodate the child without public funds for at least 6 months; accommodation must be non-overcrowded and compliant with health regulations.\n\n### Financial requirement for a BN(O) Household Child on the BN(O) Status Holder route\n\nHK 18.1. If the applicant is applying for permission to stay and has been living in the UK with permission for 12 months or more on the date of application, they will meet the financial requirement.\n\nHK 18.2. If the applicant is applying for entry clearance, or is applying for permission to stay and has been in the UK for less than 12 months on the date of application, the decision maker must be satisfied that the BN(O) Status Holder or their partner is able to maintain and accommodate the BN(O) Household Child adequately in the UK without recourse to public funds for at least 6 months.\n\n1.   HK 18.3. For the purposes of HK 18.2 accommodation will not be regarded as adequate if \n    1.   (a) it is or will be overcrowded; or\n    2.   (b) it contravenes public health regulations.\n\nHK 18.4. The BN(O) Status Holder or their partner may rely on credible promises of future third party support.\n\nHK 18.5. The BN(O) Status Holder or their partner must show that they have the required funds as specified in Appendix Finance.",
      "needs_review": false
    },
    {
      "metadata": {
        "source": "Immigration Rules Appendix Hong Kong British National (Overseas)",
        "part": "Immigration Rules Appendix Hong Kong British National (Overseas)",
        "section_id": "HK 19.1",
        "section_title": "Ordinary residence in Hong Kong requirement for dependent partner or BN(O) Household Child on the BN(O) Status Holder route",
        "parent_section": "HK 19",
        "hierarchy_level": 2,
        "topic": "leave-to-enter",
        "url": "https://www.gov.uk/guidance/immigration-rules/immigration-rules-appendix-hong-kong-british-national-overseas",
        "scraped_at": "2025-12-06T17:27:49.815386"
      },
      "text": "### Ordinary residence in Hong Kong requirement for dependent partner or BN(O) Household Child on the BN(O) Status Holder route\n\nHK 19.1. If the applicant is applying for entry clearance as a dependent partner or BN(O) Household Child, the applicant must be ordinarily resident in Hong Kong at the date of application.\n\nHK 19.2. An applicant applying for permission to stay must be in the UK and must be ordinarily resident in the UK, the Bailiwick of Guernsey, Bailiwick of Jersey, the Isle of Man or Hong Kong on the date of application.",
      "summary": "Applicants seeking entry clearance as a dependent partner or BN(O) Household Child must be ordinarily resident in Hong Kong at the application date. For permission to stay, they must be in the UK or specified Crown dependencies and normally resident there or in Hong Kong at the time of application.",
      "augmented_text": "Document: Immigration Rules Appendix Hong Kong British National (Overseas)\nPart: Immigration Rules Appendix Hong Kong British National (Overseas)\nSection ID: HK 19.1\nSection: Ordinary residence in Hong Kong requirement for dependent partner or BN(O) Household Child on the BN(O) Status Holder route\nTopic: leave-to-enter\n\nSummary: Applicants seeking entry clearance as a dependent partner or BN(O) Household Child must be ordinarily resident in Hong Kong at the application date. For permission to stay, they must be in the UK or specified Crown dependencies and normally resident there or in Hong Kong at the time of application.\n\n### Ordinary residence in Hong Kong requirement for dependent partner or BN(O) Household Child on the BN(O) Status Holder route\n\nHK 19.1. If the applicant is applying for entry clearance as a dependent partner or BN(O) Household Child, the applicant must be ordinarily resident in Hong Kong at the date of application.\n\nHK 19.2. An applicant applying for permission to stay must be in the UK and must be ordinarily resident in the UK, the Bailiwick of Guernsey, Bailiwick of Jersey, the Isle of Man or Hong Kong on the date of application.",
      "needs_review": false
    },
    {
      "metadata": {
        "source": "Immigration Rules Appendix Hong Kong British National (Overseas)",
        "part": "Immigration Rules Appendix Hong Kong British National (Overseas)",
        "section_id": "1",
        "section_title": "In-country tuberculosis certificate requirement for a dependent partner or BN(O) Household Child on the BN(O) Status Holder route",
        "parent_section": null,
        "hierarchy_level": 1,
        "topic": "family",
        "url": "https://www.gov.uk/guidance/immigration-rules/immigration-rules-appendix-hong-kong-british-national-overseas",
        "scraped_at": "2025-12-06T17:27:49.815418"
      },
      "text": "### In-country tuberculosis certificate requirement for a dependent partner or BN(O) Household Child on the BN(O) Status Holder route\n\n1.   HK 20.1. If the applicant is applying for permission to stay and: \n    1.   (a) their last grant of permission was for 6 months or less; and\n    2.   (b) the applicant was present in a country listed in Appendix Tuberculosis (TB). of these rules for more than six months immediately prior to their last grant of permission,\n\n2.   the applicant must provide a valid medical certificate confirming that they have undergone screening for active pulmonary tuberculosis and that this tuberculosis is not present in them.\n\nHK 20.2. In HK 20.1. a valid medical certificate is a certificate from an approved centre issued within the 6 months immediately before the date of application.\n\nHK 20.3. The in-country tuberculosis requirement is met if the applicant has provided a medical certificate described in HK 20.1. as part of a successful application for entry clearance in the 12 months before the date of application.\n\nHK 20.4. The list of approved centres in the UK, updated from time to time, can be found at: [https://www.gov.uk/government/publications/uk-tuberculosis-test-clinics-for-hong-kong-bno](https://www.gov.uk/government/publications/uk-tuberculosis-test-clinics-for-hong-kong-bno).",
      "summary": "This provision applies to dependent partners and BN(O) Household Children applying for permission to stay under the BN(O) route. They must provide a recent medical certificate showing they have undergone TB screening, if their last permission was for 6 months or less and they resided in listed countries for over six months before the last grant. The certificate must be from an approved centre and issued within six months prior to application.",
      "augmented_text": "Document: Immigration Rules Appendix Hong Kong British National (Overseas)\nPart: Immigration Rules Appendix Hong Kong British National (Overseas)\nSection ID: 1\nSection: In-country tuberculosis certificate requirement for a dependent partner or BN(O) Household Child on the BN(O) Status Holder route\nTopic: family\n\nSummary: This provision applies to dependent partners and BN(O) Household Children applying for permission to stay under the BN(O) route. They must provide a recent medical certificate showing they have undergone TB screening, if their last permission was for 6 months or less and they resided in listed countries for over six months before the last grant. The certificate must be from an approved centre and issued within six months prior to application.\n\n### In-country tuberculosis certificate requirement for a dependent partner or BN(O) Household Child on the BN(O) Status Holder route\n\n1.   HK 20.1. If the applicant is applying for permission to stay and: \n    1.   (a) their last grant of permission was for 6 months or less; and\n    2.   (b) the applicant was present in a country listed in Appendix Tuberculosis (TB). of these rules for more than six months immediately prior to their last grant of permission,\n\n2.   the applicant must provide a valid medical certificate confirming that they have undergone screening for active pulmonary tuberculosis and that this tuberculosis is not present in them.\n\nHK 20.2. In HK 20.1. a valid medical certificate is a certificate from an approved centre issued within the 6 months immediately before the date of application.\n\nHK 20.3. The in-country tuberculosis requirement is met if the applicant has provided a medical certificate described in HK 20.1. as part of a successful application for entry clearance in the 12 months before the date of application.\n\nHK 20.4. The list of approved centres in the UK, updated from time to time, can be found at: [https://www.gov.uk/government/publications/uk-tuberculosis-test-clinics-for-hong-kong-bno](https://www.gov.uk/government/publications/uk-tuberculosis-test-clinics-for-hong-kong-bno).",
      "needs_review": false
    },
    {
      "metadata": {
        "source": "Immigration Rules Appendix Hong Kong British National (Overseas)",
        "part": "Immigration Rules Appendix Hong Kong British National (Overseas)",
        "section_id": "HK 21.1",
        "section_title": "Decision on an application as a partner or BN(O) Household Child on the BN(O) Status Holder Route",
        "parent_section": "HK 21",
        "hierarchy_level": 2,
        "topic": "eligibility",
        "url": "https://www.gov.uk/guidance/immigration-rules/immigration-rules-appendix-hong-kong-british-national-overseas",
        "scraped_at": "2025-12-06T17:27:49.815432"
      },
      "text": "### Decision on an application as a partner or BN(O) Household Child on the BN(O) Status Holder Route\n\nHK 21.1. If the decision maker is satisfied that all the suitability and eligibility requirements for a dependent partner or dependent BN(O) Household Child on the BN(O) Status Holder route are met the application will be granted, otherwise the application will be refused.\n\nHK 21.2. If the application is refused the person can apply for an Administrative Review under Appendix AR: Administrative Review.",
      "summary": "This provision applies to applicants seeking residence as a partner or BN(O) Household Child under the BN(O) Status Holder Route. It requires the decision-maker to assess all suitability and eligibility criteria; failure to meet these leads to refusal, with the option for an Administrative Review.",
      "augmented_text": "Document: Immigration Rules Appendix Hong Kong British National (Overseas)\nPart: Immigration Rules Appendix Hong Kong British National (Overseas)\nSection ID: HK 21.1\nSection: Decision on an application as a partner or BN(O) Household Child on the BN(O) Status Holder Route\nTopic: eligibility\n\nSummary: This provision applies to applicants seeking residence as a partner or BN(O) Household Child under the BN(O) Status Holder Route. It requires the decision-maker to assess all suitability and eligibility criteria; failure to meet these leads to refusal, with the option for an Administrative Review.\n\n### Decision on an application as a partner or BN(O) Household Child on the BN(O) Status Holder Route\n\nHK 21.1. If the decision maker is satisfied that all the suitability and eligibility requirements for a dependent partner or dependent BN(O) Household Child on the BN(O) Status Holder route are met the application will be granted, otherwise the application will be refused.\n\nHK 21.2. If the application is refused the person can apply for an Administrative Review under Appendix AR: Administrative Review.",
      "needs_review": false
    },
    {
      "metadata": {
        "source": "Immigration Rules Appendix Hong Kong British National (Overseas)",
        "part": "Immigration Rules Appendix Hong Kong British National (Overseas)",
        "section_id": "1",
        "section_title": "Period of grant for a dependent partner or BN(O) Household Child on the BN(O) Status Holder route",
        "parent_section": null,
        "hierarchy_level": 1,
        "topic": "family",
        "url": "https://www.gov.uk/guidance/immigration-rules/immigration-rules-appendix-hong-kong-british-national-overseas",
        "scraped_at": "2025-12-06T17:27:49.815463"
      },
      "text": "### Period of grant for a dependent partner or BN(O) Household Child on the BN(O) Status Holder route\n\n1.   HK 22.1. The partner will be granted permission for either: \n    1.   (a) a period of 30 months (plus, where the partner has extant permission on the Hong Kong BN(O) route, the remaining period of that permission, up to a maximum of 28 days) where they have applied for a period of 30 months; or\n    2.   (b) 5 years, if they applied for a period of 5 years.\n\nHK 22.2. DELETED.\n\nHK 22.3. DELETED.\n\n1.   HK 22.4. A BN(O) Household Child will be granted either: \n    1.   (a) where the BN(O) Household Child is applying as the dependant of one parent or grandparent with permission as a BN(O) Status Holder or the partner of a BN(O) Status Holder, permission that ends on the same date as that parent or grandparent; or\n    2.   (b) where the BN(O) Household Child is applying as the dependant of both parents or grandparents with permission as a BN(O) Status Holder or the partner of a BN(O) Status Holder, permission that ends on the same date as those parents or grandparents or, if different, the same date as the parent or grandparent whose permission ends latest.",
      "summary": "This provision applies to dependents (partners and household children) of BN(O) Status Holders. Partners can receive permission for either 30 months or 5 years, depending on their application, while BN(O) household children’s permission aligns with that of their parent(s) or grandparent(s). Conditions include matching expiry dates with the primary permit holder’s permission.",
      "augmented_text": "Document: Immigration Rules Appendix Hong Kong British National (Overseas)\nPart: Immigration Rules Appendix Hong Kong British National (Overseas)\nSection ID: 1\nSection: Period of grant for a dependent partner or BN(O) Household Child on the BN(O) Status Holder route\nTopic: family\n\nSummary: This provision applies to dependents (partners and household children) of BN(O) Status Holders. Partners can receive permission for either 30 months or 5 years, depending on their application, while BN(O) household children’s permission aligns with that of their parent(s) or grandparent(s). Conditions include matching expiry dates with the primary permit holder’s permission.\n\n### Period of grant for a dependent partner or BN(O) Household Child on the BN(O) Status Holder route\n\n1.   HK 22.1. The partner will be granted permission for either: \n    1.   (a) a period of 30 months (plus, where the partner has extant permission on the Hong Kong BN(O) route, the remaining period of that permission, up to a maximum of 28 days) where they have applied for a period of 30 months; or\n    2.   (b) 5 years, if they applied for a period of 5 years.\n\nHK 22.2. DELETED.\n\nHK 22.3. DELETED.\n\n1.   HK 22.4. A BN(O) Household Child will be granted either: \n    1.   (a) where the BN(O) Household Child is applying as the dependant of one parent or grandparent with permission as a BN(O) Status Holder or the partner of a BN(O) Status Holder, permission that ends on the same date as that parent or grandparent; or\n    2.   (b) where the BN(O) Household Child is applying as the dependant of both parents or grandparents with permission as a BN(O) Status Holder or the partner of a BN(O) Status Holder, permission that ends on the same date as those parents or grandparents or, if different, the same date as the parent or grandparent whose permission ends latest.",
      "needs_review": false
    },
    {
      "metadata": {
        "source": "Immigration Rules Appendix Hong Kong British National (Overseas)",
        "part": "Immigration Rules Appendix Hong Kong British National (Overseas)",
        "section_id": "1",
        "section_title": "Conditions of grant for a partner or BN(O) Household Child on the BN(O) Status Holder route",
        "parent_section": null,
        "hierarchy_level": 1,
        "topic": "financial",
        "url": "https://www.gov.uk/guidance/immigration-rules/immigration-rules-appendix-hong-kong-british-national-overseas",
        "scraped_at": "2025-12-06T17:27:49.815480"
      },
      "text": "### Conditions of grant for a partner or BN(O) Household Child on the BN(O) Status Holder route\n\n1.   HK 22.5. The grant will be subject to all the following conditions: \n    1.   (a) no access to public funds; and\n    2.   (b) work (including self-employment and voluntary work) permitted except for employment as a professional sportsperson (including as a sports coach); and\n    3.   (c) study is permitted, subject to the ATAS condition in Appendix ATAS.\n    4.   (d) DELETED.",
      "summary": "This provision applies to partners or BN(O) Household Children granted status under the BN(O) route. They must not access public funds, may work (excluding professional sports), and can study subject to ATAS conditions; specific restrictions or deletions may apply.",
      "augmented_text": "Document: Immigration Rules Appendix Hong Kong British National (Overseas)\nPart: Immigration Rules Appendix Hong Kong British National (Overseas)\nSection ID: 1\nSection: Conditions of grant for a partner or BN(O) Household Child on the BN(O) Status Holder route\nTopic: financial\n\nSummary: This provision applies to partners or BN(O) Household Children granted status under the BN(O) route. They must not access public funds, may work (excluding professional sports), and can study subject to ATAS conditions; specific restrictions or deletions may apply.\n\n### Conditions of grant for a partner or BN(O) Household Child on the BN(O) Status Holder route\n\n1.   HK 22.5. The grant will be subject to all the following conditions: \n    1.   (a) no access to public funds; and\n    2.   (b) work (including self-employment and voluntary work) permitted except for employment as a professional sportsperson (including as a sports coach); and\n    3.   (c) study is permitted, subject to the ATAS condition in Appendix ATAS.\n    4.   (d) DELETED.",
      "needs_review": false
    },
    {
      "metadata": {
        "source": "Immigration Rules Appendix Hong Kong British National (Overseas)",
        "part": "Immigration Rules Appendix Hong Kong British National (Overseas)",
        "section_id": "BN(O) HM 1",
        "section_title": "BN(O) Household Member route",
        "parent_section": null,
        "hierarchy_level": 2,
        "topic": "eligibility",
        "url": "https://www.gov.uk/guidance/immigration-rules/immigration-rules-appendix-hong-kong-british-national-overseas",
        "scraped_at": "2025-12-06T17:27:49.815501"
      },
      "text": "### BN(O) Household Member route",
      "summary": "The BN(O) Household Member route applies to family members of BN(O) visa holders. Applicants must meet eligibility and relationship criteria, and must not have been previously refused or removed from the UK; specific conditions or exceptions are outlined in the rules.",
      "augmented_text": "Document: Immigration Rules Appendix Hong Kong British National (Overseas)\nPart: Immigration Rules Appendix Hong Kong British National (Overseas)\nSection ID: BN(O) HM 1\nSection: BN(O) Household Member route\nTopic: eligibility\n\nSummary: The BN(O) Household Member route applies to family members of BN(O) visa holders. Applicants must meet eligibility and relationship criteria, and must not have been previously refused or removed from the UK; specific conditions or exceptions are outlined in the rules.\n\n### BN(O) Household Member route",
      "needs_review": false
    },
    {
      "metadata": {
        "source": "Immigration Rules Appendix Hong Kong British National (Overseas)",
        "part": "Immigration Rules Appendix Hong Kong British National (Overseas)",
        "section_id": "HK 23.1",
        "section_title": "Validity requirements for the BN(O) Household Member route",
        "parent_section": "HK 23",
        "hierarchy_level": 2,
        "topic": "leave-to-enter",
        "url": "https://www.gov.uk/guidance/immigration-rules/immigration-rules-appendix-hong-kong-british-national-overseas",
        "scraped_at": "2025-12-06T17:27:49.815540"
      },
      "text": "### Validity requirements for the BN(O) Household Member route\n\nHK 23.1. A person applying for entry clearance or permission to stay on the BN(O) Household Member route must apply online on the gov.uk website on the specified form as follows:\n\n| Applicant | Specified form |\n| --- | --- |\n| Applicants with a chipped passport who: - hold a passport which shows they are registered as a British National (Overseas); or - hold a passport issued by the Hong Kong Special Administrative Region; or - are EEA nationals. | Either: • Hong Kong British National (Overseas) Visa using the UK Immigration: ID Check app (when available); or • Hong Kong British National (Overseas) Visa |\n| Other applicants | Hong Kong British National (Overseas) Visa |\n\n1.   HK 23.2. An application for entry clearance or permission to stay on the BN(O) Household Member route must meet all the following requirements: \n    1.   (a) any fee and Immigration Health Charge must have been paid, unless the applicant has been granted a fee waiver; and\n    2.   (b) the applicant must have provided biometrics when required; and\n    3.   (c) the applicant must have provided a passport or other travel document which satisfactorily establishes their identity and nationality; and\n    4.   (d) when applying for the first time as a BN(O) Household Member, if the applicant is applying as a child of the partner of a BN(O) Status Holder and does not have, or did not last hold, permission as a Household Child on the BN(O) Status Holder route, the applicant must apply for entry clearance or permission to stay in the UK at the same time as the BN(O) Status Holder.\n\nHK 23.3. The applicant must have been born on or after 1 July 1997.\n\nHK 23.4. The applicant must be aged 18 or over on the date of application.\n\nHK 23.5. The applicant must not have or have last had permission as a BN(O) Adult Dependent Relative on the BN(O) Status Holder route.\n\nHK 23.6. An application which does not meet the validity requirements for the BN(O) Household Member route may be rejected as invalid and not considered.",
      "summary": "This provision applies to applicants seeking entry clearance or permission to stay on the BN(O) Household Member route. They must apply online using the specified form and meet requirements including paying fees, providing biometrics, submitting valid travel documents, and, for first-time applications as a Household Member, demonstrating appropriate relationship status. Critical conditions include fee payment and biometric submission, with exceptions for fee waivers.",
      "augmented_text": "Document: Immigration Rules Appendix Hong Kong British National (Overseas)\nPart: Immigration Rules Appendix Hong Kong British National (Overseas)\nSection ID: HK 23.1\nSection: Validity requirements for the BN(O) Household Member route\nTopic: leave-to-enter\n\nSummary: This provision applies to applicants seeking entry clearance or permission to stay on the BN(O) Household Member route. They must apply online using the specified form and meet requirements including paying fees, providing biometrics, submitting valid travel documents, and, for first-time applications as a Household Member, demonstrating appropriate relationship status. Critical conditions include fee payment and biometric submission, with exceptions for fee waivers.\n\n### Validity requirements for the BN(O) Household Member route\n\nHK 23.1. A person applying for entry clearance or permission to stay on the BN(O) Household Member route must apply online on the gov.uk website on the specified form as follows:\n\n| Applicant | Specified form |\n| --- | --- |\n| Applicants with a chipped passport who: - hold a passport which shows they are registered as a British National (Overseas); or - hold a passport issued by the Hong Kong Special Administrative Region; or - are EEA nationals. | Either: • Hong Kong British National (Overseas) Visa using the UK Immigration: ID Check app (when available); or • Hong Kong British National (Overseas) Visa |\n| Other applicants | Hong Kong British National (Overseas) Visa |\n\n1.   HK 23.2. An application for entry clearance or permission to stay on the BN(O) Household Member route must meet all the following requirements: \n    1.   (a) any fee and Immigration Health Charge must have been paid, unless the applicant has been granted a fee waiver; and\n    2.   (b) the applicant must have provided biometrics when required; and\n    3.   (c) the applicant must have provided a passport or other travel document which satisfactorily establishes their identity and nationality; and\n    4.   (d) when applying for the first time as a BN(O) Household Member, if the applicant is applying as a child of the partner of a BN(O) Status Holder and does not have, or did not last hold, permission as a Household Child on the BN(O) Status Holder route, the applicant must apply for entry clearance or permission to stay in the UK at the same time as the BN(O) Status Holder.\n\nHK 23.3. The applicant must have been born on or after 1 July 1997.\n\nHK 23.4. The applicant must be aged 18 or over on the date of application.\n\nHK 23.5. The applicant must not have or have last had permission as a BN(O) Adult Dependent Relative on the BN(O) Status Holder route.\n\nHK 23.6. An application which does not meet the validity requirements for the BN(O) Household Member route may be rejected as invalid and not considered.",
      "needs_review": false
    },
    {
      "metadata": {
        "source": "Immigration Rules Appendix Hong Kong British National (Overseas)",
        "part": "Immigration Rules Appendix Hong Kong British National (Overseas)",
        "section_id": "HK 24.1",
        "section_title": "Suitability requirements for the BN(O) Household Member route",
        "parent_section": "HK 24",
        "hierarchy_level": 2,
        "topic": "suitability",
        "url": "https://www.gov.uk/guidance/immigration-rules/immigration-rules-appendix-hong-kong-british-national-overseas",
        "scraped_at": "2025-12-06T17:27:49.815562"
      },
      "text": "### Suitability requirements for the BN(O) Household Member route\n\nHK 24.1. The applicant must not fall for refusal under Part Suitability.\n\n1.   HK 24.2. If applying for permission to stay the applicant must not be: \n    1.   (a) in breach of immigration laws, except that where the Exceptions for overstayers section of Part Suitability applies, that period of overstaying will be disregarded; or\n    2.   (b) on immigration bail, except where they have been placed on such bail after making an asylum claim in the UK.",
      "summary": "The provision applies to BN(O) household applicants seeking permission to stay. They must not be in breach of immigration laws or on immigration bail, with specific exceptions for overstayers and asylum-related bail.",
      "augmented_text": "Document: Immigration Rules Appendix Hong Kong British National (Overseas)\nPart: Immigration Rules Appendix Hong Kong British National (Overseas)\nSection ID: HK 24.1\nSection: Suitability requirements for the BN(O) Household Member route\nTopic: suitability\n\nSummary: The provision applies to BN(O) household applicants seeking permission to stay. They must not be in breach of immigration laws or on immigration bail, with specific exceptions for overstayers and asylum-related bail.\n\n### Suitability requirements for the BN(O) Household Member route\n\nHK 24.1. The applicant must not fall for refusal under Part Suitability.\n\n1.   HK 24.2. If applying for permission to stay the applicant must not be: \n    1.   (a) in breach of immigration laws, except that where the Exceptions for overstayers section of Part Suitability applies, that period of overstaying will be disregarded; or\n    2.   (b) on immigration bail, except where they have been placed on such bail after making an asylum claim in the UK.",
      "needs_review": false
    },
    {
      "metadata": {
        "source": "Immigration Rules Appendix Hong Kong British National (Overseas)",
        "part": "Immigration Rules Appendix Hong Kong British National (Overseas)",
        "section_id": "Eligibility requirements for the BN(O) Household Member route",
        "section_title": "Eligibility requirements for the BN(O) Household Member route",
        "parent_section": null,
        "hierarchy_level": 2,
        "topic": "eligibility",
        "url": "https://www.gov.uk/guidance/immigration-rules/immigration-rules-appendix-hong-kong-british-national-overseas",
        "scraped_at": "2025-12-06T17:27:49.815571"
      },
      "text": "### Eligibility requirements for the BN(O) Household Member route",
      "summary": "This provision applies to BN(O) household members seeking entry under the BN(O) Household Member route. They must meet specific eligibility criteria, including relationship and immigration requirements, with certain exceptions and conditions detailed in the rules.",
      "augmented_text": "Document: Immigration Rules Appendix Hong Kong British National (Overseas)\nPart: Immigration Rules Appendix Hong Kong British National (Overseas)\nSection ID: Eligibility requirements for the BN(O) Household Member route\nSection: Eligibility requirements for the BN(O) Household Member route\nTopic: eligibility\n\nSummary: This provision applies to BN(O) household members seeking entry under the BN(O) Household Member route. They must meet specific eligibility criteria, including relationship and immigration requirements, with certain exceptions and conditions detailed in the rules.\n\n### Eligibility requirements for the BN(O) Household Member route",
      "needs_review": false
    },
    {
      "metadata": {
        "source": "Immigration Rules Appendix Hong Kong British National (Overseas)",
        "part": "Immigration Rules Appendix Hong Kong British National (Overseas)",
        "section_id": "HK 25.1",
        "section_title": "Entry requirement for a BN(O) Household Member",
        "parent_section": "HK 25",
        "hierarchy_level": 2,
        "topic": "leave-to-enter",
        "url": "https://www.gov.uk/guidance/immigration-rules/immigration-rules-appendix-hong-kong-british-national-overseas",
        "scraped_at": "2025-12-06T17:27:49.815596"
      },
      "text": "### Entry requirement for a BN(O) Household Member\n\nHK 25.1. A person seeking to come to the UK on the BN(O) Household Member route must apply for and obtain entry clearance on the BN(O) Household Member route before they arrive in the UK.\n\nHK 25.2. A person applying for entry clearance as a BN(O) Household member must, if Appendix Tuberculosis applies, provide a valid medical certificate confirming that they have undergone screening for active pulmonary tuberculosis and that this tuberculosis is not present in them.",
      "summary": "BN(O) Household Members seeking UK entry must obtain entry clearance beforehand. If applicable under Appendix Tuberculosis, they must also provide a valid screening certificate confirming no active pulmonary TB.",
      "augmented_text": "Document: Immigration Rules Appendix Hong Kong British National (Overseas)\nPart: Immigration Rules Appendix Hong Kong British National (Overseas)\nSection ID: HK 25.1\nSection: Entry requirement for a BN(O) Household Member\nTopic: leave-to-enter\n\nSummary: BN(O) Household Members seeking UK entry must obtain entry clearance beforehand. If applicable under Appendix Tuberculosis, they must also provide a valid screening certificate confirming no active pulmonary TB.\n\n### Entry requirement for a BN(O) Household Member\n\nHK 25.1. A person seeking to come to the UK on the BN(O) Household Member route must apply for and obtain entry clearance on the BN(O) Household Member route before they arrive in the UK.\n\nHK 25.2. A person applying for entry clearance as a BN(O) Household member must, if Appendix Tuberculosis applies, provide a valid medical certificate confirming that they have undergone screening for active pulmonary tuberculosis and that this tuberculosis is not present in them.",
      "needs_review": false
    },
    {
      "metadata": {
        "source": "Immigration Rules Appendix Hong Kong British National (Overseas)",
        "part": "Immigration Rules Appendix Hong Kong British National (Overseas)",
        "section_id": "HK 26.1",
        "section_title": "Relationship requirement for a BN(O) Household Member",
        "parent_section": "HK 26",
        "hierarchy_level": 2,
        "topic": "eligibility",
        "url": "https://www.gov.uk/guidance/immigration-rules/immigration-rules-appendix-hong-kong-british-national-overseas",
        "scraped_at": "2025-12-06T17:27:49.815630"
      },
      "text": "### Relationship requirement for a BN(O) Household Member\n\nHK 26.1. If the applicant is applying for permission to stay and they have permission on the Hong Kong British National (Overseas) route on the date of application, they will meet the relationship requirement.\n\n1.   HK 26.2. If the applicant is applying for entry clearance or permission to stay and they do not have permission on the Hong Kong British National (Overseas) route on the date of application, the applicant: \n    1.   (a) must be the child of a person who is, or who was prior to their death, a British National (Overseas) under the Hong Kong (British Nationality) Order 1986; or\n    2.   (b) must be the child of a partner of a BN(O) Status Holder: \n        1.   (i) who forms part of the same household as the BN(O) Status holder; and\n        2.   (ii) the BN(O) Status Holder must have, or at the same time be being granted, entry clearance or permission on the BN(O) Status Holder route.\n\nHK 26.3. In HK 26.2. a person will form part of the same household as the BN(O) Status Holder if they normally live with the BN(O) Status Holder.",
      "summary": "This provision applies to BN(O) household members applying for permission to stay or entry clearance. They must either already have permission via the BN(O) route or be the child of a BN(O) or a partner living in the same household with a BN(O) Status Holder. Critical conditions include familial or household relationships and the timing of permission grants.",
      "augmented_text": "Document: Immigration Rules Appendix Hong Kong British National (Overseas)\nPart: Immigration Rules Appendix Hong Kong British National (Overseas)\nSection ID: HK 26.1\nSection: Relationship requirement for a BN(O) Household Member\nTopic: eligibility\n\nSummary: This provision applies to BN(O) household members applying for permission to stay or entry clearance. They must either already have permission via the BN(O) route or be the child of a BN(O) or a partner living in the same household with a BN(O) Status Holder. Critical conditions include familial or household relationships and the timing of permission grants.\n\n### Relationship requirement for a BN(O) Household Member\n\nHK 26.1. If the applicant is applying for permission to stay and they have permission on the Hong Kong British National (Overseas) route on the date of application, they will meet the relationship requirement.\n\n1.   HK 26.2. If the applicant is applying for entry clearance or permission to stay and they do not have permission on the Hong Kong British National (Overseas) route on the date of application, the applicant: \n    1.   (a) must be the child of a person who is, or who was prior to their death, a British National (Overseas) under the Hong Kong (British Nationality) Order 1986; or\n    2.   (b) must be the child of a partner of a BN(O) Status Holder: \n        1.   (i) who forms part of the same household as the BN(O) Status holder; and\n        2.   (ii) the BN(O) Status Holder must have, or at the same time be being granted, entry clearance or permission on the BN(O) Status Holder route.\n\nHK 26.3. In HK 26.2. a person will form part of the same household as the BN(O) Status Holder if they normally live with the BN(O) Status Holder.",
      "needs_review": false
    },
    {
      "metadata": {
        "source": "Immigration Rules Appendix Hong Kong British National (Overseas)",
        "part": "Immigration Rules Appendix Hong Kong British National (Overseas)",
        "section_id": "HK 27.1",
        "section_title": "Financial requirement for a BN(O) Household Member",
        "parent_section": "HK 27",
        "hierarchy_level": 2,
        "topic": "financial",
        "url": "https://www.gov.uk/guidance/immigration-rules/immigration-rules-appendix-hong-kong-british-national-overseas",
        "scraped_at": "2025-12-06T17:27:49.815648"
      },
      "text": "### Financial requirement for a BN(O) Household Member\n\nHK 27.1. If the applicant is applying for permission to stay and has been living in the UK with permission for 12 months or more on the date of application, they will meet the financial requirement unless the applicant’s previous grant of permission was for 12 months Leave Outside the Rules following an unsuccessful application for the Hong Kong British National (Overseas) route.\n\nHK 27.2. If the applicant is applying for entry clearance, or is applying for permission to stay and they have been in the UK for less than 12 months on the date of application, or where the applicant’s previous grant of permission was for 12 months Leave Outside the Rules following an unsuccessful application for the Hong Kong British National (Overseas) route, the decision maker must be satisfied that the applicant, or a person who has or is being granted permission on the BN(O) Status Holder route, is able to, and will, maintain and accommodate the applicant adequately in the UK without recourse to public funds for at least 6 months.\n\n1.   HK 27.3. For the purposes of HK 27.2 accommodation will not be regarded as adequate if: \n    1.   (a) it is or will be overcrowded; or\n    2.   (b) it contravenes public health regulations.\n\nHK 27.4. The applicant or the person on the BN(O) Status Holder route may rely on credible promises of future third party support.\n\nHK 27.5. The applicant or the person on the BN(O) Status Holder route must show that they have the required funds as specified in Appendix Finance.",
      "summary": "This provision applies to BN(O) Household Members applying to stay or enter the UK. Applicants who have been in the UK for 12+ months are deemed to meet the financial requirement, unless their prior permission was for 12 months outside the Rules after an unsuccessful route application. Those with less than 12 months’ residence or previous adverse permission must demonstrate adequate maintenance and accommodation without recourse to public funds for at least 6 months, excluding overcrowded or health-violating premises.",
      "augmented_text": "Document: Immigration Rules Appendix Hong Kong British National (Overseas)\nPart: Immigration Rules Appendix Hong Kong British National (Overseas)\nSection ID: HK 27.1\nSection: Financial requirement for a BN(O) Household Member\nTopic: financial\n\nSummary: This provision applies to BN(O) Household Members applying to stay or enter the UK. Applicants who have been in the UK for 12+ months are deemed to meet the financial requirement, unless their prior permission was for 12 months outside the Rules after an unsuccessful route application. Those with less than 12 months’ residence or previous adverse permission must demonstrate adequate maintenance and accommodation without recourse to public funds for at least 6 months, excluding overcrowded or health-violating premises.\n\n### Financial requirement for a BN(O) Household Member\n\nHK 27.1. If the applicant is applying for permission to stay and has been living in the UK with permission for 12 months or more on the date of application, they will meet the financial requirement unless the applicant’s previous grant of permission was for 12 months Leave Outside the Rules following an unsuccessful application for the Hong Kong British National (Overseas) route.\n\nHK 27.2. If the applicant is applying for entry clearance, or is applying for permission to stay and they have been in the UK for less than 12 months on the date of application, or where the applicant’s previous grant of permission was for 12 months Leave Outside the Rules following an unsuccessful application for the Hong Kong British National (Overseas) route, the decision maker must be satisfied that the applicant, or a person who has or is being granted permission on the BN(O) Status Holder route, is able to, and will, maintain and accommodate the applicant adequately in the UK without recourse to public funds for at least 6 months.\n\n1.   HK 27.3. For the purposes of HK 27.2 accommodation will not be regarded as adequate if: \n    1.   (a) it is or will be overcrowded; or\n    2.   (b) it contravenes public health regulations.\n\nHK 27.4. The applicant or the person on the BN(O) Status Holder route may rely on credible promises of future third party support.\n\nHK 27.5. The applicant or the person on the BN(O) Status Holder route must show that they have the required funds as specified in Appendix Finance.",
      "needs_review": false
    },
    {
      "metadata": {
        "source": "Immigration Rules Appendix Hong Kong British National (Overseas)",
        "part": "Immigration Rules Appendix Hong Kong British National (Overseas)",
        "section_id": "HK 28.1",
        "section_title": "Ordinary residence in Hong Kong requirement for a BN(O) Household Member",
        "parent_section": "HK 28",
        "hierarchy_level": 2,
        "topic": "leave-to-enter",
        "url": "https://www.gov.uk/guidance/immigration-rules/immigration-rules-appendix-hong-kong-british-national-overseas",
        "scraped_at": "2025-12-06T17:27:49.815673"
      },
      "text": "### Ordinary residence in Hong Kong requirement for a BN(O) Household Member\n\nHK 28.1. An applicant applying for entry clearance as a BN(O) Household Member must be ordinarily resident in Hong Kong on the date of application.\n\nHK 28.2. An applicant applying for permission to stay must be in the UK and must be ordinarily resident in the UK, the Bailiwick of Guernsey, Bailiwick of Jersey, the Isle of Man or Hong Kong.",
      "summary": "This provision applies to BN(O) Household Members seeking entry clearance or permission to stay. They must be ordinarily resident in Hong Kong (for entry) or in the UK, its Crown dependencies, or Hong Kong (for permission to stay) at the relevant application date, with no exceptions specified.",
      "augmented_text": "Document: Immigration Rules Appendix Hong Kong British National (Overseas)\nPart: Immigration Rules Appendix Hong Kong British National (Overseas)\nSection ID: HK 28.1\nSection: Ordinary residence in Hong Kong requirement for a BN(O) Household Member\nTopic: leave-to-enter\n\nSummary: This provision applies to BN(O) Household Members seeking entry clearance or permission to stay. They must be ordinarily resident in Hong Kong (for entry) or in the UK, its Crown dependencies, or Hong Kong (for permission to stay) at the relevant application date, with no exceptions specified.\n\n### Ordinary residence in Hong Kong requirement for a BN(O) Household Member\n\nHK 28.1. An applicant applying for entry clearance as a BN(O) Household Member must be ordinarily resident in Hong Kong on the date of application.\n\nHK 28.2. An applicant applying for permission to stay must be in the UK and must be ordinarily resident in the UK, the Bailiwick of Guernsey, Bailiwick of Jersey, the Isle of Man or Hong Kong.",
      "needs_review": false
    },
    {
      "metadata": {
        "source": "Immigration Rules Appendix Hong Kong British National (Overseas)",
        "part": "Immigration Rules Appendix Hong Kong British National (Overseas)",
        "section_id": "HK 29.1",
        "section_title": "In-country tuberculosis certificate requirement for a BN(O) Household Member",
        "parent_section": null,
        "hierarchy_level": 1,
        "topic": "health",
        "url": "https://www.gov.uk/guidance/immigration-rules/immigration-rules-appendix-hong-kong-british-national-overseas",
        "scraped_at": "2025-12-06T17:27:49.815707"
      },
      "text": "### In-country tuberculosis certificate requirement for a BN(O) Household Member\n\n1.   HK 29.1. If the applicant is applying for permission to stay and: \n    1.   (a) their last grant of permission was for 6 months or less; and\n    2.   (b) the applicant was present in a country listed in Appendix Tuberculosis of these rules for more than six months immediately prior to their last grant of permission,\n\n2.   the applicant must provide a valid medical certificate confirming that they have undergone screening for active pulmonary tuberculosis and that this tuberculosis is not present in them.\n\nHK 29.2. In HK 29.1. a valid medical certificate is a certificate from an approved centre issued within the 6 months immediately before the date of application.\n\nHK 29.3. The in-country tuberculosis certificate requirement is met if the applicant has provided a medical certificate described in HK 29.1. as part of a successful application for entry clearance in the 12 months before the date of application.\n\nHK 29.4. The list of approved centres in the UK, updated from time to time, can be found at: [https://www.gov.uk/government/publications/uk-tuberculosis-test-clinics-for-hong-kong-bno](https://www.gov.uk/government/publications/uk-tuberculosis-test-clinics-for-hong-kong-bno).",
      "summary": "BN(O) household members applying to stay must provide a recent (within 6 months) medical certificate confirming they tested negative for active tuberculosis if they previously stayed in a listed country for over six months and their last permission was for six months or less; this requirement can also be satisfied by a valid certificate from an approved UK clinic obtained within the past 12 months.",
      "augmented_text": "Document: Immigration Rules Appendix Hong Kong British National (Overseas)\nPart: Immigration Rules Appendix Hong Kong British National (Overseas)\nSection ID: HK 29.1\nSection: In-country tuberculosis certificate requirement for a BN(O) Household Member\nTopic: health\n\nSummary: BN(O) household members applying to stay must provide a recent (within 6 months) medical certificate confirming they tested negative for active tuberculosis if they previously stayed in a listed country for over six months and their last permission was for six months or less; this requirement can also be satisfied by a valid certificate from an approved UK clinic obtained within the past 12 months.\n\n### In-country tuberculosis certificate requirement for a BN(O) Household Member\n\n1.   HK 29.1. If the applicant is applying for permission to stay and: \n    1.   (a) their last grant of permission was for 6 months or less; and\n    2.   (b) the applicant was present in a country listed in Appendix Tuberculosis of these rules for more than six months immediately prior to their last grant of permission,\n\n2.   the applicant must provide a valid medical certificate confirming that they have undergone screening for active pulmonary tuberculosis and that this tuberculosis is not present in them.\n\nHK 29.2. In HK 29.1. a valid medical certificate is a certificate from an approved centre issued within the 6 months immediately before the date of application.\n\nHK 29.3. The in-country tuberculosis certificate requirement is met if the applicant has provided a medical certificate described in HK 29.1. as part of a successful application for entry clearance in the 12 months before the date of application.\n\nHK 29.4. The list of approved centres in the UK, updated from time to time, can be found at: [https://www.gov.uk/government/publications/uk-tuberculosis-test-clinics-for-hong-kong-bno](https://www.gov.uk/government/publications/uk-tuberculosis-test-clinics-for-hong-kong-bno).",
      "needs_review": false
    },
    {
      "metadata": {
        "source": "Immigration Rules Appendix Hong Kong British National (Overseas)",
        "part": "Immigration Rules Appendix Hong Kong British National (Overseas)",
        "section_id": "HK 30.1",
        "section_title": "Decision on an application as a BN(O) Household Member",
        "parent_section": "HK 30",
        "hierarchy_level": 2,
        "topic": "eligibility",
        "url": "https://www.gov.uk/guidance/immigration-rules/immigration-rules-appendix-hong-kong-british-national-overseas",
        "scraped_at": "2025-12-06T17:27:49.815720"
      },
      "text": "### Decision on an application as a BN(O) Household Member\n\nHK 30.1. If the decision maker is satisfied that all the suitability and eligibility requirements on the BN(O) Household Member route are met the application will be granted, otherwise the application will be refused.\n\nHK 30.2. If the application is refused the person can apply for an Administrative Review under Appendix AR: Administrative Review.",
      "summary": "This provision applies to BN(O) Household Members applying for immigration. The key requirement is that all suitability and eligibility criteria are met for approval; otherwise, the application is refused, but applicants may request an Administrative Review.",
      "augmented_text": "Document: Immigration Rules Appendix Hong Kong British National (Overseas)\nPart: Immigration Rules Appendix Hong Kong British National (Overseas)\nSection ID: HK 30.1\nSection: Decision on an application as a BN(O) Household Member\nTopic: eligibility\n\nSummary: This provision applies to BN(O) Household Members applying for immigration. The key requirement is that all suitability and eligibility criteria are met for approval; otherwise, the application is refused, but applicants may request an Administrative Review.\n\n### Decision on an application as a BN(O) Household Member\n\nHK 30.1. If the decision maker is satisfied that all the suitability and eligibility requirements on the BN(O) Household Member route are met the application will be granted, otherwise the application will be refused.\n\nHK 30.2. If the application is refused the person can apply for an Administrative Review under Appendix AR: Administrative Review.",
      "needs_review": false
    },
    {
      "metadata": {
        "source": "Immigration Rules Appendix Hong Kong British National (Overseas)",
        "part": "Immigration Rules Appendix Hong Kong British National (Overseas)",
        "section_id": "1",
        "section_title": "Period of grant for a BN(O) Household Member",
        "parent_section": null,
        "hierarchy_level": 1,
        "topic": "family",
        "url": "https://www.gov.uk/guidance/immigration-rules/immigration-rules-appendix-hong-kong-british-national-overseas",
        "scraped_at": "2025-12-06T17:27:49.815750"
      },
      "text": "### Period of grant for a BN(O) Household Member\n\n1.   HK 31.1. If the applicant is applying as the child of a BN(O) Status Holder or they already have permission on the Hong Kong British National (Overseas) route on the date of application, they will be granted permission for either: \n    1.   a) a period of 5 years, where the applicant has applied for a period of 5 years; or\n    2.   b) a period of 30 months (plus, where the applicant has remaining permission under the Hong Kong BN(O) route, the remaining period of that permission, up to a maximum of 28 days) where the applicant has applied for a period of 30 months.\n\nHK 31.2. If the applicant does not have permission on the Hong Kong British National (Overseas) route on the date of application and is the child of a partner on the BN(O) Status Holder route, the applicant will be granted permission which ends on the same date as the BN(O) Status Holder.",
      "summary": "BN(O) Household Members who are children or partners of BN(O) status holders may receive 5-year or 30-month permission if applying as children, or permission ending with the BN(O) status holder if not. Conditions depend on their relationship and existing permissions, with specific maximum durations.",
      "augmented_text": "Document: Immigration Rules Appendix Hong Kong British National (Overseas)\nPart: Immigration Rules Appendix Hong Kong British National (Overseas)\nSection ID: 1\nSection: Period of grant for a BN(O) Household Member\nTopic: family\n\nSummary: BN(O) Household Members who are children or partners of BN(O) status holders may receive 5-year or 30-month permission if applying as children, or permission ending with the BN(O) status holder if not. Conditions depend on their relationship and existing permissions, with specific maximum durations.\n\n### Period of grant for a BN(O) Household Member\n\n1.   HK 31.1. If the applicant is applying as the child of a BN(O) Status Holder or they already have permission on the Hong Kong British National (Overseas) route on the date of application, they will be granted permission for either: \n    1.   a) a period of 5 years, where the applicant has applied for a period of 5 years; or\n    2.   b) a period of 30 months (plus, where the applicant has remaining permission under the Hong Kong BN(O) route, the remaining period of that permission, up to a maximum of 28 days) where the applicant has applied for a period of 30 months.\n\nHK 31.2. If the applicant does not have permission on the Hong Kong British National (Overseas) route on the date of application and is the child of a partner on the BN(O) Status Holder route, the applicant will be granted permission which ends on the same date as the BN(O) Status Holder.",
      "needs_review": false
    },
    {
      "metadata": {
        "source": "Immigration Rules Appendix Hong Kong British National (Overseas)",
        "part": "Immigration Rules Appendix Hong Kong British National (Overseas)",
        "section_id": "1",
        "section_title": "Conditions of grant for a BN(O) Household Member",
        "parent_section": null,
        "hierarchy_level": 1,
        "topic": "financial",
        "url": "https://www.gov.uk/guidance/immigration-rules/immigration-rules-appendix-hong-kong-british-national-overseas",
        "scraped_at": "2025-12-06T17:27:49.815767"
      },
      "text": "### Conditions of grant for a BN(O) Household Member\n\n1.   HK 31.3. The grant will be subject to all the following conditions: \n    1.   (a) no access to public funds; and\n    2.   (b) work (including self-employment and voluntary work) permitted except for employment as a professional sportsperson, including as a sports coach; and\n    3.   (c) study is permitted, subject to the condition in Appendix ATAS.\n    4.   (d) DELETED.",
      "summary": "This provision applies to BN(O) Household Members granted immigration status. They must not access public funds, may work (excluding professional sports), and can study (with ATAS conditions). Access to employment as a professional sportsperson is prohibited.",
      "augmented_text": "Document: Immigration Rules Appendix Hong Kong British National (Overseas)\nPart: Immigration Rules Appendix Hong Kong British National (Overseas)\nSection ID: 1\nSection: Conditions of grant for a BN(O) Household Member\nTopic: financial\n\nSummary: This provision applies to BN(O) Household Members granted immigration status. They must not access public funds, may work (excluding professional sports), and can study (with ATAS conditions). Access to employment as a professional sportsperson is prohibited.\n\n### Conditions of grant for a BN(O) Household Member\n\n1.   HK 31.3. The grant will be subject to all the following conditions: \n    1.   (a) no access to public funds; and\n    2.   (b) work (including self-employment and voluntary work) permitted except for employment as a professional sportsperson, including as a sports coach; and\n    3.   (c) study is permitted, subject to the condition in Appendix ATAS.\n    4.   (d) DELETED.",
      "needs_review": false
    },
    {
      "metadata": {
        "source": "Immigration Rules Appendix Hong Kong British National (Overseas)",
        "part": "Immigration Rules Appendix Hong Kong British National (Overseas)",
        "section_id": "SW 3.1",
        "section_title": "Dependants of BN(O) Household Members",
        "parent_section": null,
        "hierarchy_level": 2,
        "topic": "eligibility",
        "url": "https://www.gov.uk/guidance/immigration-rules/immigration-rules-appendix-hong-kong-british-national-overseas",
        "scraped_at": "2025-12-06T17:27:49.815786"
      },
      "text": "### Dependants of BN(O) Household Members",
      "summary": "This provision applies to dependants of BN(O) household members seeking entry or stay in the UK. Dependants must meet specified eligibility criteria and may require sponsorship; certain conditions or restrictions may apply depending on their relationship and circumstances.",
      "augmented_text": "Document: Immigration Rules Appendix Hong Kong British National (Overseas)\nPart: Immigration Rules Appendix Hong Kong British National (Overseas)\nSection ID: SW 3.1\nSection: Dependants of BN(O) Household Members\nTopic: eligibility\n\nSummary: This provision applies to dependants of BN(O) household members seeking entry or stay in the UK. Dependants must meet specified eligibility criteria and may require sponsorship; certain conditions or restrictions may apply depending on their relationship and circumstances.\n\n### Dependants of BN(O) Household Members",
      "needs_review": false
    },
    {
      "metadata": {
        "source": "Immigration Rules Appendix Hong Kong British National (Overseas)",
        "part": "Immigration Rules Appendix Hong Kong British National (Overseas)",
        "section_id": "HK 32.1",
        "section_title": "Validity requirements for a dependent partner or dependent child of a BN(O) Household Member on the Hong Kong BN(O) route",
        "parent_section": "HK 32",
        "hierarchy_level": 2,
        "topic": "leave-to-enter",
        "url": "https://www.gov.uk/guidance/immigration-rules/immigration-rules-appendix-hong-kong-british-national-overseas",
        "scraped_at": "2025-12-06T17:27:49.815819"
      },
      "text": "### Validity requirements for a dependent partner or dependent child of a BN(O) Household Member on the Hong Kong BN(O) route\n\nHK 32.1. A person applying for entry clearance or permission to stay as a dependent partner or dependent child on the BN(O) Household Member route must apply online on the gov.uk website on the specified form as follows:\n\n| Applicant | Specified form |\n| --- | --- |\n| Applicants with a chipped passport who: - hold a passport which shows they are registered as a British National (Overseas); or - hold a passport issued by the Hong Kong Special Administrative Region; or - are EEA nationals. | Either: • Hong Kong British National (Overseas) Visa using the UK Immigration: ID Check app (when available); or • Hong Kong British National (Overseas) Visa |\n| Other applicants | Hong Kong British National (Overseas) Visa |\n\n1.   HK 32.2. An application for entry clearance or permission to stay as a partner or child on the BN(O) Household Member route must meet the following validity requirements: \n    1.   (a) any fee and Immigration Health Charge must have been paid, unless the applicant has been granted a fee waiver; and\n    2.   (b) the applicant must have provided biometrics when required; and\n    3.   (c) the applicant must have provided a passport or other travel document which satisfactorily establishes their identity and nationality; and\n    4.   (d) when applying on the BN(O) Household Member route as a partner or child of a person who is the child of a BN(O) Status Holder and where the applicant does not currently hold, or did not last hold, permission on the BN(O) Household Member route, the applicant must be applying as a partner or child of a BN(O) Household Member who: \n        1.   (i) has made a valid application for entry clearance or permission to stay in the UK as a BN(O) Household Member that has not been decided; or\n        2.   (ii) has entry clearance or permission as a BN(O) Household Member\n\n    5.   (e) when applying on the BN(O) Household Member as a partner or child of a person who is the child of a partner of a BN(O) Status Holder and where the applicant does not currently hold, or did not last hold, permission on the BN(O) Household Member route, the applicant must apply at the same time as the BN(O) Status Holder.\n\nHK 32.3. DELETED\n\nHK 32.4. An application which does not meet the validity requirements for a dependent partner or dependent child on the BN(O) Household Member route may be rejected as invalid and not considered.",
      "summary": "Applicants seeking to join or stay as dependents of a BN(O) Household Member must apply online using specified forms, paying fees, providing biometrics, and submitting valid travel documents that confirm their identity and nationality. These requirements apply to all applicants, with specific forms for certain passport types, ensuring they meet the UK's immigration validity standards.",
      "augmented_text": "Document: Immigration Rules Appendix Hong Kong British National (Overseas)\nPart: Immigration Rules Appendix Hong Kong British National (Overseas)\nSection ID: HK 32.1\nSection: Validity requirements for a dependent partner or dependent child of a BN(O) Household Member on the Hong Kong BN(O) route\nTopic: leave-to-enter\n\nSummary: Applicants seeking to join or stay as dependents of a BN(O) Household Member must apply online using specified forms, paying fees, providing biometrics, and submitting valid travel documents that confirm their identity and nationality. These requirements apply to all applicants, with specific forms for certain passport types, ensuring they meet the UK's immigration validity standards.\n\n### Validity requirements for a dependent partner or dependent child of a BN(O) Household Member on the Hong Kong BN(O) route\n\nHK 32.1. A person applying for entry clearance or permission to stay as a dependent partner or dependent child on the BN(O) Household Member route must apply online on the gov.uk website on the specified form as follows:\n\n| Applicant | Specified form |\n| --- | --- |\n| Applicants with a chipped passport who: - hold a passport which shows they are registered as a British National (Overseas); or - hold a passport issued by the Hong Kong Special Administrative Region; or - are EEA nationals. | Either: • Hong Kong British National (Overseas) Visa using the UK Immigration: ID Check app (when available); or • Hong Kong British National (Overseas) Visa |\n| Other applicants | Hong Kong British National (Overseas) Visa |\n\n1.   HK 32.2. An application for entry clearance or permission to stay as a partner or child on the BN(O) Household Member route must meet the following validity requirements: \n    1.   (a) any fee and Immigration Health Charge must have been paid, unless the applicant has been granted a fee waiver; and\n    2.   (b) the applicant must have provided biometrics when required; and\n    3.   (c) the applicant must have provided a passport or other travel document which satisfactorily establishes their identity and nationality; and\n    4.   (d) when applying on the BN(O) Household Member route as a partner or child of a person who is the child of a BN(O) Status Holder and where the applicant does not currently hold, or did not last hold, permission on the BN(O) Household Member route, the applicant must be applying as a partner or child of a BN(O) Household Member who: \n        1.   (i) has made a valid application for entry clearance or permission to stay in the UK as a BN(O) Household Member that has not been decided; or\n        2.   (ii) has entry clearance or permission as a BN(O) Household Member\n\n    5.   (e) when applying on the BN(O) Household Member as a partner or child of a person who is the child of a partner of a BN(O) Status Holder and where the applicant does not currently hold, or did not last hold, permission on the BN(O) Household Member route, the applicant must apply at the same time as the BN(O) Status Holder.\n\nHK 32.3. DELETED\n\nHK 32.4. An application which does not meet the validity requirements for a dependent partner or dependent child on the BN(O) Household Member route may be rejected as invalid and not considered.",
      "needs_review": false
    },
    {
      "metadata": {
        "source": "Immigration Rules Appendix Hong Kong British National (Overseas)",
        "part": "Immigration Rules Appendix Hong Kong British National (Overseas)",
        "section_id": "HK 33.1",
        "section_title": "Suitability requirements for a dependent partner or child on the BN(O) Household Member route",
        "parent_section": "HK 33",
        "hierarchy_level": 2,
        "topic": "suitability",
        "url": "https://www.gov.uk/guidance/immigration-rules/immigration-rules-appendix-hong-kong-british-national-overseas",
        "scraped_at": "2025-12-06T17:27:49.815840"
      },
      "text": "### Suitability requirements for a dependent partner or child on the BN(O) Household Member route\n\nHK 33.1. The applicant must not fall for refusal under Part Suitability.\n\n1.   HK 33.2. If applying for permission to stay the applicant must not be: \n    1.   (a) in breach of immigration laws, except that where the Exceptions for overstayers section of Part Suitability applies, that period of overstaying will be disregarded; or\n    2.   (b) on immigration bail, except where they have been placed on such bail after making an asylum claim in the UK.",
      "summary": "This provision applies to dependent partners and children on the BN(O) Household Member route. They must not breach immigration laws or be on immigration bail (unless related to asylum), ensuring their suitability for permission to stay under UK immigration rules.",
      "augmented_text": "Document: Immigration Rules Appendix Hong Kong British National (Overseas)\nPart: Immigration Rules Appendix Hong Kong British National (Overseas)\nSection ID: HK 33.1\nSection: Suitability requirements for a dependent partner or child on the BN(O) Household Member route\nTopic: suitability\n\nSummary: This provision applies to dependent partners and children on the BN(O) Household Member route. They must not breach immigration laws or be on immigration bail (unless related to asylum), ensuring their suitability for permission to stay under UK immigration rules.\n\n### Suitability requirements for a dependent partner or child on the BN(O) Household Member route\n\nHK 33.1. The applicant must not fall for refusal under Part Suitability.\n\n1.   HK 33.2. If applying for permission to stay the applicant must not be: \n    1.   (a) in breach of immigration laws, except that where the Exceptions for overstayers section of Part Suitability applies, that period of overstaying will be disregarded; or\n    2.   (b) on immigration bail, except where they have been placed on such bail after making an asylum claim in the UK.",
      "needs_review": false
    },
    {
      "metadata": {
        "source": "Immigration Rules Appendix Hong Kong British National (Overseas)",
        "part": "Immigration Rules Appendix Hong Kong British National (Overseas)",
        "section_id": "Eligibility requirements for a dependent partner or child on the BN(O) Household Member route",
        "section_title": "Eligibility requirements for a dependent partner or child on the BN(O) Household Member route",
        "parent_section": null,
        "hierarchy_level": 2,
        "topic": "eligibility",
        "url": "https://www.gov.uk/guidance/immigration-rules/immigration-rules-appendix-hong-kong-british-national-overseas",
        "scraped_at": "2025-12-06T17:27:49.815849"
      },
      "text": "### Eligibility requirements for a dependent partner or child on the BN(O) Household Member route",
      "summary": "This provision applies to dependent partners and children applying under the BN(O) Household Member route. They must meet eligibility criteria, including relationship proof and maintenance requirements, with certain exceptions for family circumstances.",
      "augmented_text": "Document: Immigration Rules Appendix Hong Kong British National (Overseas)\nPart: Immigration Rules Appendix Hong Kong British National (Overseas)\nSection ID: Eligibility requirements for a dependent partner or child on the BN(O) Household Member route\nSection: Eligibility requirements for a dependent partner or child on the BN(O) Household Member route\nTopic: eligibility\n\nSummary: This provision applies to dependent partners and children applying under the BN(O) Household Member route. They must meet eligibility criteria, including relationship proof and maintenance requirements, with certain exceptions for family circumstances.\n\n### Eligibility requirements for a dependent partner or child on the BN(O) Household Member route",
      "needs_review": false
    },
    {
      "metadata": {
        "source": "Immigration Rules Appendix Hong Kong British National (Overseas)",
        "part": "Immigration Rules Appendix Hong Kong British National (Overseas)",
        "section_id": "HK 34.1",
        "section_title": "Entry requirements for a partner or child on the BN(O) Household Member route",
        "parent_section": "HK 34",
        "hierarchy_level": 2,
        "topic": "leave-to-enter",
        "url": "https://www.gov.uk/guidance/immigration-rules/immigration-rules-appendix-hong-kong-british-national-overseas",
        "scraped_at": "2025-12-06T17:27:49.815874"
      },
      "text": "### Entry requirements for a partner or child on the BN(O) Household Member route\n\nHK 34.1. A person seeking to come to the UK as a partner or child on the BN(O) Household Member route must apply for and obtain entry clearance as a partner or child before they arrive in the UK.\n\nHK 34.2. A person applying for entry clearance as the partner or child a BN(O) Household member must, if Appendix Tuberculosis applies, provide a valid medical certificate confirming that they have undergone screening for active pulmonary tuberculosis and that this tuberculosis is not present in them.",
      "summary": "Applicants seeking entry as a partner or child on the BN(O) Household Member route must obtain prior entry clearance, including TB screening if applicable, before arriving in the UK.",
      "augmented_text": "Document: Immigration Rules Appendix Hong Kong British National (Overseas)\nPart: Immigration Rules Appendix Hong Kong British National (Overseas)\nSection ID: HK 34.1\nSection: Entry requirements for a partner or child on the BN(O) Household Member route\nTopic: leave-to-enter\n\nSummary: Applicants seeking entry as a partner or child on the BN(O) Household Member route must obtain prior entry clearance, including TB screening if applicable, before arriving in the UK.\n\n### Entry requirements for a partner or child on the BN(O) Household Member route\n\nHK 34.1. A person seeking to come to the UK as a partner or child on the BN(O) Household Member route must apply for and obtain entry clearance as a partner or child before they arrive in the UK.\n\nHK 34.2. A person applying for entry clearance as the partner or child a BN(O) Household member must, if Appendix Tuberculosis applies, provide a valid medical certificate confirming that they have undergone screening for active pulmonary tuberculosis and that this tuberculosis is not present in them.",
      "needs_review": false
    },
    {
      "metadata": {
        "source": "Immigration Rules Appendix Hong Kong British National (Overseas)",
        "part": "Immigration Rules Appendix Hong Kong British National (Overseas)",
        "section_id": "HK 35.1",
        "section_title": "Relationship requirements for dependent partner of a BN(O) Household Member",
        "parent_section": "HK 35",
        "hierarchy_level": 2,
        "topic": "family",
        "url": "https://www.gov.uk/guidance/immigration-rules/immigration-rules-appendix-hong-kong-british-national-overseas",
        "scraped_at": "2025-12-06T17:27:49.815909"
      },
      "text": "### Relationship requirements for dependent partner of a BN(O) Household Member\n\nHK 35.1. If the applicant is applying for permission to stay and they have permission as a partner on the BN(O) Household Member route on the date of application, they will meet the relationship requirements.\n\nHK 35.2. Where the applicant is applying for entry clearance or permission to stay and they have not previously had permission on the BN(O) Household Member route they must meet the relationship requirement as set out in HK 35.3. to HK 35.9.\n\n1.   HK 35.3. The applicant must be the partner of a person (P) where one of the following applies: \n    1.   (a) P has permission on the BN(O) Household Member route; or\n    2.   (b) P is, at the same time, applying for (and is granted) entry clearance or permission on the BN(O) Household Member route; or\n    3.   (c) P is settled or has become a British citizen, providing P had permission on the BN(O) Household Member route when they settled and the applicant had permission as P’s partner at that time.\n\nHK 35.4. The requirements of Appendix Relationship with Partner must be met .\n\nHK 35.5. DELETED.\n\nHK 35.6. DELETED.\n\n1.   HK 35.7. Where P is the child of a partner on the BN(O) Status Holder route: \n    1.   (a) the applicant must form part of the same household as the BN(O) Status Holder on the date of application; and\n    2.   (b) the BN(O) Status Holder must have, or at the same time be being granted, entry clearance or permission on the BN(O) Status Holder route.\n\nHK 35.8. In HK 35.7(a) a person will form part of the same household as the BN(O) Status Holder if they normally live with the BN(O) Status Holder.\n\nHK 35.9. DELETED.",
      "summary": "This provision applies to dependents applying for permission to stay as partners of BN(O) Household Members. Applicants must demonstrate a genuine partner relationship with someone on the BN(O) route, meeting specified connection criteria; those already granted BN(O) permission or with settled status are exempt. Additionally, partners of BN(O) status holders or their children must satisfy household and relationship conditions.",
      "augmented_text": "Document: Immigration Rules Appendix Hong Kong British National (Overseas)\nPart: Immigration Rules Appendix Hong Kong British National (Overseas)\nSection ID: HK 35.1\nSection: Relationship requirements for dependent partner of a BN(O) Household Member\nTopic: family\n\nSummary: This provision applies to dependents applying for permission to stay as partners of BN(O) Household Members. Applicants must demonstrate a genuine partner relationship with someone on the BN(O) route, meeting specified connection criteria; those already granted BN(O) permission or with settled status are exempt. Additionally, partners of BN(O) status holders or their children must satisfy household and relationship conditions.\n\n### Relationship requirements for dependent partner of a BN(O) Household Member\n\nHK 35.1. If the applicant is applying for permission to stay and they have permission as a partner on the BN(O) Household Member route on the date of application, they will meet the relationship requirements.\n\nHK 35.2. Where the applicant is applying for entry clearance or permission to stay and they have not previously had permission on the BN(O) Household Member route they must meet the relationship requirement as set out in HK 35.3. to HK 35.9.\n\n1.   HK 35.3. The applicant must be the partner of a person (P) where one of the following applies: \n    1.   (a) P has permission on the BN(O) Household Member route; or\n    2.   (b) P is, at the same time, applying for (and is granted) entry clearance or permission on the BN(O) Household Member route; or\n    3.   (c) P is settled or has become a British citizen, providing P had permission on the BN(O) Household Member route when they settled and the applicant had permission as P’s partner at that time.\n\nHK 35.4. The requirements of Appendix Relationship with Partner must be met .\n\nHK 35.5. DELETED.\n\nHK 35.6. DELETED.\n\n1.   HK 35.7. Where P is the child of a partner on the BN(O) Status Holder route: \n    1.   (a) the applicant must form part of the same household as the BN(O) Status Holder on the date of application; and\n    2.   (b) the BN(O) Status Holder must have, or at the same time be being granted, entry clearance or permission on the BN(O) Status Holder route.\n\nHK 35.8. In HK 35.7(a) a person will form part of the same household as the BN(O) Status Holder if they normally live with the BN(O) Status Holder.\n\nHK 35.9. DELETED.",
      "needs_review": false
    },
    {
      "metadata": {
        "source": "Immigration Rules Appendix Hong Kong British National (Overseas)",
        "part": "Immigration Rules Appendix Hong Kong British National (Overseas)",
        "section_id": "HK 36.1",
        "section_title": "Financial requirement for partner of a BN(O) Household Member",
        "parent_section": "HK 36",
        "hierarchy_level": 2,
        "topic": "financial",
        "url": "https://www.gov.uk/guidance/immigration-rules/immigration-rules-appendix-hong-kong-british-national-overseas",
        "scraped_at": "2025-12-06T17:27:49.815930"
      },
      "text": "### Financial requirement for partner of a BN(O) Household Member\n\nHK 36.1. If the applicant is applying for permission to stay and has been living in the UK with permission for 12 months or more on the date of application, they will meet the financial requirement unless the applicant’s previous grant of permission was for 12 months Leave Outside the Rules following an unsuccessful application for the Hong Kong British National (Overseas) route.\n\nHK 36.2. If the applicant is applying for entry clearance, or is applying for permission to stay and has been in the UK for less than 12 months on the date of application, or where the applicant’s previous grant of permission was for 12 months Leave Outside the Rules following an unsuccessful application for the Hong Kong British National (Overseas) route, the decision maker must be satisfied that the applicant, the BN(O) Household Member or a person being granted permission on the BN(O) Status Holder route is able to maintain and accommodate the applicant adequately in the UK without recourse to public funds for at least 6 months.\n\n1.   HK 36.3 For the purposes of HK 36.2. accommodation will not be regarded as adequate if \n    1.   (a) it is or will be overcrowded; or\n    2.   (b) it contravenes public health regulations.\n\nHK 36.4. The applicant, the BN(O) Household Member or a person being granted permission on the BN(O) Status Holder route may rely on credible promises of future third party support.\n\nHK 36.5. The applicant, the BN(O) Household Member or a person being granted permission on the BN(O) Status Holder route must show that they have the required funds as specified in Appendix Finance.",
      "summary": "This provision applies to partners of BN(O) Household Members seeking permission to stay in the UK. Applicants must meet financial requirements, either by demonstrating ongoing residence of 12 months with permission or, if less than 12 months, by showing they can be maintained and accommodated without public funds for at least 6 months. Exceptions include previous grants for 12 months Leave Outside the Rules after unsuccessful BN(O) route applications, and credible third-party support can be relied upon.",
      "augmented_text": "Document: Immigration Rules Appendix Hong Kong British National (Overseas)\nPart: Immigration Rules Appendix Hong Kong British National (Overseas)\nSection ID: HK 36.1\nSection: Financial requirement for partner of a BN(O) Household Member\nTopic: financial\n\nSummary: This provision applies to partners of BN(O) Household Members seeking permission to stay in the UK. Applicants must meet financial requirements, either by demonstrating ongoing residence of 12 months with permission or, if less than 12 months, by showing they can be maintained and accommodated without public funds for at least 6 months. Exceptions include previous grants for 12 months Leave Outside the Rules after unsuccessful BN(O) route applications, and credible third-party support can be relied upon.\n\n### Financial requirement for partner of a BN(O) Household Member\n\nHK 36.1. If the applicant is applying for permission to stay and has been living in the UK with permission for 12 months or more on the date of application, they will meet the financial requirement unless the applicant’s previous grant of permission was for 12 months Leave Outside the Rules following an unsuccessful application for the Hong Kong British National (Overseas) route.\n\nHK 36.2. If the applicant is applying for entry clearance, or is applying for permission to stay and has been in the UK for less than 12 months on the date of application, or where the applicant’s previous grant of permission was for 12 months Leave Outside the Rules following an unsuccessful application for the Hong Kong British National (Overseas) route, the decision maker must be satisfied that the applicant, the BN(O) Household Member or a person being granted permission on the BN(O) Status Holder route is able to maintain and accommodate the applicant adequately in the UK without recourse to public funds for at least 6 months.\n\n1.   HK 36.3 For the purposes of HK 36.2. accommodation will not be regarded as adequate if \n    1.   (a) it is or will be overcrowded; or\n    2.   (b) it contravenes public health regulations.\n\nHK 36.4. The applicant, the BN(O) Household Member or a person being granted permission on the BN(O) Status Holder route may rely on credible promises of future third party support.\n\nHK 36.5. The applicant, the BN(O) Household Member or a person being granted permission on the BN(O) Status Holder route must show that they have the required funds as specified in Appendix Finance.",
      "needs_review": false
    },
    {
      "metadata": {
        "source": "Immigration Rules Appendix Hong Kong British National (Overseas)",
        "part": "Immigration Rules Appendix Hong Kong British National (Overseas)",
        "section_id": "1",
        "section_title": "Relationship requirement for dependent child of a BN(O) Household Member",
        "parent_section": null,
        "hierarchy_level": 1,
        "topic": "family",
        "url": "https://www.gov.uk/guidance/immigration-rules/immigration-rules-appendix-hong-kong-british-national-overseas",
        "scraped_at": "2025-12-06T17:27:49.815963"
      },
      "text": "### Relationship requirement for dependent child of a BN(O) Household Member\n\n1.   HK 37.1. The applicant must be the child of a person (P) where one of the following applies: \n    1.   (a) P has permission on the BN(O) Household Member route; or\n    2.   (b) P is, at the same time, applying for (and is granted) entry clearance or permission on the BN(O) Household Member route; or\n    3.   (c) P is settled or has become a British citizen, providing P had permission on the BN(O) Household Member route when they settled, and the applicant had permission as P’s child at that time.\n\n1.   HK 37.2. Where neither parent of the applicant is the child of a BN(O) status holder and the applicant has not previously been granted entry clearance or permission as a child on the BN(O) Household Member route: \n    1.   (a) the applicant must form part of the same household as the BN(O) Status Holder on the date of application; and\n    2.   (b) the BN(O) Status Holder must have, or at the same time be being granted, entry clearance or permission on the BN(O) Status Holder route.\n\nHK 37.3. In HK 37.2(a) a person will form part of the same household as the BN(O) Status Holder if they normally live with the BN(O) Status Holder.\n\nHK 37.4. If the applicant is a child born in the UK to a BN(O) Household Member or their partner, the applicant must provide a full UK birth certificate showing the names of both parents.",
      "summary": "This provision applies to dependent children of BN(O) Household Members seeking entry or settlement. The key requirement is that the applicant must be related as a child to someone with permission or settlement under the BN(O) route, or live in the same household as such a person if they haven't previously been granted BN(O) status. Critical conditions include proof of relationship, household proximity, and specific eligibility when born in the UK.",
      "augmented_text": "Document: Immigration Rules Appendix Hong Kong British National (Overseas)\nPart: Immigration Rules Appendix Hong Kong British National (Overseas)\nSection ID: 1\nSection: Relationship requirement for dependent child of a BN(O) Household Member\nTopic: family\n\nSummary: This provision applies to dependent children of BN(O) Household Members seeking entry or settlement. The key requirement is that the applicant must be related as a child to someone with permission or settlement under the BN(O) route, or live in the same household as such a person if they haven't previously been granted BN(O) status. Critical conditions include proof of relationship, household proximity, and specific eligibility when born in the UK.\n\n### Relationship requirement for dependent child of a BN(O) Household Member\n\n1.   HK 37.1. The applicant must be the child of a person (P) where one of the following applies: \n    1.   (a) P has permission on the BN(O) Household Member route; or\n    2.   (b) P is, at the same time, applying for (and is granted) entry clearance or permission on the BN(O) Household Member route; or\n    3.   (c) P is settled or has become a British citizen, providing P had permission on the BN(O) Household Member route when they settled, and the applicant had permission as P’s child at that time.\n\n1.   HK 37.2. Where neither parent of the applicant is the child of a BN(O) status holder and the applicant has not previously been granted entry clearance or permission as a child on the BN(O) Household Member route: \n    1.   (a) the applicant must form part of the same household as the BN(O) Status Holder on the date of application; and\n    2.   (b) the BN(O) Status Holder must have, or at the same time be being granted, entry clearance or permission on the BN(O) Status Holder route.\n\nHK 37.3. In HK 37.2(a) a person will form part of the same household as the BN(O) Status Holder if they normally live with the BN(O) Status Holder.\n\nHK 37.4. If the applicant is a child born in the UK to a BN(O) Household Member or their partner, the applicant must provide a full UK birth certificate showing the names of both parents.",
      "needs_review": false
    },
    {
      "metadata": {
        "source": "Immigration Rules Appendix Hong Kong British National (Overseas)",
        "part": "Immigration Rules Appendix Hong Kong British National (Overseas)",
        "section_id": "HK 38.1",
        "section_title": "Care requirement for a dependent child of a BN(O) Household Member",
        "parent_section": "HK 38",
        "hierarchy_level": 2,
        "topic": "family",
        "url": "https://www.gov.uk/guidance/immigration-rules/immigration-rules-appendix-hong-kong-british-national-overseas",
        "scraped_at": "2025-12-06T17:27:49.815993"
      },
      "text": "### Care requirement for a dependent child of a BN(O) Household Member\n\nHK 38.1. The applicant must intend to live with a parent who has permission on the BN(O) Household Member route during their stay in the UK, unless they can demonstrate a valid reason why they should not live with that parent.\n\nHK 38.2. The applicant must meet the Care Requirement for a dependent child in Appendix Children.",
      "summary": "The provision applies to dependent children of BN(O) Household Members seeking entry or stay in the UK. It requires the applicant to intend to live with the parent holding BN(O) permission, unless a valid reason exists, and to meet the Care Requirement for dependent children.",
      "augmented_text": "Document: Immigration Rules Appendix Hong Kong British National (Overseas)\nPart: Immigration Rules Appendix Hong Kong British National (Overseas)\nSection ID: HK 38.1\nSection: Care requirement for a dependent child of a BN(O) Household Member\nTopic: family\n\nSummary: The provision applies to dependent children of BN(O) Household Members seeking entry or stay in the UK. It requires the applicant to intend to live with the parent holding BN(O) permission, unless a valid reason exists, and to meet the Care Requirement for dependent children.\n\n### Care requirement for a dependent child of a BN(O) Household Member\n\nHK 38.1. The applicant must intend to live with a parent who has permission on the BN(O) Household Member route during their stay in the UK, unless they can demonstrate a valid reason why they should not live with that parent.\n\nHK 38.2. The applicant must meet the Care Requirement for a dependent child in Appendix Children.",
      "needs_review": false
    },
    {
      "metadata": {
        "source": "Immigration Rules Appendix Hong Kong British National (Overseas)",
        "part": "Immigration Rules Appendix Hong Kong British National (Overseas)",
        "section_id": "HK 39.1",
        "section_title": "Age requirement for a dependent child of a BN(O) Household Member",
        "parent_section": "HK 39",
        "hierarchy_level": 2,
        "topic": "family",
        "url": "https://www.gov.uk/guidance/immigration-rules/immigration-rules-appendix-hong-kong-british-national-overseas",
        "scraped_at": "2025-12-06T17:27:49.816018"
      },
      "text": "### Age requirement for a dependent child of a BN(O) Household Member\n\nHK 39.1. The applicant must be under the age of 18 at the date of application.",
      "summary": "This provision applies to dependent children of BN(O) Household Members applying for entry. Applicants must be under 18 years old at the application date; no exceptions are specified.",
      "augmented_text": "Document: Immigration Rules Appendix Hong Kong British National (Overseas)\nPart: Immigration Rules Appendix Hong Kong British National (Overseas)\nSection ID: HK 39.1\nSection: Age requirement for a dependent child of a BN(O) Household Member\nTopic: family\n\nSummary: This provision applies to dependent children of BN(O) Household Members applying for entry. Applicants must be under 18 years old at the application date; no exceptions are specified.\n\n### Age requirement for a dependent child of a BN(O) Household Member\n\nHK 39.1. The applicant must be under the age of 18 at the date of application.",
      "needs_review": true,
      "review_reasons": [
        "generic_summary"
      ]
    },
    {
      "metadata": {
        "source": "Immigration Rules Appendix Hong Kong British National (Overseas)",
        "part": "Immigration Rules Appendix Hong Kong British National (Overseas)",
        "section_id": "HK 40.1",
        "section_title": "Financial requirement for child of a BN(O) Household Member",
        "parent_section": "HK 40",
        "hierarchy_level": 2,
        "topic": "financial",
        "url": "https://www.gov.uk/guidance/immigration-rules/immigration-rules-appendix-hong-kong-british-national-overseas",
        "scraped_at": "2025-12-06T17:27:49.817490"
      },
      "text": "### Financial requirement for child of a BN(O) Household Member\n\nHK 40.1. If the applicant is applying for permission to stay and has been living in the UK for 12 months or more on the date of application, they will meet the financial requirement unless the applicant’s previous grant of permission was for 12 months Leave Outside the Rules following an unsuccessful application for the Hong Kong British National (Overseas) route.\n\nHK 40.2. If the applicant is applying for entry clearance, or is applying for permission to stay and has been in the UK with permission for less than 12 months on the date of application, or where the applicant’s previous grant of permission was for 12 months Leave Outside the Rules following an unsuccessful application for the Hong Kong British National (Overseas) route, the decision maker must be satisfied that the BN(O) Household Member, their partner or a person who is being granted permission on the BN(O) Status Holder route is able to and will maintain and accommodate the applicant adequately in the UK without recourse to public funds for at least six months.\n\n1.   HK 40.3. For the purposes of HK 40.2. accommodation will not be regarded as adequate if \n    1.   (a) it is or will be overcrowded; or\n    2.   (b) it contravenes public health regulations.\n\nHK 40.4. The BN(O) Household Member, their partner or a person with permission on the BN(O) Status Holder route may rely on credible promises of future third party support.\n\nHK 40.5. The BN(O) Household Member, their partner or a person with permission on the BN(O) Status Holder route must show that they have the required funds as specified in Appendix Finance.",
      "summary": "This provision applies to applicants seeking permission to stay or entry clearance as a child of a BN(O) Household Member. The key requirement is that applicants or their sponsors must demonstrate adequate maintenance and accommodation in the UK for at least six months unless they have lived in the UK for 12 months or more, in which case the financial requirement is deemed met. Conditions include restrictions based on previous immigration history, accommodation standards, and reliance on credible third-party support.",
      "augmented_text": "Document: Immigration Rules Appendix Hong Kong British National (Overseas)\nPart: Immigration Rules Appendix Hong Kong British National (Overseas)\nSection ID: HK 40.1\nSection: Financial requirement for child of a BN(O) Household Member\nTopic: financial\n\nSummary: This provision applies to applicants seeking permission to stay or entry clearance as a child of a BN(O) Household Member. The key requirement is that applicants or their sponsors must demonstrate adequate maintenance and accommodation in the UK for at least six months unless they have lived in the UK for 12 months or more, in which case the financial requirement is deemed met. Conditions include restrictions based on previous immigration history, accommodation standards, and reliance on credible third-party support.\n\n### Financial requirement for child of a BN(O) Household Member\n\nHK 40.1. If the applicant is applying for permission to stay and has been living in the UK for 12 months or more on the date of application, they will meet the financial requirement unless the applicant’s previous grant of permission was for 12 months Leave Outside the Rules following an unsuccessful application for the Hong Kong British National (Overseas) route.\n\nHK 40.2. If the applicant is applying for entry clearance, or is applying for permission to stay and has been in the UK with permission for less than 12 months on the date of application, or where the applicant’s previous grant of permission was for 12 months Leave Outside the Rules following an unsuccessful application for the Hong Kong British National (Overseas) route, the decision maker must be satisfied that the BN(O) Household Member, their partner or a person who is being granted permission on the BN(O) Status Holder route is able to and will maintain and accommodate the applicant adequately in the UK without recourse to public funds for at least six months.\n\n1.   HK 40.3. For the purposes of HK 40.2. accommodation will not be regarded as adequate if \n    1.   (a) it is or will be overcrowded; or\n    2.   (b) it contravenes public health regulations.\n\nHK 40.4. The BN(O) Household Member, their partner or a person with permission on the BN(O) Status Holder route may rely on credible promises of future third party support.\n\nHK 40.5. The BN(O) Household Member, their partner or a person with permission on the BN(O) Status Holder route must show that they have the required funds as specified in Appendix Finance.",
      "needs_review": false
    },
    {
      "metadata": {
        "source": "Immigration Rules Appendix Hong Kong British National (Overseas)",
        "part": "Immigration Rules Appendix Hong Kong British National (Overseas)",
        "section_id": "HK 41.1",
        "section_title": "Ordinary residence in Hong Kong requirement for partner or child of a BN(O) Household Member",
        "parent_section": "HK 41",
        "hierarchy_level": 2,
        "topic": "leave-to-enter",
        "url": "https://www.gov.uk/guidance/immigration-rules/immigration-rules-appendix-hong-kong-british-national-overseas",
        "scraped_at": "2025-12-06T17:27:49.817548"
      },
      "text": "### Ordinary residence in Hong Kong requirement for partner or child of a BN(O) Household Member\n\nHK 41.1. If the applicant is applying for entry clearance as a dependent partner or child the applicant must be ordinarily resident in Hong Kong at the date of application.\n\nHK 41.2. An applicant applying for permission to stay must be in the UK and must be ordinarily resident in the UK, the Bailiwick of Guernsey, Bailiwick of Jersey, the Isle of Man or Hong Kong on the date of application.",
      "summary": "This provision applies to dependents of BN(O) Household Members applying for entry clearance or permission to stay. Applicants must be ordinarily resident in Hong Kong (for entry clearance) or in the UK or specified Crown dependencies (for permission to stay) on the application date. No exceptions or thresholds are specified.",
      "augmented_text": "Document: Immigration Rules Appendix Hong Kong British National (Overseas)\nPart: Immigration Rules Appendix Hong Kong British National (Overseas)\nSection ID: HK 41.1\nSection: Ordinary residence in Hong Kong requirement for partner or child of a BN(O) Household Member\nTopic: leave-to-enter\n\nSummary: This provision applies to dependents of BN(O) Household Members applying for entry clearance or permission to stay. Applicants must be ordinarily resident in Hong Kong (for entry clearance) or in the UK or specified Crown dependencies (for permission to stay) on the application date. No exceptions or thresholds are specified.\n\n### Ordinary residence in Hong Kong requirement for partner or child of a BN(O) Household Member\n\nHK 41.1. If the applicant is applying for entry clearance as a dependent partner or child the applicant must be ordinarily resident in Hong Kong at the date of application.\n\nHK 41.2. An applicant applying for permission to stay must be in the UK and must be ordinarily resident in the UK, the Bailiwick of Guernsey, Bailiwick of Jersey, the Isle of Man or Hong Kong on the date of application.",
      "needs_review": false
    },
    {
      "metadata": {
        "source": "Immigration Rules Appendix Hong Kong British National (Overseas)",
        "part": "Immigration Rules Appendix Hong Kong British National (Overseas)",
        "section_id": "1",
        "section_title": "In-country tuberculosis requirement for partner or child of a BN(O) Household Member",
        "parent_section": null,
        "hierarchy_level": 1,
        "topic": "family",
        "url": "https://www.gov.uk/guidance/immigration-rules/immigration-rules-appendix-hong-kong-british-national-overseas",
        "scraped_at": "2025-12-06T17:27:49.817586"
      },
      "text": "### In-country tuberculosis requirement for partner or child of a BN(O) Household Member\n\n1.   HK 42.1. If the applicant is applying for permission to stay and: \n    1.   (a) their last grant of permission was for 6 months or less;\n    2.   (b) the applicant was present in a country listed in Appendix Tuberculosis of these rules for more than six months immediately prior to their last grant of permission,\n\n2.   the applicant must provide a valid medical certificate confirming that they have undergone screening for active pulmonary tuberculosis and that this tuberculosis is not present in them.\n\nHK 42.2. In HK 42.1. a valid medical certificate is a certificate from an approved centre issued within the 6 months immediately before the date of application.\n\nHK 42.3. The in-country tuberculosis requirement is met if the applicant provided a medical certificate described in HK 42.1. as part of a successful application for entry clearance in the 12 months before the date of application.\n\nHK 42.4. The list of approved centres in the UK, updated from time to time, can be found at: [https://www.gov.uk/government/publications/uk-tuberculosis-test-clinics-for-hong-kong-bno](https://www.gov.uk/government/publications/uk-tuberculosis-test-clinics-for-hong-kong-bno).",
      "summary": "Applicants who last had permission for 6 months or less and were in a listed country for over six months must provide a recent (within 6 months) approved medical certificate confirming they do not have active tuberculosis. This requirement applies to partners or children of BN(O) Household Members seeking permission to stay, with certificates valid for up to 12 months prior to application.",
      "augmented_text": "Document: Immigration Rules Appendix Hong Kong British National (Overseas)\nPart: Immigration Rules Appendix Hong Kong British National (Overseas)\nSection ID: 1\nSection: In-country tuberculosis requirement for partner or child of a BN(O) Household Member\nTopic: family\n\nSummary: Applicants who last had permission for 6 months or less and were in a listed country for over six months must provide a recent (within 6 months) approved medical certificate confirming they do not have active tuberculosis. This requirement applies to partners or children of BN(O) Household Members seeking permission to stay, with certificates valid for up to 12 months prior to application.\n\n### In-country tuberculosis requirement for partner or child of a BN(O) Household Member\n\n1.   HK 42.1. If the applicant is applying for permission to stay and: \n    1.   (a) their last grant of permission was for 6 months or less;\n    2.   (b) the applicant was present in a country listed in Appendix Tuberculosis of these rules for more than six months immediately prior to their last grant of permission,\n\n2.   the applicant must provide a valid medical certificate confirming that they have undergone screening for active pulmonary tuberculosis and that this tuberculosis is not present in them.\n\nHK 42.2. In HK 42.1. a valid medical certificate is a certificate from an approved centre issued within the 6 months immediately before the date of application.\n\nHK 42.3. The in-country tuberculosis requirement is met if the applicant provided a medical certificate described in HK 42.1. as part of a successful application for entry clearance in the 12 months before the date of application.\n\nHK 42.4. The list of approved centres in the UK, updated from time to time, can be found at: [https://www.gov.uk/government/publications/uk-tuberculosis-test-clinics-for-hong-kong-bno](https://www.gov.uk/government/publications/uk-tuberculosis-test-clinics-for-hong-kong-bno).",
      "needs_review": false
    },
    {
      "metadata": {
        "source": "Immigration Rules Appendix Hong Kong British National (Overseas)",
        "part": "Immigration Rules Appendix Hong Kong British National (Overseas)",
        "section_id": "HK 43.1",
        "section_title": "Decision on an application as a partner or child of a BN(O) Household Member on the Hong Kong BN(O) route",
        "parent_section": "HK 43",
        "hierarchy_level": 2,
        "topic": "eligibility",
        "url": "https://www.gov.uk/guidance/immigration-rules/immigration-rules-appendix-hong-kong-british-national-overseas",
        "scraped_at": "2025-12-06T17:27:49.817603"
      },
      "text": "### Decision on an application as a partner or child of a BN(O) Household Member on the Hong Kong BN(O) route\n\nHK 43.1. If the decision maker is satisfied that all the suitability and eligibility requirements for the dependent partner or dependent child on the BN(O) Household Member route are met the application will be granted, otherwise the application will be refused.\n\nHK 43.2. If the application is refused the person can apply for an Administrative Review under Appendix AR: Administrative Review.",
      "summary": "This provision applies to partners or children of BN(O) Household Members applying via the Hong Kong BN(O) route. The decision-maker grants the application if all suitability and eligibility requirements are met; otherwise, it is refused, with applicants able to request an Administrative Review.",
      "augmented_text": "Document: Immigration Rules Appendix Hong Kong British National (Overseas)\nPart: Immigration Rules Appendix Hong Kong British National (Overseas)\nSection ID: HK 43.1\nSection: Decision on an application as a partner or child of a BN(O) Household Member on the Hong Kong BN(O) route\nTopic: eligibility\n\nSummary: This provision applies to partners or children of BN(O) Household Members applying via the Hong Kong BN(O) route. The decision-maker grants the application if all suitability and eligibility requirements are met; otherwise, it is refused, with applicants able to request an Administrative Review.\n\n### Decision on an application as a partner or child of a BN(O) Household Member on the Hong Kong BN(O) route\n\nHK 43.1. If the decision maker is satisfied that all the suitability and eligibility requirements for the dependent partner or dependent child on the BN(O) Household Member route are met the application will be granted, otherwise the application will be refused.\n\nHK 43.2. If the application is refused the person can apply for an Administrative Review under Appendix AR: Administrative Review.",
      "needs_review": false
    },
    {
      "metadata": {
        "source": "Immigration Rules Appendix Hong Kong British National (Overseas)",
        "part": "Immigration Rules Appendix Hong Kong British National (Overseas)",
        "section_id": "1",
        "section_title": "Period of grant for a dependent partner or child of a BN(O) Household Member",
        "parent_section": null,
        "hierarchy_level": 1,
        "topic": "family",
        "url": "https://www.gov.uk/guidance/immigration-rules/immigration-rules-appendix-hong-kong-british-national-overseas",
        "scraped_at": "2025-12-06T17:27:49.817634"
      },
      "text": "### Period of grant for a dependent partner or child of a BN(O) Household Member\n\n1.   HK 44.1. The partner will be granted permission for either: \n    1.   (a) a period of 30 months (plus, where the partner has extant permission on the Hong Kong BN(O) route, the remaining period of that permission, up to a maximum of 28 days) where they have applied for a period of 30 months; or\n    2.   (b) 5 years, if they applied for a period of 5 years.\n\n1.   HK 44.2. DELETED.\n\nHK 44.3. DELETED.\n\n1.   HK 44.4. A child on the BN(O) Household Member route will be granted either: \n    1.   (a) where the child is applying as the dependant of one parent with permission as a BN(O) Household Member or the partner of a BN(O) Household Member, permission that ends on the same date as that parent; or\n    2.   (b) where the child is applying as the dependant of both parents with permission on the BN(O) Household Member route, permission that ends on the same date as those parents or, if different, the same date as the parent whose permission ends latest.",
      "summary": "Dependents of BN(O) Household Members—partners and children—are eligible for grants of 30 months or 5 years, based on their application. Permissions for children end concurrently with or after their parent(s) on the BN(O) route; partners receive up to 30 months, depending on their application.",
      "augmented_text": "Document: Immigration Rules Appendix Hong Kong British National (Overseas)\nPart: Immigration Rules Appendix Hong Kong British National (Overseas)\nSection ID: 1\nSection: Period of grant for a dependent partner or child of a BN(O) Household Member\nTopic: family\n\nSummary: Dependents of BN(O) Household Members—partners and children—are eligible for grants of 30 months or 5 years, based on their application. Permissions for children end concurrently with or after their parent(s) on the BN(O) route; partners receive up to 30 months, depending on their application.\n\n### Period of grant for a dependent partner or child of a BN(O) Household Member\n\n1.   HK 44.1. The partner will be granted permission for either: \n    1.   (a) a period of 30 months (plus, where the partner has extant permission on the Hong Kong BN(O) route, the remaining period of that permission, up to a maximum of 28 days) where they have applied for a period of 30 months; or\n    2.   (b) 5 years, if they applied for a period of 5 years.\n\n1.   HK 44.2. DELETED.\n\nHK 44.3. DELETED.\n\n1.   HK 44.4. A child on the BN(O) Household Member route will be granted either: \n    1.   (a) where the child is applying as the dependant of one parent with permission as a BN(O) Household Member or the partner of a BN(O) Household Member, permission that ends on the same date as that parent; or\n    2.   (b) where the child is applying as the dependant of both parents with permission on the BN(O) Household Member route, permission that ends on the same date as those parents or, if different, the same date as the parent whose permission ends latest.",
      "needs_review": false
    },
    {
      "metadata": {
        "source": "Immigration Rules Appendix Hong Kong British National (Overseas)",
        "part": "Immigration Rules Appendix Hong Kong British National (Overseas)",
        "section_id": "1",
        "section_title": "Conditions of grant for a partner or child of a BN(O) Household Member",
        "parent_section": null,
        "hierarchy_level": 1,
        "topic": "financial",
        "url": "https://www.gov.uk/guidance/immigration-rules/immigration-rules-appendix-hong-kong-british-national-overseas",
        "scraped_at": "2025-12-06T17:27:49.817651"
      },
      "text": "### Conditions of grant for a partner or child of a BN(O) Household Member\n\n1.   HK 44.5. The grant will be subject to all the following conditions: \n    1.   (a) no access to public funds; and\n    2.   (b) work (including self-employment and voluntary work) permitted except for employment as a professional sportsperson (including as a sports coach); and\n    3.   (c) study is permitted, subject to the ATAS condition in Appendix ATAS.\n    4.   (d) DELETED.",
      "summary": "This provision applies to partners or children of BN(O) Household Members granted immigration status. They must not access public funds, have permission to work (excluding professional sports), and may study subject to ATAS requirements, with some conditions deleted or clarified.",
      "augmented_text": "Document: Immigration Rules Appendix Hong Kong British National (Overseas)\nPart: Immigration Rules Appendix Hong Kong British National (Overseas)\nSection ID: 1\nSection: Conditions of grant for a partner or child of a BN(O) Household Member\nTopic: financial\n\nSummary: This provision applies to partners or children of BN(O) Household Members granted immigration status. They must not access public funds, have permission to work (excluding professional sports), and may study subject to ATAS requirements, with some conditions deleted or clarified.\n\n### Conditions of grant for a partner or child of a BN(O) Household Member\n\n1.   HK 44.5. The grant will be subject to all the following conditions: \n    1.   (a) no access to public funds; and\n    2.   (b) work (including self-employment and voluntary work) permitted except for employment as a professional sportsperson (including as a sports coach); and\n    3.   (c) study is permitted, subject to the ATAS condition in Appendix ATAS.\n    4.   (d) DELETED.",
      "needs_review": false
    },
    {
      "metadata": {
        "source": "Immigration Rules Appendix Hong Kong British National (Overseas)",
        "part": "Immigration Rules Appendix Hong Kong British National (Overseas)",
        "section_id": "AD 1.1",
        "section_title": "Adult Dependent Relative on the Hong Kong British National (Overseas) route",
        "parent_section": null,
        "hierarchy_level": 2,
        "topic": "eligibility",
        "url": "https://www.gov.uk/guidance/immigration-rules/immigration-rules-appendix-hong-kong-british-national-overseas",
        "scraped_at": "2025-12-06T17:27:49.817674"
      },
      "text": "### Adult Dependent Relative on the Hong Kong British National (Overseas) route",
      "summary": "This provision applies to adult dependent relatives seeking entry under the Hong Kong BN(O) route. It requires demonstrating genuine dependency and deserving their claim, with specific criteria for illness, age, or care needs, and exceptions for less serious conditions.",
      "augmented_text": "Document: Immigration Rules Appendix Hong Kong British National (Overseas)\nPart: Immigration Rules Appendix Hong Kong British National (Overseas)\nSection ID: AD 1.1\nSection: Adult Dependent Relative on the Hong Kong British National (Overseas) route\nTopic: eligibility\n\nSummary: This provision applies to adult dependent relatives seeking entry under the Hong Kong BN(O) route. It requires demonstrating genuine dependency and deserving their claim, with specific criteria for illness, age, or care needs, and exceptions for less serious conditions.\n\n### Adult Dependent Relative on the Hong Kong British National (Overseas) route",
      "needs_review": false
    },
    {
      "metadata": {
        "source": "Immigration Rules Appendix Hong Kong British National (Overseas)",
        "part": "Immigration Rules Appendix Hong Kong British National (Overseas)",
        "section_id": "HK 45.1",
        "section_title": "Validity Requirements for a BN(O) Adult Dependant Relative",
        "parent_section": "HK 45",
        "hierarchy_level": 2,
        "topic": "leave-to-enter",
        "url": "https://www.gov.uk/guidance/immigration-rules/immigration-rules-appendix-hong-kong-british-national-overseas",
        "scraped_at": "2025-12-06T17:27:49.817709"
      },
      "text": "### Validity Requirements for a BN(O) Adult Dependant Relative\n\nHK 45.1. A person applying for entry clearance or permission to stay as a BN(O) Adult Dependant Relative on the Hong Kong British National (Overseas) route must apply online on the gov.uk website on the specified form as follows:\n\n| Applicant | Specified form |\n| --- | --- |\n| Applicants with a chipped passport who: - hold a passport which shows they are registered as a British National (Overseas); or - hold a passport issued by the Hong Kong Special Administrative Region; or - are EEA nationals. | Either: • Hong Kong British National (Overseas) Visa using the UK Immigration: ID Check app (when available); or • Hong Kong British National (Overseas) Visa |\n| Other applicants | Hong Kong British National (Overseas) Visa |\n\n1.   HK 45.2. An application for entry clearance or permission to stay as a BN(O) Adult Dependent Relative on the Hong Kong British National (Overseas) route must meet all the following validity requirements: \n    1.   (a) any fee and Immigration Health Charge must have been paid, unless the applicant has been granted a fee waiver; and\n    2.   (b) the applicant must have provided biometrics when required; and\n    3.   (c) the applicant must have provided a passport or other travel document which satisfactorily established their identity and nationality.\n\nHK 45.3. The applicant must be aged 18 years or over on the date of application.\n\n1.   HK 45.4. The applicant must be the parent, grandparent, brother, sister, son or daughter of a person who is: \n    1.   (a) a BN(O) status holder who has entry clearance or permission to stay under the BN(O) Status Holder route or who has made a valid application for such entry clearance or permission to stay; or;\n    2.   (b) the dependent partner (“DP”) of a BN(O) Status Holder, where the DP has entry clearance or permission to stay under the BN(O) Status Holder route or has made a valid application for such entry clearance or permission to stay; or\n    3.   (c) the child of a BN(O) status holder who has entry clearance or permission to stay under the BN(O) Household Member route or who has made a valid application for such entry clearance or permission to stay; or\n    4.   (d) the dependent partner (“DP”) of a child of a BN(O) status holder, where the DP has entry clearance or permission under the BN(O) Household Member route or has made a valid application for such entry clearance or permission to stay; or\n    5.   (e) both a British citizen and a BN(O) status holder.\n\nHK 45.5. An application which does not meet the validity requirements for a BN(O) Adult Dependent Relative on the Hong Kong British National (Overseas) route may be rejected as invalid and not considered.",
      "summary": "Applicants aged 18 or over applying as BN(O) Adult Dependant Relatives must submit online applications using specific forms, pay applicable fees, provide biometrics, and submit valid travel documents. Critical conditions include meeting identity, nationality, and age requirements, with certain form options based on passport type.",
      "augmented_text": "Document: Immigration Rules Appendix Hong Kong British National (Overseas)\nPart: Immigration Rules Appendix Hong Kong British National (Overseas)\nSection ID: HK 45.1\nSection: Validity Requirements for a BN(O) Adult Dependant Relative\nTopic: leave-to-enter\n\nSummary: Applicants aged 18 or over applying as BN(O) Adult Dependant Relatives must submit online applications using specific forms, pay applicable fees, provide biometrics, and submit valid travel documents. Critical conditions include meeting identity, nationality, and age requirements, with certain form options based on passport type.\n\n### Validity Requirements for a BN(O) Adult Dependant Relative\n\nHK 45.1. A person applying for entry clearance or permission to stay as a BN(O) Adult Dependant Relative on the Hong Kong British National (Overseas) route must apply online on the gov.uk website on the specified form as follows:\n\n| Applicant | Specified form |\n| --- | --- |\n| Applicants with a chipped passport who: - hold a passport which shows they are registered as a British National (Overseas); or - hold a passport issued by the Hong Kong Special Administrative Region; or - are EEA nationals. | Either: • Hong Kong British National (Overseas) Visa using the UK Immigration: ID Check app (when available); or • Hong Kong British National (Overseas) Visa |\n| Other applicants | Hong Kong British National (Overseas) Visa |\n\n1.   HK 45.2. An application for entry clearance or permission to stay as a BN(O) Adult Dependent Relative on the Hong Kong British National (Overseas) route must meet all the following validity requirements: \n    1.   (a) any fee and Immigration Health Charge must have been paid, unless the applicant has been granted a fee waiver; and\n    2.   (b) the applicant must have provided biometrics when required; and\n    3.   (c) the applicant must have provided a passport or other travel document which satisfactorily established their identity and nationality.\n\nHK 45.3. The applicant must be aged 18 years or over on the date of application.\n\n1.   HK 45.4. The applicant must be the parent, grandparent, brother, sister, son or daughter of a person who is: \n    1.   (a) a BN(O) status holder who has entry clearance or permission to stay under the BN(O) Status Holder route or who has made a valid application for such entry clearance or permission to stay; or;\n    2.   (b) the dependent partner (“DP”) of a BN(O) Status Holder, where the DP has entry clearance or permission to stay under the BN(O) Status Holder route or has made a valid application for such entry clearance or permission to stay; or\n    3.   (c) the child of a BN(O) status holder who has entry clearance or permission to stay under the BN(O) Household Member route or who has made a valid application for such entry clearance or permission to stay; or\n    4.   (d) the dependent partner (“DP”) of a child of a BN(O) status holder, where the DP has entry clearance or permission under the BN(O) Household Member route or has made a valid application for such entry clearance or permission to stay; or\n    5.   (e) both a British citizen and a BN(O) status holder.\n\nHK 45.5. An application which does not meet the validity requirements for a BN(O) Adult Dependent Relative on the Hong Kong British National (Overseas) route may be rejected as invalid and not considered.",
      "needs_review": false
    },
    {
      "metadata": {
        "source": "Immigration Rules Appendix Hong Kong British National (Overseas)",
        "part": "Immigration Rules Appendix Hong Kong British National (Overseas)",
        "section_id": "HK 46.1",
        "section_title": "Suitability Requirements for a BN(O) Adult Dependent Relative",
        "parent_section": "HK 46",
        "hierarchy_level": 2,
        "topic": "suitability",
        "url": "https://www.gov.uk/guidance/immigration-rules/immigration-rules-appendix-hong-kong-british-national-overseas",
        "scraped_at": "2025-12-06T17:27:49.817730"
      },
      "text": "### Suitability Requirements for a BN(O) Adult Dependent Relative\n\nHK 46.1. The applicant must not fall for refusal under Part Suitability.\n\n1.   HK 46.2. If applying for permission to stay the applicant must not be: \n    1.   (a) in breach of immigration laws, except that where the Exceptions for overstayers section of Part Suitability applies, that period of overstaying will be disregarded; or\n    2.   (b) on immigration bail, except where they have been placed on such bail after making an asylum claim in the UK.",
      "summary": "This provision applies to BN(O) adult dependent relative applicants. They must meet suitability criteria, including not breaching immigration laws or being on bail (unless related to asylum), with exceptions for overstaying as specified.",
      "augmented_text": "Document: Immigration Rules Appendix Hong Kong British National (Overseas)\nPart: Immigration Rules Appendix Hong Kong British National (Overseas)\nSection ID: HK 46.1\nSection: Suitability Requirements for a BN(O) Adult Dependent Relative\nTopic: suitability\n\nSummary: This provision applies to BN(O) adult dependent relative applicants. They must meet suitability criteria, including not breaching immigration laws or being on bail (unless related to asylum), with exceptions for overstaying as specified.\n\n### Suitability Requirements for a BN(O) Adult Dependent Relative\n\nHK 46.1. The applicant must not fall for refusal under Part Suitability.\n\n1.   HK 46.2. If applying for permission to stay the applicant must not be: \n    1.   (a) in breach of immigration laws, except that where the Exceptions for overstayers section of Part Suitability applies, that period of overstaying will be disregarded; or\n    2.   (b) on immigration bail, except where they have been placed on such bail after making an asylum claim in the UK.",
      "needs_review": false
    },
    {
      "metadata": {
        "source": "Immigration Rules Appendix Hong Kong British National (Overseas)",
        "part": "Immigration Rules Appendix Hong Kong British National (Overseas)",
        "section_id": "Eligibility Requirements for a BN(O) Adult Dependent Relative",
        "section_title": "Eligibility Requirements for a BN(O) Adult Dependent Relative",
        "parent_section": null,
        "hierarchy_level": 2,
        "topic": "eligibility",
        "url": "https://www.gov.uk/guidance/immigration-rules/immigration-rules-appendix-hong-kong-british-national-overseas",
        "scraped_at": "2025-12-06T17:27:49.817740"
      },
      "text": "### Eligibility Requirements for a BN(O) Adult Dependent Relative",
      "summary": "This provision applies to BN(O) adult dependent relatives seeking entry. They must demonstrate genuine dependency on the BN(O) visa holder and satisfy health, financial, and relationship criteria, with specific conditions and exceptions outlined for eligibility.",
      "augmented_text": "Document: Immigration Rules Appendix Hong Kong British National (Overseas)\nPart: Immigration Rules Appendix Hong Kong British National (Overseas)\nSection ID: Eligibility Requirements for a BN(O) Adult Dependent Relative\nSection: Eligibility Requirements for a BN(O) Adult Dependent Relative\nTopic: eligibility\n\nSummary: This provision applies to BN(O) adult dependent relatives seeking entry. They must demonstrate genuine dependency on the BN(O) visa holder and satisfy health, financial, and relationship criteria, with specific conditions and exceptions outlined for eligibility.\n\n### Eligibility Requirements for a BN(O) Adult Dependent Relative",
      "needs_review": false
    },
    {
      "metadata": {
        "source": "Immigration Rules Appendix Hong Kong British National (Overseas)",
        "part": "Immigration Rules Appendix Hong Kong British National (Overseas)",
        "section_id": "HK 47.1",
        "section_title": "Entry requirements for a BN(O) Adult Dependent Relative",
        "parent_section": "HK 47",
        "hierarchy_level": 2,
        "topic": "leave-to-enter",
        "url": "https://www.gov.uk/guidance/immigration-rules/immigration-rules-appendix-hong-kong-british-national-overseas",
        "scraped_at": "2025-12-06T17:27:49.817765"
      },
      "text": "### Entry requirements for a BN(O) Adult Dependent Relative\n\nHK 47.1. A person seeking to come to the UK as a BN(O) Adult Dependent Relative on the Hong Kong British National (Overseas) route must apply for and obtain entry clearance as a BN(O) Adult Dependant Relative before they arrive in the UK.\n\nHK 47.2. A person applying for entry clearance as a BN(O) Adult Dependent Relative on the Hong Kong British National (Overseas) route must, if Appendix Tuberculosis applies, provide a valid medical certificate confirming that they have undergone screening for active pulmonary tuberculosis and that this tuberculosis is not present in them.",
      "summary": "Applicants seeking entry to the UK as BN(O) Adult Dependent Relatives must obtain entry clearance beforehand, including a TB screening certificate if applicable; no post-arrival applications are permitted.",
      "augmented_text": "Document: Immigration Rules Appendix Hong Kong British National (Overseas)\nPart: Immigration Rules Appendix Hong Kong British National (Overseas)\nSection ID: HK 47.1\nSection: Entry requirements for a BN(O) Adult Dependent Relative\nTopic: leave-to-enter\n\nSummary: Applicants seeking entry to the UK as BN(O) Adult Dependent Relatives must obtain entry clearance beforehand, including a TB screening certificate if applicable; no post-arrival applications are permitted.\n\n### Entry requirements for a BN(O) Adult Dependent Relative\n\nHK 47.1. A person seeking to come to the UK as a BN(O) Adult Dependent Relative on the Hong Kong British National (Overseas) route must apply for and obtain entry clearance as a BN(O) Adult Dependant Relative before they arrive in the UK.\n\nHK 47.2. A person applying for entry clearance as a BN(O) Adult Dependent Relative on the Hong Kong British National (Overseas) route must, if Appendix Tuberculosis applies, provide a valid medical certificate confirming that they have undergone screening for active pulmonary tuberculosis and that this tuberculosis is not present in them.",
      "needs_review": false
    },
    {
      "metadata": {
        "source": "Immigration Rules Appendix Hong Kong British National (Overseas)",
        "part": "Immigration Rules Appendix Hong Kong British National (Overseas)",
        "section_id": "HK 48.1",
        "section_title": "Relationship requirement for a BN(O) Adult Dependent Relative",
        "parent_section": "HK 48",
        "hierarchy_level": 2,
        "topic": "eligibility",
        "url": "https://www.gov.uk/guidance/immigration-rules/immigration-rules-appendix-hong-kong-british-national-overseas",
        "scraped_at": "2025-12-06T17:27:49.817803"
      },
      "text": "### Relationship requirement for a BN(O) Adult Dependent Relative\n\nHK 48.1. If the applicant is applying for permission to stay and they have permission as a BN(O) Adult Dependent Relative on the Hong Kong British National (Overseas) route on the date of application, they will meet the relationship requirement.\n\n1.   HK 48.2. Where the applicant is applying for entry clearance or permission to stay, and they have not previously had permission on the Hong Kong BN(O) route, they must be the parent, grandparent, brother, sister, son, or daughter of a person who is: \n    1.   (a) a BN(O) status holder who has, or is at the same time being granted, entry clearance or permission to stay under the BN(O) Status Holder route; or\n    2.   (b) the dependent partner (“DP”) of a BN(O) status holder, where the DP has, or is at the same time being granted, entry clearance or permission to stay under the BN(O) Status Holder route; or\n    3.   (c) the child of a BN(O) status holder who has, or is at the same time being granted, entry clearance or permission to stay under the BN(O) Household Member route; or\n    4.   (d) the dependent partner (“DP”) of a child of a BN(O) status holder, where the DP has, or is at the same time being granted, entry clearance or permission under the BN(O) Household Member route; or\n    5.   (e) both a British citizen and a BN(O) status holder.\n\n1.   HK 48.3. Where the applicant is the parent or grandparent of a BN(O) Status Holder or of the partner of a BN(O) Status Holder or of the child of a BN(O) status holder applying on the BN(O) Household Member route or of the partner of a child of a BN(O) status holder applying on the BN(O) Household Member route, the applicant must not be in a subsisting relationship with a partner unless: \n    1.   (a) that partner is also the parent or grandparent of the BN(O) Status Holder or of the partner of a BN(O) Status Holder or of the child of a BN(O) status holder applying on the BN(O) Household Member route or of the partner of a child of a BN(O) status holder applying on the BN(O) Household Member route; and\n    2.   (b) that partner is applying for entry clearance or permission to stay at the same time as the applicant.",
      "summary": "Applicants applying for permission to stay as BN(O) Adult Dependent Relatives must either already hold such permission or be the parent, grandparent, sibling, or child of a BN(O) status holder or their partner, provided the related individual has or is granted BN(O) route status. Exceptions apply if the applicant has prior permission on the BN(O) route.",
      "augmented_text": "Document: Immigration Rules Appendix Hong Kong British National (Overseas)\nPart: Immigration Rules Appendix Hong Kong British National (Overseas)\nSection ID: HK 48.1\nSection: Relationship requirement for a BN(O) Adult Dependent Relative\nTopic: eligibility\n\nSummary: Applicants applying for permission to stay as BN(O) Adult Dependent Relatives must either already hold such permission or be the parent, grandparent, sibling, or child of a BN(O) status holder or their partner, provided the related individual has or is granted BN(O) route status. Exceptions apply if the applicant has prior permission on the BN(O) route.\n\n### Relationship requirement for a BN(O) Adult Dependent Relative\n\nHK 48.1. If the applicant is applying for permission to stay and they have permission as a BN(O) Adult Dependent Relative on the Hong Kong British National (Overseas) route on the date of application, they will meet the relationship requirement.\n\n1.   HK 48.2. Where the applicant is applying for entry clearance or permission to stay, and they have not previously had permission on the Hong Kong BN(O) route, they must be the parent, grandparent, brother, sister, son, or daughter of a person who is: \n    1.   (a) a BN(O) status holder who has, or is at the same time being granted, entry clearance or permission to stay under the BN(O) Status Holder route; or\n    2.   (b) the dependent partner (“DP”) of a BN(O) status holder, where the DP has, or is at the same time being granted, entry clearance or permission to stay under the BN(O) Status Holder route; or\n    3.   (c) the child of a BN(O) status holder who has, or is at the same time being granted, entry clearance or permission to stay under the BN(O) Household Member route; or\n    4.   (d) the dependent partner (“DP”) of a child of a BN(O) status holder, where the DP has, or is at the same time being granted, entry clearance or permission under the BN(O) Household Member route; or\n    5.   (e) both a British citizen and a BN(O) status holder.\n\n1.   HK 48.3. Where the applicant is the parent or grandparent of a BN(O) Status Holder or of the partner of a BN(O) Status Holder or of the child of a BN(O) status holder applying on the BN(O) Household Member route or of the partner of a child of a BN(O) status holder applying on the BN(O) Household Member route, the applicant must not be in a subsisting relationship with a partner unless: \n    1.   (a) that partner is also the parent or grandparent of the BN(O) Status Holder or of the partner of a BN(O) Status Holder or of the child of a BN(O) status holder applying on the BN(O) Household Member route or of the partner of a child of a BN(O) status holder applying on the BN(O) Household Member route; and\n    2.   (b) that partner is applying for entry clearance or permission to stay at the same time as the applicant.",
      "needs_review": false
    },
    {
      "metadata": {
        "source": "Immigration Rules Appendix Hong Kong British National (Overseas)",
        "part": "Immigration Rules Appendix Hong Kong British National (Overseas)",
        "section_id": "HK 49.1",
        "section_title": "Dependency requirement for a BN(O) Adult Dependent Relative",
        "parent_section": "HK 49",
        "hierarchy_level": 2,
        "topic": "dependents",
        "url": "https://www.gov.uk/guidance/immigration-rules/immigration-rules-appendix-hong-kong-british-national-overseas",
        "scraped_at": "2025-12-06T17:27:49.817838"
      },
      "text": "### Dependency requirement for a BN(O) Adult Dependent Relative\n\nHK 49.1. If the applicant is applying for permission to stay and they have permission as a BN(O) Adult Dependent Relative on the Hong Kong British National (Overseas) route on the date of application, they will meet the dependency requirement.\n\n1.   HK 49.2 Where the applicant is applying for entry clearance or permission to stay, and they have not previously had permission on the Hong Kong BN(O) route the applicant must: \n    1.   (a) as a result of age, illness or disability require long-term personal care to perform everyday tasks; and\n    2.   (b) DELETED\n    3.   (c) be unable, even with the practical and financial help of the BN(O) Status Holder or the partner of the BN(O) Status Holder or the BN(O) Household Member or the partner of the BN(O) Household Member, to obtain the required level of help in Hong Kong, if the BN(O) Status Holder or the partner of the BN(O) Status Holder or the BN(O) Household Member or the partner of the BN(O) Household Member moves to the UK, either because the help: \n        1.   (i) is not available, and there is no person in Hong Kong who can reasonably provide it; or\n        2.   (ii) is not affordable.\n\nHK 49.3 DELETED.\n\n1.   HK 49.4. Where the applicant and their partner are the parents or grandparents of the BN(O) Status Holder, or of the partner of the BN(O) Status Holder, or of the BN(O) Household Member, or of the partner of the BN(O) Household Member, the applicant, or their partner, must: \n    1.   (a) as a result of age, illness or disability require long-term personal care to perform everyday tasks; and\n    2.   (b) be unable, even with the practical and financial help of the BN(O) Status Holder or the partner of the BN(O) Status Holder or the BN(O) Household Member or the partner of the BN(O) Household Member, to obtain the required level of help in Hong Kong if the BN(O) Status Holder or the partner of the BN(O) Status Holder or the BN(O) Household Member or the partner of the BN(O) Household Member moves to the UK either because the help: \n        1.   (i) is not available and there is no person in Hong Kong who can reasonably provide it; or\n        2.   (ii) is not affordable.",
      "summary": "This provision applies to BN(O) adult dependent relatives seeking permission to stay or entry clearance. They must demonstrate long-term need for personal care due to age, illness, or disability, and an inability to access necessary help in Hong Kong if the BN(O) status holder or household member moves to the UK. Exceptions apply if relevant help is unavailable or unaffordable.",
      "augmented_text": "Document: Immigration Rules Appendix Hong Kong British National (Overseas)\nPart: Immigration Rules Appendix Hong Kong British National (Overseas)\nSection ID: HK 49.1\nSection: Dependency requirement for a BN(O) Adult Dependent Relative\nTopic: dependents\n\nSummary: This provision applies to BN(O) adult dependent relatives seeking permission to stay or entry clearance. They must demonstrate long-term need for personal care due to age, illness, or disability, and an inability to access necessary help in Hong Kong if the BN(O) status holder or household member moves to the UK. Exceptions apply if relevant help is unavailable or unaffordable.\n\n### Dependency requirement for a BN(O) Adult Dependent Relative\n\nHK 49.1. If the applicant is applying for permission to stay and they have permission as a BN(O) Adult Dependent Relative on the Hong Kong British National (Overseas) route on the date of application, they will meet the dependency requirement.\n\n1.   HK 49.2 Where the applicant is applying for entry clearance or permission to stay, and they have not previously had permission on the Hong Kong BN(O) route the applicant must: \n    1.   (a) as a result of age, illness or disability require long-term personal care to perform everyday tasks; and\n    2.   (b) DELETED\n    3.   (c) be unable, even with the practical and financial help of the BN(O) Status Holder or the partner of the BN(O) Status Holder or the BN(O) Household Member or the partner of the BN(O) Household Member, to obtain the required level of help in Hong Kong, if the BN(O) Status Holder or the partner of the BN(O) Status Holder or the BN(O) Household Member or the partner of the BN(O) Household Member moves to the UK, either because the help: \n        1.   (i) is not available, and there is no person in Hong Kong who can reasonably provide it; or\n        2.   (ii) is not affordable.\n\nHK 49.3 DELETED.\n\n1.   HK 49.4. Where the applicant and their partner are the parents or grandparents of the BN(O) Status Holder, or of the partner of the BN(O) Status Holder, or of the BN(O) Household Member, or of the partner of the BN(O) Household Member, the applicant, or their partner, must: \n    1.   (a) as a result of age, illness or disability require long-term personal care to perform everyday tasks; and\n    2.   (b) be unable, even with the practical and financial help of the BN(O) Status Holder or the partner of the BN(O) Status Holder or the BN(O) Household Member or the partner of the BN(O) Household Member, to obtain the required level of help in Hong Kong if the BN(O) Status Holder or the partner of the BN(O) Status Holder or the BN(O) Household Member or the partner of the BN(O) Household Member moves to the UK either because the help: \n        1.   (i) is not available and there is no person in Hong Kong who can reasonably provide it; or\n        2.   (ii) is not affordable.",
      "needs_review": false
    },
    {
      "metadata": {
        "source": "Immigration Rules Appendix Hong Kong British National (Overseas)",
        "part": "Immigration Rules Appendix Hong Kong British National (Overseas)",
        "section_id": "HK 50.1",
        "section_title": "Financial requirement for a BN(O) Adult Dependent Relative",
        "parent_section": "HK 50",
        "hierarchy_level": 2,
        "topic": "financial",
        "url": "https://www.gov.uk/guidance/immigration-rules/immigration-rules-appendix-hong-kong-british-national-overseas",
        "scraped_at": "2025-12-06T17:27:49.817858"
      },
      "text": "### Financial requirement for a BN(O) Adult Dependent Relative\n\nHK 50.1. If the applicant is applying for permission to stay and has been living in the UK with permission for 12 months or more on the date of application, they will meet the financial requirement unless the applicant’s previous grant of permission was for 12 months Leave Outside the Rules following an unsuccessful application for the Hong Kong British National (Overseas) route.\n\nHK 50.2. If the BN(O) Adult Dependent Relative is applying for entry clearance, or is applying for permission to stay and has been in the UK for less than 12 months on the date of application, or where the applicant’s previous grant of permission was for 12 months Leave Outside the Rules following an unsuccessful application for the Hong Kong British National (Overseas) route, the decision maker must be satisfied that the BN(O) Status Holder or their partner or the BN(O) Household Member or their partner is able to and will maintain and accommodate the BN(O) Adult Dependent Relative adequately in the UK without recourse to public funds for at least 6 months.\n\n1.   HK 50.3 For the purposes of HK 50.2. accommodation will not be regarded as adequate if: \n    1.   (a) it is or will be overcrowded; or\n    2.   (b) it contravenes public health regulations.\n\nHK 50.4. The BN(O) Status Holder or their partner or the BN(O) Household Member or their partner may rely on credible promises of future third party support.\n\nHK 50.5. The BN(O) Status Holder or their partner or the BN(O) Household Member or their partner must show that they have the required funds as specified in Appendix Finance.",
      "summary": "This provision applies to BN(O) Adult Dependent Relatives seeking permission to stay or entry clearance. They must demonstrate they can maintain and accommodate themselves in the UK without public funds for six months, except if they've lived in the UK for 12+ months on permission. Adequate accommodation must not be overcrowded or violate health standards.",
      "augmented_text": "Document: Immigration Rules Appendix Hong Kong British National (Overseas)\nPart: Immigration Rules Appendix Hong Kong British National (Overseas)\nSection ID: HK 50.1\nSection: Financial requirement for a BN(O) Adult Dependent Relative\nTopic: financial\n\nSummary: This provision applies to BN(O) Adult Dependent Relatives seeking permission to stay or entry clearance. They must demonstrate they can maintain and accommodate themselves in the UK without public funds for six months, except if they've lived in the UK for 12+ months on permission. Adequate accommodation must not be overcrowded or violate health standards.\n\n### Financial requirement for a BN(O) Adult Dependent Relative\n\nHK 50.1. If the applicant is applying for permission to stay and has been living in the UK with permission for 12 months or more on the date of application, they will meet the financial requirement unless the applicant’s previous grant of permission was for 12 months Leave Outside the Rules following an unsuccessful application for the Hong Kong British National (Overseas) route.\n\nHK 50.2. If the BN(O) Adult Dependent Relative is applying for entry clearance, or is applying for permission to stay and has been in the UK for less than 12 months on the date of application, or where the applicant’s previous grant of permission was for 12 months Leave Outside the Rules following an unsuccessful application for the Hong Kong British National (Overseas) route, the decision maker must be satisfied that the BN(O) Status Holder or their partner or the BN(O) Household Member or their partner is able to and will maintain and accommodate the BN(O) Adult Dependent Relative adequately in the UK without recourse to public funds for at least 6 months.\n\n1.   HK 50.3 For the purposes of HK 50.2. accommodation will not be regarded as adequate if: \n    1.   (a) it is or will be overcrowded; or\n    2.   (b) it contravenes public health regulations.\n\nHK 50.4. The BN(O) Status Holder or their partner or the BN(O) Household Member or their partner may rely on credible promises of future third party support.\n\nHK 50.5. The BN(O) Status Holder or their partner or the BN(O) Household Member or their partner must show that they have the required funds as specified in Appendix Finance.",
      "needs_review": false
    },
    {
      "metadata": {
        "source": "Immigration Rules Appendix Hong Kong British National (Overseas)",
        "part": "Immigration Rules Appendix Hong Kong British National (Overseas)",
        "section_id": "HK 51.1",
        "section_title": "Ordinary residence in Hong Kong requirement for a BN(O) Adult Dependent Relative",
        "parent_section": "HK 51",
        "hierarchy_level": 2,
        "topic": "leave-to-enter",
        "url": "https://www.gov.uk/guidance/immigration-rules/immigration-rules-appendix-hong-kong-british-national-overseas",
        "scraped_at": "2025-12-06T17:27:49.817884"
      },
      "text": "### Ordinary residence in Hong Kong requirement for a BN(O) Adult Dependent Relative\n\nHK 51.1. If the applicant is applying for entry clearance as a BN(O) Adult Dependent Relative the applicant must be ordinarily resident in Hong Kong on the date of application.\n\nHK 51.2. An applicant applying for permission to stay must be in the UK and must be ordinarily resident in the UK, the Bailiwick of Guernsey, Bailiwick of Jersey, the Isle of Man or Hong Kong on the date of application.",
      "summary": "Applicants for BN(O) Adult Dependent Relative visas must be ordinarily resident in Hong Kong at the application date for entry clearance, while those seeking permission to stay must be in the UK or specified Crown dependencies and also generally be ordinarily resident there.",
      "augmented_text": "Document: Immigration Rules Appendix Hong Kong British National (Overseas)\nPart: Immigration Rules Appendix Hong Kong British National (Overseas)\nSection ID: HK 51.1\nSection: Ordinary residence in Hong Kong requirement for a BN(O) Adult Dependent Relative\nTopic: leave-to-enter\n\nSummary: Applicants for BN(O) Adult Dependent Relative visas must be ordinarily resident in Hong Kong at the application date for entry clearance, while those seeking permission to stay must be in the UK or specified Crown dependencies and also generally be ordinarily resident there.\n\n### Ordinary residence in Hong Kong requirement for a BN(O) Adult Dependent Relative\n\nHK 51.1. If the applicant is applying for entry clearance as a BN(O) Adult Dependent Relative the applicant must be ordinarily resident in Hong Kong on the date of application.\n\nHK 51.2. An applicant applying for permission to stay must be in the UK and must be ordinarily resident in the UK, the Bailiwick of Guernsey, Bailiwick of Jersey, the Isle of Man or Hong Kong on the date of application.",
      "needs_review": false
    },
    {
      "metadata": {
        "source": "Immigration Rules Appendix Hong Kong British National (Overseas)",
        "part": "Immigration Rules Appendix Hong Kong British National (Overseas)",
        "section_id": "HK 52.1",
        "section_title": "In-country tuberculosis certificate requirement for a BN(O) Adult Dependent Relative",
        "parent_section": null,
        "hierarchy_level": 1,
        "topic": "health",
        "url": "https://www.gov.uk/guidance/immigration-rules/immigration-rules-appendix-hong-kong-british-national-overseas",
        "scraped_at": "2025-12-06T17:27:49.817919"
      },
      "text": "### In-country tuberculosis certificate requirement for a BN(O) Adult Dependent Relative\n\n1.   HK 52.1. If the applicant is applying for permission to stay and: \n    1.   (a) their last grant of permission was for 6 months or less; and\n    2.   (b) the applicant was present in a country listed in Appendix Tuberculosis of these rules for more than six months immediately prior to their last grant of permission,\n\n2.   the applicant must provide a valid medical certificate confirming that they have undergone screening for active pulmonary tuberculosis and that this tuberculosis is not present in them.\n\nHK 52.2. In HK 52.1. a valid medical certificate is a certificate from an approved centre issued within the 6 months immediately before the date of application.\n\nHK 52.3. The in-country tuberculosis requirement is met where the applicant provided a medical certificate described in HK 52.1. as part of a successful application for entry clearance in the 12 months before the date of application.\n\nHK 52.4. The list of approved centres in the UK, updated from time to time, can be found at: [https://www.gov.uk/government/publications/uk-tuberculosis-test-clinics-for-hong-kong-bno](https://www.gov.uk/government/publications/uk-tuberculosis-test-clinics-for-hong-kong-bno).",
      "summary": "BN(O) Adult Dependent Relatives must provide a recent (within 6 months) TB screening certificate if their last permission was ≤6 months and they previously stayed in a listed country for over six months. The certificate must be from an approved centre and submitted within 12 months of applying. Exceptions apply if prior entry clearance included such certification within the past year.",
      "augmented_text": "Document: Immigration Rules Appendix Hong Kong British National (Overseas)\nPart: Immigration Rules Appendix Hong Kong British National (Overseas)\nSection ID: HK 52.1\nSection: In-country tuberculosis certificate requirement for a BN(O) Adult Dependent Relative\nTopic: health\n\nSummary: BN(O) Adult Dependent Relatives must provide a recent (within 6 months) TB screening certificate if their last permission was ≤6 months and they previously stayed in a listed country for over six months. The certificate must be from an approved centre and submitted within 12 months of applying. Exceptions apply if prior entry clearance included such certification within the past year.\n\n### In-country tuberculosis certificate requirement for a BN(O) Adult Dependent Relative\n\n1.   HK 52.1. If the applicant is applying for permission to stay and: \n    1.   (a) their last grant of permission was for 6 months or less; and\n    2.   (b) the applicant was present in a country listed in Appendix Tuberculosis of these rules for more than six months immediately prior to their last grant of permission,\n\n2.   the applicant must provide a valid medical certificate confirming that they have undergone screening for active pulmonary tuberculosis and that this tuberculosis is not present in them.\n\nHK 52.2. In HK 52.1. a valid medical certificate is a certificate from an approved centre issued within the 6 months immediately before the date of application.\n\nHK 52.3. The in-country tuberculosis requirement is met where the applicant provided a medical certificate described in HK 52.1. as part of a successful application for entry clearance in the 12 months before the date of application.\n\nHK 52.4. The list of approved centres in the UK, updated from time to time, can be found at: [https://www.gov.uk/government/publications/uk-tuberculosis-test-clinics-for-hong-kong-bno](https://www.gov.uk/government/publications/uk-tuberculosis-test-clinics-for-hong-kong-bno).",
      "needs_review": false
    },
    {
      "metadata": {
        "source": "Immigration Rules Appendix Hong Kong British National (Overseas)",
        "part": "Immigration Rules Appendix Hong Kong British National (Overseas)",
        "section_id": "HK 53.1",
        "section_title": "Decision on an application as a BN(O) Adult Dependent Relative",
        "parent_section": "HK 53",
        "hierarchy_level": 2,
        "topic": "eligibility",
        "url": "https://www.gov.uk/guidance/immigration-rules/immigration-rules-appendix-hong-kong-british-national-overseas",
        "scraped_at": "2025-12-06T17:27:49.817932"
      },
      "text": "### Decision on an application as a BN(O) Adult Dependent Relative\n\nHK 53.1. If the decision maker is satisfied that all the suitability and eligibility requirements for a BN(O) Adult Dependent Relative are met the application will be granted, otherwise the application will be refused.\n\nHK 53.2. If the application is refused the person can apply for an Administrative Review under Appendix AR: Administrative Review.",
      "summary": "This provision applies to BN(O) Adult Dependent Relative applications, requiring the decision-maker to verify eligibility and suitability. Applications are granted if requirements are met; otherwise, they are refused, with applicants entitled to a subsequent Administrative Review.",
      "augmented_text": "Document: Immigration Rules Appendix Hong Kong British National (Overseas)\nPart: Immigration Rules Appendix Hong Kong British National (Overseas)\nSection ID: HK 53.1\nSection: Decision on an application as a BN(O) Adult Dependent Relative\nTopic: eligibility\n\nSummary: This provision applies to BN(O) Adult Dependent Relative applications, requiring the decision-maker to verify eligibility and suitability. Applications are granted if requirements are met; otherwise, they are refused, with applicants entitled to a subsequent Administrative Review.\n\n### Decision on an application as a BN(O) Adult Dependent Relative\n\nHK 53.1. If the decision maker is satisfied that all the suitability and eligibility requirements for a BN(O) Adult Dependent Relative are met the application will be granted, otherwise the application will be refused.\n\nHK 53.2. If the application is refused the person can apply for an Administrative Review under Appendix AR: Administrative Review.",
      "needs_review": false
    },
    {
      "metadata": {
        "source": "Immigration Rules Appendix Hong Kong British National (Overseas)",
        "part": "Immigration Rules Appendix Hong Kong British National (Overseas)",
        "section_id": "HK 54.1",
        "section_title": "Period of grant for a BN(O) Adult Dependent Relative",
        "parent_section": null,
        "hierarchy_level": 1,
        "topic": "duration",
        "url": "https://www.gov.uk/guidance/immigration-rules/immigration-rules-appendix-hong-kong-british-national-overseas",
        "scraped_at": "2025-12-06T17:27:49.817964"
      },
      "text": "### Period of grant for a BN(O) Adult Dependent Relative\n\n1.   HK 54.1. The BN(O) Adult Dependent Relative will be granted permission for either: \n    1.   (a) a period of 30 months (plus, where the applicant has extant permission under the Hong Kong BN(O) Route, the remaining period of that permission, up to a maximum of 28 days) where they have applied for a period of 30 months; or\n    2.   (b) 5 years, if they have applied for a period of 5 years.\n\nHK 54.2. DELETED.",
      "summary": "BN(O) Adult Dependent Relatives applying under the Hong Kong BN(O) route are granted either 30 months (plus remaining permission if applicable) or 5 years, depending on their application. The exact period depends on the original application, with specific caps on remaining permission when applying for 30 months.",
      "augmented_text": "Document: Immigration Rules Appendix Hong Kong British National (Overseas)\nPart: Immigration Rules Appendix Hong Kong British National (Overseas)\nSection ID: HK 54.1\nSection: Period of grant for a BN(O) Adult Dependent Relative\nTopic: duration\n\nSummary: BN(O) Adult Dependent Relatives applying under the Hong Kong BN(O) route are granted either 30 months (plus remaining permission if applicable) or 5 years, depending on their application. The exact period depends on the original application, with specific caps on remaining permission when applying for 30 months.\n\n### Period of grant for a BN(O) Adult Dependent Relative\n\n1.   HK 54.1. The BN(O) Adult Dependent Relative will be granted permission for either: \n    1.   (a) a period of 30 months (plus, where the applicant has extant permission under the Hong Kong BN(O) Route, the remaining period of that permission, up to a maximum of 28 days) where they have applied for a period of 30 months; or\n    2.   (b) 5 years, if they have applied for a period of 5 years.\n\nHK 54.2. DELETED.",
      "needs_review": false
    },
    {
      "metadata": {
        "source": "Immigration Rules Appendix Hong Kong British National (Overseas)",
        "part": "Immigration Rules Appendix Hong Kong British National (Overseas)",
        "section_id": "1",
        "section_title": "Conditions of grant for a BN(O) Adult Dependent Relative",
        "parent_section": null,
        "hierarchy_level": 1,
        "topic": "financial",
        "url": "https://www.gov.uk/guidance/immigration-rules/immigration-rules-appendix-hong-kong-british-national-overseas",
        "scraped_at": "2025-12-06T17:27:49.817979"
      },
      "text": "### Conditions of grant for a BN(O) Adult Dependent Relative\n\n1.   HK 54.3. The grant will be subject to all the following conditions: \n    1.   (a) no access to public funds; and\n    2.   (b) work (including self-employment and voluntary work) permitted except for employment as a professional sportsperson, including as a sports coach; and\n    3.   (c) study is permitted, subject to the ATAS condition in Appendix ATAS.\n    4.   (d) DELETED.",
      "summary": "This provision applies to BN(O) Adult Dependent Relatives granted entry. They must not access public funds, are allowed to work (excluding professional sports roles), and can study with ATAS clearance. These conditions are mandatory for the grant.",
      "augmented_text": "Document: Immigration Rules Appendix Hong Kong British National (Overseas)\nPart: Immigration Rules Appendix Hong Kong British National (Overseas)\nSection ID: 1\nSection: Conditions of grant for a BN(O) Adult Dependent Relative\nTopic: financial\n\nSummary: This provision applies to BN(O) Adult Dependent Relatives granted entry. They must not access public funds, are allowed to work (excluding professional sports roles), and can study with ATAS clearance. These conditions are mandatory for the grant.\n\n### Conditions of grant for a BN(O) Adult Dependent Relative\n\n1.   HK 54.3. The grant will be subject to all the following conditions: \n    1.   (a) no access to public funds; and\n    2.   (b) work (including self-employment and voluntary work) permitted except for employment as a professional sportsperson, including as a sports coach; and\n    3.   (c) study is permitted, subject to the ATAS condition in Appendix ATAS.\n    4.   (d) DELETED.",
      "needs_review": false
    },
    {
      "metadata": {
        "source": "Immigration Rules Appendix Hong Kong British National (Overseas)",
        "part": "Immigration Rules Appendix Hong Kong British National (Overseas)",
        "section_id": "Settlement on the Hong Kong BN(O) route",
        "section_title": "Settlement on the Hong Kong BN(O) route",
        "parent_section": null,
        "hierarchy_level": 2,
        "topic": "settlement",
        "url": "https://www.gov.uk/guidance/immigration-rules/immigration-rules-appendix-hong-kong-british-national-overseas",
        "scraped_at": "2025-12-06T17:27:49.817995"
      },
      "text": "### Settlement on the Hong Kong BN(O) route",
      "summary": "This provision applies to BN(O) visa holders applying for settlement in the UK. They must meet specified residence and character requirements, with exceptions or thresholds outlined for eligibility.",
      "augmented_text": "Document: Immigration Rules Appendix Hong Kong British National (Overseas)\nPart: Immigration Rules Appendix Hong Kong British National (Overseas)\nSection ID: Settlement on the Hong Kong BN(O) route\nSection: Settlement on the Hong Kong BN(O) route\nTopic: settlement\n\nSummary: This provision applies to BN(O) visa holders applying for settlement in the UK. They must meet specified residence and character requirements, with exceptions or thresholds outlined for eligibility.\n\n### Settlement on the Hong Kong BN(O) route",
      "needs_review": true,
      "review_reasons": [
        "generic_summary"
      ]
    },
    {
      "metadata": {
        "source": "Immigration Rules Appendix Hong Kong British National (Overseas)",
        "part": "Immigration Rules Appendix Hong Kong British National (Overseas)",
        "section_id": "HK 55.1",
        "section_title": "Validity requirements for Settlement on the Hong Kong BN(O) route",
        "parent_section": "HK 55",
        "hierarchy_level": 2,
        "topic": "settlement",
        "url": "https://www.gov.uk/guidance/immigration-rules/immigration-rules-appendix-hong-kong-british-national-overseas",
        "scraped_at": "2025-12-06T17:27:49.818031"
      },
      "text": "### Validity requirements for Settlement on the Hong Kong BN(O) route\n\nHK 55.1. A person applying for settlement on the Hong Kong BN(O) route must apply online on the gov.uk website on the specified form as follows:\n\n| Applicant | Specified form |\n| --- | --- |\n| − All applicants | • Set (O) form |\n\n1.   HK 55.2. An application for settlement on the Hong Kong BN(O) route must meet all the following requirements: \n    1.   (a) any fee must have been paid; and\n    2.   (b) the applicant must have provided biometrics when required; and\n    3.   (c) the applicant must have provided a passport or other travel document which satisfactorily establishes their identity and nationality;\n    4.   (d) the applicant must have, or have last had, permission on the Hong Kong BN(O) route; and\n    5.   (e) the applicant must be in the UK.\n\nHK 55.3. An application which does not meet the validity requirements for settlement on the BN(O) route may be rejected as invalid and not considered.",
      "summary": "This provision applies to applicants seeking settlement via the Hong Kong BN(O) route. They must submit an online Set (O) form, pay fees, provide biometrics and a valid travel document, have current or previous BN(O) route permission, and be in the UK. Applications failing these conditions may be rejected as invalid.",
      "augmented_text": "Document: Immigration Rules Appendix Hong Kong British National (Overseas)\nPart: Immigration Rules Appendix Hong Kong British National (Overseas)\nSection ID: HK 55.1\nSection: Validity requirements for Settlement on the Hong Kong BN(O) route\nTopic: settlement\n\nSummary: This provision applies to applicants seeking settlement via the Hong Kong BN(O) route. They must submit an online Set (O) form, pay fees, provide biometrics and a valid travel document, have current or previous BN(O) route permission, and be in the UK. Applications failing these conditions may be rejected as invalid.\n\n### Validity requirements for Settlement on the Hong Kong BN(O) route\n\nHK 55.1. A person applying for settlement on the Hong Kong BN(O) route must apply online on the gov.uk website on the specified form as follows:\n\n| Applicant | Specified form |\n| --- | --- |\n| − All applicants | • Set (O) form |\n\n1.   HK 55.2. An application for settlement on the Hong Kong BN(O) route must meet all the following requirements: \n    1.   (a) any fee must have been paid; and\n    2.   (b) the applicant must have provided biometrics when required; and\n    3.   (c) the applicant must have provided a passport or other travel document which satisfactorily establishes their identity and nationality;\n    4.   (d) the applicant must have, or have last had, permission on the Hong Kong BN(O) route; and\n    5.   (e) the applicant must be in the UK.\n\nHK 55.3. An application which does not meet the validity requirements for settlement on the BN(O) route may be rejected as invalid and not considered.",
      "needs_review": false
    },
    {
      "metadata": {
        "source": "Immigration Rules Appendix Hong Kong British National (Overseas)",
        "part": "Immigration Rules Appendix Hong Kong British National (Overseas)",
        "section_id": "HK 56.1",
        "section_title": "Suitability requirements for settlement on the Hong Kong BN(O) route",
        "parent_section": "HK 56",
        "hierarchy_level": 2,
        "topic": "suitability",
        "url": "https://www.gov.uk/guidance/immigration-rules/immigration-rules-appendix-hong-kong-british-national-overseas",
        "scraped_at": "2025-12-06T17:27:49.818052"
      },
      "text": "### Suitability requirements for settlement on the Hong Kong BN(O) route\n\nHK 56.1. The applicant must not fall for refusal under Part Suitability.\n\n1.   HK 56.2 The applicant must not be: \n    1.   (a) in breach of immigration laws, except that where the Exceptions for overstayers section of Part Suitability applies, that period of overstaying will be disregarded; or\n    2.   (b) on immigration bail, except where they have been placed on such bail after making an asylum claim in the UK.",
      "summary": "Applicants seeking settlement under the Hong Kong BN(O) route must meet suitability criteria, including not breaching immigration laws (with certain overstaying exceptions) or being on immigration bail (except for those involved in asylum cases).",
      "augmented_text": "Document: Immigration Rules Appendix Hong Kong British National (Overseas)\nPart: Immigration Rules Appendix Hong Kong British National (Overseas)\nSection ID: HK 56.1\nSection: Suitability requirements for settlement on the Hong Kong BN(O) route\nTopic: suitability\n\nSummary: Applicants seeking settlement under the Hong Kong BN(O) route must meet suitability criteria, including not breaching immigration laws (with certain overstaying exceptions) or being on immigration bail (except for those involved in asylum cases).\n\n### Suitability requirements for settlement on the Hong Kong BN(O) route\n\nHK 56.1. The applicant must not fall for refusal under Part Suitability.\n\n1.   HK 56.2 The applicant must not be: \n    1.   (a) in breach of immigration laws, except that where the Exceptions for overstayers section of Part Suitability applies, that period of overstaying will be disregarded; or\n    2.   (b) on immigration bail, except where they have been placed on such bail after making an asylum claim in the UK.",
      "needs_review": false
    },
    {
      "metadata": {
        "source": "Immigration Rules Appendix Hong Kong British National (Overseas)",
        "part": "Immigration Rules Appendix Hong Kong British National (Overseas)",
        "section_id": "Eligibility Requirements for Settlement on the Hong Kong BN(O) route",
        "section_title": "Eligibility Requirements for Settlement on the Hong Kong BN(O) route",
        "parent_section": null,
        "hierarchy_level": 2,
        "topic": "eligibility",
        "url": "https://www.gov.uk/guidance/immigration-rules/immigration-rules-appendix-hong-kong-british-national-overseas",
        "scraped_at": "2025-12-06T17:27:49.818061"
      },
      "text": "### Eligibility Requirements for Settlement on the Hong Kong BN(O) route",
      "summary": "This provision applies to BN(O) visa holders seeking settlement in the UK. It requires applicants to meet continuous residence, and good character criteria, with specific thresholds for time spent in the UK; exceptions apply for certain absences.",
      "augmented_text": "Document: Immigration Rules Appendix Hong Kong British National (Overseas)\nPart: Immigration Rules Appendix Hong Kong British National (Overseas)\nSection ID: Eligibility Requirements for Settlement on the Hong Kong BN(O) route\nSection: Eligibility Requirements for Settlement on the Hong Kong BN(O) route\nTopic: eligibility\n\nSummary: This provision applies to BN(O) visa holders seeking settlement in the UK. It requires applicants to meet continuous residence, and good character criteria, with specific thresholds for time spent in the UK; exceptions apply for certain absences.\n\n### Eligibility Requirements for Settlement on the Hong Kong BN(O) route",
      "needs_review": false
    },
    {
      "metadata": {
        "source": "Immigration Rules Appendix Hong Kong British National (Overseas)",
        "part": "Immigration Rules Appendix Hong Kong British National (Overseas)",
        "section_id": "HK 57.1",
        "section_title": "Relationship requirement for settlement as a dependent child on the Hong Kong BN(O) route",
        "parent_section": "HK 57",
        "hierarchy_level": 2,
        "topic": "settlement",
        "url": "https://www.gov.uk/guidance/immigration-rules/immigration-rules-appendix-hong-kong-british-national-overseas",
        "scraped_at": "2025-12-06T17:27:49.818090"
      },
      "text": "### Relationship requirement for settlement as a dependent child on the Hong Kong BN(O) route\n\nHK 57.1. Where the applicant is under 18 on the date of application the additional requirements in HK 57.2. to HK 57.4. must be met.\n\nHK 57.2. The applicant must have last been granted permission as a dependent child on the Hong Kong BN(O) route.\n\n1.   HK 57.3 The applicant’s parent must: \n    1.   (a) at the same time, be being granted settlement on the Hong Kong BN(O) route; or\n    2.   (b) be settled or a British citizen.\n\n2.   HK 57.4. The applicant’s other parent (who is not the parent in HK 57.3.) must be being granted settlement at the same time, or be settled or a British citizen, unless: \n    1.   (a) the parent in HK 57.3. is the applicant’s sole surviving parent; or\n    2.   (b) the parent in HK 57.3. has sole responsibility for the applicant’s upbringing; or\n    3.   (c) the decision maker is satisfied that there are serious and compelling reasons to grant the applicant settlement.",
      "summary": "This provision applies to applicants under 18 seeking settlement as dependents on the Hong Kong BN(O) route. They must have last been granted permission as a dependent child, with their parent(s) either being granted or settled in the UK, or British citizens, unless specific exceptional conditions apply. Key exceptions include sole surviving parent status, sole responsibility, or compelling reasons to grant settlement.",
      "augmented_text": "Document: Immigration Rules Appendix Hong Kong British National (Overseas)\nPart: Immigration Rules Appendix Hong Kong British National (Overseas)\nSection ID: HK 57.1\nSection: Relationship requirement for settlement as a dependent child on the Hong Kong BN(O) route\nTopic: settlement\n\nSummary: This provision applies to applicants under 18 seeking settlement as dependents on the Hong Kong BN(O) route. They must have last been granted permission as a dependent child, with their parent(s) either being granted or settled in the UK, or British citizens, unless specific exceptional conditions apply. Key exceptions include sole surviving parent status, sole responsibility, or compelling reasons to grant settlement.\n\n### Relationship requirement for settlement as a dependent child on the Hong Kong BN(O) route\n\nHK 57.1. Where the applicant is under 18 on the date of application the additional requirements in HK 57.2. to HK 57.4. must be met.\n\nHK 57.2. The applicant must have last been granted permission as a dependent child on the Hong Kong BN(O) route.\n\n1.   HK 57.3 The applicant’s parent must: \n    1.   (a) at the same time, be being granted settlement on the Hong Kong BN(O) route; or\n    2.   (b) be settled or a British citizen.\n\n2.   HK 57.4. The applicant’s other parent (who is not the parent in HK 57.3.) must be being granted settlement at the same time, or be settled or a British citizen, unless: \n    1.   (a) the parent in HK 57.3. is the applicant’s sole surviving parent; or\n    2.   (b) the parent in HK 57.3. has sole responsibility for the applicant’s upbringing; or\n    3.   (c) the decision maker is satisfied that there are serious and compelling reasons to grant the applicant settlement.",
      "needs_review": false
    },
    {
      "metadata": {
        "source": "Immigration Rules Appendix Hong Kong British National (Overseas)",
        "part": "Immigration Rules Appendix Hong Kong British National (Overseas)",
        "section_id": "HK 58.1",
        "section_title": "Care requirement for settlement as a dependent child on the Hong Kong BN(O) route",
        "parent_section": "HK 58",
        "hierarchy_level": 2,
        "topic": "settlement",
        "url": "https://www.gov.uk/guidance/immigration-rules/immigration-rules-appendix-hong-kong-british-national-overseas",
        "scraped_at": "2025-12-06T17:27:49.818115"
      },
      "text": "### Care requirement for settlement as a dependent child on the Hong Kong BN(O) route\n\nHK 58.1. The applicant must meet the Care Requirement for a dependent child in Appendix Children.",
      "summary": "This provision applies to dependent children applying for settlement via the Hong Kong BN(O) route. Applicants must satisfy the Care Requirement specified in Appendix Children, with no explicit exceptions noted.",
      "augmented_text": "Document: Immigration Rules Appendix Hong Kong British National (Overseas)\nPart: Immigration Rules Appendix Hong Kong British National (Overseas)\nSection ID: HK 58.1\nSection: Care requirement for settlement as a dependent child on the Hong Kong BN(O) route\nTopic: settlement\n\nSummary: This provision applies to dependent children applying for settlement via the Hong Kong BN(O) route. Applicants must satisfy the Care Requirement specified in Appendix Children, with no explicit exceptions noted.\n\n### Care requirement for settlement as a dependent child on the Hong Kong BN(O) route\n\nHK 58.1. The applicant must meet the Care Requirement for a dependent child in Appendix Children.",
      "needs_review": false
    },
    {
      "metadata": {
        "source": "Immigration Rules Appendix Hong Kong British National (Overseas)",
        "part": "Immigration Rules Appendix Hong Kong British National (Overseas)",
        "section_id": "1",
        "section_title": "Relationship requirement for settlement as an adult dependant relative on the Hong Kong BN(O) route",
        "parent_section": null,
        "hierarchy_level": 1,
        "topic": "settlement",
        "url": "https://www.gov.uk/guidance/immigration-rules/immigration-rules-appendix-hong-kong-british-national-overseas",
        "scraped_at": "2025-12-06T17:27:49.818143"
      },
      "text": "### Relationship requirement for settlement as an adult dependant relative on the Hong Kong BN(O) route\n\n1.   HK 59.1. Where the applicant has or last had permission as an adult dependant relative on the Hong Kong BN(O) route, they must be the parent, grandparent, brother, sister, son or daughter of a person who: \n    1.   (a) last had permission as a BN(O) Status Holder or the partner of a BN(O) Status Holder or the BN(O) Household Member or the partner of the BN(O) Household Member and who is at the same time being granted settlement on the Hong Kong BN(O) route; or\n    2.   (b) is settled and whose last grant of permission prior to settlement was as a BN(O) Status Holder or the partner of a BN(O) Status Holder or the BN(O) Household Member or the partner of the BN(O) Household Member; or\n    3.   (c) is a British citizen.",
      "summary": "This provision applies to adult dependant relative applicants on the Hong Kong BN(O) route seeking settlement. They must be a parent, grandparent, sibling, or child of a BN(O) status holder, partner, household member, or a British citizen, with the relationship existing to a BN(O) status holder or British citizen at the time of or prior to settlement. Critical conditions include the relation to a qualifying individual who last had BN(O) or British citizenship status.",
      "augmented_text": "Document: Immigration Rules Appendix Hong Kong British National (Overseas)\nPart: Immigration Rules Appendix Hong Kong British National (Overseas)\nSection ID: 1\nSection: Relationship requirement for settlement as an adult dependant relative on the Hong Kong BN(O) route\nTopic: settlement\n\nSummary: This provision applies to adult dependant relative applicants on the Hong Kong BN(O) route seeking settlement. They must be a parent, grandparent, sibling, or child of a BN(O) status holder, partner, household member, or a British citizen, with the relationship existing to a BN(O) status holder or British citizen at the time of or prior to settlement. Critical conditions include the relation to a qualifying individual who last had BN(O) or British citizenship status.\n\n### Relationship requirement for settlement as an adult dependant relative on the Hong Kong BN(O) route\n\n1.   HK 59.1. Where the applicant has or last had permission as an adult dependant relative on the Hong Kong BN(O) route, they must be the parent, grandparent, brother, sister, son or daughter of a person who: \n    1.   (a) last had permission as a BN(O) Status Holder or the partner of a BN(O) Status Holder or the BN(O) Household Member or the partner of the BN(O) Household Member and who is at the same time being granted settlement on the Hong Kong BN(O) route; or\n    2.   (b) is settled and whose last grant of permission prior to settlement was as a BN(O) Status Holder or the partner of a BN(O) Status Holder or the BN(O) Household Member or the partner of the BN(O) Household Member; or\n    3.   (c) is a British citizen.",
      "needs_review": false
    },
    {
      "metadata": {
        "source": "Immigration Rules Appendix Hong Kong British National (Overseas)",
        "part": "Immigration Rules Appendix Hong Kong British National (Overseas)",
        "section_id": "HK 60.1",
        "section_title": "English language requirement for settlement on the Hong Kong BN(O) route",
        "parent_section": "HK 60",
        "hierarchy_level": 2,
        "topic": "english-language",
        "url": "https://www.gov.uk/guidance/immigration-rules/immigration-rules-appendix-hong-kong-british-national-overseas",
        "scraped_at": "2025-12-06T17:27:49.818160"
      },
      "text": "### English language requirement for settlement on the Hong Kong BN(O) route\n\nHK 60.1. Unless an exemption applies, the applicant must show English language ability on the Common European Framework of Reference for Languages in speaking and listening to at least level B1.\n\nHK 60.2. The applicant must show they meet the English Language requirement as specified in Appendix English Language.",
      "summary": "Applicants applying for settlement via the Hong Kong BN(O) route must demonstrate at least B1 level in speaking and listening English, unless exempted. The requirement aligns with the standards in Appendix English Language.",
      "augmented_text": "Document: Immigration Rules Appendix Hong Kong British National (Overseas)\nPart: Immigration Rules Appendix Hong Kong British National (Overseas)\nSection ID: HK 60.1\nSection: English language requirement for settlement on the Hong Kong BN(O) route\nTopic: english-language\n\nSummary: Applicants applying for settlement via the Hong Kong BN(O) route must demonstrate at least B1 level in speaking and listening English, unless exempted. The requirement aligns with the standards in Appendix English Language.\n\n### English language requirement for settlement on the Hong Kong BN(O) route\n\nHK 60.1. Unless an exemption applies, the applicant must show English language ability on the Common European Framework of Reference for Languages in speaking and listening to at least level B1.\n\nHK 60.2. The applicant must show they meet the English Language requirement as specified in Appendix English Language.",
      "needs_review": false
    },
    {
      "metadata": {
        "source": "Immigration Rules Appendix Hong Kong British National (Overseas)",
        "part": "Immigration Rules Appendix Hong Kong British National (Overseas)",
        "section_id": "HK 61.1",
        "section_title": "Knowledge of Life in the UK requirement for settlement on the Hong Kong BN(O) route",
        "parent_section": "HK 61",
        "hierarchy_level": 2,
        "topic": "settlement",
        "url": "https://www.gov.uk/guidance/immigration-rules/immigration-rules-appendix-hong-kong-british-national-overseas",
        "scraped_at": "2025-12-06T17:27:49.818188"
      },
      "text": "### Knowledge of Life in the UK requirement for settlement on the Hong Kong BN(O) route\n\nHK 61.1. If the applicant is aged 18 or over, and under 65 on the date of application, they must meet the Knowledge of Life in the UK requirement as specified in Appendix KOL UK.",
      "summary": "Applicants aged 18 to under 65 pursuing settlement on the Hong Kong BN(O) route must demonstrate knowledge of Life in the UK, as outlined in Appendix KOL UK. This requirement is mandatory unless exemptions apply, with no specified exceptions noted in this clause.",
      "augmented_text": "Document: Immigration Rules Appendix Hong Kong British National (Overseas)\nPart: Immigration Rules Appendix Hong Kong British National (Overseas)\nSection ID: HK 61.1\nSection: Knowledge of Life in the UK requirement for settlement on the Hong Kong BN(O) route\nTopic: settlement\n\nSummary: Applicants aged 18 to under 65 pursuing settlement on the Hong Kong BN(O) route must demonstrate knowledge of Life in the UK, as outlined in Appendix KOL UK. This requirement is mandatory unless exemptions apply, with no specified exceptions noted in this clause.\n\n### Knowledge of Life in the UK requirement for settlement on the Hong Kong BN(O) route\n\nHK 61.1. If the applicant is aged 18 or over, and under 65 on the date of application, they must meet the Knowledge of Life in the UK requirement as specified in Appendix KOL UK.",
      "needs_review": false
    },
    {
      "metadata": {
        "source": "Immigration Rules Appendix Hong Kong British National (Overseas)",
        "part": "Immigration Rules Appendix Hong Kong British National (Overseas)",
        "section_id": "HK 62.1",
        "section_title": "Qualifying period for settlement on the BN(O) route",
        "parent_section": "HK 62",
        "hierarchy_level": 2,
        "topic": "settlement",
        "url": "https://www.gov.uk/guidance/immigration-rules/immigration-rules-appendix-hong-kong-british-national-overseas",
        "scraped_at": "2025-12-06T17:27:49.818214"
      },
      "text": "### Qualifying period for settlement on the BN(O) route\n\nHK 62.1. The applicant must have spent a continuous period of 5 years with permission in the UK on a route under which a person can settle, of which the most recent grant of permission must have been on the Hong Kong BN(O) route.",
      "summary": "Applicants on the BN(O) route must have lawfully spent five consecutive years in the UK on a qualifying route for settlement, with the most recent permission granted specifically under the BN(O) route.",
      "augmented_text": "Document: Immigration Rules Appendix Hong Kong British National (Overseas)\nPart: Immigration Rules Appendix Hong Kong British National (Overseas)\nSection ID: HK 62.1\nSection: Qualifying period for settlement on the BN(O) route\nTopic: settlement\n\nSummary: Applicants on the BN(O) route must have lawfully spent five consecutive years in the UK on a qualifying route for settlement, with the most recent permission granted specifically under the BN(O) route.\n\n### Qualifying period for settlement on the BN(O) route\n\nHK 62.1. The applicant must have spent a continuous period of 5 years with permission in the UK on a route under which a person can settle, of which the most recent grant of permission must have been on the Hong Kong BN(O) route.",
      "needs_review": false
    },
    {
      "metadata": {
        "source": "Immigration Rules Appendix Hong Kong British National (Overseas)",
        "part": "Immigration Rules Appendix Hong Kong British National (Overseas)",
        "section_id": "HK 63.1",
        "section_title": "Continuous Residence requirement for settlement on the Hong Kong BN(O) route",
        "parent_section": "HK 63",
        "hierarchy_level": 2,
        "topic": "settlement",
        "url": "https://www.gov.uk/guidance/immigration-rules/immigration-rules-appendix-hong-kong-british-national-overseas",
        "scraped_at": "2025-12-06T17:27:49.818239"
      },
      "text": "### Continuous Residence requirement for settlement on the Hong Kong BN(O) route\n\nHK 63.1. The applicant must meet the continuous residence requirement as specified in Appendix Continuous Residence during the period in HK 62.1.",
      "summary": "Applicants applying for settlement on the Hong Kong BN(O) route must satisfy the continuous residence requirement outlined in Appendix Continuous Residence, as specified in HK 62.1; no explicit exceptions are mentioned.",
      "augmented_text": "Document: Immigration Rules Appendix Hong Kong British National (Overseas)\nPart: Immigration Rules Appendix Hong Kong British National (Overseas)\nSection ID: HK 63.1\nSection: Continuous Residence requirement for settlement on the Hong Kong BN(O) route\nTopic: settlement\n\nSummary: Applicants applying for settlement on the Hong Kong BN(O) route must satisfy the continuous residence requirement outlined in Appendix Continuous Residence, as specified in HK 62.1; no explicit exceptions are mentioned.\n\n### Continuous Residence requirement for settlement on the Hong Kong BN(O) route\n\nHK 63.1. The applicant must meet the continuous residence requirement as specified in Appendix Continuous Residence during the period in HK 62.1.",
      "needs_review": false
    },
    {
      "metadata": {
        "source": "Immigration Rules Appendix Hong Kong British National (Overseas)",
        "part": "Immigration Rules Appendix Hong Kong British National (Overseas)",
        "section_id": "HK 64.1",
        "section_title": "Decision on an application for settlement on the Hong Kong BN(O) route",
        "parent_section": "HK 64",
        "hierarchy_level": 2,
        "topic": "eligibility",
        "url": "https://www.gov.uk/guidance/immigration-rules/immigration-rules-appendix-hong-kong-british-national-overseas",
        "scraped_at": "2025-12-06T17:27:49.818254"
      },
      "text": "### Decision on an application for settlement on the Hong Kong BN(O) route\n\nHK 64.1. If the decision maker is satisfied all the suitability and eligibility requirements for settlement are met the applicant will be granted settlement.\n\n1.   HK 64.1A. If the requirements for settlement are not met, but the decision maker believes the applicant is likely to meet all the suitability and eligibility requirements for permission to stay under Appendix Hong Kong BN(O) (based on the route under which they have or last had permission), the application will be varied by the Secretary of State to an application for permission to stay on that route. Where this happens: \n    1.   (a) no additional application fee for permission to stay will be required and the settlement application fee will not be refunded; and\n    2.   (b) the Secretary of State will write to the applicant informing them of this variation and if required will request the applicant pay any Immigration Health Charge.\n\nHK 64.1B If the applicant does not pay the requested Immigration Health Charge, the application for permission to stay will be rejected as invalid.\n\n1.   HK 64.1C. Where an applicant is granted permission to stay it will be granted for 30 months and subject to the following conditions: \n    1.   (a) no access to public funds; and\n    2.   (b) work (including self-employment and voluntary work) permitted except for employment as a professional sportsperson (including as a sports coach); and\n    3.   (c) study is permitted, subject to the ATAS condition in Appendix ATAS.\n    4.   (d) DELETED.\n\nHK 64.1D. If the decision maker is not satisfied that the applicant meets all the suitability and eligibility requirements for settlement or permission to stay, the application for settlement will be refused.\n\nHK 64.2. If the application is refused, a request can be made for an Administrative Review under Appendix AR: Administrative Review.",
      "summary": "Applicants seeking settlement under the Hong Kong BN(O) route must meet all eligibility and suitability criteria. If not, their application may be varied to permission to stay on the same route without additional fees, contingent on paying the Immigration Health Charge; failure to pay results in rejection. Granted permission lasts 30 months, with restrictions on public funds, work (excluding professional sports), and study.",
      "augmented_text": "Document: Immigration Rules Appendix Hong Kong British National (Overseas)\nPart: Immigration Rules Appendix Hong Kong British National (Overseas)\nSection ID: HK 64.1\nSection: Decision on an application for settlement on the Hong Kong BN(O) route\nTopic: eligibility\n\nSummary: Applicants seeking settlement under the Hong Kong BN(O) route must meet all eligibility and suitability criteria. If not, their application may be varied to permission to stay on the same route without additional fees, contingent on paying the Immigration Health Charge; failure to pay results in rejection. Granted permission lasts 30 months, with restrictions on public funds, work (excluding professional sports), and study.\n\n### Decision on an application for settlement on the Hong Kong BN(O) route\n\nHK 64.1. If the decision maker is satisfied all the suitability and eligibility requirements for settlement are met the applicant will be granted settlement.\n\n1.   HK 64.1A. If the requirements for settlement are not met, but the decision maker believes the applicant is likely to meet all the suitability and eligibility requirements for permission to stay under Appendix Hong Kong BN(O) (based on the route under which they have or last had permission), the application will be varied by the Secretary of State to an application for permission to stay on that route. Where this happens: \n    1.   (a) no additional application fee for permission to stay will be required and the settlement application fee will not be refunded; and\n    2.   (b) the Secretary of State will write to the applicant informing them of this variation and if required will request the applicant pay any Immigration Health Charge.\n\nHK 64.1B If the applicant does not pay the requested Immigration Health Charge, the application for permission to stay will be rejected as invalid.\n\n1.   HK 64.1C. Where an applicant is granted permission to stay it will be granted for 30 months and subject to the following conditions: \n    1.   (a) no access to public funds; and\n    2.   (b) work (including self-employment and voluntary work) permitted except for employment as a professional sportsperson (including as a sports coach); and\n    3.   (c) study is permitted, subject to the ATAS condition in Appendix ATAS.\n    4.   (d) DELETED.\n\nHK 64.1D. If the decision maker is not satisfied that the applicant meets all the suitability and eligibility requirements for settlement or permission to stay, the application for settlement will be refused.\n\nHK 64.2. If the application is refused, a request can be made for an Administrative Review under Appendix AR: Administrative Review.",
      "needs_review": false
    },
    {
      "metadata": {
        "source": "Immigration Rules Appendix Hong Kong British National (Overseas)",
        "part": "Immigration Rules Appendix Hong Kong British National (Overseas)",
        "section_id": "1",
        "section_title": "Variation of no access to public funds condition",
        "parent_section": null,
        "hierarchy_level": 1,
        "topic": "financial",
        "url": "https://www.gov.uk/guidance/immigration-rules/immigration-rules-appendix-hong-kong-british-national-overseas",
        "scraped_at": "2025-12-06T17:27:49.818279"
      },
      "text": "### Variation of no access to public funds condition\n\n1.   HK 65.1 A person in the UK with permission on the Hong Kong BN(O) route may have that permission varied to remove a no access to public funds condition where the decision maker is satisfied that: \n    1.   (a) the applicant is destitute, as defined in section 95 of the Immigration and Asylum Act 1999, or is at risk of imminent destitution; or\n    2.   (b) there are reasons relating to the welfare of a relevant child which outweigh the considerations for maintaining the condition (treating the best interests of a relevant child as a primary consideration); or\n    3.   (c) the applicant is facing exceptional circumstances affecting their income or expenditure.\n\n1.   HK 65.2. For the purposes of HK 65.1, ‘relevant child’ means a person who: \n    1.   (i) is under the age of 18 years at the date of application; and\n    2.   (ii) it is clear from the information provided by the applicant, is a child who would be affected by a decision to impose or maintain the no access to public funds condition.\n\nHK 65.3. Where an applicant is applying for further permission on the Hong Kong BN(O) route for 30 months and has previously had their permission varied to remove a no access to public funds condition under HK65.1, the decision maker may grant further permission without such a condition where they are satisfied that the applicant continues to meet the requirements set out in HK 65.1.\n\nPrint this page",
      "summary": "This provision applies to Hong Kong BN(O) route visa holders requesting to vary or omit the no access to public funds condition. The decision maker may grant the variation if the applicant is destitute, facing exceptional circumstances, or if relevant child welfare outweighs public funds restrictions. Conditions include primary consideration of child's best interests and the applicant's ongoing eligibility for further permission.",
      "augmented_text": "Document: Immigration Rules Appendix Hong Kong British National (Overseas)\nPart: Immigration Rules Appendix Hong Kong British National (Overseas)\nSection ID: 1\nSection: Variation of no access to public funds condition\nTopic: financial\n\nSummary: This provision applies to Hong Kong BN(O) route visa holders requesting to vary or omit the no access to public funds condition. The decision maker may grant the variation if the applicant is destitute, facing exceptional circumstances, or if relevant child welfare outweighs public funds restrictions. Conditions include primary consideration of child's best interests and the applicant's ongoing eligibility for further permission.\n\n### Variation of no access to public funds condition\n\n1.   HK 65.1 A person in the UK with permission on the Hong Kong BN(O) route may have that permission varied to remove a no access to public funds condition where the decision maker is satisfied that: \n    1.   (a) the applicant is destitute, as defined in section 95 of the Immigration and Asylum Act 1999, or is at risk of imminent destitution; or\n    2.   (b) there are reasons relating to the welfare of a relevant child which outweigh the considerations for maintaining the condition (treating the best interests of a relevant child as a primary consideration); or\n    3.   (c) the applicant is facing exceptional circumstances affecting their income or expenditure.\n\n1.   HK 65.2. For the purposes of HK 65.1, ‘relevant child’ means a person who: \n    1.   (i) is under the age of 18 years at the date of application; and\n    2.   (ii) it is clear from the information provided by the applicant, is a child who would be affected by a decision to impose or maintain the no access to public funds condition.\n\nHK 65.3. Where an applicant is applying for further permission on the Hong Kong BN(O) route for 30 months and has previously had their permission varied to remove a no access to public funds condition under HK65.1, the decision maker may grant further permission without such a condition where they are satisfied that the applicant continues to meet the requirements set out in HK 65.1.\n\nPrint this page",
      "needs_review": false
    }
  ]
}