{
  "url": "https://www.gov.uk/guidance/immigration-rules/immigration-rules-appendix-long-residence",
  "part_name": "Immigration Rules Appendix Long Residence",
  "scraped_at": "2025-12-06T17:28:10.563643",
  "chunk_count": 19,
  "chunks": [
    {
      "metadata": {
        "source": "Immigration Rules Appendix Long Residence",
        "part": "Immigration Rules Appendix Long Residence",
        "section_id": "SW 3.1",
        "section_title": "Permission to stay on the Long Residence route",
        "parent_section": null,
        "hierarchy_level": 2,
        "topic": "eligibility",
        "url": "https://www.gov.uk/guidance/immigration-rules/immigration-rules-appendix-long-residence",
        "scraped_at": "2025-12-06T17:28:10.562874"
      },
      "text": "### Permission to stay on the Long Residence route",
      "summary": "This provision applies to long-residence applicants seeking permission to stay under the Long Residence route. They must demonstrate continuous residence and meet specific eligibility criteria, with certain exceptions based on conduct or breaches of immigration rules.",
      "augmented_text": "Document: Immigration Rules Appendix Long Residence\nPart: Immigration Rules Appendix Long Residence\nSection ID: SW 3.1\nSection: Permission to stay on the Long Residence route\nTopic: eligibility\n\nSummary: This provision applies to long-residence applicants seeking permission to stay under the Long Residence route. They must demonstrate continuous residence and meet specific eligibility criteria, with certain exceptions based on conduct or breaches of immigration rules.\n\n### Permission to stay on the Long Residence route",
      "needs_review": false
    },
    {
      "metadata": {
        "source": "Immigration Rules Appendix Long Residence",
        "part": "Immigration Rules Appendix Long Residence",
        "section_id": "LR 1.1",
        "section_title": "Validity requirements for permission to stay on the Long Residence route",
        "parent_section": "LR 1",
        "hierarchy_level": 2,
        "topic": "eligibility",
        "url": "https://www.gov.uk/guidance/immigration-rules/immigration-rules-appendix-long-residence",
        "scraped_at": "2025-12-06T17:28:10.562932"
      },
      "text": "### Validity requirements for permission to stay on the Long Residence route\n\nLR 1.1. A person applying for permission to stay on the Long Residence route must apply online on the gov.uk website on the specified form “Application to extend your stay in the UK on the basis of long residence”.\n\n1.   LR 1.2. An application for permission to stay on the Long Residence route must meet all the following requirements: \n    1.   (a) any fee and Immigration Health Charge must have been paid; and\n    2.   (b) the applicant must have provided biometrics when required; and\n    3.   (c) the applicant must have provided a passport or other document which satisfactorily establishes their identity and nationality.\n\nLR 1.3. The applicant must be in the UK on the date of application.\n\nLR 1.4. An application which does not meet all the validity requirements for permission to stay on the Long Residence route may be rejected as invalid and not considered.",
      "summary": "Applicants seeking permission to stay on the Long Residence route must apply online, pay required fees, provide biometrics and identity documents, and be in the UK at the time of application; failure to meet these requirements renders the application invalid.",
      "augmented_text": "Document: Immigration Rules Appendix Long Residence\nPart: Immigration Rules Appendix Long Residence\nSection ID: LR 1.1\nSection: Validity requirements for permission to stay on the Long Residence route\nTopic: eligibility\n\nSummary: Applicants seeking permission to stay on the Long Residence route must apply online, pay required fees, provide biometrics and identity documents, and be in the UK at the time of application; failure to meet these requirements renders the application invalid.\n\n### Validity requirements for permission to stay on the Long Residence route\n\nLR 1.1. A person applying for permission to stay on the Long Residence route must apply online on the gov.uk website on the specified form “Application to extend your stay in the UK on the basis of long residence”.\n\n1.   LR 1.2. An application for permission to stay on the Long Residence route must meet all the following requirements: \n    1.   (a) any fee and Immigration Health Charge must have been paid; and\n    2.   (b) the applicant must have provided biometrics when required; and\n    3.   (c) the applicant must have provided a passport or other document which satisfactorily establishes their identity and nationality.\n\nLR 1.3. The applicant must be in the UK on the date of application.\n\nLR 1.4. An application which does not meet all the validity requirements for permission to stay on the Long Residence route may be rejected as invalid and not considered.",
      "needs_review": false
    },
    {
      "metadata": {
        "source": "Immigration Rules Appendix Long Residence",
        "part": "Immigration Rules Appendix Long Residence",
        "section_id": "LR 2.1",
        "section_title": "Suitability requirements for permission to stay on the Long Residence route",
        "parent_section": "LR 2",
        "hierarchy_level": 2,
        "topic": "suitability",
        "url": "https://www.gov.uk/guidance/immigration-rules/immigration-rules-appendix-long-residence",
        "scraped_at": "2025-12-06T17:28:10.562961"
      },
      "text": "### Suitability requirements for permission to stay on the Long Residence route\n\nLR 2.1. The applicant must not fall for refusal under Part Suitability.\n\n1.   LR 2.2. The applicant must not be: \n    1.   (a) in breach of immigration laws, except that where the Exceptions for overstayers section of Part Suitability applies, that period of overstaying will be disregarded (although it will not count towards the qualifying period); or\n    2.   (b) on immigration bail.",
      "summary": "Applicants seeking permission to stay under the Long Residence route must comply with suitability requirements, including not being in breach of immigration laws (except where overstaying is disregarded) or on immigration bail.",
      "augmented_text": "Document: Immigration Rules Appendix Long Residence\nPart: Immigration Rules Appendix Long Residence\nSection ID: LR 2.1\nSection: Suitability requirements for permission to stay on the Long Residence route\nTopic: suitability\n\nSummary: Applicants seeking permission to stay under the Long Residence route must comply with suitability requirements, including not being in breach of immigration laws (except where overstaying is disregarded) or on immigration bail.\n\n### Suitability requirements for permission to stay on the Long Residence route\n\nLR 2.1. The applicant must not fall for refusal under Part Suitability.\n\n1.   LR 2.2. The applicant must not be: \n    1.   (a) in breach of immigration laws, except that where the Exceptions for overstayers section of Part Suitability applies, that period of overstaying will be disregarded (although it will not count towards the qualifying period); or\n    2.   (b) on immigration bail.",
      "needs_review": false
    },
    {
      "metadata": {
        "source": "Immigration Rules Appendix Long Residence",
        "part": "Immigration Rules Appendix Long Residence",
        "section_id": "Eligibility requirements for permission to stay on the Long Residence route",
        "section_title": "Eligibility requirements for permission to stay on the Long Residence route",
        "parent_section": null,
        "hierarchy_level": 3,
        "topic": "eligibility",
        "url": "https://www.gov.uk/guidance/immigration-rules/immigration-rules-appendix-long-residence",
        "scraped_at": "2025-12-06T17:28:10.562972"
      },
      "text": "### Eligibility requirements for permission to stay on the Long Residence route",
      "summary": "This provision applies to long-residing individuals seeking permission to stay under the Long Residence route. Applicants must meet specific residence, conduct, and character requirements, with exceptions for certain vulnerable groups; prolonged periods of unlawful residence generally qualify applicants unless conduct or character issues exist.",
      "augmented_text": "Document: Immigration Rules Appendix Long Residence\nPart: Immigration Rules Appendix Long Residence\nSection ID: Eligibility requirements for permission to stay on the Long Residence route\nSection: Eligibility requirements for permission to stay on the Long Residence route\nTopic: eligibility\n\nSummary: This provision applies to long-residing individuals seeking permission to stay under the Long Residence route. Applicants must meet specific residence, conduct, and character requirements, with exceptions for certain vulnerable groups; prolonged periods of unlawful residence generally qualify applicants unless conduct or character issues exist.\n\n### Eligibility requirements for permission to stay on the Long Residence route",
      "needs_review": false
    },
    {
      "metadata": {
        "source": "Immigration Rules Appendix Long Residence",
        "part": "Immigration Rules Appendix Long Residence",
        "section_id": "LR 3.1",
        "section_title": "Qualifying period requirement for permission to stay on the Long Residence route",
        "parent_section": null,
        "hierarchy_level": 1,
        "topic": "eligibility",
        "url": "https://www.gov.uk/guidance/immigration-rules/immigration-rules-appendix-long-residence",
        "scraped_at": "2025-12-06T17:28:10.563010"
      },
      "text": "### Qualifying period requirement for permission to stay on the Long Residence route\n\n1.   LR 3.1. The applicant must have spent a qualifying period of 10 years lawfully in the UK, for the entirety of which one or more of the following applied: \n    1.   (a) the applicant had permission, except permission under Appendix Ukraine Scheme, or permission as a Visitor, Short-term Student (English language) or Seasonal Worker (or under any of their predecessor routes); or\n    2.   (b) the applicant was exempt from immigration control; or\n    3.   (c) the applicant was in the UK as an EEA national, or the family member of an EEA national, exercising a right to reside under the Immigration (European Economic Area) Regulations 2016 prior to 11pm on 31 December 2020 (and until 30 June 2021 or the final determination of an application under Appendix EU made by them by that date); or\n    4.   (d) a period as a British citizen, except where citizenship has subsequently been deprived.\n\n1.   LR 3.2. The following periods will not count towards the qualifying period for Long Residence: \n    1.   (a) time spent on immigration bail, temporary admission or temporary release; and\n    2.   (b) any period of overstaying between periods of permission before 24 November 2016, even if a further application was made within 28 days of the expiry of the previous permission; and\n    3.   (c) any period of overstaying between periods of permission on or after 24 November 2016 even if the Exceptions for overstayers section of Part Suitability applies to that period of overstaying; and\n    4.   (d) any current period of overstaying where the Exceptions for overstayers section of Part Suitability applies.",
      "summary": "Applicants must have 10 years lawful UK residence, with periods under specific permissions, exemptions, or EEA rights, excluding overstays or time on bail since 24 Nov 2016. Certain short-term or restricted permissions do not count toward the qualifying period.",
      "augmented_text": "Document: Immigration Rules Appendix Long Residence\nPart: Immigration Rules Appendix Long Residence\nSection ID: LR 3.1\nSection: Qualifying period requirement for permission to stay on the Long Residence route\nTopic: eligibility\n\nSummary: Applicants must have 10 years lawful UK residence, with periods under specific permissions, exemptions, or EEA rights, excluding overstays or time on bail since 24 Nov 2016. Certain short-term or restricted permissions do not count toward the qualifying period.\n\n### Qualifying period requirement for permission to stay on the Long Residence route\n\n1.   LR 3.1. The applicant must have spent a qualifying period of 10 years lawfully in the UK, for the entirety of which one or more of the following applied: \n    1.   (a) the applicant had permission, except permission under Appendix Ukraine Scheme, or permission as a Visitor, Short-term Student (English language) or Seasonal Worker (or under any of their predecessor routes); or\n    2.   (b) the applicant was exempt from immigration control; or\n    3.   (c) the applicant was in the UK as an EEA national, or the family member of an EEA national, exercising a right to reside under the Immigration (European Economic Area) Regulations 2016 prior to 11pm on 31 December 2020 (and until 30 June 2021 or the final determination of an application under Appendix EU made by them by that date); or\n    4.   (d) a period as a British citizen, except where citizenship has subsequently been deprived.\n\n1.   LR 3.2. The following periods will not count towards the qualifying period for Long Residence: \n    1.   (a) time spent on immigration bail, temporary admission or temporary release; and\n    2.   (b) any period of overstaying between periods of permission before 24 November 2016, even if a further application was made within 28 days of the expiry of the previous permission; and\n    3.   (c) any period of overstaying between periods of permission on or after 24 November 2016 even if the Exceptions for overstayers section of Part Suitability applies to that period of overstaying; and\n    4.   (d) any current period of overstaying where the Exceptions for overstayers section of Part Suitability applies.",
      "needs_review": false
    },
    {
      "metadata": {
        "source": "Immigration Rules Appendix Long Residence",
        "part": "Immigration Rules Appendix Long Residence",
        "section_id": "LR 4.1",
        "section_title": "Continuous residence requirement for permission to stay on the Long Residence route",
        "parent_section": "LR 4",
        "hierarchy_level": 2,
        "topic": "residence",
        "url": "https://www.gov.uk/guidance/immigration-rules/immigration-rules-appendix-long-residence",
        "scraped_at": "2025-12-06T17:28:10.563044"
      },
      "text": "### Continuous residence requirement for permission to stay on the Long Residence route\n\nLR 4.1. The applicant must have met the continuous residence requirement set out in Appendix Continuous Residence for the entirety of the qualifying period.",
      "summary": "Applicants seeking permission to stay under the Long Residence route must have maintained continuous residence throughout the qualifying period, as specified in Appendix Continuous Residence. The requirement applies without exception, emphasizing uninterrupted residence for eligibility.",
      "augmented_text": "Document: Immigration Rules Appendix Long Residence\nPart: Immigration Rules Appendix Long Residence\nSection ID: LR 4.1\nSection: Continuous residence requirement for permission to stay on the Long Residence route\nTopic: residence\n\nSummary: Applicants seeking permission to stay under the Long Residence route must have maintained continuous residence throughout the qualifying period, as specified in Appendix Continuous Residence. The requirement applies without exception, emphasizing uninterrupted residence for eligibility.\n\n### Continuous residence requirement for permission to stay on the Long Residence route\n\nLR 4.1. The applicant must have met the continuous residence requirement set out in Appendix Continuous Residence for the entirety of the qualifying period.",
      "needs_review": false
    },
    {
      "metadata": {
        "source": "Immigration Rules Appendix Long Residence",
        "part": "Immigration Rules Appendix Long Residence",
        "section_id": "LR 5.1",
        "section_title": "Transitional arrangements for the Long Residence route",
        "parent_section": "LR 5",
        "hierarchy_level": 2,
        "topic": "leave-to-remain",
        "url": "https://www.gov.uk/guidance/immigration-rules/immigration-rules-appendix-long-residence",
        "scraped_at": "2025-12-06T17:28:10.563072"
      },
      "text": "### Transitional arrangements for the Long Residence route\n\nLR 5.1. A person granted an extension of stay on the basis of long residence following an application made on or before 8 July 2012 will remain subject to the rules in force on 8 July 2012.",
      "summary": "This provision applies to applicants granted extensions for long residence prior to July 8, 2012. It states they remain subject to the rules in force on that date, ensuring transitional consistency. There are no additional conditions or exceptions specified.",
      "augmented_text": "Document: Immigration Rules Appendix Long Residence\nPart: Immigration Rules Appendix Long Residence\nSection ID: LR 5.1\nSection: Transitional arrangements for the Long Residence route\nTopic: leave-to-remain\n\nSummary: This provision applies to applicants granted extensions for long residence prior to July 8, 2012. It states they remain subject to the rules in force on that date, ensuring transitional consistency. There are no additional conditions or exceptions specified.\n\n### Transitional arrangements for the Long Residence route\n\nLR 5.1. A person granted an extension of stay on the basis of long residence following an application made on or before 8 July 2012 will remain subject to the rules in force on 8 July 2012.",
      "needs_review": false
    },
    {
      "metadata": {
        "source": "Immigration Rules Appendix Long Residence",
        "part": "Immigration Rules Appendix Long Residence",
        "section_id": "LR 6.1",
        "section_title": "Decision on an application for permission to stay on the Long Residence route",
        "parent_section": "LR 6",
        "hierarchy_level": 2,
        "topic": "eligibility",
        "url": "https://www.gov.uk/guidance/immigration-rules/immigration-rules-appendix-long-residence",
        "scraped_at": "2025-12-06T17:28:10.563087"
      },
      "text": "### Decision on an application for permission to stay on the Long Residence route\n\nLR 6.1. If the decision maker is satisfied the suitability and eligibility requirements for permission to stay on the Long Residence route are met, the application will be granted.\n\nLR 6.2. If the decision maker is not satisfied the requirements for permission to stay on the Long Residence route are met, the applicant will be considered under the leave to remain rules for a partner, parent or child under Appendix FM (family life) and the permission to stay requirements of Appendix Private Life, and where those requirements are met, the applicant will be granted leave to remain under the relevant rules in Appendix FM (family life) or granted permission to stay under Appendix Private Life.\n\nLR 6.3. Subject to LR 6.2, if the decision maker is not satisfied that the applicant meets the suitability and eligibility requirements for permission to stay on the Long Residence route, the application will be refused.",
      "summary": "Applicants applying for permission to stay under the Long Residence route must satisfy suitability and eligibility criteria; if not, they may be considered under family or private life rules or face refusal.",
      "augmented_text": "Document: Immigration Rules Appendix Long Residence\nPart: Immigration Rules Appendix Long Residence\nSection ID: LR 6.1\nSection: Decision on an application for permission to stay on the Long Residence route\nTopic: eligibility\n\nSummary: Applicants applying for permission to stay under the Long Residence route must satisfy suitability and eligibility criteria; if not, they may be considered under family or private life rules or face refusal.\n\n### Decision on an application for permission to stay on the Long Residence route\n\nLR 6.1. If the decision maker is satisfied the suitability and eligibility requirements for permission to stay on the Long Residence route are met, the application will be granted.\n\nLR 6.2. If the decision maker is not satisfied the requirements for permission to stay on the Long Residence route are met, the applicant will be considered under the leave to remain rules for a partner, parent or child under Appendix FM (family life) and the permission to stay requirements of Appendix Private Life, and where those requirements are met, the applicant will be granted leave to remain under the relevant rules in Appendix FM (family life) or granted permission to stay under Appendix Private Life.\n\nLR 6.3. Subject to LR 6.2, if the decision maker is not satisfied that the applicant meets the suitability and eligibility requirements for permission to stay on the Long Residence route, the application will be refused.",
      "needs_review": false
    },
    {
      "metadata": {
        "source": "Immigration Rules Appendix Long Residence",
        "part": "Immigration Rules Appendix Long Residence",
        "section_id": "LR 7.1",
        "section_title": "Period of grant for permission to stay on the Long Residence route",
        "parent_section": "LR 7",
        "hierarchy_level": 2,
        "topic": "duration",
        "url": "https://www.gov.uk/guidance/immigration-rules/immigration-rules-appendix-long-residence",
        "scraped_at": "2025-12-06T17:28:10.563115"
      },
      "text": "### Period of grant for permission to stay on the Long Residence route\n\nLR 7.1. The applicant will be granted permission to stay for a period of 24 months.",
      "summary": "Applicants on the Long Residence route will be granted a 24-month permission to stay, subject to general eligibility. No specific conditions or exceptions are detailed in this provision.",
      "augmented_text": "Document: Immigration Rules Appendix Long Residence\nPart: Immigration Rules Appendix Long Residence\nSection ID: LR 7.1\nSection: Period of grant for permission to stay on the Long Residence route\nTopic: duration\n\nSummary: Applicants on the Long Residence route will be granted a 24-month permission to stay, subject to general eligibility. No specific conditions or exceptions are detailed in this provision.\n\n### Period of grant for permission to stay on the Long Residence route\n\nLR 7.1. The applicant will be granted permission to stay for a period of 24 months.",
      "needs_review": false
    },
    {
      "metadata": {
        "source": "Immigration Rules Appendix Long Residence",
        "part": "Immigration Rules Appendix Long Residence",
        "section_id": "1",
        "section_title": "Conditions of grant for permission to stay on the Long Residence route",
        "parent_section": null,
        "hierarchy_level": 1,
        "topic": "financial",
        "url": "https://www.gov.uk/guidance/immigration-rules/immigration-rules-appendix-long-residence",
        "scraped_at": "2025-12-06T17:28:10.563156"
      },
      "text": "### Conditions of grant for permission to stay on the Long Residence route\n\n1.   LR 8.1. The grant will be subject to the following conditions: \n    1.   (a) no access to public funds; and\n    2.   (b) work (including self-employment and voluntary work) is permitted; and\n    3.   (c) study is permitted, subject to the Academic Technology Approval Scheme (ATAS) condition in Appendix ATAS.",
      "summary": "Applicants granted permission to stay under the Long Residence route must not access public funds, are permitted to work and study (subject to ATAS requirements), with no additional conditions specified.",
      "augmented_text": "Document: Immigration Rules Appendix Long Residence\nPart: Immigration Rules Appendix Long Residence\nSection ID: 1\nSection: Conditions of grant for permission to stay on the Long Residence route\nTopic: financial\n\nSummary: Applicants granted permission to stay under the Long Residence route must not access public funds, are permitted to work and study (subject to ATAS requirements), with no additional conditions specified.\n\n### Conditions of grant for permission to stay on the Long Residence route\n\n1.   LR 8.1. The grant will be subject to the following conditions: \n    1.   (a) no access to public funds; and\n    2.   (b) work (including self-employment and voluntary work) is permitted; and\n    3.   (c) study is permitted, subject to the Academic Technology Approval Scheme (ATAS) condition in Appendix ATAS.",
      "needs_review": false
    },
    {
      "metadata": {
        "source": "Immigration Rules Appendix Long Residence",
        "part": "Immigration Rules Appendix Long Residence",
        "section_id": "Settlement on the Long Residence route",
        "section_title": "Settlement on the Long Residence route",
        "parent_section": null,
        "hierarchy_level": 2,
        "topic": "settlement",
        "url": "https://www.gov.uk/guidance/immigration-rules/immigration-rules-appendix-long-residence",
        "scraped_at": "2025-12-06T17:28:10.563223"
      },
      "text": "### Settlement on the Long Residence route",
      "summary": "This provision applies to applicants seeking settlement via the Long Residence route. It requires continuous lawful residence, typically for 10 years, with limited absences, and certain good character criteria; exceptions may apply for victims of persecution or other mitigating circumstances.",
      "augmented_text": "Document: Immigration Rules Appendix Long Residence\nPart: Immigration Rules Appendix Long Residence\nSection ID: Settlement on the Long Residence route\nSection: Settlement on the Long Residence route\nTopic: settlement\n\nSummary: This provision applies to applicants seeking settlement via the Long Residence route. It requires continuous lawful residence, typically for 10 years, with limited absences, and certain good character criteria; exceptions may apply for victims of persecution or other mitigating circumstances.\n\n### Settlement on the Long Residence route",
      "needs_review": false
    },
    {
      "metadata": {
        "source": "Immigration Rules Appendix Long Residence",
        "part": "Immigration Rules Appendix Long Residence",
        "section_id": "LR 9.1",
        "section_title": "Validity requirements for settlement on the Long Residence route",
        "parent_section": "LR 9",
        "hierarchy_level": 2,
        "topic": "settlement",
        "url": "https://www.gov.uk/guidance/immigration-rules/immigration-rules-appendix-long-residence",
        "scraped_at": "2025-12-06T17:28:10.563385"
      },
      "text": "### Validity requirements for settlement on the Long Residence route\n\nLR 9.1. A person applying for settlement on the Long Residence route must apply online on the gov.uk website on the specified form “Apply to settle in the UK – long residence”.\n\n1.   LR 9.2. An application for settlement on the Long Residence route must meet all the following requirements: \n    1.   (a) any fee must have been paid; and\n    2.   (b) the applicant must have provided biometrics when required; and\n    3.   (c) the applicant must have provided a passport or other document which satisfactorily establishes their identity and nationality.\n\nLR 9.3. The applicant must be in the UK on the date of application.\n\nLR 9.4. An application which does not meet all the validity requirements for settlement on the Long Residence route may be rejected as invalid and not considered.",
      "summary": "Applicants seeking settlement via the Long Residence route must apply online, pay fees, provide biometrics, and submit identity documents while being in the UK on the application date. Failure to meet these validity conditions can result in rejection of the application.",
      "augmented_text": "Document: Immigration Rules Appendix Long Residence\nPart: Immigration Rules Appendix Long Residence\nSection ID: LR 9.1\nSection: Validity requirements for settlement on the Long Residence route\nTopic: settlement\n\nSummary: Applicants seeking settlement via the Long Residence route must apply online, pay fees, provide biometrics, and submit identity documents while being in the UK on the application date. Failure to meet these validity conditions can result in rejection of the application.\n\n### Validity requirements for settlement on the Long Residence route\n\nLR 9.1. A person applying for settlement on the Long Residence route must apply online on the gov.uk website on the specified form “Apply to settle in the UK – long residence”.\n\n1.   LR 9.2. An application for settlement on the Long Residence route must meet all the following requirements: \n    1.   (a) any fee must have been paid; and\n    2.   (b) the applicant must have provided biometrics when required; and\n    3.   (c) the applicant must have provided a passport or other document which satisfactorily establishes their identity and nationality.\n\nLR 9.3. The applicant must be in the UK on the date of application.\n\nLR 9.4. An application which does not meet all the validity requirements for settlement on the Long Residence route may be rejected as invalid and not considered.",
      "needs_review": false
    },
    {
      "metadata": {
        "source": "Immigration Rules Appendix Long Residence",
        "part": "Immigration Rules Appendix Long Residence",
        "section_id": "LR 10.1",
        "section_title": "Suitability requirements for settlement on the Long Residence route",
        "parent_section": "LR 10",
        "hierarchy_level": 2,
        "topic": "suitability",
        "url": "https://www.gov.uk/guidance/immigration-rules/immigration-rules-appendix-long-residence",
        "scraped_at": "2025-12-06T17:28:10.563429"
      },
      "text": "### Suitability requirements for settlement on the Long Residence route\n\nLR 10.1. The applicant must not fall for refusal under Part Suitability.\n\n1.   LR 10.2. The applicant must not be: \n    1.   (a) in breach of immigration laws, except that where the Exceptions for overstayers section of Part Suitability applies, that period of overstaying will be disregarded (although it will not count towards the qualifying period); or\n    2.   (b) on immigration bail.",
      "summary": "Applicants seeking settlement on the Long Residence route must meet suitability criteria, specifically not breaching immigration laws (excluding qualifying overstays) or being on immigration bail. Exceptions apply to overstayers covered under Part Suitability; otherwise, compliance is mandatory.",
      "augmented_text": "Document: Immigration Rules Appendix Long Residence\nPart: Immigration Rules Appendix Long Residence\nSection ID: LR 10.1\nSection: Suitability requirements for settlement on the Long Residence route\nTopic: suitability\n\nSummary: Applicants seeking settlement on the Long Residence route must meet suitability criteria, specifically not breaching immigration laws (excluding qualifying overstays) or being on immigration bail. Exceptions apply to overstayers covered under Part Suitability; otherwise, compliance is mandatory.\n\n### Suitability requirements for settlement on the Long Residence route\n\nLR 10.1. The applicant must not fall for refusal under Part Suitability.\n\n1.   LR 10.2. The applicant must not be: \n    1.   (a) in breach of immigration laws, except that where the Exceptions for overstayers section of Part Suitability applies, that period of overstaying will be disregarded (although it will not count towards the qualifying period); or\n    2.   (b) on immigration bail.",
      "needs_review": false
    },
    {
      "metadata": {
        "source": "Immigration Rules Appendix Long Residence",
        "part": "Immigration Rules Appendix Long Residence",
        "section_id": "Eligibility requirements for settlement on the Long Residence route",
        "section_title": "Eligibility requirements for settlement on the Long Residence route",
        "parent_section": null,
        "hierarchy_level": 3,
        "topic": "eligibility",
        "url": "https://www.gov.uk/guidance/immigration-rules/immigration-rules-appendix-long-residence",
        "scraped_at": "2025-12-06T17:28:10.563443"
      },
      "text": "### Eligibility requirements for settlement on the Long Residence route",
      "summary": "This provision applies to individuals seeking settlement on the Long Residence route. Applicants must have lawfully resided in the UK for at least 10 years, with no significant criminal or immigration violations, to qualify for settlement.",
      "augmented_text": "Document: Immigration Rules Appendix Long Residence\nPart: Immigration Rules Appendix Long Residence\nSection ID: Eligibility requirements for settlement on the Long Residence route\nSection: Eligibility requirements for settlement on the Long Residence route\nTopic: eligibility\n\nSummary: This provision applies to individuals seeking settlement on the Long Residence route. Applicants must have lawfully resided in the UK for at least 10 years, with no significant criminal or immigration violations, to qualify for settlement.\n\n### Eligibility requirements for settlement on the Long Residence route",
      "needs_review": false
    },
    {
      "metadata": {
        "source": "Immigration Rules Appendix Long Residence",
        "part": "Immigration Rules Appendix Long Residence",
        "section_id": "1",
        "section_title": "Qualifying period requirement for settlement on the Long Residence route",
        "parent_section": null,
        "hierarchy_level": 1,
        "topic": "settlement",
        "url": "https://www.gov.uk/guidance/immigration-rules/immigration-rules-appendix-long-residence",
        "scraped_at": "2025-12-06T17:28:10.563476"
      },
      "text": "### Qualifying period requirement for settlement on the Long Residence route\n\n1.   LR 11.1. The applicant must have spent a qualifying period of 10 years lawfully in the UK, for the entirety of which one or more of the following applied: \n    1.   (a) the applicant had permission, except permission under Appendix Ukraine Scheme, or permission as a Visitor, Short-term Student (English language) or Seasonal Worker (or under any of their predecessor routes); or\n    2.   (b) the applicant was exempt from immigration control; or\n    3.   (c) the applicant was in the UK as an EEA national, or the family member of an EEA national, exercising a right to reside under the Immigration (European Economic Area) Regulations 2016 prior to 11pm on 31 December 2020 (and until 30 June 2021 or the final determination of an application under Appendix EU made by them by that date); or\n    4.   (d) a period as a British citizen, except where citizenship has subsequently been deprived.\n\n1.   LR 11.2. The following periods will not count towards the qualifying period for Long Residence: \n    1.   (a) time spent on immigration bail, temporary admission or temporary release; and\n    2.   (b) any period of overstaying between periods of permission before 24 November 2016 even if a further application was made within 28 days of the expiry of the previous permission; and\n    3.   (c) any period of overstaying between periods of permission on or after 24 November 2016 even if the Exceptions for overstayers section of Part Suitability applies to that period of overstaying; and\n    4.   (d) any current period of overstaying where the Exceptions for overstayers section of Part Suitability applies.\n\nLR 11.3. Subject to LR 11.4, the applicant must have had permission on their current immigration route for at least 12 months on the date of application, or have been exempt from immigration control in the 12 months immediately before the date of application.\n\nLR 11.4. If the applicant’s current permission was granted before 11 April 2024, LR 11.3. does not apply.",
      "summary": "This provision applies to applicants seeking settlement via the Long Residence route in the UK. They must have a lawful 10-year residence, including periods with specific permissions, exemptions, or EU rights, with certain periods (e.g., overstays post-2016 or on bail) excluded. Critical thresholds include continuous lawful residence and specific permitted statuses, with some exceptions for overstays.",
      "augmented_text": "Document: Immigration Rules Appendix Long Residence\nPart: Immigration Rules Appendix Long Residence\nSection ID: 1\nSection: Qualifying period requirement for settlement on the Long Residence route\nTopic: settlement\n\nSummary: This provision applies to applicants seeking settlement via the Long Residence route in the UK. They must have a lawful 10-year residence, including periods with specific permissions, exemptions, or EU rights, with certain periods (e.g., overstays post-2016 or on bail) excluded. Critical thresholds include continuous lawful residence and specific permitted statuses, with some exceptions for overstays.\n\n### Qualifying period requirement for settlement on the Long Residence route\n\n1.   LR 11.1. The applicant must have spent a qualifying period of 10 years lawfully in the UK, for the entirety of which one or more of the following applied: \n    1.   (a) the applicant had permission, except permission under Appendix Ukraine Scheme, or permission as a Visitor, Short-term Student (English language) or Seasonal Worker (or under any of their predecessor routes); or\n    2.   (b) the applicant was exempt from immigration control; or\n    3.   (c) the applicant was in the UK as an EEA national, or the family member of an EEA national, exercising a right to reside under the Immigration (European Economic Area) Regulations 2016 prior to 11pm on 31 December 2020 (and until 30 June 2021 or the final determination of an application under Appendix EU made by them by that date); or\n    4.   (d) a period as a British citizen, except where citizenship has subsequently been deprived.\n\n1.   LR 11.2. The following periods will not count towards the qualifying period for Long Residence: \n    1.   (a) time spent on immigration bail, temporary admission or temporary release; and\n    2.   (b) any period of overstaying between periods of permission before 24 November 2016 even if a further application was made within 28 days of the expiry of the previous permission; and\n    3.   (c) any period of overstaying between periods of permission on or after 24 November 2016 even if the Exceptions for overstayers section of Part Suitability applies to that period of overstaying; and\n    4.   (d) any current period of overstaying where the Exceptions for overstayers section of Part Suitability applies.\n\nLR 11.3. Subject to LR 11.4, the applicant must have had permission on their current immigration route for at least 12 months on the date of application, or have been exempt from immigration control in the 12 months immediately before the date of application.\n\nLR 11.4. If the applicant’s current permission was granted before 11 April 2024, LR 11.3. does not apply.",
      "needs_review": false
    },
    {
      "metadata": {
        "source": "Immigration Rules Appendix Long Residence",
        "part": "Immigration Rules Appendix Long Residence",
        "section_id": "LR 12.1",
        "section_title": "Continuous residence requirement for settlement on the Long Residence route",
        "parent_section": "LR 12",
        "hierarchy_level": 2,
        "topic": "settlement",
        "url": "https://www.gov.uk/guidance/immigration-rules/immigration-rules-appendix-long-residence",
        "scraped_at": "2025-12-06T17:28:10.563501"
      },
      "text": "### Continuous residence requirement for settlement on the Long Residence route\n\nLR 12.1. The applicant must have met the continuous residence requirement set out in Appendix Continuous Residence for the entirety of the qualifying period.",
      "summary": "Applicants seeking settlement under the Long Residence route must have maintained continuous residence throughout the qualifying period, as specified in Appendix Continuous Residence, with no significant absences or lapses.",
      "augmented_text": "Document: Immigration Rules Appendix Long Residence\nPart: Immigration Rules Appendix Long Residence\nSection ID: LR 12.1\nSection: Continuous residence requirement for settlement on the Long Residence route\nTopic: settlement\n\nSummary: Applicants seeking settlement under the Long Residence route must have maintained continuous residence throughout the qualifying period, as specified in Appendix Continuous Residence, with no significant absences or lapses.\n\n### Continuous residence requirement for settlement on the Long Residence route\n\nLR 12.1. The applicant must have met the continuous residence requirement set out in Appendix Continuous Residence for the entirety of the qualifying period.",
      "needs_review": false
    },
    {
      "metadata": {
        "source": "Immigration Rules Appendix Long Residence",
        "part": "Immigration Rules Appendix Long Residence",
        "section_id": "LR 13.1",
        "section_title": "English Language requirement for settlement on the Long Residence route",
        "parent_section": "LR 13",
        "hierarchy_level": 2,
        "topic": "english-language",
        "url": "https://www.gov.uk/guidance/immigration-rules/immigration-rules-appendix-long-residence",
        "scraped_at": "2025-12-06T17:28:10.563517"
      },
      "text": "### English Language requirement for settlement on the Long Residence route\n\nLR 13.1. Unless an exemption applies, the applicant must show English language ability on the Common European Framework of Reference for Languages in speaking and listening of at least level B1.\n\nLR 13.2. The applicant must show they meet the English language requirement, or that an exemption applies, as set out in Appendix English Language.",
      "summary": "Applicants for settlement under the Long Residence route must demonstrate at least B1 level English in speaking and listening, unless exempted per Appendix English Language.",
      "augmented_text": "Document: Immigration Rules Appendix Long Residence\nPart: Immigration Rules Appendix Long Residence\nSection ID: LR 13.1\nSection: English Language requirement for settlement on the Long Residence route\nTopic: english-language\n\nSummary: Applicants for settlement under the Long Residence route must demonstrate at least B1 level English in speaking and listening, unless exempted per Appendix English Language.\n\n### English Language requirement for settlement on the Long Residence route\n\nLR 13.1. Unless an exemption applies, the applicant must show English language ability on the Common European Framework of Reference for Languages in speaking and listening of at least level B1.\n\nLR 13.2. The applicant must show they meet the English language requirement, or that an exemption applies, as set out in Appendix English Language.",
      "needs_review": false
    },
    {
      "metadata": {
        "source": "Immigration Rules Appendix Long Residence",
        "part": "Immigration Rules Appendix Long Residence",
        "section_id": "LR 14.1",
        "section_title": "Knowledge of life in the UK requirement for settlement on the Long Residence route",
        "parent_section": "LR 14",
        "hierarchy_level": 2,
        "topic": "settlement",
        "url": "https://www.gov.uk/guidance/immigration-rules/immigration-rules-appendix-long-residence",
        "scraped_at": "2025-12-06T17:28:10.563542"
      },
      "text": "### Knowledge of life in the UK requirement for settlement on the Long Residence route\n\nLR 14.1. Unless an exemption applies, the applicant must meet the Knowledge of life in the UK requirement as set out in Appendix KOL UK.\n\nLR 14.2. The applicant must show they meet the Knowledge of life in the UK requirement, or that they are exempt, as set out in Appendix KOL UK.",
      "summary": "Applicants seeking settlement via the Long Residence route must meet or be exempt from the UK life in the UK requirement, as detailed in Appendix KOL UK; exemptions are specified in the same appendix.",
      "augmented_text": "Document: Immigration Rules Appendix Long Residence\nPart: Immigration Rules Appendix Long Residence\nSection ID: LR 14.1\nSection: Knowledge of life in the UK requirement for settlement on the Long Residence route\nTopic: settlement\n\nSummary: Applicants seeking settlement via the Long Residence route must meet or be exempt from the UK life in the UK requirement, as detailed in Appendix KOL UK; exemptions are specified in the same appendix.\n\n### Knowledge of life in the UK requirement for settlement on the Long Residence route\n\nLR 14.1. Unless an exemption applies, the applicant must meet the Knowledge of life in the UK requirement as set out in Appendix KOL UK.\n\nLR 14.2. The applicant must show they meet the Knowledge of life in the UK requirement, or that they are exempt, as set out in Appendix KOL UK.",
      "needs_review": false
    },
    {
      "metadata": {
        "source": "Immigration Rules Appendix Long Residence",
        "part": "Immigration Rules Appendix Long Residence",
        "section_id": "LR 15.1",
        "section_title": "Decision on an application for settlement on the Long Residence route",
        "parent_section": "LR 15",
        "hierarchy_level": 2,
        "topic": "eligibility",
        "url": "https://www.gov.uk/guidance/immigration-rules/immigration-rules-appendix-long-residence",
        "scraped_at": "2025-12-06T17:28:10.563557"
      },
      "text": "### Decision on an application for settlement on the Long Residence route\n\nLR 15.1. If the decision maker is satisfied that the suitability and eligibility requirements for settlement on the Long Residence route are met, the applicant will be granted settlement.\n\n1.   LR 15.2. If the decision maker is not satisfied the suitability and eligibility requirements for settlement on the Long Residence route are met, but thinks the applicant may meet requirements for permission to stay on the Long Residence route or one of the following routes, the application will be varied by the Secretary of State to an application for permission to stay: \n    1.   (a) as a partner, parent or child under Appendix FM (family life); or\n    2.   (b) under Appendix Private Life.\n\n1.   LR 15.3. If the application is varied as set out in LR 15.2, the Secretary of State will contact the applicant informing them of this variation and: \n    1.   (a) no additional application fee for the application for permission to stay will be required and the settlement application fee will not be refunded; and\n    2.   (b) the applicant must pay any required Immigration Health Charge.\n\nLR 15.4. If LR 15.2. applies and the applicant does not pay the required Immigration Health Charge, or does not request a waiver for the Immigration Health Charge, which is then granted, the application for permission to stay will be rejected as invalid and the applicant will not be refunded the fee paid for the settlement application.\n\nLR 15.5. If the application is varied to an application for permission to stay and the decision maker is satisfied the suitability and eligibility requirements for permission to stay on the Long Residence route are met, the applicant will be granted permission to stay on the Long Residence route.\n\nLR 15.6. If the decision maker is not satisfied the requirements for permission to stay on the Long Residence route are met, the applicant will be considered under the leave to remain rules for a partner, parent or child under Appendix FM (family life) and the permission to stay requirements of Appendix Private Life, and where the relevant requirements are met, the applicant will be granted under those rules.\n\nLR 15.7. If the decision maker is not satisfied the requirements for settlement or permission to stay on the Long Residence route are met, and the applicant is not granted permission to stay under Appendix FM (family life) or Appendix Private Life, the applicant will be refused settlement on the Long Residence route.\n\nPrint this page",
      "summary": "This provision applies to applicants seeking settlement via the Long Residence route. If eligible and suitable, they are granted settlement; if not, their application may be varied to a permission to stay on different routes. Failure to pay the Immigration Health Charge results in application rejection without refund.",
      "augmented_text": "Document: Immigration Rules Appendix Long Residence\nPart: Immigration Rules Appendix Long Residence\nSection ID: LR 15.1\nSection: Decision on an application for settlement on the Long Residence route\nTopic: eligibility\n\nSummary: This provision applies to applicants seeking settlement via the Long Residence route. If eligible and suitable, they are granted settlement; if not, their application may be varied to a permission to stay on different routes. Failure to pay the Immigration Health Charge results in application rejection without refund.\n\n### Decision on an application for settlement on the Long Residence route\n\nLR 15.1. If the decision maker is satisfied that the suitability and eligibility requirements for settlement on the Long Residence route are met, the applicant will be granted settlement.\n\n1.   LR 15.2. If the decision maker is not satisfied the suitability and eligibility requirements for settlement on the Long Residence route are met, but thinks the applicant may meet requirements for permission to stay on the Long Residence route or one of the following routes, the application will be varied by the Secretary of State to an application for permission to stay: \n    1.   (a) as a partner, parent or child under Appendix FM (family life); or\n    2.   (b) under Appendix Private Life.\n\n1.   LR 15.3. If the application is varied as set out in LR 15.2, the Secretary of State will contact the applicant informing them of this variation and: \n    1.   (a) no additional application fee for the application for permission to stay will be required and the settlement application fee will not be refunded; and\n    2.   (b) the applicant must pay any required Immigration Health Charge.\n\nLR 15.4. If LR 15.2. applies and the applicant does not pay the required Immigration Health Charge, or does not request a waiver for the Immigration Health Charge, which is then granted, the application for permission to stay will be rejected as invalid and the applicant will not be refunded the fee paid for the settlement application.\n\nLR 15.5. If the application is varied to an application for permission to stay and the decision maker is satisfied the suitability and eligibility requirements for permission to stay on the Long Residence route are met, the applicant will be granted permission to stay on the Long Residence route.\n\nLR 15.6. If the decision maker is not satisfied the requirements for permission to stay on the Long Residence route are met, the applicant will be considered under the leave to remain rules for a partner, parent or child under Appendix FM (family life) and the permission to stay requirements of Appendix Private Life, and where the relevant requirements are met, the applicant will be granted under those rules.\n\nLR 15.7. If the decision maker is not satisfied the requirements for settlement or permission to stay on the Long Residence route are met, and the applicant is not granted permission to stay under Appendix FM (family life) or Appendix Private Life, the applicant will be refused settlement on the Long Residence route.\n\nPrint this page",
      "needs_review": false
    }
  ]
}