{
  "url": "https://www.gov.uk/guidance/immigration-rules/immigration-rules-appendix-student",
  "part_name": "Immigration Rules: Appendix Student",
  "scraped_at": "2025-12-06T17:30:45.899066",
  "chunk_count": 39,
  "chunks": [
    {
      "metadata": {
        "source": "Immigration Rules: Appendix Student",
        "part": "Immigration Rules: Appendix Student",
        "section_id": "1",
        "section_title": "Validity requirements for a Student",
        "parent_section": null,
        "hierarchy_level": 1,
        "topic": "leave-to-enter",
        "url": "https://www.gov.uk/guidance/immigration-rules/immigration-rules-appendix-student",
        "scraped_at": "2025-12-06T17:30:45.897992"
      },
      "text": "### Validity requirements for a Student\n\n1.   ST 1.1. A person applying for entry clearance or permission to stay as a Student must apply on the specified form on the gov.uk website as follows: \n    1.   (a) for applicants outside the UK applying for entry clearance, form “Student visa”; or\n    2.   (b) for applicants in the UK applying for permission to stay, form “Student”.\n\n1.   ST 1.2. An application for entry clearance or permission to stay as a Student must meet all the following requirements: \n    1.   (a) any fee and Immigration Health Charge must have been paid; and \n    2.   (b) the applicant must have provided biometrics when required; and\n    3.   (c) the applicant must have provided a passport or other travel document which satisfactorily establishes their identity and nationality; and\n    4.   (d) the applicant must provide a Confirmation of Acceptance for Studies reference number that was issued to them no more than 6 months before the date of application.\n\nST 1.3. If the applicant has, in the last 12 months before the date of application, completed a course of studies in the UK for which they have been awarded a scholarship or sponsorship by a Government or international scholarship agency covering both fees and living costs for study in the UK, they must provide written consent in relation to the application from that Government or agency.\n\nST 1.4. If applying for permission to stay, the applicant must be in the UK on the date of application\n\n1.   ST 1.4A. If applying for permission to stay, the applicant must not have, or have last been granted, permission: \n    1.   (a) as a Visitor; or\n    2.   (b) as a Short-term Student; or\n    3.   (c) as a Parent of a Child Student; or\n    4.   (d) as a Seasonal Worker; or\n    5.   (e) as a Domestic Worker in a Private Household; or\n    6.   (f) outside the Immigration Rules\n\nST 1.5. The applicant must be at least 16 years old on the date of application.\n\nST 1.6. An application which does not meet all the validity requirements for a Student may be rejected as invalid and not considered.",
      "summary": "The provision applies to individuals applying for UK Student visas or permission to stay. Applicants must submit the correct form, pay fees, provide biometrics, a valid passport, and a recent Confirmation of Acceptance for Studies; if in the UK, they must be present on application. Additional conditions include providing government sponsorship consent if previously sponsored and meeting specific timing requirements.",
      "augmented_text": "Document: Immigration Rules: Appendix Student\nPart: Immigration Rules: Appendix Student\nSection ID: 1\nSection: Validity requirements for a Student\nTopic: leave-to-enter\n\nSummary: The provision applies to individuals applying for UK Student visas or permission to stay. Applicants must submit the correct form, pay fees, provide biometrics, a valid passport, and a recent Confirmation of Acceptance for Studies; if in the UK, they must be present on application. Additional conditions include providing government sponsorship consent if previously sponsored and meeting specific timing requirements.\n\n### Validity requirements for a Student\n\n1.   ST 1.1. A person applying for entry clearance or permission to stay as a Student must apply on the specified form on the gov.uk website as follows: \n    1.   (a) for applicants outside the UK applying for entry clearance, form “Student visa”; or\n    2.   (b) for applicants in the UK applying for permission to stay, form “Student”.\n\n1.   ST 1.2. An application for entry clearance or permission to stay as a Student must meet all the following requirements: \n    1.   (a) any fee and Immigration Health Charge must have been paid; and \n    2.   (b) the applicant must have provided biometrics when required; and\n    3.   (c) the applicant must have provided a passport or other travel document which satisfactorily establishes their identity and nationality; and\n    4.   (d) the applicant must provide a Confirmation of Acceptance for Studies reference number that was issued to them no more than 6 months before the date of application.\n\nST 1.3. If the applicant has, in the last 12 months before the date of application, completed a course of studies in the UK for which they have been awarded a scholarship or sponsorship by a Government or international scholarship agency covering both fees and living costs for study in the UK, they must provide written consent in relation to the application from that Government or agency.\n\nST 1.4. If applying for permission to stay, the applicant must be in the UK on the date of application\n\n1.   ST 1.4A. If applying for permission to stay, the applicant must not have, or have last been granted, permission: \n    1.   (a) as a Visitor; or\n    2.   (b) as a Short-term Student; or\n    3.   (c) as a Parent of a Child Student; or\n    4.   (d) as a Seasonal Worker; or\n    5.   (e) as a Domestic Worker in a Private Household; or\n    6.   (f) outside the Immigration Rules\n\nST 1.5. The applicant must be at least 16 years old on the date of application.\n\nST 1.6. An application which does not meet all the validity requirements for a Student may be rejected as invalid and not considered.",
      "needs_review": false
    },
    {
      "metadata": {
        "source": "Immigration Rules: Appendix Student",
        "part": "Immigration Rules: Appendix Student",
        "section_id": "ST 2.1",
        "section_title": "Suitability requirements for a Student",
        "parent_section": "ST 2",
        "hierarchy_level": 2,
        "topic": "suitability",
        "url": "https://www.gov.uk/guidance/immigration-rules/immigration-rules-appendix-student",
        "scraped_at": "2025-12-06T17:30:45.898033"
      },
      "text": "### Suitability requirements for a Student\n\nST 2.1. The applicant must not fall for refusal under Part Suitability.\n\n1.   ST 2.2. If the applicant is applying for permission to stay, they must not be: \n    1.   (a) in the UK in breach of immigration laws, except that where the Exceptions for overstayers section of Part Suitability applies, that period of overstaying will be disregarded; or\n    2.   (b)on immigration bail.",
      "summary": "Applicants for a Student visa must be considered suitable under immigration laws, not breaching regulations or on bail. Overstaying is disregarded if covered by specific exceptions, ensuring they meet core suitability criteria prior to approval.",
      "augmented_text": "Document: Immigration Rules: Appendix Student\nPart: Immigration Rules: Appendix Student\nSection ID: ST 2.1\nSection: Suitability requirements for a Student\nTopic: suitability\n\nSummary: Applicants for a Student visa must be considered suitable under immigration laws, not breaching regulations or on bail. Overstaying is disregarded if covered by specific exceptions, ensuring they meet core suitability criteria prior to approval.\n\n### Suitability requirements for a Student\n\nST 2.1. The applicant must not fall for refusal under Part Suitability.\n\n1.   ST 2.2. If the applicant is applying for permission to stay, they must not be: \n    1.   (a) in the UK in breach of immigration laws, except that where the Exceptions for overstayers section of Part Suitability applies, that period of overstaying will be disregarded; or\n    2.   (b)on immigration bail.",
      "needs_review": false
    },
    {
      "metadata": {
        "source": "Immigration Rules: Appendix Student",
        "part": "Immigration Rules: Appendix Student",
        "section_id": "Eligibility requirements for a Student",
        "section_title": "Eligibility requirements for a Student",
        "parent_section": null,
        "hierarchy_level": 2,
        "topic": "eligibility",
        "url": "https://www.gov.uk/guidance/immigration-rules/immigration-rules-appendix-student",
        "scraped_at": "2025-12-06T17:30:45.898044"
      },
      "text": "### Eligibility requirements for a Student",
      "summary": "This provision applies to individuals seeking student immigration status. It requires applicants to demonstrate genuine study intentions, meet English language and maintenance thresholds, and obtain a suitable confirmation of acceptance (CAS). Exceptions are limited and contingent on specific circumstances detailed in the rules.",
      "augmented_text": "Document: Immigration Rules: Appendix Student\nPart: Immigration Rules: Appendix Student\nSection ID: Eligibility requirements for a Student\nSection: Eligibility requirements for a Student\nTopic: eligibility\n\nSummary: This provision applies to individuals seeking student immigration status. It requires applicants to demonstrate genuine study intentions, meet English language and maintenance thresholds, and obtain a suitable confirmation of acceptance (CAS). Exceptions are limited and contingent on specific circumstances detailed in the rules.\n\n### Eligibility requirements for a Student",
      "needs_review": false
    },
    {
      "metadata": {
        "source": "Immigration Rules: Appendix Student",
        "part": "Immigration Rules: Appendix Student",
        "section_id": "ST 3.1",
        "section_title": "Entry requirements for a Student",
        "parent_section": "ST 3",
        "hierarchy_level": 2,
        "topic": "leave-to-enter",
        "url": "https://www.gov.uk/guidance/immigration-rules/immigration-rules-appendix-student",
        "scraped_at": "2025-12-06T17:30:45.898068"
      },
      "text": "### Entry requirements for a Student\n\nST 3.1. A person seeking to come to the UK as a Student must apply for and obtain entry clearance as a Student before they arrive in the UK.\n\nST 3.2. A person applying for entry clearance as a Student must, if Appendix Tuberculosis applies, provide a valid medical certificate confirming that they have undergone screening for active pulmonary tuberculosis and that this tuberculosis is not present in them.",
      "summary": "Students must obtain entry clearance prior to arrival and, if applicable, provide a TB screening certificate confirming they are free of active pulmonary tuberculosis.",
      "augmented_text": "Document: Immigration Rules: Appendix Student\nPart: Immigration Rules: Appendix Student\nSection ID: ST 3.1\nSection: Entry requirements for a Student\nTopic: leave-to-enter\n\nSummary: Students must obtain entry clearance prior to arrival and, if applicable, provide a TB screening certificate confirming they are free of active pulmonary tuberculosis.\n\n### Entry requirements for a Student\n\nST 3.1. A person seeking to come to the UK as a Student must apply for and obtain entry clearance as a Student before they arrive in the UK.\n\nST 3.2. A person applying for entry clearance as a Student must, if Appendix Tuberculosis applies, provide a valid medical certificate confirming that they have undergone screening for active pulmonary tuberculosis and that this tuberculosis is not present in them.",
      "needs_review": false
    },
    {
      "metadata": {
        "source": "Immigration Rules: Appendix Student",
        "part": "Immigration Rules: Appendix Student",
        "section_id": "ST 4.1",
        "section_title": "Date of application requirement for a Student",
        "parent_section": "ST 4",
        "hierarchy_level": 2,
        "topic": "leave-to-enter",
        "url": "https://www.gov.uk/guidance/immigration-rules/immigration-rules-appendix-student",
        "scraped_at": "2025-12-06T17:30:45.898091"
      },
      "text": "### Date of application requirement for a Student\n\nST 4.1. An application for entry clearance must be made no more than 6 months before the start date of the course stated on the Confirmation of Acceptance for Studies.\n\nST 4.2. An application for permission to stay must be made no more than 3 months before the start date of the course on the Confirmation of Acceptance for Studies.\n\nST 4.3. An application for permission to stay must be for study on a course with a start date no more than 28 days after the expiry date of the applicant’s previous permission.",
      "summary": "This provision applies to students applying for entry clearance or permission to stay. Applications must be made within specified timeframes: no more than 6 months before course start for entry clearance, and no more than 3 months before for permission to stay. Additionally, permission to stay must be sought within 28 days after previous permission expiry for studies with start dates shortly after.",
      "augmented_text": "Document: Immigration Rules: Appendix Student\nPart: Immigration Rules: Appendix Student\nSection ID: ST 4.1\nSection: Date of application requirement for a Student\nTopic: leave-to-enter\n\nSummary: This provision applies to students applying for entry clearance or permission to stay. Applications must be made within specified timeframes: no more than 6 months before course start for entry clearance, and no more than 3 months before for permission to stay. Additionally, permission to stay must be sought within 28 days after previous permission expiry for studies with start dates shortly after.\n\n### Date of application requirement for a Student\n\nST 4.1. An application for entry clearance must be made no more than 6 months before the start date of the course stated on the Confirmation of Acceptance for Studies.\n\nST 4.2. An application for permission to stay must be made no more than 3 months before the start date of the course on the Confirmation of Acceptance for Studies.\n\nST 4.3. An application for permission to stay must be for study on a course with a start date no more than 28 days after the expiry date of the applicant’s previous permission.",
      "needs_review": false
    },
    {
      "metadata": {
        "source": "Immigration Rules: Appendix Student",
        "part": "Immigration Rules: Appendix Student",
        "section_id": "ST 5.1",
        "section_title": "Genuine Student requirement",
        "parent_section": "ST 5",
        "hierarchy_level": 2,
        "topic": "eligibility",
        "url": "https://www.gov.uk/guidance/immigration-rules/immigration-rules-appendix-student",
        "scraped_at": "2025-12-06T17:30:45.898113"
      },
      "text": "### Genuine Student requirement\n\nST 5.1. The applicant must be a genuine student.",
      "summary": "Applicants must be genuine students seeking to study for legitimate reasons. They must satisfy the immigration officer of their sincerity and purpose, with no specific exceptions noted.",
      "augmented_text": "Document: Immigration Rules: Appendix Student\nPart: Immigration Rules: Appendix Student\nSection ID: ST 5.1\nSection: Genuine Student requirement\nTopic: eligibility\n\nSummary: Applicants must be genuine students seeking to study for legitimate reasons. They must satisfy the immigration officer of their sincerity and purpose, with no specific exceptions noted.\n\n### Genuine Student requirement\n\nST 5.1. The applicant must be a genuine student.",
      "needs_review": false
    },
    {
      "metadata": {
        "source": "Immigration Rules: Appendix Student",
        "part": "Immigration Rules: Appendix Student",
        "section_id": "ST 6.1",
        "section_title": "Points requirement for a Student",
        "parent_section": "ST 6",
        "hierarchy_level": 2,
        "topic": "eligibility",
        "url": "https://www.gov.uk/guidance/immigration-rules/immigration-rules-appendix-student",
        "scraped_at": "2025-12-06T17:30:45.898130"
      },
      "text": "### Points requirement for a Student\n\nST 6.1. The applicant must be awarded all 70 points from the table below.\n\n| Points type | Relevant requirements to be met | Points |\n| --- | --- | --- |\n| Study (must meet all) | • Confirmation of Acceptance for Studies requirement • Course requirement • Approved qualification requirement • Level of study requirement • Place of study requirement | 50 |\n| Financial | Financial requirement | 10 |\n| Language | Language requirement | 10 |",
      "summary": "This provision applies to student applicants seeking entry under the UK Immigration Rules. They must earn a total of 70 points, with 50 points from study requirements and 10 each for financial ability and language proficiency. All specified conditions for each category must be met; failure to do so disqualifies the application.",
      "augmented_text": "Document: Immigration Rules: Appendix Student\nPart: Immigration Rules: Appendix Student\nSection ID: ST 6.1\nSection: Points requirement for a Student\nTopic: eligibility\n\nSummary: This provision applies to student applicants seeking entry under the UK Immigration Rules. They must earn a total of 70 points, with 50 points from study requirements and 10 each for financial ability and language proficiency. All specified conditions for each category must be met; failure to do so disqualifies the application.\n\n### Points requirement for a Student\n\nST 6.1. The applicant must be awarded all 70 points from the table below.\n\n| Points type | Relevant requirements to be met | Points |\n| --- | --- | --- |\n| Study (must meet all) | • Confirmation of Acceptance for Studies requirement • Course requirement • Approved qualification requirement • Level of study requirement • Place of study requirement | 50 |\n| Financial | Financial requirement | 10 |\n| Language | Language requirement | 10 |",
      "needs_review": false
    },
    {
      "metadata": {
        "source": "Immigration Rules: Appendix Student",
        "part": "Immigration Rules: Appendix Student",
        "section_id": "ST 7.1",
        "section_title": "Confirmation of Acceptance for Studies requirement",
        "parent_section": "ST 7",
        "hierarchy_level": 2,
        "topic": "eligibility",
        "url": "https://www.gov.uk/guidance/immigration-rules/immigration-rules-appendix-student",
        "scraped_at": "2025-12-06T17:30:45.898162"
      },
      "text": "### Confirmation of Acceptance for Studies requirement\n\nST 7.1. The Confirmation of Acceptance for Studies must have been issued by a student sponsor whose licence is still valid on the date on which the application is decided.\n\nST 7.2. The Confirmation of Acceptance for Studies must not have been used in a previous application which was either granted or refused (but could have been relied on in a previous application which was rejected as invalid, made void or withdrawn).\n\nST 7.3. The student sponsor must not have withdrawn the offer to the applicant after the date that the Confirmation of Acceptance for Studies was issued.\n\n1.   ST 7.4. The Confirmation of Acceptance for Studies must contain the necessary information to confirm all the following requirements are met: \n    1.   (a) the course requirement; and\n    2.   (b) the approved qualification requirement; and\n    3.   (c) the level of study requirement; and\n    4.   (d) the place of study requirement.\n\nST 7.5. The Confirmation of Acceptance for Studies must state the cost of any accommodation provided by the sponsor and fees (and any payment already made) so that the financial requirement can be assessed.\n\nST 7.6. The Confirmation of Acceptance for Studies must show how the English language requirement has been met, and where the sponsor has assessed the applicant’s English language ability, must include the information in ST 13.3. and ST 13.4.",
      "summary": "The Immigration Rules require applicants for student visas to have a valid Confirmation of Acceptance for Studies issued by a licensed, current sponsor, which must not have been previously used or withdrawn. The documentation must detail course, qualification, study level, place, costs, and English language compliance to meet eligibility criteria. Exceptions include previous invalid or withdrawn offers.",
      "augmented_text": "Document: Immigration Rules: Appendix Student\nPart: Immigration Rules: Appendix Student\nSection ID: ST 7.1\nSection: Confirmation of Acceptance for Studies requirement\nTopic: eligibility\n\nSummary: The Immigration Rules require applicants for student visas to have a valid Confirmation of Acceptance for Studies issued by a licensed, current sponsor, which must not have been previously used or withdrawn. The documentation must detail course, qualification, study level, place, costs, and English language compliance to meet eligibility criteria. Exceptions include previous invalid or withdrawn offers.\n\n### Confirmation of Acceptance for Studies requirement\n\nST 7.1. The Confirmation of Acceptance for Studies must have been issued by a student sponsor whose licence is still valid on the date on which the application is decided.\n\nST 7.2. The Confirmation of Acceptance for Studies must not have been used in a previous application which was either granted or refused (but could have been relied on in a previous application which was rejected as invalid, made void or withdrawn).\n\nST 7.3. The student sponsor must not have withdrawn the offer to the applicant after the date that the Confirmation of Acceptance for Studies was issued.\n\n1.   ST 7.4. The Confirmation of Acceptance for Studies must contain the necessary information to confirm all the following requirements are met: \n    1.   (a) the course requirement; and\n    2.   (b) the approved qualification requirement; and\n    3.   (c) the level of study requirement; and\n    4.   (d) the place of study requirement.\n\nST 7.5. The Confirmation of Acceptance for Studies must state the cost of any accommodation provided by the sponsor and fees (and any payment already made) so that the financial requirement can be assessed.\n\nST 7.6. The Confirmation of Acceptance for Studies must show how the English language requirement has been met, and where the sponsor has assessed the applicant’s English language ability, must include the information in ST 13.3. and ST 13.4.",
      "needs_review": false
    },
    {
      "metadata": {
        "source": "Immigration Rules: Appendix Student",
        "part": "Immigration Rules: Appendix Student",
        "section_id": "ST 8.1",
        "section_title": "Course requirement for a Student",
        "parent_section": null,
        "hierarchy_level": 1,
        "topic": "eligibility",
        "url": "https://www.gov.uk/guidance/immigration-rules/immigration-rules-appendix-student",
        "scraped_at": "2025-12-06T17:30:45.898194"
      },
      "text": "### Course requirement for a Student\n\n1.   ST 8.1. The application must be for a single course of study that meets the requirements in ST 8.2. unless it is one of the following: \n    1.   (a) a combined pre-sessional course which meets the requirements in ST 15.1. to 15.3.; or\n    2.   (b) a full-time, salaried, elected executive position as a Student Union Sabbatical Officer, where the applicant is either part-way through their studies or will fill the position in the academic year immediately after their graduation\n\n1.   ST 8.2. The application must be for a course which is one of the following: \n    1.   (a) a full-time course at degree level or above that leads to an approved qualification; or\n    2.   (b) a full-time course below degree level involving a minimum of 15 hours per week of classroom-based daytime study (08:00 to 18:00, Monday to Friday) that leads to an approved qualification; or\n    3.   (c) a full-time course involving a minimum of 15 hours per week of classroom-based daytime study that is a pre-sessional course; or\n    4.   (d) a part-time course above degree level that leads to an approved qualification where the Confirmation of Acceptance for Studies has been issued by a higher education provider with a track record of compliance; or\n    5.   (e) a full-time course at degree level or above that is recognised by Ecctis as being equivalent to a UK higher education course where the Confirmation of Acceptance for Studies has been assigned by an overseas higher education institution or a higher education provider with a track record of compliance.\n\nST 8.3. If the course is an Association of Certified Chartered Accountants (ACCA) qualification or an ACCA Foundations in Accountancy qualification, the student sponsor must be an ACCA approved learning partner – student tuition at either Gold or Platinum level.\n\nST 8.4. If the Academic Technology Approval Scheme (ATAS) requirement in Appendix ATAS applies, the applicant must have a valid ATAS certificate and provide it with the application.",
      "summary": "This provision applies to Student visa applicants, requiring them to pursue a single eligible full-time or specified part-time course leading to an approved qualification. Exceptions include combined pre-sessional courses and certain elected Student Union positions. The course must meet defined hours and level criteria, with specific recognition and compliance conditions.",
      "augmented_text": "Document: Immigration Rules: Appendix Student\nPart: Immigration Rules: Appendix Student\nSection ID: ST 8.1\nSection: Course requirement for a Student\nTopic: eligibility\n\nSummary: This provision applies to Student visa applicants, requiring them to pursue a single eligible full-time or specified part-time course leading to an approved qualification. Exceptions include combined pre-sessional courses and certain elected Student Union positions. The course must meet defined hours and level criteria, with specific recognition and compliance conditions.\n\n### Course requirement for a Student\n\n1.   ST 8.1. The application must be for a single course of study that meets the requirements in ST 8.2. unless it is one of the following: \n    1.   (a) a combined pre-sessional course which meets the requirements in ST 15.1. to 15.3.; or\n    2.   (b) a full-time, salaried, elected executive position as a Student Union Sabbatical Officer, where the applicant is either part-way through their studies or will fill the position in the academic year immediately after their graduation\n\n1.   ST 8.2. The application must be for a course which is one of the following: \n    1.   (a) a full-time course at degree level or above that leads to an approved qualification; or\n    2.   (b) a full-time course below degree level involving a minimum of 15 hours per week of classroom-based daytime study (08:00 to 18:00, Monday to Friday) that leads to an approved qualification; or\n    3.   (c) a full-time course involving a minimum of 15 hours per week of classroom-based daytime study that is a pre-sessional course; or\n    4.   (d) a part-time course above degree level that leads to an approved qualification where the Confirmation of Acceptance for Studies has been issued by a higher education provider with a track record of compliance; or\n    5.   (e) a full-time course at degree level or above that is recognised by Ecctis as being equivalent to a UK higher education course where the Confirmation of Acceptance for Studies has been assigned by an overseas higher education institution or a higher education provider with a track record of compliance.\n\nST 8.3. If the course is an Association of Certified Chartered Accountants (ACCA) qualification or an ACCA Foundations in Accountancy qualification, the student sponsor must be an ACCA approved learning partner – student tuition at either Gold or Platinum level.\n\nST 8.4. If the Academic Technology Approval Scheme (ATAS) requirement in Appendix ATAS applies, the applicant must have a valid ATAS certificate and provide it with the application.",
      "needs_review": false
    },
    {
      "metadata": {
        "source": "Immigration Rules: Appendix Student",
        "part": "Immigration Rules: Appendix Student",
        "section_id": "ST 9.1",
        "section_title": "Approved qualification requirement for a Student",
        "parent_section": null,
        "hierarchy_level": 1,
        "topic": "eligibility",
        "url": "https://www.gov.uk/guidance/immigration-rules/immigration-rules-appendix-student",
        "scraped_at": "2025-12-06T17:30:45.898226"
      },
      "text": "### Approved qualification requirement for a Student\n\n1.   ST 9.1. The course of study, unless it is a pre-sessional course, must lead to an approved qualification which is one of the following: \n    1.   (a) validated by Royal Charter; or\n    2.   (b) awarded by a UK recognised body; or\n    3.   (c) covered by a legal agreement between a UK recognised body and another education provider or awarding body, which confirms both: \n        1.   (i) the UK recognised body’s independent assessment of the level of the student sponsor’s or awarding body’s programme compared to the Regulated Qualifications Framework or its equivalents; and\n        2.   (ii) that the UK recognised body would admit any student who successfully completes the education provider’s or the awarding body’s named course onto a specific or a range of degree-level courses it provides; or\n\n    4.   (d) recognised by one or more recognised bodies through a formal articulation agreement with the awarding body; or\n    5.   (e) in England, Wales and Northern Ireland, is at Regulated Qualifications Framework level 3 or above; or in Scotland is accredited at Scottish Credit and Qualifications Framework level 6 or above; or\n    6.   (f) an overseas qualification that Ecctis assesses as valid and equivalent to Regulated Qualifications Framework level 3 or above; or\n    7.   (g) an aviation licence, rating or certificate issued by the UK’s Civil Aviation Authority.",
      "summary": "This provision applies to students seeking approval for their courses. It requires the course to lead to an approved qualification, such as those validated by Royal Charter, UK recognised bodies, or equivalent international assessments, with specific thresholds in England, Wales, Northern Ireland, and Scotland; aviation-related certifications also qualify. Exceptions include pre-sessional courses, which do not need to meet these qualification criteria.",
      "augmented_text": "Document: Immigration Rules: Appendix Student\nPart: Immigration Rules: Appendix Student\nSection ID: ST 9.1\nSection: Approved qualification requirement for a Student\nTopic: eligibility\n\nSummary: This provision applies to students seeking approval for their courses. It requires the course to lead to an approved qualification, such as those validated by Royal Charter, UK recognised bodies, or equivalent international assessments, with specific thresholds in England, Wales, Northern Ireland, and Scotland; aviation-related certifications also qualify. Exceptions include pre-sessional courses, which do not need to meet these qualification criteria.\n\n### Approved qualification requirement for a Student\n\n1.   ST 9.1. The course of study, unless it is a pre-sessional course, must lead to an approved qualification which is one of the following: \n    1.   (a) validated by Royal Charter; or\n    2.   (b) awarded by a UK recognised body; or\n    3.   (c) covered by a legal agreement between a UK recognised body and another education provider or awarding body, which confirms both: \n        1.   (i) the UK recognised body’s independent assessment of the level of the student sponsor’s or awarding body’s programme compared to the Regulated Qualifications Framework or its equivalents; and\n        2.   (ii) that the UK recognised body would admit any student who successfully completes the education provider’s or the awarding body’s named course onto a specific or a range of degree-level courses it provides; or\n\n    4.   (d) recognised by one or more recognised bodies through a formal articulation agreement with the awarding body; or\n    5.   (e) in England, Wales and Northern Ireland, is at Regulated Qualifications Framework level 3 or above; or in Scotland is accredited at Scottish Credit and Qualifications Framework level 6 or above; or\n    6.   (f) an overseas qualification that Ecctis assesses as valid and equivalent to Regulated Qualifications Framework level 3 or above; or\n    7.   (g) an aviation licence, rating or certificate issued by the UK’s Civil Aviation Authority.",
      "needs_review": false
    },
    {
      "metadata": {
        "source": "Immigration Rules: Appendix Student",
        "part": "Immigration Rules: Appendix Student",
        "section_id": "ST 10.1",
        "section_title": "Level of study requirement for a Student",
        "parent_section": null,
        "hierarchy_level": 1,
        "topic": "eligibility",
        "url": "https://www.gov.uk/guidance/immigration-rules/immigration-rules-appendix-student",
        "scraped_at": "2025-12-06T17:30:45.898258"
      },
      "text": "### Level of study requirement for a Student\n\n1.   ST 10.1. If the Confirmation of Acceptance for Studies has been assigned by a probationary sponsor, the course must meet one of the following requirements unless it is a pre-sessional course: \n    1.   (a) the course will be studied in England, Wales or Northern Ireland, and the applicant is aged under 18, and the course is at Regulated Qualifications Framework level 3 or above; or\n    2.   (b) the course will be studied in England, Wales or Northern Ireland, and the applicant is aged 18 or over, and the course is at Regulated Qualifications Framework level 4 or above; or\n    3.   (c) the course will be studied in Scotland, and the applicant is aged under 18, and the course is at Scottish Credit and Qualifications Framework level 6 or above; or\n    4.   (d) the course will be studied in Scotland, and the applicant is aged 18 or over and the course is at Scottish Credit and Qualifications Framework level 7 or above.\n\n1.   ST 10.2. If the Confirmation of Acceptance for Studies has been assigned by a student sponsor, the course must meet one of the following requirements: \n    1.   (a) the course will be studied in England, Wales or Northern Ireland and it is at Regulated Qualifications Framework level 3 or above; or\n    2.   (b) the course will be studied in Scotland and it is at Scottish Credit and Qualifications Framework level 6 or above; or\n    3.   (c) the course is a short-term study abroad programme in the UK as part of the applicant’s qualification at an overseas higher education institution outside of the UK, and that qualification is recognised as being at UK bachelor’s degree level or above by Ecctis; or\n    4.   (d) the course is a pre-sessional course in English language at level B2 or above of the Common European Framework of Reference for Languages; or\n    5.   (e) DELETED\n    6.   (f) the course is being delivered under a partnership between a higher education institution and a research institute and is accredited at Regulated Qualifications Framework level 7 or above, or at Scottish Credit and Qualifications Framework Level 11 or above.",
      "summary": "This provision applies to students with a Confirmation of Acceptance for Studies, requiring their courses to meet specific qualification levels based on age, location (UK country), and sponsor type. For probationary sponsors, courses must meet at least RQF level 3 or above in England, Wales, or Northern Ireland, or SCQF level 6 or above in Scotland; for student sponsors, the levels are similar or higher, with specific thresholds for short-term study abroad. Critical conditions include course location, applicant's age, and sponsor type.",
      "augmented_text": "Document: Immigration Rules: Appendix Student\nPart: Immigration Rules: Appendix Student\nSection ID: ST 10.1\nSection: Level of study requirement for a Student\nTopic: eligibility\n\nSummary: This provision applies to students with a Confirmation of Acceptance for Studies, requiring their courses to meet specific qualification levels based on age, location (UK country), and sponsor type. For probationary sponsors, courses must meet at least RQF level 3 or above in England, Wales, or Northern Ireland, or SCQF level 6 or above in Scotland; for student sponsors, the levels are similar or higher, with specific thresholds for short-term study abroad. Critical conditions include course location, applicant's age, and sponsor type.\n\n### Level of study requirement for a Student\n\n1.   ST 10.1. If the Confirmation of Acceptance for Studies has been assigned by a probationary sponsor, the course must meet one of the following requirements unless it is a pre-sessional course: \n    1.   (a) the course will be studied in England, Wales or Northern Ireland, and the applicant is aged under 18, and the course is at Regulated Qualifications Framework level 3 or above; or\n    2.   (b) the course will be studied in England, Wales or Northern Ireland, and the applicant is aged 18 or over, and the course is at Regulated Qualifications Framework level 4 or above; or\n    3.   (c) the course will be studied in Scotland, and the applicant is aged under 18, and the course is at Scottish Credit and Qualifications Framework level 6 or above; or\n    4.   (d) the course will be studied in Scotland, and the applicant is aged 18 or over and the course is at Scottish Credit and Qualifications Framework level 7 or above.\n\n1.   ST 10.2. If the Confirmation of Acceptance for Studies has been assigned by a student sponsor, the course must meet one of the following requirements: \n    1.   (a) the course will be studied in England, Wales or Northern Ireland and it is at Regulated Qualifications Framework level 3 or above; or\n    2.   (b) the course will be studied in Scotland and it is at Scottish Credit and Qualifications Framework level 6 or above; or\n    3.   (c) the course is a short-term study abroad programme in the UK as part of the applicant’s qualification at an overseas higher education institution outside of the UK, and that qualification is recognised as being at UK bachelor’s degree level or above by Ecctis; or\n    4.   (d) the course is a pre-sessional course in English language at level B2 or above of the Common European Framework of Reference for Languages; or\n    5.   (e) DELETED\n    6.   (f) the course is being delivered under a partnership between a higher education institution and a research institute and is accredited at Regulated Qualifications Framework level 7 or above, or at Scottish Credit and Qualifications Framework Level 11 or above.",
      "needs_review": false
    },
    {
      "metadata": {
        "source": "Immigration Rules: Appendix Student",
        "part": "Immigration Rules: Appendix Student",
        "section_id": "ST 11.1",
        "section_title": "Place of study requirement for a Student",
        "parent_section": "ST 11",
        "hierarchy_level": 2,
        "topic": "family",
        "url": "https://www.gov.uk/guidance/immigration-rules/immigration-rules-appendix-student",
        "scraped_at": "2025-12-06T17:30:45.898284"
      },
      "text": "### Place of study requirement for a Student\n\nST 11.1. All study that forms part of the course of study apart from permitted remote delivery must take place on the premises of the student sponsor or a partner institution unless the applicant is on a course-related work placement, a study abroad programme overseas, or a pre-sessional course.",
      "summary": "This provision applies to Student visa applicants and requires that all in-person study, except for work placements, study abroad, or pre-sessional courses, occurs on the sponsor’s premises or partner institutions. Remote learning is permitted only under specific exceptions.",
      "augmented_text": "Document: Immigration Rules: Appendix Student\nPart: Immigration Rules: Appendix Student\nSection ID: ST 11.1\nSection: Place of study requirement for a Student\nTopic: family\n\nSummary: This provision applies to Student visa applicants and requires that all in-person study, except for work placements, study abroad, or pre-sessional courses, occurs on the sponsor’s premises or partner institutions. Remote learning is permitted only under specific exceptions.\n\n### Place of study requirement for a Student\n\nST 11.1. All study that forms part of the course of study apart from permitted remote delivery must take place on the premises of the student sponsor or a partner institution unless the applicant is on a course-related work placement, a study abroad programme overseas, or a pre-sessional course.",
      "needs_review": false
    },
    {
      "metadata": {
        "source": "Immigration Rules: Appendix Student",
        "part": "Immigration Rules: Appendix Student",
        "section_id": "ST 12.1",
        "section_title": "Financial requirement for a Student",
        "parent_section": "ST 12",
        "hierarchy_level": 2,
        "topic": "financial",
        "url": "https://www.gov.uk/guidance/immigration-rules/immigration-rules-appendix-student",
        "scraped_at": "2025-12-06T17:30:45.898302"
      },
      "text": "### Financial requirement for a Student\n\nST 12.1. If the applicant is applying for permission to stay and has been living in the UK with permission for 12 months or more on the date of application, they will meet the financial requirement and do not need to show funds.\n\nST 12.2. If the applicant is applying for entry clearance or permission to stay and is applying as a Student Union Sabbatical Officer they will meet the financial requirement and do not need to show funds.\n\nST 12.3. If ST 12.2. does not apply, and the applicant is applying for entry clearance, or is applying for permission to stay and has been in the UK with permission for less than 12 months, the applicant must have the following funds:\n\n(a) Studying in London\n\n| Type of Study | Funds required |\n| --- | --- |\n| Residential Independent School | Sufficient funds to pay outstanding fees (course fees and boarding fees) for one academic year |\n| All other cases | Sufficient funds to pay any outstanding course fees as stated on the Confirmation of Acceptance for Studies, and £1529 for each month of the course (up to a maximum of 9 months) |\n\n(b) Studying outside London\n\n| Type of Study | Funds required |\n| --- | --- |\n| Residential Independent School | Sufficient funds to pay outstanding fees (course fees and boarding fees) for one academic year |\n| All other cases | Sufficient funds to pay any outstanding course fees as stated on the Confirmation of Acceptance for Studies, and £1171 for each month of the course (up to a maximum of 9 months) |\n\nIf the length of the applicant’s course includes a part of a month, the time period will be rounded up to the next full month.\n\nST 12.4. If the applicant has paid a deposit to the student sponsor for accommodation arranged by the sponsor, this deposit (up to a maximum of £1529) can be offset against the funds required in ST 12.3.\n\nST 12.5. If the applicant has paid all or part of their course fees to their student sponsor this must be confirmed on the Confirmation of Acceptance for Studies, or the applicant must provide a receipt issued by the student sponsor confirming the amount of fees paid.\n\nST 12.6. The applicant must show that they have held the required level of funds for a 28-day period and as specified in Appendix Finance unless the applicant is relying on a student loan or official financial sponsorship which meets the requirements of FIN 8.3. in Appendix Finance\n\nST.12.7. If the funds held in the applicant’s account on the date of decision fall substantially below the level of funds required at ST.12.3, the decision maker must be satisfied that the spent funds have been used to pay outstanding course fees, a deposit for accommodation or other costs associated with the proposed course of study in the UK",
      "summary": "This provision applies to Student visa applicants and specifies financial requirements. Applicants who have lived in the UK with permission for over 12 months or are Student Union Sabbatical Officers do not need to demonstrate funds; others must show funds covering course fees and monthly living costs (£1529/month in London, £1171 outside London) if in the UK for less than 12 months.",
      "augmented_text": "Document: Immigration Rules: Appendix Student\nPart: Immigration Rules: Appendix Student\nSection ID: ST 12.1\nSection: Financial requirement for a Student\nTopic: financial\n\nSummary: This provision applies to Student visa applicants and specifies financial requirements. Applicants who have lived in the UK with permission for over 12 months or are Student Union Sabbatical Officers do not need to demonstrate funds; others must show funds covering course fees and monthly living costs (£1529/month in London, £1171 outside London) if in the UK for less than 12 months.\n\n### Financial requirement for a Student\n\nST 12.1. If the applicant is applying for permission to stay and has been living in the UK with permission for 12 months or more on the date of application, they will meet the financial requirement and do not need to show funds.\n\nST 12.2. If the applicant is applying for entry clearance or permission to stay and is applying as a Student Union Sabbatical Officer they will meet the financial requirement and do not need to show funds.\n\nST 12.3. If ST 12.2. does not apply, and the applicant is applying for entry clearance, or is applying for permission to stay and has been in the UK with permission for less than 12 months, the applicant must have the following funds:\n\n(a) Studying in London\n\n| Type of Study | Funds required |\n| --- | --- |\n| Residential Independent School | Sufficient funds to pay outstanding fees (course fees and boarding fees) for one academic year |\n| All other cases | Sufficient funds to pay any outstanding course fees as stated on the Confirmation of Acceptance for Studies, and £1529 for each month of the course (up to a maximum of 9 months) |\n\n(b) Studying outside London\n\n| Type of Study | Funds required |\n| --- | --- |\n| Residential Independent School | Sufficient funds to pay outstanding fees (course fees and boarding fees) for one academic year |\n| All other cases | Sufficient funds to pay any outstanding course fees as stated on the Confirmation of Acceptance for Studies, and £1171 for each month of the course (up to a maximum of 9 months) |\n\nIf the length of the applicant’s course includes a part of a month, the time period will be rounded up to the next full month.\n\nST 12.4. If the applicant has paid a deposit to the student sponsor for accommodation arranged by the sponsor, this deposit (up to a maximum of £1529) can be offset against the funds required in ST 12.3.\n\nST 12.5. If the applicant has paid all or part of their course fees to their student sponsor this must be confirmed on the Confirmation of Acceptance for Studies, or the applicant must provide a receipt issued by the student sponsor confirming the amount of fees paid.\n\nST 12.6. The applicant must show that they have held the required level of funds for a 28-day period and as specified in Appendix Finance unless the applicant is relying on a student loan or official financial sponsorship which meets the requirements of FIN 8.3. in Appendix Finance\n\nST.12.7. If the funds held in the applicant’s account on the date of decision fall substantially below the level of funds required at ST.12.3, the decision maker must be satisfied that the spent funds have been used to pay outstanding course fees, a deposit for accommodation or other costs associated with the proposed course of study in the UK",
      "needs_review": false
    },
    {
      "metadata": {
        "source": "Immigration Rules: Appendix Student",
        "part": "Immigration Rules: Appendix Student",
        "section_id": "1",
        "section_title": "English language requirement for a Student",
        "parent_section": null,
        "hierarchy_level": 1,
        "topic": "english-language",
        "url": "https://www.gov.uk/guidance/immigration-rules/immigration-rules-appendix-student",
        "scraped_at": "2025-12-06T17:30:45.898319"
      },
      "text": "### English language requirement for a Student\n\n1.   ST 13.1. An applicant must either: \n    1.   (a) show English language ability on the Common European Framework of Reference for Languages in all 4 components (reading, writing, speaking and listening) of at least: \n        1.   (i) level B2, where the applicant is studying a course at UK bachelor’s degree level or above; or\n        2.   (ii) level B1, where the applicant is studying a pre-sessional course or a course below UK bachelor’s degree level; or\n\n    2.   (b) have a GCSE level qualification or above in Welsh, Scots Gaelic, or Irish language.\n\nST 13.2. The applicant must show they meet the English language requirement as specified in Appendix English Language.\n\nST 13.3. Where the student sponsor has assessed that the applicant meets the English language requirement, they must state this and the method of assessment on the Confirmation of Acceptance for Studies.\n\nST 13.4. Where a Secure English Language Test is required, the name of the test provider, the unique reference number for the test and the score for each component tested (reading, writing, listening, speaking) must be included on the Confirmation of Acceptance for Studies.",
      "summary": "This provision applies to Student visa applicants, requiring them to demonstrate English language ability at B2 (degree level) or B1 (pre-sessional or below UK degree level) standards across all components, or possess a relevant GCSE qualification. The applicant’s English proficiency must be confirmed via assessment details on the Confirmation of Acceptance for Studies, including secure test information if applicable. Certain qualifications or levels suffice, with specific documentation requirements for sponsors.",
      "augmented_text": "Document: Immigration Rules: Appendix Student\nPart: Immigration Rules: Appendix Student\nSection ID: 1\nSection: English language requirement for a Student\nTopic: english-language\n\nSummary: This provision applies to Student visa applicants, requiring them to demonstrate English language ability at B2 (degree level) or B1 (pre-sessional or below UK degree level) standards across all components, or possess a relevant GCSE qualification. The applicant’s English proficiency must be confirmed via assessment details on the Confirmation of Acceptance for Studies, including secure test information if applicable. Certain qualifications or levels suffice, with specific documentation requirements for sponsors.\n\n### English language requirement for a Student\n\n1.   ST 13.1. An applicant must either: \n    1.   (a) show English language ability on the Common European Framework of Reference for Languages in all 4 components (reading, writing, speaking and listening) of at least: \n        1.   (i) level B2, where the applicant is studying a course at UK bachelor’s degree level or above; or\n        2.   (ii) level B1, where the applicant is studying a pre-sessional course or a course below UK bachelor’s degree level; or\n\n    2.   (b) have a GCSE level qualification or above in Welsh, Scots Gaelic, or Irish language.\n\nST 13.2. The applicant must show they meet the English language requirement as specified in Appendix English Language.\n\nST 13.3. Where the student sponsor has assessed that the applicant meets the English language requirement, they must state this and the method of assessment on the Confirmation of Acceptance for Studies.\n\nST 13.4. Where a Secure English Language Test is required, the name of the test provider, the unique reference number for the test and the score for each component tested (reading, writing, listening, speaking) must be included on the Confirmation of Acceptance for Studies.",
      "needs_review": false
    },
    {
      "metadata": {
        "source": "Immigration Rules: Appendix Student",
        "part": "Immigration Rules: Appendix Student",
        "section_id": "ST 14.1",
        "section_title": "Academic Progress requirement for a Student",
        "parent_section": null,
        "hierarchy_level": 1,
        "topic": "eligibility",
        "url": "https://www.gov.uk/guidance/immigration-rules/immigration-rules-appendix-student",
        "scraped_at": "2025-12-06T17:30:45.898358"
      },
      "text": "### Academic Progress requirement for a Student\n\n1.   ST 14.1. An applicant who has, or previously had, permission as a Student and is applying for permission to stay as a Student must have successfully completed the course of study for which they were last granted permission as a Student or one of the following applies: \n    1.   (a) one of the exceptions in ST 14.4.; or\n    2.   (b) they are applying to progress to a higher level course as specified in ST 14.3.(a) or (b).; or\n    3.   (c) they have successfully completed the course of study for which they were last granted permission as a Student or the course of study they were allowed to change to without applying for further permission on the Student route and will now be taking a course at the same level as specified at ST 14.3(c); or\n    4.   (d) they have successfully completed the course of study with their sponsor where the change of course was allowed without applying for further permission on the Student route.\n\nST 14.2. An applicant who has, or previously had, permission on the Student route and is applying for permission to stay as a Student must show academic progress from the previous courses of study unless one of the exceptions in ST 14.4. applies.\n\n1.   ST 14.3. An applicant will show academic progress if they are applying for any of the following: \n    1.   (a) to progress from a bachelor’s to master’s level course which is part of an integrated master’s course, where the applicant has been offered a place on a higher-level course by the student sponsor after an assessment of their academic ability; or\n    2.   (b) to progress from a master’s degree to a PhD which is part of an integrated master’s and PhD programme, where the applicant has been offered a place on a higher-level course by the student sponsor after an assessment of their academic ability; or\n    3.   (c) a course which is above the level of the previous course of study for which they were last granted permission unless: \n        1.   (i) the student sponsor is a higher education provider with a track record of compliance; and\n        2.   (ii) the course is at degree level or above; and\n        3.   (iii) the new course is at the same level as the previous course of study; and\n        4.   (iv) the student sponsor confirms that either: \n            1.   (a) the new course of study is related to the applicant’s previous course of study (meaning that it is either connected to the previous course, part of the same subject group, or involves deeper specialisation); or\n            2.   (b) the combination of the previous course of study and the new course of study support the applicant’s genuine career aspirations.\n            3.   (c) the applicant has left an integrated master’s or PhD programme having successfully completed the course leading to the award of the lower level qualification which formed a part of that programme.\n\n1.   ST 14.4. An applicant does not need to show academic progress where they: \n    1.   (a) are applying to re-sit examinations or repeat modules under ST 14.5.; or\n    2.   (b) have previously re-sat examinations or repeated modules under ST 14.5. and are applying to complete the course for which those examinations were re-sat or modules repeated; or\n    3.   (c) are applying to: \n        1.   (i) continue studying with their current student sponsor; or\n        2.   (ii) move to a new student sponsor to enable them to follow their academic supervisor to another institution,\n\n    4.   for the purpose of completing the PhD or other doctoral qualification for which study was undertaken during their last period of permission as a Student; or\n    5.   (d) are making an application to move to a new student sponsor to complete a course of study begun at a student sponsor that has subsequently had its licence revoked; or\n    6.   (e) are applying to undertake a role as a Student Union Sabbatical Officer; or\n    7.   (f) after undertaking a period as a Student Union Sabbatical Officer are applying to complete the qualification for which the Confirmation of Acceptance for Studies was assigned before that period; or\n    8.   (g) DELETED\n    9.   (h) are applying to undertake an intercalated bachelor’s or master’s degree course or PhD where they are studying medicine, veterinary medicine and science, or dentistry as their principal course of study, or to complete their principal course, having completed a period of intercalation; or\n    10.   (i) are applying to undertake a study abroad programme or work placement which is both integral to and assessed as part of the course, or to complete their course, having completed a study abroad programme or work placement.\n\nST 14.5. If the applicant is sponsored by a probationary sponsor, they must not previously have re-sat the same examination or repeated the same module, more than once (they can only do so twice).",
      "summary": "Students applying to stay must demonstrate successful completion of their previous course or meet specific exceptions, including progressing to higher or same-level courses. They must also show academic progress unless qualifying for an exception. Critical thresholds include course completion, progression to higher levels, or changes permitted without further permission.",
      "augmented_text": "Document: Immigration Rules: Appendix Student\nPart: Immigration Rules: Appendix Student\nSection ID: ST 14.1\nSection: Academic Progress requirement for a Student\nTopic: eligibility\n\nSummary: Students applying to stay must demonstrate successful completion of their previous course or meet specific exceptions, including progressing to higher or same-level courses. They must also show academic progress unless qualifying for an exception. Critical thresholds include course completion, progression to higher levels, or changes permitted without further permission.\n\n### Academic Progress requirement for a Student\n\n1.   ST 14.1. An applicant who has, or previously had, permission as a Student and is applying for permission to stay as a Student must have successfully completed the course of study for which they were last granted permission as a Student or one of the following applies: \n    1.   (a) one of the exceptions in ST 14.4.; or\n    2.   (b) they are applying to progress to a higher level course as specified in ST 14.3.(a) or (b).; or\n    3.   (c) they have successfully completed the course of study for which they were last granted permission as a Student or the course of study they were allowed to change to without applying for further permission on the Student route and will now be taking a course at the same level as specified at ST 14.3(c); or\n    4.   (d) they have successfully completed the course of study with their sponsor where the change of course was allowed without applying for further permission on the Student route.\n\nST 14.2. An applicant who has, or previously had, permission on the Student route and is applying for permission to stay as a Student must show academic progress from the previous courses of study unless one of the exceptions in ST 14.4. applies.\n\n1.   ST 14.3. An applicant will show academic progress if they are applying for any of the following: \n    1.   (a) to progress from a bachelor’s to master’s level course which is part of an integrated master’s course, where the applicant has been offered a place on a higher-level course by the student sponsor after an assessment of their academic ability; or\n    2.   (b) to progress from a master’s degree to a PhD which is part of an integrated master’s and PhD programme, where the applicant has been offered a place on a higher-level course by the student sponsor after an assessment of their academic ability; or\n    3.   (c) a course which is above the level of the previous course of study for which they were last granted permission unless: \n        1.   (i) the student sponsor is a higher education provider with a track record of compliance; and\n        2.   (ii) the course is at degree level or above; and\n        3.   (iii) the new course is at the same level as the previous course of study; and\n        4.   (iv) the student sponsor confirms that either: \n            1.   (a) the new course of study is related to the applicant’s previous course of study (meaning that it is either connected to the previous course, part of the same subject group, or involves deeper specialisation); or\n            2.   (b) the combination of the previous course of study and the new course of study support the applicant’s genuine career aspirations.\n            3.   (c) the applicant has left an integrated master’s or PhD programme having successfully completed the course leading to the award of the lower level qualification which formed a part of that programme.\n\n1.   ST 14.4. An applicant does not need to show academic progress where they: \n    1.   (a) are applying to re-sit examinations or repeat modules under ST 14.5.; or\n    2.   (b) have previously re-sat examinations or repeated modules under ST 14.5. and are applying to complete the course for which those examinations were re-sat or modules repeated; or\n    3.   (c) are applying to: \n        1.   (i) continue studying with their current student sponsor; or\n        2.   (ii) move to a new student sponsor to enable them to follow their academic supervisor to another institution,\n\n    4.   for the purpose of completing the PhD or other doctoral qualification for which study was undertaken during their last period of permission as a Student; or\n    5.   (d) are making an application to move to a new student sponsor to complete a course of study begun at a student sponsor that has subsequently had its licence revoked; or\n    6.   (e) are applying to undertake a role as a Student Union Sabbatical Officer; or\n    7.   (f) after undertaking a period as a Student Union Sabbatical Officer are applying to complete the qualification for which the Confirmation of Acceptance for Studies was assigned before that period; or\n    8.   (g) DELETED\n    9.   (h) are applying to undertake an intercalated bachelor’s or master’s degree course or PhD where they are studying medicine, veterinary medicine and science, or dentistry as their principal course of study, or to complete their principal course, having completed a period of intercalation; or\n    10.   (i) are applying to undertake a study abroad programme or work placement which is both integral to and assessed as part of the course, or to complete their course, having completed a study abroad programme or work placement.\n\nST 14.5. If the applicant is sponsored by a probationary sponsor, they must not previously have re-sat the same examination or repeated the same module, more than once (they can only do so twice).",
      "needs_review": false
    },
    {
      "metadata": {
        "source": "Immigration Rules: Appendix Student",
        "part": "Immigration Rules: Appendix Student",
        "section_id": "ST 15.1",
        "section_title": "Combined Pre-sessional Course requirement for a Student",
        "parent_section": null,
        "hierarchy_level": 1,
        "topic": "eligibility",
        "url": "https://www.gov.uk/guidance/immigration-rules/immigration-rules-appendix-student",
        "scraped_at": "2025-12-06T17:30:45.898387"
      },
      "text": "### Combined Pre-sessional Course requirement for a Student\n\n1.   ST 15.1. A single Confirmation of Acceptance for Studies can be assigned for a combined pre-sessional course and a main course at degree level or above by a higher education provider with a track record of compliance if: \n    1.   (a) the pre-sessional course lasts no longer than 3 months; and\n    2.   (b) the main course will begin no more than 1 month after the pre-sessional course ends.\n\nST 15.2. If the applicant has been assessed as having language ability of at least level B2 in order to meet the English language requirement at ST 13.1., the Confirmation of Acceptance for Studies must confirm that the applicant has an unconditional offer of a place on the main course.\n\nST 15.3. If the applicant has been assessed (which must be by a method other than assessment by the student sponsor) as having language ability of at least level B1 in order to meet the English language requirement at ST 13.1., the Confirmation of Acceptance for Studies must confirm that the student sponsor is satisfied that the applicant will have at least level B2 at the end of the pre-sessional course.",
      "summary": "This provision applies to students undertaking combined pre-sessional and main degree courses. It requires a single Confirmation of Acceptance for Studies for courses lasting up to 3 months pre-sessional and beginning within 1 month afterward, with language level conditions (B1 or B2) depending on assessment. Critical conditions include higher education provider compliance and separate language assessments outside student sponsor evaluation.",
      "augmented_text": "Document: Immigration Rules: Appendix Student\nPart: Immigration Rules: Appendix Student\nSection ID: ST 15.1\nSection: Combined Pre-sessional Course requirement for a Student\nTopic: eligibility\n\nSummary: This provision applies to students undertaking combined pre-sessional and main degree courses. It requires a single Confirmation of Acceptance for Studies for courses lasting up to 3 months pre-sessional and beginning within 1 month afterward, with language level conditions (B1 or B2) depending on assessment. Critical conditions include higher education provider compliance and separate language assessments outside student sponsor evaluation.\n\n### Combined Pre-sessional Course requirement for a Student\n\n1.   ST 15.1. A single Confirmation of Acceptance for Studies can be assigned for a combined pre-sessional course and a main course at degree level or above by a higher education provider with a track record of compliance if: \n    1.   (a) the pre-sessional course lasts no longer than 3 months; and\n    2.   (b) the main course will begin no more than 1 month after the pre-sessional course ends.\n\nST 15.2. If the applicant has been assessed as having language ability of at least level B2 in order to meet the English language requirement at ST 13.1., the Confirmation of Acceptance for Studies must confirm that the applicant has an unconditional offer of a place on the main course.\n\nST 15.3. If the applicant has been assessed (which must be by a method other than assessment by the student sponsor) as having language ability of at least level B1 in order to meet the English language requirement at ST 13.1., the Confirmation of Acceptance for Studies must confirm that the student sponsor is satisfied that the applicant will have at least level B2 at the end of the pre-sessional course.",
      "needs_review": false
    },
    {
      "metadata": {
        "source": "Immigration Rules: Appendix Student",
        "part": "Immigration Rules: Appendix Student",
        "section_id": "ST 16.1",
        "section_title": "Postgraduate Doctor or Dentist requirement",
        "parent_section": "ST 16",
        "hierarchy_level": 2,
        "topic": "eligibility",
        "url": "https://www.gov.uk/guidance/immigration-rules/immigration-rules-appendix-student",
        "scraped_at": "2025-12-06T17:30:45.898408"
      },
      "text": "### Postgraduate Doctor or Dentist requirement\n\nST 16.1. DELETED",
      "summary": "This provision applies to postgraduate doctors and dentists seeking visa entry under the Student route. It requires them to meet specific academic and professional standards; however, the detailed conditions are deleted and not specified.",
      "augmented_text": "Document: Immigration Rules: Appendix Student\nPart: Immigration Rules: Appendix Student\nSection ID: ST 16.1\nSection: Postgraduate Doctor or Dentist requirement\nTopic: eligibility\n\nSummary: This provision applies to postgraduate doctors and dentists seeking visa entry under the Student route. It requires them to meet specific academic and professional standards; however, the detailed conditions are deleted and not specified.\n\n### Postgraduate Doctor or Dentist requirement\n\nST 16.1. DELETED",
      "needs_review": false
    },
    {
      "metadata": {
        "source": "Immigration Rules: Appendix Student",
        "part": "Immigration Rules: Appendix Student",
        "section_id": "ST 17.1",
        "section_title": "Work Placement requirement",
        "parent_section": "ST 17",
        "hierarchy_level": 2,
        "topic": "eligibility",
        "url": "https://www.gov.uk/guidance/immigration-rules/immigration-rules-appendix-student",
        "scraped_at": "2025-12-06T17:30:45.898438"
      },
      "text": "### Work Placement requirement\n\nST 17.1. A course that includes a work placement must lead to an approved qualification and the Confirmation of Acceptance for Studies must be assigned by a student sponsor (who is not a probationary sponsor) if the course of study is below degree level.\n\nST 17.2. A work placement must be assessed as an integral part of the course and must not be longer than one third of the total length of the course, except when there is a statutory requirement that it must be so, or where ST 17.3. applies.\n\n1.   ST 17.3. A work placement on a course that is at degree level or above: \n    1.   (a) at a higher education provider with a track record of compliance; or\n    2.   (b) at an overseas higher education institution in the UK; or\n    3.   (c) as part of a qualification recognised as being at UK bachelor’s degree level or above by a student undertaking a study abroad programme in the UK,\n\n2.   must not be longer than half of the total length of the course of study.\n\nST 18.1. DELETED.\n\nST 18.2. DELETED.",
      "summary": "This provision applies to students enrolled in courses with work placements. It requires work placements to be integral to the course, approved, and within specified durations—no more than one-third of below-degree courses and half of degree-level or above courses—unless Statutory or specific conditions apply. Placements must be approved by a sponsored Confirmation of Acceptance for Studies, with exceptions for certain degree-level or recognized qualifications.",
      "augmented_text": "Document: Immigration Rules: Appendix Student\nPart: Immigration Rules: Appendix Student\nSection ID: ST 17.1\nSection: Work Placement requirement\nTopic: eligibility\n\nSummary: This provision applies to students enrolled in courses with work placements. It requires work placements to be integral to the course, approved, and within specified durations—no more than one-third of below-degree courses and half of degree-level or above courses—unless Statutory or specific conditions apply. Placements must be approved by a sponsored Confirmation of Acceptance for Studies, with exceptions for certain degree-level or recognized qualifications.\n\n### Work Placement requirement\n\nST 17.1. A course that includes a work placement must lead to an approved qualification and the Confirmation of Acceptance for Studies must be assigned by a student sponsor (who is not a probationary sponsor) if the course of study is below degree level.\n\nST 17.2. A work placement must be assessed as an integral part of the course and must not be longer than one third of the total length of the course, except when there is a statutory requirement that it must be so, or where ST 17.3. applies.\n\n1.   ST 17.3. A work placement on a course that is at degree level or above: \n    1.   (a) at a higher education provider with a track record of compliance; or\n    2.   (b) at an overseas higher education institution in the UK; or\n    3.   (c) as part of a qualification recognised as being at UK bachelor’s degree level or above by a student undertaking a study abroad programme in the UK,\n\n2.   must not be longer than half of the total length of the course of study.\n\nST 18.1. DELETED.\n\nST 18.2. DELETED.",
      "needs_review": false
    },
    {
      "metadata": {
        "source": "Immigration Rules: Appendix Student",
        "part": "Immigration Rules: Appendix Student",
        "section_id": "ST 19.1",
        "section_title": "Maximum period of study requirement for a Student",
        "parent_section": "ST 19",
        "hierarchy_level": 2,
        "topic": "duration",
        "url": "https://www.gov.uk/guidance/immigration-rules/immigration-rules-appendix-student",
        "scraped_at": "2025-12-06T17:30:45.898486"
      },
      "text": "### Maximum period of study requirement for a Student\n\nST 19.1. If the course is below degree level, the grant of permission must not lead to the applicant being granted more than two years’ permission as a Student to study courses below degree level from the age of 18 unless ST 19.2. applies.\n\nST 19.2. If the course is below degree level but is subject to a regulatory requirement by the Maritime and Coastguard Agency that the applicant must spend at least 12 months at sea as a part of that course, the grant of permission must not lead to the applicant being granted more than 3 years’ permission as a Student from the age of 18 to study courses below degree level.\n\nST 19.3. If the course is at degree level, the grant of permission must not lead to the applicant being granted more than five years’ permission as a Student from the age of 18 to study courses at degree level unless the course of study is one of those listed at ST 19.4.\n\n1.   ST 19.4. The five-year maximum period of study at degree level in ST 19.3. will not apply if the applicant has a Confirmation of Acceptance for Studies that has been assigned for a course of study in one of the following subjects: \n    1.   (a) architecture; or\n    2.   (b) medicine; or\n    3.   (c) dentistry; or\n    4.   (d) veterinary medicine and science; or\n    5.   (e) music at a music college that is a member of Conservatoires UK; or\n    6.   (f) law, where the applicant has completed a course at degree level or above and is applying for a course of study which is: \n        1.   (i) a law conversion course validated by the Solicitors Regulation Authority and the Bar Standards Board in England and Wales; or\n        2.   (ii) a Masters in Law (MLaw) in Northern Ireland; or\n        3.   (iii) an accelerated graduate LLB in Scotland.\n\nST 19.5. DELETED\n\nST 19.6. When calculating the period of permission granted under ST 19.1. to ST 19.5., any period of permission as a Student extended under section 3C of the Immigration Act 1971 will count towards the period of permission granted.",
      "summary": "This provision applies to students studying below or at degree level in the UK. It limits permission to two years for courses below degree level, three years if part of a maritime program, and five years for degree-level studies, unless studying specified subjects like medicine, law, or music at accredited institutions. Exceptions apply for certain regulated courses and subjects.",
      "augmented_text": "Document: Immigration Rules: Appendix Student\nPart: Immigration Rules: Appendix Student\nSection ID: ST 19.1\nSection: Maximum period of study requirement for a Student\nTopic: duration\n\nSummary: This provision applies to students studying below or at degree level in the UK. It limits permission to two years for courses below degree level, three years if part of a maritime program, and five years for degree-level studies, unless studying specified subjects like medicine, law, or music at accredited institutions. Exceptions apply for certain regulated courses and subjects.\n\n### Maximum period of study requirement for a Student\n\nST 19.1. If the course is below degree level, the grant of permission must not lead to the applicant being granted more than two years’ permission as a Student to study courses below degree level from the age of 18 unless ST 19.2. applies.\n\nST 19.2. If the course is below degree level but is subject to a regulatory requirement by the Maritime and Coastguard Agency that the applicant must spend at least 12 months at sea as a part of that course, the grant of permission must not lead to the applicant being granted more than 3 years’ permission as a Student from the age of 18 to study courses below degree level.\n\nST 19.3. If the course is at degree level, the grant of permission must not lead to the applicant being granted more than five years’ permission as a Student from the age of 18 to study courses at degree level unless the course of study is one of those listed at ST 19.4.\n\n1.   ST 19.4. The five-year maximum period of study at degree level in ST 19.3. will not apply if the applicant has a Confirmation of Acceptance for Studies that has been assigned for a course of study in one of the following subjects: \n    1.   (a) architecture; or\n    2.   (b) medicine; or\n    3.   (c) dentistry; or\n    4.   (d) veterinary medicine and science; or\n    5.   (e) music at a music college that is a member of Conservatoires UK; or\n    6.   (f) law, where the applicant has completed a course at degree level or above and is applying for a course of study which is: \n        1.   (i) a law conversion course validated by the Solicitors Regulation Authority and the Bar Standards Board in England and Wales; or\n        2.   (ii) a Masters in Law (MLaw) in Northern Ireland; or\n        3.   (iii) an accelerated graduate LLB in Scotland.\n\nST 19.5. DELETED\n\nST 19.6. When calculating the period of permission granted under ST 19.1. to ST 19.5., any period of permission as a Student extended under section 3C of the Immigration Act 1971 will count towards the period of permission granted.",
      "needs_review": false
    },
    {
      "metadata": {
        "source": "Immigration Rules: Appendix Student",
        "part": "Immigration Rules: Appendix Student",
        "section_id": "ST 20.1",
        "section_title": "Documents used to obtain an offer requirement for a Student",
        "parent_section": null,
        "hierarchy_level": 1,
        "topic": "eligibility",
        "url": "https://www.gov.uk/guidance/immigration-rules/immigration-rules-appendix-student",
        "scraped_at": "2025-12-06T17:30:45.898517"
      },
      "text": "### Documents used to obtain an offer requirement for a Student\n\n1.   ST 20.1. The applicant must provide evidence of the qualifications or references they used to obtain the offer of a place on the course of study from the student sponsor, unless either: \n    1.   (a) the applicant is applying for a course of study at degree level or above and is sponsored by a higher education provider with a track record of compliance; or\n    2.   (b) ST 22.1. applies.\n\n1.   ST 20.2. The evidence of each qualification must be one of the following: \n    1.   (a) the certificate(s) of qualification; or\n    2.   (b) the transcript of results; or\n    3.   (c) a print out of the qualification or transcript results from the awarding body’s online checking service.\n\nST 20.3. Where the applicant has provided a print out of qualifications or transcript results from the awarding body’s online checking service, the decision maker may require the applicant to provide the certificate of qualification or transcript of results.",
      "summary": "Applicants seeking a student visa must provide evidence of their qualifications used to secure their offer, unless applying for degree-level or higher studies with a trusted higher education sponsor or if specified in ST 22.1. Acceptable evidence includes certificates, transcripts, or online verification printouts, with the possibility of requiring original documents upon request.",
      "augmented_text": "Document: Immigration Rules: Appendix Student\nPart: Immigration Rules: Appendix Student\nSection ID: ST 20.1\nSection: Documents used to obtain an offer requirement for a Student\nTopic: eligibility\n\nSummary: Applicants seeking a student visa must provide evidence of their qualifications used to secure their offer, unless applying for degree-level or higher studies with a trusted higher education sponsor or if specified in ST 22.1. Acceptable evidence includes certificates, transcripts, or online verification printouts, with the possibility of requiring original documents upon request.\n\n### Documents used to obtain an offer requirement for a Student\n\n1.   ST 20.1. The applicant must provide evidence of the qualifications or references they used to obtain the offer of a place on the course of study from the student sponsor, unless either: \n    1.   (a) the applicant is applying for a course of study at degree level or above and is sponsored by a higher education provider with a track record of compliance; or\n    2.   (b) ST 22.1. applies.\n\n1.   ST 20.2. The evidence of each qualification must be one of the following: \n    1.   (a) the certificate(s) of qualification; or\n    2.   (b) the transcript of results; or\n    3.   (c) a print out of the qualification or transcript results from the awarding body’s online checking service.\n\nST 20.3. Where the applicant has provided a print out of qualifications or transcript results from the awarding body’s online checking service, the decision maker may require the applicant to provide the certificate of qualification or transcript of results.",
      "needs_review": false
    },
    {
      "metadata": {
        "source": "Immigration Rules: Appendix Student",
        "part": "Immigration Rules: Appendix Student",
        "section_id": "ST 21.1",
        "section_title": "Parental consent requirement for a Student",
        "parent_section": "ST 21",
        "hierarchy_level": 2,
        "topic": "family",
        "url": "https://www.gov.uk/guidance/immigration-rules/immigration-rules-appendix-student",
        "scraped_at": "2025-12-06T17:30:45.898541"
      },
      "text": "### Parental consent requirement for a Student\n\nST 21.1. The applicant must meet the parental consent requirement for applicant not applying as a dependent child in Appendix Children.\n\nST 21.2. DELETED",
      "summary": "This provision applies to Student visa applicants who are not applying as dependent children. They must meet the parental consent requirement unless applying under the Appendix Children. No additional conditions or exceptions are specified.",
      "augmented_text": "Document: Immigration Rules: Appendix Student\nPart: Immigration Rules: Appendix Student\nSection ID: ST 21.1\nSection: Parental consent requirement for a Student\nTopic: family\n\nSummary: This provision applies to Student visa applicants who are not applying as dependent children. They must meet the parental consent requirement unless applying under the Appendix Children. No additional conditions or exceptions are specified.\n\n### Parental consent requirement for a Student\n\nST 21.1. The applicant must meet the parental consent requirement for applicant not applying as a dependent child in Appendix Children.\n\nST 21.2. DELETED",
      "needs_review": false
    },
    {
      "metadata": {
        "source": "Immigration Rules: Appendix Student",
        "part": "Immigration Rules: Appendix Student",
        "section_id": "1",
        "section_title": "Differential evidence requirement for a Student",
        "parent_section": null,
        "hierarchy_level": 1,
        "topic": "financial",
        "url": "https://www.gov.uk/guidance/immigration-rules/immigration-rules-appendix-student",
        "scraped_at": "2025-12-06T17:30:45.898559"
      },
      "text": "### Differential evidence requirement for a Student\n\n1.   ST 22.1. Evidence to show that the applicant meets the financial requirement and the requirement to provide documents used to obtain an offer does not need to be provided with the application (but may be required by the decision maker) if the applicant is applying from the country or territory where they are living, or from in the UK, and the applicant either: \n    1.   (a) holds a passport which shows they are registered as a British National (Overseas), or which was issued by the competent authorities of Hong Kong SAR, Macau SAR or Taiwan (which includes the number of the identification card issued by the competent authority in Taiwan); or\n    2.   (b) is a national of any of the following: \n        1.   Australia\n        2.   Austria\n        3.   Bahrain\n        4.   Barbados\n        5.   Belgium\n        6.   Botswana\n        7.   Brazil\n        8.   Brunei\n        9.   Bulgaria\n        10.   Cambodia\n        11.   Canada\n        12.   Chile\n        13.   China\n        14.   Croatia\n        15.   Republic of Cyprus\n        16.   Czech Republic\n        17.   Denmark\n        18.   The Dominican Republic\n        19.   Estonia\n        20.   Finland\n        21.   France\n        22.   Germany\n        23.   Greece\n        24.   Hungary\n        25.   Iceland\n        26.   Indonesia\n        27.   Ireland\n        28.   Italy\n        29.   Japan\n        30.   Kazakhstan\n        31.   Kuwait\n        32.   Latvia\n        33.   Liechtenstein\n        34.   Lithuania\n        35.   Luxembourg\n        36.   Malaysia\n        37.   Malta\n        38.   Mauritius\n        39.   Mexico\n        40.   Netherlands\n        41.   New Zealand\n        42.   Norway\n        43.   Oman\n        44.   Peru\n        45.   Poland\n        46.   Portugal\n        47.   Qatar\n        48.   Romania\n        49.   Serbia\n        50.   Singapore\n        51.   Slovakia\n        52.   Slovenia\n        53.   South Korea\n        54.   Spain\n        55.   Sweden\n        56.   Switzerland\n        57.   Thailand\n        58.   Tunisia\n        59.   United Arab Emirates\n        60.   United States of America",
      "summary": "This provision applies to Student visa applicants applying from within the UK or their home country. They are not required to submit evidence of meeting financial and offer documents unless requested, provided they hold specific nationalities or residence documentation (e.g., British National Overseas, Hong Kong, Macau, Taiwan, or listed nationalities). Exceptions apply based on nationality or residency status.",
      "augmented_text": "Document: Immigration Rules: Appendix Student\nPart: Immigration Rules: Appendix Student\nSection ID: 1\nSection: Differential evidence requirement for a Student\nTopic: financial\n\nSummary: This provision applies to Student visa applicants applying from within the UK or their home country. They are not required to submit evidence of meeting financial and offer documents unless requested, provided they hold specific nationalities or residence documentation (e.g., British National Overseas, Hong Kong, Macau, Taiwan, or listed nationalities). Exceptions apply based on nationality or residency status.\n\n### Differential evidence requirement for a Student\n\n1.   ST 22.1. Evidence to show that the applicant meets the financial requirement and the requirement to provide documents used to obtain an offer does not need to be provided with the application (but may be required by the decision maker) if the applicant is applying from the country or territory where they are living, or from in the UK, and the applicant either: \n    1.   (a) holds a passport which shows they are registered as a British National (Overseas), or which was issued by the competent authorities of Hong Kong SAR, Macau SAR or Taiwan (which includes the number of the identification card issued by the competent authority in Taiwan); or\n    2.   (b) is a national of any of the following: \n        1.   Australia\n        2.   Austria\n        3.   Bahrain\n        4.   Barbados\n        5.   Belgium\n        6.   Botswana\n        7.   Brazil\n        8.   Brunei\n        9.   Bulgaria\n        10.   Cambodia\n        11.   Canada\n        12.   Chile\n        13.   China\n        14.   Croatia\n        15.   Republic of Cyprus\n        16.   Czech Republic\n        17.   Denmark\n        18.   The Dominican Republic\n        19.   Estonia\n        20.   Finland\n        21.   France\n        22.   Germany\n        23.   Greece\n        24.   Hungary\n        25.   Iceland\n        26.   Indonesia\n        27.   Ireland\n        28.   Italy\n        29.   Japan\n        30.   Kazakhstan\n        31.   Kuwait\n        32.   Latvia\n        33.   Liechtenstein\n        34.   Lithuania\n        35.   Luxembourg\n        36.   Malaysia\n        37.   Malta\n        38.   Mauritius\n        39.   Mexico\n        40.   Netherlands\n        41.   New Zealand\n        42.   Norway\n        43.   Oman\n        44.   Peru\n        45.   Poland\n        46.   Portugal\n        47.   Qatar\n        48.   Romania\n        49.   Serbia\n        50.   Singapore\n        51.   Slovakia\n        52.   Slovenia\n        53.   South Korea\n        54.   Spain\n        55.   Sweden\n        56.   Switzerland\n        57.   Thailand\n        58.   Tunisia\n        59.   United Arab Emirates\n        60.   United States of America",
      "needs_review": false
    },
    {
      "metadata": {
        "source": "Immigration Rules: Appendix Student",
        "part": "Immigration Rules: Appendix Student",
        "section_id": "ST 23.1",
        "section_title": "Information on the Confirmation of Acceptance for Studies requirement",
        "parent_section": null,
        "hierarchy_level": 1,
        "topic": "sponsorship",
        "url": "https://www.gov.uk/guidance/immigration-rules/immigration-rules-appendix-student",
        "scraped_at": "2025-12-06T17:30:45.898591"
      },
      "text": "### Information on the Confirmation of Acceptance for Studies requirement\n\n1.   ST 23.1. The student sponsor must provide all the following information about the course of study on the Confirmation of Acceptance for Studies: \n    1.   (a) title of course; and\n    2.   (b) academic level of course; and\n    3.   (c) course start and end dates; and\n    4.   (d) hours of study per week, including confirmation on whether the course is part-time or full-time; and\n    5.   (e) the address of the main place of study; and\n    6.   (f) the cost of accommodation and fees; and\n    7.   (g) if the student sponsor has assessed the applicant by use of one or more references, details of the references assessed; and\n    8.   (h) if the course involves a work placement, details of any work placement relating to the course; and\n    9.   (i) if the course will be provided by an education provider which is not the student sponsor, details of the partner institution; and\n    10.   (j) whether the ATAS requirement in Annex ATAS applies; and\n    11.   (k) DELETED\n    12.   (l) a statement of how the student sponsor has assessed the applicant’s English language ability including, where relevant, the applicant’s English language test scores in all 4 components (reading, writing, speaking and listening); and\n    13.   (m) if the course is part of a study abroad programme, the name and address of the partner institution; and\n    14.   (n) if the applicant is applying for a full-time, salaried, elected executive position as a Student Union Sabbatical Officer and is part-way through their studies or being sponsored to fill the position in the academic year immediately after their graduation; and\n    15.   (o) DELETED\n    16.   (p) if the applicant has previously been granted permission as a Student, confirmation that the new course meets the academic progress requirement from the previous course as required by ST 14.1. to ST 14.5.",
      "summary": "This provision applies to student sponsors providing a Confirmation of Acceptance for Studies (CAS). They must include detailed course information, including title, dates, hours, location, costs, and assessment of the applicant’s English skills. Critical conditions include disclosing course specifics, work placements if applicable, and details of partner institutions when relevant.",
      "augmented_text": "Document: Immigration Rules: Appendix Student\nPart: Immigration Rules: Appendix Student\nSection ID: ST 23.1\nSection: Information on the Confirmation of Acceptance for Studies requirement\nTopic: sponsorship\n\nSummary: This provision applies to student sponsors providing a Confirmation of Acceptance for Studies (CAS). They must include detailed course information, including title, dates, hours, location, costs, and assessment of the applicant’s English skills. Critical conditions include disclosing course specifics, work placements if applicable, and details of partner institutions when relevant.\n\n### Information on the Confirmation of Acceptance for Studies requirement\n\n1.   ST 23.1. The student sponsor must provide all the following information about the course of study on the Confirmation of Acceptance for Studies: \n    1.   (a) title of course; and\n    2.   (b) academic level of course; and\n    3.   (c) course start and end dates; and\n    4.   (d) hours of study per week, including confirmation on whether the course is part-time or full-time; and\n    5.   (e) the address of the main place of study; and\n    6.   (f) the cost of accommodation and fees; and\n    7.   (g) if the student sponsor has assessed the applicant by use of one or more references, details of the references assessed; and\n    8.   (h) if the course involves a work placement, details of any work placement relating to the course; and\n    9.   (i) if the course will be provided by an education provider which is not the student sponsor, details of the partner institution; and\n    10.   (j) whether the ATAS requirement in Annex ATAS applies; and\n    11.   (k) DELETED\n    12.   (l) a statement of how the student sponsor has assessed the applicant’s English language ability including, where relevant, the applicant’s English language test scores in all 4 components (reading, writing, speaking and listening); and\n    13.   (m) if the course is part of a study abroad programme, the name and address of the partner institution; and\n    14.   (n) if the applicant is applying for a full-time, salaried, elected executive position as a Student Union Sabbatical Officer and is part-way through their studies or being sponsored to fill the position in the academic year immediately after their graduation; and\n    15.   (o) DELETED\n    16.   (p) if the applicant has previously been granted permission as a Student, confirmation that the new course meets the academic progress requirement from the previous course as required by ST 14.1. to ST 14.5.",
      "needs_review": false
    },
    {
      "metadata": {
        "source": "Immigration Rules: Appendix Student",
        "part": "Immigration Rules: Appendix Student",
        "section_id": "ST 24.1",
        "section_title": "Decision on application for a Student",
        "parent_section": "ST 24",
        "hierarchy_level": 2,
        "topic": "eligibility",
        "url": "https://www.gov.uk/guidance/immigration-rules/immigration-rules-appendix-student",
        "scraped_at": "2025-12-06T17:30:45.898602"
      },
      "text": "### Decision on application for a Student\n\nST 24.1. If the decision maker is satisfied that all the suitability and eligibility requirements for a Student are met, the application will be granted; otherwise, the application will be refused.\n\nST 24.2. If the application is refused, the person can apply for an Administrative Review under Appendix AR.",
      "summary": "This provision applies to student applicants, stating that applications are granted if all suitability and eligibility requirements are met; otherwise, they are refused. Applicants refused can request an Administrative Review. No specific thresholds or exceptions are detailed here.",
      "augmented_text": "Document: Immigration Rules: Appendix Student\nPart: Immigration Rules: Appendix Student\nSection ID: ST 24.1\nSection: Decision on application for a Student\nTopic: eligibility\n\nSummary: This provision applies to student applicants, stating that applications are granted if all suitability and eligibility requirements are met; otherwise, they are refused. Applicants refused can request an Administrative Review. No specific thresholds or exceptions are detailed here.\n\n### Decision on application for a Student\n\nST 24.1. If the decision maker is satisfied that all the suitability and eligibility requirements for a Student are met, the application will be granted; otherwise, the application will be refused.\n\nST 24.2. If the application is refused, the person can apply for an Administrative Review under Appendix AR.",
      "needs_review": false
    },
    {
      "metadata": {
        "source": "Immigration Rules: Appendix Student",
        "part": "Immigration Rules: Appendix Student",
        "section_id": "1",
        "section_title": "Period and conditions of grant for a Student",
        "parent_section": null,
        "hierarchy_level": 1,
        "topic": "financial",
        "url": "https://www.gov.uk/guidance/immigration-rules/immigration-rules-appendix-student",
        "scraped_at": "2025-12-06T17:30:45.898618"
      },
      "text": "### Period and conditions of grant for a Student\n\n1.   ST 25.1. The grant of permission will be subject to the following conditions: \n    1.   (a) no access to public funds; and\n    2.   (b) no work, except as specified in ST 26; and\n    3.   (c) no study, except as specified in ST 27.\n    4.   (d) DELETED\n\nST 25.2. The applicant will be granted permission for the duration of the course as specified on the Confirmation of Acceptance for Studies plus the relevant periods specified in ST 25.3.\n\n1.   ST 25.3. The period of permission granted to an applicant before the start of the course who is applying for entry clearance will be either: \n    1.   (a) the relevant period before the course date which is set out in the table below, if entry clearance is granted 1 month or more before the start date of the course; or\n    2.   (b) 7 days before the intended date of travel, if entry clearance is granted less than 1 month before the start date of the course; or\n    3.   (c) with immediate effect, if entry clearance is granted less than 7 days before the intended date of travel and less than 1 month before the start date of the course.\n\nThe applicant will be granted a period of permission dependent on the type and length of course as in the table below:\n\n| Type of Course | Period granted before course start date | Period granted after course end date |\n| --- | --- | --- |\n| A course of 12 months or longer | 1 Month | 4 Months |\n| A course of 6 months or longer but shorter than 12 months | 1 Month | 2 Months |\n| A pre-sessional course of less than 6 months | 1 Month | 1 Month |\n| A course of less than 6 months in length which is not a pre- sessional course | 7 Days | 7 Days |",
      "summary": "This provision applies to Student visa holders, outlining permission conditions such as no public funds, limited work, and restricted study. Permission duration aligns with the course length plus specified pre- and post-course periods, depending on application timing and course duration. Exceptions apply based on application timing and course length.",
      "augmented_text": "Document: Immigration Rules: Appendix Student\nPart: Immigration Rules: Appendix Student\nSection ID: 1\nSection: Period and conditions of grant for a Student\nTopic: financial\n\nSummary: This provision applies to Student visa holders, outlining permission conditions such as no public funds, limited work, and restricted study. Permission duration aligns with the course length plus specified pre- and post-course periods, depending on application timing and course duration. Exceptions apply based on application timing and course length.\n\n### Period and conditions of grant for a Student\n\n1.   ST 25.1. The grant of permission will be subject to the following conditions: \n    1.   (a) no access to public funds; and\n    2.   (b) no work, except as specified in ST 26; and\n    3.   (c) no study, except as specified in ST 27.\n    4.   (d) DELETED\n\nST 25.2. The applicant will be granted permission for the duration of the course as specified on the Confirmation of Acceptance for Studies plus the relevant periods specified in ST 25.3.\n\n1.   ST 25.3. The period of permission granted to an applicant before the start of the course who is applying for entry clearance will be either: \n    1.   (a) the relevant period before the course date which is set out in the table below, if entry clearance is granted 1 month or more before the start date of the course; or\n    2.   (b) 7 days before the intended date of travel, if entry clearance is granted less than 1 month before the start date of the course; or\n    3.   (c) with immediate effect, if entry clearance is granted less than 7 days before the intended date of travel and less than 1 month before the start date of the course.\n\nThe applicant will be granted a period of permission dependent on the type and length of course as in the table below:\n\n| Type of Course | Period granted before course start date | Period granted after course end date |\n| --- | --- | --- |\n| A course of 12 months or longer | 1 Month | 4 Months |\n| A course of 6 months or longer but shorter than 12 months | 1 Month | 2 Months |\n| A pre-sessional course of less than 6 months | 1 Month | 1 Month |\n| A course of less than 6 months in length which is not a pre- sessional course | 7 Days | 7 Days |",
      "needs_review": false
    },
    {
      "metadata": {
        "source": "Immigration Rules: Appendix Student",
        "part": "Immigration Rules: Appendix Student",
        "section_id": "ST26.1",
        "section_title": "Work Conditions for a Student",
        "parent_section": null,
        "hierarchy_level": 2,
        "topic": "employment",
        "url": "https://www.gov.uk/guidance/immigration-rules/immigration-rules-appendix-student",
        "scraped_at": "2025-12-06T17:30:45.898656"
      },
      "text": "### Work Conditions for a Student\n\nST26.1. The applicant will be granted permission with the following employment conditions:\n\n**Type of study****Employment conditions**\nStudent following a full-time course of degree level or above study: \n\n • sponsored by a higher education provider with a track record of compliance; or \n\n • sponsored by an overseas higher education institution to undertake a short-term study abroad programme in the UK 20 hours per week during term-time (full- time employment permitted outside of term-time)\nStudent undertaking a full-time course below degree level study sponsored by a higher education provider with a track record of compliance 10 hours per week during term-time (full- time employment permitted outside of term-time)\nAll other study, including all part-time study No employment permitted\n\nST 26.2. Students are permitted to undertake work related to a work placement, assessed as an integral part of the course, that meets the requirements at ST 17.1. to ST 17.3.\n\nST 26.3. Employment as an elected Student Union Sabbatical Officer or elected National Union of Students (NUS) position is permitted for up to 2 years if the Confirmation of Acceptance for Studies was assigned for this purpose.\n\nST 26.4. DELETED.\n\n1.   ST 26.5. A Student is not allowed to do any of the following: \n    1.   (a) be self-employed or engage in business activity unless ST 26.8 applies; or\n    2.   (b) work as a professional sportsperson (including as a sports coach); or\n    3.   (c) work as an entertainer; or\n    4.   (d) work in a position which would fill a permanent full-time vacancy unless ST 26.6. applies.\n\n1.   ST 26.6. A Student who makes a valid application for permission to stay under the Skilled Worker, or Graduate route, may start employment in a full-time permanent vacancy either up to 3 months prior to the course completion date (for the Skilled Worker route) or once they have successfully completed their course of study (for the Graduate route), provided all of the following apply: \n    1.   (a) the Student is studying a full-time course of study at degree level or above with a higher education provider with a track record of compliance; and\n    2.   (b) the application as a Skilled Worker, or Graduate, was made when the applicant had permission as a Student; and\n    3.   (c) a decision has not been made on the Skilled Worker, or Graduate, application, or where a decision has been made, any Administrative Review against a refusal of that application has not been finally determined.\n\nST 26.7. DELETED\n\n1.   ST 26.8. A Student may be self-employed, if: \n    1.   (a) they have applied for permission on the Innovator Founder route; and\n    2.   (b) that application is supported by an endorsement from an Innovator Founder endorsing body; and\n    3.   (c) the application was made when the applicant had permission as a Student; and\n    4.   (d) a decision has not been made on the application, or where the application has been refused, any Administrative Review against a refusal has not been finally determined.",
      "summary": "This provision applies to student visa applicants and current students. Students can work limited hours during term-time based on their course level (up to 20 hours for degree or abroad study; 10 hours for sub-degree courses) and full-time outside term-time, with restrictions on self-employment, business activities, and professional sports. Work related to course-integrated placements and certain Student Union roles are permitted.",
      "augmented_text": "Document: Immigration Rules: Appendix Student\nPart: Immigration Rules: Appendix Student\nSection ID: ST26.1\nSection: Work Conditions for a Student\nTopic: employment\n\nSummary: This provision applies to student visa applicants and current students. Students can work limited hours during term-time based on their course level (up to 20 hours for degree or abroad study; 10 hours for sub-degree courses) and full-time outside term-time, with restrictions on self-employment, business activities, and professional sports. Work related to course-integrated placements and certain Student Union roles are permitted.\n\n### Work Conditions for a Student\n\nST26.1. The applicant will be granted permission with the following employment conditions:\n\n**Type of study****Employment conditions**\nStudent following a full-time course of degree level or above study: \n\n • sponsored by a higher education provider with a track record of compliance; or \n\n • sponsored by an overseas higher education institution to undertake a short-term study abroad programme in the UK 20 hours per week during term-time (full- time employment permitted outside of term-time)\nStudent undertaking a full-time course below degree level study sponsored by a higher education provider with a track record of compliance 10 hours per week during term-time (full- time employment permitted outside of term-time)\nAll other study, including all part-time study No employment permitted\n\nST 26.2. Students are permitted to undertake work related to a work placement, assessed as an integral part of the course, that meets the requirements at ST 17.1. to ST 17.3.\n\nST 26.3. Employment as an elected Student Union Sabbatical Officer or elected National Union of Students (NUS) position is permitted for up to 2 years if the Confirmation of Acceptance for Studies was assigned for this purpose.\n\nST 26.4. DELETED.\n\n1.   ST 26.5. A Student is not allowed to do any of the following: \n    1.   (a) be self-employed or engage in business activity unless ST 26.8 applies; or\n    2.   (b) work as a professional sportsperson (including as a sports coach); or\n    3.   (c) work as an entertainer; or\n    4.   (d) work in a position which would fill a permanent full-time vacancy unless ST 26.6. applies.\n\n1.   ST 26.6. A Student who makes a valid application for permission to stay under the Skilled Worker, or Graduate route, may start employment in a full-time permanent vacancy either up to 3 months prior to the course completion date (for the Skilled Worker route) or once they have successfully completed their course of study (for the Graduate route), provided all of the following apply: \n    1.   (a) the Student is studying a full-time course of study at degree level or above with a higher education provider with a track record of compliance; and\n    2.   (b) the application as a Skilled Worker, or Graduate, was made when the applicant had permission as a Student; and\n    3.   (c) a decision has not been made on the Skilled Worker, or Graduate, application, or where a decision has been made, any Administrative Review against a refusal of that application has not been finally determined.\n\nST 26.7. DELETED\n\n1.   ST 26.8. A Student may be self-employed, if: \n    1.   (a) they have applied for permission on the Innovator Founder route; and\n    2.   (b) that application is supported by an endorsement from an Innovator Founder endorsing body; and\n    3.   (c) the application was made when the applicant had permission as a Student; and\n    4.   (d) a decision has not been made on the application, or where the application has been refused, any Administrative Review against a refusal has not been finally determined.",
      "needs_review": false
    },
    {
      "metadata": {
        "source": "Immigration Rules: Appendix Student",
        "part": "Immigration Rules: Appendix Student",
        "section_id": "1",
        "section_title": "Study Conditions",
        "parent_section": null,
        "hierarchy_level": 1,
        "topic": "family",
        "url": "https://www.gov.uk/guidance/immigration-rules/immigration-rules-appendix-student",
        "scraped_at": "2025-12-06T17:30:45.898685"
      },
      "text": "### Study Conditions\n\n1.   ST 27.1. A Student must only study with the student sponsor which assigned the Confirmation of Acceptance for Studies unless either: \n    1.   (a) the Student is studying at a partner institution of their student sponsor; or\n    2.   (b) the Student has made an application for permission to stay while they have permission as a Student: \n        1.   (i) which is supported by a valid Confirmation of Acceptance for Studies assigned by a student sponsor; and\n        2.   (ii) the application has not yet been decided, or any Administrative Review against that decision has not been determined; and\n\n    3.   (iii) the Student will be studying at the student sponsor that assigned the Confirmation of Acceptance for Studies.\n\nST 27.2. A Student must only study on the course of study, or courses where a combined pre- sessional course is being taken, for which the Confirmation of Acceptance for Studies was assigned unless ST 27.3. applies.\n\n1.   ST 27.3. A Student may begin studying on a new course with their current student sponsor if: \n    1.   (a) the student sponsor is a higher education provider with a track record of compliance; and\n    2.   (b) the Student has not completed the course that the Confirmation of Acceptance for Studies was assigned for; and\n    3.   (c) the new course is not at a lower qualification level than the course the Confirmation of Acceptance for Studies was assigned for unless they were last granted permission to study an integrated master’s or PhD programme and will now be studying on the lower level qualification of that programme.; and\n    4.   (d) the course is at degree level or above; and\n    5.   (e) any new course at degree level can be completed within the current period of permission; and\n    6.   (f) the student sponsor confirms that new course is related to the course for which the Confirmation of Acceptance for Studies was assigned or supports the Student’s genuine career aspirations.\n\nST 27.4. The Student may study on a study abroad programme overseas that is an integral and assessed part of the course of study named on the Confirmation of Acceptance for Studies.\n\nST 27.5. Supplementary study is permitted.\n\nST 27.6. Study is subject to the ATAS condition in Appendix ATAS.\n\nST 27.7. The Student must not study at a State School or Academy (except for a voluntary grammar school with boarding in Northern Ireland) but if the Student has been granted permission to study at a student sponsor which becomes a State School or Academy during that period of permission the Student may complete the course for which the Confirmation of Acceptance for Studies was assigned.",
      "summary": "Students must study solely with their sponsor who issued their Confirmation of Acceptance for Studies, unless studying at a partner institution or during pending permission applications. They can only pursue the original course or approved combined pre-sessional courses, with limited exceptions allowing course changes under specific conditions involving sponsors' compliance and course level stability.",
      "augmented_text": "Document: Immigration Rules: Appendix Student\nPart: Immigration Rules: Appendix Student\nSection ID: 1\nSection: Study Conditions\nTopic: family\n\nSummary: Students must study solely with their sponsor who issued their Confirmation of Acceptance for Studies, unless studying at a partner institution or during pending permission applications. They can only pursue the original course or approved combined pre-sessional courses, with limited exceptions allowing course changes under specific conditions involving sponsors' compliance and course level stability.\n\n### Study Conditions\n\n1.   ST 27.1. A Student must only study with the student sponsor which assigned the Confirmation of Acceptance for Studies unless either: \n    1.   (a) the Student is studying at a partner institution of their student sponsor; or\n    2.   (b) the Student has made an application for permission to stay while they have permission as a Student: \n        1.   (i) which is supported by a valid Confirmation of Acceptance for Studies assigned by a student sponsor; and\n        2.   (ii) the application has not yet been decided, or any Administrative Review against that decision has not been determined; and\n\n    3.   (iii) the Student will be studying at the student sponsor that assigned the Confirmation of Acceptance for Studies.\n\nST 27.2. A Student must only study on the course of study, or courses where a combined pre- sessional course is being taken, for which the Confirmation of Acceptance for Studies was assigned unless ST 27.3. applies.\n\n1.   ST 27.3. A Student may begin studying on a new course with their current student sponsor if: \n    1.   (a) the student sponsor is a higher education provider with a track record of compliance; and\n    2.   (b) the Student has not completed the course that the Confirmation of Acceptance for Studies was assigned for; and\n    3.   (c) the new course is not at a lower qualification level than the course the Confirmation of Acceptance for Studies was assigned for unless they were last granted permission to study an integrated master’s or PhD programme and will now be studying on the lower level qualification of that programme.; and\n    4.   (d) the course is at degree level or above; and\n    5.   (e) any new course at degree level can be completed within the current period of permission; and\n    6.   (f) the student sponsor confirms that new course is related to the course for which the Confirmation of Acceptance for Studies was assigned or supports the Student’s genuine career aspirations.\n\nST 27.4. The Student may study on a study abroad programme overseas that is an integral and assessed part of the course of study named on the Confirmation of Acceptance for Studies.\n\nST 27.5. Supplementary study is permitted.\n\nST 27.6. Study is subject to the ATAS condition in Appendix ATAS.\n\nST 27.7. The Student must not study at a State School or Academy (except for a voluntary grammar school with boarding in Northern Ireland) but if the Student has been granted permission to study at a student sponsor which becomes a State School or Academy during that period of permission the Student may complete the course for which the Confirmation of Acceptance for Studies was assigned.",
      "needs_review": false
    },
    {
      "metadata": {
        "source": "Immigration Rules: Appendix Student",
        "part": "Immigration Rules: Appendix Student",
        "section_id": "SW 3.1",
        "section_title": "Dependants of a Student",
        "parent_section": null,
        "hierarchy_level": 2,
        "topic": "dependants",
        "url": "https://www.gov.uk/guidance/immigration-rules/immigration-rules-appendix-student",
        "scraped_at": "2025-12-06T17:30:45.898702"
      },
      "text": "### Dependants of a Student",
      "summary": "This provision applies to dependants of International Students in the UK. Dependants must meet certain eligibility criteria and obtain appropriate visas to accompany or join the student, with exceptions for those who fail to meet sponsorship or financial requirements.",
      "augmented_text": "Document: Immigration Rules: Appendix Student\nPart: Immigration Rules: Appendix Student\nSection ID: SW 3.1\nSection: Dependants of a Student\nTopic: dependants\n\nSummary: This provision applies to dependants of International Students in the UK. Dependants must meet certain eligibility criteria and obtain appropriate visas to accompany or join the student, with exceptions for those who fail to meet sponsorship or financial requirements.\n\n### Dependants of a Student",
      "needs_review": false
    },
    {
      "metadata": {
        "source": "Immigration Rules: Appendix Student",
        "part": "Immigration Rules: Appendix Student",
        "section_id": "ST 28.1",
        "section_title": "Validity requirements for a dependent partner or dependent child of a Student",
        "parent_section": "ST 28",
        "hierarchy_level": 2,
        "topic": "leave-to-enter",
        "url": "https://www.gov.uk/guidance/immigration-rules/immigration-rules-appendix-student",
        "scraped_at": "2025-12-06T17:30:45.898727"
      },
      "text": "### Validity requirements for a dependent partner or dependent child of a Student\n\nST 28.1. A person applying for entry clearance or permission to stay as a partner or child of a Student must apply on the specified form on the gov.uk website as follows:\n\n| Location of Partner or Child | Specified form |\n| --- | --- |\n| Applicant outside the UK | Dependant partner visa Dependant child visa |\n| Applicant inside the UK | Dependant partner Dependant child |\n\n1.   ST 28.2. An application for entry clearance or permission to stay as a partner or child of a Student must meet all the following requirements: \n    1.   (a) any fee and Immigration Health Charge must have been paid; and\n    2.   (b) the applicant must have provided biometrics when required; and\n    3.   (c) the applicant must have provided a passport or other travel document which satisfactorily establishes their identity and nationality; and\n    4.   (d) the applicant must be applying as partner or child of a person who: \n        1.   (i) has made a valid application for entry clearance or permission to stay on the Student route that has not been decided; or\n        2.   (ii) has entry clearance or permission to stay on the Student route.\n\nST 28.3. If the applicant has in the 12 months before the date of application completed a course of studies in the UK for which they have been awarded a scholarship or sponsorship by a Government or international scholarship agency covering both fees and living costs for study in the UK, they must provide written consent to the application from that Government or agency.\n\nST 28.4. If applying for permission to stay, the applicant must be in the UK on the date of application.\n\n1.   ST 28.4A. If applying for permission to stay, the applicant must not have, or have last been granted, permission: \n    1.   (a) as a Visitor; or\n    2.   (b) as a Short-term Student; or\n    3.   (c) as a Parent of a Child Student; or\n    4.   (d) as a Seasonal Worker; or\n    5.   (e) as a Domestic Worker in a Private Household; or\n    6.   (f) outside the Immigration Rules.\n\nST 28.5. An application which does not meet all the validity requirements for a partner or child of a Student may be rejected as invalid and not considered.",
      "summary": "Dependent partners or children of Students must apply using specified forms, pay relevant fees and health surcharge, and provide biometrics and identity documents. Applicants must be linked to a Student who has valid or pending permission or an active application on the Student route; scholarship or sponsorship coverage within 12 months does not alter these requirements.",
      "augmented_text": "Document: Immigration Rules: Appendix Student\nPart: Immigration Rules: Appendix Student\nSection ID: ST 28.1\nSection: Validity requirements for a dependent partner or dependent child of a Student\nTopic: leave-to-enter\n\nSummary: Dependent partners or children of Students must apply using specified forms, pay relevant fees and health surcharge, and provide biometrics and identity documents. Applicants must be linked to a Student who has valid or pending permission or an active application on the Student route; scholarship or sponsorship coverage within 12 months does not alter these requirements.\n\n### Validity requirements for a dependent partner or dependent child of a Student\n\nST 28.1. A person applying for entry clearance or permission to stay as a partner or child of a Student must apply on the specified form on the gov.uk website as follows:\n\n| Location of Partner or Child | Specified form |\n| --- | --- |\n| Applicant outside the UK | Dependant partner visa Dependant child visa |\n| Applicant inside the UK | Dependant partner Dependant child |\n\n1.   ST 28.2. An application for entry clearance or permission to stay as a partner or child of a Student must meet all the following requirements: \n    1.   (a) any fee and Immigration Health Charge must have been paid; and\n    2.   (b) the applicant must have provided biometrics when required; and\n    3.   (c) the applicant must have provided a passport or other travel document which satisfactorily establishes their identity and nationality; and\n    4.   (d) the applicant must be applying as partner or child of a person who: \n        1.   (i) has made a valid application for entry clearance or permission to stay on the Student route that has not been decided; or\n        2.   (ii) has entry clearance or permission to stay on the Student route.\n\nST 28.3. If the applicant has in the 12 months before the date of application completed a course of studies in the UK for which they have been awarded a scholarship or sponsorship by a Government or international scholarship agency covering both fees and living costs for study in the UK, they must provide written consent to the application from that Government or agency.\n\nST 28.4. If applying for permission to stay, the applicant must be in the UK on the date of application.\n\n1.   ST 28.4A. If applying for permission to stay, the applicant must not have, or have last been granted, permission: \n    1.   (a) as a Visitor; or\n    2.   (b) as a Short-term Student; or\n    3.   (c) as a Parent of a Child Student; or\n    4.   (d) as a Seasonal Worker; or\n    5.   (e) as a Domestic Worker in a Private Household; or\n    6.   (f) outside the Immigration Rules.\n\nST 28.5. An application which does not meet all the validity requirements for a partner or child of a Student may be rejected as invalid and not considered.",
      "needs_review": false
    },
    {
      "metadata": {
        "source": "Immigration Rules: Appendix Student",
        "part": "Immigration Rules: Appendix Student",
        "section_id": "ST 29.1",
        "section_title": "Suitability requirements for a dependent partner or dependent child of a Student",
        "parent_section": "ST 29",
        "hierarchy_level": 2,
        "topic": "suitability",
        "url": "https://www.gov.uk/guidance/immigration-rules/immigration-rules-appendix-student",
        "scraped_at": "2025-12-06T17:30:45.898746"
      },
      "text": "### Suitability requirements for a dependent partner or dependent child of a Student\n\nST 29.1. The suitability requirements for a partner or child on the Student route are that they must not fall for refusal under Part Suitability.\n\n1.   ST 29.2. A person applying for permission to stay must not be: \n    1.   (a) in the UK in breach of immigration laws, except that where the Exceptions for overstayers section of Part Suitability applies, that period of overstaying will be disregarded; or\n    2.   (b) on immigration bail.",
      "summary": "This provision applies to dependent partners and children of Student visa holders. They must meet suitability criteria, including not being in breach of immigration laws (subject to exceptions) or on bail, to be granted or remain in the UK.",
      "augmented_text": "Document: Immigration Rules: Appendix Student\nPart: Immigration Rules: Appendix Student\nSection ID: ST 29.1\nSection: Suitability requirements for a dependent partner or dependent child of a Student\nTopic: suitability\n\nSummary: This provision applies to dependent partners and children of Student visa holders. They must meet suitability criteria, including not being in breach of immigration laws (subject to exceptions) or on bail, to be granted or remain in the UK.\n\n### Suitability requirements for a dependent partner or dependent child of a Student\n\nST 29.1. The suitability requirements for a partner or child on the Student route are that they must not fall for refusal under Part Suitability.\n\n1.   ST 29.2. A person applying for permission to stay must not be: \n    1.   (a) in the UK in breach of immigration laws, except that where the Exceptions for overstayers section of Part Suitability applies, that period of overstaying will be disregarded; or\n    2.   (b) on immigration bail.",
      "needs_review": false
    },
    {
      "metadata": {
        "source": "Immigration Rules: Appendix Student",
        "part": "Immigration Rules: Appendix Student",
        "section_id": "Eligibility requirements for a dependent partner or dependent child of a Student",
        "section_title": "Eligibility requirements for a dependent partner or dependent child of a Student",
        "parent_section": null,
        "hierarchy_level": 3,
        "topic": "eligibility",
        "url": "https://www.gov.uk/guidance/immigration-rules/immigration-rules-appendix-student",
        "scraped_at": "2025-12-06T17:30:45.898754"
      },
      "text": "### Eligibility requirements for a dependent partner or dependent child of a Student",
      "summary": "This provision applies to dependents of Student visa holders, including partners and children. They must meet eligibility criteria demonstrating genuine relationship, support, and accommodation, with requirements varying based on circumstances. No specific exceptions are noted here beyond standard criteria.",
      "augmented_text": "Document: Immigration Rules: Appendix Student\nPart: Immigration Rules: Appendix Student\nSection ID: Eligibility requirements for a dependent partner or dependent child of a Student\nSection: Eligibility requirements for a dependent partner or dependent child of a Student\nTopic: eligibility\n\nSummary: This provision applies to dependents of Student visa holders, including partners and children. They must meet eligibility criteria demonstrating genuine relationship, support, and accommodation, with requirements varying based on circumstances. No specific exceptions are noted here beyond standard criteria.\n\n### Eligibility requirements for a dependent partner or dependent child of a Student",
      "needs_review": false
    },
    {
      "metadata": {
        "source": "Immigration Rules: Appendix Student",
        "part": "Immigration Rules: Appendix Student",
        "section_id": "ST 30.1",
        "section_title": "Entry requirement for a dependent partner or dependent child of a Student",
        "parent_section": "ST 30",
        "hierarchy_level": 2,
        "topic": "leave-to-enter",
        "url": "https://www.gov.uk/guidance/immigration-rules/immigration-rules-appendix-student",
        "scraped_at": "2025-12-06T17:30:45.898776"
      },
      "text": "### Entry requirement for a dependent partner or dependent child of a Student\n\nST 30.1. A person seeking to come to the UK as a partner or child of a Student must apply for and obtain entry clearance as a partner or child before they arrive in the UK.\n\nST 30.2. A person applying for entry clearance as the partner or child of a Student must, if Appendix Tuberculosis applies, provide a valid medical certificate confirming that they have undergone screening for active pulmonary tuberculosis and that this tuberculosis is not present in them.",
      "summary": "Dependents (partner or child) of Students must apply for and obtain entry clearance before arriving in the UK. Applicants subject to tuberculosis screening must provide a valid medical certificate confirming they are free of active pulmonary TB.",
      "augmented_text": "Document: Immigration Rules: Appendix Student\nPart: Immigration Rules: Appendix Student\nSection ID: ST 30.1\nSection: Entry requirement for a dependent partner or dependent child of a Student\nTopic: leave-to-enter\n\nSummary: Dependents (partner or child) of Students must apply for and obtain entry clearance before arriving in the UK. Applicants subject to tuberculosis screening must provide a valid medical certificate confirming they are free of active pulmonary TB.\n\n### Entry requirement for a dependent partner or dependent child of a Student\n\nST 30.1. A person seeking to come to the UK as a partner or child of a Student must apply for and obtain entry clearance as a partner or child before they arrive in the UK.\n\nST 30.2. A person applying for entry clearance as the partner or child of a Student must, if Appendix Tuberculosis applies, provide a valid medical certificate confirming that they have undergone screening for active pulmonary tuberculosis and that this tuberculosis is not present in them.",
      "needs_review": false
    },
    {
      "metadata": {
        "source": "Immigration Rules: Appendix Student",
        "part": "Immigration Rules: Appendix Student",
        "section_id": "1",
        "section_title": "Student course requirement for a dependent partner or dependent child of a Student",
        "parent_section": null,
        "hierarchy_level": 1,
        "topic": "family",
        "url": "https://www.gov.uk/guidance/immigration-rules/immigration-rules-appendix-student",
        "scraped_at": "2025-12-06T17:30:45.898805"
      },
      "text": "### Student course requirement for a dependent partner or dependent child of a Student\n\n1.   ST 31.1. Unless they are a child who meets the requirements in ST 31.2., the applicant must be the partner or child of a person who is: \n    1.   (a) a Student who has received a scholarship or sponsorship from a Government for study in the UK and has, or is applying for, permission to study on a full-time course of 6 months or longer; or\n    2.   (b) a full-time Student who has, or is applying for, permission to study a postgraduate level course of 9 months or longer at a higher education provider with a track record of compliance and, if the course start date is on or after 1 January 2024, the provider has confirmed the course is a PhD or other doctoral qualification, or a research-based higher degree; or\n    3.   (c) DELETED\n    4.   (d) a Student who has, or had within the last 3 months before the date of application, permission to study on a full-time course of 6 months or longer, and is now applying for permission to study a full-time course of 6 months or longer where either: \n        1.   (i) the partner or child already has, or had within the last 3 months before the date of application, permission as a dependent partner or dependent child of the Student; or\n        2.   (ii) the child was born since the last grant of permission to the Student, where the Student and partner or child are applying at the same time.\n\n1.   ST 31.2. If the applicant is a child who does not meet the requirement at ST.31.1., they must instead meet one of the following requirements: \n    1.   (a) the applicant must have been born during the Student’s current period of permission to study a full-time course of 6 months or longer and they are applying for permission during that period; or\n    2.   (b) where the Student has permission to re-sit examinations or repeat a module of a full- time course of 6 months or longer, the applicant must have been born either: \n        1.   (i) during the Student’s original period of permission; or\n        2.   (ii) during the period of permission granted for re-sitting examinations or to repeat a module; or\n\n    3.   (c) the applicant must have been born no more than 3 months after the expiry of the Student’s most recent permission and must be making an application for entry clearance within 6 months of the expiry of their parent’s most recent permission.",
      "summary": "This provision applies to dependents (partners or children) of UK Students seeking entry or permission. They must be linked to a Student with a government scholarship or studying full-time for 6+ months (undergraduate or postgraduate), or meet specific recent permission criteria. The rules exclude children under certain age and status conditions.",
      "augmented_text": "Document: Immigration Rules: Appendix Student\nPart: Immigration Rules: Appendix Student\nSection ID: 1\nSection: Student course requirement for a dependent partner or dependent child of a Student\nTopic: family\n\nSummary: This provision applies to dependents (partners or children) of UK Students seeking entry or permission. They must be linked to a Student with a government scholarship or studying full-time for 6+ months (undergraduate or postgraduate), or meet specific recent permission criteria. The rules exclude children under certain age and status conditions.\n\n### Student course requirement for a dependent partner or dependent child of a Student\n\n1.   ST 31.1. Unless they are a child who meets the requirements in ST 31.2., the applicant must be the partner or child of a person who is: \n    1.   (a) a Student who has received a scholarship or sponsorship from a Government for study in the UK and has, or is applying for, permission to study on a full-time course of 6 months or longer; or\n    2.   (b) a full-time Student who has, or is applying for, permission to study a postgraduate level course of 9 months or longer at a higher education provider with a track record of compliance and, if the course start date is on or after 1 January 2024, the provider has confirmed the course is a PhD or other doctoral qualification, or a research-based higher degree; or\n    3.   (c) DELETED\n    4.   (d) a Student who has, or had within the last 3 months before the date of application, permission to study on a full-time course of 6 months or longer, and is now applying for permission to study a full-time course of 6 months or longer where either: \n        1.   (i) the partner or child already has, or had within the last 3 months before the date of application, permission as a dependent partner or dependent child of the Student; or\n        2.   (ii) the child was born since the last grant of permission to the Student, where the Student and partner or child are applying at the same time.\n\n1.   ST 31.2. If the applicant is a child who does not meet the requirement at ST.31.1., they must instead meet one of the following requirements: \n    1.   (a) the applicant must have been born during the Student’s current period of permission to study a full-time course of 6 months or longer and they are applying for permission during that period; or\n    2.   (b) where the Student has permission to re-sit examinations or repeat a module of a full- time course of 6 months or longer, the applicant must have been born either: \n        1.   (i) during the Student’s original period of permission; or\n        2.   (ii) during the period of permission granted for re-sitting examinations or to repeat a module; or\n\n    3.   (c) the applicant must have been born no more than 3 months after the expiry of the Student’s most recent permission and must be making an application for entry clearance within 6 months of the expiry of their parent’s most recent permission.",
      "needs_review": false
    },
    {
      "metadata": {
        "source": "Immigration Rules: Appendix Student",
        "part": "Immigration Rules: Appendix Student",
        "section_id": "1",
        "section_title": "Relationship requirement for dependent partner of a Student",
        "parent_section": null,
        "hierarchy_level": 1,
        "topic": "family",
        "url": "https://www.gov.uk/guidance/immigration-rules/immigration-rules-appendix-student",
        "scraped_at": "2025-12-06T17:30:45.898830"
      },
      "text": "### Relationship requirement for dependent partner of a Student\n\n1.   ST 32.1. The applicant must be the partner of a Person (P) where one of the following applies: \n    1.   (a) P has permission to stay on the Student route; or\n    2.   (b) P is, at the same time, applying for (and is granted) entry clearance or permission to stay on the Student route.\n\nST 32.2. The requirements of Appendix Relationship with Partner must be met.\n\nST 32.3. DELETED\n\nST 32.4. DELETED\n\nST 32.5. DELETED\n\nST 32.6. DELETED",
      "summary": "This provision applies to dependent partners of Student visa holders or applicants. They must demonstrate a genuine relationship with a Person authorized to stay under the Student route and meet the requirements of the Appendix Relationship with Partner. Exceptions or additional conditions are not specified in the provided text.",
      "augmented_text": "Document: Immigration Rules: Appendix Student\nPart: Immigration Rules: Appendix Student\nSection ID: 1\nSection: Relationship requirement for dependent partner of a Student\nTopic: family\n\nSummary: This provision applies to dependent partners of Student visa holders or applicants. They must demonstrate a genuine relationship with a Person authorized to stay under the Student route and meet the requirements of the Appendix Relationship with Partner. Exceptions or additional conditions are not specified in the provided text.\n\n### Relationship requirement for dependent partner of a Student\n\n1.   ST 32.1. The applicant must be the partner of a Person (P) where one of the following applies: \n    1.   (a) P has permission to stay on the Student route; or\n    2.   (b) P is, at the same time, applying for (and is granted) entry clearance or permission to stay on the Student route.\n\nST 32.2. The requirements of Appendix Relationship with Partner must be met.\n\nST 32.3. DELETED\n\nST 32.4. DELETED\n\nST 32.5. DELETED\n\nST 32.6. DELETED",
      "needs_review": false
    },
    {
      "metadata": {
        "source": "Immigration Rules: Appendix Student",
        "part": "Immigration Rules: Appendix Student",
        "section_id": "ST 33.1",
        "section_title": "Financial requirement for dependent partner of a Student",
        "parent_section": "ST 33",
        "hierarchy_level": 2,
        "topic": "financial",
        "url": "https://www.gov.uk/guidance/immigration-rules/immigration-rules-appendix-student",
        "scraped_at": "2025-12-06T17:30:45.898851"
      },
      "text": "### Financial requirement for dependent partner of a Student\n\nST 33.1. If the applicant is applying for permission to stay and has been living in the UK with permission for 12 months or longer on the date of application, they will meet the financial requirement and do not need to show funds.\n\nST 33.2. If the applicant is applying for entry clearance or permission to stay, where they have been in the UK less than 12 months, the applicant or their partner (who must be a Student or applying at the same time as a Student) must have the funds specified in the table below, for a total of 9 months, or for the period of permission applied for by the applicant, whichever is the shorter.\n\n| Place of Student’s study | Funds required by a dependent partner |\n| --- | --- |\n| Studying in London | £845 per month |\n| Studying outside London | £680 per month |\n\nST 33.3. The funds must be in addition to the funds required for the Student to meet the financial requirement, and the funds required to meet the financial requirement for any dependent child who is applying at the same time, or is already in the UK as a dependent child of the Student.\n\nST 33.4. Unless the applicant is relying on financial sponsorship from a Government or international scholarship agency that covers the living costs of the applicant and the Student, they must show that they have held the required level of funds for a 28-day period and as specified in Appendix Finance.\n\nST 33.5. Unless the applicant is applying at the same time as the Student and ST 22.1. applies, the applicant must show that they have the required funds as specified in Appendix Finance.\n\nST.33.6. If the funds held in the applicant’s account on the date of decision fall substantially below the level of funds required at ST 33.2, the decision maker must be satisfied that the spent funds have been used to pay a deposit for accommodation or other costs associated with the proposed period of permission in the UK.\n\nST 34.1. DELETED\n\nST 34.2. DELETED\n\nST 34.3. DELETED\n\nST 35.1. DELETED\n\nST 36.1. DELETED\n\nST 36.2. DELETED",
      "summary": "Dependent partners of Students must meet specified financial requirements based on duration in the UK—either no funds if in the UK 12+ months or proof of funds covering 9 months (£845/month in London, £680 outside). Funds must be in addition to the Student's own funds and held for 28 days unless sponsored; exceptions apply for sponsorship.",
      "augmented_text": "Document: Immigration Rules: Appendix Student\nPart: Immigration Rules: Appendix Student\nSection ID: ST 33.1\nSection: Financial requirement for dependent partner of a Student\nTopic: financial\n\nSummary: Dependent partners of Students must meet specified financial requirements based on duration in the UK—either no funds if in the UK 12+ months or proof of funds covering 9 months (£845/month in London, £680 outside). Funds must be in addition to the Student's own funds and held for 28 days unless sponsored; exceptions apply for sponsorship.\n\n### Financial requirement for dependent partner of a Student\n\nST 33.1. If the applicant is applying for permission to stay and has been living in the UK with permission for 12 months or longer on the date of application, they will meet the financial requirement and do not need to show funds.\n\nST 33.2. If the applicant is applying for entry clearance or permission to stay, where they have been in the UK less than 12 months, the applicant or their partner (who must be a Student or applying at the same time as a Student) must have the funds specified in the table below, for a total of 9 months, or for the period of permission applied for by the applicant, whichever is the shorter.\n\n| Place of Student’s study | Funds required by a dependent partner |\n| --- | --- |\n| Studying in London | £845 per month |\n| Studying outside London | £680 per month |\n\nST 33.3. The funds must be in addition to the funds required for the Student to meet the financial requirement, and the funds required to meet the financial requirement for any dependent child who is applying at the same time, or is already in the UK as a dependent child of the Student.\n\nST 33.4. Unless the applicant is relying on financial sponsorship from a Government or international scholarship agency that covers the living costs of the applicant and the Student, they must show that they have held the required level of funds for a 28-day period and as specified in Appendix Finance.\n\nST 33.5. Unless the applicant is applying at the same time as the Student and ST 22.1. applies, the applicant must show that they have the required funds as specified in Appendix Finance.\n\nST.33.6. If the funds held in the applicant’s account on the date of decision fall substantially below the level of funds required at ST 33.2, the decision maker must be satisfied that the spent funds have been used to pay a deposit for accommodation or other costs associated with the proposed period of permission in the UK.\n\nST 34.1. DELETED\n\nST 34.2. DELETED\n\nST 34.3. DELETED\n\nST 35.1. DELETED\n\nST 36.1. DELETED\n\nST 36.2. DELETED",
      "needs_review": false
    },
    {
      "metadata": {
        "source": "Immigration Rules: Appendix Student",
        "part": "Immigration Rules: Appendix Student",
        "section_id": "1",
        "section_title": "Requirements for a dependent child of a Student",
        "parent_section": null,
        "hierarchy_level": 1,
        "topic": "leave-to-enter",
        "url": "https://www.gov.uk/guidance/immigration-rules/immigration-rules-appendix-student",
        "scraped_at": "2025-12-06T17:30:45.898873"
      },
      "text": "### Requirements for a dependent child of a Student\n\n1.   ST 36A.1. The applicant must meet the following requirements for a dependent child in Appendix Children: \n    1.   (a) relationship requirement: entry clearance and permission to stay; and\n    2.   (b) care requirement; and\n    3.   (c) age and independent life requirement.",
      "summary": "Dependent children of Students must satisfy the relationship, care, and age/independent life requirements outlined in Appendix Children to gain entry clearance and permission to stay, subject to specific eligibility conditions.",
      "augmented_text": "Document: Immigration Rules: Appendix Student\nPart: Immigration Rules: Appendix Student\nSection ID: 1\nSection: Requirements for a dependent child of a Student\nTopic: leave-to-enter\n\nSummary: Dependent children of Students must satisfy the relationship, care, and age/independent life requirements outlined in Appendix Children to gain entry clearance and permission to stay, subject to specific eligibility conditions.\n\n### Requirements for a dependent child of a Student\n\n1.   ST 36A.1. The applicant must meet the following requirements for a dependent child in Appendix Children: \n    1.   (a) relationship requirement: entry clearance and permission to stay; and\n    2.   (b) care requirement; and\n    3.   (c) age and independent life requirement.",
      "needs_review": false
    },
    {
      "metadata": {
        "source": "Immigration Rules: Appendix Student",
        "part": "Immigration Rules: Appendix Student",
        "section_id": "ST 37.1",
        "section_title": "Financial requirement for dependent child of a Student",
        "parent_section": "ST 37",
        "hierarchy_level": 2,
        "topic": "financial",
        "url": "https://www.gov.uk/guidance/immigration-rules/immigration-rules-appendix-student",
        "scraped_at": "2025-12-06T17:30:45.898888"
      },
      "text": "### Financial requirement for dependent child of a Student\n\nST 37.1. If the applicant is applying for permission to stay and has been in the UK with permission for 12 months or longer on the date of application, they will meet the financial requirement and do not need to show funds.\n\nST 37.2. Where the applicant is applying for entry clearance, or permission to stay and they have been in the UK less than 12 months on the date of application, the applicant or their parent must have the funds specified in the table below, for a total of 9 months, or for the period of permission applied for by the applicant, whichever is the shorter.\n\n| Place of Student’s study | Funds required for a dependent child |\n| --- | --- |\n| Studying in London | £845 per month |\n| Studying outside London | £680 per month |\n\nST 37.3. The funds must be in addition to the funds required for the Student to meet the financial requirement, and the funds required for any dependant of the Student, who is applying at the same time as the applicant or is already in the UK as a dependant of the Student.\n\nST 37.4. Where ST 37.2. applies, unless the applicant is relying on financial sponsorship from a Government or international scholarship agency that covers the living costs of the Student and the applicant, the required level of funds must have been held for a 28-day period and as specified in Appendix Finance.\n\nST.37.5. If the funds held in the applicant’s account on the date of decision fall substantially below the level of funds required at ST 37.2, the decision maker must be satisfied that the spent funds have been used to pay a deposit for accommodation or other costs associated with the proposed period of permission in the UK.",
      "summary": "Dependent children of Students must either have been in the UK for 12 months or more (requiring no funds) or demonstrate funds covering 9 months based on their study location, with the amount specified (£845/london, £680/outside London). Funds must be additional to the Student’s, held for 28 days unless sponsored; exceptions apply for students with over 12 months’ UK presence.",
      "augmented_text": "Document: Immigration Rules: Appendix Student\nPart: Immigration Rules: Appendix Student\nSection ID: ST 37.1\nSection: Financial requirement for dependent child of a Student\nTopic: financial\n\nSummary: Dependent children of Students must either have been in the UK for 12 months or more (requiring no funds) or demonstrate funds covering 9 months based on their study location, with the amount specified (£845/london, £680/outside London). Funds must be additional to the Student’s, held for 28 days unless sponsored; exceptions apply for students with over 12 months’ UK presence.\n\n### Financial requirement for dependent child of a Student\n\nST 37.1. If the applicant is applying for permission to stay and has been in the UK with permission for 12 months or longer on the date of application, they will meet the financial requirement and do not need to show funds.\n\nST 37.2. Where the applicant is applying for entry clearance, or permission to stay and they have been in the UK less than 12 months on the date of application, the applicant or their parent must have the funds specified in the table below, for a total of 9 months, or for the period of permission applied for by the applicant, whichever is the shorter.\n\n| Place of Student’s study | Funds required for a dependent child |\n| --- | --- |\n| Studying in London | £845 per month |\n| Studying outside London | £680 per month |\n\nST 37.3. The funds must be in addition to the funds required for the Student to meet the financial requirement, and the funds required for any dependant of the Student, who is applying at the same time as the applicant or is already in the UK as a dependant of the Student.\n\nST 37.4. Where ST 37.2. applies, unless the applicant is relying on financial sponsorship from a Government or international scholarship agency that covers the living costs of the Student and the applicant, the required level of funds must have been held for a 28-day period and as specified in Appendix Finance.\n\nST.37.5. If the funds held in the applicant’s account on the date of decision fall substantially below the level of funds required at ST 37.2, the decision maker must be satisfied that the spent funds have been used to pay a deposit for accommodation or other costs associated with the proposed period of permission in the UK.",
      "needs_review": false
    },
    {
      "metadata": {
        "source": "Immigration Rules: Appendix Student",
        "part": "Immigration Rules: Appendix Student",
        "section_id": "ST 38.1",
        "section_title": "Decision on an application as a dependent partner or dependent child of a Student",
        "parent_section": "ST 38",
        "hierarchy_level": 2,
        "topic": "eligibility",
        "url": "https://www.gov.uk/guidance/immigration-rules/immigration-rules-appendix-student",
        "scraped_at": "2025-12-06T17:30:45.898899"
      },
      "text": "### Decision on an application as a dependent partner or dependent child of a Student\n\nST 38.1. If the decision maker is satisfied that all the suitability and eligibility requirements for the dependent partner or dependent child of a Student are met, the application will be granted, otherwise the application will be refused.\n\nST 38.2. If the application is refused, the person can apply for an Administrative Review under Appendix AR.",
      "summary": "This provision applies to dependent partners or children of Students. The decision maker grants the application if suitability and eligibility criteria are met; otherwise, it is refused, with a right to an Administrative Review.",
      "augmented_text": "Document: Immigration Rules: Appendix Student\nPart: Immigration Rules: Appendix Student\nSection ID: ST 38.1\nSection: Decision on an application as a dependent partner or dependent child of a Student\nTopic: eligibility\n\nSummary: This provision applies to dependent partners or children of Students. The decision maker grants the application if suitability and eligibility criteria are met; otherwise, it is refused, with a right to an Administrative Review.\n\n### Decision on an application as a dependent partner or dependent child of a Student\n\nST 38.1. If the decision maker is satisfied that all the suitability and eligibility requirements for the dependent partner or dependent child of a Student are met, the application will be granted, otherwise the application will be refused.\n\nST 38.2. If the application is refused, the person can apply for an Administrative Review under Appendix AR.",
      "needs_review": false
    },
    {
      "metadata": {
        "source": "Immigration Rules: Appendix Student",
        "part": "Immigration Rules: Appendix Student",
        "section_id": "ST 39.1",
        "section_title": "Period and conditions of grant for a dependent partner or dependent child of a Student",
        "parent_section": "ST 39",
        "hierarchy_level": 2,
        "topic": "family",
        "url": "https://www.gov.uk/guidance/immigration-rules/immigration-rules-appendix-student",
        "scraped_at": "2025-12-06T17:30:45.898932"
      },
      "text": "### Period and conditions of grant for a dependent partner or dependent child of a Student\n\nST 39.1. A dependent partner will be granted permission which ends on the same date as the Student’s permission.\n\nST 39.2. A dependent child will be granted permission which ends on the same date as whichever of their parents’ permission ends first.\n\n1.   ST 39.3. The grant will be subject to all the following conditions: \n    1.   (a) no access to public funds; and\n    2.   (b) work (including self-employment and voluntary work) is permitted except: \n        1.   (i) where the dependant meets the requirement at ST 31.1.(d) and the Student has been granted less than 9 months’ permission, unless that is to continue a course of study where they had previously been granted at least 9 months’ permission; or\n        2.   (ii) where the dependant meets the requirement at ST 31.1.(d) and the Student is studying a course below degree level; or\n        3.   (iii) no employment as a professional sportsperson (including as a sports coach); and\n\n    3.   (c) study is permitted, subject to the ATAS condition in Appendix ATAS (if the study will commence when the partner or child is aged over 18).\n    4.   (d) DELETED\n\nPrint this page",
      "summary": "Dependents of Students are granted permission that ends with the Student’s (or the earlier of two parents' for children). They cannot access public funds, may work under specific conditions, and study permission is subject to ATAS if over 18. Exceptions apply based on course length and level.",
      "augmented_text": "Document: Immigration Rules: Appendix Student\nPart: Immigration Rules: Appendix Student\nSection ID: ST 39.1\nSection: Period and conditions of grant for a dependent partner or dependent child of a Student\nTopic: family\n\nSummary: Dependents of Students are granted permission that ends with the Student’s (or the earlier of two parents' for children). They cannot access public funds, may work under specific conditions, and study permission is subject to ATAS if over 18. Exceptions apply based on course length and level.\n\n### Period and conditions of grant for a dependent partner or dependent child of a Student\n\nST 39.1. A dependent partner will be granted permission which ends on the same date as the Student’s permission.\n\nST 39.2. A dependent child will be granted permission which ends on the same date as whichever of their parents’ permission ends first.\n\n1.   ST 39.3. The grant will be subject to all the following conditions: \n    1.   (a) no access to public funds; and\n    2.   (b) work (including self-employment and voluntary work) is permitted except: \n        1.   (i) where the dependant meets the requirement at ST 31.1.(d) and the Student has been granted less than 9 months’ permission, unless that is to continue a course of study where they had previously been granted at least 9 months’ permission; or\n        2.   (ii) where the dependant meets the requirement at ST 31.1.(d) and the Student is studying a course below degree level; or\n        3.   (iii) no employment as a professional sportsperson (including as a sports coach); and\n\n    3.   (c) study is permitted, subject to the ATAS condition in Appendix ATAS (if the study will commence when the partner or child is aged over 18).\n    4.   (d) DELETED\n\nPrint this page",
      "needs_review": false
    }
  ]
}