{
  "url": "https://www.gov.uk/guidance/immigration-rules/immigration-rules-appendix-t5-temporary-worker-religious-worker",
  "part_name": "Appendix Temporary Work – Religious Worker",
  "scraped_at": "2025-12-06T17:25:44.175814",
  "chunk_count": 24,
  "chunks": [
    {
      "metadata": {
        "source": "Appendix Temporary Work – Religious Worker",
        "part": "Appendix Temporary Work – Religious Worker",
        "section_id": "RW 1.1",
        "section_title": "Validity requirements for a Religious Worker",
        "parent_section": "RW 1",
        "hierarchy_level": 2,
        "topic": "leave-to-enter",
        "url": "https://www.gov.uk/guidance/immigration-rules/immigration-rules-appendix-t5-temporary-worker-religious-worker",
        "scraped_at": "2025-12-06T17:25:44.175022"
      },
      "text": "### Validity requirements for a Religious Worker\n\nRW 1.1. A person applying for entry clearance or permission to stay as a Religious Worker must apply online on gov.uk on the specified form as follows:\n\n| Applicant | Specified form |\n| --- | --- |\n| EEA national with a chipped passport | Either: • Temporary Worker using the UK Immigration: ID Check app; or • the forms listed below for applicants outside or inside the UK (as relevant) |\n| Applicants outside the UK | Temporary Worker visa |\n| Applicants inside the UK | Temporary Worker |\n\n1.   RW 1.2. An application for entry clearance or permission to stay as a Religious Worker must meet all the following requirements: \n    1.   (a) any fee and Immigration Health Charge must have been paid; and\n    2.   (b) the applicant must have provided biometrics when required; and\n    3.   (c) the applicant must have provided a passport or other travel document which satisfactorily establishes their identity and nationality; and\n    4.   (d) the applicant must have a Certificate of Sponsorship that was issued to them no more than 3 months before the date of application.\n\nRW 1.3. The applicant must be aged 18 or over on the date of application.\n\nRW 1.4. If applying for permission to stay, the applicant must be in the UK on the date of application.\n\nRW 1.4A. If applying for permission to stay, the applicant must have, or have last had, permission as a Religious Worker.\n\nRW 1.5. An application which does not meet all the validity requirements for a Religious Worker may be rejected as invalid and not considered.",
      "summary": "Applicants for a Religious Worker visa must apply online using the specified form, pay relevant fees, provide biometrics, travel documents, and a valid Certificate of Sponsorship issued within three months. They must be aged 18 or over and, if applying to stay, be in the UK with prior permission as a Religious Worker. Failure to meet these validity requirements invalidates the application.",
      "augmented_text": "Document: Appendix Temporary Work – Religious Worker\nPart: Appendix Temporary Work – Religious Worker\nSection ID: RW 1.1\nSection: Validity requirements for a Religious Worker\nTopic: leave-to-enter\n\nSummary: Applicants for a Religious Worker visa must apply online using the specified form, pay relevant fees, provide biometrics, travel documents, and a valid Certificate of Sponsorship issued within three months. They must be aged 18 or over and, if applying to stay, be in the UK with prior permission as a Religious Worker. Failure to meet these validity requirements invalidates the application.\n\n### Validity requirements for a Religious Worker\n\nRW 1.1. A person applying for entry clearance or permission to stay as a Religious Worker must apply online on gov.uk on the specified form as follows:\n\n| Applicant | Specified form |\n| --- | --- |\n| EEA national with a chipped passport | Either: • Temporary Worker using the UK Immigration: ID Check app; or • the forms listed below for applicants outside or inside the UK (as relevant) |\n| Applicants outside the UK | Temporary Worker visa |\n| Applicants inside the UK | Temporary Worker |\n\n1.   RW 1.2. An application for entry clearance or permission to stay as a Religious Worker must meet all the following requirements: \n    1.   (a) any fee and Immigration Health Charge must have been paid; and\n    2.   (b) the applicant must have provided biometrics when required; and\n    3.   (c) the applicant must have provided a passport or other travel document which satisfactorily establishes their identity and nationality; and\n    4.   (d) the applicant must have a Certificate of Sponsorship that was issued to them no more than 3 months before the date of application.\n\nRW 1.3. The applicant must be aged 18 or over on the date of application.\n\nRW 1.4. If applying for permission to stay, the applicant must be in the UK on the date of application.\n\nRW 1.4A. If applying for permission to stay, the applicant must have, or have last had, permission as a Religious Worker.\n\nRW 1.5. An application which does not meet all the validity requirements for a Religious Worker may be rejected as invalid and not considered.",
      "needs_review": false
    },
    {
      "metadata": {
        "source": "Appendix Temporary Work – Religious Worker",
        "part": "Appendix Temporary Work – Religious Worker",
        "section_id": "RW 2.1",
        "section_title": "Suitability requirements for a Religious Worker",
        "parent_section": "RW 2",
        "hierarchy_level": 2,
        "topic": "suitability",
        "url": "https://www.gov.uk/guidance/immigration-rules/immigration-rules-appendix-t5-temporary-worker-religious-worker",
        "scraped_at": "2025-12-06T17:25:44.175079"
      },
      "text": "### Suitability requirements for a Religious Worker\n\nRW 2.1. The applicant must not fall for refusal under Part Suitability.\n\n1.   RW 2.2. If applying for permission to stay the applicant must not be: \n    1.   (a) in breach of immigration laws, except that where the Exceptions for overstayers section of Part Suitability applies, that period of overstaying will be disregarded; or\n    2.   (b) on immigration bail.",
      "summary": "Religious Worker applicants must not breach immigration laws or be on bail; overstaying may be disregarded if covered by specific exceptions, ensuring their suitability for permission to stay.",
      "augmented_text": "Document: Appendix Temporary Work – Religious Worker\nPart: Appendix Temporary Work – Religious Worker\nSection ID: RW 2.1\nSection: Suitability requirements for a Religious Worker\nTopic: suitability\n\nSummary: Religious Worker applicants must not breach immigration laws or be on bail; overstaying may be disregarded if covered by specific exceptions, ensuring their suitability for permission to stay.\n\n### Suitability requirements for a Religious Worker\n\nRW 2.1. The applicant must not fall for refusal under Part Suitability.\n\n1.   RW 2.2. If applying for permission to stay the applicant must not be: \n    1.   (a) in breach of immigration laws, except that where the Exceptions for overstayers section of Part Suitability applies, that period of overstaying will be disregarded; or\n    2.   (b) on immigration bail.",
      "needs_review": false
    },
    {
      "metadata": {
        "source": "Appendix Temporary Work – Religious Worker",
        "part": "Appendix Temporary Work – Religious Worker",
        "section_id": "Eligibility requirements for a Religious Worker",
        "section_title": "Eligibility requirements for a Religious Worker",
        "parent_section": null,
        "hierarchy_level": 2,
        "topic": "eligibility",
        "url": "https://www.gov.uk/guidance/immigration-rules/immigration-rules-appendix-t5-temporary-worker-religious-worker",
        "scraped_at": "2025-12-06T17:25:44.175171"
      },
      "text": "### Eligibility requirements for a Religious Worker",
      "summary": "This section applies to individuals seeking a Religious Worker visa. Applicants must demonstrate a genuine religious role, meet the considered criteria, and obtain approval from relevant religious authorities. Exceptions or specific thresholds are detailed in additional provisions.",
      "augmented_text": "Document: Appendix Temporary Work – Religious Worker\nPart: Appendix Temporary Work – Religious Worker\nSection ID: Eligibility requirements for a Religious Worker\nSection: Eligibility requirements for a Religious Worker\nTopic: eligibility\n\nSummary: This section applies to individuals seeking a Religious Worker visa. Applicants must demonstrate a genuine religious role, meet the considered criteria, and obtain approval from relevant religious authorities. Exceptions or specific thresholds are detailed in additional provisions.\n\n### Eligibility requirements for a Religious Worker",
      "needs_review": false
    },
    {
      "metadata": {
        "source": "Appendix Temporary Work – Religious Worker",
        "part": "Appendix Temporary Work – Religious Worker",
        "section_id": "RW 3.1",
        "section_title": "Entry requirements for a Religious Worker",
        "parent_section": "RW 3",
        "hierarchy_level": 2,
        "topic": "leave-to-enter",
        "url": "https://www.gov.uk/guidance/immigration-rules/immigration-rules-appendix-t5-temporary-worker-religious-worker",
        "scraped_at": "2025-12-06T17:25:44.175201"
      },
      "text": "### Entry requirements for a Religious Worker\n\nRW 3.1. A person seeking to come to the UK on the Religious Worker route must have applied for and obtained entry clearance as a Religious Worker before they arrive in the UK.\n\nRW 3.2. A person applying for entry clearance as a Religious Worker must, if Appendix Tuberculosis applies, provide a valid medical certificate confirming that they have undergone screening for active pulmonary tuberculosis and that this tuberculosis is not present in them.\n\nRW 3.3. An applicant for entry clearance must not have had permission as a Religious Worker or Charity Worker at any time during the 12 months immediately before the date of application unless they can show they were not in the UK at any time during those 12 months.",
      "summary": "Religious Workers seeking entry to the UK must obtain prior entry clearance before arrival and, if applicable, provide a TB test result. Applicants must not have held Religious Worker or Charity Worker permission in the previous 12 months unless they were outside the UK during that period.",
      "augmented_text": "Document: Appendix Temporary Work – Religious Worker\nPart: Appendix Temporary Work – Religious Worker\nSection ID: RW 3.1\nSection: Entry requirements for a Religious Worker\nTopic: leave-to-enter\n\nSummary: Religious Workers seeking entry to the UK must obtain prior entry clearance before arrival and, if applicable, provide a TB test result. Applicants must not have held Religious Worker or Charity Worker permission in the previous 12 months unless they were outside the UK during that period.\n\n### Entry requirements for a Religious Worker\n\nRW 3.1. A person seeking to come to the UK on the Religious Worker route must have applied for and obtained entry clearance as a Religious Worker before they arrive in the UK.\n\nRW 3.2. A person applying for entry clearance as a Religious Worker must, if Appendix Tuberculosis applies, provide a valid medical certificate confirming that they have undergone screening for active pulmonary tuberculosis and that this tuberculosis is not present in them.\n\nRW 3.3. An applicant for entry clearance must not have had permission as a Religious Worker or Charity Worker at any time during the 12 months immediately before the date of application unless they can show they were not in the UK at any time during those 12 months.",
      "needs_review": false
    },
    {
      "metadata": {
        "source": "Appendix Temporary Work – Religious Worker",
        "part": "Appendix Temporary Work – Religious Worker",
        "section_id": "RW 4.1",
        "section_title": "Sponsorship requirement for a Religious Worker",
        "parent_section": null,
        "hierarchy_level": 1,
        "topic": "sponsorship",
        "url": "https://www.gov.uk/guidance/immigration-rules/immigration-rules-appendix-t5-temporary-worker-religious-worker",
        "scraped_at": "2025-12-06T17:25:44.175240"
      },
      "text": "### Sponsorship requirement for a Religious Worker\n\n1.   RW 4.1. The applicant must have a valid Certificate of Sponsorship for the job they are planning to do; which to be valid must: \n    1.   (a) confirm the applicant’s name, that they are being sponsored as a Religious Worker, details of the job and pay the sponsor is offering them; and\n    2.   (b) include a start date, stated by the sponsor, which is no more than 3 months after the date of application; and\n    3.   (c) not have been used in a previous application which was either granted or refused (but can have been used in a previous application which was rejected as invalid, made void or withdrawn); and\n    4.   (d) not have been withdrawn by the sponsor or cancelled by the Home Office; and\n    5.   (e) confirm that the role meets the requirements at RW 4.3; and\n    6.   (f) confirm whether the applicant is a member of the sponsor’s order, if the sponsor is a religious order; and\n    7.   (g) confirm that the applicant will receive pay and conditions at least equal to those given to settled workers in the same role; and\n    8.   (h) confirm that the pay complies with or is exempt from the National Minimum Wage; and\n    9.   (i) confirm that the requirements of the resident labour consideration, as set out in RW 4.2, in respect of the job, have been complied with, or that the applicant is applying for permission to stay and the sponsor is the same sponsor as in their last grant of permission as a Religious Worker.\n\n2.   RW 4.2. The requirements of the resident labour consideration are: \n    1.   (a) that the role is supernumerary, such that it is over and above the sponsor’s normal staffing requirements and if the person filling the role was not there, it would not need to be filled by anyone else (with a full explanation of why it is supernumerary); or\n    2.   (b) that the role involves living mainly within and being a member of a religious order, which must be a lineage of communities or of people who live in some way set apart from society in accordance with their specific religious devotion, for example an order of nuns or monks; or\n    3.   (c) that the sponsor holds national records of all available individuals, details of those records and confirms that the records show that no suitable settled worker is available to fill the role; or\n    4.   (d) that a national recruitment search was undertaken, and the following details are provided: \n        1.   (i) where the role was advertised, which must be at least one of the following: \n            1.   (1) a national form of media appropriate to the sponsor’s religion or denomination; or\n            2.   (2) the sponsor’s own website, if that is how the sponsor usually reaches out to its community on a national scale, that is where it normally advertises vacant positions, and the pages containing the advertisement are free to view without paying a subscription fee or making a donation; or\n            3.   (3) Jobcentre Plus (or in Northern Ireland, Job Centre Online) or in the employment section of a national newspaper, if there is no suitable national form of media appropriate to the sponsor’s religion or denomination; and\n\n        2.   (ii) any reference numbers of the advertisements; and\n        3.   (iii) the period the role was advertised for, which must include at least 28 days during the six month period immediately before the date the sponsor assigned the Certificate of Sponsorship to the applicant; and\n        4.   (iv) confirmation that no suitable settled workers are available to be recruited for the role.\n\n3.   RW 4.3. The sponsor must ensure the role meets all the following requirements: \n    1.   (a) the role must involve performing religious duties within, or directed by, the sponsor’s organisation to support the activities of the religious institution; and\n    2.   (b) the religious duties must not include work which falls under a role of a Minister of Religion (which means the applicant must not have core duties of leading a congregation in performing the rites and rituals of the faith and in preaching the essentials of the creed).\n\nRW 4.4. The sponsor must be authorised by the Home Office to sponsor the job in question under the Religious Worker route.\n\nRW 4.5. The sponsor must be listed as A-rated on the Home Office’s register of licensed sponsors, unless the applicant was last granted permission as a Religious Worker and is applying to continue working for the same sponsor as in their last permission.\n\nRW 4.6. The decision maker must not have reasonable grounds to believe the job the applicant is being sponsored to do does not comply with the National Minimum Wage Regulations or the Working Time Regulations.",
      "summary": "This provision applies to Religious Worker applicants requiring a valid Certificate of Sponsorship. The certificate must specify details such as sponsor, role, pay, start date within three months, and confirm compliance with employment and resident labour requirements, with exceptions for previous invalid or withdrawn Certificates.",
      "augmented_text": "Document: Appendix Temporary Work – Religious Worker\nPart: Appendix Temporary Work – Religious Worker\nSection ID: RW 4.1\nSection: Sponsorship requirement for a Religious Worker\nTopic: sponsorship\n\nSummary: This provision applies to Religious Worker applicants requiring a valid Certificate of Sponsorship. The certificate must specify details such as sponsor, role, pay, start date within three months, and confirm compliance with employment and resident labour requirements, with exceptions for previous invalid or withdrawn Certificates.\n\n### Sponsorship requirement for a Religious Worker\n\n1.   RW 4.1. The applicant must have a valid Certificate of Sponsorship for the job they are planning to do; which to be valid must: \n    1.   (a) confirm the applicant’s name, that they are being sponsored as a Religious Worker, details of the job and pay the sponsor is offering them; and\n    2.   (b) include a start date, stated by the sponsor, which is no more than 3 months after the date of application; and\n    3.   (c) not have been used in a previous application which was either granted or refused (but can have been used in a previous application which was rejected as invalid, made void or withdrawn); and\n    4.   (d) not have been withdrawn by the sponsor or cancelled by the Home Office; and\n    5.   (e) confirm that the role meets the requirements at RW 4.3; and\n    6.   (f) confirm whether the applicant is a member of the sponsor’s order, if the sponsor is a religious order; and\n    7.   (g) confirm that the applicant will receive pay and conditions at least equal to those given to settled workers in the same role; and\n    8.   (h) confirm that the pay complies with or is exempt from the National Minimum Wage; and\n    9.   (i) confirm that the requirements of the resident labour consideration, as set out in RW 4.2, in respect of the job, have been complied with, or that the applicant is applying for permission to stay and the sponsor is the same sponsor as in their last grant of permission as a Religious Worker.\n\n2.   RW 4.2. The requirements of the resident labour consideration are: \n    1.   (a) that the role is supernumerary, such that it is over and above the sponsor’s normal staffing requirements and if the person filling the role was not there, it would not need to be filled by anyone else (with a full explanation of why it is supernumerary); or\n    2.   (b) that the role involves living mainly within and being a member of a religious order, which must be a lineage of communities or of people who live in some way set apart from society in accordance with their specific religious devotion, for example an order of nuns or monks; or\n    3.   (c) that the sponsor holds national records of all available individuals, details of those records and confirms that the records show that no suitable settled worker is available to fill the role; or\n    4.   (d) that a national recruitment search was undertaken, and the following details are provided: \n        1.   (i) where the role was advertised, which must be at least one of the following: \n            1.   (1) a national form of media appropriate to the sponsor’s religion or denomination; or\n            2.   (2) the sponsor’s own website, if that is how the sponsor usually reaches out to its community on a national scale, that is where it normally advertises vacant positions, and the pages containing the advertisement are free to view without paying a subscription fee or making a donation; or\n            3.   (3) Jobcentre Plus (or in Northern Ireland, Job Centre Online) or in the employment section of a national newspaper, if there is no suitable national form of media appropriate to the sponsor’s religion or denomination; and\n\n        2.   (ii) any reference numbers of the advertisements; and\n        3.   (iii) the period the role was advertised for, which must include at least 28 days during the six month period immediately before the date the sponsor assigned the Certificate of Sponsorship to the applicant; and\n        4.   (iv) confirmation that no suitable settled workers are available to be recruited for the role.\n\n3.   RW 4.3. The sponsor must ensure the role meets all the following requirements: \n    1.   (a) the role must involve performing religious duties within, or directed by, the sponsor’s organisation to support the activities of the religious institution; and\n    2.   (b) the religious duties must not include work which falls under a role of a Minister of Religion (which means the applicant must not have core duties of leading a congregation in performing the rites and rituals of the faith and in preaching the essentials of the creed).\n\nRW 4.4. The sponsor must be authorised by the Home Office to sponsor the job in question under the Religious Worker route.\n\nRW 4.5. The sponsor must be listed as A-rated on the Home Office’s register of licensed sponsors, unless the applicant was last granted permission as a Religious Worker and is applying to continue working for the same sponsor as in their last permission.\n\nRW 4.6. The decision maker must not have reasonable grounds to believe the job the applicant is being sponsored to do does not comply with the National Minimum Wage Regulations or the Working Time Regulations.",
      "needs_review": false
    },
    {
      "metadata": {
        "source": "Appendix Temporary Work – Religious Worker",
        "part": "Appendix Temporary Work – Religious Worker",
        "section_id": "RW 5.1",
        "section_title": "Genuineness requirement for a Religious Worker",
        "parent_section": null,
        "hierarchy_level": 1,
        "topic": "eligibility",
        "url": "https://www.gov.uk/guidance/immigration-rules/immigration-rules-appendix-t5-temporary-worker-religious-worker",
        "scraped_at": "2025-12-06T17:25:44.175264"
      },
      "text": "### Genuineness requirement for a Religious Worker\n\n1.   RW 5.1. The applicant must: \n    1.   (a) genuinely intend, and be able, to undertake the role for which they are being sponsored; and\n    2.   (b) not intend to undertake employment other than in the role for which they are being sponsored, or as otherwise permitted by paragraph RW 8.3.",
      "summary": "Religious Worker applicants must genuinely intend and be able to perform their sponsored role and not seek alternative employment unless permitted. They must meet these genuineness criteria to qualify under the rules.",
      "augmented_text": "Document: Appendix Temporary Work – Religious Worker\nPart: Appendix Temporary Work – Religious Worker\nSection ID: RW 5.1\nSection: Genuineness requirement for a Religious Worker\nTopic: eligibility\n\nSummary: Religious Worker applicants must genuinely intend and be able to perform their sponsored role and not seek alternative employment unless permitted. They must meet these genuineness criteria to qualify under the rules.\n\n### Genuineness requirement for a Religious Worker\n\n1.   RW 5.1. The applicant must: \n    1.   (a) genuinely intend, and be able, to undertake the role for which they are being sponsored; and\n    2.   (b) not intend to undertake employment other than in the role for which they are being sponsored, or as otherwise permitted by paragraph RW 8.3.",
      "needs_review": false
    },
    {
      "metadata": {
        "source": "Appendix Temporary Work – Religious Worker",
        "part": "Appendix Temporary Work – Religious Worker",
        "section_id": "RW 6.1",
        "section_title": "Financial requirement for a Religious Worker",
        "parent_section": "RW 6",
        "hierarchy_level": 2,
        "topic": "financial",
        "url": "https://www.gov.uk/guidance/immigration-rules/immigration-rules-appendix-t5-temporary-worker-religious-worker",
        "scraped_at": "2025-12-06T17:25:44.175277"
      },
      "text": "### Financial requirement for a Religious Worker\n\nRW 6.1. If the applicant is applying for permission to stay and has been in the UK with permission for 12 months or longer on the date of application, they will meet the financial requirement and do not need to show funds.\n\n1.   RW 6.2. If the applicant is applying for entry clearance, or is applying for permission to stay and has been in the UK for less than 12 months on the date of application, either: \n    1.   (a) the applicant must have funds of at least £1,270; or\n    2.   (b) the applicant’s A rated sponsor must confirm on the Certificate of Sponsorship that they will, if it is necessary, maintain and accommodate the applicant up to the end of the first month of their employment for an amount of at least £1,270.\n\nRW 6.3. If RW 6.2.(a) applies, the applicant must show that they have held the required level of funds for a 28-day period and as specified in Appendix Finance.",
      "summary": "Religious Workers applying for permission to stay or entry clearance must either have been in the UK for over 12 months (meeting the financial requirement) or, if for less than 12 months, must show at least £1,270 in funds or have a sponsor confirm they can maintain and accommodate the applicant for the first month.",
      "augmented_text": "Document: Appendix Temporary Work – Religious Worker\nPart: Appendix Temporary Work – Religious Worker\nSection ID: RW 6.1\nSection: Financial requirement for a Religious Worker\nTopic: financial\n\nSummary: Religious Workers applying for permission to stay or entry clearance must either have been in the UK for over 12 months (meeting the financial requirement) or, if for less than 12 months, must show at least £1,270 in funds or have a sponsor confirm they can maintain and accommodate the applicant for the first month.\n\n### Financial requirement for a Religious Worker\n\nRW 6.1. If the applicant is applying for permission to stay and has been in the UK with permission for 12 months or longer on the date of application, they will meet the financial requirement and do not need to show funds.\n\n1.   RW 6.2. If the applicant is applying for entry clearance, or is applying for permission to stay and has been in the UK for less than 12 months on the date of application, either: \n    1.   (a) the applicant must have funds of at least £1,270; or\n    2.   (b) the applicant’s A rated sponsor must confirm on the Certificate of Sponsorship that they will, if it is necessary, maintain and accommodate the applicant up to the end of the first month of their employment for an amount of at least £1,270.\n\nRW 6.3. If RW 6.2.(a) applies, the applicant must show that they have held the required level of funds for a 28-day period and as specified in Appendix Finance.",
      "needs_review": false
    },
    {
      "metadata": {
        "source": "Appendix Temporary Work – Religious Worker",
        "part": "Appendix Temporary Work – Religious Worker",
        "section_id": "RW 7.1",
        "section_title": "Decision on an application as a Religious Worker",
        "parent_section": "RW 7",
        "hierarchy_level": 2,
        "topic": "eligibility",
        "url": "https://www.gov.uk/guidance/immigration-rules/immigration-rules-appendix-t5-temporary-worker-religious-worker",
        "scraped_at": "2025-12-06T17:25:44.175287"
      },
      "text": "### Decision on an application as a Religious Worker\n\nRW 7.1. If the decision maker is satisfied that all the suitability and eligibility requirements for the Religious Worker route are met, the application will be granted, otherwise the application will be refused.\n\nRW 7.2. If the application is refused, the person can apply for an Administrative Review under Appendix AR: Administrative Review.",
      "summary": "This provision applies to Religious Worker applicants, requiring that all suitability and eligibility criteria are met for approval. If conditions are satisfied, the application is granted; if not, it is refused, but the applicant may request an Administrative Review.",
      "augmented_text": "Document: Appendix Temporary Work – Religious Worker\nPart: Appendix Temporary Work – Religious Worker\nSection ID: RW 7.1\nSection: Decision on an application as a Religious Worker\nTopic: eligibility\n\nSummary: This provision applies to Religious Worker applicants, requiring that all suitability and eligibility criteria are met for approval. If conditions are satisfied, the application is granted; if not, it is refused, but the applicant may request an Administrative Review.\n\n### Decision on an application as a Religious Worker\n\nRW 7.1. If the decision maker is satisfied that all the suitability and eligibility requirements for the Religious Worker route are met, the application will be granted, otherwise the application will be refused.\n\nRW 7.2. If the application is refused, the person can apply for an Administrative Review under Appendix AR: Administrative Review.",
      "needs_review": false
    },
    {
      "metadata": {
        "source": "Appendix Temporary Work – Religious Worker",
        "part": "Appendix Temporary Work – Religious Worker",
        "section_id": "1",
        "section_title": "Period of grant for a Religious Worker",
        "parent_section": null,
        "hierarchy_level": 1,
        "topic": "leave-to-enter",
        "url": "https://www.gov.uk/guidance/immigration-rules/immigration-rules-appendix-t5-temporary-worker-religious-worker",
        "scraped_at": "2025-12-06T17:25:44.175304"
      },
      "text": "### Period of grant for a Religious Worker\n\n1.   RW 8.1. If the application is for entry clearance, the applicant will be granted whichever is the shorter of: \n    1.   (a) the period of the job on the Certificate of Sponsorship plus 14 days before and after; or\n    2.   (b) 24 months.\n\n2.   RW 8.2. If the application is for permission to stay, the applicant will be granted whichever is the shorter of: \n    1.   (a) the period of the job on the Certificate of Sponsorship plus 14 days; or\n    2.   (b) the difference between the period the applicant has already spent in the UK since their last grant of permission as a Religious Worker and 24 months.",
      "summary": "Religious Workers applying for entry clearance or permission to stay are granted a period up to 24 months, limited by either the Certificate of Sponsorship plus 14 days or the elapsed time since their last stay, whichever is shorter.",
      "augmented_text": "Document: Appendix Temporary Work – Religious Worker\nPart: Appendix Temporary Work – Religious Worker\nSection ID: 1\nSection: Period of grant for a Religious Worker\nTopic: leave-to-enter\n\nSummary: Religious Workers applying for entry clearance or permission to stay are granted a period up to 24 months, limited by either the Certificate of Sponsorship plus 14 days or the elapsed time since their last stay, whichever is shorter.\n\n### Period of grant for a Religious Worker\n\n1.   RW 8.1. If the application is for entry clearance, the applicant will be granted whichever is the shorter of: \n    1.   (a) the period of the job on the Certificate of Sponsorship plus 14 days before and after; or\n    2.   (b) 24 months.\n\n2.   RW 8.2. If the application is for permission to stay, the applicant will be granted whichever is the shorter of: \n    1.   (a) the period of the job on the Certificate of Sponsorship plus 14 days; or\n    2.   (b) the difference between the period the applicant has already spent in the UK since their last grant of permission as a Religious Worker and 24 months.",
      "needs_review": false
    },
    {
      "metadata": {
        "source": "Appendix Temporary Work – Religious Worker",
        "part": "Appendix Temporary Work – Religious Worker",
        "section_id": "1",
        "section_title": "Conditions of grant for a Religious Worker",
        "parent_section": null,
        "hierarchy_level": 1,
        "topic": "financial",
        "url": "https://www.gov.uk/guidance/immigration-rules/immigration-rules-appendix-t5-temporary-worker-religious-worker",
        "scraped_at": "2025-12-06T17:25:44.175315"
      },
      "text": "### Conditions of grant for a Religious Worker\n\n1.   RW 8.3. The grant will be subject to all the following conditions: \n    1.   (a) no access to public funds; and\n    2.   (b) work is permitted only in the role the applicant is being sponsored for; and\n    3.   (c) supplementary employment is permitted; and\n    4.   (d) study is permitted, subject to the ATAS condition in Appendix ATAS.\n    5.   (e) DELETED.",
      "summary": "Religious Workers in the UK must not access public funds, work solely in their sponsored role, and may undertake supplementary employment or study (with ATAS). These conditions are mandatory unless specifically waived.",
      "augmented_text": "Document: Appendix Temporary Work – Religious Worker\nPart: Appendix Temporary Work – Religious Worker\nSection ID: 1\nSection: Conditions of grant for a Religious Worker\nTopic: financial\n\nSummary: Religious Workers in the UK must not access public funds, work solely in their sponsored role, and may undertake supplementary employment or study (with ATAS). These conditions are mandatory unless specifically waived.\n\n### Conditions of grant for a Religious Worker\n\n1.   RW 8.3. The grant will be subject to all the following conditions: \n    1.   (a) no access to public funds; and\n    2.   (b) work is permitted only in the role the applicant is being sponsored for; and\n    3.   (c) supplementary employment is permitted; and\n    4.   (d) study is permitted, subject to the ATAS condition in Appendix ATAS.\n    5.   (e) DELETED.",
      "needs_review": false
    },
    {
      "metadata": {
        "source": "Appendix Temporary Work – Religious Worker",
        "part": "Appendix Temporary Work – Religious Worker",
        "section_id": "DW 1",
        "section_title": "Dependants of a Religious Worker",
        "parent_section": null,
        "hierarchy_level": 2,
        "topic": "eligibility",
        "url": "https://www.gov.uk/guidance/immigration-rules/immigration-rules-appendix-t5-temporary-worker-religious-worker",
        "scraped_at": "2025-12-06T17:25:44.175329"
      },
      "text": "### Dependants of a Religious Worker",
      "summary": "This provision applies to dependants of religious workers granted entry or stay under the temporary work visa. Dependants must meet specified requirements, such as proof of relationship and support, and their application is subject to certain conditions; exceptions or thresholds are not detailed in this excerpt.",
      "augmented_text": "Document: Appendix Temporary Work – Religious Worker\nPart: Appendix Temporary Work – Religious Worker\nSection ID: DW 1\nSection: Dependants of a Religious Worker\nTopic: eligibility\n\nSummary: This provision applies to dependants of religious workers granted entry or stay under the temporary work visa. Dependants must meet specified requirements, such as proof of relationship and support, and their application is subject to certain conditions; exceptions or thresholds are not detailed in this excerpt.\n\n### Dependants of a Religious Worker",
      "needs_review": false
    },
    {
      "metadata": {
        "source": "Appendix Temporary Work – Religious Worker",
        "part": "Appendix Temporary Work – Religious Worker",
        "section_id": "RW 9.1",
        "section_title": "Validity requirements for a dependent partner or dependent child of a Religious Worker",
        "parent_section": "RW 9",
        "hierarchy_level": 2,
        "topic": "leave-to-enter",
        "url": "https://www.gov.uk/guidance/immigration-rules/immigration-rules-appendix-t5-temporary-worker-religious-worker",
        "scraped_at": "2025-12-06T17:25:44.175353"
      },
      "text": "### Validity requirements for a dependent partner or dependent child of a Religious Worker\n\nRW 9.1. A person applying for entry clearance or permission to stay as a dependent partner or dependent child of a Religious Worker must apply online on the gov.uk website on the specified form as follows:\n\n| Applicant | Specified form |\n| --- | --- |\n| EEA national with a chipped passport | Either (as applicable): • Dependant partner or dependant child using the UK Immigration: ID Check app; or • the forms listed below for dependant applicants outside or inside the UK as relevant. |\n| Applicants outside the UK | Dependant partner visa Dependant child visa |\n| Applicants inside the UK | If the dependant is applying at the same time as the Religious Worker, they can be included in the form Temporary Worker where the form allows dependants to be added. Otherwise: - Dependant partner - Dependant child |\n\n1.   RW 9.2. An application for entry clearance or permission to stay as a partner or child of a Religious Worker must meet all the following requirements: \n    1.   (a) any fee and Immigration Health Charge must have been paid; and\n    2.   (b) the applicant must have provided biometrics when required; and\n    3.   (c) the applicant must have provided a passport or other travel document which satisfactorily establishes their identity and nationality; and\n    4.   (d) the applicant must be applying as a partner or child of a person who: \n        1.   (i) has made a valid application for entry clearance or permission to stay on the Religious Worker route that has not been decided; or\n        2.   (ii) has entry clearance or permission to stay on the Religious Worker route.\n\nRW 9.3. An applicant applying as a dependent partner must be aged 18 or over on the date of application.\n\nRW 9.4. If applying for permission to stay, the applicant must be in the UK on the date of application.\n\n1.   RW 9.4ZA. If applying for permission to stay, the applicant must not have, or have last been granted, permission: \n    1.   (a) as a Visitor; or\n    2.   (b) as a Short-term Student; or\n    3.   (c) as a Parent of a Child Student; or\n    4.   (d) as a Seasonal Worker; or\n    5.   (e) as a Domestic Worker in a Private Household; or\n    6.   (f) outside the Immigration Rules.\n\n1.   RW 9.4A. An applicant who is applying for permission to stay and has, or last had, permission as a Student, must fulfil one of the Conditions A or B below on the date of application: \n    1.   (a) Condition A: the applicant must have completed the course of study for which the Confirmation of Acceptance for Studies was assigned (or a course to which ST 27.3 of Appendix Student applies); or\n    2.   (b) Condition B: the applicant must: \n        1.   (i) be studying a full-time course of study leading to the award of a PhD with a higher education provider which has a track record of compliance; and\n        2.   (ii) have completed at least 24 months of study on that course.\n\nRW 9.5. An application which does not meet all the validity requirements for a partner or child of a Religious Worker may be rejected as invalid and not considered.",
      "summary": "This provision applies to dependents of Religious Workers applying for entry clearance or permission to stay. Dependents must apply online using specific forms, pay applicable fees and health charges, provide biometrics and valid travel documents, and only qualify if their sponsoring Religious Worker’s application is valid. Exceptions include simultaneous applications when dependents are included with the Religious Worker.",
      "augmented_text": "Document: Appendix Temporary Work – Religious Worker\nPart: Appendix Temporary Work – Religious Worker\nSection ID: RW 9.1\nSection: Validity requirements for a dependent partner or dependent child of a Religious Worker\nTopic: leave-to-enter\n\nSummary: This provision applies to dependents of Religious Workers applying for entry clearance or permission to stay. Dependents must apply online using specific forms, pay applicable fees and health charges, provide biometrics and valid travel documents, and only qualify if their sponsoring Religious Worker’s application is valid. Exceptions include simultaneous applications when dependents are included with the Religious Worker.\n\n### Validity requirements for a dependent partner or dependent child of a Religious Worker\n\nRW 9.1. A person applying for entry clearance or permission to stay as a dependent partner or dependent child of a Religious Worker must apply online on the gov.uk website on the specified form as follows:\n\n| Applicant | Specified form |\n| --- | --- |\n| EEA national with a chipped passport | Either (as applicable): • Dependant partner or dependant child using the UK Immigration: ID Check app; or • the forms listed below for dependant applicants outside or inside the UK as relevant. |\n| Applicants outside the UK | Dependant partner visa Dependant child visa |\n| Applicants inside the UK | If the dependant is applying at the same time as the Religious Worker, they can be included in the form Temporary Worker where the form allows dependants to be added. Otherwise: - Dependant partner - Dependant child |\n\n1.   RW 9.2. An application for entry clearance or permission to stay as a partner or child of a Religious Worker must meet all the following requirements: \n    1.   (a) any fee and Immigration Health Charge must have been paid; and\n    2.   (b) the applicant must have provided biometrics when required; and\n    3.   (c) the applicant must have provided a passport or other travel document which satisfactorily establishes their identity and nationality; and\n    4.   (d) the applicant must be applying as a partner or child of a person who: \n        1.   (i) has made a valid application for entry clearance or permission to stay on the Religious Worker route that has not been decided; or\n        2.   (ii) has entry clearance or permission to stay on the Religious Worker route.\n\nRW 9.3. An applicant applying as a dependent partner must be aged 18 or over on the date of application.\n\nRW 9.4. If applying for permission to stay, the applicant must be in the UK on the date of application.\n\n1.   RW 9.4ZA. If applying for permission to stay, the applicant must not have, or have last been granted, permission: \n    1.   (a) as a Visitor; or\n    2.   (b) as a Short-term Student; or\n    3.   (c) as a Parent of a Child Student; or\n    4.   (d) as a Seasonal Worker; or\n    5.   (e) as a Domestic Worker in a Private Household; or\n    6.   (f) outside the Immigration Rules.\n\n1.   RW 9.4A. An applicant who is applying for permission to stay and has, or last had, permission as a Student, must fulfil one of the Conditions A or B below on the date of application: \n    1.   (a) Condition A: the applicant must have completed the course of study for which the Confirmation of Acceptance for Studies was assigned (or a course to which ST 27.3 of Appendix Student applies); or\n    2.   (b) Condition B: the applicant must: \n        1.   (i) be studying a full-time course of study leading to the award of a PhD with a higher education provider which has a track record of compliance; and\n        2.   (ii) have completed at least 24 months of study on that course.\n\nRW 9.5. An application which does not meet all the validity requirements for a partner or child of a Religious Worker may be rejected as invalid and not considered.",
      "needs_review": false
    },
    {
      "metadata": {
        "source": "Appendix Temporary Work – Religious Worker",
        "part": "Appendix Temporary Work – Religious Worker",
        "section_id": "RW 10.1",
        "section_title": "Suitability requirements for a dependent partner or dependent child of a Religious Worker",
        "parent_section": "RW 10",
        "hierarchy_level": 2,
        "topic": "suitability",
        "url": "https://www.gov.uk/guidance/immigration-rules/immigration-rules-appendix-t5-temporary-worker-religious-worker",
        "scraped_at": "2025-12-06T17:25:44.175368"
      },
      "text": "### Suitability requirements for a dependent partner or dependent child of a Religious Worker\n\nRW 10.1. The applicant must not fall for refusal under Part Suitability.\n\n1.   RW 10.2. If applying for permission to stay the applicant must not be: \n    1.   (a) in breach of immigration laws, except that where the Exceptions for overstayers section of Part Suitability applies, that period of overstaying will be disregarded; or\n    2.   (b) on immigration bail.",
      "summary": "This provision applies to dependents of Religious Workers seeking permission to stay. They must not breach immigration laws (with exceptions for overstayers) or be on immigration bail, ensuring their suitability for approval.",
      "augmented_text": "Document: Appendix Temporary Work – Religious Worker\nPart: Appendix Temporary Work – Religious Worker\nSection ID: RW 10.1\nSection: Suitability requirements for a dependent partner or dependent child of a Religious Worker\nTopic: suitability\n\nSummary: This provision applies to dependents of Religious Workers seeking permission to stay. They must not breach immigration laws (with exceptions for overstayers) or be on immigration bail, ensuring their suitability for approval.\n\n### Suitability requirements for a dependent partner or dependent child of a Religious Worker\n\nRW 10.1. The applicant must not fall for refusal under Part Suitability.\n\n1.   RW 10.2. If applying for permission to stay the applicant must not be: \n    1.   (a) in breach of immigration laws, except that where the Exceptions for overstayers section of Part Suitability applies, that period of overstaying will be disregarded; or\n    2.   (b) on immigration bail.",
      "needs_review": false
    },
    {
      "metadata": {
        "source": "Appendix Temporary Work – Religious Worker",
        "part": "Appendix Temporary Work – Religious Worker",
        "section_id": "Eligibility requirements for a dependent partner or dependent child of a Religious Worker",
        "section_title": "Eligibility requirements for a dependent partner or dependent child of a Religious Worker",
        "parent_section": null,
        "hierarchy_level": 3,
        "topic": "eligibility",
        "url": "https://www.gov.uk/guidance/immigration-rules/immigration-rules-appendix-t5-temporary-worker-religious-worker",
        "scraped_at": "2025-12-06T17:25:44.175375"
      },
      "text": "### Eligibility requirements for a dependent partner or dependent child of a Religious Worker",
      "summary": "This provision applies to dependent partners and children of Religious Workers. They must demonstrate their relationship and meet visa eligibility criteria, with specific conditions pertaining to their application circumstances; exceptions or thresholds are not specified in this excerpt.",
      "augmented_text": "Document: Appendix Temporary Work – Religious Worker\nPart: Appendix Temporary Work – Religious Worker\nSection ID: Eligibility requirements for a dependent partner or dependent child of a Religious Worker\nSection: Eligibility requirements for a dependent partner or dependent child of a Religious Worker\nTopic: eligibility\n\nSummary: This provision applies to dependent partners and children of Religious Workers. They must demonstrate their relationship and meet visa eligibility criteria, with specific conditions pertaining to their application circumstances; exceptions or thresholds are not specified in this excerpt.\n\n### Eligibility requirements for a dependent partner or dependent child of a Religious Worker",
      "needs_review": false
    },
    {
      "metadata": {
        "source": "Appendix Temporary Work – Religious Worker",
        "part": "Appendix Temporary Work – Religious Worker",
        "section_id": "RW 11.1",
        "section_title": "Entry requirement for a dependent partner or dependent child of a Religious Worker",
        "parent_section": "RW 11",
        "hierarchy_level": 2,
        "topic": "leave-to-enter",
        "url": "https://www.gov.uk/guidance/immigration-rules/immigration-rules-appendix-t5-temporary-worker-religious-worker",
        "scraped_at": "2025-12-06T17:25:44.175393"
      },
      "text": "### Entry requirement for a dependent partner or dependent child of a Religious Worker\n\nRW 11.1. A person seeking to come to the UK as a dependent partner or dependent child of a Religious Worker must apply for and obtain entry clearance as a dependent partner or dependent child of a Religious Worker before they arrive in the UK.\n\nRW 11.2. A person applying for entry clearance as the partner or child of a Religious Worker must, if Appendix Tuberculosis to these Rules applies, provide a valid medical certificate confirming that they have undergone screening for active pulmonary tuberculosis and that this tuberculosis is not present in them.",
      "summary": "Dependents of Religious Workers must apply for and obtain entry clearance before arriving in the UK. If applicable, they must also provide a tuberculosis screening certificate. No exceptions are specified.",
      "augmented_text": "Document: Appendix Temporary Work – Religious Worker\nPart: Appendix Temporary Work – Religious Worker\nSection ID: RW 11.1\nSection: Entry requirement for a dependent partner or dependent child of a Religious Worker\nTopic: leave-to-enter\n\nSummary: Dependents of Religious Workers must apply for and obtain entry clearance before arriving in the UK. If applicable, they must also provide a tuberculosis screening certificate. No exceptions are specified.\n\n### Entry requirement for a dependent partner or dependent child of a Religious Worker\n\nRW 11.1. A person seeking to come to the UK as a dependent partner or dependent child of a Religious Worker must apply for and obtain entry clearance as a dependent partner or dependent child of a Religious Worker before they arrive in the UK.\n\nRW 11.2. A person applying for entry clearance as the partner or child of a Religious Worker must, if Appendix Tuberculosis to these Rules applies, provide a valid medical certificate confirming that they have undergone screening for active pulmonary tuberculosis and that this tuberculosis is not present in them.",
      "needs_review": false
    },
    {
      "metadata": {
        "source": "Appendix Temporary Work – Religious Worker",
        "part": "Appendix Temporary Work – Religious Worker",
        "section_id": "1",
        "section_title": "Relationship requirement for a dependent partner of a Religious Worker",
        "parent_section": null,
        "hierarchy_level": 1,
        "topic": "family",
        "url": "https://www.gov.uk/guidance/immigration-rules/immigration-rules-appendix-t5-temporary-worker-religious-worker",
        "scraped_at": "2025-12-06T17:25:44.175414"
      },
      "text": "### Relationship requirement for a dependent partner of a Religious Worker\n\n1.   RW 12.1. The applicant must be the partner of a person (P) where one of the following applies: \n    1.   (a) P has permission on the Religious Worker route; or\n    2.   (b) P is, at the same time, applying for (and is granted) entry clearance or permission on the Religious Worker route.\n\n2.   RW 12.2. The requirements of Appendix Relationship with Partner must be met.\n\nRW 12.3. DELETED.\n\nRW 12.4. DELETED.",
      "summary": "This provision applies to dependent partners of Religious Workers. They must be partners of individuals with permission or applying for permission under the Religious Worker route, meeting specific relationship requirements. No exceptions or thresholds are specified.",
      "augmented_text": "Document: Appendix Temporary Work – Religious Worker\nPart: Appendix Temporary Work – Religious Worker\nSection ID: 1\nSection: Relationship requirement for a dependent partner of a Religious Worker\nTopic: family\n\nSummary: This provision applies to dependent partners of Religious Workers. They must be partners of individuals with permission or applying for permission under the Religious Worker route, meeting specific relationship requirements. No exceptions or thresholds are specified.\n\n### Relationship requirement for a dependent partner of a Religious Worker\n\n1.   RW 12.1. The applicant must be the partner of a person (P) where one of the following applies: \n    1.   (a) P has permission on the Religious Worker route; or\n    2.   (b) P is, at the same time, applying for (and is granted) entry clearance or permission on the Religious Worker route.\n\n2.   RW 12.2. The requirements of Appendix Relationship with Partner must be met.\n\nRW 12.3. DELETED.\n\nRW 12.4. DELETED.",
      "needs_review": false
    },
    {
      "metadata": {
        "source": "Appendix Temporary Work – Religious Worker",
        "part": "Appendix Temporary Work – Religious Worker",
        "section_id": "1",
        "section_title": "Relationship requirement for a dependent child of a Religious Worker",
        "parent_section": null,
        "hierarchy_level": 1,
        "topic": "family",
        "url": "https://www.gov.uk/guidance/immigration-rules/immigration-rules-appendix-t5-temporary-worker-religious-worker",
        "scraped_at": "2025-12-06T17:25:44.175430"
      },
      "text": "### Relationship requirement for a dependent child of a Religious Worker\n\n1.   RW 13.1. DELETED.\n2.   RW 13.2. DELETED.\n\nRW 13.3. DELETED.",
      "summary": "This provision applies to dependent children of Religious Workers. It establishes relationship requirements for their immigration, with certain conditions and thresholds. Specific details have been deleted, indicating restrictions or exemptions may apply.",
      "augmented_text": "Document: Appendix Temporary Work – Religious Worker\nPart: Appendix Temporary Work – Religious Worker\nSection ID: 1\nSection: Relationship requirement for a dependent child of a Religious Worker\nTopic: family\n\nSummary: This provision applies to dependent children of Religious Workers. It establishes relationship requirements for their immigration, with certain conditions and thresholds. Specific details have been deleted, indicating restrictions or exemptions may apply.\n\n### Relationship requirement for a dependent child of a Religious Worker\n\n1.   RW 13.1. DELETED.\n2.   RW 13.2. DELETED.\n\nRW 13.3. DELETED.",
      "needs_review": false
    },
    {
      "metadata": {
        "source": "Appendix Temporary Work – Religious Worker",
        "part": "Appendix Temporary Work – Religious Worker",
        "section_id": "RW 14.1",
        "section_title": "Care requirement for a dependent child of a Religious Worker",
        "parent_section": "RW 14",
        "hierarchy_level": 2,
        "topic": "family",
        "url": "https://www.gov.uk/guidance/immigration-rules/immigration-rules-appendix-t5-temporary-worker-religious-worker",
        "scraped_at": "2025-12-06T17:25:44.175446"
      },
      "text": "### Care requirement for a dependent child of a Religious Worker\n\nRW 14.1. DELETED.",
      "summary": "This provision applies to dependent children of Religious Workers. It requires that the child’s care arrangements meet specific standards, with conditions ensuring appropriate care, though detailed conditions are not specified in this excerpt.",
      "augmented_text": "Document: Appendix Temporary Work – Religious Worker\nPart: Appendix Temporary Work – Religious Worker\nSection ID: RW 14.1\nSection: Care requirement for a dependent child of a Religious Worker\nTopic: family\n\nSummary: This provision applies to dependent children of Religious Workers. It requires that the child’s care arrangements meet specific standards, with conditions ensuring appropriate care, though detailed conditions are not specified in this excerpt.\n\n### Care requirement for a dependent child of a Religious Worker\n\nRW 14.1. DELETED.",
      "needs_review": false
    },
    {
      "metadata": {
        "source": "Appendix Temporary Work – Religious Worker",
        "part": "Appendix Temporary Work – Religious Worker",
        "section_id": "RW 15.1",
        "section_title": "Age requirement for a dependent child of a Religious Worker",
        "parent_section": "RW 15",
        "hierarchy_level": 2,
        "topic": "family",
        "url": "https://www.gov.uk/guidance/immigration-rules/immigration-rules-appendix-t5-temporary-worker-religious-worker",
        "scraped_at": "2025-12-06T17:25:44.175462"
      },
      "text": "### Age requirement for a dependent child of a Religious Worker\n\nRW 15.1. DELETED.\n\nRW 15.2. DELETED.",
      "summary": "This provision applies to dependent children of Religious Workers. It states that children must be under 18 to qualify as dependents unless other criteria are met; specific conditions or exceptions are not detailed in the deleted sections.",
      "augmented_text": "Document: Appendix Temporary Work – Religious Worker\nPart: Appendix Temporary Work – Religious Worker\nSection ID: RW 15.1\nSection: Age requirement for a dependent child of a Religious Worker\nTopic: family\n\nSummary: This provision applies to dependent children of Religious Workers. It states that children must be under 18 to qualify as dependents unless other criteria are met; specific conditions or exceptions are not detailed in the deleted sections.\n\n### Age requirement for a dependent child of a Religious Worker\n\nRW 15.1. DELETED.\n\nRW 15.2. DELETED.",
      "needs_review": false
    },
    {
      "metadata": {
        "source": "Appendix Temporary Work – Religious Worker",
        "part": "Appendix Temporary Work – Religious Worker",
        "section_id": "1",
        "section_title": "Requirements for a dependent child of a Religious Worker",
        "parent_section": null,
        "hierarchy_level": 1,
        "topic": "leave-to-enter",
        "url": "https://www.gov.uk/guidance/immigration-rules/immigration-rules-appendix-t5-temporary-worker-religious-worker",
        "scraped_at": "2025-12-06T17:25:44.175479"
      },
      "text": "### Requirements for a dependent child of a Religious Worker\n\n1.   RW 15A.1. The applicant must meet the following requirements for a dependent child in Appendix Children: \n    1.   (a) relationship requirement: entry clearance and permission to stay; and\n    2.   (b) care requirement; and\n    3.   (c) age and independent life requirement.",
      "summary": "This provision applies to dependent children of Religious Workers. They must meet relationship, care, and age/independent life requirements for entry clearance and permission to stay, with specific conditions outlined in Appendix Children.",
      "augmented_text": "Document: Appendix Temporary Work – Religious Worker\nPart: Appendix Temporary Work – Religious Worker\nSection ID: 1\nSection: Requirements for a dependent child of a Religious Worker\nTopic: leave-to-enter\n\nSummary: This provision applies to dependent children of Religious Workers. They must meet relationship, care, and age/independent life requirements for entry clearance and permission to stay, with specific conditions outlined in Appendix Children.\n\n### Requirements for a dependent child of a Religious Worker\n\n1.   RW 15A.1. The applicant must meet the following requirements for a dependent child in Appendix Children: \n    1.   (a) relationship requirement: entry clearance and permission to stay; and\n    2.   (b) care requirement; and\n    3.   (c) age and independent life requirement.",
      "needs_review": false
    },
    {
      "metadata": {
        "source": "Appendix Temporary Work – Religious Worker",
        "part": "Appendix Temporary Work – Religious Worker",
        "section_id": "RW 16.1",
        "section_title": "Financial requirement for a dependent partner or dependent child of a Religious Worker",
        "parent_section": "RW 16",
        "hierarchy_level": 2,
        "topic": "financial",
        "url": "https://www.gov.uk/guidance/immigration-rules/immigration-rules-appendix-t5-temporary-worker-religious-worker",
        "scraped_at": "2025-12-06T17:25:44.175575"
      },
      "text": "### Financial requirement for a dependent partner or dependent child of a Religious Worker\n\nRW 16.1. If the applicant is applying for permission to stay and has been living in the UK with permission for 12 months or longer on the date of application, they will meet the financial requirement and do not need to show funds.\n\n1.   RW 16.2. If the applicant is applying for entry clearance, or has been in the UK for less than 12 months on the date of application, either: \n    1.   (a) funds of at least the amount required in RW 16.3. must be held collectively by one or more of the following: \n        1.   i) the applicant; and\n        2.   ii) the Religious Worker (P); and\n        3.   iii) if the applicant is applying as a dependent child, their parent who is lawfully present in the UK or being granted entry clearance, or permission to stay, at the same time; or\n\n    2.   (b) the Religious Worker’s A-rated sponsor must certify that they will, if necessary, maintain and accommodate the dependent partner and/or any dependent child as well as the Religious Worker, up to the end of the first month of each of their grants of permission, to at least the amounts required in RW 16.3.\n\n2.   RW 16.3. The funds required are: \n    1.   (a) £285 for a dependent partner in the UK, or applying for entry clearance; and\n    2.   (b) £315 for the first dependent child in the UK, or applying for entry clearance; and\n    3.   (c) £200 for any other dependent child in the UK, or applying for entry clearance.\n\nRW 16.4. If RW 16.2.(a) applies, the funds held for the applicant must be held in addition to any funds required for the Religious Worker to meet the financial requirement and any other dependants in the UK or applying at the same time.\n\nRW 16.5. If RW 16.2.(a) applies, the funds must have been held for a 28-day period and as specified in Appendix Finance.",
      "summary": "Dependent partners and children of Religious Workers must either have lived in the UK for over 12 months or, if less, show collective funds of at least £285 (partner) or £315 (first child) and/or obtain sponsor certification to cover maintenance and accommodation, with exceptions applying based on length of residence.",
      "augmented_text": "Document: Appendix Temporary Work – Religious Worker\nPart: Appendix Temporary Work – Religious Worker\nSection ID: RW 16.1\nSection: Financial requirement for a dependent partner or dependent child of a Religious Worker\nTopic: financial\n\nSummary: Dependent partners and children of Religious Workers must either have lived in the UK for over 12 months or, if less, show collective funds of at least £285 (partner) or £315 (first child) and/or obtain sponsor certification to cover maintenance and accommodation, with exceptions applying based on length of residence.\n\n### Financial requirement for a dependent partner or dependent child of a Religious Worker\n\nRW 16.1. If the applicant is applying for permission to stay and has been living in the UK with permission for 12 months or longer on the date of application, they will meet the financial requirement and do not need to show funds.\n\n1.   RW 16.2. If the applicant is applying for entry clearance, or has been in the UK for less than 12 months on the date of application, either: \n    1.   (a) funds of at least the amount required in RW 16.3. must be held collectively by one or more of the following: \n        1.   i) the applicant; and\n        2.   ii) the Religious Worker (P); and\n        3.   iii) if the applicant is applying as a dependent child, their parent who is lawfully present in the UK or being granted entry clearance, or permission to stay, at the same time; or\n\n    2.   (b) the Religious Worker’s A-rated sponsor must certify that they will, if necessary, maintain and accommodate the dependent partner and/or any dependent child as well as the Religious Worker, up to the end of the first month of each of their grants of permission, to at least the amounts required in RW 16.3.\n\n2.   RW 16.3. The funds required are: \n    1.   (a) £285 for a dependent partner in the UK, or applying for entry clearance; and\n    2.   (b) £315 for the first dependent child in the UK, or applying for entry clearance; and\n    3.   (c) £200 for any other dependent child in the UK, or applying for entry clearance.\n\nRW 16.4. If RW 16.2.(a) applies, the funds held for the applicant must be held in addition to any funds required for the Religious Worker to meet the financial requirement and any other dependants in the UK or applying at the same time.\n\nRW 16.5. If RW 16.2.(a) applies, the funds must have been held for a 28-day period and as specified in Appendix Finance.",
      "needs_review": false
    },
    {
      "metadata": {
        "source": "Appendix Temporary Work – Religious Worker",
        "part": "Appendix Temporary Work – Religious Worker",
        "section_id": "RW 17.1",
        "section_title": "Decision on an application as a dependent partner or dependent child of a Religious Worker",
        "parent_section": "RW 17",
        "hierarchy_level": 2,
        "topic": "eligibility",
        "url": "https://www.gov.uk/guidance/immigration-rules/immigration-rules-appendix-t5-temporary-worker-religious-worker",
        "scraped_at": "2025-12-06T17:25:44.175643"
      },
      "text": "### Decision on an application as a dependent partner or dependent child of a Religious Worker\n\nRW 17.1. If the decision maker is satisfied that all the suitability and eligibility requirements for a dependent partner or dependent child of a Religious Worker are met, the application will be granted, otherwise the application will be refused.\n\nRW 17.2. If the application is refused, the person can apply for an Administrative Review under Appendix AR: Administrative Review.",
      "summary": "This provision applies to dependents of Religious Workers seeking entry or stay. The key requirement is that all suitability and eligibility criteria must be met for approval; otherwise, the application will be refused. If refused, applicants may request an Administrative Review.",
      "augmented_text": "Document: Appendix Temporary Work – Religious Worker\nPart: Appendix Temporary Work – Religious Worker\nSection ID: RW 17.1\nSection: Decision on an application as a dependent partner or dependent child of a Religious Worker\nTopic: eligibility\n\nSummary: This provision applies to dependents of Religious Workers seeking entry or stay. The key requirement is that all suitability and eligibility criteria must be met for approval; otherwise, the application will be refused. If refused, applicants may request an Administrative Review.\n\n### Decision on an application as a dependent partner or dependent child of a Religious Worker\n\nRW 17.1. If the decision maker is satisfied that all the suitability and eligibility requirements for a dependent partner or dependent child of a Religious Worker are met, the application will be granted, otherwise the application will be refused.\n\nRW 17.2. If the application is refused, the person can apply for an Administrative Review under Appendix AR: Administrative Review.",
      "needs_review": false
    },
    {
      "metadata": {
        "source": "Appendix Temporary Work – Religious Worker",
        "part": "Appendix Temporary Work – Religious Worker",
        "section_id": "RW 18.1",
        "section_title": "Period of grant for a dependent partner or dependent child of a Religious Worker",
        "parent_section": "RW 18",
        "hierarchy_level": 2,
        "topic": "family",
        "url": "https://www.gov.uk/guidance/immigration-rules/immigration-rules-appendix-t5-temporary-worker-religious-worker",
        "scraped_at": "2025-12-06T17:25:44.175686"
      },
      "text": "### Period of grant for a dependent partner or dependent child of a Religious Worker\n\nRW 18.1. A partner will be granted permission which ends on the same date as their partner’s permission as a Religious Worker.\n\nRW 18.2. A child will be granted permission which ends on the same date as whichever of their parents’ permission ends first.",
      "summary": "This provision applies to dependents of Religious Workers. A partner's permission ends when the Religious Worker's expires; a child's permission expires when either parent’s does first. No exceptions are specified.",
      "augmented_text": "Document: Appendix Temporary Work – Religious Worker\nPart: Appendix Temporary Work – Religious Worker\nSection ID: RW 18.1\nSection: Period of grant for a dependent partner or dependent child of a Religious Worker\nTopic: family\n\nSummary: This provision applies to dependents of Religious Workers. A partner's permission ends when the Religious Worker's expires; a child's permission expires when either parent’s does first. No exceptions are specified.\n\n### Period of grant for a dependent partner or dependent child of a Religious Worker\n\nRW 18.1. A partner will be granted permission which ends on the same date as their partner’s permission as a Religious Worker.\n\nRW 18.2. A child will be granted permission which ends on the same date as whichever of their parents’ permission ends first.",
      "needs_review": false
    },
    {
      "metadata": {
        "source": "Appendix Temporary Work – Religious Worker",
        "part": "Appendix Temporary Work – Religious Worker",
        "section_id": "1",
        "section_title": "Conditions of grant for a dependent partner or dependent child of a Religious Worker",
        "parent_section": null,
        "hierarchy_level": 1,
        "topic": "financial",
        "url": "https://www.gov.uk/guidance/immigration-rules/immigration-rules-appendix-t5-temporary-worker-religious-worker",
        "scraped_at": "2025-12-06T17:25:44.175701"
      },
      "text": "### Conditions of grant for a dependent partner or dependent child of a Religious Worker\n\n1.   RW 18.3. The grant will be subject to all the following conditions: \n    1.   (a) no access to public funds; and\n    2.   (b) work (including self-employment and voluntary work) is permitted, except as a professional sportsperson (including as a sports coach); and\n    3.   (c) study is permitted, subject to the ATAS condition in Appendix ATAS if the applicant is over the age of 18.\n    4.   (d) DELETED.\n\nPrint this page",
      "summary": "Dependent partners or children of Religious Workers may stay with restrictions including no access to public funds, permitted work (excluding professional sports), and study (if over 18 and subject to ATAS). Conditions apply universally without exceptions.",
      "augmented_text": "Document: Appendix Temporary Work – Religious Worker\nPart: Appendix Temporary Work – Religious Worker\nSection ID: 1\nSection: Conditions of grant for a dependent partner or dependent child of a Religious Worker\nTopic: financial\n\nSummary: Dependent partners or children of Religious Workers may stay with restrictions including no access to public funds, permitted work (excluding professional sports), and study (if over 18 and subject to ATAS). Conditions apply universally without exceptions.\n\n### Conditions of grant for a dependent partner or dependent child of a Religious Worker\n\n1.   RW 18.3. The grant will be subject to all the following conditions: \n    1.   (a) no access to public funds; and\n    2.   (b) work (including self-employment and voluntary work) is permitted, except as a professional sportsperson (including as a sports coach); and\n    3.   (c) study is permitted, subject to the ATAS condition in Appendix ATAS if the applicant is over the age of 18.\n    4.   (d) DELETED.\n\nPrint this page",
      "needs_review": false
    }
  ]
}