{
  "url": "https://www.gov.uk/guidance/immigration-rules/immigration-rules-appendix-parent-of-a-child-student",
  "part_name": "Immigration Rules Appendix Parent of a Child Student",
  "scraped_at": "2025-12-06T17:28:15.975278",
  "chunk_count": 11,
  "chunks": [
    {
      "metadata": {
        "source": "Immigration Rules Appendix Parent of a Child Student",
        "part": "Immigration Rules Appendix Parent of a Child Student",
        "section_id": "PC 1.1",
        "section_title": "Validity requirements for the Parent of a Child Student",
        "parent_section": "PC 1",
        "hierarchy_level": 2,
        "topic": "leave-to-enter",
        "url": "https://www.gov.uk/guidance/immigration-rules/immigration-rules-appendix-parent-of-a-child-student",
        "scraped_at": "2025-12-06T17:28:15.975055"
      },
      "text": "### Validity requirements for the Parent of a Child Student\n\nPC 1.1. A person applying for entry clearance or permission to stay as a Parent of a Child Student must apply online on the gov.uk website on the specified form as follows:\n\n| Location of applicant | Specified form |\n| --- | --- |\n| Outside the UK | Parent of a Child Student |\n| Inside the UK | Application to extend stay in the UK: FLR(IR) |\n\n1.   PC 1.2. An application for entry clearance or permission to stay as a Parent of a Child Student must meet all the following requirements: \n    1.   (a) any fee and Immigration Health Charge must have been paid; and\n    2.   (b) the applicant must have provided biometrics when required; and\n    3.   (c) the applicant must have provided a passport or other travel document which satisfactorily establishes their identity and nationality.\n\nPC 1.3. The applicant must be aged 18 or over on the date of application.\n\n1.   PC 1.4. If applying for permission to stay, the applicant must be in the UK on the date of application.\n2.   PC 1.4A. If applying for permission to stay, the applicant must not have, or have last been granted, permission: \n    1.   (a) as a Visitor; or\n    2.   (b) as a Short-term Student; or\n    3.   (c) outside the Immigration Rules.\n\nPC 1.5. An application which does not meet all the validity requirements for the Parent of a Child Student may be rejected as invalid and not considered.",
      "summary": "Applicants must be 18 or over, in the UK (if applying for permission to stay), and submit the correct online form with paid fees, biometrics, and valid travel documents. Applications failing these criteria are invalid and may be rejected. Critical conditions include compliance with specific age, location, and documentation requirements.",
      "augmented_text": "Document: Immigration Rules Appendix Parent of a Child Student\nPart: Immigration Rules Appendix Parent of a Child Student\nSection ID: PC 1.1\nSection: Validity requirements for the Parent of a Child Student\nTopic: leave-to-enter\n\nSummary: Applicants must be 18 or over, in the UK (if applying for permission to stay), and submit the correct online form with paid fees, biometrics, and valid travel documents. Applications failing these criteria are invalid and may be rejected. Critical conditions include compliance with specific age, location, and documentation requirements.\n\n### Validity requirements for the Parent of a Child Student\n\nPC 1.1. A person applying for entry clearance or permission to stay as a Parent of a Child Student must apply online on the gov.uk website on the specified form as follows:\n\n| Location of applicant | Specified form |\n| --- | --- |\n| Outside the UK | Parent of a Child Student |\n| Inside the UK | Application to extend stay in the UK: FLR(IR) |\n\n1.   PC 1.2. An application for entry clearance or permission to stay as a Parent of a Child Student must meet all the following requirements: \n    1.   (a) any fee and Immigration Health Charge must have been paid; and\n    2.   (b) the applicant must have provided biometrics when required; and\n    3.   (c) the applicant must have provided a passport or other travel document which satisfactorily establishes their identity and nationality.\n\nPC 1.3. The applicant must be aged 18 or over on the date of application.\n\n1.   PC 1.4. If applying for permission to stay, the applicant must be in the UK on the date of application.\n2.   PC 1.4A. If applying for permission to stay, the applicant must not have, or have last been granted, permission: \n    1.   (a) as a Visitor; or\n    2.   (b) as a Short-term Student; or\n    3.   (c) outside the Immigration Rules.\n\nPC 1.5. An application which does not meet all the validity requirements for the Parent of a Child Student may be rejected as invalid and not considered.",
      "needs_review": false
    },
    {
      "metadata": {
        "source": "Immigration Rules Appendix Parent of a Child Student",
        "part": "Immigration Rules Appendix Parent of a Child Student",
        "section_id": "PC 2.1",
        "section_title": "Suitability requirements for the Parent of a Child Student",
        "parent_section": "PC 2",
        "hierarchy_level": 2,
        "topic": "suitability",
        "url": "https://www.gov.uk/guidance/immigration-rules/immigration-rules-appendix-parent-of-a-child-student",
        "scraped_at": "2025-12-06T17:28:15.975080"
      },
      "text": "### Suitability requirements for the Parent of a Child Student\n\nPC 2.1. The applicant must not fall for refusal under Part Suitability.\n\n1.   PC 2.2. If applying for permission to stay the applicant must be: \n    1.   (a) in breach of immigration laws, except that where the Exceptions for overstayers section of Part Suitability applies, that period of overstaying will be disregarded; or\n    2.   (b) on immigration bail.",
      "summary": "This provision applies to parents of Child Student applicants. It requires that they are not in breach of immigration laws (except where overstaying is disregarded) or on immigration bail to be deemed suitable.",
      "augmented_text": "Document: Immigration Rules Appendix Parent of a Child Student\nPart: Immigration Rules Appendix Parent of a Child Student\nSection ID: PC 2.1\nSection: Suitability requirements for the Parent of a Child Student\nTopic: suitability\n\nSummary: This provision applies to parents of Child Student applicants. It requires that they are not in breach of immigration laws (except where overstaying is disregarded) or on immigration bail to be deemed suitable.\n\n### Suitability requirements for the Parent of a Child Student\n\nPC 2.1. The applicant must not fall for refusal under Part Suitability.\n\n1.   PC 2.2. If applying for permission to stay the applicant must be: \n    1.   (a) in breach of immigration laws, except that where the Exceptions for overstayers section of Part Suitability applies, that period of overstaying will be disregarded; or\n    2.   (b) on immigration bail.",
      "needs_review": false
    },
    {
      "metadata": {
        "source": "Immigration Rules Appendix Parent of a Child Student",
        "part": "Immigration Rules Appendix Parent of a Child Student",
        "section_id": "Eligibility requirements for Parent of a Child Student",
        "section_title": "Eligibility requirements for Parent of a Child Student",
        "parent_section": null,
        "hierarchy_level": 2,
        "topic": "eligibility",
        "url": "https://www.gov.uk/guidance/immigration-rules/immigration-rules-appendix-parent-of-a-child-student",
        "scraped_at": "2025-12-06T17:28:15.975088"
      },
      "text": "### Eligibility requirements for Parent of a Child Student",
      "summary": "This provision applies to parents of Child Students seeking entry under the Immigration Rules. It requires demonstrating genuine parental relationship, eligibility of the child's status, and sufficient funds or accommodation. Exceptions or specific thresholds may apply depending on circumstances.",
      "augmented_text": "Document: Immigration Rules Appendix Parent of a Child Student\nPart: Immigration Rules Appendix Parent of a Child Student\nSection ID: Eligibility requirements for Parent of a Child Student\nSection: Eligibility requirements for Parent of a Child Student\nTopic: eligibility\n\nSummary: This provision applies to parents of Child Students seeking entry under the Immigration Rules. It requires demonstrating genuine parental relationship, eligibility of the child's status, and sufficient funds or accommodation. Exceptions or specific thresholds may apply depending on circumstances.\n\n### Eligibility requirements for Parent of a Child Student",
      "needs_review": false
    },
    {
      "metadata": {
        "source": "Immigration Rules Appendix Parent of a Child Student",
        "part": "Immigration Rules Appendix Parent of a Child Student",
        "section_id": "PC 3.1",
        "section_title": "Entry requirements for Parent of a Child Student",
        "parent_section": "PC 3",
        "hierarchy_level": 2,
        "topic": "leave-to-enter",
        "url": "https://www.gov.uk/guidance/immigration-rules/immigration-rules-appendix-parent-of-a-child-student",
        "scraped_at": "2025-12-06T17:28:15.975107"
      },
      "text": "### Entry requirements for Parent of a Child Student\n\nPC 3.1. A person seeking to come to the UK as a Parent of a Child Student must apply for and obtain entry clearance as a Parent of a Child Student before they arrive in the UK.\n\nPC 3.2. A person applying for entry clearance as the Parent of a Child Student must, if Appendix Tuberculosis applies, provide a valid medical certificate confirming that they have undergone screening for active pulmonary tuberculosis and that this tuberculosis is not present in them.",
      "summary": "Parents wishing to join a Child Student in the UK must obtain prior entry clearance as a Parent of a Child Student. They must also, if applicable, provide a TB screening certificate confirming they are free of active pulmonary tuberculosis before arrival.",
      "augmented_text": "Document: Immigration Rules Appendix Parent of a Child Student\nPart: Immigration Rules Appendix Parent of a Child Student\nSection ID: PC 3.1\nSection: Entry requirements for Parent of a Child Student\nTopic: leave-to-enter\n\nSummary: Parents wishing to join a Child Student in the UK must obtain prior entry clearance as a Parent of a Child Student. They must also, if applicable, provide a TB screening certificate confirming they are free of active pulmonary tuberculosis before arrival.\n\n### Entry requirements for Parent of a Child Student\n\nPC 3.1. A person seeking to come to the UK as a Parent of a Child Student must apply for and obtain entry clearance as a Parent of a Child Student before they arrive in the UK.\n\nPC 3.2. A person applying for entry clearance as the Parent of a Child Student must, if Appendix Tuberculosis applies, provide a valid medical certificate confirming that they have undergone screening for active pulmonary tuberculosis and that this tuberculosis is not present in them.",
      "needs_review": false
    },
    {
      "metadata": {
        "source": "Immigration Rules Appendix Parent of a Child Student",
        "part": "Immigration Rules Appendix Parent of a Child Student",
        "section_id": "PC 4.1",
        "section_title": "Relationship requirement for Parent of a Child Student",
        "parent_section": "PC 4",
        "hierarchy_level": 2,
        "topic": "leave-to-enter",
        "url": "https://www.gov.uk/guidance/immigration-rules/immigration-rules-appendix-parent-of-a-child-student",
        "scraped_at": "2025-12-06T17:28:15.975130"
      },
      "text": "### Relationship requirement for Parent of a Child Student\n\nPC 4.1. The applicant must be the parent of a child who has, or is at the same time applying for, entry clearance or permission to stay as a Child Student.\n\nPC 4.2. The Child Student’s other parent must not be in the UK or seeking to come to the UK.",
      "summary": "This provision applies to parents applying as Parent of a Child Student. The applicant must be the child's parent, with the child's other parent not in the UK or seeking entry. No exceptions are specified.",
      "augmented_text": "Document: Immigration Rules Appendix Parent of a Child Student\nPart: Immigration Rules Appendix Parent of a Child Student\nSection ID: PC 4.1\nSection: Relationship requirement for Parent of a Child Student\nTopic: leave-to-enter\n\nSummary: This provision applies to parents applying as Parent of a Child Student. The applicant must be the child's parent, with the child's other parent not in the UK or seeking entry. No exceptions are specified.\n\n### Relationship requirement for Parent of a Child Student\n\nPC 4.1. The applicant must be the parent of a child who has, or is at the same time applying for, entry clearance or permission to stay as a Child Student.\n\nPC 4.2. The Child Student’s other parent must not be in the UK or seeking to come to the UK.",
      "needs_review": false
    },
    {
      "metadata": {
        "source": "Immigration Rules Appendix Parent of a Child Student",
        "part": "Immigration Rules Appendix Parent of a Child Student",
        "section_id": "PC 5.1",
        "section_title": "Child Student requirements for Parent of a Child Student",
        "parent_section": "PC 5",
        "hierarchy_level": 2,
        "topic": "leave-to-enter",
        "url": "https://www.gov.uk/guidance/immigration-rules/immigration-rules-appendix-parent-of-a-child-student",
        "scraped_at": "2025-12-06T17:28:15.975147"
      },
      "text": "### Child Student requirements for Parent of a Child Student\n\nPC 5.1. The Child Student must be aged between 4 and 11 years on the date of application and have, or at the same time be applying for, entry clearance or permission to stay, under Appendix Child Student.",
      "summary": "This provision applies to parents applying to stay as a Parent of a Child Student. They must support a child aged 4-11 enrolled as a Child Student under Appendix Child Student, with the child’s age and status at the application date being critical conditions.",
      "augmented_text": "Document: Immigration Rules Appendix Parent of a Child Student\nPart: Immigration Rules Appendix Parent of a Child Student\nSection ID: PC 5.1\nSection: Child Student requirements for Parent of a Child Student\nTopic: leave-to-enter\n\nSummary: This provision applies to parents applying to stay as a Parent of a Child Student. They must support a child aged 4-11 enrolled as a Child Student under Appendix Child Student, with the child’s age and status at the application date being critical conditions.\n\n### Child Student requirements for Parent of a Child Student\n\nPC 5.1. The Child Student must be aged between 4 and 11 years on the date of application and have, or at the same time be applying for, entry clearance or permission to stay, under Appendix Child Student.",
      "needs_review": false
    },
    {
      "metadata": {
        "source": "Immigration Rules Appendix Parent of a Child Student",
        "part": "Immigration Rules Appendix Parent of a Child Student",
        "section_id": "PC 6.1",
        "section_title": "Care requirement for Parent of a Child Student",
        "parent_section": "PC 6",
        "hierarchy_level": 2,
        "topic": "family",
        "url": "https://www.gov.uk/guidance/immigration-rules/immigration-rules-appendix-parent-of-a-child-student",
        "scraped_at": "2025-12-06T17:28:15.975170"
      },
      "text": "### Care requirement for Parent of a Child Student\n\nPC 6.1. The applicant must intend to live with the Child Student during the applicant’s stay in the UK.",
      "summary": "This provision applies to parents of Child Students. The applicant must intend to live with the child during their stay in the UK, with no specific exceptions noted.",
      "augmented_text": "Document: Immigration Rules Appendix Parent of a Child Student\nPart: Immigration Rules Appendix Parent of a Child Student\nSection ID: PC 6.1\nSection: Care requirement for Parent of a Child Student\nTopic: family\n\nSummary: This provision applies to parents of Child Students. The applicant must intend to live with the child during their stay in the UK, with no specific exceptions noted.\n\n### Care requirement for Parent of a Child Student\n\nPC 6.1. The applicant must intend to live with the Child Student during the applicant’s stay in the UK.",
      "needs_review": true,
      "review_reasons": [
        "generic_summary"
      ]
    },
    {
      "metadata": {
        "source": "Immigration Rules Appendix Parent of a Child Student",
        "part": "Immigration Rules Appendix Parent of a Child Student",
        "section_id": "PC 7.1",
        "section_title": "Financial requirement for Parent of a Child Student",
        "parent_section": "PC 7",
        "hierarchy_level": 2,
        "topic": "financial",
        "url": "https://www.gov.uk/guidance/immigration-rules/immigration-rules-appendix-parent-of-a-child-student",
        "scraped_at": "2025-12-06T17:28:15.975182"
      },
      "text": "### Financial requirement for Parent of a Child Student\n\nPC 7.1. If the applicant is applying for permission to stay and has been in the UK with permission for 12 months or longer on the date of application, they will meet the financial requirement and do not need to show funds.\n\nPC 7.2. If both the applicant and the Child Student are applying at the same time for either entry clearance, or permission to stay where they have both lived in the UK for less than 12 months on the date of application, the applicant will meet the financial requirement if the Child Student shows the level of funds required under CS 10.2.\n\n1.   PC 7.3. If neither PC 7.1 or PC 7.2 apply the applicant must: \n    1.   (a) have funds of £1,560 for each month of their intended stay in the UK up to a maximum of 9 months; and\n    2.   (b) have funds of £625 for each month of their intended stay up to a maximum of 9 months for any child other than the Child Student who will be under their care in the UK.\n\nPC 7.4. The applicant must not intend to make the UK their main home and must have sufficient funds to maintain their main home outside the UK, in addition to any other funds required by these rules.\n\nPC 7.5. The applicant or their partner must show that they have held the required level of funds for a 28-day period and as specified in Appendix Finance.\n\nPC 7.6. The applicant may rely on funds held in the account of a partner who is outside the UK in addition to the account holders listed in FIN 5.1(a).",
      "summary": "This provision applies to Parent of a Child Student visa applicants. Applicants must meet financial requirements based on their UK residence duration and the child's circumstances, with specific fund thresholds (£1,560 per month, £625 per month per child). Exceptions apply if they've been in the UK for 12+ months or both applying simultaneously; applicants must also hold funds outside the UK and demonstrate consistent savings for 28 days.",
      "augmented_text": "Document: Immigration Rules Appendix Parent of a Child Student\nPart: Immigration Rules Appendix Parent of a Child Student\nSection ID: PC 7.1\nSection: Financial requirement for Parent of a Child Student\nTopic: financial\n\nSummary: This provision applies to Parent of a Child Student visa applicants. Applicants must meet financial requirements based on their UK residence duration and the child's circumstances, with specific fund thresholds (£1,560 per month, £625 per month per child). Exceptions apply if they've been in the UK for 12+ months or both applying simultaneously; applicants must also hold funds outside the UK and demonstrate consistent savings for 28 days.\n\n### Financial requirement for Parent of a Child Student\n\nPC 7.1. If the applicant is applying for permission to stay and has been in the UK with permission for 12 months or longer on the date of application, they will meet the financial requirement and do not need to show funds.\n\nPC 7.2. If both the applicant and the Child Student are applying at the same time for either entry clearance, or permission to stay where they have both lived in the UK for less than 12 months on the date of application, the applicant will meet the financial requirement if the Child Student shows the level of funds required under CS 10.2.\n\n1.   PC 7.3. If neither PC 7.1 or PC 7.2 apply the applicant must: \n    1.   (a) have funds of £1,560 for each month of their intended stay in the UK up to a maximum of 9 months; and\n    2.   (b) have funds of £625 for each month of their intended stay up to a maximum of 9 months for any child other than the Child Student who will be under their care in the UK.\n\nPC 7.4. The applicant must not intend to make the UK their main home and must have sufficient funds to maintain their main home outside the UK, in addition to any other funds required by these rules.\n\nPC 7.5. The applicant or their partner must show that they have held the required level of funds for a 28-day period and as specified in Appendix Finance.\n\nPC 7.6. The applicant may rely on funds held in the account of a partner who is outside the UK in addition to the account holders listed in FIN 5.1(a).",
      "needs_review": false
    },
    {
      "metadata": {
        "source": "Immigration Rules Appendix Parent of a Child Student",
        "part": "Immigration Rules Appendix Parent of a Child Student",
        "section_id": "PC 8.1",
        "section_title": "Decision on an application as a Parent of a Child Student",
        "parent_section": "PC 8",
        "hierarchy_level": 2,
        "topic": "eligibility",
        "url": "https://www.gov.uk/guidance/immigration-rules/immigration-rules-appendix-parent-of-a-child-student",
        "scraped_at": "2025-12-06T17:28:15.975191"
      },
      "text": "### Decision on an application as a Parent of a Child Student\n\nPC 8.1. If the decision maker is satisfied that all the suitability and eligibility requirements are met for the Parent of a Child Student the application will be granted, otherwise, the application will be refused.\n\nPC 8.2. If the application is refused the person can apply for an Administrative Review under Appendix AR: Administrative Review.",
      "summary": "This provision applies to parents applying as Parents of a Child Student. The key requirement is that all suitability and eligibility criteria must be met for the application to be granted; failure results in refusal. Applicants can request an Administrative Review if refused, with no specific exceptions noted.",
      "augmented_text": "Document: Immigration Rules Appendix Parent of a Child Student\nPart: Immigration Rules Appendix Parent of a Child Student\nSection ID: PC 8.1\nSection: Decision on an application as a Parent of a Child Student\nTopic: eligibility\n\nSummary: This provision applies to parents applying as Parents of a Child Student. The key requirement is that all suitability and eligibility criteria must be met for the application to be granted; failure results in refusal. Applicants can request an Administrative Review if refused, with no specific exceptions noted.\n\n### Decision on an application as a Parent of a Child Student\n\nPC 8.1. If the decision maker is satisfied that all the suitability and eligibility requirements are met for the Parent of a Child Student the application will be granted, otherwise, the application will be refused.\n\nPC 8.2. If the application is refused the person can apply for an Administrative Review under Appendix AR: Administrative Review.",
      "needs_review": false
    },
    {
      "metadata": {
        "source": "Immigration Rules Appendix Parent of a Child Student",
        "part": "Immigration Rules Appendix Parent of a Child Student",
        "section_id": "PC 9.1",
        "section_title": "Period of grant for Parent of a Child Student",
        "parent_section": "PC 9",
        "hierarchy_level": 2,
        "topic": "family",
        "url": "https://www.gov.uk/guidance/immigration-rules/immigration-rules-appendix-parent-of-a-child-student",
        "scraped_at": "2025-12-06T17:28:15.975215"
      },
      "text": "### Period of grant for Parent of a Child Student\n\nPC 9.1. The Parent of a Child Student will be granted permission for a period which ends at the same time as the Child Student’s permission, or on the date the Child Student reaches the age of 12 years, whichever is sooner.",
      "summary": "The provision applies to Parents of Child Students seeking permission. They must be granted leave that expires with the Child Student’s status or when the child turns 12, whichever occurs first. No exceptions are specified.",
      "augmented_text": "Document: Immigration Rules Appendix Parent of a Child Student\nPart: Immigration Rules Appendix Parent of a Child Student\nSection ID: PC 9.1\nSection: Period of grant for Parent of a Child Student\nTopic: family\n\nSummary: The provision applies to Parents of Child Students seeking permission. They must be granted leave that expires with the Child Student’s status or when the child turns 12, whichever occurs first. No exceptions are specified.\n\n### Period of grant for Parent of a Child Student\n\nPC 9.1. The Parent of a Child Student will be granted permission for a period which ends at the same time as the Child Student’s permission, or on the date the Child Student reaches the age of 12 years, whichever is sooner.",
      "needs_review": false
    },
    {
      "metadata": {
        "source": "Immigration Rules Appendix Parent of a Child Student",
        "part": "Immigration Rules Appendix Parent of a Child Student",
        "section_id": "1",
        "section_title": "Conditions of grant for Parent of a Child Student",
        "parent_section": null,
        "hierarchy_level": 1,
        "topic": "financial",
        "url": "https://www.gov.uk/guidance/immigration-rules/immigration-rules-appendix-parent-of-a-child-student",
        "scraped_at": "2025-12-06T17:28:15.975227"
      },
      "text": "### Conditions of grant for Parent of a Child Student\n\n1.   PC 9.2. The grant will be subject to all the following conditions: \n    1.   (a) no access to public funds; and\n    2.   (b) no work; and\n    3.   (c) no study.\n    4.   (d) DELETED.\n\nPrint this page",
      "summary": "This provision applies to Parents of Child Students granted entry under the Immigration Rules. It requires them to abstain from accessing public funds, working, or studying during their stay, with specific conditions outlined for maintaining status.",
      "augmented_text": "Document: Immigration Rules Appendix Parent of a Child Student\nPart: Immigration Rules Appendix Parent of a Child Student\nSection ID: 1\nSection: Conditions of grant for Parent of a Child Student\nTopic: financial\n\nSummary: This provision applies to Parents of Child Students granted entry under the Immigration Rules. It requires them to abstain from accessing public funds, working, or studying during their stay, with specific conditions outlined for maintaining status.\n\n### Conditions of grant for Parent of a Child Student\n\n1.   PC 9.2. The grant will be subject to all the following conditions: \n    1.   (a) no access to public funds; and\n    2.   (b) no work; and\n    3.   (c) no study.\n    4.   (d) DELETED.\n\nPrint this page",
      "needs_review": false
    }
  ]
}