{
  "url": "https://www.gov.uk/guidance/immigration-rules/immigration-rules-appendix-child-relative-sponsors-with-protection",
  "part_name": "Immigration Rules Appendix Child Relative (Sponsors with Protection)",
  "scraped_at": "2025-12-06T17:26:20.538677",
  "chunk_count": 17,
  "chunks": [
    {
      "metadata": {
        "source": "Immigration Rules Appendix Child Relative (Sponsors with Protection)",
        "part": "Immigration Rules Appendix Child Relative (Sponsors with Protection)",
        "section_id": "Entry clearance or permission to stay with or join a close relative",
        "section_title": "Entry clearance or permission to stay with or join a close relative",
        "parent_section": null,
        "hierarchy_level": 2,
        "topic": "leave-to-enter",
        "url": "https://www.gov.uk/guidance/immigration-rules/immigration-rules-appendix-child-relative-sponsors-with-protection",
        "scraped_at": "2025-12-06T17:26:20.538247"
      },
      "text": "### Entry clearance or permission to stay with or join a close relative",
      "summary": "This provision applies to applicants seeking entry clearance or permission to stay with or join a close relative under UK immigration rules. It requires the sponsor to demonstrate their relationship and meet specific eligibility criteria, with exceptions for special protection cases.",
      "augmented_text": "Document: Immigration Rules Appendix Child Relative (Sponsors with Protection)\nPart: Immigration Rules Appendix Child Relative (Sponsors with Protection)\nSection ID: Entry clearance or permission to stay with or join a close relative\nSection: Entry clearance or permission to stay with or join a close relative\nTopic: leave-to-enter\n\nSummary: This provision applies to applicants seeking entry clearance or permission to stay with or join a close relative under UK immigration rules. It requires the sponsor to demonstrate their relationship and meet specific eligibility criteria, with exceptions for special protection cases.\n\n### Entry clearance or permission to stay with or join a close relative",
      "needs_review": false
    },
    {
      "metadata": {
        "source": "Immigration Rules Appendix Child Relative (Sponsors with Protection)",
        "part": "Immigration Rules Appendix Child Relative (Sponsors with Protection)",
        "section_id": "CRP 1.1",
        "section_title": "Validity requirements for entry clearance or permission to stay with or join a close relative",
        "parent_section": "CRP 1",
        "hierarchy_level": 2,
        "topic": "leave-to-enter",
        "url": "https://www.gov.uk/guidance/immigration-rules/immigration-rules-appendix-child-relative-sponsors-with-protection",
        "scraped_at": "2025-12-06T17:26:20.538297"
      },
      "text": "### Validity requirements for entry clearance or permission to stay with or join a close relative\n\nCRP 1.1. A person applying for permission to stay in the UK with their close relative must apply on the GOV.UK website on the specified form as follows: “FLR (P).\n\nCRP 1.1A. A person applying for entry clearance to join their close relative in the UK must apply online on the GOV.UK website on the specified form as follows: “Child of a close relative with protection status in the UK”.\n\n1.   CRP 1.2. An application for entry clearance or permission to stay with or join a close relative in the UK must meet all the following requirements: \n    1.   (a) any fee and Immigration Health Charge must have been paid (unless the applicant has been granted a fee waiver); and\n    2.   (b) the applicant must have provided biometrics when required; and\n    3.   (c) the applicant must have satisfactorily established their identity and nationality; and\n    4.   (d) the applicant’s close relative must currently have protection status in the UK; and\n    5.   (e) the applicant must be under the age of 18 on the date of application.\n\nCRP 1.3. An application which does not meet all the validity requirements for entry clearance or permission to stay with or join a close relative in the UK may be rejected as invalid and not considered.",
      "summary": "Applicants under 18 seeking permission to stay or join a protected close relative must apply online using specified forms, meet fee, biometrics, identity, and age requirements, and their relative must have protection status in the UK. Applications failing to meet these conditions will be rejected as invalid.",
      "augmented_text": "Document: Immigration Rules Appendix Child Relative (Sponsors with Protection)\nPart: Immigration Rules Appendix Child Relative (Sponsors with Protection)\nSection ID: CRP 1.1\nSection: Validity requirements for entry clearance or permission to stay with or join a close relative\nTopic: leave-to-enter\n\nSummary: Applicants under 18 seeking permission to stay or join a protected close relative must apply online using specified forms, meet fee, biometrics, identity, and age requirements, and their relative must have protection status in the UK. Applications failing to meet these conditions will be rejected as invalid.\n\n### Validity requirements for entry clearance or permission to stay with or join a close relative\n\nCRP 1.1. A person applying for permission to stay in the UK with their close relative must apply on the GOV.UK website on the specified form as follows: “FLR (P).\n\nCRP 1.1A. A person applying for entry clearance to join their close relative in the UK must apply online on the GOV.UK website on the specified form as follows: “Child of a close relative with protection status in the UK”.\n\n1.   CRP 1.2. An application for entry clearance or permission to stay with or join a close relative in the UK must meet all the following requirements: \n    1.   (a) any fee and Immigration Health Charge must have been paid (unless the applicant has been granted a fee waiver); and\n    2.   (b) the applicant must have provided biometrics when required; and\n    3.   (c) the applicant must have satisfactorily established their identity and nationality; and\n    4.   (d) the applicant’s close relative must currently have protection status in the UK; and\n    5.   (e) the applicant must be under the age of 18 on the date of application.\n\nCRP 1.3. An application which does not meet all the validity requirements for entry clearance or permission to stay with or join a close relative in the UK may be rejected as invalid and not considered.",
      "needs_review": false
    },
    {
      "metadata": {
        "source": "Immigration Rules Appendix Child Relative (Sponsors with Protection)",
        "part": "Immigration Rules Appendix Child Relative (Sponsors with Protection)",
        "section_id": "CRP 2.1",
        "section_title": "Suitability requirements for entry clearance or permission to stay with or join a close relative",
        "parent_section": "CRP 2",
        "hierarchy_level": 2,
        "topic": "suitability",
        "url": "https://www.gov.uk/guidance/immigration-rules/immigration-rules-appendix-child-relative-sponsors-with-protection",
        "scraped_at": "2025-12-06T17:26:20.538329"
      },
      "text": "### Suitability requirements for entry clearance or permission to stay with or join a close relative\n\nCRP 2.1. The applicant must not fall for refusal under Part Suitability.",
      "summary": "This provision applies to applicants seeking entry clearance or permission to stay with or join a close relative. They must meet suitability requirements, ensuring they do not qualify for refusal under Part Suitability, with no specified exceptions.",
      "augmented_text": "Document: Immigration Rules Appendix Child Relative (Sponsors with Protection)\nPart: Immigration Rules Appendix Child Relative (Sponsors with Protection)\nSection ID: CRP 2.1\nSection: Suitability requirements for entry clearance or permission to stay with or join a close relative\nTopic: suitability\n\nSummary: This provision applies to applicants seeking entry clearance or permission to stay with or join a close relative. They must meet suitability requirements, ensuring they do not qualify for refusal under Part Suitability, with no specified exceptions.\n\n### Suitability requirements for entry clearance or permission to stay with or join a close relative\n\nCRP 2.1. The applicant must not fall for refusal under Part Suitability.",
      "needs_review": false
    },
    {
      "metadata": {
        "source": "Immigration Rules Appendix Child Relative (Sponsors with Protection)",
        "part": "Immigration Rules Appendix Child Relative (Sponsors with Protection)",
        "section_id": "1",
        "section_title": "Eligibility requirements for entry clearance or permission to stay with or join a close relative",
        "parent_section": null,
        "hierarchy_level": 1,
        "topic": "eligibility",
        "url": "https://www.gov.uk/guidance/immigration-rules/immigration-rules-appendix-child-relative-sponsors-with-protection",
        "scraped_at": "2025-12-06T17:26:20.538346"
      },
      "text": "### Eligibility requirements for entry clearance or permission to stay with or join a close relative\n\n1.   CRP 3.1. The applicant must meet the following requirements for a dependent child in Appendix Children: \n    1.   (a) independent life requirement; and\n    2.   (b) care requirement.\n\n2.   CRP 3.2. The decision maker must be satisfied that the applicant has no family other than the close relative in the UK that could reasonably be expected to support or care for them.",
      "summary": "This provision applies to dependent children seeking entry clearance or permission to stay with or join a close relative. Applicants must meet the independent life and care requirements and have no family outside the UK able to support or care for them. Exceptionally, the decision hinges on these criteria being satisfied.",
      "augmented_text": "Document: Immigration Rules Appendix Child Relative (Sponsors with Protection)\nPart: Immigration Rules Appendix Child Relative (Sponsors with Protection)\nSection ID: 1\nSection: Eligibility requirements for entry clearance or permission to stay with or join a close relative\nTopic: eligibility\n\nSummary: This provision applies to dependent children seeking entry clearance or permission to stay with or join a close relative. Applicants must meet the independent life and care requirements and have no family outside the UK able to support or care for them. Exceptionally, the decision hinges on these criteria being satisfied.\n\n### Eligibility requirements for entry clearance or permission to stay with or join a close relative\n\n1.   CRP 3.1. The applicant must meet the following requirements for a dependent child in Appendix Children: \n    1.   (a) independent life requirement; and\n    2.   (b) care requirement.\n\n2.   CRP 3.2. The decision maker must be satisfied that the applicant has no family other than the close relative in the UK that could reasonably be expected to support or care for them.",
      "needs_review": false
    },
    {
      "metadata": {
        "source": "Immigration Rules Appendix Child Relative (Sponsors with Protection)",
        "part": "Immigration Rules Appendix Child Relative (Sponsors with Protection)",
        "section_id": "CRP 4.1",
        "section_title": "Relationship requirements for entry clearance or permission to stay with or join a close relative",
        "parent_section": "CRP 4",
        "hierarchy_level": 2,
        "topic": "leave-to-enter",
        "url": "https://www.gov.uk/guidance/immigration-rules/immigration-rules-appendix-child-relative-sponsors-with-protection",
        "scraped_at": "2025-12-06T17:26:20.538373"
      },
      "text": "### Relationship requirements for entry clearance or permission to stay with or join a close relative\n\nCRP 4.1. The decision maker must be satisfied that the applicant has an existing, genuine family relationship with their close relative in the UK.\n\nCRP 4.2. The person with protection status in the UK must be a close relative of the applicant.",
      "summary": "This provision applies to applicants seeking entry clearance or permission to stay with or join a close relative in the UK. It requires proof of a genuine family relationship with a close relative who has protection status in the UK. The decision depends on satisfying the relationship’s authenticity; no exceptions are specified here.",
      "augmented_text": "Document: Immigration Rules Appendix Child Relative (Sponsors with Protection)\nPart: Immigration Rules Appendix Child Relative (Sponsors with Protection)\nSection ID: CRP 4.1\nSection: Relationship requirements for entry clearance or permission to stay with or join a close relative\nTopic: leave-to-enter\n\nSummary: This provision applies to applicants seeking entry clearance or permission to stay with or join a close relative in the UK. It requires proof of a genuine family relationship with a close relative who has protection status in the UK. The decision depends on satisfying the relationship’s authenticity; no exceptions are specified here.\n\n### Relationship requirements for entry clearance or permission to stay with or join a close relative\n\nCRP 4.1. The decision maker must be satisfied that the applicant has an existing, genuine family relationship with their close relative in the UK.\n\nCRP 4.2. The person with protection status in the UK must be a close relative of the applicant.",
      "needs_review": false
    },
    {
      "metadata": {
        "source": "Immigration Rules Appendix Child Relative (Sponsors with Protection)",
        "part": "Immigration Rules Appendix Child Relative (Sponsors with Protection)",
        "section_id": "CRP 5.1",
        "section_title": "Maintenance and accommodation requirements for entry clearance or permission to stay with or join a close relative",
        "parent_section": "CRP 5",
        "hierarchy_level": 2,
        "topic": "financial",
        "url": "https://www.gov.uk/guidance/immigration-rules/immigration-rules-appendix-child-relative-sponsors-with-protection",
        "scraped_at": "2025-12-06T17:26:20.538391"
      },
      "text": "### Maintenance and accommodation requirements for entry clearance or permission to stay with or join a close relative\n\nCRP 5.1. The close relative in the UK must be able to provide adequate maintenance and accommodation for the applicant without reliance on public funds.\n\nCRP 5.2. The applicant must provide evidence of funds as specified in Appendix FM-SE.",
      "summary": "This provision applies to close relatives in the UK seeking entry clearance or permission to stay with or join a relative. It requires the UK-based relative to demonstrate the ability to provide adequate maintenance and accommodation without public funds, with applicants needing to supply proof of funds as specified in Appendix FM-SE.",
      "augmented_text": "Document: Immigration Rules Appendix Child Relative (Sponsors with Protection)\nPart: Immigration Rules Appendix Child Relative (Sponsors with Protection)\nSection ID: CRP 5.1\nSection: Maintenance and accommodation requirements for entry clearance or permission to stay with or join a close relative\nTopic: financial\n\nSummary: This provision applies to close relatives in the UK seeking entry clearance or permission to stay with or join a relative. It requires the UK-based relative to demonstrate the ability to provide adequate maintenance and accommodation without public funds, with applicants needing to supply proof of funds as specified in Appendix FM-SE.\n\n### Maintenance and accommodation requirements for entry clearance or permission to stay with or join a close relative\n\nCRP 5.1. The close relative in the UK must be able to provide adequate maintenance and accommodation for the applicant without reliance on public funds.\n\nCRP 5.2. The applicant must provide evidence of funds as specified in Appendix FM-SE.",
      "needs_review": false
    },
    {
      "metadata": {
        "source": "Immigration Rules Appendix Child Relative (Sponsors with Protection)",
        "part": "Immigration Rules Appendix Child Relative (Sponsors with Protection)",
        "section_id": "CRP 6.1",
        "section_title": "Eligibility under Article 8 of the Human Rights Convention for entry clearance or permission to stay with or join a close relative",
        "parent_section": "CRP 6",
        "hierarchy_level": 2,
        "topic": "eligibility",
        "url": "https://www.gov.uk/guidance/immigration-rules/immigration-rules-appendix-child-relative-sponsors-with-protection",
        "scraped_at": "2025-12-06T17:26:20.538405"
      },
      "text": "### Eligibility under Article 8 of the Human Rights Convention for entry clearance or permission to stay with or join a close relative\n\nCRP 6.1. Where the applicant does not meet all the suitability or eligibility requirements (subject to CRP 6.2), the decision maker must be satisfied that refusal of the application would not breach Article 8 of the Human Rights Convention because it would result in unjustifiably harsh consequences for the applicant or their family.\n\nCRP 6.2. Where CRP 6.1. applies and the decision maker is satisfied that the applicant should be refused under paragraph SUI 2.1., paragraph SUI 2.3., paragraph SUI 3.1., paragraph SUI 4.1. and paragraph SUI 5.1. of Part Suitability, the application to stay with or join a close relative in the UK will be refused.",
      "summary": "This provision applies to applicants seeking entry or stay with a close relative under Article 8. The decision must consider whether refusal would breach Article 8 due to unjustifiably harsh consequences, unless suitability criteria are met for refusal. Exceptions occur if the applicant fails suitability conditions, leading to application refusal.",
      "augmented_text": "Document: Immigration Rules Appendix Child Relative (Sponsors with Protection)\nPart: Immigration Rules Appendix Child Relative (Sponsors with Protection)\nSection ID: CRP 6.1\nSection: Eligibility under Article 8 of the Human Rights Convention for entry clearance or permission to stay with or join a close relative\nTopic: eligibility\n\nSummary: This provision applies to applicants seeking entry or stay with a close relative under Article 8. The decision must consider whether refusal would breach Article 8 due to unjustifiably harsh consequences, unless suitability criteria are met for refusal. Exceptions occur if the applicant fails suitability conditions, leading to application refusal.\n\n### Eligibility under Article 8 of the Human Rights Convention for entry clearance or permission to stay with or join a close relative\n\nCRP 6.1. Where the applicant does not meet all the suitability or eligibility requirements (subject to CRP 6.2), the decision maker must be satisfied that refusal of the application would not breach Article 8 of the Human Rights Convention because it would result in unjustifiably harsh consequences for the applicant or their family.\n\nCRP 6.2. Where CRP 6.1. applies and the decision maker is satisfied that the applicant should be refused under paragraph SUI 2.1., paragraph SUI 2.3., paragraph SUI 3.1., paragraph SUI 4.1. and paragraph SUI 5.1. of Part Suitability, the application to stay with or join a close relative in the UK will be refused.",
      "needs_review": false
    },
    {
      "metadata": {
        "source": "Immigration Rules Appendix Child Relative (Sponsors with Protection)",
        "part": "Immigration Rules Appendix Child Relative (Sponsors with Protection)",
        "section_id": "CRP 7.1",
        "section_title": "Decision on an application for entry clearance or permission to stay with or join a close relative",
        "parent_section": "CRP 7",
        "hierarchy_level": 2,
        "topic": "eligibility",
        "url": "https://www.gov.uk/guidance/immigration-rules/immigration-rules-appendix-child-relative-sponsors-with-protection",
        "scraped_at": "2025-12-06T17:26:20.538419"
      },
      "text": "### Decision on an application for entry clearance or permission to stay with or join a close relative\n\nCRP 7.1. Where the decision maker is satisfied that all the relevant eligibility requirements are met, unless paragraph CRP 6.2. applies, the application will be granted permission which expires on the same date as their close relative’s permission in the UK; otherwise, the application will be refused.",
      "summary": "This provision applies to applicants seeking permission to stay with or join a close relative under the Child Relative category. The decision maker must be satisfied that all eligibility requirements are met for permission to be granted, which will expire alongside the close relative’s permission unless specific conditions apply; otherwise, the application is refused.",
      "augmented_text": "Document: Immigration Rules Appendix Child Relative (Sponsors with Protection)\nPart: Immigration Rules Appendix Child Relative (Sponsors with Protection)\nSection ID: CRP 7.1\nSection: Decision on an application for entry clearance or permission to stay with or join a close relative\nTopic: eligibility\n\nSummary: This provision applies to applicants seeking permission to stay with or join a close relative under the Child Relative category. The decision maker must be satisfied that all eligibility requirements are met for permission to be granted, which will expire alongside the close relative’s permission unless specific conditions apply; otherwise, the application is refused.\n\n### Decision on an application for entry clearance or permission to stay with or join a close relative\n\nCRP 7.1. Where the decision maker is satisfied that all the relevant eligibility requirements are met, unless paragraph CRP 6.2. applies, the application will be granted permission which expires on the same date as their close relative’s permission in the UK; otherwise, the application will be refused.",
      "needs_review": false
    },
    {
      "metadata": {
        "source": "Immigration Rules Appendix Child Relative (Sponsors with Protection)",
        "part": "Immigration Rules Appendix Child Relative (Sponsors with Protection)",
        "section_id": "CRP 8.1",
        "section_title": "Period of grant for entry clearance or permission to stay with or join a close relative",
        "parent_section": "CRP 8",
        "hierarchy_level": 2,
        "topic": "leave-to-enter",
        "url": "https://www.gov.uk/guidance/immigration-rules/immigration-rules-appendix-child-relative-sponsors-with-protection",
        "scraped_at": "2025-12-06T17:26:20.538446"
      },
      "text": "### Period of grant for entry clearance or permission to stay with or join a close relative\n\nCRP 8.1. The applicant will be granted permission which expires on the same date as their close relative’s permission in the UK.",
      "summary": "This provision applies to applicants joining close relatives with protection. They must be granted permission that expires concurrently with the relative’s existing permission in the UK. No specific exceptions or thresholds are detailed.",
      "augmented_text": "Document: Immigration Rules Appendix Child Relative (Sponsors with Protection)\nPart: Immigration Rules Appendix Child Relative (Sponsors with Protection)\nSection ID: CRP 8.1\nSection: Period of grant for entry clearance or permission to stay with or join a close relative\nTopic: leave-to-enter\n\nSummary: This provision applies to applicants joining close relatives with protection. They must be granted permission that expires concurrently with the relative’s existing permission in the UK. No specific exceptions or thresholds are detailed.\n\n### Period of grant for entry clearance or permission to stay with or join a close relative\n\nCRP 8.1. The applicant will be granted permission which expires on the same date as their close relative’s permission in the UK.",
      "needs_review": false
    },
    {
      "metadata": {
        "source": "Immigration Rules Appendix Child Relative (Sponsors with Protection)",
        "part": "Immigration Rules Appendix Child Relative (Sponsors with Protection)",
        "section_id": "1",
        "section_title": "Conditions of grant for entry clearance or permission to stay with or join a close relative",
        "parent_section": null,
        "hierarchy_level": 1,
        "topic": "financial",
        "url": "https://www.gov.uk/guidance/immigration-rules/immigration-rules-appendix-child-relative-sponsors-with-protection",
        "scraped_at": "2025-12-06T17:26:20.538470"
      },
      "text": "### Conditions of grant for entry clearance or permission to stay with or join a close relative\n\n1.   CRP 9.1. The applicant’s permission will be subject to the following conditions: \n    1.   (a) no access to public funds, unless CRP 9.2. applies; and\n    2.   (b) work permitted (including self-employment and voluntary work); and (c) study is permitted, subject to the ATAS condition in Appendix ATAS.\n\n1.   CRP 9.2. Where the decision maker is satisfied that: \n    1.   (a) the close relative in the UK is destitute as defined in section 95 of the Immigration and Asylum Act 1999, or is at risk of imminent destitution; or\n    2.   (b) there are reasons relating to the welfare of the applicant which outweigh the considerations for imposing or maintaining the condition (treating the best interests of a relevant child as a primary consideration); or\n    3.   (c) the applicant is facing exceptional circumstances affecting their income or expenditure;\n\n2.   then the applicant’s permission will not be subject to a condition of no access to public funds.\n\n1.   CRP 9.3. For the purposes of CRP 9.2, ‘relevant child’ means a person who: \n    1.   (a) is under the age of 18 years on the date of application; and\n    2.   (b) would be affected by a decision to impose or maintain the no access to public funds condition based on the information provided by the applicant.",
      "summary": "This provision applies to applicants seeking permission to stay or join close relatives under the Child Relative route. It mandates conditions such as no access to public funds (unless specific hardship criteria are met), with work and study permitted; exceptions apply if the UK relative is destitute, welfare concerns prevail, or there are exceptional financial circumstances. The 'relevant child' is under 18 and impacted by public funds restrictions.",
      "augmented_text": "Document: Immigration Rules Appendix Child Relative (Sponsors with Protection)\nPart: Immigration Rules Appendix Child Relative (Sponsors with Protection)\nSection ID: 1\nSection: Conditions of grant for entry clearance or permission to stay with or join a close relative\nTopic: financial\n\nSummary: This provision applies to applicants seeking permission to stay or join close relatives under the Child Relative route. It mandates conditions such as no access to public funds (unless specific hardship criteria are met), with work and study permitted; exceptions apply if the UK relative is destitute, welfare concerns prevail, or there are exceptional financial circumstances. The 'relevant child' is under 18 and impacted by public funds restrictions.\n\n### Conditions of grant for entry clearance or permission to stay with or join a close relative\n\n1.   CRP 9.1. The applicant’s permission will be subject to the following conditions: \n    1.   (a) no access to public funds, unless CRP 9.2. applies; and\n    2.   (b) work permitted (including self-employment and voluntary work); and (c) study is permitted, subject to the ATAS condition in Appendix ATAS.\n\n1.   CRP 9.2. Where the decision maker is satisfied that: \n    1.   (a) the close relative in the UK is destitute as defined in section 95 of the Immigration and Asylum Act 1999, or is at risk of imminent destitution; or\n    2.   (b) there are reasons relating to the welfare of the applicant which outweigh the considerations for imposing or maintaining the condition (treating the best interests of a relevant child as a primary consideration); or\n    3.   (c) the applicant is facing exceptional circumstances affecting their income or expenditure;\n\n2.   then the applicant’s permission will not be subject to a condition of no access to public funds.\n\n1.   CRP 9.3. For the purposes of CRP 9.2, ‘relevant child’ means a person who: \n    1.   (a) is under the age of 18 years on the date of application; and\n    2.   (b) would be affected by a decision to impose or maintain the no access to public funds condition based on the information provided by the applicant.",
      "needs_review": false
    },
    {
      "metadata": {
        "source": "Immigration Rules Appendix Child Relative (Sponsors with Protection)",
        "part": "Immigration Rules Appendix Child Relative (Sponsors with Protection)",
        "section_id": "Settlement to stay with a close relative",
        "section_title": "Settlement to stay with a close relative",
        "parent_section": null,
        "hierarchy_level": 2,
        "topic": "settlement",
        "url": "https://www.gov.uk/guidance/immigration-rules/immigration-rules-appendix-child-relative-sponsors-with-protection",
        "scraped_at": "2025-12-06T17:26:20.538488"
      },
      "text": "### Settlement to stay with a close relative",
      "summary": "This provision applies to sponsors with protection status seeking settlement for their child relatives. It requires demonstrating a genuine family relationship and that the child's best interests justify settlement, with relevant conditions and safeguards in place.",
      "augmented_text": "Document: Immigration Rules Appendix Child Relative (Sponsors with Protection)\nPart: Immigration Rules Appendix Child Relative (Sponsors with Protection)\nSection ID: Settlement to stay with a close relative\nSection: Settlement to stay with a close relative\nTopic: settlement\n\nSummary: This provision applies to sponsors with protection status seeking settlement for their child relatives. It requires demonstrating a genuine family relationship and that the child's best interests justify settlement, with relevant conditions and safeguards in place.\n\n### Settlement to stay with a close relative",
      "needs_review": false
    },
    {
      "metadata": {
        "source": "Immigration Rules Appendix Child Relative (Sponsors with Protection)",
        "part": "Immigration Rules Appendix Child Relative (Sponsors with Protection)",
        "section_id": "CRP 10.1",
        "section_title": "Validity requirements for settlement to stay with a close",
        "parent_section": "CRP 10",
        "hierarchy_level": 2,
        "topic": "leave-to-remain",
        "url": "https://www.gov.uk/guidance/immigration-rules/immigration-rules-appendix-child-relative-sponsors-with-protection",
        "scraped_at": "2025-12-06T17:26:20.538522"
      },
      "text": "### Validity requirements for settlement to stay with a close\n\nCRP 10.1. A person in the UK applying for settlement to stay with their close relative in the UK must apply on the specified form “Apply to extend your stay or apply for indefinite leave to remain if your asylum claim has been refused and you have been given discretionary leave, or apply for settlement to stay with a close relative (FLR (DL))”.\n\n1.   CRP 10.2. An application for settlement to stay with a close relative in the UK must meet all the following requirements: \n    1.   (a) any fee must have been paid; and\n    2.   (b) the applicant must have provided biometrics when required; and\n    3.   (c) the applicant must be in the UK on the date of application; and\n    4.   (d) the applicant must have satisfactorily established their identity and nationality; and\n    5.   (e) the applicant must have, or have last had, permission to stay with or join their close relative in the UK under Appendix CRP; and\n    6.   (f) the applicant’s close relative must: \n        1.   (i) have made a separate but valid application for settlement in the UK, and that application has not yet been decided; or\n        2.   (ii) be already settled in the UK, providing they had protection status when they settled.\n\nCRP 10.3. An application which does not meet all the validity requirements for settlement to stay with their close relative in the UK may be rejected as invalid and not considered.",
      "summary": "This provision applies to individuals in the UK applying for settlement to stay with a close relative. Applicants must meet requirements including paying fees, providing biometrics, being in the UK on application, and establishing identity and nationality; their relative must have a valid settlement or protection status. Applications failing these conditions are invalid and may be rejected.",
      "augmented_text": "Document: Immigration Rules Appendix Child Relative (Sponsors with Protection)\nPart: Immigration Rules Appendix Child Relative (Sponsors with Protection)\nSection ID: CRP 10.1\nSection: Validity requirements for settlement to stay with a close\nTopic: leave-to-remain\n\nSummary: This provision applies to individuals in the UK applying for settlement to stay with a close relative. Applicants must meet requirements including paying fees, providing biometrics, being in the UK on application, and establishing identity and nationality; their relative must have a valid settlement or protection status. Applications failing these conditions are invalid and may be rejected.\n\n### Validity requirements for settlement to stay with a close\n\nCRP 10.1. A person in the UK applying for settlement to stay with their close relative in the UK must apply on the specified form “Apply to extend your stay or apply for indefinite leave to remain if your asylum claim has been refused and you have been given discretionary leave, or apply for settlement to stay with a close relative (FLR (DL))”.\n\n1.   CRP 10.2. An application for settlement to stay with a close relative in the UK must meet all the following requirements: \n    1.   (a) any fee must have been paid; and\n    2.   (b) the applicant must have provided biometrics when required; and\n    3.   (c) the applicant must be in the UK on the date of application; and\n    4.   (d) the applicant must have satisfactorily established their identity and nationality; and\n    5.   (e) the applicant must have, or have last had, permission to stay with or join their close relative in the UK under Appendix CRP; and\n    6.   (f) the applicant’s close relative must: \n        1.   (i) have made a separate but valid application for settlement in the UK, and that application has not yet been decided; or\n        2.   (ii) be already settled in the UK, providing they had protection status when they settled.\n\nCRP 10.3. An application which does not meet all the validity requirements for settlement to stay with their close relative in the UK may be rejected as invalid and not considered.",
      "needs_review": false
    },
    {
      "metadata": {
        "source": "Immigration Rules Appendix Child Relative (Sponsors with Protection)",
        "part": "Immigration Rules Appendix Child Relative (Sponsors with Protection)",
        "section_id": "CRP 11.1",
        "section_title": "Suitability requirements for settlement to stay with a close relative",
        "parent_section": "CRP 11",
        "hierarchy_level": 2,
        "topic": "suitability",
        "url": "https://www.gov.uk/guidance/immigration-rules/immigration-rules-appendix-child-relative-sponsors-with-protection",
        "scraped_at": "2025-12-06T17:26:20.538541"
      },
      "text": "### Suitability requirements for settlement to stay with a close relative\n\nCRP 11.1. The applicant must not fall for refusal under Part Suitability.",
      "summary": "This provision applies to applicants seeking settlement to stay with a close relative under Appendix Child Relative (Sponsors with Protection). The applicant must meet suitability requirements, including not being refused under Part Suitability, with no specific exemptions noted.",
      "augmented_text": "Document: Immigration Rules Appendix Child Relative (Sponsors with Protection)\nPart: Immigration Rules Appendix Child Relative (Sponsors with Protection)\nSection ID: CRP 11.1\nSection: Suitability requirements for settlement to stay with a close relative\nTopic: suitability\n\nSummary: This provision applies to applicants seeking settlement to stay with a close relative under Appendix Child Relative (Sponsors with Protection). The applicant must meet suitability requirements, including not being refused under Part Suitability, with no specific exemptions noted.\n\n### Suitability requirements for settlement to stay with a close relative\n\nCRP 11.1. The applicant must not fall for refusal under Part Suitability.",
      "needs_review": false
    },
    {
      "metadata": {
        "source": "Immigration Rules Appendix Child Relative (Sponsors with Protection)",
        "part": "Immigration Rules Appendix Child Relative (Sponsors with Protection)",
        "section_id": "1",
        "section_title": "Eligibility requirements for settlement to stay with a close relative Requirements for settlement to stay with a close relative",
        "parent_section": null,
        "hierarchy_level": 1,
        "topic": "eligibility",
        "url": "https://www.gov.uk/guidance/immigration-rules/immigration-rules-appendix-child-relative-sponsors-with-protection",
        "scraped_at": "2025-12-06T17:26:20.538553"
      },
      "text": "### Eligibility requirements for settlement to stay with a close relative Requirements for settlement to stay with a close relative\n\n1.   CRP 12.1. The applicant must meet the following requirements for a dependent child in Appendix Children: \n    1.   (a) independent life requirement; and\n    2.   (b) care requirement.",
      "summary": "This provision applies to dependent children seeking settlement to stay with a close relative. Applicants must meet the independence and care requirements detailed in Appendix Children, with specific thresholds for independence and care needs being essential.",
      "augmented_text": "Document: Immigration Rules Appendix Child Relative (Sponsors with Protection)\nPart: Immigration Rules Appendix Child Relative (Sponsors with Protection)\nSection ID: 1\nSection: Eligibility requirements for settlement to stay with a close relative Requirements for settlement to stay with a close relative\nTopic: eligibility\n\nSummary: This provision applies to dependent children seeking settlement to stay with a close relative. Applicants must meet the independence and care requirements detailed in Appendix Children, with specific thresholds for independence and care needs being essential.\n\n### Eligibility requirements for settlement to stay with a close relative Requirements for settlement to stay with a close relative\n\n1.   CRP 12.1. The applicant must meet the following requirements for a dependent child in Appendix Children: \n    1.   (a) independent life requirement; and\n    2.   (b) care requirement.",
      "needs_review": false
    },
    {
      "metadata": {
        "source": "Immigration Rules Appendix Child Relative (Sponsors with Protection)",
        "part": "Immigration Rules Appendix Child Relative (Sponsors with Protection)",
        "section_id": "CRP 13.1",
        "section_title": "English language requirement for settlement to stay with a close relative",
        "parent_section": "CRP 13",
        "hierarchy_level": 2,
        "topic": "english-language",
        "url": "https://www.gov.uk/guidance/immigration-rules/immigration-rules-appendix-child-relative-sponsors-with-protection",
        "scraped_at": "2025-12-06T17:26:20.538571"
      },
      "text": "### English language requirement for settlement to stay with a close relative\n\nCRP 13.1. Unless an exemption applies, the applicant must show English language ability on the Common European Framework of Reference for Languages in speaking and listening to at least level B1.\n\nCRP 13.2. The applicant must show they meet the English language requirement, or are exempt, as specified in Appendix English Language.",
      "summary": "This provision applies to applicants seeking settlement to stay with a close relative under protection. They must demonstrate English language ability at B1 level in speaking and listening unless exempted. Exemptions are detailed in Appendix English Language.",
      "augmented_text": "Document: Immigration Rules Appendix Child Relative (Sponsors with Protection)\nPart: Immigration Rules Appendix Child Relative (Sponsors with Protection)\nSection ID: CRP 13.1\nSection: English language requirement for settlement to stay with a close relative\nTopic: english-language\n\nSummary: This provision applies to applicants seeking settlement to stay with a close relative under protection. They must demonstrate English language ability at B1 level in speaking and listening unless exempted. Exemptions are detailed in Appendix English Language.\n\n### English language requirement for settlement to stay with a close relative\n\nCRP 13.1. Unless an exemption applies, the applicant must show English language ability on the Common European Framework of Reference for Languages in speaking and listening to at least level B1.\n\nCRP 13.2. The applicant must show they meet the English language requirement, or are exempt, as specified in Appendix English Language.",
      "needs_review": false
    },
    {
      "metadata": {
        "source": "Immigration Rules Appendix Child Relative (Sponsors with Protection)",
        "part": "Immigration Rules Appendix Child Relative (Sponsors with Protection)",
        "section_id": "CRP 14.1",
        "section_title": "Knowledge of life in the UK requirement for settlement to stay with a close relative",
        "parent_section": "CRP 14",
        "hierarchy_level": 2,
        "topic": "settlement",
        "url": "https://www.gov.uk/guidance/immigration-rules/immigration-rules-appendix-child-relative-sponsors-with-protection",
        "scraped_at": "2025-12-06T17:26:20.538597"
      },
      "text": "### Knowledge of life in the UK requirement for settlement to stay with a close relative\n\nCRP 14.1. Unless an exemption applies, the applicant must meet the Knowledge of Life in the UK requirement as set out in Appendix KOL UK.",
      "summary": "This provision applies to applicants seeking settlement to stay with a close relative. They must meet the Knowledge of Life in the UK requirement, unless an exemption applies, as specified in Appendix KOL UK.",
      "augmented_text": "Document: Immigration Rules Appendix Child Relative (Sponsors with Protection)\nPart: Immigration Rules Appendix Child Relative (Sponsors with Protection)\nSection ID: CRP 14.1\nSection: Knowledge of life in the UK requirement for settlement to stay with a close relative\nTopic: settlement\n\nSummary: This provision applies to applicants seeking settlement to stay with a close relative. They must meet the Knowledge of Life in the UK requirement, unless an exemption applies, as specified in Appendix KOL UK.\n\n### Knowledge of life in the UK requirement for settlement to stay with a close relative\n\nCRP 14.1. Unless an exemption applies, the applicant must meet the Knowledge of Life in the UK requirement as set out in Appendix KOL UK.",
      "needs_review": false
    },
    {
      "metadata": {
        "source": "Immigration Rules Appendix Child Relative (Sponsors with Protection)",
        "part": "Immigration Rules Appendix Child Relative (Sponsors with Protection)",
        "section_id": "CRP 15.1",
        "section_title": "Decision on an application for settlement to stay with a close relative",
        "parent_section": "CRP 15",
        "hierarchy_level": 2,
        "topic": "eligibility",
        "url": "https://www.gov.uk/guidance/immigration-rules/immigration-rules-appendix-child-relative-sponsors-with-protection",
        "scraped_at": "2025-12-06T17:26:20.538610"
      },
      "text": "### Decision on an application for settlement to stay with a close relative\n\nCRP 15.1. If the decision maker is satisfied that all the suitability and eligibility requirements for settlement to stay with their close relative in the UK are met, the application will be granted.\n\nCRP 15.2. If the decision maker is not satisfied that the applicant meets all the suitability and eligibility requirements, the application for settlement to stay with their close relative in the UK will be refused.\n\nPrint this page",
      "summary": "This provision applies to applicants seeking settlement to stay with a close relative in the UK. The key requirement is that all suitability and eligibility criteria must be satisfied for the application to be granted; failure to meet these results in refusal. There are no specified exceptions beyond meeting the standard criteria.",
      "augmented_text": "Document: Immigration Rules Appendix Child Relative (Sponsors with Protection)\nPart: Immigration Rules Appendix Child Relative (Sponsors with Protection)\nSection ID: CRP 15.1\nSection: Decision on an application for settlement to stay with a close relative\nTopic: eligibility\n\nSummary: This provision applies to applicants seeking settlement to stay with a close relative in the UK. The key requirement is that all suitability and eligibility criteria must be satisfied for the application to be granted; failure to meet these results in refusal. There are no specified exceptions beyond meeting the standard criteria.\n\n### Decision on an application for settlement to stay with a close relative\n\nCRP 15.1. If the decision maker is satisfied that all the suitability and eligibility requirements for settlement to stay with their close relative in the UK are met, the application will be granted.\n\nCRP 15.2. If the decision maker is not satisfied that the applicant meets all the suitability and eligibility requirements, the application for settlement to stay with their close relative in the UK will be refused.\n\nPrint this page",
      "needs_review": false
    }
  ]
}