{
  "url": "https://www.gov.uk/guidance/immigration-rules/immigration-rules-appendix-temporary-work-international-agreement",
  "part_name": "Immigration Rules Appendix Temporary Work - International Agreement",
  "scraped_at": "2025-12-06T17:29:15.351767",
  "chunk_count": 54,
  "chunks": [
    {
      "metadata": {
        "source": "Immigration Rules Appendix Temporary Work - International Agreement",
        "part": "Immigration Rules Appendix Temporary Work - International Agreement",
        "section_id": "IA 1.1",
        "section_title": "Validity Requirements for the International Agreement route",
        "parent_section": "IA 1",
        "hierarchy_level": 2,
        "topic": "leave-to-enter",
        "url": "https://www.gov.uk/guidance/immigration-rules/immigration-rules-appendix-temporary-work-international-agreement",
        "scraped_at": "2025-12-06T17:29:15.350580"
      },
      "text": "### Validity Requirements for the International Agreement route\n\nIA 1.1. A person applying for entry clearance or permission to stay on the International Agreement route must apply online on gov.uk on the specified form as follows:\n\n| Applicant | Specified form |\n| --- | --- |\n| EEA national with a chipped passport | Either: •Temporary Worker using the UK Immigration: ID Check app; or • the forms listed below for applicants outside or inside the UK (as relevant) |\n| Applicants outside the UK | Temporary Worker visa |\n| Applicants inside the UK | Temporary Worker |\n\n1.   IA 1.2. An application for entry clearance or permission to stay on the International Agreement route must meet all the following requirements: \n    1.   (a) any fee and Immigration Health Charge must have been paid; and\n    2.   (b) the applicant must have provided biometrics when required; and\n    3.   (c) the applicant must have provided a passport or other travel document which satisfactorily establishes their identity and nationality; and\n    4.   (d) the applicant must have a Certificate of Sponsorship that was issued to them no more than 3 months before the date of application.\n\nIA 1.3. The applicant must be aged 18 or over on the date of application.\n\nIA 1.4. If applying for permission to stay, the applicant must be in the UK on the date of application.\n\nIA 1.4A. If applying for permission to stay, the applicant must have, or have last had, permission on the International Agreement route.\n\nIA 1.5. An application which does not meet all the validity requirements for the International Agreement route may be rejected as invalid and not considered.",
      "summary": "Applicants for the International Agreement route—EEA nationals (with chipped passports) or other eligible individuals—must apply online using the specified form and meet requirements including fee payment, biometrics, valid travel documents, and a recent Certificate of Sponsorship. Applicants must be at least 18, and if applying to stay, must be within the UK and possess or have held relevant permission under this route.",
      "augmented_text": "Document: Immigration Rules Appendix Temporary Work - International Agreement\nPart: Immigration Rules Appendix Temporary Work - International Agreement\nSection ID: IA 1.1\nSection: Validity Requirements for the International Agreement route\nTopic: leave-to-enter\n\nSummary: Applicants for the International Agreement route—EEA nationals (with chipped passports) or other eligible individuals—must apply online using the specified form and meet requirements including fee payment, biometrics, valid travel documents, and a recent Certificate of Sponsorship. Applicants must be at least 18, and if applying to stay, must be within the UK and possess or have held relevant permission under this route.\n\n### Validity Requirements for the International Agreement route\n\nIA 1.1. A person applying for entry clearance or permission to stay on the International Agreement route must apply online on gov.uk on the specified form as follows:\n\n| Applicant | Specified form |\n| --- | --- |\n| EEA national with a chipped passport | Either: •Temporary Worker using the UK Immigration: ID Check app; or • the forms listed below for applicants outside or inside the UK (as relevant) |\n| Applicants outside the UK | Temporary Worker visa |\n| Applicants inside the UK | Temporary Worker |\n\n1.   IA 1.2. An application for entry clearance or permission to stay on the International Agreement route must meet all the following requirements: \n    1.   (a) any fee and Immigration Health Charge must have been paid; and\n    2.   (b) the applicant must have provided biometrics when required; and\n    3.   (c) the applicant must have provided a passport or other travel document which satisfactorily establishes their identity and nationality; and\n    4.   (d) the applicant must have a Certificate of Sponsorship that was issued to them no more than 3 months before the date of application.\n\nIA 1.3. The applicant must be aged 18 or over on the date of application.\n\nIA 1.4. If applying for permission to stay, the applicant must be in the UK on the date of application.\n\nIA 1.4A. If applying for permission to stay, the applicant must have, or have last had, permission on the International Agreement route.\n\nIA 1.5. An application which does not meet all the validity requirements for the International Agreement route may be rejected as invalid and not considered.",
      "needs_review": false
    },
    {
      "metadata": {
        "source": "Immigration Rules Appendix Temporary Work - International Agreement",
        "part": "Immigration Rules Appendix Temporary Work - International Agreement",
        "section_id": "IA 2.1",
        "section_title": "Suitability Requirements for the International Agreement route",
        "parent_section": "IA 2",
        "hierarchy_level": 2,
        "topic": "suitability",
        "url": "https://www.gov.uk/guidance/immigration-rules/immigration-rules-appendix-temporary-work-international-agreement",
        "scraped_at": "2025-12-06T17:29:15.350611"
      },
      "text": "### Suitability Requirements for the International Agreement route\n\nIA 2.1. The applicant must not fall for refusal under Part Suitability.\n\n1.   IA 2.2. If applying for permission to stay the applicant must not be: \n    1.   (a) in breach of immigration laws, except that where the Exceptions for overstayers section of Part Suitability applies, that period of overstaying will be disregarded; or\n    2.   (b) on immigration bail.",
      "summary": "Applicants applying under the International Agreement route must meet suitability criteria, ensuring they are not subject to refusal under Part Suitability, are not in breach of immigration laws (except where overstaying is disregarded under exceptions), and are not on immigration bail.",
      "augmented_text": "Document: Immigration Rules Appendix Temporary Work - International Agreement\nPart: Immigration Rules Appendix Temporary Work - International Agreement\nSection ID: IA 2.1\nSection: Suitability Requirements for the International Agreement route\nTopic: suitability\n\nSummary: Applicants applying under the International Agreement route must meet suitability criteria, ensuring they are not subject to refusal under Part Suitability, are not in breach of immigration laws (except where overstaying is disregarded under exceptions), and are not on immigration bail.\n\n### Suitability Requirements for the International Agreement route\n\nIA 2.1. The applicant must not fall for refusal under Part Suitability.\n\n1.   IA 2.2. If applying for permission to stay the applicant must not be: \n    1.   (a) in breach of immigration laws, except that where the Exceptions for overstayers section of Part Suitability applies, that period of overstaying will be disregarded; or\n    2.   (b) on immigration bail.",
      "needs_review": false
    },
    {
      "metadata": {
        "source": "Immigration Rules Appendix Temporary Work - International Agreement",
        "part": "Immigration Rules Appendix Temporary Work - International Agreement",
        "section_id": "Eligibility Requirements for the International Agreement route",
        "section_title": "Eligibility Requirements for the International Agreement route",
        "parent_section": null,
        "hierarchy_level": 2,
        "topic": "eligibility",
        "url": "https://www.gov.uk/guidance/immigration-rules/immigration-rules-appendix-temporary-work-international-agreement",
        "scraped_at": "2025-12-06T17:29:15.350622"
      },
      "text": "### Eligibility Requirements for the International Agreement route",
      "summary": "This provision applies to individuals seeking entry under the International Agreement route. Applicants must demonstrate they meet specific eligibility criteria, including fulfilling the terms of applicable international agreements, with certain conditions or exceptions outlined in the full rules.",
      "augmented_text": "Document: Immigration Rules Appendix Temporary Work - International Agreement\nPart: Immigration Rules Appendix Temporary Work - International Agreement\nSection ID: Eligibility Requirements for the International Agreement route\nSection: Eligibility Requirements for the International Agreement route\nTopic: eligibility\n\nSummary: This provision applies to individuals seeking entry under the International Agreement route. Applicants must demonstrate they meet specific eligibility criteria, including fulfilling the terms of applicable international agreements, with certain conditions or exceptions outlined in the full rules.\n\n### Eligibility Requirements for the International Agreement route",
      "needs_review": false
    },
    {
      "metadata": {
        "source": "Immigration Rules Appendix Temporary Work - International Agreement",
        "part": "Immigration Rules Appendix Temporary Work - International Agreement",
        "section_id": "IA 3.1",
        "section_title": "Entry requirement for the International Agreement route",
        "parent_section": "IA 3",
        "hierarchy_level": 2,
        "topic": "leave-to-enter",
        "url": "https://www.gov.uk/guidance/immigration-rules/immigration-rules-appendix-temporary-work-international-agreement",
        "scraped_at": "2025-12-06T17:29:15.350646"
      },
      "text": "### Entry requirement for the International Agreement route\n\nIA 3.1. A person seeking to come to the UK on the International Agreement route must apply for and obtain entry clearance on the International Agreement route before they arrive in the UK.\n\nIA 3.2. A person applying for entry clearance on the International Agreement route must, if Appendix Tuberculosis applies, provide a valid medical certificate confirming that they have undergone screening for active pulmonary tuberculosis and that this tuberculosis is not present in them.",
      "summary": "Applicants seeking entry via the International Agreement route must obtain prior entry clearance and, if applicable, provide a valid medical certificate confirming they have undergone tuberculosis screening and are clear of active pulmonary TB.",
      "augmented_text": "Document: Immigration Rules Appendix Temporary Work - International Agreement\nPart: Immigration Rules Appendix Temporary Work - International Agreement\nSection ID: IA 3.1\nSection: Entry requirement for the International Agreement route\nTopic: leave-to-enter\n\nSummary: Applicants seeking entry via the International Agreement route must obtain prior entry clearance and, if applicable, provide a valid medical certificate confirming they have undergone tuberculosis screening and are clear of active pulmonary TB.\n\n### Entry requirement for the International Agreement route\n\nIA 3.1. A person seeking to come to the UK on the International Agreement route must apply for and obtain entry clearance on the International Agreement route before they arrive in the UK.\n\nIA 3.2. A person applying for entry clearance on the International Agreement route must, if Appendix Tuberculosis applies, provide a valid medical certificate confirming that they have undergone screening for active pulmonary tuberculosis and that this tuberculosis is not present in them.",
      "needs_review": false
    },
    {
      "metadata": {
        "source": "Immigration Rules Appendix Temporary Work - International Agreement",
        "part": "Immigration Rules Appendix Temporary Work - International Agreement",
        "section_id": "IA 4.1",
        "section_title": "Sponsorship requirement for the International Agreement route",
        "parent_section": null,
        "hierarchy_level": 1,
        "topic": "sponsorship",
        "url": "https://www.gov.uk/guidance/immigration-rules/immigration-rules-appendix-temporary-work-international-agreement",
        "scraped_at": "2025-12-06T17:29:15.350685"
      },
      "text": "### Sponsorship requirement for the International Agreement route\n\n1.   IA 4.1. The applicant must have a valid Certificate of Sponsorship for the job they are planning to do; which to be valid must: \n    1.   (a) confirm the applicant’s name, that they are being sponsored on the International Agreement route, details of the job and salary the sponsor is offering them, and that these arrangements comply with the National Minimum Wage; and\n    2.   (b)include a start date, stated by the sponsor, which is no more than three months after the date of application; and\n    3.   (c) not have been used in a previous application which was either granted or refused (but can have been used in a previous application which was rejected as invalid, made void or withdrawn); and\n    4.   (d) not have been withdrawn by the sponsor or cancelled by the Home Office; and\n    5.   (e) include confirmation that the role meets the relevant requirements at IA 6.1, depending on the role; and\n    6.   (f) confirm whether the Academic Technology Approval Scheme (ATAS) requirement in Appendix ATAS applies.\n\nIA 4.2. The sponsor must be authorised by the Home Office to sponsor the job in question under the International Agreement route.\n\nIA 4.3. The sponsor must be listed as A-rated on the Home Office’s register of licensed sponsors, unless the applicant was last granted permission on the International Agreement route and is applying to continue working for the same sponsor as in their last permission.\n\nIA 4.4. The decision maker must not have reasonable grounds to believe the job the applicant is being sponsored to do does not comply with the National Minimum Wage Regulations or the Working Time Regulations.",
      "summary": "Applicants on the International Agreement route must have a valid Certificate of Sponsorship from a Home Office-licensed, A-rated sponsor, confirming job details, salary (meeting minimum wage), and compliance with relevant conditions. The sponsorship must not have been previously used in a granted or refused application, and the certificate should include a recent start date (within three months).",
      "augmented_text": "Document: Immigration Rules Appendix Temporary Work - International Agreement\nPart: Immigration Rules Appendix Temporary Work - International Agreement\nSection ID: IA 4.1\nSection: Sponsorship requirement for the International Agreement route\nTopic: sponsorship\n\nSummary: Applicants on the International Agreement route must have a valid Certificate of Sponsorship from a Home Office-licensed, A-rated sponsor, confirming job details, salary (meeting minimum wage), and compliance with relevant conditions. The sponsorship must not have been previously used in a granted or refused application, and the certificate should include a recent start date (within three months).\n\n### Sponsorship requirement for the International Agreement route\n\n1.   IA 4.1. The applicant must have a valid Certificate of Sponsorship for the job they are planning to do; which to be valid must: \n    1.   (a) confirm the applicant’s name, that they are being sponsored on the International Agreement route, details of the job and salary the sponsor is offering them, and that these arrangements comply with the National Minimum Wage; and\n    2.   (b)include a start date, stated by the sponsor, which is no more than three months after the date of application; and\n    3.   (c) not have been used in a previous application which was either granted or refused (but can have been used in a previous application which was rejected as invalid, made void or withdrawn); and\n    4.   (d) not have been withdrawn by the sponsor or cancelled by the Home Office; and\n    5.   (e) include confirmation that the role meets the relevant requirements at IA 6.1, depending on the role; and\n    6.   (f) confirm whether the Academic Technology Approval Scheme (ATAS) requirement in Appendix ATAS applies.\n\nIA 4.2. The sponsor must be authorised by the Home Office to sponsor the job in question under the International Agreement route.\n\nIA 4.3. The sponsor must be listed as A-rated on the Home Office’s register of licensed sponsors, unless the applicant was last granted permission on the International Agreement route and is applying to continue working for the same sponsor as in their last permission.\n\nIA 4.4. The decision maker must not have reasonable grounds to believe the job the applicant is being sponsored to do does not comply with the National Minimum Wage Regulations or the Working Time Regulations.",
      "needs_review": false
    },
    {
      "metadata": {
        "source": "Immigration Rules Appendix Temporary Work - International Agreement",
        "part": "Immigration Rules Appendix Temporary Work - International Agreement",
        "section_id": "IA 5.1",
        "section_title": "Genuineness requirement for the International Agreement route",
        "parent_section": null,
        "hierarchy_level": 1,
        "topic": "eligibility",
        "url": "https://www.gov.uk/guidance/immigration-rules/immigration-rules-appendix-temporary-work-international-agreement",
        "scraped_at": "2025-12-06T17:29:15.350716"
      },
      "text": "### Genuineness requirement for the International Agreement route\n\n1.   IA 5.1. The applicant must: \n    1.   (a) genuinely intend to, and be able to, undertake the role for which they are sponsored; and\n    2.   (b) not intend to undertake employment other than in the role for which they are being sponsored, or as otherwise permitted by paragraph IA14.7.",
      "summary": "Applicants applying under the International Agreement route must genuinely intend and be capable of performing the sponsored role and not plan to undertake unpermitted employment beyond that role. No exceptions are specified, emphasizing the importance of role-specific commitments.",
      "augmented_text": "Document: Immigration Rules Appendix Temporary Work - International Agreement\nPart: Immigration Rules Appendix Temporary Work - International Agreement\nSection ID: IA 5.1\nSection: Genuineness requirement for the International Agreement route\nTopic: eligibility\n\nSummary: Applicants applying under the International Agreement route must genuinely intend and be capable of performing the sponsored role and not plan to undertake unpermitted employment beyond that role. No exceptions are specified, emphasizing the importance of role-specific commitments.\n\n### Genuineness requirement for the International Agreement route\n\n1.   IA 5.1. The applicant must: \n    1.   (a) genuinely intend to, and be able to, undertake the role for which they are sponsored; and\n    2.   (b) not intend to undertake employment other than in the role for which they are being sponsored, or as otherwise permitted by paragraph IA14.7.",
      "needs_review": false
    },
    {
      "metadata": {
        "source": "Immigration Rules Appendix Temporary Work - International Agreement",
        "part": "Immigration Rules Appendix Temporary Work - International Agreement",
        "section_id": "IA 5.1A",
        "section_title": "ATAS requirement for the International Agreement route",
        "parent_section": "IA 5",
        "hierarchy_level": 2,
        "topic": "eligibility",
        "url": "https://www.gov.uk/guidance/immigration-rules/immigration-rules-appendix-temporary-work-international-agreement",
        "scraped_at": "2025-12-06T17:29:15.350742"
      },
      "text": "### ATAS requirement for the International Agreement route\n\nIA 5.1A. If the ATAS requirement in Appendix ATAS applies, the applicant must provide a valid ATAS certificate.",
      "summary": "Applicants under the International Agreement route must provide a valid ATAS certificate if the ATAS requirement applies, ensuring they meet security clearance standards. This requirement is mandatory unless explicitly exempted.",
      "augmented_text": "Document: Immigration Rules Appendix Temporary Work - International Agreement\nPart: Immigration Rules Appendix Temporary Work - International Agreement\nSection ID: IA 5.1A\nSection: ATAS requirement for the International Agreement route\nTopic: eligibility\n\nSummary: Applicants under the International Agreement route must provide a valid ATAS certificate if the ATAS requirement applies, ensuring they meet security clearance standards. This requirement is mandatory unless explicitly exempted.\n\n### ATAS requirement for the International Agreement route\n\nIA 5.1A. If the ATAS requirement in Appendix ATAS applies, the applicant must provide a valid ATAS certificate.",
      "needs_review": false
    },
    {
      "metadata": {
        "source": "Immigration Rules Appendix Temporary Work - International Agreement",
        "part": "Immigration Rules Appendix Temporary Work - International Agreement",
        "section_id": "IA 6.1",
        "section_title": "International Agreement requirement",
        "parent_section": null,
        "hierarchy_level": 1,
        "topic": "eligibility",
        "url": "https://www.gov.uk/guidance/immigration-rules/immigration-rules-appendix-temporary-work-international-agreement",
        "scraped_at": "2025-12-06T17:29:15.350770"
      },
      "text": "### International Agreement requirement\n\n1.   IA 6.1. The role the applicant is applying to do must be as one of the following (and the applicant must also meet the specific requirements for that work): \n    1.   (a) a private servant in a diplomatic household; or\n    2.   (b) an employee of an overseas government or other international organisation established under an international treaty signed by UK.\n    3.   (c) DELETED.",
      "summary": "This provision applies to applicants seeking roles under international agreements. They must be employed as a private servant in a diplomatic household or as an employee of an overseas government or international organization under treaty. The applicant must meet specific work requirements for these categories.",
      "augmented_text": "Document: Immigration Rules Appendix Temporary Work - International Agreement\nPart: Immigration Rules Appendix Temporary Work - International Agreement\nSection ID: IA 6.1\nSection: International Agreement requirement\nTopic: eligibility\n\nSummary: This provision applies to applicants seeking roles under international agreements. They must be employed as a private servant in a diplomatic household or as an employee of an overseas government or international organization under treaty. The applicant must meet specific work requirements for these categories.\n\n### International Agreement requirement\n\n1.   IA 6.1. The role the applicant is applying to do must be as one of the following (and the applicant must also meet the specific requirements for that work): \n    1.   (a) a private servant in a diplomatic household; or\n    2.   (b) an employee of an overseas government or other international organisation established under an international treaty signed by UK.\n    3.   (c) DELETED.",
      "needs_review": false
    },
    {
      "metadata": {
        "source": "Immigration Rules Appendix Temporary Work - International Agreement",
        "part": "Immigration Rules Appendix Temporary Work - International Agreement",
        "section_id": "IA 7.1",
        "section_title": "Private servant in diplomatic household requirements",
        "parent_section": null,
        "hierarchy_level": 1,
        "topic": "eligibility",
        "url": "https://www.gov.uk/guidance/immigration-rules/immigration-rules-appendix-temporary-work-international-agreement",
        "scraped_at": "2025-12-06T17:29:15.350800"
      },
      "text": "### Private servant in diplomatic household requirements\n\n1.   IA 7.1. The applicant must be employed as a private servant by, and in the household of, either: \n    1.   (a) a named member of staff of a diplomatic or consular mission who has diplomatic privileges and immunity as defined by the Vienna Convention on Diplomatic Relations; or\n    2.   (b) a named official employed by an international organisation recognised by the UK government with diplomatic privileges or immunities under UK or international law.\n\n2.   IA 7.2. DELETED.\n\nIA 7.3. The applicant must not intend to undertake any other role for the sponsor other than as a private servant in the specified household.\n\nIA 7.4. The applicant must intend to work full time in the role they are being sponsored for.\n\nIA 7.5. The applicant must not be a relative of the employer, or employer’s spouse, either by blood or by marriage (including but not limited to, the spouse or unmarried partner, child, parent, grandparent or sibling of either the employer or the employer’s spouse).\n\nIA 7.6. DELETED\n\nIA 7.7. The applicant must be paid at least the level of the National Minimum Wage throughout their stay.\n\nIA 7.8. The applicant must provide the evidence of employment terms and conditions as set out in Appendix Domestic Worker Statement.\n\nIA 7.9. The applicant must provide a signed statement from the sponsor confirming that the role will not constitute work done in relation to the employer’s family household within the meaning of regulation 57 of the National Minimum Wage Regulations 2015.\n\nIA 7.10. Where the application is for permission to stay, they must provide evidence of payment of salary for no less than 3 months prior to the date of application. Evidence must be submitted in accordance with Appendix Finance.",
      "summary": "This provision applies to applicants employed as private servants in diplomatic or international organization households. They must work full-time, not undertake other roles, be paid at least the minimum wage, and have no familial relation to the employer. Exceptions include employment solely for diplomatic or international organization staff with immunity, and evidence of employment terms is required.",
      "augmented_text": "Document: Immigration Rules Appendix Temporary Work - International Agreement\nPart: Immigration Rules Appendix Temporary Work - International Agreement\nSection ID: IA 7.1\nSection: Private servant in diplomatic household requirements\nTopic: eligibility\n\nSummary: This provision applies to applicants employed as private servants in diplomatic or international organization households. They must work full-time, not undertake other roles, be paid at least the minimum wage, and have no familial relation to the employer. Exceptions include employment solely for diplomatic or international organization staff with immunity, and evidence of employment terms is required.\n\n### Private servant in diplomatic household requirements\n\n1.   IA 7.1. The applicant must be employed as a private servant by, and in the household of, either: \n    1.   (a) a named member of staff of a diplomatic or consular mission who has diplomatic privileges and immunity as defined by the Vienna Convention on Diplomatic Relations; or\n    2.   (b) a named official employed by an international organisation recognised by the UK government with diplomatic privileges or immunities under UK or international law.\n\n2.   IA 7.2. DELETED.\n\nIA 7.3. The applicant must not intend to undertake any other role for the sponsor other than as a private servant in the specified household.\n\nIA 7.4. The applicant must intend to work full time in the role they are being sponsored for.\n\nIA 7.5. The applicant must not be a relative of the employer, or employer’s spouse, either by blood or by marriage (including but not limited to, the spouse or unmarried partner, child, parent, grandparent or sibling of either the employer or the employer’s spouse).\n\nIA 7.6. DELETED\n\nIA 7.7. The applicant must be paid at least the level of the National Minimum Wage throughout their stay.\n\nIA 7.8. The applicant must provide the evidence of employment terms and conditions as set out in Appendix Domestic Worker Statement.\n\nIA 7.9. The applicant must provide a signed statement from the sponsor confirming that the role will not constitute work done in relation to the employer’s family household within the meaning of regulation 57 of the National Minimum Wage Regulations 2015.\n\nIA 7.10. Where the application is for permission to stay, they must provide evidence of payment of salary for no less than 3 months prior to the date of application. Evidence must be submitted in accordance with Appendix Finance.",
      "needs_review": false
    },
    {
      "metadata": {
        "source": "Immigration Rules Appendix Temporary Work - International Agreement",
        "part": "Immigration Rules Appendix Temporary Work - International Agreement",
        "section_id": "IA 7.11",
        "section_title": "English language requirement for a private servant in a diplomatic household",
        "parent_section": "IA 7",
        "hierarchy_level": 2,
        "topic": "english-language",
        "url": "https://www.gov.uk/guidance/immigration-rules/immigration-rules-appendix-temporary-work-international-agreement",
        "scraped_at": "2025-12-06T17:29:15.350817"
      },
      "text": "### English language requirement for a private servant in a diplomatic household\n\nIA 7.11. Where the application is for entry clearance, the applicant must show English language ability on the Common European Framework of Reference for Languages in all 4 components (reading, writing, speaking and listening) of at least B1 (intermediate).\n\nIA 7.12. The applicant must show they meet the English language requirement as specified in Appendix English Language.",
      "summary": "This provision applies to private servants in diplomatic households applying for entry clearance. They must demonstrate at least B1 level in all four components of English (reading, writing, speaking, listening) per the Common European Framework. The requirement aligns with the standards in Appendix English Language.",
      "augmented_text": "Document: Immigration Rules Appendix Temporary Work - International Agreement\nPart: Immigration Rules Appendix Temporary Work - International Agreement\nSection ID: IA 7.11\nSection: English language requirement for a private servant in a diplomatic household\nTopic: english-language\n\nSummary: This provision applies to private servants in diplomatic households applying for entry clearance. They must demonstrate at least B1 level in all four components of English (reading, writing, speaking, listening) per the Common European Framework. The requirement aligns with the standards in Appendix English Language.\n\n### English language requirement for a private servant in a diplomatic household\n\nIA 7.11. Where the application is for entry clearance, the applicant must show English language ability on the Common European Framework of Reference for Languages in all 4 components (reading, writing, speaking and listening) of at least B1 (intermediate).\n\nIA 7.12. The applicant must show they meet the English language requirement as specified in Appendix English Language.",
      "needs_review": false
    },
    {
      "metadata": {
        "source": "Immigration Rules Appendix Temporary Work - International Agreement",
        "part": "Immigration Rules Appendix Temporary Work - International Agreement",
        "section_id": "IA 8.1",
        "section_title": "Employee of an overseas government or other international organisation requirement",
        "parent_section": "IA 8",
        "hierarchy_level": 2,
        "topic": "eligibility",
        "url": "https://www.gov.uk/guidance/immigration-rules/immigration-rules-appendix-temporary-work-international-agreement",
        "scraped_at": "2025-12-06T17:29:15.350871"
      },
      "text": "### Employee of an overseas government or other international organisation requirement\n\nIA 8.1. The applicant must be under a contract of employment with the overseas government or international organisation.\n\nIA 8.1A. Where the applicant is, or will be, working on a contract basis (being supplied as labour from one organisation to another), the decision maker must be satisfied that the applicant will not be filling a permanent position, including on a temporary basis.\n\nIA 8.2. The applicant must not intend to take any other form of role for the sponsor other than that for which the Certificate of Sponsorship was assigned.\n\nIA 8.3. The applicant must not be working as a private servant in a diplomatic household or as a domestic worker in a private household.",
      "summary": "This provision applies to employees of overseas governments or international organizations. Applicants must be under a valid contract, not fill permanent roles (including temporary), and only work in roles specified in their Certificate of Sponsorship. They must not work as private servants or domestic workers in private households.",
      "augmented_text": "Document: Immigration Rules Appendix Temporary Work - International Agreement\nPart: Immigration Rules Appendix Temporary Work - International Agreement\nSection ID: IA 8.1\nSection: Employee of an overseas government or other international organisation requirement\nTopic: eligibility\n\nSummary: This provision applies to employees of overseas governments or international organizations. Applicants must be under a valid contract, not fill permanent roles (including temporary), and only work in roles specified in their Certificate of Sponsorship. They must not work as private servants or domestic workers in private households.\n\n### Employee of an overseas government or other international organisation requirement\n\nIA 8.1. The applicant must be under a contract of employment with the overseas government or international organisation.\n\nIA 8.1A. Where the applicant is, or will be, working on a contract basis (being supplied as labour from one organisation to another), the decision maker must be satisfied that the applicant will not be filling a permanent position, including on a temporary basis.\n\nIA 8.2. The applicant must not intend to take any other form of role for the sponsor other than that for which the Certificate of Sponsorship was assigned.\n\nIA 8.3. The applicant must not be working as a private servant in a diplomatic household or as a domestic worker in a private household.",
      "needs_review": false
    },
    {
      "metadata": {
        "source": "Immigration Rules Appendix Temporary Work - International Agreement",
        "part": "Immigration Rules Appendix Temporary Work - International Agreement",
        "section_id": "IA 9.1",
        "section_title": "Contractual Service Supplier requirements",
        "parent_section": "IA 9",
        "hierarchy_level": 2,
        "topic": "eligibility",
        "url": "https://www.gov.uk/guidance/immigration-rules/immigration-rules-appendix-temporary-work-international-agreement",
        "scraped_at": "2025-12-06T17:29:15.350916"
      },
      "text": "### Contractual Service Supplier requirement\n\nIA 9.1. DELETED.\n\nIA 9.2. DELETED.\n\nIA 9.3. DELETED.\n\nIA 9.4. DELETED.\n\nIA 9.5. DELETED.\n\nIA 9.6. DELETED.\n\nIA 9.7. DELETED.\n\nIA 9.8. DELETED.\n\nIA 9.9. DELETED\n\nIA 9.10. DELETED.",
      "summary": "This provision applies to contractual service suppliers under international agreements, requiring them to meet specific eligibility criteria. The rules emphasize compliance with contractual obligations and applicable conditions; however, detailed requirements are not specified in this excerpt. Critical thresholds or exceptions are not provided here.",
      "augmented_text": "Document: Immigration Rules Appendix Temporary Work - International Agreement\nPart: Immigration Rules Appendix Temporary Work - International Agreement\nSection ID: IA 9.1\nSection: Contractual Service Supplier requirements\nTopic: eligibility\n\nSummary: This provision applies to contractual service suppliers under international agreements, requiring them to meet specific eligibility criteria. The rules emphasize compliance with contractual obligations and applicable conditions; however, detailed requirements are not specified in this excerpt. Critical thresholds or exceptions are not provided here.\n\n### Contractual Service Supplier requirement\n\nIA 9.1. DELETED.\n\nIA 9.2. DELETED.\n\nIA 9.3. DELETED.\n\nIA 9.4. DELETED.\n\nIA 9.5. DELETED.\n\nIA 9.6. DELETED.\n\nIA 9.7. DELETED.\n\nIA 9.8. DELETED.\n\nIA 9.9. DELETED\n\nIA 9.10. DELETED.",
      "needs_review": false
    },
    {
      "metadata": {
        "source": "Immigration Rules Appendix Temporary Work - International Agreement",
        "part": "Immigration Rules Appendix Temporary Work - International Agreement",
        "section_id": "IA 10.1",
        "section_title": "Independent Professional requirement",
        "parent_section": "IA 10",
        "hierarchy_level": 2,
        "topic": "eligibility",
        "url": "https://www.gov.uk/guidance/immigration-rules/immigration-rules-appendix-temporary-work-international-agreement",
        "scraped_at": "2025-12-06T17:29:15.350947"
      },
      "text": "### Independent Professional requirement\n\nIA 10.1. DELETED.\n\nIA 10.2. DELETED.\n\nIA 10.3. DELETED.\n\nIA 10.4. DELETED.\n\nIA 10.5. DELETED.\n\nIA 10.6. DELETED.\n\nIA 10.7. DELETED.\n\nIA 10.8 DELETED.",
      "summary": "This provision applies to applicants seeking entry under the International Agreement route. It previously outlined an independent professional requirement, but the specific details have been deleted, indicating that the requirement is currently not in force or specified, with no remaining conditions or exceptions provided.",
      "augmented_text": "Document: Immigration Rules Appendix Temporary Work - International Agreement\nPart: Immigration Rules Appendix Temporary Work - International Agreement\nSection ID: IA 10.1\nSection: Independent Professional requirement\nTopic: eligibility\n\nSummary: This provision applies to applicants seeking entry under the International Agreement route. It previously outlined an independent professional requirement, but the specific details have been deleted, indicating that the requirement is currently not in force or specified, with no remaining conditions or exceptions provided.\n\n### Independent Professional requirement\n\nIA 10.1. DELETED.\n\nIA 10.2. DELETED.\n\nIA 10.3. DELETED.\n\nIA 10.4. DELETED.\n\nIA 10.5. DELETED.\n\nIA 10.6. DELETED.\n\nIA 10.7. DELETED.\n\nIA 10.8 DELETED.",
      "needs_review": false
    },
    {
      "metadata": {
        "source": "Immigration Rules Appendix Temporary Work - International Agreement",
        "part": "Immigration Rules Appendix Temporary Work - International Agreement",
        "section_id": "IA 11.1",
        "section_title": "Financial Requirement for the International Agreement route",
        "parent_section": "IA 11",
        "hierarchy_level": 2,
        "topic": "financial",
        "url": "https://www.gov.uk/guidance/immigration-rules/immigration-rules-appendix-temporary-work-international-agreement",
        "scraped_at": "2025-12-06T17:29:15.350966"
      },
      "text": "### Financial Requirement for the International Agreement route\n\nIA 11.1. If the applicant is applying for permission to stay and has been in the UK with permission for 12 months or longer on the date of application, they will meet the financial requirement and do not need to show funds.\n\n1.   IA 11.2. If the applicant is applying for entry clearance, or is applying for permission to stay and has been in the UK for less than 12 months on the date of application, either: \n    1.   (a) the applicant must have funds of at least £1,270; or\n    2.   (b) the applicant’s A rated sponsor must confirm on the Certificate of Sponsorship that they will, if it is necessary, maintain and accommodate the applicant up to the end of the first month of their employment for an amount of at least £1,270.\n\nIA 11.3. If IA 11.2. applies, the applicant must show that they have held the required level of funds for a 28-day period and as specified in Appendix Finance.",
      "summary": "Applicants applying for permission to stay in the UK must have been present for 12 months or more to meet the financial requirement without showing funds; those with less than 12 months’ residence need at least £1,270 in funds or sponsorship confirmation, maintained for 28 days.",
      "augmented_text": "Document: Immigration Rules Appendix Temporary Work - International Agreement\nPart: Immigration Rules Appendix Temporary Work - International Agreement\nSection ID: IA 11.1\nSection: Financial Requirement for the International Agreement route\nTopic: financial\n\nSummary: Applicants applying for permission to stay in the UK must have been present for 12 months or more to meet the financial requirement without showing funds; those with less than 12 months’ residence need at least £1,270 in funds or sponsorship confirmation, maintained for 28 days.\n\n### Financial Requirement for the International Agreement route\n\nIA 11.1. If the applicant is applying for permission to stay and has been in the UK with permission for 12 months or longer on the date of application, they will meet the financial requirement and do not need to show funds.\n\n1.   IA 11.2. If the applicant is applying for entry clearance, or is applying for permission to stay and has been in the UK for less than 12 months on the date of application, either: \n    1.   (a) the applicant must have funds of at least £1,270; or\n    2.   (b) the applicant’s A rated sponsor must confirm on the Certificate of Sponsorship that they will, if it is necessary, maintain and accommodate the applicant up to the end of the first month of their employment for an amount of at least £1,270.\n\nIA 11.3. If IA 11.2. applies, the applicant must show that they have held the required level of funds for a 28-day period and as specified in Appendix Finance.",
      "needs_review": false
    },
    {
      "metadata": {
        "source": "Immigration Rules Appendix Temporary Work - International Agreement",
        "part": "Immigration Rules Appendix Temporary Work - International Agreement",
        "section_id": "IA 13.1",
        "section_title": "Decision on an application on the International Agreement route",
        "parent_section": "IA 13",
        "hierarchy_level": 2,
        "topic": "eligibility",
        "url": "https://www.gov.uk/guidance/immigration-rules/immigration-rules-appendix-temporary-work-international-agreement",
        "scraped_at": "2025-12-06T17:29:15.350979"
      },
      "text": "### Decision on an application on the International Agreement route\n\nIA 13.1. If the decision maker is satisfied that all the suitability and eligibility requirements for the International Agreement route are met, the application will be granted, otherwise the application will be refused.\n\nIA 13.2. If the application is refused, the person can apply for an Administrative Review under Appendix AR: Administrative Review.",
      "summary": "Applications under the International Agreement route are granted if all suitability and eligibility requirements are met; otherwise, they are refused. Applicants who are refused may request an Administrative Review under Appendix AR.",
      "augmented_text": "Document: Immigration Rules Appendix Temporary Work - International Agreement\nPart: Immigration Rules Appendix Temporary Work - International Agreement\nSection ID: IA 13.1\nSection: Decision on an application on the International Agreement route\nTopic: eligibility\n\nSummary: Applications under the International Agreement route are granted if all suitability and eligibility requirements are met; otherwise, they are refused. Applicants who are refused may request an Administrative Review under Appendix AR.\n\n### Decision on an application on the International Agreement route\n\nIA 13.1. If the decision maker is satisfied that all the suitability and eligibility requirements for the International Agreement route are met, the application will be granted, otherwise the application will be refused.\n\nIA 13.2. If the application is refused, the person can apply for an Administrative Review under Appendix AR: Administrative Review.",
      "needs_review": false
    },
    {
      "metadata": {
        "source": "Immigration Rules Appendix Temporary Work - International Agreement",
        "part": "Immigration Rules Appendix Temporary Work - International Agreement",
        "section_id": "IA 14.1",
        "section_title": "Period of grant for the International Agreement route",
        "parent_section": "IA 14",
        "hierarchy_level": 2,
        "topic": "leave-to-enter",
        "url": "https://www.gov.uk/guidance/immigration-rules/immigration-rules-appendix-temporary-work-international-agreement",
        "scraped_at": "2025-12-06T17:29:15.351004"
      },
      "text": "### Period of grant for the International Agreement route\n\nIA 14.1. DELETED.\n\nIA 14.2. DELETED.\n\n1.   IA 14.3. If the application is for entry clearance, the applicant will be granted whichever is the shorter of: \n    1.   (a) the period of the role on the Certificate of Sponsorship plus 14 days before and 14 days after that period; or\n    2.   (b) 24 months.\n\n1.   IA 14.4. If the applicant is an employee of an overseas government or other international organisation and their application is for permission to stay, the applicant will be granted whichever is the shorter of: \n    1.   (a) the period of the role on the Certificate of Sponsorship plus 14 days after that period; or\n    2.   (b) the difference between 24 months and the period they have already been granted permission on the International Agreement route.\n\n1.   IA 14.5. If the applicant is a private servant in a diplomatic household and their application is for permission to stay, the applicant will be granted whichever is the shorter of: \n    1.   (a) the period of the role on the Certificate of Sponsorship plus 14 days after that period; or\n    2.   (b) 24 months; or\n    3.   (c) the difference between five years and the period they have already been granted permission on the International Agreement route.\n\nIA 14.6. DELETED.",
      "summary": "This provision applies to applicants under the International Agreement route. It sets maximum grant periods: up to 24 months for entry clearance, or calculated durations based on sponsorship and existing permissions, with specific exceptions for employees of international organizations and diplomatic private servants. Critical conditions include role durations on the Certificate of Sponsorship and previous permissions, with time limits varying by applicant category.",
      "augmented_text": "Document: Immigration Rules Appendix Temporary Work - International Agreement\nPart: Immigration Rules Appendix Temporary Work - International Agreement\nSection ID: IA 14.1\nSection: Period of grant for the International Agreement route\nTopic: leave-to-enter\n\nSummary: This provision applies to applicants under the International Agreement route. It sets maximum grant periods: up to 24 months for entry clearance, or calculated durations based on sponsorship and existing permissions, with specific exceptions for employees of international organizations and diplomatic private servants. Critical conditions include role durations on the Certificate of Sponsorship and previous permissions, with time limits varying by applicant category.\n\n### Period of grant for the International Agreement route\n\nIA 14.1. DELETED.\n\nIA 14.2. DELETED.\n\n1.   IA 14.3. If the application is for entry clearance, the applicant will be granted whichever is the shorter of: \n    1.   (a) the period of the role on the Certificate of Sponsorship plus 14 days before and 14 days after that period; or\n    2.   (b) 24 months.\n\n1.   IA 14.4. If the applicant is an employee of an overseas government or other international organisation and their application is for permission to stay, the applicant will be granted whichever is the shorter of: \n    1.   (a) the period of the role on the Certificate of Sponsorship plus 14 days after that period; or\n    2.   (b) the difference between 24 months and the period they have already been granted permission on the International Agreement route.\n\n1.   IA 14.5. If the applicant is a private servant in a diplomatic household and their application is for permission to stay, the applicant will be granted whichever is the shorter of: \n    1.   (a) the period of the role on the Certificate of Sponsorship plus 14 days after that period; or\n    2.   (b) 24 months; or\n    3.   (c) the difference between five years and the period they have already been granted permission on the International Agreement route.\n\nIA 14.6. DELETED.",
      "needs_review": false
    },
    {
      "metadata": {
        "source": "Immigration Rules Appendix Temporary Work - International Agreement",
        "part": "Immigration Rules Appendix Temporary Work - International Agreement",
        "section_id": "1",
        "section_title": "Conditions of grant on the International Agreement route",
        "parent_section": null,
        "hierarchy_level": 1,
        "topic": "financial",
        "url": "https://www.gov.uk/guidance/immigration-rules/immigration-rules-appendix-temporary-work-international-agreement",
        "scraped_at": "2025-12-06T17:29:15.351021"
      },
      "text": "### Conditions of grant on the International Agreement route\n\n1.   IA 14.7. The grant will be subject to all the following conditions: \n    1.   (a) no access to public funds; and\n    2.   (b) the only work permitted is \n        1.   (i) the job the applicant is being sponsored for; and\n        2.   (ii) supplementary employment only for a person being sponsored for a job as an employee of overseas governments or international organisations (but not as a private servant in a diplomatic household) and only provided the job in (i) is also being done.\n\n    3.   (c) study is permitted, subject to the ATAS condition in Appendix ATAS.\n    4.   (d) DELETED.\n\nIA 14.8. If the applicant is being sponsored as a private servant in a diplomatic household, IA 14.7.(b) does not prevent them from taking employment as a domestic worker in a different household from the one specified in the Certificate of Sponsorship.",
      "summary": "Applicants under the International Agreement route must not access public funds, work only in their sponsored job or permitted supplementary roles (e.g., overseas government workers), and may study with ATAS clearance; private servants can also work as domestic staff elsewhere.",
      "augmented_text": "Document: Immigration Rules Appendix Temporary Work - International Agreement\nPart: Immigration Rules Appendix Temporary Work - International Agreement\nSection ID: 1\nSection: Conditions of grant on the International Agreement route\nTopic: financial\n\nSummary: Applicants under the International Agreement route must not access public funds, work only in their sponsored job or permitted supplementary roles (e.g., overseas government workers), and may study with ATAS clearance; private servants can also work as domestic staff elsewhere.\n\n### Conditions of grant on the International Agreement route\n\n1.   IA 14.7. The grant will be subject to all the following conditions: \n    1.   (a) no access to public funds; and\n    2.   (b) the only work permitted is \n        1.   (i) the job the applicant is being sponsored for; and\n        2.   (ii) supplementary employment only for a person being sponsored for a job as an employee of overseas governments or international organisations (but not as a private servant in a diplomatic household) and only provided the job in (i) is also being done.\n\n    3.   (c) study is permitted, subject to the ATAS condition in Appendix ATAS.\n    4.   (d) DELETED.\n\nIA 14.8. If the applicant is being sponsored as a private servant in a diplomatic household, IA 14.7.(b) does not prevent them from taking employment as a domestic worker in a different household from the one specified in the Certificate of Sponsorship.",
      "needs_review": false
    },
    {
      "metadata": {
        "source": "Immigration Rules Appendix Temporary Work - International Agreement",
        "part": "Immigration Rules Appendix Temporary Work - International Agreement",
        "section_id": "Settlement by a Private Servant in a diplomatic household",
        "section_title": "Settlement by a Private Servant in a diplomatic household",
        "parent_section": null,
        "hierarchy_level": 2,
        "topic": "settlement",
        "url": "https://www.gov.uk/guidance/immigration-rules/immigration-rules-appendix-temporary-work-international-agreement",
        "scraped_at": "2025-12-06T17:29:15.351038"
      },
      "text": "### Settlement by a Private Servant in a diplomatic household",
      "summary": "This provision applies to private servants working within diplomatic households. It requires them to meet specific criteria for settlement, including verified employment and compliance with immigration conditions. Exceptions and thresholds are detailed in the full legal context.",
      "augmented_text": "Document: Immigration Rules Appendix Temporary Work - International Agreement\nPart: Immigration Rules Appendix Temporary Work - International Agreement\nSection ID: Settlement by a Private Servant in a diplomatic household\nSection: Settlement by a Private Servant in a diplomatic household\nTopic: settlement\n\nSummary: This provision applies to private servants working within diplomatic households. It requires them to meet specific criteria for settlement, including verified employment and compliance with immigration conditions. Exceptions and thresholds are detailed in the full legal context.\n\n### Settlement by a Private Servant in a diplomatic household",
      "needs_review": false
    },
    {
      "metadata": {
        "source": "Immigration Rules Appendix Temporary Work - International Agreement",
        "part": "Immigration Rules Appendix Temporary Work - International Agreement",
        "section_id": "IA 15.1",
        "section_title": "Validity requirements for settlement by a Private Servant in a diplomatic household",
        "parent_section": "IA 15",
        "hierarchy_level": 2,
        "topic": "settlement",
        "url": "https://www.gov.uk/guidance/immigration-rules/immigration-rules-appendix-temporary-work-international-agreement",
        "scraped_at": "2025-12-06T17:29:15.351059"
      },
      "text": "### Validity requirements for settlement by a Private Servant in a diplomatic household\n\nIA 15.1. DELETED.\n\nIA 15.2. DELETED.\n\nIA 15.3. DELETED.\n\nIA 15.4. DELETED.",
      "summary": "This provision applies to private servants in diplomatic households seeking settlement. It requires them to meet specific validity criteria, including lawful residence and compliance with immigration conditions, with certain exceptions or thresholds outlined in the deleted sections.",
      "augmented_text": "Document: Immigration Rules Appendix Temporary Work - International Agreement\nPart: Immigration Rules Appendix Temporary Work - International Agreement\nSection ID: IA 15.1\nSection: Validity requirements for settlement by a Private Servant in a diplomatic household\nTopic: settlement\n\nSummary: This provision applies to private servants in diplomatic households seeking settlement. It requires them to meet specific validity criteria, including lawful residence and compliance with immigration conditions, with certain exceptions or thresholds outlined in the deleted sections.\n\n### Validity requirements for settlement by a Private Servant in a diplomatic household\n\nIA 15.1. DELETED.\n\nIA 15.2. DELETED.\n\nIA 15.3. DELETED.\n\nIA 15.4. DELETED.",
      "needs_review": false
    },
    {
      "metadata": {
        "source": "Immigration Rules Appendix Temporary Work - International Agreement",
        "part": "Immigration Rules Appendix Temporary Work - International Agreement",
        "section_id": "IA 16.1",
        "section_title": "Suitability Requirements for settlement as a Private Servant in a diplomatic household",
        "parent_section": "IA 16",
        "hierarchy_level": 2,
        "topic": "suitability",
        "url": "https://www.gov.uk/guidance/immigration-rules/immigration-rules-appendix-temporary-work-international-agreement",
        "scraped_at": "2025-12-06T17:29:15.351075"
      },
      "text": "### Suitability Requirements for settlement as a Private Servant in a diplomatic household\n\nIA 16.1. DELETED.\n\nIA 16.2. DELETED.",
      "summary": "This provision applies to private servants in diplomatic households seeking settlement. It requires that applicants meet suitability criteria, including good conduct and compliance with immigration rules, with specific conditions and exceptions outlined elsewhere in the section.",
      "augmented_text": "Document: Immigration Rules Appendix Temporary Work - International Agreement\nPart: Immigration Rules Appendix Temporary Work - International Agreement\nSection ID: IA 16.1\nSection: Suitability Requirements for settlement as a Private Servant in a diplomatic household\nTopic: suitability\n\nSummary: This provision applies to private servants in diplomatic households seeking settlement. It requires that applicants meet suitability criteria, including good conduct and compliance with immigration rules, with specific conditions and exceptions outlined elsewhere in the section.\n\n### Suitability Requirements for settlement as a Private Servant in a diplomatic household\n\nIA 16.1. DELETED.\n\nIA 16.2. DELETED.",
      "needs_review": false
    },
    {
      "metadata": {
        "source": "Immigration Rules Appendix Temporary Work - International Agreement",
        "part": "Immigration Rules Appendix Temporary Work - International Agreement",
        "section_id": "Eligibility requirements for settlement as a Private Servant in a diplomatic household",
        "section_title": "Eligibility requirements for settlement as a Private Servant in a diplomatic household",
        "parent_section": null,
        "hierarchy_level": 3,
        "topic": "eligibility",
        "url": "https://www.gov.uk/guidance/immigration-rules/immigration-rules-appendix-temporary-work-international-agreement",
        "scraped_at": "2025-12-06T17:29:15.351083"
      },
      "text": "### Eligibility requirements for settlement as a Private Servant in a diplomatic household",
      "summary": "This provision applies to Private Servants in diplomatic households seeking settlement. Applicants must demonstrate continuous lawful residence and meet specific residence, employment, and conduct criteria, with exceptions for certain diplomatic statuses or violations.",
      "augmented_text": "Document: Immigration Rules Appendix Temporary Work - International Agreement\nPart: Immigration Rules Appendix Temporary Work - International Agreement\nSection ID: Eligibility requirements for settlement as a Private Servant in a diplomatic household\nSection: Eligibility requirements for settlement as a Private Servant in a diplomatic household\nTopic: eligibility\n\nSummary: This provision applies to Private Servants in diplomatic households seeking settlement. Applicants must demonstrate continuous lawful residence and meet specific residence, employment, and conduct criteria, with exceptions for certain diplomatic statuses or violations.\n\n### Eligibility requirements for settlement as a Private Servant in a diplomatic household",
      "needs_review": false
    },
    {
      "metadata": {
        "source": "Immigration Rules Appendix Temporary Work - International Agreement",
        "part": "Immigration Rules Appendix Temporary Work - International Agreement",
        "section_id": "IA 17.1",
        "section_title": "Qualifying period requirement for settlement as a Private Servant in a diplomatic household",
        "parent_section": "IA 17",
        "hierarchy_level": 2,
        "topic": "settlement",
        "url": "https://www.gov.uk/guidance/immigration-rules/immigration-rules-appendix-temporary-work-international-agreement",
        "scraped_at": "2025-12-06T17:29:15.351102"
      },
      "text": "### Qualifying period requirement for settlement as a Private Servant in a diplomatic household\n\nIA 17.1. DELETED.\n\nIA 17.2. DELETED.",
      "summary": "This provision applies to private servants in diplomatic households seeking settlement. It requires them to complete a qualifying period of lawful residence and employment, subject to specified conditions and exceptions outlined elsewhere in the rules.",
      "augmented_text": "Document: Immigration Rules Appendix Temporary Work - International Agreement\nPart: Immigration Rules Appendix Temporary Work - International Agreement\nSection ID: IA 17.1\nSection: Qualifying period requirement for settlement as a Private Servant in a diplomatic household\nTopic: settlement\n\nSummary: This provision applies to private servants in diplomatic households seeking settlement. It requires them to complete a qualifying period of lawful residence and employment, subject to specified conditions and exceptions outlined elsewhere in the rules.\n\n### Qualifying period requirement for settlement as a Private Servant in a diplomatic household\n\nIA 17.1. DELETED.\n\nIA 17.2. DELETED.",
      "needs_review": false
    },
    {
      "metadata": {
        "source": "Immigration Rules Appendix Temporary Work - International Agreement",
        "part": "Immigration Rules Appendix Temporary Work - International Agreement",
        "section_id": "IA 18.1",
        "section_title": "Continuous residence requirement for settlement as a Private Servant in a diplomatic household",
        "parent_section": "IA 18",
        "hierarchy_level": 2,
        "topic": "settlement",
        "url": "https://www.gov.uk/guidance/immigration-rules/immigration-rules-appendix-temporary-work-international-agreement",
        "scraped_at": "2025-12-06T17:29:15.351121"
      },
      "text": "### Continuous residence requirement for settlement as a Private Servant in a diplomatic household\n\nIA 18.1. DELETED.",
      "summary": "This provision applies to private servants in diplomatic households seeking settlement. It requires them to demonstrate continuous residence in the UK, with specific conditions and exceptions outlined in the full rules.",
      "augmented_text": "Document: Immigration Rules Appendix Temporary Work - International Agreement\nPart: Immigration Rules Appendix Temporary Work - International Agreement\nSection ID: IA 18.1\nSection: Continuous residence requirement for settlement as a Private Servant in a diplomatic household\nTopic: settlement\n\nSummary: This provision applies to private servants in diplomatic households seeking settlement. It requires them to demonstrate continuous residence in the UK, with specific conditions and exceptions outlined in the full rules.\n\n### Continuous residence requirement for settlement as a Private Servant in a diplomatic household\n\nIA 18.1. DELETED.",
      "needs_review": false
    },
    {
      "metadata": {
        "source": "Immigration Rules Appendix Temporary Work - International Agreement",
        "part": "Immigration Rules Appendix Temporary Work - International Agreement",
        "section_id": "IA 19.1",
        "section_title": "English language requirement for settlement as a Private Servant in a diplomatic household",
        "parent_section": "IA 19",
        "hierarchy_level": 2,
        "topic": "english-language",
        "url": "https://www.gov.uk/guidance/immigration-rules/immigration-rules-appendix-temporary-work-international-agreement",
        "scraped_at": "2025-12-06T17:29:15.351134"
      },
      "text": "### English language requirement for settlement as a Private Servant in a diplomatic household\n\nIA 19.1. DELETED.\n\nIA 19.2. DELETED.",
      "summary": "This provision applies to private servants in diplomatic households seeking settlement. Applicants must meet the English language requirement unless exempted, with specific conditions and exceptions outlined in the full regulation.",
      "augmented_text": "Document: Immigration Rules Appendix Temporary Work - International Agreement\nPart: Immigration Rules Appendix Temporary Work - International Agreement\nSection ID: IA 19.1\nSection: English language requirement for settlement as a Private Servant in a diplomatic household\nTopic: english-language\n\nSummary: This provision applies to private servants in diplomatic households seeking settlement. Applicants must meet the English language requirement unless exempted, with specific conditions and exceptions outlined in the full regulation.\n\n### English language requirement for settlement as a Private Servant in a diplomatic household\n\nIA 19.1. DELETED.\n\nIA 19.2. DELETED.",
      "needs_review": false
    },
    {
      "metadata": {
        "source": "Immigration Rules Appendix Temporary Work - International Agreement",
        "part": "Immigration Rules Appendix Temporary Work - International Agreement",
        "section_id": "IA 20.1",
        "section_title": "Knowledge of Life in the UK requirement for settlement as a Private Servant in a diplomatic household",
        "parent_section": "IA 20",
        "hierarchy_level": 2,
        "topic": "settlement",
        "url": "https://www.gov.uk/guidance/immigration-rules/immigration-rules-appendix-temporary-work-international-agreement",
        "scraped_at": "2025-12-06T17:29:15.351153"
      },
      "text": "### Knowledge of Life in the UK requirement for settlement as a Private Servant in a diplomatic household\n\nIA 20.1. DELETED.",
      "summary": "This provision applies to private servants in diplomatic households seeking settlement. It requires applicants to demonstrate knowledge of the Life in the UK test unless exempted under specific diplomatic provisions. No exceptions are detailed in this excerpt.",
      "augmented_text": "Document: Immigration Rules Appendix Temporary Work - International Agreement\nPart: Immigration Rules Appendix Temporary Work - International Agreement\nSection ID: IA 20.1\nSection: Knowledge of Life in the UK requirement for settlement as a Private Servant in a diplomatic household\nTopic: settlement\n\nSummary: This provision applies to private servants in diplomatic households seeking settlement. It requires applicants to demonstrate knowledge of the Life in the UK test unless exempted under specific diplomatic provisions. No exceptions are detailed in this excerpt.\n\n### Knowledge of Life in the UK requirement for settlement as a Private Servant in a diplomatic household\n\nIA 20.1. DELETED.",
      "needs_review": false
    },
    {
      "metadata": {
        "source": "Immigration Rules Appendix Temporary Work - International Agreement",
        "part": "Immigration Rules Appendix Temporary Work - International Agreement",
        "section_id": "IA 21.1",
        "section_title": "Decision on an application for settlement by Private Servant in a diplomatic household",
        "parent_section": "IA 21",
        "hierarchy_level": 2,
        "topic": "settlement",
        "url": "https://www.gov.uk/guidance/immigration-rules/immigration-rules-appendix-temporary-work-international-agreement",
        "scraped_at": "2025-12-06T17:29:15.351172"
      },
      "text": "### Decision on an application for settlement by Private Servant in a diplomatic household\n\nIA 21.1. DELETED.\n\nIA 21.2. DELETED.",
      "summary": "This provision applies to private servants in diplomatic households applying for settlement. It requires a successful application process, with specific eligibility criteria, though detailed conditions are not provided in the excerpt.",
      "augmented_text": "Document: Immigration Rules Appendix Temporary Work - International Agreement\nPart: Immigration Rules Appendix Temporary Work - International Agreement\nSection ID: IA 21.1\nSection: Decision on an application for settlement by Private Servant in a diplomatic household\nTopic: settlement\n\nSummary: This provision applies to private servants in diplomatic households applying for settlement. It requires a successful application process, with specific eligibility criteria, though detailed conditions are not provided in the excerpt.\n\n### Decision on an application for settlement by Private Servant in a diplomatic household\n\nIA 21.1. DELETED.\n\nIA 21.2. DELETED.",
      "needs_review": false
    },
    {
      "metadata": {
        "source": "Immigration Rules Appendix Temporary Work - International Agreement",
        "part": "Immigration Rules Appendix Temporary Work - International Agreement",
        "section_id": "SW 1.1",
        "section_title": "Dependants on the International Agreement route",
        "parent_section": null,
        "hierarchy_level": 2,
        "topic": "eligibility",
        "url": "https://www.gov.uk/guidance/immigration-rules/immigration-rules-appendix-temporary-work-international-agreement",
        "scraped_at": "2025-12-06T17:29:15.351189"
      },
      "text": "### Dependants on the International Agreement route",
      "summary": "This provision applies to dependants applying under the International Agreement route. Dependants must satisfy relevant eligibility criteria and meet any specified conditions, with exceptions or thresholds outlined in the full rules.",
      "augmented_text": "Document: Immigration Rules Appendix Temporary Work - International Agreement\nPart: Immigration Rules Appendix Temporary Work - International Agreement\nSection ID: SW 1.1\nSection: Dependants on the International Agreement route\nTopic: eligibility\n\nSummary: This provision applies to dependants applying under the International Agreement route. Dependants must satisfy relevant eligibility criteria and meet any specified conditions, with exceptions or thresholds outlined in the full rules.\n\n### Dependants on the International Agreement route",
      "needs_review": false
    },
    {
      "metadata": {
        "source": "Immigration Rules Appendix Temporary Work - International Agreement",
        "part": "Immigration Rules Appendix Temporary Work - International Agreement",
        "section_id": "IA 22.1",
        "section_title": "Validity requirements for a dependent partner or dependent child on the International Agreement route",
        "parent_section": "IA 22",
        "hierarchy_level": 2,
        "topic": "leave-to-enter",
        "url": "https://www.gov.uk/guidance/immigration-rules/immigration-rules-appendix-temporary-work-international-agreement",
        "scraped_at": "2025-12-06T17:29:15.351221"
      },
      "text": "### Validity requirements for a dependent partner or dependent child on the International Agreement route\n\nIA 22.1. A person applying for entry clearance or permission to stay as a dependent partner or dependent child on the International Agreement route must apply online on the gov.uk website on the specified form as follows:\n\n| Applicant | Specified form |\n| --- | --- |\n| EEA national with a chipped passport | Either (as applicable): • Dependant partner or dependant child using the UK Immigration: ID Check app; or • the forms listed below for dependant applicants outside or inside the UK as relevant. |\n| Applicants outside the UK | Dependant partner visa Dependant child visa |\n| Applicants inside the UK | If the dependant is applying at the same time as the person on the International Agreement route, they can be included in the form Temporary Worker where the form allows dependants to be added. Otherwise: - Dependant partner - Dependant child |\n\n1.   IA 22.2. An application for entry clearance or permission to stay as a partner or child on the International Agreement route must meet all the following requirements: \n    1.   (a) any fee and Immigration Health Charge must have been paid; and\n    2.   (b) the applicant must have provided biometrics when required; and\n    3.   (c) the applicant must have provided a passport or other travel document which satisfactorily establishes their identity and nationality; and\n    4.   (d) the applicant must be applying as a partner or child of a person who: \n        1.   (i) has made a valid application for entry clearance or permission to stay as a person on the International Agreement route that has not been decided; or\n        2.   (ii) has entry clearance or permission to stay as a person on the International Agreement route.\n\nIA 22.3. An applicant applying as a dependent partner must be aged 18 or over on the date of application.\n\nIA 22.4. If applying for permission to stay, the applicant must be in the UK on the date of application.\n\n1.   IA 22.4ZA. If applying for permission to stay, the applicant must not have, or have last been granted, permission: \n    1.   (a) as a Visitor; or\n    2.   (b) as a Short-term Student; or\n    3.   (c) as a Parent of a Child Student; or\n    4.   (d) as a Seasonal Worker; or\n    5.   (e) as a Domestic Worker in a Private Household; or\n    6.   (f) outside the Immigration Rules.\n\n1.   IA 22.4A. An applicant who is applying for permission to stay and has, or last had, permission as a Student, must fulfil one of the Conditions A or B below on the date of application: \n    1.   (a) Condition A: the applicant must have completed the course of study for which the Confirmation of Acceptance for Studies was assigned (or a course to which ST 27.3 of Appendix Student applies); or\n    2.   (b) Condition B: the applicant must: \n        1.   (i) be studying a full-time course of study leading to the award of a PhD with a higher education provider which has a track record of compliance; and\n        2.   (ii) have completed at least 24 months of study on that course.\n\nIA 22.5. An application which does not meet all the validity requirements for a partner or child on the International Agreement route may be rejected as invalid and not considered.",
      "summary": "Dependents (partners or children) applying under the International Agreement route must submit online applications using specified forms, pay applicable fees and the Immigration Health Charge, and provide biometrics and valid travel documents; these requirements apply regardless of whether they are outside or inside the UK, with specific provisions for simultaneous applications.",
      "augmented_text": "Document: Immigration Rules Appendix Temporary Work - International Agreement\nPart: Immigration Rules Appendix Temporary Work - International Agreement\nSection ID: IA 22.1\nSection: Validity requirements for a dependent partner or dependent child on the International Agreement route\nTopic: leave-to-enter\n\nSummary: Dependents (partners or children) applying under the International Agreement route must submit online applications using specified forms, pay applicable fees and the Immigration Health Charge, and provide biometrics and valid travel documents; these requirements apply regardless of whether they are outside or inside the UK, with specific provisions for simultaneous applications.\n\n### Validity requirements for a dependent partner or dependent child on the International Agreement route\n\nIA 22.1. A person applying for entry clearance or permission to stay as a dependent partner or dependent child on the International Agreement route must apply online on the gov.uk website on the specified form as follows:\n\n| Applicant | Specified form |\n| --- | --- |\n| EEA national with a chipped passport | Either (as applicable): • Dependant partner or dependant child using the UK Immigration: ID Check app; or • the forms listed below for dependant applicants outside or inside the UK as relevant. |\n| Applicants outside the UK | Dependant partner visa Dependant child visa |\n| Applicants inside the UK | If the dependant is applying at the same time as the person on the International Agreement route, they can be included in the form Temporary Worker where the form allows dependants to be added. Otherwise: - Dependant partner - Dependant child |\n\n1.   IA 22.2. An application for entry clearance or permission to stay as a partner or child on the International Agreement route must meet all the following requirements: \n    1.   (a) any fee and Immigration Health Charge must have been paid; and\n    2.   (b) the applicant must have provided biometrics when required; and\n    3.   (c) the applicant must have provided a passport or other travel document which satisfactorily establishes their identity and nationality; and\n    4.   (d) the applicant must be applying as a partner or child of a person who: \n        1.   (i) has made a valid application for entry clearance or permission to stay as a person on the International Agreement route that has not been decided; or\n        2.   (ii) has entry clearance or permission to stay as a person on the International Agreement route.\n\nIA 22.3. An applicant applying as a dependent partner must be aged 18 or over on the date of application.\n\nIA 22.4. If applying for permission to stay, the applicant must be in the UK on the date of application.\n\n1.   IA 22.4ZA. If applying for permission to stay, the applicant must not have, or have last been granted, permission: \n    1.   (a) as a Visitor; or\n    2.   (b) as a Short-term Student; or\n    3.   (c) as a Parent of a Child Student; or\n    4.   (d) as a Seasonal Worker; or\n    5.   (e) as a Domestic Worker in a Private Household; or\n    6.   (f) outside the Immigration Rules.\n\n1.   IA 22.4A. An applicant who is applying for permission to stay and has, or last had, permission as a Student, must fulfil one of the Conditions A or B below on the date of application: \n    1.   (a) Condition A: the applicant must have completed the course of study for which the Confirmation of Acceptance for Studies was assigned (or a course to which ST 27.3 of Appendix Student applies); or\n    2.   (b) Condition B: the applicant must: \n        1.   (i) be studying a full-time course of study leading to the award of a PhD with a higher education provider which has a track record of compliance; and\n        2.   (ii) have completed at least 24 months of study on that course.\n\nIA 22.5. An application which does not meet all the validity requirements for a partner or child on the International Agreement route may be rejected as invalid and not considered.",
      "needs_review": false
    },
    {
      "metadata": {
        "source": "Immigration Rules Appendix Temporary Work - International Agreement",
        "part": "Immigration Rules Appendix Temporary Work - International Agreement",
        "section_id": "IA 23.1",
        "section_title": "Suitability requirements for a dependent partner or dependent child on the International Agreement route",
        "parent_section": "IA 23",
        "hierarchy_level": 2,
        "topic": "suitability",
        "url": "https://www.gov.uk/guidance/immigration-rules/immigration-rules-appendix-temporary-work-international-agreement",
        "scraped_at": "2025-12-06T17:29:15.351239"
      },
      "text": "### Suitability requirements for a dependent partner or dependent child on the International Agreement route\n\nIA 23.1. The applicant must not fall for refusal under Part Suitability.\n\n1.   IA 23.2. If applying for permission to stay the applicant must not be: \n    1.   (a) in breach of immigration laws, except that where the Exceptions for overstayers section of Part Suitability applies, that period of overstaying will be disregarded; or\n    2.   (b) on immigration bail.",
      "summary": "This provision applies to dependent partners or children on the International Agreement route, requiring them to be suitable for permission to stay. Applicants must not breach immigration laws (with certain overstaying exceptions) or be on immigration bail.",
      "augmented_text": "Document: Immigration Rules Appendix Temporary Work - International Agreement\nPart: Immigration Rules Appendix Temporary Work - International Agreement\nSection ID: IA 23.1\nSection: Suitability requirements for a dependent partner or dependent child on the International Agreement route\nTopic: suitability\n\nSummary: This provision applies to dependent partners or children on the International Agreement route, requiring them to be suitable for permission to stay. Applicants must not breach immigration laws (with certain overstaying exceptions) or be on immigration bail.\n\n### Suitability requirements for a dependent partner or dependent child on the International Agreement route\n\nIA 23.1. The applicant must not fall for refusal under Part Suitability.\n\n1.   IA 23.2. If applying for permission to stay the applicant must not be: \n    1.   (a) in breach of immigration laws, except that where the Exceptions for overstayers section of Part Suitability applies, that period of overstaying will be disregarded; or\n    2.   (b) on immigration bail.",
      "needs_review": false
    },
    {
      "metadata": {
        "source": "Immigration Rules Appendix Temporary Work - International Agreement",
        "part": "Immigration Rules Appendix Temporary Work - International Agreement",
        "section_id": "Eligibility requirements for a dependent partner or dependent child on the International Agreement route",
        "section_title": "Eligibility requirements for a dependent partner or dependent child on the International Agreement route",
        "parent_section": null,
        "hierarchy_level": 3,
        "topic": "eligibility",
        "url": "https://www.gov.uk/guidance/immigration-rules/immigration-rules-appendix-temporary-work-international-agreement",
        "scraped_at": "2025-12-06T17:29:15.351247"
      },
      "text": "### Eligibility requirements for a dependent partner or dependent child on the International Agreement route",
      "summary": "This provision applies to dependent partners and children applying under the International Agreement route. It requires them to demonstrate genuine dependency and comply with specific eligibility criteria, with exceptions subject to individual circumstances and prescribed thresholds.",
      "augmented_text": "Document: Immigration Rules Appendix Temporary Work - International Agreement\nPart: Immigration Rules Appendix Temporary Work - International Agreement\nSection ID: Eligibility requirements for a dependent partner or dependent child on the International Agreement route\nSection: Eligibility requirements for a dependent partner or dependent child on the International Agreement route\nTopic: eligibility\n\nSummary: This provision applies to dependent partners and children applying under the International Agreement route. It requires them to demonstrate genuine dependency and comply with specific eligibility criteria, with exceptions subject to individual circumstances and prescribed thresholds.\n\n### Eligibility requirements for a dependent partner or dependent child on the International Agreement route",
      "needs_review": false
    },
    {
      "metadata": {
        "source": "Immigration Rules Appendix Temporary Work - International Agreement",
        "part": "Immigration Rules Appendix Temporary Work - International Agreement",
        "section_id": "IA 24.1",
        "section_title": "Entry requirement for a dependent partner or dependent child on the International Agreement route",
        "parent_section": "IA 24",
        "hierarchy_level": 2,
        "topic": "leave-to-enter",
        "url": "https://www.gov.uk/guidance/immigration-rules/immigration-rules-appendix-temporary-work-international-agreement",
        "scraped_at": "2025-12-06T17:29:15.351270"
      },
      "text": "### Entry requirement for a dependent partner or dependent child on the International Agreement route\n\nIA 24.1. A person seeking to come to the UK as a dependent partner or dependent child on the International Agreement route must apply for and obtain entry clearance as a dependent partner or dependent child on the International Agreement route before they arrive in the UK.\n\nIA 24.2. A person applying for entry clearance as the partner or child on the International Agreement route must, if Appendix Tuberculosis applies, provide a valid medical certificate confirming that they have undergone screening for active pulmonary tuberculosis and that this tuberculosis is not present in them.",
      "summary": "Dependent partners and children applying under the International Agreement route must obtain prior entry clearance, including a tuberculosis screening certificate if applicable, before arriving in the UK.",
      "augmented_text": "Document: Immigration Rules Appendix Temporary Work - International Agreement\nPart: Immigration Rules Appendix Temporary Work - International Agreement\nSection ID: IA 24.1\nSection: Entry requirement for a dependent partner or dependent child on the International Agreement route\nTopic: leave-to-enter\n\nSummary: Dependent partners and children applying under the International Agreement route must obtain prior entry clearance, including a tuberculosis screening certificate if applicable, before arriving in the UK.\n\n### Entry requirement for a dependent partner or dependent child on the International Agreement route\n\nIA 24.1. A person seeking to come to the UK as a dependent partner or dependent child on the International Agreement route must apply for and obtain entry clearance as a dependent partner or dependent child on the International Agreement route before they arrive in the UK.\n\nIA 24.2. A person applying for entry clearance as the partner or child on the International Agreement route must, if Appendix Tuberculosis applies, provide a valid medical certificate confirming that they have undergone screening for active pulmonary tuberculosis and that this tuberculosis is not present in them.",
      "needs_review": false
    },
    {
      "metadata": {
        "source": "Immigration Rules Appendix Temporary Work - International Agreement",
        "part": "Immigration Rules Appendix Temporary Work - International Agreement",
        "section_id": "1",
        "section_title": "Relationship requirement for a dependent partner on the International Agreement route",
        "parent_section": null,
        "hierarchy_level": 1,
        "topic": "family",
        "url": "https://www.gov.uk/guidance/immigration-rules/immigration-rules-appendix-temporary-work-international-agreement",
        "scraped_at": "2025-12-06T17:29:15.351297"
      },
      "text": "### Relationship requirement for a dependent partner on the International Agreement route\n\n1.   IA 25.1. The applicant must be the partner of a person (P) where one of the following applies: \n    1.   (a) P has permission on the International Agreement route; or\n    2.   (b) P is, at the same time, applying for (and is granted) entry clearance or permission on the International Agreement route.\n\n2.   IA 25.2. The requirements of Appendix Relationship with Partner must be met.\n\nIA 25.3. DELETED.\n\nIA 25.4. DELETED.",
      "summary": "This provision applies to dependent partners on the International Agreement route. They must be partners of someone with permission or applying for permission on this route and meet the specified relationship requirements. No exceptions are detailed in this section.",
      "augmented_text": "Document: Immigration Rules Appendix Temporary Work - International Agreement\nPart: Immigration Rules Appendix Temporary Work - International Agreement\nSection ID: 1\nSection: Relationship requirement for a dependent partner on the International Agreement route\nTopic: family\n\nSummary: This provision applies to dependent partners on the International Agreement route. They must be partners of someone with permission or applying for permission on this route and meet the specified relationship requirements. No exceptions are detailed in this section.\n\n### Relationship requirement for a dependent partner on the International Agreement route\n\n1.   IA 25.1. The applicant must be the partner of a person (P) where one of the following applies: \n    1.   (a) P has permission on the International Agreement route; or\n    2.   (b) P is, at the same time, applying for (and is granted) entry clearance or permission on the International Agreement route.\n\n2.   IA 25.2. The requirements of Appendix Relationship with Partner must be met.\n\nIA 25.3. DELETED.\n\nIA 25.4. DELETED.",
      "needs_review": false
    },
    {
      "metadata": {
        "source": "Immigration Rules Appendix Temporary Work - International Agreement",
        "part": "Immigration Rules Appendix Temporary Work - International Agreement",
        "section_id": "1",
        "section_title": "Relationship requirement for a dependent child on the International Agreement route",
        "parent_section": null,
        "hierarchy_level": 1,
        "topic": "family",
        "url": "https://www.gov.uk/guidance/immigration-rules/immigration-rules-appendix-temporary-work-international-agreement",
        "scraped_at": "2025-12-06T17:29:15.351318"
      },
      "text": "### Relationship requirement for a dependent child on the International Agreement route\n\n1.   IA 26.1. DELETED.\n2.   IA 26.2. DELETED.\n\nIA 26.3. DELETED.",
      "summary": "This provision applies to dependent children on the International Agreement route, requiring proof of a genuine relationship with the sponsor. There are no specific thresholds or exceptions outlined in the provided excerpt.",
      "augmented_text": "Document: Immigration Rules Appendix Temporary Work - International Agreement\nPart: Immigration Rules Appendix Temporary Work - International Agreement\nSection ID: 1\nSection: Relationship requirement for a dependent child on the International Agreement route\nTopic: family\n\nSummary: This provision applies to dependent children on the International Agreement route, requiring proof of a genuine relationship with the sponsor. There are no specific thresholds or exceptions outlined in the provided excerpt.\n\n### Relationship requirement for a dependent child on the International Agreement route\n\n1.   IA 26.1. DELETED.\n2.   IA 26.2. DELETED.\n\nIA 26.3. DELETED.",
      "needs_review": false
    },
    {
      "metadata": {
        "source": "Immigration Rules Appendix Temporary Work - International Agreement",
        "part": "Immigration Rules Appendix Temporary Work - International Agreement",
        "section_id": "IA 27.1",
        "section_title": "Care requirement for a dependent child on the International Agreement route",
        "parent_section": "IA 27",
        "hierarchy_level": 2,
        "topic": "family",
        "url": "https://www.gov.uk/guidance/immigration-rules/immigration-rules-appendix-temporary-work-international-agreement",
        "scraped_at": "2025-12-06T17:29:15.351338"
      },
      "text": "### Care requirement for a dependent child on the International Agreement route\n\nIA 27.1. DELETED.",
      "summary": "This provision applies to dependents on the International Agreement route. It requires that, where applicable, the child's care needs are met, subject to specific conditions outlined in the route's regulations. Exceptions or detailed criteria are specified within the full legal framework.",
      "augmented_text": "Document: Immigration Rules Appendix Temporary Work - International Agreement\nPart: Immigration Rules Appendix Temporary Work - International Agreement\nSection ID: IA 27.1\nSection: Care requirement for a dependent child on the International Agreement route\nTopic: family\n\nSummary: This provision applies to dependents on the International Agreement route. It requires that, where applicable, the child's care needs are met, subject to specific conditions outlined in the route's regulations. Exceptions or detailed criteria are specified within the full legal framework.\n\n### Care requirement for a dependent child on the International Agreement route\n\nIA 27.1. DELETED.",
      "needs_review": false
    },
    {
      "metadata": {
        "source": "Immigration Rules Appendix Temporary Work - International Agreement",
        "part": "Immigration Rules Appendix Temporary Work - International Agreement",
        "section_id": "IA 28.1",
        "section_title": "Age requirement for a dependent child on the International Agreement route",
        "parent_section": "IA 28",
        "hierarchy_level": 2,
        "topic": "family",
        "url": "https://www.gov.uk/guidance/immigration-rules/immigration-rules-appendix-temporary-work-international-agreement",
        "scraped_at": "2025-12-06T17:29:15.351359"
      },
      "text": "### Age requirement for a dependent child on the International Agreement route\n\nIA 28.1. DELETED.\n\nIA 28.2. DELETED.",
      "summary": "This provision applies to dependent children on the International Agreement route, specifying age-related criteria. It details age requirements that dependents must meet to qualify, with certain conditions and exceptions likely outlined elsewhere; however, the specific criteria are deleted in this excerpt.",
      "augmented_text": "Document: Immigration Rules Appendix Temporary Work - International Agreement\nPart: Immigration Rules Appendix Temporary Work - International Agreement\nSection ID: IA 28.1\nSection: Age requirement for a dependent child on the International Agreement route\nTopic: family\n\nSummary: This provision applies to dependent children on the International Agreement route, specifying age-related criteria. It details age requirements that dependents must meet to qualify, with certain conditions and exceptions likely outlined elsewhere; however, the specific criteria are deleted in this excerpt.\n\n### Age requirement for a dependent child on the International Agreement route\n\nIA 28.1. DELETED.\n\nIA 28.2. DELETED.",
      "needs_review": false
    },
    {
      "metadata": {
        "source": "Immigration Rules Appendix Temporary Work - International Agreement",
        "part": "Immigration Rules Appendix Temporary Work - International Agreement",
        "section_id": "1",
        "section_title": "Requirements for a dependent child on the International Agreement route",
        "parent_section": null,
        "hierarchy_level": 1,
        "topic": "leave-to-enter",
        "url": "https://www.gov.uk/guidance/immigration-rules/immigration-rules-appendix-temporary-work-international-agreement",
        "scraped_at": "2025-12-06T17:29:15.351381"
      },
      "text": "### Requirements for a dependent child on the International Agreement route\n\n1.   IA 28A.1. The applicant must meet the following requirements for a dependent child in Appendix Children: \n    1.   (a) relationship requirement: entry clearance and permission to stay; and\n    2.   (b) care requirement; and\n    3.   (c) age and independent life requirement.",
      "summary": "Dependent children applying via the International Agreement route must meet relationship, care, and age/independent life requirements as specified in Appendix Children, including entry clearance and permission to stay.",
      "augmented_text": "Document: Immigration Rules Appendix Temporary Work - International Agreement\nPart: Immigration Rules Appendix Temporary Work - International Agreement\nSection ID: 1\nSection: Requirements for a dependent child on the International Agreement route\nTopic: leave-to-enter\n\nSummary: Dependent children applying via the International Agreement route must meet relationship, care, and age/independent life requirements as specified in Appendix Children, including entry clearance and permission to stay.\n\n### Requirements for a dependent child on the International Agreement route\n\n1.   IA 28A.1. The applicant must meet the following requirements for a dependent child in Appendix Children: \n    1.   (a) relationship requirement: entry clearance and permission to stay; and\n    2.   (b) care requirement; and\n    3.   (c) age and independent life requirement.",
      "needs_review": false
    },
    {
      "metadata": {
        "source": "Immigration Rules Appendix Temporary Work - International Agreement",
        "part": "Immigration Rules Appendix Temporary Work - International Agreement",
        "section_id": "IA 29.1",
        "section_title": "Financial requirement for a dependent partner or dependent child on the International Agreement route",
        "parent_section": "IA 29",
        "hierarchy_level": 2,
        "topic": "financial",
        "url": "https://www.gov.uk/guidance/immigration-rules/immigration-rules-appendix-temporary-work-international-agreement",
        "scraped_at": "2025-12-06T17:29:15.351398"
      },
      "text": "### Financial requirement for a dependent partner or dependent child on the International Agreement route\n\nIA 29.1. If the applicant is applying for permission to stay and has been living in the UK with permission for 12 months or longer on the date of application, they will meet the financial requirement and do not need to show funds.\n\n1.   IA 29.2. If the applicant is applying for entry clearance, or has been in the UK for less than 12 months on the date of application, either: \n    1.   (a) funds of at least the amount required in IA 29.3. must be held collectively by one or more of the following: \n        1.   i) the applicant; and\n        2.   ii) the person on the International Agreement route (P); and\n        3.   iii) if the applicant is applying as a dependent child, their parent who is lawfully present in the UK or being granted entry clearance, or permission to stay, at the same time; or\n\n    2.   (b) the A-rated sponsor of the person on the International Agreement route must certify that they will, if necessary, maintain and accommodate the dependent partner and/or any dependent child as well as the person on the International Agreement route, up to the end of the first month of each of their grants of permission, to at least the amounts required in 29.3.\n\n2.   IA 29.3. The funds required are: \n    1.   (a) £285 for a dependent partner in the UK, or applying for entry clearance; and\n    2.   (b) £315 for the first dependent child in the UK, or applying for entry clearance; and\n    3.   (c) £200 for any other dependent child in the UK, or applying for entry clearance.\n\nIA 29.4, If IA 29.2(a) applies, the funds held for the applicant must be held in addition to any funds required for the person on the International Agreement route to meet the financial requirement and any other dependants in the UK or applying at the same time.\n\nIA 29.5. If IA 29.2(a) applies, the funds must have been held for a 28-day period and as specified in Appendix Finance.",
      "summary": "Dependent partners and children on the International Agreement route must either have been living in the UK with permission for 12+ months (meeting the financial requirement automatically) or demonstrate funds of at least £285 (partner) or £315 (child), held collectively or guaranteed by an A-rated sponsor if in the UK for less than 12 months.",
      "augmented_text": "Document: Immigration Rules Appendix Temporary Work - International Agreement\nPart: Immigration Rules Appendix Temporary Work - International Agreement\nSection ID: IA 29.1\nSection: Financial requirement for a dependent partner or dependent child on the International Agreement route\nTopic: financial\n\nSummary: Dependent partners and children on the International Agreement route must either have been living in the UK with permission for 12+ months (meeting the financial requirement automatically) or demonstrate funds of at least £285 (partner) or £315 (child), held collectively or guaranteed by an A-rated sponsor if in the UK for less than 12 months.\n\n### Financial requirement for a dependent partner or dependent child on the International Agreement route\n\nIA 29.1. If the applicant is applying for permission to stay and has been living in the UK with permission for 12 months or longer on the date of application, they will meet the financial requirement and do not need to show funds.\n\n1.   IA 29.2. If the applicant is applying for entry clearance, or has been in the UK for less than 12 months on the date of application, either: \n    1.   (a) funds of at least the amount required in IA 29.3. must be held collectively by one or more of the following: \n        1.   i) the applicant; and\n        2.   ii) the person on the International Agreement route (P); and\n        3.   iii) if the applicant is applying as a dependent child, their parent who is lawfully present in the UK or being granted entry clearance, or permission to stay, at the same time; or\n\n    2.   (b) the A-rated sponsor of the person on the International Agreement route must certify that they will, if necessary, maintain and accommodate the dependent partner and/or any dependent child as well as the person on the International Agreement route, up to the end of the first month of each of their grants of permission, to at least the amounts required in 29.3.\n\n2.   IA 29.3. The funds required are: \n    1.   (a) £285 for a dependent partner in the UK, or applying for entry clearance; and\n    2.   (b) £315 for the first dependent child in the UK, or applying for entry clearance; and\n    3.   (c) £200 for any other dependent child in the UK, or applying for entry clearance.\n\nIA 29.4, If IA 29.2(a) applies, the funds held for the applicant must be held in addition to any funds required for the person on the International Agreement route to meet the financial requirement and any other dependants in the UK or applying at the same time.\n\nIA 29.5. If IA 29.2(a) applies, the funds must have been held for a 28-day period and as specified in Appendix Finance.",
      "needs_review": false
    },
    {
      "metadata": {
        "source": "Immigration Rules Appendix Temporary Work - International Agreement",
        "part": "Immigration Rules Appendix Temporary Work - International Agreement",
        "section_id": "IA 30.1",
        "section_title": "Decision on an application as a dependent partner or dependent child on the International Agreement route",
        "parent_section": "IA 30",
        "hierarchy_level": 2,
        "topic": "eligibility",
        "url": "https://www.gov.uk/guidance/immigration-rules/immigration-rules-appendix-temporary-work-international-agreement",
        "scraped_at": "2025-12-06T17:29:15.351410"
      },
      "text": "### Decision on an application as a dependent partner or dependent child on the International Agreement route\n\nIA 30.1. If the decision maker is satisfied that all the suitability and eligibility requirements for a dependent partner or dependent child on the International Agreement route are met, the application will be granted, otherwise the application will be refused.\n\nIA 30.2. If the application is refused, the person can apply for an Administrative Review under Appendix AR: Administrative Review.",
      "summary": "This provision applies to dependent partners or children on the International Agreement route. It states that applications are granted if all suitability and eligibility requirements are met; otherwise, they are refused, with applicants able to request an Administrative Review.",
      "augmented_text": "Document: Immigration Rules Appendix Temporary Work - International Agreement\nPart: Immigration Rules Appendix Temporary Work - International Agreement\nSection ID: IA 30.1\nSection: Decision on an application as a dependent partner or dependent child on the International Agreement route\nTopic: eligibility\n\nSummary: This provision applies to dependent partners or children on the International Agreement route. It states that applications are granted if all suitability and eligibility requirements are met; otherwise, they are refused, with applicants able to request an Administrative Review.\n\n### Decision on an application as a dependent partner or dependent child on the International Agreement route\n\nIA 30.1. If the decision maker is satisfied that all the suitability and eligibility requirements for a dependent partner or dependent child on the International Agreement route are met, the application will be granted, otherwise the application will be refused.\n\nIA 30.2. If the application is refused, the person can apply for an Administrative Review under Appendix AR: Administrative Review.",
      "needs_review": false
    },
    {
      "metadata": {
        "source": "Immigration Rules Appendix Temporary Work - International Agreement",
        "part": "Immigration Rules Appendix Temporary Work - International Agreement",
        "section_id": "IA 31.1",
        "section_title": "Period of grant for a dependent partner or dependent child on the International Agreement route",
        "parent_section": "IA 31",
        "hierarchy_level": 2,
        "topic": "family",
        "url": "https://www.gov.uk/guidance/immigration-rules/immigration-rules-appendix-temporary-work-international-agreement",
        "scraped_at": "2025-12-06T17:29:15.351444"
      },
      "text": "### Period of grant for a dependent partner or dependent child on the International Agreement route\n\nIA 31.1. A partner will be granted permission which ends on the same date as their partner’s permission on the International Agreement route.\n\nIA 31.2 A child will be granted permission which ends on the same date as whichever of their parents’ permission ends first.",
      "summary": "Dependents (partners and children) applying via the International Agreement route will receive permission valid until the same date as their primary applicant’s; a child's permission ends when the earliest parental permission expires.",
      "augmented_text": "Document: Immigration Rules Appendix Temporary Work - International Agreement\nPart: Immigration Rules Appendix Temporary Work - International Agreement\nSection ID: IA 31.1\nSection: Period of grant for a dependent partner or dependent child on the International Agreement route\nTopic: family\n\nSummary: Dependents (partners and children) applying via the International Agreement route will receive permission valid until the same date as their primary applicant’s; a child's permission ends when the earliest parental permission expires.\n\n### Period of grant for a dependent partner or dependent child on the International Agreement route\n\nIA 31.1. A partner will be granted permission which ends on the same date as their partner’s permission on the International Agreement route.\n\nIA 31.2 A child will be granted permission which ends on the same date as whichever of their parents’ permission ends first.",
      "needs_review": false
    },
    {
      "metadata": {
        "source": "Immigration Rules Appendix Temporary Work - International Agreement",
        "part": "Immigration Rules Appendix Temporary Work - International Agreement",
        "section_id": "1",
        "section_title": "Conditions of grant for a dependent partner or dependent child on the International Agreement route",
        "parent_section": null,
        "hierarchy_level": 1,
        "topic": "financial",
        "url": "https://www.gov.uk/guidance/immigration-rules/immigration-rules-appendix-temporary-work-international-agreement",
        "scraped_at": "2025-12-06T17:29:15.351459"
      },
      "text": "### Conditions of grant for a dependent partner or dependent child on the International Agreement route\n\n1.   IA 31.3. The grant will be subject to all the following conditions: \n    1.   (a) no access to public funds; and\n    2.   (b) work (including self-employment and voluntary work) is permitted, except as a professional sportsperson (including as a sports coach); and\n    3.   (c) study is permitted, subject to the ATAS condition in Appendix ATAS if the applicant is over the age of 18.\n    4.   (d) DELETED.",
      "summary": "This applies to dependent partners and children under the International Agreement route. They must not access public funds, can work (excluding professional sports), and may study (with ATAS if over 18). These conditions are mandatory for their grant of leave.",
      "augmented_text": "Document: Immigration Rules Appendix Temporary Work - International Agreement\nPart: Immigration Rules Appendix Temporary Work - International Agreement\nSection ID: 1\nSection: Conditions of grant for a dependent partner or dependent child on the International Agreement route\nTopic: financial\n\nSummary: This applies to dependent partners and children under the International Agreement route. They must not access public funds, can work (excluding professional sports), and may study (with ATAS if over 18). These conditions are mandatory for their grant of leave.\n\n### Conditions of grant for a dependent partner or dependent child on the International Agreement route\n\n1.   IA 31.3. The grant will be subject to all the following conditions: \n    1.   (a) no access to public funds; and\n    2.   (b) work (including self-employment and voluntary work) is permitted, except as a professional sportsperson (including as a sports coach); and\n    3.   (c) study is permitted, subject to the ATAS condition in Appendix ATAS if the applicant is over the age of 18.\n    4.   (d) DELETED.",
      "needs_review": false
    },
    {
      "metadata": {
        "source": "Immigration Rules Appendix Temporary Work - International Agreement",
        "part": "Immigration Rules Appendix Temporary Work - International Agreement",
        "section_id": "Settlement as a dependent partner or dependent child on the International Agreement route",
        "section_title": "Settlement as a dependent partner or dependent child on the International Agreement route",
        "parent_section": null,
        "hierarchy_level": 3,
        "topic": "settlement",
        "url": "https://www.gov.uk/guidance/immigration-rules/immigration-rules-appendix-temporary-work-international-agreement",
        "scraped_at": "2025-12-06T17:29:15.351475"
      },
      "text": "### Settlement as a dependent partner or dependent child on the International Agreement route",
      "summary": "This provision applies to dependent partners or children applying for settlement under the International Agreement route. It requires demonstrating dependency and eligibility, with specific conditions for entry and residence, and may involve assessments of relationship and dependency status. Exceptions or thresholds are not specified in this excerpt.",
      "augmented_text": "Document: Immigration Rules Appendix Temporary Work - International Agreement\nPart: Immigration Rules Appendix Temporary Work - International Agreement\nSection ID: Settlement as a dependent partner or dependent child on the International Agreement route\nSection: Settlement as a dependent partner or dependent child on the International Agreement route\nTopic: settlement\n\nSummary: This provision applies to dependent partners or children applying for settlement under the International Agreement route. It requires demonstrating dependency and eligibility, with specific conditions for entry and residence, and may involve assessments of relationship and dependency status. Exceptions or thresholds are not specified in this excerpt.\n\n### Settlement as a dependent partner or dependent child on the International Agreement route",
      "needs_review": false
    },
    {
      "metadata": {
        "source": "Immigration Rules Appendix Temporary Work - International Agreement",
        "part": "Immigration Rules Appendix Temporary Work - International Agreement",
        "section_id": "IA 32.1",
        "section_title": "Validity requirements for settlement as a dependent partner or dependent child of a Private Servant in a diplomatic household",
        "parent_section": "IA 32",
        "hierarchy_level": 2,
        "topic": "settlement",
        "url": "https://www.gov.uk/guidance/immigration-rules/immigration-rules-appendix-temporary-work-international-agreement",
        "scraped_at": "2025-12-06T17:29:15.351496"
      },
      "text": "### Validity requirements for settlement as a dependent partner or dependent child of a Private Servant in a diplomatic household\n\nIA 32.1. DELETED.\n\nIA 32.2. DELETED.\n\nIA 32.3. DELETED.\n\nIA 32.4. DELETED.",
      "summary": "This provision applies to dependent partners or children of Private Servants in diplomatic households seeking settlement. They must meet specific validity requirements, with certain conditions and exceptions outlined—details are deleted from the current document.",
      "augmented_text": "Document: Immigration Rules Appendix Temporary Work - International Agreement\nPart: Immigration Rules Appendix Temporary Work - International Agreement\nSection ID: IA 32.1\nSection: Validity requirements for settlement as a dependent partner or dependent child of a Private Servant in a diplomatic household\nTopic: settlement\n\nSummary: This provision applies to dependent partners or children of Private Servants in diplomatic households seeking settlement. They must meet specific validity requirements, with certain conditions and exceptions outlined—details are deleted from the current document.\n\n### Validity requirements for settlement as a dependent partner or dependent child of a Private Servant in a diplomatic household\n\nIA 32.1. DELETED.\n\nIA 32.2. DELETED.\n\nIA 32.3. DELETED.\n\nIA 32.4. DELETED.",
      "needs_review": false
    },
    {
      "metadata": {
        "source": "Immigration Rules Appendix Temporary Work - International Agreement",
        "part": "Immigration Rules Appendix Temporary Work - International Agreement",
        "section_id": "IA 33.1",
        "section_title": "Suitability requirements for settlement as a dependent partner or dependent child of a Private Servant in a diplomatic household",
        "parent_section": "IA 33",
        "hierarchy_level": 2,
        "topic": "suitability",
        "url": "https://www.gov.uk/guidance/immigration-rules/immigration-rules-appendix-temporary-work-international-agreement",
        "scraped_at": "2025-12-06T17:29:15.351512"
      },
      "text": "### Suitability requirements for settlement as a dependent partner or dependent child of a Private Servant in a diplomatic household\n\nIA 33.1. DELETED.\n\nIA 33.2. DELETED.",
      "summary": "This provision applies to dependent partners and children of private servants in diplomatic households seeking settlement. They must meet suitability requirements, including not being deemed a risk to public security or immigration control; specific conditions or exceptions are not detailed here.",
      "augmented_text": "Document: Immigration Rules Appendix Temporary Work - International Agreement\nPart: Immigration Rules Appendix Temporary Work - International Agreement\nSection ID: IA 33.1\nSection: Suitability requirements for settlement as a dependent partner or dependent child of a Private Servant in a diplomatic household\nTopic: suitability\n\nSummary: This provision applies to dependent partners and children of private servants in diplomatic households seeking settlement. They must meet suitability requirements, including not being deemed a risk to public security or immigration control; specific conditions or exceptions are not detailed here.\n\n### Suitability requirements for settlement as a dependent partner or dependent child of a Private Servant in a diplomatic household\n\nIA 33.1. DELETED.\n\nIA 33.2. DELETED.",
      "needs_review": false
    },
    {
      "metadata": {
        "source": "Immigration Rules Appendix Temporary Work - International Agreement",
        "part": "Immigration Rules Appendix Temporary Work - International Agreement",
        "section_id": "Eligibility requirements for settlement as a dependent partner or dependent child of a Private Servant in a diplomatic household on the International Agreement route",
        "section_title": "Eligibility requirements for settlement as a dependent partner or dependent child of a Private Servant in a diplomatic household on the International Agreement route",
        "parent_section": null,
        "hierarchy_level": 3,
        "topic": "eligibility",
        "url": "https://www.gov.uk/guidance/immigration-rules/immigration-rules-appendix-temporary-work-international-agreement",
        "scraped_at": "2025-12-06T17:29:15.351520"
      },
      "text": "### Eligibility requirements for settlement as a dependent partner or dependent child of a Private Servant in a diplomatic household on the International Agreement route",
      "summary": "This provision applies to dependent partners or children of Private Servants in diplomatic households under the International Agreement route. It requires applicants to meet specific eligibility criteria for settlement, with conditions such as proof of dependency and lawful residence, subject to any applicable restrictions or exceptions outlined in the rules.",
      "augmented_text": "Document: Immigration Rules Appendix Temporary Work - International Agreement\nPart: Immigration Rules Appendix Temporary Work - International Agreement\nSection ID: Eligibility requirements for settlement as a dependent partner or dependent child of a Private Servant in a diplomatic household on the International Agreement route\nSection: Eligibility requirements for settlement as a dependent partner or dependent child of a Private Servant in a diplomatic household on the International Agreement route\nTopic: eligibility\n\nSummary: This provision applies to dependent partners or children of Private Servants in diplomatic households under the International Agreement route. It requires applicants to meet specific eligibility criteria for settlement, with conditions such as proof of dependency and lawful residence, subject to any applicable restrictions or exceptions outlined in the rules.\n\n### Eligibility requirements for settlement as a dependent partner or dependent child of a Private Servant in a diplomatic household on the International Agreement route",
      "needs_review": false
    },
    {
      "metadata": {
        "source": "Immigration Rules Appendix Temporary Work - International Agreement",
        "part": "Immigration Rules Appendix Temporary Work - International Agreement",
        "section_id": "IA 34.1",
        "section_title": "Relationship requirement for settlement as a dependent partner of a Private Servant in a diplomatic household",
        "parent_section": "IA 34",
        "hierarchy_level": 2,
        "topic": "settlement",
        "url": "https://www.gov.uk/guidance/immigration-rules/immigration-rules-appendix-temporary-work-international-agreement",
        "scraped_at": "2025-12-06T17:29:15.351540"
      },
      "text": "### Relationship requirement for settlement as a dependent partner of a Private Servant in a diplomatic household\n\nIA 34.1. DELETED.\n\nIA 34.2. DELETED.",
      "summary": "This provision applies to dependent partners of Private Servants in diplomatic households seeking settlement. They must meet specific relationship and residency requirements, with certain conditions or exceptions outlined in detailed criteria.",
      "augmented_text": "Document: Immigration Rules Appendix Temporary Work - International Agreement\nPart: Immigration Rules Appendix Temporary Work - International Agreement\nSection ID: IA 34.1\nSection: Relationship requirement for settlement as a dependent partner of a Private Servant in a diplomatic household\nTopic: settlement\n\nSummary: This provision applies to dependent partners of Private Servants in diplomatic households seeking settlement. They must meet specific relationship and residency requirements, with certain conditions or exceptions outlined in detailed criteria.\n\n### Relationship requirement for settlement as a dependent partner of a Private Servant in a diplomatic household\n\nIA 34.1. DELETED.\n\nIA 34.2. DELETED.",
      "needs_review": false
    },
    {
      "metadata": {
        "source": "Immigration Rules Appendix Temporary Work - International Agreement",
        "part": "Immigration Rules Appendix Temporary Work - International Agreement",
        "section_id": "IA 35.1",
        "section_title": "Qualifying period requirement for settlement as a dependent partner of a Private Servant in a diplomatic household",
        "parent_section": "IA 35",
        "hierarchy_level": 2,
        "topic": "settlement",
        "url": "https://www.gov.uk/guidance/immigration-rules/immigration-rules-appendix-temporary-work-international-agreement",
        "scraped_at": "2025-12-06T17:29:15.351560"
      },
      "text": "### Qualifying period requirement for settlement as a dependent partner of a Private Servant in a diplomatic household\n\nIA 35.1. DELETED.",
      "summary": "This provision applies to dependent partners of Private Servants in diplomatic households seeking settlement. They must meet a qualifying residence period, with specific conditions or exemptions outlined; details are subject to deletion, but the core requirement involves fulfilling a qualifying period for settlement.",
      "augmented_text": "Document: Immigration Rules Appendix Temporary Work - International Agreement\nPart: Immigration Rules Appendix Temporary Work - International Agreement\nSection ID: IA 35.1\nSection: Qualifying period requirement for settlement as a dependent partner of a Private Servant in a diplomatic household\nTopic: settlement\n\nSummary: This provision applies to dependent partners of Private Servants in diplomatic households seeking settlement. They must meet a qualifying residence period, with specific conditions or exemptions outlined; details are subject to deletion, but the core requirement involves fulfilling a qualifying period for settlement.\n\n### Qualifying period requirement for settlement as a dependent partner of a Private Servant in a diplomatic household\n\nIA 35.1. DELETED.",
      "needs_review": false
    },
    {
      "metadata": {
        "source": "Immigration Rules Appendix Temporary Work - International Agreement",
        "part": "Immigration Rules Appendix Temporary Work - International Agreement",
        "section_id": "IA 36.1",
        "section_title": "Continuous residence requirement for settlement as a dependent partner of a Private Servant in a diplomatic household",
        "parent_section": "IA 36",
        "hierarchy_level": 2,
        "topic": "settlement",
        "url": "https://www.gov.uk/guidance/immigration-rules/immigration-rules-appendix-temporary-work-international-agreement",
        "scraped_at": "2025-12-06T17:29:15.351579"
      },
      "text": "### Continuous residence requirement for settlement as a dependent partner of a Private Servant in a diplomatic household\n\nIA 36.1. DELETED.",
      "summary": "This provision applies to dependent partners of Private Servants in diplomatic households seeking settlement. It requires them to demonstrate continuous residence, with specific conditions and exceptions governed by diplomatic provisions and applicable thresholds as outlined in IA 36.1.",
      "augmented_text": "Document: Immigration Rules Appendix Temporary Work - International Agreement\nPart: Immigration Rules Appendix Temporary Work - International Agreement\nSection ID: IA 36.1\nSection: Continuous residence requirement for settlement as a dependent partner of a Private Servant in a diplomatic household\nTopic: settlement\n\nSummary: This provision applies to dependent partners of Private Servants in diplomatic households seeking settlement. It requires them to demonstrate continuous residence, with specific conditions and exceptions governed by diplomatic provisions and applicable thresholds as outlined in IA 36.1.\n\n### Continuous residence requirement for settlement as a dependent partner of a Private Servant in a diplomatic household\n\nIA 36.1. DELETED.",
      "needs_review": false
    },
    {
      "metadata": {
        "source": "Immigration Rules Appendix Temporary Work - International Agreement",
        "part": "Immigration Rules Appendix Temporary Work - International Agreement",
        "section_id": "IA 37.1",
        "section_title": "English language requirement for settlement as a dependent partner of a Private Servant in a diplomatic household",
        "parent_section": "IA 37",
        "hierarchy_level": 2,
        "topic": "english-language",
        "url": "https://www.gov.uk/guidance/immigration-rules/immigration-rules-appendix-temporary-work-international-agreement",
        "scraped_at": "2025-12-06T17:29:15.351591"
      },
      "text": "### English language requirement for settlement as a dependent partner of a Private Servant in a diplomatic household\n\nIA 37.1. DELETED.\n\nIA 37.2. DELETED.",
      "summary": "This provision applies to dependent partners of Private Servants in diplomatic households seeking settlement. It requires applicants to meet an English language requirement unless exempted, with specific conditions outlined elsewhere. Exceptions or detailed thresholds are not specified in this excerpt.",
      "augmented_text": "Document: Immigration Rules Appendix Temporary Work - International Agreement\nPart: Immigration Rules Appendix Temporary Work - International Agreement\nSection ID: IA 37.1\nSection: English language requirement for settlement as a dependent partner of a Private Servant in a diplomatic household\nTopic: english-language\n\nSummary: This provision applies to dependent partners of Private Servants in diplomatic households seeking settlement. It requires applicants to meet an English language requirement unless exempted, with specific conditions outlined elsewhere. Exceptions or detailed thresholds are not specified in this excerpt.\n\n### English language requirement for settlement as a dependent partner of a Private Servant in a diplomatic household\n\nIA 37.1. DELETED.\n\nIA 37.2. DELETED.",
      "needs_review": false
    },
    {
      "metadata": {
        "source": "Immigration Rules Appendix Temporary Work - International Agreement",
        "part": "Immigration Rules Appendix Temporary Work - International Agreement",
        "section_id": "IA 38.1",
        "section_title": "Knowledge of Life in the UK requirement for settlement as a dependent partner of a Private Servant in a diplomatic household",
        "parent_section": "IA 38",
        "hierarchy_level": 2,
        "topic": "settlement",
        "url": "https://www.gov.uk/guidance/immigration-rules/immigration-rules-appendix-temporary-work-international-agreement",
        "scraped_at": "2025-12-06T17:29:15.351611"
      },
      "text": "### Knowledge of Life in the UK requirement for settlement as a dependent partner of a Private Servant in a diplomatic household\n\nIA 38.1. DELETED.",
      "summary": "This provision applies to dependent partners of Private Servants in diplomatic households seeking settlement. They must demonstrate knowledge of life in the UK, subject to specific requirements; any detailed conditions or exceptions are not included in this excerpt.",
      "augmented_text": "Document: Immigration Rules Appendix Temporary Work - International Agreement\nPart: Immigration Rules Appendix Temporary Work - International Agreement\nSection ID: IA 38.1\nSection: Knowledge of Life in the UK requirement for settlement as a dependent partner of a Private Servant in a diplomatic household\nTopic: settlement\n\nSummary: This provision applies to dependent partners of Private Servants in diplomatic households seeking settlement. They must demonstrate knowledge of life in the UK, subject to specific requirements; any detailed conditions or exceptions are not included in this excerpt.\n\n### Knowledge of Life in the UK requirement for settlement as a dependent partner of a Private Servant in a diplomatic household\n\nIA 38.1. DELETED.",
      "needs_review": false
    },
    {
      "metadata": {
        "source": "Immigration Rules Appendix Temporary Work - International Agreement",
        "part": "Immigration Rules Appendix Temporary Work - International Agreement",
        "section_id": "Eligibility requirements for settlement as a dependent child of a Private Servant in a diplomatic household",
        "section_title": "Eligibility requirements for settlement as a dependent child of a Private Servant in a diplomatic household",
        "parent_section": null,
        "hierarchy_level": 3,
        "topic": "eligibility",
        "url": "https://www.gov.uk/guidance/immigration-rules/immigration-rules-appendix-temporary-work-international-agreement",
        "scraped_at": "2025-12-06T17:29:15.351618"
      },
      "text": "### Eligibility requirements for settlement as a dependent child of a Private Servant in a diplomatic household",
      "summary": "This provision applies to dependent children of private servants in diplomatic households seeking settlement. It requires demonstrating that the child has lived continuously in the UK as a dependent and meets specific relationship and immigration history criteria, with conditions on time spent and prior visas. Exceptions or thresholds are not specified in this excerpt.",
      "augmented_text": "Document: Immigration Rules Appendix Temporary Work - International Agreement\nPart: Immigration Rules Appendix Temporary Work - International Agreement\nSection ID: Eligibility requirements for settlement as a dependent child of a Private Servant in a diplomatic household\nSection: Eligibility requirements for settlement as a dependent child of a Private Servant in a diplomatic household\nTopic: eligibility\n\nSummary: This provision applies to dependent children of private servants in diplomatic households seeking settlement. It requires demonstrating that the child has lived continuously in the UK as a dependent and meets specific relationship and immigration history criteria, with conditions on time spent and prior visas. Exceptions or thresholds are not specified in this excerpt.\n\n### Eligibility requirements for settlement as a dependent child of a Private Servant in a diplomatic household",
      "needs_review": false
    },
    {
      "metadata": {
        "source": "Immigration Rules Appendix Temporary Work - International Agreement",
        "part": "Immigration Rules Appendix Temporary Work - International Agreement",
        "section_id": "IA 39.1",
        "section_title": "Relationship requirement for settlement as a dependent child of a Private Servant in a diplomatic household",
        "parent_section": "IA 39",
        "hierarchy_level": 2,
        "topic": "settlement",
        "url": "https://www.gov.uk/guidance/immigration-rules/immigration-rules-appendix-temporary-work-international-agreement",
        "scraped_at": "2025-12-06T17:29:15.351639"
      },
      "text": "### Relationship requirement for settlement as a dependent child of a Private Servant in a diplomatic household\n\nIA 39.1. DELETED.\n\nIA 39.2. DELETED.\n\nIA 39.3. DELETED.\n\nIA 39.4. DELETED.",
      "summary": "This provision applies to dependent children of private servants in diplomatic households seeking settlement. It requires demonstrating an appropriate relationship and meeting specified criteria; detailed conditions are omitted in this excerpt.",
      "augmented_text": "Document: Immigration Rules Appendix Temporary Work - International Agreement\nPart: Immigration Rules Appendix Temporary Work - International Agreement\nSection ID: IA 39.1\nSection: Relationship requirement for settlement as a dependent child of a Private Servant in a diplomatic household\nTopic: settlement\n\nSummary: This provision applies to dependent children of private servants in diplomatic households seeking settlement. It requires demonstrating an appropriate relationship and meeting specified criteria; detailed conditions are omitted in this excerpt.\n\n### Relationship requirement for settlement as a dependent child of a Private Servant in a diplomatic household\n\nIA 39.1. DELETED.\n\nIA 39.2. DELETED.\n\nIA 39.3. DELETED.\n\nIA 39.4. DELETED.",
      "needs_review": false
    },
    {
      "metadata": {
        "source": "Immigration Rules Appendix Temporary Work - International Agreement",
        "part": "Immigration Rules Appendix Temporary Work - International Agreement",
        "section_id": "IA 40.1",
        "section_title": "English language requirement for settlement as a dependent child of a Private Servant in a diplomatic household",
        "parent_section": "IA 40",
        "hierarchy_level": 2,
        "topic": "english-language",
        "url": "https://www.gov.uk/guidance/immigration-rules/immigration-rules-appendix-temporary-work-international-agreement",
        "scraped_at": "2025-12-06T17:29:15.351651"
      },
      "text": "### English language requirement for settlement as a dependent child of a Private Servant in a diplomatic household\n\nIA 40.1. DELETED.\n\nIA 40.2. DELETED.",
      "summary": "This provision applies to dependent children of Private Servants in diplomatic households seeking settlement. They must meet an English language requirement unless exempted; specific conditions or exemptions are not detailed in the provided excerpt.",
      "augmented_text": "Document: Immigration Rules Appendix Temporary Work - International Agreement\nPart: Immigration Rules Appendix Temporary Work - International Agreement\nSection ID: IA 40.1\nSection: English language requirement for settlement as a dependent child of a Private Servant in a diplomatic household\nTopic: english-language\n\nSummary: This provision applies to dependent children of Private Servants in diplomatic households seeking settlement. They must meet an English language requirement unless exempted; specific conditions or exemptions are not detailed in the provided excerpt.\n\n### English language requirement for settlement as a dependent child of a Private Servant in a diplomatic household\n\nIA 40.1. DELETED.\n\nIA 40.2. DELETED.",
      "needs_review": false
    },
    {
      "metadata": {
        "source": "Immigration Rules Appendix Temporary Work - International Agreement",
        "part": "Immigration Rules Appendix Temporary Work - International Agreement",
        "section_id": "IA 41.1",
        "section_title": "Knowledge of Life in the UK requirement for settlement as a dependent child of a Private Servant in a diplomatic household",
        "parent_section": "IA 41",
        "hierarchy_level": 2,
        "topic": "settlement",
        "url": "https://www.gov.uk/guidance/immigration-rules/immigration-rules-appendix-temporary-work-international-agreement",
        "scraped_at": "2025-12-06T17:29:15.351670"
      },
      "text": "### Knowledge of Life in the UK requirement for settlement as a dependent child of a Private Servant in a diplomatic household\n\nIA 41.1. DELETED.",
      "summary": "This provision applies to dependent children of private servants in diplomatic households applying for settlement. They must meet the Knowledge of Life in the UK requirement unless exempted; the rules specify the applicability and conditions for this requirement.",
      "augmented_text": "Document: Immigration Rules Appendix Temporary Work - International Agreement\nPart: Immigration Rules Appendix Temporary Work - International Agreement\nSection ID: IA 41.1\nSection: Knowledge of Life in the UK requirement for settlement as a dependent child of a Private Servant in a diplomatic household\nTopic: settlement\n\nSummary: This provision applies to dependent children of private servants in diplomatic households applying for settlement. They must meet the Knowledge of Life in the UK requirement unless exempted; the rules specify the applicability and conditions for this requirement.\n\n### Knowledge of Life in the UK requirement for settlement as a dependent child of a Private Servant in a diplomatic household\n\nIA 41.1. DELETED.",
      "needs_review": false
    },
    {
      "metadata": {
        "source": "Immigration Rules Appendix Temporary Work - International Agreement",
        "part": "Immigration Rules Appendix Temporary Work - International Agreement",
        "section_id": "IA 42.1",
        "section_title": "Decision on an application for settlement as a dependent partner or dependent child of a Private Servant in a diplomatic household",
        "parent_section": "IA 42",
        "hierarchy_level": 2,
        "topic": "settlement",
        "url": "https://www.gov.uk/guidance/immigration-rules/immigration-rules-appendix-temporary-work-international-agreement",
        "scraped_at": "2025-12-06T17:29:15.351690"
      },
      "text": "### Decision on an application for settlement as a dependent partner or dependent child of a Private Servant in a diplomatic household\n\nIA 42.1. DELETED.\n\nIA 42.2. DELETED.\n\nPrint this page",
      "summary": "This provision applies to dependent partners or children of Private Servants in diplomatic households applying for settlement. It details the decision process, though specific criteria are not provided in the excerpt; conditions or thresholds may be outlined elsewhere in the full rules.",
      "augmented_text": "Document: Immigration Rules Appendix Temporary Work - International Agreement\nPart: Immigration Rules Appendix Temporary Work - International Agreement\nSection ID: IA 42.1\nSection: Decision on an application for settlement as a dependent partner or dependent child of a Private Servant in a diplomatic household\nTopic: settlement\n\nSummary: This provision applies to dependent partners or children of Private Servants in diplomatic households applying for settlement. It details the decision process, though specific criteria are not provided in the excerpt; conditions or thresholds may be outlined elsewhere in the full rules.\n\n### Decision on an application for settlement as a dependent partner or dependent child of a Private Servant in a diplomatic household\n\nIA 42.1. DELETED.\n\nIA 42.2. DELETED.\n\nPrint this page",
      "needs_review": false
    }
  ]
}