{
  "url": "https://www.gov.uk/guidance/immigration-rules/immigration-rules-appendix-domestic-workers-in-a-private-household",
  "part_name": "Immigration Rules Appendix Domestic Workers in a Private Household",
  "scraped_at": "2025-12-06T17:26:41.752827",
  "chunk_count": 42,
  "chunks": [
    {
      "metadata": {
        "source": "Immigration Rules Appendix Domestic Workers in a Private Household",
        "part": "Immigration Rules Appendix Domestic Workers in a Private Household",
        "section_id": "DW 1.1",
        "section_title": "Validity requirements for Domestic Worker in a Private Household",
        "parent_section": "DW 1",
        "hierarchy_level": 2,
        "topic": "eligibility",
        "url": "https://www.gov.uk/guidance/immigration-rules/immigration-rules-appendix-domestic-workers-in-a-private-household",
        "scraped_at": "2025-12-06T17:26:41.751205"
      },
      "text": "### Validity requirements for Domestic Worker in a Private Household\n\nDW 1.1. A person applying for permission to stay as a Domestic Worker in a Private Household must apply on the gov.uk website on the specified form FLR(IR).\n\n1.   DW 1.2. An application for permission to stay as a Domestic Worker in a Private Household must meet all the following requirements: \n    1.   (a) the applicant must be in the UK on the date of application; and\n    2.   (b) any fee and Immigration Health Charge must have been paid; and\n    3.   (c) the applicant must have provided biometrics when required; and\n    4.   (d) the applicant must have provided a valid passport or other travel document which satisfactorily establishes their identity and nationality.\n\nDW 1.2A. The applicant must have entered the UK with valid entry clearance as a Domestic Worker in a Private Household under the rules in place before 6 April 2012 and have held permission to stay as a Domestic Worker in a Private Household since they entered on this route.\n\nDW 1.3. An application which does not meet all the validity requirements for a Domestic Worker in a Private Household may be rejected as invalid and not considered.",
      "summary": "Applicants seeking permission to stay as Domestic Workers in a Private Household must apply online using form FLR(IR), ensuring they are in the UK, have paid fees and Immigration Health Charge, provided biometrics, and hold a valid travel document. They must have entered the UK with valid entry clearance under pre-2012 rules and maintained lawful permission; applications not meeting these requirements will be rejected.",
      "augmented_text": "Document: Immigration Rules Appendix Domestic Workers in a Private Household\nPart: Immigration Rules Appendix Domestic Workers in a Private Household\nSection ID: DW 1.1\nSection: Validity requirements for Domestic Worker in a Private Household\nTopic: eligibility\n\nSummary: Applicants seeking permission to stay as Domestic Workers in a Private Household must apply online using form FLR(IR), ensuring they are in the UK, have paid fees and Immigration Health Charge, provided biometrics, and hold a valid travel document. They must have entered the UK with valid entry clearance under pre-2012 rules and maintained lawful permission; applications not meeting these requirements will be rejected.\n\n### Validity requirements for Domestic Worker in a Private Household\n\nDW 1.1. A person applying for permission to stay as a Domestic Worker in a Private Household must apply on the gov.uk website on the specified form FLR(IR).\n\n1.   DW 1.2. An application for permission to stay as a Domestic Worker in a Private Household must meet all the following requirements: \n    1.   (a) the applicant must be in the UK on the date of application; and\n    2.   (b) any fee and Immigration Health Charge must have been paid; and\n    3.   (c) the applicant must have provided biometrics when required; and\n    4.   (d) the applicant must have provided a valid passport or other travel document which satisfactorily establishes their identity and nationality.\n\nDW 1.2A. The applicant must have entered the UK with valid entry clearance as a Domestic Worker in a Private Household under the rules in place before 6 April 2012 and have held permission to stay as a Domestic Worker in a Private Household since they entered on this route.\n\nDW 1.3. An application which does not meet all the validity requirements for a Domestic Worker in a Private Household may be rejected as invalid and not considered.",
      "needs_review": false
    },
    {
      "metadata": {
        "source": "Immigration Rules Appendix Domestic Workers in a Private Household",
        "part": "Immigration Rules Appendix Domestic Workers in a Private Household",
        "section_id": "DW 2.1",
        "section_title": "Suitability requirements for a Domestic Worker in a Private Household",
        "parent_section": "DW 2",
        "hierarchy_level": 2,
        "topic": "suitability",
        "url": "https://www.gov.uk/guidance/immigration-rules/immigration-rules-appendix-domestic-workers-in-a-private-household",
        "scraped_at": "2025-12-06T17:26:41.751265"
      },
      "text": "### Suitability requirements for a Domestic Worker in a Private Household\n\nDW 2.1. The applicant must not fall for refusal under Part Suitability.\n\nDW 2.2. The applicant must not be in the UK in breach of immigration laws except that, where the Exceptions for overstayers section of Part Suitability applies, any current period of overstaying will be disregarded.",
      "summary": "This provision applies to domestic workers applying for entry or permission to stay in private households. They must meet suitability criteria, including not breaching immigration laws, unless an overstaying exception applies; any overstaying is generally disregarded if covered by the exception.",
      "augmented_text": "Document: Immigration Rules Appendix Domestic Workers in a Private Household\nPart: Immigration Rules Appendix Domestic Workers in a Private Household\nSection ID: DW 2.1\nSection: Suitability requirements for a Domestic Worker in a Private Household\nTopic: suitability\n\nSummary: This provision applies to domestic workers applying for entry or permission to stay in private households. They must meet suitability criteria, including not breaching immigration laws, unless an overstaying exception applies; any overstaying is generally disregarded if covered by the exception.\n\n### Suitability requirements for a Domestic Worker in a Private Household\n\nDW 2.1. The applicant must not fall for refusal under Part Suitability.\n\nDW 2.2. The applicant must not be in the UK in breach of immigration laws except that, where the Exceptions for overstayers section of Part Suitability applies, any current period of overstaying will be disregarded.",
      "needs_review": false
    },
    {
      "metadata": {
        "source": "Immigration Rules Appendix Domestic Workers in a Private Household",
        "part": "Immigration Rules Appendix Domestic Workers in a Private Household",
        "section_id": "DW 3.1",
        "section_title": "Eligibility requirements for a Domestic Worker in a Private Household",
        "parent_section": "DW 3",
        "hierarchy_level": 2,
        "topic": "eligibility",
        "url": "https://www.gov.uk/guidance/immigration-rules/immigration-rules-appendix-domestic-workers-in-a-private-household",
        "scraped_at": "2025-12-06T17:26:41.751295"
      },
      "text": "### Eligibility requirements for a Domestic Worker in a Private Household\n\nDW 3.1. DELETED.\n\nDW 3.2 DELETED.\n\nDW 3.3. The applicant must be employed for at least 30 hours per week in a private household under the same roof as the employer or in the same household as the employer for the duration of their employment.\n\nDW 3.4. The applicant must have agreed in writing, the terms and conditions of their employment in the UK and must provide evidence, in the form set out in Appendix Domestic Worker Statement, which must be fully completed and signed by both parties.\n\nDW 3.5. The decision maker must be satisfied that the applicant’s conditions of employment mean that they will be paid at least the UK National Minimum Wage throughout their employment in the UK.\n\nDW 3.6. The applicant must not intend to take any form of employment except as a Domestic Worker in a Private Household.",
      "summary": "This provision applies to domestic workers in private households seeking immigration status. The applicant must be employed for at least 30 hours/week, have a written employment agreement, and be paid at least the UK National Minimum Wage. They must also intend only to work as a domestic worker in a private household; no other employment is permitted.",
      "augmented_text": "Document: Immigration Rules Appendix Domestic Workers in a Private Household\nPart: Immigration Rules Appendix Domestic Workers in a Private Household\nSection ID: DW 3.1\nSection: Eligibility requirements for a Domestic Worker in a Private Household\nTopic: eligibility\n\nSummary: This provision applies to domestic workers in private households seeking immigration status. The applicant must be employed for at least 30 hours/week, have a written employment agreement, and be paid at least the UK National Minimum Wage. They must also intend only to work as a domestic worker in a private household; no other employment is permitted.\n\n### Eligibility requirements for a Domestic Worker in a Private Household\n\nDW 3.1. DELETED.\n\nDW 3.2 DELETED.\n\nDW 3.3. The applicant must be employed for at least 30 hours per week in a private household under the same roof as the employer or in the same household as the employer for the duration of their employment.\n\nDW 3.4. The applicant must have agreed in writing, the terms and conditions of their employment in the UK and must provide evidence, in the form set out in Appendix Domestic Worker Statement, which must be fully completed and signed by both parties.\n\nDW 3.5. The decision maker must be satisfied that the applicant’s conditions of employment mean that they will be paid at least the UK National Minimum Wage throughout their employment in the UK.\n\nDW 3.6. The applicant must not intend to take any form of employment except as a Domestic Worker in a Private Household.",
      "needs_review": false
    },
    {
      "metadata": {
        "source": "Immigration Rules Appendix Domestic Workers in a Private Household",
        "part": "Immigration Rules Appendix Domestic Workers in a Private Household",
        "section_id": "DW 4.1",
        "section_title": "Financial requirement for Domestic Worker in a Private Household",
        "parent_section": "DW 4",
        "hierarchy_level": 2,
        "topic": "financial",
        "url": "https://www.gov.uk/guidance/immigration-rules/immigration-rules-appendix-domestic-workers-in-a-private-household",
        "scraped_at": "2025-12-06T17:26:41.751321"
      },
      "text": "### Financial requirement for Domestic Worker in a Private Household\n\nDW 4.1. The decision maker must be satisfied that the applicant can and will adequately maintain and accommodate themselves, and any dependants in the UK or applying for entry clearance, without recourse to public funds.\n\nDW 4.2. Funds must be shown as specified in Appendix Finance.",
      "summary": "This provision applies to domestic workers seeking entry clearance or extension. Applicants must demonstrate they can adequately support and accommodate themselves and dependants in the UK without recourse to public funds, meeting the financial criteria set out in Appendix Finance.",
      "augmented_text": "Document: Immigration Rules Appendix Domestic Workers in a Private Household\nPart: Immigration Rules Appendix Domestic Workers in a Private Household\nSection ID: DW 4.1\nSection: Financial requirement for Domestic Worker in a Private Household\nTopic: financial\n\nSummary: This provision applies to domestic workers seeking entry clearance or extension. Applicants must demonstrate they can adequately support and accommodate themselves and dependants in the UK without recourse to public funds, meeting the financial criteria set out in Appendix Finance.\n\n### Financial requirement for Domestic Worker in a Private Household\n\nDW 4.1. The decision maker must be satisfied that the applicant can and will adequately maintain and accommodate themselves, and any dependants in the UK or applying for entry clearance, without recourse to public funds.\n\nDW 4.2. Funds must be shown as specified in Appendix Finance.",
      "needs_review": false
    },
    {
      "metadata": {
        "source": "Immigration Rules Appendix Domestic Workers in a Private Household",
        "part": "Immigration Rules Appendix Domestic Workers in a Private Household",
        "section_id": "DW 5.1",
        "section_title": "Decision on an application as a Domestic Worker in a Private Household",
        "parent_section": "DW 5",
        "hierarchy_level": 2,
        "topic": "eligibility",
        "url": "https://www.gov.uk/guidance/immigration-rules/immigration-rules-appendix-domestic-workers-in-a-private-household",
        "scraped_at": "2025-12-06T17:26:41.751344"
      },
      "text": "### Decision on an application as a Domestic Worker in a Private Household\n\nDW 5.1. If the decision maker is satisfied that all of the suitability and eligibility requirements for permission to stay as a Domestic Worker in a Private Household are met the application will be granted, otherwise the application will be refused.\n\nDW 5.2. If the application is refused, the person can apply for an Administrative Review under Appendix AR: Administrative Review.",
      "summary": "This provision applies to applicants seeking permission to stay as Domestic Workers in private households. Applications are granted if all suitability and eligibility requirements are met; otherwise, they are refused, with an entitlement to request an Administrative Review.",
      "augmented_text": "Document: Immigration Rules Appendix Domestic Workers in a Private Household\nPart: Immigration Rules Appendix Domestic Workers in a Private Household\nSection ID: DW 5.1\nSection: Decision on an application as a Domestic Worker in a Private Household\nTopic: eligibility\n\nSummary: This provision applies to applicants seeking permission to stay as Domestic Workers in private households. Applications are granted if all suitability and eligibility requirements are met; otherwise, they are refused, with an entitlement to request an Administrative Review.\n\n### Decision on an application as a Domestic Worker in a Private Household\n\nDW 5.1. If the decision maker is satisfied that all of the suitability and eligibility requirements for permission to stay as a Domestic Worker in a Private Household are met the application will be granted, otherwise the application will be refused.\n\nDW 5.2. If the application is refused, the person can apply for an Administrative Review under Appendix AR: Administrative Review.",
      "needs_review": false
    },
    {
      "metadata": {
        "source": "Immigration Rules Appendix Domestic Workers in a Private Household",
        "part": "Immigration Rules Appendix Domestic Workers in a Private Household",
        "section_id": "DW 6.1",
        "section_title": "Period of grant for a Domestic Worker in a Private Household",
        "parent_section": "DW 6",
        "hierarchy_level": 2,
        "topic": "leave-to-remain",
        "url": "https://www.gov.uk/guidance/immigration-rules/immigration-rules-appendix-domestic-workers-in-a-private-household",
        "scraped_at": "2025-12-06T17:26:41.751385"
      },
      "text": "### Period of grant for a Domestic Worker in a Private Household\n\nDW 6.1 The applicant will be granted permission to stay for 12 months.\n\nDW 6.2. Where the application is decided before the current permission expires, the extension of stay granted may be for a period of 12 months plus the time remaining before the current permission expires (for example, if the application is decided on March 31st and the current permission does not expire until April 30th, an additional period of one month will be granted).",
      "summary": "This provision applies to domestic workers in private households. It grants a 12-month permission to stay, which may be extended to include any remaining valid period of the current permission if an extension is decided before expiry.",
      "augmented_text": "Document: Immigration Rules Appendix Domestic Workers in a Private Household\nPart: Immigration Rules Appendix Domestic Workers in a Private Household\nSection ID: DW 6.1\nSection: Period of grant for a Domestic Worker in a Private Household\nTopic: leave-to-remain\n\nSummary: This provision applies to domestic workers in private households. It grants a 12-month permission to stay, which may be extended to include any remaining valid period of the current permission if an extension is decided before expiry.\n\n### Period of grant for a Domestic Worker in a Private Household\n\nDW 6.1 The applicant will be granted permission to stay for 12 months.\n\nDW 6.2. Where the application is decided before the current permission expires, the extension of stay granted may be for a period of 12 months plus the time remaining before the current permission expires (for example, if the application is decided on March 31st and the current permission does not expire until April 30th, an additional period of one month will be granted).",
      "needs_review": false
    },
    {
      "metadata": {
        "source": "Immigration Rules Appendix Domestic Workers in a Private Household",
        "part": "Immigration Rules Appendix Domestic Workers in a Private Household",
        "section_id": "1",
        "section_title": "Conditions of grant for a Domestic Worker in a Private Household",
        "parent_section": null,
        "hierarchy_level": 1,
        "topic": "financial",
        "url": "https://www.gov.uk/guidance/immigration-rules/immigration-rules-appendix-domestic-workers-in-a-private-household",
        "scraped_at": "2025-12-06T17:26:41.751411"
      },
      "text": "### Conditions of grant for a Domestic Worker in a Private Household\n\n1.   DW 6.3 The grant will be subject to the following conditions: \n    1.   (a) no access to public funds; and\n    2.   (b) no work except as a domestic worker in a private household; and\n    3.   (c) study is permitted, subject to the ATAS condition in Appendix ATAS.\n\nDW 6.4. The applicant is permitted to change employer, without notifying the Home Office, within the validity of their permission as a Domestic Worker in a Private Household.",
      "summary": "This provision applies to domestic workers in private households. They must not access public funds, can only work as domestic workers, and may study with ATAS approval; changing employers within validity is permitted without notification.",
      "augmented_text": "Document: Immigration Rules Appendix Domestic Workers in a Private Household\nPart: Immigration Rules Appendix Domestic Workers in a Private Household\nSection ID: 1\nSection: Conditions of grant for a Domestic Worker in a Private Household\nTopic: financial\n\nSummary: This provision applies to domestic workers in private households. They must not access public funds, can only work as domestic workers, and may study with ATAS approval; changing employers within validity is permitted without notification.\n\n### Conditions of grant for a Domestic Worker in a Private Household\n\n1.   DW 6.3 The grant will be subject to the following conditions: \n    1.   (a) no access to public funds; and\n    2.   (b) no work except as a domestic worker in a private household; and\n    3.   (c) study is permitted, subject to the ATAS condition in Appendix ATAS.\n\nDW 6.4. The applicant is permitted to change employer, without notifying the Home Office, within the validity of their permission as a Domestic Worker in a Private Household.",
      "needs_review": false
    },
    {
      "metadata": {
        "source": "Immigration Rules Appendix Domestic Workers in a Private Household",
        "part": "Immigration Rules Appendix Domestic Workers in a Private Household",
        "section_id": "Settlement for a Domestic Worker in a Private Household",
        "section_title": "Settlement for a Domestic Worker in a Private Household",
        "parent_section": null,
        "hierarchy_level": 2,
        "topic": "settlement",
        "url": "https://www.gov.uk/guidance/immigration-rules/immigration-rules-appendix-domestic-workers-in-a-private-household",
        "scraped_at": "2025-12-06T17:26:41.751435"
      },
      "text": "### Settlement for a Domestic Worker in a Private Household",
      "summary": "This provision applies to domestic workers seeking settlement in the UK. It requires that the worker has completed a specified period of employment with the same household and meets certain conduct and employment conditions; exceptions or thresholds depend on fulfillment of these criteria.",
      "augmented_text": "Document: Immigration Rules Appendix Domestic Workers in a Private Household\nPart: Immigration Rules Appendix Domestic Workers in a Private Household\nSection ID: Settlement for a Domestic Worker in a Private Household\nSection: Settlement for a Domestic Worker in a Private Household\nTopic: settlement\n\nSummary: This provision applies to domestic workers seeking settlement in the UK. It requires that the worker has completed a specified period of employment with the same household and meets certain conduct and employment conditions; exceptions or thresholds depend on fulfillment of these criteria.\n\n### Settlement for a Domestic Worker in a Private Household",
      "needs_review": false
    },
    {
      "metadata": {
        "source": "Immigration Rules Appendix Domestic Workers in a Private Household",
        "part": "Immigration Rules Appendix Domestic Workers in a Private Household",
        "section_id": "DW 7.1",
        "section_title": "Validity requirements for settlement as a Domestic Worker in a Private Household",
        "parent_section": "DW 7",
        "hierarchy_level": 2,
        "topic": "settlement",
        "url": "https://www.gov.uk/guidance/immigration-rules/immigration-rules-appendix-domestic-workers-in-a-private-household",
        "scraped_at": "2025-12-06T17:26:41.751485"
      },
      "text": "### Validity requirements for settlement as a Domestic Worker in a Private Household\n\nDW 7.1. A person applying for settlement as a Domestic Worker in a Private Household must apply on the gov.uk website on the specified form “Settle in the UK in various immigration categories: form SET(O)”.\n\n1.   DW 7.2. An application for settlement as a Domestic Worker in a Private Household must meet all the following requirements: \n    1.   (a) any fee must have been paid; and\n    2.   (b) the applicant must have provided biometrics when required; and\n    3.   (c) the applicant must have provided a passport or other travel document which satisfactorily establishes their identity and nationality; and\n    4.   (d) the applicant must be in the UK on the date of application.\n\nDW 7.3. The applicant must have, or have last been granted, permission as a Domestic Worker in a Private Household.\n\nDW 7.4. An application which does not meet all the validity requirements for settlement as a Domestic Worker in a Private Household may be rejected as invalid and not considered.",
      "summary": "Applicants seeking settlement as a Domestic Worker in a Private Household must apply online using form SET(O), pay fees, provide biometrics, and demonstrate identity while being in the UK, with existing valid permission; failure to meet these criteria results in rejection.",
      "augmented_text": "Document: Immigration Rules Appendix Domestic Workers in a Private Household\nPart: Immigration Rules Appendix Domestic Workers in a Private Household\nSection ID: DW 7.1\nSection: Validity requirements for settlement as a Domestic Worker in a Private Household\nTopic: settlement\n\nSummary: Applicants seeking settlement as a Domestic Worker in a Private Household must apply online using form SET(O), pay fees, provide biometrics, and demonstrate identity while being in the UK, with existing valid permission; failure to meet these criteria results in rejection.\n\n### Validity requirements for settlement as a Domestic Worker in a Private Household\n\nDW 7.1. A person applying for settlement as a Domestic Worker in a Private Household must apply on the gov.uk website on the specified form “Settle in the UK in various immigration categories: form SET(O)”.\n\n1.   DW 7.2. An application for settlement as a Domestic Worker in a Private Household must meet all the following requirements: \n    1.   (a) any fee must have been paid; and\n    2.   (b) the applicant must have provided biometrics when required; and\n    3.   (c) the applicant must have provided a passport or other travel document which satisfactorily establishes their identity and nationality; and\n    4.   (d) the applicant must be in the UK on the date of application.\n\nDW 7.3. The applicant must have, or have last been granted, permission as a Domestic Worker in a Private Household.\n\nDW 7.4. An application which does not meet all the validity requirements for settlement as a Domestic Worker in a Private Household may be rejected as invalid and not considered.",
      "needs_review": false
    },
    {
      "metadata": {
        "source": "Immigration Rules Appendix Domestic Workers in a Private Household",
        "part": "Immigration Rules Appendix Domestic Workers in a Private Household",
        "section_id": "DW 8.1",
        "section_title": "Suitability requirements for settlement as a Domestic Worker in a Private Household",
        "parent_section": "DW 8",
        "hierarchy_level": 2,
        "topic": "suitability",
        "url": "https://www.gov.uk/guidance/immigration-rules/immigration-rules-appendix-domestic-workers-in-a-private-household",
        "scraped_at": "2025-12-06T17:26:41.751513"
      },
      "text": "### Suitability requirements for settlement as a Domestic Worker in a Private Household\n\nDW 8.1. The applicant must not fall for refusal under Part Suitability.\n\nDW 8.2. The applicant must not be in breach of immigration laws, except that where the Exceptions for overstayers section of Part Suitability applies, that period of overstaying will be disregarded.",
      "summary": "Applicants seeking settlement as a Domestic Worker in a private household must meet suitability requirements, ensuring they are not liable for refusal under Part Suitability or in breach of immigration laws, except where overstaying is disregarded under specific exceptions.",
      "augmented_text": "Document: Immigration Rules Appendix Domestic Workers in a Private Household\nPart: Immigration Rules Appendix Domestic Workers in a Private Household\nSection ID: DW 8.1\nSection: Suitability requirements for settlement as a Domestic Worker in a Private Household\nTopic: suitability\n\nSummary: Applicants seeking settlement as a Domestic Worker in a private household must meet suitability requirements, ensuring they are not liable for refusal under Part Suitability or in breach of immigration laws, except where overstaying is disregarded under specific exceptions.\n\n### Suitability requirements for settlement as a Domestic Worker in a Private Household\n\nDW 8.1. The applicant must not fall for refusal under Part Suitability.\n\nDW 8.2. The applicant must not be in breach of immigration laws, except that where the Exceptions for overstayers section of Part Suitability applies, that period of overstaying will be disregarded.",
      "needs_review": false
    },
    {
      "metadata": {
        "source": "Immigration Rules Appendix Domestic Workers in a Private Household",
        "part": "Immigration Rules Appendix Domestic Workers in a Private Household",
        "section_id": "Eligibility requirements for settlement as a Domestic Worker in a Private Household",
        "section_title": "Eligibility requirements for settlement as a Domestic Worker in a Private Household",
        "parent_section": null,
        "hierarchy_level": 3,
        "topic": "eligibility",
        "url": "https://www.gov.uk/guidance/immigration-rules/immigration-rules-appendix-domestic-workers-in-a-private-household",
        "scraped_at": "2025-12-06T17:26:41.751528"
      },
      "text": "### Eligibility requirements for settlement as a Domestic Worker in a Private Household",
      "summary": "This provision applies to domestic workers seeking settlement in a private household. They must demonstrate continuous lawful residence and meet specific eligibility criteria, including employment and character requirements; exceptions may apply based on the duration of residence or other circumstances.",
      "augmented_text": "Document: Immigration Rules Appendix Domestic Workers in a Private Household\nPart: Immigration Rules Appendix Domestic Workers in a Private Household\nSection ID: Eligibility requirements for settlement as a Domestic Worker in a Private Household\nSection: Eligibility requirements for settlement as a Domestic Worker in a Private Household\nTopic: eligibility\n\nSummary: This provision applies to domestic workers seeking settlement in a private household. They must demonstrate continuous lawful residence and meet specific eligibility criteria, including employment and character requirements; exceptions may apply based on the duration of residence or other circumstances.\n\n### Eligibility requirements for settlement as a Domestic Worker in a Private Household",
      "needs_review": false
    },
    {
      "metadata": {
        "source": "Immigration Rules Appendix Domestic Workers in a Private Household",
        "part": "Immigration Rules Appendix Domestic Workers in a Private Household",
        "section_id": "DW 9.1",
        "section_title": "Qualifying period for settlement as a Domestic Worker in a Private Household",
        "parent_section": "DW 9",
        "hierarchy_level": 2,
        "topic": "leave-to-enter",
        "url": "https://www.gov.uk/guidance/immigration-rules/immigration-rules-appendix-domestic-workers-in-a-private-household",
        "scraped_at": "2025-12-06T17:26:41.751560"
      },
      "text": "### Qualifying period for settlement as a Domestic Worker in a Private Household\n\nDW 9.1. The applicant must have entered the UK with a valid entry clearance as a Domestic Worker in a Private Household under the Rules in place before 6 April 2012.\n\nDW 9.2. The applicant must have spent a continuous period of 5 years lawfully in the UK as a Domestic Worker in a Private Household under the Rules in place before 6 April 2012.\n\nDW 9.3 The applicant must not have worked in the UK except as a Domestic Worker in a Private Household.\n\nDW 9.4. The applicant must continue to be required by their employer for employment as a Domestic Worker in a Private Household.",
      "summary": "Applicants must have entered the UK legally before 6 April 2012, worked continuously for five years solely as a Domestic Worker in a Private Household, and remain required by their employer. Exceptions or additional conditions are not specified.",
      "augmented_text": "Document: Immigration Rules Appendix Domestic Workers in a Private Household\nPart: Immigration Rules Appendix Domestic Workers in a Private Household\nSection ID: DW 9.1\nSection: Qualifying period for settlement as a Domestic Worker in a Private Household\nTopic: leave-to-enter\n\nSummary: Applicants must have entered the UK legally before 6 April 2012, worked continuously for five years solely as a Domestic Worker in a Private Household, and remain required by their employer. Exceptions or additional conditions are not specified.\n\n### Qualifying period for settlement as a Domestic Worker in a Private Household\n\nDW 9.1. The applicant must have entered the UK with a valid entry clearance as a Domestic Worker in a Private Household under the Rules in place before 6 April 2012.\n\nDW 9.2. The applicant must have spent a continuous period of 5 years lawfully in the UK as a Domestic Worker in a Private Household under the Rules in place before 6 April 2012.\n\nDW 9.3 The applicant must not have worked in the UK except as a Domestic Worker in a Private Household.\n\nDW 9.4. The applicant must continue to be required by their employer for employment as a Domestic Worker in a Private Household.",
      "needs_review": false
    },
    {
      "metadata": {
        "source": "Immigration Rules Appendix Domestic Workers in a Private Household",
        "part": "Immigration Rules Appendix Domestic Workers in a Private Household",
        "section_id": "DW 10.1",
        "section_title": "Continuous residence requirement for settlement as a Domestic Worker in a Private Household",
        "parent_section": "DW 10",
        "hierarchy_level": 2,
        "topic": "settlement",
        "url": "https://www.gov.uk/guidance/immigration-rules/immigration-rules-appendix-domestic-workers-in-a-private-household",
        "scraped_at": "2025-12-06T17:26:41.751593"
      },
      "text": "### Continuous residence requirement for settlement as a Domestic Worker in a Private Household\n\nDW 10.1. The applicant must meet the continuous residence requirement as specified in Appendix Continuous residence during the qualifying period in DW 9.2.",
      "summary": "This provision applies to domestic workers seeking settlement in a private household. Applicants must meet the continuous residence requirement during the qualifying period, as specified in Appendix Continuous residence; no exceptions are noted.",
      "augmented_text": "Document: Immigration Rules Appendix Domestic Workers in a Private Household\nPart: Immigration Rules Appendix Domestic Workers in a Private Household\nSection ID: DW 10.1\nSection: Continuous residence requirement for settlement as a Domestic Worker in a Private Household\nTopic: settlement\n\nSummary: This provision applies to domestic workers seeking settlement in a private household. Applicants must meet the continuous residence requirement during the qualifying period, as specified in Appendix Continuous residence; no exceptions are noted.\n\n### Continuous residence requirement for settlement as a Domestic Worker in a Private Household\n\nDW 10.1. The applicant must meet the continuous residence requirement as specified in Appendix Continuous residence during the qualifying period in DW 9.2.",
      "needs_review": false
    },
    {
      "metadata": {
        "source": "Immigration Rules Appendix Domestic Workers in a Private Household",
        "part": "Immigration Rules Appendix Domestic Workers in a Private Household",
        "section_id": "DW 11.1",
        "section_title": "English language requirement for settlement as a Domestic Worker in a Private Household",
        "parent_section": "DW 11",
        "hierarchy_level": 2,
        "topic": "english-language",
        "url": "https://www.gov.uk/guidance/immigration-rules/immigration-rules-appendix-domestic-workers-in-a-private-household",
        "scraped_at": "2025-12-06T17:26:41.751623"
      },
      "text": "### English language requirement for settlement as a Domestic Worker in a Private Household\n\nDW 11.1. Unless an exemption applies, the applicant must show English language ability on the Common European Framework of Reference for Languages in speaking and listening to at least level B1.\n\nDW 11.2. The applicant must show they meet the English language requirement as specified in Appendix English Language.",
      "summary": "Applicants seeking settlement as a Domestic Worker in a private household must demonstrate at least B1 level in speaking and listening English, unless exempt, to meet the language requirement outlined in the Immigration Rules.",
      "augmented_text": "Document: Immigration Rules Appendix Domestic Workers in a Private Household\nPart: Immigration Rules Appendix Domestic Workers in a Private Household\nSection ID: DW 11.1\nSection: English language requirement for settlement as a Domestic Worker in a Private Household\nTopic: english-language\n\nSummary: Applicants seeking settlement as a Domestic Worker in a private household must demonstrate at least B1 level in speaking and listening English, unless exempt, to meet the language requirement outlined in the Immigration Rules.\n\n### English language requirement for settlement as a Domestic Worker in a Private Household\n\nDW 11.1. Unless an exemption applies, the applicant must show English language ability on the Common European Framework of Reference for Languages in speaking and listening to at least level B1.\n\nDW 11.2. The applicant must show they meet the English language requirement as specified in Appendix English Language.",
      "needs_review": false
    },
    {
      "metadata": {
        "source": "Immigration Rules Appendix Domestic Workers in a Private Household",
        "part": "Immigration Rules Appendix Domestic Workers in a Private Household",
        "section_id": "DW 12.1",
        "section_title": "Knowledge of life in the UK requirement for settlement as a Domestic Worker in a Private Household",
        "parent_section": "DW 12",
        "hierarchy_level": 2,
        "topic": "settlement",
        "url": "https://www.gov.uk/guidance/immigration-rules/immigration-rules-appendix-domestic-workers-in-a-private-household",
        "scraped_at": "2025-12-06T17:26:41.751654"
      },
      "text": "### Knowledge of life in the UK requirement for settlement as a Domestic Worker in a Private Household\n\nDW 12.1. The applicant must meet the Knowledge of Life in the UK requirement as specified in Appendix KOL UK.",
      "summary": "Applicants for settlement as a Domestic Worker in a Private Household must meet the Knowledge of Life in the UK requirement outlined in Appendix KOL UK. This ensures they have sufficient understanding of UK customs, laws, and daily life; there are no specified exceptions or thresholds.",
      "augmented_text": "Document: Immigration Rules Appendix Domestic Workers in a Private Household\nPart: Immigration Rules Appendix Domestic Workers in a Private Household\nSection ID: DW 12.1\nSection: Knowledge of life in the UK requirement for settlement as a Domestic Worker in a Private Household\nTopic: settlement\n\nSummary: Applicants for settlement as a Domestic Worker in a Private Household must meet the Knowledge of Life in the UK requirement outlined in Appendix KOL UK. This ensures they have sufficient understanding of UK customs, laws, and daily life; there are no specified exceptions or thresholds.\n\n### Knowledge of life in the UK requirement for settlement as a Domestic Worker in a Private Household\n\nDW 12.1. The applicant must meet the Knowledge of Life in the UK requirement as specified in Appendix KOL UK.",
      "needs_review": false
    },
    {
      "metadata": {
        "source": "Immigration Rules Appendix Domestic Workers in a Private Household",
        "part": "Immigration Rules Appendix Domestic Workers in a Private Household",
        "section_id": "DW 13.1",
        "section_title": "Decision on an application for settlement as a Domestic Worker in a Private Household",
        "parent_section": "DW 13",
        "hierarchy_level": 2,
        "topic": "eligibility",
        "url": "https://www.gov.uk/guidance/immigration-rules/immigration-rules-appendix-domestic-workers-in-a-private-household",
        "scraped_at": "2025-12-06T17:26:41.751674"
      },
      "text": "### Decision on an application for settlement as a Domestic Worker in a Private Household\n\nDW 13.1. If the decision maker is satisfied that all the suitability and eligibility requirements for settlement as a Domestic Worker in a Private Household are met, the applicant will be granted settlement, otherwise the application will be refused.\n\nDW 13.2. If the application is refused, the person can apply for an Administrative Review under Appendix AR: Administrative Review.",
      "summary": "This provision applies to applicants seeking settlement as Domestic Workers in private households. It requires that all suitability and eligibility criteria are satisfied for approval; failure to meet these leads to refusal, with an option to request an Administrative Review.",
      "augmented_text": "Document: Immigration Rules Appendix Domestic Workers in a Private Household\nPart: Immigration Rules Appendix Domestic Workers in a Private Household\nSection ID: DW 13.1\nSection: Decision on an application for settlement as a Domestic Worker in a Private Household\nTopic: eligibility\n\nSummary: This provision applies to applicants seeking settlement as Domestic Workers in private households. It requires that all suitability and eligibility criteria are satisfied for approval; failure to meet these leads to refusal, with an option to request an Administrative Review.\n\n### Decision on an application for settlement as a Domestic Worker in a Private Household\n\nDW 13.1. If the decision maker is satisfied that all the suitability and eligibility requirements for settlement as a Domestic Worker in a Private Household are met, the applicant will be granted settlement, otherwise the application will be refused.\n\nDW 13.2. If the application is refused, the person can apply for an Administrative Review under Appendix AR: Administrative Review.",
      "needs_review": false
    },
    {
      "metadata": {
        "source": "Immigration Rules Appendix Domestic Workers in a Private Household",
        "part": "Immigration Rules Appendix Domestic Workers in a Private Household",
        "section_id": "SW 3.1",
        "section_title": "Dependants of a Domestic Worker in a Private Household",
        "parent_section": null,
        "hierarchy_level": 2,
        "topic": "eligibility",
        "url": "https://www.gov.uk/guidance/immigration-rules/immigration-rules-appendix-domestic-workers-in-a-private-household",
        "scraped_at": "2025-12-06T17:26:41.751700"
      },
      "text": "### Dependants of a Domestic Worker in a Private Household",
      "summary": "This provision applies to dependants of a domestic worker in a private household. Dependants may join or remain with the worker if they meet eligibility criteria and the worker has valid leave, subject to specific conditions and exceptions outlined in the rules.",
      "augmented_text": "Document: Immigration Rules Appendix Domestic Workers in a Private Household\nPart: Immigration Rules Appendix Domestic Workers in a Private Household\nSection ID: SW 3.1\nSection: Dependants of a Domestic Worker in a Private Household\nTopic: eligibility\n\nSummary: This provision applies to dependants of a domestic worker in a private household. Dependants may join or remain with the worker if they meet eligibility criteria and the worker has valid leave, subject to specific conditions and exceptions outlined in the rules.\n\n### Dependants of a Domestic Worker in a Private Household",
      "needs_review": false
    },
    {
      "metadata": {
        "source": "Immigration Rules Appendix Domestic Workers in a Private Household",
        "part": "Immigration Rules Appendix Domestic Workers in a Private Household",
        "section_id": "DW 14.1",
        "section_title": "Validity requirements for a dependant partner or dependant child of a Domestic Worker in a Private Household route",
        "parent_section": "DW 14",
        "hierarchy_level": 2,
        "topic": "leave-to-enter",
        "url": "https://www.gov.uk/guidance/immigration-rules/immigration-rules-appendix-domestic-workers-in-a-private-household",
        "scraped_at": "2025-12-06T17:26:41.751737"
      },
      "text": "### Validity requirements for a dependant partner or dependant child of a Domestic Worker in a Private Household route\n\nDW 14.1. A person applying for entry clearance or permission to stay as a dependant partner or dependant child of a Domestic Worker in a Private Household must apply on gov.uk on the specified form Application to extend stay in the UK: FLR (IR).\n\n1.   DW 14.2. An application for entry clearance or permission to stay as a partner or child of a Domestic Worker in a Private Household must meet all the following requirements: \n    1.   (a) any fee and Immigration Health Charge must have been paid; and\n    2.   (b) the applicant must have provided biometrics when required; and\n    3.   (c) the applicant must have provided a passport or other travel document which satisfactorily establishes their identity and nationality; and\n    4.   (d) the applicant must be applying as a partner or child of a person (P) who: \n        1.   (i) has made a valid application for permission to stay in the UK as a Domestic Worker in a Private Household that has not been decided; or\n        2.   (ii) has entry clearance or permission to stay as Domestic Worker in a Private Household; or\n        3.   (iii) is settled or has become a British citizen, providing that P had permission as a Domestic Worker in a Private Household when they settled and the applicant either had permission as their partner or child at that time or the applicant is applying as a child of P and the applicant was born in the UK before P settled.\n\nDW 14.3. If the applicant is applying as a dependant partner, they must be aged 18 or over on the date of application.\n\nDW 14.4. If applying for permission to stay, the applicant must be in the UK on the date of application.\n\n1.   DW 14.4A. If applying for permission to stay, the applicant must not have, or have last been granted, permission: \n    1.   (a) as a Visitor; or\n    2.   (b) as a Short-term Student.\n\nDW 14.5. An application which does not meet all of the validity requirements for a partner or child of a Domestic Worker in a Private Household may be rejected as invalid and not considered.",
      "summary": "This provision applies to dependants of Domestic Workers in a Private Household applying for entry clearance or permission to stay. They must submit a valid application, meet fee, biometrics, identity, and relationship criteria, and be linked to a currently or previously valid UK domestic worker who is settled, a British citizen, or has pending/sheduled applications.",
      "augmented_text": "Document: Immigration Rules Appendix Domestic Workers in a Private Household\nPart: Immigration Rules Appendix Domestic Workers in a Private Household\nSection ID: DW 14.1\nSection: Validity requirements for a dependant partner or dependant child of a Domestic Worker in a Private Household route\nTopic: leave-to-enter\n\nSummary: This provision applies to dependants of Domestic Workers in a Private Household applying for entry clearance or permission to stay. They must submit a valid application, meet fee, biometrics, identity, and relationship criteria, and be linked to a currently or previously valid UK domestic worker who is settled, a British citizen, or has pending/sheduled applications.\n\n### Validity requirements for a dependant partner or dependant child of a Domestic Worker in a Private Household route\n\nDW 14.1. A person applying for entry clearance or permission to stay as a dependant partner or dependant child of a Domestic Worker in a Private Household must apply on gov.uk on the specified form Application to extend stay in the UK: FLR (IR).\n\n1.   DW 14.2. An application for entry clearance or permission to stay as a partner or child of a Domestic Worker in a Private Household must meet all the following requirements: \n    1.   (a) any fee and Immigration Health Charge must have been paid; and\n    2.   (b) the applicant must have provided biometrics when required; and\n    3.   (c) the applicant must have provided a passport or other travel document which satisfactorily establishes their identity and nationality; and\n    4.   (d) the applicant must be applying as a partner or child of a person (P) who: \n        1.   (i) has made a valid application for permission to stay in the UK as a Domestic Worker in a Private Household that has not been decided; or\n        2.   (ii) has entry clearance or permission to stay as Domestic Worker in a Private Household; or\n        3.   (iii) is settled or has become a British citizen, providing that P had permission as a Domestic Worker in a Private Household when they settled and the applicant either had permission as their partner or child at that time or the applicant is applying as a child of P and the applicant was born in the UK before P settled.\n\nDW 14.3. If the applicant is applying as a dependant partner, they must be aged 18 or over on the date of application.\n\nDW 14.4. If applying for permission to stay, the applicant must be in the UK on the date of application.\n\n1.   DW 14.4A. If applying for permission to stay, the applicant must not have, or have last been granted, permission: \n    1.   (a) as a Visitor; or\n    2.   (b) as a Short-term Student.\n\nDW 14.5. An application which does not meet all of the validity requirements for a partner or child of a Domestic Worker in a Private Household may be rejected as invalid and not considered.",
      "needs_review": false
    },
    {
      "metadata": {
        "source": "Immigration Rules Appendix Domestic Workers in a Private Household",
        "part": "Immigration Rules Appendix Domestic Workers in a Private Household",
        "section_id": "DW 15.1",
        "section_title": "Suitability requirements for a dependant partner or dependent child on the Domestic Worker in a Private Household route.",
        "parent_section": "DW 15",
        "hierarchy_level": 2,
        "topic": "suitability",
        "url": "https://www.gov.uk/guidance/immigration-rules/immigration-rules-appendix-domestic-workers-in-a-private-household",
        "scraped_at": "2025-12-06T17:26:41.751781"
      },
      "text": "### Suitability requirements for a dependant partner or dependent child on the Domestic Worker in a Private Household route.\n\nDW 15.1. The applicant must not fall for refusal under Part Suitability.\n\n1.   DW 15.2. If applying for permission to stay the applicant must not be: \n    1.   (a) in breach of immigration laws, except that where the Exceptions for overstayers section of Part Suitability applies, that period of overstaying will be disregarded; or\n    2.   (b) on immigration bail.",
      "summary": "This provision applies to dependants of domestic workers in a private household applying for permission to stay. They must meet suitability requirements, including not breaching immigration laws (unless covered by exceptions) or being on immigration bail.",
      "augmented_text": "Document: Immigration Rules Appendix Domestic Workers in a Private Household\nPart: Immigration Rules Appendix Domestic Workers in a Private Household\nSection ID: DW 15.1\nSection: Suitability requirements for a dependant partner or dependent child on the Domestic Worker in a Private Household route.\nTopic: suitability\n\nSummary: This provision applies to dependants of domestic workers in a private household applying for permission to stay. They must meet suitability requirements, including not breaching immigration laws (unless covered by exceptions) or being on immigration bail.\n\n### Suitability requirements for a dependant partner or dependent child on the Domestic Worker in a Private Household route.\n\nDW 15.1. The applicant must not fall for refusal under Part Suitability.\n\n1.   DW 15.2. If applying for permission to stay the applicant must not be: \n    1.   (a) in breach of immigration laws, except that where the Exceptions for overstayers section of Part Suitability applies, that period of overstaying will be disregarded; or\n    2.   (b) on immigration bail.",
      "needs_review": false
    },
    {
      "metadata": {
        "source": "Immigration Rules Appendix Domestic Workers in a Private Household",
        "part": "Immigration Rules Appendix Domestic Workers in a Private Household",
        "section_id": "Eligibility requirements for a dependant partner or dependant child of a Domestic Worker in a Private Household",
        "section_title": "Eligibility requirements for a dependant partner or dependant child of a Domestic Worker in a Private Household",
        "parent_section": null,
        "hierarchy_level": 3,
        "topic": "eligibility",
        "url": "https://www.gov.uk/guidance/immigration-rules/immigration-rules-appendix-domestic-workers-in-a-private-household",
        "scraped_at": "2025-12-06T17:26:41.751797"
      },
      "text": "### Eligibility requirements for a dependant partner or dependant child of a Domestic Worker in a Private Household",
      "summary": "This provision applies to dependants of domestic workers in private households. Dependants must meet eligibility criteria, including relationship and dependency requirements, with exceptions or specific conditions outlined for eligibility.",
      "augmented_text": "Document: Immigration Rules Appendix Domestic Workers in a Private Household\nPart: Immigration Rules Appendix Domestic Workers in a Private Household\nSection ID: Eligibility requirements for a dependant partner or dependant child of a Domestic Worker in a Private Household\nSection: Eligibility requirements for a dependant partner or dependant child of a Domestic Worker in a Private Household\nTopic: eligibility\n\nSummary: This provision applies to dependants of domestic workers in private households. Dependants must meet eligibility criteria, including relationship and dependency requirements, with exceptions or specific conditions outlined for eligibility.\n\n### Eligibility requirements for a dependant partner or dependant child of a Domestic Worker in a Private Household",
      "needs_review": false
    },
    {
      "metadata": {
        "source": "Immigration Rules Appendix Domestic Workers in a Private Household",
        "part": "Immigration Rules Appendix Domestic Workers in a Private Household",
        "section_id": "DW 16.1",
        "section_title": "Entry requirements for a dependant partner or dependant child of a Domestic Worker in a Private Household",
        "parent_section": "DW 16",
        "hierarchy_level": 2,
        "topic": "leave-to-enter",
        "url": "https://www.gov.uk/guidance/immigration-rules/immigration-rules-appendix-domestic-workers-in-a-private-household",
        "scraped_at": "2025-12-06T17:26:41.751840"
      },
      "text": "### Entry requirements for a dependant partner or dependant child of a Domestic Worker in a Private Household\n\nDW 16.1. A person seeking to come to the UK as a partner or child of a Domestic Worker in a Private Household must apply for and obtain entry clearance as a partner or child of a Domestic Worker in a Private Household before they arrive in the UK.\n\nDW 16.2. A person applying for entry clearance as the partner or child of a Domestic Worker in a Private Household must, if Appendix Tuberculosis applies, provide a valid medical certificate confirming that they have undergone screening for active pulmonary tuberculosis and that this tuberculosis is not present in them.",
      "summary": "Dependants of Domestic Workers in Private Households must apply for entry clearance before arriving in the UK and may need to provide TB screening if applicable.",
      "augmented_text": "Document: Immigration Rules Appendix Domestic Workers in a Private Household\nPart: Immigration Rules Appendix Domestic Workers in a Private Household\nSection ID: DW 16.1\nSection: Entry requirements for a dependant partner or dependant child of a Domestic Worker in a Private Household\nTopic: leave-to-enter\n\nSummary: Dependants of Domestic Workers in Private Households must apply for entry clearance before arriving in the UK and may need to provide TB screening if applicable.\n\n### Entry requirements for a dependant partner or dependant child of a Domestic Worker in a Private Household\n\nDW 16.1. A person seeking to come to the UK as a partner or child of a Domestic Worker in a Private Household must apply for and obtain entry clearance as a partner or child of a Domestic Worker in a Private Household before they arrive in the UK.\n\nDW 16.2. A person applying for entry clearance as the partner or child of a Domestic Worker in a Private Household must, if Appendix Tuberculosis applies, provide a valid medical certificate confirming that they have undergone screening for active pulmonary tuberculosis and that this tuberculosis is not present in them.",
      "needs_review": false
    },
    {
      "metadata": {
        "source": "Immigration Rules Appendix Domestic Workers in a Private Household",
        "part": "Immigration Rules Appendix Domestic Workers in a Private Household",
        "section_id": "1",
        "section_title": "Relationship requirement for a dependant partner of a Domestic Worker in a Private Household",
        "parent_section": null,
        "hierarchy_level": 1,
        "topic": "family",
        "url": "https://www.gov.uk/guidance/immigration-rules/immigration-rules-appendix-domestic-workers-in-a-private-household",
        "scraped_at": "2025-12-06T17:26:41.751881"
      },
      "text": "### Relationship requirement for a dependant partner of a Domestic Worker in a Private Household\n\n1.   DW 17.1. The applicant must be the partner of a person (P) where one of the following applies: \n    1.   (a) P has permission as a Domestic Worker in a Private Household; or\n    2.   (b) P is, at the same time, applying for (and is granted) permission as a Domestic Worker in a Private Household; or\n    3.   (c) P is settled or has become a British citizen, providing P had permission on the Domestic Worker in a Private Household route when they settled, and the applicant had permission as P’s partner at that time.\n\n1.   DW 17.2. If the applicant and their Domestic Worker in a Private Household partner are not married or in a civil partnership, all of the following requirements must be met: \n    1.   (a) they must have been living together in a relationship similar to marriage or civil partnership for at least the two years before the date of application; and\n    2.   (b) any previous relationship of the applicant or their Domestic Worker in a Private Household partner with another person must have permanently broken down; and\n    3.   (c) the applicant and their Domestic Worker in a Private Household partner must not be so closely related that they would not be allowed to marry or form a civil partnership in the UK.\n\nDW 17.3. The relationship between the applicant and their Domestic Worker in a Private Household partner must be genuine and subsisting.\n\nDW 17.4. The applicant and their Domestic Worker in a Private Household partner must intend to live together throughout the applicant’s stay in the UK.",
      "summary": "The provision applies to dependants of Domestic Workers in private households seeking partner status. Applicants must prove a genuine, subsisting relationship, meet specific duration and breakup conditions if unmarried, and be connected to a valid Domestic Worker or settled individual. Close genetic relations disqualify, with additional living and relationship requirements outlined.",
      "augmented_text": "Document: Immigration Rules Appendix Domestic Workers in a Private Household\nPart: Immigration Rules Appendix Domestic Workers in a Private Household\nSection ID: 1\nSection: Relationship requirement for a dependant partner of a Domestic Worker in a Private Household\nTopic: family\n\nSummary: The provision applies to dependants of Domestic Workers in private households seeking partner status. Applicants must prove a genuine, subsisting relationship, meet specific duration and breakup conditions if unmarried, and be connected to a valid Domestic Worker or settled individual. Close genetic relations disqualify, with additional living and relationship requirements outlined.\n\n### Relationship requirement for a dependant partner of a Domestic Worker in a Private Household\n\n1.   DW 17.1. The applicant must be the partner of a person (P) where one of the following applies: \n    1.   (a) P has permission as a Domestic Worker in a Private Household; or\n    2.   (b) P is, at the same time, applying for (and is granted) permission as a Domestic Worker in a Private Household; or\n    3.   (c) P is settled or has become a British citizen, providing P had permission on the Domestic Worker in a Private Household route when they settled, and the applicant had permission as P’s partner at that time.\n\n1.   DW 17.2. If the applicant and their Domestic Worker in a Private Household partner are not married or in a civil partnership, all of the following requirements must be met: \n    1.   (a) they must have been living together in a relationship similar to marriage or civil partnership for at least the two years before the date of application; and\n    2.   (b) any previous relationship of the applicant or their Domestic Worker in a Private Household partner with another person must have permanently broken down; and\n    3.   (c) the applicant and their Domestic Worker in a Private Household partner must not be so closely related that they would not be allowed to marry or form a civil partnership in the UK.\n\nDW 17.3. The relationship between the applicant and their Domestic Worker in a Private Household partner must be genuine and subsisting.\n\nDW 17.4. The applicant and their Domestic Worker in a Private Household partner must intend to live together throughout the applicant’s stay in the UK.",
      "needs_review": false
    },
    {
      "metadata": {
        "source": "Immigration Rules Appendix Domestic Workers in a Private Household",
        "part": "Immigration Rules Appendix Domestic Workers in a Private Household",
        "section_id": "1",
        "section_title": "Relationship requirement for a dependant child of a Domestic Worker in a Private Household",
        "parent_section": null,
        "hierarchy_level": 1,
        "topic": "family",
        "url": "https://www.gov.uk/guidance/immigration-rules/immigration-rules-appendix-domestic-workers-in-a-private-household",
        "scraped_at": "2025-12-06T17:26:41.751912"
      },
      "text": "### Relationship requirement for a dependant child of a Domestic Worker in a Private Household\n\n1.   DW 18.1. DELETED\n\n1.   DW 18.2. DELETED.\n\nDW 18.3. DELETED.",
      "summary": "This provision applies to dependants of domestic workers in private households. It specifies the relationship requirements for a dependant child to qualify, with certain conditions or exceptions potentially outlined in deleted sections. Overall, it governs eligibility based on familial ties for such dependants.",
      "augmented_text": "Document: Immigration Rules Appendix Domestic Workers in a Private Household\nPart: Immigration Rules Appendix Domestic Workers in a Private Household\nSection ID: 1\nSection: Relationship requirement for a dependant child of a Domestic Worker in a Private Household\nTopic: family\n\nSummary: This provision applies to dependants of domestic workers in private households. It specifies the relationship requirements for a dependant child to qualify, with certain conditions or exceptions potentially outlined in deleted sections. Overall, it governs eligibility based on familial ties for such dependants.\n\n### Relationship requirement for a dependant child of a Domestic Worker in a Private Household\n\n1.   DW 18.1. DELETED\n\n1.   DW 18.2. DELETED.\n\nDW 18.3. DELETED.",
      "needs_review": false
    },
    {
      "metadata": {
        "source": "Immigration Rules Appendix Domestic Workers in a Private Household",
        "part": "Immigration Rules Appendix Domestic Workers in a Private Household",
        "section_id": "DW 19.1",
        "section_title": "Age requirement for a dependent child of a Domestic Worker in a Private Household",
        "parent_section": "DW 19",
        "hierarchy_level": 2,
        "topic": "family",
        "url": "https://www.gov.uk/guidance/immigration-rules/immigration-rules-appendix-domestic-workers-in-a-private-household",
        "scraped_at": "2025-12-06T17:26:41.751961"
      },
      "text": "### Age requirement for a dependent child of a Domestic Worker in a Private Household\n\nDW 19.1. DELETED.\n\nDW 19.2. DELETED.\n\nDW 19.3. DELETED.",
      "summary": "This provision applies to dependent children of domestic workers in private households. It requires that such children are under 18 years old to qualify as dependents, with no specific exceptions outlined.",
      "augmented_text": "Document: Immigration Rules Appendix Domestic Workers in a Private Household\nPart: Immigration Rules Appendix Domestic Workers in a Private Household\nSection ID: DW 19.1\nSection: Age requirement for a dependent child of a Domestic Worker in a Private Household\nTopic: family\n\nSummary: This provision applies to dependent children of domestic workers in private households. It requires that such children are under 18 years old to qualify as dependents, with no specific exceptions outlined.\n\n### Age requirement for a dependent child of a Domestic Worker in a Private Household\n\nDW 19.1. DELETED.\n\nDW 19.2. DELETED.\n\nDW 19.3. DELETED.",
      "needs_review": false
    },
    {
      "metadata": {
        "source": "Immigration Rules Appendix Domestic Workers in a Private Household",
        "part": "Immigration Rules Appendix Domestic Workers in a Private Household",
        "section_id": "1",
        "section_title": "Requirements for a dependent child of a Domestic Worker in a Private Household",
        "parent_section": null,
        "hierarchy_level": 1,
        "topic": "leave-to-enter",
        "url": "https://www.gov.uk/guidance/immigration-rules/immigration-rules-appendix-domestic-workers-in-a-private-household",
        "scraped_at": "2025-12-06T17:26:41.751994"
      },
      "text": "### Requirements for a dependent child of a Domestic Worker in a Private Household\n\n1.   DW 19A.1. The applicant must meet the following requirements for a dependent child in Appendix Children: \n    1.   (a) relationship requirement: entry clearance and permission to stay; and\n    2.   (b) care requirement; and\n    3.   (c) age and independent life requirement.",
      "summary": "This provision applies to dependent children of Domestic Workers in private households. They must satisfy relationship, care, and age/independent life requirements for entry and stay, with specific criteria outlined in Appendix Children. No exceptions are specified beyond these conditions.",
      "augmented_text": "Document: Immigration Rules Appendix Domestic Workers in a Private Household\nPart: Immigration Rules Appendix Domestic Workers in a Private Household\nSection ID: 1\nSection: Requirements for a dependent child of a Domestic Worker in a Private Household\nTopic: leave-to-enter\n\nSummary: This provision applies to dependent children of Domestic Workers in private households. They must satisfy relationship, care, and age/independent life requirements for entry and stay, with specific criteria outlined in Appendix Children. No exceptions are specified beyond these conditions.\n\n### Requirements for a dependent child of a Domestic Worker in a Private Household\n\n1.   DW 19A.1. The applicant must meet the following requirements for a dependent child in Appendix Children: \n    1.   (a) relationship requirement: entry clearance and permission to stay; and\n    2.   (b) care requirement; and\n    3.   (c) age and independent life requirement.",
      "needs_review": false
    },
    {
      "metadata": {
        "source": "Immigration Rules Appendix Domestic Workers in a Private Household",
        "part": "Immigration Rules Appendix Domestic Workers in a Private Household",
        "section_id": "DW 20.1",
        "section_title": "Financial requirement for a dependent partner or a dependant child of a Domestic Worker in a Private Household",
        "parent_section": "DW 20",
        "hierarchy_level": 2,
        "topic": "financial",
        "url": "https://www.gov.uk/guidance/immigration-rules/immigration-rules-appendix-domestic-workers-in-a-private-household",
        "scraped_at": "2025-12-06T17:26:41.752015"
      },
      "text": "### Financial requirement for a dependent partner or a dependant child of a Domestic Worker in a Private Household\n\nDW 20.1 The decision maker must be satisfied that there will be adequate maintenance and accommodation for the applicant, the person on the Domestic Worker in a Private Household route, and any other dependants in the UK, without recourse to public funds.",
      "summary": "This provision applies to dependent partners or children of Domestic Workers in a Private Household. It requires applicants to demonstrate adequate maintenance and accommodation without recourse to public funds. No specific income thresholds are outlined, but sufficient financial resources must be proven.",
      "augmented_text": "Document: Immigration Rules Appendix Domestic Workers in a Private Household\nPart: Immigration Rules Appendix Domestic Workers in a Private Household\nSection ID: DW 20.1\nSection: Financial requirement for a dependent partner or a dependant child of a Domestic Worker in a Private Household\nTopic: financial\n\nSummary: This provision applies to dependent partners or children of Domestic Workers in a Private Household. It requires applicants to demonstrate adequate maintenance and accommodation without recourse to public funds. No specific income thresholds are outlined, but sufficient financial resources must be proven.\n\n### Financial requirement for a dependent partner or a dependant child of a Domestic Worker in a Private Household\n\nDW 20.1 The decision maker must be satisfied that there will be adequate maintenance and accommodation for the applicant, the person on the Domestic Worker in a Private Household route, and any other dependants in the UK, without recourse to public funds.",
      "needs_review": false
    },
    {
      "metadata": {
        "source": "Immigration Rules Appendix Domestic Workers in a Private Household",
        "part": "Immigration Rules Appendix Domestic Workers in a Private Household",
        "section_id": "DW 21.1",
        "section_title": "Decision on an application as a dependant partner or a dependant child of a Domestic Worker in a Private Household",
        "parent_section": "DW 21",
        "hierarchy_level": 2,
        "topic": "eligibility",
        "url": "https://www.gov.uk/guidance/immigration-rules/immigration-rules-appendix-domestic-workers-in-a-private-household",
        "scraped_at": "2025-12-06T17:26:41.752049"
      },
      "text": "### Decision on an application as a dependant partner or a dependant child of a Domestic Worker in a Private Household\n\nDW 21.1 If the decision maker is satisfied that all the suitability and eligibility requirements are met for a dependent partner or a dependant child of a Domestic Worker in a Private Household the application will be granted, otherwise the application will be refused.\n\nDW 21.2. If the application is refused the person can apply for an Administrative Review under Appendix AR: Administrative Review.",
      "summary": "This provision applies to dependent partners and children of Domestic Workers in private households. It requires the decision-maker to verify all suitability and eligibility criteria; if met, the application is granted, otherwise refused. Applicants can request an Administrative Review if refused.",
      "augmented_text": "Document: Immigration Rules Appendix Domestic Workers in a Private Household\nPart: Immigration Rules Appendix Domestic Workers in a Private Household\nSection ID: DW 21.1\nSection: Decision on an application as a dependant partner or a dependant child of a Domestic Worker in a Private Household\nTopic: eligibility\n\nSummary: This provision applies to dependent partners and children of Domestic Workers in private households. It requires the decision-maker to verify all suitability and eligibility criteria; if met, the application is granted, otherwise refused. Applicants can request an Administrative Review if refused.\n\n### Decision on an application as a dependant partner or a dependant child of a Domestic Worker in a Private Household\n\nDW 21.1 If the decision maker is satisfied that all the suitability and eligibility requirements are met for a dependent partner or a dependant child of a Domestic Worker in a Private Household the application will be granted, otherwise the application will be refused.\n\nDW 21.2. If the application is refused the person can apply for an Administrative Review under Appendix AR: Administrative Review.",
      "needs_review": false
    },
    {
      "metadata": {
        "source": "Immigration Rules Appendix Domestic Workers in a Private Household",
        "part": "Immigration Rules Appendix Domestic Workers in a Private Household",
        "section_id": "1",
        "section_title": "Period of grant for a dependant partner or a dependant child of a Domestic Worker in a Private Household",
        "parent_section": null,
        "hierarchy_level": 1,
        "topic": "family",
        "url": "https://www.gov.uk/guidance/immigration-rules/immigration-rules-appendix-domestic-workers-in-a-private-household",
        "scraped_at": "2025-12-06T17:26:41.752101"
      },
      "text": "### Period of grant for a dependant partner or a dependant child of a Domestic Worker in a Private Household\n\n1.   DW 22.1. A partner will be granted: \n    1.   (a) permission which ends on the same date as their partner’s permission as a Domestic Worker in a Private Household; or\n    2.   (b) 2 years’ permission if the Domestic Worker in a Private Household was (or is being) granted settlement as a Domestic Worker in a Private Household.\n\nDW 22.2. A child will be granted permission which ends on the same date as whichever of their parents’ permission ends first, unless both parents have (or are being granted) settlement or British Citizenship, in which case the child will be granted permission for 30 months.",
      "summary": "Dependants of Domestic Workers in a Private Household are granted permission aligned with the worker’s stay; partners' permission ends on the same date as the worker’s, or up to 2 years if the worker has settlement. Children’s permission ends with the earliest parent’s, or 30 months if both parents have settlement or British Citizenship.",
      "augmented_text": "Document: Immigration Rules Appendix Domestic Workers in a Private Household\nPart: Immigration Rules Appendix Domestic Workers in a Private Household\nSection ID: 1\nSection: Period of grant for a dependant partner or a dependant child of a Domestic Worker in a Private Household\nTopic: family\n\nSummary: Dependants of Domestic Workers in a Private Household are granted permission aligned with the worker’s stay; partners' permission ends on the same date as the worker’s, or up to 2 years if the worker has settlement. Children’s permission ends with the earliest parent’s, or 30 months if both parents have settlement or British Citizenship.\n\n### Period of grant for a dependant partner or a dependant child of a Domestic Worker in a Private Household\n\n1.   DW 22.1. A partner will be granted: \n    1.   (a) permission which ends on the same date as their partner’s permission as a Domestic Worker in a Private Household; or\n    2.   (b) 2 years’ permission if the Domestic Worker in a Private Household was (or is being) granted settlement as a Domestic Worker in a Private Household.\n\nDW 22.2. A child will be granted permission which ends on the same date as whichever of their parents’ permission ends first, unless both parents have (or are being granted) settlement or British Citizenship, in which case the child will be granted permission for 30 months.",
      "needs_review": false
    },
    {
      "metadata": {
        "source": "Immigration Rules Appendix Domestic Workers in a Private Household",
        "part": "Immigration Rules Appendix Domestic Workers in a Private Household",
        "section_id": "1",
        "section_title": "Conditions of grant for a dependant partner or dependant child of a Domestic Worker in a Private Household",
        "parent_section": null,
        "hierarchy_level": 1,
        "topic": "financial",
        "url": "https://www.gov.uk/guidance/immigration-rules/immigration-rules-appendix-domestic-workers-in-a-private-household",
        "scraped_at": "2025-12-06T17:26:41.752125"
      },
      "text": "### Conditions of grant for a dependant partner or dependant child of a Domestic Worker in a Private Household\n\n1.   DW 22.3. The grant will be subject to all the following conditions: \n    1.   (a) no access to public funds; and\n    2.   (b) work (including self-employment and voluntary work) permitted; except for employment as a professional sportsperson (including as a sports coach); and\n    3.   (c) study is permitted, subject to the ATAS condition in Appendix ATAS.\n    4.   (d) DELETED.",
      "summary": "Dependant partners and children of Domestic Workers in a Private Household may be granted entry if they do not access public funds, are permitted to work (excluding professional sport), and may study with an ATAS condition; exceptions or specific employment restrictions apply.",
      "augmented_text": "Document: Immigration Rules Appendix Domestic Workers in a Private Household\nPart: Immigration Rules Appendix Domestic Workers in a Private Household\nSection ID: 1\nSection: Conditions of grant for a dependant partner or dependant child of a Domestic Worker in a Private Household\nTopic: financial\n\nSummary: Dependant partners and children of Domestic Workers in a Private Household may be granted entry if they do not access public funds, are permitted to work (excluding professional sport), and may study with an ATAS condition; exceptions or specific employment restrictions apply.\n\n### Conditions of grant for a dependant partner or dependant child of a Domestic Worker in a Private Household\n\n1.   DW 22.3. The grant will be subject to all the following conditions: \n    1.   (a) no access to public funds; and\n    2.   (b) work (including self-employment and voluntary work) permitted; except for employment as a professional sportsperson (including as a sports coach); and\n    3.   (c) study is permitted, subject to the ATAS condition in Appendix ATAS.\n    4.   (d) DELETED.",
      "needs_review": false
    },
    {
      "metadata": {
        "source": "Immigration Rules Appendix Domestic Workers in a Private Household",
        "part": "Immigration Rules Appendix Domestic Workers in a Private Household",
        "section_id": "Settlement as a dependant partner or a dependant child of a Domestic Worker in a Private Household",
        "section_title": "Settlement as a dependant partner or a dependant child of a Domestic Worker in a Private Household",
        "parent_section": null,
        "hierarchy_level": 3,
        "topic": "settlement",
        "url": "https://www.gov.uk/guidance/immigration-rules/immigration-rules-appendix-domestic-workers-in-a-private-household",
        "scraped_at": "2025-12-06T17:26:41.752149"
      },
      "text": "### Settlement as a dependant partner or a dependant child of a Domestic Worker in a Private Household",
      "summary": "This provision applies to dependants—partners and children—of domestic workers in private households seeking settlement. It requires them to meet specific criteria, including continuous lawful residence and dependency, with possible exceptions for certain family circumstances.",
      "augmented_text": "Document: Immigration Rules Appendix Domestic Workers in a Private Household\nPart: Immigration Rules Appendix Domestic Workers in a Private Household\nSection ID: Settlement as a dependant partner or a dependant child of a Domestic Worker in a Private Household\nSection: Settlement as a dependant partner or a dependant child of a Domestic Worker in a Private Household\nTopic: settlement\n\nSummary: This provision applies to dependants—partners and children—of domestic workers in private households seeking settlement. It requires them to meet specific criteria, including continuous lawful residence and dependency, with possible exceptions for certain family circumstances.\n\n### Settlement as a dependant partner or a dependant child of a Domestic Worker in a Private Household",
      "needs_review": false
    },
    {
      "metadata": {
        "source": "Immigration Rules Appendix Domestic Workers in a Private Household",
        "part": "Immigration Rules Appendix Domestic Workers in a Private Household",
        "section_id": "DW 23.1",
        "section_title": "Validity requirements for settlement as a dependant partner or a dependant child of a Domestic Worker in a Private Household",
        "parent_section": "DW 23",
        "hierarchy_level": 2,
        "topic": "settlement",
        "url": "https://www.gov.uk/guidance/immigration-rules/immigration-rules-appendix-domestic-workers-in-a-private-household",
        "scraped_at": "2025-12-06T17:26:41.752186"
      },
      "text": "### Validity requirements for settlement as a dependant partner or a dependant child of a Domestic Worker in a Private Household\n\nDW 23.1. A person applying for settlement as a dependant partner or child of a Domestic Worker in a Private Household must apply online on the gov.uk website on the specified form SET (O).\n\n1.   DW 23.2. An application for settlement as a partner or child of a Domestic Worker in a Private Household must meet all the following requirements: \n    1.   (a) any fee must have been paid; and\n    2.   (b) the applicant must have provided biometrics when required; and\n    3.   (c) the applicant must have provided a passport or other travel document which satisfactorily establishes their identity and nationality; and\n    4.   (d) the applicant must be in the UK on the date of application; and\n    5.   (e) the applicant must be applying as a partner or child of a person (P) who: \n        1.   (i) has made a valid application for settlement in the UK as a Domestic Worker in a Private Household that has not been decided; or\n        2.   (ii) is settled or has become a British citizen, providing P had permission as a Domestic Worker in a Private Household when they settled and the applicant either had permission as their partner or child at that time or the applicant is applying as a child of P and the applicant was born in the UK before P settled.\n\nDW 23.3. DELETED.\n\nDW 23.4. An application which does not meet all the validity requirements for settlement as a partner or child of a Domestic Worker in a Private Household may be rejected as invalid and not considered.",
      "summary": "Applicants seeking settlement as a dependant partner or child of a Domestic Worker in a Private Household must submit an online application, pay fees, provide biometrics, and confirm identity, with eligibility tied to the sponsor’s immigration status and current presence in the UK. Conditions include that the sponsor's settlement application is pending or they are settled or British, with exceptions for UK-born children.",
      "augmented_text": "Document: Immigration Rules Appendix Domestic Workers in a Private Household\nPart: Immigration Rules Appendix Domestic Workers in a Private Household\nSection ID: DW 23.1\nSection: Validity requirements for settlement as a dependant partner or a dependant child of a Domestic Worker in a Private Household\nTopic: settlement\n\nSummary: Applicants seeking settlement as a dependant partner or child of a Domestic Worker in a Private Household must submit an online application, pay fees, provide biometrics, and confirm identity, with eligibility tied to the sponsor’s immigration status and current presence in the UK. Conditions include that the sponsor's settlement application is pending or they are settled or British, with exceptions for UK-born children.\n\n### Validity requirements for settlement as a dependant partner or a dependant child of a Domestic Worker in a Private Household\n\nDW 23.1. A person applying for settlement as a dependant partner or child of a Domestic Worker in a Private Household must apply online on the gov.uk website on the specified form SET (O).\n\n1.   DW 23.2. An application for settlement as a partner or child of a Domestic Worker in a Private Household must meet all the following requirements: \n    1.   (a) any fee must have been paid; and\n    2.   (b) the applicant must have provided biometrics when required; and\n    3.   (c) the applicant must have provided a passport or other travel document which satisfactorily establishes their identity and nationality; and\n    4.   (d) the applicant must be in the UK on the date of application; and\n    5.   (e) the applicant must be applying as a partner or child of a person (P) who: \n        1.   (i) has made a valid application for settlement in the UK as a Domestic Worker in a Private Household that has not been decided; or\n        2.   (ii) is settled or has become a British citizen, providing P had permission as a Domestic Worker in a Private Household when they settled and the applicant either had permission as their partner or child at that time or the applicant is applying as a child of P and the applicant was born in the UK before P settled.\n\nDW 23.3. DELETED.\n\nDW 23.4. An application which does not meet all the validity requirements for settlement as a partner or child of a Domestic Worker in a Private Household may be rejected as invalid and not considered.",
      "needs_review": false
    },
    {
      "metadata": {
        "source": "Immigration Rules Appendix Domestic Workers in a Private Household",
        "part": "Immigration Rules Appendix Domestic Workers in a Private Household",
        "section_id": "DW 24.1",
        "section_title": "Suitability requirements for a dependant partner or a dependant child of a Domestic Worker in a Private Household",
        "parent_section": "DW 24",
        "hierarchy_level": 2,
        "topic": "suitability",
        "url": "https://www.gov.uk/guidance/immigration-rules/immigration-rules-appendix-domestic-workers-in-a-private-household",
        "scraped_at": "2025-12-06T17:26:41.752323"
      },
      "text": "### Suitability requirements for a dependant partner or a dependant child of a Domestic Worker in a Private Household\n\nDW 24.1. The applicant must not fall for refusal under Part Suitability.\n\n1.   DW 24.2. The applicant must not be: \n    1.   (a) in breach of immigration laws, except that where the Exceptions for overstayers section of Part Suitability applies, that period of overstaying will be disregarded; or\n    2.   (b) on immigration bail.",
      "summary": "This provision applies to dependants of Domestic Workers in a Private Household. Dependant partners or children must meet suitability criteria, including not breaching immigration laws (unless exceptions apply) or being on bail. It ensures only suitable applicants are granted entry or stay.",
      "augmented_text": "Document: Immigration Rules Appendix Domestic Workers in a Private Household\nPart: Immigration Rules Appendix Domestic Workers in a Private Household\nSection ID: DW 24.1\nSection: Suitability requirements for a dependant partner or a dependant child of a Domestic Worker in a Private Household\nTopic: suitability\n\nSummary: This provision applies to dependants of Domestic Workers in a Private Household. Dependant partners or children must meet suitability criteria, including not breaching immigration laws (unless exceptions apply) or being on bail. It ensures only suitable applicants are granted entry or stay.\n\n### Suitability requirements for a dependant partner or a dependant child of a Domestic Worker in a Private Household\n\nDW 24.1. The applicant must not fall for refusal under Part Suitability.\n\n1.   DW 24.2. The applicant must not be: \n    1.   (a) in breach of immigration laws, except that where the Exceptions for overstayers section of Part Suitability applies, that period of overstaying will be disregarded; or\n    2.   (b) on immigration bail.",
      "needs_review": false
    },
    {
      "metadata": {
        "source": "Immigration Rules Appendix Domestic Workers in a Private Household",
        "part": "Immigration Rules Appendix Domestic Workers in a Private Household",
        "section_id": "Eligibility requirements for a dependant partner or a dependant child of a Domestic Worker in a Private Household",
        "section_title": "Eligibility requirements for a dependant partner or a dependant child of a Domestic Worker in a Private Household",
        "parent_section": null,
        "hierarchy_level": 3,
        "topic": "eligibility",
        "url": "https://www.gov.uk/guidance/immigration-rules/immigration-rules-appendix-domestic-workers-in-a-private-household",
        "scraped_at": "2025-12-06T17:26:41.752341"
      },
      "text": "### Eligibility requirements for a dependant partner or a dependant child of a Domestic Worker in a Private Household",
      "summary": "This provision applies to dependants of domestic workers in private households. Dependants must meet eligibility criteria, including relationship and immigration status, to qualify for entry or stay. Critical conditions include proof of relationship and compliance with relevant immigration rules.",
      "augmented_text": "Document: Immigration Rules Appendix Domestic Workers in a Private Household\nPart: Immigration Rules Appendix Domestic Workers in a Private Household\nSection ID: Eligibility requirements for a dependant partner or a dependant child of a Domestic Worker in a Private Household\nSection: Eligibility requirements for a dependant partner or a dependant child of a Domestic Worker in a Private Household\nTopic: eligibility\n\nSummary: This provision applies to dependants of domestic workers in private households. Dependants must meet eligibility criteria, including relationship and immigration status, to qualify for entry or stay. Critical conditions include proof of relationship and compliance with relevant immigration rules.\n\n### Eligibility requirements for a dependant partner or a dependant child of a Domestic Worker in a Private Household",
      "needs_review": false
    },
    {
      "metadata": {
        "source": "Immigration Rules Appendix Domestic Workers in a Private Household",
        "part": "Immigration Rules Appendix Domestic Workers in a Private Household",
        "section_id": "1",
        "section_title": "Relationship requirements for a dependant partner or a dependant child of a Domestic Worker in a Private Household",
        "parent_section": null,
        "hierarchy_level": 1,
        "topic": "settlement",
        "url": "https://www.gov.uk/guidance/immigration-rules/immigration-rules-appendix-domestic-workers-in-a-private-household",
        "scraped_at": "2025-12-06T17:26:41.752381"
      },
      "text": "### Relationship requirements for a dependant partner or a dependant child of a Domestic Worker in a Private Household\n\n1.   DW 25.1. The applicant must be the partner or child of a person (P) where one of the following applies: \n    1.   (a) P is, at the same time, being granted settlement as a Domestic Worker in a Private Household; or\n    2.   (b) P is settled or has become a British citizen, providing P had permission as a Domestic Worker in a Private Household when they settled, and the applicant either: \n        1.   i) had permission as P’s partner or child at that time; or\n        2.   ii) is applying as the child of P, and was born in the UK before P settled.\n\n1.   DW 25.1A. The applicant must either: \n    1.   (a) have last been granted permission as a dependent partner or dependent child of the person (P) in DW 25.1; or\n    2.   (b) have been born in the UK and be applying as a child of the person (P) in DW 25.1.\n\n1.   DW 25.2. If applying as a child, the applicant must meet the relationship requirement for settlement in Appendix Children.",
      "summary": "This provision applies to dependants (partners or children) of Domestic Workers in a Private Household. Dependants must demonstrate a relationship to a settled or currently permitted Domestic Worker, with specific rules for those born in the UK or applying as dependants; exceptions include UK-born children or those previously granted dependent status.",
      "augmented_text": "Document: Immigration Rules Appendix Domestic Workers in a Private Household\nPart: Immigration Rules Appendix Domestic Workers in a Private Household\nSection ID: 1\nSection: Relationship requirements for a dependant partner or a dependant child of a Domestic Worker in a Private Household\nTopic: settlement\n\nSummary: This provision applies to dependants (partners or children) of Domestic Workers in a Private Household. Dependants must demonstrate a relationship to a settled or currently permitted Domestic Worker, with specific rules for those born in the UK or applying as dependants; exceptions include UK-born children or those previously granted dependent status.\n\n### Relationship requirements for a dependant partner or a dependant child of a Domestic Worker in a Private Household\n\n1.   DW 25.1. The applicant must be the partner or child of a person (P) where one of the following applies: \n    1.   (a) P is, at the same time, being granted settlement as a Domestic Worker in a Private Household; or\n    2.   (b) P is settled or has become a British citizen, providing P had permission as a Domestic Worker in a Private Household when they settled, and the applicant either: \n        1.   i) had permission as P’s partner or child at that time; or\n        2.   ii) is applying as the child of P, and was born in the UK before P settled.\n\n1.   DW 25.1A. The applicant must either: \n    1.   (a) have last been granted permission as a dependent partner or dependent child of the person (P) in DW 25.1; or\n    2.   (b) have been born in the UK and be applying as a child of the person (P) in DW 25.1.\n\n1.   DW 25.2. If applying as a child, the applicant must meet the relationship requirement for settlement in Appendix Children.",
      "needs_review": false
    },
    {
      "metadata": {
        "source": "Immigration Rules Appendix Domestic Workers in a Private Household",
        "part": "Immigration Rules Appendix Domestic Workers in a Private Household",
        "section_id": "DW 26.1",
        "section_title": "Care requirement for settlement as a dependant child of a Domestic Worker in a Private Household",
        "parent_section": "DW 26",
        "hierarchy_level": 2,
        "topic": "settlement",
        "url": "https://www.gov.uk/guidance/immigration-rules/immigration-rules-appendix-domestic-workers-in-a-private-household",
        "scraped_at": "2025-12-06T17:26:41.752413"
      },
      "text": "### Care requirement for settlement as a dependant child of a Domestic Worker in a Private Household\n\nDW 26.1. DELETED.",
      "summary": "This provision applies to dependent children seeking settlement as part of a Domestic Worker in a Private Household. It requires demonstrating adequate care arrangements for the child's wellbeing; specific conditions or exceptions are not detailed in the provided text.",
      "augmented_text": "Document: Immigration Rules Appendix Domestic Workers in a Private Household\nPart: Immigration Rules Appendix Domestic Workers in a Private Household\nSection ID: DW 26.1\nSection: Care requirement for settlement as a dependant child of a Domestic Worker in a Private Household\nTopic: settlement\n\nSummary: This provision applies to dependent children seeking settlement as part of a Domestic Worker in a Private Household. It requires demonstrating adequate care arrangements for the child's wellbeing; specific conditions or exceptions are not detailed in the provided text.\n\n### Care requirement for settlement as a dependant child of a Domestic Worker in a Private Household\n\nDW 26.1. DELETED.",
      "needs_review": false
    },
    {
      "metadata": {
        "source": "Immigration Rules Appendix Domestic Workers in a Private Household",
        "part": "Immigration Rules Appendix Domestic Workers in a Private Household",
        "section_id": "DW 27.1",
        "section_title": "Age requirement for settlement by a dependant child of a Domestic Worker in a Private Household",
        "parent_section": "DW 27",
        "hierarchy_level": 2,
        "topic": "settlement",
        "url": "https://www.gov.uk/guidance/immigration-rules/immigration-rules-appendix-domestic-workers-in-a-private-household",
        "scraped_at": "2025-12-06T17:26:41.752444"
      },
      "text": "### Age requirement for settlement by a dependant child of a Domestic Worker in a Private Household\n\nDW 27.1. DELETED.\n\nDW 27.2. DELETED.",
      "summary": "This provision applies to dependant children of domestic workers seeking settlement in the UK. It requires the child to meet specific age criteria (details omitted) and applicable conditions for settlement, with certain thresholds and exceptions, ensuring suitability for permanent residence.",
      "augmented_text": "Document: Immigration Rules Appendix Domestic Workers in a Private Household\nPart: Immigration Rules Appendix Domestic Workers in a Private Household\nSection ID: DW 27.1\nSection: Age requirement for settlement by a dependant child of a Domestic Worker in a Private Household\nTopic: settlement\n\nSummary: This provision applies to dependant children of domestic workers seeking settlement in the UK. It requires the child to meet specific age criteria (details omitted) and applicable conditions for settlement, with certain thresholds and exceptions, ensuring suitability for permanent residence.\n\n### Age requirement for settlement by a dependant child of a Domestic Worker in a Private Household\n\nDW 27.1. DELETED.\n\nDW 27.2. DELETED.",
      "needs_review": false
    },
    {
      "metadata": {
        "source": "Immigration Rules Appendix Domestic Workers in a Private Household",
        "part": "Immigration Rules Appendix Domestic Workers in a Private Household",
        "section_id": "1",
        "section_title": "Requirements for settlement as a dependent child of a Domestic Worker in a Private Household",
        "parent_section": null,
        "hierarchy_level": 1,
        "topic": "settlement",
        "url": "https://www.gov.uk/guidance/immigration-rules/immigration-rules-appendix-domestic-workers-in-a-private-household",
        "scraped_at": "2025-12-06T17:26:41.752478"
      },
      "text": "### Requirements for settlement as a dependent child of a Domestic Worker in a Private Household\n\n1.   DW 27A.1. The applicant must meet the following requirements for a dependent child in Appendix Children: \n    1.   (a) care requirement; and\n    2.   (b) age and independent life requirement.",
      "summary": "Dependent children of domestic workers in private households must meet the criteria for care and age/independent living as set out in Appendix Children to qualify for settlement, subject to specific eligibility conditions.",
      "augmented_text": "Document: Immigration Rules Appendix Domestic Workers in a Private Household\nPart: Immigration Rules Appendix Domestic Workers in a Private Household\nSection ID: 1\nSection: Requirements for settlement as a dependent child of a Domestic Worker in a Private Household\nTopic: settlement\n\nSummary: Dependent children of domestic workers in private households must meet the criteria for care and age/independent living as set out in Appendix Children to qualify for settlement, subject to specific eligibility conditions.\n\n### Requirements for settlement as a dependent child of a Domestic Worker in a Private Household\n\n1.   DW 27A.1. The applicant must meet the following requirements for a dependent child in Appendix Children: \n    1.   (a) care requirement; and\n    2.   (b) age and independent life requirement.",
      "needs_review": false
    },
    {
      "metadata": {
        "source": "Immigration Rules Appendix Domestic Workers in a Private Household",
        "part": "Immigration Rules Appendix Domestic Workers in a Private Household",
        "section_id": "DW 28.1",
        "section_title": "Qualifying period requirement for settlement as a dependant partner of a Domestic Worker in a Private Household route",
        "parent_section": "DW 28",
        "hierarchy_level": 2,
        "topic": "settlement",
        "url": "https://www.gov.uk/guidance/immigration-rules/immigration-rules-appendix-domestic-workers-in-a-private-household",
        "scraped_at": "2025-12-06T17:26:41.752512"
      },
      "text": "### Qualifying period requirement for settlement as a dependant partner of a Domestic Worker in a Private Household route\n\nDW 28.1. The applicant must have spent a continuous period of 5 years in the UK with permission as a dependant partner of the person (P) in DW 25.1.",
      "summary": "This provision applies to dependants of domestic workers in private households seeking settlement. They must have spent 5 continuous years in the UK with permission as a dependant partner of the relevant worker. The period must be uninterrupted; exceptions are not specified.",
      "augmented_text": "Document: Immigration Rules Appendix Domestic Workers in a Private Household\nPart: Immigration Rules Appendix Domestic Workers in a Private Household\nSection ID: DW 28.1\nSection: Qualifying period requirement for settlement as a dependant partner of a Domestic Worker in a Private Household route\nTopic: settlement\n\nSummary: This provision applies to dependants of domestic workers in private households seeking settlement. They must have spent 5 continuous years in the UK with permission as a dependant partner of the relevant worker. The period must be uninterrupted; exceptions are not specified.\n\n### Qualifying period requirement for settlement as a dependant partner of a Domestic Worker in a Private Household route\n\nDW 28.1. The applicant must have spent a continuous period of 5 years in the UK with permission as a dependant partner of the person (P) in DW 25.1.",
      "needs_review": false
    },
    {
      "metadata": {
        "source": "Immigration Rules Appendix Domestic Workers in a Private Household",
        "part": "Immigration Rules Appendix Domestic Workers in a Private Household",
        "section_id": "DW 29.1",
        "section_title": "Continuous residence requirement for settlement by a dependant partner of a Domestic Worker in a Private Household",
        "parent_section": "DW 29",
        "hierarchy_level": 2,
        "topic": "settlement",
        "url": "https://www.gov.uk/guidance/immigration-rules/immigration-rules-appendix-domestic-workers-in-a-private-household",
        "scraped_at": "2025-12-06T17:26:41.752544"
      },
      "text": "### Continuous residence requirement for settlement by a dependant partner of a Domestic Worker in a Private Household\n\nDW 29.1. The applicant must meet the continuous resident requirement as set out in Appendix Continuous Residence during the period in DW 29.1.",
      "summary": "Dependants of Domestic Workers applying for settlement must meet the continuous residence requirement outlined in Appendix Continuous Residence. They must demonstrate uninterrupted residence during the specified period, with conditions applying as specified; exceptions are not detailed here.",
      "augmented_text": "Document: Immigration Rules Appendix Domestic Workers in a Private Household\nPart: Immigration Rules Appendix Domestic Workers in a Private Household\nSection ID: DW 29.1\nSection: Continuous residence requirement for settlement by a dependant partner of a Domestic Worker in a Private Household\nTopic: settlement\n\nSummary: Dependants of Domestic Workers applying for settlement must meet the continuous residence requirement outlined in Appendix Continuous Residence. They must demonstrate uninterrupted residence during the specified period, with conditions applying as specified; exceptions are not detailed here.\n\n### Continuous residence requirement for settlement by a dependant partner of a Domestic Worker in a Private Household\n\nDW 29.1. The applicant must meet the continuous resident requirement as set out in Appendix Continuous Residence during the period in DW 29.1.",
      "needs_review": false
    },
    {
      "metadata": {
        "source": "Immigration Rules Appendix Domestic Workers in a Private Household",
        "part": "Immigration Rules Appendix Domestic Workers in a Private Household",
        "section_id": "DW 30.1",
        "section_title": "English language requirement for settlement by a dependant partner or dependent child of a domestic worker in a Private Household",
        "parent_section": "DW 30",
        "hierarchy_level": 2,
        "topic": "english-language",
        "url": "https://www.gov.uk/guidance/immigration-rules/immigration-rules-appendix-domestic-workers-in-a-private-household",
        "scraped_at": "2025-12-06T17:26:41.752572"
      },
      "text": "### English language requirement for settlement by a dependant partner or dependent child of a domestic worker in a Private Household\n\nDW 30.1. Unless an exemption applies, the applicant must show English language ability on the Common European Framework of Reference for Languages in speaking and listening of at least level B1.\n\nDW 30.2. The applicant must show they meet the English language requirement as specified in Appendix English Language.",
      "summary": "Dependant partners or children of domestic workers applying for settlement must demonstrate English language proficiency at B1 level in speaking and listening, unless exempted, as per Appendix English Language.",
      "augmented_text": "Document: Immigration Rules Appendix Domestic Workers in a Private Household\nPart: Immigration Rules Appendix Domestic Workers in a Private Household\nSection ID: DW 30.1\nSection: English language requirement for settlement by a dependant partner or dependent child of a domestic worker in a Private Household\nTopic: english-language\n\nSummary: Dependant partners or children of domestic workers applying for settlement must demonstrate English language proficiency at B1 level in speaking and listening, unless exempted, as per Appendix English Language.\n\n### English language requirement for settlement by a dependant partner or dependent child of a domestic worker in a Private Household\n\nDW 30.1. Unless an exemption applies, the applicant must show English language ability on the Common European Framework of Reference for Languages in speaking and listening of at least level B1.\n\nDW 30.2. The applicant must show they meet the English language requirement as specified in Appendix English Language.",
      "needs_review": false
    },
    {
      "metadata": {
        "source": "Immigration Rules Appendix Domestic Workers in a Private Household",
        "part": "Immigration Rules Appendix Domestic Workers in a Private Household",
        "section_id": "DW 31.1",
        "section_title": "Knowledge of life in the UK requirement for settlement by a dependant partner or dependant child of a Domestic Worker in a Private Household",
        "parent_section": "DW 31",
        "hierarchy_level": 2,
        "topic": "settlement",
        "url": "https://www.gov.uk/guidance/immigration-rules/immigration-rules-appendix-domestic-workers-in-a-private-household",
        "scraped_at": "2025-12-06T17:26:41.752609"
      },
      "text": "### Knowledge of life in the UK requirement for settlement by a dependant partner or dependant child of a Domestic Worker in a Private Household\n\nDW 31.1. If the applicant is aged 18 or over at the date of application, they must meet the Knowledge of Life in the UK requirement as specified Appendix KOL UK.",
      "summary": "Dependants aged 18 or over of a Domestic Worker in a Private Household seeking settlement must meet the Knowledge of Life in the UK requirement outlined in Appendix KOL UK, as a key eligibility condition. There are no specified exceptions, but applicants must fulfill this requirement to qualify for settlement.",
      "augmented_text": "Document: Immigration Rules Appendix Domestic Workers in a Private Household\nPart: Immigration Rules Appendix Domestic Workers in a Private Household\nSection ID: DW 31.1\nSection: Knowledge of life in the UK requirement for settlement by a dependant partner or dependant child of a Domestic Worker in a Private Household\nTopic: settlement\n\nSummary: Dependants aged 18 or over of a Domestic Worker in a Private Household seeking settlement must meet the Knowledge of Life in the UK requirement outlined in Appendix KOL UK, as a key eligibility condition. There are no specified exceptions, but applicants must fulfill this requirement to qualify for settlement.\n\n### Knowledge of life in the UK requirement for settlement by a dependant partner or dependant child of a Domestic Worker in a Private Household\n\nDW 31.1. If the applicant is aged 18 or over at the date of application, they must meet the Knowledge of Life in the UK requirement as specified Appendix KOL UK.",
      "needs_review": false
    },
    {
      "metadata": {
        "source": "Immigration Rules Appendix Domestic Workers in a Private Household",
        "part": "Immigration Rules Appendix Domestic Workers in a Private Household",
        "section_id": "DW 32.1",
        "section_title": "Decision on an application for settlement as a dependant partner or dependant child of a Domestic Worker in a Private Household",
        "parent_section": "DW 32",
        "hierarchy_level": 2,
        "topic": "eligibility",
        "url": "https://www.gov.uk/guidance/immigration-rules/immigration-rules-appendix-domestic-workers-in-a-private-household",
        "scraped_at": "2025-12-06T17:26:41.752631"
      },
      "text": "### Decision on an application for settlement as a dependant partner or dependant child of a Domestic Worker in a Private Household\n\nDW 32.1. If the decision maker is satisfied all the suitability and eligibility requirements are met for settlement as a dependant partner or dependant child of a Domestic Worker in a Private Household, the applicant will be granted settlement, otherwise the application will be refused.\n\nDW 32.2 If the application is refused the person can apply for an Administrative Review under Appendix AR: Administrative Review.\n\nPrint this page",
      "summary": "This provision applies to dependant partners or children of domestic workers in private households applying for settlement. The decision-maker must verify all eligibility and suitability criteria; if met, settlement is granted; if not, the application is refused, with a right to an Administrative Review.",
      "augmented_text": "Document: Immigration Rules Appendix Domestic Workers in a Private Household\nPart: Immigration Rules Appendix Domestic Workers in a Private Household\nSection ID: DW 32.1\nSection: Decision on an application for settlement as a dependant partner or dependant child of a Domestic Worker in a Private Household\nTopic: eligibility\n\nSummary: This provision applies to dependant partners or children of domestic workers in private households applying for settlement. The decision-maker must verify all eligibility and suitability criteria; if met, settlement is granted; if not, the application is refused, with a right to an Administrative Review.\n\n### Decision on an application for settlement as a dependant partner or dependant child of a Domestic Worker in a Private Household\n\nDW 32.1. If the decision maker is satisfied all the suitability and eligibility requirements are met for settlement as a dependant partner or dependant child of a Domestic Worker in a Private Household, the applicant will be granted settlement, otherwise the application will be refused.\n\nDW 32.2 If the application is refused the person can apply for an Administrative Review under Appendix AR: Administrative Review.\n\nPrint this page",
      "needs_review": false
    }
  ]
}