{
  "url": "https://www.gov.uk/guidance/immigration-rules/immigration-rules-appendix-victim-of-domestic-abuse",
  "part_name": "Immigration Rules Appendix Victim of Domestic Abuse",
  "scraped_at": "2025-12-06T17:29:52.600891",
  "chunk_count": 11,
  "chunks": [
    {
      "metadata": {
        "source": "Immigration Rules Appendix Victim of Domestic Abuse",
        "part": "Immigration Rules Appendix Victim of Domestic Abuse",
        "section_id": "VDA 1.1",
        "section_title": "Validity requirements for the Victim of Domestic Abuse route",
        "parent_section": "VDA 1",
        "hierarchy_level": 2,
        "topic": "leave-to-enter",
        "url": "https://www.gov.uk/guidance/immigration-rules/immigration-rules-appendix-victim-of-domestic-abuse",
        "scraped_at": "2025-12-06T17:29:52.600726"
      },
      "text": "### Validity requirements for the Victim of Domestic Abuse route\n\nVDA 1.1. A person applying from outside the UK on the Victim of Domestic Abuse route must apply for entry clearance online on the gov.uk website on the specified form: “Return to the UK”.\n\n1.   VDA 1.2. A person applying in the UK on the Victim of Domestic Abuse route must apply online on the gov.uk website on one of the specified forms as follows: \n    1.   (a) for the Victim of Domestic Abuse, and a child applying on the Victim of Domestic Abuse route at the same time as their parent and who is included in their parent’s application, form SET (DV); or\n    2.   (b) for a child of a Victim of Domestic Abuse who is not applying at the same time as their parent, form SET (F).\n\n1.   VDA 1.3. An application on the Victim of Domestic Abuse route must meet all of the following validity requirements: \n    1.   (a) any fee must have been paid (unless the applicant has been granted a fee waiver); and\n    2.   (b) the applicant must have provided biometrics when required\n    3.   (c) the applicant must have provided a passport or other document which satisfactorily establishes their identity and nationality.\n\nVDA 1.4. An application which does not meet all the validity requirements for the Victim of Domestic Abuse route may be rejected as invalid and not considered.",
      "summary": "Applicants applying from outside or inside the UK on the Victim of Domestic Abuse route must submit valid online applications with correct forms, pay fees or obtain waivers, provide biometrics, and submit proof of identity. Applications failing to meet these requirements will be rejected as invalid.",
      "augmented_text": "Document: Immigration Rules Appendix Victim of Domestic Abuse\nPart: Immigration Rules Appendix Victim of Domestic Abuse\nSection ID: VDA 1.1\nSection: Validity requirements for the Victim of Domestic Abuse route\nTopic: leave-to-enter\n\nSummary: Applicants applying from outside or inside the UK on the Victim of Domestic Abuse route must submit valid online applications with correct forms, pay fees or obtain waivers, provide biometrics, and submit proof of identity. Applications failing to meet these requirements will be rejected as invalid.\n\n### Validity requirements for the Victim of Domestic Abuse route\n\nVDA 1.1. A person applying from outside the UK on the Victim of Domestic Abuse route must apply for entry clearance online on the gov.uk website on the specified form: “Return to the UK”.\n\n1.   VDA 1.2. A person applying in the UK on the Victim of Domestic Abuse route must apply online on the gov.uk website on one of the specified forms as follows: \n    1.   (a) for the Victim of Domestic Abuse, and a child applying on the Victim of Domestic Abuse route at the same time as their parent and who is included in their parent’s application, form SET (DV); or\n    2.   (b) for a child of a Victim of Domestic Abuse who is not applying at the same time as their parent, form SET (F).\n\n1.   VDA 1.3. An application on the Victim of Domestic Abuse route must meet all of the following validity requirements: \n    1.   (a) any fee must have been paid (unless the applicant has been granted a fee waiver); and\n    2.   (b) the applicant must have provided biometrics when required\n    3.   (c) the applicant must have provided a passport or other document which satisfactorily establishes their identity and nationality.\n\nVDA 1.4. An application which does not meet all the validity requirements for the Victim of Domestic Abuse route may be rejected as invalid and not considered.",
      "needs_review": false
    },
    {
      "metadata": {
        "source": "Immigration Rules Appendix Victim of Domestic Abuse",
        "part": "Immigration Rules Appendix Victim of Domestic Abuse",
        "section_id": "VDA 2.1",
        "section_title": "Suitability requirements for the Victim of Domestic Abuse route",
        "parent_section": "VDA 2",
        "hierarchy_level": 2,
        "topic": "suitability",
        "url": "https://www.gov.uk/guidance/immigration-rules/immigration-rules-appendix-victim-of-domestic-abuse",
        "scraped_at": "2025-12-06T17:29:52.600742"
      },
      "text": "### Suitability requirements for the Victim of Domestic Abuse route\n\nVDA 2.1. The applicant must not fall for refusal under Part Suitability, but SUI 11.4(a) does not apply.",
      "summary": "This provision applies to applicants seeking the Victim of Domestic Abuse route. They must meet suitability criteria, specifically not being refused under Part Suitability, except for SUI 11.4(a). There are no additional conditions or exceptions specified here.",
      "augmented_text": "Document: Immigration Rules Appendix Victim of Domestic Abuse\nPart: Immigration Rules Appendix Victim of Domestic Abuse\nSection ID: VDA 2.1\nSection: Suitability requirements for the Victim of Domestic Abuse route\nTopic: suitability\n\nSummary: This provision applies to applicants seeking the Victim of Domestic Abuse route. They must meet suitability criteria, specifically not being refused under Part Suitability, except for SUI 11.4(a). There are no additional conditions or exceptions specified here.\n\n### Suitability requirements for the Victim of Domestic Abuse route\n\nVDA 2.1. The applicant must not fall for refusal under Part Suitability, but SUI 11.4(a) does not apply.",
      "needs_review": false
    },
    {
      "metadata": {
        "source": "Immigration Rules Appendix Victim of Domestic Abuse",
        "part": "Immigration Rules Appendix Victim of Domestic Abuse",
        "section_id": "Eligibility requirements for Victim of Domestic Abuse Route",
        "section_title": "Eligibility requirements for Victim of Domestic Abuse Route",
        "parent_section": null,
        "hierarchy_level": 2,
        "topic": "eligibility",
        "url": "https://www.gov.uk/guidance/immigration-rules/immigration-rules-appendix-victim-of-domestic-abuse",
        "scraped_at": "2025-12-06T17:29:52.600749"
      },
      "text": "### Eligibility requirements for Victim of Domestic Abuse Route",
      "summary": "The Victim of Domestic Abuse Route applies to individuals experiencing domestic abuse seeking immigration protection. Applicants must demonstrate credible evidence of abuse and meet specific eligibility criteria, with exceptions only in limited circumstances as outlined in the rules.",
      "augmented_text": "Document: Immigration Rules Appendix Victim of Domestic Abuse\nPart: Immigration Rules Appendix Victim of Domestic Abuse\nSection ID: Eligibility requirements for Victim of Domestic Abuse Route\nSection: Eligibility requirements for Victim of Domestic Abuse Route\nTopic: eligibility\n\nSummary: The Victim of Domestic Abuse Route applies to individuals experiencing domestic abuse seeking immigration protection. Applicants must demonstrate credible evidence of abuse and meet specific eligibility criteria, with exceptions only in limited circumstances as outlined in the rules.\n\n### Eligibility requirements for Victim of Domestic Abuse Route",
      "needs_review": false
    },
    {
      "metadata": {
        "source": "Immigration Rules Appendix Victim of Domestic Abuse",
        "part": "Immigration Rules Appendix Victim of Domestic Abuse",
        "section_id": "VDA 3.1",
        "section_title": "Entry requirements for the Victim of Domestic Abuse route",
        "parent_section": "VDA 3",
        "hierarchy_level": 2,
        "topic": "leave-to-enter",
        "url": "https://www.gov.uk/guidance/immigration-rules/immigration-rules-appendix-victim-of-domestic-abuse",
        "scraped_at": "2025-12-06T17:29:52.600766"
      },
      "text": "### Entry requirements for the Victim of Domestic Abuse route\n\nVDA 3.1 Where a person is outside the UK they must apply for and obtain entry clearance on the Victim of Domestic Abuse route before they arrive in the UK.\n\nVDA 3.2. Where a person is applying for entry clearance on the Victim of Domestic Abuse route they must, if Appendix Tuberculosis applies, provide a valid medical certificate confirming that they have undergone screening for active pulmonary tuberculosis and that this tuberculosis is not present in them.",
      "summary": "Applicants seeking entry via the Victim of Domestic Abuse route must obtain prior entry clearance before arrival. If applicable, they must also provide a medical certificate confirming they have undergone TB screening and do not have active pulmonary tuberculosis.",
      "augmented_text": "Document: Immigration Rules Appendix Victim of Domestic Abuse\nPart: Immigration Rules Appendix Victim of Domestic Abuse\nSection ID: VDA 3.1\nSection: Entry requirements for the Victim of Domestic Abuse route\nTopic: leave-to-enter\n\nSummary: Applicants seeking entry via the Victim of Domestic Abuse route must obtain prior entry clearance before arrival. If applicable, they must also provide a medical certificate confirming they have undergone TB screening and do not have active pulmonary tuberculosis.\n\n### Entry requirements for the Victim of Domestic Abuse route\n\nVDA 3.1 Where a person is outside the UK they must apply for and obtain entry clearance on the Victim of Domestic Abuse route before they arrive in the UK.\n\nVDA 3.2. Where a person is applying for entry clearance on the Victim of Domestic Abuse route they must, if Appendix Tuberculosis applies, provide a valid medical certificate confirming that they have undergone screening for active pulmonary tuberculosis and that this tuberculosis is not present in them.",
      "needs_review": false
    },
    {
      "metadata": {
        "source": "Immigration Rules Appendix Victim of Domestic Abuse",
        "part": "Immigration Rules Appendix Victim of Domestic Abuse",
        "section_id": "1",
        "section_title": "Relationship requirements for a Victim of Domestic Abuse",
        "parent_section": null,
        "hierarchy_level": 1,
        "topic": "family",
        "url": "https://www.gov.uk/guidance/immigration-rules/immigration-rules-appendix-victim-of-domestic-abuse",
        "scraped_at": "2025-12-06T17:29:52.600787"
      },
      "text": "### Relationship requirements for a Victim of Domestic Abuse\n\n1.   VDA 4.1. The applicant must have, or have last been granted, permission as one of the following: \n    1.   (a) a partner under Appendix FM (except for permission as a fiancé(e) or proposed civil partner) of a person who is a British citizen, settled in the UK or an EEA national in the UK with limited leave to enter or remain granted under paragraph EU3 of Appendix EU on the basis of meeting condition 1 in paragraph EU14 of Appendix EU; or\n    2.   (aa) a spouse, civil partner or durable partner under Appendix EU with limited leave to enter or remain as a family member of a relevant EEA citizen (or of a qualifying British citizen), as a joining family member of a relevant sponsor or as a family member who has retained the right of residence, granted under paragraph EU3 or EU3A of that Appendix; or\n    3.   (b) a partner under Appendix FM, Part 8, Part 11, or Appendix Family Reunion (Protection) of a person with permission as a refugee; or\n    4.   (c) a spouse, civil partner, unmarried or same sex partner under paragraph 282(a), 282(c), 285, 295B(a), 295B(c) or 295E of Part 8 of a person present and settled in the UK a victim of domestic abuse under Appendix FM or Part 8; or\n    5.   (d) a victim of domestic abuse under Appendix FM; or\n    6.   (e) a partner under Appendix Armed Forces or Part 7 (except for permission as a fiancé(e) or proposed civil partner), of any of the below: \n        1.   (i) a person who is a British citizen; or\n        2.   (ii) a foreign and commonwealth citizen with at least 4 years’ reckonable service in HM Forces at the date of application under this paragraph or;\n        3.   (iii) a member of HM Armed forces who has applied for or been granted permission or settlement as a foreign and commonwealth citizen discharged from HM Armed Forces; or\n\n    7.   (f) leave outside the rules granted under the Migrant Victims of Domestic Abuse Concession (formerly the Destitution Domestic Violence Concession (DDVC)), and before that were last granted permission under one of the categories defined in VDA 4.1(a) to (e).\n\nVDA 4.2. The relationship between the applicant and their partner must have broken down permanently as a result of domestic abuse.\n\nVDA 4.3. If the applicant is applying from outside the UK, they must have been abandoned outside the UK.",
      "summary": "This provision applies to applicants who are victims of domestic abuse seeking immigration relief. They must have held specific immigration permission, such as as a partner, spouse, or family member under UK or EU rules, with certain exceptions (e.g., fiancé(e) or proposed civil partner). Critical conditions include last holding or currently holding valid permission based on relationships with UK or EEA nationals, refugees, or armed forces members.",
      "augmented_text": "Document: Immigration Rules Appendix Victim of Domestic Abuse\nPart: Immigration Rules Appendix Victim of Domestic Abuse\nSection ID: 1\nSection: Relationship requirements for a Victim of Domestic Abuse\nTopic: family\n\nSummary: This provision applies to applicants who are victims of domestic abuse seeking immigration relief. They must have held specific immigration permission, such as as a partner, spouse, or family member under UK or EU rules, with certain exceptions (e.g., fiancé(e) or proposed civil partner). Critical conditions include last holding or currently holding valid permission based on relationships with UK or EEA nationals, refugees, or armed forces members.\n\n### Relationship requirements for a Victim of Domestic Abuse\n\n1.   VDA 4.1. The applicant must have, or have last been granted, permission as one of the following: \n    1.   (a) a partner under Appendix FM (except for permission as a fiancé(e) or proposed civil partner) of a person who is a British citizen, settled in the UK or an EEA national in the UK with limited leave to enter or remain granted under paragraph EU3 of Appendix EU on the basis of meeting condition 1 in paragraph EU14 of Appendix EU; or\n    2.   (aa) a spouse, civil partner or durable partner under Appendix EU with limited leave to enter or remain as a family member of a relevant EEA citizen (or of a qualifying British citizen), as a joining family member of a relevant sponsor or as a family member who has retained the right of residence, granted under paragraph EU3 or EU3A of that Appendix; or\n    3.   (b) a partner under Appendix FM, Part 8, Part 11, or Appendix Family Reunion (Protection) of a person with permission as a refugee; or\n    4.   (c) a spouse, civil partner, unmarried or same sex partner under paragraph 282(a), 282(c), 285, 295B(a), 295B(c) or 295E of Part 8 of a person present and settled in the UK a victim of domestic abuse under Appendix FM or Part 8; or\n    5.   (d) a victim of domestic abuse under Appendix FM; or\n    6.   (e) a partner under Appendix Armed Forces or Part 7 (except for permission as a fiancé(e) or proposed civil partner), of any of the below: \n        1.   (i) a person who is a British citizen; or\n        2.   (ii) a foreign and commonwealth citizen with at least 4 years’ reckonable service in HM Forces at the date of application under this paragraph or;\n        3.   (iii) a member of HM Armed forces who has applied for or been granted permission or settlement as a foreign and commonwealth citizen discharged from HM Armed Forces; or\n\n    7.   (f) leave outside the rules granted under the Migrant Victims of Domestic Abuse Concession (formerly the Destitution Domestic Violence Concession (DDVC)), and before that were last granted permission under one of the categories defined in VDA 4.1(a) to (e).\n\nVDA 4.2. The relationship between the applicant and their partner must have broken down permanently as a result of domestic abuse.\n\nVDA 4.3. If the applicant is applying from outside the UK, they must have been abandoned outside the UK.",
      "needs_review": false
    },
    {
      "metadata": {
        "source": "Immigration Rules Appendix Victim of Domestic Abuse",
        "part": "Immigration Rules Appendix Victim of Domestic Abuse",
        "section_id": "1",
        "section_title": "Requirements for a child of a Victim of Domestic Abuse",
        "parent_section": null,
        "hierarchy_level": 1,
        "topic": "settlement",
        "url": "https://www.gov.uk/guidance/immigration-rules/immigration-rules-appendix-victim-of-domestic-abuse",
        "scraped_at": "2025-12-06T17:29:52.600802"
      },
      "text": "### Requirements for a child of a Victim of Domestic Abuse\n\n1.   VDA 5.1. The applicant must meet the following requirements for a dependent child in Appendix Children: \n    1.   (a) relationship requirement for settlement; and\n    2.   (b) care requirement; and\n    3.   (c) age and independent life requirement.",
      "summary": "This provision applies to dependent children of victims of domestic abuse seeking settlement. They must meet relationship, care, and age/independent life requirements outlined in Appendix Children. Critical conditions include demonstrating appropriate dependency and suitability for settlement.",
      "augmented_text": "Document: Immigration Rules Appendix Victim of Domestic Abuse\nPart: Immigration Rules Appendix Victim of Domestic Abuse\nSection ID: 1\nSection: Requirements for a child of a Victim of Domestic Abuse\nTopic: settlement\n\nSummary: This provision applies to dependent children of victims of domestic abuse seeking settlement. They must meet relationship, care, and age/independent life requirements outlined in Appendix Children. Critical conditions include demonstrating appropriate dependency and suitability for settlement.\n\n### Requirements for a child of a Victim of Domestic Abuse\n\n1.   VDA 5.1. The applicant must meet the following requirements for a dependent child in Appendix Children: \n    1.   (a) relationship requirement for settlement; and\n    2.   (b) care requirement; and\n    3.   (c) age and independent life requirement.",
      "needs_review": false
    },
    {
      "metadata": {
        "source": "Immigration Rules Appendix Victim of Domestic Abuse",
        "part": "Immigration Rules Appendix Victim of Domestic Abuse",
        "section_id": "VDA 6.1",
        "section_title": "English language requirements for a child of a Victim of Domestic Abuse",
        "parent_section": "VDA 6",
        "hierarchy_level": 2,
        "topic": "english-language",
        "url": "https://www.gov.uk/guidance/immigration-rules/immigration-rules-appendix-victim-of-domestic-abuse",
        "scraped_at": "2025-12-06T17:29:52.600812"
      },
      "text": "### English language requirements for a child of a Victim of Domestic Abuse\n\nVDA 6.1. If the applicant is applying as a child of a victim of domestic abuse and is aged over 18, the applicant must show English language ability on the Common European Framework of Reference for Languages in speaking and listening of at least level B1.\n\nVDA 6.2. The applicant must show they meet the English language requirement or that an exemption applies, as specified in Appendix English Language.",
      "summary": "Applicants over 18 applying as children of a victim of domestic abuse must demonstrate at least B1 level in speaking and listening English, unless an exemption in Appendix English Language applies.",
      "augmented_text": "Document: Immigration Rules Appendix Victim of Domestic Abuse\nPart: Immigration Rules Appendix Victim of Domestic Abuse\nSection ID: VDA 6.1\nSection: English language requirements for a child of a Victim of Domestic Abuse\nTopic: english-language\n\nSummary: Applicants over 18 applying as children of a victim of domestic abuse must demonstrate at least B1 level in speaking and listening English, unless an exemption in Appendix English Language applies.\n\n### English language requirements for a child of a Victim of Domestic Abuse\n\nVDA 6.1. If the applicant is applying as a child of a victim of domestic abuse and is aged over 18, the applicant must show English language ability on the Common European Framework of Reference for Languages in speaking and listening of at least level B1.\n\nVDA 6.2. The applicant must show they meet the English language requirement or that an exemption applies, as specified in Appendix English Language.",
      "needs_review": false
    },
    {
      "metadata": {
        "source": "Immigration Rules Appendix Victim of Domestic Abuse",
        "part": "Immigration Rules Appendix Victim of Domestic Abuse",
        "section_id": "VDA 7.1",
        "section_title": "Knowledge of life in the UK requirements for a child of a Victim of Domestic Abuse",
        "parent_section": "VDA 7",
        "hierarchy_level": 2,
        "topic": "family",
        "url": "https://www.gov.uk/guidance/immigration-rules/immigration-rules-appendix-victim-of-domestic-abuse",
        "scraped_at": "2025-12-06T17:29:52.600828"
      },
      "text": "### Knowledge of life in the UK requirements for a child of a Victim of Domestic Abuse\n\nVDA 7.1. The applicant must meet the Knowledge of Life in the UK requirement, or an exemption must apply, as set out in Appendix KOL UK.",
      "summary": "This provision applies to children of victims of domestic abuse applying under the UK Immigration Rules. They must meet the Knowledge of Life in the UK requirement, unless exempted under Appendix KOL UK. No alternative thresholds are specified beyond exemptions.",
      "augmented_text": "Document: Immigration Rules Appendix Victim of Domestic Abuse\nPart: Immigration Rules Appendix Victim of Domestic Abuse\nSection ID: VDA 7.1\nSection: Knowledge of life in the UK requirements for a child of a Victim of Domestic Abuse\nTopic: family\n\nSummary: This provision applies to children of victims of domestic abuse applying under the UK Immigration Rules. They must meet the Knowledge of Life in the UK requirement, unless exempted under Appendix KOL UK. No alternative thresholds are specified beyond exemptions.\n\n### Knowledge of life in the UK requirements for a child of a Victim of Domestic Abuse\n\nVDA 7.1. The applicant must meet the Knowledge of Life in the UK requirement, or an exemption must apply, as set out in Appendix KOL UK.",
      "needs_review": false
    },
    {
      "metadata": {
        "source": "Immigration Rules Appendix Victim of Domestic Abuse",
        "part": "Immigration Rules Appendix Victim of Domestic Abuse",
        "section_id": "VDA 8.1",
        "section_title": "Maintenance and Accommodation requirements for a child of a Victim of Domestic Abuse",
        "parent_section": "VDA 8",
        "hierarchy_level": 2,
        "topic": "financial",
        "url": "https://www.gov.uk/guidance/immigration-rules/immigration-rules-appendix-victim-of-domestic-abuse",
        "scraped_at": "2025-12-06T17:29:52.600837"
      },
      "text": "### Maintenance and Accommodation requirements for a child of a Victim of Domestic Abuse\n\nVDA 8.1 Where the applicant is applying as a child, the decision maker must be satisfied that there will be adequate maintenance and accommodation for the applicant without recourse to public funds.\n\nVDA 8.2 Funds must be shown as specified in Appendix FM-SE.",
      "summary": "Applicants applying as children of a Victim of Domestic Abuse must demonstrate adequate maintenance and accommodation without recourse to public funds, using funds specified in Appendix FM-SE.",
      "augmented_text": "Document: Immigration Rules Appendix Victim of Domestic Abuse\nPart: Immigration Rules Appendix Victim of Domestic Abuse\nSection ID: VDA 8.1\nSection: Maintenance and Accommodation requirements for a child of a Victim of Domestic Abuse\nTopic: financial\n\nSummary: Applicants applying as children of a Victim of Domestic Abuse must demonstrate adequate maintenance and accommodation without recourse to public funds, using funds specified in Appendix FM-SE.\n\n### Maintenance and Accommodation requirements for a child of a Victim of Domestic Abuse\n\nVDA 8.1 Where the applicant is applying as a child, the decision maker must be satisfied that there will be adequate maintenance and accommodation for the applicant without recourse to public funds.\n\nVDA 8.2 Funds must be shown as specified in Appendix FM-SE.",
      "needs_review": false
    },
    {
      "metadata": {
        "source": "Immigration Rules Appendix Victim of Domestic Abuse",
        "part": "Immigration Rules Appendix Victim of Domestic Abuse",
        "section_id": "VDA 9.1",
        "section_title": "Decision on an application for settlement on the Victim of Domestic Abuse route",
        "parent_section": "VDA 9",
        "hierarchy_level": 2,
        "topic": "eligibility",
        "url": "https://www.gov.uk/guidance/immigration-rules/immigration-rules-appendix-victim-of-domestic-abuse",
        "scraped_at": "2025-12-06T17:29:52.600844"
      },
      "text": "### Decision on an application for settlement on the Victim of Domestic Abuse route\n\nVDA 9.1. If the decision maker is satisfied that all the suitability and eligibility requirements for entry clearance or settlement on the Victim of Domestic Abuse route are met, the application will be granted, otherwise the application will be refused.\n\nVDA 9.2. If the application is refused, the person can apply for an Administrative Review under Appendix AR: Administrative Review.",
      "summary": "Applicants seeking settlement under the Victim of Domestic Abuse route must meet all suitability and eligibility criteria; if so, their application will be granted. If refused, they have the right to request an Administrative Review.",
      "augmented_text": "Document: Immigration Rules Appendix Victim of Domestic Abuse\nPart: Immigration Rules Appendix Victim of Domestic Abuse\nSection ID: VDA 9.1\nSection: Decision on an application for settlement on the Victim of Domestic Abuse route\nTopic: eligibility\n\nSummary: Applicants seeking settlement under the Victim of Domestic Abuse route must meet all suitability and eligibility criteria; if so, their application will be granted. If refused, they have the right to request an Administrative Review.\n\n### Decision on an application for settlement on the Victim of Domestic Abuse route\n\nVDA 9.1. If the decision maker is satisfied that all the suitability and eligibility requirements for entry clearance or settlement on the Victim of Domestic Abuse route are met, the application will be granted, otherwise the application will be refused.\n\nVDA 9.2. If the application is refused, the person can apply for an Administrative Review under Appendix AR: Administrative Review.",
      "needs_review": false
    },
    {
      "metadata": {
        "source": "Immigration Rules Appendix Victim of Domestic Abuse",
        "part": "Immigration Rules Appendix Victim of Domestic Abuse",
        "section_id": "VDA 10.1",
        "section_title": "Period and conditions of grant on the Victim of Domestic Abuse route",
        "parent_section": "VDA 10",
        "hierarchy_level": 2,
        "topic": "leave-to-enter",
        "url": "https://www.gov.uk/guidance/immigration-rules/immigration-rules-appendix-victim-of-domestic-abuse",
        "scraped_at": "2025-12-06T17:29:52.600858"
      },
      "text": "### Period and conditions of grant on the Victim of Domestic Abuse route\n\nVDA 10.1. Where the applicant is outside the UK and the requirements for entry clearance are met, they will be granted entry clearance for settlement.\n\nVDA 10.2. Where the applicant is in the UK and the requirements for settlement are met, they will be granted settlement.\n\nPrint this page",
      "summary": "This provision applies to applicants under the Victim of Domestic Abuse route. It grants entry clearance for settlement if outside the UK or settlement if inside and the application meets the specified requirements. Conditions include meeting the entry or settlement criteria; no exceptions are specified.",
      "augmented_text": "Document: Immigration Rules Appendix Victim of Domestic Abuse\nPart: Immigration Rules Appendix Victim of Domestic Abuse\nSection ID: VDA 10.1\nSection: Period and conditions of grant on the Victim of Domestic Abuse route\nTopic: leave-to-enter\n\nSummary: This provision applies to applicants under the Victim of Domestic Abuse route. It grants entry clearance for settlement if outside the UK or settlement if inside and the application meets the specified requirements. Conditions include meeting the entry or settlement criteria; no exceptions are specified.\n\n### Period and conditions of grant on the Victim of Domestic Abuse route\n\nVDA 10.1. Where the applicant is outside the UK and the requirements for entry clearance are met, they will be granted entry clearance for settlement.\n\nVDA 10.2. Where the applicant is in the UK and the requirements for settlement are met, they will be granted settlement.\n\nPrint this page",
      "needs_review": false
    }
  ]
}