{
  "url": "https://www.gov.uk/guidance/immigration-rules/immigration-rules-appendix-global-talent",
  "part_name": "Immigration Rules Appendix Global Talent",
  "scraped_at": "2025-12-06T17:27:23.901459",
  "chunk_count": 71,
  "chunks": [
    {
      "metadata": {
        "source": "Immigration Rules Appendix Global Talent",
        "part": "Immigration Rules Appendix Global Talent",
        "section_id": "Part 1",
        "section_title": "Global Talent Endorsement application",
        "parent_section": null,
        "hierarchy_level": 2,
        "topic": "application",
        "url": "https://www.gov.uk/guidance/immigration-rules/immigration-rules-appendix-global-talent",
        "scraped_at": "2025-12-06T17:27:23.899725"
      },
      "text": "### Part 1- Global Talent Endorsement application",
      "summary": "This provision applies to applicants seeking a Global Talent endorsement. It requires them to demonstrate they meet the specified criteria and obtain an endorsement from a designated competent body. Critical conditions include submitting sufficient evidence and fulfilling any eligibility thresholds set by the endorsing authority.",
      "augmented_text": "Document: Immigration Rules Appendix Global Talent\nPart: Immigration Rules Appendix Global Talent\nSection ID: Part 1\nSection: Global Talent Endorsement application\nTopic: application\n\nSummary: This provision applies to applicants seeking a Global Talent endorsement. It requires them to demonstrate they meet the specified criteria and obtain an endorsement from a designated competent body. Critical conditions include submitting sufficient evidence and fulfilling any eligibility thresholds set by the endorsing authority.\n\n### Part 1- Global Talent Endorsement application",
      "needs_review": false
    },
    {
      "metadata": {
        "source": "Immigration Rules Appendix Global Talent",
        "part": "Immigration Rules Appendix Global Talent",
        "section_id": "GTE 1.1",
        "section_title": "Validity requirements for a Global Talent Endorsement application",
        "parent_section": null,
        "hierarchy_level": 1,
        "topic": "eligibility",
        "url": "https://www.gov.uk/guidance/immigration-rules/immigration-rules-appendix-global-talent",
        "scraped_at": "2025-12-06T17:27:23.899758"
      },
      "text": "### Validity requirements for a Global Talent Endorsement application\n\n1.   GTE 1.1. A person applying for Global Talent endorsement must apply online on the gov.uk website on the specified form “Apply for Global Talent endorsement - stage 1.\n2.   GTE 1.2. An application for Global Talent endorsement must meet both the following requirements: \n    1.   (a) the endorsement application fee must have been paid; and\n    2.   (b) the application must be for endorsement by an endorsing body in the field relevant to the applicant.\n\n3.   GTE 1.3. An application which does not meet all the validity requirements for a Global Talent endorsement may be rejected as invalid and not considered.",
      "summary": "Applicants for a Global Talent endorsement must apply online, pay the endorsement fee, and ensure the endorsement aligns with their field. Applications failing these validity criteria may be rejected without consideration.",
      "augmented_text": "Document: Immigration Rules Appendix Global Talent\nPart: Immigration Rules Appendix Global Talent\nSection ID: GTE 1.1\nSection: Validity requirements for a Global Talent Endorsement application\nTopic: eligibility\n\nSummary: Applicants for a Global Talent endorsement must apply online, pay the endorsement fee, and ensure the endorsement aligns with their field. Applications failing these validity criteria may be rejected without consideration.\n\n### Validity requirements for a Global Talent Endorsement application\n\n1.   GTE 1.1. A person applying for Global Talent endorsement must apply online on the gov.uk website on the specified form “Apply for Global Talent endorsement - stage 1.\n2.   GTE 1.2. An application for Global Talent endorsement must meet both the following requirements: \n    1.   (a) the endorsement application fee must have been paid; and\n    2.   (b) the application must be for endorsement by an endorsing body in the field relevant to the applicant.\n\n3.   GTE 1.3. An application which does not meet all the validity requirements for a Global Talent endorsement may be rejected as invalid and not considered.",
      "needs_review": false
    },
    {
      "metadata": {
        "source": "Immigration Rules Appendix Global Talent",
        "part": "Immigration Rules Appendix Global Talent",
        "section_id": "GTE 2.1",
        "section_title": "Eligibility requirements for a Global Talent Endorsement application",
        "parent_section": "GTE 2",
        "hierarchy_level": 2,
        "topic": "eligibility",
        "url": "https://www.gov.uk/guidance/immigration-rules/immigration-rules-appendix-global-talent",
        "scraped_at": "2025-12-06T17:27:23.899770"
      },
      "text": "### Eligibility requirements for a Global Talent Endorsement application\n\nGTE 2.1. An application for endorsement must be made under one of the fields below and must meet the endorsement requirements for that field.",
      "summary": "Applicants seeking a Global Talent Endorsement must apply under a designated field and meet its specific endorsement criteria, including relevant qualifications or achievements. Eligibility is contingent on satisfying the field-specific requirements; exceptions are not specified in this excerpt.",
      "augmented_text": "Document: Immigration Rules Appendix Global Talent\nPart: Immigration Rules Appendix Global Talent\nSection ID: GTE 2.1\nSection: Eligibility requirements for a Global Talent Endorsement application\nTopic: eligibility\n\nSummary: Applicants seeking a Global Talent Endorsement must apply under a designated field and meet its specific endorsement criteria, including relevant qualifications or achievements. Eligibility is contingent on satisfying the field-specific requirements; exceptions are not specified in this excerpt.\n\n### Eligibility requirements for a Global Talent Endorsement application\n\nGTE 2.1. An application for endorsement must be made under one of the fields below and must meet the endorsement requirements for that field.",
      "needs_review": false
    },
    {
      "metadata": {
        "source": "Immigration Rules Appendix Global Talent",
        "part": "Immigration Rules Appendix Global Talent",
        "section_id": "Arts and Culture endorsement",
        "section_title": "Arts and Culture endorsement",
        "parent_section": null,
        "hierarchy_level": 2,
        "topic": "endorsement",
        "url": "https://www.gov.uk/guidance/immigration-rules/immigration-rules-appendix-global-talent",
        "scraped_at": "2025-12-06T17:27:23.899783"
      },
      "text": "### Arts and Culture endorsement",
      "summary": "This provision applies to individuals seeking an Arts and Culture endorsement under the Global Talent route. Applicants must demonstrate exceptional talent and recognition in their field, with endorsement from a relevant designated body; certain thresholds and criteria are specified to qualify.",
      "augmented_text": "Document: Immigration Rules Appendix Global Talent\nPart: Immigration Rules Appendix Global Talent\nSection ID: Arts and Culture endorsement\nSection: Arts and Culture endorsement\nTopic: endorsement\n\nSummary: This provision applies to individuals seeking an Arts and Culture endorsement under the Global Talent route. Applicants must demonstrate exceptional talent and recognition in their field, with endorsement from a relevant designated body; certain thresholds and criteria are specified to qualify.\n\n### Arts and Culture endorsement",
      "needs_review": false
    },
    {
      "metadata": {
        "source": "Immigration Rules Appendix Global Talent",
        "part": "Immigration Rules Appendix Global Talent",
        "section_id": "GTE 3.1",
        "section_title": "Arts and Culture field track record requirements",
        "parent_section": null,
        "hierarchy_level": 1,
        "topic": "eligibility",
        "url": "https://www.gov.uk/guidance/immigration-rules/immigration-rules-appendix-global-talent",
        "scraped_at": "2025-12-06T17:27:23.899806"
      },
      "text": "### Arts and Culture field track record requirements\n\n1.   GTE 3.1. An applicant for endorsement in the field of Arts and Culture must satisfy the endorsing body that they have either been recognised as an exceptional talent, or someone with exceptional promise, in the field of arts and culture and: \n    1.   (a) be professionally engaged in producing outstanding performed, presented, distributed or internationally exhibited work; and\n    2.   (b) show regular professional engagement in their field in the last 5 years; and\n    3.   (c) if evidencing exceptional talent, show a substantial track record in at least 2 countries; and\n    4.   (d) if evidencing exceptional promise: \n        1.   (i) be at an early stage in their career; and\n        2.   (ii) show a developing track record in 1 or more countries.",
      "summary": "Applicants in Arts and Culture seeking endorsement must demonstrate either exceptional talent or promise by showing outstanding or developing professional engagement, with evidence of a substantial or growing international track record, respectively. Criteria include recent activity within the last 5 years and, for talent, recognition in at least 2 countries.",
      "augmented_text": "Document: Immigration Rules Appendix Global Talent\nPart: Immigration Rules Appendix Global Talent\nSection ID: GTE 3.1\nSection: Arts and Culture field track record requirements\nTopic: eligibility\n\nSummary: Applicants in Arts and Culture seeking endorsement must demonstrate either exceptional talent or promise by showing outstanding or developing professional engagement, with evidence of a substantial or growing international track record, respectively. Criteria include recent activity within the last 5 years and, for talent, recognition in at least 2 countries.\n\n### Arts and Culture field track record requirements\n\n1.   GTE 3.1. An applicant for endorsement in the field of Arts and Culture must satisfy the endorsing body that they have either been recognised as an exceptional talent, or someone with exceptional promise, in the field of arts and culture and: \n    1.   (a) be professionally engaged in producing outstanding performed, presented, distributed or internationally exhibited work; and\n    2.   (b) show regular professional engagement in their field in the last 5 years; and\n    3.   (c) if evidencing exceptional talent, show a substantial track record in at least 2 countries; and\n    4.   (d) if evidencing exceptional promise: \n        1.   (i) be at an early stage in their career; and\n        2.   (ii) show a developing track record in 1 or more countries.",
      "needs_review": false
    },
    {
      "metadata": {
        "source": "Immigration Rules Appendix Global Talent",
        "part": "Immigration Rules Appendix Global Talent",
        "section_id": "GTE 3.2",
        "section_title": "Arts and Culture field track record evidential requirements",
        "parent_section": null,
        "hierarchy_level": 1,
        "topic": "evidence",
        "url": "https://www.gov.uk/guidance/immigration-rules/immigration-rules-appendix-global-talent",
        "scraped_at": "2025-12-06T17:27:23.899831"
      },
      "text": "### Arts and Culture field track record evidential requirements\n\n1.   GTE 3.2. An applicant must provide all of the following: \n    1.   (a) a CV which sets out their professional arts and culture career to date; and\n    2.   (b) 3 dated letters of recommendation supporting the Global talent application of which: \n        1.   (i) 2 must be from well-established arts and culture organisations that the applicant has worked with in an artistic capacity, who are acknowledged as experts in the applicant’s field, and at least one of the organisations must be based in the UK; and\n        2.   (ii) the third must be from another well-established arts and culture organisation, or an individual that the applicant has worked with in an artistic capacity, who has recognised experience in the applicant’s field.\n\n2.   GTE 3.3. An applicant who is evidencing exceptional talent in their field must provide at least two of the following: \n    1.   (a) evidence from at least 2 countries (which can include their country of residence) of 2 or more examples of significant media recognition for their work as an individual or as a named member of a group or as a contributor; or\n    2.   (b) evidence of winning, or significantly contributing to winning, at least 1 international award for excellence; or\n    3.   (c) evidence from at least 2 countries (which can include their country of residence) of proof of professional appearances, performances, publications or exhibitions considered internationally significant in their field, or evidence of extensive international distribution and sales for their work as an individual or as a named member of a group or as a contributor.\n\n3.   GTE 3.4. An applicant who is evidencing exceptional promise in their field must provide at least 2 of the following: \n    1.   (a) evidence from at least 1 country (which can include their country of residence) of at least 2 examples of recent media recognition for their work as an individual, as a named member of a group or as a contributor; or\n    2.   (b) evidence of winning, or significantly contributing to winning, or significantly contributing to being nominated or shortlisted for, or being nominated or shortlisted for, at least 1 international award for excellence; or\n    3.   (c) evidence from at least 1 country (which can include their country of residence) of proof of professional appearances, performances, publications or exhibitions recognised in their field, or evidence of international distribution and sales for their work as an individual, as a named member of a group or as a contributor.",
      "summary": "Applicants must submit a CV and three recommendation letters from established arts organisations, including UK-based ones. Those evidencing exceptional talent must provide media recognition, international awards, or significant international performances or publications, with at least two types of evidence required. Conditions include endorsements from recognized experts and specific international achievements.",
      "augmented_text": "Document: Immigration Rules Appendix Global Talent\nPart: Immigration Rules Appendix Global Talent\nSection ID: GTE 3.2\nSection: Arts and Culture field track record evidential requirements\nTopic: evidence\n\nSummary: Applicants must submit a CV and three recommendation letters from established arts organisations, including UK-based ones. Those evidencing exceptional talent must provide media recognition, international awards, or significant international performances or publications, with at least two types of evidence required. Conditions include endorsements from recognized experts and specific international achievements.\n\n### Arts and Culture field track record evidential requirements\n\n1.   GTE 3.2. An applicant must provide all of the following: \n    1.   (a) a CV which sets out their professional arts and culture career to date; and\n    2.   (b) 3 dated letters of recommendation supporting the Global talent application of which: \n        1.   (i) 2 must be from well-established arts and culture organisations that the applicant has worked with in an artistic capacity, who are acknowledged as experts in the applicant’s field, and at least one of the organisations must be based in the UK; and\n        2.   (ii) the third must be from another well-established arts and culture organisation, or an individual that the applicant has worked with in an artistic capacity, who has recognised experience in the applicant’s field.\n\n2.   GTE 3.3. An applicant who is evidencing exceptional talent in their field must provide at least two of the following: \n    1.   (a) evidence from at least 2 countries (which can include their country of residence) of 2 or more examples of significant media recognition for their work as an individual or as a named member of a group or as a contributor; or\n    2.   (b) evidence of winning, or significantly contributing to winning, at least 1 international award for excellence; or\n    3.   (c) evidence from at least 2 countries (which can include their country of residence) of proof of professional appearances, performances, publications or exhibitions considered internationally significant in their field, or evidence of extensive international distribution and sales for their work as an individual or as a named member of a group or as a contributor.\n\n3.   GTE 3.4. An applicant who is evidencing exceptional promise in their field must provide at least 2 of the following: \n    1.   (a) evidence from at least 1 country (which can include their country of residence) of at least 2 examples of recent media recognition for their work as an individual, as a named member of a group or as a contributor; or\n    2.   (b) evidence of winning, or significantly contributing to winning, or significantly contributing to being nominated or shortlisted for, or being nominated or shortlisted for, at least 1 international award for excellence; or\n    3.   (c) evidence from at least 1 country (which can include their country of residence) of proof of professional appearances, performances, publications or exhibitions recognised in their field, or evidence of international distribution and sales for their work as an individual, as a named member of a group or as a contributor.",
      "needs_review": false
    },
    {
      "metadata": {
        "source": "Immigration Rules Appendix Global Talent",
        "part": "Immigration Rules Appendix Global Talent",
        "section_id": "Architecture endorsement",
        "section_title": "Architecture endorsement",
        "parent_section": null,
        "hierarchy_level": 2,
        "topic": "endorsement",
        "url": "https://www.gov.uk/guidance/immigration-rules/immigration-rules-appendix-global-talent",
        "scraped_at": "2025-12-06T17:27:23.899842"
      },
      "text": "### Architecture endorsement",
      "summary": "This provision applies to applicants seeking a Global Talent endorsement in architecture. It requires demonstrating exceptional talent and recognition in the field, with specific criteria and evidence outlined by the endorsing body. Conditions include meeting eligibility standards and providing relevant supporting documentation.",
      "augmented_text": "Document: Immigration Rules Appendix Global Talent\nPart: Immigration Rules Appendix Global Talent\nSection ID: Architecture endorsement\nSection: Architecture endorsement\nTopic: endorsement\n\nSummary: This provision applies to applicants seeking a Global Talent endorsement in architecture. It requires demonstrating exceptional talent and recognition in the field, with specific criteria and evidence outlined by the endorsing body. Conditions include meeting eligibility standards and providing relevant supporting documentation.\n\n### Architecture endorsement",
      "needs_review": false
    },
    {
      "metadata": {
        "source": "Immigration Rules Appendix Global Talent",
        "part": "Immigration Rules Appendix Global Talent",
        "section_id": "GTE 4.1",
        "section_title": "Architecture field track record requirement",
        "parent_section": null,
        "hierarchy_level": 1,
        "topic": "professional",
        "url": "https://www.gov.uk/guidance/immigration-rules/immigration-rules-appendix-global-talent",
        "scraped_at": "2025-12-06T17:27:23.899863"
      },
      "text": "### Architecture field track record requirement\n\n1.   GTE 4.1. An applicant for endorsement in the field of Architecture must satisfy the endorsing body that they have either been recognised as an exceptional talent, or someone with exceptional promise, in the field of architecture and: \n    1.   (a) be professionally engaged in producing outstanding presented, published or internationally exhibited work; and\n    2.   (b) show regular professional engagement in their field in the last 5 years; and\n    3.   (c) show either a substantial track record in at least 2 countries if evidencing exceptional talent, or a developing track record in at least 1 country if evidencing exceptional promise.",
      "summary": "Applicants for the Architecture field track must demonstrate they are recognized as an exceptional talent or promise, with outstanding work, regular engagement in the past 5 years, and a substantial international track record (for talents) or developing record (for promise). The criteria include international recognition and ongoing professional activity, with specific thresholds based on talent level.",
      "augmented_text": "Document: Immigration Rules Appendix Global Talent\nPart: Immigration Rules Appendix Global Talent\nSection ID: GTE 4.1\nSection: Architecture field track record requirement\nTopic: professional\n\nSummary: Applicants for the Architecture field track must demonstrate they are recognized as an exceptional talent or promise, with outstanding work, regular engagement in the past 5 years, and a substantial international track record (for talents) or developing record (for promise). The criteria include international recognition and ongoing professional activity, with specific thresholds based on talent level.\n\n### Architecture field track record requirement\n\n1.   GTE 4.1. An applicant for endorsement in the field of Architecture must satisfy the endorsing body that they have either been recognised as an exceptional talent, or someone with exceptional promise, in the field of architecture and: \n    1.   (a) be professionally engaged in producing outstanding presented, published or internationally exhibited work; and\n    2.   (b) show regular professional engagement in their field in the last 5 years; and\n    3.   (c) show either a substantial track record in at least 2 countries if evidencing exceptional talent, or a developing track record in at least 1 country if evidencing exceptional promise.",
      "needs_review": false
    },
    {
      "metadata": {
        "source": "Immigration Rules Appendix Global Talent",
        "part": "Immigration Rules Appendix Global Talent",
        "section_id": "GTE 4.2",
        "section_title": "Architectural career evidence requirements",
        "parent_section": null,
        "hierarchy_level": 1,
        "topic": "eligibility",
        "url": "https://www.gov.uk/guidance/immigration-rules/immigration-rules-appendix-global-talent",
        "scraped_at": "2025-12-06T17:27:23.899887"
      },
      "text": "### Architecture field track record evidential requirements\n\n1.   GTE 4.2. An applicant must provide all of the following: \n    1.   (a) a CV which sets out their professional architecture career to date; and\n    2.   (b) 3 dated letters of recommendation supporting the Global Talent application of which: \n        1.   (i) 2 must be from well-established architecture organisations that the applicant has worked with in an architectural capacity, who are acknowledged as experts in the applicant’s field, and at least one1 of the organisations must be based in the UK; and\n        2.   (ii) the third must be from another well-established architecture organisation, or an individual, that the applicant has worked with in an architectural capacity, who has recognised expertise in the applicant’s field.\n\n2.   GTE 4.3. An applicant who is evidencing exceptional talent in their field must provide at least 2 of the following: \n    1.   (a) evidence of winning, or significantly contributing to winning, at least 1 international award for excellence; or\n    2.   (b) evidence from at least 2 countries (which can include their country of residence) of a minimum of 2 examples of significant media recognition for their work as an individual or as a named member of a group or as a contributor; or\n    3.   (c) evidence from at least 2 countries (which can include their country of residence) of a minimum of 2 examples of publications or exhibitions considered internationally significant in the applicant’s field, for their work as an individual or as a named member of a group or as a contributor.\n\n3.   GTE 4.4. An applicant who is evidencing exceptional promise in their field must provide at least 2 of the following: \n    1.   (a) evidence of winning, or significantly contributing to winning, or significantly contributing to being nominated or shortlisted for, or being nominated or shortlisted for, at least 1 international award for excellence in the last 5 years; or\n    2.   (b) evidence from at least 1 country (which can include their country of residence) of a minimum of 2 examples of recent media recognition for their work as an individual or as a named member of a group or as a contributor; or\n    3.   (c) evidence from at least 1 country (which can include their country of residence) of a minimum of 2 examples of publications or exhibitions in the last 5 years considered internationally significant in the applicant’s field for their work as an individual or as a named member of a group or as a contributor.",
      "summary": "Applicants in the architecture field must submit a CV and three recommendation letters—two from UK-based and recognized organizations, and one from another well-established firm or expert. To demonstrate exceptional talent, they must also provide evidence of international awards, media recognition, or significant publications/exhibitions in at least two countries.",
      "augmented_text": "Document: Immigration Rules Appendix Global Talent\nPart: Immigration Rules Appendix Global Talent\nSection ID: GTE 4.2\nSection: Architectural career evidence requirements\nTopic: eligibility\n\nSummary: Applicants in the architecture field must submit a CV and three recommendation letters—two from UK-based and recognized organizations, and one from another well-established firm or expert. To demonstrate exceptional talent, they must also provide evidence of international awards, media recognition, or significant publications/exhibitions in at least two countries.\n\n### Architecture field track record evidential requirements\n\n1.   GTE 4.2. An applicant must provide all of the following: \n    1.   (a) a CV which sets out their professional architecture career to date; and\n    2.   (b) 3 dated letters of recommendation supporting the Global Talent application of which: \n        1.   (i) 2 must be from well-established architecture organisations that the applicant has worked with in an architectural capacity, who are acknowledged as experts in the applicant’s field, and at least one1 of the organisations must be based in the UK; and\n        2.   (ii) the third must be from another well-established architecture organisation, or an individual, that the applicant has worked with in an architectural capacity, who has recognised expertise in the applicant’s field.\n\n2.   GTE 4.3. An applicant who is evidencing exceptional talent in their field must provide at least 2 of the following: \n    1.   (a) evidence of winning, or significantly contributing to winning, at least 1 international award for excellence; or\n    2.   (b) evidence from at least 2 countries (which can include their country of residence) of a minimum of 2 examples of significant media recognition for their work as an individual or as a named member of a group or as a contributor; or\n    3.   (c) evidence from at least 2 countries (which can include their country of residence) of a minimum of 2 examples of publications or exhibitions considered internationally significant in the applicant’s field, for their work as an individual or as a named member of a group or as a contributor.\n\n3.   GTE 4.4. An applicant who is evidencing exceptional promise in their field must provide at least 2 of the following: \n    1.   (a) evidence of winning, or significantly contributing to winning, or significantly contributing to being nominated or shortlisted for, or being nominated or shortlisted for, at least 1 international award for excellence in the last 5 years; or\n    2.   (b) evidence from at least 1 country (which can include their country of residence) of a minimum of 2 examples of recent media recognition for their work as an individual or as a named member of a group or as a contributor; or\n    3.   (c) evidence from at least 1 country (which can include their country of residence) of a minimum of 2 examples of publications or exhibitions in the last 5 years considered internationally significant in the applicant’s field for their work as an individual or as a named member of a group or as a contributor.",
      "needs_review": false
    },
    {
      "metadata": {
        "source": "Immigration Rules Appendix Global Talent",
        "part": "Immigration Rules Appendix Global Talent",
        "section_id": "SW 3.1",
        "section_title": "Fashion Design Industry endorsement",
        "parent_section": null,
        "hierarchy_level": 2,
        "topic": "sponsorship",
        "url": "https://www.gov.uk/guidance/immigration-rules/immigration-rules-appendix-global-talent",
        "scraped_at": "2025-12-06T17:27:23.899899"
      },
      "text": "### Fashion Design Industry endorsement",
      "summary": "This provision applies to fashion design industry applicants seeking endorsement under the Global Talent route. Applicants must demonstrate recognized achievement or exceptional promise in fashion design and receive an endorsement from an authorized endorsing body. Critical conditions include meeting the specific criteria set by the endorsing body; exceptions or additional thresholds are not detailed here.",
      "augmented_text": "Document: Immigration Rules Appendix Global Talent\nPart: Immigration Rules Appendix Global Talent\nSection ID: SW 3.1\nSection: Fashion Design Industry endorsement\nTopic: sponsorship\n\nSummary: This provision applies to fashion design industry applicants seeking endorsement under the Global Talent route. Applicants must demonstrate recognized achievement or exceptional promise in fashion design and receive an endorsement from an authorized endorsing body. Critical conditions include meeting the specific criteria set by the endorsing body; exceptions or additional thresholds are not detailed here.\n\n### Fashion Design Industry endorsement",
      "needs_review": false
    },
    {
      "metadata": {
        "source": "Immigration Rules Appendix Global Talent",
        "part": "Immigration Rules Appendix Global Talent",
        "section_id": "GTE 5.1",
        "section_title": "Fashion Design Industry field track record requirement",
        "parent_section": null,
        "hierarchy_level": 1,
        "topic": "eligibility",
        "url": "https://www.gov.uk/guidance/immigration-rules/immigration-rules-appendix-global-talent",
        "scraped_at": "2025-12-06T17:27:23.899920"
      },
      "text": "### Fashion Design Industry field track record requirement\n\n1.   GTE 5.1. An applicant for endorsement in the field of fashion design must satisfy the endorsing body that they have either been recognised as an exceptional talent, or someone with exceptional promise, in the field of fashion design and: \n    1.   (a) have a leading design role in the fashion business; and\n    2.   (b) show regular professional engagement in the fashion design industry in the last 5 years; and\n    3.   (c) if evidencing exceptional talent, show professional engagement in producing outstanding work that has been sold or exhibited internationally through catwalk or other exhibitions and a substantial track record in at least 2 countries; and\n    4.   (d) if evidencing exceptional promise, show a developing track record in at least 1 country and professional engagement in producing outstanding work that has been recognised by leading industry players.",
      "summary": "Applicants applying for endorsement in the fashion design field must demonstrate either exceptional talent or promise by having a leading role, recent industry engagement, and international recognition or a developing track record in fashion design, with specific emphasis on sales, exhibitions, and recognition in at least one or two countries.",
      "augmented_text": "Document: Immigration Rules Appendix Global Talent\nPart: Immigration Rules Appendix Global Talent\nSection ID: GTE 5.1\nSection: Fashion Design Industry field track record requirement\nTopic: eligibility\n\nSummary: Applicants applying for endorsement in the fashion design field must demonstrate either exceptional talent or promise by having a leading role, recent industry engagement, and international recognition or a developing track record in fashion design, with specific emphasis on sales, exhibitions, and recognition in at least one or two countries.\n\n### Fashion Design Industry field track record requirement\n\n1.   GTE 5.1. An applicant for endorsement in the field of fashion design must satisfy the endorsing body that they have either been recognised as an exceptional talent, or someone with exceptional promise, in the field of fashion design and: \n    1.   (a) have a leading design role in the fashion business; and\n    2.   (b) show regular professional engagement in the fashion design industry in the last 5 years; and\n    3.   (c) if evidencing exceptional talent, show professional engagement in producing outstanding work that has been sold or exhibited internationally through catwalk or other exhibitions and a substantial track record in at least 2 countries; and\n    4.   (d) if evidencing exceptional promise, show a developing track record in at least 1 country and professional engagement in producing outstanding work that has been recognised by leading industry players.",
      "needs_review": false
    },
    {
      "metadata": {
        "source": "Immigration Rules Appendix Global Talent",
        "part": "Immigration Rules Appendix Global Talent",
        "section_id": "GTE 5.2",
        "section_title": "Fashion Design Industry field track record evidential requirements",
        "parent_section": null,
        "hierarchy_level": 1,
        "topic": "eligibility",
        "url": "https://www.gov.uk/guidance/immigration-rules/immigration-rules-appendix-global-talent",
        "scraped_at": "2025-12-06T17:27:23.899944"
      },
      "text": "### Fashion Design Industry field track record evidential requirements\n\n1.   GTE 5.2. An applicant must provide all of the following: \n    1.   (a) a CV which sets out their professional fashion design career to date; and\n    2.   (b) 3 dated letters of recommendation supporting the Global Talent application of which: \n        1.   (i) 2 must be from well-established fashion organisations that the applicant has worked with in a fashion design capacity, who are acknowledged as experts in the applicant’s field, and at least one1 of the organisations must be based in the UK; and\n        2.   (ii) the third must be from another well-established fashion organisation, or an individual, that the applicant has worked with in a fashion design capacity, who has recognised expertise in the applicant’s field.\n\n2.   GTE 5.3. An applicant who is evidencing exceptional talent in the fashion design industry field must provide at least 2 of the following: \n    1.   (a) evidence of winning, or significantly contributing to winning, or being nominated or shortlisted for, or significantly contributing to being nominated or shortlisted for, at least 1 international award for excellence; or\n    2.   (b) evidence from at least 2 countries (which can include their country of residence) of at least 2 examples of significant media recognition for their individual work; or\n    3.   (c) evidence of catwalk shows, presentations or exhibitions considered internationally significant in the fashion design industry; or\n    4.   (d) evidence of extensive distribution and sales of their collections via internationally renowned retailers, their retail outlet or their ecommerce platform.\n\n3.   GTE 5.4. An applicant who is evidencing exceptional promise in the fashion design industry must provide at least 2 of the following: \n    1.   (a) at least 2 examples of recent UK or international media recognition for their individual work or their work as a contributing designer; or\n    2.   (b) evidence of support and sponsorship through one of the following: \n        1.   (i) British Fashion Council support schemes; or\n        2.   (ii) Fashion East support scheme; or (iii)The Sarabande Foundation; or\n        3.   (iv) The Centre of Fashion Enterprise; or\n        4.   (v) an international organisation which the British Fashion Council is satisfied operates as its counterpart , outside of the UK; or\n\n    3.   (c) evidence of at least 1 order placed by a luxury retailer or boutique; or\n    4.   (d) at least 2 examples of evidence of recognition by leading industry players of an exceptional graduating collection.",
      "summary": "Applicants in the fashion design industry must provide a CV and three recommendation letters—two from UK-based and well-established fashion organizations. To demonstrate exceptional talent, they need to supply evidence of international awards, significant media recognition, or internationally acclaimed exhibitions. Conditions include verifying reputable endorsements and meeting specific recognition thresholds.",
      "augmented_text": "Document: Immigration Rules Appendix Global Talent\nPart: Immigration Rules Appendix Global Talent\nSection ID: GTE 5.2\nSection: Fashion Design Industry field track record evidential requirements\nTopic: eligibility\n\nSummary: Applicants in the fashion design industry must provide a CV and three recommendation letters—two from UK-based and well-established fashion organizations. To demonstrate exceptional talent, they need to supply evidence of international awards, significant media recognition, or internationally acclaimed exhibitions. Conditions include verifying reputable endorsements and meeting specific recognition thresholds.\n\n### Fashion Design Industry field track record evidential requirements\n\n1.   GTE 5.2. An applicant must provide all of the following: \n    1.   (a) a CV which sets out their professional fashion design career to date; and\n    2.   (b) 3 dated letters of recommendation supporting the Global Talent application of which: \n        1.   (i) 2 must be from well-established fashion organisations that the applicant has worked with in a fashion design capacity, who are acknowledged as experts in the applicant’s field, and at least one1 of the organisations must be based in the UK; and\n        2.   (ii) the third must be from another well-established fashion organisation, or an individual, that the applicant has worked with in a fashion design capacity, who has recognised expertise in the applicant’s field.\n\n2.   GTE 5.3. An applicant who is evidencing exceptional talent in the fashion design industry field must provide at least 2 of the following: \n    1.   (a) evidence of winning, or significantly contributing to winning, or being nominated or shortlisted for, or significantly contributing to being nominated or shortlisted for, at least 1 international award for excellence; or\n    2.   (b) evidence from at least 2 countries (which can include their country of residence) of at least 2 examples of significant media recognition for their individual work; or\n    3.   (c) evidence of catwalk shows, presentations or exhibitions considered internationally significant in the fashion design industry; or\n    4.   (d) evidence of extensive distribution and sales of their collections via internationally renowned retailers, their retail outlet or their ecommerce platform.\n\n3.   GTE 5.4. An applicant who is evidencing exceptional promise in the fashion design industry must provide at least 2 of the following: \n    1.   (a) at least 2 examples of recent UK or international media recognition for their individual work or their work as a contributing designer; or\n    2.   (b) evidence of support and sponsorship through one of the following: \n        1.   (i) British Fashion Council support schemes; or\n        2.   (ii) Fashion East support scheme; or (iii)The Sarabande Foundation; or\n        3.   (iv) The Centre of Fashion Enterprise; or\n        4.   (v) an international organisation which the British Fashion Council is satisfied operates as its counterpart , outside of the UK; or\n\n    3.   (c) evidence of at least 1 order placed by a luxury retailer or boutique; or\n    4.   (d) at least 2 examples of evidence of recognition by leading industry players of an exceptional graduating collection.",
      "needs_review": false
    },
    {
      "metadata": {
        "source": "Immigration Rules Appendix Global Talent",
        "part": "Immigration Rules Appendix Global Talent",
        "section_id": "Film and Television endorsement",
        "section_title": "Film and Television endorsement",
        "parent_section": null,
        "hierarchy_level": 2,
        "topic": "endorsement",
        "url": "https://www.gov.uk/guidance/immigration-rules/immigration-rules-appendix-global-talent",
        "scraped_at": "2025-12-06T17:27:23.899956"
      },
      "text": "### Film and Television endorsement",
      "summary": "This provision applies to applicants seeking endorsement under Film and Television category in the Global Talent route. It requires applicants to demonstrate recognized expertise and meet specified criteria for endorsement, with consideration given to exceptional talent and relevant experience; exceptions or thresholds are detailed in the eligibility guidance.",
      "augmented_text": "Document: Immigration Rules Appendix Global Talent\nPart: Immigration Rules Appendix Global Talent\nSection ID: Film and Television endorsement\nSection: Film and Television endorsement\nTopic: endorsement\n\nSummary: This provision applies to applicants seeking endorsement under Film and Television category in the Global Talent route. It requires applicants to demonstrate recognized expertise and meet specified criteria for endorsement, with consideration given to exceptional talent and relevant experience; exceptions or thresholds are detailed in the eligibility guidance.\n\n### Film and Television endorsement",
      "needs_review": false
    },
    {
      "metadata": {
        "source": "Immigration Rules Appendix Global Talent",
        "part": "Immigration Rules Appendix Global Talent",
        "section_id": "GTE 6.1",
        "section_title": "Film and Television field track record requirement",
        "parent_section": null,
        "hierarchy_level": 1,
        "topic": "eligibility",
        "url": "https://www.gov.uk/guidance/immigration-rules/immigration-rules-appendix-global-talent",
        "scraped_at": "2025-12-06T17:27:23.899978"
      },
      "text": "### Film and Television field track record requirement\n\n1.   GTE 6.1. An applicant for an exceptional talent endorsement in the field of Film and Television must satisfy the endorsing body that they have been recognised as an exceptional talent in the field of film and television and show 1 of the following: \n    1.   (a) that they have won at any time a “Main Award” for their work as an individual which means: \n        1.   (i) an Academy Award; or\n        2.   (ii) a British Academy of Film and Television Arts (BAFTA) (film, television, television craft, Cymru, Scotland, Games awards only); or\n        3.   (iii) a Golden Globe; or\n        4.   (iv) an Emmy Award; or\n\n    2.   (b) in the last 10 years they have been nominated for, or made a significant contribution to winning, or being nominated for any of the Main Awards; or\n    3.   (c) in the last 15 years, they have achieved a minimum of 2 nominations for the Main Awards for their work as an individual; or\n    4.   (d) they have notable industry recognition for at least 2 separate productions through international distribution sales, media recognition and a specified combination of awards from Pact’s Notable Industry Recognition Awards List, as set out in [https://www.pact.co.uk/applying-for-talent-visas/notable-industry-recognition-awards-list.html](https://www.pact.co.uk/applying-for-talent-visas/notable-industry-recognition-awards-list.html)",
      "summary": "Applicants for exceptional talent in Film and Television must demonstrate recognition through major awards, recent nominations, multiple nominations over 15 years, or notable industry recognition for at least two productions, with specific thresholds and timeframes.",
      "augmented_text": "Document: Immigration Rules Appendix Global Talent\nPart: Immigration Rules Appendix Global Talent\nSection ID: GTE 6.1\nSection: Film and Television field track record requirement\nTopic: eligibility\n\nSummary: Applicants for exceptional talent in Film and Television must demonstrate recognition through major awards, recent nominations, multiple nominations over 15 years, or notable industry recognition for at least two productions, with specific thresholds and timeframes.\n\n### Film and Television field track record requirement\n\n1.   GTE 6.1. An applicant for an exceptional talent endorsement in the field of Film and Television must satisfy the endorsing body that they have been recognised as an exceptional talent in the field of film and television and show 1 of the following: \n    1.   (a) that they have won at any time a “Main Award” for their work as an individual which means: \n        1.   (i) an Academy Award; or\n        2.   (ii) a British Academy of Film and Television Arts (BAFTA) (film, television, television craft, Cymru, Scotland, Games awards only); or\n        3.   (iii) a Golden Globe; or\n        4.   (iv) an Emmy Award; or\n\n    2.   (b) in the last 10 years they have been nominated for, or made a significant contribution to winning, or being nominated for any of the Main Awards; or\n    3.   (c) in the last 15 years, they have achieved a minimum of 2 nominations for the Main Awards for their work as an individual; or\n    4.   (d) they have notable industry recognition for at least 2 separate productions through international distribution sales, media recognition and a specified combination of awards from Pact’s Notable Industry Recognition Awards List, as set out in [https://www.pact.co.uk/applying-for-talent-visas/notable-industry-recognition-awards-list.html](https://www.pact.co.uk/applying-for-talent-visas/notable-industry-recognition-awards-list.html)",
      "needs_review": false
    },
    {
      "metadata": {
        "source": "Immigration Rules Appendix Global Talent",
        "part": "Immigration Rules Appendix Global Talent",
        "section_id": "GTE 6.2",
        "section_title": "Film and Television field track record evidential requirements",
        "parent_section": null,
        "hierarchy_level": 1,
        "topic": "eligibility",
        "url": "https://www.gov.uk/guidance/immigration-rules/immigration-rules-appendix-global-talent",
        "scraped_at": "2025-12-06T17:27:23.899999"
      },
      "text": "### Film and Television field track record evidential requirements\n\n1.   GTE 6.2. An applicant must provide all of the following: \n    1.   (a) a CV which sets out their professional film and television career to date; and\n    2.   (b) 3 dated letters of recommendation supporting the Global Talent application of which: \n        1.   (i) 2 must be from well-established film and television organisations that the applicant has worked with in a film and television capacity, who are acknowledged as experts in the applicant’s field, and at least one of the organisations must be based in the UK; and\n        2.   (ii) the third must be from another well-established film and television organisation, or an individual, that the applicant has worked with in a film and television capacity, who has recognised expertise in the applicant’s field.",
      "summary": "Applicants applying under the Film and Television track must submit a CV detailing their career and three supportive, dated recommendation letters—two from UK-based or recognized industry organizations and one from another respected entity or individual—demonstrating their professional track record in the field.",
      "augmented_text": "Document: Immigration Rules Appendix Global Talent\nPart: Immigration Rules Appendix Global Talent\nSection ID: GTE 6.2\nSection: Film and Television field track record evidential requirements\nTopic: eligibility\n\nSummary: Applicants applying under the Film and Television track must submit a CV detailing their career and three supportive, dated recommendation letters—two from UK-based or recognized industry organizations and one from another respected entity or individual—demonstrating their professional track record in the field.\n\n### Film and Television field track record evidential requirements\n\n1.   GTE 6.2. An applicant must provide all of the following: \n    1.   (a) a CV which sets out their professional film and television career to date; and\n    2.   (b) 3 dated letters of recommendation supporting the Global Talent application of which: \n        1.   (i) 2 must be from well-established film and television organisations that the applicant has worked with in a film and television capacity, who are acknowledged as experts in the applicant’s field, and at least one of the organisations must be based in the UK; and\n        2.   (ii) the third must be from another well-established film and television organisation, or an individual, that the applicant has worked with in a film and television capacity, who has recognised expertise in the applicant’s field.",
      "needs_review": false
    },
    {
      "metadata": {
        "source": "Immigration Rules Appendix Global Talent",
        "part": "Immigration Rules Appendix Global Talent",
        "section_id": "DT 1.1",
        "section_title": "Digital Technology endorsement",
        "parent_section": null,
        "hierarchy_level": 2,
        "topic": "sponsorship",
        "url": "https://www.gov.uk/guidance/immigration-rules/immigration-rules-appendix-global-talent",
        "scraped_at": "2025-12-06T17:27:23.900010"
      },
      "text": "### Digital Technology endorsement",
      "summary": "This provision applies to applicants seeking the Global Talent visa in Digital Technology. They must secure an endorsement from approved endorsers demonstrating exceptional talent or potential in digital technology. Conditions include meeting specific eligibility criteria; exceptions are not specified.",
      "augmented_text": "Document: Immigration Rules Appendix Global Talent\nPart: Immigration Rules Appendix Global Talent\nSection ID: DT 1.1\nSection: Digital Technology endorsement\nTopic: sponsorship\n\nSummary: This provision applies to applicants seeking the Global Talent visa in Digital Technology. They must secure an endorsement from approved endorsers demonstrating exceptional talent or potential in digital technology. Conditions include meeting specific eligibility criteria; exceptions are not specified.\n\n### Digital Technology endorsement",
      "needs_review": false
    },
    {
      "metadata": {
        "source": "Immigration Rules Appendix Global Talent",
        "part": "Immigration Rules Appendix Global Talent",
        "section_id": "GTE 7.1",
        "section_title": "Digital Technology field track record requirement",
        "parent_section": null,
        "hierarchy_level": 1,
        "topic": "eligibility",
        "url": "https://www.gov.uk/guidance/immigration-rules/immigration-rules-appendix-global-talent",
        "scraped_at": "2025-12-06T17:27:23.900031"
      },
      "text": "### Digital Technology field track record requirement\n\n1.   GTE 7.1. An applicant for endorsement in the field of digital technology must: \n    1.   (a) satisfy the endorsing body that they have either been recognised as an exceptional talent, or someone with exceptional promise, in the field of digital technology in the last 5 years; and\n    2.   (b) show one of the following: \n        1.   (i) if they are a technical applicant, that they have proven technical expertise with the latest technologies in building, using, deploying or exploiting a technology stack and building technical infrastructure; or\n        2.   (ii) if they are a business applicant, that they have proven commercial, investment or product expertise in building digital products or leading investments in significant digital product businesses.",
      "summary": "Applicants seeking endorsement in digital technology must demonstrate either recognition as an exceptional talent or promise within the last five years. Technical applicants must prove expertise in current technologies, while business applicants need to show experience in digital product development or investment. Critical conditions include meeting the endorsing body's criteria and choosing the appropriate expertise pathway.",
      "augmented_text": "Document: Immigration Rules Appendix Global Talent\nPart: Immigration Rules Appendix Global Talent\nSection ID: GTE 7.1\nSection: Digital Technology field track record requirement\nTopic: eligibility\n\nSummary: Applicants seeking endorsement in digital technology must demonstrate either recognition as an exceptional talent or promise within the last five years. Technical applicants must prove expertise in current technologies, while business applicants need to show experience in digital product development or investment. Critical conditions include meeting the endorsing body's criteria and choosing the appropriate expertise pathway.\n\n### Digital Technology field track record requirement\n\n1.   GTE 7.1. An applicant for endorsement in the field of digital technology must: \n    1.   (a) satisfy the endorsing body that they have either been recognised as an exceptional talent, or someone with exceptional promise, in the field of digital technology in the last 5 years; and\n    2.   (b) show one of the following: \n        1.   (i) if they are a technical applicant, that they have proven technical expertise with the latest technologies in building, using, deploying or exploiting a technology stack and building technical infrastructure; or\n        2.   (ii) if they are a business applicant, that they have proven commercial, investment or product expertise in building digital products or leading investments in significant digital product businesses.",
      "needs_review": false
    },
    {
      "metadata": {
        "source": "Immigration Rules Appendix Global Talent",
        "part": "Immigration Rules Appendix Global Talent",
        "section_id": "GTE 7.2",
        "section_title": "Digital Technology track record evidential requirements",
        "parent_section": null,
        "hierarchy_level": 1,
        "topic": "evidential",
        "url": "https://www.gov.uk/guidance/immigration-rules/immigration-rules-appendix-global-talent",
        "scraped_at": "2025-12-06T17:27:23.900055"
      },
      "text": "### Digital Technology track record evidential requirements\n\n1.   GTE 7.2. An applicant must provide all of the following: \n    1.   (a) a CV with career and publication history included; and\n    2.   (b) 3 dated letters of recommendation from 3 different well-established individuals acknowledged as experts in the digital technology field, with detailed knowledge of the applicant’s work over a period of 12 months or more, supporting the Global Talent application, which include all of the following: \n        1.   (i) how the author knows the applicant; and\n        2.   (ii) the applicant’s achievements in the relevant field; and\n        3.   (iii) how the author considers the applicant shows exceptional talent or promise; and\n        4.   (iv) the contribution the applicant would be expected to make to the UK digital economy.\n\n2.   GTE 7.3. An applicant evidencing exceptional talent must provide at least 2 pieces of evidence for 2 of the following: \n    1.   (a) a proven track record for innovation as a founder or senior executive of a product-led digital technology company or as an employee working on a new digital field or concept; or\n    2.   (b) proof of recognition for work beyond the applicant’s occupation that contributes to the advancement of the field; or\n    3.   (c) they have made significant technical, commercial or entrepreneurial contributions to the field as a founder, senior executive, board member or employee of a product-led digital technology company; or\n    4.   (d) they have demonstrated exceptional ability in the field by academic contributions through research published or endorsed by an expert.\n\n3.   GTE 7.4. An applicant evidencing exceptional promise must: \n    1.   (a) provide at least 2 pieces of evidence for 2 of the following: \n        1.   (i) innovation as a founder of a product-led digital technology company or as an employee working on a new digital field or concept; or\n        2.   (ii) a proof of recognition for work beyond the applicant’s occupation that contributes to the advancement of the field; or\n        3.   (iii) they have made significant technical, commercial or entrepreneurial contributions to the field as a founder or employee of a product-led digital technology company; or\n        4.   (iv) they have demonstrated exceptional ability in the field by academic contributions through research endorsed by an expert; and\n\n    2.   (b) be at an early stage in their career.\n\n4.   GTE 7.5. An applicant must provide evidence of any commercially successful established businesses, share ownership or businesses dissolved in the last 5 years where the applicant has been a founder or senior executive.",
      "summary": "Applicants seeking the UK Digital Technology Global Talent route must submit a CV, three expert recommendation letters detailing their achievements and potential, and evidence of innovation or recognition in the digital field. They must meet specific evidential thresholds, including demonstrating exceptional talent or a proven track record, with certain requirements varying based on the applicant’s level of recognition.",
      "augmented_text": "Document: Immigration Rules Appendix Global Talent\nPart: Immigration Rules Appendix Global Talent\nSection ID: GTE 7.2\nSection: Digital Technology track record evidential requirements\nTopic: evidential\n\nSummary: Applicants seeking the UK Digital Technology Global Talent route must submit a CV, three expert recommendation letters detailing their achievements and potential, and evidence of innovation or recognition in the digital field. They must meet specific evidential thresholds, including demonstrating exceptional talent or a proven track record, with certain requirements varying based on the applicant’s level of recognition.\n\n### Digital Technology track record evidential requirements\n\n1.   GTE 7.2. An applicant must provide all of the following: \n    1.   (a) a CV with career and publication history included; and\n    2.   (b) 3 dated letters of recommendation from 3 different well-established individuals acknowledged as experts in the digital technology field, with detailed knowledge of the applicant’s work over a period of 12 months or more, supporting the Global Talent application, which include all of the following: \n        1.   (i) how the author knows the applicant; and\n        2.   (ii) the applicant’s achievements in the relevant field; and\n        3.   (iii) how the author considers the applicant shows exceptional talent or promise; and\n        4.   (iv) the contribution the applicant would be expected to make to the UK digital economy.\n\n2.   GTE 7.3. An applicant evidencing exceptional talent must provide at least 2 pieces of evidence for 2 of the following: \n    1.   (a) a proven track record for innovation as a founder or senior executive of a product-led digital technology company or as an employee working on a new digital field or concept; or\n    2.   (b) proof of recognition for work beyond the applicant’s occupation that contributes to the advancement of the field; or\n    3.   (c) they have made significant technical, commercial or entrepreneurial contributions to the field as a founder, senior executive, board member or employee of a product-led digital technology company; or\n    4.   (d) they have demonstrated exceptional ability in the field by academic contributions through research published or endorsed by an expert.\n\n3.   GTE 7.4. An applicant evidencing exceptional promise must: \n    1.   (a) provide at least 2 pieces of evidence for 2 of the following: \n        1.   (i) innovation as a founder of a product-led digital technology company or as an employee working on a new digital field or concept; or\n        2.   (ii) a proof of recognition for work beyond the applicant’s occupation that contributes to the advancement of the field; or\n        3.   (iii) they have made significant technical, commercial or entrepreneurial contributions to the field as a founder or employee of a product-led digital technology company; or\n        4.   (iv) they have demonstrated exceptional ability in the field by academic contributions through research endorsed by an expert; and\n\n    2.   (b) be at an early stage in their career.\n\n4.   GTE 7.5. An applicant must provide evidence of any commercially successful established businesses, share ownership or businesses dissolved in the last 5 years where the applicant has been a founder or senior executive.",
      "needs_review": false
    },
    {
      "metadata": {
        "source": "Immigration Rules Appendix Global Talent",
        "part": "Immigration Rules Appendix Global Talent",
        "section_id": "SW 3.1",
        "section_title": "Science, engineering, humanities, social science and medicine fields endorsement",
        "parent_section": null,
        "hierarchy_level": 2,
        "topic": "sponsorship",
        "url": "https://www.gov.uk/guidance/immigration-rules/immigration-rules-appendix-global-talent",
        "scraped_at": "2025-12-06T17:27:23.900068"
      },
      "text": "### Science, engineering, humanities, social science and medicine fields endorsement",
      "summary": "This provision applies to applicants seeking endorsement in science, engineering, humanities, social sciences, and medicine fields. It requires demonstrating exceptional talent or promise through specific criteria, with eligibility contingent on meeting endorsing body standards and overcoming any applicable thresholds or exceptions.",
      "augmented_text": "Document: Immigration Rules Appendix Global Talent\nPart: Immigration Rules Appendix Global Talent\nSection ID: SW 3.1\nSection: Science, engineering, humanities, social science and medicine fields endorsement\nTopic: sponsorship\n\nSummary: This provision applies to applicants seeking endorsement in science, engineering, humanities, social sciences, and medicine fields. It requires demonstrating exceptional talent or promise through specific criteria, with eligibility contingent on meeting endorsing body standards and overcoming any applicable thresholds or exceptions.\n\n### Science, engineering, humanities, social science and medicine fields endorsement",
      "needs_review": false
    },
    {
      "metadata": {
        "source": "Immigration Rules Appendix Global Talent",
        "part": "Immigration Rules Appendix Global Talent",
        "section_id": "GTE 8.1",
        "section_title": "Science, engineering, humanities, social science and medicine fields track record requirement",
        "parent_section": "GTE 8",
        "hierarchy_level": 2,
        "topic": "eligibility",
        "url": "https://www.gov.uk/guidance/immigration-rules/immigration-rules-appendix-global-talent",
        "scraped_at": "2025-12-06T17:27:23.900091"
      },
      "text": "### Science, engineering, humanities, social science and medicine fields track record requirement\n\nGTE 8.1. An applicant for endorsement in the field of science, engineering, humanities, social science and medicine must be an active researcher in an academic, industry or government research institution.",
      "summary": "Applicants seeking endorsement in science, engineering, humanities, social science, or medicine must be active researchers at academic, industry, or government research institutions; this requirement applies unless otherwise specified.",
      "augmented_text": "Document: Immigration Rules Appendix Global Talent\nPart: Immigration Rules Appendix Global Talent\nSection ID: GTE 8.1\nSection: Science, engineering, humanities, social science and medicine fields track record requirement\nTopic: eligibility\n\nSummary: Applicants seeking endorsement in science, engineering, humanities, social science, or medicine must be active researchers at academic, industry, or government research institutions; this requirement applies unless otherwise specified.\n\n### Science, engineering, humanities, social science and medicine fields track record requirement\n\nGTE 8.1. An applicant for endorsement in the field of science, engineering, humanities, social science and medicine must be an active researcher in an academic, industry or government research institution.",
      "needs_review": false
    },
    {
      "metadata": {
        "source": "Immigration Rules Appendix Global Talent",
        "part": "Immigration Rules Appendix Global Talent",
        "section_id": "GTE 8.2",
        "section_title": "Fast track endorsement",
        "parent_section": null,
        "hierarchy_level": 1,
        "topic": "eligibility",
        "url": "https://www.gov.uk/guidance/immigration-rules/immigration-rules-appendix-global-talent",
        "scraped_at": "2025-12-06T17:27:23.900113"
      },
      "text": "### Fast track endorsement\n\n1.   GTE 8.2. An applicant applying for endorsement on the fast track must provide evidence of one of the following: \n    1.   (a) that they hold, or have held in the 5 years before the date of application, a peer reviewed research fellowship or award named on the list published by the Royal Society, the Royal Academy of Engineering and the British Academy; or\n    2.   (b) that they have been appointed to an eligible academic or research position at an approved UK Higher Education Institution or research institute named on the list published by the Royal Society, the Royal Academy of Engineering and the British Academy; or\n    3.   (c) that they will be hosted or employed in a UK research organisation named on the UKRI published list and will provide critical contributions to work supported by a substantial research grant or award from an endorsed funder named on the UKRI published list.\n\n2.   GTE 8.3. DELETED.\n3.   GTE 8.4. An applicant applying for endorsement on the fast track under GTE 8.2.(c) must either: \n    1.   (a) direct independently, or under the supervision of a Principal Investigator, a unique research or innovation project and meet all the following requirements: \n        1.   (i) they must have a PhD qualification or equivalent research experience (including industrial or clinical research); and\n        2.   (ii) they must actively participate in a relevant field in a University, research institute or industry; and\n        3.   (iii) they must have their name or post listed on the grant or award as the Principal or co-investigator, Researcher Co-investigator, Post-doctoral researcher or Research Assistant, or an equivalent position acceptable to UKRI; or\n\n    2.   (b) make critical contributions to research by providing core technical or domain excellence or in developing new technologies and methodologies and meet both the following requirements: \n        1.   (i) they must have a UK bachelor’s degree or equivalent overseas research degree or equivalent research experience (including industrial or clinical research); and\n        2.   (ii) they must have research experience within a University, Research Institute or Industry.",
      "summary": "Applicants seeking fast track endorsement must demonstrate recent prestigious research awards, academic or research positions at UK institutions, or hosting/employment at UK research organizations with significant grant support; they must also lead or participate in research projects and meet specific academic or professional criteria.",
      "augmented_text": "Document: Immigration Rules Appendix Global Talent\nPart: Immigration Rules Appendix Global Talent\nSection ID: GTE 8.2\nSection: Fast track endorsement\nTopic: eligibility\n\nSummary: Applicants seeking fast track endorsement must demonstrate recent prestigious research awards, academic or research positions at UK institutions, or hosting/employment at UK research organizations with significant grant support; they must also lead or participate in research projects and meet specific academic or professional criteria.\n\n### Fast track endorsement\n\n1.   GTE 8.2. An applicant applying for endorsement on the fast track must provide evidence of one of the following: \n    1.   (a) that they hold, or have held in the 5 years before the date of application, a peer reviewed research fellowship or award named on the list published by the Royal Society, the Royal Academy of Engineering and the British Academy; or\n    2.   (b) that they have been appointed to an eligible academic or research position at an approved UK Higher Education Institution or research institute named on the list published by the Royal Society, the Royal Academy of Engineering and the British Academy; or\n    3.   (c) that they will be hosted or employed in a UK research organisation named on the UKRI published list and will provide critical contributions to work supported by a substantial research grant or award from an endorsed funder named on the UKRI published list.\n\n2.   GTE 8.3. DELETED.\n3.   GTE 8.4. An applicant applying for endorsement on the fast track under GTE 8.2.(c) must either: \n    1.   (a) direct independently, or under the supervision of a Principal Investigator, a unique research or innovation project and meet all the following requirements: \n        1.   (i) they must have a PhD qualification or equivalent research experience (including industrial or clinical research); and\n        2.   (ii) they must actively participate in a relevant field in a University, research institute or industry; and\n        3.   (iii) they must have their name or post listed on the grant or award as the Principal or co-investigator, Researcher Co-investigator, Post-doctoral researcher or Research Assistant, or an equivalent position acceptable to UKRI; or\n\n    2.   (b) make critical contributions to research by providing core technical or domain excellence or in developing new technologies and methodologies and meet both the following requirements: \n        1.   (i) they must have a UK bachelor’s degree or equivalent overseas research degree or equivalent research experience (including industrial or clinical research); and\n        2.   (ii) they must have research experience within a University, Research Institute or Industry.",
      "needs_review": false
    },
    {
      "metadata": {
        "source": "Immigration Rules Appendix Global Talent",
        "part": "Immigration Rules Appendix Global Talent",
        "section_id": "GTE 8.5",
        "section_title": "Fast Track endorsement - evidential requirements",
        "parent_section": "GTE 8",
        "hierarchy_level": 2,
        "topic": "evidence",
        "url": "https://www.gov.uk/guidance/immigration-rules/immigration-rules-appendix-global-talent",
        "scraped_at": "2025-12-06T17:27:23.900139"
      },
      "text": "### Fast Track endorsement - evidential requirements\n\nGTE 8.5. An applicant on the fast track applying under GTE 8.2.(a) must provide written confirmation from an awarding body named on the list published by the Royal Society, the Royal Academy of Engineering and the British Academy that they hold, or have held in the last 5 years, an eligible peer reviewed fellowship or award.\n\n1.   GTE 8.6. An applicant on the fast track applying under GTE 8.2.(b) must hold an eligible academic or research position at an approved UK Higher Education Institution or Research Institute named on the list published by the Royal Society, the Royal Academy of Engineering and the British Academy and they must provide both: \n    1.   (a) a job description setting out the duties and responsibilities of the position; and\n    2.   (b) a statement of guarantee from the Director of Human Resources, or equivalent, which confirms: \n        1.   (i) the job was advertised, and an open competition was held, or where it was not, an explanation as to why not; and\n        2.   (ii) the applicant has accepted the job offer; and\n        3.   (iii) the job title and department in which the applicant will be based; and\n        4.   (iv) the applicant: \n            1.   (1) has responsibility for academic, research or innovation leadership and development; or\n            2.   (2) will direct or lead an individual or team research project or research programme of work; or\n            3.   (3) will direct or lead an individual or team innovation project or innovation programme of work; and\n\n        5.   (v) at least two references were received; and\n        6.   (vi) at least three academic, research or innovation representatives were on the interview panel(s); and\n        7.   (vii) at least one expert in the applicant’s field was on the interview panel(s), or at least one relevant expert, independent of the employing institution, was consulted before the job offer was made.\n\n2.   GTE 8.7. An applicant on the fast track applying under GTE 8.2.(c) must provide a declaration from the Director of Human Resources, or equivalent at the UKRI-approved UK research organisation which confirms all the following: \n    1.   (a) that the applicant has accepted the job offer or hosting agreement; and\n    2.   (b) the job title and department in which the applicant will be based; and\n    3.   (c) that there is at least one year remaining on their employment contract or hosting agreement; and\n    4.   (d) that they will provide critical contributions to work supported by a substantial research grant or award from an endorsed funder; and\n    5.   (e) that they are essential to the execution of the grant or award; and\n    6.   (f) that at least 50% of the applicant’s time will be spent working on the grant or award by the endorsed funder (Principal investigators and co-investigators can aggregate time spent on multiple eligible awards or grants to demonstrate this requirement); and\n    7.   (g) that a robust recruitment process has been completed where the applicant was not named on the grant application.\n\n3.   GTE 8.7A. An applicant on the fast track applying under GTE 8.2.(c) must show that the grant or award from an endorsed funder is worth at least £30,000, covers a minimum of two years; and is either funded by a one-off grant or award that has been won in open competition or attributed to a large institutional, renewable award that is subject to periodic peer review, by either: \n    1.   (a)providing a link to the grant or award on a UKRI-approved database the details on which would be checked by UKRI against the above requirements; or\n    2.   (b)providing written confirmation of the grant or award from the endorsed funder that the above requirements are met.",
      "summary": "This provision applies to applicants seeking fast track endorsement under the UK Global Talent route. They must provide evidence of either a peer-reviewed fellowship or an academic/research position at a UK recognized institution, with specific documentation confirming eligibility, job duties, and the authority to lead research activities, subject to conditions and approval by designated bodies.",
      "augmented_text": "Document: Immigration Rules Appendix Global Talent\nPart: Immigration Rules Appendix Global Talent\nSection ID: GTE 8.5\nSection: Fast Track endorsement - evidential requirements\nTopic: evidence\n\nSummary: This provision applies to applicants seeking fast track endorsement under the UK Global Talent route. They must provide evidence of either a peer-reviewed fellowship or an academic/research position at a UK recognized institution, with specific documentation confirming eligibility, job duties, and the authority to lead research activities, subject to conditions and approval by designated bodies.\n\n### Fast Track endorsement - evidential requirements\n\nGTE 8.5. An applicant on the fast track applying under GTE 8.2.(a) must provide written confirmation from an awarding body named on the list published by the Royal Society, the Royal Academy of Engineering and the British Academy that they hold, or have held in the last 5 years, an eligible peer reviewed fellowship or award.\n\n1.   GTE 8.6. An applicant on the fast track applying under GTE 8.2.(b) must hold an eligible academic or research position at an approved UK Higher Education Institution or Research Institute named on the list published by the Royal Society, the Royal Academy of Engineering and the British Academy and they must provide both: \n    1.   (a) a job description setting out the duties and responsibilities of the position; and\n    2.   (b) a statement of guarantee from the Director of Human Resources, or equivalent, which confirms: \n        1.   (i) the job was advertised, and an open competition was held, or where it was not, an explanation as to why not; and\n        2.   (ii) the applicant has accepted the job offer; and\n        3.   (iii) the job title and department in which the applicant will be based; and\n        4.   (iv) the applicant: \n            1.   (1) has responsibility for academic, research or innovation leadership and development; or\n            2.   (2) will direct or lead an individual or team research project or research programme of work; or\n            3.   (3) will direct or lead an individual or team innovation project or innovation programme of work; and\n\n        5.   (v) at least two references were received; and\n        6.   (vi) at least three academic, research or innovation representatives were on the interview panel(s); and\n        7.   (vii) at least one expert in the applicant’s field was on the interview panel(s), or at least one relevant expert, independent of the employing institution, was consulted before the job offer was made.\n\n2.   GTE 8.7. An applicant on the fast track applying under GTE 8.2.(c) must provide a declaration from the Director of Human Resources, or equivalent at the UKRI-approved UK research organisation which confirms all the following: \n    1.   (a) that the applicant has accepted the job offer or hosting agreement; and\n    2.   (b) the job title and department in which the applicant will be based; and\n    3.   (c) that there is at least one year remaining on their employment contract or hosting agreement; and\n    4.   (d) that they will provide critical contributions to work supported by a substantial research grant or award from an endorsed funder; and\n    5.   (e) that they are essential to the execution of the grant or award; and\n    6.   (f) that at least 50% of the applicant’s time will be spent working on the grant or award by the endorsed funder (Principal investigators and co-investigators can aggregate time spent on multiple eligible awards or grants to demonstrate this requirement); and\n    7.   (g) that a robust recruitment process has been completed where the applicant was not named on the grant application.\n\n3.   GTE 8.7A. An applicant on the fast track applying under GTE 8.2.(c) must show that the grant or award from an endorsed funder is worth at least £30,000, covers a minimum of two years; and is either funded by a one-off grant or award that has been won in open competition or attributed to a large institutional, renewable award that is subject to periodic peer review, by either: \n    1.   (a)providing a link to the grant or award on a UKRI-approved database the details on which would be checked by UKRI against the above requirements; or\n    2.   (b)providing written confirmation of the grant or award from the endorsed funder that the above requirements are met.",
      "needs_review": false
    },
    {
      "metadata": {
        "source": "Immigration Rules Appendix Global Talent",
        "part": "Immigration Rules Appendix Global Talent",
        "section_id": "GTE 8.8",
        "section_title": "Full peer review endorsement for exceptional talent",
        "parent_section": null,
        "hierarchy_level": 1,
        "topic": "eligibility",
        "url": "https://www.gov.uk/guidance/immigration-rules/immigration-rules-appendix-global-talent",
        "scraped_at": "2025-12-06T17:27:23.900159"
      },
      "text": "### Full peer review endorsement\n\n1.   GTE 8.8. An applicant evidencing exceptional talent under full peer review endorsement must satisfy the endorsing body they have been recognised as an exceptional talent in the field of science, engineering, humanities, social science or medicine; and must: \n    1.   (a) be an active researcher in a relevant field, typically in a university, research institute or in industry; and\n    2.   (b) have a PhD or equivalent research experience (including industrial or clinical research).\n\n2.   GTE 8.9. An applicant evidencing exceptional promise under full peer review endorsement must satisfy the endorsing body they have been recognised as having exceptional promise in the field of science, engineering, humanities, social science or medicine; and must: \n    1.   (a) be an active researcher in a relevant field, typically in a university, research institute or in industry; and\n    2.   (b) have a PhD or equivalent research experience (including industrial or clinical research); and\n    3.   (c) be at an early stage in their career.",
      "summary": "Applicants seeking global talent endorsement must be recognized as having either exceptional talent or promise in science, engineering, humanities, social science, or medicine, evidencing active research in relevant fields with a PhD or equivalent. Exceptional talent applicants require full peer review endorsement, while those with exceptional promise must demonstrate early career status; both must be affiliated with research institutions or industry.",
      "augmented_text": "Document: Immigration Rules Appendix Global Talent\nPart: Immigration Rules Appendix Global Talent\nSection ID: GTE 8.8\nSection: Full peer review endorsement for exceptional talent\nTopic: eligibility\n\nSummary: Applicants seeking global talent endorsement must be recognized as having either exceptional talent or promise in science, engineering, humanities, social science, or medicine, evidencing active research in relevant fields with a PhD or equivalent. Exceptional talent applicants require full peer review endorsement, while those with exceptional promise must demonstrate early career status; both must be affiliated with research institutions or industry.\n\n### Full peer review endorsement\n\n1.   GTE 8.8. An applicant evidencing exceptional talent under full peer review endorsement must satisfy the endorsing body they have been recognised as an exceptional talent in the field of science, engineering, humanities, social science or medicine; and must: \n    1.   (a) be an active researcher in a relevant field, typically in a university, research institute or in industry; and\n    2.   (b) have a PhD or equivalent research experience (including industrial or clinical research).\n\n2.   GTE 8.9. An applicant evidencing exceptional promise under full peer review endorsement must satisfy the endorsing body they have been recognised as having exceptional promise in the field of science, engineering, humanities, social science or medicine; and must: \n    1.   (a) be an active researcher in a relevant field, typically in a university, research institute or in industry; and\n    2.   (b) have a PhD or equivalent research experience (including industrial or clinical research); and\n    3.   (c) be at an early stage in their career.",
      "needs_review": false
    },
    {
      "metadata": {
        "source": "Immigration Rules Appendix Global Talent",
        "part": "Immigration Rules Appendix Global Talent",
        "section_id": "GTE 8.10",
        "section_title": "Full peer review endorsement evidential requirements",
        "parent_section": null,
        "hierarchy_level": 1,
        "topic": "eligibility",
        "url": "https://www.gov.uk/guidance/immigration-rules/immigration-rules-appendix-global-talent",
        "scraped_at": "2025-12-06T17:27:23.900182"
      },
      "text": "### Full peer review endorsement evidential requirements\n\n1.   GTE 8.10. A full peer review endorsement applicant must: \n    1.   (a) provide a CV which sets out their career and publication history; and\n    2.   (b) provide a letter of personal recommendation from an eminent person resident in the UK supporting the Global Talent application which includes all of the following: \n        1.   (i) how the author knows the applicant; and\n        2.   (ii) the applicant’s achievements in the relevant field; and\n        3.   (iii) how the author considers the applicant shows exceptional talent or promise; and\n        4.   (iv) the contribution the applicant would be expected to make to UK research and innovation excellence and wider society; and\n\n    3.   (c) if evidencing exceptional talent, provide a letter from an additional eminent person in the applicant’s field, which includes all of the following: \n        1.   (i) a statement confirming that the author is a senior member of a reputable UK organisation concerned with research or innovation in the applicant’s field; and\n        2.   (ii) how the author considers the applicant’s work to show exceptional talent; and\n        3.   (iii) the contribution the applicant would be expected to make to UK research or innovation excellence and wider society; and\n        4.   (iv) a statement confirming that the author’s assessment is provided on the basis of their capacity as an objective expert in their field and is an objective assessment of the applicant’s reputation in the field, notwithstanding any personal knowledge they may have of the applicant or any direct involvement they may have (or previously have had) in the applicant’s work.",
      "summary": "Applicants seeking a full peer review endorsement must submit a CV detailing their career and publications, along with recommendation letters from UK eminent experts confirming their achievements, exceptional talent, and potential contributions to UK research and society. Additional evidence is required if demonstrating exceptional talent, including statements from senior UK research or innovation leaders. Critical conditions include providing clear, expert-driven evidence and ensuring recommendations are objective.",
      "augmented_text": "Document: Immigration Rules Appendix Global Talent\nPart: Immigration Rules Appendix Global Talent\nSection ID: GTE 8.10\nSection: Full peer review endorsement evidential requirements\nTopic: eligibility\n\nSummary: Applicants seeking a full peer review endorsement must submit a CV detailing their career and publications, along with recommendation letters from UK eminent experts confirming their achievements, exceptional talent, and potential contributions to UK research and society. Additional evidence is required if demonstrating exceptional talent, including statements from senior UK research or innovation leaders. Critical conditions include providing clear, expert-driven evidence and ensuring recommendations are objective.\n\n### Full peer review endorsement evidential requirements\n\n1.   GTE 8.10. A full peer review endorsement applicant must: \n    1.   (a) provide a CV which sets out their career and publication history; and\n    2.   (b) provide a letter of personal recommendation from an eminent person resident in the UK supporting the Global Talent application which includes all of the following: \n        1.   (i) how the author knows the applicant; and\n        2.   (ii) the applicant’s achievements in the relevant field; and\n        3.   (iii) how the author considers the applicant shows exceptional talent or promise; and\n        4.   (iv) the contribution the applicant would be expected to make to UK research and innovation excellence and wider society; and\n\n    3.   (c) if evidencing exceptional talent, provide a letter from an additional eminent person in the applicant’s field, which includes all of the following: \n        1.   (i) a statement confirming that the author is a senior member of a reputable UK organisation concerned with research or innovation in the applicant’s field; and\n        2.   (ii) how the author considers the applicant’s work to show exceptional talent; and\n        3.   (iii) the contribution the applicant would be expected to make to UK research or innovation excellence and wider society; and\n        4.   (iv) a statement confirming that the author’s assessment is provided on the basis of their capacity as an objective expert in their field and is an objective assessment of the applicant’s reputation in the field, notwithstanding any personal knowledge they may have of the applicant or any direct involvement they may have (or previously have had) in the applicant’s work.",
      "needs_review": false
    },
    {
      "metadata": {
        "source": "Immigration Rules Appendix Global Talent",
        "part": "Immigration Rules Appendix Global Talent",
        "section_id": "Part 2- Application for entry clearance or permission on the Global Talent Route",
        "section_title": "Part 2- Application for entry clearance or permission on the Global Talent Route",
        "parent_section": null,
        "hierarchy_level": 2,
        "topic": "leave-to-enter",
        "url": "https://www.gov.uk/guidance/immigration-rules/immigration-rules-appendix-global-talent",
        "scraped_at": "2025-12-06T17:27:23.900193"
      },
      "text": "### Part 2- Application for entry clearance or permission on the Global Talent Route",
      "summary": "This provision applies to applicants seeking entry clearance or permission under the Global Talent Route. It requires demonstrating exceptional talent or promise in designated fields, with specific criteria and exceptions outlined for eligibility. Applicants must meet the relevant thresholds unless otherwise specified.",
      "augmented_text": "Document: Immigration Rules Appendix Global Talent\nPart: Immigration Rules Appendix Global Talent\nSection ID: Part 2- Application for entry clearance or permission on the Global Talent Route\nSection: Part 2- Application for entry clearance or permission on the Global Talent Route\nTopic: leave-to-enter\n\nSummary: This provision applies to applicants seeking entry clearance or permission under the Global Talent Route. It requires demonstrating exceptional talent or promise in designated fields, with specific criteria and exceptions outlined for eligibility. Applicants must meet the relevant thresholds unless otherwise specified.\n\n### Part 2- Application for entry clearance or permission on the Global Talent Route",
      "needs_review": false
    },
    {
      "metadata": {
        "source": "Immigration Rules Appendix Global Talent",
        "part": "Immigration Rules Appendix Global Talent",
        "section_id": "GT 1.1",
        "section_title": "Validity Requirements for Global Talent route",
        "parent_section": "GT 1",
        "hierarchy_level": 2,
        "topic": "leave-to-enter",
        "url": "https://www.gov.uk/guidance/immigration-rules/immigration-rules-appendix-global-talent",
        "scraped_at": "2025-12-06T17:27:23.900214"
      },
      "text": "### Validity Requirements for Global Talent route\n\nGT 1.1. A person applying for entry clearance or permission to stay on the Global Talent route must apply online on the specified form on gov.uk website as follows:\n\n| Applicant | Specified form |\n| --- | --- |\n| EEA national with a chipped passport | Either: • Global Talent using the UK Immigration: ID Check app (when available); or • the forms listed below for applicants outside or inside the UK (as relevant) |\n| Applicants outside the UK | Global Talent visa – stage 2 |\n| Applicants inside the UK | Global Talent permission to stay – stage 2 |\n\n1.   GT 1.2. An application for entry clearance or permission to stay on the Global Talent route must meet all the following requirements: \n    1.   (a) any fee and Immigration Health Charge must have been paid; and\n    2.   (b) the applicant must have provided biometrics when required; and\n    3.   (c) the applicant must have provided a passport or other travel document which satisfactorily establishes their identity and nationality; and\n    4.   (d)the applicant must have been issued with an endorsement letter by a Home Office approved endorsing body or have been awarded a prize listed in Appendix Global Talent: Prestigious Prizes; and\n    5.   (e)if applying for the first grant of permission on the Global Talent route using an endorsement letter, the date of application must be no more than 3 months after the date on the endorsement letter; and\n    6.   (f) the applicant’s endorsement or prize must not have been withdrawn or suspended.\n\nGT 1.3. If the applicant has in the last 12 months before the date of application received an award from a Government or international scholarship agency covering both fees and living costs for study in the UK, they must provide written consent to the application from that Government or agency.\n\nGT 1.4. The applicant must be aged 18 or over on the date of application.\n\n1.   GT 1.5. If applying for permission to stay, the applicant must be in the UK on the date of application.\n2.   GT 1.5ZA. If applying for permission to stay, the applicant must not have, or have last been granted, permission: \n    1.   (a) as a Visitor; or\n    2.   (b) as a Short-term Student; or\n    3.   (c) as a Parent of a Child Student; or\n    4.   (d) as a Seasonal Worker; or\n    5.   (e) as a Domestic Worker in a Private Household; or\n    6.   (f) outside the Immigration Rules.\n\n1.   GT 1.5A. An applicant who is applying for permission to stay and has, or last had, permission as a Student, must fulfil one of the Conditions A or B below on the date of application: \n    1.   (a) Condition A: the applicant must have completed the course of study for which the Confirmation of Acceptance for Studies was assigned (or a course to which ST 27.3 of Appendix Student applies); or\n    2.   (b) Condition B: the applicant must: \n        1.   (i) be studying a full-time course of study leading to the award of a PhD with a higher education provider which has a track record of compliance; and\n        2.   (ii) have completed at least 24 months of study on that course.\n\nGT 1.6. An application which does not meet all the validity requirements for the Global Talent route may be rejected as invalid and not considered.",
      "summary": "Applicants seeking permission on the UK Global Talent route must submit online applications, pay relevant fees and charges, provide biometrics, and hold an endorsed letter or prestigious prize. Applications must be made within three months of endorsement issuance and meet all specified documentation and eligibility requirements.",
      "augmented_text": "Document: Immigration Rules Appendix Global Talent\nPart: Immigration Rules Appendix Global Talent\nSection ID: GT 1.1\nSection: Validity Requirements for Global Talent route\nTopic: leave-to-enter\n\nSummary: Applicants seeking permission on the UK Global Talent route must submit online applications, pay relevant fees and charges, provide biometrics, and hold an endorsed letter or prestigious prize. Applications must be made within three months of endorsement issuance and meet all specified documentation and eligibility requirements.\n\n### Validity Requirements for Global Talent route\n\nGT 1.1. A person applying for entry clearance or permission to stay on the Global Talent route must apply online on the specified form on gov.uk website as follows:\n\n| Applicant | Specified form |\n| --- | --- |\n| EEA national with a chipped passport | Either: • Global Talent using the UK Immigration: ID Check app (when available); or • the forms listed below for applicants outside or inside the UK (as relevant) |\n| Applicants outside the UK | Global Talent visa – stage 2 |\n| Applicants inside the UK | Global Talent permission to stay – stage 2 |\n\n1.   GT 1.2. An application for entry clearance or permission to stay on the Global Talent route must meet all the following requirements: \n    1.   (a) any fee and Immigration Health Charge must have been paid; and\n    2.   (b) the applicant must have provided biometrics when required; and\n    3.   (c) the applicant must have provided a passport or other travel document which satisfactorily establishes their identity and nationality; and\n    4.   (d)the applicant must have been issued with an endorsement letter by a Home Office approved endorsing body or have been awarded a prize listed in Appendix Global Talent: Prestigious Prizes; and\n    5.   (e)if applying for the first grant of permission on the Global Talent route using an endorsement letter, the date of application must be no more than 3 months after the date on the endorsement letter; and\n    6.   (f) the applicant’s endorsement or prize must not have been withdrawn or suspended.\n\nGT 1.3. If the applicant has in the last 12 months before the date of application received an award from a Government or international scholarship agency covering both fees and living costs for study in the UK, they must provide written consent to the application from that Government or agency.\n\nGT 1.4. The applicant must be aged 18 or over on the date of application.\n\n1.   GT 1.5. If applying for permission to stay, the applicant must be in the UK on the date of application.\n2.   GT 1.5ZA. If applying for permission to stay, the applicant must not have, or have last been granted, permission: \n    1.   (a) as a Visitor; or\n    2.   (b) as a Short-term Student; or\n    3.   (c) as a Parent of a Child Student; or\n    4.   (d) as a Seasonal Worker; or\n    5.   (e) as a Domestic Worker in a Private Household; or\n    6.   (f) outside the Immigration Rules.\n\n1.   GT 1.5A. An applicant who is applying for permission to stay and has, or last had, permission as a Student, must fulfil one of the Conditions A or B below on the date of application: \n    1.   (a) Condition A: the applicant must have completed the course of study for which the Confirmation of Acceptance for Studies was assigned (or a course to which ST 27.3 of Appendix Student applies); or\n    2.   (b) Condition B: the applicant must: \n        1.   (i) be studying a full-time course of study leading to the award of a PhD with a higher education provider which has a track record of compliance; and\n        2.   (ii) have completed at least 24 months of study on that course.\n\nGT 1.6. An application which does not meet all the validity requirements for the Global Talent route may be rejected as invalid and not considered.",
      "needs_review": false
    },
    {
      "metadata": {
        "source": "Immigration Rules Appendix Global Talent",
        "part": "Immigration Rules Appendix Global Talent",
        "section_id": "GT 2.1",
        "section_title": "Suitability Requirements for Global Talent route",
        "parent_section": "GT 2",
        "hierarchy_level": 2,
        "topic": "suitability",
        "url": "https://www.gov.uk/guidance/immigration-rules/immigration-rules-appendix-global-talent",
        "scraped_at": "2025-12-06T17:27:23.900227"
      },
      "text": "### Suitability Requirements for Global Talent route\n\nGT 2.1. The applicant must not fall for refusal under Part Suitability.\n\n1.   GT 2.2. If applying for permission to stay the applicant must not be: \n    1.   (a) in breach of immigration laws, except that where the Exceptions for overstayers section of Part Suitability applies, that period of overstaying will be disregarded; or\n    2.   (b) on immigration bail",
      "summary": "Applicants for the Global Talent route must be suitable under Part Suitability, not breaching immigration laws (unless exceptions apply) or on immigration bail.",
      "augmented_text": "Document: Immigration Rules Appendix Global Talent\nPart: Immigration Rules Appendix Global Talent\nSection ID: GT 2.1\nSection: Suitability Requirements for Global Talent route\nTopic: suitability\n\nSummary: Applicants for the Global Talent route must be suitable under Part Suitability, not breaching immigration laws (unless exceptions apply) or on immigration bail.\n\n### Suitability Requirements for Global Talent route\n\nGT 2.1. The applicant must not fall for refusal under Part Suitability.\n\n1.   GT 2.2. If applying for permission to stay the applicant must not be: \n    1.   (a) in breach of immigration laws, except that where the Exceptions for overstayers section of Part Suitability applies, that period of overstaying will be disregarded; or\n    2.   (b) on immigration bail",
      "needs_review": false
    },
    {
      "metadata": {
        "source": "Immigration Rules Appendix Global Talent",
        "part": "Immigration Rules Appendix Global Talent",
        "section_id": "Eligibility Requirements for Global Talent route",
        "section_title": "Eligibility Requirements for Global Talent route",
        "parent_section": null,
        "hierarchy_level": 2,
        "topic": "eligibility",
        "url": "https://www.gov.uk/guidance/immigration-rules/immigration-rules-appendix-global-talent",
        "scraped_at": "2025-12-06T17:27:23.900233"
      },
      "text": "### Eligibility Requirements for Global Talent route",
      "summary": "The Global Talent route applies to eligible applicants endorsed for exceptional talent or promise in specific fields. Applicants must obtain an endorsement confirming their exceptional ability or potential; certain thresholds or criteria apply, with exceptions for endorsed individuals.",
      "augmented_text": "Document: Immigration Rules Appendix Global Talent\nPart: Immigration Rules Appendix Global Talent\nSection ID: Eligibility Requirements for Global Talent route\nSection: Eligibility Requirements for Global Talent route\nTopic: eligibility\n\nSummary: The Global Talent route applies to eligible applicants endorsed for exceptional talent or promise in specific fields. Applicants must obtain an endorsement confirming their exceptional ability or potential; certain thresholds or criteria apply, with exceptions for endorsed individuals.\n\n### Eligibility Requirements for Global Talent route",
      "needs_review": false
    },
    {
      "metadata": {
        "source": "Immigration Rules Appendix Global Talent",
        "part": "Immigration Rules Appendix Global Talent",
        "section_id": "GT 3.1",
        "section_title": "Entry requirements for Global Talent route",
        "parent_section": "GT 3",
        "hierarchy_level": 2,
        "topic": "leave-to-enter",
        "url": "https://www.gov.uk/guidance/immigration-rules/immigration-rules-appendix-global-talent",
        "scraped_at": "2025-12-06T17:27:23.900248"
      },
      "text": "### Entry requirements for Global Talent route\n\nGT 3.1. A person seeking to come to the UK on the Global Talent route must apply for and obtain entry clearance on the Global Talent route before their arrival in the UK.\n\nGT 3.2. A person applying for entry clearance on the Global Talent route must, if Appendix Tuberculosis applies, provide a valid medical certificate confirming that they have undergone screening for active pulmonary tuberculosis and that this tuberculosis is not present in them.",
      "summary": "Applicants seeking entry on the UK Global Talent route must obtain entry clearance prior to arrival and, where applicable, provide a valid TB screening certificate.",
      "augmented_text": "Document: Immigration Rules Appendix Global Talent\nPart: Immigration Rules Appendix Global Talent\nSection ID: GT 3.1\nSection: Entry requirements for Global Talent route\nTopic: leave-to-enter\n\nSummary: Applicants seeking entry on the UK Global Talent route must obtain entry clearance prior to arrival and, where applicable, provide a valid TB screening certificate.\n\n### Entry requirements for Global Talent route\n\nGT 3.1. A person seeking to come to the UK on the Global Talent route must apply for and obtain entry clearance on the Global Talent route before their arrival in the UK.\n\nGT 3.2. A person applying for entry clearance on the Global Talent route must, if Appendix Tuberculosis applies, provide a valid medical certificate confirming that they have undergone screening for active pulmonary tuberculosis and that this tuberculosis is not present in them.",
      "needs_review": false
    },
    {
      "metadata": {
        "source": "Immigration Rules Appendix Global Talent",
        "part": "Immigration Rules Appendix Global Talent",
        "section_id": "GT 4.1",
        "section_title": "Points requirement for Global Talent route",
        "parent_section": "GT 4",
        "hierarchy_level": 2,
        "topic": "leave-to-enter",
        "url": "https://www.gov.uk/guidance/immigration-rules/immigration-rules-appendix-global-talent",
        "scraped_at": "2025-12-06T17:27:23.900265"
      },
      "text": "### Points requirement for Global Talent route\n\nGT 4.1. An applicant applying for entry clearance or permission to stay must be awarded 70 points in the table below.\n\n| Requirement | Points available |\n| --- | --- |\n| An applicant making an initial application not relying on an endorsement: • has been awarded a qualifying prize listed in Appendix Global Talent: Prestigious Prizes. | 70 |\n| An applicant making an initial application relying on an endorsement: • has been issued with an endorsement letter by an endorsing body; and • the date of application is no more than 3 months after the date on the endorsement letter; and • the endorsement has not been withdrawn by the endorsing body. | 70 |\n| An applicant applying for an extension of their permission: • has met the earned money requirement; and • if they were granted their initial application using an endorsement, has not had their endorsement withdrawn by the endorsing body. | 70 |\n| Total number of points required in each case | 70 |\n\nGT 4.1ZA. An applicant who has held permission on the Global Talent route in the 12 months immediately before the date of application will be considered under the extension of permission requirements in GT 5.1.",
      "summary": "The UK Global Talent route applies to applicants seeking entry clearance or permission to stay, requiring 70 points. Eligible applicants must either have won a qualifying prize or possess an endorsing body’s letter, meeting specific timing and validity conditions, including no withdrawal of endorsement.",
      "augmented_text": "Document: Immigration Rules Appendix Global Talent\nPart: Immigration Rules Appendix Global Talent\nSection ID: GT 4.1\nSection: Points requirement for Global Talent route\nTopic: leave-to-enter\n\nSummary: The UK Global Talent route applies to applicants seeking entry clearance or permission to stay, requiring 70 points. Eligible applicants must either have won a qualifying prize or possess an endorsing body’s letter, meeting specific timing and validity conditions, including no withdrawal of endorsement.\n\n### Points requirement for Global Talent route\n\nGT 4.1. An applicant applying for entry clearance or permission to stay must be awarded 70 points in the table below.\n\n| Requirement | Points available |\n| --- | --- |\n| An applicant making an initial application not relying on an endorsement: • has been awarded a qualifying prize listed in Appendix Global Talent: Prestigious Prizes. | 70 |\n| An applicant making an initial application relying on an endorsement: • has been issued with an endorsement letter by an endorsing body; and • the date of application is no more than 3 months after the date on the endorsement letter; and • the endorsement has not been withdrawn by the endorsing body. | 70 |\n| An applicant applying for an extension of their permission: • has met the earned money requirement; and • if they were granted their initial application using an endorsement, has not had their endorsement withdrawn by the endorsing body. | 70 |\n| Total number of points required in each case | 70 |\n\nGT 4.1ZA. An applicant who has held permission on the Global Talent route in the 12 months immediately before the date of application will be considered under the extension of permission requirements in GT 5.1.",
      "needs_review": false
    },
    {
      "metadata": {
        "source": "Immigration Rules Appendix Global Talent",
        "part": "Immigration Rules Appendix Global Talent",
        "section_id": "1",
        "section_title": "Points for initial application on the Global Talent route",
        "parent_section": null,
        "hierarchy_level": 1,
        "topic": "points",
        "url": "https://www.gov.uk/guidance/immigration-rules/immigration-rules-appendix-global-talent",
        "scraped_at": "2025-12-06T17:27:23.900285"
      },
      "text": "### Points for initial application on the Global Talent route\n\n1.   GT 4.1A. Applicants relying on a prize in Appendix Global Talent: Prestigious Prizes to score points must meet both of the following requirements: \n    1.   (a) they must be the named recipient of the prize (prizes given to an organisation or group the applicant is associated with are not acceptable); and\n    2.   (b) the prize issued by the relevant body must not have been withdrawn or suspended.\n\n1.   GT 4.2. Applicants relying on an endorsement to score points must meet both of the following requirements: \n    1.   (a) the endorsement issued by the endorsing body must not have been withdrawn; and\n    2.   (b) the endorsing body must continue to be approved by the Home Office on the date of decision.\n\nGT 4.3. If the requirements in GT4.1A or GT 4.2. are met 70 points will be awarded for an initial application on the Global Talent route.",
      "summary": "Applicants seeking initial entry under the UK Global Talent route must meet criteria related to prestigious prizes or endorsements, ensuring prizes are awarded directly to them and are valid, and endorsements are approved and active. Once these conditions are satisfied, 70 points are awarded toward their application.",
      "augmented_text": "Document: Immigration Rules Appendix Global Talent\nPart: Immigration Rules Appendix Global Talent\nSection ID: 1\nSection: Points for initial application on the Global Talent route\nTopic: points\n\nSummary: Applicants seeking initial entry under the UK Global Talent route must meet criteria related to prestigious prizes or endorsements, ensuring prizes are awarded directly to them and are valid, and endorsements are approved and active. Once these conditions are satisfied, 70 points are awarded toward their application.\n\n### Points for initial application on the Global Talent route\n\n1.   GT 4.1A. Applicants relying on a prize in Appendix Global Talent: Prestigious Prizes to score points must meet both of the following requirements: \n    1.   (a) they must be the named recipient of the prize (prizes given to an organisation or group the applicant is associated with are not acceptable); and\n    2.   (b) the prize issued by the relevant body must not have been withdrawn or suspended.\n\n1.   GT 4.2. Applicants relying on an endorsement to score points must meet both of the following requirements: \n    1.   (a) the endorsement issued by the endorsing body must not have been withdrawn; and\n    2.   (b) the endorsing body must continue to be approved by the Home Office on the date of decision.\n\nGT 4.3. If the requirements in GT4.1A or GT 4.2. are met 70 points will be awarded for an initial application on the Global Talent route.",
      "needs_review": false
    },
    {
      "metadata": {
        "source": "Immigration Rules Appendix Global Talent",
        "part": "Immigration Rules Appendix Global Talent",
        "section_id": "1",
        "section_title": "Points for extension of stay on the Global Talent route",
        "parent_section": null,
        "hierarchy_level": 1,
        "topic": "leave-to-remain",
        "url": "https://www.gov.uk/guidance/immigration-rules/immigration-rules-appendix-global-talent",
        "scraped_at": "2025-12-06T17:27:23.900302"
      },
      "text": "### Points for extension of stay on the Global Talent route\n\n1.   GT 5.1. An applicant who has, or last had, permission on the Global Talent route and is applying for an extension of permission must meet the following requirements: \n    1.   (a) the applicant must have earned money in the UK during their last period of permission in either: \n        1.   (i) a field related to the subject matter of their prize if they were granted their initial application using a prize listed in Appendix Global Talent: Prestigious Prizes; or\n        2.   (ii) the field in which they were previously endorsed in the Global Talent route if they were granted their initial application using an endorsement; and\n\n    2.   (b) if the applicant was granted their initial application using an endorsement: \n        1.   (i) the endorsement letter issued by a Home Office approved endorsing body must not have been withdrawn; and\n        2.   (ii) the endorsing body must continue to be approved by the Home Office on the date of decision.\n\nGT 5.2. DELETED.\n\nGT 5.3. If the requirements in GT 5.1. are met 70 points will be awarded for an application for an extension of stay on the Global Talent route.",
      "summary": "This provision applies to individuals seeking an extension of stay on the UK Global Talent route. Applicants must have earned money in the UK related to their initial prize or endorsement field, and if endorsed, their endorsing body's approval must remain valid; meeting these criteria grants 70 points toward extension.",
      "augmented_text": "Document: Immigration Rules Appendix Global Talent\nPart: Immigration Rules Appendix Global Talent\nSection ID: 1\nSection: Points for extension of stay on the Global Talent route\nTopic: leave-to-remain\n\nSummary: This provision applies to individuals seeking an extension of stay on the UK Global Talent route. Applicants must have earned money in the UK related to their initial prize or endorsement field, and if endorsed, their endorsing body's approval must remain valid; meeting these criteria grants 70 points toward extension.\n\n### Points for extension of stay on the Global Talent route\n\n1.   GT 5.1. An applicant who has, or last had, permission on the Global Talent route and is applying for an extension of permission must meet the following requirements: \n    1.   (a) the applicant must have earned money in the UK during their last period of permission in either: \n        1.   (i) a field related to the subject matter of their prize if they were granted their initial application using a prize listed in Appendix Global Talent: Prestigious Prizes; or\n        2.   (ii) the field in which they were previously endorsed in the Global Talent route if they were granted their initial application using an endorsement; and\n\n    2.   (b) if the applicant was granted their initial application using an endorsement: \n        1.   (i) the endorsement letter issued by a Home Office approved endorsing body must not have been withdrawn; and\n        2.   (ii) the endorsing body must continue to be approved by the Home Office on the date of decision.\n\nGT 5.2. DELETED.\n\nGT 5.3. If the requirements in GT 5.1. are met 70 points will be awarded for an application for an extension of stay on the Global Talent route.",
      "needs_review": false
    },
    {
      "metadata": {
        "source": "Immigration Rules Appendix Global Talent",
        "part": "Immigration Rules Appendix Global Talent",
        "section_id": "GT 6.1",
        "section_title": "Decision on an application on the Global Talent route",
        "parent_section": "GT 6",
        "hierarchy_level": 2,
        "topic": "eligibility",
        "url": "https://www.gov.uk/guidance/immigration-rules/immigration-rules-appendix-global-talent",
        "scraped_at": "2025-12-06T17:27:23.900310"
      },
      "text": "### Decision on an application on the Global Talent route\n\nGT 6.1. If the decision maker is satisfied that all the suitability and eligibility requirements for the Global Talent route are met the application will be granted, otherwise the application will be refused.\n\nGT 6.2. If the application is refused the person can apply for an Administrative Review under Appendix AR: Administrative Review.",
      "summary": "Applicants on the Global Talent route must meet all suitability and eligibility criteria for their application to be granted; failure to do so results in refusal. Refused applications can be challenged through an Administrative Review process.",
      "augmented_text": "Document: Immigration Rules Appendix Global Talent\nPart: Immigration Rules Appendix Global Talent\nSection ID: GT 6.1\nSection: Decision on an application on the Global Talent route\nTopic: eligibility\n\nSummary: Applicants on the Global Talent route must meet all suitability and eligibility criteria for their application to be granted; failure to do so results in refusal. Refused applications can be challenged through an Administrative Review process.\n\n### Decision on an application on the Global Talent route\n\nGT 6.1. If the decision maker is satisfied that all the suitability and eligibility requirements for the Global Talent route are met the application will be granted, otherwise the application will be refused.\n\nGT 6.2. If the application is refused the person can apply for an Administrative Review under Appendix AR: Administrative Review.",
      "needs_review": false
    },
    {
      "metadata": {
        "source": "Immigration Rules Appendix Global Talent",
        "part": "Immigration Rules Appendix Global Talent",
        "section_id": "GT 7.1",
        "section_title": "Period of grant on the Global Talent route",
        "parent_section": "GT 7",
        "hierarchy_level": 2,
        "topic": "duration",
        "url": "https://www.gov.uk/guidance/immigration-rules/immigration-rules-appendix-global-talent",
        "scraped_at": "2025-12-06T17:27:23.900330"
      },
      "text": "### Period of grant on the Global Talent route\n\nGT 7.1. Permission will be granted for the period of years the applicant requests, up to a maximum of 5 years on each application.\n\nGT 7.2. There is no limit on the total period of permission that may be granted on the Global Talent route.",
      "summary": "Applicants applying under the Global Talent route may be granted permission for up to 5 years per application, with no overall limit on total permission duration.",
      "augmented_text": "Document: Immigration Rules Appendix Global Talent\nPart: Immigration Rules Appendix Global Talent\nSection ID: GT 7.1\nSection: Period of grant on the Global Talent route\nTopic: duration\n\nSummary: Applicants applying under the Global Talent route may be granted permission for up to 5 years per application, with no overall limit on total permission duration.\n\n### Period of grant on the Global Talent route\n\nGT 7.1. Permission will be granted for the period of years the applicant requests, up to a maximum of 5 years on each application.\n\nGT 7.2. There is no limit on the total period of permission that may be granted on the Global Talent route.",
      "needs_review": false
    },
    {
      "metadata": {
        "source": "Immigration Rules Appendix Global Talent",
        "part": "Immigration Rules Appendix Global Talent",
        "section_id": "1",
        "section_title": "Conditions of grant on the Global Talent route",
        "parent_section": null,
        "hierarchy_level": 1,
        "topic": "financial",
        "url": "https://www.gov.uk/guidance/immigration-rules/immigration-rules-appendix-global-talent",
        "scraped_at": "2025-12-06T17:27:23.900340"
      },
      "text": "### Conditions of grant on the Global Talent route\n\n1.   GT 7.3. The grant will be subject to all the following conditions: \n    1.   (a) no access to public funds; and\n    2.   (b) work (including self-employment and voluntary work) permitted except for employment as a professional sportsperson (including as a sports coach); and\n    3.   (c) study is permitted, subject to the ATAS condition in Appendix ATAS.\n    4.   (d) DELETED",
      "summary": "The Global Talent route applies to eligible applicants granted visas, who must not access public funds, may work (excluding professional sports employment), and can study (with ATAS approval). These conditions are mandatory for visa validity.",
      "augmented_text": "Document: Immigration Rules Appendix Global Talent\nPart: Immigration Rules Appendix Global Talent\nSection ID: 1\nSection: Conditions of grant on the Global Talent route\nTopic: financial\n\nSummary: The Global Talent route applies to eligible applicants granted visas, who must not access public funds, may work (excluding professional sports employment), and can study (with ATAS approval). These conditions are mandatory for visa validity.\n\n### Conditions of grant on the Global Talent route\n\n1.   GT 7.3. The grant will be subject to all the following conditions: \n    1.   (a) no access to public funds; and\n    2.   (b) work (including self-employment and voluntary work) permitted except for employment as a professional sportsperson (including as a sports coach); and\n    3.   (c) study is permitted, subject to the ATAS condition in Appendix ATAS.\n    4.   (d) DELETED",
      "needs_review": false
    },
    {
      "metadata": {
        "source": "Immigration Rules Appendix Global Talent",
        "part": "Immigration Rules Appendix Global Talent",
        "section_id": "Settlement by a person on the Global Talent route",
        "section_title": "Settlement by a person on the Global Talent route",
        "parent_section": null,
        "hierarchy_level": 2,
        "topic": "settlement",
        "url": "https://www.gov.uk/guidance/immigration-rules/immigration-rules-appendix-global-talent",
        "scraped_at": "2025-12-06T17:27:23.900350"
      },
      "text": "### Settlement by a person on the Global Talent route",
      "summary": "This provision applies to individuals on the Global Talent route seeking settlement. It requires meeting specific residence and eligibility criteria, with exceptions for certain visa types or periods of absence, to qualify for indefinite leave to remain.",
      "augmented_text": "Document: Immigration Rules Appendix Global Talent\nPart: Immigration Rules Appendix Global Talent\nSection ID: Settlement by a person on the Global Talent route\nSection: Settlement by a person on the Global Talent route\nTopic: settlement\n\nSummary: This provision applies to individuals on the Global Talent route seeking settlement. It requires meeting specific residence and eligibility criteria, with exceptions for certain visa types or periods of absence, to qualify for indefinite leave to remain.\n\n### Settlement by a person on the Global Talent route",
      "needs_review": false
    },
    {
      "metadata": {
        "source": "Immigration Rules Appendix Global Talent",
        "part": "Immigration Rules Appendix Global Talent",
        "section_id": "GT 8.1",
        "section_title": "Validity requirements for settlement by a person on the Global Talent route",
        "parent_section": "GT 8",
        "hierarchy_level": 2,
        "topic": "settlement",
        "url": "https://www.gov.uk/guidance/immigration-rules/immigration-rules-appendix-global-talent",
        "scraped_at": "2025-12-06T17:27:23.900373"
      },
      "text": "### Validity requirements for settlement by a person on the Global Talent route\n\nGT 8.1. A person applying for settlement on the Global Talent route must apply online on the gov.uk website on the specified form “Settle in the UK in various immigration categories: form SET(O)”.\n\n1.   GT 8.2. An application for settlement on the Global Talent route must meet all the following requirements: \n    1.   (a) any fee must have been paid; and\n    2.   (b) the applicant must have provided any required biometrics; and\n    3.   (c) the applicant must have provided a passport or other travel document which satisfactorily establishes their identity and nationality; and\n    4.   (d) the applicant must be in the UK; and\n    5.   (e) the applicant’s endorsement or prize listed in Appendix Global Talent: Prestigious Prizes must not have been withdrawn or suspended.\n\nGT 8.3. The applicant must have, or have last been granted, permission on the Global Talent route.\n\nGT 8.4. An application which does not meet all the validity requirements for settlement on the Global Talent route may be rejected as invalid and not considered.",
      "summary": "Applicants applying for settlement on the Global Talent route must submit an online form, pay fees, provide biometrics, a valid travel document, and ensure their endorsement remains valid. They must also be in the UK and have current or previous permission on this route; failure to meet these conditions may lead to rejection.",
      "augmented_text": "Document: Immigration Rules Appendix Global Talent\nPart: Immigration Rules Appendix Global Talent\nSection ID: GT 8.1\nSection: Validity requirements for settlement by a person on the Global Talent route\nTopic: settlement\n\nSummary: Applicants applying for settlement on the Global Talent route must submit an online form, pay fees, provide biometrics, a valid travel document, and ensure their endorsement remains valid. They must also be in the UK and have current or previous permission on this route; failure to meet these conditions may lead to rejection.\n\n### Validity requirements for settlement by a person on the Global Talent route\n\nGT 8.1. A person applying for settlement on the Global Talent route must apply online on the gov.uk website on the specified form “Settle in the UK in various immigration categories: form SET(O)”.\n\n1.   GT 8.2. An application for settlement on the Global Talent route must meet all the following requirements: \n    1.   (a) any fee must have been paid; and\n    2.   (b) the applicant must have provided any required biometrics; and\n    3.   (c) the applicant must have provided a passport or other travel document which satisfactorily establishes their identity and nationality; and\n    4.   (d) the applicant must be in the UK; and\n    5.   (e) the applicant’s endorsement or prize listed in Appendix Global Talent: Prestigious Prizes must not have been withdrawn or suspended.\n\nGT 8.3. The applicant must have, or have last been granted, permission on the Global Talent route.\n\nGT 8.4. An application which does not meet all the validity requirements for settlement on the Global Talent route may be rejected as invalid and not considered.",
      "needs_review": false
    },
    {
      "metadata": {
        "source": "Immigration Rules Appendix Global Talent",
        "part": "Immigration Rules Appendix Global Talent",
        "section_id": "GT 9.1",
        "section_title": "Suitability requirements for settlement by a person on the Global Talent route",
        "parent_section": "GT 9",
        "hierarchy_level": 2,
        "topic": "suitability",
        "url": "https://www.gov.uk/guidance/immigration-rules/immigration-rules-appendix-global-talent",
        "scraped_at": "2025-12-06T17:27:23.900386"
      },
      "text": "### Suitability requirements for settlement by a person on the Global Talent route\n\nGT 9.1. The applicant must not fall for refusal under Part Suitability.\n\n1.   GT 9.2. The applicant must not be: \n    1.   (a) in breach of immigration laws, except that where the Exceptions for overstayers section of Part Suitability applies, that period of overstaying will be disregarded; or\n    2.   (b) on immigration bail.",
      "summary": "Applicants on the Global Talent route must not breach immigration laws (unless eligible for overstaying exceptions) or be on immigration bail to be considered suitable for settlement under GT 9.1.",
      "augmented_text": "Document: Immigration Rules Appendix Global Talent\nPart: Immigration Rules Appendix Global Talent\nSection ID: GT 9.1\nSection: Suitability requirements for settlement by a person on the Global Talent route\nTopic: suitability\n\nSummary: Applicants on the Global Talent route must not breach immigration laws (unless eligible for overstaying exceptions) or be on immigration bail to be considered suitable for settlement under GT 9.1.\n\n### Suitability requirements for settlement by a person on the Global Talent route\n\nGT 9.1. The applicant must not fall for refusal under Part Suitability.\n\n1.   GT 9.2. The applicant must not be: \n    1.   (a) in breach of immigration laws, except that where the Exceptions for overstayers section of Part Suitability applies, that period of overstaying will be disregarded; or\n    2.   (b) on immigration bail.",
      "needs_review": false
    },
    {
      "metadata": {
        "source": "Immigration Rules Appendix Global Talent",
        "part": "Immigration Rules Appendix Global Talent",
        "section_id": "Eligibility requirements for settlement by a person on the Global Talent route",
        "section_title": "Eligibility requirements for settlement by a person on the Global Talent route",
        "parent_section": null,
        "hierarchy_level": 2,
        "topic": "eligibility",
        "url": "https://www.gov.uk/guidance/immigration-rules/immigration-rules-appendix-global-talent",
        "scraped_at": "2025-12-06T17:27:23.900392"
      },
      "text": "### Eligibility requirements for settlement by a person on the Global Talent route",
      "summary": "This provision applies to Global Talent route applicants seeking settlement. It requires applicants to meet specific eligibility criteria, including continuous residence and endorsement standards, with exceptions based on age or other factors. Meeting these conditions is essential for settlement approval.",
      "augmented_text": "Document: Immigration Rules Appendix Global Talent\nPart: Immigration Rules Appendix Global Talent\nSection ID: Eligibility requirements for settlement by a person on the Global Talent route\nSection: Eligibility requirements for settlement by a person on the Global Talent route\nTopic: eligibility\n\nSummary: This provision applies to Global Talent route applicants seeking settlement. It requires applicants to meet specific eligibility criteria, including continuous residence and endorsement standards, with exceptions based on age or other factors. Meeting these conditions is essential for settlement approval.\n\n### Eligibility requirements for settlement by a person on the Global Talent route",
      "needs_review": false
    },
    {
      "metadata": {
        "source": "Immigration Rules Appendix Global Talent",
        "part": "Immigration Rules Appendix Global Talent",
        "section_id": "GT 10.1",
        "section_title": "Endorsement requirement for settlement by a person on the Global Talent route",
        "parent_section": "GT 10",
        "hierarchy_level": 2,
        "topic": "settlement",
        "url": "https://www.gov.uk/guidance/immigration-rules/immigration-rules-appendix-global-talent",
        "scraped_at": "2025-12-06T17:27:23.900410"
      },
      "text": "### Endorsement requirement for settlement by a person on the Global Talent route\n\nGT 10.1. If the applicant was granted their initial application using an endorsement, the endorsement must not have been withdrawn by the endorsing body.\n\n1.   GT 10.2. The applicant must have earned money in the UK during their last period of permission in the field in either: \n    1.   (a) a field related to the subject matter of their prize if they were granted for their initial application using a prize listed in Appendix Global Talent: Prestigious Prizes; or\n    2.   (b) the field in which they were previously endorsed in the Global Talent route if they were granted their initial application using an endorsement.",
      "summary": "Applicants on the Global Talent route seeking settlement must have an active, non-withdrawn endorsement and have earned income in the UK within their endorsed or prize-related field during their last permission period.",
      "augmented_text": "Document: Immigration Rules Appendix Global Talent\nPart: Immigration Rules Appendix Global Talent\nSection ID: GT 10.1\nSection: Endorsement requirement for settlement by a person on the Global Talent route\nTopic: settlement\n\nSummary: Applicants on the Global Talent route seeking settlement must have an active, non-withdrawn endorsement and have earned income in the UK within their endorsed or prize-related field during their last permission period.\n\n### Endorsement requirement for settlement by a person on the Global Talent route\n\nGT 10.1. If the applicant was granted their initial application using an endorsement, the endorsement must not have been withdrawn by the endorsing body.\n\n1.   GT 10.2. The applicant must have earned money in the UK during their last period of permission in the field in either: \n    1.   (a) a field related to the subject matter of their prize if they were granted for their initial application using a prize listed in Appendix Global Talent: Prestigious Prizes; or\n    2.   (b) the field in which they were previously endorsed in the Global Talent route if they were granted their initial application using an endorsement.",
      "needs_review": false
    },
    {
      "metadata": {
        "source": "Immigration Rules Appendix Global Talent",
        "part": "Immigration Rules Appendix Global Talent",
        "section_id": "1",
        "section_title": "Qualifying period requirement for settlement by a person on the Global Talent route",
        "parent_section": null,
        "hierarchy_level": 1,
        "topic": "settlement",
        "url": "https://www.gov.uk/guidance/immigration-rules/immigration-rules-appendix-global-talent",
        "scraped_at": "2025-12-06T17:27:23.900428"
      },
      "text": "### Qualifying period requirement for settlement by a person on the Global Talent route\n\n1.   GT 11.1. The applicant must have spent a continuous period of 3 years in the UK if: \n    1.   (a) they were endorsed by the Royal Society, British Academy, Royal Academy of Engineering or UKRI; or\n    2.   (b) they were endorsed under the exceptional talent criteria by Arts Council England or Tech Nation; or\n    3.   (c) they were granted their initial application using a prize listed in Appendix Global Talent: Prestigious Prizes.\n\nGT 11.2. The applicant must have spent a continuous period of 5 years in the UK if they were endorsed under the exceptional promise criteria by Arts Council England or Tech Nation.\n\n1.   GT 11.3. The continuous period must consist of time with permission (not as a dependant) on any of (or any combination of), the following routes: \n    1.   (a) Global Talent; or\n    2.   (b) Innovator Founder; or\n    3.   (c) Skilled Worker; or\n    4.   (d) T2 Minister of Religion; or\n    5.   (e) International Sportsperson; or\n    6.   (f) Tier 1, other than Tier 1 (Graduate Entrepreneur); or\n    7.   (g) Scale-up; or\n    8.   (h) Representative of an Overseas Business.",
      "summary": "Eligible applicants on the UK Global Talent route must have a continuous UK residence of 3 years (endorsed by scientific bodies or prize winners) or 5 years (endorsed under exceptional promise), with time spent under specific qualifying immigration routes, excluding dependants.",
      "augmented_text": "Document: Immigration Rules Appendix Global Talent\nPart: Immigration Rules Appendix Global Talent\nSection ID: 1\nSection: Qualifying period requirement for settlement by a person on the Global Talent route\nTopic: settlement\n\nSummary: Eligible applicants on the UK Global Talent route must have a continuous UK residence of 3 years (endorsed by scientific bodies or prize winners) or 5 years (endorsed under exceptional promise), with time spent under specific qualifying immigration routes, excluding dependants.\n\n### Qualifying period requirement for settlement by a person on the Global Talent route\n\n1.   GT 11.1. The applicant must have spent a continuous period of 3 years in the UK if: \n    1.   (a) they were endorsed by the Royal Society, British Academy, Royal Academy of Engineering or UKRI; or\n    2.   (b) they were endorsed under the exceptional talent criteria by Arts Council England or Tech Nation; or\n    3.   (c) they were granted their initial application using a prize listed in Appendix Global Talent: Prestigious Prizes.\n\nGT 11.2. The applicant must have spent a continuous period of 5 years in the UK if they were endorsed under the exceptional promise criteria by Arts Council England or Tech Nation.\n\n1.   GT 11.3. The continuous period must consist of time with permission (not as a dependant) on any of (or any combination of), the following routes: \n    1.   (a) Global Talent; or\n    2.   (b) Innovator Founder; or\n    3.   (c) Skilled Worker; or\n    4.   (d) T2 Minister of Religion; or\n    5.   (e) International Sportsperson; or\n    6.   (f) Tier 1, other than Tier 1 (Graduate Entrepreneur); or\n    7.   (g) Scale-up; or\n    8.   (h) Representative of an Overseas Business.",
      "needs_review": false
    },
    {
      "metadata": {
        "source": "Immigration Rules Appendix Global Talent",
        "part": "Immigration Rules Appendix Global Talent",
        "section_id": "GT 12.1",
        "section_title": "Continuous residence requirement for settlement by a person on the Global Talent route",
        "parent_section": "GT 12",
        "hierarchy_level": 2,
        "topic": "settlement",
        "url": "https://www.gov.uk/guidance/immigration-rules/immigration-rules-appendix-global-talent",
        "scraped_at": "2025-12-06T17:27:23.900444"
      },
      "text": "### Continuous residence requirement for settlement by a person on the Global Talent route\n\nGT 12.1. The applicant must meet the continuous residence requirement as specified in Appendix Continuous Residence.",
      "summary": "Applicants on the Global Talent route must satisfy the continuous residence requirement outlined in Appendix Continuous Residence to qualify for settlement, with specific conditions and exceptions detailed therein.",
      "augmented_text": "Document: Immigration Rules Appendix Global Talent\nPart: Immigration Rules Appendix Global Talent\nSection ID: GT 12.1\nSection: Continuous residence requirement for settlement by a person on the Global Talent route\nTopic: settlement\n\nSummary: Applicants on the Global Talent route must satisfy the continuous residence requirement outlined in Appendix Continuous Residence to qualify for settlement, with specific conditions and exceptions detailed therein.\n\n### Continuous residence requirement for settlement by a person on the Global Talent route\n\nGT 12.1. The applicant must meet the continuous residence requirement as specified in Appendix Continuous Residence.",
      "needs_review": false
    },
    {
      "metadata": {
        "source": "Immigration Rules Appendix Global Talent",
        "part": "Immigration Rules Appendix Global Talent",
        "section_id": "GT 13.1",
        "section_title": "English language requirement for settlement by a person on the Global Talent route",
        "parent_section": "GT 13",
        "hierarchy_level": 2,
        "topic": "english-language",
        "url": "https://www.gov.uk/guidance/immigration-rules/immigration-rules-appendix-global-talent",
        "scraped_at": "2025-12-06T17:27:23.900455"
      },
      "text": "### English language requirement for settlement by a person on the Global Talent route\n\nGT 13.1. Unless an exemption applies, the applicant must show English language ability on the Common European Framework of Reference for Languages in speaking and listening to at least level B1.\n\nGT 13.2. The applicant must show they meet the English language requirement as specified in Appendix English Language.",
      "summary": "Applicants seeking settlement on the Global Talent route must demonstrate English language proficiency at least B1 level in speaking and listening, unless exempt. They must meet the standards outlined in the Appendix English Language, with specific exemptions applying.",
      "augmented_text": "Document: Immigration Rules Appendix Global Talent\nPart: Immigration Rules Appendix Global Talent\nSection ID: GT 13.1\nSection: English language requirement for settlement by a person on the Global Talent route\nTopic: english-language\n\nSummary: Applicants seeking settlement on the Global Talent route must demonstrate English language proficiency at least B1 level in speaking and listening, unless exempt. They must meet the standards outlined in the Appendix English Language, with specific exemptions applying.\n\n### English language requirement for settlement by a person on the Global Talent route\n\nGT 13.1. Unless an exemption applies, the applicant must show English language ability on the Common European Framework of Reference for Languages in speaking and listening to at least level B1.\n\nGT 13.2. The applicant must show they meet the English language requirement as specified in Appendix English Language.",
      "needs_review": false
    },
    {
      "metadata": {
        "source": "Immigration Rules Appendix Global Talent",
        "part": "Immigration Rules Appendix Global Talent",
        "section_id": "GT 14.1",
        "section_title": "Knowledge of life in the UK requirement for settlement by a person on the Global Talent route",
        "parent_section": "GT 14",
        "hierarchy_level": 2,
        "topic": "settlement",
        "url": "https://www.gov.uk/guidance/immigration-rules/immigration-rules-appendix-global-talent",
        "scraped_at": "2025-12-06T17:27:23.900470"
      },
      "text": "### Knowledge of life in the UK requirement for settlement by a person on the Global Talent route\n\nGT 14.1. The applicant must meet the Knowledge of Life in the UK requirement as set out in Appendix KOL UK.",
      "summary": "Applicants seeking settlement on the Global Talent route must meet the Knowledge of Life in the UK requirement outlined in Appendix KOL UK. There are no specified exceptions; compliance with this requirement is essential for settlement eligibility.",
      "augmented_text": "Document: Immigration Rules Appendix Global Talent\nPart: Immigration Rules Appendix Global Talent\nSection ID: GT 14.1\nSection: Knowledge of life in the UK requirement for settlement by a person on the Global Talent route\nTopic: settlement\n\nSummary: Applicants seeking settlement on the Global Talent route must meet the Knowledge of Life in the UK requirement outlined in Appendix KOL UK. There are no specified exceptions; compliance with this requirement is essential for settlement eligibility.\n\n### Knowledge of life in the UK requirement for settlement by a person on the Global Talent route\n\nGT 14.1. The applicant must meet the Knowledge of Life in the UK requirement as set out in Appendix KOL UK.",
      "needs_review": false
    },
    {
      "metadata": {
        "source": "Immigration Rules Appendix Global Talent",
        "part": "Immigration Rules Appendix Global Talent",
        "section_id": "GT 15.1",
        "section_title": "Decision on an application for settlement as a person on the Global Talent route",
        "parent_section": "GT 15",
        "hierarchy_level": 2,
        "topic": "eligibility",
        "url": "https://www.gov.uk/guidance/immigration-rules/immigration-rules-appendix-global-talent",
        "scraped_at": "2025-12-06T17:27:23.900478"
      },
      "text": "### Decision on an application for settlement as a person on the Global Talent route\n\nGT 15.1. If the decision maker is satisfied all the suitability and eligibility requirements are met for settlement on the Global Talent route the applicant will be granted settlement, otherwise the application will be refused.\n\nGT 15.2. If the application is refused the person can apply for an Administrative Review under Appendix AR: Administrative Review.",
      "summary": "Applicants on the Global Talent route must meet suitability and eligibility requirements for settlement; if satisfied, their application is granted, otherwise refused. Refusals can be challenged via Administrative Review under Appendix AR.",
      "augmented_text": "Document: Immigration Rules Appendix Global Talent\nPart: Immigration Rules Appendix Global Talent\nSection ID: GT 15.1\nSection: Decision on an application for settlement as a person on the Global Talent route\nTopic: eligibility\n\nSummary: Applicants on the Global Talent route must meet suitability and eligibility requirements for settlement; if satisfied, their application is granted, otherwise refused. Refusals can be challenged via Administrative Review under Appendix AR.\n\n### Decision on an application for settlement as a person on the Global Talent route\n\nGT 15.1. If the decision maker is satisfied all the suitability and eligibility requirements are met for settlement on the Global Talent route the applicant will be granted settlement, otherwise the application will be refused.\n\nGT 15.2. If the application is refused the person can apply for an Administrative Review under Appendix AR: Administrative Review.",
      "needs_review": false
    },
    {
      "metadata": {
        "source": "Immigration Rules Appendix Global Talent",
        "part": "Immigration Rules Appendix Global Talent",
        "section_id": "SW 3.1",
        "section_title": "Dependants on the Global Talent route",
        "parent_section": null,
        "hierarchy_level": 2,
        "topic": "eligibility",
        "url": "https://www.gov.uk/guidance/immigration-rules/immigration-rules-appendix-global-talent",
        "scraped_at": "2025-12-06T17:27:23.900490"
      },
      "text": "### Dependants on the Global Talent route",
      "summary": "Dependants applying on the Global Talent route must meet eligibility criteria, including relationship and suitability assessments. They are permitted to work and study in the UK, subject to conditions, with exceptions for certain restrictions or prior approvals.",
      "augmented_text": "Document: Immigration Rules Appendix Global Talent\nPart: Immigration Rules Appendix Global Talent\nSection ID: SW 3.1\nSection: Dependants on the Global Talent route\nTopic: eligibility\n\nSummary: Dependants applying on the Global Talent route must meet eligibility criteria, including relationship and suitability assessments. They are permitted to work and study in the UK, subject to conditions, with exceptions for certain restrictions or prior approvals.\n\n### Dependants on the Global Talent route",
      "needs_review": false
    },
    {
      "metadata": {
        "source": "Immigration Rules Appendix Global Talent",
        "part": "Immigration Rules Appendix Global Talent",
        "section_id": "GT 16.1",
        "section_title": "Validity requirements for a dependent partner or dependent child on the Global Talent route",
        "parent_section": "GT 16",
        "hierarchy_level": 2,
        "topic": "leave-to-enter",
        "url": "https://www.gov.uk/guidance/immigration-rules/immigration-rules-appendix-global-talent",
        "scraped_at": "2025-12-06T17:27:23.900511"
      },
      "text": "### Validity requirements for a dependent partner or dependent child on the Global Talent route\n\nGT 16.1. A person applying for entry clearance or permission to stay as a dependent partner or dependent child on the Global Talent route must apply online on the gov.uk website on the specified form as follows:\n\n| Applicant | Specified form |\n| --- | --- |\n| EEA national with a chipped passport | Either (as applicable): • Dependant partner or dependant child using the UK Immigration: ID Check app; or • the forms listed below for dependant applicants outside or inside the UK as relevant. |\n| Applicants outside the UK | Dependant partner visa Dependant child visa |\n| Applicants inside the UK | If the dependant is applying at the same time as the Global talent applicant, they can be included in the form “Global talent – stage 2” where the form allows dependants to be added. Otherwise: – Dependant partner – Dependant child |\n\n1.   GT 16.2. An application for entry clearance or permission to stay as a partner or child of a person on the Global Talent route must meet all the following requirements: \n    1.   (a) any fee and Immigration Health Charge must have been paid; and\n    2.   (b) the applicant must have provided biometrics when required; and\n    3.   (c) the applicant must have provided a passport or other travel document which satisfactorily establishes their identity and nationality; and\n    4.   (d) the applicant must be applying as partner or child of a person (P) who: \n        1.   (i) has made a valid application for entry clearance or permission to stay on the Global Talent route that has not been decided; or\n        2.   (ii) has entry clearance or permission to stay on the Global Talent route; or\n        3.   (iii) is settled or has become a British citizen, providing that P had permission on the Global Talent route when they settled and the applicant either had permission as their partner or child at that time, or the applicant is applying as a child of P and the applicant was born in the UK before P settled.\n\nGT 16.3. A person applying as a dependent partner must be aged 18 or over on the date of application.\n\nGT 16.4 DELETED.\n\n1.   GT 16.5. If applying for permission to stay, the applicant must be in the UK on the date of application.\n2.   GT 16.5ZA. If applying for permission to stay, the applicant must not have, or have last been granted, permission: *(a) as a Visitor; or \n    1.   (b) as a Short-term Student; or\n    2.   (c) as a Parent of a Child Student; or\n    3.   (d) as a Seasonal Worker; or\n    4.   (e) as a Domestic Worker in a Private Household; or\n    5.   (f) outside the Immigration Rules.\n\n1.   GT 16.5A. An applicant who is applying for permission to stay and has, or last had, permission as a Student, must fulfil one of the Conditions A or B below on the date of application: \n    1.   (a) Condition A: the applicant must have completed the course of study for which the Confirmation of Acceptance for Studies was assigned (or a course to which ST 27.3 of Appendix Student applies); or\n    2.   (b) Condition B: the applicant must: \n        1.   (i) be studying a full-time course of study leading to the award of a PhD with a higher education provider which has a track record of compliance; and\n        2.   (ii) have completed at least 24 months of study on that course.\n\nGT 16.6. An application which does not meet all the validity requirements for a partner or child on the Global Talent route may be rejected as invalid and not considered.",
      "summary": "Dependent partners or children on the UK Global Talent route must apply online using specified forms, paying fees and health charges, providing biometrics, and valid identity documents. Applicants outside the UK use separate visa forms, while those inside can be included with the main applicant or apply separately, subject to conditions.",
      "augmented_text": "Document: Immigration Rules Appendix Global Talent\nPart: Immigration Rules Appendix Global Talent\nSection ID: GT 16.1\nSection: Validity requirements for a dependent partner or dependent child on the Global Talent route\nTopic: leave-to-enter\n\nSummary: Dependent partners or children on the UK Global Talent route must apply online using specified forms, paying fees and health charges, providing biometrics, and valid identity documents. Applicants outside the UK use separate visa forms, while those inside can be included with the main applicant or apply separately, subject to conditions.\n\n### Validity requirements for a dependent partner or dependent child on the Global Talent route\n\nGT 16.1. A person applying for entry clearance or permission to stay as a dependent partner or dependent child on the Global Talent route must apply online on the gov.uk website on the specified form as follows:\n\n| Applicant | Specified form |\n| --- | --- |\n| EEA national with a chipped passport | Either (as applicable): • Dependant partner or dependant child using the UK Immigration: ID Check app; or • the forms listed below for dependant applicants outside or inside the UK as relevant. |\n| Applicants outside the UK | Dependant partner visa Dependant child visa |\n| Applicants inside the UK | If the dependant is applying at the same time as the Global talent applicant, they can be included in the form “Global talent – stage 2” where the form allows dependants to be added. Otherwise: – Dependant partner – Dependant child |\n\n1.   GT 16.2. An application for entry clearance or permission to stay as a partner or child of a person on the Global Talent route must meet all the following requirements: \n    1.   (a) any fee and Immigration Health Charge must have been paid; and\n    2.   (b) the applicant must have provided biometrics when required; and\n    3.   (c) the applicant must have provided a passport or other travel document which satisfactorily establishes their identity and nationality; and\n    4.   (d) the applicant must be applying as partner or child of a person (P) who: \n        1.   (i) has made a valid application for entry clearance or permission to stay on the Global Talent route that has not been decided; or\n        2.   (ii) has entry clearance or permission to stay on the Global Talent route; or\n        3.   (iii) is settled or has become a British citizen, providing that P had permission on the Global Talent route when they settled and the applicant either had permission as their partner or child at that time, or the applicant is applying as a child of P and the applicant was born in the UK before P settled.\n\nGT 16.3. A person applying as a dependent partner must be aged 18 or over on the date of application.\n\nGT 16.4 DELETED.\n\n1.   GT 16.5. If applying for permission to stay, the applicant must be in the UK on the date of application.\n2.   GT 16.5ZA. If applying for permission to stay, the applicant must not have, or have last been granted, permission: *(a) as a Visitor; or \n    1.   (b) as a Short-term Student; or\n    2.   (c) as a Parent of a Child Student; or\n    3.   (d) as a Seasonal Worker; or\n    4.   (e) as a Domestic Worker in a Private Household; or\n    5.   (f) outside the Immigration Rules.\n\n1.   GT 16.5A. An applicant who is applying for permission to stay and has, or last had, permission as a Student, must fulfil one of the Conditions A or B below on the date of application: \n    1.   (a) Condition A: the applicant must have completed the course of study for which the Confirmation of Acceptance for Studies was assigned (or a course to which ST 27.3 of Appendix Student applies); or\n    2.   (b) Condition B: the applicant must: \n        1.   (i) be studying a full-time course of study leading to the award of a PhD with a higher education provider which has a track record of compliance; and\n        2.   (ii) have completed at least 24 months of study on that course.\n\nGT 16.6. An application which does not meet all the validity requirements for a partner or child on the Global Talent route may be rejected as invalid and not considered.",
      "needs_review": false
    },
    {
      "metadata": {
        "source": "Immigration Rules Appendix Global Talent",
        "part": "Immigration Rules Appendix Global Talent",
        "section_id": "GT 17.1",
        "section_title": "Suitability requirements for a dependent partner or dependent child on the Global Talent route",
        "parent_section": "GT 17",
        "hierarchy_level": 2,
        "topic": "suitability",
        "url": "https://www.gov.uk/guidance/immigration-rules/immigration-rules-appendix-global-talent",
        "scraped_at": "2025-12-06T17:27:23.900524"
      },
      "text": "### Suitability requirements for a dependent partner or dependent child on the Global Talent route\n\nGT 17.1. The applicant must not fall for refusal under Part Suitability.\n\n1.   GT 17.2. If applying for permission to stay the applicant must not be: \n    1.   (a) in breach of immigration laws, except that where the Exceptions for overstayers section of Part Suitability applies, that period of overstaying will be disregarded; or\n    2.   (b) on immigration bail.",
      "summary": "This provision applies to dependent partners or children on the UK Global Talent route, requiring them to meet suitability criteria. They must not breach immigration laws (unless overstaying is disregarded) or be on immigration bail to be granted or continue permission to stay.",
      "augmented_text": "Document: Immigration Rules Appendix Global Talent\nPart: Immigration Rules Appendix Global Talent\nSection ID: GT 17.1\nSection: Suitability requirements for a dependent partner or dependent child on the Global Talent route\nTopic: suitability\n\nSummary: This provision applies to dependent partners or children on the UK Global Talent route, requiring them to meet suitability criteria. They must not breach immigration laws (unless overstaying is disregarded) or be on immigration bail to be granted or continue permission to stay.\n\n### Suitability requirements for a dependent partner or dependent child on the Global Talent route\n\nGT 17.1. The applicant must not fall for refusal under Part Suitability.\n\n1.   GT 17.2. If applying for permission to stay the applicant must not be: \n    1.   (a) in breach of immigration laws, except that where the Exceptions for overstayers section of Part Suitability applies, that period of overstaying will be disregarded; or\n    2.   (b) on immigration bail.",
      "needs_review": false
    },
    {
      "metadata": {
        "source": "Immigration Rules Appendix Global Talent",
        "part": "Immigration Rules Appendix Global Talent",
        "section_id": "Eligibility requirements for a dependent partner or dependent child on the Global Talent route",
        "section_title": "Eligibility requirements for a dependent partner or dependent child on the Global Talent route",
        "parent_section": null,
        "hierarchy_level": 2,
        "topic": "eligibility",
        "url": "https://www.gov.uk/guidance/immigration-rules/immigration-rules-appendix-global-talent",
        "scraped_at": "2025-12-06T17:27:23.900530"
      },
      "text": "### Eligibility requirements for a dependent partner or dependent child on the Global Talent route",
      "summary": "Dependents of Global Talent applicants, including partners and children, must meet specific eligibility criteria to qualify for entry or stay, such as relationship validation and dependency status. They must also comply with any applicable conditions and exceptions outlined in the rules.",
      "augmented_text": "Document: Immigration Rules Appendix Global Talent\nPart: Immigration Rules Appendix Global Talent\nSection ID: Eligibility requirements for a dependent partner or dependent child on the Global Talent route\nSection: Eligibility requirements for a dependent partner or dependent child on the Global Talent route\nTopic: eligibility\n\nSummary: Dependents of Global Talent applicants, including partners and children, must meet specific eligibility criteria to qualify for entry or stay, such as relationship validation and dependency status. They must also comply with any applicable conditions and exceptions outlined in the rules.\n\n### Eligibility requirements for a dependent partner or dependent child on the Global Talent route",
      "needs_review": false
    },
    {
      "metadata": {
        "source": "Immigration Rules Appendix Global Talent",
        "part": "Immigration Rules Appendix Global Talent",
        "section_id": "GT 18.1",
        "section_title": "Entry requirement for a dependent partner or dependent child on the Global Talent route",
        "parent_section": "GT 18",
        "hierarchy_level": 2,
        "topic": "leave-to-enter",
        "url": "https://www.gov.uk/guidance/immigration-rules/immigration-rules-appendix-global-talent",
        "scraped_at": "2025-12-06T17:27:23.900546"
      },
      "text": "### Entry requirement for a dependent partner or dependent child on the Global Talent route\n\nGT 18.1. A person seeking to come to the UK as a partner or child must apply for and obtain entry clearance as a partner or child on the Global Talent route before they arrive in the UK.\n\nGT 18.2. A person applying for entry clearance as a partner or child on the Global Talent route must, if Appendix Tuberculosis applies, provide a valid medical certificate confirming that they have undergone screening for active pulmonary tuberculosis and that this tuberculosis is not present in them.",
      "summary": "Dependents (partners or children) applying via the Global Talent route must secure entry clearance before arrival. If applicable, they must also provide a TB screening certificate confirming they do not have pulmonary tuberculosis.",
      "augmented_text": "Document: Immigration Rules Appendix Global Talent\nPart: Immigration Rules Appendix Global Talent\nSection ID: GT 18.1\nSection: Entry requirement for a dependent partner or dependent child on the Global Talent route\nTopic: leave-to-enter\n\nSummary: Dependents (partners or children) applying via the Global Talent route must secure entry clearance before arrival. If applicable, they must also provide a TB screening certificate confirming they do not have pulmonary tuberculosis.\n\n### Entry requirement for a dependent partner or dependent child on the Global Talent route\n\nGT 18.1. A person seeking to come to the UK as a partner or child must apply for and obtain entry clearance as a partner or child on the Global Talent route before they arrive in the UK.\n\nGT 18.2. A person applying for entry clearance as a partner or child on the Global Talent route must, if Appendix Tuberculosis applies, provide a valid medical certificate confirming that they have undergone screening for active pulmonary tuberculosis and that this tuberculosis is not present in them.",
      "needs_review": false
    },
    {
      "metadata": {
        "source": "Immigration Rules Appendix Global Talent",
        "part": "Immigration Rules Appendix Global Talent",
        "section_id": "1",
        "section_title": "Relationship requirements for a dependent partner on the Global Talent route",
        "parent_section": null,
        "hierarchy_level": 1,
        "topic": "family",
        "url": "https://www.gov.uk/guidance/immigration-rules/immigration-rules-appendix-global-talent",
        "scraped_at": "2025-12-06T17:27:23.900564"
      },
      "text": "### Relationship requirements for a dependent partner on the Global Talent route\n\n1.   GT 19.1. The applicant must be the partner of a person (P) and one of the following must apply: \n    1.   (a) P has permission on the Global Talent route; or\n    2.   (b) P is, at the same time, applying for (and is granted) permission on the Global Talent route; or\n    3.   (c) P is settled or has become a British citizen, providing P had permission on the Global Talent route and the applicant had permission as P’s partner at that time.\n\nGT 19.2. The requirements of Appendix Relationship with Partner must be met.\n\nGT 19.3. DELETED\n\nGT 19.4. DELETED",
      "summary": "Dependents applying on the Global Talent route must be partners of individuals with permission, pending application, or settled/British citizenship; they must also meet the specified relationship criteria.",
      "augmented_text": "Document: Immigration Rules Appendix Global Talent\nPart: Immigration Rules Appendix Global Talent\nSection ID: 1\nSection: Relationship requirements for a dependent partner on the Global Talent route\nTopic: family\n\nSummary: Dependents applying on the Global Talent route must be partners of individuals with permission, pending application, or settled/British citizenship; they must also meet the specified relationship criteria.\n\n### Relationship requirements for a dependent partner on the Global Talent route\n\n1.   GT 19.1. The applicant must be the partner of a person (P) and one of the following must apply: \n    1.   (a) P has permission on the Global Talent route; or\n    2.   (b) P is, at the same time, applying for (and is granted) permission on the Global Talent route; or\n    3.   (c) P is settled or has become a British citizen, providing P had permission on the Global Talent route and the applicant had permission as P’s partner at that time.\n\nGT 19.2. The requirements of Appendix Relationship with Partner must be met.\n\nGT 19.3. DELETED\n\nGT 19.4. DELETED",
      "needs_review": false
    },
    {
      "metadata": {
        "source": "Immigration Rules Appendix Global Talent",
        "part": "Immigration Rules Appendix Global Talent",
        "section_id": "1",
        "section_title": "Relationship requirement for a dependent child on the Global Talent route",
        "parent_section": null,
        "hierarchy_level": 1,
        "topic": "family",
        "url": "https://www.gov.uk/guidance/immigration-rules/immigration-rules-appendix-global-talent",
        "scraped_at": "2025-12-06T17:27:23.900579"
      },
      "text": "### Relationship requirement for a dependent child on the Global Talent route\n\n1.   GT 20.1. DELETED.\n2.   GT 20.2. DELETED.",
      "summary": "This provision applies to dependent children on the Global Talent route. It requires proof of their relationship with the eligible applicant, subject to specific conditions or documentation, with no specified exceptions in the provided excerpt.",
      "augmented_text": "Document: Immigration Rules Appendix Global Talent\nPart: Immigration Rules Appendix Global Talent\nSection ID: 1\nSection: Relationship requirement for a dependent child on the Global Talent route\nTopic: family\n\nSummary: This provision applies to dependent children on the Global Talent route. It requires proof of their relationship with the eligible applicant, subject to specific conditions or documentation, with no specified exceptions in the provided excerpt.\n\n### Relationship requirement for a dependent child on the Global Talent route\n\n1.   GT 20.1. DELETED.\n2.   GT 20.2. DELETED.",
      "needs_review": false
    },
    {
      "metadata": {
        "source": "Immigration Rules Appendix Global Talent",
        "part": "Immigration Rules Appendix Global Talent",
        "section_id": "GT 21.1",
        "section_title": "Care requirement for a dependent child on the Global Talent route",
        "parent_section": "GT 21",
        "hierarchy_level": 2,
        "topic": "family",
        "url": "https://www.gov.uk/guidance/immigration-rules/immigration-rules-appendix-global-talent",
        "scraped_at": "2025-12-06T17:27:23.900634"
      },
      "text": "### Care requirement for a dependent child on the Global Talent route\n\nGT 21.1. DELETED.",
      "summary": "This provision applies to dependents of Global Talent applicants. It requires that the child’s welfare and care are appropriately managed during their stay, with specific adherence to relevant care standards; exceptions or detailed conditions are not specified in this excerpt.",
      "augmented_text": "Document: Immigration Rules Appendix Global Talent\nPart: Immigration Rules Appendix Global Talent\nSection ID: GT 21.1\nSection: Care requirement for a dependent child on the Global Talent route\nTopic: family\n\nSummary: This provision applies to dependents of Global Talent applicants. It requires that the child’s welfare and care are appropriately managed during their stay, with specific adherence to relevant care standards; exceptions or detailed conditions are not specified in this excerpt.\n\n### Care requirement for a dependent child on the Global Talent route\n\nGT 21.1. DELETED.",
      "needs_review": false
    },
    {
      "metadata": {
        "source": "Immigration Rules Appendix Global Talent",
        "part": "Immigration Rules Appendix Global Talent",
        "section_id": "GT 22.1",
        "section_title": "Age requirement for a dependent child on the Global Talent route",
        "parent_section": "GT 22",
        "hierarchy_level": 2,
        "topic": "family",
        "url": "https://www.gov.uk/guidance/immigration-rules/immigration-rules-appendix-global-talent",
        "scraped_at": "2025-12-06T17:27:23.900655"
      },
      "text": "### Age requirement for a dependent child on the Global Talent route\n\nGT 22.1. DELETED.\n\nGT 22.2. DELETED.",
      "summary": "This provision applies to dependent children on the Global Talent route, requiring them to be under 18 years of age. There are no specified exceptions, emphasizing the age limit as a critical condition for eligibility.",
      "augmented_text": "Document: Immigration Rules Appendix Global Talent\nPart: Immigration Rules Appendix Global Talent\nSection ID: GT 22.1\nSection: Age requirement for a dependent child on the Global Talent route\nTopic: family\n\nSummary: This provision applies to dependent children on the Global Talent route, requiring them to be under 18 years of age. There are no specified exceptions, emphasizing the age limit as a critical condition for eligibility.\n\n### Age requirement for a dependent child on the Global Talent route\n\nGT 22.1. DELETED.\n\nGT 22.2. DELETED.",
      "needs_review": false
    },
    {
      "metadata": {
        "source": "Immigration Rules Appendix Global Talent",
        "part": "Immigration Rules Appendix Global Talent",
        "section_id": "1",
        "section_title": "Requirements for a dependent child on the Global Talent route",
        "parent_section": null,
        "hierarchy_level": 1,
        "topic": "leave-to-enter",
        "url": "https://www.gov.uk/guidance/immigration-rules/immigration-rules-appendix-global-talent",
        "scraped_at": "2025-12-06T17:27:23.900673"
      },
      "text": "### Requirements for a dependent child on the Global Talent route\n\n1.   GT 22A.1. The applicant must meet the following requirements for a dependent child in Appendix Children: \n    1.   (a) relationship requirement: entry clearance and permission to stay; and\n    2.   (b) care requirement; and\n    3.   (c) age and independent life requirement.",
      "summary": "Dependent children applying via the Global Talent route must satisfy relationship, care, and age/independent life requirements specified in Appendix Children, including entry clearance, permission to stay, and relevant conditions.",
      "augmented_text": "Document: Immigration Rules Appendix Global Talent\nPart: Immigration Rules Appendix Global Talent\nSection ID: 1\nSection: Requirements for a dependent child on the Global Talent route\nTopic: leave-to-enter\n\nSummary: Dependent children applying via the Global Talent route must satisfy relationship, care, and age/independent life requirements specified in Appendix Children, including entry clearance, permission to stay, and relevant conditions.\n\n### Requirements for a dependent child on the Global Talent route\n\n1.   GT 22A.1. The applicant must meet the following requirements for a dependent child in Appendix Children: \n    1.   (a) relationship requirement: entry clearance and permission to stay; and\n    2.   (b) care requirement; and\n    3.   (c) age and independent life requirement.",
      "needs_review": false
    },
    {
      "metadata": {
        "source": "Immigration Rules Appendix Global Talent",
        "part": "Immigration Rules Appendix Global Talent",
        "section_id": "GT 23.1",
        "section_title": "Decision on an application as a dependent partner or dependent child on the Global Talent route",
        "parent_section": "GT 23",
        "hierarchy_level": 2,
        "topic": "eligibility",
        "url": "https://www.gov.uk/guidance/immigration-rules/immigration-rules-appendix-global-talent",
        "scraped_at": "2025-12-06T17:27:23.900684"
      },
      "text": "### Decision on an application as a dependent partner or dependent child on the Global Talent route\n\nGT 23.1. If the decision maker is satisfied that all the suitability and eligibility requirements for a dependent partner or dependent child on the Global Talent route are met, the application will be granted, otherwise the application will be refused.\n\nGT 23.2. If the application is refused, the person can apply for an Administrative Review under Appendix AR: Administrative Review.",
      "summary": "This provision applies to dependent partners and children applying under the Global Talent route. Applications are granted if suitability and eligibility criteria are met; otherwise, they are refused, with the option for Administrative Review.",
      "augmented_text": "Document: Immigration Rules Appendix Global Talent\nPart: Immigration Rules Appendix Global Talent\nSection ID: GT 23.1\nSection: Decision on an application as a dependent partner or dependent child on the Global Talent route\nTopic: eligibility\n\nSummary: This provision applies to dependent partners and children applying under the Global Talent route. Applications are granted if suitability and eligibility criteria are met; otherwise, they are refused, with the option for Administrative Review.\n\n### Decision on an application as a dependent partner or dependent child on the Global Talent route\n\nGT 23.1. If the decision maker is satisfied that all the suitability and eligibility requirements for a dependent partner or dependent child on the Global Talent route are met, the application will be granted, otherwise the application will be refused.\n\nGT 23.2. If the application is refused, the person can apply for an Administrative Review under Appendix AR: Administrative Review.",
      "needs_review": false
    },
    {
      "metadata": {
        "source": "Immigration Rules Appendix Global Talent",
        "part": "Immigration Rules Appendix Global Talent",
        "section_id": "1",
        "section_title": "Period of grant for a dependent partner or dependent child on the Global Talent route",
        "parent_section": null,
        "hierarchy_level": 1,
        "topic": "family",
        "url": "https://www.gov.uk/guidance/immigration-rules/immigration-rules-appendix-global-talent",
        "scraped_at": "2025-12-06T17:27:23.900710"
      },
      "text": "### Period of grant for a dependent partner or dependent child on the Global Talent route\n\n1.   GT 24.1. A partner will be granted: \n    1.   (a) permission which ends on the same date as their partner’s permission on the Global Talent route; or\n    2.   (b) 3 years’ permission if the partner was (or is being) granted settlement on the Global Talent route.\n\nGT 24.2. A child will be granted permission which ends on the same date as whichever of their parents’ permission ends first, unless both parents have (or are being granted) settlement or British Citizenship, in which case the child will be granted permission for 3 years.",
      "summary": "Dependents (partners or children) on the Global Talent route are granted permission that either matches their partner’s permission duration or, if granted settlement, up to 3 years; children’s permissions end with the earliest parent’s, unless both parents have settlement or British Citizenship, then for 3 years.",
      "augmented_text": "Document: Immigration Rules Appendix Global Talent\nPart: Immigration Rules Appendix Global Talent\nSection ID: 1\nSection: Period of grant for a dependent partner or dependent child on the Global Talent route\nTopic: family\n\nSummary: Dependents (partners or children) on the Global Talent route are granted permission that either matches their partner’s permission duration or, if granted settlement, up to 3 years; children’s permissions end with the earliest parent’s, unless both parents have settlement or British Citizenship, then for 3 years.\n\n### Period of grant for a dependent partner or dependent child on the Global Talent route\n\n1.   GT 24.1. A partner will be granted: \n    1.   (a) permission which ends on the same date as their partner’s permission on the Global Talent route; or\n    2.   (b) 3 years’ permission if the partner was (or is being) granted settlement on the Global Talent route.\n\nGT 24.2. A child will be granted permission which ends on the same date as whichever of their parents’ permission ends first, unless both parents have (or are being granted) settlement or British Citizenship, in which case the child will be granted permission for 3 years.",
      "needs_review": false
    },
    {
      "metadata": {
        "source": "Immigration Rules Appendix Global Talent",
        "part": "Immigration Rules Appendix Global Talent",
        "section_id": "1",
        "section_title": "Conditions of grant for a dependent partner or dependent child on the Global Talent route",
        "parent_section": null,
        "hierarchy_level": 1,
        "topic": "financial",
        "url": "https://www.gov.uk/guidance/immigration-rules/immigration-rules-appendix-global-talent",
        "scraped_at": "2025-12-06T17:27:23.900722"
      },
      "text": "### Conditions of grant for a dependent partner or dependent child on the Global Talent route\n\n1.   GT 24.3. The grant will be subject to all the following conditions: \n    1.   (a) no access to public funds; and\n    2.   (b) work (including self-employment and voluntary work) is permitted, except as a professional sportsperson or sports coach; and\n    3.   (c) study is permitted, subject to the ATAS condition in Appendix ATAS, if the applicant is over age 18.\n    4.   (d) DELETED",
      "summary": "Dependent partners or children on the Global Talent route must not access public funds, can work (excluding professional sports), and may study (with ATAS if over 18); these conditions apply unless explicitly waived.",
      "augmented_text": "Document: Immigration Rules Appendix Global Talent\nPart: Immigration Rules Appendix Global Talent\nSection ID: 1\nSection: Conditions of grant for a dependent partner or dependent child on the Global Talent route\nTopic: financial\n\nSummary: Dependent partners or children on the Global Talent route must not access public funds, can work (excluding professional sports), and may study (with ATAS if over 18); these conditions apply unless explicitly waived.\n\n### Conditions of grant for a dependent partner or dependent child on the Global Talent route\n\n1.   GT 24.3. The grant will be subject to all the following conditions: \n    1.   (a) no access to public funds; and\n    2.   (b) work (including self-employment and voluntary work) is permitted, except as a professional sportsperson or sports coach; and\n    3.   (c) study is permitted, subject to the ATAS condition in Appendix ATAS, if the applicant is over age 18.\n    4.   (d) DELETED",
      "needs_review": false
    },
    {
      "metadata": {
        "source": "Immigration Rules Appendix Global Talent",
        "part": "Immigration Rules Appendix Global Talent",
        "section_id": "Settlement as a dependent partner or dependent child on the Global Talent route",
        "section_title": "Settlement as a dependent partner or dependent child on the Global Talent route",
        "parent_section": null,
        "hierarchy_level": 2,
        "topic": "settlement",
        "url": "https://www.gov.uk/guidance/immigration-rules/immigration-rules-appendix-global-talent",
        "scraped_at": "2025-12-06T17:27:23.900734"
      },
      "text": "### Settlement as a dependent partner or dependent child on the Global Talent route",
      "summary": "This provision applies to dependent partners and children on the UK Global Talent route seeking settlement. They must meet specific residency and character requirements, with certain exceptions for early settlement eligibility.",
      "augmented_text": "Document: Immigration Rules Appendix Global Talent\nPart: Immigration Rules Appendix Global Talent\nSection ID: Settlement as a dependent partner or dependent child on the Global Talent route\nSection: Settlement as a dependent partner or dependent child on the Global Talent route\nTopic: settlement\n\nSummary: This provision applies to dependent partners and children on the UK Global Talent route seeking settlement. They must meet specific residency and character requirements, with certain exceptions for early settlement eligibility.\n\n### Settlement as a dependent partner or dependent child on the Global Talent route",
      "needs_review": false
    },
    {
      "metadata": {
        "source": "Immigration Rules Appendix Global Talent",
        "part": "Immigration Rules Appendix Global Talent",
        "section_id": "GT 25.1",
        "section_title": "Validity requirements for settlement as a dependent partner or dependent child on the Global Talent route",
        "parent_section": "GT 25",
        "hierarchy_level": 2,
        "topic": "settlement",
        "url": "https://www.gov.uk/guidance/immigration-rules/immigration-rules-appendix-global-talent",
        "scraped_at": "2025-12-06T17:27:23.900759"
      },
      "text": "### Validity requirements for settlement as a dependent partner or dependent child on the Global Talent route\n\nGT 25.1. A person applying for settlement as a dependent partner or dependent child on the Global Talent route must apply online on the gov.uk website on the specified form, “Settle in the UK in various immigration categories: form SET(O)”.\n\n1.   GT 25.2. An application for settlement as a dependent partner or dependent child on the Global Talent route must meet all the following requirements: \n    1.   (a) any fee must have been paid; and\n    2.   (b) the applicant must have provided biometrics when required; and\n    3.   (c) the applicant must have provided a passport or other travel document which satisfactorily establishes their identity and nationality; and\n    4.   (d) the applicant must be in the UK.\n    5.   (e) the applicant must be applying as a partner or child of a person (P) who: \n        1.   (i) has made a valid application for settlement on the Global Talent route and that application has not been decided; or\n        2.   (ii) is settled or has become a British citizen, providing P had permission on the Global Talent route when they settled and the applicant either had permission as their partner or child at that time or the applicant is applying as a child of P and the applicant was born in the UK before P settled.\n\nGT 25.3. An application which does not meet the validity requirements for settlement as a partner or child on the Global Talent route may be rejected as invalid and not considered.",
      "summary": "Applicants seeking settlement as dependent partners or children on the Global Talent route must apply online using form SET(O), pay applicable fees, provide biometrics and valid travel documents, and be in the UK. They must also be linked to a main applicant who has a pending or settled Global Talent application, with specific conditions for children born in the UK or when the main applicant has settled or become a British citizen.",
      "augmented_text": "Document: Immigration Rules Appendix Global Talent\nPart: Immigration Rules Appendix Global Talent\nSection ID: GT 25.1\nSection: Validity requirements for settlement as a dependent partner or dependent child on the Global Talent route\nTopic: settlement\n\nSummary: Applicants seeking settlement as dependent partners or children on the Global Talent route must apply online using form SET(O), pay applicable fees, provide biometrics and valid travel documents, and be in the UK. They must also be linked to a main applicant who has a pending or settled Global Talent application, with specific conditions for children born in the UK or when the main applicant has settled or become a British citizen.\n\n### Validity requirements for settlement as a dependent partner or dependent child on the Global Talent route\n\nGT 25.1. A person applying for settlement as a dependent partner or dependent child on the Global Talent route must apply online on the gov.uk website on the specified form, “Settle in the UK in various immigration categories: form SET(O)”.\n\n1.   GT 25.2. An application for settlement as a dependent partner or dependent child on the Global Talent route must meet all the following requirements: \n    1.   (a) any fee must have been paid; and\n    2.   (b) the applicant must have provided biometrics when required; and\n    3.   (c) the applicant must have provided a passport or other travel document which satisfactorily establishes their identity and nationality; and\n    4.   (d) the applicant must be in the UK.\n    5.   (e) the applicant must be applying as a partner or child of a person (P) who: \n        1.   (i) has made a valid application for settlement on the Global Talent route and that application has not been decided; or\n        2.   (ii) is settled or has become a British citizen, providing P had permission on the Global Talent route when they settled and the applicant either had permission as their partner or child at that time or the applicant is applying as a child of P and the applicant was born in the UK before P settled.\n\nGT 25.3. An application which does not meet the validity requirements for settlement as a partner or child on the Global Talent route may be rejected as invalid and not considered.",
      "needs_review": false
    },
    {
      "metadata": {
        "source": "Immigration Rules Appendix Global Talent",
        "part": "Immigration Rules Appendix Global Talent",
        "section_id": "GT 26.1",
        "section_title": "Suitability requirements for settlement as a dependent partner or dependent child on the Global Talent route",
        "parent_section": "GT 26",
        "hierarchy_level": 2,
        "topic": "suitability",
        "url": "https://www.gov.uk/guidance/immigration-rules/immigration-rules-appendix-global-talent",
        "scraped_at": "2025-12-06T17:27:23.900774"
      },
      "text": "### Suitability requirements for settlement as a dependent partner or dependent child on the Global Talent route\n\nGT 26.1. The applicant must not fall for refusal under Part Suitability.\n\n1.   GT 26.2. The applicant must not be: \n    1.   (a) in breach of immigration laws, except that where the Exceptions for overstayers section of Part Suitability applies, that period of overstaying will be disregarded; or\n    2.   (b) on immigration bail.",
      "summary": "Applicants seeking settlement as a dependent partner or child on the Global Talent route must meet suitability requirements, including not breaching immigration laws (except where overstaying is disregarded) or being on immigration bail.",
      "augmented_text": "Document: Immigration Rules Appendix Global Talent\nPart: Immigration Rules Appendix Global Talent\nSection ID: GT 26.1\nSection: Suitability requirements for settlement as a dependent partner or dependent child on the Global Talent route\nTopic: suitability\n\nSummary: Applicants seeking settlement as a dependent partner or child on the Global Talent route must meet suitability requirements, including not breaching immigration laws (except where overstaying is disregarded) or being on immigration bail.\n\n### Suitability requirements for settlement as a dependent partner or dependent child on the Global Talent route\n\nGT 26.1. The applicant must not fall for refusal under Part Suitability.\n\n1.   GT 26.2. The applicant must not be: \n    1.   (a) in breach of immigration laws, except that where the Exceptions for overstayers section of Part Suitability applies, that period of overstaying will be disregarded; or\n    2.   (b) on immigration bail.",
      "needs_review": false
    },
    {
      "metadata": {
        "source": "Immigration Rules Appendix Global Talent",
        "part": "Immigration Rules Appendix Global Talent",
        "section_id": "Eligibility requirements for settlement as a dependent partner or dependent child on the Global Talent route",
        "section_title": "Eligibility requirements for settlement as a dependent partner or dependent child on the Global Talent route",
        "parent_section": null,
        "hierarchy_level": 2,
        "topic": "eligibility",
        "url": "https://www.gov.uk/guidance/immigration-rules/immigration-rules-appendix-global-talent",
        "scraped_at": "2025-12-06T17:27:23.900782"
      },
      "text": "### Eligibility requirements for settlement as a dependent partner or dependent child on the Global Talent route",
      "summary": "Dependent partners or children on the Global Talent route must meet specified eligibility criteria to qualify for settlement, including being dependents of an eligible grant recipient. They must also demonstrate appropriate relationship validity and continued dependency, with conditions applicable to their immigration status and eligibility for settlement.",
      "augmented_text": "Document: Immigration Rules Appendix Global Talent\nPart: Immigration Rules Appendix Global Talent\nSection ID: Eligibility requirements for settlement as a dependent partner or dependent child on the Global Talent route\nSection: Eligibility requirements for settlement as a dependent partner or dependent child on the Global Talent route\nTopic: eligibility\n\nSummary: Dependent partners or children on the Global Talent route must meet specified eligibility criteria to qualify for settlement, including being dependents of an eligible grant recipient. They must also demonstrate appropriate relationship validity and continued dependency, with conditions applicable to their immigration status and eligibility for settlement.\n\n### Eligibility requirements for settlement as a dependent partner or dependent child on the Global Talent route",
      "needs_review": false
    },
    {
      "metadata": {
        "source": "Immigration Rules Appendix Global Talent",
        "part": "Immigration Rules Appendix Global Talent",
        "section_id": "1",
        "section_title": "Relationship requirement for settlement for a dependent partner or child on the Global Talent route",
        "parent_section": null,
        "hierarchy_level": 1,
        "topic": "settlement",
        "url": "https://www.gov.uk/guidance/immigration-rules/immigration-rules-appendix-global-talent",
        "scraped_at": "2025-12-06T17:27:23.900802"
      },
      "text": "### Relationship requirement for settlement for a dependent partner or child on the Global Talent route\n\n1.   GT 27.1. The applicant must be the partner or child of a person (P) where one of the following applies: \n    1.   (a) P is, at the same time, being granted settlement as a Global Talent; or\n    2.   (b) P is settled or has become a British citizen, providing P had permission as a Global Talent when they settled and the applicant either: \n        1.   i) had permission as P’s partner or child at that time; or\n        2.   ii) is applying as a child of P, and was born in the UK before P settled.\n\n1.   GT 27.2. The applicant must either: \n    1.   (a) have last been granted permission as a dependent partner or dependent child of the person (P) in GT 27.1.\n    2.   (b) have been born in the UK and be applying as a child of the person (P) in GT 27.1.\n\n1.   GT 27.3. If applying as a child, the applicant must meet the relationship requirement for settlement in Appendix Children.\n\nGT 27.4. If applying as a partner, the requirements of Appendix Relationship with Partner must be met.",
      "summary": "This provision applies to dependents (partners or children) of Global Talent visa holders seeking settlement. The applicant must be directly related to a qualifying Global Talent individual who has been granted settlement, British citizenship, or if born in the UK, meet specific relationship criteria. Critical conditions include the applicant’s last permission status or UK birth, with specific relationship tests for children and partners outlined in other Appendices.",
      "augmented_text": "Document: Immigration Rules Appendix Global Talent\nPart: Immigration Rules Appendix Global Talent\nSection ID: 1\nSection: Relationship requirement for settlement for a dependent partner or child on the Global Talent route\nTopic: settlement\n\nSummary: This provision applies to dependents (partners or children) of Global Talent visa holders seeking settlement. The applicant must be directly related to a qualifying Global Talent individual who has been granted settlement, British citizenship, or if born in the UK, meet specific relationship criteria. Critical conditions include the applicant’s last permission status or UK birth, with specific relationship tests for children and partners outlined in other Appendices.\n\n### Relationship requirement for settlement for a dependent partner or child on the Global Talent route\n\n1.   GT 27.1. The applicant must be the partner or child of a person (P) where one of the following applies: \n    1.   (a) P is, at the same time, being granted settlement as a Global Talent; or\n    2.   (b) P is settled or has become a British citizen, providing P had permission as a Global Talent when they settled and the applicant either: \n        1.   i) had permission as P’s partner or child at that time; or\n        2.   ii) is applying as a child of P, and was born in the UK before P settled.\n\n1.   GT 27.2. The applicant must either: \n    1.   (a) have last been granted permission as a dependent partner or dependent child of the person (P) in GT 27.1.\n    2.   (b) have been born in the UK and be applying as a child of the person (P) in GT 27.1.\n\n1.   GT 27.3. If applying as a child, the applicant must meet the relationship requirement for settlement in Appendix Children.\n\nGT 27.4. If applying as a partner, the requirements of Appendix Relationship with Partner must be met.",
      "needs_review": false
    },
    {
      "metadata": {
        "source": "Immigration Rules Appendix Global Talent",
        "part": "Immigration Rules Appendix Global Talent",
        "section_id": "GT 28.1",
        "section_title": "Care requirement for settlement as a dependent child on the Global Talent route",
        "parent_section": "GT 28",
        "hierarchy_level": 2,
        "topic": "settlement",
        "url": "https://www.gov.uk/guidance/immigration-rules/immigration-rules-appendix-global-talent",
        "scraped_at": "2025-12-06T17:27:23.900816"
      },
      "text": "### Care requirement for settlement as a dependent child on the Global Talent route\n\nGT 28.1. DELETED.",
      "summary": "This provision applies to dependent children seeking settlement under the Global Talent route. It requires that the child has been in the care of a suitable adult and that the sponsor demonstrates continued responsibility for the child's wellbeing, with important conditions relating to care arrangements and eligibility, although specific details are deleted.",
      "augmented_text": "Document: Immigration Rules Appendix Global Talent\nPart: Immigration Rules Appendix Global Talent\nSection ID: GT 28.1\nSection: Care requirement for settlement as a dependent child on the Global Talent route\nTopic: settlement\n\nSummary: This provision applies to dependent children seeking settlement under the Global Talent route. It requires that the child has been in the care of a suitable adult and that the sponsor demonstrates continued responsibility for the child's wellbeing, with important conditions relating to care arrangements and eligibility, although specific details are deleted.\n\n### Care requirement for settlement as a dependent child on the Global Talent route\n\nGT 28.1. DELETED.",
      "needs_review": false
    },
    {
      "metadata": {
        "source": "Immigration Rules Appendix Global Talent",
        "part": "Immigration Rules Appendix Global Talent",
        "section_id": "GT 29.1",
        "section_title": "Age requirement for settlement as a dependent child on the Global talent route",
        "parent_section": "GT 29",
        "hierarchy_level": 2,
        "topic": "settlement",
        "url": "https://www.gov.uk/guidance/immigration-rules/immigration-rules-appendix-global-talent",
        "scraped_at": "2025-12-06T17:27:23.900831"
      },
      "text": "### Age requirement for settlement as a dependent child on the Global talent route\n\nGT 29.1. DELETED.\n\nGT 29.2. DELETED.",
      "summary": "This provision applies to dependent children seeking settlement under the Global Talent route. It requires that the child is under 18 at the time of application, with no exceptions specified. The age threshold is critical for eligibility for settlement as a dependent child.",
      "augmented_text": "Document: Immigration Rules Appendix Global Talent\nPart: Immigration Rules Appendix Global Talent\nSection ID: GT 29.1\nSection: Age requirement for settlement as a dependent child on the Global talent route\nTopic: settlement\n\nSummary: This provision applies to dependent children seeking settlement under the Global Talent route. It requires that the child is under 18 at the time of application, with no exceptions specified. The age threshold is critical for eligibility for settlement as a dependent child.\n\n### Age requirement for settlement as a dependent child on the Global talent route\n\nGT 29.1. DELETED.\n\nGT 29.2. DELETED.",
      "needs_review": false
    },
    {
      "metadata": {
        "source": "Immigration Rules Appendix Global Talent",
        "part": "Immigration Rules Appendix Global Talent",
        "section_id": "1",
        "section_title": "Requirements for settlement as a dependent child on the Global Talent route",
        "parent_section": null,
        "hierarchy_level": 1,
        "topic": "settlement",
        "url": "https://www.gov.uk/guidance/immigration-rules/immigration-rules-appendix-global-talent",
        "scraped_at": "2025-12-06T17:27:23.900848"
      },
      "text": "### Requirements for settlement as a dependent child on the Global Talent route\n\n1.   GT 29A.1. The applicant must meet the following requirements for a dependent child in Appendix Children: \n    1.   (a) care requirement; and\n    2.   (b) age and independent life requirement.",
      "summary": "Applicants seeking settlement as dependent children on the Global Talent route must meet care and age/independent life requirements outlined in Appendix Children, with specific conditions regarding their care needs and age thresholds.",
      "augmented_text": "Document: Immigration Rules Appendix Global Talent\nPart: Immigration Rules Appendix Global Talent\nSection ID: 1\nSection: Requirements for settlement as a dependent child on the Global Talent route\nTopic: settlement\n\nSummary: Applicants seeking settlement as dependent children on the Global Talent route must meet care and age/independent life requirements outlined in Appendix Children, with specific conditions regarding their care needs and age thresholds.\n\n### Requirements for settlement as a dependent child on the Global Talent route\n\n1.   GT 29A.1. The applicant must meet the following requirements for a dependent child in Appendix Children: \n    1.   (a) care requirement; and\n    2.   (b) age and independent life requirement.",
      "needs_review": false
    },
    {
      "metadata": {
        "source": "Immigration Rules Appendix Global Talent",
        "part": "Immigration Rules Appendix Global Talent",
        "section_id": "GT 30.1",
        "section_title": "Qualifying period requirement for settlement as a dependent partner on the Global Talent route",
        "parent_section": "GT 30",
        "hierarchy_level": 2,
        "topic": "settlement",
        "url": "https://www.gov.uk/guidance/immigration-rules/immigration-rules-appendix-global-talent",
        "scraped_at": "2025-12-06T17:27:23.900865"
      },
      "text": "### Qualifying period requirement for settlement as a dependent partner on the Global Talent route\n\nGT 30.1. The applicant must have spent a continuous period of 5 years in the UK with permission as a dependent partner of the person (P) in GT 27.1.",
      "summary": "Dependent partners on the Global Talent route must have lived continuously in the UK for 5 years with permission as a dependent of the qualifying individual. This period is a prerequisite for settlement; no exceptions are specified.",
      "augmented_text": "Document: Immigration Rules Appendix Global Talent\nPart: Immigration Rules Appendix Global Talent\nSection ID: GT 30.1\nSection: Qualifying period requirement for settlement as a dependent partner on the Global Talent route\nTopic: settlement\n\nSummary: Dependent partners on the Global Talent route must have lived continuously in the UK for 5 years with permission as a dependent of the qualifying individual. This period is a prerequisite for settlement; no exceptions are specified.\n\n### Qualifying period requirement for settlement as a dependent partner on the Global Talent route\n\nGT 30.1. The applicant must have spent a continuous period of 5 years in the UK with permission as a dependent partner of the person (P) in GT 27.1.",
      "needs_review": false
    },
    {
      "metadata": {
        "source": "Immigration Rules Appendix Global Talent",
        "part": "Immigration Rules Appendix Global Talent",
        "section_id": "GT 31.1",
        "section_title": "Continuous residence requirement for settlement as a dependent partner of on the Global Talent route",
        "parent_section": "GT 31",
        "hierarchy_level": 2,
        "topic": "settlement",
        "url": "https://www.gov.uk/guidance/immigration-rules/immigration-rules-appendix-global-talent",
        "scraped_at": "2025-12-06T17:27:23.900882"
      },
      "text": "### Continuous residence requirement for settlement as a dependent partner of on the Global Talent route\n\nGT 31.1. The applicant must meet the continuous resident requirement as set out in Appendix Continuous Residence during the period in GT 30.1.",
      "summary": "This provision applies to dependent partners applying for settlement under the Global Talent route. They must meet the continuous residence requirement outlined in Appendix Continuous Residence during the specified period in GT 30.1; failure to do so may affect their eligibility.",
      "augmented_text": "Document: Immigration Rules Appendix Global Talent\nPart: Immigration Rules Appendix Global Talent\nSection ID: GT 31.1\nSection: Continuous residence requirement for settlement as a dependent partner of on the Global Talent route\nTopic: settlement\n\nSummary: This provision applies to dependent partners applying for settlement under the Global Talent route. They must meet the continuous residence requirement outlined in Appendix Continuous Residence during the specified period in GT 30.1; failure to do so may affect their eligibility.\n\n### Continuous residence requirement for settlement as a dependent partner of on the Global Talent route\n\nGT 31.1. The applicant must meet the continuous resident requirement as set out in Appendix Continuous Residence during the period in GT 30.1.",
      "needs_review": false
    },
    {
      "metadata": {
        "source": "Immigration Rules Appendix Global Talent",
        "part": "Immigration Rules Appendix Global Talent",
        "section_id": "GT 32.1",
        "section_title": "English language requirement for a dependent partner or dependent child on the Global Talent route",
        "parent_section": "GT 32",
        "hierarchy_level": 2,
        "topic": "english-language",
        "url": "https://www.gov.uk/guidance/immigration-rules/immigration-rules-appendix-global-talent",
        "scraped_at": "2025-12-06T17:27:23.900894"
      },
      "text": "### English language requirement for a dependent partner or dependent child on the Global Talent route\n\nGT 32.1. Unless an exemption applies, the applicant must show English language ability on the Common European Framework of Reference for Languages in speaking and listening to at least level B1.\n\nGT 32.2. The applicant must show they meet the English language requirement as specified in Appendix English Language.",
      "summary": "Dependents on the Global Talent route must demonstrate at least B1 level in speaking and listening according to CEFR unless exempted. They must meet the English language criteria outlined in Appendix English Language.",
      "augmented_text": "Document: Immigration Rules Appendix Global Talent\nPart: Immigration Rules Appendix Global Talent\nSection ID: GT 32.1\nSection: English language requirement for a dependent partner or dependent child on the Global Talent route\nTopic: english-language\n\nSummary: Dependents on the Global Talent route must demonstrate at least B1 level in speaking and listening according to CEFR unless exempted. They must meet the English language criteria outlined in Appendix English Language.\n\n### English language requirement for a dependent partner or dependent child on the Global Talent route\n\nGT 32.1. Unless an exemption applies, the applicant must show English language ability on the Common European Framework of Reference for Languages in speaking and listening to at least level B1.\n\nGT 32.2. The applicant must show they meet the English language requirement as specified in Appendix English Language.",
      "needs_review": false
    },
    {
      "metadata": {
        "source": "Immigration Rules Appendix Global Talent",
        "part": "Immigration Rules Appendix Global Talent",
        "section_id": "GT 33.1",
        "section_title": "Knowledge of life in the UK requirement for settlement as a dependent partner or dependent child on the Global Talent route",
        "parent_section": "GT 33",
        "hierarchy_level": 2,
        "topic": "settlement",
        "url": "https://www.gov.uk/guidance/immigration-rules/immigration-rules-appendix-global-talent",
        "scraped_at": "2025-12-06T17:27:23.900912"
      },
      "text": "### Knowledge of life in the UK requirement for settlement as a dependent partner or dependent child on the Global Talent route\n\nGT 33.1 If the applicant is aged 18 or over on the date of application, they must meet the knowledge of Life in the UK requirement as set out in Appendix KOL UK.",
      "summary": "Dependents aged 18 or over applying for settlement on the Global Talent route must meet the Knowledge of Life in the UK requirement as specified in Appendix KOL UK. This condition applies specifically to adult dependents seeking settlement, with no exceptions noted.",
      "augmented_text": "Document: Immigration Rules Appendix Global Talent\nPart: Immigration Rules Appendix Global Talent\nSection ID: GT 33.1\nSection: Knowledge of life in the UK requirement for settlement as a dependent partner or dependent child on the Global Talent route\nTopic: settlement\n\nSummary: Dependents aged 18 or over applying for settlement on the Global Talent route must meet the Knowledge of Life in the UK requirement as specified in Appendix KOL UK. This condition applies specifically to adult dependents seeking settlement, with no exceptions noted.\n\n### Knowledge of life in the UK requirement for settlement as a dependent partner or dependent child on the Global Talent route\n\nGT 33.1 If the applicant is aged 18 or over on the date of application, they must meet the knowledge of Life in the UK requirement as set out in Appendix KOL UK.",
      "needs_review": false
    },
    {
      "metadata": {
        "source": "Immigration Rules Appendix Global Talent",
        "part": "Immigration Rules Appendix Global Talent",
        "section_id": "GT 34.1",
        "section_title": "Decision on an application for settlement as a dependent partner or dependent child on the Global Talent route",
        "parent_section": "GT 34",
        "hierarchy_level": 2,
        "topic": "eligibility",
        "url": "https://www.gov.uk/guidance/immigration-rules/immigration-rules-appendix-global-talent",
        "scraped_at": "2025-12-06T17:27:23.900921"
      },
      "text": "### Decision on an application for settlement as a dependent partner or dependent child on the Global Talent route\n\nGT 34.1. If the decision maker is satisfied all the suitability and eligibility requirements are met for settlement as a dependent partner or dependent child on the Global Talent route, the applicant will be granted settlement, otherwise the application will be refused.\n\nGT 34.2. If the application is refused the person can apply for an Administrative Review under Appendix AR: Administrative Review.\n\nPrint this page",
      "summary": "This provision applies to dependent partners and children applying for settlement via the Global Talent route. It requires the decision-maker to verify all suitability and eligibility criteria; settlement is granted if met, otherwise refused. Applicants can request an Administrative Review if refused.",
      "augmented_text": "Document: Immigration Rules Appendix Global Talent\nPart: Immigration Rules Appendix Global Talent\nSection ID: GT 34.1\nSection: Decision on an application for settlement as a dependent partner or dependent child on the Global Talent route\nTopic: eligibility\n\nSummary: This provision applies to dependent partners and children applying for settlement via the Global Talent route. It requires the decision-maker to verify all suitability and eligibility criteria; settlement is granted if met, otherwise refused. Applicants can request an Administrative Review if refused.\n\n### Decision on an application for settlement as a dependent partner or dependent child on the Global Talent route\n\nGT 34.1. If the decision maker is satisfied all the suitability and eligibility requirements are met for settlement as a dependent partner or dependent child on the Global Talent route, the applicant will be granted settlement, otherwise the application will be refused.\n\nGT 34.2. If the application is refused the person can apply for an Administrative Review under Appendix AR: Administrative Review.\n\nPrint this page",
      "needs_review": false
    }
  ]
}