{
  "url": "https://www.gov.uk/guidance/immigration-rules/immigration-rules-appendix-graduate",
  "part_name": "Immigration Rules Appendix Graduate",
  "scraped_at": "2025-12-06T17:27:34.572921",
  "chunk_count": 22,
  "chunks": [
    {
      "metadata": {
        "source": "Immigration Rules Appendix Graduate",
        "part": "Immigration Rules Appendix Graduate",
        "section_id": "GR 1.1",
        "section_title": "Validation requirements for a Graduate",
        "parent_section": "GR 1",
        "hierarchy_level": 2,
        "topic": "eligibility",
        "url": "https://www.gov.uk/guidance/immigration-rules/immigration-rules-appendix-graduate",
        "scraped_at": "2025-12-06T17:27:34.571712"
      },
      "text": "### Validation requirements for a Graduate\n\nGR 1.1. A person applying for permission to stay as a Graduate must apply online on the gov.uk website on the specified form “Graduate”.\n\n1.   GR 1.2. An application for permission as a Graduate must meet all the following requirements: \n    1.   (a) any fee and Immigration Health Charge must have been paid; and\n    2.   (b) the applicant must have provided biometrics when required; and\n    3.   (c) the applicant must have provided a passport or other document which satisfactorily establishes their identity and nationality; and\n    4.   (d) the applicant must be in the UK.\n\nGR 1.3. The applicant must have, or have last had, permission as a Student.\n\nGR 1.4. The applicant must not have been previously granted permission under the Doctorate Extension Scheme or as a Graduate.\n\nGR 1.5. If the applicant has in the 12 months before the date of application completed a course of studies in the UK for which they have been awarded a scholarship or sponsorship by a Government or international scholarship agency covering both fees and living costs for study in the UK, they must provide written consent to the application from that Government or agency.\n\nGR 1.6. An application which does not meet all the validity requirements for a Graduate may be rejected as invalid and not considered.",
      "summary": "Applicants must apply online as a Graduate in the UK, paying all fees, providing biometrics and valid identity documents, and currently or previously held Student permission. Exceptions include recent scholarship or sponsorship consent; failure to meet all validity requirements leads to rejection.",
      "augmented_text": "Document: Immigration Rules Appendix Graduate\nPart: Immigration Rules Appendix Graduate\nSection ID: GR 1.1\nSection: Validation requirements for a Graduate\nTopic: eligibility\n\nSummary: Applicants must apply online as a Graduate in the UK, paying all fees, providing biometrics and valid identity documents, and currently or previously held Student permission. Exceptions include recent scholarship or sponsorship consent; failure to meet all validity requirements leads to rejection.\n\n### Validation requirements for a Graduate\n\nGR 1.1. A person applying for permission to stay as a Graduate must apply online on the gov.uk website on the specified form “Graduate”.\n\n1.   GR 1.2. An application for permission as a Graduate must meet all the following requirements: \n    1.   (a) any fee and Immigration Health Charge must have been paid; and\n    2.   (b) the applicant must have provided biometrics when required; and\n    3.   (c) the applicant must have provided a passport or other document which satisfactorily establishes their identity and nationality; and\n    4.   (d) the applicant must be in the UK.\n\nGR 1.3. The applicant must have, or have last had, permission as a Student.\n\nGR 1.4. The applicant must not have been previously granted permission under the Doctorate Extension Scheme or as a Graduate.\n\nGR 1.5. If the applicant has in the 12 months before the date of application completed a course of studies in the UK for which they have been awarded a scholarship or sponsorship by a Government or international scholarship agency covering both fees and living costs for study in the UK, they must provide written consent to the application from that Government or agency.\n\nGR 1.6. An application which does not meet all the validity requirements for a Graduate may be rejected as invalid and not considered.",
      "needs_review": false
    },
    {
      "metadata": {
        "source": "Immigration Rules Appendix Graduate",
        "part": "Immigration Rules Appendix Graduate",
        "section_id": "GR 2.1",
        "section_title": "Suitability requirements for a Graduate",
        "parent_section": "GR 2",
        "hierarchy_level": 2,
        "topic": "suitability",
        "url": "https://www.gov.uk/guidance/immigration-rules/immigration-rules-appendix-graduate",
        "scraped_at": "2025-12-06T17:27:34.571750"
      },
      "text": "### Suitability requirements for a Graduate\n\nGR 2.1. The applicant must not fall for refusal under Part Suitability.\n\n1.   GR 2.2. The applicant must not be: \n    1.   (a) in the UK in breach of immigration laws, except that where the Exceptions for overstayers section of Part Suitability applies, that period of overstaying will be disregarded; or\n    2.   (b) on immigration bail.",
      "summary": "This provision applies to Graduate applicants, requiring them to meet suitability criteria without breaches under Part Suitability. They must not be unlawfully in the UK (except certain overstays) or be on immigration bail.",
      "augmented_text": "Document: Immigration Rules Appendix Graduate\nPart: Immigration Rules Appendix Graduate\nSection ID: GR 2.1\nSection: Suitability requirements for a Graduate\nTopic: suitability\n\nSummary: This provision applies to Graduate applicants, requiring them to meet suitability criteria without breaches under Part Suitability. They must not be unlawfully in the UK (except certain overstays) or be on immigration bail.\n\n### Suitability requirements for a Graduate\n\nGR 2.1. The applicant must not fall for refusal under Part Suitability.\n\n1.   GR 2.2. The applicant must not be: \n    1.   (a) in the UK in breach of immigration laws, except that where the Exceptions for overstayers section of Part Suitability applies, that period of overstaying will be disregarded; or\n    2.   (b) on immigration bail.",
      "needs_review": false
    },
    {
      "metadata": {
        "source": "Immigration Rules Appendix Graduate",
        "part": "Immigration Rules Appendix Graduate",
        "section_id": "Eligibility requirements for a Graduate",
        "section_title": "Eligibility requirements for a Graduate",
        "parent_section": null,
        "hierarchy_level": 2,
        "topic": "eligibility",
        "url": "https://www.gov.uk/guidance/immigration-rules/immigration-rules-appendix-graduate",
        "scraped_at": "2025-12-06T17:27:34.571760"
      },
      "text": "### Eligibility requirements for a Graduate",
      "summary": "This section applies to graduates seeking immigration status under the Graduate route. Applicants must have completed an eligible qualification at a UK higher education provider and meet maintenance and English language requirements. Exceptions apply if otherwise specified in the rules.",
      "augmented_text": "Document: Immigration Rules Appendix Graduate\nPart: Immigration Rules Appendix Graduate\nSection ID: Eligibility requirements for a Graduate\nSection: Eligibility requirements for a Graduate\nTopic: eligibility\n\nSummary: This section applies to graduates seeking immigration status under the Graduate route. Applicants must have completed an eligible qualification at a UK higher education provider and meet maintenance and English language requirements. Exceptions apply if otherwise specified in the rules.\n\n### Eligibility requirements for a Graduate",
      "needs_review": false
    },
    {
      "metadata": {
        "source": "Immigration Rules Appendix Graduate",
        "part": "Immigration Rules Appendix Graduate",
        "section_id": "GR 3.1",
        "section_title": "Points requirement",
        "parent_section": "GR 3",
        "hierarchy_level": 2,
        "topic": "eligibility",
        "url": "https://www.gov.uk/guidance/immigration-rules/immigration-rules-appendix-graduate",
        "scraped_at": "2025-12-06T17:27:34.571773"
      },
      "text": "### Points requirement\n\nGR 3.1. The applicant must be awarded all 70 points in the table below.\n\n| Points type | Relevant requirements to be met | Number of points |\n| --- | --- | --- |\n| Successful course completion | • Successful completion requirement • Qualification requirement • Study in the UK requirement | 70 |",
      "summary": "Applicants seeking graduate admission must be awarded all 70 points, primarily through successful UK course completion, qualification, and study requirements; failure to meet these thresholds disqualifies eligibility under this rule.",
      "augmented_text": "Document: Immigration Rules Appendix Graduate\nPart: Immigration Rules Appendix Graduate\nSection ID: GR 3.1\nSection: Points requirement\nTopic: eligibility\n\nSummary: Applicants seeking graduate admission must be awarded all 70 points, primarily through successful UK course completion, qualification, and study requirements; failure to meet these thresholds disqualifies eligibility under this rule.\n\n### Points requirement\n\nGR 3.1. The applicant must be awarded all 70 points in the table below.\n\n| Points type | Relevant requirements to be met | Number of points |\n| --- | --- | --- |\n| Successful course completion | • Successful completion requirement • Qualification requirement • Study in the UK requirement | 70 |",
      "needs_review": false
    },
    {
      "metadata": {
        "source": "Immigration Rules Appendix Graduate",
        "part": "Immigration Rules Appendix Graduate",
        "section_id": "GR 4.1",
        "section_title": "Successful completion requirement",
        "parent_section": "GR 4",
        "hierarchy_level": 2,
        "topic": "eligibility",
        "url": "https://www.gov.uk/guidance/immigration-rules/immigration-rules-appendix-graduate",
        "scraped_at": "2025-12-06T17:27:34.571823"
      },
      "text": "### Successful completion requirement\n\nGR 4.1. The applicant must have last been sponsored by a Student sponsor which is a higher education provider with a track record of compliance on the date of application.\n\nGR 4.2. The applicant must have successfully completed the course of study which was undertaken during their last grant of permission to study on the Student route (where the applicant was allowed to change their course of study without applying for further permission as a Student, this requirement only applies to the course to which they changed).\n\nGR 4.3. The student sponsor must have notified the Home Office, by the date of application, that the applicant has successfully completed the course of study in GR 4.2.",
      "summary": "This provision applies to students applying under the Graduate route. They must have been sponsored by a UK higher education provider with a strong compliance record, completed their course of study during their last permission, and their sponsor must have notified the Home Office of this completion before application.",
      "augmented_text": "Document: Immigration Rules Appendix Graduate\nPart: Immigration Rules Appendix Graduate\nSection ID: GR 4.1\nSection: Successful completion requirement\nTopic: eligibility\n\nSummary: This provision applies to students applying under the Graduate route. They must have been sponsored by a UK higher education provider with a strong compliance record, completed their course of study during their last permission, and their sponsor must have notified the Home Office of this completion before application.\n\n### Successful completion requirement\n\nGR 4.1. The applicant must have last been sponsored by a Student sponsor which is a higher education provider with a track record of compliance on the date of application.\n\nGR 4.2. The applicant must have successfully completed the course of study which was undertaken during their last grant of permission to study on the Student route (where the applicant was allowed to change their course of study without applying for further permission as a Student, this requirement only applies to the course to which they changed).\n\nGR 4.3. The student sponsor must have notified the Home Office, by the date of application, that the applicant has successfully completed the course of study in GR 4.2.",
      "needs_review": false
    },
    {
      "metadata": {
        "source": "Immigration Rules Appendix Graduate",
        "part": "Immigration Rules Appendix Graduate",
        "section_id": "GR 5.1",
        "section_title": "Qualification requirement",
        "parent_section": "GR 5",
        "hierarchy_level": 2,
        "topic": "eligibility",
        "url": "https://www.gov.uk/guidance/immigration-rules/immigration-rules-appendix-graduate",
        "scraped_at": "2025-12-06T17:27:34.571898"
      },
      "text": "### Qualification requirement\n\nGR 5.1. The applicant will meet the qualification requirement if they have successfully completed a course of study for which they have been or will be awarded a UK bachelor’s degree, a UK postgraduate degree, or successfully completed a relevant qualification listed in GR 5.2.\n\n1.   GR 5.2 A relevant qualification is one of the following: \n    1.   (a) a law conversion course validated by the Solicitors Regulation Authority in England and Wales; or\n    2.   (b) the Legal Practice Course in England and Wales, the Solicitors Course in Northern Ireland, or a Diploma in Professional Legal Practice in Scotland; or\n    3.   (c) the Bar Practice Course in England and Wales, or the Bar Course in Northern Ireland; or\n    4.   (d) DELETED\n    5.   (e) a Postgraduate Certificate in Education (PGCE) or Postgraduate Diploma in Education (PGDE); or\n    6.   (f) a professional course requiring study at UK bachelor’s degree level or above in a profession with reserved activities that is regulated by UK law or UK public authority.\n\nGR 5.3. If the name of the applicant’s course of study was changed by the Student sponsor, but the course content remained the same, or if an integral and assessed work placement or permitted study abroad programme was added, this will not prevent the applicant being able to meet the qualification requirement.\n\nGR 5.4 The qualification must have been gained during the last grant of permission to study as a Student, or in the period of permission immediately before the applicant’s last grant of permission, if the last grant of permission was to undertake a role as a Student Union Sabbatical Officer.",
      "summary": "This provision applies to applicants seeking to meet the qualification requirement for UK immigration. They must have completed a UK bachelor’s, postgraduate degree, or a relevant qualification listed in GR 5.2, obtained during their last grant of permission to study. Changes in course name or content, including work placements or study abroad, do not affect qualification eligibility.",
      "augmented_text": "Document: Immigration Rules Appendix Graduate\nPart: Immigration Rules Appendix Graduate\nSection ID: GR 5.1\nSection: Qualification requirement\nTopic: eligibility\n\nSummary: This provision applies to applicants seeking to meet the qualification requirement for UK immigration. They must have completed a UK bachelor’s, postgraduate degree, or a relevant qualification listed in GR 5.2, obtained during their last grant of permission to study. Changes in course name or content, including work placements or study abroad, do not affect qualification eligibility.\n\n### Qualification requirement\n\nGR 5.1. The applicant will meet the qualification requirement if they have successfully completed a course of study for which they have been or will be awarded a UK bachelor’s degree, a UK postgraduate degree, or successfully completed a relevant qualification listed in GR 5.2.\n\n1.   GR 5.2 A relevant qualification is one of the following: \n    1.   (a) a law conversion course validated by the Solicitors Regulation Authority in England and Wales; or\n    2.   (b) the Legal Practice Course in England and Wales, the Solicitors Course in Northern Ireland, or a Diploma in Professional Legal Practice in Scotland; or\n    3.   (c) the Bar Practice Course in England and Wales, or the Bar Course in Northern Ireland; or\n    4.   (d) DELETED\n    5.   (e) a Postgraduate Certificate in Education (PGCE) or Postgraduate Diploma in Education (PGDE); or\n    6.   (f) a professional course requiring study at UK bachelor’s degree level or above in a profession with reserved activities that is regulated by UK law or UK public authority.\n\nGR 5.3. If the name of the applicant’s course of study was changed by the Student sponsor, but the course content remained the same, or if an integral and assessed work placement or permitted study abroad programme was added, this will not prevent the applicant being able to meet the qualification requirement.\n\nGR 5.4 The qualification must have been gained during the last grant of permission to study as a Student, or in the period of permission immediately before the applicant’s last grant of permission, if the last grant of permission was to undertake a role as a Student Union Sabbatical Officer.",
      "needs_review": false
    },
    {
      "metadata": {
        "source": "Immigration Rules Appendix Graduate",
        "part": "Immigration Rules Appendix Graduate",
        "section_id": "GR 6.1",
        "section_title": "Study in the UK requirement",
        "parent_section": "GR 6",
        "hierarchy_level": 2,
        "topic": "eligibility",
        "url": "https://www.gov.uk/guidance/immigration-rules/immigration-rules-appendix-graduate",
        "scraped_at": "2025-12-06T17:27:34.571960"
      },
      "text": "### Study in the UK requirement\n\nGR 6.1. The applicant must have held permission as a Student, which was granted to study the relevant qualification in the UK, for a minimum period of time (the relevant period), as in the table below.\n\n| Total length of course | Relevant period of Student permission granted during which all study took place in the UK (apart from permitted study abroad programmes) |\n| --- | --- |\n| 12 months or less | Full duration of course |\n| Longer than 12 months | At least 12 months |\n\n1.   GR 6.2. Where distance learning took place overseas between 24 January 2020 and 30 June 2022, this will not prevent the applicant meeting the requirement to spend the relevant period at GR 6.1 studying in the UK if either: \n    1.   (a) they began a course of 12 months or less prior to 21 June 2021 and entered the UK on or before 27 September 2021 with permission as a Student; or\n    2.   (b) they began a course of 12 months or less between 21 June 2021 and 30 June 2022 and entered the UK on or before 30 June 2022 with permission as a Student.\n\nGR 6.3. Any period of distance learning that took place between 24 January 2020 and 30 June 2022 as part of a course of study lasting longer than 12 months whilst the applicant held permission as a Student, will not prevent the applicant from meeting the requirement to spend the relevant period at GR 6.1. studying in the UK.",
      "summary": "This provision applies to Student visa applicants seeking to meet UK study requirements. The applicant must have held Student permission for the duration of their course—full length if ≤12 months, at least 12 months if longer—with specific allowances for distance learning overseas during COVID-19 (Jan 2020-Jun 2022). Exceptions apply for permitted distance learning periods and early course starts.",
      "augmented_text": "Document: Immigration Rules Appendix Graduate\nPart: Immigration Rules Appendix Graduate\nSection ID: GR 6.1\nSection: Study in the UK requirement\nTopic: eligibility\n\nSummary: This provision applies to Student visa applicants seeking to meet UK study requirements. The applicant must have held Student permission for the duration of their course—full length if ≤12 months, at least 12 months if longer—with specific allowances for distance learning overseas during COVID-19 (Jan 2020-Jun 2022). Exceptions apply for permitted distance learning periods and early course starts.\n\n### Study in the UK requirement\n\nGR 6.1. The applicant must have held permission as a Student, which was granted to study the relevant qualification in the UK, for a minimum period of time (the relevant period), as in the table below.\n\n| Total length of course | Relevant period of Student permission granted during which all study took place in the UK (apart from permitted study abroad programmes) |\n| --- | --- |\n| 12 months or less | Full duration of course |\n| Longer than 12 months | At least 12 months |\n\n1.   GR 6.2. Where distance learning took place overseas between 24 January 2020 and 30 June 2022, this will not prevent the applicant meeting the requirement to spend the relevant period at GR 6.1 studying in the UK if either: \n    1.   (a) they began a course of 12 months or less prior to 21 June 2021 and entered the UK on or before 27 September 2021 with permission as a Student; or\n    2.   (b) they began a course of 12 months or less between 21 June 2021 and 30 June 2022 and entered the UK on or before 30 June 2022 with permission as a Student.\n\nGR 6.3. Any period of distance learning that took place between 24 January 2020 and 30 June 2022 as part of a course of study lasting longer than 12 months whilst the applicant held permission as a Student, will not prevent the applicant from meeting the requirement to spend the relevant period at GR 6.1. studying in the UK.",
      "needs_review": false
    },
    {
      "metadata": {
        "source": "Immigration Rules Appendix Graduate",
        "part": "Immigration Rules Appendix Graduate",
        "section_id": "GR 7.1",
        "section_title": "Decision on an application as a Graduate",
        "parent_section": "GR 7",
        "hierarchy_level": 2,
        "topic": "eligibility",
        "url": "https://www.gov.uk/guidance/immigration-rules/immigration-rules-appendix-graduate",
        "scraped_at": "2025-12-06T17:27:34.571984"
      },
      "text": "### Decision on an application as a Graduate\n\nGR 7.1. If the decision maker is satisfied that all the suitability and eligibility requirements for a Graduate are met the application will be granted, otherwise the application will be refused.\n\nGR 7.2. If the application is refused, the person can apply for an Administrative Review under Appendix AR: Administrative Review.",
      "summary": "This provision applies to applicants seeking a Graduate visa. The decision-maker grants the application if all suitability and eligibility criteria are met; otherwise, it is refused, with applicants entitled to request an Administrative Review.",
      "augmented_text": "Document: Immigration Rules Appendix Graduate\nPart: Immigration Rules Appendix Graduate\nSection ID: GR 7.1\nSection: Decision on an application as a Graduate\nTopic: eligibility\n\nSummary: This provision applies to applicants seeking a Graduate visa. The decision-maker grants the application if all suitability and eligibility criteria are met; otherwise, it is refused, with applicants entitled to request an Administrative Review.\n\n### Decision on an application as a Graduate\n\nGR 7.1. If the decision maker is satisfied that all the suitability and eligibility requirements for a Graduate are met the application will be granted, otherwise the application will be refused.\n\nGR 7.2. If the application is refused, the person can apply for an Administrative Review under Appendix AR: Administrative Review.",
      "needs_review": false
    },
    {
      "metadata": {
        "source": "Immigration Rules Appendix Graduate",
        "part": "Immigration Rules Appendix Graduate",
        "section_id": "GR 8.1",
        "section_title": "Period of grant for a Graduate",
        "parent_section": "GR 8",
        "hierarchy_level": 2,
        "topic": "eligibility",
        "url": "https://www.gov.uk/guidance/immigration-rules/immigration-rules-appendix-graduate",
        "scraped_at": "2025-12-06T17:27:34.572042"
      },
      "text": "### Period of grant for a Graduate\n\nGR 8.1. The applicant will be granted the period of permission as set out in the table below:\n\n| Type of Qualification | Period granted from date of decision |\n| --- | --- |\n| PhD or other doctoral qualification | 3 years |\n| All other qualifications | 2 years if the applicant has successfully completed a course at UK bachelor’s degree or master’s degree level, or another relevant qualification that meets the requirement of ST8.1/2/3 of the Rules, and the application is made before 1 January 2027. |\n| All other qualifications | 18 months if the applicant has successfully completed a course at UK bachelor’s degree or master’s degree level, or another relevant qualification that meets the requirement of ST8.1/2/3 of the Rules, and the application is made on or after 1 January 2027. |",
      "summary": "The provision applies to graduates applying for permission to stay in the UK. It grants 3 years for PhD holders, 2 years for other qualifications if the application is before 1 Jan 2027, and 18 months if after, contingent on course completion and timing.",
      "augmented_text": "Document: Immigration Rules Appendix Graduate\nPart: Immigration Rules Appendix Graduate\nSection ID: GR 8.1\nSection: Period of grant for a Graduate\nTopic: eligibility\n\nSummary: The provision applies to graduates applying for permission to stay in the UK. It grants 3 years for PhD holders, 2 years for other qualifications if the application is before 1 Jan 2027, and 18 months if after, contingent on course completion and timing.\n\n### Period of grant for a Graduate\n\nGR 8.1. The applicant will be granted the period of permission as set out in the table below:\n\n| Type of Qualification | Period granted from date of decision |\n| --- | --- |\n| PhD or other doctoral qualification | 3 years |\n| All other qualifications | 2 years if the applicant has successfully completed a course at UK bachelor’s degree or master’s degree level, or another relevant qualification that meets the requirement of ST8.1/2/3 of the Rules, and the application is made before 1 January 2027. |\n| All other qualifications | 18 months if the applicant has successfully completed a course at UK bachelor’s degree or master’s degree level, or another relevant qualification that meets the requirement of ST8.1/2/3 of the Rules, and the application is made on or after 1 January 2027. |",
      "needs_review": false
    },
    {
      "metadata": {
        "source": "Immigration Rules Appendix Graduate",
        "part": "Immigration Rules Appendix Graduate",
        "section_id": "1",
        "section_title": "Conditions of grant for a Graduate",
        "parent_section": null,
        "hierarchy_level": 1,
        "topic": "financial",
        "url": "https://www.gov.uk/guidance/immigration-rules/immigration-rules-appendix-graduate",
        "scraped_at": "2025-12-06T17:27:34.572073"
      },
      "text": "### Conditions of grant for a Graduate\n\n1.   GR 8.2. The grant will be subject to all the following conditions: \n    1.   (a) no access to public funds; and\n    2.   (b) work (including self-employment and voluntary work) is permitted, apart from work as a professional sportsperson; and\n    3.   (c) study is permitted, except study with an education provider which is a Student sponsor, and which would meet the approved qualification and level of study requirements of the Student route which are set out in Appendix Student; and\n    4.   (d) study is subject to the ATAS condition in Appendix ATAS.\n    5.   (e) DELETED",
      "summary": "The grant applies to graduates, allowing work and study with restrictions. They must not access public funds, cannot work as professional sportspeople, and their study must not involve a Student sponsor or violate ATAS conditions. Exceptions include permitted work, self-employment, and voluntary activities.",
      "augmented_text": "Document: Immigration Rules Appendix Graduate\nPart: Immigration Rules Appendix Graduate\nSection ID: 1\nSection: Conditions of grant for a Graduate\nTopic: financial\n\nSummary: The grant applies to graduates, allowing work and study with restrictions. They must not access public funds, cannot work as professional sportspeople, and their study must not involve a Student sponsor or violate ATAS conditions. Exceptions include permitted work, self-employment, and voluntary activities.\n\n### Conditions of grant for a Graduate\n\n1.   GR 8.2. The grant will be subject to all the following conditions: \n    1.   (a) no access to public funds; and\n    2.   (b) work (including self-employment and voluntary work) is permitted, apart from work as a professional sportsperson; and\n    3.   (c) study is permitted, except study with an education provider which is a Student sponsor, and which would meet the approved qualification and level of study requirements of the Student route which are set out in Appendix Student; and\n    4.   (d) study is subject to the ATAS condition in Appendix ATAS.\n    5.   (e) DELETED",
      "needs_review": false
    },
    {
      "metadata": {
        "source": "Immigration Rules Appendix Graduate",
        "part": "Immigration Rules Appendix Graduate",
        "section_id": "GD 1",
        "section_title": "Dependants of a Graduate",
        "parent_section": null,
        "hierarchy_level": 2,
        "topic": "eligibility",
        "url": "https://www.gov.uk/guidance/immigration-rules/immigration-rules-appendix-graduate",
        "scraped_at": "2025-12-06T17:27:34.572108"
      },
      "text": "### Dependants of a Graduate",
      "summary": "This provision applies to dependants of a graduate. It requires them to meet specified relationship and suitability criteria to qualify for entry or stay, with certain restrictions outlined, such as not being eligible if they have overstayed or breached immigration conditions.",
      "augmented_text": "Document: Immigration Rules Appendix Graduate\nPart: Immigration Rules Appendix Graduate\nSection ID: GD 1\nSection: Dependants of a Graduate\nTopic: eligibility\n\nSummary: This provision applies to dependants of a graduate. It requires them to meet specified relationship and suitability criteria to qualify for entry or stay, with certain restrictions outlined, such as not being eligible if they have overstayed or breached immigration conditions.\n\n### Dependants of a Graduate",
      "needs_review": false
    },
    {
      "metadata": {
        "source": "Immigration Rules Appendix Graduate",
        "part": "Immigration Rules Appendix Graduate",
        "section_id": "GR 9.1",
        "section_title": "Validity requirements for a dependent partner or dependent child of a Graduate",
        "parent_section": "GR 9",
        "hierarchy_level": 2,
        "topic": "family",
        "url": "https://www.gov.uk/guidance/immigration-rules/immigration-rules-appendix-graduate",
        "scraped_at": "2025-12-06T17:27:34.572200"
      },
      "text": "### Validity requirements for a dependent partner or dependent child of a Graduate\n\nGR 9.1. A person applying for permission to stay as a partner or child of a Graduate must apply on the specified form on the gov.uk website as follows:\n\n1.   Either (as applicable): \n    1.   Dependant partner\n    2.   Dependant child\n\n1.   GR 9.2. An application for permission to stay as a partner or child of a Graduate must meet all the following requirements: \n    1.   (a) any fee and Immigration Health Charge must have been paid; and\n    2.   (b) the applicant must have provided biometrics when required; and\n    3.   (c) the applicant must have provided a passport or other document which satisfactorily establishes their identity and nationality; and\n    4.   (d) the applicant must be applying as partner or child of a person who: \n        1.   (i) has made a valid application for permission to stay on the Graduate route that has not been decided; or\n        2.   (ii) has permission to stay on the Graduate route.\n\nGR 9.3. If the applicant has in the 12 months before the date of application completed a course of studies in the UK for which they have been awarded a scholarship or sponsorship by a Government or international scholarship agency covering both fees and living costs for study in the UK, they must provide written consent to the application from that Government or agency.\n\nGR 9.4. The applicant must be in the UK on the date of application.\n\n1.   GR 9.4A. The applicant must meet one of the following requirements: \n    1.   (a) they must have, or have last been granted, permission as a dependent partner of a Student and that Student is applying for, or has now been granted, permission to stay in the Graduate route; or\n    2.   (b) they must have, or have last been granted, permission as a dependent child of either a Student or dependent partner of the Student and that Student is applying for, or has now been granted, permission to stay in the Graduate route; or\n    3.   (c) they must be a child born in the UK during the last grant of Student permission of a Student and that Student is applying for, or has now been granted, permission to stay in the Graduate route.\n\nGR 9.5. An application which does not meet all the validity requirements for a partner or child of a Graduate may be rejected as invalid and not considered.",
      "summary": "Dependent partners or children of Graduates applying to stay must submit a specified form, pay fees and health charges, provide biometrics and identity documents, and be linked to a Graduate route holder with valid or pending permission. If awarded a UK scholarship in the past 12 months, written consent from the sponsoring agency is required; applicants must also be physically present in the UK at application.",
      "augmented_text": "Document: Immigration Rules Appendix Graduate\nPart: Immigration Rules Appendix Graduate\nSection ID: GR 9.1\nSection: Validity requirements for a dependent partner or dependent child of a Graduate\nTopic: family\n\nSummary: Dependent partners or children of Graduates applying to stay must submit a specified form, pay fees and health charges, provide biometrics and identity documents, and be linked to a Graduate route holder with valid or pending permission. If awarded a UK scholarship in the past 12 months, written consent from the sponsoring agency is required; applicants must also be physically present in the UK at application.\n\n### Validity requirements for a dependent partner or dependent child of a Graduate\n\nGR 9.1. A person applying for permission to stay as a partner or child of a Graduate must apply on the specified form on the gov.uk website as follows:\n\n1.   Either (as applicable): \n    1.   Dependant partner\n    2.   Dependant child\n\n1.   GR 9.2. An application for permission to stay as a partner or child of a Graduate must meet all the following requirements: \n    1.   (a) any fee and Immigration Health Charge must have been paid; and\n    2.   (b) the applicant must have provided biometrics when required; and\n    3.   (c) the applicant must have provided a passport or other document which satisfactorily establishes their identity and nationality; and\n    4.   (d) the applicant must be applying as partner or child of a person who: \n        1.   (i) has made a valid application for permission to stay on the Graduate route that has not been decided; or\n        2.   (ii) has permission to stay on the Graduate route.\n\nGR 9.3. If the applicant has in the 12 months before the date of application completed a course of studies in the UK for which they have been awarded a scholarship or sponsorship by a Government or international scholarship agency covering both fees and living costs for study in the UK, they must provide written consent to the application from that Government or agency.\n\nGR 9.4. The applicant must be in the UK on the date of application.\n\n1.   GR 9.4A. The applicant must meet one of the following requirements: \n    1.   (a) they must have, or have last been granted, permission as a dependent partner of a Student and that Student is applying for, or has now been granted, permission to stay in the Graduate route; or\n    2.   (b) they must have, or have last been granted, permission as a dependent child of either a Student or dependent partner of the Student and that Student is applying for, or has now been granted, permission to stay in the Graduate route; or\n    3.   (c) they must be a child born in the UK during the last grant of Student permission of a Student and that Student is applying for, or has now been granted, permission to stay in the Graduate route.\n\nGR 9.5. An application which does not meet all the validity requirements for a partner or child of a Graduate may be rejected as invalid and not considered.",
      "needs_review": false
    },
    {
      "metadata": {
        "source": "Immigration Rules Appendix Graduate",
        "part": "Immigration Rules Appendix Graduate",
        "section_id": "GR 10.1",
        "section_title": "Suitability requirements for a dependent partner or dependent child of a Graduate",
        "parent_section": "GR 10",
        "hierarchy_level": 2,
        "topic": "suitability",
        "url": "https://www.gov.uk/guidance/immigration-rules/immigration-rules-appendix-graduate",
        "scraped_at": "2025-12-06T17:27:34.572326"
      },
      "text": "### Suitability requirements for a dependent partner or dependent child of a Graduate\n\nGR 10.1. The applicant must not fall for refusal under Part Suitability.\n\n1.   GR 10.2. The applicant must not be: \n    1.   (a) in the UK in breach of immigration laws, except that where the Exceptions for overstayers section of Part Suitability applies, that period of overstaying will be disregarded; or\n    2.   (b) on immigration bail.",
      "summary": "This provision applies to dependent partners or children of Graduates. They must meet suitability requirements, notably not be in breach of immigration laws (except where overstaying is disregarded) or be on immigration bail.",
      "augmented_text": "Document: Immigration Rules Appendix Graduate\nPart: Immigration Rules Appendix Graduate\nSection ID: GR 10.1\nSection: Suitability requirements for a dependent partner or dependent child of a Graduate\nTopic: suitability\n\nSummary: This provision applies to dependent partners or children of Graduates. They must meet suitability requirements, notably not be in breach of immigration laws (except where overstaying is disregarded) or be on immigration bail.\n\n### Suitability requirements for a dependent partner or dependent child of a Graduate\n\nGR 10.1. The applicant must not fall for refusal under Part Suitability.\n\n1.   GR 10.2. The applicant must not be: \n    1.   (a) in the UK in breach of immigration laws, except that where the Exceptions for overstayers section of Part Suitability applies, that period of overstaying will be disregarded; or\n    2.   (b) on immigration bail.",
      "needs_review": false
    },
    {
      "metadata": {
        "source": "Immigration Rules Appendix Graduate",
        "part": "Immigration Rules Appendix Graduate",
        "section_id": "Eligibility requirements for a dependent partner or dependent child of a Graduate",
        "section_title": "Eligibility requirements for a dependent partner or dependent child of a Graduate",
        "parent_section": null,
        "hierarchy_level": 2,
        "topic": "eligibility",
        "url": "https://www.gov.uk/guidance/immigration-rules/immigration-rules-appendix-graduate",
        "scraped_at": "2025-12-06T17:27:34.572371"
      },
      "text": "### Eligibility requirements for a dependent partner or dependent child of a Graduate",
      "summary": "This section applies to dependents of UK Graduates seeking entry or extension. Dependents must meet specified relationship and accommodation requirements, with exceptions for certain partners. They must also demonstrate support and maintenance funds as outlined in the rules.",
      "augmented_text": "Document: Immigration Rules Appendix Graduate\nPart: Immigration Rules Appendix Graduate\nSection ID: Eligibility requirements for a dependent partner or dependent child of a Graduate\nSection: Eligibility requirements for a dependent partner or dependent child of a Graduate\nTopic: eligibility\n\nSummary: This section applies to dependents of UK Graduates seeking entry or extension. Dependents must meet specified relationship and accommodation requirements, with exceptions for certain partners. They must also demonstrate support and maintenance funds as outlined in the rules.\n\n### Eligibility requirements for a dependent partner or dependent child of a Graduate",
      "needs_review": false
    },
    {
      "metadata": {
        "source": "Immigration Rules Appendix Graduate",
        "part": "Immigration Rules Appendix Graduate",
        "section_id": "1",
        "section_title": "Relationship requirement for dependent partner of a Graduate",
        "parent_section": null,
        "hierarchy_level": 1,
        "topic": "family",
        "url": "https://www.gov.uk/guidance/immigration-rules/immigration-rules-appendix-graduate",
        "scraped_at": "2025-12-06T17:27:34.572435"
      },
      "text": "### Relationship requirement for dependent partner of a Graduate\n\n1.   GR 11.1. The applicant must be the partner of a Person (P) where one of the following applies: \n    1.   (a) P has permission to stay on the Graduate route; or\n    2.   (b) P is, at the same time, applying for (and is granted) permission to stay on the Graduate route.\n\nGR 11.2. The requirements of Appendix Relationship with Partner must be met.\n\nGR 11.3. DELETED",
      "summary": "This provision applies to dependent partners of Graduate route migrants. It requires that they be partners of individuals with valid or pending Graduate route permission, meeting the specified relationship criteria under Appendix Relationship with Partner; no additional exceptions are noted.",
      "augmented_text": "Document: Immigration Rules Appendix Graduate\nPart: Immigration Rules Appendix Graduate\nSection ID: 1\nSection: Relationship requirement for dependent partner of a Graduate\nTopic: family\n\nSummary: This provision applies to dependent partners of Graduate route migrants. It requires that they be partners of individuals with valid or pending Graduate route permission, meeting the specified relationship criteria under Appendix Relationship with Partner; no additional exceptions are noted.\n\n### Relationship requirement for dependent partner of a Graduate\n\n1.   GR 11.1. The applicant must be the partner of a Person (P) where one of the following applies: \n    1.   (a) P has permission to stay on the Graduate route; or\n    2.   (b) P is, at the same time, applying for (and is granted) permission to stay on the Graduate route.\n\nGR 11.2. The requirements of Appendix Relationship with Partner must be met.\n\nGR 11.3. DELETED",
      "needs_review": false
    },
    {
      "metadata": {
        "source": "Immigration Rules Appendix Graduate",
        "part": "Immigration Rules Appendix Graduate",
        "section_id": "GR 12.1",
        "section_title": "Relationship requirement for dependent child of a Graduate",
        "parent_section": "GR 12",
        "hierarchy_level": 2,
        "topic": "family",
        "url": "https://www.gov.uk/guidance/immigration-rules/immigration-rules-appendix-graduate",
        "scraped_at": "2025-12-06T17:27:34.572485"
      },
      "text": "### Relationship requirement for dependent child of a Graduate\n\nGR 12.1. DELETED.\n\nGR 12.2. DELETED\n\nGR 12.3. DELETED.",
      "summary": "This provision applies to dependent children of Graduate visa holders. It requires the child to be under 18, dependent, and in a genuine relationship with the graduate parent. No specific exceptions are provided in this excerpt.",
      "augmented_text": "Document: Immigration Rules Appendix Graduate\nPart: Immigration Rules Appendix Graduate\nSection ID: GR 12.1\nSection: Relationship requirement for dependent child of a Graduate\nTopic: family\n\nSummary: This provision applies to dependent children of Graduate visa holders. It requires the child to be under 18, dependent, and in a genuine relationship with the graduate parent. No specific exceptions are provided in this excerpt.\n\n### Relationship requirement for dependent child of a Graduate\n\nGR 12.1. DELETED.\n\nGR 12.2. DELETED\n\nGR 12.3. DELETED.",
      "needs_review": false
    },
    {
      "metadata": {
        "source": "Immigration Rules Appendix Graduate",
        "part": "Immigration Rules Appendix Graduate",
        "section_id": "GR 13.1",
        "section_title": "Care requirement for dependent child of a Graduate",
        "parent_section": "GR 13",
        "hierarchy_level": 2,
        "topic": "family",
        "url": "https://www.gov.uk/guidance/immigration-rules/immigration-rules-appendix-graduate",
        "scraped_at": "2025-12-06T17:27:34.572526"
      },
      "text": "### Care requirement for dependent child of a Graduate\n\nGR 13.1. DELETED.",
      "summary": "This provision applies to dependent children of Graduate route applicants. It requires demonstrating adequate care arrangements for the child during their stay, with no specific thresholds or exceptions outlined.",
      "augmented_text": "Document: Immigration Rules Appendix Graduate\nPart: Immigration Rules Appendix Graduate\nSection ID: GR 13.1\nSection: Care requirement for dependent child of a Graduate\nTopic: family\n\nSummary: This provision applies to dependent children of Graduate route applicants. It requires demonstrating adequate care arrangements for the child during their stay, with no specific thresholds or exceptions outlined.\n\n### Care requirement for dependent child of a Graduate\n\nGR 13.1. DELETED.",
      "needs_review": false
    },
    {
      "metadata": {
        "source": "Immigration Rules Appendix Graduate",
        "part": "Immigration Rules Appendix Graduate",
        "section_id": "GR 14.1",
        "section_title": "Age requirement for a dependent child of a Graduate",
        "parent_section": "GR 14",
        "hierarchy_level": 2,
        "topic": "family",
        "url": "https://www.gov.uk/guidance/immigration-rules/immigration-rules-appendix-graduate",
        "scraped_at": "2025-12-06T17:27:34.572568"
      },
      "text": "### Age requirement for a dependent child of a Graduate\n\nGR 14.1. DELETED.\n\nGR 14.2. DELETED.",
      "summary": "This provision applies to dependent children of Graduate migrants. It requires that the child be under 18 years old at the time of application, with no specific exceptions noted. The rule ensures dependents are minors to qualify under this category.",
      "augmented_text": "Document: Immigration Rules Appendix Graduate\nPart: Immigration Rules Appendix Graduate\nSection ID: GR 14.1\nSection: Age requirement for a dependent child of a Graduate\nTopic: family\n\nSummary: This provision applies to dependent children of Graduate migrants. It requires that the child be under 18 years old at the time of application, with no specific exceptions noted. The rule ensures dependents are minors to qualify under this category.\n\n### Age requirement for a dependent child of a Graduate\n\nGR 14.1. DELETED.\n\nGR 14.2. DELETED.",
      "needs_review": false
    },
    {
      "metadata": {
        "source": "Immigration Rules Appendix Graduate",
        "part": "Immigration Rules Appendix Graduate",
        "section_id": "1",
        "section_title": "Requirements for a dependent child of a Graduate",
        "parent_section": null,
        "hierarchy_level": 1,
        "topic": "leave-to-enter",
        "url": "https://www.gov.uk/guidance/immigration-rules/immigration-rules-appendix-graduate",
        "scraped_at": "2025-12-06T17:27:34.572615"
      },
      "text": "### Requirements for a dependent child of a Graduate\n\n1.   GR 14A.1. The applicant must meet the following requirements for a dependent child in Appendix Children: \n    1.   (a) relationship requirement: entry clearance and permission to stay; and\n    2.   (b) care requirement; and\n    3.   (c) age and independent life requirement.",
      "summary": "Dependent children of Graduates must satisfy relationship, care, and age/independent life requirements for entry clearance and permission to stay, with specific conditions outlined in Appendix Children.",
      "augmented_text": "Document: Immigration Rules Appendix Graduate\nPart: Immigration Rules Appendix Graduate\nSection ID: 1\nSection: Requirements for a dependent child of a Graduate\nTopic: leave-to-enter\n\nSummary: Dependent children of Graduates must satisfy relationship, care, and age/independent life requirements for entry clearance and permission to stay, with specific conditions outlined in Appendix Children.\n\n### Requirements for a dependent child of a Graduate\n\n1.   GR 14A.1. The applicant must meet the following requirements for a dependent child in Appendix Children: \n    1.   (a) relationship requirement: entry clearance and permission to stay; and\n    2.   (b) care requirement; and\n    3.   (c) age and independent life requirement.",
      "needs_review": false
    },
    {
      "metadata": {
        "source": "Immigration Rules Appendix Graduate",
        "part": "Immigration Rules Appendix Graduate",
        "section_id": "1",
        "section_title": "Decision on an application as a dependent partner or dependent child of a Graduate",
        "parent_section": null,
        "hierarchy_level": 1,
        "topic": "eligibility",
        "url": "https://www.gov.uk/guidance/immigration-rules/immigration-rules-appendix-graduate",
        "scraped_at": "2025-12-06T17:27:34.572639"
      },
      "text": "### Decision on an application as a dependent partner or dependent child of a Graduate\n\n1.   GR 15.1. If the decision maker is satisfied that all the suitability and eligibility requirements for a dependent partner or dependent child of a Graduate are met, the application will be granted, otherwise the application will be refused.\n\nGR 15.2. If the application is refused, the person can apply for an Administrative Review under Appendix AR.",
      "summary": "Dependent partners or children of Graduates must meet suitability and eligibility criteria; approval is granted if satisfied, otherwise refused. Refusals can be challenged via Administrative Review.",
      "augmented_text": "Document: Immigration Rules Appendix Graduate\nPart: Immigration Rules Appendix Graduate\nSection ID: 1\nSection: Decision on an application as a dependent partner or dependent child of a Graduate\nTopic: eligibility\n\nSummary: Dependent partners or children of Graduates must meet suitability and eligibility criteria; approval is granted if satisfied, otherwise refused. Refusals can be challenged via Administrative Review.\n\n### Decision on an application as a dependent partner or dependent child of a Graduate\n\n1.   GR 15.1. If the decision maker is satisfied that all the suitability and eligibility requirements for a dependent partner or dependent child of a Graduate are met, the application will be granted, otherwise the application will be refused.\n\nGR 15.2. If the application is refused, the person can apply for an Administrative Review under Appendix AR.",
      "needs_review": false
    },
    {
      "metadata": {
        "source": "Immigration Rules Appendix Graduate",
        "part": "Immigration Rules Appendix Graduate",
        "section_id": "GR 16.1",
        "section_title": "Period of grant for a dependent partner or dependent child of a Graduate",
        "parent_section": "GR 16",
        "hierarchy_level": 2,
        "topic": "family",
        "url": "https://www.gov.uk/guidance/immigration-rules/immigration-rules-appendix-graduate",
        "scraped_at": "2025-12-06T17:27:34.572711"
      },
      "text": "### Period of grant for a dependent partner or dependent child of a Graduate\n\nGR 16.1. A dependent partner will be granted permission which ends on the same date as the Graduate partner’s permission.\n\nGR 16.2. A dependent child will be granted permission which ends on the same date as whichever of their parents’ permission ends first.",
      "summary": "This provision applies to dependent partners and children of Graduates. Dependents' permissions end simultaneously with the Graduate (partner) or the earliest expiry date among the parents, respectively. No exceptions or thresholds are specified.",
      "augmented_text": "Document: Immigration Rules Appendix Graduate\nPart: Immigration Rules Appendix Graduate\nSection ID: GR 16.1\nSection: Period of grant for a dependent partner or dependent child of a Graduate\nTopic: family\n\nSummary: This provision applies to dependent partners and children of Graduates. Dependents' permissions end simultaneously with the Graduate (partner) or the earliest expiry date among the parents, respectively. No exceptions or thresholds are specified.\n\n### Period of grant for a dependent partner or dependent child of a Graduate\n\nGR 16.1. A dependent partner will be granted permission which ends on the same date as the Graduate partner’s permission.\n\nGR 16.2. A dependent child will be granted permission which ends on the same date as whichever of their parents’ permission ends first.",
      "needs_review": false
    },
    {
      "metadata": {
        "source": "Immigration Rules Appendix Graduate",
        "part": "Immigration Rules Appendix Graduate",
        "section_id": "1",
        "section_title": "Conditions of grant for a dependent partner or dependent child of a Graduate",
        "parent_section": null,
        "hierarchy_level": 1,
        "topic": "financial",
        "url": "https://www.gov.uk/guidance/immigration-rules/immigration-rules-appendix-graduate",
        "scraped_at": "2025-12-06T17:27:34.572743"
      },
      "text": "### Conditions of grant for a dependent partner or dependent child of a Graduate\n\n1.   GR 16.3. The grant will be subject to all the following conditions: \n    1.   (a) no access to public funds; and\n    2.   (b) work (including self-employment and voluntary work) is permitted except as a professional sportsperson (including as a sports coach); and\n    3.   (c) study is permitted, subject to the ATAS condition in Appendix ATAS (if the study will commence when the person is aged over 18).\n    4.   (d) DELETED\n\nPrint this page",
      "summary": "Dependent partners or children of Graduates may be granted leave if they do not access public funds, are allowed to work (excluding professional sports), and can study (with ATAS approval if over 18). Conditions apply throughout the period of their stay.",
      "augmented_text": "Document: Immigration Rules Appendix Graduate\nPart: Immigration Rules Appendix Graduate\nSection ID: 1\nSection: Conditions of grant for a dependent partner or dependent child of a Graduate\nTopic: financial\n\nSummary: Dependent partners or children of Graduates may be granted leave if they do not access public funds, are allowed to work (excluding professional sports), and can study (with ATAS approval if over 18). Conditions apply throughout the period of their stay.\n\n### Conditions of grant for a dependent partner or dependent child of a Graduate\n\n1.   GR 16.3. The grant will be subject to all the following conditions: \n    1.   (a) no access to public funds; and\n    2.   (b) work (including self-employment and voluntary work) is permitted except as a professional sportsperson (including as a sports coach); and\n    3.   (c) study is permitted, subject to the ATAS condition in Appendix ATAS (if the study will commence when the person is aged over 18).\n    4.   (d) DELETED\n\nPrint this page",
      "needs_review": false
    }
  ]
}