{
  "url": "https://www.gov.uk/guidance/immigration-rules/immigration-rules-appendix-english-language",
  "part_name": "Immigration Rules Appendix English Language",
  "scraped_at": "2025-12-06T17:27:05.917920",
  "chunk_count": 9,
  "chunks": [
    {
      "metadata": {
        "source": "Immigration Rules Appendix English Language",
        "part": "Immigration Rules Appendix English Language",
        "section_id": "1",
        "section_title": "Exemption",
        "parent_section": null,
        "hierarchy_level": 1,
        "topic": "english-language",
        "url": "https://www.gov.uk/guidance/immigration-rules/immigration-rules-appendix-english-language",
        "scraped_at": "2025-12-06T17:27:05.917698"
      },
      "text": "### Exemption\n\n1.   EL 1.1. An applicant for settlement is exempt from the English language requirement if at the date of application any of the following apply: \n    1.   (a) they are aged 65 or over; or\n    2.   (b) they are aged under 18; or\n    3.   (c) they have a disability (physical or mental condition) which prevents them from meeting the requirement; or\n    4.   (d) they are applying for settlement as a partner, parent or dependent child aged over 18 where they: \n        1.   (i) have spent a continuous period of 15 years in the UK with permission; and\n        2.   (ii) can show an English language speaking and listening qualification at A2 CEFR or ESOL entry level 2 or Scottish Credit and Qualification Framework level 3; and\n        3.   (iii) provide confirmation from a qualified English teacher that the applicant has attended an English language class for at least 75 guided learning hours (not unsupervised study or preparation time) in the 12 months before the date of application and the teacher’s view is the applicant is unlikely to attain B1 level through further study.\n\n1.   EL1.2. An applicant for entry clearance or permission to stay under Appendix HM Armed Forces is exempt from the English language requirement if at the date of application any of the following apply: \n    1.   (a) they are aged 65 or over; or\n    2.   (b) they are aged under 18; or\n    3.   (c) they have a disability (physical or mental condition) which prevents them from meeting the requirement; or\n    4.   (d) there are exceptional circumstances which prevent the applicant from meeting the English language requirement.",
      "summary": "Applicants for settlement or certain immigration permissions are exempt from the English language requirement if they are aged under 18 or 65 or over, have a disability preventing compliance, or meet specific long-term residence and qualification criteria. Exceptions also apply for those with certain disabilities or long residency with prior English qualifications.",
      "augmented_text": "Document: Immigration Rules Appendix English Language\nPart: Immigration Rules Appendix English Language\nSection ID: 1\nSection: Exemption\nTopic: english-language\n\nSummary: Applicants for settlement or certain immigration permissions are exempt from the English language requirement if they are aged under 18 or 65 or over, have a disability preventing compliance, or meet specific long-term residence and qualification criteria. Exceptions also apply for those with certain disabilities or long residency with prior English qualifications.\n\n### Exemption\n\n1.   EL 1.1. An applicant for settlement is exempt from the English language requirement if at the date of application any of the following apply: \n    1.   (a) they are aged 65 or over; or\n    2.   (b) they are aged under 18; or\n    3.   (c) they have a disability (physical or mental condition) which prevents them from meeting the requirement; or\n    4.   (d) they are applying for settlement as a partner, parent or dependent child aged over 18 where they: \n        1.   (i) have spent a continuous period of 15 years in the UK with permission; and\n        2.   (ii) can show an English language speaking and listening qualification at A2 CEFR or ESOL entry level 2 or Scottish Credit and Qualification Framework level 3; and\n        3.   (iii) provide confirmation from a qualified English teacher that the applicant has attended an English language class for at least 75 guided learning hours (not unsupervised study or preparation time) in the 12 months before the date of application and the teacher’s view is the applicant is unlikely to attain B1 level through further study.\n\n1.   EL1.2. An applicant for entry clearance or permission to stay under Appendix HM Armed Forces is exempt from the English language requirement if at the date of application any of the following apply: \n    1.   (a) they are aged 65 or over; or\n    2.   (b) they are aged under 18; or\n    3.   (c) they have a disability (physical or mental condition) which prevents them from meeting the requirement; or\n    4.   (d) there are exceptional circumstances which prevent the applicant from meeting the English language requirement.",
      "needs_review": false
    },
    {
      "metadata": {
        "source": "Immigration Rules Appendix English Language",
        "part": "Immigration Rules Appendix English Language",
        "section_id": "EL 2.1",
        "section_title": "How the requirement is met",
        "parent_section": "EL 2",
        "hierarchy_level": 2,
        "topic": "english-language",
        "url": "https://www.gov.uk/guidance/immigration-rules/immigration-rules-appendix-english-language",
        "scraped_at": "2025-12-06T17:27:05.917742"
      },
      "text": "### How the requirement is met\n\nEL 2.1. An applicant will meet the English language requirement if any of the requirements in EL 3.1. to EL 7.2 are met.\n\nEL 2.2. The English language requirement is also met by a person applying for entry clearance or permission to stay as a Student if any of the requirements in EL 7.1. to EL 8.4. are met.\n\n1.   EL 2.3. The English language requirement is also met by a person applying for entry clearance or permission to stay as a Skilled Worker route if:\n2.   (a) the requirements in EL 7.1. and EL 7.2. are met: or\n3.   (b) the requirement in EL 9.1. is met.\n\n1.   EL 2.4. The English language requirement is also met by a person applying for:\n2.   (a) entry clearance or permission to stay on the Start-up route, or\n3.   (b) entry clearance or permission to stay on the Innovator Founder route; or\n4.   (c) entry clearance, permission to stay or settlement on the Scale-up route, or\n5.   (d) entry clearance or permission to stay on the High Potential Individual route, or\n6.   (e) settlement under Appendix Settlement Family Life, or\n7.   (f) settlement under Appendix Private Life, or\n8.   (g) entry clearance, permission to stay or settlement on the International Sportsperson route; or\n9.   (h) entry clearance, permission to stay or settlement on the Representative of an Overseas Business route; or\n10.   (i) entry clearance or permission to stay on the T2 Minister of Religion route; or\n11.   (j) settlement on the UK Ancestry route; or\n12.   (k) settlement on the Global Talent route; or\n13.   (l) settlement on the Domestic Workers in a Private Household route or\n14.   (m) settlement on Hong Kong British National (Overseas) route; or\n15.   (n) settlement on the Appendix Child Relative (Sponsors with Protection) route; or\n16.   (o) settlement on the Appendix Bereaved Partner route; or\n17.   (p) entry clearance or settlement under Appendix Victim of Domestic Abuse; or\n18.   (q) entry clearance, permission to stay or settlement under Appendix HM Armed Forces; or\n19.   (r) settlement under Appendix Long Residence; or\n20.   (s) entry clearance under Appendix Temporary Work – International Agreement.\n21.   if the requirements in EL 7.1 and EL 7.2. are met.\n\nEL 2.5. DELETED.",
      "summary": "Applicants meet the English language requirement if they satisfy specific criteria outlined in EL 3.1–8.4, depending on their route (e.g., Student, Skilled Worker, Settlement, or other categories). Conditions vary by route, with some requiring meeting particular sub-requirements; exceptions are not specified.",
      "augmented_text": "Document: Immigration Rules Appendix English Language\nPart: Immigration Rules Appendix English Language\nSection ID: EL 2.1\nSection: How the requirement is met\nTopic: english-language\n\nSummary: Applicants meet the English language requirement if they satisfy specific criteria outlined in EL 3.1–8.4, depending on their route (e.g., Student, Skilled Worker, Settlement, or other categories). Conditions vary by route, with some requiring meeting particular sub-requirements; exceptions are not specified.\n\n### How the requirement is met\n\nEL 2.1. An applicant will meet the English language requirement if any of the requirements in EL 3.1. to EL 7.2 are met.\n\nEL 2.2. The English language requirement is also met by a person applying for entry clearance or permission to stay as a Student if any of the requirements in EL 7.1. to EL 8.4. are met.\n\n1.   EL 2.3. The English language requirement is also met by a person applying for entry clearance or permission to stay as a Skilled Worker route if:\n2.   (a) the requirements in EL 7.1. and EL 7.2. are met: or\n3.   (b) the requirement in EL 9.1. is met.\n\n1.   EL 2.4. The English language requirement is also met by a person applying for:\n2.   (a) entry clearance or permission to stay on the Start-up route, or\n3.   (b) entry clearance or permission to stay on the Innovator Founder route; or\n4.   (c) entry clearance, permission to stay or settlement on the Scale-up route, or\n5.   (d) entry clearance or permission to stay on the High Potential Individual route, or\n6.   (e) settlement under Appendix Settlement Family Life, or\n7.   (f) settlement under Appendix Private Life, or\n8.   (g) entry clearance, permission to stay or settlement on the International Sportsperson route; or\n9.   (h) entry clearance, permission to stay or settlement on the Representative of an Overseas Business route; or\n10.   (i) entry clearance or permission to stay on the T2 Minister of Religion route; or\n11.   (j) settlement on the UK Ancestry route; or\n12.   (k) settlement on the Global Talent route; or\n13.   (l) settlement on the Domestic Workers in a Private Household route or\n14.   (m) settlement on Hong Kong British National (Overseas) route; or\n15.   (n) settlement on the Appendix Child Relative (Sponsors with Protection) route; or\n16.   (o) settlement on the Appendix Bereaved Partner route; or\n17.   (p) entry clearance or settlement under Appendix Victim of Domestic Abuse; or\n18.   (q) entry clearance, permission to stay or settlement under Appendix HM Armed Forces; or\n19.   (r) settlement under Appendix Long Residence; or\n20.   (s) entry clearance under Appendix Temporary Work – International Agreement.\n21.   if the requirements in EL 7.1 and EL 7.2. are met.\n\nEL 2.5. DELETED.",
      "needs_review": false
    },
    {
      "metadata": {
        "source": "Immigration Rules Appendix English Language",
        "part": "Immigration Rules Appendix English Language",
        "section_id": "EL 3.1",
        "section_title": "Met in a previous application",
        "parent_section": "EL 3",
        "hierarchy_level": 2,
        "topic": "english-language",
        "url": "https://www.gov.uk/guidance/immigration-rules/immigration-rules-appendix-english-language",
        "scraped_at": "2025-12-06T17:27:05.917757"
      },
      "text": "### Met in a previous application\n\nEL 3.1. An applicant will meet the English language requirement if they have already shown they met the requirement, at the level required for their current application, in a previous successful application for entry clearance or permission to stay.",
      "summary": "Applicants meet the English language requirement if they have previously demonstrated it at the required level in a prior successful application for entry clearance or leave to stay. This applies regardless of the time elapsed, provided the previous demonstration remains valid.",
      "augmented_text": "Document: Immigration Rules Appendix English Language\nPart: Immigration Rules Appendix English Language\nSection ID: EL 3.1\nSection: Met in a previous application\nTopic: english-language\n\nSummary: Applicants meet the English language requirement if they have previously demonstrated it at the required level in a prior successful application for entry clearance or leave to stay. This applies regardless of the time elapsed, provided the previous demonstration remains valid.\n\n### Met in a previous application\n\nEL 3.1. An applicant will meet the English language requirement if they have already shown they met the requirement, at the level required for their current application, in a previous successful application for entry clearance or permission to stay.",
      "needs_review": false
    },
    {
      "metadata": {
        "source": "Immigration Rules Appendix English Language",
        "part": "Immigration Rules Appendix English Language",
        "section_id": "EL 4.1",
        "section_title": "Majority English speaking country",
        "parent_section": "EL 4",
        "hierarchy_level": 2,
        "topic": "english-language",
        "url": "https://www.gov.uk/guidance/immigration-rules/immigration-rules-appendix-english-language",
        "scraped_at": "2025-12-06T17:27:05.917772"
      },
      "text": "### Majority English speaking country\n\nEL 4.1. An applicant will meet the English language requirement if they are a national of any of the following majority-English-speaking countries: \n\n Antigua and Barbuda \n\n Australia \n\n The Bahamas \n\n Barbados \n\n Belize \n\n The British Overseas Territories \n\n Canada \n\n Dominica \n\n Grenada \n\n Guyana \n\n Jamaica \n\n Malta \n\n New Zealand \n\n St Kitts and Nevis \n\n St Lucia \n\n St Vincent and the Grenadines \n\n Trinidad and Tobago \n\n United States of America",
      "summary": "Applicants from specified majority-English-speaking countries are deemed to meet the English language requirement without additional evidence. This applies universally to nationals from these countries, with no exceptions outlined.",
      "augmented_text": "Document: Immigration Rules Appendix English Language\nPart: Immigration Rules Appendix English Language\nSection ID: EL 4.1\nSection: Majority English speaking country\nTopic: english-language\n\nSummary: Applicants from specified majority-English-speaking countries are deemed to meet the English language requirement without additional evidence. This applies universally to nationals from these countries, with no exceptions outlined.\n\n### Majority English speaking country\n\nEL 4.1. An applicant will meet the English language requirement if they are a national of any of the following majority-English-speaking countries: \n\n Antigua and Barbuda \n\n Australia \n\n The Bahamas \n\n Barbados \n\n Belize \n\n The British Overseas Territories \n\n Canada \n\n Dominica \n\n Grenada \n\n Guyana \n\n Jamaica \n\n Malta \n\n New Zealand \n\n St Kitts and Nevis \n\n St Lucia \n\n St Vincent and the Grenadines \n\n Trinidad and Tobago \n\n United States of America",
      "needs_review": false
    },
    {
      "metadata": {
        "source": "Immigration Rules Appendix English Language",
        "part": "Immigration Rules Appendix English Language",
        "section_id": "EL 5.1",
        "section_title": "Academic qualification",
        "parent_section": "EL 5",
        "hierarchy_level": 2,
        "topic": "english-language",
        "url": "https://www.gov.uk/guidance/immigration-rules/immigration-rules-appendix-english-language",
        "scraped_at": "2025-12-06T17:27:05.917787"
      },
      "text": "### Academic qualification\n\nEL 5.1. An applicant will meet the English language requirement if they have an academic qualification which meets one of the requirements at EL 5.2. and is proven by the required evidence under EL 5.3. or EL 5.4.\n\nEL 5.2. The requirements are that the applicant has: \n\n (a) a bachelor’s degree, master’s degree or doctorate awarded in the UK; or \n\n (b) a degree or degree-level qualification taught in a university or college in a majority- English-speaking country listed in EL 4.1. (except Canada), or Ireland, which meets or exceeds the recognised standard of a bachelor’s degree, master’s degree or doctorate awarded in the UK; or \n\n (c) a degree or degree level qualification which meets, or exceeds, the recognised standard of a UK bachelor’s degree; master’s degree or doctorate and was taught or researched in English.\n\nEL 5.3. The requirement at EL 5.2. must be proven by one of: \n\n (a) a certificate from the awarding body: or \n\n (b) a transcript issued by the university or college that awarded the qualification; or \n\n (c) an official letter from the university or college that awarded the qualification containing information equivalent to a degree certificate.\n\nEL 5.4. If the qualification was awarded by a body from outside the UK, the requirement at EL 5.2. must, in addition to the requirement at EL 5.3, be proven by confirmation from Ecctis that the qualification meets the requirements at EL 5.2(b) or EL 5.2(c).",
      "summary": "This provision applies to applicants demonstrating English language proficiency through academic qualifications. They must have a degree awarded in the UK, a recognized English-speaking country (excluding Canada), or a qualification equivalent to a UK degree, with proof from official documents; if awarded outside the UK, Ecctis confirmation is also required.",
      "augmented_text": "Document: Immigration Rules Appendix English Language\nPart: Immigration Rules Appendix English Language\nSection ID: EL 5.1\nSection: Academic qualification\nTopic: english-language\n\nSummary: This provision applies to applicants demonstrating English language proficiency through academic qualifications. They must have a degree awarded in the UK, a recognized English-speaking country (excluding Canada), or a qualification equivalent to a UK degree, with proof from official documents; if awarded outside the UK, Ecctis confirmation is also required.\n\n### Academic qualification\n\nEL 5.1. An applicant will meet the English language requirement if they have an academic qualification which meets one of the requirements at EL 5.2. and is proven by the required evidence under EL 5.3. or EL 5.4.\n\nEL 5.2. The requirements are that the applicant has: \n\n (a) a bachelor’s degree, master’s degree or doctorate awarded in the UK; or \n\n (b) a degree or degree-level qualification taught in a university or college in a majority- English-speaking country listed in EL 4.1. (except Canada), or Ireland, which meets or exceeds the recognised standard of a bachelor’s degree, master’s degree or doctorate awarded in the UK; or \n\n (c) a degree or degree level qualification which meets, or exceeds, the recognised standard of a UK bachelor’s degree; master’s degree or doctorate and was taught or researched in English.\n\nEL 5.3. The requirement at EL 5.2. must be proven by one of: \n\n (a) a certificate from the awarding body: or \n\n (b) a transcript issued by the university or college that awarded the qualification; or \n\n (c) an official letter from the university or college that awarded the qualification containing information equivalent to a degree certificate.\n\nEL 5.4. If the qualification was awarded by a body from outside the UK, the requirement at EL 5.2. must, in addition to the requirement at EL 5.3, be proven by confirmation from Ecctis that the qualification meets the requirements at EL 5.2(b) or EL 5.2(c).",
      "needs_review": false
    },
    {
      "metadata": {
        "source": "Immigration Rules Appendix English Language",
        "part": "Immigration Rules Appendix English Language",
        "section_id": "EL 6.1",
        "section_title": "English language test",
        "parent_section": "EL 6",
        "hierarchy_level": 2,
        "topic": "english-language",
        "url": "https://www.gov.uk/guidance/immigration-rules/immigration-rules-appendix-english-language",
        "scraped_at": "2025-12-06T17:27:05.917799"
      },
      "text": "### English language test\n\nEL 6.1. An applicant will meet the English language requirement if they have provided a valid digital reference number from an approved provider showing they have passed an approved English language test to the required level in each required component as set out in the relevant route, in the 2 years before the date of application.\n\nThe list of approved tests and providers, updated from time to time, can be found at [https://www.gov.uk/guidance/prove-your-english-language-abilities-with-a-secure-english-language-test-selt#approved-test-providers-and-approved-tests](https://www.gov.uk/guidance/prove-your-english-language-abilities-with-a-secure-english-language-test-selt#approved-test-providers-and-approved-tests).",
      "summary": "Applicants must pass an approved English language test within 2 years prior to their application, providing a valid digital reference number from an approved provider that demonstrates they meet the required language components for their route.",
      "augmented_text": "Document: Immigration Rules Appendix English Language\nPart: Immigration Rules Appendix English Language\nSection ID: EL 6.1\nSection: English language test\nTopic: english-language\n\nSummary: Applicants must pass an approved English language test within 2 years prior to their application, providing a valid digital reference number from an approved provider that demonstrates they meet the required language components for their route.\n\n### English language test\n\nEL 6.1. An applicant will meet the English language requirement if they have provided a valid digital reference number from an approved provider showing they have passed an approved English language test to the required level in each required component as set out in the relevant route, in the 2 years before the date of application.\n\nThe list of approved tests and providers, updated from time to time, can be found at [https://www.gov.uk/guidance/prove-your-english-language-abilities-with-a-secure-english-language-test-selt#approved-test-providers-and-approved-tests](https://www.gov.uk/guidance/prove-your-english-language-abilities-with-a-secure-english-language-test-selt#approved-test-providers-and-approved-tests).",
      "needs_review": false
    },
    {
      "metadata": {
        "source": "Immigration Rules Appendix English Language",
        "part": "Immigration Rules Appendix English Language",
        "section_id": "1",
        "section_title": "GCSE or A Level English",
        "parent_section": null,
        "hierarchy_level": 1,
        "topic": "english-language",
        "url": "https://www.gov.uk/guidance/immigration-rules/immigration-rules-appendix-english-language",
        "scraped_at": "2025-12-06T17:27:05.917812"
      },
      "text": "### GCSE or A Level English\n\n1.   EL 7.1. An applicant will meet the English language requirement if they have a GCSE, an International GCSE, an A level, a Scottish National Qualification at level 4 or 5 or a Scottish Higher or Advanced Higher in English (language or literature) that was awarded: \n    1.   (a) by an Ofqual (or SQA, Qualifications Wales or CCEA) regulated awarding body; and\n    2.   (b) following education undertaken in a UK based school which began while they were aged under 18.\n\n1.   EL 7.2. The requirement at EL 7.1. must be proven by either: \n\n2.   (a) a certificate from the awarding body: or \n\n3.   (b) an official transcript issued by the awarding body",
      "summary": "Applicants can meet the English language requirement if they hold a UK-awarded GCSE, A Level, or Scottish qualification in English, obtained before age 18 from an Ofqual or equivalent-regulated body. Proof must be via a certificate or official transcript from the awarding body.",
      "augmented_text": "Document: Immigration Rules Appendix English Language\nPart: Immigration Rules Appendix English Language\nSection ID: 1\nSection: GCSE or A Level English\nTopic: english-language\n\nSummary: Applicants can meet the English language requirement if they hold a UK-awarded GCSE, A Level, or Scottish qualification in English, obtained before age 18 from an Ofqual or equivalent-regulated body. Proof must be via a certificate or official transcript from the awarding body.\n\n### GCSE or A Level English\n\n1.   EL 7.1. An applicant will meet the English language requirement if they have a GCSE, an International GCSE, an A level, a Scottish National Qualification at level 4 or 5 or a Scottish Higher or Advanced Higher in English (language or literature) that was awarded: \n    1.   (a) by an Ofqual (or SQA, Qualifications Wales or CCEA) regulated awarding body; and\n    2.   (b) following education undertaken in a UK based school which began while they were aged under 18.\n\n1.   EL 7.2. The requirement at EL 7.1. must be proven by either: \n\n2.   (a) a certificate from the awarding body: or \n\n3.   (b) an official transcript issued by the awarding body",
      "needs_review": false
    },
    {
      "metadata": {
        "source": "Immigration Rules Appendix English Language",
        "part": "Immigration Rules Appendix English Language",
        "section_id": "EL 8.1",
        "section_title": "Additional ways Students can meet the English language requirement",
        "parent_section": "EL 8",
        "hierarchy_level": 2,
        "topic": "english-language",
        "url": "https://www.gov.uk/guidance/immigration-rules/immigration-rules-appendix-english-language",
        "scraped_at": "2025-12-06T17:27:05.917829"
      },
      "text": "### Additional ways Students can meet the English language requirement\n\nEL 8.1. An applicant under Appendix Student will meet the English language requirement if they are applying for a course of study at degree level or above and are sponsored by a higher education provider with a track record of compliance who states on the Confirmation of Acceptance for Studies that they have assessed the applicant’s English language ability and how they have assessed it.\n\nEL 8.2. Where an assessment under EL 8.1. has been carried out the Confirmation of Acceptance for Studies entry must confirm that the applicant has a knowledge of English equivalent to level B2, or above, of the Council of Europe’s Common European Framework for Language Learning in all 4 components (reading, writing, speaking and listening) or that the requirement at ST 15.3. is met.\n\nEL 8.3. An applicant under Appendix Student will meet the English language requirement if they have taken an approved English test and been exempted from a component of that test by the test provider due to a disability, and the student sponsor has confirmed that they are satisfied the English language ability of the applicant is sufficient to undertake the course of study.\n\nEL 8.4. An applicant under Appendix Student will meet the English language requirement if they are applying for a short-term study abroad programme of up to six months and both: \n\n (a) the study abroad programme is part of a course of study at degree level or above at an overseas higher education institution in the United States of America; and \n\n (b) Ecctis confirm that the course of study overseas will lead to an academic (not a professional or vocational) qualification at UK bachelor’s degree level or above.",
      "summary": "Students applying for degree-level or higher courses can meet the English language requirement if sponsored by a compliant provider who assesses their English proficiency through specified means, such as confirmed CEFR Level B2 knowledge or approved tests with disability exemptions. Exceptions apply for short-term study abroad programmes of up to six months.",
      "augmented_text": "Document: Immigration Rules Appendix English Language\nPart: Immigration Rules Appendix English Language\nSection ID: EL 8.1\nSection: Additional ways Students can meet the English language requirement\nTopic: english-language\n\nSummary: Students applying for degree-level or higher courses can meet the English language requirement if sponsored by a compliant provider who assesses their English proficiency through specified means, such as confirmed CEFR Level B2 knowledge or approved tests with disability exemptions. Exceptions apply for short-term study abroad programmes of up to six months.\n\n### Additional ways Students can meet the English language requirement\n\nEL 8.1. An applicant under Appendix Student will meet the English language requirement if they are applying for a course of study at degree level or above and are sponsored by a higher education provider with a track record of compliance who states on the Confirmation of Acceptance for Studies that they have assessed the applicant’s English language ability and how they have assessed it.\n\nEL 8.2. Where an assessment under EL 8.1. has been carried out the Confirmation of Acceptance for Studies entry must confirm that the applicant has a knowledge of English equivalent to level B2, or above, of the Council of Europe’s Common European Framework for Language Learning in all 4 components (reading, writing, speaking and listening) or that the requirement at ST 15.3. is met.\n\nEL 8.3. An applicant under Appendix Student will meet the English language requirement if they have taken an approved English test and been exempted from a component of that test by the test provider due to a disability, and the student sponsor has confirmed that they are satisfied the English language ability of the applicant is sufficient to undertake the course of study.\n\nEL 8.4. An applicant under Appendix Student will meet the English language requirement if they are applying for a short-term study abroad programme of up to six months and both: \n\n (a) the study abroad programme is part of a course of study at degree level or above at an overseas higher education institution in the United States of America; and \n\n (b) Ecctis confirm that the course of study overseas will lead to an academic (not a professional or vocational) qualification at UK bachelor’s degree level or above.",
      "needs_review": false
    },
    {
      "metadata": {
        "source": "Immigration Rules Appendix English Language",
        "part": "Immigration Rules Appendix English Language",
        "section_id": "EL 9.1",
        "section_title": "Professional regulation for Skilled Workers",
        "parent_section": "EL 9",
        "hierarchy_level": 2,
        "topic": "english-language",
        "url": "https://www.gov.uk/guidance/immigration-rules/immigration-rules-appendix-english-language",
        "scraped_at": "2025-12-06T17:27:05.917841"
      },
      "text": "### Professional regulation for Skilled Workers\n\nEL 9.1. An applicant applying for entry clearance or permission to stay under Appendix Skilled Worker will meet the English language requirement if they are being sponsored to work as a doctor, dentist, nurse, midwife or veterinarian, and have passed an English Language assessment which is accepted by the relevant regulated professional body as a requirement for registration.\n\nPrint this page",
      "summary": "Skilled Worker applicants in medical and veterinary fields must pass an English language assessment accepted by the relevant professional body as part of their registration process. This requirement applies when applying for entry clearance or permission to stay. Exceptions are not specified.",
      "augmented_text": "Document: Immigration Rules Appendix English Language\nPart: Immigration Rules Appendix English Language\nSection ID: EL 9.1\nSection: Professional regulation for Skilled Workers\nTopic: english-language\n\nSummary: Skilled Worker applicants in medical and veterinary fields must pass an English language assessment accepted by the relevant professional body as part of their registration process. This requirement applies when applying for entry clearance or permission to stay. Exceptions are not specified.\n\n### Professional regulation for Skilled Workers\n\nEL 9.1. An applicant applying for entry clearance or permission to stay under Appendix Skilled Worker will meet the English language requirement if they are being sponsored to work as a doctor, dentist, nurse, midwife or veterinarian, and have passed an English Language assessment which is accepted by the relevant regulated professional body as a requirement for registration.\n\nPrint this page",
      "needs_review": false
    }
  ]
}