{
  "url": "https://www.gov.uk/guidance/immigration-rules/immigration-rules-part-2-transitional-provisions",
  "part_name": "Immigration Rules part 2: transitional provisions",
  "scraped_at": "2025-12-06T17:22:20.992156",
  "chunk_count": 1,
  "chunks": [
    {
      "metadata": {
        "source": "Immigration Rules part 2: transitional provisions",
        "part": "Immigration Rules part 2: transitional provisions",
        "section_id": "Part 2 and Appendix V",
        "section_title": "Transitional provisions and Appendix V for Visitors",
        "parent_section": null,
        "hierarchy_level": 1,
        "topic": "transitional",
        "url": "https://www.gov.uk/guidance/immigration-rules/immigration-rules-part-2-transitional-provisions",
        "scraped_at": "2025-12-06T17:22:20.992033"
      },
      "text": "### Transitional provisions Part 2 and Appendix V: Immigration Rules for Visitors\n\n1.   1. DELETED\n2.   2. DELETED\n3.   3. DELETED\n4.   4. DELETED\n\nPrint this page",
      "summary": "This provision applies to visitors under the Immigration Rules for Visitors, outlining transitional arrangements. It specifies certain requirements and conditions for entry or stay, with some provisions deleted or temporarily inapplicable, emphasizing the importance of compliance with transitional rules during the specified period.",
      "augmented_text": "Document: Immigration Rules part 2: transitional provisions\nPart: Immigration Rules part 2: transitional provisions\nSection ID: Part 2 and Appendix V\nSection: Transitional provisions and Appendix V for Visitors\nTopic: transitional\n\nSummary: This provision applies to visitors under the Immigration Rules for Visitors, outlining transitional arrangements. It specifies certain requirements and conditions for entry or stay, with some provisions deleted or temporarily inapplicable, emphasizing the importance of compliance with transitional rules during the specified period.\n\n### Transitional provisions Part 2 and Appendix V: Immigration Rules for Visitors\n\n1.   1. DELETED\n2.   2. DELETED\n3.   3. DELETED\n4.   4. DELETED\n\nPrint this page",
      "needs_review": false
    }
  ]
}